author_id,content,region,language,publish_date,harvested_date,following,followers,updates,post_type,retweet
MichAtlas,Умер первый президент современной Венгрии Арпад Гёнц http://t.co/8JQYRno0Zd,Unknown,Russian,2015-10-06T12:54:00,2015-10-06T12:54:00,1743.0000000000,686.0000000000,8827.0000000000,R,True
MichAtlas,Авиаудар по позициям «Исламского государства» в Сирии сняли на камеру GoPro. Смотрите видео без комментариев.  https://t.co/AlkS474QvX,Unknown,Russian,2015-10-06T19:32:00,2015-10-06T19:32:00,1743.0000000000,686.0000000000,8832.0000000000,R,True
MichAtlas,"""Аэрофлот"" и ""другие компании"" нацелился на самолеты ""Трансаэро"" #новости http://t.co/Eo8NfaNAVr",Unknown,Russian,2015-10-07T08:54:00,2015-10-07T08:54:00,1743.0000000000,685.0000000000,8838.0000000000,R,True
MichAtlas,СМИ: стеклянный мост над пропастью в Китае треснул под ногами туристов http://t.co/PIS0oUJNdd © Flickr http://t.co/BzQmghSf2k,Unknown,Russian,2015-10-07T09:33:00,2015-10-07T09:33:00,1743.0000000000,685.0000000000,8839.0000000000,R,True
MichAtlas,Россия перебросит ударные вертолеты в Таджикистан   https://t.co/vMrFWrmVRs,Unknown,Russian,2015-10-07T11:36:00,2015-10-07T11:36:00,1743.0000000000,685.0000000000,8842.0000000000,R,True
MichAtlas,Баззфид завел русскоязычный твиттер https://t.co/3XQMxJ5a15 @BuzzFeedRU привет парни! http://t.co/cWfkBBAOJx,Unknown,Russian,2015-10-08T09:33:00,2015-10-08T09:33:00,1743.0000000000,685.0000000000,8851.0000000000,R,True
MichAtlas,Президент Турции пригрозил России пересмотром газового контракта: http://t.co/1qe0DNfZfS,Unknown,Russian,2015-10-08T09:34:00,2015-10-08T09:34:00,1743.0000000000,685.0000000000,8852.0000000000,R,True
MichAtlas,"наш спецназовец может со ста метров попасть белке в глаз. а если вместо ножа дать ему пистолет, то с километра",Unknown,Russian,2015-10-08T21:59:00,2015-10-08T21:59:00,1743.0000000000,686.0000000000,8854.0000000000,R,True
MichAtlas,Центральный Республиканский Банк ДНР распорядился установить курсы валют на 9 октября 2015г. http://t.co/GvCJ5tMoIZ,Unknown,Russian,2015-10-08T23:11:00,2015-10-08T23:11:00,1743.0000000000,686.0000000000,8855.0000000000,R,True
MichAtlas,Бывший трейдер Deutsche Bank сознался в манипулировании рынком: http://t.co/Rotac3HqDj,Unknown,Russian,2015-10-09T09:52:00,2015-10-09T09:52:00,1743.0000000000,686.0000000000,8857.0000000000,R,True
MichAtlas,В сентябре в Москве эвакуировали более 9000 автомобилей  http://t.co/tZn876Ptit,Unknown,Russian,2015-10-09T15:53:00,2015-10-09T15:53:00,1743.0000000000,686.0000000000,8861.0000000000,R,True
MichAtlas,Суд арестовал обвиняемого в коррупции депутата Госсовета Коми Брагина http://t.co/Tqhd5nT5Ol,Unknown,Macedonian,2015-10-09T16:12:00,2015-10-09T16:12:00,1743.0000000000,686.0000000000,8862.0000000000,R,True
MichAtlas,Жертвами гватемальского оползня числятся более 250 человек http://t.co/5dH3tiOYVI http://t.co/5iDm3r3BeK,Unknown,Russian,2015-10-09T21:33:00,2015-10-09T21:33:00,1743.0000000000,687.0000000000,8863.0000000000,R,True
MichAtlas,"Компания, управляющая аэропортом ""Пулково"", подала иск к ""Трансаэро"" http://t.co/mamAgvp8OO #СПб",Unknown,Russian,2015-10-10T09:11:00,2015-10-10T09:11:00,1743.0000000000,687.0000000000,8818.0000000000,R,True
MichAtlas,Украинский долг перед Россией не будет реструктурирован http://t.co/8btjNq9VPZ http://t.co/1U9nSyzYRX,Unknown,Ukrainian,2015-10-10T15:32:00,2015-10-10T15:32:00,1743.0000000000,687.0000000000,8820.0000000000,R,True
MichAtlas,В Белоруссии на границе задержаны около 200 украинцев с оружием http://t.co/ZUrIR69lVc,Unknown,Russian,2015-10-10T20:12:00,2015-10-10T20:12:00,1744.0000000000,688.0000000000,8823.0000000000,R,True
MichAtlas,Данни Блинд: у сборной Нидерландов 15 человек травмировано — экстрим http://t.co/qf3UlAf1Md,Unknown,Russian,2015-10-10T20:31:00,2015-10-10T20:32:00,1744.0000000000,688.0000000000,8824.0000000000,R,True
MichAtlas,Очень забористое видео с Соскиным: После Сирии сатанист Путин будет бомбить украину. Порошенко - агент Путина!  https://t.co/e6LXSUFj5o,Unknown,Russian,2015-10-10T20:32:00,2015-10-10T20:32:00,1744.0000000000,688.0000000000,8825.0000000000,R,True
MichAtlas,У отеля Hyatt в Денвере найдено взрывное устройство http://t.co/CAQQijMbyT,Unknown,Russian,2015-10-10T22:12:00,2015-10-10T22:12:00,1744.0000000000,688.0000000000,8826.0000000000,R,True
MichAtlas,ВИДЕО. Минобороны РФ о контактах с Пентагоном по Сирии  http://t.co/IyyfH0g3Op http://t.co/TPgsyhWAeT,Unknown,Russian,2015-10-11T14:32:00,2015-10-11T14:32:00,1744.0000000000,688.0000000000,8830.0000000000,R,True
MichAtlas,Билеты на матч со сборной России купили шесть черногорских болельщиков http://t.co/0NNUJ3WEXF,Unknown,Russian,2015-10-11T15:52:00,2015-10-11T15:52:00,1744.0000000000,688.0000000000,8831.0000000000,R,True
MichAtlas,"Пассажиропоток группы ""Аэрофлот"" после ухода ""Трансаэро"" может вырасти на 9 млн человек  http://t.co/Xk0GAuGywN",Unknown,Russian,2015-10-12T01:14:00,2015-10-12T01:14:00,1743.0000000000,688.0000000000,8834.0000000000,R,True
MichAtlas,солдат-срочник может почистить 6 тонн картошки за день. рота может за неделю лишить Белоруссию стратегического резерва,Unknown,Russian,2015-10-13T12:33:00,2015-10-13T12:33:00,1743.0000000000,689.0000000000,8552.0000000000,R,True
MichAtlas,Путин предложил Медведева в качестве главы делегации на переговорах по Сирии #новости http://t.co/fTz3DtRcCU,Unknown,Russian,2015-10-13T18:33:00,2015-10-13T18:33:00,1743.0000000000,689.0000000000,8555.0000000000,R,True
MichAtlas,Росавиация: РЛС Украины заметили бы летящую из Снежного на MH17 ракету http://t.co/GSTgAKjmKC http://t.co/EZobP3YCrH,Unknown,Ukrainian,2015-10-14T12:53:00,2015-10-14T12:54:00,1743.0000000000,691.0000000000,8558.0000000000,R,True
MichAtlas,"В Канаде неизвестный напал на сотрудников офиса племени индейцев, 10 человек пострадали  http://t.co/y4kyTtOzpD",Unknown,Russian,2015-10-15T00:19:00,2015-10-15T00:19:00,1743.0000000000,691.0000000000,8560.0000000000,R,True
MichAtlas,МВД сообщило о хищении 330 млн руб. на строительство метро «Шипиловская»  http://t.co/UitATbRDJ7,Unknown,Russian,2015-10-15T08:11:00,2015-10-15T08:11:00,1743.0000000000,691.0000000000,8561.0000000000,R,True
MichAtlas,Меркель: снятие санкций с РФ все еще связано с выполнением «Минска-2» http://t.co/tb6lVYtUh8 © AP Photo http://t.co/fX6cQjNZCb,Unknown,Russian,2015-10-15T08:32:00,2015-10-15T08:32:00,1743.0000000000,691.0000000000,8562.0000000000,R,True
MichAtlas,Bloomberg View: перед нефтяниками США замаячали «ужасные перспективы» http://t.co/QkOwvZ5clJ © AP Photo http://t.co/U5LrS3RARU,Unknown,Russian,2015-10-15T11:57:00,2015-10-15T11:57:00,1743.0000000000,691.0000000000,8565.0000000000,R,True
MichAtlas,"16 октября 1983 года во Владивостоке была основана группа ""Мумий Тролль"" ее бессменным лидером Ильей Лагутенко http://t.co/5h5QNMQj6V",Unknown,Russian,2015-10-16T06:13:00,2015-10-16T06:13:00,1743.0000000000,691.0000000000,8569.0000000000,R,True
MichAtlas,Источник: водитель Ferrari избежит уголовной ответственности за ДТП http://t.co/d1Y1hy6O5w http://t.co/VldaY3meKe,Unknown,Russian,2015-10-16T09:51:00,2015-10-16T09:51:00,1743.0000000000,691.0000000000,8570.0000000000,R,True
MichAtlas,За 9 месяцев число неплательщиков штрафов ГИБДД в Москве выросло в четыре раза  http://t.co/rU6Yh7wjvY,Unknown,Russian,2015-10-16T12:33:00,2015-10-16T12:33:00,1743.0000000000,691.0000000000,8575.0000000000,R,True
MichAtlas,У берегов Италии спасены более 110 мигрантов http://t.co/FjIOatvnCC,Unknown,Russian,2015-10-18T17:11:00,2015-10-18T17:11:00,1744.0000000000,691.0000000000,8589.0000000000,R,True
MichAtlas,Как подобрать духи для будущей зимы  http://t.co/00kxyPFvhh http://t.co/5fw966P82I,Unknown,Russian,2015-10-18T21:13:00,2015-10-18T21:13:00,1744.0000000000,691.0000000000,8590.0000000000,R,True
MichAtlas,"Жители Тайбея ощутили землетрясение магнитудой 5,2 http://t.co/B2WfFYE9oI",Unknown,Russian,2015-10-19T03:32:00,2015-10-19T03:32:00,1744.0000000000,691.0000000000,8591.0000000000,R,True
MichAtlas,Ахахаха! http://t.co/bIOVHBNbQB,Unknown,Bulgarian,2015-10-19T04:33:00,2015-10-19T04:34:00,1744.0000000000,691.0000000000,8592.0000000000,R,True
MichAtlas,Владимир Воронков: такие встречи будут проводиться поквартально http://t.co/BxX6uh6Sbh http://t.co/nE5CWVhr8O,Unknown,Russian,2015-10-19T14:11:00,2015-10-19T14:11:00,1744.0000000000,690.0000000000,8594.0000000000,R,True
MichAtlas,Гиггз и Невилл разрешили бездомным перезимовать в их здании в Манчестере http://t.co/pD8G63X6YL,Unknown,Russian,2015-10-19T15:15:00,2015-10-19T15:15:00,1744.0000000000,690.0000000000,8595.0000000000,R,True
MichAtlas,«Ростов» — «Мордовия»: стали известны составы команд http://t.co/mhkkulYx4K,Unknown,Russian,2015-10-19T16:13:00,2015-10-19T16:13:00,1744.0000000000,690.0000000000,8596.0000000000,R,True
MichAtlas,"ФРГ, Франция и МВФ призвали ввести таксы за эмиссию парниковых газов https://t.co/gbLlTC7S99 https://t.co/SnVAV2vMBC",Unknown,Russian,2015-10-20T02:11:00,2015-10-20T02:11:00,1744.0000000000,690.0000000000,8597.0000000000,R,True
MichAtlas,Мэр Лондона едет в аэропорт. АХАХ! ЛОХ! Не может перекрыть полгорода и лететь на бронированном BMW сбивая старушек https://t.co/FnJcRwMOQs,Unknown,Russian,2015-10-20T07:31:00,2015-10-20T07:31:00,1744.0000000000,690.0000000000,8598.0000000000,R,True
MichAtlas,"Новосибирский таксист избил 91-летнего ветерана ветерана войны, забывшего адрес  https://t.co/xcmOeWhtfs",Unknown,Russian,2015-10-20T11:14:00,2015-10-20T11:14:00,1744.0000000000,690.0000000000,8599.0000000000,R,True
MichAtlas,7 ноября предложили сделать Днем памяти Романовых  https://t.co/xmSEVQ94DY https://t.co/V3GFRsjihu,Unknown,Russian,2015-10-20T23:51:00,2015-10-20T23:53:00,1744.0000000000,690.0000000000,8600.0000000000,R,True
MichAtlas,Профессиональную лыжероллерную трассу построят в Москве https://t.co/kDmvmpYTK0,Unknown,Russian,2015-10-21T09:33:00,2015-10-21T09:33:00,1744.0000000000,690.0000000000,8604.0000000000,R,True
MichAtlas,'@SFGO76 @salty_1970 @LevSharansky @maximus2575 он всех банит',Unknown,Russian,2015-10-21T14:52:00,2015-10-21T14:52:00,1744.0000000000,690.0000000000,8607.0000000000,R,True
MichAtlas,Интересный факт. #Казань https://t.co/wq2q8JBU3w,Unknown,Russian,2015-10-22T12:51:00,2015-10-22T12:51:00,1744.0000000000,692.0000000000,8613.0000000000,R,True
MichAtlas,НКО-иноагенты стали получателями президентских грантов  https://t.co/31JkX7YLH9 https://t.co/cC0EU3cClP,Unknown,Russian,2015-10-22T19:35:00,2015-10-22T19:35:00,1744.0000000000,692.0000000000,8619.0000000000,R,True
MichAtlas,"Чтобы потроллить @navalnyого, Темнейший опять пришел на форум в часах https://t.co/z7HXQ0yOyQ",Unknown,Russian,2015-10-23T03:13:00,2015-10-23T03:13:00,1744.0000000000,692.0000000000,8621.0000000000,R,True
MichAtlas,"В Хабаровске мужчина за 5 лет получил 1,5 млн рублей пенсии за умершую мать  https://t.co/UgAkLPixdp",Unknown,Russian,2015-10-23T03:31:00,2015-10-23T03:31:00,1744.0000000000,692.0000000000,8622.0000000000,R,True
MichAtlas,Еще одна компания потребовала от «Трансаэро» 43 миллиона долларов https://t.co/3fx46MQXzc https://t.co/3EpmXbLu4u,Unknown,Russian,2015-10-23T07:32:00,2015-10-23T07:32:00,1744.0000000000,692.0000000000,8623.0000000000,R,True
MichAtlas,«Химки» одержали 12-ю победу подряд в ПФЛ https://t.co/SY1U9tAC4r,Unknown,Ukrainian,2015-10-23T09:14:00,2015-10-23T09:14:00,1744.0000000000,692.0000000000,8625.0000000000,R,True
MichAtlas,Директор ФБР: Вирусные видео мешают работе полиции https://t.co/BMYz3g3ljr,Unknown,Russian,2015-10-24T01:33:00,2015-10-24T01:40:00,1742.0000000000,691.0000000000,8628.0000000000,R,True
MichAtlas,Пётр Порошенко создал центр анализа проблем в отношениях с РФ https://t.co/myuzoydyxL https://t.co/Jec2hlfdcQ,Unknown,Russian,2015-10-24T10:33:00,2015-10-24T10:40:00,1742.0000000000,692.0000000000,8630.0000000000,R,True
MichAtlas,Минобороны: Россия разбомбила более 800 объектов террористов в Сирии https://t.co/yuj3Qs4Xsn,Unknown,Russian,2015-10-24T11:52:00,2015-10-24T11:52:00,1742.0000000000,692.0000000000,8631.0000000000,R,True
MichAtlas,А жто семья рыбинского купца. Расстреляна полностью слева-направо! https://t.co/wC4w04Bzi9,Unknown,Russian,2015-10-25T13:14:00,2015-10-25T13:14:00,1740.0000000000,692.0000000000,8634.0000000000,R,True
MichAtlas,Еxit poll: кандидат Сциоли лидирует на выборах президента Аргентины https://t.co/solBHDKjzY © Flickr/ Finizio https://t.co/D86c8h7nNp,Unknown,Russian,2015-10-25T22:32:00,2015-10-25T22:33:00,1740.0000000000,692.0000000000,8635.0000000000,R,True
MichAtlas,Independent: Россия делает армию национальной идеей  https://t.co/pEufUDCrBp https://t.co/ODOINPvKyC,Unknown,Russian,2015-10-26T08:34:00,2015-10-26T08:34:00,1740.0000000000,692.0000000000,8639.0000000000,R,True
MichAtlas,Мультфильм «Монстры на каникулах-2» возглавил российский прокат https://t.co/IMS6siH6nA  #РИА_Киногид https://t.co/eHqgHSglmu,Unknown,Russian,2015-10-26T20:53:00,2015-10-26T20:53:00,1739.0000000000,691.0000000000,8640.0000000000,R,True
MichAtlas,Конгресс оставит Барака Обаму без дополнительного финансирования https://t.co/Ui6YJMgKmi https://t.co/vWYWB5xBc6,Unknown,Russian,2015-10-26T21:51:00,2015-10-26T21:51:00,1739.0000000000,691.0000000000,8641.0000000000,R,True
MichAtlas,А тем временем в мире упоротых... https://t.co/e7hkYYF1cO,Unknown,Russian,2015-10-27T05:51:00,2015-10-27T05:51:00,1739.0000000000,691.0000000000,8645.0000000000,R,True
MichAtlas,"Боевики группировки ИГ убили трех человек, подорвав памятник в сирийской Пальмире, сообщает газета ""Ан-Нахар"" https://t.co/57Bn5TS7o6",Unknown,Russian,2015-10-27T07:36:00,2015-10-27T07:36:00,1739.0000000000,691.0000000000,8646.0000000000,R,True
MichAtlas,Очередной iPhone 6 получил #LifeCorr из ЛНР за сюжет о горящем лесе  https://t.co/gQrV5iRVpy https://t.co/l1DP35QBGk,Unknown,Russian,2015-10-27T12:37:00,2015-10-27T12:37:00,1739.0000000000,691.0000000000,8647.0000000000,R,True
MichAtlas,Крис Кельми наездил на статью  https://t.co/c2bKtbAQpw https://t.co/NXELf1Dws3,Unknown,Russian,2015-10-28T11:12:00,2015-10-28T11:12:00,1739.0000000000,690.0000000000,8652.0000000000,R,True
MichAtlas,"Хохлики, новости от ваших друзей.  Франция подтвердила заинтересованность в реализации «Северного потока — 2»",Unknown,Russian,2015-10-28T12:13:00,2015-10-28T12:13:00,1739.0000000000,690.0000000000,8653.0000000000,R,True
MichAtlas,Ростов-на-Дону вошел в тройку лидеров городов-самогонщиков #юмор  https://t.co/rTFPeRO2lu https://t.co/lZK5Op83eU,Unknown,Russian,2015-10-28T14:35:00,2015-10-28T14:35:00,1739.0000000000,690.0000000000,8655.0000000000,R,True
MichAtlas,Новый генеральный директор «Трансаэро» решил встретиться с кредиторами компании https://t.co/bsnptzHcT0,Unknown,Russian,2015-10-28T18:53:00,2015-10-28T18:53:00,1739.0000000000,691.0000000000,8656.0000000000,R,True
MichAtlas,"Главред RT @M_Simonyan — о рейтингах и о том, почему западные коллеги начали активно «мочить» российский телеканал https://t.co/dw039xO7Zb",Unknown,Russian,2015-10-29T06:32:00,2015-10-29T06:32:00,1739.0000000000,691.0000000000,8659.0000000000,R,True
MichAtlas,Устроивший ДТП с Ferrari рассказал новые подробности аварии на Крымском мосту  https://t.co/onQdGPKKqT https://t.co/MnOsn4AZ1C,Unknown,Russian,2015-10-29T09:32:00,2015-10-29T09:32:00,1739.0000000000,690.0000000000,8660.0000000000,R,True
MichAtlas,МВФ опроверг сообщения по Украине  https://t.co/nv2VqrbLpe https://t.co/atB5wR0A2B,Unknown,Russian,2015-10-29T15:54:00,2015-10-29T15:54:00,1739.0000000000,690.0000000000,8662.0000000000,R,True
MichAtlas,Против экс-ведущего Top Gear возбуждено уголовное дело https://t.co/mM2XcPOK8b https://t.co/6pNG6odoBl,Unknown,Russian,2015-10-30T03:53:00,2015-10-30T03:53:00,1739.0000000000,690.0000000000,8666.0000000000,R,True
MichAtlas,В Госдуме хотят обязать производителей выпускать верхнюю одежду со светоотражателями https://t.co/SxvLAjlwIr,Unknown,Russian,2015-10-30T13:33:00,2015-10-30T13:33:00,1739.0000000000,690.0000000000,8668.0000000000,R,True
MichAtlas,Популярностью у американцев в Хэллоуин пользуются костюмы кандидатов в президенты США  https://t.co/OGxFQ6Q1uI,Unknown,Russian,2015-10-30T22:31:00,2015-10-30T22:32:00,1739.0000000000,690.0000000000,8670.0000000000,R,True
MichAtlas,«Красная Шапочка» для взрослых была доставлена в чилийские школы https://t.co/HCGL56rgfQ https://t.co/LcBbOXv4ER,Unknown,Russian,2015-10-31T04:15:00,2015-10-31T04:18:00,1739.0000000000,690.0000000000,8675.0000000000,R,True
MichAtlas,"Самолет ""Когалымавиа"" пропал над Египтом спустя 23 минуты после взлета  https://t.co/FEJhbP3OfP",Unknown,Russian,2015-10-31T10:35:00,2015-10-31T10:35:00,1739.0000000000,691.0000000000,8678.0000000000,R,True
MichAtlas,Страны и общественные деятели соболезнуют РФ в связи с авиакатастрофой https://t.co/h5YXTolyJp #7K9268 https://t.co/OxLd9XCxAK,Unknown,Russian,2015-10-31T15:55:00,2015-10-31T15:55:00,1739.0000000000,691.0000000000,8679.0000000000,R,True
MichAtlas,Соперник «Рубина» по ЛЕ «Сьон» потерпел разгромное поражение от «Лугано» https://t.co/tAs5NTTqe5,Unknown,Russian,2015-11-01T16:11:00,2015-11-01T16:11:00,1739.0000000000,690.0000000000,8679.0000000000,R,True
MichAtlas,Партия Эрдогана побеждает на досрочных выборах в парламент Турции https://t.co/L523a3dcWz,Unknown,Russian,2015-11-01T17:12:00,2015-11-01T17:12:00,1739.0000000000,690.0000000000,8680.0000000000,R,True
MichAtlas,На месте крушения российского лайнера найдено 12 крупных частей фюзеляжа https://t.co/YdCG9xhyGR,Unknown,Russian,2015-11-02T07:35:00,2015-11-02T07:35:00,1739.0000000000,690.0000000000,8684.0000000000,R,True
MichAtlas,Футболисты ЦСКА вылетели в Англию на игру с «Манчестер Юнайтед» https://t.co/JJZLVGmzxm https://t.co/cssHZsK29r,Unknown,Bulgarian,2015-11-03T04:16:00,2015-11-03T04:16:00,1739.0000000000,691.0000000000,8688.0000000000,R,True
MichAtlas,МЧС РФ: часть обломков A321 могла утонуть в песке https://t.co/plBV2JHJT6 #7K9268 https://t.co/i9F4tgsOlf,Unknown,Russian,2015-11-03T09:34:00,2015-11-03T09:34:00,1739.0000000000,691.0000000000,8689.0000000000,R,True
MichAtlas,"Несмотря на ядерную сделку, Аятолла Хаменеи все равно желает США смерти https://t.co/RcYDTFOxlp https://t.co/bYFngKEg0i",Unknown,Russian,2015-11-03T23:31:00,2015-11-03T23:32:00,1739.0000000000,692.0000000000,8695.0000000000,R,True
MichAtlas,Конгресс США рассмотрит новый вариант оборонного бюджета уже на этой неделе  https://t.co/CWGrHA2AqJ,Unknown,Russian,2015-11-03T23:51:00,2015-11-03T23:51:00,1739.0000000000,692.0000000000,8696.0000000000,R,True
MichAtlas,"Red Wings, выполняющая рейсы из Казани в Египет, прекратила полеты над Северным Синаем https://t.co/2jYeNZBDgB",Unknown,Russian,2015-11-04T09:35:00,2015-11-04T09:35:00,1739.0000000000,692.0000000000,8697.0000000000,R,True
MichAtlas,Как снимались автомобильные трюки в фильмах о Джеймсе Бонде  https://t.co/OKEQ1Uyj28 https://t.co/lB3RPIU5WC,Unknown,Russian,2015-11-04T10:11:00,2015-11-04T10:11:00,1739.0000000000,692.0000000000,8698.0000000000,R,True
MichAtlas,Дипломатический источник: в Евросоюзе есть разногласия по судьбе президента Асада https://t.co/Rr14AVWtzk https://t.co/Z2zVG9CPDW,Unknown,Russian,2015-11-04T13:02:00,2015-11-04T13:03:00,1739.0000000000,692.0000000000,8699.0000000000,R,True
MichAtlas,Защитник ПАОК: постараемся найти свободные места в рядах «Краснодара» https://t.co/uGEy7nlJyW,Unknown,Russian,2015-11-04T17:15:00,2015-11-04T17:15:00,1739.0000000000,691.0000000000,8700.0000000000,R,True
MichAtlas,Водитель разбившегося под Тулой автобуса арестован https://t.co/bDvHlLpmIS,Unknown,Russian,2015-11-04T17:23:00,2015-11-04T17:24:00,1739.0000000000,691.0000000000,8701.0000000000,R,True
MichAtlas,Конгрессмен: двойные стандарты и враждебность к РФ вредят политике США https://t.co/EzHj6Vbir7 https://t.co/JtM2wp0RQv,Unknown,Bulgarian,2015-11-04T20:14:00,2015-11-04T20:14:00,1739.0000000000,691.0000000000,8702.0000000000,R,True
MichAtlas,"Изучаются две версии крушения A321, включая загрузку опасного предмета https://t.co/DcHEZ4jaxv #7K9268 https://t.co/7BVe1IgnrG",Unknown,Russian,2015-11-04T20:54:00,2015-11-04T20:55:00,1739.0000000000,691.0000000000,8703.0000000000,R,True
MichAtlas,Ozon начнет торговать одеждой и обувью из Европы  https://t.co/Jz5gbGTl4Y,Unknown,Russian,2015-11-05T01:51:00,2015-11-05T01:51:00,1739.0000000000,691.0000000000,8704.0000000000,R,True
MichAtlas,Конституционный суд Колумбии разрешил однополым парам усыновлять детей  https://t.co/I1VtpRhyjE,Unknown,Russian,2015-11-05T02:02:00,2015-11-05T02:02:00,1739.0000000000,691.0000000000,8705.0000000000,R,True
MichAtlas,В американской Луизиане маршалы застрелили 6-летнего ребёнка во время погони за его отцом  https://t.co/aWBBiIfTzX,Unknown,Russian,2015-11-05T06:44:00,2015-11-05T06:50:00,1739.0000000000,691.0000000000,8707.0000000000,R,True
MichAtlas,Основатель «Трансаэро» опровергла данные об отъезде из России https://t.co/hA5MWsbO0P,Unknown,Russian,2015-11-05T23:52:00,2015-11-05T23:52:00,1739.0000000000,689.0000000000,8713.0000000000,R,True
