author_id,content,region,language,publish_date,harvested_date,following,followers,updates,post_type,retweet
MichAtlas,"Путешествие по Украине: по-русски говорят, в АТО не хотят http://t.co/nFgnNJG23D http://t.co/i1t8WPh4RA",Unknown,Ukrainian,2015-07-03T18:31:00,2015-07-03T18:31:00,1766.0000000000,687.0000000000,8259.0000000000,R,True
MichAtlas,Россия и Франция готовы подписать проект договора по «Мистралям» http://t.co/svungcBlqI http://t.co/VCC27UrHw5,Unknown,Russian,2015-07-10T10:12:00,2015-07-10T10:12:00,1761.0000000000,685.0000000000,8270.0000000000,R,True
MichAtlas,МГТС решила заработать на хранении персональных данных  http://t.co/H3W1gxIrgY,Unknown,Russian,2015-07-16T08:35:00,2015-07-16T08:35:00,1761.0000000000,685.0000000000,8267.0000000000,R,True
MichAtlas,ВИДЕО. В столкновениях в Греции пострадали журналисты  http://t.co/eJOb1iAkzF http://t.co/XABjwGKl9h,Unknown,Russian,2015-07-16T09:52:00,2015-07-16T09:52:00,1761.0000000000,685.0000000000,8268.0000000000,R,True
MichAtlas,Автомобиль исполнителя Gangnam Style врезался в автобус http://t.co/FEbx3bbPGi http://t.co/xPx9hBPPzK,Unknown,Russian,2015-07-16T14:52:00,2015-07-16T14:52:00,1761.0000000000,685.0000000000,8276.0000000000,R,True
MichAtlas,Губочан получил травму в преддверии матча с «Зенитом» http://t.co/M7v51P5umG,Unknown,Russian,2015-07-16T15:51:00,2015-07-16T15:51:00,1761.0000000000,685.0000000000,8277.0000000000,R,True
MichAtlas,а зачем они это делают?  бред какой то  https://t.co/HAyZ1kfIdf с помощью @YouTube,Unknown,Russian,2015-07-19T04:31:00,2015-07-19T04:31:00,1763.0000000000,683.0000000000,8294.0000000000,R,True
MichAtlas,Президент ЮАР выписан из больницы после операции http://t.co/ukfkEGV8Ht,Unknown,Russian,2015-07-19T09:32:00,2015-07-19T09:32:00,1763.0000000000,683.0000000000,8294.0000000000,R,True
MichAtlas,Путин: российской металлургии нужна коренная модернизация производства.   http://t.co/fbAyeEBDB5 http://t.co/1maxg7Ni9C,Unknown,Russian,2015-07-19T09:33:00,2015-07-19T09:33:00,1763.0000000000,683.0000000000,8295.0000000000,R,True
MichAtlas,"Кобелев: cудей критиковать нельзя, потому что у них очень хорошая память http://t.co/DJG2ciC5GN",Unknown,Russian,2015-07-19T13:51:00,2015-07-19T13:51:00,1762.0000000000,683.0000000000,8296.0000000000,R,True
MichAtlas,Жертвами нападений экстремистов на западе Ирака стали 26 силовиков  http://t.co/EB7pbzd3Nz,Unknown,Russian,2015-07-19T18:51:00,2015-07-19T18:51:00,1762.0000000000,683.0000000000,8299.0000000000,R,True
MichAtlas,Украденный Saab главы ПА ОБСЕ найден http://t.co/G8mBlsKTsE,Unknown,Russian,2015-07-19T21:11:00,2015-07-19T21:12:00,1762.0000000000,683.0000000000,8300.0000000000,R,True
MichAtlas,Филиалы Русского музея или Третьяковской галереи могут появиться в Барнауле http://t.co/zRLeplrHiK,Unknown,Russian,2015-07-20T15:53:00,2015-07-20T15:53:00,1762.0000000000,684.0000000000,8303.0000000000,R,True
MichAtlas,"Песков: Роскомнадзор вынес предупреждение ""Новой газете"" на законных основаниях http://t.co/8afw6fxi3y",Unknown,Russian,2015-07-20T19:12:00,2015-07-20T19:12:00,1762.0000000000,684.0000000000,8304.0000000000,R,True
MichAtlas,Финляндия хочет усилить военную группировку у границы с Россией http://t.co/lyTThsZNMN,Unknown,Russian,2015-07-20T19:13:00,2015-07-20T19:13:00,1762.0000000000,684.0000000000,8305.0000000000,R,True
MichAtlas,Boeing прогнозирует рост спроса на пилотов и авиатехников в ближайшие 20 лет http://t.co/7wHD5UIeNU,Unknown,Russian,2015-07-20T20:11:00,2015-07-20T20:11:00,1762.0000000000,684.0000000000,8306.0000000000,R,True
MichAtlas,Акции Apple упали на 7% после публикации квартальной отчетности http://t.co/QL52dbpu1V http://t.co/g2I2aly3V5,Unknown,Russian,2015-07-21T21:32:00,2015-07-21T21:32:00,1760.0000000000,684.0000000000,8312.0000000000,R,True
MichAtlas,Кержакову подарили футболку Месси  http://t.co/6mEqtxJlPY http://t.co/Gxgu3gKVSI,Unknown,Macedonian,2015-07-23T17:11:00,2015-07-23T17:12:00,1761.0000000000,683.0000000000,8317.0000000000,R,True
MichAtlas,Что в Америке появилось раньше – сюжет для сериала или сам сериал?! http://t.co/q3xI2q3nIJ,Unknown,Russian,2015-07-23T17:24:00,2015-07-23T17:24:00,1761.0000000000,683.0000000000,8318.0000000000,R,True
MichAtlas,ВИДЕО. Кадры крушения пассажирского автобуса в Польше  http://t.co/BIDMjgh0wf http://t.co/6LJpLvwNm9,Unknown,Russian,2015-07-23T18:13:00,2015-07-23T18:13:00,1761.0000000000,683.0000000000,8319.0000000000,R,True
MichAtlas,Депутаты Южно-Сахалинска закрыли избирком в целях экономии  http://t.co/yWmv9EbLdw http://t.co/P9kopfYyjU,Unknown,Russian,2015-07-24T06:52:00,2015-07-24T06:52:00,1760.0000000000,683.0000000000,8322.0000000000,R,True
MichAtlas,"Статью о Трампе дважды удаляли с Wikipedia. Во 2-й раз заменили фразой ""Давайте будем честны, он никому не интересен"" http://t.co/FU9y2E2OQ2",Unknown,Russian,2015-07-24T12:32:00,2015-07-24T12:32:00,1760.0000000000,683.0000000000,8324.0000000000,R,True
MichAtlas,ФОТОРЕПОРТАЖ. Путин на открытии чемпионата мира по водным видам спорта в Казани  http://t.co/ffrBJZQOQQ http://t.co/Rm4s4pktnr,Unknown,Russian,2015-07-24T18:11:00,2015-07-24T18:11:00,1760.0000000000,684.0000000000,8327.0000000000,R,True
MichAtlas,Объявлена дата релиза Shadowrun: Hong Kong  #hitech,Unknown,Macedonian,2015-07-24T20:13:00,2015-07-24T20:13:00,1760.0000000000,684.0000000000,8328.0000000000,R,True
MichAtlas,Правительство Грузии поможет малоимущим семьям из-за повышения цен на электроэнергию  http://t.co/WR2gE1DWbS,Unknown,Russian,2015-07-24T21:31:00,2015-07-24T21:31:00,1760.0000000000,684.0000000000,8329.0000000000,R,True
MichAtlas,"В Новосибирской области авария оставила без света около 8,5 тысяч человек http://t.co/yvutQ5Uu6X",Unknown,Russian,2015-07-26T05:51:00,2015-07-26T05:51:00,1761.0000000000,684.0000000000,8335.0000000000,R,True
MichAtlas,"МКС ровно 15 лет работает на орбите. Что из себя представляет МКС, какие страны ее создали, читайте в справке ria.ru: http://t.co/pwG5HQTWpP",Unknown,Russian,2015-07-26T10:32:00,2015-07-26T10:32:00,1761.0000000000,684.0000000000,8336.0000000000,R,True
MichAtlas,Торговая сеть Amazon взяла пример с McDonald's http://t.co/POe0C2qZPE http://t.co/POzi19hsmO,Unknown,Russian,2015-07-26T18:11:00,2015-07-26T18:11:00,1761.0000000000,683.0000000000,8337.0000000000,R,True
MichAtlas,Опубликованы первые данные экзит-полов с довыборов в Чернигове http://t.co/KtdT8y6T7H,Unknown,Russian,2015-07-26T19:51:00,2015-07-26T19:51:00,1761.0000000000,683.0000000000,8338.0000000000,R,True
MichAtlas,Патриарх Кирилл обратился к Путину и Порошенко  http://t.co/1T6yexGJNz http://t.co/vJbHv5BHX2,Unknown,Russian,2015-07-27T16:13:00,2015-07-27T16:14:00,1761.0000000000,683.0000000000,8346.0000000000,R,True
MichAtlas,Sony осенью планирует представить смартфон Джеймса Бонда Xperia Z5  #hitech,Unknown,Russian,2015-07-27T17:51:00,2015-07-27T17:51:00,1761.0000000000,683.0000000000,8347.0000000000,R,True
MichAtlas,Жители Подмосковья получили от семи лет за три грамма «спайса» http://t.co/RtWILDoaU4,Unknown,Russian,2015-07-28T04:32:00,2015-07-28T04:32:00,1761.0000000000,683.0000000000,8348.0000000000,R,True
MichAtlas,Владимир Путин и Петр Порошенко заочно поспорили о роли князя Владимира в истории: http://t.co/qY8HWHNttw,Unknown,Russian,2015-07-28T16:33:00,2015-07-28T16:34:00,1761.0000000000,684.0000000000,8353.0000000000,R,True
MichAtlas,Стала известна дата выхода игры Angry Birds 2  http://t.co/TJUnEQCQMU http://t.co/zNZiEHfO5E,Unknown,Macedonian,2015-07-28T20:53:00,2015-07-28T20:53:00,1761.0000000000,684.0000000000,8355.0000000000,R,True
MichAtlas,Прием абитуриентов в 51 вуз запрещен решениями Рособрнадзора http://t.co/MwcBw37UTk,Unknown,Russian,2015-07-29T07:51:00,2015-07-29T07:52:00,1761.0000000000,685.0000000000,8358.0000000000,R,True
MichAtlas,ФОТОРЕПОРТАЖ. «Ангелы» Victoria's Secret представили новую коллекцию  http://t.co/V7JLSWiaSg http://t.co/ktdn2MZm4m,Unknown,Bulgarian,2015-07-29T13:12:00,2015-07-29T13:13:00,1761.0000000000,685.0000000000,8359.0000000000,R,True
MichAtlas,[Перевод] Выбираем плагин для кэширования Wordpress: бенчмаркинг 18 плагинов  #hitech,Unknown,Ukrainian,2015-07-29T13:52:00,2015-07-29T13:52:00,1761.0000000000,685.0000000000,8361.0000000000,R,True
MichAtlas,"К берегу острова Реюньон возле Мадагаскара прибило обломок самолета, похожего на пропавший в прошлом году «Боинг»   http://t.co/3aiBmQZtGu",Unknown,Russian,2015-07-29T22:52:00,2015-07-29T22:52:00,1761.0000000000,685.0000000000,8362.0000000000,R,True
MichAtlas,"Радикалы из ""Правого сектора"" в Полтаве собирают подписи за референдум о недоверии власти http://t.co/iudAr9aciN",Unknown,Bulgarian,2015-07-30T13:11:00,2015-07-30T13:11:00,1761.0000000000,687.0000000000,8365.0000000000,R,True
MichAtlas,В Google Maps добавлена информация об очередях  #hitech,Unknown,Russian,2015-07-30T15:12:00,2015-07-30T15:12:00,1761.0000000000,687.0000000000,8367.0000000000,R,True
MichAtlas,"Список компаний, попавших под новые санкции США:   http://t.co/QBqfOCUBGR",Unknown,Russian,2015-07-30T19:52:00,2015-07-30T19:52:00,1761.0000000000,687.0000000000,8369.0000000000,R,True
MichAtlas,Продажи Apple Watch успешно стартовали в России http://t.co/VuLH7LqEy9,Unknown,Russian,2015-08-01T03:52:00,2015-08-01T03:52:00,1761.0000000000,687.0000000000,8374.0000000000,R,True
MichAtlas,В Петербурге 35 человек эвакуировали из жилого дома из-за пожара  http://t.co/TGdDOwzkuB,Unknown,Russian,2015-08-01T06:32:00,2015-08-01T06:32:00,1761.0000000000,687.0000000000,8375.0000000000,R,True
MichAtlas,Онопко: ЦСКА не мешают разговоры о возможном назначении Слуцкого в сборную http://t.co/W0ew3sz3PE,Unknown,Russian,2015-08-01T17:12:00,2015-08-01T17:12:00,1762.0000000000,687.0000000000,8378.0000000000,R,True
MichAtlas,Зенит разгромил дома Терек http://t.co/QDO3Wqpodt http://t.co/FkiuYUvhON,Unknown,Russian,2015-08-01T17:32:00,2015-08-01T17:32:00,1762.0000000000,687.0000000000,8379.0000000000,R,True
MichAtlas,"""Известия"": немецкие депутаты хотят посетить Крым http://t.co/Tb7baazQRB",Unknown,Russian,2015-08-03T00:13:00,2015-08-03T00:13:00,1760.0000000000,687.0000000000,8384.0000000000,R,True
MichAtlas,В Ивано-Франковской области Украины подожгли три сельсовета http://t.co/9FvIY4Wed7,Unknown,Russian,2015-08-03T17:34:00,2015-08-03T17:34:00,1760.0000000000,688.0000000000,8391.0000000000,R,True
MichAtlas,Марио Фернандес — MVP 3-го тура РФПЛ http://t.co/n4FCaj7u19,Unknown,Bulgarian,2015-08-04T14:11:00,2015-08-04T14:12:00,1760.0000000000,689.0000000000,8398.0000000000,R,True
MichAtlas,«Спартак» может вклиниться в борьбу за чемпионство»  http://t.co/zHjuPBlHsW http://t.co/F8HMjbufKb,Unknown,Ukrainian,2015-08-04T15:32:00,2015-08-04T15:32:00,1760.0000000000,689.0000000000,8399.0000000000,R,True
MichAtlas,"Перенос начала учебного года: кто выиграет, а кто проиграет.   http://t.co/oN5gLaXcGX http://t.co/8bx4IIamqO",Unknown,Russian,2015-08-05T19:33:00,2015-08-05T19:33:00,1760.0000000000,691.0000000000,8405.0000000000,R,True
MichAtlas,Стали известны подробности истории с «Мистралями»  http://t.co/8oWCuIF191 http://t.co/YrU5ily7yU,Unknown,Russian,2015-08-06T14:33:00,2015-08-06T14:34:00,1760.0000000000,692.0000000000,8413.0000000000,R,True
MichAtlas,Жена актера Владимира Зельдина рассказала о шутившем во время операции муже: http://t.co/7tlYGiasTw,Unknown,Russian,2015-08-06T18:53:00,2015-08-06T18:53:00,1760.0000000000,692.0000000000,8414.0000000000,R,True
MichAtlas,Коалиция Навального получила рекомендацию «отказать» в последнем регионе: http://t.co/cs3terhZRH,Unknown,Russian,2015-08-06T19:54:00,2015-08-06T19:54:00,1760.0000000000,691.0000000000,8415.0000000000,R,True
MichAtlas,"Эксперты считают, что пиар Васильевой ежемесячно обходится в 1 млн рублей http://t.co/smJbQ5xUqw",Unknown,Russian,2015-08-07T06:52:00,2015-08-07T06:53:00,1761.0000000000,691.0000000000,8417.0000000000,R,True
MichAtlas,Хаски сделали серию селфи в Норвегии http://t.co/dpTgGZjgT8,Unknown,Russian,2015-08-07T13:33:00,2015-08-07T13:34:00,1760.0000000000,693.0000000000,8423.0000000000,R,True
MichAtlas,))) http://t.co/5CQIzAgAgV,Unknown,Bulgarian,2015-08-07T17:54:00,2015-08-07T17:54:00,1760.0000000000,694.0000000000,8424.0000000000,R,True
MichAtlas,Мария Шарапова @MariaSharapova не будет участвовать в турнире в Торонто из-за травмы  https://t.co/GX5kWe8gR7 http://t.co/ltcdGUVvkY,Unknown,Russian,2015-08-08T00:52:00,2015-08-08T00:54:00,1760.0000000000,694.0000000000,8425.0000000000,R,True
MichAtlas,Глава Мордовии взял под личный контроль ситуацию с аварией поезда http://t.co/DaZxLLwZOE,Unknown,Russian,2015-08-08T12:52:00,2015-08-08T12:52:00,1760.0000000000,694.0000000000,8427.0000000000,R,True
MichAtlas,В магазинах старые ценники могут заменить на грифельные доски и электронные табло http://t.co/m6IgZofZvW,Unknown,Russian,2015-08-08T21:11:00,2015-08-08T21:11:00,1760.0000000000,694.0000000000,8429.0000000000,R,True
MichAtlas,Российский боксер Михайленко победил венесуэльца Переса и стал чемпионом Северной Америки  http://t.co/pgRWEJGv5E,Unknown,Russian,2015-08-09T06:13:00,2015-08-09T06:13:00,1760.0000000000,694.0000000000,8430.0000000000,R,True
MichAtlas,Медведев поблагодарил 4 миллиона своих читателей в Twitter  #hitech,Unknown,Russian,2015-08-09T15:32:00,2015-08-09T15:32:00,1760.0000000000,694.0000000000,8431.0000000000,R,True
MichAtlas,Корпорация Google сменит название: http://t.co/hVGE4cxzMB,Unknown,Bulgarian,2015-08-11T03:14:00,2015-08-11T03:14:00,1759.0000000000,693.0000000000,8437.0000000000,R,True
MichAtlas,"Чтобы расплатиться с игроками, ФК «Ростов» занимал деньги под проценты у своих сотрудников  http://t.co/UVtaoKhvfh http://t.co/fJECNCznye",Unknown,Russian,2015-08-11T13:11:00,2015-08-11T13:12:00,1759.0000000000,692.0000000000,8441.0000000000,R,True
MichAtlas,Саудовская Аравия хочет «Искандеры»  http://t.co/6greOltTbs http://t.co/SCaSy450FX,Unknown,Russian,2015-08-11T21:13:00,2015-08-11T21:13:00,1759.0000000000,692.0000000000,8442.0000000000,R,True
MichAtlas,Один из двух премьер-министров Ливии объявил об отставке: http://t.co/u2R0ezuL5i,Unknown,Russian,2015-08-12T01:12:00,2015-08-12T01:13:00,1759.0000000000,692.0000000000,8445.0000000000,R,True
MichAtlas,Семьям погибших при падении вертолета в Туве выплатят по 30 тысяч рублей http://t.co/VvJwkruuXj,Unknown,Russian,2015-08-12T05:11:00,2015-08-12T05:11:00,1759.0000000000,692.0000000000,8446.0000000000,R,True
MichAtlas,Путин обсудил с Совбезом участившиеся случаи обстрелов в Донбассе украинскими силовиками http://t.co/OL1allgWeq,Unknown,Russian,2015-08-12T12:53:00,2015-08-12T12:53:00,1759.0000000000,692.0000000000,8450.0000000000,R,True
MichAtlas,"укроблядям, посмевшим свои пасти на Лаврова раскрыть. в зеркало почаще смотритесь  https://t.co/PqMz8ZpWZi",Unknown,Russian,2015-08-12T13:32:00,2015-08-12T13:32:00,1759.0000000000,692.0000000000,8451.0000000000,R,True
MichAtlas,Правит-во Нидерландов отказалось рассекретить данные о катастрофе Boeing в Донбассе http://t.co/mO2obgEthb тю.а как же трибунал над Россией?,Unknown,Russian,2015-08-13T05:31:00,2015-08-13T05:31:00,1759.0000000000,692.0000000000,8461.0000000000,R,True
MichAtlas,— Я хочу есть! — стонал Паниковский. — Я хочу гуся! Зачем мы уехали из Черноморска? © http://t.co/CzV7vYolSS,Unknown,Russian,2015-08-13T09:52:00,2015-08-13T09:52:00,1759.0000000000,692.0000000000,8463.0000000000,R,True
MichAtlas,Бесчастных: итог матча «молодёжек» «Спартака» и ЦСКА можно назвать закономерным http://t.co/F9kMvxInLe,Unknown,Russian,2015-08-13T19:13:00,2015-08-13T19:13:00,1759.0000000000,692.0000000000,8469.0000000000,R,True
MichAtlas,СМИ: Deutsche Bank ожидает штрафов до $4 млрд в связи с нарушениями в РФ и США  http://t.co/wnWCI2qBYc,Unknown,Russian,2015-08-13T21:31:00,2015-08-13T21:31:00,1759.0000000000,692.0000000000,8472.0000000000,R,True
MichAtlas,"В ДНР за прошедшие сутки погиб один местный житель, ранены девять http://t.co/bOuj8P00LY",Unknown,Russian,2015-08-15T11:12:00,2015-08-15T11:12:00,1759.0000000000,692.0000000000,8482.0000000000,R,True
MichAtlas,"Омбудсмен ДНР: ОБСЕ сможет вернуть доверие местных жителей, если надавит на Киев http://t.co/2MHYbD7uG4",Unknown,Russian,2015-08-17T00:52:00,2015-08-17T00:52:00,1758.0000000000,692.0000000000,8485.0000000000,R,True
MichAtlas,"Дактилоскопирование туристов из ЕС приведет к падению турпотока в РФ, заявили в Ростуризме http://t.co/MewcjLqhB7",Unknown,Russian,2015-08-17T19:51:00,2015-08-17T19:51:00,1758.0000000000,692.0000000000,8490.0000000000,R,True
MichAtlas,Теперь уже ничто не помешает Дональду Трампу участвовать в предвыборной гонке  http://t.co/4vVocBpzMi http://t.co/LrHiuEqlcB,Unknown,Russian,2015-08-17T22:33:00,2015-08-17T22:33:00,1758.0000000000,692.0000000000,8493.0000000000,R,True
MichAtlas,"Phillip Butler: Голландские следователи - либо дураки, либо негодяи  http://t.co/XH9mw3QQIm http://t.co/LbhQktt5Ka",Unknown,Russian,2015-08-18T02:11:00,2015-08-18T02:11:00,1758.0000000000,692.0000000000,8495.0000000000,R,True
MichAtlas,Хакеры могут взломать компьютер через торрент-трекеры  #hitech,Unknown,Russian,2015-08-18T14:53:00,2015-08-18T14:53:00,1757.0000000000,692.0000000000,8499.0000000000,R,True
MichAtlas,Мэр Горловки предложил ОБСЕ создать штаб в городе http://t.co/cHyG5Vdlrq,Unknown,Russian,2015-08-18T20:05:00,2015-08-18T20:05:00,1757.0000000000,691.0000000000,8502.0000000000,R,True
MichAtlas,«Бурсаспор» сделал официальное предложение по трансферу Озбилиза http://t.co/XXZcZdoNTP,Unknown,Russian,2015-08-19T08:03:00,2015-08-19T08:03:00,1757.0000000000,691.0000000000,8507.0000000000,R,True
MichAtlas,"Япония успешно запустила корабль ""Конотори"" к МКС http://t.co/NnxuJK6hB3",Unknown,Bulgarian,2015-08-19T13:36:00,2015-08-19T13:36:00,1756.0000000000,691.0000000000,8508.0000000000,R,True
MichAtlas,Владимир Путин в ходе визита в Крым выполнил просьбу местной жительницы (ВИДЕО) https://t.co/G3y753twFN http://t.co/OCrx1L4dGD,Unknown,Russian,2015-08-19T17:32:00,2015-09-12T07:56:00,1756.0000000000,691.0000000000,8511.0000000000,R,True
MichAtlas,В Москве объявлен «оранжевый» уровень опасности  http://t.co/kjTaBxXXeI http://t.co/Sltsyo2XOt,Unknown,Russian,2015-08-20T14:52:00,2015-08-20T14:52:00,1755.0000000000,692.0000000000,8517.0000000000,R,True
MichAtlas,Первое заседание комитета ФИФА по реформам состоится 2-3 сентября http://t.co/s0brYR1eMh,Unknown,Russian,2015-08-20T19:11:00,2015-08-20T19:11:00,1755.0000000000,692.0000000000,8521.0000000000,R,True
MichAtlas,Курс доллара перед закрытием биржи превысил 68 рублей  http://t.co/OwZJaqpifc,Unknown,Russian,2015-08-20T23:11:00,2015-08-20T23:11:00,1755.0000000000,693.0000000000,8523.0000000000,R,True
MichAtlas,Шенгенская зона может прекратить существование  http://t.co/t8yTtJlIfp http://t.co/ZQhaWidsRC,Unknown,Russian,2015-08-22T15:11:00,2015-08-22T15:11:00,1755.0000000000,691.0000000000,8527.0000000000,R,True
MichAtlas,"Американцы и британец, предотвратившие теракт во Франции, получат орден Почетного легиона  http://t.co/YWpFZxqe0n",Unknown,Russian,2015-08-23T21:31:00,2015-09-18T14:16:00,1754.0000000000,693.0000000000,8532.0000000000,R,True
MichAtlas,Инспекторы из России выполнят наблюдательный полет над Германией http://t.co/slPxYPFa62,Unknown,Russian,2015-08-24T05:13:00,2015-08-24T05:13:00,1754.0000000000,693.0000000000,8533.0000000000,R,True
MichAtlas,Курс доллара ЦБ РФ обновил максимум с 1998 года    https://t.co/RAX3Al38JD,Unknown,Bulgarian,2015-08-24T12:14:00,2015-09-19T20:22:00,1754.0000000000,693.0000000000,8535.0000000000,R,True
MichAtlas,"""Валенсия"" арендует у ""Реала"" Черышева http://t.co/B38AFs6EMe",Unknown,Russian,2015-08-24T20:43:00,2015-08-24T20:43:00,1754.0000000000,693.0000000000,8538.0000000000,R,True
MichAtlas,В Турции взорвали газопровод Баку-Тбилиси-Эрзурум http://t.co/MQVYfLPaKe,Unknown,Russian,2015-08-24T23:11:00,2015-08-24T23:11:00,1754.0000000000,692.0000000000,8539.0000000000,R,True
MichAtlas,Роспотребнадзор начал процесс изъятия Persil и Fairy из магазинов http://t.co/jBxKc4wmiG http://t.co/6vRGdDKDiA,Unknown,Russian,2015-08-25T05:34:00,2015-08-25T05:34:00,1754.0000000000,692.0000000000,8540.0000000000,R,True
MichAtlas,"Суд постановил освободить Васильеву. ФСИН говорила, что готова освободить ее немедленно https://t.co/zz0sPnDvuH",Unknown,Russian,2015-08-25T10:53:00,2015-09-21T07:05:00,1754.0000000000,692.0000000000,8542.0000000000,R,True
MichAtlas,Интернет-магазинам хотят запретить принимать наличные http://t.co/URLdSUQVim http://t.co/gDBxKG0gcX,Unknown,Russian,2015-08-26T09:52:00,2015-08-26T09:52:00,1753.0000000000,692.0000000000,8545.0000000000,R,True
MichAtlas,Владимир Путин: Работа комиссии по импортозамещению должна быть наполнена конкретикой  https://t.co/ydOkkKkeKL http://t.co/OCCHUgma78,Unknown,Russian,2015-08-26T17:32:00,2015-09-22T13:10:00,1752.0000000000,691.0000000000,8546.0000000000,R,True
MichAtlas,Банк РФ рефинансирует годовую валютную задолженность банков перед ЦБ http://t.co/btSi1wsOC4,Unknown,Russian,2015-08-26T21:11:00,2015-08-26T21:11:00,1752.0000000000,692.0000000000,8548.0000000000,R,True
