author_id,content,region,language,publish_date,harvested_date,following,followers,updates,post_type,retweet
MichAtlas,В крупнейшей в России независимой системе процессинга платежей UCS на днях произошел серьезный технический сбой  http://t.co/MYUjvMhOpE,Unknown,Russian,2015-08-27T05:52:00,2015-08-27T05:52:00,1752.0000000000,692.0000000000,8550.0000000000,R,True
MichAtlas,«Яндекс» назвал самую популярную среди россиян страну для путешествий  http://t.co/DLP27ruTt7 http://t.co/re1LY1gFHZ,Unknown,Russian,2015-08-27T08:33:00,2015-08-27T08:33:00,1752.0000000000,692.0000000000,8551.0000000000,R,True
MichAtlas,Ливанов дал обещание   http://t.co/4GNiufclO9 http://t.co/71x2tmr89Y,Unknown,Bulgarian,2015-08-27T14:51:00,2015-08-27T14:52:00,1752.0000000000,692.0000000000,8553.0000000000,R,True
MichAtlas,"Казалось бы, причем тут отдых @rubin_paceka в Сочи? https://t.co/rtZ98P5dTZ",Unknown,Russian,2015-08-28T05:11:00,2015-09-23T23:42:00,1752.0000000000,692.0000000000,8557.0000000000,R,True
MichAtlas,Хабаровский НПЗ подключился к ВСТО-2 первым на Дальнем Востоке России  http://t.co/XGLynv270S,Unknown,Russian,2015-08-28T06:10:00,2015-09-24T00:19:00,1752.0000000000,692.0000000000,8558.0000000000,R,True
MichAtlas,Рейтинговое агентство Fitch предрекает Украине дефолт  http://t.co/kkMbpue1S5,Unknown,Russian,2015-08-28T06:11:00,2015-09-04T20:54:00,1752.0000000000,692.0000000000,8559.0000000000,R,True
MichAtlas,В Чечне убили замкомандира батальона «Север» и его жену  http://t.co/C5awNi8Qra http://t.co/6kfn4TNNMM,Unknown,Serbian,2015-08-28T08:13:00,2015-08-28T08:13:00,1753.0000000000,692.0000000000,8561.0000000000,R,True
MichAtlas,Кляти москали https://t.co/ew8zp249x5,Unknown,Uzbek,2015-08-28T11:11:00,2015-08-28T11:11:00,1753.0000000000,692.0000000000,8562.0000000000,R,True
MichAtlas,"Группа ""Психея"": Роскомнадзор делает нам рекламу http://t.co/kvCzolmTAA",Unknown,Russian,2015-08-28T18:54:00,2015-08-28T18:54:00,1753.0000000000,692.0000000000,8564.0000000000,R,True
MichAtlas,СК возбудил уголовное дело по факту возгорания в изоляторе №1 Ульяновска http://t.co/KoxkQwO41C,Unknown,Russian,2015-08-29T19:11:00,2015-08-29T19:12:00,1753.0000000000,692.0000000000,8568.0000000000,R,True
MichAtlas,ФРГ обещает Афганистану всестороннюю поддержку в восстановлении страны  http://t.co/ONkqjQqpL4,Unknown,Russian,2015-08-30T06:53:00,2015-09-25T21:45:00,1753.0000000000,691.0000000000,8565.0000000000,R,True
MichAtlas,Активистам не разрешили установить фото Мефистофеля вместо разрушенного барельефа http://t.co/tYoJkHCWoV,Unknown,Bulgarian,2015-08-30T12:54:00,2015-08-30T12:54:00,1753.0000000000,691.0000000000,8567.0000000000,R,True
MichAtlas,"В парке Белграда, где ночуют беженцы, создали зону с бесплатным доступом в интернет  http://t.co/XEP27sChDH",Unknown,Russian,2015-08-30T20:42:00,2015-08-30T20:42:00,1753.0000000000,691.0000000000,8569.0000000000,R,True
MichAtlas,Яровинский: участие Бибраса при переходе Амира Натхо в ЦСКА было ключевым http://t.co/T3OXQMt5el,Unknown,Russian,2015-08-31T17:33:00,2015-08-31T17:33:00,1753.0000000000,691.0000000000,8574.0000000000,R,True
MichAtlas,Специалисты подтвердили разрушение древнего храма в Пальмире боевиками ИГ http://t.co/Cmp0igIqH1,Unknown,Russian,2015-08-31T23:12:00,2015-08-31T23:12:00,1753.0000000000,691.0000000000,8577.0000000000,R,True
MichAtlas,"МИД: южнокорейский спецпредставитель прибыл в Пекин, где обсудит ядерную программу КНДР  http://t.co/qJR0rjxUBd",Unknown,Russian,2015-09-01T04:31:00,2015-09-28T07:14:00,1753.0000000000,691.0000000000,8579.0000000000,R,True
MichAtlas,Генпрокуратура признала законной подсудность дела Савченко http://t.co/utjWCJ0qTb,Unknown,Russian,2015-09-01T08:32:00,2015-09-01T08:32:00,1753.0000000000,691.0000000000,8581.0000000000,R,True
MichAtlas,Вот лучшие тексты августа:   https://t.co/r5JkHqVi5f   Ура! @ColtaRu @mediazzzona @takiedelaru @ForbesNews_Rus @villagemsk,Unknown,Russian,2015-09-01T13:51:00,2015-09-01T13:51:00,1753.0000000000,691.0000000000,8585.0000000000,R,True
MichAtlas,"Харе уже детьми то быть! Вам по 30-40 лет! Пора начать думать своей головой, идиоты, а не дядины мысли транслировать!",Unknown,Russian,2015-09-01T19:13:00,2015-09-28T21:22:00,1753.0000000000,691.0000000000,8588.0000000000,R,True
MichAtlas,"Fox:Претендуя на Арктику, РФ нарывается  на ледяную войну  США хотят кусок Арктики это нормально, а РФ сразу агрессор http://t.co/7fQJIogq1K",Unknown,Russian,2015-09-02T13:13:00,2015-09-02T13:13:00,1751.0000000000,691.0000000000,8593.0000000000,R,True
MichAtlas,И. о. главного тренера «Урала» назначен Скрипченко http://t.co/2i5n9w2Iyn,Unknown,Ukrainian,2015-09-03T09:52:00,2015-09-03T09:52:00,1752.0000000000,691.0000000000,8598.0000000000,R,True
MichAtlas,Число китайских туристов в России увеличилось более чем на 50% http://t.co/VPKD52d1jI,Unknown,Russian,2015-09-03T16:32:00,2015-09-30T12:27:00,1752.0000000000,691.0000000000,8599.0000000000,R,True
MichAtlas,Стала известна причина отмены выставки Шагала  http://t.co/V9RL6TKri1 http://t.co/rdlgZB6hln,Unknown,Russian,2015-09-03T18:51:00,2015-09-03T18:52:00,1752.0000000000,691.0000000000,8600.0000000000,R,True
MichAtlas,General Electric модернизирует энергосистему Дальнего Востока: http://t.co/f6Jq5SHQ6g #ВЭФ,Unknown,Russian,2015-09-04T03:53:00,2015-09-04T03:53:00,1752.0000000000,690.0000000000,8603.0000000000,R,True
MichAtlas,Mozilla представила бета-версию браузера Firefox для iOS http://t.co/ohWMtwcOwY,Unknown,Ukrainian,2015-09-04T15:32:00,2015-09-04T15:32:00,1752.0000000000,690.0000000000,8605.0000000000,R,True
MichAtlas,Компанию Apple просят переименовать новую модель iPhone http://t.co/9NvRO0QnFe,Unknown,Russian,2015-09-04T16:51:00,2015-09-04T16:51:00,1752.0000000000,690.0000000000,8606.0000000000,R,True
MichAtlas,Опрос: на фоне кризиса с мигрантами большинство британцев выступают за выход из ЕС  http://t.co/OlMNMNmPP3,Unknown,Russian,2015-09-06T00:31:00,2015-09-06T00:32:00,1752.0000000000,692.0000000000,8610.0000000000,R,True
MichAtlas,Стоцкий — лучший футболист «Уфы» в августе по версии болельщиков http://t.co/l6AuAnmRXg,Unknown,Russian,2015-09-06T09:43:00,2015-09-06T09:43:00,1752.0000000000,692.0000000000,8613.0000000000,R,True
MichAtlas,В составе сборной Лихтенштейна к матчу с россиянами готовятся 13 футболистов-любителей  http://t.co/85Dju7fBDG,Unknown,Russian,2015-09-07T06:56:00,2015-09-07T06:56:00,1751.0000000000,692.0000000000,8617.0000000000,R,True
MichAtlas,Пассажиров австралийского аэропорта Брисбен эвакуировали из-за задымления http://t.co/ZHN4XQ1Fo6,Unknown,Russian,2015-09-07T08:23:00,2015-09-07T08:23:00,1751.0000000000,692.0000000000,8618.0000000000,R,True
MichAtlas,"В Уссурийске ищут камерунских коз, исчезнувших из зоопарка во время паводка http://t.co/N2hQl5Wv5G",Unknown,Russian,2015-09-08T03:11:00,2015-09-08T03:11:00,1751.0000000000,691.0000000000,8626.0000000000,R,True
MichAtlas,Песков: Россия ждет разъяснений по закрытию воздушного коридора http://t.co/h26UviapQt,Unknown,Russian,2015-09-08T17:52:00,2015-09-08T17:52:00,1751.0000000000,691.0000000000,8629.0000000000,R,True
MichAtlas,Google займется доставкой свежей еды  #hitech,Unknown,Russian,2015-09-09T06:11:00,2015-09-09T06:11:00,1751.0000000000,690.0000000000,8631.0000000000,R,True
MichAtlas,Бабушку Демушкина вызвали на допрос  http://t.co/HlgBG21vlw http://t.co/1ZzRBHDu2Y,Unknown,Russian,2015-09-09T08:11:00,2015-09-09T08:11:00,1751.0000000000,690.0000000000,8632.0000000000,R,True
MichAtlas,Глава ФМС: Потоки беженцев в Европу не угрожают России  http://t.co/uOjschSTHB http://t.co/v9FESdnLez,Unknown,Russian,2015-09-09T11:40:00,2015-09-09T11:41:00,1751.0000000000,691.0000000000,8633.0000000000,R,True
MichAtlas,[Перевод] Вышла в свет Node.js v4.0.0  #hitech,Unknown,Russian,2015-09-09T12:13:00,2015-09-09T12:13:00,1751.0000000000,691.0000000000,8634.0000000000,R,True
MichAtlas,В ЕГЭ по истории в 2016 году внесут изменения  http://t.co/pa6n8EFMtH http://t.co/ocfZqX3mX8,Unknown,Russian,2015-09-09T13:54:00,2015-09-09T13:54:00,1751.0000000000,691.0000000000,8636.0000000000,R,True
MichAtlas,ВИДЕО. Байкер на полном ходу врезался в автомобиль в Сочи  http://t.co/5f2xsfOa2i http://t.co/dc37hXFbVb,Unknown,Russian,2015-09-10T12:31:00,2015-09-10T12:31:00,1751.0000000000,692.0000000000,8644.0000000000,R,True
MichAtlas,В отношении главы ГИБДД Тверской области возбуждено уголовное дело http://t.co/18TkNny1lc,Unknown,Russian,2015-09-10T23:31:00,2015-09-10T23:31:00,1751.0000000000,692.0000000000,8647.0000000000,R,True
MichAtlas,В Японии из-за наводнения остановлены три завода Toyota: http://t.co/p6Ki92oBkh,Unknown,Russian,2015-09-11T03:32:00,2015-09-11T03:32:00,1751.0000000000,692.0000000000,8648.0000000000,R,True
MichAtlas,"Три человека погибли, 26 пропали без вести из-за наводнений в Японии http://t.co/O2DopsXZGC © Flickr/ foooomio http://t.co/JPgrWxJlQ4",Unknown,Russian,2015-09-11T05:12:00,2015-09-11T05:12:00,1751.0000000000,692.0000000000,8649.0000000000,R,True
MichAtlas,Лавров назвал лучшее средство против ИГ  http://t.co/BwNDDVpoJi http://t.co/iTo3RkRTGS,Unknown,Russian,2015-09-11T11:32:00,2015-09-11T11:32:00,1751.0000000000,691.0000000000,8652.0000000000,R,True
MichAtlas,Глава Минтранса РФ открыл движение по «Сортавале» http://t.co/BZmK61WdO1 http://t.co/jic3uSf1a8,Unknown,Bulgarian,2015-09-11T12:12:00,2015-09-11T12:12:00,1751.0000000000,691.0000000000,8653.0000000000,R,True
MichAtlas,#Берлускони надеется еще раз посетить #Крым.   http://t.co/O91pv0XH05 http://t.co/17GmHUVY1D,Unknown,Russian,2015-09-12T08:55:00,2015-09-12T08:56:00,1750.0000000000,691.0000000000,8657.0000000000,R,True
MichAtlas,Сегодня утром в Ростовской области украинской РДГ были похищены и незаконно вывезены на Украину двое граждан РФ  http://t.co/u6KsTnP36B,Unknown,Russian,2015-09-12T10:49:00,2015-09-12T10:50:00,1753.0000000000,691.0000000000,8656.0000000000,R,True
MichAtlas,"Матч 8-го тура чемпионата России по футболу ЦСКА - ""Зенит"" - в онлайн-трансляции ТАСС: http://t.co/9f8IE8xkAq",Unknown,Russian,2015-09-12T11:53:00,2015-09-12T11:53:00,1753.0000000000,691.0000000000,8658.0000000000,R,True
MichAtlas,"#НевскиеНовости Вечное противостояние: ФК «Зенит» под руководством Семака сыграл вничью с ЦСКА, счет 2:2 http://t.co/O5t0tsRYQ4",Unknown,Russian,2015-09-12T15:51:00,2015-09-12T15:51:00,1751.0000000000,690.0000000000,8663.0000000000,R,True
MichAtlas,Чего ждать от сегодняшних матчей в Российской премьер-лиге  http://t.co/u5qbgOztBI http://t.co/N4E4V4CDtG,Unknown,Russian,2015-09-13T08:53:00,2015-09-13T08:54:00,1751.0000000000,692.0000000000,8667.0000000000,R,True
MichAtlas,В Сызрани задержан подозреваемый в избиении пенсионерки в супермаркете http://t.co/k5jFDNTIXu,Unknown,Russian,2015-09-14T07:07:00,2015-09-14T07:08:00,1751.0000000000,690.0000000000,8671.0000000000,R,True
MichAtlas,Второй после аварии «Протон-М» стартовал с Байконура  http://t.co/XP4RkFTKp7 http://t.co/txRaJFb9UC,Unknown,Russian,2015-09-14T19:51:00,2015-09-14T19:51:00,1750.0000000000,690.0000000000,8672.0000000000,R,True
MichAtlas,"""Ъ"": защита Кашина требует передать его дело в ФСБ http://t.co/yER5Y2VxDo",Unknown,Russian,2015-09-15T01:31:00,2015-09-15T01:31:00,1750.0000000000,690.0000000000,8675.0000000000,R,True
MichAtlas,СМИ: не менее пяти человек погибли при нападении талибов в Афганистане  http://t.co/WsQqm1nnzg,Unknown,Russian,2015-09-15T05:32:00,2015-09-15T05:33:00,1750.0000000000,689.0000000000,8678.0000000000,R,True
MichAtlas,Успей собрать команду в новом футбольном менеджере «Fantasy чемпионов»! http://t.co/r9v8ZMsSxK,Unknown,Russian,2015-09-15T09:31:00,2015-09-15T09:31:00,1750.0000000000,690.0000000000,8680.0000000000,R,True
MichAtlas,Саудовская Аравия запретила семье бен Ладена работать в стране  http://t.co/pUnxHDmuii http://t.co/8N4IXIxYTM,Unknown,Russian,2015-09-15T17:12:00,2015-09-15T17:12:00,1751.0000000000,691.0000000000,8682.0000000000,R,True
MichAtlas,Вы уже начали планировать предстоящие выходные?  http://t.co/ApowhLaMlt http://t.co/YLljqjuTdc,Unknown,Russian,2015-09-15T17:13:00,2015-09-15T17:14:00,1751.0000000000,691.0000000000,8683.0000000000,R,True
MichAtlas,Dunkin' Donuts ДОРОГО ЗАПЛАТИТ за страдания посетительницы  http://t.co/3LtpkCO6pq http://t.co/Jj7zPNpL8K,Unknown,Russian,2015-09-15T17:16:00,2015-09-15T17:16:00,1751.0000000000,691.0000000000,8684.0000000000,R,True
MichAtlas,На Куликовом поле в Одессе развернули палаточный лагерь  http://t.co/lsisFl1yHg http://t.co/D2IkBHULcb,Unknown,Russian,2015-09-15T22:32:00,2015-09-15T22:32:00,1751.0000000000,690.0000000000,8685.0000000000,R,True
MichAtlas,Протестующие пикетируют резиденцию президента Молдавии http://t.co/LHEm7VTgZ4,Unknown,Russian,2015-09-16T06:11:00,2015-09-16T06:11:00,1751.0000000000,690.0000000000,8686.0000000000,R,True
MichAtlas,Мостовой: у «Зенита» огромная халкозависимость http://t.co/dxfiDnX7iu,Unknown,Russian,2015-09-16T07:51:00,2015-09-16T07:51:00,1751.0000000000,690.0000000000,8687.0000000000,R,True
MichAtlas,Daewoo Nexia вспыхнула рядом с остановкой в Нижнем Новгороде http://t.co/EwV7lr8OgH,Unknown,Russian,2015-09-17T12:12:00,2015-09-17T12:13:00,1751.0000000000,689.0000000000,8693.0000000000,R,True
MichAtlas,КС не стал рассматривать жалобу на закон о присоединении Крыма http://t.co/R1HKaTLwis,Unknown,Russian,2015-09-17T15:12:00,2015-09-17T15:13:00,1751.0000000000,690.0000000000,8694.0000000000,R,True
MichAtlas,"Выборы, митинги и крафтовое пиво. Тренд сезона: эмоциональное выгорание https://t.co/IXqcakeayo  https://t.co/xzIHBs4YEA",Unknown,Russian,2015-09-18T10:52:00,2015-09-18T10:52:00,1751.0000000000,690.0000000000,8698.0000000000,R,True
MichAtlas,Аркадий Дворкович: Россия не будет производить продукты с ГМО  http://t.co/BUxEkGKxYg http://t.co/c0sSnqmg5w,Unknown,Russian,2015-09-18T12:12:00,2015-09-18T12:12:00,1751.0000000000,691.0000000000,8700.0000000000,R,True
MichAtlas,Псковскому парламенту предложили прекратить полномочия Шлосберга http://t.co/YlndF0FMop,Unknown,Russian,2015-09-18T14:12:00,2015-09-18T14:12:00,1751.0000000000,691.0000000000,8702.0000000000,R,True
MichAtlas,Российский шахматист Крамник не сумел выйти в 1/8 финала Кубка мира  http://t.co/k8Px4YnyNM,Unknown,Russian,2015-09-19T17:14:00,2015-09-19T17:15:00,1751.0000000000,692.0000000000,8710.0000000000,R,True
MichAtlas,Россия и Иран намерены вместе бороться с ИГ http://t.co/DOIlCNgoXi,Unknown,Russian,2015-09-21T17:32:00,2015-09-21T17:33:00,1752.0000000000,693.0000000000,8726.0000000000,R,True
MichAtlas,"В августе Ирак поставил в Китай больше нефти, чем Россия http://t.co/PT0vNIxuFD",Unknown,Russian,2015-09-21T17:52:00,2015-09-21T17:52:00,1752.0000000000,693.0000000000,8727.0000000000,R,True
MichAtlas,Порошенко ввел в действие признающую Россию военной угрозой доктрину  http://t.co/tq1uQd1WKU,Unknown,Russian,2015-09-24T18:31:00,2015-09-24T18:31:00,1749.0000000000,691.0000000000,8740.0000000000,R,True
MichAtlas,"""Известия"": в Госдуме предлагают наказывать попрошаек в военной форме http://t.co/zLKTsURg50",Unknown,Russian,2015-09-25T04:31:00,2015-09-25T04:31:00,1749.0000000000,691.0000000000,8741.0000000000,R,True
MichAtlas,Что думают жители Херсонской области о блокаде Крыма?   https://t.co/01uVJJA2fA,Unknown,Russian,2015-09-25T08:53:00,2015-09-25T08:53:00,1749.0000000000,690.0000000000,8743.0000000000,R,True
MichAtlas,#НоваяЛада В Ижевске 25 сентября стартует серийный выпуск седана LADA Vesta,Unknown,Serbian,2015-09-25T16:18:00,2015-09-25T16:18:00,1749.0000000000,690.0000000000,8746.0000000000,,False
MichAtlas,"Назван идеальный хит всех времен http://t.co/jBuWvT7kQg © flickr, Martin Fisch http://t.co/TqPAgKhO1W",Unknown,Russian,2015-09-25T20:11:00,2015-09-25T20:11:00,1750.0000000000,690.0000000000,8748.0000000000,R,True
MichAtlas,Папа римский пожелал ООН служить миру в братстве и солидарности  http://t.co/xOzCFaV6gv,Unknown,Russian,2015-09-26T07:33:00,2015-09-26T07:33:00,1746.0000000000,689.0000000000,8750.0000000000,R,True
MichAtlas,Число погибших в долине Мина иранских паломников возросло до 136 человек  http://t.co/L7j6QJfHAP,Unknown,Russian,2015-09-26T11:10:00,2015-09-26T11:11:00,1746.0000000000,689.0000000000,8753.0000000000,R,True
MichAtlas,"СМИ: в Ливии убит главарь группировки, перевозившей мигрантов в Европу  http://t.co/6J2ivKVCOW",Unknown,Russian,2015-09-26T17:53:00,2015-09-26T17:53:00,1746.0000000000,689.0000000000,8756.0000000000,R,True
MichAtlas,Керри заявил об отсутствии координации в борьбе с исламистами  http://t.co/aALhVQvL5Y,Unknown,Russian,2015-09-27T16:34:00,2015-09-27T16:34:00,1745.0000000000,688.0000000000,8761.0000000000,R,True
MichAtlas,Яценюк назвал условия для достижения мира в Донбассе  http://t.co/hTVp56I0bc http://t.co/1vcZEyYpAp,Unknown,Russian,2015-09-27T19:52:00,2015-09-27T19:52:00,1745.0000000000,689.0000000000,8763.0000000000,R,True
MichAtlas,Молдавские протестующие угрожают саботажем работы госструктур http://t.co/sBigs3tyYo,Unknown,Russian,2015-09-28T09:52:00,2015-09-28T09:52:00,1745.0000000000,690.0000000000,8767.0000000000,R,True
MichAtlas,Пойдет ли Запад на 4 условия Путина?  http://t.co/EvNazciQHH http://t.co/gfIyQ0xjgu,Unknown,Russian,2015-09-28T14:41:00,2015-09-28T14:42:00,1745.0000000000,690.0000000000,8771.0000000000,R,True
MichAtlas,Марс размокает летом. Ученые нашли на Марсе проявления жидкой воды  http://t.co/yM134gUrqd http://t.co/Fw9jELWDeU,Unknown,Russian,2015-09-28T15:52:00,2015-09-28T15:52:00,1745.0000000000,690.0000000000,8772.0000000000,R,True
MichAtlas,"Выступления Путина и Обамы в ООН - дуэль различных подходов к кризису в Сирии, считает AP  http://t.co/zeWRHMp4vx",Unknown,Russian,2015-09-29T00:52:00,2015-09-29T00:52:00,1745.0000000000,689.0000000000,8774.0000000000,R,True
MichAtlas,"Ведущая CNN, комментируя речь Путина в ООН, перепутала его с Ельциным http://t.co/TBo95rHUOg http://t.co/9e7ga2rcqD",Unknown,Russian,2015-09-29T06:52:00,2015-09-29T06:52:00,1745.0000000000,689.0000000000,8775.0000000000,R,True
MichAtlas,"Художник Шемякин отозвал авторство из ""Гофманиады"" ""Союзмультфильма"" http://t.co/HKJMaLRdYJ",Unknown,Russian,2015-09-29T12:33:00,2015-09-29T12:33:00,1745.0000000000,689.0000000000,8776.0000000000,R,True
MichAtlas,В Киеве переименуют связанные с Москвой улицы http://t.co/U6dRqIjHfs,Unknown,Russian,2015-09-30T07:32:00,2015-09-30T07:32:00,1745.0000000000,689.0000000000,8783.0000000000,R,True
MichAtlas,Доллар за 58 рублей. Всемирный банк предсказал укрепление рубля к 2017 году http://t.co/V1iAZMQoYi,Unknown,Russian,2015-09-30T12:55:00,2015-09-30T12:55:00,1743.0000000000,687.0000000000,8786.0000000000,R,True
MichAtlas,Псковичи готовят самосуд  http://t.co/mdDs84oaTS http://t.co/heLYBtZLDq,Unknown,Russian,2015-09-30T14:54:00,2015-09-30T14:54:00,1743.0000000000,687.0000000000,8787.0000000000,R,True
MichAtlas,Путин: отсутствие стрельбы вселяет уверенность в возможность преодолеть кризис на Украине  http://t.co/GS21IXuipZ,Unknown,Russian,2015-10-01T14:33:00,2015-10-01T14:33:00,1743.0000000000,687.0000000000,8797.0000000000,R,True
MichAtlas,МИД о целесообразности операции против ИГ в Ираке  http://t.co/EqZaopTsGD http://t.co/a6lBNIG5kg,Unknown,Russian,2015-10-01T14:52:00,2015-10-01T14:52:00,1743.0000000000,687.0000000000,8798.0000000000,R,True
MichAtlas,Генсек ООН напомнил об обещании Обамы отреагировать на инциденты со стрельбой в США http://t.co/FCgSKDDPRv,Unknown,Russian,2015-10-02T18:55:00,2015-10-02T18:55:00,1743.0000000000,685.0000000000,8804.0000000000,R,True
MichAtlas,ТВ: жители 100 тысяч домов в Финляндии остались без света из-за шторма http://t.co/GFfR4MaIw1 © Flickr http://t.co/naOnl8Lpvy,Unknown,Russian,2015-10-02T20:51:00,2015-10-02T20:52:00,1743.0000000000,685.0000000000,8805.0000000000,R,True
MichAtlas,Медведев: с помощью военной операции в Сирии мы защищаем россиян от терроризма  http://t.co/Nhbfanh3QH,Unknown,Russian,2015-10-03T06:11:00,2015-10-03T06:12:00,1743.0000000000,686.0000000000,8809.0000000000,R,True
MichAtlas,Подросток зарезал свою семью из-за запрета играть в компьютерную игру World of Warcraft http://t.co/6vr6gHDeAK http://t.co/FLCU2Lkkjr,Unknown,Russian,2015-10-05T07:32:00,2015-10-05T07:32:00,1743.0000000000,687.0000000000,8819.0000000000,R,True
MichAtlas,"Климкин: санкции надо продлить, если «Минск-2» не выполнят в 2015 году http://t.co/HtYWRAlOO5 http://t.co/RsNAApF7v3",Unknown,Russian,2015-10-05T22:11:00,2015-10-05T22:11:00,1743.0000000000,686.0000000000,8822.0000000000,R,True
MichAtlas,"""Известия"": чиновников предлагают лишить доступа к Google, Yahoo и WhatsApp http://t.co/oN8O7W1h3e",Unknown,Russian,2015-10-06T03:31:00,2015-10-06T03:31:00,1743.0000000000,686.0000000000,8823.0000000000,R,True
MichAtlas,Посол: РФ не ответила на инициативу Польши захоронить 800 тысяч солдат http://t.co/gOHU8Isk6V © AP Photo http://t.co/6k50Rzx6me,Unknown,Russian,2015-10-06T07:31:00,2015-10-06T07:31:00,1743.0000000000,686.0000000000,8825.0000000000,R,True
MichAtlas,Как правильно изменять  http://t.co/UGBh8zC5RQ http://t.co/i7bwhmmnMD,Unknown,Russian,2015-10-06T11:33:00,2015-10-06T11:33:00,1743.0000000000,686.0000000000,8826.0000000000,R,True
