author_id,content,region,language,publish_date,harvested_date,following,followers,updates,post_type,retweet
MichAtlas,Британия направит $47 млрд на новые атомные подлодки https://t.co/OtoQqfkuuM,Unknown,Russian,2015-11-23T16:35:00,2015-11-23T16:35:00,1734.0000000000,693.0000000000,8878.0000000000,R,True
MichAtlas,"Суд в Москве арестовал мигранта из Узбекистана, подозреваемого в ""телефонном терроризме"" https://t.co/yMjY3XTeFr",Unknown,Russian,2015-11-23T17:52:00,2015-11-23T17:52:00,1735.0000000000,692.0000000000,8879.0000000000,R,True
MichAtlas,Лондон не исключает агрессии по отношению к НАТО со стороны России https://t.co/dzHKCWRk8Q https://t.co/x13Rfkqi5J,Unknown,Russian,2015-11-23T18:12:00,2015-11-23T18:13:00,1735.0000000000,692.0000000000,8880.0000000000,R,True
MichAtlas,Лайнер American Airlines экстренно сел на полпути к Арубе  https://t.co/1BcdsFSCzP https://t.co/ms7Fxa0L7W,Unknown,Russian,2015-11-24T04:14:00,2015-11-24T04:14:00,1734.0000000000,691.0000000000,8881.0000000000,R,True
MichAtlas,МЧС РФ подготовило к отправке в Крым 300 электрогенераторов https://t.co/XeVu79FMMO,Unknown,Bulgarian,2015-11-24T07:32:00,2015-11-24T07:39:00,1734.0000000000,691.0000000000,8883.0000000000,R,True
MichAtlas,Пушков прокомментировал слова Белого дома о роли РФ в политическом урегулировании в Сирии https://t.co/zI9pCfKV8P https://t.co/y2nkvkoorL,Unknown,Russian,2015-11-24T07:34:00,2015-11-24T07:35:00,1734.0000000000,691.0000000000,8884.0000000000,R,True
MichAtlas,Япония провела первый коммерческий запуск ракеты Н2А со спутником https://t.co/hMgXhi0ALf © Фото: JAXA https://t.co/41wT2FLNHM,Unknown,Russian,2015-11-24T08:15:00,2015-11-24T08:15:00,1734.0000000000,691.0000000000,8885.0000000000,R,True
MichAtlas,ЦБ РФ повысил курсы доллара и евро  https://t.co/8eOhXnqevN https://t.co/ovUAXR4CNY,Unknown,Uzbek,2015-11-24T10:53:00,2015-11-24T10:59:00,1734.0000000000,691.0000000000,8887.0000000000,R,True
MichAtlas,Гуманитарная подгруппа по Донбассу начала работу в Минске https://t.co/Bj0EPTuhGL © Flickr https://t.co/DL6RCvVyjX,Unknown,Serbian,2015-11-24T11:32:00,2015-11-24T11:33:00,1734.0000000000,691.0000000000,8888.0000000000,R,True
MichAtlas,Нелли Уварова рассказала «Газете.Ru» о новом спектакле «Кот стыда»  https://t.co/IhSp1DkZMf https://t.co/llqkKlUMto,Unknown,Russian,2015-11-24T12:12:00,2015-11-24T12:12:00,1734.0000000000,691.0000000000,8889.0000000000,R,True
MichAtlas,"Великобритания назвала инцидент с российским Су-24 ""очень серьезным"" https://t.co/sQyCCdedzX",Unknown,Russian,2015-11-24T12:53:00,2015-11-24T12:53:00,1734.0000000000,691.0000000000,8890.0000000000,R,True
MichAtlas,В СФ предлагают прекратить авиасообщение с Турцией https://t.co/nJ9d2GuGUW #СУ24 #УдарВСпину https://t.co/DFg4dwen56,Unknown,Russian,2015-11-24T14:53:00,2015-11-24T14:53:00,1734.0000000000,691.0000000000,8892.0000000000,R,True
MichAtlas,Военного атташе Турции в России вызвали в Минобороны https://t.co/ShVJ73R6wd,Unknown,Russian,2015-11-24T14:57:00,2015-11-24T14:57:00,1734.0000000000,691.0000000000,8893.0000000000,R,True
MichAtlas,#JeSuisISIS #Turkey #БойкотТурции Турция пособник террористов. https://t.co/nIFU5mc1ux,Unknown,Russian,2015-11-24T18:12:00,2015-11-24T18:18:00,1734.0000000000,691.0000000000,8895.0000000000,R,True
MichAtlas,#TurkeyAggressor CNN: Путин пообещал Турции серьезные последствия за сбитый самолет,Unknown,Russian,2015-11-24T19:18:00,2015-11-24T19:18:00,1734.0000000000,690.0000000000,8923.0000000000,,False
MichAtlas,'@Alexey_Pushkov  #УдарВСпину #TurkeyAggressor #TurkeyISIS   Оба этих человека напали на Россию... https://t.co/H8j3DSzPju',Unknown,Russian,2015-11-24T20:07:00,2015-11-24T20:08:00,1734.0000000000,690.0000000000,8924.0000000000,R,True
MichAtlas,"Полиция Венгрии задержала шесть человек, подозреваемых в терроризме https://t.co/X7lDARCV2H https://t.co/8XJzZoq15G",Unknown,Russian,2015-11-24T23:31:00,2015-11-24T23:31:00,1734.0000000000,690.0000000000,8927.0000000000,R,True
MichAtlas,Пасечнику - пасечниково! https://t.co/If2k6tujSg,Unknown,Serbian,2015-11-25T09:53:00,2015-11-25T09:54:00,1734.0000000000,691.0000000000,8931.0000000000,R,True
MichAtlas,Хави Мартинес: с большим удовольствием продлил бы контракт с «Баварией» https://t.co/t8AjOIdfGr,Unknown,Russian,2015-11-25T10:23:00,2015-11-25T10:23:00,1734.0000000000,691.0000000000,8932.0000000000,R,True
MichAtlas,Онищенко: покупка турецких продуктов - это поддержка турецких военных https://t.co/SpLZ5Dt44V #Турция #УдарВСпину https://t.co/fdfFCPy3HE,Unknown,Russian,2015-11-25T10:50:00,2015-11-25T10:50:00,1734.0000000000,691.0000000000,8933.0000000000,R,True
MichAtlas,"Алексей Пушков @Alexey_Pushkov: Турция сбила Су-24, чтобы защитить ИГ  https://t.co/MWnLHiTSQl https://t.co/BjyfAdGlRz",Unknown,Russian,2015-11-25T11:14:00,2015-11-25T11:19:00,1734.0000000000,691.0000000000,8934.0000000000,R,True
MichAtlas,"В Хельсинки появился дорожный знак ""Люди с мобильниками"" https://t.co/kSEZsojuUL",Unknown,Russian,2015-11-25T11:19:00,2015-11-25T11:19:00,1734.0000000000,691.0000000000,8935.0000000000,R,True
MichAtlas,Росавиация: запрет Украины на транзит для авиакомпаний РФ малоактуален https://t.co/jKqiKPpA5e https://t.co/x5rvaChHnl,Unknown,Ukrainian,2015-11-25T12:41:00,2015-11-25T12:41:00,1734.0000000000,691.0000000000,8937.0000000000,R,True
MichAtlas,Матвиенко: случай с Су-24 - попытка помешать созданию широкой коалиции https://t.co/FjF7qAin5u #УдарВСпину https://t.co/pi3o3qhwy7,Unknown,Russian,2015-11-25T13:39:00,2015-11-25T13:39:00,1734.0000000000,691.0000000000,8939.0000000000,R,True
MichAtlas,"Вице-канцлер ФРГ: в сирийском конфликте непредсказуема Турция, а не РФ https://t.co/tPuDsykQ3M #StandwithRussia https://t.co/aqc7wFI3F6",Unknown,Ukrainian,2015-11-25T17:55:00,2015-11-25T17:56:00,1735.0000000000,691.0000000000,8941.0000000000,R,True
MichAtlas,"Прекрасно зная, что не примут. Популист. https://t.co/b0II6PwPo0",Unknown,Ukrainian,2015-11-25T18:40:00,2015-11-25T18:41:00,1735.0000000000,691.0000000000,8942.0000000000,R,True
MichAtlas,В Москве грабители отобрали у бизнесмена 40 млн рублей https://t.co/qNvTjaHTww,Unknown,Russian,2015-11-25T23:12:00,2015-11-25T23:12:00,1735.0000000000,691.0000000000,8945.0000000000,R,True
MichAtlas,Источник: при аварии Ми-8 в Красноярском крае погибли восемь человек https://t.co/1lvMjq4tkn,Unknown,Russian,2015-11-26T06:56:00,2015-11-26T06:57:00,1735.0000000000,690.0000000000,8946.0000000000,R,True
MichAtlas,ИГ причислила к списку своих врагов Украину и Молдавию https://t.co/DdShlYyBwq,Unknown,Ukrainian,2015-11-26T08:22:00,2015-11-26T08:22:00,1735.0000000000,689.0000000000,8949.0000000000,R,True
MichAtlas,Эксперт о заявлении Эрдогана: Цепочка поставок нефти ИГ может вести и на Украину  https://t.co/7L1ofDkuXL https://t.co/0QStPrh9qV,Unknown,Russian,2015-11-26T14:20:00,2015-11-26T14:24:00,1735.0000000000,689.0000000000,8950.0000000000,R,True
MichAtlas,ЗРК С-400 заступил на боевое дежурство на авиабазе России в Сирии https://t.co/KA5Itrc4kC https://t.co/CFkH1LoWDG,Unknown,Russian,2015-11-26T17:22:00,2015-11-26T17:22:00,1736.0000000000,689.0000000000,8951.0000000000,R,True
MichAtlas,Боевая машина PXM-5 пройдет испытания в России https://t.co/iMuuGuhXnv https://t.co/UFtpzoU3v9,Unknown,Russian,2015-11-27T10:14:00,2015-11-27T10:15:00,1736.0000000000,689.0000000000,8955.0000000000,R,True
MichAtlas,Запасов угля на Украине хватит минимум на месяц https://t.co/lMBGWm0FTD https://t.co/VrlJ1nUkfa,Unknown,Serbian,2015-11-27T10:19:00,2015-11-27T10:19:00,1736.0000000000,689.0000000000,8956.0000000000,R,True
MichAtlas,Расширение «Северного потока» не в интересах ЕС https://t.co/B0bmY3RN9e https://t.co/GXXSkugvkD,Unknown,Ukrainian,2015-11-27T10:54:00,2015-11-27T10:54:00,1736.0000000000,689.0000000000,8957.0000000000,R,True
MichAtlas,"Лениво и вразвалку   Я не то, чтобы сильно за политику, но, как всегда, расставил капканы""(с) https://t.co/8o0Z4DUnkj",Unknown,Russian,2015-11-27T12:44:00,2015-11-27T12:44:00,1736.0000000000,688.0000000000,8960.0000000000,R,True
MichAtlas,Авиакомпании РФ предоставили Минтрансу расчёты по убыткам из-за запрета полётов в Египет  https://t.co/UMu4X4FoSU,Unknown,Russian,2015-11-27T13:34:00,2015-11-27T13:34:00,1736.0000000000,688.0000000000,8961.0000000000,R,True
MichAtlas,ВС Ирака отразили нападение группировки ИГ в провинции Анбар https://t.co/y60ZakKQMz https://t.co/3OlcZkrW9n,Unknown,Russian,2015-11-27T15:32:00,2015-11-27T15:32:00,1736.0000000000,688.0000000000,8963.0000000000,R,True
MichAtlas,Приложение от Mixcord породило в интернете новый тренд с пением а капелло: https://t.co/VgZ0IDgmLP,Unknown,Russian,2015-11-27T16:38:00,2015-11-27T16:38:00,1736.0000000000,688.0000000000,8965.0000000000,R,True
MichAtlas,Фабиус: сотрудничество с армией САР возможно при политическом переходе https://t.co/q6dyBFDewz https://t.co/VkL95xtPbx,Unknown,Russian,2015-11-27T17:12:00,2015-11-27T17:15:00,1736.0000000000,688.0000000000,8966.0000000000,R,True
MichAtlas,Турецкий барьер для  фанатов «Зенита»  https://t.co/huqOCapnLl https://t.co/7YtvuxHvwS,Unknown,Ukrainian,2015-11-27T17:56:00,2015-11-27T17:56:00,1736.0000000000,688.0000000000,8968.0000000000,R,True
MichAtlas,«Негазифицированные» люди Крыма: без газа жизни нет https://t.co/Hd4j68V8yh  https://t.co/Hd4j68V8yh https://t.co/LxMPzd2qhK,Unknown,Russian,2015-11-27T19:03:00,2015-11-27T19:03:00,1736.0000000000,689.0000000000,8969.0000000000,R,True
MichAtlas,"Сирийский политик: ССА нет, ее бойцы присоединились к террористам https://t.co/SxbuK1kno3 https://t.co/BeP2KDhkbC",Unknown,Russian,2015-11-27T19:36:00,2015-11-27T19:36:00,1736.0000000000,689.0000000000,8970.0000000000,R,True
MichAtlas,Полиция запретила демонстрацию в центре Сеула https://t.co/yew0aaJLWf https://t.co/jj5RQXhOop,Unknown,Russian,2015-11-28T08:12:00,2015-11-28T08:12:00,1736.0000000000,689.0000000000,8976.0000000000,R,True
MichAtlas,Россиянина посадили на 15 лет за госизмену  https://t.co/KZPj9X2TEj,Unknown,Russian,2015-11-28T09:02:00,2015-11-28T09:02:00,1736.0000000000,689.0000000000,8977.0000000000,R,True
MichAtlas,Париж понизит градус  https://t.co/AwMgl6l02F https://t.co/J5GKrI0i6z,Unknown,Serbian,2015-11-28T10:35:00,2015-11-28T10:35:00,1736.0000000000,689.0000000000,8978.0000000000,R,True
MichAtlas,"В Одинцово с 8-го этажа парковки упала Mazda с тремя пассажирами Все трое молодых людей погибли на месте, …  https://t.co/uxu44mNJD1",Unknown,Russian,2015-11-28T10:52:00,2015-11-28T10:54:00,1736.0000000000,689.0000000000,8980.0000000000,R,True
MichAtlas,СМИ: МИД Турции рекомендует своим гражданам отказаться от несрочных поездок в Россию  https://t.co/ygRGtq88py,Unknown,Russian,2015-11-28T10:57:00,2015-11-28T10:59:00,1736.0000000000,689.0000000000,8982.0000000000,R,True
MichAtlas,Власти Турции не дают перевезти на родину тело гражданина России https://t.co/x3D9YHE5lG https://t.co/bSrJpg3Bj3,Unknown,Russian,2015-11-28T13:22:00,2015-11-28T13:22:00,1736.0000000000,689.0000000000,8983.0000000000,R,True
MichAtlas,"Агент Набиуллина: общаюсь с клубами Англии, Германии и России по поводу перехода https://t.co/uCRMy7x8yL",Unknown,Russian,2015-11-28T15:15:00,2015-11-28T15:16:00,1736.0000000000,689.0000000000,8986.0000000000,R,True
MichAtlas,"Кровь невинных людей на тебе, чекист! https://t.co/CBL4CmiYMq",Unknown,Russian,2015-11-28T15:52:00,2015-11-28T15:52:00,1736.0000000000,689.0000000000,8987.0000000000,R,True
MichAtlas,Израиль заявил о случайном заходе в свое воздушное пространство самолета ВКС Росси https://t.co/jpKI4C35vm,Unknown,Russian,2015-11-29T13:16:00,2015-11-29T13:16:00,1736.0000000000,688.0000000000,8994.0000000000,R,True
MichAtlas,"Пожежа. Все згоріло, куртка замшева, дві   https://t.co/t5mVXuJrOV",Unknown,Bulgarian,2015-11-29T14:12:00,2015-11-29T14:12:00,1736.0000000000,688.0000000000,8995.0000000000,R,True
MichAtlas,Власти Турции обсудили последствия экономических мер России для страны https://t.co/R2rKRcCuvu © Flickr/ KLMircea https://t.co/PaAPJYicTn,Unknown,Russian,2015-11-29T18:51:00,2015-11-29T18:51:00,1736.0000000000,688.0000000000,8998.0000000000,R,True
MichAtlas,"Туре Андре Фло: видно, что для «Динамо» построят отличный стадион https://t.co/McIhMpduLB",Unknown,Ukrainian,2015-11-30T10:22:00,2015-11-30T10:22:00,1736.0000000000,686.0000000000,9001.0000000000,R,True
MichAtlas,"Жители Ногинского района воюют со странными соседями, подозревая их в незаконном бизнесе на животных: https://t.co/XgGF2ZW51p",Unknown,Russian,2015-12-01T05:13:00,2015-12-01T05:13:00,1735.0000000000,685.0000000000,9007.0000000000,R,True
MichAtlas,Россия возложила гвоздики к импорту из Турции https://t.co/hmVUlqfAFT https://t.co/yBQaRSz4hs,Unknown,Russian,2015-12-01T20:51:00,2015-12-01T20:51:00,1735.0000000000,685.0000000000,9012.0000000000,R,True
MichAtlas,WP: Ирак подозревает США в сотрудничестве с боевиками ИГ https://t.co/NxvqpvLjNz,Unknown,Russian,2015-12-02T09:33:00,2015-12-02T09:33:00,1734.0000000000,684.0000000000,9015.0000000000,R,True
MichAtlas,Песков о расследовании Навального о семье Чайки  https://t.co/lH45OVbKhE https://t.co/uw8CNjHVoX,Unknown,Russian,2015-12-02T11:15:00,2015-12-02T11:16:00,1734.0000000000,683.0000000000,9017.0000000000,R,True
MichAtlas,"Владельцы парижского театра ""Батаклан"" обещают открыть его в конце 2016 года https://t.co/utW3avgsTv",Unknown,Russian,2015-12-02T16:53:00,2015-12-02T16:53:00,1734.0000000000,683.0000000000,9018.0000000000,R,True
MichAtlas,Фонд кино выделит 700 млн руб. кинотеатрам в малых городах https://t.co/s0BUG4q0Lm,Unknown,Russian,2015-12-02T20:52:00,2015-12-02T20:52:00,1734.0000000000,683.0000000000,9020.0000000000,R,True
MichAtlas,Честь офицера #Осознание@rus_improvisation #Культура_и_традиции@rus_improvisation,Unknown,Russian,2015-12-03T03:51:00,2015-12-03T03:51:00,1734.0000000000,684.0000000000,9021.0000000000,R,True
MichAtlas,Мир на грани краха. Саммит в Париже https://t.co/nXiLY1ai1a https://t.co/377wS0K8vk,Unknown,Macedonian,2015-12-03T08:37:00,2015-12-03T08:37:00,1734.0000000000,684.0000000000,9024.0000000000,R,True
MichAtlas,WSJ: президентство Обамы разобщило американцев https://t.co/yje2PLj4XM,Unknown,Bulgarian,2015-12-03T11:14:00,2015-12-03T11:15:00,1734.0000000000,684.0000000000,9025.0000000000,R,True
MichAtlas,Киев заявил о восстановлении электроснабжения Крыма https://t.co/2aeBr7Sxl6 https://t.co/7JcuVTYl12,Unknown,Russian,2015-12-03T14:57:00,2015-12-03T14:58:00,1734.0000000000,684.0000000000,9025.0000000000,R,True
MichAtlas,«Укрэнерго» не возобновляла поставки электричества в Крым https://t.co/uZ3uxS3DA9 https://t.co/LED0Gql8qi,Unknown,Ukrainian,2015-12-03T15:34:00,2015-12-03T15:34:00,1734.0000000000,684.0000000000,9026.0000000000,R,True
MichAtlas,СНБО Украины о сбитом российском Су-24: Турция действовала в соответствии с международными нормами https://t.co/dsii8cSHFp #турция,Unknown,Russian,2015-12-03T22:53:00,2015-12-03T22:53:00,1734.0000000000,681.0000000000,9030.0000000000,R,True
MichAtlas,"Бальде: пусть хоть Беленов «Краснодару» забьёт, лишь бы этот гол стал победным https://t.co/HkghbtI6S8",Unknown,Russian,2015-12-04T08:52:00,2015-12-04T08:52:00,1734.0000000000,681.0000000000,9032.0000000000,R,True
MichAtlas,В Петербурге началась процедура выдачи тел погибших в авиакатастрофе А321 https://t.co/P5VoZ95qkg,Unknown,Russian,2015-12-04T09:14:00,2015-12-04T09:14:00,1734.0000000000,681.0000000000,9033.0000000000,R,True
MichAtlas,ФБР заявило об отсутствии данных о причастности ИГ к теракту в Калифорнии https://t.co/bNF0NJRWfR,Unknown,Russian,2015-12-04T23:32:00,2015-12-04T23:32:00,1734.0000000000,681.0000000000,9036.0000000000,R,True
MichAtlas,LA Times: стрелок из Калифорнии контактировал с боевиками из Сирии #новости https://t.co/h5Ih84xubC,Unknown,Russian,2015-12-05T03:51:00,2015-12-05T03:51:00,1734.0000000000,681.0000000000,9037.0000000000,R,True
MichAtlas,"Крохотный слоненок, застрявший в луже, очаровал интернет-пользователей. ВИДЕО: https://t.co/xdHoeF115D https://t.co/6eF6p5T4Rx",Unknown,Russian,2015-12-05T11:32:00,2015-12-05T11:33:00,1734.0000000000,682.0000000000,9039.0000000000,R,True
MichAtlas,#Юмор@rus_improvisation https://t.co/kruxCUhXEd,Unknown,Bulgarian,2015-12-05T19:33:00,2015-12-05T19:34:00,1734.0000000000,682.0000000000,9040.0000000000,R,True
MichAtlas,Донецкий аэропорт подвергся обстрелу  https://t.co/kAgNxuEXof https://t.co/fTwj8P406A,Unknown,Russian,2015-12-05T20:32:00,2015-12-05T20:32:00,1734.0000000000,682.0000000000,9041.0000000000,R,True
MichAtlas,Каждый день проезжаю мимо Волковского театра! И каждый раз думаю...Почему великие соедененные Штаты появились только потом?,Unknown,Russian,2015-12-06T06:33:00,2015-12-06T06:34:00,1734.0000000000,681.0000000000,9042.0000000000,R,True
MichAtlas,Президент Киргизии призвал пристально следить за религиозной ситуацией в стране https://t.co/q2AUXcFKf0,Unknown,Russian,2015-12-07T07:31:00,2015-12-07T07:31:00,1734.0000000000,680.0000000000,9045.0000000000,R,True
MichAtlas,"Отряд МЧС продолжает искать украинского ученого, который пропал на Эльбрусе 1 декабря https://t.co/KyZeNK5L9x",Unknown,Russian,2015-12-07T09:55:00,2015-12-07T09:55:00,1734.0000000000,680.0000000000,9049.0000000000,R,True
MichAtlas,США пригрозили России большим ущербом за невыполнение Минских соглашений https://t.co/Un5GbFBOQL,Unknown,Russian,2015-12-08T00:31:00,2015-12-08T00:31:00,1734.0000000000,680.0000000000,9052.0000000000,R,True
MichAtlas,"Черевченко: может, допустили ошибки при подготовке игроков «Локомотива» https://t.co/jDCco7SpSq",Unknown,Russian,2015-12-08T13:31:00,2015-12-08T13:32:00,1734.0000000000,679.0000000000,9054.0000000000,R,True
MichAtlas,МВФ изменил условия кредитования стран с просроченным суверенным долгом https://t.co/JUw5GkziX2,Unknown,Russian,2015-12-08T19:15:00,2015-12-08T19:15:00,1733.0000000000,679.0000000000,9055.0000000000,R,True
MichAtlas,"Неизменно поддерживаем посреднические усилия ООН, направленные на достижение мира и национального согласия в Йемене https://t.co/p7aI6QjU31",Unknown,Russian,2015-12-09T12:16:00,2015-12-09T12:16:00,1733.0000000000,678.0000000000,9056.0000000000,R,True
MichAtlas,Совфед одобрил снижение штрафов для большегрузов за проезд без оплаты по федеральным трассам https://t.co/OcaImdCLeH,Unknown,Russian,2015-12-09T13:56:00,2015-12-09T13:56:00,1733.0000000000,678.0000000000,9058.0000000000,R,True
MichAtlas,Договоренности гораздо лучше любой войны. Вопрос: а НАТО готово договариваться с Россией?,Unknown,Russian,2015-12-09T16:11:00,2015-12-09T16:11:00,1733.0000000000,678.0000000000,9059.0000000000,R,True
MichAtlas,"Запад Крыма снова остался без света  Жители запада Крыма — города Евпатория, а также Раздоль https://t.co/J4qfAHkTGM https://t.co/WA03w8gkhl",Unknown,Russian,2015-12-10T01:12:00,2015-12-10T01:12:00,1733.0000000000,677.0000000000,9061.0000000000,R,True
MichAtlas,"Касперский о телефонах-шпионах, киберзверьках и других интернет-вредителях https://t.co/C8UyTcAj2t",Unknown,Russian,2015-12-10T11:34:00,2015-12-10T11:34:00,1733.0000000000,677.0000000000,9064.0000000000,R,True
MichAtlas,"Турция УГРОЖАЕТ России: ""Наше терпение не безгранично""  https://t.co/mLYHBnroZo https://t.co/JziKmGRYyx",Unknown,Russian,2015-12-11T10:54:00,2015-12-11T10:54:00,1734.0000000000,676.0000000000,9069.0000000000,R,True
MichAtlas,«Аэрофлот» на 10% снизил стоимость тарифов на внутренние рейсы https://t.co/BhFQJRjG2o,Unknown,Russian,2015-12-11T16:59:00,2015-12-11T17:00:00,1734.0000000000,676.0000000000,9070.0000000000,R,True
MichAtlas,"ВСУ заявили, что за день в Донбассе ополченцы их обстреляли 25 раз https://t.co/ITwds3V0m0 https://t.co/oY0gIjXVHG",Unknown,Ukrainian,2015-12-12T19:14:00,2015-12-12T19:14:00,1734.0000000000,676.0000000000,9074.0000000000,R,True
MichAtlas,Митинг против вступления Черногории в НАТО проходит в Подгорице  Оппозиция вывела до 5 тысяч https://t.co/sEHIyPF9xe https://t.co/vhD4RAt5jP,Unknown,Russian,2015-12-13T01:50:00,2015-12-13T01:50:00,1734.0000000000,676.0000000000,9075.0000000000,R,True
MichAtlas,Поджог BMW на Рублевке мог быть связан с бизнесом их владельца Сгоревшие автомобили принадлежали одному …  https://t.co/66K9AIH4pQ,Unknown,Russian,2015-12-13T16:51:00,2015-12-13T16:51:00,1734.0000000000,676.0000000000,9077.0000000000,R,True
MichAtlas,"Ещё одно призрачное государство - и такой же бардак: ""В парламенте Косово оппозиция устроила газовую атаку"".",Unknown,Russian,2015-12-14T15:33:00,2015-12-14T15:33:00,1734.0000000000,676.0000000000,9082.0000000000,R,True
MichAtlas,Михалков рассказал о запрещенном к показу выпуске «Бесогон ТВ» https://t.co/Z7sy2yyUlS,Unknown,Russian,2015-12-14T15:35:00,2015-12-14T15:36:00,1734.0000000000,676.0000000000,9083.0000000000,R,True
MichAtlas,#Осознание@rus_improvisation https://t.co/xKZWO4ZOI7,Unknown,Bulgarian,2015-12-14T15:51:00,2015-12-14T15:52:00,1734.0000000000,676.0000000000,9084.0000000000,R,True
MichAtlas,"Не супер - Герои: Евгений Чернышев.   https://t.co/mvY5KyIGLD #Осознание@rus_improvisation Вы знаете, мы искренне ... https://t.co/DaSSnmyh3S",Unknown,Ukrainian,2015-12-15T10:51:00,2015-12-15T10:51:00,1734.0000000000,675.0000000000,9086.0000000000,R,True
