author_id,content,region,language,publish_date,harvested_date,following,followers,updates,post_type,retweet
BereHayyTR,"RT RealJamesWoods: Election Fraud? Registered Voters Outnumber the Eligible, in 462 Counties \| National Review  https://t.co/K3H3wJCd7S",United States,English,2017-08-12T02:44:00,2017-08-12T02:44:00,0E-10,1.0000000000,237.0000000000,,False
BereHayyTR,RT DanPatrick: Senate Bill 5 is on its way to GregAbbott_TX's desk! #txlege https://t.co/pjC72nbOYm,United States,English,2017-08-12T03:40:00,2017-08-12T03:40:00,0E-10,1.0000000000,243.0000000000,,False
BereHayyTR,RT FoxNews: Developing: Federal judge orders StateDept to conduct new search for potential HillaryClinton Benghazi… https://t.co/03DdGUSZyT,United States,English,2017-08-12T03:40:00,2017-08-12T03:40:00,0E-10,1.0000000000,244.0000000000,,False
BereHayyTR,RT GomerP6699: Kentucky Gov publicly signs bill allowing public schools to teach the Bible. \| Press Corp https://t.co/qmLqtJozU0,United States,English,2017-08-12T03:40:00,2017-08-12T03:40:00,0E-10,1.0000000000,242.0000000000,,False
BereHayyTR,ISIS uses eBay to send terror money to US operatives - Fox News... How can they allow this to happen. Needs to sto… https://t.co/dUEr603b2a,United States,English,2017-08-12T03:56:00,2017-08-12T03:56:00,0E-10,1.0000000000,245.0000000000,,False
BereHayyTR,RT lowt3ch: Soros funded media matters is working with Facebook and Twitter to kill pro trump articles https://t.co/czVJ2IYrMr,United States,English,2017-08-12T04:04:00,2017-08-12T04:04:00,0E-10,1.0000000000,246.0000000000,,False
BereHayyTR,RT BFBDDick: TBrianMalone chelseahandler So you're advocating and supporting the assassination of the President of… https://t.co/j1CzVEbkAY,United States,English,2017-08-12T04:04:00,2017-08-12T04:04:00,0E-10,1.0000000000,248.0000000000,,False
BereHayyTR,Locked &amp; Loaded: What it means - Fox News https://t.co/FSLUZT8gdb,United States,English,2017-08-12T04:52:00,2017-08-12T04:52:00,0E-10,1.0000000000,249.0000000000,,False
BereHayyTR,"RT RealMattCouch: Do me a favor everyone, stop what you're doing at some point today and say a Prayer for our President. POTUS we are behin…",United States,English,2017-08-12T05:16:00,2017-08-12T05:16:00,0E-10,1.0000000000,250.0000000000,,False
BereHayyTR,"RT bayes46: McCain Attacks Trump for NK Threats, Hours Later Decade-Old Video Destroys Him https://t.co/F06SRg7v84",United States,English,2017-08-12T05:16:00,2017-08-12T05:16:00,0E-10,1.0000000000,251.0000000000,,False
BereHayyTR,RT foxandfriends: Senators learn the hard way about the fallout from turning on Trump https://t.co/L0ZcHbw1GW,United States,English,2017-08-12T05:24:00,2017-08-12T05:24:00,0E-10,1.0000000000,254.0000000000,,False
BereHayyTR,"RT petefrt: When liberals start dressing like ISIS because they don't like Donald Trump, you know you voted for th… https://t.co/f0QdVpFzPh",United States,English,2017-08-12T05:24:00,2017-08-12T05:24:00,0E-10,1.0000000000,255.0000000000,,False
BereHayyTR,RT HorseShort: STKnutsen realDonaldTrump CNN . Then this statement should be reported to SecretService because it'… https://t.co/TCNOA1Zn2b,United States,English,2017-08-12T05:24:00,2017-08-12T05:24:00,0E-10,1.0000000000,252.0000000000,,False
BereHayyTR,RT PrisonPlanet: Google must issue a strong statement defending free speech and outline how they plan to enforce it. People have had enough.,United States,English,2017-08-12T05:24:00,2017-08-12T05:24:00,0E-10,1.0000000000,253.0000000000,,False
BereHayyTR,RT marklevinshow: Disgraceful New York Times https://t.co/DfHSxkcaKx,United States,English,2017-08-12T05:32:00,2017-08-12T05:32:00,0E-10,1.0000000000,258.0000000000,,False
BereHayyTR,RT TheMadDimension: Facebook has taken down the #UniteTheRight event page but the event is still happening tomorro… https://t.co/J0ellhTiit,United States,English,2017-08-12T05:32:00,2017-08-12T05:32:00,0E-10,1.0000000000,257.0000000000,,False
BereHayyTR,RT _Makada_: Communist leftists are showing their true colors by siding with North Korean Dictator Kim Jong Un over our President. It is si…,United States,English,2017-08-12T05:32:00,2017-08-12T05:32:00,0E-10,1.0000000000,256.0000000000,,False
BereHayyTR,"RT JudicialWatch: Per DOJ, state employees sold driver's licenses &amp; IDs to illegal immigrants, allegedly leading t… https://t.co/GKVW3ugGjj",United States,English,2017-08-12T05:40:00,2017-08-12T05:40:00,0E-10,1.0000000000,259.0000000000,,False
BereHayyTR,RT ChristieC733: The End of Govt Schools   The expiration date is long past on the left’s stale “solutions”   📚#Sc… https://t.co/IKOk85F5zp,United States,English,2017-08-12T05:40:00,2017-08-12T05:40:00,0E-10,1.0000000000,260.0000000000,,False
BereHayyTR,RT THETRUMPBUREAU: THIS IS A GREAT PLAN...I AM ASKING MY 26K+ FOLLOWERS TO PARTICIPATE IN AMPLIFYING #TRUMPTRAIN'S… https://t.co/fFv2EBj2ST,United States,English,2017-08-12T12:42:00,2017-08-12T12:42:00,0E-10,1.0000000000,261.0000000000,,False
BereHayyTR,"RT DineshDSouza: ""We're socialists...enemies of today's capitalist system of exploitation &amp; we're determined to de… https://t.co/kTX89jfu4a",United States,English,2017-08-12T12:42:00,2017-08-12T12:42:00,0E-10,1.0000000000,262.0000000000,,False
BereHayyTR,RT Snikk: UH-OH: 'Discrepancies' Emerge in Jane Sanders' Burlington College Donor List in Bank Fraud Investigation https://t.co/AFItowSGpK,United States,English,2017-08-12T12:42:00,2017-08-12T12:42:00,0E-10,1.0000000000,263.0000000000,,False
BereHayyTR,"RT trish_regan: It’s simple. The base is still with Trump! If these GOP lawmakers want to win in 2018, they’ve got… https://t.co/RPf6hAeLOn",United States,English,2017-08-12T12:42:00,2017-08-12T12:42:00,0E-10,1.0000000000,264.0000000000,,False
BereHayyTR,RT adra21: This bus stop is a block away from the Google office in Venice. Holy shit. https://t.co/Xt722n2LIP,United States,English,2017-08-12T12:51:00,2017-08-12T12:52:00,0E-10,1.0000000000,265.0000000000,,False
BereHayyTR,RT TruthFeedNews: Angela Merkel Scolds Trump on North Korea as If She is Above Him https://t.co/AKerbPVSoy via truthfeednews  #maga #trump…,United States,English,2017-08-12T12:51:00,2017-08-12T12:51:00,0E-10,1.0000000000,266.0000000000,,False
BereHayyTR,RT TruthFeedNews: The 2020 DNC Primary Could Be a CIRCUS! https://t.co/eHWstmGztv via truthfeednews  #maga #trumptrain #trump,United States,English,2017-08-12T14:44:00,2017-08-12T14:44:00,0E-10,1.0000000000,269.0000000000,,False
BereHayyTR,RT GrizzleMaximus: Silly businesses that cater to illegals &amp; terrorists before homeless vets &amp; other Americans des… https://t.co/aoBLu3oTjc,United States,English,2017-08-12T14:44:00,2017-08-12T14:44:00,0E-10,1.0000000000,270.0000000000,,False
BereHayyTR,RT RealJack: It almost seems like some liberals would rather see North Korea nuke us than have President Trump defend us. It's such a joke …,United States,English,2017-08-12T14:44:00,2017-08-12T14:44:00,0E-10,1.0000000000,268.0000000000,,False
BereHayyTR,RT mitchellvii: Trump crowds hold #MAGA signs. #Antifa crowds hold bricks and sticks.  Guess which stands for the future of America?,United States,English,2017-08-12T14:44:00,2017-08-12T14:44:00,0E-10,1.0000000000,267.0000000000,,False
BereHayyTR,RT EjHirschberger: ATTENTION #TRUMPTRAIN: We must amplify our online presence.1 RETWEET this tweet2 Follow... https://t.co/VBaBNUiHAF by #…,United States,English,2017-08-12T14:52:00,2017-08-12T14:52:00,0E-10,1.0000000000,271.0000000000,,False
BereHayyTR,"RT FoxNews: .POTUS: ""I support peace, I support safety, and I support having to get very tough if we have to to pr… https://t.co/gU4sDNWbV3",United States,English,2017-08-12T16:44:00,2017-08-12T16:44:00,0E-10,1.0000000000,272.0000000000,,False
BereHayyTR,RT AmericanHotLips: I'm LIVIN' LARGE💪🏼‼️ I voted to take my country back &amp; Im NOT letting go🙌🏼🙌🏼🇺🇸🇺🇸Thank u to all… https://t.co/J6itJoPhlz,United States,English,2017-08-12T16:44:00,2017-08-12T16:44:00,0E-10,1.0000000000,273.0000000000,,False
BereHayyTR,RT RealJamesWoods: Gay Escort Found Dead of Meth Overdose at Home of Top Democrat Donor https://t.co/x0se3EYjMR,United States,English,2017-08-12T16:52:00,2017-08-12T16:52:00,0E-10,1.0000000000,276.0000000000,,False
BereHayyTR,RT CharlieDaniels: Morning prayer Lord being about a revival in our beloved America such as has never been seen before.let the name of Jesu…,United States,English,2017-08-12T16:52:00,2017-08-12T16:52:00,0E-10,1.0000000000,277.0000000000,,False
BereHayyTR,"RT RealSaavedra: September 11, 2016, Hillary Clinton said if she was president:  *NKorea Not Permitted To Have Nuk… https://t.co/cLCEUFC1pj",United States,English,2017-08-12T16:52:00,2017-08-12T16:52:00,0E-10,1.0000000000,274.0000000000,,False
BereHayyTR,"RT JohnTDolan: I'd rather have a President ""Locked &amp; Loaded"" than just plain ""Loaded"" https://t.co/nbGrE6WOza",United States,English,2017-08-12T16:52:00,2017-08-12T16:52:00,0E-10,1.0000000000,275.0000000000,,False
BereHayyTR,"RT USNJack: Chelsea, you have violated 18 U.S. Code § 2385. Your written declaration Advocating overthrow of Gover… https://t.co/dZUWVU5dPW",United States,English,2017-08-12T17:00:00,2017-08-12T17:01:00,0E-10,1.0000000000,279.0000000000,,False
BereHayyTR,Democrat Governor Urges the U.S. to Emulate COMMUNIST CHINA https://t.co/yNiTBzwc2M #bere https://t.co/Fu5je81xjo,United States,English,2017-08-12T18:20:00,2017-08-12T18:21:00,0E-10,1.0000000000,286.0000000000,,False
BereHayyTR,Trump Confirms the U.S. Military is “Locked and Loaded” if N. Korea Attacks https://t.co/gCdSis8sgG #bere https://t.co/GMQBdcVFzX,United States,English,2017-08-12T18:20:00,2017-08-12T18:21:00,0E-10,1.0000000000,281.0000000000,,False
BereHayyTR,BREAKING : Guam Prepares for “Imminent Missile” Strike https://t.co/slUmI2E9WY #bere https://t.co/L826epk6Tf,United States,English,2017-08-12T18:20:00,2017-08-12T18:21:00,0E-10,1.0000000000,284.0000000000,,False
BereHayyTR,6 Top Choices to Replace Disgraced McConnell https://t.co/4yHGLVHtM5 #bere https://t.co/7KIRvh5UYW,United States,English,2017-08-12T18:20:00,2017-08-12T18:20:00,0E-10,1.0000000000,283.0000000000,,False
BereHayyTR,Virginia Democrat Sentenced for VOTER FRAUD https://t.co/YL0DkAbe7k #bere https://t.co/2kjVLWhppk,United States,English,2017-08-12T18:20:00,2017-08-12T18:20:00,0E-10,1.0000000000,280.0000000000,,False
BereHayyTR,Canada FORCED to take DRASTIC Action to Stop Illegals From Flooding In https://t.co/1du8xAMPAt #bere https://t.co/Q88JnTGuRM,United States,English,2017-08-12T18:20:00,2017-08-12T18:21:00,0E-10,1.0000000000,285.0000000000,,False
BereHayyTR,Liberal Rag Wonders if U.S. Should Shoot Down N.K. Missiles in Self Defense https://t.co/r6eCfYurWV #bere https://t.co/IKmU4VWkBe,United States,English,2017-08-12T18:20:00,2017-08-12T18:21:00,0E-10,1.0000000000,282.0000000000,,False
BereHayyTR,New Documents Prove Loretta Lynch LIED About Tarmac Meeting https://t.co/vnAgxoYJRp #bere https://t.co/B1eYbqYiGP,United States,English,2017-08-12T18:21:00,2017-08-12T18:21:00,0E-10,1.0000000000,289.0000000000,,False
BereHayyTR,BARF! Libtard Chelsea Handler Apologizes For Trump Wherever She Goes https://t.co/rq3x4b2xQM #bere https://t.co/sZEBvIDQXT,United States,English,2017-08-12T18:21:00,2017-08-12T18:21:00,0E-10,1.0000000000,287.0000000000,,False
BereHayyTR,Robert Mueller Has Just Been EXPOSED https://t.co/vm0eK6CiaM #bere https://t.co/Ygnf0gvU4V,United States,English,2017-08-12T18:21:00,2017-08-12T18:21:00,0E-10,1.0000000000,288.0000000000,,False
BereHayyTR,WHOA! Laura Ingraham Just BLASTED China! https://t.co/N6qWdiPB0m #bere https://t.co/M3gQYJmXcE,United States,English,2017-08-12T18:35:00,2017-08-12T18:35:00,0E-10,1.0000000000,293.0000000000,,False
BereHayyTR,Maxine Waters Unveils Her Really Dumb Plan to Stop N. Korea https://t.co/3fCQAX3xEA #bere https://t.co/WVAAjZVJ4x,United States,English,2017-08-12T18:35:00,2017-08-12T18:35:00,0E-10,1.0000000000,290.0000000000,,False
BereHayyTR,Chelsea Handler Calls on Generals For a Military Coup Against Trump https://t.co/VdaXkYIrYx #bere https://t.co/XK7T3kV30R,United States,English,2017-08-12T18:35:00,2017-08-12T18:35:00,0E-10,1.0000000000,294.0000000000,,False
BereHayyTR,Liberal Magazine Claims if You Have Blonde Hair Then You’re RACIST https://t.co/qGe59j4r01 #bere https://t.co/cE4ehLrdNU,United States,English,2017-08-12T18:35:00,2017-08-12T18:35:00,0E-10,1.0000000000,291.0000000000,,False
BereHayyTR,"Under Pressure, Liar Susan Rice Just Threw Obama Under the Bus! https://t.co/YV6ZcI5kVE #bere https://t.co/GR4FkPJCRZ",United States,English,2017-08-12T18:35:00,2017-08-12T18:36:00,0E-10,1.0000000000,295.0000000000,,False
BereHayyTR,BREAKING : Judge Orders New Search of Hillary’s Benghazi Emails https://t.co/POyx1zRoud #bere https://t.co/cxOuZsU17P,United States,English,2017-08-12T18:35:00,2017-08-12T18:35:00,0E-10,1.0000000000,292.0000000000,,False
BereHayyTR,"RT JudicialWatch: #ICYMI: JW won a big court victory this week, forcing StateDept to search for docs related to Be… https://t.co/3SXc6SvW9o",United States,English,2017-08-12T18:44:00,2017-08-12T18:44:00,0E-10,1.0000000000,299.0000000000,,False
BereHayyTR,RT RealJamesWoods: 43 Percent Latent TB Rates Among Sub-Saharan Refugees in San Diego County Interviewed for Jobs … https://t.co/DDrTusHx6j,United States,English,2017-08-12T18:44:00,2017-08-12T18:44:00,0E-10,1.0000000000,298.0000000000,,False
BereHayyTR,RT VP: I stand with POTUS against hate &amp; violence. U.S is greatest when we join together &amp; oppose those seeking to… https://t.co/irG5WDvCt2,United States,English,2017-08-12T18:44:00,2017-08-12T18:44:00,0E-10,1.0000000000,297.0000000000,,False
BereHayyTR,RT realDonaldTrump: We ALL must be united &amp; condemn all that hate stands for. There is no place for this kind of violence in America. Lets …,United States,English,2017-08-12T18:44:00,2017-08-12T18:44:00,0E-10,1.0000000000,296.0000000000,,False
BereHayyTR,Angela Merkel Scolds Trump on North Korea as If She is Above Him https://t.co/Qvtc60pnYI #bere https://t.co/Y65FSdxR8E,United States,English,2017-08-12T18:50:00,2017-08-12T18:50:00,0E-10,1.0000000000,309.0000000000,,False
BereHayyTR,Japan Prime Minister Shinzo Abe Reacts to U.S. – North Korea Conflict https://t.co/xC8AjXcSz2 #bere https://t.co/Xij3L4yg4h,United States,English,2017-08-12T18:50:00,2017-08-12T18:50:00,0E-10,1.0000000000,310.0000000000,,False
BereHayyTR,"California CAVES! Pays Woman Who Had Hijab Removed By Police $85,000 https://t.co/awqeXNQbhW #bere https://t.co/KDYE4uezq3",United States,English,2017-08-12T18:50:00,2017-08-12T18:50:00,0E-10,1.0000000000,308.0000000000,,False
BereHayyTR,Horror Video : Watch Wild Somali Muslims Invade The Beaches of Spain https://t.co/FxBO8sEZC4 #bere https://t.co/C3q4y5GVCl,United States,English,2017-08-12T18:50:00,2017-08-12T18:50:00,0E-10,1.0000000000,300.0000000000,,False
BereHayyTR,Satellite Imagery Suggests North Korea Preparing Submarine Missile Test https://t.co/a3xe0P9nr8 #bere https://t.co/VvK4eCt2eq,United States,English,2017-08-12T18:50:00,2017-08-12T18:50:00,0E-10,1.0000000000,311.0000000000,,False
BereHayyTR,Pathetic Liberal Media Dedicates Hit Piece to Melania’s Heels https://t.co/TDRRpR0UiT #bere https://t.co/WtNDg9rwRB,United States,English,2017-08-12T18:50:00,2017-08-12T18:50:00,0E-10,1.0000000000,302.0000000000,,False
BereHayyTR,Kayleigh McEnany Reveals Trump’s Plan to Fight Fake News https://t.co/hR7pPrjBcJ #bere https://t.co/WG9LzdA2vW,United States,English,2017-08-12T18:50:00,2017-08-12T18:50:00,0E-10,1.0000000000,312.0000000000,,False
BereHayyTR,Dem “Leader” Just Claimed Trump is Worse than Kim Jong-un https://t.co/6uIzuiLj77 #bere https://t.co/F219Jzk8BV,United States,English,2017-08-12T18:50:00,2017-08-12T18:50:00,0E-10,1.0000000000,306.0000000000,,False
BereHayyTR,Another MASSIVE NY Times Blunder is Going Viral! https://t.co/S1mL74hlyX #bere https://t.co/JtxpKz1eHh,United States,English,2017-08-12T18:50:00,2017-08-12T18:50:00,0E-10,1.0000000000,305.0000000000,,False
BereHayyTR,HYPOCRITES! Omarosa Mocked at Black Journalist Conference https://t.co/6E4g0HiWID #bere https://t.co/e4WiOqXAxA,United States,English,2017-08-12T18:50:00,2017-08-12T18:50:00,0E-10,1.0000000000,303.0000000000,,False
BereHayyTR,Grassroots Conservative Group Calls on Senate GOP to DITCH MITCH! https://t.co/q6592oqLno #bere https://t.co/R4zXuW5EVg,United States,English,2017-08-12T18:50:00,2017-08-12T18:50:00,0E-10,1.0000000000,304.0000000000,,False
BereHayyTR,BREAKING : Ex-Mueller Deputy Threatens Deep State Assassination of Trump! https://t.co/Tu7EjqLq2y #bere https://t.co/LHkhoFcVhN,United States,English,2017-08-12T18:50:00,2017-08-12T18:50:00,0E-10,1.0000000000,307.0000000000,,False
BereHayyTR,Media Ignores This BOOMING ECONOMY Stat During the Trump Era https://t.co/7Ji1BAtJOE #bere https://t.co/PI9Ze5Pc92,United States,English,2017-08-12T18:50:00,2017-08-12T18:50:00,0E-10,1.0000000000,301.0000000000,,False
BereHayyTR,RT JessieJaneDuff: This is Democrat leadership openly supporting a murderous North Korean dictator...and why they'… https://t.co/VXHK786GIE,United States,English,2017-08-12T18:52:00,2017-08-12T18:52:00,0E-10,1.0000000000,313.0000000000,,False
BereHayyTR,The 2020 DNC Primary Could Be a CIRCUS! https://t.co/O3WTF6MxaT #bere https://t.co/jb0TQGnjkb,United States,English,2017-08-12T19:05:00,2017-08-12T19:07:00,0E-10,1.0000000000,315.0000000000,,False
BereHayyTR,Is China’s Stance on North Korea Two-Faced? https://t.co/aceWJva5Lm #bere https://t.co/zAkC4HAXMj,United States,English,2017-08-12T19:05:00,2017-08-12T19:05:00,0E-10,1.0000000000,314.0000000000,,False
BereHayyTR,Congressman Demands Mueller Testify Before Congress https://t.co/LVdexcdEWV #bere https://t.co/fvDAHocwHE,United States,English,2017-08-12T19:05:00,2017-08-12T19:06:00,0E-10,1.0000000000,320.0000000000,,False
BereHayyTR,Stephen King Tweets DEATH THREAT to President Trump https://t.co/rvcUUmqcvA #bere https://t.co/QRvcJO3aKD,United States,English,2017-08-12T19:05:00,2017-08-12T19:07:00,0E-10,1.0000000000,318.0000000000,,False
BereHayyTR,Trump HUMILIATES Merkel Over Her NORTH KOREA Comments https://t.co/1heRFNjjHH #bere https://t.co/glfu4RDhcy,United States,English,2017-08-12T19:05:00,2017-08-12T19:05:00,0E-10,1.0000000000,319.0000000000,,False
BereHayyTR,WATCH : The Deep State Just Openly Threatened to Assassinate Trump! https://t.co/Xq0VhAcnAs #bere https://t.co/sW9kbrL9gs,United States,English,2017-08-12T19:05:00,2017-08-12T19:05:00,0E-10,1.0000000000,317.0000000000,,False
BereHayyTR,Look What Sheriff Joe said about a Possible Trump Pardon! https://t.co/A81g6nArdf #bere https://t.co/yHcIKQyaK6,United States,English,2017-08-12T19:05:00,2017-08-12T19:05:00,0E-10,1.0000000000,316.0000000000,,False
BereHayyTR,FLASHBACK : Bill Clinton Made Same “Fire and Fury” Comments https://t.co/26vq4BjxDy #bere https://t.co/YNYrUBeKbL,United States,English,2017-08-12T19:05:00,2017-08-12T19:06:00,0E-10,1.0000000000,321.0000000000,,False
BereHayyTR,Trump Considering a Brilliant Strategy to Still Pass Obamacare Repeal! https://t.co/fkY6EwgQfq #bere https://t.co/pjGInLpAgf,United States,English,2017-08-12T19:05:00,2017-08-12T19:06:00,0E-10,1.0000000000,322.0000000000,,False
BereHayyTR,TRUMP EFFECT! U.S. Corporations See Best Earnings in 13 Years! https://t.co/Qu1wBkO9Oj #bere https://t.co/hkK5IdVBym,United States,English,2017-08-12T19:20:00,2017-08-12T19:20:00,0E-10,1.0000000000,331.0000000000,,False
BereHayyTR,Allen West Can No Longer Remain Silent and UNLOADS on Colin Kaepernick! https://t.co/Hrj2u8Y7JS #bere https://t.co/ELGyPJbd13,United States,English,2017-08-12T19:20:00,2017-08-12T19:21:00,0E-10,1.0000000000,329.0000000000,,False
BereHayyTR,Feinstein Calls Trump “CRUEL” for Following Immigration Laws https://t.co/VyXXIwP91Q #bere https://t.co/2gKyF9XJtW,United States,English,2017-08-12T19:20:00,2017-08-12T19:21:00,0E-10,1.0000000000,334.0000000000,,False
BereHayyTR,Disgraced GOP Lawmaker on WITCH-HUNT for Trump’s Taxes https://t.co/kmvKnbBTcw #bere https://t.co/YwUMRYOuTt,United States,English,2017-08-12T19:20:00,2017-08-12T19:20:00,0E-10,1.0000000000,332.0000000000,,False
BereHayyTR,Wall Street Journal FORCED to Admit Key Trump Jobs Policy is WORKING! https://t.co/Dp59QRQs1y #bere https://t.co/fezSZcC3yv,United States,English,2017-08-12T19:20:00,2017-08-12T19:20:00,0E-10,1.0000000000,330.0000000000,,False
BereHayyTR,LOSER McConnell “Stunned” After Trump RIPS Him for Failure https://t.co/yzuK259Iiy #bere https://t.co/MTbruBzLrz,United States,English,2017-08-12T19:20:00,2017-08-12T19:20:00,0E-10,1.0000000000,323.0000000000,,False
BereHayyTR,James Damore Op-Ed “Why I Was Fired By Google” https://t.co/fqlNP5Mmcs #bere https://t.co/RLIUA4yTZJ,United States,English,2017-08-12T19:20:00,2017-08-12T19:20:00,0E-10,1.0000000000,326.0000000000,,False
BereHayyTR,Trump has a Surprise for China and They’re NOT Going to Like It! https://t.co/cQ2aP4LR9q #bere https://t.co/yyx4wYGLF0,United States,English,2017-08-12T19:20:00,2017-08-12T19:20:00,0E-10,1.0000000000,327.0000000000,,False
BereHayyTR,Look Which DNC “Leader” Just Got Busted ROLLING HIS EYES at a Minority https://t.co/uB3gzCaC6c #bere https://t.co/CianBteeBo,United States,English,2017-08-12T19:20:00,2017-08-12T19:21:00,0E-10,1.0000000000,333.0000000000,,False
BereHayyTR,OH BOY…Hillary and Obama are Joining Forces and It’s SAD https://t.co/5iyhiEmxFg #bere https://t.co/atPZ9n4RKy,United States,English,2017-08-12T19:20:00,2017-08-12T19:20:00,0E-10,1.0000000000,325.0000000000,,False
BereHayyTR,"Well, Well, Well…Look Who Thought Trump Was Too Weak on N. Korea https://t.co/VP0oScXxnW #bere https://t.co/AVAD4NlACE",United States,English,2017-08-12T19:20:00,2017-08-12T19:20:00,0E-10,1.0000000000,324.0000000000,,False
BereHayyTR,Trump Just REFUSED a Call From a World Leader He Doesn’t Respect! https://t.co/vVcYuL7O2b #bere https://t.co/q1NrXzDeWv,United States,English,2017-08-12T19:35:00,2017-08-12T19:35:00,0E-10,1.0000000000,337.0000000000,,False
BereHayyTR,WTF?? Refugees With TB Are Interviewing at Starbucks https://t.co/1VVhSLAH2V #bere https://t.co/fEpmk4Vojz,United States,English,2017-08-12T19:35:00,2017-08-12T19:35:00,0E-10,1.0000000000,336.0000000000,,False
BereHayyTR,Trump Supporters React to Chelsea Handler’s Military Coup https://t.co/DxQiHBvt8l #bere https://t.co/QKAfaUzS8f,United States,English,2017-08-12T19:35:00,2017-08-12T19:35:00,0E-10,1.0000000000,340.0000000000,,False
BereHayyTR,Anti-Trump Republican Susan Collins Just Got Some VERY BAD NEWS! https://t.co/EZ5jB8rG5l #bere https://t.co/6tcPtGn8qC,United States,English,2017-08-12T19:35:00,2017-08-12T19:35:00,0E-10,1.0000000000,338.0000000000,,False
BereHayyTR,VIDEO : Bolton Declares We Can’t be HELD HOSTAGE by Threats of Nuclear Terror https://t.co/zPIAm0ZKv1 #bere https://t.co/pnjQZSzc6o,United States,English,2017-08-12T19:35:00,2017-08-12T19:35:00,0E-10,1.0000000000,339.0000000000,,False
BereHayyTR,Alabama Voters REJECT GOP Establishment and GO WITH TRUMP! https://t.co/OiDrYmlDgY #bere https://t.co/AW5r3TXhN8,United States,English,2017-08-12T19:35:00,2017-08-12T19:35:00,0E-10,1.0000000000,335.0000000000,,False
BereHayyTR,RT 2Chron169: State Department Hillary Clinton Covering Up Sex Trafficking Where's  Investigation What happened to this story 🤔https://…,United States,English,2017-08-12T19:40:00,2017-08-12T19:40:00,0E-10,1.0000000000,341.0000000000,,False
BereHayyTR,"RT mitchellvii: #Russiagate is dead, #Resist is dead. #BetterDeal is dead. Time for the Left to play the trusty #Nazi card. Sucks not to ha…",United States,English,2017-08-12T19:40:00,2017-08-12T19:40:00,0E-10,1.0000000000,342.0000000000,,False
BereHayyTR,RT ElderLansing: If you want to get rid of an enduring symbol of racism in America don't remove Robert E. Lee's statue try removing the Dem…,United States,English,2017-08-12T19:40:00,2017-08-12T19:40:00,0E-10,1.0000000000,343.0000000000,,False
BereHayyTR,LOL : This Strategy that would DESTROY Kim Jong-un just went VIRAL! https://t.co/iA02zD5TLM #bere https://t.co/1IOYN8w7td,United States,English,2017-08-12T21:50:00,2017-08-12T21:50:00,0E-10,1.0000000000,344.0000000000,,False
BereHayyTR,NBC Declares it’s their JOB to “SCARE EVERYONE TO DEATH” https://t.co/WGtYr5mxpk #bere https://t.co/RWnMlgjJrk,United States,English,2017-08-12T22:05:00,2017-08-12T22:05:00,0E-10,1.0000000000,345.0000000000,,False
BereHayyTR,"BREAKING : One Dead, 19 Injured in VA, State of Emergency Declared! https://t.co/GalBulfX2U #bere https://t.co/5f3U9vF9zj",United States,English,2017-08-12T22:05:00,2017-08-12T22:05:00,0E-10,1.0000000000,346.0000000000,,False
BereHayyTR,VIDEO : President Trump Reacts to Charlottesville Tragedy https://t.co/eanCJUvNJM #bere https://t.co/bb8sQa67yQ,United States,English,2017-08-12T22:05:00,2017-08-12T22:05:00,0E-10,1.0000000000,348.0000000000,,False
BereHayyTR,Charlottesville Car Terrorist Is ANTI-TRUMP? https://t.co/z8xINAPjIj #bere https://t.co/trwPmsYti2,United States,English,2017-08-12T22:05:00,2017-08-12T22:06:00,0E-10,1.0000000000,347.0000000000,,False
BereHayyTR,RT thebradfordfile: DUH! We like winners. https://t.co/wA4YVXU9WR,United States,English,2017-08-12T23:48:00,2017-08-12T23:48:00,0E-10,1.0000000000,350.0000000000,Q,True
BereHayyTR,RT 1GigiSims: ⛪️✝️😟Any true Christian or pastor would never exploit God to heal a damaged image &amp; manipulate peopl… https://t.co/KZe7baHPu1,United States,English,2017-08-12T23:48:00,2017-08-12T23:48:00,0E-10,1.0000000000,349.0000000000,,False
BereHayyTR,RT kwilli1046: 62% Of Americans Say Trump Needs To Eliminate Welfare For Illegals – Do You Agree? https://t.co/AvRPLeH7ee,United States,English,2017-08-13T00:12:00,2017-08-13T00:12:00,0E-10,1.0000000000,351.0000000000,,False
