author_id,content,region,language,publish_date,harvested_date,following,followers,updates,post_type,retweet
BereHayyTR,Hillary Reacts to Charlottesville By Blaming “White Supremacists” https://t.co/6LbBCIVIe2 #bere https://t.co/usLDe43d4v,United States,English,2017-08-13T00:50:00,2017-08-13T00:50:00,0E-10,1.0000000000,352.0000000000,,False
BereHayyTR,James Woods Reveals the One Person Happiest With Charlottesville https://t.co/AN7285KQU8 #bere https://t.co/bUQBIaCdB0,United States,English,2017-08-13T00:50:00,2017-08-13T00:50:00,0E-10,1.0000000000,353.0000000000,,False
BereHayyTR,Chicago Liberal Ask Rahm to Remove Statue of George Washington https://t.co/8tFevFRXKJ #bere https://t.co/jCRdkyAZ2N,United States,English,2017-08-17T09:44:00,2017-08-17T09:44:00,975.0000000000,7.0000000000,355.0000000000,,False
BereHayyTR,Possible 2020 POTUS Candidate Compares America to Nazi Concentration Camp https://t.co/yg1dHqDhbo #bere https://t.co/edlLu1rCgv,United States,English,2017-08-17T09:44:00,2017-08-17T09:44:00,975.0000000000,7.0000000000,354.0000000000,,False
BereHayyTR,FLASHBACK : Watch Obama Defend ISIS and Attack Christianity! https://t.co/SfUIMXCtf0 #bere https://t.co/0K4Gv0yQkz,United States,English,2017-08-17T09:51:00,2017-08-17T09:51:00,975.0000000000,8.0000000000,357.0000000000,,False
BereHayyTR,Epic Viral Video Exposes American Leftists and ISIS as MIRROR IMAGES! https://t.co/IG62qQX2ym #bere https://t.co/qhlQTD5lk6,United States,English,2017-08-17T09:51:00,2017-08-17T09:51:00,975.0000000000,8.0000000000,359.0000000000,,False
BereHayyTR,BREAKING! Ben Carson’s Home Vandalized By Hateful Liberal Thugs! https://t.co/ElYcFSIvNN #bere https://t.co/KnAFALAFI6,United States,English,2017-08-17T09:51:00,2017-08-17T09:51:00,975.0000000000,8.0000000000,356.0000000000,,False
BereHayyTR,BREAKING : More Cities CAVING and Removing Confederate Statues! https://t.co/cZtIpiqFmT #bere https://t.co/tyHkplDGyi,United States,English,2017-08-17T09:51:00,2017-08-17T09:51:00,975.0000000000,8.0000000000,360.0000000000,,False
BereHayyTR,WATCH: #AltLeft Terror Group Antifa Beats a Man For Wearing a TRUMP SHIRT https://t.co/sXtmJFu4pk #bere https://t.co/iK5hSZD1gv,United States,English,2017-08-17T09:51:00,2017-08-17T09:51:00,975.0000000000,8.0000000000,358.0000000000,,False
BereHayyTR,Look Which Governor is 100% Backing Trump Blaming “Both Sides!” https://t.co/HX1AKvRY2V #bere https://t.co/ClVOakArVc,United States,English,2017-08-17T09:54:00,2017-08-17T09:54:00,975.0000000000,9.0000000000,361.0000000000,,False
BereHayyTR,"RT realDonaldTrump: Join me at 7:00 P.M. on Tuesday, August 22nd in Phoenix, Arizona at the Phoenix Convention Cen… https://t.co/zykE1UKyJF",United States,English,2017-08-17T12:36:00,2017-08-17T12:36:00,981.0000000000,24.0000000000,364.0000000000,,False
BereHayyTR,"RT WhiteHouse: ""To all 'sanctuary' jurisdictions across the country: work WITH us to enforce a lawful immigration … https://t.co/SbxiHW9bA4",United States,English,2017-08-17T12:36:00,2017-08-17T12:36:00,981.0000000000,24.0000000000,362.0000000000,,False
BereHayyTR,RT bbusa617: https://t.co/MuPHmffjSA  McCauliffe Told Police to Stand Down w/1 Entrance/Exit When Full Antifa Attacked w/ Police Issued Ga…,United States,English,2017-08-17T12:36:00,2017-08-17T12:36:00,981.0000000000,24.0000000000,363.0000000000,,False
BereHayyTR,RT MyBrianLeyh: Charlottesville Democrat Resigns As His Racist Messages LEAK https://t.co/DkR32abKUG,United States,English,2017-08-17T12:44:00,2017-08-17T12:44:00,981.0000000000,26.0000000000,367.0000000000,,False
BereHayyTR,RT RedNationRising: Whoever made this Comey/Clinton video did a great job. #FireComey #LockHerUp #MAGA  https://t.co/LFLu9o3Z8k,United States,English,2017-08-17T12:44:00,2017-08-17T12:44:00,981.0000000000,26.0000000000,366.0000000000,,False
BereHayyTR,"RT peaceandjoy101: I NEVER have questioned my vote 4 realDonaldTrump. You cannot separate us, but many more are joining #TeamTrump #RiseAnd…",United States,English,2017-08-17T12:44:00,2017-08-17T12:44:00,981.0000000000,26.0000000000,365.0000000000,,False
BereHayyTR,Assange Just Met with a GOP Congressman and Offered BOMBSHELL PROOF! https://t.co/l9PYPru0tx #bere https://t.co/sSjddwzEyh,United States,English,2017-08-17T16:20:00,2017-08-17T16:21:00,980.0000000000,48.0000000000,374.0000000000,,False
BereHayyTR,"RT realDonaldTrump: The public is learning (even more so) how dishonest the Fake News is. They totally misrepresent what I say about hate, …",United States,English,2017-08-17T16:20:00,2017-08-17T16:20:00,980.0000000000,48.0000000000,368.0000000000,,False
BereHayyTR,RT realDonaldTrump: ...and people like Ms. Heyer. Such a disgusting lie. He just can't forget his election trouncing.The people of South Ca…,United States,English,2017-08-17T16:20:00,2017-08-17T16:20:00,980.0000000000,48.0000000000,369.0000000000,,False
BereHayyTR,"RT realDonaldTrump: Great to see that Dr. Kelli Ward is running against Flake Jeff Flake, who is WEAK on borders, crime and a non-factor in…",United States,English,2017-08-17T16:20:00,2017-08-17T16:20:00,980.0000000000,48.0000000000,370.0000000000,,False
BereHayyTR,Birmingham Mayor SUED for CAVING to Liberals and Covering Monument! https://t.co/3wKLNZVmD6 #bere https://t.co/MuBi4kVgHF,United States,English,2017-08-17T16:20:00,2017-08-17T16:21:00,980.0000000000,48.0000000000,373.0000000000,,False
BereHayyTR,RT Snikk: TRUMP WAS RIGHT? Green Party candidate for VP calls for removal of Jefferson and Washington monuments https://t.co/e8L0HyUeYN,United States,English,2017-08-17T16:20:00,2017-08-17T16:20:00,980.0000000000,48.0000000000,371.0000000000,,False
BereHayyTR,"RT Snikk: Charlottesville Police Come Forward: We Were Told to ""STAND DOWN"" to Ignite Race War (Video) https://t.co/ZC5J2ALc0i via TruthUn…",United States,English,2017-08-17T16:20:00,2017-08-17T16:20:00,980.0000000000,48.0000000000,372.0000000000,,False
BereHayyTR,Trump Just SLAMMED Losers Graham and Flake! Look What He Said! https://t.co/lysuk35Bq5 #bere https://t.co/QuspgCxtwX,United States,English,2017-08-17T16:21:00,2017-08-17T16:21:00,980.0000000000,48.0000000000,377.0000000000,,False
BereHayyTR,Antifa Plans to ERASE American History to End ‘White Supremacy’ https://t.co/xG58HJM5hg #bere https://t.co/mRyAE3WnHv,United States,English,2017-08-17T16:21:00,2017-08-17T16:21:00,980.0000000000,48.0000000000,378.0000000000,,False
BereHayyTR,Watch Rocker Ted Nugent PASSIONATELY Defend Trump Against Critics! https://t.co/mAG6Y0IQ3l #bere https://t.co/MjnsasMHdP,United States,English,2017-08-17T16:21:00,2017-08-17T16:21:00,980.0000000000,48.0000000000,375.0000000000,,False
BereHayyTR,Liberals are Now Being FORCED to Acknowledge the Violent “Alt-Left” https://t.co/QL52AjvmRK #bere https://t.co/rWVVVn3N1M,United States,English,2017-08-17T16:21:00,2017-08-17T16:21:00,980.0000000000,48.0000000000,376.0000000000,,False
BereHayyTR,Black Conservative EXPOSES that Leftists are Trying to Instigate a RACE WAR https://t.co/UuHB0O0BSh #bere https://t.co/05RRzF0R0X,United States,English,2017-08-17T16:35:00,2017-08-17T16:35:00,979.0000000000,50.0000000000,381.0000000000,,False
BereHayyTR,BOOM! Trump’s Interior Dept REFUSES to Remove Confederate Monuments https://t.co/COpNtgi2Ib #bere https://t.co/39Xriaw3vr,United States,English,2017-08-17T16:35:00,2017-08-17T16:36:00,979.0000000000,50.0000000000,390.0000000000,,False
BereHayyTR,LOL! Mayor Asks Trump to Postpone His Rally and You’ll LOVE His Response https://t.co/PDVRVVlne0 #bere https://t.co/LgWTtlOm9A,United States,English,2017-08-17T16:35:00,2017-08-17T16:36:00,979.0000000000,50.0000000000,391.0000000000,,False
BereHayyTR,Tucker Carlson Just UNLOADED on Bill Kristol With BOTH BARRELS! https://t.co/twLGIXfCDh #bere https://t.co/EKjhNnqZQL,United States,English,2017-08-17T16:35:00,2017-08-17T16:37:00,979.0000000000,50.0000000000,389.0000000000,,False
BereHayyTR,BREAKING : Disgraceful Liberal Mag Features a “KKK” Trump Cover https://t.co/f2GiLZ79lY #bere https://t.co/RcNHBnNZgk,United States,English,2017-08-17T16:35:00,2017-08-17T16:36:00,979.0000000000,50.0000000000,388.0000000000,,False
BereHayyTR,WOW! Australian Senator Wears Burka to Make Point Against Islam! https://t.co/wd0L7EsTad #bere https://t.co/joVPfhgsKo,United States,English,2017-08-17T16:35:00,2017-08-17T16:35:00,979.0000000000,50.0000000000,383.0000000000,,False
BereHayyTR,BREAKING : Chuck Grassley Refuses to Let Crooked Hillary Off the Hook https://t.co/MM3zPy6J0B #bere https://t.co/93SEA8YOvE,United States,English,2017-08-17T16:35:00,2017-08-17T16:36:00,979.0000000000,50.0000000000,384.0000000000,,False
BereHayyTR,Look What Antifa THUGS Did to This Black Student in Charlottesville https://t.co/kbFpUtdHeK #bere https://t.co/QjHb33qIwp,United States,English,2017-08-17T16:35:00,2017-08-17T16:36:00,979.0000000000,50.0000000000,392.0000000000,,False
BereHayyTR,BREAKING : Gettysburg Tells Liberals “NO!!!” https://t.co/rjrDnOlIXI #bere https://t.co/w3tjgYr3od,United States,English,2017-08-17T16:35:00,2017-08-17T16:36:00,979.0000000000,50.0000000000,387.0000000000,,False
BereHayyTR,REPORT : Obama’s EPA Holdovers are Still “Crying at Their Desks” https://t.co/ZGUyTNSZJW #bere https://t.co/4VjbA15erg,United States,English,2017-08-17T16:35:00,2017-08-17T16:35:00,979.0000000000,50.0000000000,386.0000000000,,False
BereHayyTR,PROOF : The Lying Media TWISTED Trump’s Words on Charlottesville! https://t.co/q4akAxzNHv #bere https://t.co/zz4ABpkKa3,United States,English,2017-08-17T16:35:00,2017-08-17T16:35:00,979.0000000000,50.0000000000,382.0000000000,,False
BereHayyTR,Look Who is Still Protecting Dozens of Obama Holdovers! https://t.co/RVa2QdJt0e #bere https://t.co/s70fyHWXEV,United States,English,2017-08-17T16:35:00,2017-08-17T16:36:00,979.0000000000,50.0000000000,385.0000000000,,False
BereHayyTR,BREAKING : Dems Unveil Their ‘Secret Weapon’ for 2018 Elections https://t.co/5Y8ag5rCJU #bere https://t.co/JLkbO7JOEZ,United States,English,2017-08-17T16:35:00,2017-08-17T16:36:00,979.0000000000,50.0000000000,380.0000000000,,False
BereHayyTR,This Deep State Swamp Creature Just Called Trump a “National Disgrace” https://t.co/mbLSb33LRD #bere https://t.co/VuI8dueF46,United States,English,2017-08-17T16:50:00,2017-08-17T16:50:00,979.0000000000,50.0000000000,394.0000000000,,False
BereHayyTR,WOW! Split Screen Video Proves Trump 100% Right! https://t.co/JxQfiCJhYQ #bere https://t.co/bs6Mnp9vuF,United States,English,2017-08-17T16:50:00,2017-08-17T16:51:00,979.0000000000,50.0000000000,395.0000000000,,False
BereHayyTR,RT KimDotcom: History in the making! You may start to worry DNC Bye bye Mueller 👋🏻 realDonaldTrump DonaldJTrumpJr https://t.co/ZJls3N1yu9,United States,English,2017-08-17T16:53:00,2017-08-17T16:53:00,979.0000000000,50.0000000000,396.0000000000,Q,True
BereHayyTR,LOL : Jimmy Kimmel Reads Comments from Trump Supporters Slamming Him https://t.co/AETlv3shBa #bere https://t.co/6FELT19OHD,United States,English,2017-08-17T17:05:00,2017-08-17T17:06:00,980.0000000000,52.0000000000,397.0000000000,,False
BereHayyTR,BREAKING : 4 Dead and Dozens Injured in Barcelona Terror Attack https://t.co/FsnVsS8llI #bere https://t.co/3p7kJTPcVp,United States,English,2017-08-17T17:05:00,2017-08-17T17:05:00,980.0000000000,52.0000000000,398.0000000000,,False
BereHayyTR,RT Voices4Humanity: 😡Wake Up USA!!!😱AMERICA IS UNDER ATTACK By These 187 Organizations Directly Funded By George Soros …,United States,English,2017-08-17T18:52:00,2017-08-17T18:52:00,980.0000000000,56.0000000000,399.0000000000,,False
BereHayyTR,"RT krisp__y: I'm calling for Maria Chappelle-Nadal to resign or be removed from office. She is unfit after her ""I hope Trump is assassinate…",United States,English,2017-08-17T20:52:00,2017-08-17T20:52:00,980.0000000000,70.0000000000,400.0000000000,,False
BereHayyTR,"RT denise_coyle6: ‘I hope Trump is assassinated,’— and quickly regrets https://t.co/C5pEnKZLsZ  This woman needs to be removed and arreste…",United States,English,2017-08-17T20:52:00,2017-08-17T20:52:00,980.0000000000,70.0000000000,401.0000000000,,False
BereHayyTR,"RT MAGA_1958: A lot of smart Democrats are jumping off the Titanic, and jumping on the TRUMP TRAIN… https://t.co/I5xhoLAkZv",United States,English,2017-08-17T21:00:00,2017-08-17T21:02:00,980.0000000000,71.0000000000,403.0000000000,Q,True
BereHayyTR,RT debesstrs: RT JordanSekulow: Radio - BREAKING: #Mueller Spokesperson Linked to Clinton/Lynch Tarmac Meeting. https://t.co/x1phfoeJn0,United States,English,2017-08-17T21:00:00,2017-08-17T21:01:00,980.0000000000,71.0000000000,402.0000000000,,False
BereHayyTR,Juanita Broaddrick Suggests a Statue to Be Removed and It’s BRILLIANT https://t.co/3jIDEpzg0W #bere https://t.co/PKZuV4LEI4,United States,English,2017-08-17T21:05:00,2017-08-17T21:05:00,980.0000000000,71.0000000000,406.0000000000,,False
BereHayyTR,BUSTED! Craigslist Ad Exposes Firm Hiring #AltLeft “Protesters” for $25/Hr https://t.co/3wJCjwFLbE #bere https://t.co/sBX1w5s9vi,United States,English,2017-08-17T21:05:00,2017-08-17T21:05:00,980.0000000000,71.0000000000,407.0000000000,,False
BereHayyTR,Why Did One of Mueller’s TOP Investigators Just Leave the Investigation? https://t.co/vF6d9A9Ybd #bere https://t.co/MrgdM0wac7,United States,English,2017-08-17T21:05:00,2017-08-17T21:05:00,980.0000000000,72.0000000000,404.0000000000,,False
BereHayyTR,Barcelona Update – The Death Toll CLIMBS! https://t.co/tyMCGCzkks #bere https://t.co/qaohQZesIY,United States,English,2017-08-17T21:05:00,2017-08-17T21:06:00,980.0000000000,71.0000000000,408.0000000000,,False
BereHayyTR,Remember When Bill Clinton Used this HATE SYMBOL During his Campaign? https://t.co/iDTP32WKOK #bere https://t.co/ZanGNRzXKT,United States,English,2017-08-17T21:05:00,2017-08-17T21:05:00,980.0000000000,72.0000000000,405.0000000000,,False
BereHayyTR,RT kelliwardaz: Thank you realDonaldTrump Working hard so you have a conservative from AZ to help #MAGA.  Arizonan… https://t.co/M5Gb5LtOds,United States,English,2017-08-17T21:24:00,2017-08-17T21:24:00,980.0000000000,73.0000000000,409.0000000000,,False
BereHayyTR,RT StockMonsterUSA: 1st Gov Terry McAuliffe calls for police to stand down &amp; now he refuses to condemn the Alt-Lef… https://t.co/ZsMzZwajON,United States,English,2017-08-17T22:12:00,2017-08-17T22:12:00,981.0000000000,75.0000000000,410.0000000000,,False
BereHayyTR,"RT KMOXKilleen: U.S.Secret Service here looking into Facebook post by State Senator Maria Chapelle-Nadal: ""I hope … https://t.co/BUv4KLqp8a",United States,English,2017-08-17T22:20:00,2017-08-17T22:20:00,981.0000000000,76.0000000000,412.0000000000,,False
BereHayyTR,Wasserman Schultz' ex-IT aide indicted on 4 counts \| Fox News https://t.co/hCyBhmjYH9,United States,English,2017-08-17T22:20:00,2017-08-17T22:20:00,981.0000000000,76.0000000000,411.0000000000,,False
BereHayyTR,"RT TomFitton: U.S. Pays $50 Mil for Luxury Cars, Weapons, Booze to Mentor Afghan Intel Officers https://t.co/HDaItyp6QI via JudicialWatch",United States,English,2017-08-17T22:28:00,2017-08-17T22:28:00,981.0000000000,76.0000000000,413.0000000000,,False
BereHayyTR,"RT pastormarkburns: Since #Charlottesville, 11 Americans KILLED, 40 wounded in inner city Chicago but #MSM coverin… https://t.co/6f7pUC9AHH",United States,English,2017-08-17T23:56:00,2017-08-17T23:57:00,981.0000000000,79.0000000000,414.0000000000,,False
BereHayyTR,RT Harlan: President realDonaldTrump is going to emerge from this week more popular than ever before.  People are sick of the #FakeNews!  #…,United States,English,2017-08-18T00:04:00,2017-08-18T00:04:00,981.0000000000,79.0000000000,416.0000000000,,False
BereHayyTR,RT Lizdolan: Good for #ChicagoPD Arrest all the terrorists among us  We don't need Antifa #BackTheBlue  #BlueLivesMatter #MAGA  🇺🇸https://t…,United States,English,2017-08-18T00:04:00,2017-08-18T00:04:00,981.0000000000,79.0000000000,415.0000000000,,False
BereHayyTR,RT DebLaVigne09: Deb's husband here Deb passed away Tuesday blood clot to lungs I'm crushed we will all miss her she kept me up to date dai…,United States,English,2017-08-18T00:12:00,2017-08-18T00:12:00,981.0000000000,79.0000000000,418.0000000000,,False
BereHayyTR,RT VP: The U.S. will continue to bring the full measure of economic &amp; diplomatic power to bear until democracy is restored in Venezuela #VP…,United States,English,2017-08-18T00:12:00,2017-08-18T00:12:00,981.0000000000,79.0000000000,417.0000000000,,False
BereHayyTR,RT TruthFeedNews: BREAKING! INDICTED ON FOUR COUNTS! https://t.co/gsA6WlKYyL via truthfeednews #maga #trumptrain #trump,United States,English,2017-08-18T00:20:00,2017-08-18T00:20:00,981.0000000000,79.0000000000,419.0000000000,,False
BereHayyTR,GovMikeHuckabee annoddonna POTUS This was a hateful thing and possibly a crime. I don't care what side you are o… https://t.co/n5PDxF8lOX,United States,English,2017-08-18T00:28:00,2017-08-18T00:28:00,982.0000000000,80.0000000000,420.0000000000,,False
BereHayyTR,"RT FoxNews: OPINION: Debbie Wasserman Schultz, House Democrats &amp; the incredible scandal the mainstream media wants… https://t.co/Z59eejQVKR",United States,English,2017-08-18T01:16:00,2017-08-18T01:16:00,982.0000000000,86.0000000000,421.0000000000,,False
BereHayyTR,"RT StockMonsterUSA: Meanwhile, back in 1999 Trump is honored for a lifetime of helping African American Communitie… https://t.co/6QuTrWCbeu",United States,English,2017-08-18T03:08:00,2017-08-18T03:08:00,982.0000000000,89.0000000000,422.0000000000,,False
BereHayyTR,RT JudicialWatch: Chicago Mayor #RahmEmanuel refuses to follow court order that would release the truth regarding … https://t.co/RLofZuqkya,United States,English,2017-08-18T03:16:00,2017-08-18T03:16:00,982.0000000000,89.0000000000,423.0000000000,,False
BereHayyTR,"RT immigrant4trump: My Video Exposing Hillary For Praising KKK Leader Robert Byrd, Has 170,000 Views in 3 Days On … https://t.co/QfRD6mMCmv",United States,English,2017-08-18T03:40:00,2017-08-18T03:40:00,982.0000000000,92.0000000000,425.0000000000,,False
BereHayyTR,RT Veteran4Trump: realDonaldTrump American Patriots support you sir! #MakeAmericaGreatAgain https://t.co/XlPLIKwiAj,United States,English,2017-08-18T03:40:00,2017-08-18T03:40:00,982.0000000000,92.0000000000,426.0000000000,,False
BereHayyTR,"RT JudicialWatch: Huma Emails Show Desire to Visit Dictators, Sending of Classified 💾 &amp; StateDept Favoritism to Cl… https://t.co/6W3PwkoQkT",United States,English,2017-08-18T03:40:00,2017-08-18T03:40:00,982.0000000000,92.0000000000,424.0000000000,,False
BereHayyTR,RT EjHirschberger: ATTENTION #TRUMPTRAIN: We must amplify our online presence.1 RETWEET this tweet2 Follow... https://t.co/VBaBNUiHAF by #…,United States,English,2017-08-18T03:48:00,2017-08-18T03:49:00,982.0000000000,93.0000000000,427.0000000000,,False
BereHayyTR,RT RealMattCouch: Where is the Ballistics Report from Metro D.C. Police in the Murder of Seth Rich? #SethRich,United States,English,2017-08-18T04:04:00,2017-08-18T04:04:00,982.0000000000,94.0000000000,428.0000000000,,False
BereHayyTR,RT AmericanVoterUS: NOW that we are aware of never Trumper's motivation to resist .realDonaldTrump by accepting donations from Soros  WHO i…,United States,English,2017-08-18T04:12:00,2017-08-18T04:12:00,981.0000000000,94.0000000000,430.0000000000,,False
BereHayyTR,RT Bobby_Axelrod2k: realDonaldTrump Trump Supporters are pissed off Americans that are no longer buying the #FakeN… https://t.co/HqnB80XIUz,United States,English,2017-08-18T04:12:00,2017-08-18T04:12:00,981.0000000000,94.0000000000,429.0000000000,,False
BereHayyTR,BREAKING! This New Evidence Just Implicated All of Them!!! https://t.co/UerIkkqBx2 #bere https://t.co/zHSUYJPWtL,United States,English,2017-08-18T06:05:00,2017-08-18T06:05:00,981.0000000000,97.0000000000,437.0000000000,,False
BereHayyTR,BOOM! New Poll Shows Republicans Agree With Trump’s Charlottesville Response https://t.co/7PYX3KFs5K #bere https://t.co/6BOBDQntSC,United States,English,2017-08-18T06:05:00,2017-08-18T06:05:00,981.0000000000,97.0000000000,432.0000000000,,False
BereHayyTR,COMPARISON VIDEO: Trump Condemns Hate While Obama Defends it https://t.co/qChnGpsv5L #bere https://t.co/xpdHQrkA7P,United States,English,2017-08-18T06:05:00,2017-08-18T06:05:00,981.0000000000,97.0000000000,433.0000000000,,False
BereHayyTR,BREAKING : Antifa Members Surrender to Police and Chant Like Insane Cult https://t.co/w8buh5Gg9W #bere https://t.co/mIDSpTkmsR,United States,English,2017-08-18T06:05:00,2017-08-18T06:06:00,981.0000000000,97.0000000000,440.0000000000,,False
BereHayyTR,BREAKING : Look Who is Claiming Trump Will Resign Soon https://t.co/uEFC0It5eJ #bere https://t.co/WttCtgoA4x,United States,English,2017-08-18T06:05:00,2017-08-18T06:05:00,981.0000000000,97.0000000000,434.0000000000,,False
BereHayyTR,BREAKING! A State Senator Just Called for Trump’s Assassination! https://t.co/S49m5kPhsB #bere https://t.co/0d5jW8TmRS,United States,English,2017-08-18T06:05:00,2017-08-18T06:05:00,981.0000000000,97.0000000000,431.0000000000,,False
BereHayyTR,BREAKING : Lincoln Statue Found Burnt to a Crisp in Chicago! https://t.co/Lzf79yqtlP #bere https://t.co/bEQKIEXHqH,United States,English,2017-08-18T06:05:00,2017-08-18T06:05:00,981.0000000000,97.0000000000,435.0000000000,,False
BereHayyTR,Antifa THUG Punches Black Trump Supporter and INSTANTLY Regrets it https://t.co/gOxyKPoOnj #bere https://t.co/DCIgdfv5CG,United States,English,2017-08-18T06:05:00,2017-08-18T06:05:00,981.0000000000,97.0000000000,438.0000000000,,False
BereHayyTR,BREAKING : ISIS Claims Responsibility! https://t.co/3utPY5xtjL #bere https://t.co/4cQep4LTjQ,United States,English,2017-08-18T06:05:00,2017-08-18T06:05:00,981.0000000000,97.0000000000,436.0000000000,,False
BereHayyTR,BREAKING! INDICTED ON FOUR COUNTS! https://t.co/7ajG62zmMc #bere https://t.co/ZpnZs7NBX5,United States,English,2017-08-18T06:05:00,2017-08-18T06:05:00,981.0000000000,97.0000000000,439.0000000000,,False
BereHayyTR,Terror Group CAIR Issues Anti-Confederate DEMANDS https://t.co/myTOgMIP2f #bere https://t.co/mOsEIxEQYG,United States,English,2017-08-18T06:05:00,2017-08-18T06:06:00,981.0000000000,97.0000000000,441.0000000000,,False
BereHayyTR,WTF VIDEO : Look What LOSER Al Gore is Suggesting Trump Do https://t.co/JCo4eyreR0 #bere https://t.co/m0JdeoDk1T,United States,English,2017-08-18T06:20:00,2017-08-18T06:20:00,981.0000000000,97.0000000000,446.0000000000,,False
BereHayyTR,CNN Commentator DEMANDS Founding Father Statues COME DOWN https://t.co/QJTRwJVzgv #bere https://t.co/6r9a7nJakr,United States,English,2017-08-18T06:20:00,2017-08-18T06:20:00,981.0000000000,97.0000000000,445.0000000000,,False
BereHayyTR,Look What Leftists THUGS Just Did to the NH GOP Headquarters https://t.co/W7xpvfIjAl #bere https://t.co/2UYlYbqXOt,United States,English,2017-08-18T06:20:00,2017-08-18T06:20:00,981.0000000000,97.0000000000,443.0000000000,,False
BereHayyTR,BREAKING VIDEO : Multiple ISIS Terrorists KILLED By Spanish Police! https://t.co/igO9ZEO93Q #bere https://t.co/xs29faMe7J,United States,English,2017-08-18T06:20:00,2017-08-18T06:20:00,981.0000000000,97.0000000000,444.0000000000,,False
BereHayyTR,Trump Supporters Band Together to Preserve our Nation’s History https://t.co/wr5MD0Vjt5 #bere https://t.co/JZtShrBQIA,United States,English,2017-08-18T06:20:00,2017-08-18T06:20:00,981.0000000000,97.0000000000,442.0000000000,,False
BereHayyTR,The NY Times Just Reached a NEW LOW in Trying to Prove Trump is RACIST https://t.co/N4boOTs2bq #bere https://t.co/eNOBCPDx97,United States,English,2017-08-18T09:11:00,2017-08-18T09:11:00,981.0000000000,97.0000000000,447.0000000000,,False
BereHayyTR,Secret Service Looking Into Senator Who Called for Trump’s Assassination https://t.co/fgVpC6qjUk #bere https://t.co/27AUo7CXdi,United States,English,2017-08-18T09:17:00,2017-08-18T09:17:00,981.0000000000,97.0000000000,449.0000000000,,False
BereHayyTR,Watch Disgraceful CNN Attempt to Tie Barcelona’s ISIS Attack to TRUMP! https://t.co/0IH5dHD3sX #bere https://t.co/bxGiRtTrkd,United States,English,2017-08-18T09:17:00,2017-08-18T09:17:00,981.0000000000,97.0000000000,450.0000000000,,False
BereHayyTR,Liberal Publication Calls for National Monument to be BLOWN UP https://t.co/L2nGV2IgXY #bere https://t.co/X1RXqAljCM,United States,English,2017-08-18T09:17:00,2017-08-18T09:17:00,981.0000000000,97.0000000000,448.0000000000,,False
BereHayyTR,Liberals Continue Their Disgraceful War Against History https://t.co/pGAITBbXfc #bere https://t.co/rkug51qDfb,United States,English,2017-08-18T09:17:00,2017-08-18T09:17:00,981.0000000000,97.0000000000,451.0000000000,,False
BereHayyTR,Michael Moore Makes Another Loony Prediction About Trump https://t.co/kH03wSzfvc #bere https://t.co/El9WKGgqEs,United States,English,2017-08-18T09:22:00,2017-08-18T09:22:00,981.0000000000,97.0000000000,454.0000000000,,False
BereHayyTR,House Dem Trying To Impeach Trump Based on His Charlottesville Response https://t.co/K48a87JWfF #bere https://t.co/SZL5tiiM9i,United States,English,2017-08-18T09:22:00,2017-08-18T09:22:00,981.0000000000,97.0000000000,452.0000000000,,False
BereHayyTR,Look What Liberals Did to This Historic Monument in Arizona! https://t.co/cNi4s2IxgO #bere https://t.co/09tEV4Mxzl,United States,English,2017-08-18T09:22:00,2017-08-18T09:22:00,981.0000000000,97.0000000000,453.0000000000,,False
BereHayyTR,BOOM! Hannity BLASTS Senator Who Called for Trump’s Assassination https://t.co/Rkrf2XsWsh #bere https://t.co/9l9FbFi0NL,United States,English,2017-08-18T09:22:00,2017-08-18T09:22:00,981.0000000000,97.0000000000,456.0000000000,,False
BereHayyTR,RT TomFitton: U.S. Has 3.5 Million More Registered Voters Than Live Adults — A Red Flag For Electoral Fraud https://t.co/VFxuFsgVrG via IB…,United States,English,2017-08-18T14:05:00,2017-08-18T14:05:00,981.0000000000,101.0000000000,458.0000000000,,False
