author_id,content,region,language,publish_date,harvested_date,following,followers,updates,post_type,retweet
BereHayyTR,"Cop Is Directing Traffic, Then Suddenly Shimmies To The Side And Starts Dancing Instead https://t.co/aVTQTOXj7C https://t.co/ui8x8FQ7p4",United States,English,2017-08-09T11:26:00,2017-08-09T11:26:00,0E-10,0E-10,4.0000000000,R,True
BereHayyTR,#rums How to Catch a White House Leaker https://t.co/9H8jEAGi9q https://t.co/v9C81wunnq,United States,English,2017-08-09T11:26:00,2017-08-09T11:26:00,0E-10,0E-10,2.0000000000,R,True
BereHayyTR,#rums BREAKING! The DOJ Has Outed Mueller! https://t.co/YJzcpPrrXL https://t.co/CnLTiYJujO,United States,English,2017-08-09T11:26:00,2017-08-09T11:26:00,0E-10,0E-10,3.0000000000,R,True
BereHayyTR,#rums Patricia McCarthy “Mueller Has Already Destroyed His Own Legacy” https://t.co/fHAIkiD7lP https://t.co/VPNibyrREF,United States,English,2017-08-09T11:26:00,2017-08-09T11:26:00,0E-10,0E-10,1.0000000000,R,True
BereHayyTR,FIRE AND FURY – Is War Inevitable in North Korea? https://t.co/phqepvncWp #bere https://t.co/A1sMzgC2ug,United States,English,2017-08-09T12:14:00,2017-08-09T12:14:00,0E-10,0E-10,5.0000000000,,False
BereHayyTR,BOYCOTT ALERT! Starbucks Holds Hiring Event for REFUGEES ONLY https://t.co/WNIsaGk1jq #bere https://t.co/on3qRVHp7J,United States,English,2017-08-09T12:20:00,2017-08-09T12:20:00,0E-10,0E-10,6.0000000000,,False
BereHayyTR,Mark Zuckerberg May Be Setting Up for a 2020 Presidential Run https://t.co/axBp8olFoi #bere https://t.co/nwYgrcVm96,United States,English,2017-08-09T12:20:00,2017-08-09T12:21:00,0E-10,0E-10,7.0000000000,,False
BereHayyTR,PATHETIC! Spike Lee Holds “Hire Kaepernick” Rally https://t.co/wn35RHBpEm #bere https://t.co/eg0cgQAR40,United States,English,2017-08-09T12:20:00,2017-08-09T12:20:00,0E-10,0E-10,8.0000000000,,False
BereHayyTR,BREAKING : Texas Takes a YUGE Step Forward in Battling Abortion https://t.co/7RkGhaCk0R #bere https://t.co/yig9f21oyR,United States,English,2017-08-09T12:20:00,2017-08-09T12:20:00,0E-10,0E-10,9.0000000000,,False
BereHayyTR,Traitor McCain is Now Attacking Trump on his STRONG N. Korea Stance https://t.co/4w0miFMRia #bere https://t.co/XquYrtYbqx,United States,English,2017-08-09T12:24:00,2017-08-09T12:24:00,0E-10,0E-10,10.0000000000,,False
BereHayyTR,TRUMP EFFECT : U.S. Job Openings SOAR! https://t.co/3SJtO5W8XL #bere https://t.co/Mm03UaJYQC,United States,English,2017-08-09T12:24:00,2017-08-09T12:24:00,0E-10,0E-10,13.0000000000,,False
BereHayyTR,U.S. Bombers Fly Over Korean Peninsula as Kim Jong Un Threatens Strike on Guam https://t.co/Zr4zMxyCGN #bere https://t.co/0RH9ay8rum,United States,English,2017-08-09T12:24:00,2017-08-09T12:24:00,0E-10,0E-10,12.0000000000,,False
BereHayyTR,BREAKING : Terror in France as Car SLAMS into Group of Soldiers https://t.co/QUqdMd1nBt #bere https://t.co/HCel0FCzRp,United States,English,2017-08-09T12:24:00,2017-08-09T12:25:00,0E-10,0E-10,11.0000000000,,False
BereHayyTR,This Democrat Candidate RETWEETED an “Avalanche” of PORN https://t.co/PF2d36RO3c #bere https://t.co/kbEQ6lcweB,United States,English,2017-08-09T12:31:00,2017-08-09T12:33:00,0E-10,0E-10,14.0000000000,,False
BereHayyTR,BREAKING : Iranian Drone Nearly Clashes with U.S. Fighter Jet https://t.co/IQy13aSTVb #bere https://t.co/pLhmIbm5R8,United States,English,2017-08-09T12:31:00,2017-08-09T12:31:00,0E-10,0E-10,17.0000000000,,False
BereHayyTR,VIRAL VIDEO : Incoherent Malia Obama is Dragged Out of Music Festival https://t.co/V13LwQ23Fv #bere https://t.co/o1MwE2A3Nj,United States,English,2017-08-09T12:31:00,2017-08-09T12:31:00,0E-10,0E-10,18.0000000000,,False
BereHayyTR,WOW! What Trump Said 23 Years Ago About North Korea Is Going VIRAL! https://t.co/4C2k8tj2qK #bere https://t.co/XCQm0t5ctA,United States,English,2017-08-09T12:31:00,2017-08-09T12:31:00,0E-10,0E-10,19.0000000000,,False
BereHayyTR,Dan Rather is Tickled Pink Over White House National Security Leaks https://t.co/h2HuVUIpeO #bere https://t.co/q72gMMLIPF,United States,English,2017-08-09T12:31:00,2017-08-09T12:31:00,0E-10,0E-10,16.0000000000,,False
BereHayyTR,Hannity UNLOADS on the GOP and You’ll Love Who He Calls Out! https://t.co/NBZpHIej59 #bere https://t.co/aMTJ7mNjlW,United States,English,2017-08-09T12:31:00,2017-08-09T12:31:00,0E-10,0E-10,15.0000000000,,False
BereHayyTR,BREAKING : Trump Just Tweeted a BRUTAL Warning to Kim Jong Un! https://t.co/7pSQ9mBuoT #bere https://t.co/7MG4pU0WOu,United States,English,2017-08-09T12:36:00,2017-08-09T12:36:00,0E-10,0E-10,20.0000000000,,False
BereHayyTR,Bitter Al Gore Just Make Another Kooky “Prediction” https://t.co/Ons0H0TG1V #bere https://t.co/IJm3dOjuia,United States,English,2017-08-09T14:05:00,2017-08-09T14:06:00,0E-10,0E-10,21.0000000000,,False
BereHayyTR,Hannity – Predicament with North Korea Because of Bill Clinton’s Failed Deal https://t.co/VSNAonKHrK #bere https://t.co/XEz7M9xA5A,United States,English,2017-08-09T14:05:00,2017-08-09T14:06:00,0E-10,0E-10,22.0000000000,,False
BereHayyTR,RT realDonaldTrump: My first order as President was to renovate and modernize our nuclear arsenal. It is now far stronger and more powerful…,United States,English,2017-08-09T17:01:00,2017-08-09T17:01:00,0E-10,0E-10,24.0000000000,,False
BereHayyTR,"RT realDonaldTrump: ...Hopefully we will never have to use this power, but there will never be a time that we are not the most powerful nat…",United States,English,2017-08-09T18:44:00,2017-08-09T18:44:00,0E-10,0E-10,26.0000000000,,False
BereHayyTR,RT business: A top White House aide says McConnell is making excuses for the Senate's failure to replace Obamacare… https://t.co/PSgzBQw0KT,United States,English,2017-08-09T18:44:00,2017-08-09T18:44:00,0E-10,0E-10,25.0000000000,,False
BereHayyTR,WHOA! Whoopi Just Insulted ALL Trump Voters. Look What She Said! https://t.co/9gOP8MFRo6 #bere https://t.co/uS3Ja6gSuT,United States,English,2017-08-09T18:50:00,2017-08-09T18:50:00,0E-10,0E-10,27.0000000000,,False
BereHayyTR,VIRAL Meme PERFECTLY Sums Up Google’s FIRING Hypocrisy! https://t.co/sMkzMBViMY #bere https://t.co/qVrf28dB68,United States,English,2017-08-09T18:50:00,2017-08-09T18:50:00,0E-10,0E-10,28.0000000000,,False
BereHayyTR,BREAKING : DOJ Offers Hillary Clinton A PLEA DEAL!!! https://t.co/KJx5cPUc7H #bere https://t.co/GD9rJex3FG,United States,English,2017-08-09T19:05:00,2017-08-09T19:05:00,0E-10,0E-10,38.0000000000,,False
BereHayyTR,Dobbs Obliterates Mitch McConnell and His Pathetic Excuses https://t.co/9UKzISvrZO #bere https://t.co/7Pjx6JhGvt,United States,English,2017-08-09T19:05:00,2017-08-09T19:05:00,0E-10,0E-10,31.0000000000,,False
BereHayyTR,New Emails Expose Something HORRIBLE About De Blasio https://t.co/av4Zbz8tqk #bere https://t.co/Fg51eQlnzF,United States,English,2017-08-09T19:05:00,2017-08-09T19:06:00,0E-10,0E-10,36.0000000000,,False
BereHayyTR,Over 20k Already Raised for Fired Google Employee! https://t.co/mN5MSGoiVK #bere https://t.co/lHlK3PmXt1,United States,English,2017-08-09T19:05:00,2017-08-09T19:05:00,0E-10,0E-10,29.0000000000,,False
BereHayyTR,GOP Makes BOLD Move in Wasserman Schultz IT Scandal  https://t.co/8BuxzgRo8C #bere https://t.co/j1TCVoSNRu,United States,English,2017-08-09T19:05:00,2017-08-09T19:05:00,0E-10,0E-10,32.0000000000,,False
BereHayyTR,LOL : The Official Church of Satan Just Rebuked Hillary Clinton https://t.co/wZybx8DeGv #bere https://t.co/dcG4CcUZBf,United States,English,2017-08-09T19:05:00,2017-08-09T19:05:00,0E-10,0E-10,34.0000000000,,False
BereHayyTR,WOW! We Dodged a MASSIVE Bullet Folks… https://t.co/txiwndDNci #bere https://t.co/nwsc1xhtP9,United States,English,2017-08-09T19:05:00,2017-08-09T19:05:00,0E-10,0E-10,30.0000000000,,False
BereHayyTR,BREAKING : The FBI Raided Paul Manafort’s Home https://t.co/02JHeIOHWu #bere https://t.co/NNOGeVa7eA,United States,English,2017-08-09T19:05:00,2017-08-09T19:05:00,0E-10,0E-10,35.0000000000,,False
BereHayyTR,NBC Just Sided With Kim Jong-un Over President Trump https://t.co/cp98LbToNa #bere https://t.co/qiO1JaFeqy,United States,English,2017-08-09T19:05:00,2017-08-09T19:05:00,0E-10,0E-10,37.0000000000,,False
BereHayyTR,RT AmbJohnBolton: What’s been true for the past 25 years is true today: #NorthKorea is not going to voluntarily give up their nuclear weapo…,United States,English,2017-08-09T20:04:00,2017-08-09T20:05:00,0E-10,0E-10,40.0000000000,,False
BereHayyTR,"RT JudicialWatch: 530 Clinton emails &amp; counting found by JW showing pay-for-play, mishandling classified info, fav… https://t.co/zHYyJe4pNv",United States,English,2017-08-09T20:04:00,2017-08-09T20:05:00,0E-10,0E-10,41.0000000000,,False
BereHayyTR,RT JackPosobiec: ANNOUNCING:  Nationwide Marches on Google Offices  Big Google is Watching  https://t.co/Ihh151oMzu,United States,English,2017-08-09T20:04:00,2017-08-09T20:04:00,0E-10,0E-10,39.0000000000,,False
BereHayyTR,RT GrrrGraphics: oops! https://t.co/AMWCyvInY2,United States,English,2017-08-09T20:12:00,2017-08-09T20:12:00,0E-10,0E-10,42.0000000000,Q,True
BereHayyTR,"RT realDonaldTrump: Senator Mitch McConnell said I had ""excessive expectations,"" but I don't think so. After 7 years of hearing Repeal &amp; Re…",United States,English,2017-08-09T20:12:00,2017-08-09T20:12:00,0E-10,0E-10,44.0000000000,,False
BereHayyTR,RT MADE__USA: BREAKING: Nearly a DOZEN Counties in California Are Caught In MASSIVE Voter Fraud Scandal https://t.co/Bgt7gpWHd8,United States,English,2017-08-09T20:12:00,2017-08-09T20:12:00,0E-10,0E-10,43.0000000000,,False
BereHayyTR,"RT JenniferJJacobs: NEW: Trump and Gen. John Kelly ""are and have been in constant contact with the NSC team"" ahead of fire and fury comment…",United States,English,2017-08-09T20:20:00,2017-08-09T20:20:00,0E-10,0E-10,46.0000000000,,False
BereHayyTR,RT mitchellvii: Why do I think Hillary is the real target of Mueller?  Because he is investigating crimes and she is the only one who commi…,United States,English,2017-08-09T20:20:00,2017-08-09T20:20:00,0E-10,0E-10,45.0000000000,,False
BereHayyTR,"RT Pamela_Moore13: Tucker: How does Maxine Waters afford a 6k sq. ft,  $4.3m Mansion on 40 years of government wor… https://t.co/KeGUK0IBFl",United States,English,2017-08-09T20:20:00,2017-08-09T20:20:00,0E-10,0E-10,47.0000000000,,False
BereHayyTR,RT league2734: BOYCOTT SUCCESS: Starbucks BEGS Conservatives to Come Back Don't go back they haven't changed!! https://t.co/lmDeEE7rGb,United States,English,2017-08-09T20:52:00,2017-08-09T20:52:00,0E-10,0E-10,48.0000000000,,False
BereHayyTR,RT TomFitton: Congrats to JudicialWatch's legal team who went to federal court to force release of Clinton-Lynch t… https://t.co/z1fpwcdkio,United States,English,2017-08-09T21:32:00,2017-08-09T21:32:00,0E-10,1.0000000000,49.0000000000,,False
BereHayyTR,"RT NewtTrump: BUSTED: New Docs Reveal Collusion Between Lynch, FBI, And Media To Bury The Bill Clinton Meeting—COM… https://t.co/JoWsQZoMYV",United States,English,2017-08-09T21:40:00,2017-08-09T21:41:00,0E-10,1.0000000000,50.0000000000,,False
BereHayyTR,RT sweetpeach77: Seth Rich went to a Party created just for him by 12 DNC employees at ONE OF AWAN's HOUSES the ni… https://t.co/jb5HLV6qP6,United States,English,2017-08-09T22:36:00,2017-08-09T22:36:00,0E-10,1.0000000000,51.0000000000,,False
BereHayyTR,RT RealJack: Shocker. Not.   Man Who Advised Michelle Obama on Inedible School Lunches Arrested For Defrauding Lun… https://t.co/UhxD1Mqnox,United States,English,2017-08-10T02:12:00,2017-08-10T02:12:00,0E-10,1.0000000000,53.0000000000,,False
BereHayyTR,"RT martucci_peter: ""FBI Coverup""💥ACLJ Obtains Compromising Documents! Obama White House involved! Moving Full Spee… https://t.co/UR6PpK2D16",United States,English,2017-08-10T02:12:00,2017-08-10T02:12:00,0E-10,1.0000000000,52.0000000000,,False
BereHayyTR,"RT Franklin_Graham: Pray for POTUS, VP, &amp; our leaders—for God’s wisdom in responding to sensitive world situations… https://t.co/Y7wqxvp2s2",United States,English,2017-08-10T02:20:00,2017-08-10T02:20:00,0E-10,1.0000000000,55.0000000000,,False
BereHayyTR,RT wikileaks: Why has Google changed its search system to push down publications (left &amp; right) critical of Washin… https://t.co/oVD7FXJ8Y3,United States,English,2017-08-10T02:20:00,2017-08-10T02:21:00,0E-10,1.0000000000,54.0000000000,,False
BereHayyTR,RT RealAlexJones: LIVE &amp; Exclusive: Hillary Offered Plea Deal By Department Of Justice https://t.co/UZFlHBRhL4,United States,English,2017-08-10T03:40:00,2017-08-10T03:40:00,0E-10,1.0000000000,56.0000000000,,False
BereHayyTR,RT JaySekulow: The strategic patience of the Obama Admin didn't work w/ North Korea. We can't negotiate our way to disarming North Korea. I…,United States,English,2017-08-10T04:04:00,2017-08-10T04:04:00,0E-10,1.0000000000,58.0000000000,,False
BereHayyTR,RT AmbJohnBolton: Our country &amp; civilians are vulnerable today because BarackObama did not believe in national missile defense. Let’s never…,United States,English,2017-08-10T04:04:00,2017-08-10T04:04:00,0E-10,1.0000000000,57.0000000000,,False
BereHayyTR,RT LauraLoomer: The Justice Dept has reopened its investigation into HillaryClinton and is considering offering he… https://t.co/ixlZcgvq29,United States,English,2017-08-10T04:04:00,2017-08-10T04:04:00,0E-10,1.0000000000,59.0000000000,,False
BereHayyTR,RT kwilli1046: RT if you want Trump to start enforcing a law that's been on the books for 100 years: deporting ill… https://t.co/lgnXm3xY8O,United States,English,2017-08-10T04:12:00,2017-08-10T04:14:00,0E-10,1.0000000000,60.0000000000,,False
BereHayyTR,"RT sendavidperdue: The RAISE Act is pro-worker, pro-growth, and proven to work. Check out my op-ed w/ SenTomCotton… https://t.co/ndv7VnzA6P",United States,English,2017-08-10T04:44:00,2017-08-10T04:44:00,0E-10,1.0000000000,61.0000000000,,False
BereHayyTR,RT DineshDSouza: Here's how that sleazy operator Obama freed dangerous Iranian spies while pretending they were ha… https://t.co/WNge7XadUC,United States,English,2017-08-10T04:52:00,2017-08-10T04:52:00,0E-10,1.0000000000,62.0000000000,,False
BereHayyTR,"RT TheFive: ""POTUS being unpredictable is a big asset, North Korea knew exactly what President Obama was going to do.""- jessebwatters",United States,English,2017-08-10T05:08:00,2017-08-10T05:08:00,0E-10,1.0000000000,63.0000000000,,False
BereHayyTR,RT RealJamesWoods: Democrats divided over whether party should welcome pro-life candidates \| Better they stay the … https://t.co/MtkxfzmKeN,United States,English,2017-08-10T05:08:00,2017-08-10T05:08:00,0E-10,1.0000000000,66.0000000000,,False
BereHayyTR,"RT bbusa617: BREAKING : DOJ Believes there are Ample Grounds for Prosecuting Hillary https://t.co/JY40ROXIwY DUH! Sheriff Clarke ""I'll Loc…",United States,English,2017-08-10T05:08:00,2017-08-10T05:08:00,0E-10,1.0000000000,69.0000000000,,False
BereHayyTR,"RT RightlyNews: ""realDonaldTrump is trying to protect all Americans. The country needs to come together and face t… https://t.co/s4R4wcmkAM",United States,English,2017-08-10T05:08:00,2017-08-10T05:08:00,0E-10,1.0000000000,67.0000000000,,False
BereHayyTR,RT YoungDems4Trump: The Obama Administration took BILLIONS from Fannie &amp; Freddie to fund Obamacare and is still co… https://t.co/FcIaAfzhFx,United States,English,2017-08-10T05:08:00,2017-08-10T05:08:00,0E-10,1.0000000000,68.0000000000,,False
BereHayyTR,"RT mitchellvii: Yes, Media Covered Lynch-Clinton Tarmac Meeting. With A Pillow https://t.co/YGHzwlc03n",United States,English,2017-08-10T05:08:00,2017-08-10T05:08:00,0E-10,1.0000000000,65.0000000000,,False
BereHayyTR,"RT RealJamesWoods: Atlanta gym bars police officers, military from joining - ABC News https://t.co/Qw5xuq5zqr",United States,English,2017-08-10T05:08:00,2017-08-10T05:08:00,0E-10,1.0000000000,64.0000000000,,False
BereHayyTR,"RT SandraHartle: #California it's time to make a change, one lives in the district the other is a corrupt queen of… https://t.co/GwKbtyK8a9",United States,English,2017-08-10T05:16:00,2017-08-10T05:16:00,0E-10,1.0000000000,72.0000000000,,False
BereHayyTR,Opinion: Newt Gingrich: Rahm Emanuel is the renegade mayor of a renegade city - Fox News https://t.co/joMo1TBGKX,United States,English,2017-08-10T05:16:00,2017-08-10T05:16:00,0E-10,1.0000000000,73.0000000000,,False
BereHayyTR,Opinion: Chicago Mayor Rahm Emanuel welcomes criminal aliens - Fox News https://t.co/Zxa1DdGnU7,United States,English,2017-08-10T05:16:00,2017-08-10T05:16:00,0E-10,1.0000000000,74.0000000000,,False
BereHayyTR,Opinion: Here's why Trump deserves credit for stock market surge - Fox News https://t.co/pb6XlxoCTc,United States,English,2017-08-10T05:16:00,2017-08-10T05:16:00,0E-10,1.0000000000,76.0000000000,,False
BereHayyTR,RT chuckwoolery: Google Board Gave Six Times More Money To Democrats Than Republicans https://t.co/wk6vhzlOPU via chuckwoolery,United States,English,2017-08-10T05:16:00,2017-08-10T05:16:00,0E-10,1.0000000000,71.0000000000,,False
BereHayyTR,RT IngrahamAngle: How the GOP Could Yank Party Endorsement from Never-Trump Senator via LifeZette https://t.co/kNs19mlbGJ,United States,English,2017-08-10T05:16:00,2017-08-10T05:16:00,0E-10,1.0000000000,70.0000000000,,False
BereHayyTR,Deportation orders jump 31 percent under President Trump - Fox News https://t.co/ec5R2R2092,United States,English,2017-08-10T05:16:00,2017-08-10T05:16:00,0E-10,1.0000000000,75.0000000000,,False
BereHayyTR,Trump puts military option back on the table: Gen. Jack Keane - Fox News https://t.co/HwsmHUbUu9,United States,English,2017-08-10T05:24:00,2017-08-10T05:24:00,0E-10,1.0000000000,79.0000000000,,False
BereHayyTR,Trump administration weighs military options against North Korea - Fox News https://t.co/pqnRqZn3Iw,United States,English,2017-08-10T05:24:00,2017-08-10T05:24:00,0E-10,1.0000000000,77.0000000000,,False
BereHayyTR,Can Trump use military force against North Korea without Congressional approval? - Fox News https://t.co/MEf6f95tqz,United States,English,2017-08-10T05:24:00,2017-08-10T05:24:00,0E-10,1.0000000000,78.0000000000,,False
BereHayyTR,RT joelc1400: Opinion: Chicago Mayor Rahm Emanuel welcomes criminal aliens - Fox News https://t.co/Zxa1DdGnU7,United States,English,2017-08-10T05:33:00,2017-08-10T05:33:00,0E-10,1.0000000000,80.0000000000,,False
BereHayyTR,Liberal Kills Neighbor Because he had “Trump Signs” in his Yard https://t.co/iTJbc48CqU #bere https://t.co/iFOrDrSN5K,United States,English,2017-08-10T11:25:00,2017-08-10T11:25:00,0E-10,1.0000000000,83.0000000000,,False
BereHayyTR,CNN Forced to Report BLISTERING Analysis of REELING Dem Party https://t.co/wGFetRVnod #bere https://t.co/HOEqPBXv0k,United States,English,2017-08-10T11:25:00,2017-08-10T11:25:00,0E-10,1.0000000000,81.0000000000,,False
BereHayyTR,BREAKING REPORT : DOJ Believes there are Ample Grounds for Prosecuting Hillary https://t.co/o4eJRt9WW7 #bere https://t.co/7QsiZUQHL5,United States,English,2017-08-10T11:25:00,2017-08-10T11:25:00,0E-10,1.0000000000,84.0000000000,,False
BereHayyTR,DOJ : Stolen IDs Were Sold to Illegals For Voter Fraud SCAM https://t.co/GR0iCh45m2 #bere https://t.co/HkMC293xSy,United States,English,2017-08-10T11:25:00,2017-08-10T11:26:00,0E-10,1.0000000000,82.0000000000,,False
BereHayyTR,THIS U.S. City Wants ILLEGALS to Vote. Look Which One. https://t.co/LPptHbdYPr #bere https://t.co/DGtJcytfUG,United States,English,2017-08-10T11:27:00,2017-08-10T11:27:00,0E-10,1.0000000000,90.0000000000,,False
BereHayyTR,Gorka Warns How Quickly the U.S. Can Respond to a North Korea Attack https://t.co/haNTAaPYsn #bere https://t.co/MMle5d9KJD,United States,English,2017-08-10T11:27:00,2017-08-10T11:27:00,0E-10,1.0000000000,88.0000000000,,False
BereHayyTR,De Blasio’s Former Aide Just Spilled The Beans on his Former Boss https://t.co/sNnehR2w0R #bere https://t.co/gtLqJBIfml,United States,English,2017-08-10T11:27:00,2017-08-10T11:27:00,0E-10,1.0000000000,87.0000000000,,False
BereHayyTR,Trump Supporters React to Traitor McCain’s Criticism of Trump on NK https://t.co/KLaGAO0psk #bere https://t.co/8IyXsXxdWR,United States,English,2017-08-10T11:27:00,2017-08-10T11:27:00,0E-10,1.0000000000,86.0000000000,,False
BereHayyTR,BREAKING : McMaster Has Ties to SHARIA LAW Controlled Donors https://t.co/eyMtlmSP2d #bere https://t.co/BorcvuiifA,United States,English,2017-08-10T11:27:00,2017-08-10T11:27:00,0E-10,1.0000000000,89.0000000000,,False
BereHayyTR,The Money is POURING IN for Kelli Ward to TAKE OUT Jeff Flake! https://t.co/PhRu91BuNE #bere https://t.co/ML9XFw7ryc,United States,English,2017-08-10T11:32:00,2017-08-10T11:32:00,0E-10,1.0000000000,94.0000000000,,False
BereHayyTR,ANOTHER Islamic Migrant Charged For Trying to Help ISIS in Murder Plot https://t.co/syqqRKcc8f #bere https://t.co/0sRIs8oy2a,United States,English,2017-08-10T11:32:00,2017-08-10T11:32:00,0E-10,1.0000000000,92.0000000000,,False
BereHayyTR,Newly Released Documents Show Loretta Lynch in PANIC MODE After Tarmac Fiasco https://t.co/h28NfctxMW #bere https://t.co/KSsoTJfjfl,United States,English,2017-08-10T11:32:00,2017-08-10T11:32:00,0E-10,1.0000000000,91.0000000000,,False
BereHayyTR,Gorka Triggers Liberal Media Hacks By Exposing Possible Hate Crime HOAX https://t.co/6BxVYVhnyx #bere https://t.co/Qnd3groB10,United States,English,2017-08-10T11:32:00,2017-08-10T11:32:00,0E-10,1.0000000000,93.0000000000,,False
BereHayyTR,Ron Johnson Thinks He Knows Why Mccain Voted Against Obamacare Repeal and it’s BAD https://t.co/CXvasMVM4b #bere https://t.co/badx21gTn9,United States,English,2017-08-10T11:37:00,2017-08-10T11:37:00,0E-10,1.0000000000,97.0000000000,,False
BereHayyTR,Anti-Trump A-List Actress Has Sudden Change of Heart https://t.co/a1ujy2EUvm #bere https://t.co/aUbXPh5cWm,United States,English,2017-08-10T11:37:00,2017-08-10T11:38:00,0E-10,1.0000000000,96.0000000000,,False
BereHayyTR,Liberals Implement a RIDICULOUS Method to Combat Terrorism https://t.co/r3uxqCF6mm #bere https://t.co/6TWNoHeE2h,United States,English,2017-08-10T11:37:00,2017-08-10T11:37:00,0E-10,1.0000000000,98.0000000000,,False
BereHayyTR,Look How Much Deportations are UP Since Trump Became POTUS! https://t.co/iR0MOOaCGa #bere https://t.co/TvaeZWL4s7,United States,English,2017-08-10T11:37:00,2017-08-10T11:38:00,0E-10,1.0000000000,99.0000000000,,False
BereHayyTR,Mad Max Calls Alan Dershowitz “RACIST” but he has the PERFECT Response! https://t.co/QLasevA3JK #bere https://t.co/ub7kOqskcR,United States,English,2017-08-10T11:42:00,2017-08-10T11:42:00,0E-10,1.0000000000,103.0000000000,,False
BereHayyTR,The Clinton Body Count GOES UP! Male Prostitute Found DEAD at Donor’s Home! https://t.co/iLtkO0D8sF #bere https://t.co/rSUTJkIQVj,United States,English,2017-08-10T11:42:00,2017-08-10T11:42:00,0E-10,1.0000000000,100.0000000000,,False
BereHayyTR,REPORT : Diva Megyn Kelly Already CAUSING CHAOS at NBC! https://t.co/bPgW59Xgoz #bere https://t.co/p3WBl8CQbx,United States,English,2017-08-10T11:42:00,2017-08-10T11:42:00,0E-10,1.0000000000,104.0000000000,,False
BereHayyTR,Merkel Just Tried to Give Trump Orders on North Korea and FAILED MISERABLY! https://t.co/P4ybvCk82R #bere https://t.co/1B5QmNWsXy,United States,English,2017-08-10T11:42:00,2017-08-10T11:42:00,0E-10,1.0000000000,102.0000000000,,False
BereHayyTR,Liberal Atlanta Gym Owner Just BANNED COPS and MILITARY from Joining! https://t.co/jyH12ndc9u #bere https://t.co/lwe6xGjCD4,United States,English,2017-08-10T11:42:00,2017-08-10T11:42:00,0E-10,1.0000000000,101.0000000000,,False
BereHayyTR,LOL : CNN Loses to Cartoon Network AGAIN! Falls Down EVEN FURTHER! https://t.co/1zB53Sb1zN #bere https://t.co/pYqkdbeyt5,United States,English,2017-08-10T11:47:00,2017-08-10T11:47:00,0E-10,1.0000000000,106.0000000000,,False
BereHayyTR,Disgraced NY Times Forced to Admit They LIED on Climate Change Piece https://t.co/Zhai0YkhBa #bere https://t.co/bBmGOEpqCK,United States,English,2017-08-10T11:47:00,2017-08-10T11:48:00,0E-10,1.0000000000,110.0000000000,,False
BereHayyTR,BREAKING VIDEO : Will Hillary Take a Rumored DOJ “Plea Deal?” https://t.co/KzIMYo9gHO #bere https://t.co/J2MD4fXxT4,United States,English,2017-08-10T11:47:00,2017-08-10T11:48:00,0E-10,1.0000000000,109.0000000000,,False
BereHayyTR,How Bill Clinton’s FAILED North Korea Deal Led to Today’s Nuclear Mess https://t.co/v3YR0Sp5I3 #bere https://t.co/wyGBw8D38b,United States,English,2017-08-10T11:47:00,2017-08-10T11:48:00,0E-10,1.0000000000,107.0000000000,,False
BereHayyTR,Look Which World Leader Just Borrowed a Page from Trump’s Playbook! https://t.co/s1lhKbVEwa #bere https://t.co/gxjsYv9uVv,United States,English,2017-08-10T11:47:00,2017-08-10T11:47:00,0E-10,1.0000000000,105.0000000000,,False
BereHayyTR,Unexpected Democrat Defends Trump’s “Fire and Fury” Comments https://t.co/zH8NkDdkv8 #bere https://t.co/fE8o23XC6N,United States,English,2017-08-10T11:47:00,2017-08-10T11:49:00,0E-10,1.0000000000,108.0000000000,,False
BereHayyTR,RT SCloudcroft: Judicial Watch: “POTUS should order the full &amp; immediate release of these materials.” Lynch-Clinto… https://t.co/z1fpwcdkio,United States,English,2017-08-10T12:30:00,2017-08-10T12:30:00,0E-10,1.0000000000,111.0000000000,,False
BereHayyTR,RT YoungDems4Trump: NEVER in my life did I think liberals would side with a DICTATOR threatening to NUKE them over THEIR OWN President tryi…,United States,English,2017-08-10T12:36:00,2017-08-10T12:36:00,0E-10,1.0000000000,112.0000000000,,False
BereHayyTR,RT LouDobbs: #DitchMitch- McConnell committing political suicide for failing to uphold POTUS' America-First Agenda… https://t.co/2ZM8fynmvA,United States,English,2017-08-10T12:39:00,2017-08-10T12:39:00,0E-10,1.0000000000,113.0000000000,,False
BereHayyTR,RT StefanMolyneux: Democrats Threaten Government Shutdown To Block Border Wall https://t.co/APkCpbQ7yJ,United States,English,2017-08-10T12:42:00,2017-08-10T12:42:00,0E-10,1.0000000000,115.0000000000,,False
