author_id,content,region,language,publish_date,harvested_date,following,followers,updates,post_type,retweet
BereHayyTR,RT kwilli1046: This is big! Hillary Clinton covered up child trafficking investigation at the State Department https://t.co/vPDs44asfC,United States,English,2017-08-10T12:42:00,2017-08-10T12:43:00,0E-10,1.0000000000,114.0000000000,,False
BereHayyTR,Trump Continues to ROAST Loser McConnell and it is GLORIOUS https://t.co/dCoSytUY2V #bere https://t.co/9s8f3hddVj,United States,English,2017-08-10T13:50:00,2017-08-10T13:51:00,0E-10,1.0000000000,116.0000000000,,False
BereHayyTR,Former Lynch Attorney Who Covered for Her is Now “Investigating” Lynch https://t.co/1R1ko17Tqi #bere https://t.co/C0uEg6HZw8,United States,English,2017-08-10T13:50:00,2017-08-10T13:51:00,0E-10,1.0000000000,117.0000000000,,False
BereHayyTR,BREAKING : ISIS Jihadi Arrested for Plot to Down U.S. Jet Using Drone https://t.co/81cBYTiW8r #bere https://t.co/imbGMfDxBc,United States,English,2017-08-10T13:51:00,2017-08-10T13:51:00,0E-10,1.0000000000,118.0000000000,,False
BereHayyTR,WOW! Look Which Pundit Just LEFT CNN to Become RNC Spokesperson! https://t.co/77WCFp1lcn #bere https://t.co/761eQSdLv0,United States,English,2017-08-10T13:51:00,2017-08-10T13:51:00,0E-10,1.0000000000,124.0000000000,,False
BereHayyTR,Mattis Issues OMINOUS Warning to Kim Jong Un – Look What He Said! https://t.co/E8W0ZYmmq8 #bere https://t.co/bKHRDry3Pv,United States,English,2017-08-10T13:51:00,2017-08-10T13:51:00,0E-10,1.0000000000,121.0000000000,,False
BereHayyTR,SINISTER! Look What the Trump Dossier Firm Just Tried to Get Away With! https://t.co/1UQkBSksde #bere https://t.co/EK9Oizhwj3,United States,English,2017-08-10T13:51:00,2017-08-10T13:51:00,0E-10,1.0000000000,119.0000000000,,False
BereHayyTR,What This Liberal ACLU Lawyer Thinks About FREE SPEECH is a DISGRACE! https://t.co/OJEdRB6Xmm #bere https://t.co/PaAOLN358j,United States,English,2017-08-10T13:51:00,2017-08-10T13:51:00,0E-10,1.0000000000,123.0000000000,,False
BereHayyTR,Bolton Just Defended Trump – He’s Ready for FIRE and FURY! https://t.co/zOVBOEU2fY #bere https://t.co/GMTOBrLMlb,United States,English,2017-08-10T13:51:00,2017-08-10T13:51:00,0E-10,1.0000000000,120.0000000000,,False
BereHayyTR,BREAKING : North Korea Preps for GUAM STRIKE https://t.co/EZ8ZVYytTK #bere https://t.co/D2DE5XEYzb,United States,English,2017-08-10T13:51:00,2017-08-10T13:51:00,0E-10,1.0000000000,122.0000000000,,False
BereHayyTR,RT THEHermanCain: SJW crusade to shame some NFL team into signing Colin Kaepernick not going so well … https://t.co/wfGDBFmrEU,United States,English,2017-08-10T13:56:00,2017-08-10T13:56:00,0E-10,1.0000000000,125.0000000000,,False
BereHayyTR,BREAKING : Zoo Knife Attacker Malik Abdul-Rauf Arrested for THROAT SLASHING https://t.co/OaBZ4QCwTp #bere https://t.co/2IhKQMbH5C,United States,English,2017-08-10T14:07:00,2017-08-10T14:07:00,0E-10,1.0000000000,127.0000000000,,False
BereHayyTR,BREAKING : Susan Rice Sides with North Korea Against Trump https://t.co/z6YCrSb5NI #bere https://t.co/8YyOI6bL2o,United States,English,2017-08-10T14:07:00,2017-08-10T14:07:00,0E-10,1.0000000000,128.0000000000,,False
BereHayyTR,Look What This Sinister Islamic Sex Gang Said About “White Women” https://t.co/eGJRohfQHH #bere https://t.co/4yruuOlqZ5,United States,English,2017-08-10T14:07:00,2017-08-10T14:07:00,0E-10,1.0000000000,126.0000000000,,False
BereHayyTR,RT TomFitton: The CA political establishment are upset we called them out on their dirty voting rolls. https://t.co/n0XWpJimya,United States,English,2017-08-10T14:44:00,2017-08-10T14:44:00,0E-10,1.0000000000,130.0000000000,Q,True
BereHayyTR,RT Thomas1774Paine: BREAKING: Federal Court Orders State Dept to Conduct Search of Benghazi Emails of Hillary Clin… https://t.co/jtfrsJGnBu,United States,English,2017-08-10T14:44:00,2017-08-10T14:44:00,0E-10,1.0000000000,129.0000000000,,False
BereHayyTR,RT TomiLahren: As I watch millennial men struggle to lift their bags into the overhead bin I am reminded how f'd we are if there's a draft.,United States,English,2017-08-10T14:44:00,2017-08-10T14:44:00,0E-10,1.0000000000,131.0000000000,,False
BereHayyTR,RT WhiteHouse: The USS Gerald R. Ford was made with American steel and built by American workers: … https://t.co/M38lNCYdTe,United States,English,2017-08-10T14:52:00,2017-08-10T14:52:00,0E-10,1.0000000000,136.0000000000,,False
BereHayyTR,RT JudicialWatch: BREAKING: JW wins big court ruling that may finally result in truth about Benghazi &amp; Clinton’s i… https://t.co/QivuIcrF0x,United States,English,2017-08-10T14:52:00,2017-08-10T14:52:00,0E-10,1.0000000000,135.0000000000,,False
BereHayyTR,"RT ScottPresler: FRAUD: If democrats ever tell you voter fraud doesn't exist, show them this:  https://t.co/ccrAiNmS2W #ThursdayThoughts #…",United States,English,2017-08-10T14:52:00,2017-08-10T14:52:00,0E-10,1.0000000000,137.0000000000,,False
BereHayyTR,RT kwilli1046: Loretta Lynch &amp; Clinton tarmac meeting exposed. #FakeNewsMedia did best to  #coverup story. No Cred… https://t.co/UMzBBxfbka,United States,English,2017-08-10T14:52:00,2017-08-10T14:52:00,0E-10,1.0000000000,133.0000000000,,False
BereHayyTR,RT BrianHassine: Judge just rules to open Hillary emails on Benghazi,United States,English,2017-08-10T14:52:00,2017-08-10T14:52:00,0E-10,1.0000000000,132.0000000000,,False
BereHayyTR,RT RogerJStoneJr: Ben/ based on the FISA Court finding documenting your mass based spying you're headed to a feder… https://t.co/j9iijbE1Am,United States,English,2017-08-10T14:52:00,2017-08-10T14:54:00,0E-10,1.0000000000,138.0000000000,,False
BereHayyTR,RT PoliticalShort: Susan Rice: US can 'tolerate' nuclear weapons in North Korea. Unbelievable. Now you know why we… https://t.co/seZDzbafZe,United States,English,2017-08-10T14:52:00,2017-08-10T14:52:00,0E-10,1.0000000000,134.0000000000,,False
BereHayyTR,"RT bbusa617: The Money is POURING IN for Kelli Ward to TAKE OUT Jeff Flake! https://t.co/XfmHfPZnp8  ""Dr Kelly Ward"" This Should Be A Land…",United States,English,2017-08-10T15:00:00,2017-08-10T15:01:00,0E-10,1.0000000000,139.0000000000,,False
BereHayyTR,"RT realDonaldTrump: Can you believe that Mitch McConnell, who has screamed Repeal &amp; Replace for 7 years, couldn't get it done. Must Repeal …",United States,English,2017-08-10T15:00:00,2017-08-10T15:01:00,0E-10,1.0000000000,140.0000000000,,False
BereHayyTR,RT DCjusticeseeker: Somebody needs to go to jail. Investigate Comey.  jeffsessions DeptJusticeIRL POTUS https://t.co/TE5LJic38o,United States,English,2017-08-10T15:00:00,2017-08-10T15:01:00,0E-10,1.0000000000,141.0000000000,Q,True
BereHayyTR,RT TeriAnne7201: Federal Judge Orders State Department to Search for Clinton’s Benghazi Emails https://t.co/zSNZLXt6ob #Benghazi  ‼️HELL Y…,United States,English,2017-08-10T16:44:00,2017-08-10T16:44:00,0E-10,2.0000000000,142.0000000000,,False
BereHayyTR,ANOTHER Survey Shows That the Media’s Polling is FAKE NEWS https://t.co/jLAN9Tvy9c #bere https://t.co/1ZEYEsYL1I,United States,English,2017-08-10T16:50:00,2017-08-10T16:51:00,0E-10,2.0000000000,143.0000000000,,False
BereHayyTR,Open Border Dems Threaten GOVERNMENT SHUTDOWN to Stop The Wall https://t.co/MHokbm6pkG #bere https://t.co/GzUeX6gfdm,United States,English,2017-08-10T16:50:00,2017-08-10T16:50:00,0E-10,2.0000000000,144.0000000000,,False
BereHayyTR,RT FoxNews: Judge orders State Dept to search https://t.co/PQRRe4PtKk  accounts for Clinton aides' Benghazi email… https://t.co/0IocMIkWKI,United States,English,2017-08-10T16:52:00,2017-08-10T16:52:00,0E-10,2.0000000000,146.0000000000,,False
BereHayyTR,"RT realDonaldTrump: Mitch, get back to work and put Repeal &amp; Replace, Tax Reform &amp; Cuts and a great Infrastructure Bill on my desk for sign…",United States,English,2017-08-10T16:52:00,2017-08-10T16:52:00,0E-10,2.0000000000,149.0000000000,,False
BereHayyTR,"RT AmericanHotLips: #Italy ""Migrants"" block the road demanding money, phones etc resulting in Italians not being a… https://t.co/JcMc8obdcp",United States,English,2017-08-10T16:52:00,2017-08-10T16:52:00,0E-10,2.0000000000,147.0000000000,,False
BereHayyTR,RT JudicialWatch: StateDepartment. ClintonFoundation. HumaAbedin. Special Favors. Pay-for-Play. See JW's video exp… https://t.co/LSaS9JjnvP,United States,English,2017-08-10T16:52:00,2017-08-10T16:52:00,0E-10,2.0000000000,148.0000000000,,False
BereHayyTR,RT MycaLynn: 🚨Surprise! College Dem found guilty of registering dead ppl to vote! 🚨But voting fraud isn't real 🙄🤦🏻… https://t.co/wQ6p22bDeN,United States,English,2017-08-10T16:52:00,2017-08-10T16:52:00,0E-10,2.0000000000,145.0000000000,,False
BereHayyTR,LOL : Loser Ossoff to Participate in Dem Panel on “How to Win” https://t.co/Wt8wu9AlwR #bere https://t.co/Xdp5oixvE4,United States,English,2017-08-10T17:05:00,2017-08-10T17:05:00,0E-10,2.0000000000,152.0000000000,,False
BereHayyTR,Scaramucci Going Head-to-Head With BIGGEST Anti-Trump Comedian https://t.co/Urlrcc01EH #bere https://t.co/ioCj223uqw,United States,English,2017-08-10T17:05:00,2017-08-10T17:05:00,0E-10,2.0000000000,153.0000000000,,False
BereHayyTR,The Percentage of Illegals in Federal Prisons Is STUNNING! https://t.co/dloh884KU3 #bere https://t.co/4JvvOglXIP,United States,English,2017-08-10T17:05:00,2017-08-10T17:05:00,0E-10,2.0000000000,151.0000000000,,False
BereHayyTR,REPORT : How Badly Could N. Korea Damage the United States? https://t.co/hp2LcEvnU4 #bere https://t.co/D0BYaYuESD,United States,English,2017-08-10T17:05:00,2017-08-10T17:05:00,0E-10,2.0000000000,150.0000000000,,False
BereHayyTR,"RT SalamMorcos: New Report: The DNC hack was actually a leak, and not a hack from Russia. https://t.co/auJkferqKs https://t.co/msRloBEgrJ",United States,English,2017-08-10T17:40:00,2017-08-10T17:40:00,0E-10,2.0000000000,154.0000000000,,False
BereHayyTR,"RT TomFitton: ""Attorney General Jeff Sessions should order DOJ to stop fighting the FOIA requests and unmask the t… https://t.co/WJ0mAhImlh",United States,English,2017-08-10T18:52:00,2017-08-10T18:52:00,0E-10,2.0000000000,155.0000000000,Q,True
BereHayyTR,"RT DrewLiquerman: Mad Maxine: its ok if I pay my daughter $750,000 to send a few emails but its CORRUPTION for Tru… https://t.co/nxWaKG71lw",United States,English,2017-08-10T19:48:00,2017-08-10T19:48:00,0E-10,2.0000000000,156.0000000000,,False
BereHayyTR,RT FoxNews: .stephenfhayes: StateDept Did Everything They Could to Hide HillaryClinton-Benghazi Emails https://t.co/NyONgKc8i3,United States,English,2017-08-10T19:56:00,2017-08-10T19:56:00,0E-10,2.0000000000,157.0000000000,,False
BereHayyTR,Wow! CNN actually reporting real news for a change https://t.co/LoNPHMYR4o,United States,English,2017-08-10T20:12:00,2017-08-10T20:12:00,0E-10,2.0000000000,158.0000000000,,False
BereHayyTR,RT TomFitton: Why are Tillerson and Sessions wasting taxpayer dollars protecting Hillary Clinton and the Obama adm… https://t.co/4ypG03oMOL,United States,English,2017-08-10T20:36:00,2017-08-10T20:36:00,0E-10,2.0000000000,159.0000000000,,False
BereHayyTR,RT kelliwardaz: #GOP voters want action &amp; all we've gotten is finger pointing at realDonaldTrump - the era of excu… https://t.co/7JclpMcAHG,United States,English,2017-08-10T20:44:00,2017-08-10T20:45:00,0E-10,2.0000000000,161.0000000000,,False
BereHayyTR,"RT FoxNews: .LisaMarieBoothe: ""Clinton had emailed her daughter THAT NIGHT telling her [Benghazi] was a result of … https://t.co/0BhfRvzBe6",United States,English,2017-08-10T20:44:00,2017-08-10T20:44:00,0E-10,2.0000000000,162.0000000000,,False
BereHayyTR,"RT kwilli1046: ""Clinton emailed her daughter THAT NIGHT telling her [Benghazi] was a result of a planned Al Qaeda-… https://t.co/gPa1ALm3Na",United States,English,2017-08-10T20:44:00,2017-08-10T20:44:00,0E-10,2.0000000000,160.0000000000,,False
BereHayyTR,RT surfermom77: the “Swamp Creatures” covering up 4their own Former Lynch Attorney Who Covered 4Her is Now “Invest… https://t.co/WPSZcLolXD,United States,English,2017-08-10T20:52:00,2017-08-10T20:53:00,0E-10,2.0000000000,163.0000000000,,False
BereHayyTR,RT Trump4NC: 🔴BREAKING🔴 new info!! #SethRich right before his murder was at late night house party owned by #Imran… https://t.co/b8644VzMDp,United States,English,2017-08-10T20:52:00,2017-08-10T20:52:00,0E-10,2.0000000000,164.0000000000,,False
BereHayyTR,LOL : WAPO Has Hysterical Meltdown Over Trump’s Nuke Codes https://t.co/zcavxpMroP #bere https://t.co/E6oZmGG4md,United States,English,2017-08-10T21:20:00,2017-08-10T21:20:00,0E-10,2.0000000000,165.0000000000,,False
BereHayyTR,Watch Naive Liberals DEMAND MORE Refugees in America https://t.co/GRRGOlGHpO #bere https://t.co/amqvmNMSWb,United States,English,2017-08-10T21:20:00,2017-08-10T21:20:00,0E-10,2.0000000000,166.0000000000,,False
BereHayyTR,President Trump Just Declared a “National Emergency” https://t.co/31Ua5yBFAA #bere https://t.co/U4GFg22ARj,United States,English,2017-08-10T21:20:00,2017-08-10T21:20:00,0E-10,2.0000000000,168.0000000000,,False
BereHayyTR,WHOA! Gov of Maine Just Issued a THREAT That Will TRIGGER Every Liberal https://t.co/umzmirMHUH #bere https://t.co/YOADXvFGNB,United States,English,2017-08-10T21:20:00,2017-08-10T21:20:00,0E-10,2.0000000000,169.0000000000,,False
BereHayyTR,Mike Huckabee Has Perfect Solution for N. Korea Involving Maxine Waters… https://t.co/v6JY9OLEj2 #bere https://t.co/T2GAl1fOx8,United States,English,2017-08-10T21:20:00,2017-08-10T21:20:00,0E-10,2.0000000000,167.0000000000,,False
BereHayyTR,North Korea Tensions Lead Gold Prices Soaring! https://t.co/rmfJxi2YQu #bere https://t.co/4Nc31cNY4H,United States,English,2017-08-10T21:35:00,2017-08-10T21:36:00,0E-10,2.0000000000,172.0000000000,,False
BereHayyTR,"Delusional McCain Thinks He’s President, Announces “Foreign Policy” Plans https://t.co/UZgqscNyTb #bere https://t.co/qhYmsDd0Lt",United States,English,2017-08-10T21:35:00,2017-08-10T21:35:00,0E-10,2.0000000000,171.0000000000,,False
BereHayyTR,BREAKING VIDEO : President Trump Not Backing Down! https://t.co/eOEGjvrgZ5 #bere https://t.co/F7iRyzGwbA,United States,English,2017-08-10T21:35:00,2017-08-10T21:35:00,0E-10,2.0000000000,170.0000000000,,False
BereHayyTR,RT thebradfordfile: FLAKE: Your support won't buy a pack of gum. All RINOs are a dying breed. Thankfully AZ has th… https://t.co/XN3E29XQY0,United States,English,2017-08-11T15:32:00,2017-08-11T15:32:00,0E-10,1.0000000000,193.0000000000,,False
BereHayyTR,"RT The_Trump_Train: Funny how the left insists we should not destroy North Korea's nuclear missiles pointed straight at us, yet they call f…",United States,English,2017-08-11T15:32:00,2017-08-11T15:32:00,0E-10,1.0000000000,196.0000000000,,False
BereHayyTR,RT GeorgiaDirtRoad: POLL 🚨🚨🚨  During the first 6 month's which  president did the better job?   #PleaseVote ✅,United States,English,2017-08-11T15:32:00,2017-08-11T15:32:00,0E-10,1.0000000000,195.0000000000,,False
BereHayyTR,"RT The_Trump_Train: To see those on the left grovel to Kim Jong Un, because they hate President Trump, makes me absolutely sick. They are u…",United States,English,2017-08-11T15:40:00,2017-08-11T15:41:00,0E-10,1.0000000000,197.0000000000,,False
BereHayyTR,"RT RyanJensen2018: Congrats to kelliwardaz on 30K Followers! 🇺🇸🎉🇺🇸🎉  She is Running Against RINO, Jeff Flake for U… https://t.co/ithxmidmXa",United States,English,2017-08-11T15:40:00,2017-08-11T15:41:00,0E-10,1.0000000000,198.0000000000,,False
BereHayyTR,RT kwilli1046: Pork banned from Austrian schools because Muslims complained. Appeasement is the first step to losi… https://t.co/OjGMZgdQ8G,United States,English,2017-08-11T17:00:00,2017-08-11T17:01:00,0E-10,1.0000000000,203.0000000000,,False
BereHayyTR,RT RealJamesWoods: This is pretty important. She no longer has control over the disposition of these illegally acq… https://t.co/PGJfHrbaCg,United States,English,2017-08-11T17:00:00,2017-08-11T17:00:00,0E-10,1.0000000000,200.0000000000,Q,True
BereHayyTR,RT The_Trump_Train: Reporters/MSM- The #TrumpTrain is huge. It's not some fringe group. I'll prove it. Retweet this if you're a proud membe…,United States,English,2017-08-11T17:00:00,2017-08-11T17:00:00,0E-10,1.0000000000,201.0000000000,,False
BereHayyTR,RT RealMattCouch: We're looking for multiple DNC staffers that were at a party on July 9/10 in 2016. We will give you anonymity #SethRich,United States,English,2017-08-11T17:00:00,2017-08-11T17:00:00,0E-10,1.0000000000,199.0000000000,,False
BereHayyTR,RT gatewaypundit: GOP Rep. Demands Mueller Testify In Public Congressional Hearing Over 'Conflicts of Interest' Wi… https://t.co/SgGTU4PFMC,United States,English,2017-08-11T17:00:00,2017-08-11T17:01:00,0E-10,1.0000000000,202.0000000000,,False
BereHayyTR,RT LindseyGrahamSC: Just to be clear:  President RealDonaldTrump INHERITED the mess with North Korea.   He did not create it. (1),United States,English,2017-08-11T18:04:00,2017-08-11T18:04:00,0E-10,1.0000000000,205.0000000000,,False
BereHayyTR,RT LindseyGrahamSC: realDonaldTrump No one stopped NK because the price of taking action was deemed too high.   Th… https://t.co/F5OtHIgHFs,United States,English,2017-08-11T18:04:00,2017-08-11T18:04:00,0E-10,1.0000000000,206.0000000000,,False
BereHayyTR,RT Harlan: That’s right! #MAGA 🇺🇸 https://t.co/ZxWvbUCoux,United States,English,2017-08-11T18:04:00,2017-08-11T18:04:00,0E-10,1.0000000000,208.0000000000,Q,True
BereHayyTR,RT HouseCracka: IT'S TIME TO DECLARE YOUTUBE A PUBLIC UTILITY OR FILE MASSIVE CLASS ACTION LAWSUIT!!! 🚨🚨🚨🚨🚨🚨🚨 https://t.co/ZJEu7qeZJO,United States,English,2017-08-11T18:04:00,2017-08-11T18:04:00,0E-10,1.0000000000,207.0000000000,Q,True
BereHayyTR,RT JaySekulow: Radio: A Deep Dive into AG #Lynch/#Clinton Case. https://t.co/7wCxINFELm,United States,English,2017-08-11T18:04:00,2017-08-11T18:04:00,0E-10,1.0000000000,204.0000000000,,False
BereHayyTR,RT polNewsForever: Google CEO Pichai cancels an all-hands meeting about the #GoogleMemo; some employees worry they… https://t.co/Yp75P55sKf,United States,English,2017-08-11T19:08:00,2017-08-11T19:08:00,0E-10,1.0000000000,209.0000000000,,False
BereHayyTR,RT WayneDupreeShow: .MatthewYglesia So Trump gave up his $10B for a $400K a year salary that he donates each quart… https://t.co/qpYYJc1f6E,United States,English,2017-08-11T20:36:00,2017-08-11T20:37:00,0E-10,1.0000000000,210.0000000000,,False
BereHayyTR,RT chuckwoolery: THIS IS A PROBLEMMuslim Professor CA University: “Genocide” Of White Racists “Morally Required” https://t.co/0WE2twHFLx v…,United States,English,2017-08-11T20:44:00,2017-08-11T20:44:00,0E-10,1.0000000000,211.0000000000,,False
BereHayyTR,RT GenRickDeMarco: Leftists can't stand nothing more than a black woman saying realDonaldTrump will #MAGA RT to pi… https://t.co/1ygrOpY2zJ,United States,English,2017-08-11T20:52:00,2017-08-11T20:52:00,0E-10,1.0000000000,212.0000000000,,False
BereHayyTR,"RT KamVTV: Democrats hated my guts, hurled insults at me, made lewd accusations, protested my election and started a civil war.  - Abraham …",United States,English,2017-08-11T21:48:00,2017-08-11T21:48:00,0E-10,1.0000000000,214.0000000000,,False
BereHayyTR,RT peterboykin: ATTENTION #TRUMPTRAIN: We must amplify our online presence.1 RETWEET this tweet2 Follow everyone w… https://t.co/VBaBNUAisd,United States,English,2017-08-11T21:48:00,2017-08-11T21:48:00,0E-10,1.0000000000,213.0000000000,,False
BereHayyTR,RT RealAlexJones: He shot himself in the head then carefully disposed of the weapon and walked to the beach leaving no blood trail - …,United States,English,2017-08-11T21:56:00,2017-08-11T21:56:00,0E-10,1.0000000000,217.0000000000,,False
BereHayyTR,"RT RyanJensen2018: Prosecutor looking into Debbie Wasserman Schultz found dead of ""suicide with 3 bullet holes"" bu… https://t.co/q9ivaYGaA8",United States,English,2017-08-11T21:56:00,2017-08-11T21:56:00,0E-10,1.0000000000,216.0000000000,,False
BereHayyTR,"RT RyanJensen2018: If you could kick out 1 RINO, who would it be?",United States,English,2017-08-11T21:56:00,2017-08-11T21:56:00,0E-10,1.0000000000,215.0000000000,,False
BereHayyTR,RT RyanAFournier: 7 Years. You had 7 years to figure out Obamacare. Unbelievable.,United States,English,2017-08-11T22:20:00,2017-08-11T22:20:00,0E-10,1.0000000000,218.0000000000,,False
BereHayyTR,"RT EntheosShines: Maxine Waters (D-CA) caught on video bragging Obama has ""secret database"" on all Americans DRUDG… https://t.co/6RZFnJRvht",United States,English,2017-08-11T22:28:00,2017-08-11T22:28:00,0E-10,1.0000000000,219.0000000000,,False
BereHayyTR,RT vadpradub: SIGN PETITION: Senator McCain CHANGE your Vote! 🇺🇸🇺🇸🇺🇸🇺🇸🇺🇸🇺🇸🇺🇸🇺🇸🇺🇸🇺🇸🇺🇸🇺🇸🇺🇸🇺🇸🇺🇸🇺🇸🇺🇸🇺🇸🇺🇸🇺🇸🇺🇸🇺🇸✅✅✅✅✅✅✅✅… https://t.co/WcbVSpMBT6,United States,English,2017-08-11T22:28:00,2017-08-11T22:28:00,0E-10,1.0000000000,220.0000000000,Q,True
BereHayyTR,"RT RyanJensen2018: Mitch McConnell &amp; RINO's have been Preaching ""Repeal &amp; Replace"" for 8 Years!  You can't get it … https://t.co/wYmiUJEdrO",United States,English,2017-08-11T22:28:00,2017-08-11T22:28:00,0E-10,1.0000000000,221.0000000000,,False
BereHayyTR,RT LightWarrior360: TIME TO GO AFTER ADVERTISERS! MediaEqualizer SScalpings #FIGHTFIREWITHFIRE #standwithsean sean… https://t.co/wnFYymC3i5,United States,English,2017-08-11T23:24:00,2017-08-11T23:24:00,0E-10,1.0000000000,222.0000000000,,False
BereHayyTR,RT RyanJensen2018: 📍California District 43📍  Elect Omar Navarro For Congress  ✔️Pro Trump ✔️Repeal ObamaCare ✔️Kic… https://t.co/K1PZVm9Gxi,United States,English,2017-08-11T23:40:00,2017-08-11T23:40:00,0E-10,1.0000000000,223.0000000000,,False
BereHayyTR,"RT GeorgiaDirtRoad: Feel Good Story Of The Day! 🎯  TimTebow stops warming up to shake autistic fan's hand, follows… https://t.co/WBVQL3k130",United States,English,2017-08-11T23:56:00,2017-08-11T23:56:00,0E-10,1.0000000000,224.0000000000,,False
BereHayyTR,GeorgiaDirtRoad hwholcomb TimTebow TimTebow is a great role model for our youth! He will be in the pros soon enough with that swing.,United States,English,2017-08-12T00:04:00,2017-08-12T00:04:00,0E-10,1.0000000000,225.0000000000,,False
BereHayyTR,RT bbusa617: https://t.co/WxOLoFd0QC  Clinton &amp; Blumenthal were running guns through that Embassy.These emails will prove a lot. Fed Judge…,United States,English,2017-08-12T00:12:00,2017-08-12T00:12:00,0E-10,1.0000000000,226.0000000000,,False
BereHayyTR,RT DougSchloemer: Do it asap; let's get a real investigation https://t.co/zTDxndSGWs,United States,English,2017-08-12T00:20:00,2017-08-12T00:20:00,0E-10,1.0000000000,227.0000000000,Q,True
BereHayyTR,RT USSANews: #Muslim Starbucks Workers Just Got Caught Hiding Lethal ‘Gift’ In Your Drinks – This Is Way Scarier T… https://t.co/7dahUJA3P9,United States,English,2017-08-12T00:20:00,2017-08-12T00:20:00,0E-10,1.0000000000,228.0000000000,,False
BereHayyTR,RT The_Trump_Train: If your blind hate for President Trump is making you take the side of the enemy over the USA you need to seek professio…,United States,English,2017-08-12T02:12:00,2017-08-12T02:12:00,0E-10,1.0000000000,229.0000000000,,False
BereHayyTR,RT AmericanHotLips: #Italy Groundhog Day with migrants (invaders) making demands &amp; protesting for benefits. #Openb… https://t.co/k33lVRSDMy,United States,English,2017-08-12T02:12:00,2017-08-12T02:12:00,0E-10,1.0000000000,230.0000000000,,False
BereHayyTR,"RT RealJamesWoods: If this is remotely possible, thennit is the true cancer on our society. #VoterFraud https://t.co/lzaJQuVzMh",United States,English,2017-08-12T02:21:00,2017-08-12T02:21:00,0E-10,1.0000000000,232.0000000000,Q,True
BereHayyTR,RT TomFitton: More than 3.5 million people in the U.S. are registered to vote than are alive among America’s adult… https://t.co/xyTIddkPg3,United States,English,2017-08-12T02:21:00,2017-08-12T02:21:00,0E-10,1.0000000000,233.0000000000,,False
BereHayyTR,"RT DrewLiquerman: BUSTED ""Clinton emailed her daughter THAT NIGHT telling her Benghazi was result of a planned AlQ… https://t.co/gPa1ALm3Na",United States,English,2017-08-12T02:21:00,2017-08-12T02:21:00,0E-10,1.0000000000,231.0000000000,,False
BereHayyTR,"RT RealBowensWharf: Guam's Lt. Gov To .MariaBartiromo: ""North Korea is the demon, not #Trump or #China."" #NorthKor… https://t.co/LHyaFldDWj",United States,English,2017-08-12T02:44:00,2017-08-12T02:44:00,0E-10,1.0000000000,234.0000000000,,False
BereHayyTR,"RT ScottPresler: History will remember that American democrats chose the side of a madman, Kim Jong-un over the American People.  History w…",United States,English,2017-08-12T02:44:00,2017-08-12T02:44:00,0E-10,1.0000000000,236.0000000000,,False
BereHayyTR,"RT bfraser747: ""A lunatic w/ a nuke is publicly threatening to attack USA &amp; #JohnMcCain is criticizing POTUS for h… https://t.co/BqppcmRETV",United States,English,2017-08-12T02:44:00,2017-08-12T02:44:00,0E-10,1.0000000000,238.0000000000,,False
BereHayyTR,"RT CharlieDaniels: Morning prayer Lord the roots of evil run deep in our nation, expose them to light of your righteousness Father so they'…",United States,English,2017-08-12T02:44:00,2017-08-12T02:44:00,0E-10,1.0000000000,240.0000000000,,False
BereHayyTR,RT TomFitton: How is it the FBI allowed Mr. Comey to walk out the door with sensitive documents about President Tr… https://t.co/lUYwk0e5OB,United States,English,2017-08-12T02:44:00,2017-08-12T02:44:00,0E-10,1.0000000000,239.0000000000,,False
BereHayyTR,"RT dbongino: Holy moses, is there any limit to the height of the stupid-ceiling on the Left? https://t.co/yywS0rMrlN",United States,English,2017-08-12T02:44:00,2017-08-12T02:44:00,0E-10,1.0000000000,235.0000000000,,False
