author_id,content,region,language,publish_date,harvested_date,following,followers,updates,post_type,retweet
boeing_is_back,День Победы. Две политические ошибки исправлены.   http://t.co/s9OFe7SUKt,Malaysia,Russian,2015-05-12 07:48:00,2015-05-12 07:48:00,1683,6701,725,,0
boeing_is_back,Выборы в Польше. Интрига накаляется   http://t.co/3FK0B0rKwz,Malaysia,Russian,2015-05-12 11:08:00,2015-05-12 11:08:00,1683,6702,726,,0
boeing_is_back,"О том, что Россия должна в 2015 году воевать со странами НАТО, предупреждены все, кроме русских! http://t.co/gSaHCd82kv",Malaysia,Russian,2015-05-21 09:12:00,2015-05-21 09:12:00,1932,6694,727,,0
boeing_is_back,Как нас надувают. Стоунхендж построен в 1954 году. Продолжение http://t.co/ELZE9xYv1u,Malaysia,Russian,2015-05-21 12:10:00,2015-05-21 12:10:00,1932,6694,728,,0
boeing_is_back,"Сегодня он играет джаз, а завтра Родину продаст http://t.co/Za8VJZGiGd",Malaysia,Russian,2015-05-21 16:59:00,2015-05-21 16:59:00,1932,6696,729,,0
boeing_is_back,Европа спасет советские памятники на Украине http://t.co/8Mziilznpf,Malaysia,Russian,2015-05-22 09:08:00,2015-05-22 09:08:00,1931,6694,730,,0
boeing_is_back,"Что лучше, быть верующим или быть ведающим? http://t.co/UOUKbMFj7T",Malaysia,Russian,2015-05-22 12:56:00,2015-05-22 12:57:00,1931,6693,731,,0
boeing_is_back,Порошенко защищает коррупционеров когтями и зубами http://t.co/0CywxYkOrL,Malaysia,Russian,2015-05-22 14:52:00,2015-05-22 14:52:00,1931,6693,732,,0
boeing_is_back,Об одном достоверном пророчестве http://t.co/L9pQDtN3oV,Malaysia,Russian,2015-05-22 17:13:00,2015-05-22 17:13:00,1932,6694,733,,0
boeing_is_back,О Джеке-Потрошителе. А был ли заговор? http://t.co/AHa5tPvPRH,Malaysia,Russian,2015-05-23 09:37:00,2015-05-23 09:37:00,1932,6691,734,,0
boeing_is_back,Секретный шаттл Пентагона http://t.co/QuXYqPxBoi,Malaysia,Russian,2015-05-23 11:52:00,2015-05-23 11:53:00,1932,6691,735,,0
boeing_is_back,понаехавшие http://t.co/ZS2UDmsnbs,Malaysia,Russian,2015-05-23 14:10:00,2015-05-23 14:10:00,1932,6691,736,,0
boeing_is_back,В его смерти прошу винить... http://t.co/loL8OnONeK,Malaysia,Russian,2015-05-23 16:27:00,2015-05-23 16:27:00,1932,6690,737,,0
boeing_is_back,Видео: нездоровая передача о здоровье http://t.co/7QjcyW2Q0z,Malaysia,Ukrainian,2015-05-24 07:00:00,2015-05-24 07:00:00,1932,6690,738,,0
boeing_is_back,Как быстро поднять деньги? http://t.co/gDHIcRruCA,Malaysia,Russian,2015-05-24 09:14:00,2015-05-24 09:14:00,1932,6690,739,,0
boeing_is_back,Тайна рейса 914 http://t.co/7lir9rX7AA,Malaysia,Bulgarian,2015-05-24 13:15:00,2015-05-24 13:15:00,1932,6689,740,,0
boeing_is_back,"«Русский проект», за который убивают! http://t.co/2kU3d3Pe74",Malaysia,Russian,2015-05-24 17:13:00,2015-05-24 17:13:00,1932,6689,741,,0
boeing_is_back,Россия – родина жемчуга http://t.co/l30mxphCmA,Malaysia,Russian,2015-05-25 07:13:00,2015-05-25 07:13:00,1932,6688,742,,0
boeing_is_back,Уик-энд в Освенциме http://t.co/B9WQ5xL9fJ,Malaysia,Russian,2015-05-25 10:43:00,2015-05-25 10:43:00,1932,6689,743,,0
boeing_is_back,Очередная критика России Евросоюзом http://t.co/WB8r6sWloa,Malaysia,Russian,2015-05-25 16:16:00,2015-05-25 16:16:00,1932,6689,744,,0
boeing_is_back,Бригада имени Мозгового http://t.co/RqTzS30gP6,Malaysia,Russian,2015-05-26 08:22:00,2015-05-26 08:22:00,1932,6689,745,,0
boeing_is_back,Вот и ответ на вопрос: почему нееврей не может быть министром Российской Культуры?! http://t.co/JGx1J295iG,Malaysia,Russian,2015-05-26 10:53:00,2015-05-26 10:53:00,1932,6689,746,,0
boeing_is_back,Теракт в Нью-Йорке. 1920 г. http://t.co/RcUF6PJ7Ze,Malaysia,Ukrainian,2015-05-26 13:07:00,2015-05-26 13:07:00,1932,6687,747,,0
boeing_is_back,За что убили кролика Алана? http://t.co/orWzTHBEAh,Malaysia,Uzbek,2015-05-26 16:08:00,2015-05-26 16:08:00,1932,6686,748,,0
boeing_is_back,О русском народе с еврейской головой http://t.co/6Q2FY6HePH,Malaysia,Russian,2015-05-27 10:05:00,2015-05-27 10:05:00,1931,6685,749,,0
boeing_is_back,Тайна харьковского террориста http://t.co/Xit4T2Nolq,Malaysia,Ukrainian,2015-05-27 11:30:00,2015-05-27 11:30:00,1931,6685,750,,0
boeing_is_back,Новый майдан под управлением США. На этот раз футбольный. http://t.co/HrSylisNDD,Malaysia,Russian,2015-05-27 12:51:00,2015-05-27 12:51:00,1931,6685,751,,0
boeing_is_back,Заговор против детей http://t.co/SUKwVUvKg3,Malaysia,Russian,2015-05-27 14:15:00,2015-05-27 14:16:00,1931,6684,752,,0
boeing_is_back,«Бонни и Клайд» из Калифонии — Бирма и Томас Уайт http://t.co/52aWW64B2Z,Malaysia,Uzbek,2015-05-27 17:04:00,2015-05-27 17:04:00,1931,6682,753,,0
boeing_is_back,Непростой фильм: Робот по имени Чаппи http://t.co/A8CHLkIaFi,Malaysia,Russian,2015-05-28 08:43:00,2015-05-28 08:43:00,1930,6680,754,,0
boeing_is_back,Автосинхронизация существует! http://t.co/7ckeLNYtOx,Malaysia,Russian,2015-05-28 11:31:00,2015-05-28 11:31:00,1930,6682,755,,0
boeing_is_back,Видео: чем действительно опасна Украина? http://t.co/yfMAwSg9wx,Malaysia,Russian,2015-05-28 13:25:00,2015-05-28 13:25:00,1930,6682,756,,0
boeing_is_back,Тупой и ещё тупее. http://t.co/iMRAXrOEnW,Malaysia,Russian,2015-05-28 17:36:00,2015-05-28 17:36:00,1930,6681,757,,0
boeing_is_back,Как легко сочиняется история http://t.co/8Dm66V7XvN,Malaysia,Russian,2015-05-29 07:09:00,2015-05-29 07:09:00,1929,6679,758,,0
boeing_is_back,"Украинцам не везёт с символами, над ними просто издеваются! http://t.co/L7D5BCbSlq",Malaysia,Russian,2015-05-29 10:24:00,2015-05-29 10:24:00,1930,6679,759,,0
boeing_is_back,Для чего нужна война? http://t.co/HRdddMunlO,Malaysia,Russian,2015-05-29 16:46:00,2015-05-29 16:46:00,1930,6679,760,,0
boeing_is_back,Любой разговор с либералами надо начинать с вопроса про Ливию http://t.co/rj71EPa8Mq,Malaysia,Russian,2015-05-30 09:22:00,2015-05-30 09:22:00,1931,6678,761,,0
boeing_is_back,Золотые рубли http://t.co/LBxKkYyiED,Malaysia,Russian,2015-05-30 10:30:00,2015-05-30 10:31:00,1931,6679,762,,0
boeing_is_back,"Евровидение, как инструмент массового зомбирования http://t.co/8MBsenvVxs",Malaysia,Russian,2015-05-30 14:34:00,2015-05-30 14:34:00,1932,6681,763,,0
boeing_is_back,Он защищал Русский мир и был убит жидами! http://t.co/PJQAFHADTl,Malaysia,Uzbek,2015-05-30 17:59:00,2015-05-30 17:59:00,1932,6682,764,,0
boeing_is_back,Курта Кобейна убила гитара для левшей http://t.co/9g8yAUQUsH,Malaysia,Uzbek,2015-05-31 08:43:00,2015-05-31 08:44:00,1932,6682,765,,0
boeing_is_back,Заговор еды: почему россияне верят в опасные дрожжи и ГМО-убийцы http://t.co/6IcvGjsZdX,Malaysia,Russian,2015-05-31 09:12:00,2015-05-31 09:12:00,1932,6682,766,,0
boeing_is_back,Мультфильмы управляют человечеством http://t.co/hdkIgzGulm,Malaysia,Russian,2015-05-31 10:20:00,2015-05-31 10:20:00,1932,6682,767,,0
boeing_is_back,Зона-51. Самая загадочная база в мире http://t.co/8MbPYjlYVA,Malaysia,Russian,2015-05-31 14:23:00,2015-05-31 14:23:00,1931,6683,768,,0
boeing_is_back,Белочки атакуют! http://t.co/9RebATJkbW,Malaysia,Macedonian,2015-05-31 16:01:00,2015-05-31 16:01:00,1931,6683,769,,0
boeing_is_back,«Лорел каньон» — странная история и зарождения поколения хиппи http://t.co/5QMnGa12qE,Malaysia,Bulgarian,2015-06-01 04:13:00,2015-06-01 04:13:00,1931,6683,770,,0
boeing_is_back,Как производители манипулируют потребителями? http://t.co/b9nimOOTnY,Malaysia,Bulgarian,2015-06-01 08:17:00,2015-06-01 08:17:00,1931,6683,771,,0
boeing_is_back,Суть современной красоты http://t.co/vk7dBW54kq,Malaysia,Russian,2015-06-01 13:02:00,2015-06-01 13:02:00,1931,6682,772,,0
boeing_is_back,Разоблачая разоблачителей MH17 http://t.co/Yo1Kp7vBuj,Malaysia,Russian,2015-06-01 16:24:00,2015-06-01 16:24:00,1931,6682,774,,0
boeing_is_back,Экзотические токсины http://t.co/WfKOoEMt7d,Malaysia,Russian,2015-06-02 02:21:00,2015-06-02 02:22:00,1931,6680,775,,0
boeing_is_back,Микроскопические инопланетные - капсулы-зонды http://t.co/t7Lejs0gRN,Malaysia,Russian,2015-06-02 09:37:00,2015-06-02 09:38:00,1931,6679,776,,0
boeing_is_back,Видео: климатическое оружие http://t.co/VUjLBwpvSo,Malaysia,Russian,2015-06-02 10:29:00,2015-06-02 10:29:00,1931,6679,777,,0
boeing_is_back,Что хотел сказать Фримен? http://t.co/0qS2o6pYtt,Malaysia,Russian,2015-06-02 13:16:00,2015-06-02 13:16:00,1931,6680,778,,0
boeing_is_back,Головной боли псто http://t.co/HSX3iwFKbw,Malaysia,Russian,2015-06-02 18:51:00,2015-06-02 18:51:00,1931,6682,779,,0
boeing_is_back,"Всё, что вы хотели знать о теории заговора 9/11 за 5 минут http://t.co/OmXH9atm06",Malaysia,Russian,2015-06-03 08:13:00,2015-06-03 08:13:00,1931,6681,780,,0
boeing_is_back,"Украина - это страна-убийца, уничтожившая малайзийский Боинг год назад http://t.co/7pWTpqkALd",Malaysia,Russian,2015-06-03 08:49:00,2015-06-03 08:49:00,1931,6681,781,,0
boeing_is_back,"10 тайных сообществ, которые до сих пор влияют на мир http://t.co/saO5CH8C53",Malaysia,Russian,2015-06-03 11:12:00,2015-06-03 11:12:00,1931,6681,782,,0
boeing_is_back,Сегодня умрет 165 тыс человек http://t.co/87K9XpaoPQ,Malaysia,Russian,2015-06-03 13:42:00,2015-06-03 13:42:00,1931,6681,783,,0
boeing_is_back,Преступление без наказания http://t.co/POEkFQjQql,Malaysia,Bulgarian,2015-06-03 15:14:00,2015-06-03 15:14:00,1931,6682,784,,0
boeing_is_back,"Доклад «Алмаз-Антея» о сбитом ""Боинге"" http://t.co/qob5xA479E",Malaysia,Uzbek,2015-06-03 19:15:00,2015-06-03 19:16:00,1931,6682,785,,0
boeing_is_back,"Ты одессит, Мишико, а это значит... http://t.co/8ewFdR4JcY",Malaysia,Russian,2015-06-04 10:30:00,2015-06-04 10:30:00,1931,6679,786,,0
boeing_is_back,"Предположим, что вам поставлена задача сбить над Донбассом Боинг http://t.co/u1M2UlvXzP",Malaysia,Russian,2015-06-04 12:33:00,2015-06-04 12:34:00,1931,6679,787,,0
boeing_is_back,Содомия. Почему сегодня столько внимания уделяется гомосексуалистам? http://t.co/1AEbyYLsGD,Malaysia,Russian,2015-06-04 14:00:00,2015-06-04 14:00:00,1931,6679,788,,0
boeing_is_back,Коронованная наркомафия http://t.co/k4dAJSgCBh,Malaysia,Ukrainian,2015-06-04 15:26:00,2015-06-04 15:26:00,1931,6679,789,,0
boeing_is_back,В начале июня 1988 и 1989 ... http://t.co/jNCrcEr2zk,Malaysia,Ukrainian,2015-06-04 17:47:00,2015-06-04 17:47:00,1932,6679,790,,0
boeing_is_back,На грани фантастики http://t.co/WrTP0lTlIN,Malaysia,Russian,2015-06-05 07:26:00,2015-06-05 07:27:00,1932,6679,791,,0
boeing_is_back,Заговор HRов http://t.co/4t5CytZ76O,Malaysia,Ukrainian,2015-06-05 10:39:00,2015-06-05 10:39:00,1932,6680,792,,0
boeing_is_back,Universe vs Mankind http://t.co/fabFgEf7DJ,Malaysia,English,2015-06-05 12:02:00,2015-06-05 12:02:00,1932,6680,793,,0
boeing_is_back,"может Воронеж разбомбить? опыт есть, а лучше Москву http://t.co/HWPqfVaFvM",Malaysia,Russian,2015-06-05 15:50:00,2015-06-05 15:50:00,1932,6680,794,,0
boeing_is_back,Посмотрел стриптиз и стал импотентом http://t.co/oL3B7NH3ZO,Malaysia,Russian,2015-06-06 07:08:00,2015-06-06 07:08:00,1932,6680,795,,0
boeing_is_back,Каждый боится подумать об этом http://t.co/ec6lplGJhG,Malaysia,Russian,2015-06-06 12:32:00,2015-06-06 12:32:00,1931,6679,796,,0
boeing_is_back,Провокация на религиозной почве http://t.co/SeEIcByjrT,Malaysia,Russian,2015-06-06 16:19:00,2015-06-06 16:19:00,1931,6680,797,,0
boeing_is_back,Спрятано на видном месте http://t.co/3Ob3h47gky,Malaysia,Russian,2015-06-06 19:57:00,2015-06-06 19:57:00,1931,6656,798,,0
boeing_is_back,Патриотизм и его подмена http://t.co/crtdM30kTY,Malaysia,Russian,2015-06-07 06:06:00,2015-06-07 06:06:00,1931,6656,799,,0
boeing_is_back,Микрофон в батарейке! http://t.co/UPBWKBXyGP,Malaysia,Uzbek,2015-06-07 09:44:00,2015-06-07 09:44:00,1931,6655,800,,0
boeing_is_back,О связи Барби с наркобаронами http://t.co/g3bWH2ihFV,Malaysia,Uzbek,2015-06-07 12:35:00,2015-06-07 12:37:00,1931,6655,801,,0
boeing_is_back,Гей-движения- разрушение общества http://t.co/rxJuS18GZZ,Malaysia,Bulgarian,2015-06-07 16:18:00,2015-06-07 16:18:00,1931,6655,802,,0
boeing_is_back,Принцесса и туннель http://t.co/7rWJtm3ViO,Malaysia,Russian,2015-06-07 19:17:00,2015-06-07 19:17:00,1931,6657,803,,0
boeing_is_back,Прогнозы генерала ГРУ Канчукова: «Приднестровье-2» http://t.co/lnPKtIArVb,Malaysia,Russian,2015-06-08 15:42:00,2015-06-08 15:43:00,1930,6656,804,,0
boeing_is_back,Украинские асы из Уфы http://t.co/OCB4tQ5aI6,Malaysia,Macedonian,2015-06-08 17:41:00,2015-06-08 17:41:00,1930,6656,805,,0
boeing_is_back,Марат Касем: О гей-лобби в Латвии или... молчание - знак согласия!.. http://t.co/tpb2aqq83z,Malaysia,Uzbek,2015-06-09 10:45:00,2015-06-09 10:45:00,1930,6657,806,,0
boeing_is_back,24 мая - День уничтожения славянской письменности и культуры http://t.co/gP6UVb25Yh,Malaysia,Russian,2015-06-09 12:05:00,2015-06-09 12:05:00,1929,6656,807,,0
boeing_is_back,5 мифов о российском правосудии http://t.co/fslwGbPGUC,Malaysia,Russian,2015-06-09 14:49:00,2015-06-09 14:49:00,1929,6656,808,,0
boeing_is_back,В юбилейные для этого поэта даты в стране непременно происходят катаклизмы http://t.co/ctDtdEQzP2,Malaysia,Russian,2015-06-09 15:26:00,2015-06-09 15:26:00,1929,6656,809,,0
boeing_is_back,Экс-россиянин построил тайну малазийского «боинга» http://t.co/Xf7SHwaMFX,Malaysia,Russian,2015-06-09 16:53:00,2015-06-09 16:53:00,1929,6656,810,,0
boeing_is_back,"Кто ""рисует""  на  полях  Адыгеи? http://t.co/hyGjCQBaCK",Malaysia,Russian,2015-06-10 09:20:00,2015-06-10 09:20:00,1929,6658,811,,0
boeing_is_back,Все против Петра Алексеевича http://t.co/k6kBttsKpI,Malaysia,Russian,2015-06-10 13:24:00,2015-06-10 13:25:00,1929,6658,812,,0
boeing_is_back,Совпадение? http://t.co/sXV7sPEZz4,Malaysia,Russian,2015-06-10 16:16:00,2015-06-10 16:17:00,1929,6658,813,,0
boeing_is_back,Чего боится агент «Магнолия?» http://t.co/DQhktPtnJ5,Malaysia,Russian,2015-06-11 13:20:00,2015-06-11 13:20:00,1929,6658,814,,0
boeing_is_back,ПРЕДАТЕЛИ: Владимир Резун http://t.co/C3ObPtcCeH,Malaysia,Bulgarian,2015-06-11 15:18:00,2015-06-11 15:18:00,1929,6658,815,,0
boeing_is_back,Калининград в опасности! http://t.co/PcUuTlnnHD,Malaysia,Serbian,2015-06-11 19:01:00,2015-06-11 19:01:00,1929,6658,816,,0
boeing_is_back,Элвис Пресли: убийство или побег в неизвестность? http://t.co/RAaX0kauVA,Malaysia,Russian,2015-06-12 11:39:00,2015-06-12 11:39:00,1929,6660,817,,0
boeing_is_back,Христианское троеперстие — ради чего были убиты миллионы славян http://t.co/pLN92fD6LM,Malaysia,Russian,2015-06-12 13:02:00,2015-06-12 13:02:00,1929,6661,818,,0
boeing_is_back,"О причинах происходивших в царской России ""жидовских погромов"" http://t.co/9aieQmvwrt",Malaysia,Russian,2015-06-12 13:54:00,2015-06-12 13:54:00,1929,6661,819,,0
boeing_is_back,Тайна рейса 914 http://t.co/PlXi4fyLWz,Malaysia,Bulgarian,2015-06-12 14:26:00,2015-06-12 14:26:00,1929,6661,820,,0
boeing_is_back,Откуда берётся ложь про 100 миллионов невинно убиенных http://t.co/kxGXkEvXUP,Malaysia,Russian,2015-06-12 17:21:00,2015-06-12 17:23:00,1929,6661,821,,0
boeing_is_back,Фрактальная Украина http://t.co/5wUnlt5MxN,Malaysia,Russian,2015-06-12 18:15:00,2015-06-12 18:15:00,1929,6660,822,,0
boeing_is_back,Погибшие астронавты Чалленджера 1986 года живы!!! http://t.co/LYLkpPI0sm,Malaysia,Russian,2015-06-13 07:56:00,2015-06-13 07:56:00,1929,6660,823,,0
boeing_is_back,Мост самоубийц или мост ангел-хранитель http://t.co/tZn8FhB3Rg,Malaysia,Russian,2015-06-13 09:49:00,2015-06-13 09:49:00,1929,6660,824,,0
boeing_is_back,Людей дурят! http://t.co/QvHH530nal,Malaysia,Russian,2015-06-13 11:32:00,2015-06-13 11:55:00,1929,6660,825,,0
boeing_is_back,А каким браузером пользуешься ты? http://t.co/v7dPYg8qEq,Malaysia,Russian,2015-06-13 16:19:00,2015-06-13 16:19:00,1929,6660,826,,0
boeing_is_back,"Осторожно, идёт информационная война! http://t.co/bNsbkwiXuJ",Malaysia,Russian,2015-06-14 07:53:00,2015-06-14 07:53:00,1929,6660,827,,0
boeing_is_back,"Факты о гравитации, которые Вы не знаете http://t.co/5dYAzRbkOr",Malaysia,Bulgarian,2015-06-14 09:48:00,2015-06-14 09:48:00,1929,6661,828,,0
boeing_is_back,Заповедь иудеям http://t.co/3aWhe6UIOd,Malaysia,Russian,2015-06-14 12:17:00,2015-06-14 12:17:00,1929,6661,829,,0
boeing_is_back,Ветер против Аверкина http://t.co/3DbHuYoeyD,Malaysia,Macedonian,2015-06-14 13:24:00,2015-06-14 13:24:00,1929,6661,830,,0
boeing_is_back,Секретный ингридиент пива http://t.co/nckwxodvNS,Malaysia,Russian,2015-06-14 16:20:00,2015-06-14 16:20:00,1929,6661,831,,0
boeing_is_back,Самый настоящий заговор http://t.co/j6CGkq1tgG,Malaysia,Russian,2015-06-14 19:27:00,2015-06-14 19:27:00,1929,6662,832,,0
boeing_is_back,Когда власть занимается дебилизацией населения — жди беды! http://t.co/0nohkAVYY2,Malaysia,Russian,2015-06-15 09:59:00,2015-06-15 09:59:00,1929,6661,833,,0
boeing_is_back,Странный побег Диллинджера http://t.co/z98otNUR4e,Malaysia,Russian,2015-06-15 15:31:00,2015-06-15 15:32:00,1929,6663,834,,0
boeing_is_back,Беназир Бхутто убита...лазерным лучом? http://t.co/kjlQPkpZoM,Malaysia,Russian,2015-06-15 16:35:00,2015-06-15 16:36:00,1929,6663,835,,0
boeing_is_back,Заговор господина Н. http://t.co/FxDyLGc7H8,Malaysia,Serbian,2015-06-16 11:47:00,2015-06-16 11:47:00,1930,6665,836,,0
boeing_is_back,Китайские зондеркоманды обучат белорусские эффективно подавлять народные волнения? http://t.co/J5TkKWOmaz,Malaysia,Russian,2015-06-16 16:54:00,2015-06-16 16:54:00,1930,6666,837,,0
boeing_is_back,Тема Боинга не раскрыта http://t.co/SYAsneGihH,Malaysia,Ukrainian,2015-06-16 17:24:00,2015-06-16 17:24:00,1930,6666,838,,0
boeing_is_back,"Евреям, да и неевреям тоже, пора повзрослеть и перестать верить в религиозные сказки! http://t.co/XLmDSyAaqd",Malaysia,Russian,2015-06-16 19:41:00,2015-06-16 19:41:00,1930,6666,839,,0
boeing_is_back,Заговор Роскосмоса http://t.co/2ip3Ana1rV,Malaysia,Russian,2015-06-17 05:34:00,2015-06-17 05:34:00,1930,6665,840,,0
boeing_is_back,Есть ли у голов на острове Пасхи ноги ? http://t.co/FOlB03B0P5,Malaysia,Russian,2015-06-17 09:28:00,2015-06-17 09:28:00,1930,6665,841,,0
boeing_is_back,Обратная сторона фриланса http://t.co/wZ1NvyMo4h,Malaysia,Russian,2015-06-17 12:17:00,2015-06-17 12:18:00,1930,6665,842,,0
boeing_is_back,Этот ваш ТОП http://t.co/XnFYtKvmKF,Malaysia,Hebrew,2015-06-17 14:13:00,2015-06-17 14:13:00,1930,6666,843,,0
boeing_is_back,Кто понесет наказание: раскрыта тайна трагедии башен-близнецов http://t.co/dYguWQzxne,Malaysia,Bulgarian,2015-06-17 17:18:00,2015-06-17 17:18:00,1930,6666,844,,0
boeing_is_back,"Конгениально! Одни евреи разрушили Украину, другие евреи думают, что с нею делать дальше! http://t.co/ATWUjvjFp0",Malaysia,Russian,2015-06-18 10:15:00,2015-06-18 10:16:00,1929,6664,845,,0
boeing_is_back,25 причин сказать прививкам - нет! http://t.co/6jsXCHFIUY,Malaysia,Russian,2015-06-18 11:01:00,2015-06-18 11:01:00,1929,6664,846,,0
boeing_is_back,Пушкина убили по приказу масонов-иностранцев http://t.co/Mk01EOwkjC,Malaysia,Serbian,2015-06-18 14:24:00,2015-06-18 14:24:00,1928,6664,847,,0
boeing_is_back,Устройства Wi-Fi научились считать пешеходов http://t.co/oVrOmcGW2o,Malaysia,Russian,2015-06-18 18:51:00,2015-06-18 18:51:00,1928,6664,848,,0
boeing_is_back,П - показалось http://t.co/GilcYVNaBC,Malaysia,Russian,2015-06-19 09:35:00,2015-06-19 09:36:00,1928,6664,849,,0
boeing_is_back,Кому мешает правда о климате? http://t.co/k8Kqu2FwiK,Malaysia,Russian,2015-06-19 10:47:00,2015-06-19 10:48:00,1928,6664,850,,0
boeing_is_back,Городские легенды:Затонувший фрегат и $2-4 млн.золотом http://t.co/zfr5BxQq4P,Malaysia,Russian,2015-06-19 14:07:00,2015-06-19 14:07:00,1928,6663,851,,0
boeing_is_back,"Госплан, Карл? http://t.co/VqjLxw7r8Y",Malaysia,Russian,2015-06-20 11:09:00,2015-06-20 11:09:00,1928,6664,852,,0
boeing_is_back,СПИД - рукотворное заболевание http://t.co/qHzN09LA5z,Malaysia,Russian,2015-06-20 13:34:00,2015-06-20 13:34:00,1928,6664,853,,0
boeing_is_back,Чернобыль и Путин. Не видите связи? А зря... http://t.co/vWAQaU3LVu,Malaysia,Ukrainian,2015-06-20 16:20:00,2015-06-20 16:20:00,1928,6664,854,,0
boeing_is_back,Вот такие дела http://t.co/kJMpdrmq53,Malaysia,Russian,2015-06-21 07:11:00,2015-06-21 07:11:00,1929,6665,855,,0
boeing_is_back,"Откуда взялся ""дядя Сэм"" http://t.co/zXxzbZutf9",Malaysia,Russian,2015-06-21 10:15:00,2015-06-21 10:15:00,1929,6664,856,,0
boeing_is_back,Видео: Почему горят фасады http://t.co/3TAuZgIsyj,Malaysia,Russian,2015-06-21 12:42:00,2015-06-21 12:42:00,1929,6663,857,,0
boeing_is_back,"Телефоны, природа и лето. Выходные против Аверкина http://t.co/HmQj1LyCxm",Malaysia,Russian,2015-06-21 16:28:00,2015-06-21 16:28:00,1929,6664,858,,0
boeing_is_back,Секретная встреча в Лондоне нацелена на «отмену наличных денег» http://t.co/rebidI12On,Malaysia,Russian,2015-06-22 08:20:00,2015-06-22 08:20:00,1929,6665,859,,0
boeing_is_back,Мы поменяли в Украине власть воров на власть убийц (и педерастов)! http://t.co/mhrPVWIHm9,Malaysia,Russian,2015-06-22 09:35:00,2015-06-22 09:35:00,1929,6665,860,,0
boeing_is_back,Взломать любую почту можно с помощью простого SMS http://t.co/3Nj51d7CFr,Malaysia,Russian,2015-06-22 13:07:00,2015-06-22 13:07:00,1929,6665,861,,0
boeing_is_back,"Вот где ""собака"" зарыта (видео) http://t.co/0pMud6rbwv",Malaysia,Russian,2015-06-22 14:12:00,2015-06-22 14:12:00,1929,6665,862,,0
boeing_is_back,Про свадьбы http://t.co/QJ2aqwXuD5,Malaysia,Ukrainian,2015-06-22 16:17:00,2015-06-22 16:17:00,1929,6665,863,,0
boeing_is_back,Осторожность никогда не бывает лишней http://t.co/UeL8iHTsEO,Malaysia,Russian,2015-06-22 19:20:00,2015-06-22 19:20:00,1929,6665,864,,0
boeing_is_back,СБУ против Украины: особенности работы департамента контрразведки в сфере инфобезопасности http://t.co/O5zvT0wV1A,Malaysia,Russian,2015-06-23 09:50:00,2015-06-23 09:50:00,1928,6663,865,,0
boeing_is_back,А ему-то за что досталось? http://t.co/vE7M87tLv9,Malaysia,Ukrainian,2015-06-23 14:19:00,2015-06-23 14:21:00,1928,6663,866,,0
boeing_is_back,"Личный заговор, не иначе http://t.co/hZc4GLG0bh",Malaysia,Ukrainian,2015-06-23 15:19:00,2015-06-23 15:20:00,1928,6663,867,,0
