author_id,content,region,language,publish_date,harvested_date,following,followers,updates,post_type,retweet
briigevastr,Liberals MOCK Eric Bolling Over His Son’s Death  https://t.co/UEw13pgAPi,Unknown,English,2017-09-10 18:37:00,2017-09-10 18:38:00,4815,1211,573,,0
briigevastr,Crazed Liberals Are TRIGGERED by Melania’s Comments on Hurricane Irma  https://t.co/RO7UxOBQXY,Unknown,English,2017-09-10 18:37:00,2017-09-10 18:37:00,4815,1211,572,,0
briigevastr,BREAKING VIDEO: Downtown Miami is Underwater!  https://t.co/aYCshmBP6R,Unknown,English,2017-09-10 21:17:00,2017-09-10 21:17:00,4814,1217,575,,0
briigevastr,VIDEO: Incredible Footage of Dry Ocean Floor After Hurricane Irma Hits Bahamas  https://t.co/5pOKLZDSMh,Unknown,English,2017-09-10 21:17:00,2017-09-10 21:17:00,4815,1217,574,,0
briigevastr,Rand Paul Intros Hurricane Relief Amendment That Will Have You Cheering  https://t.co/gbLCce4DHD,Unknown,English,2017-09-10 21:22:00,2017-09-10 21:22:00,4814,1217,576,,0
briigevastr,LOL: Hillary FINALLY Says Something that Has America CHEERING!  https://t.co/MQfwhACNXh,Unknown,English,2017-09-10 21:26:00,2017-09-10 21:27:00,4814,1217,578,,0
briigevastr,Liberals Cheer Stephen Colbert Mocking the Holocaust  https://t.co/KyF5E7IZ2y,Unknown,English,2017-09-10 21:26:00,2017-09-10 21:27:00,4814,1217,579,,0
briigevastr,BREAKING: Group of Ft. Lauderdale Looters Caught on Camera!  https://t.co/7l8Oedqggu,Unknown,English,2017-09-10 21:26:00,2017-09-10 21:27:00,4814,1217,580,,0
briigevastr,BREAKING: Ft Lauderdale Looters Caught on Video ARRESTED!  https://t.co/oqIhL6H19u,Unknown,English,2017-09-10 21:26:00,2017-09-10 21:27:00,4814,1217,577,,0
briigevastr,"This Girl Says She Was Being Bullied, But Was She The Real Bully Here?  https://t.co/vSamqc6Jhy",Unknown,English,2017-09-10 21:42:00,2017-09-10 21:43:00,4814,1218,581,,0
briigevastr,"NEW POLL Shows HUGE Trump Support from Seniors, 99.2% Know Media is Against Him  https://t.co/SJdnVBvu1C",Unknown,English,2017-09-10 21:42:00,2017-09-10 21:43:00,4814,1218,582,,0
briigevastr,He Put Steel Wool In A Funnel. The Result Was A 60-Year-Old Life Hack That Works!  https://t.co/WitQvHgDoj,Unknown,English,2017-09-10 21:47:00,2017-09-10 21:47:00,4814,1219,584,,0
briigevastr,"He May Have Cancer, But That Didn't Stop Him From Proposing To His Kids' Mother  https://t.co/FhDM6SDY5V",Unknown,English,2017-09-10 21:47:00,2017-09-10 21:47:00,4814,1219,583,,0
briigevastr,"When This Waterfall Sucks You In, You Better Hope It Spits You Out On The Other Side  https://t.co/wfm04a8GEg",Unknown,English,2017-09-10 21:52:00,2017-09-10 21:52:00,4814,1220,585,,0
briigevastr,"This Sounds Crazy, But You Have Pigeons To Thank For The Screens You Use Every Day  https://t.co/xS5kF28wui",Unknown,English,2017-09-10 21:52:00,2017-09-10 21:52:00,4814,1220,586,,0
briigevastr,TRUTH OR LIE? Emma Thompson Claims Trump Asked Her Out on a Date  https://t.co/JDIXzjQ66j,Unknown,English,2017-09-10 23:13:00,2017-09-10 23:13:00,4813,1226,587,,0
briigevastr,Volunteers in Georgia Go All Out to Help Victims of Hurricane Irma  https://t.co/QXTcWCXtNt,Unknown,English,2017-09-10 23:13:00,2017-09-10 23:13:00,4813,1226,588,,0
briigevastr,JUSTICE: Jail Time For Liberals Attacking Historic Monuments  https://t.co/LVt3OnMDpo,Unknown,English,2017-09-11 01:51:00,2017-09-11 01:52:00,4813,1224,591,,0
briigevastr,INSANITY! DREAMers Are Now DEMANDING Amnesty for Their Parents!  https://t.co/NnfHPPc5yU,Unknown,English,2017-09-11 01:51:00,2017-09-11 01:51:00,4813,1224,590,,0
briigevastr,"LOL: Hillary Yelling, Near Tears as She Recalls Her Election Loss  https://t.co/VnCKFczBfB",Unknown,English,2017-09-11 01:51:00,2017-09-11 01:51:00,4813,1224,589,,0
briigevastr,"Bill Nye Ties Hurricanes to Climate Change, Gets Shut Down by a REAL Scientist  https://t.co/O0bKvDDmJ5",Unknown,English,2017-09-11 01:56:00,2017-09-11 01:56:00,4813,1224,592,,0
briigevastr,BREAKING: SWAT IN STANDOFF WITH FLORIDA LOOTERS  https://t.co/YRrLrTCQ2T,Unknown,English,2017-09-11 02:07:00,2017-09-11 02:07:00,4813,1225,593,,0
briigevastr,NFL Legend Randy Moss SLAMS Kaepernick &amp; Kneelers as ‘LOSERS’  https://t.co/Tb3cIFxO2V,Unknown,English,2017-09-11 02:12:00,2017-09-11 02:12:00,4813,1226,595,,0
briigevastr,BREAKING VIDEO: Irma’s Powerful Winds SNAPPING Construction Cranes in Miami  https://t.co/oLzsYkFwpD,Unknown,English,2017-09-11 02:12:00,2017-09-11 02:12:00,4813,1226,594,,0
briigevastr,VIDEO: Amazing Hurricane Irma Rescue by Sheriff’s Marine Units  https://t.co/S57oj2Fj2q,Unknown,English,2017-09-11 14:43:00,2017-09-11 14:43:00,4813,1243,598,,0
briigevastr,Stunning Aerial Footage Shows North Korea’s Capital Completely Deserted  https://t.co/biKKooq2KQ,Unknown,English,2017-09-11 14:43:00,2017-09-11 14:43:00,4813,1243,597,,0
briigevastr,"BREAKING: He Sat For The Anthem, AND He Was Exposed As A Liar!  https://t.co/CX9O0fDV5A",Unknown,English,2017-09-11 14:52:00,2017-09-11 14:52:00,4813,1244,605,,0
briigevastr,OOPS! Hillary Bought an Extra House Pre-Election for Her Future “White House Staff”  https://t.co/wKycFGt7Mh,Unknown,English,2017-09-11 14:52:00,2017-09-11 14:52:00,4813,1244,603,,0
briigevastr,BREAKING: Denmark SUSPENDS Taking in Refugees!  https://t.co/3mEmsdHEx4,Unknown,English,2017-09-11 14:52:00,2017-09-11 14:52:00,4813,1244,604,,0
briigevastr,"IT’S OFFICIAL, Kaepernick is DONE!  https://t.co/UdGtjNBIAy",Unknown,English,2017-09-11 14:52:00,2017-09-11 14:52:00,4813,1244,599,,0
briigevastr,"BREAKING: Mccain Sides with Gore, Dems on ‘Climate Change’ Agenda  https://t.co/khEWrHmvng",Unknown,English,2017-09-11 14:52:00,2017-09-11 14:52:00,4813,1244,606,,0
briigevastr,BREAKING: Bannon Reveals Trump’s Biggest SWAMP ENEMY  https://t.co/z7fTNw8Fvu,Unknown,English,2017-09-11 14:52:00,2017-09-11 14:52:00,4813,1244,601,,0
briigevastr,Miami Police Dept. Place LOOTERS on BLAST in this HILARIOUS Tweet!  https://t.co/T5I8FcWAG2,Unknown,English,2017-09-11 14:52:00,2017-09-11 14:53:00,4813,1244,602,,0
briigevastr,BUSTED! 60 Minutes Was Just Caught Trying to Alter Bannon’s Appearance!  https://t.co/bCSORL0hOe,Unknown,English,2017-09-11 14:52:00,2017-09-11 14:52:00,4813,1244,600,,0
briigevastr,VIDEO: Bannon Links ’60 Minutes’ to the KKK and Charlie Rose LOSES IT!  https://t.co/LOsXpd0QEl,Unknown,English,2017-09-11 14:57:00,2017-09-11 14:57:00,4813,1244,611,,0
briigevastr,Hey Liberals! THIS is Why Irma Got So Strong and It’s NOT Global Warming  https://t.co/yrFV2QT7qs,Unknown,English,2017-09-11 14:57:00,2017-09-11 14:57:00,4813,1244,608,,0
briigevastr,LOL: Bannon Says Hillary is “NOT VERY BRIGHT”  https://t.co/bk9EscP7cQ,Unknown,English,2017-09-11 14:57:00,2017-09-11 14:58:00,4813,1244,610,,0
briigevastr,Christians Provide More Hurricane Aid Than FEMA Does  https://t.co/ZW9DiF0yC6,Unknown,English,2017-09-11 14:57:00,2017-09-11 14:57:00,4813,1244,612,,0
briigevastr,Watch This Florida Deputy Brave Hurricane Irma to Save American Flag  https://t.co/WZtonOiTMs,Unknown,English,2017-09-11 14:57:00,2017-09-11 14:57:00,4813,1244,609,,0
briigevastr,Jeff Sessions Considers LIE DETECTOR TESTS to Catch WH Leakers  https://t.co/Fd7V18F5mi,Unknown,English,2017-09-11 14:57:00,2017-09-11 14:57:00,4813,1244,607,,0
briigevastr,Leftists Continue to Attack and Mock Eric Bolling After His Son’s Death  https://t.co/UoRUmukYDa,Unknown,English,2017-09-11 15:02:00,2017-09-11 15:02:00,4813,1244,613,,0
briigevastr,Compilation of Disgraceful Hurricane Irma Looters is Going Viral!  https://t.co/THFLuZHoBX,Unknown,English,2017-09-11 15:07:00,2017-09-11 15:07:00,4813,1244,615,,0
briigevastr,LOL : James Woods Offers Briliant Advice on Avoiding Hurricane Looters  https://t.co/SiK8V7k4yS,Unknown,English,2017-09-11 15:07:00,2017-09-11 15:07:00,4813,1244,614,,0
briigevastr,VIDEO Proves Trump Was Right. Look Who DID Celebrate 9/11 Attacks!  https://t.co/OzpdKvSFR3,Unknown,English,2017-09-11 15:27:00,2017-09-11 15:27:00,4813,1243,616,,0
briigevastr,"After SLAMMING Christians, Feinstein Gets a Brutal PAYBACK  https://t.co/1Wsp4fhnCt",Unknown,Norwegian,2017-09-11 15:48:00,2017-09-11 15:48:00,4813,1244,619,,0
briigevastr,Rare Picture of Trump Walking Through Ruins of World Trade Center  https://t.co/m6uFv9147e,Unknown,English,2017-09-11 15:48:00,2017-09-11 15:48:00,4813,1244,618,,0
briigevastr,DELUSIONAL: Traitor McCain Wants to Be Remembered as a Hero  https://t.co/7BA4RXmb9N,Unknown,English,2017-09-11 15:48:00,2017-09-11 15:49:00,4813,1244,617,,0
briigevastr,Pope Declares People Have ‘Moral Responsibility’ to Believe in Climate Change  https://t.co/3daD228ykH,Unknown,English,2017-09-11 19:03:00,2017-09-11 19:03:00,4813,1252,620,,0
briigevastr,Hillary Doubles Down on her ‘Basket of Deplorables’ Comment  https://t.co/kUiXNkztXX,Unknown,English,2017-09-11 19:03:00,2017-09-11 19:03:00,4813,1252,621,,0
briigevastr,"Oh, You Want To Shut The Refrigerator? Not On This Cat's Watch.  https://t.co/PUEFLpc8hK",Unknown,English,2017-09-11 19:13:00,2017-09-11 19:13:00,4813,1252,623,,0
briigevastr,'What Are You Doin?' Adorable Bird Brothers Strike Up The Cutest Conversation Ever  https://t.co/uCo83usKOW,Unknown,English,2017-09-11 19:13:00,2017-09-11 19:14:00,4813,1252,625,,0
briigevastr,She Found Her Wedding Ring After 11 Years...In The Last Place You'd Want To Find It  https://t.co/gUbM0f8Z8o,Unknown,English,2017-09-11 19:18:00,2017-09-11 19:18:00,4813,1252,627,,0
briigevastr,He Thought He'd Be Tough And Pick A Fight. Then He Realized Who He Was Messing With  https://t.co/P0gRuf18Qd,Unknown,English,2017-09-11 19:18:00,2017-09-11 19:18:00,4813,1252,626,,0
briigevastr,Kind Stranger Gives Up His Comfort To Help A Heartbroken Daughter In need  https://t.co/5K9B3uLhTu,Unknown,English,2017-09-11 19:22:00,2017-09-11 19:22:00,4813,1253,628,,0
briigevastr,This Gross Retro Recipe Needs To Go Straight Back To Hell Where It Belongs  https://t.co/XVPNEk8nLk,Unknown,English,2017-09-11 19:49:00,2017-09-11 19:49:00,4813,1253,629,,0
briigevastr,BREAKING: Supreme Court Rules in Favor of Trump’s Travel Ban!  https://t.co/zy4ugDe9bj,Unknown,English,2017-09-11 23:59:00,2017-09-12 00:00:00,4811,1257,634,,0
briigevastr,Liberal Amherst Students Mock 9/11 With Anti-American Banner  https://t.co/eYfH6NnkXb,Unknown,English,2017-09-11 23:59:00,2017-09-11 23:59:00,4811,1257,630,,0
briigevastr,"Trump Sending 22,000 non-FEMA employees to Florida in Massive Irma Response  https://t.co/cXmD193zIV",Unknown,English,2017-09-11 23:59:00,2017-09-11 23:59:00,4811,1257,632,,0
briigevastr,Trump’s Harvey Response Called The Best in History!  https://t.co/23IJJJa7xj,Unknown,English,2017-09-11 23:59:00,2017-09-11 23:59:00,4811,1257,633,,0
briigevastr,LOL: Amazon Forced to Take DRASTIC Measures to Sell Copies of Hillary’s Book  https://t.co/MclMjtANd7,Unknown,English,2017-09-11 23:59:00,2017-09-11 23:59:00,4811,1257,631,,0
briigevastr,Kelly FIRES BACK at Illegal Advocate Calling Him a “Disgrace to the Uniform”  https://t.co/dgv7X4w7FE,Unknown,English,2017-09-12 00:05:00,2017-09-12 00:05:00,4811,1256,640,,0
briigevastr,Bank CEO Just Exposed the HUGE Problem with Dem’s ‘Minimum Wage’ Crusade  https://t.co/WALi8A4mIo,Unknown,English,2017-09-12 00:05:00,2017-09-12 00:05:00,4811,1256,642,,0
briigevastr,BREAKING: 9 Looters Arrested in Florida “Smash and Grab” Looting Spree  https://t.co/bR0OTRYECg,Unknown,English,2017-09-12 00:05:00,2017-09-12 00:05:00,4811,1256,638,,0
briigevastr,OH BOY: Look What Mitt Romney is Planning to do in 2018  https://t.co/HRsq6zLIii,Unknown,English,2017-09-12 00:05:00,2017-09-12 00:05:00,4811,1256,636,,0
briigevastr,BREAKING! Look Which Pro-Trump Pundit Just Got Her Own Show on Fox News!  https://t.co/GSRtH1GTe5,Unknown,English,2017-09-12 00:05:00,2017-09-12 00:05:00,4811,1256,635,,0
briigevastr,BREAKING: The DOJ Just Gave Sheriff Joe Arpaio Great News About His Pardon!  https://t.co/lHtr9n7DKg,Unknown,English,2017-09-12 00:05:00,2017-09-12 00:05:00,4811,1256,638,,0
briigevastr,"BREAKING: Hillary Hits a NEW LOW, Just Attacked Putin for Being ‘White’  https://t.co/w25oTphN0A",Unknown,English,2017-09-12 00:05:00,2017-09-12 00:05:00,4811,1256,641,,0
briigevastr,Gowdy Has Had It! Goes After Dems and Fake Trump Dossier  https://t.co/a05TRHMEoN,Unknown,English,2017-09-12 00:05:00,2017-09-12 00:05:00,4811,1256,637,,0
briigevastr,Joy Behar Suggest Hurricanes Should Be Named After Climate Change Deniers  https://t.co/SMROgzciTa,Unknown,English,2017-09-12 01:08:00,2017-09-12 01:08:00,4811,1258,646,,0
briigevastr,Liberals Start Vicious Rumor About Melania Trump  https://t.co/NcNoGpcvfW,Unknown,English,2017-09-12 01:08:00,2017-09-12 01:08:00,4811,1258,643,,0
briigevastr,Can Laura Ingraham Save Fox News?  https://t.co/5R4lffLGAa,Unknown,English,2017-09-12 01:08:00,2017-09-12 01:09:00,4811,1258,645,,0
briigevastr,LOL: Watch Diamond and Silk SCHOOL ‘The View’ on DACA  https://t.co/ZON7Msldpi,Unknown,English,2017-09-12 01:08:00,2017-09-12 01:08:00,4811,1258,647,,0
briigevastr,VIDEO: Trump’s Powerful First 9/11 Speech as President  https://t.co/9eN3YBNhSZ,Unknown,English,2017-09-12 03:13:00,2017-09-12 03:14:00,4811,1259,649,,0
briigevastr,Teachers Avoid Teaching 9/11 So Islamic Students Won’t Get ‘Offended’  https://t.co/4Y7VJ8Mi7O,Unknown,English,2017-09-12 03:13:00,2017-09-12 03:14:00,4811,1259,650,,0
briigevastr,WATCH: Pence Moved to Tears in Emotional 9/11 Speech  https://t.co/k4bw6HSlfe,Unknown,English,2017-09-12 03:13:00,2017-09-12 03:13:00,4811,1259,648,,0
briigevastr,BREAKING: ‘Rat’ Comey Under New Pressure After Being Caught Lying Under Oath  https://t.co/wMV0vP7CV2,Unknown,English,2017-09-12 14:22:00,2017-09-12 14:23:00,4811,1273,651,,0
briigevastr,PATHETIC STUNT – CNN’s Acosta Tries to Use Hurricanes to Push ‘Climate Change’  https://t.co/KGrt0V14Tb,Unknown,English,2017-09-12 14:22:00,2017-09-12 14:22:00,4811,1273,652,,0
briigevastr,BREAKING: Hillary is Blaming a BRAND NEW ENTITY for Losing the Election  https://t.co/EE1lsHc6PW,Unknown,English,2017-09-12 14:26:00,2017-09-12 14:26:00,4811,1274,653,,0
briigevastr,Why is the ESPN Host Who Called Trump a ‘White Supremacist’ Still Employed?  https://t.co/b7MutR56Fg,Unknown,English,2017-09-12 14:26:00,2017-09-12 14:26:00,4811,1274,654,,0
briigevastr,BREAKING: UN Security Votes Unanimously To Increase North Korea Sanctions  https://t.co/U3CNKz8hmJ,Unknown,English,2017-09-12 14:26:00,2017-09-12 14:27:00,4811,1274,660,,0
briigevastr,Liberal Media Pushes For DACA Claiming ‘Blacks Can’t do the Job’  https://t.co/kTgx83ud7A,Unknown,English,2017-09-12 14:26:00,2017-09-12 14:26:00,4811,1274,655,,0
briigevastr,JUSTICE: Teacher who HUMILIATED Trump-Supporting Students is FIRED  https://t.co/aQnxOL6brG,Unknown,English,2017-09-12 14:26:00,2017-09-12 14:26:00,4811,1274,656,,0
briigevastr,BREAKING: Maryland Judge Orders Investigation into Hillary’s Lawyers!  https://t.co/L00KyvaTSe,Unknown,English,2017-09-12 14:26:00,2017-09-12 14:26:00,4811,1274,659,,0
briigevastr,‘Biggest Loser’ Hillary Tries to Resurrect ‘Trump-Russia Collusion’ Claim  https://t.co/pLBP9zr1Io,Unknown,English,2017-09-12 14:26:00,2017-09-12 14:26:00,4811,1274,658,,0
briigevastr,Viral Video Exposes Linda Sarsour as a Total Phony!  https://t.co/My9cNtSrCe,Unknown,English,2017-09-12 14:26:00,2017-09-12 14:26:00,4811,1274,657,,0
briigevastr,Tim Tebow Has a Blast With WWII Veterans in Shelter After Hurricane Irma  https://t.co/wHiWzQBA00,Unknown,English,2017-09-12 14:31:00,2017-09-12 14:31:00,4810,1273,661,,0
briigevastr,Gillibrand and Collins Join Forces to Block Trump’s Transgender Military Ban  https://t.co/8HK43kLePb,Unknown,English,2017-09-12 14:31:00,2017-09-12 14:31:00,4810,1273,666,,0
briigevastr,DISGUSTING: Abortion Provider Offers Free Abortions to Harvey Victims  https://t.co/QyIfRobBR9,Unknown,English,2017-09-12 14:31:00,2017-09-12 14:31:00,4810,1273,663,,0
briigevastr,CNN’s Don Lemon Claims he can SMELL RACISM  https://t.co/Vt7IT1zOvf,Unknown,English,2017-09-12 14:31:00,2017-09-12 14:31:00,4810,1273,664,,0
briigevastr,Whoopi INSISTS the Media LOVED Trump and Gave Him Positive Coverage  https://t.co/rqDLRBbhL9,Unknown,English,2017-09-12 14:31:00,2017-09-12 14:32:00,4810,1273,662,,0
briigevastr,HA! Unhinged Hillary Admits to YELLING at the TV When Trump is on  https://t.co/ljh4wPZ3io,Unknown,English,2017-09-12 14:31:00,2017-09-12 14:31:00,4810,1273,665,,0
briigevastr,Mike Ditka Has a HARSH Message For NFL Anthem Protesters  https://t.co/3Zwx1ea3v6,Unknown,English,2017-09-12 16:02:00,2017-09-12 16:03:00,4811,1273,668,,0
briigevastr,Judge Napolitano CALLS OUT Activist Judges Fighting Trump’s Travel Ban  https://t.co/vAkCRzzn1M,Unknown,English,2017-09-12 16:02:00,2017-09-12 16:03:00,4811,1273,669,,0
briigevastr,It’s Official! We Have a New WH Communications Director  https://t.co/jyf9YTYxJ7,Unknown,English,2017-09-12 16:02:00,2017-09-12 16:03:00,4811,1273,667,,0
briigevastr,OUCH! The Reviews for Hillary are IN and HILARIOUSLY Bad!  https://t.co/MwUdJ0LDl4,Unknown,English,2017-09-12 16:41:00,2017-09-12 16:42:00,4811,1274,670,,0
briigevastr,Christian Teen Beaten to Death by Muslim Classmates in Pakistan  https://t.co/Y45NJpNJEA,Unknown,English,2017-09-12 21:07:00,2017-09-12 21:07:00,4811,1277,673,,0
briigevastr,Angry Hillary Refuses to ‘Forgive’ Women Who Didn’t Vote For Her  https://t.co/cDFPbFuEwA,Unknown,English,2017-09-12 21:07:00,2017-09-12 21:07:00,4811,1277,675,,0
briigevastr,‘The View’ Claims We’ll NEVER Know Why Hillary Lost the Election  https://t.co/qT0xVu5ype,Unknown,English,2017-09-12 21:07:00,2017-09-12 21:07:00,4811,1277,671,,0
briigevastr,NEW POLL: Majority Agree that Illegals Take Jobs from Legal Citizens  https://t.co/n1Zn6REPnK,Unknown,English,2017-09-12 21:07:00,2017-09-12 21:07:00,4811,1277,672,,0
briigevastr,Joy Reid Declares the Trump Era as the ‘Worst Time to Be a Human’  https://t.co/viEMfmcEfV,Unknown,English,2017-09-12 21:07:00,2017-09-12 21:07:00,4811,1277,674,,0
briigevastr,He Returned A Book To The Library. They Were Stunned When They Saw The Library Card.  https://t.co/9JT6cEINas,Unknown,English,2017-09-12 21:12:00,2017-09-12 21:12:00,4811,1277,677,,0
briigevastr,President Trump Replies to Katy Tur’s Claim He ‘Kissed’ Her  https://t.co/5tyeEZJRrJ,Unknown,English,2017-09-12 21:12:00,2017-09-12 21:12:00,4811,1277,678,,0
briigevastr,"It's Bad Enough When Kids Ruin Trivial Things, But These Stories Are Way, Way Worse  https://t.co/2AWN76ZgkD",Unknown,English,2017-09-12 21:16:00,2017-09-12 21:17:00,4811,1277,680,,0
briigevastr,Here's Exactly What You Don't Want To Happen When You're On Live TV  https://t.co/tq0MII7cMx,Unknown,English,2017-09-12 21:16:00,2017-09-12 21:17:00,4811,1277,679,,0
briigevastr,"When These People Saw An Elephant In Need, They Banded Together To Help  https://t.co/cvJrAUrSNg",Unknown,English,2017-09-12 21:22:00,2017-09-12 21:22:00,4811,1277,681,,0
briigevastr,This Cat's Been Stuck In A Shelter For A Year. Her Face Totally Expresses Her Rage.  https://t.co/SMm4k4ZkTk,Unknown,English,2017-09-12 21:22:00,2017-09-12 21:22:00,4811,1277,682,,0
briigevastr,"When These 22 People Woke Up, They Noticed Something Didn't Exactly Feel Right...  https://t.co/MZ67LgFw0T",Unknown,English,2017-09-12 21:27:00,2017-09-12 21:28:00,4811,1277,683,,0
briigevastr,This Baby Was All Smiles...Right Up Until He Pulled This Hilariously Evil Look  https://t.co/2PMhbq4SXI,Unknown,English,2017-09-12 21:32:00,2017-09-12 21:32:00,4811,1277,684,,0
briigevastr,Sarah Huckabee Answers if Trump Will Read Hillary’s Book and it’s HILARIOUS!  https://t.co/v6x7LFDvtH,Unknown,English,2017-09-12 21:46:00,2017-09-12 21:47:00,4810,1278,685,,0
briigevastr,BREAKING: Seattle’s Liberal Mayor Resigns in Shame After 5th Sex Abuse Allegation  https://t.co/2r4DILLZ2Y,Unknown,English,2017-09-12 21:47:00,2017-09-12 21:47:00,4810,1278,686,,0
briigevastr,BREAKING: National Guardsman Arrested For Threatening to Kill Mike Pence  https://t.co/nP89xJtBWd,Unknown,English,2017-09-12 22:06:00,2017-09-12 22:07:00,4810,1279,687,,0
briigevastr,Democrat Resigns in Disgrace After Weird Sexual Fetish is Exposed  https://t.co/CpRe8Zmtqy,Unknown,English,2017-09-12 23:12:00,2017-09-12 23:13:00,4811,1282,688,,0
briigevastr,BREAKING: Bitter Hillary Takes Her Disgraceful Attacks to Ivanka!  https://t.co/KpNGUJUNfo,Unknown,English,2017-09-12 23:12:00,2017-09-12 23:13:00,4811,1282,689,,0
briigevastr,Cornell University Declares Phrase ‘Build That Wall’ is ‘HATE SPEECH’  https://t.co/DJ7i2Jkg4m,Unknown,English,2017-09-12 23:44:00,2017-09-12 23:44:00,4810,1282,691,,0
briigevastr,Sean Spicer Perfectly Trolls Hillary’s Latest Ridiculous Claim!  https://t.co/psj1IwKvT9,Unknown,English,2017-09-12 23:44:00,2017-09-12 23:44:00,4810,1282,693,,0
briigevastr,Don Jr OBLITERATES Disgraced Seattle Dem Mayor!  https://t.co/DCrMe4OUcy,Unknown,English,2017-09-12 23:44:00,2017-09-12 23:44:00,4810,1282,690,,0
briigevastr,BREAKING: Horrible News for Wasserman Schultz – ‘Songbird’ Awan Ready to Sing!  https://t.co/7A6924hIds,Unknown,English,2017-09-12 23:44:00,2017-09-12 23:44:00,4810,1282,692,,0
briigevastr,VIDEO: Sarah Huckabee Totally Exposes Crooked Comey!  https://t.co/BbYTqpjoo5,Unknown,English,2017-09-13 02:12:00,2017-09-13 02:13:00,4810,1285,696,,0
briigevastr,Liberals on ‘The View’ Believe Al Gore’s Movie is Proof of Climate Change  https://t.co/UVADj0MtDL,Unknown,English,2017-09-13 02:12:00,2017-09-13 02:12:00,4810,1285,694,,0
briigevastr,Katy Tur Suggests Californians Should Move to Swing States to Help Dems Win Elections  https://t.co/4uJK1LxIRe,Unknown,English,2017-09-13 02:12:00,2017-09-13 02:13:00,4810,1285,695,,0
briigevastr,BREAKING: The Awan Brothers Could Get Immunity!  https://t.co/9JlL5sP3X3,Unknown,English,2017-09-13 02:17:00,2017-09-13 02:17:00,4809,1285,698,,0
briigevastr,VIRAL! Dairy Queen Owner Triggers Liberals With ‘Snowflake’ Warning  https://t.co/DT4jNOoiQk,Unknown,English,2017-09-13 02:17:00,2017-09-13 02:18:00,4809,1285,697,,0
briigevastr,VIRAL! Hillary Gets Epically Trolled During Her Book Signing!  https://t.co/eDTkeDTk70,Unknown,English,2017-09-13 08:08:00,2017-09-13 08:08:00,4809,1296,699,,0
briigevastr,LOL: Tomi Explains to Hillary ‘What Happened’ and It’s GLORIOUS!  https://t.co/BNDzrl5kNC,Unknown,English,2017-09-13 09:08:00,2017-09-13 09:10:00,4809,1296,700,,0
briigevastr,LOL: Hillary’s First Book Signing a Total Disaster  https://t.co/2Kp4kCcgKC,Unknown,English,2017-09-13 09:08:00,2017-09-13 09:09:00,4809,1296,701,,0
briigevastr,Kid Rock Brilliantly Gets Revenge on Liberal Newspaper Who Attacked Him  https://t.co/6ZinwyB8bd,Unknown,English,2017-09-13 16:09:00,2017-09-13 16:09:00,4810,1305,702,,0
briigevastr,Pathetic Hillary Now Blaming the MEDIA for Not Being Biased Enough for Her  https://t.co/XTjmJ2ZTIV,Unknown,English,2017-09-13 16:09:00,2017-09-13 16:10:00,4810,1305,703,,0
briigevastr,Paul Ryan Busted Declaring ‘NO CHANCE OF BORDER WALL’ at Private Dinner  https://t.co/MRAWz1eL8i,Unknown,English,2017-09-13 16:14:00,2017-09-13 16:14:00,4810,1305,704,,0
briigevastr,Liberals are Pushing to Make ‘Climate Change Denial’ a CRIME!  https://t.co/ZHuZZjhd19,Unknown,English,2017-09-13 16:14:00,2017-09-13 16:14:00,4810,1305,706,,0
briigevastr,Katrina Pierson Rips Hillary for Her ‘Huge Ego Problem’ and ‘Elitist Attitude’  https://t.co/Q8RPxf6xLd,Unknown,English,2017-09-13 16:14:00,2017-09-13 16:14:00,4810,1305,705,,0
briigevastr,Jimmy Kimmel REALLY Crossed the Line With This LEWD Joke About Ted Cruz  https://t.co/gJlux0H4Gz,Unknown,English,2017-09-13 16:18:00,2017-09-13 16:19:00,4810,1305,710,,0
briigevastr,Black Trump Supporter SLAMS ESPN’s Jemele Hill Over ‘White Supremacist’ Comment  https://t.co/BjV1QDbuBZ,Unknown,English,2017-09-13 16:18:00,2017-09-13 16:18:00,4810,1305,708,,0
briigevastr,Lawyer Who Tweeted Approval of ‘Betsy DeVos RAPE’ Forced to Resign  https://t.co/lGAc5L5Vq5,Unknown,English,2017-09-13 16:18:00,2017-09-13 16:19:00,4810,1305,709,,0
briigevastr,Merkel is Using Obama’s Image to BOOST Her Globalist Campaign  https://t.co/jWvqZaNIrf,Unknown,English,2017-09-13 16:18:00,2017-09-13 16:18:00,4810,1305,707,,0
briigevastr,Hillary Admits She Wanted to Make VOODOO DOLLS to STAB Her Enemies  https://t.co/nOHRTG2Qu2,Unknown,English,2017-09-13 16:18:00,2017-09-13 16:18:00,4810,1305,711,,0
briigevastr,California Inches Closer to Losing Federal Funding  https://t.co/F2Cz7y3esR,Unknown,English,2017-09-13 16:24:00,2017-09-13 16:24:00,4810,1305,715,,0
briigevastr,NEW POLL: Americans Have Spoken and They Want Hillary GONE  https://t.co/KQ6RHzat3T,Unknown,English,2017-09-13 16:24:00,2017-09-13 16:24:00,4810,1305,713,,0
briigevastr,Feminist Group Claims Pumpkin Spice Lattes Are Funding White Supremacy  https://t.co/hrULOnUuFj,Unknown,English,2017-09-13 16:24:00,2017-09-13 16:24:00,4810,1305,714,,0
briigevastr,Will Con-Artist Bernie Sanders Ever Pay Off His Massive Campaign Debt?  https://t.co/HCcT7i61wI,Unknown,English,2017-09-13 16:24:00,2017-09-13 16:24:00,4810,1305,712,,0
briigevastr,Rap Artist Releases Viral Video Depicting Him Hanging a White Child  https://t.co/DR89zwzY2p,Unknown,English,2017-09-13 16:47:00,2017-09-13 16:48:00,4810,1307,719,,0
briigevastr,Benghazi Security Contractors Come Forward With SHOCKING New Details  https://t.co/Q3NSHUOYgA,Unknown,English,2017-09-13 16:47:00,2017-09-13 16:47:00,4810,1307,716,,0
briigevastr,BREAKING: Black Lives Matter Thugs Deface Thomas Jefferson Statue  https://t.co/nSChhqz84b,Unknown,English,2017-09-13 16:47:00,2017-09-13 16:47:00,4810,1307,717,,0
briigevastr,VIDEO: Pelosi Calls DREAMers Courageous and Optimistic ‘Patriots’  https://t.co/80GVBASiWw,Unknown,English,2017-09-13 16:47:00,2017-09-13 16:47:00,4810,1307,718,,0
briigevastr,Hillary Reveals ‘Distraut’ McCain Consoled Her at Trump’s Inauguration  https://t.co/IVGCC3Yqnf,Unknown,English,2017-09-13 20:56:00,2017-09-13 20:57:00,4802,1309,720,,0
