author_id,content,region,language,publish_date,harvested_date,following,followers,updates,post_type,retweet
briigevastr,Vegas Victim who STOOD For President Trump  is Attacked by Liberals  https://t.co/Rrh0xGZqXX,Unknown,English,2017-10-07 22:21:00,2017-10-07 22:21:00,4749,1678,1823,,0
briigevastr,BREAKING POLL: It’s OVER For Jeff Flake! https://t.co/NosCWPF80Y,Unknown,English,2017-10-08 00:51:00,2017-10-08 00:51:00,4749,1679,1824,,0
briigevastr,Jimmy Kimmel Filmed Scantily Clad Young Girls Bouncing on Trampolines https://t.co/g949wHNOre,Unknown,English,2017-10-08 00:51:00,2017-10-08 00:51:00,4749,1679,1825,,0
briigevastr,"VIDEO: Mia Love BLASTS Michelle Obama for Calling the GOP ‘All Men, All White’ https://t.co/ffU93d7wZj",Unknown,English,2017-10-08 00:56:00,2017-10-08 00:56:00,4749,1679,1827,,0
briigevastr,BREAKING: Las Vegas Murderer Traveled to the Middle East https://t.co/SQnAG1itNM,Unknown,English,2017-10-08 00:56:00,2017-10-08 00:56:00,4749,1679,1826,,0
briigevastr,10 Camo Wearing Illegals Smuggling Drugs BUSTED By Border Control! https://t.co/78VYF0LZGY,Unknown,English,2017-10-08 01:01:00,2017-10-08 01:01:00,4749,1679,1828,,0
briigevastr,"VIRAL! High School Football Player Raises Flag, Puts NFLers to SHAME! https://t.co/YGitc5nD1q",Unknown,English,2017-10-08 01:21:00,2017-10-08 01:21:00,4749,1680,1829,,0
briigevastr,DISGRACE! Gay Liberal Coffee Shop Owner REFUSES to Serve Christians https://t.co/tTs82tbHNn,Unknown,English,2017-10-08 01:36:00,2017-10-08 01:36:00,4749,1681,1830,,0
briigevastr,BREAKING: ANOTHER Woman Tells Sordid Tale Of Weinstein’s Predatory Behavior! https://t.co/UGZ2mJNQ0k,Unknown,English,2017-10-08 02:36:00,2017-10-08 02:36:00,4749,1681,1831,,0
briigevastr,Taxpayers Paying MILLIONS for Removal of Confederate Statues https://t.co/deC7Op2WEP,Unknown,English,2017-10-08 03:01:00,2017-10-08 03:01:00,4749,1681,1833,,0
briigevastr,BREAKING: Trump Triggers Liberals with Latest Move! https://t.co/3Y9vnJAbzG,Unknown,English,2017-10-08 03:01:00,2017-10-08 03:01:00,4749,1681,1832,,0
briigevastr,KAEPERNICK EFFECT! NFL Favorability Crashes to RECORD LOW! https://t.co/en1xuB2INk,Unknown,English,2017-10-08 10:26:00,2017-10-08 10:26:00,4749,1683,1835,,0
briigevastr,94-Year-Old WWII Vet Puts NFL to Shame By Standing For Anthem on One Leg https://t.co/SggQTQ9SYq,Unknown,English,2017-10-08 10:26:00,2017-10-08 10:26:00,4749,1683,1836,,0
briigevastr,BREAKING: Hurricane Nate Makes Landfall in U.S. https://t.co/UIdhQkEeFp,Unknown,English,2017-10-08 10:26:00,2017-10-08 10:26:00,4749,1683,1834,,0
briigevastr,BREAKING VIDEO: ISIS Cowards SURRENDER in Iraq https://t.co/rC1c1BERik,Unknown,English,2017-10-08 10:41:00,2017-10-08 10:42:00,4749,1683,1837,,0
briigevastr,Shocking Video of Hurricane Nate’s Devastation in Mississippi https://t.co/PYxEDrUrxM,Unknown,English,2017-10-08 21:51:00,2017-10-08 21:51:00,4748,1679,1842,,0
briigevastr,Michelle Obama is Furious Women Voters Could See Past Gender Identity https://t.co/kSyX2GZM1V,Unknown,English,2017-10-08 21:51:00,2017-10-08 21:51:00,4748,1679,1839,,0
briigevastr,"BLM Students Shut Down ACLU Event, Argue ‘Liberalism Is White Supremacy’ https://t.co/AWdF0B8JfO",Unknown,English,2017-10-08 21:51:00,2017-10-08 21:51:00,4748,1679,1838,,0
briigevastr,BREAKING: President Trump Reacts to Harvey Weinstein Revelation https://t.co/fVNJSfoH3R,Unknown,English,2017-10-08 21:51:00,2017-10-08 21:51:00,4748,1679,1840,,0
briigevastr,BREAKING: Pelosi Admits Bump Stocks only the START of Dems’ Anti-Gun Agenda https://t.co/Z676B46yM3,Unknown,English,2017-10-08 21:51:00,2017-10-08 21:51:00,4748,1679,1841,,0
briigevastr,Japan Fully Supports President Trump’s Tough Stance on North Korea https://t.co/bbH6rZemee,Unknown,English,2017-10-08 22:02:00,2017-10-08 22:02:00,4748,1679,1844,,0
briigevastr,LOL: Trump Triggers Liberals by Declaring Monday is ‘COLUMBUS DAY’ https://t.co/uVKS12I3WB,Unknown,English,2017-10-08 22:02:00,2017-10-08 22:02:00,4748,1679,1843,,0
briigevastr,DNC Refuses to Return Harvey Weinstein’s Donations https://t.co/q0HcDOthrW,Unknown,English,2017-10-08 22:11:00,2017-10-08 22:11:00,4748,1680,1851,,0
briigevastr,Vegan Food Truck Owner Loses Business After Celebrating Vegas Shooting https://t.co/0A9PxvziaB,Unknown,English,2017-10-08 22:11:00,2017-10-08 22:11:00,4748,1680,1848,,0
briigevastr,BIASED COMEDY: SNL Completely Avoids the Harry Weinstein Scandal https://t.co/uF9VHCDtp2,Unknown,English,2017-10-08 22:11:00,2017-10-08 22:11:00,4748,1680,1846,,0
briigevastr,Teen Sues School for Suspension Over Refusing to Stand for Pledge https://t.co/g0pqKrfEj2,Unknown,English,2017-10-08 22:11:00,2017-10-08 22:11:00,4748,1680,1847,,0
briigevastr,MSNBC Guest Claims ‘Far-Right’ Christians Want Women ‘Back In The Kitchen’ https://t.co/FPBPs0QCDI,Unknown,English,2017-10-08 22:11:00,2017-10-08 22:11:00,4748,1680,1850,,0
briigevastr,"Well, Well, Well, West Point KNEW About Communist Cadet For Years https://t.co/3fHQHi38fb",Unknown,English,2017-10-08 22:11:00,2017-10-08 22:11:00,4748,1680,1849,,0
briigevastr,BREAKING: Iran is Caving to Trump https://t.co/HufmOQaanN,Unknown,English,2017-10-08 22:11:00,2017-10-08 22:11:00,4748,1680,1852,,0
briigevastr,BOOM! Pat Sajak OBLITERATES Kimmel With One EPIC TWEET! https://t.co/gulZZWzZ4n,Unknown,English,2017-10-08 22:11:00,2017-10-08 22:11:00,4748,1680,1854,,0
briigevastr,Watch Dinesh D’Souza’s Warning For Republicans About the Second Amendment https://t.co/UXyOxPfTsH,Unknown,English,2017-10-08 22:11:00,2017-10-08 22:11:00,4748,1680,1845,,0
briigevastr,We Now Know What the Las Vegas Killer’s Note Said and It’s CHILLING https://t.co/va7GIkNHZu,Unknown,English,2017-10-08 22:11:00,2017-10-08 22:11:00,4748,1680,1853,,0
briigevastr,VP Pence Leaves Colts Game After Players Take a Knee https://t.co/EnKTEDr8Fz,Unknown,English,2017-10-08 22:21:00,2017-10-08 22:21:00,4748,1680,1858,,0
briigevastr,BREAKING: Trump Asked Pence to Leave Colts Game if Players Kneeled  https://t.co/H3oI3ypFel,Unknown,English,2017-10-08 22:21:00,2017-10-08 22:21:00,4748,1680,1861,,0
briigevastr,N. Korea Will Test Long-Range Missile Capable of Reaching U.S. https://t.co/8B6ZJV59QX,Unknown,English,2017-10-08 22:21:00,2017-10-08 22:21:00,4748,1680,1857,,0
briigevastr,Julian Assange Just OBLITERATED the Myth that Hillary is a ‘Feminist’ https://t.co/N1l44vgdm9,Unknown,English,2017-10-08 22:21:00,2017-10-08 22:21:00,4748,1680,1856,,0
briigevastr,NFL is Officially The Most Hated Sport in America! https://t.co/6Yxm68SyIF,Unknown,English,2017-10-08 22:21:00,2017-10-08 22:21:00,4748,1680,1863,,0
briigevastr,WHAT??? Man Who Raped 12 Year Old Girl Awarded Joint Custody of Child https://t.co/4RFHv23BQr,Unknown,English,2017-10-08 22:21:00,2017-10-08 22:21:00,4748,1680,1860,,0
briigevastr,Desperate and Disgraced Harvey Weinstein Vows to Destroy NRA https://t.co/Gnaj10fuCd,Unknown,English,2017-10-08 22:21:00,2017-10-08 22:21:00,4748,1680,1855,,0
briigevastr,ALERT! Antifa’s DISGUSTING Columbus Day Plans Revealed https://t.co/zf2M9qvIl2,Unknown,English,2017-10-08 22:21:00,2017-10-08 22:21:00,4748,1680,1862,,0
briigevastr,Thousands of Christians in Poland Gather to Pray Against ‘Islamisation of Europe’ https://t.co/Rgq5r13hNL,Unknown,English,2017-10-08 22:21:00,2017-10-08 22:21:00,4748,1680,1859,,0
briigevastr,HYPOCRITES: Stunt Pulling NFL Players Call Pence’s Walk Out a ‘PR Stunt’ https://t.co/9JwKpy7rJh,Unknown,English,2017-10-09 14:42:00,2017-10-09 14:43:00,4746,1681,1864,,0
briigevastr,BREAKING: Gun Control Capitol Chicago Passes 500th Fatal Gun Shooting of the Year https://t.co/5KM2zsWcnL,Unknown,English,2017-10-09 15:08:00,2017-10-09 15:08:00,4746,1680,1865,,0
briigevastr,ICE Finds Loophole to Detain Cali Illegals Despite Brown’s ‘Sanctuary State’ Bill https://t.co/iI04pnJFu9,Unknown,English,2017-10-09 15:28:00,2017-10-09 15:28:00,4746,1681,1866,,0
briigevastr,Senator Calls on Dems to Return All Donations From Disgraced Weinstein https://t.co/TR6xDY5b6d,Unknown,English,2017-10-09 15:33:00,2017-10-09 15:33:00,4746,1681,1867,,0
briigevastr,VIRAL VIDEO: Firearms Instructor Puts ‘Gun Control’ Liberals to SHAME! https://t.co/mPNQy1oJag,Unknown,English,2017-10-09 15:33:00,2017-10-09 15:35:00,4746,1681,1868,,0
briigevastr,"High School Football Players Kneel for Anthem, Get PULLED for Lineup! https://t.co/mp1NZbGOlY",Unknown,English,2017-10-09 15:38:00,2017-10-09 15:38:00,4746,1681,1869,,0
briigevastr,BREAKING: Eric Trump Defends Mike Pence’s Decision to WALK OUT of NFL Game! https://t.co/QFlWFmy6KD,Unknown,English,2017-10-09 15:38:00,2017-10-09 15:38:00,4746,1681,1871,,0
briigevastr,Firefighter FIRED for ‘Racial Insensitivity’ After Bringing in a Watermelon https://t.co/17AKKwBiVi,Unknown,English,2017-10-09 15:38:00,2017-10-09 15:38:00,4746,1681,1870,,0
briigevastr,NHL Player Becomes First to Protest National Anthem https://t.co/AxAIIH2PiQ,Unknown,English,2017-10-09 15:42:00,2017-10-09 15:42:00,4746,1681,1872,,0
briigevastr,Lame Duck Senator Corker Claims Trump “On the Path to World War 3” https://t.co/N2ku10VczD,Unknown,English,2017-10-09 15:48:00,2017-10-09 15:48:00,4746,1681,1875,,0
briigevastr,‘Gun Control Capital’ Chicago Passes 500th Fatal Shooting of 2017 https://t.co/e6KugNCNBG,Unknown,English,2017-10-09 15:48:00,2017-10-09 15:48:00,4746,1681,1874,,0
briigevastr,KARMA? NFL Player Who Pulled Anti-Trump Stunt Suffers BRUTAL Ankle Injury https://t.co/AwrQxS1Lto,Unknown,English,2017-10-09 15:48:00,2017-10-09 15:48:00,4746,1681,1873,,0
briigevastr,WOW! VIRAL Meme Compares Deaths By GUNS vs. ABORTIONS https://t.co/VZBGONMgsh,Unknown,English,2017-10-09 15:53:00,2017-10-09 15:53:00,4746,1681,1877,,0
briigevastr,Cowboys Owner Tells Players Stand for the Flag or They Won’t Play! https://t.co/cfZqwpwNA1,Unknown,English,2017-10-09 15:53:00,2017-10-09 15:53:00,4746,1681,1876,,0
briigevastr,Anti-Trump Actress Praised Sex Abuser Weinstein as ‘God’ at Golden Globes https://t.co/dpPXnqbc1j,Unknown,English,2017-10-09 15:57:00,2017-10-09 15:57:00,4746,1680,1878,,0
briigevastr,BREAKING: Harvey Weinstein Has Been FIRED! https://t.co/oaDga9MCkn,Unknown,English,2017-10-09 15:57:00,2017-10-09 15:57:00,4746,1680,1879,,0
briigevastr,SNL Refused to Mock Harvey Weinstein Because He’s ‘From New York’ https://t.co/y3rGc1xjP1,Unknown,English,2017-10-09 16:08:00,2017-10-09 16:08:00,4746,1680,1884,,0
briigevastr,Cowboys FINALLY Lay Down the Law for NFL Anthem Kneelers https://t.co/aHkReSsQIN,Unknown,English,2017-10-09 16:08:00,2017-10-09 16:08:00,4746,1680,1880,,0
briigevastr,Disgraced Democrat and Woman Abuser Weinstein Called Actress a ‘Fat Pig’  https://t.co/RTcuLAKsbf,Unknown,English,2017-10-09 16:08:00,2017-10-09 16:08:00,4746,1680,1881,,0
briigevastr,Top Obama Officials Blew Nearly $1 Million On Non-Commercial Flights https://t.co/DFqMpYbKki,Unknown,English,2017-10-09 16:08:00,2017-10-09 16:08:00,4746,1680,1883,,0
briigevastr,Top Obama Officials Blew Nearly $1 Million On Non-Commercial Flights https://t.co/CxKVbJ8J7d,Unknown,English,2017-10-09 16:08:00,2017-10-09 16:08:00,4746,1680,1882,,0
briigevastr,BREAKING: Trump to Take Executive Action on Obamacare https://t.co/myTnSziMg2,Unknown,English,2017-10-09 16:13:00,2017-10-09 16:13:00,4746,1680,1885,,0
briigevastr,Seth Rogan Gets ROASTED For Wanting to BAN Conservative Books (Like a NAZI) https://t.co/A9pEFWphK5,Unknown,English,2017-10-09 16:13:00,2017-10-09 16:13:00,4746,1680,1890,,0
briigevastr,Woman Douses Lakers Fans Who Refused to STAND for Anthem https://t.co/D2J3A3bvdw,Unknown,English,2017-10-09 16:13:00,2017-10-09 16:13:00,4746,1680,1889,,0
briigevastr,BREAKING: Trump Refuses to Discuss DACA Unless the Border Wall is Accepted https://t.co/91jIYetbEL,Unknown,English,2017-10-09 16:13:00,2017-10-09 16:13:00,4746,1680,1887,,0
briigevastr,"LOL: Trump Has ISIS So Scared, They’re Literally Soiling Themselves in Fear https://t.co/Ip6CkMpu9b",Unknown,English,2017-10-09 16:13:00,2017-10-09 16:13:00,4746,1680,1886,,0
briigevastr,NRA Slams ‘Hypocrite Hillary’ for Gun Control Remarks https://t.co/koJAgz1eUf,Unknown,English,2017-10-09 16:13:00,2017-10-09 16:13:00,4746,1680,1888,,0
briigevastr,FEMA Head Calls San Juan Mayor’s Complaints ‘Political Noise’ https://t.co/XiSqgD7kjj,Unknown,English,2017-10-09 16:18:00,2017-10-09 16:19:00,4746,1680,1892,,0
briigevastr,NFL Coach Resigns After Video of Him ‘SNORTING BLOW’ Surfaces https://t.co/qRRDuYz9m3,Unknown,English,2017-10-09 16:18:00,2017-10-09 16:19:00,4746,1680,1891,,0
briigevastr,REPORT: Emails Show Lisa Bloom Planned on SMEARING Weinstein’s Accusers https://t.co/JRqKA0MLBn,Unknown,English,2017-10-09 19:36:00,2017-10-09 19:36:00,4746,1676,1895,,0
briigevastr,Feinstein Refuses to Say if She’ll Return Sex Predator Weinstein’s Donations https://t.co/hf77ULA2m7,Unknown,English,2017-10-09 19:36:00,2017-10-09 19:36:00,4746,1676,1894,,0
briigevastr,Trump is About to Trash Obama’s BIGGEST Climate Change Regulation https://t.co/iQskxPsj9O,Unknown,English,2017-10-09 19:36:00,2017-10-09 19:36:00,4746,1676,1893,,0
briigevastr,ESPN Host Who Called Trump ‘White Supremacist’ Now Attacking Cowboys Owner https://t.co/duq76Aq79H,Unknown,English,2017-10-09 19:36:00,2017-10-09 19:36:00,4746,1676,1896,,0
briigevastr,Heartbroken Couple Lost Their Dog On A Hike. Then One Call Changed Everything. https://t.co/YuhW4V5hAx,Unknown,English,2017-10-09 19:41:00,2017-10-09 19:41:00,4746,1676,1897,,0
briigevastr,He Looked Out Of The Plane Window. What He Saw Changed His Life Forever. https://t.co/3KQ2SjLzRh,Unknown,English,2017-10-09 19:41:00,2017-10-09 19:41:00,4746,1676,1899,,0
briigevastr,This Epic Halloween Fail Almost Got A Wannabe Zombie Killed https://t.co/M0Z65m8EYD,Unknown,English,2017-10-09 19:41:00,2017-10-09 19:41:00,4746,1676,1898,,0
briigevastr,"Move Over, Spelling Bee Champs. This Dog Is Here To Steal Your Thunder. https://t.co/WJL10qc0se",Unknown,English,2017-10-09 19:46:00,2017-10-09 19:46:00,4746,1676,1900,,0
briigevastr,He Quickly Opened His Car Door. What Was Inside Sent Him Running. https://t.co/1KUZOO7U9L,Unknown,English,2017-10-09 19:46:00,2017-10-09 19:46:00,4746,1676,1901,,0
briigevastr,Something Tells Us These Babies Don't Like What Mom And Dad Served For Dinner https://t.co/5JKEB20g1i,Unknown,English,2017-10-09 19:51:00,2017-10-09 19:51:00,4746,1676,1902,,0
briigevastr,He Stole A Car When Disaster Struck. Why He Did Will Restore Your Faith In Humanity. https://t.co/PB5cb7IfyT,Unknown,English,2017-10-09 19:51:00,2017-10-09 19:51:00,4746,1676,1903,,0
briigevastr,Vegas Gunman’s Brother Meets With Police – Is He Hiding Something? https://t.co/7B8s3a13Wj,Unknown,English,2017-10-10 12:03:00,2017-10-10 12:03:00,4743,1606,1906,,0
briigevastr,Twitter BANS Republican Senate Candidate’s Announcement for Pro-Life Stance! https://t.co/0Uerznokec,Unknown,English,2017-10-10 12:03:00,2017-10-10 12:03:00,4743,1606,1905,,0
briigevastr,BREAKING: 3 YEAR OLD TEXAS GIRL MISSING https://t.co/gpVV4aQF5B,Unknown,English,2017-10-10 12:03:00,2017-10-10 12:03:00,4743,1606,1909,,0
briigevastr,CNN’s Symone Sanders ‘White People Don’t Get To Tell Black Folk’ How to Protest https://t.co/rme9Bm14FZ,Unknown,English,2017-10-10 12:03:00,2017-10-10 12:03:00,4743,1606,1904,,0
briigevastr,Friend of Vegas Mass Murderer Speaks Out with JAW DROPPING Claim! https://t.co/2cuXS6N08G,Unknown,English,2017-10-10 12:03:00,2017-10-10 12:03:00,4743,1606,1908,,0
briigevastr,Even CNN Wants to Know Why Hillary is SILENT on Weinstein https://t.co/sx243uQ8hP,Unknown,English,2017-10-10 12:03:00,2017-10-10 12:03:00,4743,1606,1907,,0
briigevastr,BREAKING: Police Dramatically Change Vegas Shooting Story https://t.co/uNgJ2NQtqD,Unknown,English,2017-10-10 12:18:00,2017-10-10 12:18:00,4743,1606,1911,,0
briigevastr,Liberals Are Now Boycotting ESPN For Suspending Jemele Hill https://t.co/1VqsKemTrx,Unknown,English,2017-10-10 12:18:00,2017-10-10 12:18:00,4743,1606,1912,,0
briigevastr,"If You Thought NFL Players Hated Trump Before, Wait Until They Read His Latest Tweet https://t.co/P1aassxZa0",Unknown,English,2017-10-10 12:18:00,2017-10-10 12:18:00,4743,1606,1910,,0
briigevastr,Watch a Feminist and a Pervert Present an Accused RAPIST with an Award https://t.co/rigUCXP0Pq,Unknown,English,2017-10-10 12:18:00,2017-10-10 12:18:00,4743,1606,1913,,0
briigevastr,CRINGE VIDEO: Kathy Griffin Makes a BIZARRE ‘Comeback’ Wearing Trump Mask https://t.co/BYgcFOR3qS,Unknown,English,2017-10-10 12:18:00,2017-10-10 12:18:00,4743,1606,1915,,0
briigevastr,"Group Calls for NFL Boycott on Veterans Day and It’s Already 120,000 STRONG! https://t.co/dVIu7JxdgD",Unknown,English,2017-10-10 12:18:00,2017-10-10 12:18:00,4743,1606,1914,,0
briigevastr,Senate Uncovers Possible FBI ‘Collusion’ in Trump Dossier https://t.co/SNAR5EgZci,Unknown,English,2017-10-10 12:33:00,2017-10-10 12:33:00,4743,1606,1917,,0
briigevastr,"Trump SLAMS Jemele Hill, ESPN, and NFL in EPIC Twitter Rant https://t.co/zEgSh1wk2a",Unknown,English,2017-10-10 12:33:00,2017-10-10 12:33:00,4743,1606,1916,,0
briigevastr,Clueless CNN Host Proposes ‘Gun Control Laws’ That Already Exist  https://t.co/DMb3DaBd3q,Unknown,English,2017-10-10 14:33:00,2017-10-10 14:33:00,4743,1611,1919,,0
briigevastr,‘Feminist’ Hillary Clinton STILL SILENT on Sex Predator Harvey Weinstein https://t.co/L9Aj6dcB4i,Unknown,English,2017-10-10 14:33:00,2017-10-10 14:33:00,4743,1611,1918,,0
briigevastr,The Ratings Are in and Sunday Night Football is Going Down the Toilet! https://t.co/pSWBitIUaK,Unknown,English,2017-10-10 14:58:00,2017-10-10 14:58:00,4743,1610,1920,,0
briigevastr,NFL Player Says He Would Defy Rule Against Protesting During Anthem https://t.co/rjhtHY6swu,Unknown,English,2017-10-10 15:04:00,2017-10-10 15:04:00,4743,1610,1921,,0
briigevastr,LOL: Jimmy Kimmel’s Writer Claims 2nd Amendment Isn’t in the Constitution https://t.co/Tgfx15yrSz,Unknown,English,2017-10-10 16:38:00,2017-10-10 16:38:00,4743,1614,1922,,0
briigevastr,Juanita Broaddrick Takes a Lethal SHOT at Meryl Streep and the Clintons https://t.co/Hqo2CoGhmn,Unknown,English,2017-10-10 16:38:00,2017-10-10 16:38:00,4743,1614,1923,,0
briigevastr,BREAKING: OPEC is BEGGING the United States for ‘OIL HELP’ https://t.co/5JyKQsBujC,Unknown,English,2017-10-10 17:34:00,2017-10-10 17:34:00,4743,1615,1924,,0
briigevastr,NY Times BUSTED in BOMBSHELL Hidden Video Admitting to Anti-Trump Bias https://t.co/2m9nfDBiKp,Unknown,English,2017-10-10 17:38:00,2017-10-10 17:38:00,4743,1615,1925,,0
briigevastr,Ditka Tells Anthem Kneelers to ‘Adios! Find Another Country’ https://t.co/6AneymTBLW,Unknown,English,2017-10-10 17:43:00,2017-10-10 17:43:00,4743,1614,1926,,0
briigevastr,WTF? California Can Throw You in Jail if You Use the Wrong Gender Pronouns https://t.co/ShJJ5WisQz,Unknown,English,2017-10-10 17:43:00,2017-10-10 17:43:00,4743,1614,1927,,0
briigevastr,Actress Judy Dench Now Regrets Tattooing Weinstein’s Name on Her Butt https://t.co/0Bpi491cwj,Unknown,English,2017-10-10 20:18:00,2017-10-10 20:18:00,4743,1616,1928,,0
briigevastr,"After 5 Days of SILENCE, Hillary Succumbs to Pressure and ‘Condemns’ Friend Weinstein https://t.co/dD7ZG2AGAV",Unknown,English,2017-10-10 20:23:00,2017-10-10 20:24:00,4743,1616,1930,,0
briigevastr,LISTEN: Harvey Weinstein Sexually Harassing Model in His Hotel Room https://t.co/c2JG5uBrA0,Unknown,English,2017-10-10 20:23:00,2017-10-10 20:25:00,4743,1616,1929,,0
briigevastr,"TRUMP WINS! NFL Surrenders, Tells Players to STAND for the Anthem https://t.co/F1B79ALc7o",Unknown,English,2017-10-10 21:08:00,2017-10-10 21:08:00,4743,1617,1931,,0
briigevastr,"We Just Covered This Tragic Story Of Abandonment, But It Has A Happy Ending! https://t.co/2JgCBMur5J",Unknown,English,2017-10-10 21:08:00,2017-10-10 21:08:00,4743,1617,1932,,0
briigevastr,Watch As A Cat Viciously Attacks A Giant Dog (With Too Much Love And Affection) https://t.co/75tkLwYehY,Unknown,English,2017-10-10 21:13:00,2017-10-10 21:13:00,4743,1617,1933,,0
briigevastr,They Walked Into Their Bedroom And Saw An Elusive Trumpet-Cat Hybrid In Their Bed https://t.co/SuivfrCGd7,Unknown,English,2017-10-10 21:13:00,2017-10-10 21:13:00,4743,1617,1934,,0
briigevastr,"This Rescued Great Dane And Her Tiny BFF Are So Cute, They'll Make You Melt https://t.co/J5Z2g8DWa9",Unknown,English,2017-10-10 21:18:00,2017-10-10 21:18:00,4741,1616,1935,,0
briigevastr,BREAKING: Kim Jong-un Makes Dubious CIA Assassination Attempt Claim https://t.co/NAWqiEuese,Unknown,English,2017-10-11 00:13:00,2017-10-11 00:13:00,4741,1620,1936,,0
briigevastr,BOMBSHELL Undercover Project Veritas Video Exposes Anti-Trump New York Times https://t.co/2jV0USomqu,Unknown,English,2017-10-11 00:13:00,2017-10-11 00:13:00,4741,1620,1937,,0
briigevastr,Juanita Broaddrick DESTROYS Hillary’s Hypocrisy on Weinstein with Perfect Tweet https://t.co/5f4qhnTZMB,Unknown,English,2017-10-11 00:13:00,2017-10-11 00:13:00,4741,1620,1938,,0
briigevastr,"Donna Karan Defends Weinstein, Blames Victims For Dressing Seductively https://t.co/E6ysyN54zp",Unknown,English,2017-10-11 00:13:00,2017-10-11 00:13:00,4741,1620,1939,,0
briigevastr,BREAKING: Trump to Sign Executive Order to End Obamacare’s In-State Restrictions https://t.co/Wlgfxx8Rca,Unknown,English,2017-10-11 00:18:00,2017-10-11 00:18:00,4741,1620,1944,,0
briigevastr,"U.S. Marine DESTROYS Pelosi in Gun Debate, Leaves Her Speechless https://t.co/Tivp4eU5db",Unknown,English,2017-10-11 00:18:00,2017-10-11 00:18:00,4741,1620,1941,,0
briigevastr,Trump Supporter Kaya Jones Reveals What ESPN REFUSED To Show When She Sang https://t.co/tkuSv1KE95,Unknown,English,2017-10-11 00:18:00,2017-10-11 00:18:00,4741,1620,1940,,0
briigevastr,BREAKING: Weinstein’s Wife Announces She’s OUT! https://t.co/LEvBloTQBg,Unknown,English,2017-10-11 00:18:00,2017-10-11 00:18:00,4741,1620,1942,,0
briigevastr,Rob Reiner Claims Trump is ‘Far Worse’ Than Weinstein https://t.co/R4lnItiI5K,Unknown,English,2017-10-11 00:18:00,2017-10-11 00:18:00,4741,1620,1943,,0
briigevastr,BREAKING: Allegations Against Weinstein Include First Degree Rape https://t.co/tznYXk41vQ,Unknown,English,2017-10-11 00:38:00,2017-10-11 00:38:00,4741,1620,1945,,0
briigevastr,BREAKING: TN Man FIRED For Disrespecting the National Anthem! https://t.co/KtSvT3XQpV,Unknown,English,2017-10-11 00:53:00,2017-10-11 00:53:00,4741,1620,1946,,0
briigevastr,Kellyanne Conway Brutally Knocks Out Hypocrite Hillary with PERFECT Tweet! https://t.co/TwHRySFyOg,Unknown,English,2017-10-11 00:58:00,2017-10-11 00:58:00,4741,1620,1947,,0
briigevastr,Anti-Trump Actor Clooney Embarrasses Himself with Weak Statement on Weinstein https://t.co/Lte9C3tsZA,Unknown,English,2017-10-11 01:08:00,2017-10-11 01:08:00,4741,1621,1948,,0
briigevastr,ESPN Commentator Compares Jerry Jones to Slave Owner for Telling Players to Stand https://t.co/WWW5jZZSi7,Unknown,English,2017-10-11 01:38:00,2017-10-11 01:38:00,4741,1623,1949,,0
briigevastr,Sarah Huckabee Sets Reporter Spreading Fake News on Trump Straight! https://t.co/VJE5Q4YowZ,Unknown,English,2017-10-11 01:38:00,2017-10-11 01:38:00,4741,1623,1950,,0
briigevastr,Why the Latest Revised Vegas Massacre “Official Story” is Not Adding Up https://t.co/hBLGnjCplN,Unknown,English,2017-10-11 14:08:00,2017-10-11 14:08:00,4740,1619,1952,,0
briigevastr,BREAKING REPORT: President Trump to Visit Korean Border https://t.co/7wOSjERpk8,Unknown,English,2017-10-11 14:08:00,2017-10-11 14:08:00,4740,1619,1951,,0
briigevastr,OOPS! Twitter’s Ban of Marsha Blackburn’s Ad BACKFIRES! https://t.co/0Kn5cqOP30,Unknown,English,2017-10-11 14:13:00,2017-10-11 14:13:00,4740,1619,1954,,0
briigevastr,Scientists Discover Mars Once Had a MASSIVE Lake https://t.co/ZXKH4Zp75a,Unknown,English,2017-10-11 14:13:00,2017-10-11 14:13:00,4740,1619,1957,,0
briigevastr,VIDEO: Napolitano – Change in Official Timeline Big Trouble for Mandalay Bay https://t.co/02l9vYsiAB,Unknown,English,2017-10-11 14:13:00,2017-10-11 14:13:00,4740,1619,1953,,0
briigevastr,Dem Politician Vows to ARREST ICE Agents Enforcing Federal Law https://t.co/bOC4Vb6cCd,Unknown,English,2017-10-11 14:13:00,2017-10-11 14:13:00,4740,1619,1959,,0
briigevastr,BREAKING: U.S. Just Deployed B1-Bombers https://t.co/oqxI9Xt7bb,Unknown,English,2017-10-11 14:13:00,2017-10-11 14:13:00,4740,1619,1958,,0
briigevastr,"Lindsay Lohan Defends Weinstein, Urges Americans to “Stand Up” For Him https://t.co/IqMegzRrkO",Unknown,English,2017-10-11 14:13:00,2017-10-11 14:13:00,4740,1619,1955,,0
briigevastr,CRINGE VIDEO: Eminem Goes on Anti-Trump Rant on BET Awards https://t.co/T3pCa6l3zL,Unknown,English,2017-10-11 14:13:00,2017-10-11 14:13:00,4740,1619,1956,,0
briigevastr,The Obamas FINALLY Speak About Accused RAPIST and Friend Harvey Weinstein https://t.co/GDLfTSDuDR,Unknown,English,2017-10-11 14:18:00,2017-10-11 14:18:00,4740,1620,1961,,0
briigevastr,Michelle Obama Just got SMOKED by Diamond and Silk  https://t.co/HiiKmTEDla,Unknown,English,2017-10-11 14:18:00,2017-10-11 14:18:00,4740,1620,1960,,0
briigevastr,BREAKING: Trump Scores Another Supreme Court Victory! https://t.co/aOFSPt1buV,Unknown,English,2017-10-11 14:18:00,2017-10-11 14:18:00,4740,1620,1962,,0
briigevastr,Trump Acknowledges VICTORY Over NFL In New Tweet https://t.co/QfHAKPx5IL,Unknown,English,2017-10-11 14:18:00,2017-10-11 14:18:00,4740,1620,1964,,0
briigevastr,Actress Heather Graham Confirms EVERYONE Knew About Weinstein https://t.co/czPo1yz9EK,Unknown,English,2017-10-11 14:18:00,2017-10-11 14:18:00,4740,1620,1966,,0
briigevastr,Harvey Weinstein Donated to Bill Clinton’s Sex Assault Legal Defense Fund https://t.co/TwY3dtI63z,Unknown,English,2017-10-11 14:18:00,2017-10-11 14:18:00,4740,1620,1963,,0
briigevastr,Here’s the REAL Reason Roger Goodell Has The NFL Standing for the Anthem Again https://t.co/EqfZ7ZSiZR,Unknown,English,2017-10-11 14:18:00,2017-10-11 14:18:00,4740,1620,1965,,0
