author_id,content,region,language,publish_date,harvested_date,following,followers,updates,post_type,retweet
briigevastr,BREAKING : Judge Rules Against Antifa! https://t.co/Uw30hMyopt https://t.co/vPrB48SULi,Unknown,English,2017-08-25 19:02:00,2017-08-25 19:04:00,0,0,2,,0
briigevastr,CNN’s Chris Cuomo Just Compared Antifa Thugs to World War II Heroes https://t.co/apvXxnassm https://t.co/Mvs0FsesXx,Unknown,English,2017-08-25 19:02:00,2017-08-25 19:02:00,0,0,1,,0
briigevastr,Violent Liberal Arrested for SUCKER PUNCHING Black Trump Supporter https://t.co/SWB3QNdSTv https://t.co/oQ2HezfTuZ,Unknown,English,2017-08-25 19:17:00,2017-08-25 19:17:00,0,0,4,,0
briigevastr,Idiotic Dem Lawmaker Tells Wolf Blitzer Trump is Behaving Like a German “Nazi” https://t.co/ALJPD4W9Tr https://t.co/dPp9Z5JqmX,Unknown,English,2017-08-25 19:17:00,2017-08-25 19:17:00,0,0,5,,0
briigevastr,Disgraceful Liberal Media Attacks Trump’s Black Audience Members https://t.co/BNTBSR2ceH https://t.co/m3jlqUN716,Unknown,English,2017-08-25 19:17:00,2017-08-25 19:17:00,0,0,8,,0
briigevastr,This Perfect Description of “WHY DEMS LOSE” is VIRAL! https://t.co/3yvEYDFdnS https://t.co/ST6AEDidlk,Unknown,English,2017-08-25 19:17:00,2017-08-25 19:17:00,0,0,6,,0
briigevastr,BREAKING : NY Cop Sues Over De Blasio’s Anti-Police Policies https://t.co/H6dqU3ZGyG https://t.co/FTFGfIQoeU,Unknown,English,2017-08-25 19:17:00,2017-08-25 19:17:00,0,0,3,,0
briigevastr,David Axelrod WARNS Dems Foolishly Trying to “Impeach Trump” https://t.co/AguR0UbMOm https://t.co/JnLmmWnxlI,Unknown,English,2017-08-25 19:17:00,2017-08-25 19:17:00,0,0,7,,0
briigevastr,INCREDIBLE! Conservative Celeb Will Be Heading Up Trump’s Fitness Council! https://t.co/OhhviRNiaR https://t.co/w7RFqqxeIJ,Unknown,English,2017-08-25 19:32:00,2017-08-25 19:32:00,0,0,11,,0
briigevastr,"NEW POLL : Americans Blame DC Elites for Failures, Not Trump https://t.co/OvQONAFUWB https://t.co/31ULPh8Z4j",Unknown,English,2017-08-25 19:32:00,2017-08-25 19:32:00,0,0,28,,0
briigevastr,BOOM! Chuck Woolery Just Tweeted THIS about Mitch McConnell https://t.co/osyjeFUSSA https://t.co/fYeCVY0D98,Unknown,English,2017-08-25 19:32:00,2017-08-25 19:32:00,0,0,10,,0
briigevastr,BREAKING : Over 700 Troops Deployed in Texas! Widespread Evacuations! https://t.co/IMxEdabx8j https://t.co/lohLsrsZn5,Unknown,English,2017-08-25 19:32:00,2017-08-25 19:32:00,0,0,17,,0
briigevastr,How Much Macron Spent on Makeup Will Leave You SPEECHLESS https://t.co/XqkCxQcjQw https://t.co/b8NYhl8SxS,Unknown,English,2017-08-25 19:32:00,2017-08-25 19:32:00,0,0,19,,0
briigevastr,BREAKING! President Trump FIRES BACK at Obama Deep State Stooge! https://t.co/Ww1WJcsHVQ https://t.co/LC7TZSMZ4s,Unknown,English,2017-08-25 19:32:00,2017-08-25 19:32:00,0,0,12,,0
briigevastr,Rosie Tries to Mock Trump For a Typo and Fails MISERABLY https://t.co/wR9LK57hLA https://t.co/ITacfnujmT,Unknown,English,2017-08-25 19:32:00,2017-08-25 19:32:00,0,0,18,,0
briigevastr,Alt-Left Leader Vows to CRUSH SKULLS at Peaceful “Patriot Prayer” Rally https://t.co/YMDuSgb3zv https://t.co/JvfPNmTPRn,Unknown,English,2017-08-25 19:32:00,2017-08-25 19:32:00,0,0,13,,0
briigevastr,ESPN Has PROVEN How ABSURD “PC Culture” Has Become! https://t.co/PyXWZ2IANp https://t.co/JJ8mXqp96T,Unknown,English,2017-08-25 19:32:00,2017-08-25 19:33:00,0,0,20,,0
briigevastr,Liberals are Now Claiming Dolly Parton is “Racist” https://t.co/i3akoUfZnd https://t.co/gxhI8YvFeb,Unknown,English,2017-08-25 19:32:00,2017-08-25 19:32:00,0,0,14,,0
briigevastr,WHOA! A Federal Judge Just Took a Vote Away From Senate Dems! https://t.co/3mT9Ih25dW https://t.co/YIs2lR807D,Unknown,English,2017-08-25 19:32:00,2017-08-25 19:33:00,0,0,24,,0
briigevastr,Kellyanne Conway Just EXPOSED Nancy Pelosi! https://t.co/utgHEHy6hr https://t.co/wu8gyuzEB4,Unknown,English,2017-08-25 19:32:00,2017-08-25 19:32:00,0,0,25,,0
briigevastr,BREAKING : Trump Seriously Considering Ending Obama’s DACA https://t.co/Q7HU6ZepgA https://t.co/3sk0AG7Vro,Unknown,English,2017-08-25 19:32:00,2017-08-25 19:32:00,0,0,27,,0
briigevastr,Tucker Goes NUCLEAR on Hillary For Calling Trump a “Creep” https://t.co/9nug20Mbxp https://t.co/iKPxHBs9gl,Unknown,English,2017-08-25 19:32:00,2017-08-25 19:32:00,0,0,9,,0
briigevastr,WHAT??? Watch Liberal Protesters Blame Trump for Kaepernick Not Getting Hired https://t.co/Hth3KTJko2 https://t.co/5WVK3XRGM5,Unknown,English,2017-08-25 19:32:00,2017-08-25 19:32:00,0,0,21,,0
briigevastr,WHAT??? MSNBC Thinks Trump May be Charged With a CRIME For His Speech! https://t.co/IPLdD8TqVN https://t.co/VE6odNGw66,Unknown,English,2017-08-25 19:32:00,2017-08-25 19:32:00,0,0,15,,0
briigevastr,Look What CNN’s Jim Acosta is Whining About NOW! https://t.co/MnulYSDyLU https://t.co/fZmi4qv1F3,Unknown,English,2017-08-25 19:32:00,2017-08-25 19:32:00,0,0,23,,0
briigevastr,This Clever and HILARIOUS Trump-Antifa Meme Has Gone VIRAL! https://t.co/xokEqSvm7U https://t.co/K3coorBYO7,Unknown,English,2017-08-25 19:32:00,2017-08-25 19:33:00,0,0,26,,0
briigevastr,GOP Traitors Trying to Find a 2020 Primary Challenger to Run Against Trump https://t.co/UmvXHxZ4kT https://t.co/gbSVCVxSJA,Unknown,English,2017-08-25 19:47:00,2017-08-25 19:47:00,0,0,29,,0
briigevastr,"Armed Antifa Group Calls for Revolution, Seizing Property and Police Violence https://t.co/Ijp6irftlk https://t.co/0I6fuLFdm7",Unknown,English,2017-08-25 21:32:00,2017-08-25 21:32:00,0,0,34,,0
briigevastr,GOP Do-Nothing Congress Offended By Trump’s VERBAL MOABS https://t.co/ZuMDctvH0E https://t.co/Jrq2pwZVxc,Unknown,English,2017-08-25 21:32:00,2017-08-25 21:32:00,0,0,33,,0
briigevastr,Look What Liberal Troll Stephen King is Doing to “Get Revenge” on Trump https://t.co/VjFDoLMfEo https://t.co/OWVq1ahI7t,Unknown,English,2017-08-25 21:32:00,2017-08-25 21:32:00,0,0,39,,0
briigevastr,Clueless Dems Are Pushing this Nutty EXTREMIST to Run in 2020 https://t.co/dWSy5Yg1bF https://t.co/nbFAH8Ocp9,Unknown,English,2017-08-25 21:32:00,2017-08-25 21:32:00,0,0,31,,0
briigevastr,REPORT: Charlottesville ‘White Supremacist’ Leader on CNN’s Payroll https://t.co/6fsBeNAT10 https://t.co/VMjyuISo38,Unknown,English,2017-08-25 21:32:00,2017-08-25 21:32:00,0,0,32,,0
briigevastr,CNN Stands By Their Claim That 63 Million Trump Voters Are White Supremacists https://t.co/4ErIZDsPZP https://t.co/nEpRQvxl9M,Unknown,English,2017-08-25 21:32:00,2017-08-25 21:32:00,0,0,30,,0
briigevastr,SHOCK VIDEO : White Antifa Thug Arrested for Assaulting Black Trump Supporter! https://t.co/emgJ2FjuP9 https://t.co/jQtqs2S2N5,Unknown,English,2017-08-25 21:32:00,2017-08-25 21:32:00,0,0,35,,0
briigevastr,Look Which Black Sports Legend Liberals Just Labeled a “White Supremacist” https://t.co/Az2gLyMZQu https://t.co/A6Q6qjwsYv,Unknown,English,2017-08-25 21:32:00,2017-08-25 21:32:00,0,0,36,,0
briigevastr,Look What is Selling Like Hotcakes! Liberals are FURIOUS Over This! https://t.co/Opn7pK1qpI https://t.co/4x5qHpStr1,Unknown,English,2017-08-25 21:32:00,2017-08-25 21:32:00,0,0,38,,0
briigevastr,Here’s Why This KEY WITNESS in the Awan IT Scandal is SO MAD! https://t.co/DZQCfGm4VA https://t.co/quvolNBvKM,Unknown,English,2017-08-25 21:32:00,2017-08-25 21:32:00,0,0,37,,0
briigevastr,Watch Roger Stone Explain How Congress Impeaching Trump Would Lead to CIVIL WAR https://t.co/XdUw6VMzgu https://t.co/lVKs8ZzoTl,Unknown,English,2017-08-25 21:47:00,2017-08-25 21:52:00,0,0,41,,0
briigevastr,Liberals More Outraged Over Rights for Illegals than Upcoming Hurricane https://t.co/qGO4M6bI1e https://t.co/hvK6yqP4kc,Unknown,English,2017-08-25 21:47:00,2017-08-25 21:50:00,0,0,45,,0
briigevastr,Stacey Dash Gives Mad Max a Piece of Her Mind and It’s GLORIOUS! https://t.co/QnM2ZBxzyB https://t.co/mMxrvFB0kh,Unknown,English,2017-08-25 21:47:00,2017-08-25 21:50:00,0,0,42,,0
briigevastr,UN Human Rights Experts Issue “Dire Warning” to Trump https://t.co/vegpysdI1l https://t.co/CnZiBHkj29,Unknown,English,2017-08-25 21:47:00,2017-08-25 21:51:00,0,0,44,,0
briigevastr,BREAKING: James Comey Lands New Gig… but Is It Just a Publicity Stunt? https://t.co/sBUwmNptXA https://t.co/oS4bCIr2BX,Unknown,English,2017-08-25 21:47:00,2017-08-25 21:52:00,0,0,40,,0
briigevastr,Trump Supporters React to Antifa Thug Getting HIT in the Groin with Tear Gas! https://t.co/Ul8s7ArlQ0 https://t.co/XNQeJvM8af,Unknown,English,2017-08-25 21:47:00,2017-08-25 21:51:00,0,0,43,,0
briigevastr,Liberals in Minnesota Want to Replace This HISTORIC Statue With Prince https://t.co/fAKxRVEqEb https://t.co/AJBWHer394,Unknown,English,2017-08-25 22:17:00,2017-08-25 22:22:00,0,0,47,,0
briigevastr,Crybaby Acosta Gets SCHOOLED After He Uses the Hurricane to Attack Trump https://t.co/hts7N9Nq8J https://t.co/RCUumvTqnn,Unknown,English,2017-08-25 22:17:00,2017-08-25 22:25:00,0,0,46,,0
briigevastr,BREAKING : North Korea Launches Missile https://t.co/0QSQneA2og https://t.co/iu6mVGS5Zx,Unknown,English,2017-08-26 23:32:00,2017-08-26 23:32:00,0,0,48,,0
briigevastr,Look Which Legendary Singer Just Gave Kid Rock a THUMBS UP For Senate! https://t.co/dIv2sIFHHm https://t.co/aH9wbrlMw8,Unknown,English,2017-08-26 23:47:00,2017-08-26 23:47:00,0,0,49,,0
briigevastr,LIARS! Liberal Mag Claims the Media is “MORE THAN FAIR” to Conservatives https://t.co/1VDk0K4xzY https://t.co/4IGkgDX08D,Unknown,English,2017-08-26 23:47:00,2017-08-26 23:47:00,0,0,51,,0
briigevastr,BREAKING: North Korea’s Latest Missile Test Fails Miserably! https://t.co/Ns8b4giKpv https://t.co/eLzJSwQxRo,Unknown,English,2017-08-26 23:47:00,2017-08-26 23:47:00,0,0,61,,0
briigevastr,Grab the Popcorn! Howard Dean is Feuding with OBAMA! https://t.co/F0Wt49gu9u https://t.co/s8jljZMojr,Unknown,English,2017-08-26 23:47:00,2017-08-26 23:47:00,0,0,53,,0
briigevastr,WTF?! Left-Wing Website Labels Charles Barkley a “White Supremacist” https://t.co/L5WzuuBug3 https://t.co/AxbIPnTMHl,Unknown,English,2017-08-26 23:47:00,2017-08-26 23:47:00,0,0,55,,0
briigevastr,BREAKING! It’s OFFICIAL! He’s Been Pardoned! https://t.co/NOb5dLLX9F https://t.co/GVVeg9EnPX,Unknown,English,2017-08-26 23:47:00,2017-08-26 23:47:00,0,0,58,,0
briigevastr,Look How BLM Leader Shaun King Reacted to Trump Pardoning Sheriff Joe! https://t.co/zwR4sUYMcm https://t.co/mIpTIUnGLF,Unknown,English,2017-08-26 23:47:00,2017-08-26 23:47:00,0,0,60,,0
briigevastr,BREAKING : 20 Thousand Cruise Ship Passengers Are Stuck at Sea https://t.co/046Re0SqCT https://t.co/qW04Sgg9WF,Unknown,English,2017-08-26 23:47:00,2017-08-26 23:47:00,0,0,50,,0
briigevastr,Watch as Antifa HUNTS DOWN a Trump Supporter to Beat Him Unconscious https://t.co/OKeoXMpk2X https://t.co/a0knX11A0p,Unknown,English,2017-08-26 23:47:00,2017-08-26 23:49:00,0,0,57,,0
briigevastr,PURE EVIL – Soros FLOODING U.S. DA Races with Millions https://t.co/1rEVLXQJJR https://t.co/VC2JByFFfd,Unknown,English,2017-08-26 23:47:00,2017-08-26 23:47:00,0,0,54,,0
briigevastr,Watch Antifa “Fight Racism” by Sucker Punching a Black Trump Supporter  https://t.co/Q3A3M4mqyH https://t.co/gYsFA6IdQH,Unknown,English,2017-08-26 23:47:00,2017-08-26 23:47:00,0,0,52,,0
briigevastr,Trump Supporters REACT to Trump Pardoning Sheriff Joe! https://t.co/RfS30hGIvI https://t.co/V6iLZE7Cxl,Unknown,English,2017-08-26 23:47:00,2017-08-26 23:49:00,0,0,59,,0
briigevastr,Trudeau Learning the Hard Way “Refugees Welcome” is Bankrupting His Country https://t.co/7Gxk6lgyl1 https://t.co/AGBsi05Vgu,Unknown,English,2017-08-26 23:47:00,2017-08-26 23:47:00,0,0,56,,0
briigevastr,Look How Sheriff Joe Just Reacted to the News He’s Been Pardoned! https://t.co/ELSWcBrwBY https://t.co/Mxd7dGcaG8,Unknown,English,2017-08-26 23:47:00,2017-08-26 23:48:00,0,0,62,,0
briigevastr,BREAKING VIDEO : Hurricane Harvey is WREAKING HAVOC! https://t.co/jF89fvIHXD https://t.co/H65VpZZkfe,Unknown,English,2017-08-27 00:02:00,2017-08-27 00:02:00,0,0,64,,0
briigevastr,Fake Pardon Outrage Just Another EXCUSE for Traitor Mccain to Attack Trump https://t.co/RSvyupW4P7 https://t.co/m4tsq9Yy68,Unknown,English,2017-08-27 00:02:00,2017-08-27 00:02:00,0,0,65,,0
briigevastr,Disgraceful Liberals Use Hurricane Harvey to Take Shots at Trump https://t.co/Q1IQ2bcjUg https://t.co/4bnaEZNOU6,Unknown,English,2017-08-27 00:02:00,2017-08-27 00:03:00,0,0,68,,0
briigevastr,Leftists Just KILLED a Diverse Prayer Rally By Falsely Screaming “NAZI!” https://t.co/cqiiJIMYRO https://t.co/2TGsfx9D2X,Unknown,English,2017-08-27 00:02:00,2017-08-27 00:02:00,0,0,69,,0
briigevastr,BREAKING : Sebastian Gorka Resigns From the White House https://t.co/Esa0UOUfmc https://t.co/NFhBhSvu3q,Unknown,English,2017-08-27 00:02:00,2017-08-27 00:03:00,0,0,67,,0
briigevastr,Traitor John Mccain FURIOUS Over Arpaio’s Pardon. Look What He Said! https://t.co/TaFbdp4jta https://t.co/mDoYS9WcSu,Unknown,English,2017-08-27 00:02:00,2017-08-27 00:03:00,0,0,63,,0
briigevastr,Look Which Statues History Destroying Liberals are Attacking NOW https://t.co/ZDmtQhLZA3 https://t.co/qGpa8sxrBW,Unknown,English,2017-08-27 00:02:00,2017-08-27 00:02:00,0,0,66,,0
briigevastr,BIG REMINDER : The KKK Wanted to Tear Down Statues Too https://t.co/uyKlnMTE2Z https://t.co/OPtS62jBma,Unknown,English,2017-08-27 00:17:00,2017-08-27 00:17:00,0,0,74,,0
briigevastr,"HEY LIBERALS! Obama Pardoned Nearly 2,000 Convicted Criminals in 8 Years! https://t.co/RDLlnbLaC6 https://t.co/tzphQjh2Ki",Unknown,English,2017-08-27 00:17:00,2017-08-27 00:18:00,0,0,78,,0
briigevastr,LOL : Hollywood Celebs LASH OUT Over Sheriff Joe Pardon https://t.co/Sh5PSa4jSq https://t.co/HAYiOWPQZ6,Unknown,English,2017-08-27 00:17:00,2017-08-27 00:17:00,0,0,73,,0
briigevastr,"Liberals Implode, Say Sheriff Joe Pardon is an ‘Attack on the Constitution’ https://t.co/tCM3kHwQh0 https://t.co/iUlb2gy3VH",Unknown,English,2017-08-27 00:17:00,2017-08-27 00:17:00,0,0,71,,0
briigevastr,#AltLeft Antifa Website just got BANNED for its Role in THIS Violent Riot! https://t.co/pLzcV4sc8G https://t.co/3ofzTek0wc,Unknown,English,2017-08-27 00:17:00,2017-08-27 00:17:00,0,0,72,,0
briigevastr,Watch Tucker School a NAACP Liberal Who Demands a NFL Team Hire Kaepernick https://t.co/G9qvd0Kv1U https://t.co/3Ttf3aCl3O,Unknown,English,2017-08-27 00:17:00,2017-08-27 00:17:00,0,0,70,,0
briigevastr,VIDEO : Libs All Using the EXACT SAME Phrase to Feign Outrage Over Arpaio Pardon https://t.co/DZOHsb4Hog https://t.co/tn2Qn7zNaB,Unknown,English,2017-08-27 00:17:00,2017-08-27 00:17:00,0,0,76,,0
briigevastr,Trump Supporters REJOICE Over Sheriff Joe’s Pardon! https://t.co/37vFdaPlmG https://t.co/oJEopNoHra,Unknown,English,2017-08-27 00:17:00,2017-08-27 00:17:00,0,0,77,,0
briigevastr,Look What Sheriff Clarke Said About Arpaio’s Pardon https://t.co/ozFpCeGdkM https://t.co/Zp3fGX6qS1,Unknown,English,2017-08-27 00:17:00,2017-08-27 00:17:00,0,0,75,,0
briigevastr,Ann Coulter Reacts to Sheriff Joe Arpaio’s Pardon! https://t.co/DIt5vFc82R https://t.co/fH1cKBzASE,Unknown,English,2017-08-27 00:32:00,2017-08-27 00:32:00,0,0,81,,0
briigevastr,BLM Co-Founder Accuses Trump of Something Completely RIDICULOUS! https://t.co/pX8fqBlSsu https://t.co/U2m2gcoV1p,Unknown,English,2017-08-27 00:32:00,2017-08-27 00:33:00,0,0,90,,0
briigevastr,President Trump Shows the World Powerful Leadership During #HurricaneHarvey  https://t.co/CuSPDUsFNk https://t.co/xug48cb0t6,Unknown,English,2017-08-27 00:32:00,2017-08-27 00:33:00,0,0,92,,0
briigevastr,LOL : Fox News Reporter DESTROYS CNN’s Jim Acosta  https://t.co/k4xoy7hJgw https://t.co/tRH7rZaSAb,Unknown,English,2017-08-27 00:32:00,2017-08-27 00:32:00,0,0,87,,0
briigevastr,BREAKING : Trump Reveals New “Extreme Vetting” Requirements! https://t.co/yklG7S78JY https://t.co/6cxPzgz2J0,Unknown,English,2017-08-27 00:32:00,2017-08-27 00:32:00,0,0,83,,0
briigevastr,Leaked Memo Exposes Secret Closed Door Charlottesville Meeting https://t.co/2Uage5Oy79 https://t.co/ji8yBViwJu,Unknown,English,2017-08-27 00:32:00,2017-08-27 00:33:00,0,0,93,,0
briigevastr,Over 120 Murders Directly Tied to Obama’s Release of Illegals in 2015 Alone https://t.co/RaR1iNm0uZ https://t.co/i4mGXhBTtX,Unknown,English,2017-08-27 00:32:00,2017-08-27 00:32:00,0,0,85,,0
briigevastr,Liberal Violence Forces a Pro-Trump Rally to be CANCELED https://t.co/2DM5IjiT0a https://t.co/p2jGTyIIVX,Unknown,English,2017-08-27 00:32:00,2017-08-27 00:32:00,0,0,89,,0
briigevastr,Antifa Thug In Viral Video Just Got Some VERY BAD News https://t.co/UOJ1so7taj https://t.co/upxmzDNfYT,Unknown,English,2017-08-27 00:32:00,2017-08-27 00:33:00,0,0,91,,0
briigevastr,WTF? MSNBC Host Tries to Accuse Texas of Using Hurricane to Deport Illegals https://t.co/Fi2eLc9TAJ https://t.co/nu1HrLL8dd,Unknown,English,2017-08-27 00:32:00,2017-08-27 00:32:00,0,0,88,,0
briigevastr,Pro-Trump Challenger Takes Commanding Lead Over Anti-Trump Senator  https://t.co/WWiFDI9SVM https://t.co/G4sRcwYNOo,Unknown,English,2017-08-27 00:32:00,2017-08-27 00:32:00,0,0,84,,0
briigevastr,Alyssa Milano Tries Accusing Trump of Narcissism and It BACKFIRES FAST! https://t.co/Y0ea4NK6N7 https://t.co/Mros3eewDj,Unknown,English,2017-08-27 00:32:00,2017-08-27 00:32:00,0,0,80,,0
briigevastr,WOW! CNN Neglects Hurricane Harvey So They Can Complain About Trump https://t.co/wo2Ri3wD8e https://t.co/SqLM09563e,Unknown,English,2017-08-27 00:32:00,2017-08-27 00:32:00,0,0,86,,0
briigevastr,Texas Governor Praises Trump’s SWIFT Response to #HurricaneHarvey https://t.co/myVefHHdGA https://t.co/WjV5iV9hAD,Unknown,English,2017-08-27 00:32:00,2017-08-27 00:33:00,0,0,94,,0
briigevastr,Obama Pardoned a Crack Dealer Who Murdered 3 People Upon Release https://t.co/S88taCYoEb https://t.co/2lUdaAfurV,Unknown,English,2017-08-27 00:32:00,2017-08-27 00:32:00,0,0,79,,0
briigevastr,It’s OFFICIAL! Trump Signs the Order! https://t.co/L82uSC7J9B https://t.co/cVgEyccigX,Unknown,English,2017-08-27 00:32:00,2017-08-27 00:32:00,0,0,82,,0
briigevastr,WOW! This Was Sheriff Arpaio’s Reaction When He Saw Trump’s Pardon https://t.co/0H7RMthkvZ https://t.co/ic1ucFzfor,Unknown,English,2017-08-27 00:47:00,2017-08-27 00:47:00,0,0,99,,0
briigevastr,Liberal Activists Now Want to CENSOR One of the GREATEST FILMS OF ALL TIME! https://t.co/GxTNyvnotm https://t.co/F9367GXUFB,Unknown,English,2017-08-27 00:47:00,2017-08-27 00:47:00,0,0,104,,0
briigevastr,Iowa Teacher Creates ‘Historical Wall of Bullies’ And Guess Who He Added… https://t.co/GsklJIjG43 https://t.co/SqWW4f3Xvc,Unknown,English,2017-08-27 00:47:00,2017-08-27 00:47:00,0,0,100,,0
briigevastr,Traitor Paul Ryan Just Did the UNTHINKABLE! This is SICK! https://t.co/99t3B3V5ac https://t.co/Dinx4CfPwT,Unknown,English,2017-08-27 00:47:00,2017-08-27 00:47:00,0,0,103,,0
briigevastr,MSNBC Clowns are “SHOCKED” Trump Hasn’t BOTCHED the Hurricane https://t.co/xr8C39UmiQ https://t.co/CnmHhrvMil,Unknown,English,2017-08-27 00:47:00,2017-08-27 00:47:00,0,0,96,,0
briigevastr,FLASHBACK: Bill Clinton Pardoned a Filthy Criminal! https://t.co/KipVq61mmx https://t.co/N4VcLXtelt,Unknown,English,2017-08-27 00:47:00,2017-08-27 00:47:00,0,0,97,,0
briigevastr,South Carolina Just Dealt Planned Parenthood a DEVASTATING BLOW! https://t.co/knlAreEcew https://t.co/rErgn7aX1U,Unknown,English,2017-08-27 00:47:00,2017-08-27 00:47:00,0,0,95,,0
briigevastr,LOL : Pelosi’s Father Has DEEP Connection to Confederate Statues! https://t.co/tmBmJ6xG4G https://t.co/qsb34unHu9,Unknown,English,2017-08-27 00:47:00,2017-08-27 00:47:00,0,0,101,,0
briigevastr,Look Which Notorious GOP Traitor is Opposing Trump’s Transgender Military Ban https://t.co/xOunALzWFN https://t.co/042KoNQNRm,Unknown,English,2017-08-27 00:47:00,2017-08-27 00:47:00,0,0,102,,0
briigevastr,BREAKING REPORT! Russia Did NOT Hack The DNC! https://t.co/YyRsRizLZe https://t.co/wg5BZf2Njz,Unknown,English,2017-08-27 00:47:00,2017-08-27 00:47:00,0,0,98,,0
briigevastr,"CNN Anchor Tries to Link Hurricane Harvey to Climate Change, FAILS MISERABLY https://t.co/Kvdntirv9m https://t.co/rhDaGDDrg8",Unknown,English,2017-08-27 00:47:00,2017-08-27 00:47:00,0,0,105,,0
briigevastr,BREAKING : Sheriff Joe PUNCHES BACK at Traitor John McCain https://t.co/HcEM3xMYRS https://t.co/wkUSv0MIhU,Unknown,English,2017-08-27 16:02:00,2017-08-27 16:03:00,994,79,107,,0
briigevastr,TX Gov Abbot Praises Trump’s Handling of Hurricane Harvey. Look What He Said! https://t.co/oe90mXw1fw https://t.co/YEzRdDFlwl,Unknown,English,2017-08-27 16:02:00,2017-08-27 16:03:00,994,79,111,,0
briigevastr,BREAKING : Christian Group SUES SPLC and Amazon! Look What They Found Out! https://t.co/RJ7JuHW0Fe https://t.co/YxCbQYkI7k,Unknown,English,2017-08-27 16:02:00,2017-08-27 16:03:00,994,79,113,,0
briigevastr,BREAKING : Tragic Death in Latest Islamic Terror Attack https://t.co/FPy6dRbub1 https://t.co/w7e03wKs7t,Unknown,English,2017-08-27 16:02:00,2017-08-27 16:02:00,994,79,109,,0
briigevastr,GOP TRAITOR Sides With Dems on ERASING U.S. History! Look Who It Is! https://t.co/RoOSpIKTMv https://t.co/CPtOpFdDhx,Unknown,English,2017-08-27 16:02:00,2017-08-27 16:03:00,994,79,110,,0
briigevastr,BREAKING : Elizabeth Warren REFUSES to Truly Condemn Antifa! https://t.co/sWGX5FQGQt https://t.co/y0xpp25YZ8,Unknown,English,2017-08-27 16:02:00,2017-08-27 16:03:00,994,79,112,,0
briigevastr,FLASHBACK: Remember the Time Bill Clinton Pardoned His OWN BROTHER? https://t.co/ushTeL91Sf https://t.co/GeP8P4tkaN,Unknown,English,2017-08-27 16:02:00,2017-08-27 16:02:00,994,79,106,,0
briigevastr,"Joy Reid Tries to Make a “Nazi” Joke, But it BACKFIRES Fast! https://t.co/ifGXNM3PzW https://t.co/Qfm4hBA4kC",Unknown,English,2017-08-27 16:02:00,2017-08-27 16:02:00,994,79,108,,0
briigevastr,Watch How President Trump Just Honored Our Troops! https://t.co/BCqU13hnFG https://t.co/rmvEDVMYS5,Unknown,English,2017-08-27 16:03:00,2017-08-27 16:03:00,994,79,116,,0
briigevastr,BREAKING : Third Gender Officially Announced! https://t.co/9zwm7yMiRU https://t.co/SlB5U9Y04C,Unknown,English,2017-08-27 16:03:00,2017-08-27 16:03:00,994,79,118,,0
briigevastr,Singer Joy Villa is TAKING A STAND Against the Anti-Trump Entertainment Industry! https://t.co/c4g3c2RoL1 https://t.co/YSQt6PJOQY,Unknown,English,2017-08-27 16:03:00,2017-08-27 16:03:00,994,79,115,,0
briigevastr,Watch Antifa Clash With A Journalist then Get VIOLENT! https://t.co/6Z2cKTjpmD https://t.co/0BfTeXx1yW,Unknown,English,2017-08-27 16:03:00,2017-08-27 16:03:00,994,79,119,,0
briigevastr,BACKLASH! Liberal Hollywood Getting CRUSHED With Record Low Attendance! https://t.co/9mJN3Ynxaa https://t.co/PoewgMP9R2,Unknown,English,2017-08-27 16:03:00,2017-08-27 16:03:00,994,79,114,,0
briigevastr,BREAKING : New Eyewitness Evidence Emerges that Charlottesville Was a Set-Up https://t.co/z3CFWXLnrw https://t.co/YUqNkLEfiC,Unknown,English,2017-08-27 16:03:00,2017-08-27 16:03:00,994,79,117,,0
briigevastr,Corrupt Dem Senator BANNED from Voting Asks Judge to Bend the Rules So He Still Can https://t.co/Fl5BkjglMh https://t.co/oTowobf90J,Unknown,English,2017-08-27 16:17:00,2017-08-27 16:17:00,993,79,120,,0
briigevastr,Marine DESTROYS Wasserman Schultz Over Her “Islamophobia” Awan Excuse https://t.co/jzDTjTzcpW https://t.co/tgQOHkJGwB,Unknown,English,2017-08-27 16:17:00,2017-08-27 16:17:00,993,79,122,,0
briigevastr,Watch How President Trump Just Honored Our Troops! https://t.co/Oo6wXD0gPj https://t.co/php1EsO0e6,Unknown,English,2017-08-27 16:17:00,2017-08-27 16:17:00,993,79,123,,0
briigevastr,Eminem Decides to Bash Trump After Forgetting His Own Lyrics https://t.co/L6K6zn7k0z https://t.co/xBt1tmNBb9,Unknown,English,2017-08-27 19:32:00,2017-08-27 19:32:00,993,96,125,,0
briigevastr,Social Justice Warriors Want Veterans BANNED From Attending College https://t.co/7qekAWk01T https://t.co/uNc5ICLaZY,Unknown,English,2017-08-27 19:32:00,2017-08-27 19:32:00,993,96,126,,0
briigevastr,"This SHOCKING “Before and After” Photo of Houston, TX Is Viral https://t.co/OjZLkSj0ZE https://t.co/NMJT0TR2gc",Unknown,English,2017-08-27 19:32:00,2017-08-27 19:32:00,993,96,124,,0
briigevastr,BREAKING : Look What Trump Just Said About NAFTA and Mexico! https://t.co/eg1YBJJykr https://t.co/7bDaZhWkUi,Unknown,English,2017-08-27 19:32:00,2017-08-27 19:32:00,993,96,127,,0
briigevastr,This Reporter Saving “Old Glory” From Hurricane Harvey Will Bring a Tear to Your Eye! https://t.co/2ngw8BIUkr https://t.co/Zp6kLBN2iX,Unknown,English,2017-08-27 22:32:00,2017-08-27 22:32:00,993,100,133,,0
briigevastr,“White Shaming” is the NEW RAGE on Liberal College Campuses https://t.co/qVVNsT5e9b https://t.co/rN8IBqJpTY,Unknown,English,2017-08-27 22:32:00,2017-08-27 22:32:00,993,100,132,,0
briigevastr,Trump Just Reminded Mexico of Something They WILL BE PAYING FOR! https://t.co/8RGotWhu1T https://t.co/EwKQibfEOl,Unknown,English,2017-08-27 22:32:00,2017-08-27 22:32:00,993,100,131,,0
briigevastr,This Rant Exposing The TRUTH About Traitor John Mccain Is VIRAL! https://t.co/XzlGE1835M https://t.co/CN08AsMRvH,Unknown,English,2017-08-27 22:32:00,2017-08-27 22:32:00,993,100,128,,0
briigevastr,FLASHBACK: Jeff Flake’s Son Linked to Death of 17 Dogs https://t.co/qFyQc0pDdY https://t.co/2VlnFAZZKR,Unknown,English,2017-08-27 22:32:00,2017-08-27 22:32:00,993,100,129,,0
briigevastr,SHOCKING Viral Photo of Nursing Home Flood Victims Proven AUTHENTIC https://t.co/CbNUOMtSRS https://t.co/QOMD6p5AYj,Unknown,English,2017-08-27 22:32:00,2017-08-27 22:32:00,993,100,130,,0
briigevastr,"DOH! Chelsea Clinton Tries to Attack Sheriff Arpaio, Fails MISERABLY! https://t.co/bLHxomlPpn https://t.co/c5JGg6VhiN",Unknown,English,2017-08-27 22:47:00,2017-08-27 22:47:00,993,101,134,,0
briigevastr,Gorka Issues Ominous Warning – Hillary Supporters Have Infiltrated! https://t.co/YE3DLx0XrR https://t.co/AeI1Evp5ll,Unknown,English,2017-08-28 00:02:00,2017-08-28 00:02:00,993,105,135,,0
briigevastr,Mad Max Has a Theory on Trump Pardoning Sheriff Arpaio and it’s a DOOZY! https://t.co/y4v5XugSm7 https://t.co/HWifHrrnLe,Unknown,English,2017-08-28 00:17:00,2017-08-28 00:17:00,993,106,137,,0
briigevastr,REPORT : CONVICTION of Obama IRS Officials Likely https://t.co/biDPHop5Is https://t.co/zm9u6wNBLv,Unknown,English,2017-08-28 00:17:00,2017-08-28 00:17:00,993,106,136,,0
