author_id,content,region,language,publish_date,harvested_date,following,followers,updates,post_type,retweet
AlbuquerqueOn,Even more places to play at Tingley Beach this winter! https://t.co/5BaFjc2Yuo #WeAreABQ #GetOutside #Playtime https://t.co/HZNGtKzZYT,Unknown,English,2016-11-27 00:47:00,2016-11-27 00:47:00,60,1,1,R,1
AlbuquerqueOn,"Albuquerque Fire Department investigates fires at Barnes and Noble, Old Navy https://t.co/GQkewPYICg https://t.co/W8gpclt2m0",Unknown,English,2016-11-27 03:36:00,2016-11-27 03:37:00,60,1,2,,0
AlbuquerqueOn,Portable classroom at elementary school gutted by fire this morning https://t.co/aBJfxrZ1qV https://t.co/4otVwmBUSW,Unknown,English,2016-11-27 03:40:00,2016-11-27 03:40:00,60,1,3,,0
AlbuquerqueOn,River of Lights opens at Albuquerque BioPark https://t.co/mPJJS2YEaN https://t.co/uJ5jXx0xCG,Unknown,English,2016-11-27 04:37:00,2016-11-27 04:37:00,60,2,4,,0
AlbuquerqueOn,Saturday evening weather forecast https://t.co/fwWB6Cd1QN https://t.co/oBvAPKyzDU,Unknown,English,2016-11-27 05:10:00,2016-11-27 05:10:00,60,2,5,,0
AlbuquerqueOn,Burlesque performers raise money for homeless shelter https://t.co/mXZ71DBJn8 https://t.co/ngd7coTsaL,Unknown,English,2016-11-27 06:10:00,2016-11-27 06:10:00,60,2,6,,0
AlbuquerqueOn,"Albuquerque man's truck stolen twice, recovered twice https://t.co/1pZmf6XW2w https://t.co/X9lhF2Q1Fw",Unknown,English,2016-11-27 18:10:00,2016-11-27 18:10:00,60,1,7,,0
AlbuquerqueOn,River of Lights returns to the BioPark https://t.co/pFCitLV7ZA https://t.co/19kKrR6wZX,Unknown,English,2016-11-27 18:40:00,2016-11-27 18:40:00,60,1,8,,0
AlbuquerqueOn,Eye on New Mexico: Giving Tuesday https://t.co/cgChFnPTVs https://t.co/OMteDAiVEF,Unknown,English,2016-11-27 20:10:00,2016-11-27 20:10:00,60,1,9,,0
AlbuquerqueOn,New Mexico revokes hunting privileges in poaching case https://t.co/AetbqKYwGz https://t.co/1IqKoYbWpJ,Unknown,English,2016-11-27 20:40:00,2016-11-27 20:40:00,60,2,10,,0
AlbuquerqueOn,Texas oil company looks to boost production in New Mexico https://t.co/zoXlDSgsgB https://t.co/lrFbjjFANH,Unknown,English,2016-11-27 21:10:00,2016-11-27 21:10:00,60,2,11,,0
AlbuquerqueOn,Bear raids family’s fridge https://t.co/oL8DbmcDw5 https://t.co/MYYw8z3mcV,Unknown,English,2016-11-27 23:40:00,2016-11-27 23:40:00,60,2,12,,0
AlbuquerqueOn,POLICE: Nude man shot while breaking into home https://t.co/jrVxXbHPlg https://t.co/1XDRLmvY0v,Unknown,English,2016-11-28 00:10:00,2016-11-28 00:10:00,60,3,13,,0
AlbuquerqueOn,Several ATMs in Albuquerque riddled with bullets https://t.co/78bEIh0m1a https://t.co/hpqk0txf7q,Unknown,English,2016-11-28 00:40:00,2016-11-28 00:40:00,60,2,14,,0
AlbuquerqueOn,Krampus stampedes through Austrian town ahead of Christmas https://t.co/YInrBayoFg https://t.co/BwhxdC8BXN,Unknown,English,2016-11-28 01:10:00,2016-11-28 01:10:00,60,3,15,,0
AlbuquerqueOn,Teen fights for her life after Thanksgiving Day car crash https://t.co/HzSmUOlRZ3 https://t.co/HgfTrv7Ozi,Unknown,English,2016-11-28 01:40:00,2016-11-28 01:40:00,60,3,16,,0
AlbuquerqueOn,Team of federal investigators in Albuquerque to investigate Nob Hill condo fire https://t.co/fmOoLN59K3 https://t.co/iUKDgZGKm4,Unknown,English,2016-11-28 02:37:00,2016-11-28 02:37:00,60,3,17,,0
AlbuquerqueOn,Charges dropped against former Las Cruces police officers in alleged holding cell assa... https://t.co/BaPVVuNo4K https://t.co/Ou2FEL9gLd,Unknown,English,2016-11-28 03:40:00,2016-11-28 03:40:00,60,3,18,,0
AlbuquerqueOn,Albuquerque man shot multiple times while allegedly trying to break into houses https://t.co/Bk2I2Jrxdr https://t.co/7COjQZmwSn,Unknown,English,2016-11-28 04:07:00,2016-11-28 04:07:00,60,3,19,,0
AlbuquerqueOn,Family heartbroken after Albuquerque mother dies in drunk driving wreck https://t.co/wuTTab38iO https://t.co/k9SrHag4ku,Unknown,English,2016-11-28 05:07:00,2016-11-28 05:08:00,60,3,20,,0
AlbuquerqueOn,ATF is investigating the Carlisle condo fire https://t.co/RDT8IcurdF https://t.co/H3f1GtGZwh,Unknown,English,2016-11-28 06:10:00,2016-11-28 06:10:00,60,3,21,,0
AlbuquerqueOn,"Pressured to be in a relationship come the holidays, Rent-A-Boyfriend https://t.co/3Toja4wTRn https://t.co/UGsxYFuBzb",Unknown,English,2016-11-28 07:10:00,2016-11-28 07:10:00,60,3,22,,0
AlbuquerqueOn,"Wind, snow around New Mexico https://t.co/3nO4GYKRxQ https://t.co/dFCjyqA6Ec",Unknown,English,2016-11-28 12:07:00,2016-11-28 12:07:00,60,3,23,,0
AlbuquerqueOn,Southbound I-25 closed at mile marker 259 due to semi-truck incident https://t.co/q60NLmCNEo https://t.co/HMyF7dXFFB,Unknown,English,2016-11-28 14:10:00,2016-11-28 14:10:00,60,3,24,,0
AlbuquerqueOn,"Monday’s Morning Rush Video, 5 Facts: Wind, snow expected across New Mexico https://t.co/QCsDblEtYE https://t.co/kIqvXx57B3",Unknown,English,2016-11-28 14:37:00,2016-11-28 14:37:00,60,3,25,,0
AlbuquerqueOn,Monday morning weather forecast https://t.co/6LArq5mG9K https://t.co/Owdaqxphl0,Unknown,English,2016-11-28 15:10:00,2016-11-28 15:10:00,60,3,26,,0
AlbuquerqueOn,"Ohio State University: active shooter is on campus, police on scene https://t.co/l7NPBXXGAo https://t.co/WbFvcrKH9i",Unknown,English,2016-11-28 15:37:00,2016-11-28 15:37:00,60,4,27,,0
AlbuquerqueOn,Caffeine with canines: Dog café opens in December https://t.co/Bp19I7yq1E https://t.co/R6colU6u0s,Unknown,English,2016-11-28 16:10:00,2016-11-28 16:10:00,60,4,28,,0
AlbuquerqueOn,Dakota Access pipeline protesters told to leave by Dec. 5 https://t.co/jDQBYBcV2x https://t.co/FrbxyAawXl,Unknown,English,2016-11-28 16:40:00,2016-11-28 16:40:00,60,4,29,,0
AlbuquerqueOn,"The Latest: Ohio St injuries include stab wounds, hit by car https://t.co/szNVJobZC2 https://t.co/SfifacFTMc",Unknown,English,2016-11-28 17:40:00,2016-11-28 17:40:00,60,4,30,,0
AlbuquerqueOn,"AFD responds to early morning fires in Albuquerque, suspect arrested https://t.co/h6IxS0Spz4 https://t.co/GhqITZTqDp",Unknown,English,2016-11-28 18:10:00,2016-11-28 18:11:00,60,4,31,,0
AlbuquerqueOn,New Mexico electric utility to seek another rate increase https://t.co/Y0Kjib5IiI https://t.co/MWAMtRMuY3,Unknown,English,2016-11-28 18:37:00,2016-11-28 18:37:00,60,4,32,,0
AlbuquerqueOn,Man charged in connection with Old Navy store fire https://t.co/Btrq75aHtV https://t.co/9JCiIpLKNR,Unknown,English,2016-11-28 18:40:00,2016-11-28 18:40:00,60,4,33,,0
AlbuquerqueOn,New Mexico electric utility to seek another rate increase https://t.co/pCFeH8M6MZ https://t.co/hjOnBNiTqP,Unknown,English,2016-11-28 19:10:00,2016-11-28 19:10:00,60,4,34,,0
AlbuquerqueOn,Poop package targets porch bandits https://t.co/WqIYB4sJzz https://t.co/uhpIXPG8o9,Unknown,English,2016-11-28 20:10:00,2016-11-28 20:11:00,60,4,35,,0
AlbuquerqueOn,Tips to destress and stay connected during the holidays https://t.co/PLkrnhiO4O https://t.co/GyeUaMnU2b,Unknown,English,2016-11-28 21:10:00,2016-11-28 21:10:00,60,4,36,,0
AlbuquerqueOn,Santa Fe police officers to get refresher course on pot laws https://t.co/Uytcootn6x https://t.co/imUoXBpYGI,Unknown,English,2016-11-28 21:37:00,2016-11-28 21:37:00,60,4,37,,0
AlbuquerqueOn,Supreme Court asks US government's view on mine spill suit https://t.co/kqW0M05ETV https://t.co/ta3OJv0ki8,Unknown,English,2016-11-28 22:10:00,2016-11-28 22:10:00,60,4,38,,0
AlbuquerqueOn,"Trump charges, without evidence, millions voted illegally https://t.co/TE1OJ37m3Y https://t.co/06Cg5Gn545",Unknown,English,2016-11-28 22:40:00,2016-11-28 22:40:00,60,4,39,,0
AlbuquerqueOn,Murder charge against former Albuquerque officer Dominique Perez dropped https://t.co/6TwuHVuDSU https://t.co/U2kMR9wc6t,Unknown,English,2016-11-28 23:07:00,2016-11-28 23:07:00,60,4,40,,0
AlbuquerqueOn,Terrorism suspected in car-and-knife attack at Ohio State https://t.co/IufRWCroRA https://t.co/Ny6LnYzTpz,Unknown,English,2016-11-28 23:10:00,2016-11-28 23:10:00,60,4,41,,0
AlbuquerqueOn,Ring with tribute to New Mexico teen’s mother stolen https://t.co/KVpXTwGHhD https://t.co/DKn3OfkC3M,Unknown,English,2016-11-28 23:37:00,2016-11-28 23:37:00,60,4,42,,0
AlbuquerqueOn,Murder charge against former police officer dismissed https://t.co/sQy5vu4KH0 https://t.co/97HrvjGHLe,Unknown,English,2016-11-28 23:40:00,2016-11-28 23:40:00,60,4,43,,0
AlbuquerqueOn,Albuquerque area expected to see snow Monday night https://t.co/jaPShvdHSj https://t.co/3zq8kgpOQ5,Unknown,English,2016-11-29 00:10:00,2016-11-29 00:10:00,60,4,44,,0
AlbuquerqueOn,Ex-auto burglar gives Santa Fe Police insights https://t.co/7eBJ6PTcMu https://t.co/u4BKHoh7EG,Unknown,English,2016-11-29 00:37:00,2016-11-29 00:37:00,60,4,45,,0
AlbuquerqueOn,Stretch of Rio Grande Blvd. restriped https://t.co/wOUPSrzlnW https://t.co/5fPa469wXA,Unknown,English,2016-11-29 00:40:00,2016-11-29 00:40:00,60,4,46,,0
AlbuquerqueOn,Monday evening weather forecast https://t.co/rJQi01nGe7 https://t.co/kJYbZOIwGe,Unknown,English,2016-11-29 01:10:00,2016-11-29 01:10:00,60,4,47,,0
AlbuquerqueOn,Police charge man with violent carjacking https://t.co/NUkSmQP5vZ https://t.co/MvLY7AyLK5,Unknown,English,2016-11-29 01:40:00,2016-11-29 01:40:00,60,4,48,,0
AlbuquerqueOn,Albuquerque coffee shop to give the ‘parquito’ another try https://t.co/WLaSqSh4cq https://t.co/8y1fGsqSns,Unknown,English,2016-11-29 03:07:00,2016-11-29 03:08:00,60,4,49,,0
AlbuquerqueOn,Orders could have little effect on pipeline protest camp https://t.co/6Yd1fUwUzw https://t.co/D26qle1AOm,Unknown,English,2016-11-29 03:10:00,2016-11-29 03:10:00,60,4,50,,0
AlbuquerqueOn,Suspect in California murder case is arrested in New Mexico https://t.co/iel44IOdLv https://t.co/lonzLLeI7F,Unknown,English,2016-11-29 03:40:00,2016-11-29 03:40:00,60,4,51,,0
AlbuquerqueOn,Santa Fe Police use Facebook videos to promote safety https://t.co/09hBab2uaJ https://t.co/8JKZkaRQ9f,Unknown,English,2016-11-29 05:07:00,2016-11-29 05:07:00,60,4,52,,0
AlbuquerqueOn,Woman finds four ATMs with bullet holes https://t.co/lqFowC2L0E https://t.co/LTYxOlt7w4,Unknown,English,2016-11-29 05:40:00,2016-11-29 05:40:00,60,4,53,,0
AlbuquerqueOn,Winter Weather: Parts of New Mexico see snow Monday night https://t.co/NoTADwvZQ3 https://t.co/x5bsJdiKhg,Unknown,English,2016-11-29 12:44:00,2016-11-29 12:44:00,60,4,54,,0
AlbuquerqueOn,Trial starts this week for man accused in Lilly Garcia’s death https://t.co/XBMTXT8rL7 https://t.co/1LFAu25AYD,Unknown,English,2016-11-29 13:52:00,2016-11-29 13:53:00,60,4,55,,0
AlbuquerqueOn,"Tuesday’s Morning Rush Video, 5 Facts: Arsonist suspect in Albuquerque Old Navy fire i... https://t.co/mwgdmJARur https://t.co/W06Ovz3mQL",Unknown,English,2016-11-29 14:14:00,2016-11-29 14:15:00,60,4,56,,0
AlbuquerqueOn,Accident at Lomas and Tramway impacting traffic https://t.co/Pumz1a8kus https://t.co/lAaBtH0dwY,Unknown,English,2016-11-29 14:22:00,2016-11-29 14:22:00,60,4,57,,0
AlbuquerqueOn,Tuesday morning weather forecast https://t.co/C0mIgd0tNA https://t.co/EDVG8Yn0NG,Unknown,English,2016-11-29 14:52:00,2016-11-29 14:52:00,60,4,58,,0
AlbuquerqueOn,WWII vet to receive honorary degree from New Mexico college https://t.co/OSn0YT7VBR https://t.co/hyBwJ7wSag,Unknown,English,2016-11-29 15:14:00,2016-11-29 15:15:00,60,4,59,,0
AlbuquerqueOn,State auditor calls for second audit of insurance taxes https://t.co/npURVYdrS1 https://t.co/BOfj3tYXfV,Unknown,English,2016-11-29 15:22:00,2016-11-29 15:22:00,60,4,60,,0
AlbuquerqueOn,"New Mexico will certify election results, recount 3 races https://t.co/GqVT00uucY https://t.co/tl5uyFdSTt",Unknown,English,2016-11-29 15:52:00,2016-11-29 15:52:00,60,4,61,,0
AlbuquerqueOn,New Mexico school district eyes prizes to grow bus ridership https://t.co/6VZJnBXlu9 https://t.co/aLAOOPCioo,Unknown,English,2016-11-29 16:14:00,2016-11-29 16:14:00,60,4,62,,0
AlbuquerqueOn,Tribe gets federal funds for lumber mill feasibility study https://t.co/qRfoz5GN5N https://t.co/q8FMYCmNZF,Unknown,English,2016-11-29 16:22:00,2016-11-29 16:22:00,60,4,63,,0
AlbuquerqueOn,"New Mexico will certify election results, recount 3 races https://t.co/dGoTDz4y7X https://t.co/B2ssqJhdzM",Unknown,English,2016-11-29 16:44:00,2016-11-29 16:44:00,60,4,64,,0
AlbuquerqueOn,Photos: Winter weather hits New Mexico https://t.co/urlewocbXL https://t.co/AhCeoLQ9Pz,Unknown,English,2016-11-29 17:44:00,2016-11-29 17:44:00,60,4,65,,0
AlbuquerqueOn,Rio Rancho police seek help searching for missing teen https://t.co/NMUIwjRUwS https://t.co/KLbdSfEROC,Unknown,English,2016-11-29 18:14:00,2016-11-29 18:14:00,60,4,66,,0
AlbuquerqueOn,Man accused in hit and run of police officer pleads guilty https://t.co/ZMcEzeMSFC https://t.co/8Kzq447wmP,Unknown,English,2016-11-29 18:52:00,2016-11-29 18:52:00,60,4,67,,0
AlbuquerqueOn,"Police: Driver shoots suspected carjacker, additional suspects sought https://t.co/SQ00S78pK9 https://t.co/v3gjdZXtTr",Unknown,English,2016-11-29 19:14:00,2016-11-29 19:14:00,60,4,68,,0
AlbuquerqueOn,Carjacking suspect shot by intended victim https://t.co/is1v35YXdZ https://t.co/n0PDH01XO5,Unknown,English,2016-11-29 19:52:00,2016-11-29 19:52:00,60,4,69,,0
AlbuquerqueOn,Most New Mexico school districts' grades remain the same https://t.co/tY4zcuhbli https://t.co/j8bAwNYlQu,Unknown,English,2016-11-29 20:52:00,2016-11-29 20:52:00,60,4,70,,0
AlbuquerqueOn,Most New Mexico school districts’ grades remain the same https://t.co/ZM1xMpDDOs https://t.co/Hz4TYwNgRO,Unknown,English,2016-11-29 21:44:00,2016-11-29 21:44:00,60,4,71,,0
AlbuquerqueOn,Giving Tuesday offers ways to give back https://t.co/rZztlDndOT https://t.co/5TuYufqfeZ,Unknown,English,2016-11-29 21:52:00,2016-11-29 21:52:00,60,4,72,,0
AlbuquerqueOn,The Latest: Officials say 3 dead in Tennessee wildfires https://t.co/6uwaahkFfD https://t.co/Nm1wxY9ozd,Unknown,English,2016-11-29 22:22:00,2016-11-29 22:22:00,60,4,73,,0
AlbuquerqueOn,Elton John returns to Albuquerque for the first time in 10 years https://t.co/zBW7l8OXvm https://t.co/HVmi64sIFq,Unknown,English,2016-11-29 22:52:00,2016-11-29 22:52:00,60,4,74,,0
AlbuquerqueOn,Brazilian soccer team's plane crashes in Colombia; 75 dead https://t.co/YuzHnvvdih https://t.co/VdBSueM3XQ,Unknown,English,2016-11-29 23:22:00,2016-11-29 23:23:00,60,4,75,,0
AlbuquerqueOn,Police seek robbery suspect wearing neck brace https://t.co/S4QjwrgLkv https://t.co/LtjKpOi52S,Unknown,English,2016-11-30 00:22:00,2016-11-30 00:22:00,60,4,76,,0
AlbuquerqueOn,Police search for missing 80-year-old man https://t.co/69M7NG1Q7T https://t.co/fMK77ru5lZ,Unknown,English,2016-11-30 00:44:00,2016-11-30 00:45:00,60,4,77,,0
AlbuquerqueOn,Four Corners hit with first winter storm of season https://t.co/vuJYxbv3pi https://t.co/kTlATO6xde,Unknown,English,2016-11-30 00:52:00,2016-11-30 00:52:00,60,4,78,,0
AlbuquerqueOn,PNM’s latest rate increase request draws ire from customers https://t.co/tNXU2ptNkC https://t.co/prB1toqTLT,Unknown,English,2016-11-30 01:22:00,2016-11-30 01:22:00,60,4,79,,0
AlbuquerqueOn,Police: Thieves checking obituaries to find homes to burglarize https://t.co/WfSq4wKHEK https://t.co/CGpetuXcuO,Unknown,English,2016-11-30 01:44:00,2016-11-30 01:44:00,60,4,80,,0
AlbuquerqueOn,UNM commemorates Pit’s 50th anniversary on Wednesday https://t.co/r51Uyj4tXz https://t.co/cBk8hjtiBb,Unknown,English,2016-11-30 01:52:00,2016-11-30 01:52:00,60,4,81,,0
AlbuquerqueOn,Serviceman receives gift of new roof https://t.co/20n3NjWzfc https://t.co/iAW7aiO4Gj,Unknown,English,2016-11-30 02:22:00,2016-11-30 02:25:00,60,4,82,,0
AlbuquerqueOn,"Oklahoma woman dead, Nevada man arrested after chase, crash near Clovis https://t.co/OpdnNNP8aj https://t.co/YTKIK5LoHN",Unknown,English,2016-11-30 02:52:00,2016-11-30 02:52:00,60,4,83,,0
AlbuquerqueOn,Albuquerque military family gifted new roof https://t.co/IZ0VoMczJs https://t.co/ou2tM0D3Xe,Unknown,English,2016-11-30 03:44:00,2016-11-30 03:44:00,60,4,84,,0
AlbuquerqueOn,Escaping wildfires meant fleeing through hell-like landscape https://t.co/EhZWB5so6K https://t.co/UFCYccCvrC,Unknown,English,2016-11-30 03:52:00,2016-11-30 03:52:00,60,4,85,,0
AlbuquerqueOn,Government revenues falter in New Mexico https://t.co/jzqurZqnlQ https://t.co/TrXjXGV2EK,Unknown,English,2016-11-30 04:14:00,2016-11-30 04:14:00,60,4,86,,0
AlbuquerqueOn,Albuquerque lawyer named district judge https://t.co/qku5jGQrCr https://t.co/fP2J1AbAgb,Unknown,English,2016-11-30 04:36:00,2016-11-30 04:36:00,60,4,87,,0
AlbuquerqueOn,Special Olympics New Mexico loses chunk of state funding https://t.co/aXggemTi6y https://t.co/MzRJdT7rF5,Unknown,English,2016-11-30 05:14:00,2016-11-30 05:14:00,60,4,88,,0
AlbuquerqueOn,Dennis Hopper’s daughter selling his record collection https://t.co/4hYHXXwae9 https://t.co/2NhSJH0wOx,Unknown,English,2016-11-30 05:52:00,2016-11-30 05:52:00,60,4,89,,0
AlbuquerqueOn,New Mexico to begin recounting votes in 3 county races https://t.co/1ZmrZZ8N0J https://t.co/fFSjEXDPyw,Unknown,English,2016-11-30 12:55:00,2016-11-30 12:55:00,60,3,90,,0
AlbuquerqueOn,Feds bring expert teams to investigate ABQ arsons https://t.co/nVl8HiJt8J https://t.co/O5N8PLcuql,Unknown,English,2016-11-30 14:29:00,2016-11-30 14:29:00,60,3,91,,0
AlbuquerqueOn,Campus police: ENMU active shooter alert was false alarm https://t.co/fzpT6Jlmkd https://t.co/jO8TUPHxf5,Unknown,English,2016-11-30 15:25:00,2016-11-30 15:25:00,60,3,91,,0
AlbuquerqueOn,New Mexico playing catch-up as it heads into winter https://t.co/5VnurAE6wk https://t.co/hVCsMRIDGL,Unknown,English,2016-11-30 15:29:00,2016-11-30 15:29:00,60,3,92,,0
AlbuquerqueOn,New Mexico ed secretary praises Trump’s ed secretary pick https://t.co/dHIjYIzjUQ https://t.co/mbRB8L204o,Unknown,English,2016-11-30 15:55:00,2016-11-30 15:55:00,60,3,93,,0
AlbuquerqueOn,Skandera praises Trump's ed secretary pick https://t.co/CqK8QW5ODH https://t.co/pLm2gkD18D,Unknown,English,2016-11-30 16:29:00,2016-11-30 16:29:00,60,3,94,,0
AlbuquerqueOn,Eastern New Mexico University campus gets false alert https://t.co/Z3OZFBbkuF https://t.co/fGTE4bXUF2,Unknown,English,2016-11-30 18:29:00,2016-11-30 18:32:00,60,3,96,,0
AlbuquerqueOn,Man accused in Old Navy fire remanded to US Marshal's custody https://t.co/S4q7plOMcS https://t.co/0NHHbJiIrV,Unknown,English,2016-11-30 19:29:00,2016-11-30 19:29:00,60,3,97,,0
AlbuquerqueOn,"Las Cruces police: Woman cut, stabbed her boyfriend in car https://t.co/Hcy6Aa40sb https://t.co/sE7jg5bJLN",Unknown,English,2016-11-30 19:55:00,2016-11-30 19:55:00,60,3,98,,0
AlbuquerqueOn,FBI searching for Albuquerque bank robbery suspect https://t.co/MDH7GJxWJ8 https://t.co/YCi36unttw,Unknown,English,2016-11-30 20:25:00,2016-11-30 20:25:00,60,3,99,,0
AlbuquerqueOn,Former US senator to serve as advisor for Land Office https://t.co/XTn3x19HxS https://t.co/UpavFCjeZs,Unknown,English,2016-11-30 20:59:00,2016-11-30 20:59:00,60,3,100,,0
AlbuquerqueOn,Retrial in El Rancho pickaxe killings case underway https://t.co/A7hOvexj22 https://t.co/Mq6EXlGHw2,Unknown,English,2016-11-30 21:59:00,2016-11-30 21:59:00,60,3,101,,0
AlbuquerqueOn,Attorneys: Suspect in road-rage shooting agrees to plea deal https://t.co/AM6RiRNbLu https://t.co/aCoAqcuvUU,Unknown,English,2016-11-30 22:29:00,2016-11-30 22:29:00,60,3,102,,0
AlbuquerqueOn,Albuquerque firefighter honored by Dept. of Defense with Patriot Award https://t.co/Nk30oMIUH3 https://t.co/nkMinSA34c,Unknown,English,2016-11-30 23:55:00,2016-11-30 23:55:00,60,3,103,,0
AlbuquerqueOn,"3 more bodies found in Tennessee wildfire ruins, toll at 7 https://t.co/aykZLGi1Rl https://t.co/UgO5Lzp1k2",Unknown,English,2016-11-30 23:59:00,2016-11-30 23:59:00,60,3,104,,0
AlbuquerqueOn,"Prosecutor clears officer in man's death, says man was armed https://t.co/D3OlkKAVGC https://t.co/97DAplHKUx",Unknown,English,2016-12-01 00:29:00,2016-12-01 00:29:00,60,3,105,,0
AlbuquerqueOn,Bestselling author gives donation to Albuquerque middle school’s library https://t.co/rZ2IpEH1aA https://t.co/QqB0nlPfkj,Unknown,English,2016-12-01 00:55:00,2016-12-01 00:55:00,60,3,106,,0
AlbuquerqueOn,This year's must-have Christmas toy hard to find https://t.co/MfuvoUqg92 https://t.co/n4Ghnaxhqj,Unknown,English,2016-12-01 00:59:00,2016-12-01 00:59:00,60,3,107,,0
AlbuquerqueOn,"Vandals steal van from Albuquerque business, use it to smash in door at another https://t.co/BFCA04Fy0N https://t.co/mXYC1ZEPAC",Unknown,English,2016-12-01 01:25:00,2016-12-01 01:25:00,60,3,108,,0
AlbuquerqueOn,"New Mexico police: Woman cut, stabbed her boyfriend in car https://t.co/Dgr7NqzV6j https://t.co/oFzt8l0hDi",Unknown,English,2016-12-01 01:29:00,2016-12-01 01:29:00,60,3,109,,0
AlbuquerqueOn,St. Pius students raise money for injured ABQ High cheerleader https://t.co/GlQVPWRfzQ https://t.co/hkxRYLPt3k,Unknown,English,2016-12-01 01:59:00,2016-12-01 01:59:00,60,3,110,,0
AlbuquerqueOn,Eastbound lanes on I-40 reopened after police activity https://t.co/p17Iypo4rX https://t.co/v6EdlCuksA,Unknown,English,2016-12-01 02:29:00,2016-12-01 02:30:00,60,3,111,,0
AlbuquerqueOn,OPEC agrees to cut output in bid to push up oil price https://t.co/5BwZUutJUv https://t.co/WBimxeCk3t,Unknown,English,2016-12-01 03:29:00,2016-12-01 03:29:00,60,3,112,,0
AlbuquerqueOn,Leadership change comes early at New Mexico elections agency https://t.co/1BxrdzhnNv https://t.co/ElwRpdWrCR,Unknown,English,2016-12-01 03:55:00,2016-12-01 03:55:00,60,3,113,,0
AlbuquerqueOn,The Latest: Tacoma officer shot multiple times in surgery https://t.co/5pU47pwZ8e https://t.co/vVsy6lnSwW,Unknown,English,2016-12-01 04:29:00,2016-12-01 04:29:00,60,3,114,,0
AlbuquerqueOn,Video shows thief taking packages from Albuquerque home https://t.co/iM1p19jshz https://t.co/mzHgFpt6xs,Unknown,English,2016-12-01 05:25:00,2016-12-01 05:25:00,60,3,115,,0
AlbuquerqueOn,California Guard soldiers won't be forced to repay bonuses https://t.co/nWwjBri4fH https://t.co/zBUZKgqMJL,Unknown,English,2016-12-01 05:29:00,2016-12-01 05:29:00,60,3,116,,0
AlbuquerqueOn,Lobos hold off Abilene Christian down the stretch https://t.co/l7ZbRZPGrM https://t.co/481hAQnCYe,Unknown,English,2016-12-01 05:59:00,2016-12-01 05:59:00,60,3,117,,0
AlbuquerqueOn,Police: Suspect in Tacoma officer’s death shot and killed https://t.co/urxQHxsJGL https://t.co/4RtVFUMLVL,Unknown,English,2016-12-01 13:25:00,2016-12-01 13:25:00,60,3,118,,0
AlbuquerqueOn,Police video released in DWI crash involving helicopter https://t.co/BDy9ixUe53 https://t.co/d4qULCvffu,Unknown,English,2016-12-01 13:59:00,2016-12-01 14:01:00,60,3,119,,0
AlbuquerqueOn,Public defender standoff reaches Supreme Court https://t.co/4n6u0zYvrc https://t.co/c6vMVzRsKM,Unknown,English,2016-12-01 14:29:00,2016-12-01 14:29:00,60,3,120,,0
AlbuquerqueOn,Understanding your sleep type https://t.co/9elM7B6G80 https://t.co/CdhebwFtzw,Unknown,English,2016-12-01 15:29:00,2016-12-01 15:29:00,60,3,121,,0
AlbuquerqueOn,Feds prepare to repackage radioactive waste in New Mexico https://t.co/GxOGm7nyUM https://t.co/wIkPq5olpW,Unknown,English,2016-12-01 15:59:00,2016-12-01 15:59:00,60,3,122,,0
AlbuquerqueOn,Feds prepare to repackage radioactive waste in New Mexico https://t.co/c1Q4zTPPnN https://t.co/494x08RiaE,Unknown,English,2016-12-01 16:35:00,2016-12-01 16:35:00,60,3,123,,0
AlbuquerqueOn,Road-rage shooter sentenced to 16 years in plea deal https://t.co/WhhI0csPWP https://t.co/GFedABlP5R,Unknown,English,2016-12-01 17:11:00,2016-12-01 17:11:00,60,3,124,,0
AlbuquerqueOn,Chattanooga police seek suspect who shot officer 3 times https://t.co/JRBgpAbUgY https://t.co/daMb6YGtX2,Unknown,English,2016-12-01 17:35:00,2016-12-01 17:35:00,60,3,125,,0
AlbuquerqueOn,"Man, woman accused of taking $340,000 from Santa Fe veteran https://t.co/fKq43ORJ8y https://t.co/Vl9CYWGxsl",Unknown,English,2016-12-01 18:11:00,2016-12-01 18:11:00,60,3,126,,0
AlbuquerqueOn,Dona Ana treasurer convicted; allegedly made offer of money for sex to co-worker https://t.co/FU9OcDNrsF https://t.co/LPbdI4Ktmf,Unknown,English,2016-12-01 18:41:00,2016-12-01 18:41:00,60,3,127,,0
AlbuquerqueOn,Heinrich urges Obama to declassify information regarding Russia and U.S. election https://t.co/vWqkiABzjw https://t.co/4s18rpaHcR,Unknown,English,2016-12-01 19:11:00,2016-12-01 19:11:00,60,3,128,,0
AlbuquerqueOn,Holiday gifts for furry friends https://t.co/60eqJJvzVc https://t.co/oojfUcuVCo,Unknown,English,2016-12-01 19:41:00,2016-12-01 19:41:00,60,3,129,,0
AlbuquerqueOn,Santa apps deliver Christmas fun https://t.co/9caLWVyA4l https://t.co/o8UVd94vSr,Unknown,English,2016-12-01 20:11:00,2016-12-01 20:11:00,60,3,130,,0
AlbuquerqueOn,Veterans' group criticizes vets joining pipeline protest https://t.co/B9zDwURvDl https://t.co/UhTB9ERGuV,Unknown,English,2016-12-01 20:41:00,2016-12-01 20:41:00,60,3,131,,0
AlbuquerqueOn,Parents disarmed their son who brought guns to Utah school https://t.co/v97vzYiLhR https://t.co/B1YWADCUSa,Unknown,English,2016-12-01 22:11:00,2016-12-01 22:11:00,60,3,132,,0
AlbuquerqueOn,New Mexico high court upholds Clovis man's murder conviction https://t.co/J0NxA9ChPO https://t.co/Is7pUpcvvG,Unknown,English,2016-12-01 22:41:00,2016-12-01 22:42:00,60,3,133,,0
AlbuquerqueOn,Jury begins deliberations in case of Albuquerque teacher facing embezzlement charges https://t.co/vI9Beqo2Yi https://t.co/crpZfUREbt,Unknown,English,2016-12-01 23:35:00,2016-12-01 23:35:00,60,3,134,,0
AlbuquerqueOn,Police search for caregivers accused of scamming 95-year-old Santa Fe man https://t.co/2kYMdoXfEO https://t.co/WiBpNr8czt,Unknown,English,2016-12-02 00:05:00,2016-12-02 00:05:00,60,3,135,,0
AlbuquerqueOn,Website aims to connect New Mexico students with employers https://t.co/CCM4rf4hPN https://t.co/fhXHcnlZ7u,Unknown,English,2016-12-02 00:35:00,2016-12-02 00:35:00,60,3,136,,0
AlbuquerqueOn,"Woman arrested, connected to contractor’s death https://t.co/906AcaPU7R https://t.co/hVvUsbtB0I",Unknown,English,2016-12-02 00:41:00,2016-12-02 00:41:00,60,3,137,,0
AlbuquerqueOn,White House announces support for women in military draft https://t.co/1OccZjrObM https://t.co/mKkb0YmdCI,Unknown,English,2016-12-02 01:11:00,2016-12-02 01:11:00,60,3,138,,0
AlbuquerqueOn,Trump to nominate retired Gen. James Mattis to lead Pentagon https://t.co/lZVqHPxPZV https://t.co/668pOju2xh,Unknown,English,2016-12-02 02:11:00,2016-12-02 02:11:00,60,3,139,,0
