author_id,content,region,language,publish_date,harvested_date,following,followers,updates,post_type,retweet
AlbuquerqueOn,Albuquerque Police searching for suspect in city bus stabbing https://t.co/HvAetHc0j3 https://t.co/zfkmwx7sGr,Unknown,English,2017-01-22 16:32:00,2017-01-22 16:32:00,61,12,1388,,0
AlbuquerqueOn,Police: Homeowner shoots and kills suspected burglar in southwest Albuquerque https://t.co/7cw55cZukr https://t.co/knWRbytS3f,Unknown,English,2017-01-22 17:32:00,2017-01-22 17:32:00,61,12,1389,,0
AlbuquerqueOn,"Stabbing victim in hospital, police searching for suspect https://t.co/hso54DpdX3 https://t.co/JC8wfkI7Av",Unknown,English,2017-01-22 21:34:00,2017-01-22 21:34:00,61,12,1390,,0
AlbuquerqueOn,Albuquerque police search for suspect after stabbing on bus https://t.co/gAzQ5wwyQG https://t.co/Ng2wEq2Osu,Unknown,English,2017-01-22 21:58:00,2017-01-22 21:58:00,61,12,1391,,0
AlbuquerqueOn,Police: Homeowner shoots home invasion suspect https://t.co/4sbi1Wnz9g https://t.co/wA4lprmU5t,Unknown,English,2017-01-22 22:34:00,2017-01-22 22:34:00,61,12,1392,,0
AlbuquerqueOn,Murder evidence found in storage locker https://t.co/yhZYv32d0j https://t.co/3eHrX8t01Q,Unknown,English,2017-01-22 23:34:00,2017-01-22 23:34:00,61,12,1393,,0
AlbuquerqueOn,"Sandia Peaks Ski Area suffers power outage, ski lifts functioning https://t.co/mX0PzqQTlk https://t.co/5TsoHTPz8F",Unknown,English,2017-01-23 00:04:00,2017-01-23 00:04:00,61,12,1394,,0
AlbuquerqueOn,Firefighters respond to mobile home fire southeast Albuquerque https://t.co/l5ITrD7R2d https://t.co/SymA57OVMJ,Unknown,English,2017-01-23 01:02:00,2017-01-23 01:02:00,61,12,1395,,0
AlbuquerqueOn,Elk invades Colorado gift shop https://t.co/mn1nZMmeKl https://t.co/svzFwGm4fa,Unknown,English,2017-01-23 01:04:00,2017-01-23 01:04:00,61,12,1396,,0
AlbuquerqueOn,One man dead in San Antonio mall shooting https://t.co/Bid2vLNRIW https://t.co/jsEYTBEzye,Unknown,English,2017-01-23 02:04:00,2017-01-23 02:06:00,61,12,1397,,0
AlbuquerqueOn,Sunday evening forecast https://t.co/EMDzaZIl0V https://t.co/D9TG1Mrwi1,Unknown,English,2017-01-23 03:04:00,2017-01-23 03:04:00,61,12,1398,,0
AlbuquerqueOn,Suspect arrested in southeast Albuquerque convenience store robbery https://t.co/aEFUINYGba https://t.co/1wLBPQKRtZ,Unknown,English,2017-01-23 04:02:00,2017-01-23 04:02:00,61,12,1399,,0
AlbuquerqueOn,Albuquerque Police arrest woman after convenience store robbery https://t.co/SVUhNDelNZ https://t.co/A7qCfJiNwD,Unknown,English,2017-01-23 04:32:00,2017-01-23 04:32:00,61,12,1400,,0
AlbuquerqueOn,Albuquerque Rescue Mission has new name and new focus https://t.co/aSb87Q6Uud https://t.co/nSbpq61brW,Unknown,English,2017-01-23 06:02:00,2017-01-23 06:02:00,61,12,1401,,0
AlbuquerqueOn,Local veterans have everything stolen https://t.co/vxH0EWOio1 https://t.co/arfTq694Tx,Unknown,English,2017-01-23 06:04:00,2017-01-23 06:04:00,61,12,1402,,0
AlbuquerqueOn,Albuquerque police search for suspect after stabbing on bus https://t.co/5JCdbhY6Iv https://t.co/rpmwgN8Uk9,Unknown,English,2017-01-23 14:02:00,2017-01-23 14:02:00,61,12,1403,,0
AlbuquerqueOn,Potholes are dotting ART construction https://t.co/0lEWesomXw https://t.co/WrLk8gnLdD,Unknown,English,2017-01-23 14:04:00,2017-01-23 14:04:00,61,12,1404,,0
AlbuquerqueOn,"Monday’s Morning Rush Video, 5 Facts: New billboards highlight New Mexico cold cases https://t.co/goYjkm8D2u https://t.co/sL9B2AaTZC",Unknown,English,2017-01-23 14:32:00,2017-01-23 14:32:00,61,12,1405,,0
AlbuquerqueOn,Hundreds of New Mexicans travel to Washington D.C. to join Women's March https://t.co/s0Ss6EfU8t https://t.co/FLrBB0SVV4,Unknown,English,2017-01-23 14:34:00,2017-01-23 14:34:00,61,12,1406,,0
AlbuquerqueOn,2 suspects in custody in deadly San Antonio mall shooting https://t.co/2z7wq2G2MJ https://t.co/nYTBdq4uDQ,Unknown,English,2017-01-23 15:34:00,2017-01-23 15:34:00,61,12,1407,,0
AlbuquerqueOn,Protesters take control of Mexican border crossing with US https://t.co/NshKjnfdTw https://t.co/w66GMilP1E,Unknown,English,2017-01-23 16:04:00,2017-01-23 16:04:00,61,12,1408,,0
AlbuquerqueOn,Trump to nominate former NM congresswoman Wilson for Air Force post https://t.co/kOGJ3pjx0P https://t.co/RCy6lj6r3D,Unknown,English,2017-01-23 16:34:00,2017-01-23 16:34:00,61,12,1409,,0
AlbuquerqueOn,Police ID second car theft suspect in fatal crash https://t.co/2QtE06zezm https://t.co/bMo9YQBd86,Unknown,English,2017-01-23 17:32:00,2017-01-23 17:32:00,61,12,1410,,0
AlbuquerqueOn,APD releases name of second suspect in fatal crash following car theft https://t.co/T2npqYBw3w https://t.co/TRFQ7u1Ba3,Unknown,English,2017-01-23 17:34:00,2017-01-23 17:34:00,61,12,1411,,0
AlbuquerqueOn,NM middle schoolers create app to help with bullying https://t.co/ls2VbdFEIj https://t.co/0aTpkoBRxe,Unknown,English,2017-01-23 18:04:00,2017-01-23 18:04:00,61,12,1412,,0
AlbuquerqueOn,Rio Rancho Police Department Chief stepping down in mid-February https://t.co/9iG90pWLxr https://t.co/O9GH5qDL2D,Unknown,English,2017-01-23 19:02:00,2017-01-23 19:02:00,61,12,1413,,0
AlbuquerqueOn,Rio Rancho police chief steps down https://t.co/Iwcr2Rzl1k https://t.co/v24w9hddtT,Unknown,English,2017-01-23 19:04:00,2017-01-23 19:04:00,61,12,1414,,0
AlbuquerqueOn,New Mexico attorney general raises budget concerns https://t.co/JskzpRpCnP https://t.co/V6W4SplPo6,Unknown,English,2017-01-23 19:34:00,2017-01-23 19:34:00,61,12,1415,,0
AlbuquerqueOn,"Title, early trailer released for next 'Star Wars' installment https://t.co/sCvCZ1Kadc https://t.co/pihRpNuC3c",Unknown,English,2017-01-23 20:04:00,2017-01-23 20:04:00,61,12,1416,,0
AlbuquerqueOn,New Mexico Legislature considers move to open primaries https://t.co/aHTpo7QZ60 https://t.co/EuJiDQdaO2,Unknown,English,2017-01-23 21:32:00,2017-01-23 21:32:00,61,12,1417,,0
AlbuquerqueOn,Fighting winter allergies https://t.co/wmSRkP3B8M https://t.co/LLgvwu1vG9,Unknown,English,2017-01-23 21:34:00,2017-01-23 21:34:00,61,12,1418,,0
AlbuquerqueOn,Trump gets to work https://t.co/9oVNU2AsYl https://t.co/yxuYqh9p76,Unknown,English,2017-01-23 22:34:00,2017-01-23 22:34:00,61,12,1419,,0
AlbuquerqueOn,Bill would protect working pregnant women in New Mexico https://t.co/OnWoSdsSyg https://t.co/rJACYQETaG,Unknown,English,2017-01-23 23:02:00,2017-01-23 23:02:00,61,12,1420,,0
AlbuquerqueOn,Albuquerque man must pay restitution for food stamp fraud https://t.co/PfmURoo7Ew https://t.co/MDcyRFWgzr,Unknown,English,2017-01-23 23:04:00,2017-01-23 23:04:00,61,12,1421,,0
AlbuquerqueOn,"Parents, students concerned with number of crashes at Albuquerque intersection https://t.co/PjKcHfTaRP https://t.co/0FmNhr5WFI",Unknown,English,2017-01-23 23:50:00,2017-01-23 23:50:00,61,12,1422,,0
AlbuquerqueOn,Police: ‘Good Samaritan’ shot robber who had killed man https://t.co/TVGjxxOKBS https://t.co/8z0DOvFZZQ,Unknown,English,2017-01-24 00:20:00,2017-01-24 00:21:00,61,12,1423,,0
AlbuquerqueOn,Non-profit pushes new ideas to legislature https://t.co/776tfjMIK6 https://t.co/0BTAJUbmlk,Unknown,English,2017-01-24 00:50:00,2017-01-24 00:50:00,61,12,1424,,0
AlbuquerqueOn,New Mexico House approves school spending cuts https://t.co/rhxvZviAbU https://t.co/PmubvygdtW,Unknown,English,2017-01-24 01:20:00,2017-01-24 01:20:00,61,12,1425,,0
AlbuquerqueOn,Durango Fire encouraging residents to shove snow near hydrants https://t.co/aFdouaMzaq https://t.co/LFLqOn6LVd,Unknown,English,2017-01-24 01:50:00,2017-01-24 01:50:00,61,12,1426,,0
AlbuquerqueOn,"Affordable Care Act executive order won't change NM's insurance exchange, officials sa... https://t.co/v5AMeYE1kF https://t.co/j1XShLLHOn",Unknown,English,2017-01-24 02:20:00,2017-01-24 02:20:00,61,12,1427,,0
AlbuquerqueOn,Senate confirms Trump's pick to run the CIA https://t.co/CLFqrrN6Je https://t.co/Z3BPTXJt50,Unknown,English,2017-01-24 02:50:00,2017-01-24 02:50:00,61,12,1428,,0
AlbuquerqueOn,The Latest: New Mexico House approves solvency plan https://t.co/Fk4KqjUoWs https://t.co/ar6jfV2V9p,Unknown,English,2017-01-24 03:50:00,2017-01-24 03:50:00,61,12,1429,,0
AlbuquerqueOn,City of Albuquerque continues work to close pay gap between men and women https://t.co/Lwfdr3Plmu https://t.co/OqwTJKCowV,Unknown,English,2017-01-24 05:20:00,2017-01-24 05:20:00,61,12,1430,,0
AlbuquerqueOn,Carlsbad city councilor's Facebook post about women draws criticism https://t.co/hasXe90B90 https://t.co/Df9itJJ8JB,Unknown,English,2017-01-24 05:20:00,2017-01-24 05:20:00,61,12,1431,,0
AlbuquerqueOn,Pay It 4ward: Woman helps veterans cope with PTSD https://t.co/L8YJsycFJ1 https://t.co/pezYS9oyXS,Unknown,English,2017-01-24 05:50:00,2017-01-24 05:50:00,61,12,1432,,0
AlbuquerqueOn,Albuquerque Public Schools to break ground on new Westside school https://t.co/gELVWrJ21L https://t.co/gaLl4q46z6,Unknown,English,2017-01-24 13:50:00,2017-01-24 13:50:00,61,12,1433,,0
AlbuquerqueOn,Police seeking suspects on the loose in several cases https://t.co/peR8D6rWF9 https://t.co/XaXOZ2lGvN,Unknown,English,2017-01-24 14:20:00,2017-01-24 14:20:00,61,12,1435,,0
AlbuquerqueOn,"Tuesday’s Morning Rush Video, 5 Facts: Storm brings snow, rain and wind to New Mexico https://t.co/neo9mhpUpc https://t.co/cKDXn38zt6",Unknown,English,2017-01-24 14:20:00,2017-01-24 14:20:00,61,12,1434,,0
AlbuquerqueOn,Water service restored for northern New Mexico village https://t.co/idnI2Hqhtt https://t.co/Qmd6KNNqCU,Unknown,English,2017-01-24 14:50:00,2017-01-24 14:50:00,61,12,1436,,0
AlbuquerqueOn,Tuesday morning weather forecast https://t.co/AMjpH8Cgvc https://t.co/ZQTC9z9LiG,Unknown,English,2017-01-24 14:50:00,2017-01-24 14:50:00,61,12,1437,,0
AlbuquerqueOn,The Latest: Oscars give 7 actors their first nominations https://t.co/71ybvCsWIz https://t.co/QCeVOcQQt8,Unknown,English,2017-01-24 15:20:00,2017-01-24 15:20:00,61,12,1438,,0
AlbuquerqueOn,Bill would extend background checks to off-market gun sales https://t.co/tQvwc2bwk5 https://t.co/67aviUxixG,Unknown,English,2017-01-24 16:20:00,2017-01-24 16:20:00,61,12,1439,,0
AlbuquerqueOn,New Mexico bill would halt enforcement of immigration laws https://t.co/iLaoSybGs9 https://t.co/zjitEN5z32,Unknown,English,2017-01-24 16:50:00,2017-01-24 16:50:00,61,12,1441,,0
AlbuquerqueOn,New Mexico bill would halt enforcement of immigration laws https://t.co/80JWr3EcdA https://t.co/090WN7a7IK,Unknown,English,2017-01-24 16:50:00,2017-01-24 16:50:00,61,12,1440,,0
AlbuquerqueOn,"Trump acts to advance Keystone XL, Dakota Access pipelines https://t.co/5MRp5WWzDC https://t.co/eW6xT49Tur",Unknown,English,2017-01-24 18:50:00,2017-01-24 18:50:00,61,12,1442,,0
AlbuquerqueOn,State police say Bernalillo County election case is closed https://t.co/ReEzBSs6Mq https://t.co/pSqqapRhQ9,Unknown,English,2017-01-24 19:20:00,2017-01-24 19:20:00,61,12,1443,,0
AlbuquerqueOn,Albuquerque police seek information to identify armed robbery suspect https://t.co/3mPa7bJxIO https://t.co/XcN79rcvKi,Unknown,English,2017-01-24 19:50:00,2017-01-24 19:50:00,61,12,1444,,0
AlbuquerqueOn,Bills to reinstate New Mexico’s solar tax credit move ahead https://t.co/Jzfc5YQRd6 https://t.co/O7yU8J5t78,Unknown,English,2017-01-24 20:50:00,2017-01-24 20:50:00,61,12,1445,,0
AlbuquerqueOn,Dion's Pizza temporarily substitutes its beloved Ranch dressing https://t.co/3DeiPCV0os https://t.co/hhCqMY2Mpu,Unknown,English,2017-01-24 20:50:00,2017-01-24 20:50:00,61,12,1446,,0
AlbuquerqueOn,Print $1 off coupon to KOB 4 Health &amp; Wellness Fair https://t.co/1c1JBbimBy https://t.co/QlpZlyLNA2,Unknown,English,2017-01-24 21:20:00,2017-01-24 21:20:00,61,12,1447,,0
AlbuquerqueOn,Man accused of killing police officer back in Albuquerque for hearing https://t.co/rl8QpFji96 https://t.co/7O907X6Dnj,Unknown,English,2017-01-24 21:50:00,2017-01-24 21:50:00,61,12,1448,,0
AlbuquerqueOn,"UK government loses Brexit case, must consult Parliament https://t.co/fTSUUHE1AC https://t.co/mHy9AF3ZcC",Unknown,English,2017-01-24 22:20:00,2017-01-24 22:20:00,61,12,1449,,0
AlbuquerqueOn,Las Cruces officer fatally shoots fugitive wanted by Marshals https://t.co/yTu4NYU6Y6 https://t.co/3n7tEnUqsy,Unknown,English,2017-01-24 22:50:00,2017-01-24 22:50:00,61,12,1450,,0
AlbuquerqueOn,New Mexico lawmakers attempt to tackle state’s car theft problem https://t.co/tNwl8ZtW0E https://t.co/iaz9cTY0bR,Unknown,English,2017-01-25 00:20:00,2017-01-25 00:20:00,61,12,1451,,0
AlbuquerqueOn,Bills to reinstate New Mexico's solar tax credit move ahead https://t.co/8F5s6XreFp https://t.co/D20GWKPgLb,Unknown,English,2017-01-25 00:20:00,2017-01-25 00:20:00,61,12,1452,,0
AlbuquerqueOn,Senate confirms Trump's nominee for US ambassador to the UN https://t.co/vasbxjsBeZ https://t.co/rb3XP81ids,Unknown,English,2017-01-25 00:50:00,2017-01-25 00:50:00,61,12,1453,,0
AlbuquerqueOn,APS breaks ground on new west side school https://t.co/WrizZUOT5A https://t.co/qfMHAzRanC,Unknown,English,2017-01-25 01:20:00,2017-01-25 01:20:00,61,12,1454,,0
AlbuquerqueOn,"Pharmaceutical sales lead to bust at meth lab, police say https://t.co/AqKYwbGwBW https://t.co/dzdZzNEswP",Unknown,English,2017-01-25 01:50:00,2017-01-25 01:50:00,61,12,1456,,0
AlbuquerqueOn,New Mexico State Police Chief breaks up fight at Starbucks https://t.co/VDXdoCYUuP https://t.co/Ye7NyMKAaG,Unknown,English,2017-01-25 01:50:00,2017-01-25 01:50:00,61,12,1455,,0
AlbuquerqueOn,"More security needed on city buses, riders say https://t.co/Ozbm1LaCoO https://t.co/rVWbroaxqb",Unknown,English,2017-01-25 02:50:00,2017-01-25 02:50:00,61,12,1457,,0
AlbuquerqueOn,"Trump moving forward with border wall, weighs refugee cuts https://t.co/0ge1QUXRqc https://t.co/eqzCT0ABMo",Unknown,English,2017-01-25 04:50:00,2017-01-25 04:51:00,61,12,1458,,0
AlbuquerqueOn,Bill to fix New Mexico’s budget passed on to governor’s desk https://t.co/3R3LhJKgu7 https://t.co/leK5vUSPTM,Unknown,English,2017-01-25 05:20:00,2017-01-25 05:20:00,61,12,1459,,0
AlbuquerqueOn,Four arrested after SWAT incident in SE Albuquerque https://t.co/TPvUuEZveA https://t.co/lbgzkXQrkL,Unknown,English,2017-01-25 05:20:00,2017-01-25 05:20:00,61,12,1460,,0
AlbuquerqueOn,"After Trump executive order, pipeline opponents plan to continue protests https://t.co/PvbsNStZwr https://t.co/yAGSQ89kke",Unknown,English,2017-01-25 05:50:00,2017-01-25 05:50:00,61,12,1461,,0
AlbuquerqueOn,Albuquerque spends $640K to expand high-speed internet https://t.co/qnUwsggIUj https://t.co/A9xyp1apx5,Unknown,English,2017-01-25 06:54:00,2017-01-25 06:54:00,61,12,1462,,0
AlbuquerqueOn,New Mexico beats Utah State 74-61 for 4th straight win https://t.co/eVmtpBrsru https://t.co/nPIYz8pfjE,Unknown,English,2017-01-25 08:20:00,2017-01-25 08:20:00,61,12,1463,,0
AlbuquerqueOn,School Board to review results of Albuquerque Public Schools parent survey https://t.co/RItPuA6df8 https://t.co/XIFI9a4RjW,Unknown,English,2017-01-25 13:20:00,2017-01-25 13:20:00,61,12,1464,,0
AlbuquerqueOn,"Wednesday’s Morning Rush Video, 5 Facts: Bill aims to keep New Mexico authorities from... https://t.co/Ubws64sUDb https://t.co/AwI4VOU9fZ",Unknown,English,2017-01-25 14:20:00,2017-01-25 14:21:00,61,12,1465,,0
AlbuquerqueOn,Community effort helping to rebuild Joy Light Church https://t.co/RWCLaYHVQJ https://t.co/brGyoEjYte,Unknown,English,2017-01-25 14:50:00,2017-01-25 14:50:00,61,12,1466,,0
AlbuquerqueOn,Wednesday morning weather forecast https://t.co/OBRI7Y9ENf https://t.co/7SxhH2aNQt,Unknown,English,2017-01-25 15:20:00,2017-01-25 15:20:00,61,12,1468,,0
AlbuquerqueOn,2 lawmakers pushing ‘right to die’ bill in New Mexico https://t.co/i5fhkdAhD1 https://t.co/kuTmN4Kz3B,Unknown,English,2017-01-25 15:20:00,2017-01-25 15:20:00,61,12,1467,,0
AlbuquerqueOn,New Mexico Supreme Court to decide power plant case https://t.co/XYS4hlbseI https://t.co/TWlTKhOg2b,Unknown,English,2017-01-25 15:50:00,2017-01-25 15:50:00,61,12,1469,,0
AlbuquerqueOn,Head of Navajo Nation releases aid to deal with storm damage https://t.co/J75Yc8Kpm2 https://t.co/ryd3lNxkTz,Unknown,English,2017-01-25 16:50:00,2017-01-25 16:52:00,61,12,1470,,0
AlbuquerqueOn,Federal hiring freeze could kill hundreds of New Mexico jobs https://t.co/VSGcGT5Igo https://t.co/GkVEvz8KNB,Unknown,English,2017-01-25 17:20:00,2017-01-25 17:20:00,61,12,1471,,0
AlbuquerqueOn,"What's next for the Dakota Access, Keystone XL pipelines? https://t.co/gkGTRMSlVj https://t.co/FLwpezS1g1",Unknown,English,2017-01-25 17:50:00,2017-01-25 17:52:00,61,12,1472,,0
AlbuquerqueOn,Trump draft order seeks review on terror interrogations https://t.co/RGeBUfmIbb https://t.co/nHnWz2ATGM,Unknown,English,2017-01-25 18:20:00,2017-01-25 18:20:00,61,12,1473,,0
AlbuquerqueOn,Pope takes over Knights of Malta after condom dispute https://t.co/as5VgI3auX https://t.co/zTfxaKPRRf,Unknown,English,2017-01-25 19:50:00,2017-01-25 19:50:00,61,12,1474,,0
AlbuquerqueOn,"Dow Jones industrial average breaks through 20,000 milestone https://t.co/cnDzLezL1E https://t.co/Lte8FurS1v",Unknown,English,2017-01-25 20:20:00,2017-01-25 20:20:00,61,12,1475,,0
AlbuquerqueOn,"Dow Jones industrial average breaks through 20,000 milestone https://t.co/UIcZo5PS84 https://t.co/aUIcoihHuj",Unknown,English,2017-01-25 20:50:00,2017-01-25 20:50:00,61,12,1476,,0
AlbuquerqueOn,'I Had To Help' https://t.co/qJMIKwNTA5 https://t.co/2bAcHeGWPx,Unknown,English,2017-01-25 21:20:00,2017-01-25 21:20:00,61,12,1477,,0
AlbuquerqueOn,New Mexico State Police: Arizona man has died in a crash https://t.co/n0SNQPdj32 https://t.co/Rn2zyqvvrU,Unknown,English,2017-01-25 22:20:00,2017-01-25 22:20:00,61,12,1479,,0
AlbuquerqueOn,"Friends, family to honor Albuquerque teen killed in crash caused by car thieves https://t.co/FMFRjuRavc https://t.co/CtXkLDJP5Y",Unknown,English,2017-01-25 22:20:00,2017-01-25 22:20:00,61,12,1478,,0
AlbuquerqueOn,Survivors of Italy avalanche tell AP they never gave up hope https://t.co/yxGmVbxtPY https://t.co/OcxXiyEM8G,Unknown,English,2017-01-25 22:50:00,2017-01-25 22:50:00,61,12,1480,,0
AlbuquerqueOn,Pioneering TV actress Mary Tyler Moore dies at 80 https://t.co/XNrETLUjP1 https://t.co/OgWqgnTFnV,Unknown,English,2017-01-25 23:20:00,2017-01-25 23:20:00,61,12,1482,,0
AlbuquerqueOn,New Mexico lawmakers considering 2 anti-abortion bills https://t.co/VbnO2l4O0F https://t.co/eDbeUY96eb,Unknown,English,2017-01-25 23:20:00,2017-01-25 23:20:00,61,12,1481,,0
AlbuquerqueOn,Police arrest man connected to Albuquerque gang https://t.co/iIPByahEvV https://t.co/hbGISYH1e2,Unknown,English,2017-01-26 00:20:00,2017-01-26 00:20:00,61,12,1483,,0
AlbuquerqueOn,Teen arrested in Tuesday SWAT scene charged in gun shop burglaries https://t.co/LYPJGlI3HI https://t.co/k7bPIJbLri,Unknown,English,2017-01-26 00:20:00,2017-01-26 00:20:00,61,12,1484,,0
AlbuquerqueOn,New Mexico Legislature approves solvency plan https://t.co/EZvYhYDiMo https://t.co/SGSOtV7LMS,Unknown,English,2017-01-26 00:50:00,2017-01-26 00:50:00,61,12,1485,,0
AlbuquerqueOn,Wednesday evening weather forecast https://t.co/dRmtUwwmev https://t.co/W4hPVxbzRD,Unknown,English,2017-01-26 01:20:00,2017-01-26 01:20:00,61,12,1487,,0
AlbuquerqueOn,New Mexico lawmaker wants to make animal cruelty a felony https://t.co/YwMyonzEqt https://t.co/0VhUpX1O6K,Unknown,English,2017-01-26 01:20:00,2017-01-26 01:20:00,61,12,1486,,0
AlbuquerqueOn,"New Mexico could improve tobacco control policies, study shows https://t.co/J8uuQg45sI https://t.co/saRoTCLY92",Unknown,English,2017-01-26 01:50:00,2017-01-26 01:50:00,61,12,1488,,0
AlbuquerqueOn,Program offers free in-home help for first time parents https://t.co/oktQ2COv8A https://t.co/MtuPYsbX75,Unknown,English,2017-01-26 02:20:00,2017-01-26 02:20:00,61,12,1489,,0
AlbuquerqueOn,Employer fires Carlsbad councilor for Facebook comments https://t.co/Iwr1vgmw74 https://t.co/QJPuaRbQ9q,Unknown,English,2017-01-26 04:20:00,2017-01-26 04:20:00,61,12,1490,,0
AlbuquerqueOn,Teen killed in fatal crash remembered https://t.co/W1ZBoaPji3 https://t.co/d7yjz33Pog,Unknown,English,2017-01-26 05:20:00,2017-01-26 05:20:00,61,12,1491,,0
AlbuquerqueOn,ABQ Ride employee: “I wouldn’t allow my family to ride a bus” https://t.co/21DBh9nkyY https://t.co/AEz5xfCHV4,Unknown,English,2017-01-26 05:50:00,2017-01-26 05:50:00,61,12,1493,,0
AlbuquerqueOn,Surveillance catches man trying to open car doors in Albuquerque neighborhood https://t.co/PCjAngdHEb https://t.co/7czwlVnvvk,Unknown,English,2017-01-26 05:50:00,2017-01-26 05:50:00,61,12,1492,,0
AlbuquerqueOn,Former state Democratic Party chair enters ABQ mayoral race https://t.co/mSax54Ry6y https://t.co/IxbS2g3PjC,Unknown,English,2017-01-26 06:20:00,2017-01-26 06:20:00,61,12,1494,,0
AlbuquerqueOn,Albuquerque counts the homeless https://t.co/IMT9EXT2nI https://t.co/DM6iLwz8DV,Unknown,English,2017-01-26 06:54:00,2017-01-26 06:54:00,61,12,1495,,0
AlbuquerqueOn,Albuquerque Convention Center to host local boxers on March 18 https://t.co/A5e9x03d0a https://t.co/IEi1cAThaz,Unknown,English,2017-01-26 12:50:00,2017-01-26 12:50:00,61,12,1496,,0
AlbuquerqueOn,"No widespread voter fraud in NM during election, acting secretary of state says https://t.co/9PItrTq02E https://t.co/czQUTNmGYu",Unknown,English,2017-01-26 14:20:00,2017-01-26 14:20:00,61,12,1497,,0
AlbuquerqueOn,2 New Mexico cities make donations to African sister cities https://t.co/eZhLCBIeqn https://t.co/vhrC3rEdzg,Unknown,English,2017-01-26 14:50:00,2017-01-26 14:50:00,61,12,1498,,0
AlbuquerqueOn,Navajo Nation Council approves $242K for emergency services https://t.co/EEgmDf8KUR https://t.co/Xsd80zTz0I,Unknown,English,2017-01-26 15:20:00,2017-01-26 15:20:00,61,12,1499,,0
AlbuquerqueOn,CYFD debuts new tool for finding family resources https://t.co/WtgLn36XBH https://t.co/LbjWGj5h9Y,Unknown,English,2017-01-26 15:50:00,2017-01-26 15:50:00,61,12,1500,,0
AlbuquerqueOn,Federal judge considers ranchers' discrimination case https://t.co/qBzAKsh2Cp https://t.co/esi9lOdOfn,Unknown,English,2017-01-26 18:20:00,2017-01-26 18:20:00,61,12,1501,,0
AlbuquerqueOn,Border Patrol chief out day after Trump border fence decree https://t.co/TNiD9pPB4Y https://t.co/vYlIljhiVN,Unknown,English,2017-01-26 18:50:00,2017-01-26 18:50:00,61,12,1502,,0
AlbuquerqueOn,"New Mexico Democrats seek out jobs in hemp, new minimum wage https://t.co/mANbiFhQjn https://t.co/tdUIa2JHJc",Unknown,English,2017-01-26 19:20:00,2017-01-26 19:20:00,61,12,1504,,0
AlbuquerqueOn,Teens accused of breaking into Albuquerque gun shops faces judge https://t.co/30epqEICvJ https://t.co/LJCEjTL7sl,Unknown,English,2017-01-26 19:20:00,2017-01-26 19:20:00,61,12,1503,,0
AlbuquerqueOn,Teen severely hurt in suspected street race crash https://t.co/MavhtSHHSL https://t.co/jqyEFAfGOn,Unknown,English,2017-01-26 20:20:00,2017-01-26 20:20:00,61,13,1505,,0
AlbuquerqueOn,Man said in 911 calls he feared for children's well-being https://t.co/FRsxrWVhoF https://t.co/dqGIN581NH,Unknown,English,2017-01-26 21:20:00,2017-01-26 21:20:00,61,13,1506,,0
AlbuquerqueOn,Senior diplomat resignations accepted as Trump team enters https://t.co/iwpACXTxaG https://t.co/u9P397rohT,Unknown,English,2017-01-26 21:50:00,2017-01-26 21:50:00,61,13,1507,,0
AlbuquerqueOn,Democratic lawmakers pushing for minimum wage increase https://t.co/5P5T1bRsDT https://t.co/Tg9IAYogyE,Unknown,English,2017-01-27 00:50:00,2017-01-27 00:50:00,61,13,1508,,0
AlbuquerqueOn,Thursday evening weather forecast https://t.co/55joiuToIi https://t.co/85GFJoZzAP,Unknown,English,2017-01-27 01:20:00,2017-01-27 01:20:00,61,13,1510,,0
AlbuquerqueOn,Ad selling marijuana found on New Mexico Facebook page https://t.co/lQ5pVErzk4 https://t.co/sQI89Gastw,Unknown,English,2017-01-27 01:20:00,2017-01-27 01:20:00,61,13,1509,,0
AlbuquerqueOn,Far-right writer to speak at UNM Friday https://t.co/GoFJkqBpsh https://t.co/MUWCaFbpBz,Unknown,English,2017-01-27 01:50:00,2017-01-27 01:50:00,61,13,1512,,0
AlbuquerqueOn,Police responding to altercation in northeast Albuquerque https://t.co/SnU9psWXwu https://t.co/SFXP31M1H7,Unknown,English,2017-01-27 01:50:00,2017-01-27 01:50:00,61,13,1511,,0
AlbuquerqueOn,App is 'Cultural Atlas' of New Mexico https://t.co/PuNq50XneY https://t.co/OvxyRIo2UC,Unknown,English,2017-01-27 02:50:00,2017-01-27 02:50:00,61,13,1513,,0
AlbuquerqueOn,Police activity reported in NE Albuquerque https://t.co/MSzadFlhlj https://t.co/GSWCNpLlEx,Unknown,English,2017-01-27 03:50:00,2017-01-27 03:50:00,61,13,1514,,0
AlbuquerqueOn,Neighbors claim Albuquerque failing to fix neighborhood traffic dangers https://t.co/gzlWUN3xRx https://t.co/Okz1xbGB6i,Unknown,English,2017-01-27 05:20:00,2017-01-27 05:20:00,61,13,1515,,0
AlbuquerqueOn,Gas hose adapter crashes into driver’s windshield https://t.co/Px8YXmx7ck https://t.co/E9YfcdX7K3,Unknown,English,2017-01-27 05:50:00,2017-01-27 05:50:00,61,13,1516,,0
AlbuquerqueOn,Police seek suspect who fled after hitting Valencia County deputy https://t.co/8yXS18UGe0 https://t.co/RRSyjsHNLD,Unknown,English,2017-01-27 12:50:00,2017-01-27 12:50:00,61,13,1517,,0
AlbuquerqueOn,Bill would let New Mexico AG’s office probe police shootings https://t.co/tally0zRRn https://t.co/Ik6BrCELE7,Unknown,English,2017-01-27 13:50:00,2017-01-27 13:50:00,61,13,1518,,0
AlbuquerqueOn,Lincoln County newspaper invites Russian president to town https://t.co/m3ZCjA8F3P https://t.co/SHZlitZDMD,Unknown,English,2017-01-27 14:20:00,2017-01-27 14:20:00,61,13,1520,,0
AlbuquerqueOn,"Friday’s Morning Rush Video, 5 Facts: Albuquerque police officers shoot at suspect pos... https://t.co/A0ggqaPY4X https://t.co/lBuwlhBOJI",Unknown,English,2017-01-27 14:20:00,2017-01-27 14:20:00,61,13,1519,,0
AlbuquerqueOn,"Overnight stolen vehicle pursuit crosses county lines, ends in SE Albuquerque https://t.co/aqXCI9QYcP https://t.co/duVQj2PpEZ",Unknown,English,2017-01-27 14:50:00,2017-01-27 14:50:00,61,13,1521,,0
AlbuquerqueOn,New Mexico budget woes stifle tourism ad campaign https://t.co/2IDV61m4Za https://t.co/NG8iQqGYsr,Unknown,English,2017-01-27 15:20:00,2017-01-27 15:20:00,61,13,1522,,0
AlbuquerqueOn,Chelsea Manning’s attorney responds to Trump’s ‘ungrateful traitor’ tweet https://t.co/zMopd38XvJ https://t.co/AhgO5u5Sal,Unknown,English,2017-01-27 15:20:00,2017-01-27 15:20:00,61,13,1523,,0
