author_id,content,region,language,publish_date,harvested_date,following,followers,updates,post_type,retweet
AlbuquerqueOn,Proposal aims to abolish job of state's education secretary https://t.co/t2aXIfk9Yu https://t.co/Ppm21NKipw,Unknown,English,2016-12-27 04:23:00,2016-12-27 04:23:00,60,11,696,,0
AlbuquerqueOn,People buy Christmas presents for Albuquerque zoo animals https://t.co/onNEuzO2JH https://t.co/QDGub52VcB,Unknown,English,2016-12-27 05:21:00,2016-12-27 05:21:00,60,11,697,,0
AlbuquerqueOn,Lost hikers rescued in Gila National Forest https://t.co/P7wXaNoKEI https://t.co/eCeKkjuj6C,Unknown,English,2016-12-27 05:23:00,2016-12-27 05:23:00,60,11,698,,0
AlbuquerqueOn,Pay It 4ward: Woman helped establish nurse advice hotline https://t.co/E7ArNUTj0E https://t.co/cWAFrLwYdn,Unknown,English,2016-12-27 05:53:00,2016-12-27 05:53:00,60,11,699,,0
AlbuquerqueOn,Police: Man attacked mom on Christmas day because he didn’t like food https://t.co/r2Pq9VAKA9 https://t.co/DPAuhQA50T,Unknown,English,2016-12-27 12:51:00,2016-12-27 12:51:00,60,11,700,,0
AlbuquerqueOn,New Mexico budget woes threaten pay for jurors https://t.co/pX9YipXnKU https://t.co/SQGjQXdrKi,Unknown,English,2016-12-27 13:53:00,2016-12-27 13:53:00,60,11,701,,0
AlbuquerqueOn,Mall fights send post-holiday shoppers scrambling for exits https://t.co/kHNSdKuO5d https://t.co/L88OzqMBym,Unknown,English,2016-12-27 14:23:00,2016-12-27 14:23:00,60,11,702,,0
AlbuquerqueOn,Energy companies plan to boost wind generation in New Mexico https://t.co/ocnF3EjEbe https://t.co/QqHABBMa4a,Unknown,English,2016-12-27 14:53:00,2016-12-27 14:53:00,60,11,703,,0
AlbuquerqueOn,New Mexico police to crack down on drunken drivers https://t.co/LUOg5jqz66 https://t.co/f94Vhnoe4C,Unknown,English,2016-12-27 15:21:00,2016-12-27 15:21:00,60,11,704,,0
AlbuquerqueOn,Tuesday morning weather forecast https://t.co/VPWY6OKHOl https://t.co/uGF7rqkuPW,Unknown,English,2016-12-27 15:23:00,2016-12-27 15:23:00,60,11,705,,0
AlbuquerqueOn,New Mexico gets nearly $11M in homeless grants https://t.co/HKrTaTeKoY https://t.co/HT8Wl6wLuf,Unknown,English,2016-12-27 15:51:00,2016-12-27 15:51:00,60,11,706,,0
AlbuquerqueOn,New Mexico lawmaker wants moratorium on new charter schools https://t.co/GnrugxHhGc https://t.co/VkfirVDcMC,Unknown,English,2016-12-27 16:23:00,2016-12-27 16:23:00,60,11,707,,0
AlbuquerqueOn,New Mexico lawmaker wants moratorium on new charter schools https://t.co/qSWgM26dl7 https://t.co/Q272dYgkpU,Unknown,English,2016-12-27 16:51:00,2016-12-27 16:51:00,60,11,708,,0
AlbuquerqueOn,Santa Fe Archbishop using 'Social Gospel' to fight New Mexico poverty https://t.co/rxne1bFeDF https://t.co/At1Vm5QAuZ,Unknown,English,2016-12-27 17:23:00,2016-12-27 17:23:00,60,11,709,,0
AlbuquerqueOn,Energy companies plan to boost wind generation in New Mexico https://t.co/DNdynBbvDg https://t.co/ocZkCMKQE5,Unknown,English,2016-12-27 17:51:00,2016-12-27 17:51:00,60,11,710,,0
AlbuquerqueOn,"Actress Carrie Fisher dead at 60, daughter's publicist says https://t.co/PgNUhTCwss https://t.co/IPVXMChBw5",Unknown,English,2016-12-27 18:23:00,2016-12-27 18:23:00,60,11,711,,0
AlbuquerqueOn,"City agencies, PNM partner to recycle Christmas trees, lights https://t.co/UFcPBlFfDf https://t.co/5xPuOOIJhy",Unknown,English,2016-12-27 18:53:00,2016-12-27 18:53:00,60,11,712,,0
AlbuquerqueOn,New Mexico unveils new anti-DWI ads https://t.co/5CpPNHUe5M https://t.co/1x52fqWv2w,Unknown,English,2016-12-27 19:21:00,2016-12-27 19:21:00,60,11,713,,0
AlbuquerqueOn,"New Mexico unveils new anti-DWI ads, lists top ten DWI fugitives as agencies begin cra... https://t.co/kGQXQ2Jz8S https://t.co/1G0e9FYJvg",Unknown,English,2016-12-27 20:23:00,2016-12-27 20:23:00,60,11,714,,0
AlbuquerqueOn,Raw Video: Over 100 snakes recovered in high rise apartment https://t.co/ztwUR2F9bf https://t.co/0AA6g9kchd,Unknown,English,2016-12-27 21:23:00,2016-12-27 21:23:00,60,11,715,,0
AlbuquerqueOn,Ex-inmate alleges mistreatment when asking for medication https://t.co/AVPhw6sXdq https://t.co/9lYCkGEYTJ,Unknown,English,2016-12-27 22:23:00,2016-12-27 22:23:00,60,11,716,,0
AlbuquerqueOn,"Police seek mother accused of beating, kidnapping her son https://t.co/1H7jgyA4oq https://t.co/PPRcF09MZM",Unknown,English,2016-12-27 22:51:00,2016-12-27 22:51:00,60,11,717,,0
AlbuquerqueOn,Former inmate claims he was mistreated at MDC when asking for medication https://t.co/5oNf5SVs2f https://t.co/w68wI9qqMr,Unknown,English,2016-12-27 23:51:00,2016-12-27 23:52:00,60,11,718,,0
AlbuquerqueOn,Lawmaker sponsors three strikes crime bill https://t.co/1eXLmFYDtX https://t.co/h70lFfHpKx,Unknown,English,2016-12-28 00:23:00,2016-12-28 00:23:00,60,11,719,,0
AlbuquerqueOn,Albuquerque landlord pays January rent for all tenants https://t.co/1bfoq1SSsF https://t.co/zA6hGIi9qj,Unknown,English,2016-12-28 00:51:00,2016-12-28 00:51:00,60,11,720,,0
AlbuquerqueOn,Junk dumped near woman's property https://t.co/BexoxpEWgd https://t.co/goVjEPFjB1,Unknown,English,2016-12-28 00:53:00,2016-12-28 00:53:00,60,11,721,,0
AlbuquerqueOn,Archbishop using ‘Social Gospel’ to fight New Mexico poverty https://t.co/W4ucJ7semd https://t.co/4CgpRgVsSv,Unknown,English,2016-12-28 01:21:00,2016-12-28 01:21:00,60,11,722,,0
AlbuquerqueOn,"Drunken driver crashes into café’s trailer, police say https://t.co/o1zmbuvsfE https://t.co/00E3uJx5UL",Unknown,English,2016-12-28 01:23:00,2016-12-28 01:23:00,60,11,723,,0
AlbuquerqueOn,"Lawmaker seeks more transparency in university presidents, coaches contracts https://t.co/lJMDpaiHRV https://t.co/eaRV73XoCe",Unknown,English,2016-12-28 01:53:00,2016-12-28 01:53:00,60,11,724,,0
AlbuquerqueOn,Stray bag of toys prompts scare at Trump Tower https://t.co/rSvjrfFzxp https://t.co/DY6PcLhS3K,Unknown,English,2016-12-28 02:23:00,2016-12-28 02:23:00,60,11,725,,0
AlbuquerqueOn,Albuquerque coffee shop vandalized Christmas night https://t.co/AMPStG3nnd https://t.co/ih79dY9vvQ,Unknown,English,2016-12-28 05:21:00,2016-12-28 05:21:00,60,11,726,,0
AlbuquerqueOn,Texas family stuck in New Mexico after dangerous crash https://t.co/MP98ilrRIu https://t.co/dsrfFrBHbs,Unknown,English,2016-12-28 05:23:00,2016-12-28 05:23:00,60,11,727,,0
AlbuquerqueOn,Contested race for ABQ mayor coming next October https://t.co/kCIe13rtG5 https://t.co/B2QhC7JsWu,Unknown,English,2016-12-28 05:53:00,2016-12-28 05:53:00,60,11,728,,0
AlbuquerqueOn,New Mexico lawmakers propose raising state’s minimum wage https://t.co/CZJHOYLh2J https://t.co/05Q1q2w7ot,Unknown,English,2016-12-28 12:51:00,2016-12-28 12:51:00,60,10,729,,0
AlbuquerqueOn,New Mexico photo to be featured in National Geographic calendar https://t.co/4CZiJP4C0e https://t.co/eKGeUne0cc,Unknown,English,2016-12-28 13:21:00,2016-12-28 13:21:00,60,10,730,,0
AlbuquerqueOn,Lawmaker proposes changes to teacher evaluation system https://t.co/V5G2ztlQLa https://t.co/JSh8Wd39VK,Unknown,English,2016-12-28 13:53:00,2016-12-28 13:53:00,60,10,731,,0
AlbuquerqueOn,"Albuquerque police on scene of possible shooting near Edith, Lomas https://t.co/TlwhFRQVw9 https://t.co/DoyRb5RYh6",Unknown,English,2016-12-28 14:21:00,2016-12-28 14:21:00,60,10,732,,0
AlbuquerqueOn,"Albuquerque mayor discusses 2016 accomplishments, goals for 2017 https://t.co/mwJRnSuoQf https://t.co/nFWrD85Pfj",Unknown,English,2016-12-28 14:23:00,2016-12-28 14:23:00,60,10,733,,0
AlbuquerqueOn,Report: Breweries spread to all corners of New Mexico https://t.co/gCMJHsVztR https://t.co/mJ8C3v6fVY,Unknown,English,2016-12-28 14:53:00,2016-12-28 14:53:00,60,10,734,,0
AlbuquerqueOn,Campaign finance reform on the agenda again in New Mexico https://t.co/yUH6JxTT2c https://t.co/GYRswEYPhj,Unknown,English,2016-12-28 15:21:00,2016-12-28 15:21:00,60,10,735,,0
AlbuquerqueOn,Wednesday morning weather forecast https://t.co/J8XwvIbxzk https://t.co/ldsCF2UOKy,Unknown,English,2016-12-28 15:23:00,2016-12-28 15:23:00,60,10,736,,0
AlbuquerqueOn,New Mexico teen injured in car surfing incident https://t.co/527lLkUlHC https://t.co/MRf7jEfAwX,Unknown,English,2016-12-28 15:53:00,2016-12-28 15:53:00,60,10,737,,0
AlbuquerqueOn,New Mexico Republican House speaker will leave Legislature https://t.co/x9Vizpytt9 https://t.co/7kCKCPsoM6,Unknown,English,2016-12-28 17:51:00,2016-12-28 17:51:00,60,10,738,,0
AlbuquerqueOn,Police investigate apparent stabbing death at Lomas and Edith https://t.co/7y3105KCDh https://t.co/4KImsOJd2o,Unknown,English,2016-12-28 17:53:00,2016-12-28 17:53:00,60,10,739,,0
AlbuquerqueOn,Pups learn the ropes for paw patrol https://t.co/9Tjf10cZ5W https://t.co/paDJFnBDSB,Unknown,English,2016-12-28 18:53:00,2016-12-28 18:53:00,60,10,740,,0
AlbuquerqueOn,"Mia, Elijah rank as top baby names in New Mexico in 2016 https://t.co/2uP4ksz1k0 https://t.co/QmYdnuXwF6",Unknown,English,2016-12-28 19:21:00,2016-12-28 19:21:00,60,10,741,,0
AlbuquerqueOn,"Mia, Elijah rank as top baby names in New Mexico in 2016 https://t.co/ZihHdndBUv https://t.co/CE5goFV7of",Unknown,English,2016-12-28 20:23:00,2016-12-28 20:23:00,60,10,742,,0
AlbuquerqueOn,Deadly officer–involved shooting ruled justified https://t.co/UYlEQQGp7B https://t.co/srsWzfvJ5k,Unknown,English,2016-12-28 20:53:00,2016-12-28 20:53:00,60,10,743,,0
AlbuquerqueOn,Old school cool marks the new tech revolution https://t.co/k5eqT7670v https://t.co/muRc4qNy9G,Unknown,English,2016-12-28 21:23:00,2016-12-28 21:23:00,60,10,744,,0
AlbuquerqueOn,Hundreds in California who bought bad dough for tamales line up for refund https://t.co/Z8HN8yyK87 https://t.co/nlllxNRfFf,Unknown,English,2016-12-28 21:53:00,2016-12-28 21:53:00,60,10,745,,0
AlbuquerqueOn,Democrat-led Legislature likely to increase minimum wage https://t.co/rzJhlT9Nn1 https://t.co/1uBCyA4UqL,Unknown,English,2016-12-28 22:23:00,2016-12-28 22:23:00,60,10,746,,0
AlbuquerqueOn,NMMI band won’t attend inaugural parade despite fund raising effort https://t.co/l3OaKsYy2a https://t.co/uEJsxItaHo,Unknown,English,2016-12-28 23:21:00,2016-12-28 23:21:00,60,10,747,,0
AlbuquerqueOn,"Police, FBI, other agencies ramp up security for Rose Parade https://t.co/LsBILBoI8M https://t.co/yWauPIZxYu",Unknown,English,2016-12-28 23:51:00,2016-12-28 23:51:00,60,10,748,,0
AlbuquerqueOn,Officials break ground on new rail hub in Los Lunas https://t.co/TVevRkWrAi https://t.co/RLLASoHFXB,Unknown,English,2016-12-28 23:53:00,2016-12-28 23:53:00,60,10,749,,0
AlbuquerqueOn,Westgate residents seeing no improvement to speeding problem https://t.co/EY8rKVdJZa https://t.co/iDnEQ2c0Yr,Unknown,English,2016-12-29 00:23:00,2016-12-29 00:23:00,60,10,750,,0
AlbuquerqueOn,City of Albuquerque to get rid of green vehicle parking permits https://t.co/ebxEX1GT4e https://t.co/vbdYwKjHcw,Unknown,English,2016-12-29 00:51:00,2016-12-29 00:51:00,60,10,751,,0
AlbuquerqueOn,"APD: Pair stole guns, other items from storage units https://t.co/LUuuTUD5oL https://t.co/SD1uaBwxbK",Unknown,English,2016-12-29 00:53:00,2016-12-29 00:53:00,60,10,752,,0
AlbuquerqueOn,Albuquerque boys donate their hair to children fighting cancer https://t.co/rwTEQForXT https://t.co/eAnq5UWO0u,Unknown,English,2016-12-29 01:21:00,2016-12-29 01:21:00,60,10,753,,0
AlbuquerqueOn,Alexa a witness to murder? Prosecutors seek Amazon Echo data https://t.co/0kG5ZyoVYG https://t.co/OufWC47uBG,Unknown,English,2016-12-29 01:23:00,2016-12-29 01:23:00,60,10,754,,0
AlbuquerqueOn,Casting call draws hundreds to audition https://t.co/9IsfiQWPFL https://t.co/WDmYmLWVO3,Unknown,English,2016-12-29 01:53:00,2016-12-29 01:53:00,60,10,755,,0
AlbuquerqueOn,"Actress Debbie Reynolds has died at 84, son says https://t.co/OZo9L6Cnjm https://t.co/6Dn83DKoP6",Unknown,English,2016-12-29 03:23:00,2016-12-29 03:23:00,60,10,756,,0
AlbuquerqueOn,Video appears to show Texas police shooting man walking away https://t.co/SlSXFvB3Wd https://t.co/hj0Vd9mV6j,Unknown,English,2016-12-29 03:51:00,2016-12-29 03:51:00,60,10,757,,0
AlbuquerqueOn,"Police: Thieves break into storage unit, leave with guns https://t.co/DInXf6OsC8 https://t.co/sEW5evzBZg",Unknown,English,2016-12-29 05:21:00,2016-12-29 05:21:00,60,10,758,,0
AlbuquerqueOn,Decade has passed since historic blizzard in ABQ https://t.co/lYKaAZjRJT https://t.co/RaPD6OUD9a,Unknown,English,2016-12-29 05:23:00,2016-12-29 05:23:00,60,10,759,,0
AlbuquerqueOn,Brown's 14 FTs help New Mexico beat Fresno State 78-73 https://t.co/iiRxOHIYnN https://t.co/DtqB0TLEfz,Unknown,English,2016-12-29 05:53:00,2016-12-29 05:53:00,60,10,760,,0
AlbuquerqueOn,Officials propose plan to help inmates after they are released from jail https://t.co/K8CRrkjBD1 https://t.co/3jT3AyHs5b,Unknown,English,2016-12-29 12:51:00,2016-12-29 12:52:00,60,10,761,,0
AlbuquerqueOn,New Mexico to go after drunken drivers who skip court https://t.co/RB1oqhV0w6 https://t.co/anTO1m8tdr,Unknown,English,2016-12-29 13:21:00,2016-12-29 13:21:00,60,10,762,,0
AlbuquerqueOn,Lawmaker seeks more accountability with governor’s special fund https://t.co/yyNHvMRNS3 https://t.co/F0ZE8tfnYy,Unknown,English,2016-12-29 13:53:00,2016-12-29 13:53:00,60,10,763,,0
AlbuquerqueOn,"Thursday’s Morning Rush Video, 5 Facts: Parents say Los Lunas teacher’s assignment hum... https://t.co/jTaKG4hAh8 https://t.co/D88fZztSYC",Unknown,English,2016-12-29 14:21:00,2016-12-29 14:21:00,60,10,764,,0
AlbuquerqueOn,Businesses bring 'third wave' of coffee to Albuquerque https://t.co/rQTCpnZCD6 https://t.co/xlH1VfoYsc,Unknown,English,2016-12-29 14:53:00,2016-12-29 14:53:00,60,10,765,,0
AlbuquerqueOn,New Mexico to go after drunken drivers who skip court https://t.co/xcRbkbUcGI https://t.co/h4pwunk8vV,Unknown,English,2016-12-29 15:23:00,2016-12-29 15:23:00,60,10,766,,0
AlbuquerqueOn,Planning could lead to new international rail crossing https://t.co/9Bjt7Bbpqq https://t.co/GivdLAHAqa,Unknown,English,2016-12-29 16:53:00,2016-12-29 16:53:00,60,10,767,,0
AlbuquerqueOn,Ex-teacher convicted of touching student seeks treatment https://t.co/M7tIGNtCJb https://t.co/Gck2wS4Xof,Unknown,English,2016-12-29 17:53:00,2016-12-29 17:53:00,60,10,768,,0
AlbuquerqueOn,30 new cadets join the Albuquerque Police Department https://t.co/ZpkU3yZldV https://t.co/Q7MFFIK9gd,Unknown,English,2016-12-29 19:21:00,2016-12-29 19:21:00,60,10,769,,0
AlbuquerqueOn,Carlsbad Caverns elevators still out of service after months https://t.co/rL3wKow2UZ https://t.co/6IvQWrYjkQ,Unknown,English,2016-12-29 19:23:00,2016-12-29 19:23:00,60,10,770,,0
AlbuquerqueOn,Ketamine being used in new treatments for vets https://t.co/zt3NSUpCJ0 https://t.co/WfNiWc9E9V,Unknown,English,2016-12-29 19:53:00,2016-12-29 19:55:00,60,10,771,,0
AlbuquerqueOn,Dona Ana County treasurer appeals corruption conviction https://t.co/QiRTvvwj5x https://t.co/2q0Jgwp9Rr,Unknown,English,2016-12-29 20:23:00,2016-12-29 20:24:00,60,10,772,,0
AlbuquerqueOn,New Mexico highlights progress on overdose deaths https://t.co/ZdokheWBXX https://t.co/y3ErXPR5Ft,Unknown,English,2016-12-29 21:23:00,2016-12-29 21:23:00,60,10,773,,0
AlbuquerqueOn,Brother of JonBenet Ramsey sues CBS for $750M over series https://t.co/0lA4piOhk8 https://t.co/KNXp2sZTDw,Unknown,English,2016-12-29 21:53:00,2016-12-29 21:53:00,60,10,774,,0
AlbuquerqueOn,WisePies makes second payment to keep name on UNM basketball arena https://t.co/BgSvJ4VXta https://t.co/m63YAjmzci,Unknown,English,2016-12-29 22:51:00,2016-12-29 22:51:00,60,10,775,,0
AlbuquerqueOn,New Mexico lawmaker looks to make it easier for eligible adults to carry a gun https://t.co/g4hFHtUdue https://t.co/D04eRhDsjJ,Unknown,English,2016-12-29 23:51:00,2016-12-29 23:51:00,60,10,776,,0
AlbuquerqueOn,Deadly 2014 Albuquerque police shooting ruled justified https://t.co/e61RNOp2T7 https://t.co/4fjTXxrlYI,Unknown,English,2016-12-30 00:21:00,2016-12-30 00:21:00,60,10,777,,0
AlbuquerqueOn,Obama retaliates against Russia for election hacking https://t.co/GA66COT1xm https://t.co/ayfeCFKWYr,Unknown,English,2016-12-30 00:23:00,2016-12-30 00:23:00,60,10,778,,0
AlbuquerqueOn,SWAT teams respond to barricaded subject in southwest Albuquerque home https://t.co/yWqa4TfFGc https://t.co/28d2lui4l6,Unknown,English,2016-12-30 00:51:00,2016-12-30 00:51:00,60,10,779,,0
AlbuquerqueOn,Private contractor hunting for leak in Questa’s water system https://t.co/bg5KA6Yb5F https://t.co/qjCKzkhaVJ,Unknown,English,2016-12-30 00:53:00,2016-12-30 00:53:00,60,10,780,,0
AlbuquerqueOn,Senator proposes bill that sets requirements for New Mexico sheriffs https://t.co/64O15dV3VC https://t.co/rXJReyA8X0,Unknown,English,2016-12-30 01:21:00,2016-12-30 01:21:00,60,10,781,,0
AlbuquerqueOn,Santa Fe police arrest suspected bicycle thieves https://t.co/bvdQg6xS5x https://t.co/bvv6g7L12u,Unknown,English,2016-12-30 01:23:00,2016-12-30 01:23:00,60,10,782,,0
AlbuquerqueOn,Police investigating a suspicious death in NW Albuquerque https://t.co/z2qdQpp6Lm https://t.co/KAUnXE2eKr,Unknown,English,2016-12-30 01:44:00,2016-12-30 01:44:00,60,10,783,,0
AlbuquerqueOn,Farmington rents temporary ice skating rink https://t.co/IpW5UJfzjS https://t.co/La4KMSPuDL,Unknown,English,2016-12-30 01:53:00,2016-12-30 01:53:00,60,10,784,,0
AlbuquerqueOn,Lawmakers to bring back pot debate to upcoming session https://t.co/z8eFOd9KF4 https://t.co/EtaGAyvWHr,Unknown,English,2016-12-30 02:23:00,2016-12-30 02:23:00,60,10,785,,0
AlbuquerqueOn,SWAT team called out to SW ABQ neighborhood https://t.co/FjKFcjREUg https://t.co/JG7i8D7wSq,Unknown,English,2016-12-30 02:53:00,2016-12-30 02:53:00,60,10,786,,0
AlbuquerqueOn,APD graduates 93 for the year with latest class https://t.co/BfoPybrUAD https://t.co/QxjaH8jdJg,Unknown,English,2016-12-30 04:23:00,2016-12-30 04:23:00,60,10,787,,0
AlbuquerqueOn,"Albuquerque woman leads police on chase, crashes stolen car https://t.co/7KUZS1B5w8 https://t.co/FxEaxFxsrw",Unknown,English,2016-12-30 05:21:00,2016-12-30 05:21:00,60,10,788,,0
AlbuquerqueOn,Pedestrian dies after crash on San Mateo https://t.co/WTzBcr1ZSI https://t.co/JLTbBnPcq1,Unknown,English,2016-12-30 05:23:00,2016-12-30 05:23:00,60,10,789,,0
AlbuquerqueOn,Edgewood homeowner potentially on the hook for water system breach https://t.co/b4Re8MFVhn https://t.co/vazrpIUPlY,Unknown,English,2016-12-30 05:53:00,2016-12-30 05:53:00,60,10,790,,0
AlbuquerqueOn,New Mexico highlights progress on overdose deaths https://t.co/AwpcePB872 https://t.co/rtXAQ0ze6d,Unknown,English,2016-12-30 13:21:00,2016-12-30 13:21:00,60,10,791,,0
AlbuquerqueOn,Convenience store’s controversial signs causing online outrage https://t.co/Pq0fp7oMYm https://t.co/zawxZRfd8R,Unknown,English,2016-12-30 13:53:00,2016-12-30 13:53:00,60,10,792,,0
AlbuquerqueOn,"Albuquerque police searching for 6 missing, endangered children https://t.co/McWCkYnQ5a https://t.co/92mlJPDz8W",Unknown,English,2016-12-30 14:21:00,2016-12-30 14:21:00,60,10,793,,0
AlbuquerqueOn,Police: Repeat offender arrested at motel for auto theft https://t.co/7oPpo9wL9p https://t.co/mETcAhChWt,Unknown,English,2016-12-30 14:23:00,2016-12-30 14:23:00,60,10,794,,0
AlbuquerqueOn,Study: Babies in home visit program have less medical costs https://t.co/aRItUGy8Qt https://t.co/eoeVwuvTya,Unknown,English,2016-12-30 14:53:00,2016-12-30 14:53:00,60,10,795,,0
AlbuquerqueOn,Friday morning weather forecast https://t.co/LgloFfS0Dg https://t.co/UXsUBhgLDk,Unknown,English,2016-12-30 15:23:00,2016-12-30 15:23:00,60,10,796,,0
AlbuquerqueOn,"Santa Fe police arrest 3 thieves, recover 8 stolen bikes https://t.co/3KKYZ7T6OZ https://t.co/mnBxBJFAjs",Unknown,English,2016-12-30 16:21:00,2016-12-30 16:21:00,60,10,797,,0
AlbuquerqueOn,APD searching for six missing children https://t.co/roJZ34c6DI https://t.co/Si4wFpyJ0f,Unknown,English,2016-12-30 16:23:00,2016-12-30 16:23:00,60,10,798,,0
AlbuquerqueOn,Holiday season sees spike in deaths https://t.co/DQHRzBRafV https://t.co/BGsDwbdYaw,Unknown,English,2016-12-30 18:23:00,2016-12-30 18:23:00,60,10,799,,0
AlbuquerqueOn,Santa Claus is back on Facebook after proving his identity https://t.co/ddSrBAnxKR https://t.co/e7qeEK0I9b,Unknown,English,2016-12-30 18:53:00,2016-12-30 18:53:00,60,10,800,,0
AlbuquerqueOn,Raw video: Peru's shamans predict doom and gloom for 2017 https://t.co/mEkVmVvqha https://t.co/j98r5OHDx7,Unknown,English,2016-12-30 19:23:00,2016-12-30 19:23:00,60,10,801,,0
AlbuquerqueOn,"Against backlash, publisher to put out Yiannopoulos book https://t.co/RyhA1BgraO https://t.co/ztdsEX40MS",Unknown,English,2016-12-30 19:53:00,2016-12-30 19:53:00,60,10,802,,0
AlbuquerqueOn,Study: Chaco inhabitants likely relied on imported food https://t.co/W4sbRMlfut https://t.co/MzjfpZuXq4,Unknown,English,2016-12-30 20:53:00,2016-12-30 20:53:00,60,10,803,,0
AlbuquerqueOn,Putin says Russia won't expel diplomats; Trump offers praise https://t.co/vGPM3usAC9 https://t.co/glxr0VCUYW,Unknown,English,2016-12-30 21:53:00,2016-12-30 21:53:00,60,10,804,,0
AlbuquerqueOn,APD looking for burglary suspects https://t.co/aKImU1ouGt https://t.co/E20eDRMeOZ,Unknown,English,2016-12-30 22:53:00,2016-12-30 22:53:00,60,10,805,,0
AlbuquerqueOn,Friday evening weather forecast https://t.co/qxjwskinNZ https://t.co/JP0w6scqHy,Unknown,English,2016-12-30 23:53:00,2016-12-30 23:53:00,60,10,806,,0
AlbuquerqueOn,Police need help identifying man found dead on road https://t.co/5VBSi4Er5j https://t.co/TsEZiURkdt,Unknown,English,2016-12-31 00:21:00,2016-12-31 00:21:00,60,10,807,,0
AlbuquerqueOn,Gila forest grows by nearly 1 square mile https://t.co/zxx2MVco31 https://t.co/Pci1YjRw2g,Unknown,English,2016-12-31 00:23:00,2016-12-31 00:23:00,60,10,808,,0
AlbuquerqueOn,"Albuquerque Rapid Transit construction near Nob Hill, Old Town to resume https://t.co/yjyV9teQkV https://t.co/kcHIlsdvyv",Unknown,English,2016-12-31 00:51:00,2016-12-31 00:51:00,60,10,809,,0
AlbuquerqueOn,Washington Post names ABQ mayor among 2016's most inspiring people https://t.co/JuDthg0mxC https://t.co/WtEdCwKz2A,Unknown,English,2016-12-31 00:53:00,2016-12-31 00:53:00,60,10,810,,0
AlbuquerqueOn,"UNM student, cyclist dies after being hit by car in Texas https://t.co/0VrfO6BZGH https://t.co/1LwjBKybBv",Unknown,English,2016-12-31 01:21:00,2016-12-31 01:21:00,60,10,811,,0
AlbuquerqueOn,"Bloomfield woman hit pedestrians in stolen car, San Juan deputies say https://t.co/rdpqAGRyjC https://t.co/k9vK7FqWre",Unknown,English,2016-12-31 01:23:00,2016-12-31 01:23:00,60,10,812,,0
AlbuquerqueOn,Albuquerque police busts thieves targeting holiday shoppers https://t.co/wtLUlKvbL6 https://t.co/NOlLN5HDUc,Unknown,English,2016-12-31 01:51:00,2016-12-31 01:51:00,60,10,813,,0
AlbuquerqueOn,Halliburton to hire 200 workers in Permian Basin https://t.co/BY7mLpHdwj https://t.co/V9yKuhdiFK,Unknown,English,2016-12-31 01:53:00,2016-12-31 01:53:00,60,10,814,,0
AlbuquerqueOn,With new year comes variety of resolutions https://t.co/1ubH8mNfaa https://t.co/c0E0kI1wTR,Unknown,English,2016-12-31 02:23:00,2016-12-31 02:23:00,60,10,815,,0
AlbuquerqueOn,UN Security Council to vote Saturday on Syria cease-fire https://t.co/V6kvd1CYbK https://t.co/E6NGJxzfM9,Unknown,English,2016-12-31 02:53:00,2016-12-31 02:53:00,60,10,816,,0
AlbuquerqueOn,Debbie Reynolds and Carrie Fisher to be buried together https://t.co/24TFYjyN9j https://t.co/fvPhroCbHW,Unknown,English,2016-12-31 03:23:00,2016-12-31 03:23:00,60,10,817,,0
AlbuquerqueOn,New Mexico lawmaker looks to stiffen penalties for distracted drivers https://t.co/znvrkvs4nz https://t.co/T993KR7RyV,Unknown,English,2016-12-31 05:21:00,2016-12-31 05:21:00,60,10,818,,0
AlbuquerqueOn,"Gas leak near Central, 18th Street clamped; road reopened https://t.co/N7ni1Ds8y2 https://t.co/twTXDwNsZ2",Unknown,English,2016-12-31 05:23:00,2016-12-31 05:23:00,60,10,819,,0
AlbuquerqueOn,Top 10 feel-good New Mexico stories of 2016 https://t.co/hfQuWRzBSW https://t.co/fh7Em6wqD2,Unknown,English,2016-12-31 21:51:00,2016-12-31 21:51:00,60,10,820,,0
AlbuquerqueOn,"New Year's Eve, not time to celebrate by shooting guns in air https://t.co/bgxWZrmlIm https://t.co/6dTmS5Pm5e",Unknown,English,2016-12-31 22:53:00,2016-12-31 22:53:00,60,10,821,,0
AlbuquerqueOn,Albuquerque men arrested for trying to sell stolen gun parts https://t.co/EFexDXO1ZW https://t.co/FR5BS6tgcA,Unknown,English,2017-01-01 00:21:00,2017-01-01 00:21:00,60,10,822,,0
AlbuquerqueOn,County enters last weekend of Tavern Taxi program https://t.co/WEHIPNCHwl https://t.co/27EpTPIKna,Unknown,English,2017-01-01 01:53:00,2017-01-01 01:53:00,60,10,823,,0
AlbuquerqueOn,Family searching for missing woman from Cubero https://t.co/V53LABsMdR https://t.co/SCao9QsZI3,Unknown,English,2017-01-01 02:23:00,2017-01-01 02:23:00,60,10,824,,0
AlbuquerqueOn,New Year’s Eve weather forecast https://t.co/96LLWHTvVX https://t.co/n23Zyj4alO,Unknown,English,2017-01-01 02:53:00,2017-01-01 02:53:00,60,10,825,,0
AlbuquerqueOn,Repeat offender attempting to steal a truck injures two ABQ firefighters https://t.co/zvyW5E3zPR https://t.co/JapBHTrj6C,Unknown,English,2017-01-01 04:23:00,2017-01-01 04:23:00,60,10,826,,0
AlbuquerqueOn,Rain dampens world record Menorah attempt https://t.co/AqkVFxGf36 https://t.co/313uDCIUWw,Unknown,English,2017-01-01 05:23:00,2017-01-01 05:23:00,60,10,827,,0
AlbuquerqueOn,City celebrates NYE in Civic Plaza https://t.co/Fi93MF1h81 https://t.co/711n17Az8z,Unknown,English,2017-01-01 05:53:00,2017-01-01 05:53:00,60,10,828,,0
AlbuquerqueOn,State police crack down on drunk drivers during the holidays https://t.co/7fUyUveVVQ https://t.co/10gtjVisAd,Unknown,English,2017-01-01 07:21:00,2017-01-01 07:21:00,60,10,829,,0
AlbuquerqueOn,Albuquerque Pokemon Go players here to stay and give back https://t.co/0p2IG7WxcP https://t.co/sojx09ynE7,Unknown,English,2017-01-01 14:51:00,2017-01-01 14:51:00,60,10,830,,0
AlbuquerqueOn,Queen Elizabeth II misses church due to 'heavy cold' https://t.co/iZK1Ut3aIb https://t.co/sqGMF5l7p2,Unknown,English,2017-01-01 14:53:00,2017-01-01 14:53:00,60,10,831,,0
AlbuquerqueOn,New UN chief urges New Year's resolution: 'Put Peace First' https://t.co/fPrxNCBEo2 https://t.co/BB0jlvVW9d,Unknown,English,2017-01-01 15:23:00,2017-01-01 15:23:00,60,10,832,,0
AlbuquerqueOn,China says it will shut down ivory trade by end of 2017 https://t.co/F6AODNBSmj https://t.co/SfoTo206EX,Unknown,English,2017-01-01 15:53:00,2017-01-01 15:53:00,60,10,833,,0
