author_id,content,region,language,publish_date,harvested_date,following,followers,updates,post_type,retweet
AlbuquerqueOn,Man soon to be released from MDC caught bringing drugs into jail https://t.co/vmLHje0Aj7 https://t.co/R3khMTkIPE,Unknown,English,2017-02-26 00:31:00,2017-02-26 00:31:00,1707,129,2073,,0
AlbuquerqueOn,"Song and dance, protest and politics to mingle at Oscars https://t.co/s7zyRy0EDt https://t.co/gPqStEGU9p",Unknown,English,2017-02-26 01:01:00,2017-02-26 01:01:00,1707,129,2074,,0
AlbuquerqueOn,Wyoming beats New Mexico 82-71 https://t.co/csY6B6229G https://t.co/jUILPN0tcM,Unknown,English,2017-02-26 02:31:00,2017-02-26 02:31:00,1707,129,2075,,0
AlbuquerqueOn,"Albuquerque man arrested, charged with string of armed robberies https://t.co/sPCaKm87SH https://t.co/Xkk519ctY1",Unknown,English,2017-02-26 03:41:00,2017-02-26 03:41:00,1707,129,2076,,0
AlbuquerqueOn,Late night police pursuit ends with arrests https://t.co/qfbFDetkLa https://t.co/b5yu3eDEZd,Unknown,English,2017-02-26 04:01:00,2017-02-26 04:01:00,1707,129,2077,,0
AlbuquerqueOn,Group steps in to help Albuquerque veteran with roof troubles https://t.co/3ypdVV4aDs https://t.co/sMMaIe9109,Unknown,English,2017-02-26 04:11:00,2017-02-26 04:11:00,1707,129,2078,,0
AlbuquerqueOn,APD working to change how they deal with people with mental illness https://t.co/KshHvDlzNh https://t.co/6OopkRlc4r,Unknown,English,2017-02-26 06:01:00,2017-02-26 06:01:00,1707,129,2079,,0
AlbuquerqueOn,Albuquerque recording artist creates ‘countryachi’ music genre https://t.co/jmKcE9Tqm1 https://t.co/la1lWrfqoa,Unknown,English,2017-02-26 06:11:00,2017-02-26 06:11:00,1707,129,2080,,0
AlbuquerqueOn,State Police sends out Amber Alert for 15-year-old girl in Taos https://t.co/2JGWUnAzEe https://t.co/UsvAWn4ZkE,Unknown,English,2017-02-26 08:41:00,2017-02-26 08:41:00,1707,130,2081,,0
AlbuquerqueOn,Lake created by coal waste landslide floods Bosnian highway https://t.co/SrDc7BE7AJ https://t.co/ZrYT7V5AjT,Unknown,English,2017-02-26 14:01:00,2017-02-26 14:01:00,1707,131,2082,,0
AlbuquerqueOn,Sharp vision: New glasses help the legally blind see https://t.co/6b058NA08g https://t.co/QdXkTxvDli,Unknown,English,2017-02-26 14:31:00,2017-02-26 14:31:00,1707,132,2083,,0
AlbuquerqueOn,Justice Ginsburg praises media and the role of free press https://t.co/0ScvG7533f https://t.co/hniWChBC0v,Unknown,English,2017-02-26 15:01:00,2017-02-26 15:01:00,1707,132,2084,,0
AlbuquerqueOn,What popular tax breaks are at risk if GOP overhauls taxes? https://t.co/BA8OrLToJ5 https://t.co/uByryIcB70,Unknown,English,2017-02-26 15:31:00,2017-02-26 15:31:00,1707,132,2085,,0
AlbuquerqueOn,Hollywood Southwest exhibit showcases New Mexico’s film history https://t.co/5bFGnlgMaP https://t.co/aSgB7PPQ37,Unknown,English,2017-02-26 16:08:00,2017-02-26 16:08:00,1707,132,2086,,0
AlbuquerqueOn,The Latest: Suspect in parade crash that injured 28 ID'd https://t.co/StnCmkddry https://t.co/tcSGzpcuqZ,Unknown,English,2017-02-26 16:40:00,2017-02-26 16:40:00,1707,132,2087,,0
AlbuquerqueOn,Teen found safe after armed abduction; suspect arrested https://t.co/i66uQLTqaF https://t.co/TP8KDjDfb9,Unknown,English,2017-02-26 18:40:00,2017-02-26 18:40:00,1708,132,2088,,0
AlbuquerqueOn,Santa Fe councilors compete with mayor's soda tax plan https://t.co/cjB6pZsqs0 https://t.co/5PIOrMtgNo,Unknown,English,2017-02-26 19:40:00,2017-02-26 19:40:00,1708,133,2089,,0
AlbuquerqueOn,Family representative says actor Bill Paxton has died https://t.co/7sdM7JIKXx https://t.co/byAodMkPtK,Unknown,English,2017-02-26 20:10:00,2017-02-26 20:10:00,1708,133,2090,,0
AlbuquerqueOn,Save or splurge? Making the most of your tax refund https://t.co/k8x2eh2x6d https://t.co/PugPT2gSLu,Unknown,English,2017-02-26 21:10:00,2017-02-26 21:10:00,1708,134,2091,,0
AlbuquerqueOn,Supreme Court weighs law banning sex offenders from Facebook https://t.co/sEUnUE5YUH https://t.co/LX2R22lCc1,Unknown,English,2017-02-26 22:00:00,2017-02-26 22:02:00,1707,134,2092,,0
AlbuquerqueOn,I-10 at Arizona state line closed due to blowing dust Sunday afternoon https://t.co/2fuWm0THpe https://t.co/1hZ7CHCinp,Unknown,English,2017-02-27 00:30:00,2017-02-27 00:30:00,1707,137,2093,,0
AlbuquerqueOn,Busch wins his first Daytona 500 https://t.co/4fkp4TxCOj https://t.co/7WMeMwrmq3,Unknown,English,2017-02-27 01:00:00,2017-02-27 01:02:00,1707,139,2094,,0
AlbuquerqueOn,Eye on New Mexico: APD Reforms https://t.co/Eigc8y75vY https://t.co/QGI5UUr1OE,Unknown,English,2017-02-27 02:00:00,2017-02-27 02:00:00,1708,140,2095,,0
AlbuquerqueOn,Police investigate southwest Albuquerque shooting https://t.co/uWWCENMcN4 https://t.co/HPu8yx9sG1,Unknown,English,2017-02-27 02:13:00,2017-02-27 02:13:00,1708,140,2096,,0
AlbuquerqueOn,Woman dies near Durango after hitting a tree while skiing https://t.co/8Df41nm8wf https://t.co/eGhJHE8Onz,Unknown,English,2017-02-27 06:00:00,2017-02-27 06:00:00,1708,140,2097,,0
AlbuquerqueOn,Police investigate why SUV ran over gas pump causing explosion https://t.co/nU6Sq1CCdr https://t.co/YJmr0UaC5l,Unknown,English,2017-02-27 06:13:00,2017-02-27 06:13:00,1708,140,2098,,0
AlbuquerqueOn,Albuquerque Public Schools board members to decide fate of charter school https://t.co/RhGb4mma9I https://t.co/F2Gog2NCEw,Unknown,English,2017-02-27 12:56:00,2017-02-27 12:56:00,1708,142,2099,,0
AlbuquerqueOn,Iranians welcome Farhadi's Oscar for best foreign film https://t.co/1NmEJpyHgd https://t.co/8izDPX1IJx,Unknown,English,2017-02-27 14:32:00,2017-02-27 14:32:00,1708,142,2100,,0
AlbuquerqueOn,Volunteers sought for Manhattan Project National Park https://t.co/gcQV42dTPU https://t.co/5kpIrftqZa,Unknown,English,2017-02-27 16:32:00,2017-02-27 16:32:00,1708,143,2101,,0
AlbuquerqueOn,Feds give OK on key road to Spaceport America in New Mexico https://t.co/8tEPbAo3Y2 https://t.co/1exNG006Jz,Unknown,English,2017-02-27 16:56:00,2017-02-27 16:56:00,1708,143,2102,,0
AlbuquerqueOn,Man charged in nightclub shooting death found not guilty https://t.co/D79JFC80KZ https://t.co/vSID243khB,Unknown,English,2017-02-27 18:02:00,2017-02-27 18:04:00,1708,143,2103,,0
AlbuquerqueOn,Calls for Russia probe grow https://t.co/fiZupZQan0 https://t.co/Wgpw0B3w6M,Unknown,English,2017-02-27 18:32:00,2017-02-27 18:32:00,1708,143,2104,,0
AlbuquerqueOn,Swedish politician: officials should have sex in lunchbreak https://t.co/fznUbUjRis https://t.co/ORUMMFahPq,Unknown,English,2017-02-27 19:02:00,2017-02-27 19:03:00,1708,143,2105,,0
AlbuquerqueOn,Third suspect in Albuquerque murder arrested https://t.co/Y9FLYhMFXK https://t.co/UOGpku8s0F,Unknown,English,2017-02-27 19:26:00,2017-02-27 19:26:00,1708,143,2106,,0
AlbuquerqueOn,Dashcam shows doggy-distracted driver's crash https://t.co/eWhfUKZt23 https://t.co/xz5SQg9cvY,Unknown,English,2017-02-27 19:32:00,2017-02-27 19:32:00,1708,143,2107,,0
AlbuquerqueOn,Lawyer: Justice Dept. to no longer contest Texas' voter ID law https://t.co/MgrvZYQKQl https://t.co/dW0znOmwY0,Unknown,English,2017-02-27 20:02:00,2017-02-27 20:02:00,1929,143,2108,,0
AlbuquerqueOn,The Latest: Jewish centers 'back in business' after threats https://t.co/K5SQb4NN3b https://t.co/OUeP97mdjv,Unknown,English,2017-02-27 20:32:00,2017-02-27 20:32:00,2202,144,2109,,0
AlbuquerqueOn,Albuquerque launches competition for tallest building in New Mexico https://t.co/uBIMy0xYUr https://t.co/J4mvsaFlRU,Unknown,English,2017-02-27 21:02:00,2017-02-27 21:04:00,2202,146,2110,,0
AlbuquerqueOn,Authorities: Man dead after a fire at a Las Cruces apartment https://t.co/WIkLy0k2SM https://t.co/1xUcQnvJWQ,Unknown,English,2017-02-27 22:02:00,2017-02-27 22:04:00,2201,149,2111,,0
AlbuquerqueOn,Albuquerque BioPark celebrates International Polar Bear Day https://t.co/E16P2C03fD https://t.co/JLdizEQc9J,Unknown,English,2017-02-27 22:26:00,2017-02-27 22:26:00,2201,149,2112,,0
AlbuquerqueOn,"Takata pleads guilty in air bag scandal, agrees to pay $1B https://t.co/09Ajd3eddy https://t.co/JTQJEVq3Wo",Unknown,English,2017-02-27 22:32:00,2017-02-27 22:32:00,2201,149,2113,,0
AlbuquerqueOn,"Big surge for military in Trump budget, big cuts elsewhere https://t.co/hdL779KMOv https://t.co/VQoiGvhJa5",Unknown,English,2017-02-27 23:02:00,2017-02-27 23:02:00,2201,150,2114,,0
AlbuquerqueOn,Group plans to build New Mexico license plate wall on Route 66 https://t.co/Yo8rNdLrdw https://t.co/PBjOb41i5a,Unknown,English,2017-02-27 23:26:00,2017-02-27 23:26:00,2201,151,2115,,0
AlbuquerqueOn,Las Cruces police: Suspect in homicide case now in custody https://t.co/VX0tm17Xjn https://t.co/kfzhTLmXZD,Unknown,English,2017-02-27 23:32:00,2017-02-27 23:32:00,2201,151,2116,,0
AlbuquerqueOn,"Albuquerque mayor hopes to add new, iconic building to city’s skyline https://t.co/DjQ2cnxh9a https://t.co/KJ2EnmkcCW",Unknown,English,2017-02-27 23:56:00,2017-02-27 23:56:00,2200,151,2117,,0
AlbuquerqueOn,Jewish centers cope with bomb threats; graves vandalized https://t.co/bWkG9iJb5Z https://t.co/PRNuxYOW7S,Unknown,English,2017-02-28 00:02:00,2017-02-28 00:02:00,2200,152,2118,,0
AlbuquerqueOn,Countermeasures to Trump inundate New Mexico Legislature https://t.co/ocq7LU3vJG https://t.co/sxeMfi5DMS,Unknown,English,2017-02-28 00:32:00,2017-02-28 00:32:00,2200,153,2119,,0
AlbuquerqueOn,Albuquerque woman sews her way out of poverty https://t.co/xnC463gdZp https://t.co/qymQEIIdKM,Unknown,English,2017-02-28 00:53:00,2017-02-28 00:53:00,2200,153,2120,,0
AlbuquerqueOn,Woman recounts battle with anorexia https://t.co/qKRqzgr22I https://t.co/ex5fye7j5K,Unknown,English,2017-02-28 01:02:00,2017-02-28 01:02:00,2200,153,2121,,0
AlbuquerqueOn,Man involved in New Mexico fraud scheme fighting to stay out of jail https://t.co/OmnHna6rhO https://t.co/jEiTTT6NZE,Unknown,English,2017-02-28 01:23:00,2017-02-28 01:23:00,2200,155,2122,,0
AlbuquerqueOn,Dial-up internet service in Farmington ends https://t.co/SqfSkZLSE6 https://t.co/ewgAn3MKqb,Unknown,English,2017-02-28 01:32:00,2017-02-28 01:32:00,2200,156,2123,,0
AlbuquerqueOn,Marshals arrest suspect in June 2016 fatal shooting https://t.co/ikOlEFc5Za https://t.co/5ysobFsSMv,Unknown,English,2017-02-28 02:02:00,2017-02-28 02:03:00,2200,156,2124,,0
AlbuquerqueOn,Santa Fe man arrested in crash that killed Colorado woman https://t.co/LMyIM3XmlE https://t.co/1OmQNFNIo9,Unknown,English,2017-02-28 03:02:00,2017-02-28 03:04:00,2200,156,2125,,0
AlbuquerqueOn,Trump looks to refocus his presidency in address to Congress https://t.co/4rQqhEgqmK https://t.co/LQOcStKQpO,Unknown,English,2017-02-28 03:32:00,2017-02-28 03:32:00,2200,156,2126,,0
AlbuquerqueOn,Albuquerque High hoping to be like last year’s 11 seed at state tournament https://t.co/VOvaR2OPkn https://t.co/JuKtyOs0XH,Unknown,English,2017-02-28 04:53:00,2017-02-28 04:53:00,2200,156,2127,,0
AlbuquerqueOn,New Mexico Lottery has $2.5-$3M in unclaimed winnings each year https://t.co/0i1Yx3zFm5 https://t.co/jJxIARKOu9,Unknown,English,2017-02-28 05:23:00,2017-02-28 05:23:00,2200,156,2128,,0
AlbuquerqueOn,Committee kills pay day loans bill; other legislation advances https://t.co/cIeWyXcrCs https://t.co/2H3RSoHhIw,Unknown,English,2017-02-28 05:32:00,2017-02-28 05:32:00,2200,156,2129,,0
AlbuquerqueOn,Police investigating after body found in northwest Albuquerque https://t.co/w9cTVMtDjk,Unknown,English,2017-02-28 05:53:00,2017-02-28 05:53:00,2200,155,2130,,0
AlbuquerqueOn,New Mexico open primary bill moves through Senate https://t.co/df2LqmLuAj https://t.co/phAO5PC0LN,Unknown,English,2017-02-28 13:53:00,2017-02-28 13:53:00,1551,160,2131,,0
AlbuquerqueOn,"Inspector general: ABQ's latest deal with Taser International is fair, unbiased https://t.co/XpLmIMwyKY https://t.co/OVvrkTB71R",Unknown,English,2017-02-28 14:02:00,2017-02-28 14:02:00,1511,160,2132,,0
AlbuquerqueOn,New Mexico ski resorts craving more snow https://t.co/NNi9CbG43f https://t.co/S9PslcUZnl,Unknown,English,2017-02-28 14:23:00,2017-02-28 14:23:00,1500,160,2133,,0
AlbuquerqueOn,Oil rep: Fracking opposition hurting New Mexico oil industry https://t.co/89vfbtIovq https://t.co/I9KmxJG1Zp,Unknown,English,2017-02-28 14:32:00,2017-02-28 14:32:00,1500,160,2134,,0
AlbuquerqueOn,Tuesday morning weather forecast https://t.co/99dEdQS1xR https://t.co/Db06LG5A8y,Unknown,English,2017-02-28 15:02:00,2017-02-28 15:02:00,1500,160,2135,,0
AlbuquerqueOn,New Mexico Senate backs solar contracts for state buildings https://t.co/AuhKQWi4iR https://t.co/dfoRIaeoeS,Unknown,English,2017-02-28 15:23:00,2017-02-28 15:23:00,1500,160,2136,,0
AlbuquerqueOn,Hazardous high winds expected across eastern New Mexico https://t.co/ugQJwu5Qs3 https://t.co/IJpYk5c2Z9,Unknown,English,2017-02-28 15:32:00,2017-02-28 15:32:00,1500,160,2137,,0
AlbuquerqueOn,"A year later, Las Vegas residents still face OB-GYN shortage https://t.co/nr4DJFzF9J https://t.co/MlXjTo9ZJm",Unknown,English,2017-02-28 16:02:00,2017-02-28 16:02:00,1499,160,2138,,0
AlbuquerqueOn,Albuquerque chef tests her skills on 'Chopped' https://t.co/42uQtXvwsc https://t.co/I845Ou8TFc,Unknown,English,2017-02-28 17:00:00,2017-02-28 17:00:00,1499,159,2139,,0
AlbuquerqueOn,Blowing dust closes I-10 near Arizona-New Mexico line again https://t.co/KIlWk0SdB6 https://t.co/rIrJ0ITOeL,Unknown,English,2017-02-28 17:35:00,2017-02-28 17:35:00,1499,159,2140,,0
AlbuquerqueOn,Man arrested in connection with body found in grocery store parking lot https://t.co/UgJ1dZ2kg3 https://t.co/ZPoQMBe7Z3,Unknown,English,2017-02-28 19:00:00,2017-02-28 19:00:00,1499,159,2141,,0
AlbuquerqueOn,"Kellyanne Conway kneels on Oval Office couch, sparks debate https://t.co/4mhO2vU1ZP https://t.co/NAOri1kQDB",Unknown,English,2017-02-28 20:00:00,2017-02-28 20:00:00,1499,161,2142,,0
AlbuquerqueOn,"Outage leaves 2,812 Albuquerque PNM customers without power https://t.co/H9UWjK8zv0 https://t.co/VZVU2m7lXC",Unknown,English,2017-02-28 20:05:00,2017-02-28 20:05:00,1499,161,2143,,0
AlbuquerqueOn,New Mexico watches its wallet on new criminal penalties https://t.co/KfoU8Koa6K https://t.co/c5acO3QmMX,Unknown,English,2017-02-28 21:30:00,2017-02-28 21:30:00,1499,161,2144,,0
AlbuquerqueOn,What to watch for when Trump makes 1st address to Congress https://t.co/ojEa1RHNpf https://t.co/2LtvIcqn6x,Unknown,English,2017-02-28 22:00:00,2017-02-28 22:00:00,1499,161,2145,,0
AlbuquerqueOn,Roswell-Phoenix flights reach first-year milestone https://t.co/cSCmi0YWw9 https://t.co/VkP6DBLJN9,Unknown,English,2017-02-28 22:30:00,2017-02-28 22:30:00,1499,161,2146,,0
AlbuquerqueOn,Albuquerque man accused in deadly crash sentenced to jail https://t.co/ZjK3HheDZh https://t.co/I8U4Q8fVa9,Unknown,English,2017-02-28 22:35:00,2017-02-28 22:35:00,1499,161,2147,,0
AlbuquerqueOn,Video shows good deeds done by Albuquerque officers https://t.co/6rw5iVkHbV https://t.co/QFm3CvsyG9,Unknown,English,2017-02-28 23:11:00,2017-02-28 23:13:00,1499,159,2148,,0
AlbuquerqueOn,Fire burns near Eddy County Fairgrounds https://t.co/x7bu4BYrmA https://t.co/NvQmCz1f9Z,Unknown,English,2017-02-28 23:49:00,2017-02-28 23:49:00,1499,158,2149,,0
AlbuquerqueOn,Study ranks New Mexico high for pet health https://t.co/bcKtc6Mxg1 https://t.co/5uDkVjDSFd,Unknown,English,2017-03-01 00:11:00,2017-03-01 00:11:00,1499,158,2150,,0
AlbuquerqueOn,Study ranks New Mexico high for pet health https://t.co/bcKtc6Mxg1 https://t.co/5uDkVjDSFd,Unknown,English,2017-03-01 00:11:00,2017-03-01 00:11:00,1499,158,2150,,0
AlbuquerqueOn,Amazon cloud storage failure causes widespread disruption https://t.co/LXRfyKMYZ4 https://t.co/e1bmdeIjYI,Unknown,English,2017-03-01 00:19:00,2017-03-01 00:19:00,1499,158,2151,,0
AlbuquerqueOn,Amazon cloud storage failure causes widespread disruption https://t.co/LXRfyKMYZ4 https://t.co/e1bmdeIjYI,Unknown,English,2017-03-01 00:19:00,2017-03-01 00:19:00,1499,158,2151,,0
AlbuquerqueOn,New Mexico Senator proposes bill to protect Jewish Community Centers https://t.co/XwUDXS5P8X https://t.co/olNB4TB7ps,Unknown,English,2017-03-01 00:41:00,2017-03-01 00:41:00,1499,158,2152,,0
AlbuquerqueOn,New Mexico Senator proposes bill to protect Jewish Community Centers https://t.co/XwUDXS5P8X https://t.co/olNB4TB7ps,Unknown,English,2017-03-01 00:41:00,2017-03-01 00:41:00,1499,158,2152,,0
AlbuquerqueOn,Renewable energy bills advance in New Mexico https://t.co/j3b2LO5b4P https://t.co/9rY2ERikdo,Unknown,English,2017-03-01 00:49:00,2017-03-01 00:49:00,1499,158,2153,,0
AlbuquerqueOn,Renewable energy bills advance in New Mexico https://t.co/j3b2LO5b4P https://t.co/9rY2ERikdo,Unknown,English,2017-03-01 00:49:00,2017-03-01 00:49:00,1499,158,2153,,0
AlbuquerqueOn,New Mexico family asking for help after fatal skiing accident https://t.co/RCwMfFb73M https://t.co/W40yq9UqTe,Unknown,English,2017-03-01 01:11:00,2017-03-01 01:11:00,1499,157,2154,,0
AlbuquerqueOn,New Mexico family asking for help after fatal skiing accident https://t.co/RCwMfFb73M https://t.co/W40yq9UqTe,Unknown,English,2017-03-01 01:11:00,2017-03-01 01:11:00,1499,157,2154,,0
AlbuquerqueOn,Ex-New Mexico corrections officer pleads guilty in drug case https://t.co/iiFKE8zQ81 https://t.co/HOxz0v6ZKx,Unknown,English,2017-03-01 01:19:00,2017-03-01 01:19:00,1499,157,2155,,0
AlbuquerqueOn,Ex-New Mexico corrections officer pleads guilty in drug case https://t.co/iiFKE8zQ81 https://t.co/HOxz0v6ZKx,Unknown,English,2017-03-01 01:19:00,2017-03-01 01:19:00,1499,157,2155,,0
AlbuquerqueOn,APD: 75-year-old man carjacked outside Tony Hillerman Library https://t.co/hFjT6TOnIB https://t.co/Ba9hcJxQiE,Unknown,English,2017-03-01 01:49:00,2017-03-01 01:49:00,1498,155,2156,,0
AlbuquerqueOn,APD: 75-year-old man carjacked outside Tony Hillerman Library https://t.co/hFjT6TOnIB https://t.co/Ba9hcJxQiE,Unknown,English,2017-03-01 01:49:00,2017-03-01 01:49:00,1498,155,2156,,0
AlbuquerqueOn,"Man arrested for exposing himself in front of children, police say https://t.co/wRF7MlDvMl https://t.co/PnUWbYlLKZ",Unknown,English,2017-03-01 02:19:00,2017-03-01 02:19:00,1498,155,2157,,0
AlbuquerqueOn,"Man arrested for exposing himself in front of children, police say https://t.co/wRF7MlDvMl https://t.co/PnUWbYlLKZ",Unknown,English,2017-03-01 02:19:00,2017-03-01 02:19:00,1498,155,2157,,0
AlbuquerqueOn,Case closed: Death of treasure hunter remains a mystery https://t.co/Q9jY0HWXHV https://t.co/3m7BhfI6D6,Unknown,English,2017-03-01 02:49:00,2017-03-01 02:49:00,1498,156,2158,,0
AlbuquerqueOn,Case closed: Death of treasure hunter remains a mystery https://t.co/Q9jY0HWXHV https://t.co/3m7BhfI6D6,Unknown,English,2017-03-01 02:49:00,2017-03-01 02:49:00,1498,156,2158,,0
AlbuquerqueOn,The Latest: Trump pledges new action on immigration https://t.co/rIjfJwAGGC https://t.co/08cGXyCSZK,Unknown,English,2017-03-01 03:19:00,2017-03-01 03:19:00,1498,157,2159,,0
AlbuquerqueOn,The Latest: Trump pledges new action on immigration https://t.co/rIjfJwAGGC https://t.co/08cGXyCSZK,Unknown,English,2017-03-01 03:19:00,2017-03-01 03:19:00,1498,157,2159,,0
AlbuquerqueOn,"Deputies investigating reported abduction, carjacking attempt in Sandia Heights https://t.co/oi8ly8mxTu https://t.co/Zho3n8tyTP",Unknown,English,2017-03-01 04:49:00,2017-03-01 04:49:00,1499,157,2160,,0
AlbuquerqueOn,"Deputies investigating reported abduction, carjacking attempt in Sandia Heights https://t.co/oi8ly8mxTu https://t.co/Zho3n8tyTP",Unknown,English,2017-03-01 04:49:00,2017-03-01 04:49:00,1499,157,2160,,0
AlbuquerqueOn,Wild winds hit New Mexico with vengeance https://t.co/HXDGKAWbJG https://t.co/9iDTWWyqeh,Unknown,English,2017-03-01 05:11:00,2017-03-01 05:11:00,1499,157,2161,,0
AlbuquerqueOn,New Mexico House approves stiffer gun possession penalty https://t.co/zf8vWCkSZF https://t.co/hMIipgwSky,Unknown,English,2017-03-01 05:49:00,2017-03-01 05:50:00,1498,157,2162,,0
AlbuquerqueOn,"Manhunt underway for out-of-state murder suspect after Albuquerque kidnapping, carjack... https://t.co/5yAlB6P61M https://t.co/a9yBkQbDYU",Unknown,English,2017-03-01 12:31:00,2017-03-01 12:31:00,1923,159,2163,,0
AlbuquerqueOn,"Wednesday’s Morning Rush Video, 5 Facts: Mississippi murder suspect spotted in Albuque... https://t.co/8D64rCZIcp https://t.co/Rp0mehFZRl",Unknown,English,2017-03-01 14:06:00,2017-03-01 14:06:00,1923,159,2164,,0
AlbuquerqueOn,New Mexico tribes pressure feds on drilling in Chaco region https://t.co/s4v0dQO1Fk https://t.co/jNpKdMGqao,Unknown,English,2017-03-01 18:28:00,2017-03-01 18:28:00,1922,164,2165,,0
AlbuquerqueOn,Artesia fire claims two homes https://t.co/WTxBaalUM3 https://t.co/TK14y79vWS,Unknown,English,2017-03-01 18:58:00,2017-03-01 18:58:00,1922,164,2166,,0
AlbuquerqueOn,Trump's military spending plan could impact New Mexico's bases https://t.co/GfggUrKw7F https://t.co/MTcOLZU2CE,Unknown,English,2017-03-01 19:28:00,2017-03-01 19:28:00,1922,164,2167,,0
AlbuquerqueOn,New Mexico Senate debates minimum wage hike https://t.co/TAoxALmrTy https://t.co/JbqXgI11Zq,Unknown,English,2017-03-01 20:54:00,2017-03-01 20:54:00,1922,163,2168,,0
AlbuquerqueOn,Kidnapping suspect's crime spree began in Mississippi https://t.co/hk8XMMnTRy https://t.co/6EX05G2UbN,Unknown,English,2017-03-01 21:28:00,2017-03-01 21:28:00,1922,164,2169,,0
AlbuquerqueOn,Feds: New Mexico's signature crop fares well in 2016 https://t.co/F2RKhnLMpK https://t.co/HP1ZLYiC0o,Unknown,English,2017-03-01 21:58:00,2017-03-01 21:58:00,1922,162,2170,,0
AlbuquerqueOn,New Mexico House approves stiffer gun possession penalty https://t.co/Kr6fI4IE4U https://t.co/BDx8qZuSht,Unknown,English,2017-03-01 22:24:00,2017-03-01 22:24:00,1922,162,2171,,0
AlbuquerqueOn,Long stretch of NM International Border has no fencing; just vehicle barriers https://t.co/3sNJGlQOgv https://t.co/BKdVHoU5qI,Unknown,English,2017-03-01 22:58:00,2017-03-01 22:58:00,1922,163,2172,,0
AlbuquerqueOn,Suspect in Albuquerque stabbing death appears in court https://t.co/EwuK4xvNJc https://t.co/k0EBhpgMKn,Unknown,English,2017-03-01 23:24:00,2017-03-01 23:24:00,1922,162,2173,,0
AlbuquerqueOn,"Record highs for US stocks; Dow crosses 21,000-point mark https://t.co/GclcemUCRH https://t.co/PEUp7Bc2M7",Unknown,English,2017-03-01 23:28:00,2017-03-01 23:28:00,1922,162,2174,,0
AlbuquerqueOn,AP Exclusive: Accountants in Oscar mistake off the show https://t.co/SdvqHqpL6H https://t.co/mDtfjzgg7o,Unknown,English,2017-03-01 23:58:00,2017-03-01 23:58:00,1922,163,2175,,0
AlbuquerqueOn,Albuquerque chef named ‘Chopped’ champion https://t.co/im2EW9w8Ac https://t.co/Dj3Grlnmpu,Unknown,English,2017-03-02 00:24:00,2017-03-02 00:24:00,1922,162,2176,,0
AlbuquerqueOn,Judge rules taxi driver murder suspect can't post bond until arraignment https://t.co/MxbdbJvBe8 https://t.co/T8kDq3nPO3,Unknown,English,2017-03-02 00:28:00,2017-03-02 00:28:00,1922,162,2177,,0
AlbuquerqueOn,New Mexico senator hopes to reduce penalties for having marijuana https://t.co/KGISoi259C https://t.co/qGyyTG0PNo,Unknown,English,2017-03-02 00:54:00,2017-03-02 00:54:00,1922,162,2178,,0
AlbuquerqueOn,Cirque du Soleil hosts performances in Albuquerque https://t.co/aYimlTB5M0 https://t.co/3zD68HDKFN,Unknown,English,2017-03-02 01:24:00,2017-03-02 01:24:00,1922,163,2179,,0
AlbuquerqueOn,New Mexico governor pressures Senate to act on nominations https://t.co/4ayI3P0M8g https://t.co/1hrAcISIS9,Unknown,English,2017-03-02 01:28:00,2017-03-02 01:28:00,1922,163,2180,,0
AlbuquerqueOn,Medical marijuana facility holds ribbon-cutting ceremony in Bernalillo https://t.co/3fS3DfTCw9 https://t.co/pO6qDjjjHz,Unknown,English,2017-03-02 01:58:00,2017-03-02 01:58:00,1921,166,2181,,0
AlbuquerqueOn,About $200K in funds missing at Northern New Mexico College https://t.co/772Un9E0oI https://t.co/wYfPHorEjM,Unknown,English,2017-03-02 02:24:00,2017-03-02 02:24:00,1921,166,2182,,0
AlbuquerqueOn,Deadly storm in Midwest sounded like 'explosion of glass' https://t.co/xbQnABLFxo https://t.co/WVsJOx8cJv,Unknown,English,2017-03-02 02:28:00,2017-03-02 02:28:00,1921,166,2183,,0
AlbuquerqueOn,AP Exclusive: Taxes could flow with Dakota Access pipeline https://t.co/YWQWck3i82 https://t.co/nYe3EFurAP,Unknown,English,2017-03-02 02:58:00,2017-03-02 02:58:00,1921,166,2184,,0
AlbuquerqueOn,Albuquerque Public Schools swears in new board members https://t.co/gUfSWrXTW5 https://t.co/cUEx4EGYiZ,Unknown,English,2017-03-02 04:54:00,2017-03-02 04:54:00,1921,165,2185,,0
AlbuquerqueOn,Sources: APD supervisors told to limit overtime https://t.co/TudfySHbPY https://t.co/qBDwznWyjQ,Unknown,English,2017-03-02 05:28:00,2017-03-02 05:28:00,1921,166,2186,,0
AlbuquerqueOn,New Mexico seeks return to pre-recession employment levels https://t.co/AeEj8Tbt7J https://t.co/VsZmCiMbpp,Unknown,English,2017-03-02 14:28:00,2017-03-02 14:28:00,1921,172,2187,,0
AlbuquerqueOn,New Mexico health agency: Flu activity widespread in state https://t.co/xNb73JTsT0 https://t.co/EZ8iorjEFc,Unknown,English,2017-03-02 14:54:00,2017-03-02 14:54:00,1921,172,2188,,0
AlbuquerqueOn,Rep. Pearce to hold in-person town hall in Ruidoso https://t.co/QBc6LlSLGj https://t.co/C6gIOJdQ2T,Unknown,English,2017-03-02 14:58:00,2017-03-02 14:58:00,1921,172,2189,,0
AlbuquerqueOn,New Mexico Democrats push for gasoline tax increase https://t.co/5wdUb3Gcnn https://t.co/FVRa5tdFF2,Unknown,English,2017-03-02 15:24:00,2017-03-02 15:24:00,1921,172,2190,,0
AlbuquerqueOn,Environmentalists challenge Rio Grande water transfer https://t.co/Gz7BH9446h https://t.co/vnYM6waP5G,Unknown,English,2017-03-02 15:28:00,2017-03-02 15:28:00,1921,172,2191,,0
AlbuquerqueOn,Department of Health: Flu cases widespread across New Mexico https://t.co/XZ1Bm4rF3G https://t.co/ICWjrBvLXw,Unknown,English,2017-03-02 16:28:00,2017-03-02 16:28:00,1921,173,2192,,0
AlbuquerqueOn,The Latest: Flood risk greatly reduced in protest camp area https://t.co/sOMSFEpQrb https://t.co/8wwUQ7Lw2A,Unknown,English,2017-03-02 17:58:00,2017-03-02 17:58:00,1921,172,2193,,0
AlbuquerqueOn,Calls grow for Sessions to withdraw from Russia probe https://t.co/SHRXFAkPxH https://t.co/toBayogLLt,Unknown,English,2017-03-02 18:28:00,2017-03-02 18:28:00,1921,172,2194,,0
AlbuquerqueOn,New Mexico Democrats push for gasoline tax increase https://t.co/sunbv0WIrP https://t.co/XtYNu6m3fK,Unknown,English,2017-03-02 18:58:00,2017-03-02 18:58:00,1921,174,2195,,0
