author_id,content,region,language,publish_date,harvested_date,following,followers,updates,post_type,retweet
angelistRR,#ste BREAKING : U.S. Spy Satellites CATCH North Korea Attempting Sneaky Move https://t.co/bsWPgfRHkx https://t.co/JsfvUGwgbm,Unknown,English,2017-08-08 07:28:00,2017-08-08 07:29:00,49,1,13,R,1
angelistRR,#ste BOMBSHELL! Comey’s FBI Helped Set Up Clinton / Lynch Tarmac Meeting https://t.co/gNCNiaCNHW https://t.co/PrYYoaacco,Unknown,English,2017-08-08 07:28:00,2017-08-08 07:28:00,49,1,12,R,1
angelistRR,#ste Trump’s Lawyer Going to SCOTUS Over Blockade of Undercover Abortion Videos https://t.co/l0exTb7TI0 https://t.co/fCKivgFqtc,Unknown,English,2017-08-08 07:28:00,2017-08-08 07:28:00,49,1,4,R,1
angelistRR,#ste SICK! ANTIFA attacked Trump Supporters during a PRAYER Rally! https://t.co/EL4aQ9cHqC https://t.co/cNupx6pkD8,Unknown,English,2017-08-08 07:28:00,2017-08-08 07:28:00,49,1,16,R,1
angelistRR,#ste BREAKING : EVEN MORE Jobs Coming to Michigan! https://t.co/VBhurhL8qO https://t.co/S9BG2sKwPT,Unknown,English,2017-08-08 07:28:00,2017-08-08 07:28:00,49,1,7,R,1
angelistRR,#ste BREAKING : Sean Hannity is Preparing to SUE the Obama Administration! https://t.co/9rK1nLuSGf https://t.co/f12ZOIw7ua,Unknown,English,2017-08-08 07:28:00,2017-08-08 07:28:00,49,1,1,R,1
angelistRR,"#ste While Dems and Media Obsess on Russia, Trump’s AMERICAN Economy is BOOMING! https://t.co/IvMpbP4DYn https://t.co/zQvy0v3FSN",Unknown,English,2017-08-08 07:28:00,2017-08-08 07:28:00,49,1,6,R,1
angelistRR,"#ste Liberal Author Attacks Trump’s “Birther” Comments, Forgets one HUGE Problem! https://t.co/dynfuCHEVR https://t.co/vlODdgwgOr",Unknown,English,2017-08-08 07:28:00,2017-08-08 07:29:00,49,1,9,R,1
angelistRR,#ste Former Obama Officials Formed a Shadow DC Network to Push His Agenda https://t.co/tlWiZ8G79g https://t.co/EFS4UTHS2H,Unknown,English,2017-08-08 07:28:00,2017-08-08 07:28:00,49,1,15,R,1
angelistRR,#ste Atheists LOSING THEIR SH*T Over Trump’s CHRISTIAN White House https://t.co/qkpOzFKlwn https://t.co/4zmWXyqR2V,Unknown,English,2017-08-08 07:28:00,2017-08-08 07:28:00,49,1,3,R,1
angelistRR,#ste Eric Bolling Just Responded to His Fox News Suspension! https://t.co/jHIMvDgRQG https://t.co/V76qNQjRYn,Unknown,English,2017-08-08 07:28:00,2017-08-08 07:28:00,49,1,2,R,1
angelistRR,#ste Gov. Abbott Just IGNORED the BAD Advice of “Triggered” Crybaby Liberals! https://t.co/Pyv2AxhtKj https://t.co/fjSOsvMTq2,Unknown,English,2017-08-08 07:28:00,2017-08-08 07:28:00,49,1,11,R,1
angelistRR,#ste Trump Cracks Down on Food Stamp Fraud and it INSTANTLY Does Wonders! https://t.co/M5hs5ZtPzU https://t.co/3U1v8Ba8sj,Unknown,English,2017-08-08 07:28:00,2017-08-08 07:28:00,49,1,5,R,1
angelistRR,#ste LOL : Rahm Emanuel Refuses to Answer if Pelosi and Schumer are Good Leaders https://t.co/bjZI0cfuwf https://t.co/3ncDJ2DGmS,Unknown,English,2017-08-08 07:28:00,2017-08-08 07:29:00,49,1,14,R,1
angelistRR,#ste WHAT??? Liberal Media Advising Parents to IGNORE Gender Science! https://t.co/mVs7wZqpb3 https://t.co/6EERJNlhB6,Unknown,English,2017-08-08 07:28:00,2017-08-08 07:28:00,49,1,10,R,1
angelistRR,#ste Massive Obama Era Food Stamp Fraud EXPOSED and ENDED By Trump! https://t.co/YxZqRLZYmc https://t.co/vDFXIE9lMS,Unknown,English,2017-08-08 07:28:00,2017-08-08 07:28:00,49,1,17,R,1
angelistRR,#ste Traitor Jeff Flake is Now Defending Obama https://t.co/TY4E8MFK26 https://t.co/moT2yRIghm,Unknown,English,2017-08-08 07:28:00,2017-08-08 07:28:00,49,1,8,R,1
angelistRR,RT Rubysayzz: WE THE PEOPLE KNEW THIS - NOW APPT SPECIAL COUNSEL! AGJeffBSessions  POTUS   https://t.co/l0ZVgcKBon,Unknown,English,2017-08-11 12:20:00,2017-08-11 12:21:00,0,4,18,,0
angelistRR,RT DebAlwaystrump: America is pissed😠 FBI never checked DNC servers to see if Russia REALLY hacked just took Dems … https://t.co/g6Lkal8m7n,Unknown,English,2017-08-11 12:21:00,2017-08-11 12:21:00,0,4,20,,0
angelistRR,RT Rampage95x2: 🚨🇺🇸 #RampagesRant 🇺🇸🚨 Liberals &amp; Stolen Valor &amp; Libs blaming Trump for N Korea! #Liberalism101 : s… https://t.co/vdvsOuCtqq,Unknown,English,2017-08-11 12:21:00,2017-08-11 12:21:00,0,4,21,,0
angelistRR,RT BattleFrontUSA: I try and have compassion for democratic voters since they can't overcome being conned by #fakenews and #fakenewspolls .…,Unknown,English,2017-08-11 12:21:00,2017-08-11 12:21:00,0,4,23,,0
angelistRR,"RT DebAlwaystrump: FBI Congress DOJ politicized✔ UNPUNISHED Dem corruption doubled our DEBT💲💸 8 years knows ""Fake … https://t.co/dEPJJ3zteU",Unknown,English,2017-08-11 12:21:00,2017-08-11 12:21:00,0,4,19,,0
angelistRR,RT roccotrinacria: Anyone surprised???guess when America was lulled2sleep by Obama's stupidity theyweren't  counti… https://t.co/AqIfvVTjtV,Unknown,English,2017-08-11 12:21:00,2017-08-11 12:21:00,49,4,22,,0
angelistRR,RT AppSame: Well billclinton gave North Korea $5B BarackObama gave Iran $17.5B want to know what will get https://t.co/rXw37nNG9s,Unknown,English,2017-08-11 12:22:00,2017-08-11 12:23:00,0,4,24,,0
angelistRR,RT kelliwardaz: #GOP voters want action &amp; all we've gotten is finger pointing at realDonaldTrump - the era of excu… https://t.co/B37QYKnior,Unknown,English,2017-08-11 12:23:00,2017-08-11 12:23:00,0,4,26,,0
angelistRR,"RT StacyLStiles: Instead of providing FBI w/ all his files months ago, #Manafort could have been like #HRC &amp; all o… https://t.co/Xgo4SgfJCO",Unknown,English,2017-08-11 12:23:00,2017-08-11 12:23:00,49,4,25,,0
angelistRR,RT KamVTV: NBC's Andrea Mitchell just got Schooled and its VIRAL  #vogue #MAGA https://t.co/9buzI5niWj,Unknown,English,2017-08-11 12:24:00,2017-08-11 12:24:00,0,4,27,,0
angelistRR,Woohoo! https://t.co/gUu1vwHrEm,Unknown,English,2017-08-11 12:33:00,2017-08-11 12:33:00,49,4,28,Q,1
angelistRR,"RT FoxNews: Google mistreats conservative employees, California congressman says https://t.co/i6AwdiSmcL",Unknown,English,2017-08-11 12:33:00,2017-08-11 12:33:00,49,4,29,,0
angelistRR,"RT ramin_parsa: DougSides I'm a former Muslim. Islam is very evil. Islam is a combination of Nazism,facisim,social… https://t.co/hMBPjECeVm",Unknown,English,2017-08-11 12:34:00,2017-08-11 12:35:00,0,4,33,,0
angelistRR,RT kjsm006: ⚠️⚠️ #clintoncrimefamily must watch RealMattCouch on #Periscope: America First Media Live Thursday Nig… https://t.co/xjNnfBpzP0,Unknown,English,2017-08-11 12:34:00,2017-08-11 12:34:00,0,4,30,,0
angelistRR,RT LVNancy: 💯#DebbieWassermanSchultz: a Threat to National Securtiy #LockHerUP 🔹#DNC Data breach 🔹Refused FBI coop… https://t.co/CPIdpfjI6t,Unknown,English,2017-08-11 12:34:00,2017-08-11 12:34:00,0,4,31,,0
angelistRR,"RT StacyLStiles: This Celebrity Obsessed Culture we live in is poisoning our youth, &amp; destroying our Freedom of Sp… https://t.co/HpYsTojGBX",Unknown,English,2017-08-11 12:34:00,2017-08-11 12:35:00,49,4,34,,0
angelistRR,RT BARRYCUDA3: HILLARY'S RUSSIAN TREASON ! MEDIA ? realDonaldTrump RealJamesWoods rrommel9999 DougLehto USMC eaves… https://t.co/Lj1QvAAEpN,Unknown,English,2017-08-11 12:34:00,2017-08-11 12:34:00,0,4,32,,0
angelistRR,RT securefreedom: Nikki Haley won consent of China &amp; Russia to punish North Korea.  Can Team Trump now make China … https://t.co/Gefn6LvP4d,Unknown,English,2017-08-11 12:35:00,2017-08-11 12:35:00,0,4,36,,0
angelistRR,"RT DiamondandSilk: .YouTube TeamYouTube stopped over 95% percent of our videos from being monetized, stating: ""It'… https://t.co/GatfLz21yz",Unknown,English,2017-08-11 12:35:00,2017-08-11 12:35:00,49,4,35,,0
angelistRR,"RT securefreedom: Obama knew about Korea's nukes &amp; did his usual stunt: ignore discredit, downplay. The media was … https://t.co/buwU5edRum",Unknown,English,2017-08-11 12:36:00,2017-08-11 12:36:00,0,4,39,,0
angelistRR,"RT BrianHassine: Love listening to GOP experts on fox debate what to do with Trump, when ITS UP TO US..NOT THEM ChrisStirewalt U and your b…",Unknown,English,2017-08-11 12:36:00,2017-08-11 12:37:00,49,4,41,,0
angelistRR,RT tweettruth2me: Your mouth has caused more devastation to America than assault weapons. https://t.co/QQbG9XzeQa,Unknown,English,2017-08-11 12:36:00,2017-08-11 12:36:00,0,4,40,Q,1
angelistRR,RT StacyLStiles: What we need to put an end to is all the corruption &amp; crimes flowing from  #DNC &amp; #DemocraticPart… https://t.co/MHKbRz7bK4,Unknown,English,2017-08-11 12:36:00,2017-08-11 12:37:00,49,4,38,,0
angelistRR,RT vannsmole: Why do liberals get their own hashtag?  #NationalLazyDay,Unknown,English,2017-08-11 12:37:00,2017-08-11 12:37:00,0,4,42,,0
angelistRR,#anlis Muslim Terror Group Defends McMaster https://t.co/rlugytU5So https://t.co/h8gJsWrOcf,Unknown,English,2017-08-11 13:02:00,2017-08-11 13:02:00,49,4,45,,0
angelistRR,#anlis Fox News Host SLAMS Mueller for ‘Stacking the Deck’ Against Trump https://t.co/U6MrvTL8gf https://t.co/jWAN3zpBGt,Unknown,English,2017-08-11 13:02:00,2017-08-11 13:03:00,0,4,44,,0
angelistRR,#anlis Democrat Declares NRA a “National Security Threat” https://t.co/2w2FBr8gvE https://t.co/ii35xmunKI,Unknown,English,2017-08-11 13:02:00,2017-08-11 13:02:00,0,4,43,,0
angelistRR,#anlis Sanctuary City Clown Rahm Emanuel Trying to “Take on Trump” https://t.co/mW3SrGtRdJ https://t.co/deohPjyO5L,Unknown,English,2017-08-11 13:08:00,2017-08-11 13:08:00,49,4,49,,0
angelistRR,#anlis Australia Choses a Side! https://t.co/Aishb2erAx https://t.co/0N8CtFdxfz,Unknown,Spanish,2017-08-11 13:08:00,2017-08-11 13:08:00,49,4,50,,0
angelistRR,#anlis Obama Plans ‘Delicate Dance’ in Comeback with Dems https://t.co/3WHN7xQqhs https://t.co/2bdWP0SDW1,Unknown,English,2017-08-11 13:08:00,2017-08-11 13:09:00,0,4,46,,0
angelistRR,#anlis Trump Lawyer RIPS Special Counsel for “GROSS ABUSE” https://t.co/o5zlmKVatw https://t.co/KjOUrIVoKr,Unknown,English,2017-08-11 13:08:00,2017-08-11 13:09:00,0,4,48,,0
angelistRR,Lib pussies. https://t.co/nuWSEyLm8W,Unknown,English,2017-08-11 16:25:00,2017-08-11 16:25:00,49,4,58,Q,1
angelistRR,RT debesstrs: new nickname for her #MadMaxMaxine https://t.co/lWX6Ut5qcS,Unknown,English,2017-08-11 16:25:00,2017-08-11 16:25:00,49,4,60,Q,1
angelistRR,RT SebGorka: Thanks to good offices of Secretary Tillerson &amp; nikkihaley we reached an history UN decision.  Ball i… https://t.co/O3PtJAAUSL,Unknown,English,2017-08-11 16:25:00,2017-08-11 16:25:00,49,4,54,,0
angelistRR,RT JDjwhite54: tweettruth2me mickrsmith Every woman needs to carry a gun. Except a liberal one.,Unknown,English,2017-08-11 16:25:00,2017-08-11 16:25:00,49,4,53,,0
angelistRR,RT Thomas1774Paine: The Media Lied About The Leaked Google Memo (VIDEO) https://t.co/dUKXrD2qaO,Unknown,English,2017-08-11 16:25:00,2017-08-11 16:25:00,49,4,55,,0
angelistRR,RT debesstrs: RT PollyPatriot: MT dansch2002: We don't have to wait for Washington! Join us! … https://t.co/jNw7rRofSo,Unknown,English,2017-08-11 16:25:00,2017-08-11 16:25:00,49,4,61,,0
angelistRR,"RT American1765: I am real &amp; I use my real pics. I have a BA, MA &amp; PhD in communication. I believe in the American spirit conceived in 1765…",Unknown,English,2017-08-11 16:25:00,2017-08-11 16:25:00,49,4,52,,0
angelistRR,Maxine is a dumb nasty cunt. Period. https://t.co/4bQ9BUB18Q,Unknown,English,2017-08-11 16:25:00,2017-08-11 16:25:00,49,4,59,Q,1
angelistRR,RT docmurdock: To think that we have a President who uses LOCKED &amp; LOADED is FUCKING AWESOME!!! #lockedandloaded #TRUMP #MAGA #SUCKITDEMS #…,Unknown,English,2017-08-11 16:25:00,2017-08-11 16:25:00,49,4,57,,0
angelistRR,RT Pink_About_it: I've never seen so many snowflakes triggered over morning Joe mika and psycho joe. 😂  Only trump can make a snowstorm hap…,Unknown,English,2017-08-11 16:25:00,2017-08-11 16:25:00,49,4,56,,0
angelistRR,"RT timgw37: dcexaminer ""When is a Russian 'hack' not a hack? Evidence suggests DNC email hack was an inside job"" https://t.co/vso6XFbsdK …",Unknown,English,2017-08-11 16:33:00,2017-08-11 16:33:00,49,5,68,,0
angelistRR,RT TruthinGov2016: Reminder to those obstructing the Seth Rich investigation: this case will go to trial. You do not want to be on the wron…,Unknown,English,2017-08-11 16:33:00,2017-08-11 16:33:00,49,5,67,,0
angelistRR,RT TCuccio: GovAbbott SenTedCruz  #GodBlessTexas # https://t.co/9hUYe9eip0,Unknown,English,2017-08-11 16:33:00,2017-08-11 16:33:00,49,5,69,,0
angelistRR,"RT jihadwatchRS: Hamas-linked CAIR defends McMaster, says “Islamophobes” behind effort to remove him https://t.co/3UWwdv6NMn",Unknown,English,2017-08-11 16:33:00,2017-08-11 16:33:00,49,5,64,,0
angelistRR,RT davidconklin74: ANOTHER example of BHO's goons that are JUDGES and are SS tactics in OUR COUNTRY!!!  SESSIONS ?… https://t.co/OjuROZLLT2,Unknown,English,2017-08-11 16:33:00,2017-08-11 16:33:00,49,5,66,,0
angelistRR,RT debesstrs: OutnumberedFNC  STOP SAYING MIXED MESSAGE that is just spin 😠 Americans totally understand  what Trump is saying,Unknown,English,2017-08-11 16:33:00,2017-08-11 16:33:00,49,5,62,,0
angelistRR,RT go4gin: SAD trombone: Even Dems want Debbie Wasserman Schultz and her ‘negative stories’ to GTFO – … https://t.co/bdiG3XZlGT,Unknown,English,2017-08-11 16:33:00,2017-08-11 16:33:00,49,5,70,,0
angelistRR,RT debesstrs: MSMs &amp; Dems STFU  Americans understand what Trump says  We will NOT start a war with NOKO but we will not walk away if THEY do,Unknown,English,2017-08-11 16:33:00,2017-08-11 16:33:00,49,5,63,,0
angelistRR,"RT RickRWells: Obama Tools RICE, CLAPPER Urge ""Do Nothing"" Accept KOREA Nukes https://t.co/8cgnaqTAcT https://t.co/3TbJXOgqF8",Unknown,English,2017-08-11 16:33:00,2017-08-11 16:33:00,49,5,65,,0
angelistRR,Ezekiel Elliott suspended for 6 games.  #CCOT #TCOT#pjnet #maga #cowboys,Unknown,English,2017-08-11 17:37:00,2017-08-11 17:37:00,49,5,71,,0
angelistRR,RT Natire2u: Quit FUCKING around &amp; playing games w/ these assholes! Pack up the whole community &amp; #deport all #Ill… https://t.co/UY7r5KaLMO,Unknown,English,2017-08-11 17:45:00,2017-08-11 17:46:00,49,5,72,,0
angelistRR,"RT RealMattCouch: It's amazing how people can start a Go Fund Me to buy a Potato Gun, but America First gets shut down for investigating mu…",Unknown,English,2017-08-11 17:46:00,2017-08-11 17:46:00,49,5,76,,0
angelistRR,RT hockeygrandma23: peddoc63 mickrsmith Yea! Great solution  to an irritating problem 🤐🤐🤐🤐,Unknown,English,2017-08-11 17:46:00,2017-08-11 17:46:00,49,5,78,,0
angelistRR,"RT Dcilurso1: TheMarkRomano RavenRantz Hahahaha...I've been banned once again for calling a North Korea Apologist a ""moron""",Unknown,English,2017-08-11 17:46:00,2017-08-11 17:46:00,49,5,73,,0
angelistRR,RT peddoc63: Way Better... #GoogleDoodle https://t.co/VmBy2WAMDK,Unknown,English,2017-08-11 17:46:00,2017-08-11 17:46:00,49,5,74,,0
angelistRR,TrumpsBlonde angie 614swat skb_sara MADE__USA hrenee80 PinkBelgium ChooseToBFree DauntlessSly… https://t.co/67u2vm6m1X,Unknown,English,2017-08-11 17:46:00,2017-08-11 17:46:00,49,5,77,,0
angelistRR,Kamala is a nasty cunt. https://t.co/vxP6SD4epd,Unknown,English,2017-08-11 17:46:00,2017-08-11 17:46:00,49,5,75,Q,1
angelistRR,RT Rubysayzz: Patriots:  Choose three words to describe our great president  Reply and Retweet  POTUS #MAGA #MASA https://t.co/eHZWIo98Js,Unknown,English,2017-08-11 21:13:00,2017-08-11 21:13:00,49,5,79,,0
angelistRR,I Call BS.  Democrat Rep. Claims NRA Becoming a Domestic Security Threat - Breitbart https://t.co/k0Cf06pliq #maga #trumptrain #NRA #PJNET,Unknown,English,2017-08-11 21:13:00,2017-08-11 21:13:00,49,5,80,,0
angelistRR,RT alozrasT: Poor people of #NorthKorea..their great and invincible leader has been on many amazing adventures . N… https://t.co/GUjsd62gP0,Unknown,English,2017-08-12 01:05:00,2017-08-12 01:05:00,49,5,85,,0
angelistRR,"RT RyanJensen2018: Prosecutor looking into Debbie Wasserman Schultz found dead of ""suicide with 3 bullet holes"" bu… https://t.co/OZfqM4ARgs",Unknown,English,2017-08-12 01:05:00,2017-08-12 01:05:00,49,5,81,,0
angelistRR,RT thebradfordfile: AMERICA: Let's try to limit the voting to living citizens. #VoterID https://t.co/QVdwL8wGpT,Unknown,English,2017-08-12 01:05:00,2017-08-12 01:05:00,49,5,82,,0
angelistRR,DE_Ploribus_Uno But it certainly fits!,Unknown,English,2017-08-12 01:05:00,2017-08-12 01:05:00,49,5,86,,0
angelistRR,RT TuckerCarlson: .HeyTammyBruce: China's willingness to help w/ #NOKO shows they know that realDonaldTrump is serious about what he says #…,Unknown,English,2017-08-12 01:05:00,2017-08-12 01:05:00,49,5,84,,0
angelistRR,RT MADE__USA: 👠LOOK WHO is guest hosting for #SeanHannity Tonight at 10P on FOX NEWS!! #Judge Jeanine Pirro FoxNew… https://t.co/3N6bXtk3iz,Unknown,English,2017-08-12 01:05:00,2017-08-12 01:06:00,49,5,83,,0
angelistRR,"RT JohnTDolan: ""EXCESSIVE EXPECTATIONS""???We the People long ago gave up on ANY expectations from Congress. That's… https://t.co/Xmzvoct8KV",Unknown,English,2017-08-12 01:13:00,2017-08-12 01:13:00,49,5,91,,0
angelistRR,RT GrizzleMaximus: POTUS issues stern &amp; fiery warning to Kim should they continue to travel down the same path the… https://t.co/0e5n2xnNob,Unknown,English,2017-08-12 01:13:00,2017-08-12 01:13:00,49,5,88,,0
angelistRR,RT KurtSchlichter: Noted Democrat supports the troops https://t.co/J2GxS7taMg,Unknown,English,2017-08-12 01:13:00,2017-08-12 01:13:00,49,5,89,Q,1
angelistRR,RT TuckerCarlson: .MarkSteynOnline: #SusanRice and people like her are the reason we are in the situation we are in with #NOKO #Tucker FoxN…,Unknown,English,2017-08-12 01:13:00,2017-08-12 01:13:00,49,5,92,,0
angelistRR,"RT LouDobbs: America First- WVGovernor: We've got a President in POTUS that is the real deal now, who actually car… https://t.co/11p6bJUsxC",Unknown,English,2017-08-12 01:13:00,2017-08-12 01:13:00,49,5,87,,0
angelistRR,RT SusanStormXO: 🚨Yet Democratic say no fraud on their part 🚨  It's insanity 📌 Anytime they fight an issue - you k… https://t.co/YcUuofAyYG,Unknown,English,2017-08-12 01:13:00,2017-08-12 01:13:00,49,5,93,,0
angelistRR,"RT jojoh888: Democrats praise #KimJongUn, the same democrats whose majority is in California where a nuclear missi… https://t.co/FAizPyp670",Unknown,English,2017-08-12 01:13:00,2017-08-12 01:13:00,49,5,90,,0
angelistRR,"SusanPryor2013 jojoh888 As much as I disagree with policy makers in Kalifornistan, I could never wish that on fellow countrymen.",Unknown,English,2017-08-12 01:21:00,2017-08-12 01:21:00,49,5,94,,0
angelistRR,"RT WayneRoot: Go get 'em Eric. BANKRUPT these scummy lowlife biased commie rag journalists who spread ""fake news.""  https://t.co/2GlyI89UHh",Unknown,English,2017-08-12 12:21:00,2017-08-12 12:21:00,49,6,95,,0
angelistRR,Dispicable. https://t.co/fFyG1QbO9Q,Unknown,English,2017-08-12 12:23:00,2017-08-12 12:23:00,49,6,96,Q,1
angelistRR,And the Lib lawbreakers continue their crime sprees unabated. https://t.co/7qPiryqbed,Unknown,English,2017-08-12 12:30:00,2017-08-12 12:30:00,49,6,97,Q,1
angelistRR,RT wolfmanvt1: Damn right! https://t.co/83gP6oml6a,Unknown,English,2017-08-12 12:37:00,2017-08-12 12:38:00,49,6,99,Q,1
angelistRR,sunnykcollins Mad Maxine is one of the nastiest cunts in D.C.,Unknown,English,2017-08-12 12:38:00,2017-08-12 12:38:00,49,6,100,,0
angelistRR,jwhaifa trstno11 Sooo glad that cunt lost!,Unknown,English,2017-08-12 12:39:00,2017-08-12 12:39:00,49,6,101,,0
angelistRR,carrerapulse He's a traitorous asshole.,Unknown,English,2017-08-12 12:40:00,2017-08-12 12:40:00,49,6,102,,0
angelistRR,That. Is. Awesome. https://t.co/h6ZDu2X2YK,Unknown,English,2017-08-12 12:42:00,2017-08-12 12:42:00,49,6,103,Q,1
angelistRR,MrsMalindo keny_berd SparkleSoup45 Clueless nasty cunt.,Unknown,English,2017-08-12 12:43:00,2017-08-12 12:43:00,49,6,104,,0
angelistRR,Could be pay per view. https://t.co/qlnK4zRegG,Unknown,English,2017-08-12 12:47:00,2017-08-12 12:47:00,49,6,105,Q,1
angelistRR,trstno11 jwhaifa That's a great undercard you've got there....,Unknown,English,2017-08-12 12:49:00,2017-08-12 12:49:00,49,6,107,,0
angelistRR,trstno11 Don't forget Kamala. She's an up and coming cunt also...,Unknown,English,2017-08-12 12:51:00,2017-08-12 12:51:00,49,6,109,,0
angelistRR,Man Who Advised Michelle Obama's Hideous School Lunch Program Arrested For ... Defrauding School Lunch Program https://t.co/GeJ35rmLCh #ma…,Unknown,English,2017-08-12 14:04:00,2017-08-12 14:05:00,49,8,111,,0
angelistRR,Man Who Advised Michelle Obama's Hideous School Lunch Program Arrested For ... Defrauding Lunch Program https://t.co/GeJ35rmLCh #pjnet,Unknown,English,2017-08-12 14:04:00,2017-08-12 14:05:00,49,8,112,,0
angelistRR,2020 Zuck vs. Trump: The Alarming Vision Facebook’s Founder Has for America https://t.co/xodf0PSkOH #CCOT #TCOT#pjnet #maga #trumptrain #N…,Unknown,English,2017-08-12 14:07:00,2017-08-12 14:07:00,49,8,113,,0
angelistRR,"RT PfischerFischer: Pretty deep, huh! https://t.co/pEoY0YnnmO",Unknown,English,2017-08-12 16:57:00,2017-08-12 16:59:00,49,8,114,Q,1
angelistRR,#anlis Canada FORCED to take DRASTIC Action to Stop Illegals From Flooding In https://t.co/P7rHCIk44r https://t.co/3ldXDKVJ1T,Unknown,English,2017-08-12 18:17:00,2017-08-12 18:17:00,49,7,121,,0
angelistRR,#anlis New Documents Prove Loretta Lynch LIED About Tarmac Meeting https://t.co/JTRH0xed12 https://t.co/fsYvpTOtES,Unknown,English,2017-08-12 18:17:00,2017-08-12 18:17:00,49,7,125,,0
angelistRR,#anlis Trump Confirms the U.S. Military is “Locked and Loaded” if N. Korea Attacks https://t.co/SotQtlSoBJ https://t.co/oUe2ptM4rK,Unknown,English,2017-08-12 18:17:00,2017-08-12 18:17:00,49,7,117,,0
angelistRR,#anlis Virginia Democrat Sentenced for VOTER FRAUD https://t.co/ukYLbJyTIO https://t.co/seHUR387EH,Unknown,English,2017-08-12 18:17:00,2017-08-12 18:17:00,49,7,116,,0
angelistRR,#anlis BARF! Libtard Chelsea Handler Apologizes For Trump Wherever She Goes https://t.co/6HNw4idNBU https://t.co/cLVXF4lWDz,Unknown,English,2017-08-12 18:17:00,2017-08-12 18:17:00,49,7,123,,0
angelistRR,#anlis Robert Mueller Has Just Been EXPOSED https://t.co/MHYaTIwYGc https://t.co/rT4H957Tcq,Unknown,English,2017-08-12 18:17:00,2017-08-12 18:18:00,49,7,124,,0
angelistRR,#anlis Democrat Governor Urges the U.S. to Emulate COMMUNIST CHINA https://t.co/xfUPnahHSk https://t.co/z74eiKJlFk,Unknown,English,2017-08-12 18:17:00,2017-08-12 18:17:00,49,7,122,,0
angelistRR,#anlis BREAKING : Guam Prepares for “Imminent Missile” Strike https://t.co/pSx9P9zYLx https://t.co/naMg1J6DJW,Unknown,English,2017-08-12 18:17:00,2017-08-12 18:17:00,49,7,120,,0
angelistRR,#anlis Liberal Rag Wonders if U.S. Should Shoot Down N.K. Missiles in Self Defense https://t.co/SII8JuEwK7 https://t.co/2gzIVlFWzL,Unknown,English,2017-08-12 18:17:00,2017-08-12 18:17:00,49,7,118,,0
angelistRR,#anlis 6 Top Choices to Replace Disgraced McConnell https://t.co/3NzYrzj8EE https://t.co/iv1CL9Kcq2,Unknown,English,2017-08-12 18:17:00,2017-08-12 18:17:00,49,7,119,,0
angelistRR,#anlis Liberal Magazine Claims if You Have Blonde Hair Then You’re RACIST https://t.co/ESDAzG7lsH https://t.co/rqJYVrS6YW,Unknown,English,2017-08-12 18:32:00,2017-08-12 18:32:00,49,7,127,,0
angelistRR,#anlis BREAKING : Judge Orders New Search of Hillary’s Benghazi Emails https://t.co/eIs3QJxA2H https://t.co/Qv2OL6flNo,Unknown,English,2017-08-12 18:32:00,2017-08-12 18:32:00,49,7,128,,0
angelistRR,#anlis Maxine Waters Unveils Her Really Dumb Plan to Stop N. Korea https://t.co/L37cq8DsNv https://t.co/dHZKSa6hq3,Unknown,English,2017-08-12 18:32:00,2017-08-12 18:32:00,49,7,126,,0
angelistRR,"#anlis Under Pressure, Liar Susan Rice Just Threw Obama Under the Bus! https://t.co/klVfRzIg5i https://t.co/pTldTwkLkd",Unknown,English,2017-08-12 18:32:00,2017-08-12 18:32:00,49,7,131,,0
angelistRR,#anlis Chelsea Handler Calls on Generals For a Military Coup Against Trump https://t.co/Cs7ghcNn5j https://t.co/4YKKhj2CIj,Unknown,English,2017-08-12 18:32:00,2017-08-12 18:32:00,49,7,130,,0
angelistRR,#anlis WHOA! Laura Ingraham Just BLASTED China! https://t.co/S4wTdht9xZ https://t.co/FtEdyPhyaI,Unknown,English,2017-08-12 18:32:00,2017-08-12 18:32:00,49,7,129,,0
angelistRR,#anlis Grassroots Conservative Group Calls on Senate GOP to DITCH MITCH! https://t.co/KrZvQ3y8zE https://t.co/LF5ps1oyNV,Unknown,English,2017-08-12 18:47:00,2017-08-12 18:47:00,49,7,136,,0
angelistRR,#anlis Media Ignores This BOOMING ECONOMY Stat During the Trump Era https://t.co/uHnc6ol3JI https://t.co/v2Gdem1WL3,Unknown,English,2017-08-12 18:47:00,2017-08-12 18:47:00,49,7,133,,0
angelistRR,#anlis Kayleigh McEnany Reveals Trump’s Plan to Fight Fake News https://t.co/JTMYegEas3 https://t.co/sOL0UYhEPz,Unknown,English,2017-08-12 18:47:00,2017-08-12 18:48:00,49,7,144,,0
angelistRR,#anlis Dem “Leader” Just Claimed Trump is Worse than Kim Jong-un https://t.co/7OK5J56i4K https://t.co/cyUamx7fBo,Unknown,English,2017-08-12 18:47:00,2017-08-12 18:47:00,49,7,138,,0
angelistRR,#anlis Japan Prime Minister Shinzo Abe Reacts to U.S. – North Korea Conflict https://t.co/do6EwGaWPc https://t.co/N0wPDePL50,Unknown,English,2017-08-12 18:47:00,2017-08-12 18:47:00,49,7,142,,0
angelistRR,#anlis HYPOCRITES! Omarosa Mocked at Black Journalist Conference https://t.co/HzZOnxaGSZ https://t.co/LYn3VKkP8q,Unknown,English,2017-08-12 18:47:00,2017-08-12 18:47:00,49,7,135,,0
angelistRR,"#anlis California CAVES! Pays Woman Who Had Hijab Removed By Police $85,000 https://t.co/dQ40VL4EB1 https://t.co/pHzOpg1eD8",Unknown,English,2017-08-12 18:47:00,2017-08-12 18:47:00,49,7,140,,0
angelistRR,#anlis BREAKING : Ex-Mueller Deputy Threatens Deep State Assassination of Trump! https://t.co/2Bo3JPtKlv https://t.co/8JgTSAcVNA,Unknown,English,2017-08-12 18:47:00,2017-08-12 18:47:00,49,7,139,,0
angelistRR,#anlis Angela Merkel Scolds Trump on North Korea as If She is Above Him https://t.co/ncxg3kctEB https://t.co/2RZjIF8Hoz,Unknown,English,2017-08-12 18:47:00,2017-08-12 18:47:00,49,7,141,,0
angelistRR,#anlis Pathetic Liberal Media Dedicates Hit Piece to Melania’s Heels https://t.co/0WZT6zdqu3 https://t.co/0vaTDFEJFP,Unknown,English,2017-08-12 18:47:00,2017-08-12 18:47:00,49,7,134,,0
