author_id,content,region,language,publish_date,harvested_date,following,followers,updates,post_type,retweet
arons_kwende,Сеть фитнес-клубов Drive Fitness расширяется и дарит год фитнеса всего за 12 000 рублей (Фото) http://t.co/NCoHT5OKEB,United States,Russian,2015-06-23 05:51:00,2015-06-23 05:51:00,1984,467,2192,R,1
arons_kwende,Пургин: Почти половина Boeing-777 лежит в полях Донбасса http://t.co/2GJgGN9oIY http://t.co/3FeWVIOVB3,United States,Russian,2015-06-24 15:51:00,2015-06-24 15:51:00,1984,468,2193,R,1
arons_kwende,«Трактор» начнет сезон домашней серией 26 августа  http://t.co/gM3Zy0ONOn http://t.co/RN7povwQuK,United States,Bulgarian,2015-07-01 13:51:00,2015-07-01 13:51:00,1984,471,2200,R,1
arons_kwende,Экс-главу «Роснанотеха» подозревают в растрате 300 миллионов рублей http://t.co/zQHuyizEw3 http://t.co/dAXeXkrTsK,United States,Russian,2015-07-02 18:31:00,2015-07-02 18:31:00,1983,469,2202,R,1
arons_kwende,"Новейшая БМП на базе платформы ""Армата"" загорелась по пути в Нижний Тагил http://t.co/riExU4oter",United States,Bulgarian,2015-07-06 16:32:00,2015-07-06 16:34:00,1983,458,2209,R,1
arons_kwende,"Более 1,5 млн билетов на поезда дальнего следования Горьковского филиала ФПК продано через интернет с начала 2... http://t.co/Zv26d2Rl10",United States,Russian,2015-07-07 09:11:00,2015-07-07 09:12:00,1983,457,2211,R,1
arons_kwende,Сбор гуманитарной помощи.Присоединяйтесь http://t.co/1ObHOmMYFo,United States,Russian,2015-07-10 11:17:00,2015-07-10 11:19:00,1981,458,2215,R,1
arons_kwende,'@byDrBre @ah_veroniki засранцу за это жизнь сохранят',United States,Russian,2015-07-11 16:56:00,2015-07-11 16:56:00,1982,458,2214,,0
arons_kwende,Путин подписал указ о ликвидации Минкрыма  http://t.co/m8UMdnKOU1,United States,Russian,2015-07-15 14:51:00,2015-07-15 14:51:00,1680,454,2218,R,1
arons_kwende,Родственники 18 погибших пассажиров Boeing подали иск на $900 млн в суд Чикаго против бывшего Игоря Гиркина (Стрелкова),United States,Russian,2015-07-16 07:53:00,2015-07-16 07:53:00,1680,455,2220,R,1
arons_kwende,Власти: личных машин в Москве с 2010 года стало на 250 тысяч меньше http://t.co/7xJINcx0JY,United States,Russian,2015-07-16 11:33:00,2015-07-16 11:34:00,1680,455,2221,R,1
arons_kwende,"ФОТОРЕПОРТАЖ. ""Спартак"" открыл сезон http://t.co/lS1YLXYMsl http://t.co/bvhyrhIuqG",United States,Russian,2015-07-17 21:12:00,2015-07-17 21:12:00,1679,454,2227,R,1
arons_kwende,Почти 70% японцев не поддерживают расширение полномочий сил самообороны http://t.co/4fIyDLmG8G,United States,Russian,2015-07-18 08:31:00,2015-07-18 08:32:00,1679,454,2229,R,1
arons_kwende,Новый город.   Специальный репортаж Алексея Егорова: http://t.co/KoTZV1A2GG http://t.co/NFzkl6m0vd,United States,Russian,2015-07-18 11:53:00,2015-07-18 11:53:00,1679,454,2230,R,1
arons_kwende,Помощник президента РФ: Попасть под санкции США — как госнаграду получить http://t.co/gX5kd8shQZ http://t.co/QwywpsCRq8,United States,Russian,2015-07-18 18:51:00,2015-07-18 18:51:00,1679,454,2232,R,1
arons_kwende,«Зенит» — «Динамо»: гол Кокорина в ворота «Зенита» http://t.co/ukAK8w3jxO,United States,Bulgarian,2015-07-19 12:12:00,2015-07-19 12:12:00,1679,450,2238,R,1
arons_kwende,КПРФ (@kprf) предложила вернуть в уголовный кодекс статью «Вредительство»: http://t.co/BxgpjYQoBz,United States,Russian,2015-07-20 15:51:00,2015-07-20 15:51:00,1677,449,2244,R,1
arons_kwende,«Крылья Советов» начали сезон с победой над «Анжи»  http://t.co/z6mAeZw2dk http://t.co/5ICN8qtGHY,United States,Russian,2015-07-20 16:53:00,2015-07-20 16:54:00,1677,449,2245,R,1
arons_kwende,"Актер из сериала ""Во все тяжкие"" подался в политику http://t.co/M50W9vqLYy http://t.co/fpcs9zrB0w",United States,Russian,2015-07-20 20:32:00,2015-07-20 20:32:00,1677,449,2247,R,1
arons_kwende,Минобороны документально подтвердило статус арестованных в Донбассе военных http://t.co/EJQIqEurH8,United States,Russian,2015-07-21 21:32:00,2015-07-21 21:32:00,976,449,2258,R,1
arons_kwende,"Ровно 71 год назад был основан Международный валютный фонд.  Организация,которая делает бедные страны нищими",United States,Russian,2015-07-22 14:48:00,2015-07-22 14:48:00,677,456,2265,R,1
arons_kwende,Шведский инвестор: Санкции стоило бы вводить против Киева  http://t.co/cXg8meuur7 http://t.co/c2yaYOFjoW,United States,Russian,2015-07-22 15:55:00,2015-07-22 15:55:00,677,456,2266,R,1
arons_kwende,В Луганске найдены запасы американского оружия http://t.co/rGrR1OlFUo,United States,Russian,2015-07-22 17:33:00,2015-07-22 17:33:00,677,456,2267,R,1
arons_kwende,Делегация из Европарламента приедет в Россию вслед за депутатами Франции  http://t.co/uqmEdzP7Ru,United States,Russian,2015-07-22 21:12:00,2015-07-22 21:12:00,677,456,2268,R,1
arons_kwende,'@SFGO76 причем тут это? У них тоже гострудиспекция есть',United States,Russian,2015-07-23 03:12:00,2015-07-23 03:12:00,677,456,2272,R,1
arons_kwende,"Пока существует патрульная полиция Киева, концерну @Toyota банкротство не грозит http://t.co/PcUbaZg84c",United States,Russian,2015-07-24 08:52:00,2015-07-24 08:52:00,677,451,2279,R,1
arons_kwende,«Яндекс» станет консультантом «Сбербанка» по Big Data  #hitech,United States,Ukrainian,2015-07-25 00:51:00,2015-07-25 00:51:00,677,446,2284,R,1
arons_kwende,"В Ираке произошел теракт, погибли 12 человек http://t.co/yGE47G2NZZ",United States,Russian,2015-07-25 16:32:00,2015-07-25 16:33:00,677,446,2287,R,1
arons_kwende,В Мариуполе проходят протесты против вывода войск из Широкино http://t.co/1Le2CVl3dF,United States,Russian,2015-07-26 08:52:00,2015-07-26 08:52:00,677,447,2288,R,1
arons_kwende,Двухэтажный автобус с туристами лишился крыши в результате ДТП в туннеле на севере Франции http://t.co/nP5KoMGk1Z,United States,Russian,2015-07-26 13:12:00,2015-07-26 13:12:00,677,448,2289,R,1
arons_kwende,Организаторы Ice Bucket Challenge отчитались за собранные 115 миллионов долларов   http://t.co/QnwaczPTGi http://t.co/k4YP1nbcDT,United States,Russian,2015-07-26 16:11:00,2015-07-26 16:11:00,677,446,2291,R,1
arons_kwende,Новая Морская доктрина предусматривает постоянное присутствие флота России в Средиземноморье http://t.co/onyZl2rkM6,United States,Russian,2015-07-26 17:32:00,2015-07-26 17:32:00,677,446,2292,R,1
arons_kwende,"пленный нацист: ""Я обосрался. Я вообще о*уевший. Меня мать дома ждет""  https://t.co/0fdKdnrMXp  #анасзашо ?",United States,Russian,2015-07-26 21:31:00,2015-07-26 21:32:00,677,446,2293,R,1
arons_kwende,СМИ сообщили о смерти дочери Уитни Хьюстон  http://t.co/ghZM3yDiAJ,United States,Russian,2015-07-27 03:53:00,2015-07-27 03:53:00,677,446,2294,R,1
arons_kwende,#Словения выступает против антироссийских санкций.   http://t.co/po0NjmkTPU http://t.co/FRgW1b8SlW,United States,Russian,2015-07-27 16:13:00,2015-07-27 16:14:00,677,446,2298,R,1
arons_kwende,Обзор и видео докладов по информационной безопасности с конференции SECR-2014  #hitech,United States,Russian,2015-07-27 22:52:00,2015-07-27 22:52:00,677,446,2300,R,1
arons_kwende,Олланд пообещал в ближайшее время решить проблему «российских «Мистралей»  http://t.co/HbYpsd0oFT,United States,Russian,2015-07-28 02:11:00,2015-07-28 02:12:00,677,446,2303,R,1
arons_kwende,"В одном из кафе Киевской области произошла перестрелка, двое ранены  http://t.co/dHqGikK5TX",United States,Russian,2015-07-28 07:11:00,2015-07-28 07:11:00,677,446,2304,R,1
arons_kwende,ФОТОРЕПОРТАЖ. Фестиваль перьев  http://t.co/AjpI9Nkuum http://t.co/oBFHekO2Co,United States,Ukrainian,2015-07-28 08:51:00,2015-07-28 08:51:00,677,446,2306,R,1
arons_kwende,"Кабаева отменяеццо, посоны. Теперь так http://t.co/goKVBxxwCB",United States,Russian,2015-07-28 20:13:00,2015-07-28 20:13:00,677,446,2308,R,1
arons_kwende,Доллар. Золото. Мы все умрем. http://t.co/9pG0gAhN17 #Золото #Мировыефинансы #Нефтеторговля http://t.co/ozXknBOM4K,United States,Uzbek,2015-07-29 10:53:00,2015-07-29 10:53:00,677,446,2313,R,1
arons_kwende,Идем на рекорд: как мы оптимизировали прикрепление изображений в Почте Mail.Ru для iOS  #hitech,United States,Russian,2015-07-29 12:31:00,2015-07-29 12:31:00,677,446,2314,R,1
arons_kwende,"Скончался  бизнесмен Ян Кульчик, самый богатый человек Польши и один из крупнейших инвесторов Украины http://t.co/g4RnNARCTI",United States,Russian,2015-07-29 13:11:00,2015-07-29 13:12:00,677,446,2315,R,1
arons_kwende,Путин поговорил с премьер-министром Голландии в день голосования в ООН по Boeing 777: http://t.co/ZcdHFPNWkJ,United States,Russian,2015-07-29 14:12:00,2015-07-29 14:12:00,677,446,2317,R,1
arons_kwende,Тайваньские студенты оккупировали министерство образования из-за «китаизации» учебников  http://t.co/fsyF8ctfys http://t.co/89Bo6axfy1,United States,Russian,2015-07-31 05:32:00,2015-07-31 05:32:00,677,444,2323,R,1
arons_kwende,Facebook рассказал о раздающих интернет беспилотниках: http://t.co/UquUoTFHRP,United States,Russian,2015-07-31 15:33:00,2015-07-31 15:33:00,677,444,2325,R,1
arons_kwende,Минобороны опубликовало документы об истории ВДВ http://t.co/PnuFe3Jq3k,United States,Russian,2015-08-01 22:51:00,2015-08-01 22:52:00,678,443,2331,R,1
arons_kwende,"Кошкин дом, который построила Мизулина. Путешествия Лобкова и Филипенко продолжаются:  http://t.co/9fYiMKSTrc  https://t.co/XoOQp4NPEb",United States,Russian,2015-08-01 22:53:00,2015-08-01 22:53:00,678,443,2332,R,1
arons_kwende,Первый замминистра: Минобрнауки не согласно переносить дату начала учебного года  http://t.co/Cwu3y29kNp,United States,Russian,2015-08-02 11:13:00,2015-08-02 11:13:00,677,441,2337,R,1
arons_kwende,Смертники с двухтонной бомбой: в турецком теракте обвиняют курдов http://t.co/RxNG1rEjCP,United States,Russian,2015-08-03 02:31:00,2015-08-03 02:34:00,678,442,2340,R,1
arons_kwende,Подгруппа по безопасности в Минске работает над соглашением по отводу танков и вооружений до 100 мм http://t.co/4WFKK4hNqs,United States,Russian,2015-08-03 22:51:00,2015-08-03 22:52:00,679,443,2344,R,1
arons_kwende,Следующее заседание контактной группы по Донбассу может пройти 26 августа  http://t.co/GsSSKg0rbr,United States,Russian,2015-08-04 02:32:00,2015-08-04 02:32:00,679,443,2348,R,1
arons_kwende,Прогноз погоды на сегодня  http://t.co/kON8z9IO1E http://t.co/Sjy8UJkrKV,United States,Russian,2015-08-04 06:53:00,2015-08-04 06:53:00,679,443,2350,R,1
arons_kwende,Три россиянина погибли при покорении пика Ленина  http://t.co/mZroO4g4ts http://t.co/njHuVGpDEl,United States,Russian,2015-08-04 06:53:00,2015-08-04 06:53:00,679,443,2349,R,1
arons_kwende,.@yarregru Физкультурно-строительный? Хохлы и молдаване будут на скорость ложить кладку и клеить обои? http://t.co/JHLBvCsPZ7,United States,Russian,2015-08-04 14:33:00,2015-08-04 14:33:00,679,443,2351,R,1
arons_kwende,Инвестор Марк Мобиус увидел дно на нефтяном рынке:  http://t.co/IIgv9wWsd1,United States,Russian,2015-08-04 14:53:00,2015-08-04 14:53:00,679,443,2352,R,1
arons_kwende,UPD. Палата представителей Конгресса США в сентябре проголосует за отклонение сделки с Ираном  http://t.co/rLwrWMQNEj,United States,Russian,2015-08-04 21:12:00,2015-08-04 21:12:00,679,443,2353,R,1
arons_kwende,СМИ: евромайдановцы устроили драку в одесском клубе http://t.co/hBaUHZ324j http://t.co/5B3FuP4lKs,United States,Russian,2015-08-05 05:51:00,2015-08-05 05:51:00,679,443,2355,R,1
arons_kwende,"Старший помощник капитана затонувшей ""Булгарии"" подпал под амнистию http://t.co/ReehuOhC8F",United States,Bulgarian,2015-08-05 10:31:00,2015-08-05 10:31:00,679,443,2356,R,1
arons_kwende,Литва просит у Еврокомиссии €32 млн на возмещение убытков от продэмбарго РФ http://t.co/0ebIwk4qDp,United States,Russian,2015-08-05 11:31:00,2015-08-05 11:31:00,679,443,2357,R,1
arons_kwende,Число погибших в ДТП с российскими туристами в Турции возросло до шести: http://t.co/cl8fh8dr89,United States,Russian,2015-08-06 17:51:00,2015-08-06 17:51:00,679,443,2362,R,1
arons_kwende,Бибиков: с ЦСКА «Мордовия» должна сыграть в Саранске http://t.co/z5mOsaMuAH,United States,Serbian,2015-08-06 19:13:00,2015-08-06 19:16:00,679,443,2366,R,1
arons_kwende,Овощам тут не место. Как уничтожали санкционные продукты на границе России и Белоруссии  http://t.co/5xNBPvXnhT http://t.co/Kaw0Sk5W79,United States,Russian,2015-08-06 20:53:00,2015-08-06 20:54:00,679,443,2367,R,1
arons_kwende,При столкновении вертолета и гидроплана под Москвой погибла 10-летняя девочка  http://t.co/Rfmm8wMLV4 http://t.co/ueG6VuWy00,United States,Russian,2015-08-08 19:34:00,2015-08-08 19:34:00,679,445,2378,R,1
arons_kwende,Фанаты «Спартака» проведут начало матча с «Крыльями» в тишине в знак скорбии http://t.co/T9rGdhTqmH,United States,Russian,2015-08-09 08:32:00,2015-08-09 08:32:00,679,436,2380,R,1
arons_kwende,В американском Фергюсоне в ходе протестов задержаны почти 60 человек http://t.co/KIcxerLq1t,United States,Russian,2015-08-11 00:51:00,2015-08-11 00:52:00,679,434,2387,R,1
arons_kwende,В Москве через две недели появятся первые 100 машин для краткосрочной аренды   http://t.co/VHAm7LghPZ,United States,Russian,2015-08-11 13:32:00,2015-08-11 13:32:00,679,434,2391,R,1
arons_kwende,Владимир Бортко снимет фильм о современной Анне Карениной http://t.co/DbXYwB68nM,United States,Russian,2015-08-11 13:51:00,2015-08-11 13:52:00,679,434,2392,R,1
arons_kwende,"Московский НПЗ заявил, что не причастен к пожару на нефтепроводе в Марьино  http://t.co/gTQitbjTIy",United States,Russian,2015-08-12 17:12:00,2015-08-12 17:12:00,679,434,2395,R,1
arons_kwende,Порошенко встретился с министром иностранных дел Белоруссии http://t.co/0GJdpaniKE,United States,Russian,2015-08-12 23:12:00,2015-08-12 23:12:00,679,434,2397,R,1
arons_kwende,Facebook уволил стажера за создание расширения для Messenger http://t.co/iv8F8rBhqj,United States,Russian,2015-08-13 07:52:00,2015-08-13 07:52:00,679,434,2398,R,1
arons_kwende,Сотрудники ФСБ пришли с обысками в компанию Qiwi http://t.co/KQydUuKxy3,United States,Russian,2015-08-13 12:31:00,2015-08-13 12:32:00,679,433,2400,R,1
arons_kwende,"Пару недель обсуждается история собаки-поводыря, которую искал сам Бастрыкин. В истории полно белых пятен    https://t.co/ruxAEftnX5",United States,Russian,2015-08-13 15:12:00,2015-08-13 15:12:00,679,434,2402,R,1
arons_kwende,Беспилотники ОБСЕ подвергаются электронным атакам в районе Мариуполя http://t.co/0VYVdoKcaZ,United States,Russian,2015-08-13 17:11:00,2015-08-13 17:11:00,679,434,2403,R,1
arons_kwende,Поставки новых Great Wall в автосалоны практически прекратились  http://t.co/tnaHiB4k3E,United States,Russian,2015-08-14 00:31:00,2015-08-14 00:31:00,677,432,2404,R,1
arons_kwende,МЧС России закупит новейшие вертолеты AgustaWestland http://t.co/zq3nam2moD,United States,Russian,2015-08-14 10:13:00,2015-08-14 10:13:00,677,432,2405,R,1
arons_kwende,"#ПосланиеПотомкам Одно послание- сохраните страну. Сделайте ее еще лучше, помните о Родине, где бы вы не находились. http://t.co/eMODJLrV74",United States,Russian,2015-08-14 18:57:00,2015-08-14 18:57:00,676,431,2409,R,1
arons_kwende,Дерзкий «Касперский»: как ответили в Лаборатории на расследование информагентства Reuters http://t.co/xwuzJzOL21 http://t.co/50GoEaQ99Q,United States,Russian,2015-08-14 21:32:00,2015-08-14 21:33:00,676,431,2411,R,1
arons_kwende,"Калиниченко: прошлые дерби «Спартак» проводил вяло, а сейчас — никакой безнадёги http://t.co/BkdJzULwkw",United States,Russian,2015-08-15 11:13:00,2015-08-15 11:13:00,676,432,2412,R,1
arons_kwende,Киев будет отвечать перед жителями Донбасса в европейском суде http://t.co/z4an1d0S4M http://t.co/X3bo8Jhbq8,United States,Russian,2015-08-15 15:52:00,2015-08-15 15:52:00,676,433,2414,R,1
arons_kwende,"Экс-солит Deep Purple Джо Линн Тернер выступил в Крыму, не испугавшись санкций http://t.co/bLiJNr1z5y http://t.co/bDoONY3kS0",United States,Ukrainian,2015-08-15 22:52:00,2015-08-15 22:53:00,675,433,2415,R,1
arons_kwende,«Партизан» не сможет заявить Ломича из-за долгов «Мордовии» http://t.co/HqbVMB0gy7,United States,Ukrainian,2015-08-17 09:32:00,2015-08-17 09:32:00,675,432,2420,R,1
arons_kwende,Вышел первый тизер драмы об однополой любви «Кэрол» http://t.co/FzKZtItfAq,United States,Russian,2015-08-17 16:14:00,2015-08-17 16:14:00,675,432,2421,R,1
arons_kwende,"Первый контракт The Beatles со звукозаписывающей компанией выставят на аукционе, передает  Reuters http://t.co/g89A1VoOCH",United States,Russian,2015-08-18 20:24:00,2015-08-18 20:24:00,675,431,2430,R,1
arons_kwende,Всемирный банк перечислил Украине $732 млн на реализацию энергопроектов http://t.co/lJignJgzsU,United States,Russian,2015-08-19 18:52:00,2015-08-19 18:52:00,674,427,2434,R,1
arons_kwende,Полиция: в организации теракта в Бангкоке участвовали не менее человек http://t.co/DGUABaqtWp,United States,Russian,2015-08-20 05:32:00,2015-08-20 05:32:00,674,426,2437,R,1
arons_kwende,"Дебилы, блядь. (c) http://t.co/Lr8SOza8T6",United States,Russian,2015-08-21 00:51:00,2015-08-21 00:51:00,674,426,2443,R,1
arons_kwende,"«Я горжусь битвой, через которую прошло правительство. Мы выстояли против давления и шантажа», — речь Ципраса.  https://t.co/xq8VwbueZ2",United States,Russian,2015-08-21 08:52:00,2015-08-21 08:52:00,674,426,2444,R,1
arons_kwende,Следственный комитет принимает меры для ареста имущества экс-министра финансов Московской области http://t.co/QK3VkfGpCR,United States,Russian,2015-08-21 13:12:00,2015-09-14 01:42:00,674,426,2445,R,1
arons_kwende,Южная Корея заявила о готовности дать «мощный отпор» действиям КНДР  http://t.co/yBMXzpIykD http://t.co/0vmTgdin0B,United States,Russian,2015-08-22 06:53:00,2015-08-22 06:53:00,674,426,2455,R,1
arons_kwende,Малайзия отправила Нидерландам отзыв на доклад о крушении Boeing http://t.co/v87yjNBdhX,United States,Russian,2015-08-23 08:53:00,2015-08-23 08:53:00,674,426,2461,R,1
arons_kwende,"Юрист: в отличие от «Интера», «Марсель» не испугался решения ФИФА по Диарра http://t.co/QYO3cJ67Ie",United States,Russian,2015-08-24 12:12:00,2015-08-24 12:13:00,673,426,2468,R,1
arons_kwende,В ДНР ответили на сравнение Новороссии с Мордором http://t.co/BKodrlB2Pz,United States,Russian,2015-08-24 16:11:00,2015-08-24 16:11:00,673,427,2469,R,1
arons_kwende,Генпрокуратуру попросили проверить деятельность Максима Ликсутова  http://t.co/iiwCeHqdsO,United States,Russian,2015-08-25 09:34:00,2015-08-25 09:34:00,673,427,2474,R,1
arons_kwende,ЕС и госдеп призвали освободить Сенцова и Кольченко http://t.co/fkNQvr772U,United States,Russian,2015-08-25 18:13:00,2015-09-21 15:00:00,673,426,2475,R,1
arons_kwende,Патрушев рекомендовал госслужащим пользоваться Google и WhatsApp дома http://t.co/4yUSzVKFv7,United States,Russian,2015-08-27 05:12:00,2015-08-27 05:12:00,673,426,2487,R,1
arons_kwende,Россию признали одной из наименее эмоциональных стран http://t.co/zhZkoDhbsY,United States,Russian,2015-08-27 13:53:00,2015-08-27 13:53:00,673,425,2490,R,1
arons_kwende,Боевики ИГ похитили 200 участников антитеррористической демонстрации #новости http://t.co/6DgXPKqrb4,United States,Russian,2015-08-30 11:12:00,2015-08-30 11:13:00,673,427,2503,R,1
arons_kwende,Сборная России по легкой атлетике за два года опустилась с первого на девятое место на ЧМ  http://t.co/KYv9D39S1o,United States,Russian,2015-08-30 15:32:00,2015-08-30 16:20:00,673,427,2505,R,1
arons_kwende,"поддержим хыхы))) @soondook: @vata_v_ban @alexrvua1 @ElvisMikle @Banderakaratel  а вот, еще одно чмо: в бан просится @vezhlivaya_",United States,Russian,2015-08-30 16:53:00,2015-08-30 17:14:00,673,427,2506,R,1
arons_kwende,"Р. Билялетдинов: «Рубин» не будет сидеть и ждать, когда улыбнётся солнышко http://t.co/bEADB7Odah",United States,Russian,2015-08-30 18:12:00,2015-08-30 18:12:00,673,427,2507,R,1
arons_kwende,Президент ЦСКА рассказал об отношении к Тине Канделаки  http://t.co/goSrqQhQN1 http://t.co/v9QNXrKQeK,United States,Russian,2015-08-31 12:32:00,2015-08-31 12:32:00,673,427,2509,R,1
arons_kwende,Белый дом прокомментировал президентские амбиции рэпера Канье Уэста http://t.co/rBVOh6Dycm,United States,Russian,2015-08-31 19:31:00,2015-09-27 20:05:00,673,427,2512,R,1
arons_kwende,В Москве в понедельник ожидается до +20&deg;C http://t.co/iUSNPtDpR4,United States,Russian,2015-09-01 03:51:00,2015-09-01 03:51:00,673,427,2514,R,1
arons_kwende,Российская футбольная Премьер-Лига одобрила контракт с «НТВ-Плюс» http://t.co/wWgILItfMo,United States,Russian,2015-09-01 17:35:00,2015-09-01 17:35:00,673,427,2521,R,1
