author_id,content,region,language,publish_date,harvested_date,following,followers,updates,post_type,retweet
arons_kwende,Fiat Ducato стал внедорожным домом на колесах http://t.co/WKevg0G8tN,United States,Russian,2015-09-02 01:11:00,2015-09-02 01:11:00,673,427,2525,R,1
arons_kwende,"Партия ""УКРОП"" призвала к перевыборам в ВР и досрочным выборам президента   http://t.co/790NsDw0BO http://t.co/2s9lK8vgUc",United States,Russian,2015-09-02 08:12:00,2015-09-02 08:12:00,673,427,2528,R,1
arons_kwende,"В. Березуцкий: хотел бы поспорить с Вернблумом, кто из нас мобильнее на поле http://t.co/mTr7csnDPb",United States,Russian,2015-09-02 12:32:00,2015-09-02 12:32:00,673,427,2530,R,1
arons_kwende,Мирей Матье: У меня нет санкций против России http://t.co/4ZKm8w5d5f http://t.co/TCTpXOdayB,United States,Russian,2015-09-02 14:13:00,2015-09-02 14:13:00,673,427,2532,R,1
arons_kwende,The Verge: Подписка на YouTube станет платной до конца года  #hitech,United States,Russian,2015-09-02 16:11:00,2015-09-02 16:11:00,673,427,2535,R,1
arons_kwende,В Колорадо упал военный вертолет  http://t.co/757Lq8Xzqf,United States,Russian,2015-09-03 02:11:00,2015-09-03 02:11:00,673,427,2537,R,1
arons_kwende,Да что вы говорите? В гугле забанили?  https://t.co/EN2Cuh58Bx https://t.co/MzPN8kRKAJ,United States,Macedonian,2015-09-03 05:52:00,2015-09-03 05:52:00,673,427,2538,R,1
arons_kwende,Число китайских туристов в России увеличилось более чем на 50% http://t.co/VPKD52d1jI,United States,Russian,2015-09-03 16:43:00,2015-09-30 12:36:00,673,427,2542,R,1
arons_kwende,Совет директоров «Аэрофлота» принял решение об участии в санации «Трансаэро»  http://t.co/vUJz9KrhJr http://t.co/kFYqh1QLqd,United States,Russian,2015-09-03 17:52:00,2015-09-03 17:52:00,673,427,2543,R,1
arons_kwende,Саакашвили записал видеоответ на обвинения Яценюка  http://t.co/lbPizeiXmG http://t.co/AxEynnFtE9,United States,Russian,2015-09-04 21:12:00,2015-09-04 21:12:00,673,427,2548,R,1
arons_kwende,"Бывший сотрудник Tesla взломал компьютер босса, чтобы опорочить компанию http://t.co/luMkWG0D1A",United States,Russian,2015-09-04 22:12:00,2015-09-04 22:12:00,673,427,2550,R,1
arons_kwende,"'@salty_1970 @udaff_ka @rus_fas я однажды со сбером побежал в город снимать,прибежал-сбер не работает,пришлось назад бежать и снимать в ВТБ)'",United States,Russian,2015-09-05 05:13:00,2015-09-05 05:13:00,673,428,2554,R,1
arons_kwende,«Газета.Ru» запускает новый спецпроект про путешествия по стране  http://t.co/sbPZcxf72m http://t.co/pmQtdyeiqs,United States,Russian,2015-09-05 07:33:00,2015-09-05 07:33:00,673,428,2555,R,1
arons_kwende,МИД Венгрии назвал причину миграционного кризиса  http://t.co/E2OMaFXLyJ http://t.co/L9i4z2Y1a6,United States,Russian,2015-09-05 08:33:00,2015-09-05 08:33:00,673,428,2556,R,1
arons_kwende,В центре Москвы горит здание   http://t.co/S6fnd3K0I7 http://t.co/IxbuFqdYo0,United States,Russian,2015-09-06 08:53:00,2015-09-06 08:53:00,673,427,2559,R,1
arons_kwende,ФК «Ростов» сыграет товарищеский матч с лидером чемпионата области http://t.co/1odYVawYyJ,United States,Russian,2015-09-06 15:35:00,2015-09-06 15:35:00,672,428,2563,R,1
arons_kwende,"Uber привлек $1,2 млрд для развития на рынке Китая  #hitech",United States,Ukrainian,2015-09-07 17:31:00,2015-09-07 17:31:00,672,428,2569,R,1
arons_kwende,Ливерпульское кафе предложило клиентам блюда из залежавшихся товаров: http://t.co/0NeJALgHEh,United States,Bulgarian,2015-09-08 09:34:00,2015-09-08 09:34:00,672,428,2574,R,1
arons_kwende,Экс-президент Гватемалы стал фигурантом уголовного дела http://t.co/Doi7HwyEyD,United States,Russian,2015-09-08 20:31:00,2015-09-08 20:31:00,672,427,2578,R,1
arons_kwende,Компания Canon выпустит сенсор с разрешением 250 мегапикселей  #hitech,United States,Russian,2015-09-08 23:51:00,2015-09-08 23:51:00,672,427,2579,R,1
arons_kwende,"Российские военные находятся в Сирии много лет и помогают осваивать технику для борьбы с террористами, заявил Лавров http://t.co/bbKyTegJnI",United States,Russian,2015-09-10 13:33:00,2015-09-10 13:33:00,671,427,2588,R,1
arons_kwende,Apple подняла цены в России. Самый дешевый макбук эйр 13-дюймовый — минимум 78 тысяч!    https://t.co/MwRTYc6a8G,United States,Russian,2015-09-10 15:13:00,2015-09-10 15:13:00,671,427,2589,R,1
arons_kwende,Что грозит «богу Кузе»  http://t.co/xNVEEpFXMX http://t.co/4UVoW0pQna,United States,Ukrainian,2015-09-11 06:51:00,2015-09-11 06:52:00,671,427,2593,R,1
arons_kwende,Порошенко рассказал о поводе для оптимизма   http://t.co/c91O7ri8z0 http://t.co/Lvz83u5N5V,United States,Russian,2015-09-11 08:51:00,2015-09-11 08:51:00,671,427,2594,R,1
arons_kwende,"А ну ка почитаем Пиви @DunordavindV, ""a news addict."", из Швеции.))) Давайте порадуем его русскими читателями.)))",United States,Russian,2015-09-11 19:51:00,2015-09-11 19:52:00,671,427,2596,R,1
arons_kwende,В центральной Калифорнии началась эвакуация жителей в связи с новым крупным пожаром  http://t.co/Tn85P1ByXd,United States,Russian,2015-09-11 23:11:00,2015-09-11 23:11:00,671,427,2597,R,1
arons_kwende,Бабаев: главная цель ЦСКА в Лиге чемпионов — выход из группы http://t.co/CKTu5naowj,United States,Russian,2015-09-12 15:12:00,2015-09-12 15:12:00,669,426,2595,R,1
arons_kwende,За что на ЭТОТ РАЗ раскритиковали Charlie Hebdo  http://t.co/5bjRpztUzm http://t.co/6BSGvBzkTD,United States,Ukrainian,2015-09-14 18:31:00,2015-09-14 18:31:00,669,426,2605,R,1
arons_kwende,СПУСТЯ МЕСЯЦ возбудили дело за погром в Манеже  http://t.co/mHipkU6I4f http://t.co/ubQbp2dRec,United States,Russian,2015-09-14 18:52:00,2015-09-14 18:52:00,669,426,2606,R,1
arons_kwende,Вся суть нынешнего миграционного кризиса в одном ролике  https://t.co/4eRqGhT8SL,United States,Russian,2015-09-15 12:38:00,2015-09-15 12:38:00,670,427,2608,R,1
arons_kwende,"ЦБ РФ снизил на 16 сентября курс доллара до 67,16 рубля http://t.co/zao3gWuttL",United States,Russian,2015-09-15 14:25:00,2015-09-15 14:25:00,670,427,2612,R,1
arons_kwende,"В Москве задержаны лже-банкиры, обналичившие более 100 млн рублей http://t.co/2yRpLadWNX",United States,Russian,2015-09-16 08:13:00,2015-09-16 08:13:00,670,427,2616,R,1
arons_kwende,В США школьника задержали за самодельные часы http://t.co/uorLSd1Aem http://t.co/VVLGsUS2i7,United States,Russian,2015-09-17 00:31:00,2015-09-17 00:31:00,670,427,2618,R,1
arons_kwende,Президент Чили сообщила о троих погибших при землетрясении http://t.co/rYGlOHNQMm,United States,Russian,2015-09-17 04:11:00,2015-09-17 04:11:00,670,427,2619,R,1
arons_kwende,"Панов: у Лодыгина нет конкуренции в клубе, и он допускает слишком много ошибок http://t.co/0p3j4ErUMY",United States,Russian,2015-09-17 10:54:00,2015-09-17 10:54:00,670,427,2621,R,1
arons_kwende,В кинотеатры России не пустили «Любовь» https://t.co/dFQ53scldb http://t.co/hfcgc8r8Jk,United States,Russian,2015-09-17 13:55:00,2015-09-17 13:55:00,670,427,2623,R,1
arons_kwende,"Захарченко заявил, что Порошенко признал его главой ДНР http://t.co/8CrYyXHy2A",United States,Russian,2015-09-17 18:14:00,2015-09-17 18:14:00,670,427,2625,R,1
arons_kwende,Заместитель Саакашвили хочет стать главой Одесской таможни http://t.co/aTD2JRo7Ou,United States,Russian,2015-09-18 16:52:00,2015-09-18 16:53:00,670,426,2633,R,1
arons_kwende,Американские военные заявляют о российских истребителях в Сирии http://t.co/uX5Rmu6lsN,United States,Russian,2015-09-18 18:33:00,2015-09-18 18:33:00,670,426,2635,R,1
arons_kwende,Таксисты вышли на демонстрацию против сервиса Uber http://t.co/OnrjlgV3ef http://t.co/ygwMiQ8xgJ,United States,Russian,2015-09-19 03:32:00,2015-09-19 03:32:00,670,426,2637,R,1
arons_kwende,Генпрокуратура Таджикистана предъявит обвинение 13 мятежникам в 10-дневный срок  http://t.co/HYyTh7de4j,United States,Bulgarian,2015-09-19 06:52:00,2015-09-19 06:52:00,670,426,2638,R,1
arons_kwende,Преступный Гайзер: любитель дорогих часов и запонок старался быть ближе к народу  Подробности: http://t.co/TxjSWh0eha http://t.co/Fspxyy8WNb,United States,Russian,2015-09-19 18:32:00,2015-09-19 18:32:00,670,426,2642,R,1
arons_kwende,Боевики убили бригадного генерала МВД Египта на Синае http://t.co/lVi2F9AMNF,United States,Ukrainian,2015-09-20 02:12:00,2015-09-20 02:12:00,670,426,2645,R,1
arons_kwende,США планируют разместить лазерные пушки на истребителях к 2020 году http://t.co/ewyRrIfRfM http://t.co/WtAJjRUnpn,United States,Russian,2015-09-20 09:52:00,2015-09-20 09:52:00,670,426,2647,R,1
arons_kwende,"Федун: «Спартак-2» ещё сыграет на «Открытие Арене», но это вообще нерентабельно http://t.co/Sa2QgePNbq",United States,Russian,2015-09-20 15:12:00,2015-09-20 15:12:00,670,426,2650,R,1
arons_kwende,Microsoft пока не может спрогнозировать сроки устранения неполадок со Skype в России http://t.co/9OVspd2nIr,United States,Russian,2015-09-21 14:12:00,2015-09-21 14:12:00,670,426,2653,R,1
arons_kwende,"Лория: пока летел в самолёте, мой менеджер выбрал за меня номер в «Крыльях» http://t.co/ZUbl28AjTO",United States,Russian,2015-09-21 17:31:00,2015-09-21 17:31:00,670,426,2654,R,1
arons_kwende,На северо-западе Сирии продлено перемирие между шиитами и повстанцами http://t.co/x4Yxvk3ZJ7,United States,Ukrainian,2015-09-22 12:53:00,2015-09-22 12:53:00,670,426,2661,R,1
arons_kwende,Замглавы МИД РФ: Не может быть никакого трибунала по крушению MH 17 в обход Совбеза ООН http://t.co/0fLLrepzjl http://t.co/zXHKHmmqn7,United States,Russian,2015-09-22 14:14:00,2015-09-22 14:15:00,670,426,2662,R,1
arons_kwende,Савченко склеила на суде бумажную птицу для детского дома  http://t.co/rAdGqOUawT http://t.co/qZGrJGG4KF,United States,Ukrainian,2015-09-22 16:11:00,2015-09-22 16:11:00,670,426,2663,R,1
arons_kwende,Вертонген: Кейн — не звезда на один сезон http://t.co/mwMothYFSb,United States,Ukrainian,2015-09-22 16:54:00,2015-09-22 16:54:00,670,426,2664,R,1
arons_kwende,"Что предпримет ДНР, если Украина вступит в НАТО  http://t.co/RUdv7EPbTu http://t.co/Jzv8m3LrKd",United States,Russian,2015-09-23 14:36:00,2015-09-23 14:36:00,670,426,2668,R,1
arons_kwende,СК возобновил расследование дела о гибели царской семьи  http://t.co/iFFIpgF0tp http://t.co/u7pheX2GRN,United States,Russian,2015-09-23 15:18:00,2015-09-23 15:19:00,670,426,2670,R,1
arons_kwende,Зрадด้้้้้็็็็็้้้้้็็็็็้้้้้้้้็็็็็้้้้้็็็็็้้้้้้้้็็็็็้้้้้็็็็็้้้้้้้้็็็็็้้้้้็็,United States,Russian,2015-09-24 02:31:00,2015-09-24 02:31:00,670,426,2675,R,1
arons_kwende,"«Если нужно, Аленичев может дать по одному месту»  http://t.co/dGwRPcSXdh http://t.co/3TSnjPBcDt",United States,Russian,2015-09-24 11:52:00,2015-09-24 11:53:00,670,426,2677,R,1
arons_kwende,Крупнейший СКАНДАЛ разразился в Volkswagen  http://t.co/nlAbMhLXeF http://t.co/zDHqn5tXY1,United States,Russian,2015-09-25 14:32:00,2015-09-25 14:32:00,670,426,2684,R,1
arons_kwende,Русские идут! http://t.co/7n4sYYN4jC,United States,Russian,2015-09-26 04:11:00,2015-09-26 04:11:00,669,425,2685,R,1
arons_kwende,Украинские военные отмечают одиночные обстрелы со стороны ополченцев http://t.co/L2fpeAPbWK,United States,Russian,2015-09-26 06:32:00,2015-09-26 06:32:00,669,425,2686,R,1
arons_kwende,Слава украини! Целлюлиту слава! http://t.co/GTLr7yHRhA,United States,Ukrainian,2015-09-26 11:53:00,2015-09-26 11:53:00,669,425,2688,R,1
arons_kwende,Новый кроссовер Mazda Koeru займёт место между CX-3 и CX-5 http://t.co/Xzuubzesj4 http://t.co/ogX5PhBc1c,United States,Russian,2015-09-26 17:52:00,2015-09-26 17:52:00,669,425,2690,R,1
arons_kwende,"Ефремова показали,за Спартак топит. Интересно,как к этому отнесётся эффективный @SFGO76 ?",United States,Russian,2015-09-26 17:53:00,2015-09-26 17:53:00,669,425,2691,R,1
arons_kwende,ФОТОГАЛЕРЕЯ. 60 лет назад начали строить Останкинскую телебашню  http://t.co/DvoNEaIz33 http://t.co/qMNDDKBDnD,United States,Russian,2015-09-27 09:13:00,2015-09-27 09:13:00,669,425,2695,R,1
arons_kwende,Ворота «Краснодара» в матче с «Тереком» будет защищать Синицын http://t.co/dlnGHGLf1o,United States,Russian,2015-09-27 13:53:00,2015-09-27 13:53:00,669,425,2696,R,1
arons_kwende,"«Зенит» опроверг информацию о том, что голкипер Лодыгин и защитник Анюков подрались после игры со «Спартаком» http://t.co/E2dyPsZjrb",United States,Russian,2015-09-27 19:52:00,2015-09-27 19:52:00,670,425,2699,R,1
arons_kwende,"Ирак заявил, что делится разведданными с Россией для борьбы с ИГ http://t.co/EpA5hJrq64",United States,Russian,2015-09-28 11:52:00,2015-09-28 11:52:00,670,425,2702,R,1
arons_kwende,Посол ФРГ в РФ прояснил ситуацию с размещением ядерного оружия США в Германии  http://t.co/B3jbkJ27eT http://t.co/rbjDrE0fJe,United States,Russian,2015-09-28 11:52:00,2015-09-28 11:53:00,670,425,2704,R,1
arons_kwende,Суд в Челябинске вынес приговор российскому блогеру Константину Жаринову за репост записи «Правого сектора» http://t.co/c7SwZIB5Dv,United States,Russian,2015-09-28 11:52:00,2015-09-28 11:52:00,670,425,2703,R,1
arons_kwende,"Суд в Петербурге вернется к делу о запрете сообщества ""MDK"" в ""ВКонтакте""  http://t.co/8gzf8ISksH",United States,Russian,2015-09-28 22:12:00,2015-09-28 22:13:00,670,426,2711,R,1
arons_kwende,Опубликовано видео задержания Савченко в Донбассе   https://t.co/7dgKODD0j2,United States,Russian,2015-09-29 12:52:00,2015-09-29 12:52:00,670,426,2713,R,1
arons_kwende,"Мовсисян тренировался в общей группе, Промес и Джано занимались индивидуально http://t.co/OD4bKldMlk",United States,Russian,2015-09-30 13:54:00,2015-09-30 13:54:00,670,426,2721,R,1
arons_kwende,Нетаньяху отказался обедать в одном ресторане с премьером Пакистана http://t.co/xJ1r3wYAD9,United States,Russian,2015-10-01 10:52:00,2015-10-01 10:52:00,670,426,2733,R,1
arons_kwende,Bild: Меркель может получить Нобелевскую премию мира http://t.co/XIsEjb1axP,United States,Russian,2015-10-02 13:33:00,2015-10-02 13:33:00,670,424,2737,R,1
arons_kwende,СМИ: президент ОПЕК освобождена под залог http://t.co/AaSN0uPEEe,United States,Bulgarian,2015-10-03 00:52:00,2015-10-03 00:52:00,671,425,2738,R,1
arons_kwende,"Ленка @LenaOReilly решила уйти в монастырь и всем раздаёт бабло. Кому надо, пишите ей в личку!",United States,Russian,2015-10-03 05:11:00,2015-10-03 05:11:00,671,425,2739,R,1
arons_kwende,"У моей Ольки прадед, немецкий дворянин Корх. Его сын получил от Государя 4-е креста св. Георгия за Россию.Другой дед - хохол >",United States,Russian,2015-10-03 18:32:00,2015-10-03 18:32:00,671,425,2742,R,1
arons_kwende,Леонид Федун предсказал возвращение цены на нефть к $100 за барр. http://t.co/nXiue0QZpO,United States,Russian,2015-10-04 17:12:00,2015-10-04 17:12:00,671,424,2745,R,1
arons_kwende,Индия приветствует Ангелу Меркель http://t.co/7F4KGfuwLP http://t.co/dOcuTh1lYK,United States,Russian,2015-10-05 01:51:00,2015-10-05 01:51:00,671,424,2746,R,1
arons_kwende,"""Известия"": в Индонезии выпустили сборник речей Путина http://t.co/Ot8sNRN7TY",United States,Serbian,2015-10-05 02:52:00,2015-10-05 02:52:00,671,424,2747,R,1
arons_kwende,США ввели санкции против трех россиян за связь с исламскими террористами http://t.co/hpmiz5NuJ0,United States,Russian,2015-10-05 18:51:00,2015-10-05 18:51:00,671,423,2750,R,1
arons_kwende,СМИ: чиновникам РФ хотят запретить использовать Google и WhatsApp http://t.co/jrAPf09Q7I http://t.co/SbFGtnykJu,United States,Russian,2015-10-06 00:11:00,2015-10-06 00:11:00,671,423,2754,R,1
arons_kwende,Как точечная платная парковка может лишить возможности владеть автомобилем http://t.co/3GP6MUPVMG http://t.co/E3wdK7jLIn,United States,Russian,2015-10-06 06:32:00,2015-10-06 06:32:00,671,423,2756,R,1
arons_kwende,"Кеды Converse, 1917 год http://t.co/gJIVuI6VGi",United States,Russian,2015-10-06 07:32:00,2015-10-06 07:32:00,671,423,2758,R,1
arons_kwende,Официальный курс евро упал ниже 73 руб.  http://t.co/56o98rhtM6,United States,Russian,2015-10-06 11:13:00,2015-10-06 11:13:00,671,423,2761,R,1
arons_kwende,«Трансаэро» отменила полеты из Красноярска на 7-8 октября http://t.co/zO7Cz4tk4l http://t.co/qVD47q2p91,United States,Russian,2015-10-06 12:35:00,2015-10-06 12:35:00,671,423,2762,R,1
arons_kwende,"В Иране опровергли информацию, что игроки их женской сборной оказались мужчинами http://t.co/4HZogYdqy9",United States,Russian,2015-10-06 16:51:00,2015-10-06 16:51:00,668,420,2763,R,1
arons_kwende,"РЕН ТВ подвел итоги кастинга на официальное лицо промо-кампании 5 сезона ""Игры престолов"" http://t.co/26Yq94adZY http://t.co/QQ75Eb893n",United States,Russian,2015-10-06 19:52:00,2015-10-06 19:52:00,668,420,2764,R,1
arons_kwende,На севере Москвы совершен вооруженный налет на отделение Сбербанка http://t.co/Pf0GjWU1ru,United States,Russian,2015-10-06 22:51:00,2015-10-06 22:51:00,668,420,2765,R,1
arons_kwende,"Путин отметит день рождения в компании друзей и партнеров по хоккейной команде, заявил Дмитрий Песков http://t.co/zO7s4RCXZm",United States,Russian,2015-10-07 10:34:00,2015-10-07 10:34:00,668,420,2766,R,1
arons_kwende,Девять  маршруток сгорели на автостоянке на западе Москвы http://t.co/Y0Haku3dgp,United States,Russian,2015-10-08 08:53:00,2015-10-08 08:53:00,668,419,2771,R,1
arons_kwende,BuzzFeed пришел на российский рынок. Теперь у них есть русскоязычный твиттер и первый материал на русском языке!   https://t.co/cD4MYlOIvj,United States,Russian,2015-10-08 15:32:00,2015-10-08 15:32:00,668,419,2776,R,1
arons_kwende,Клопп официально стал главным тренером «Ливерпуля» http://t.co/vv7EHEOZ7S,United States,Russian,2015-10-08 21:12:00,2015-10-08 21:12:00,668,418,2777,R,1
arons_kwende,Саудовская Аравия увеличит поддержку сирийских повстанцев http://t.co/s9mKRQ01QO,United States,Russian,2015-10-09 06:32:00,2015-10-09 06:32:00,668,418,2779,R,1
arons_kwende,Новые РЕПРЕССИИ Ким Чен Ына?  http://t.co/wiLuWORMG8 http://t.co/1LAh0tZljK,United States,Russian,2015-10-09 08:13:00,2015-10-09 08:13:00,668,418,2780,R,1
arons_kwende,Вывсёврети! Весьмирснами!   Израиль отказывается впускать на свою территорию украинцев http://t.co/hxouJzUUa3,United States,Russian,2015-10-09 19:33:00,2015-10-09 19:33:00,668,419,2785,R,1
arons_kwende,Малайзийские СМИ: Нидерланды игнорируют данные по крушению MH 17 в Донбассе  https://t.co/gGi42Dtyk4 http://t.co/1S6uivy1ei,United States,Russian,2015-10-11 23:12:00,2015-10-11 23:12:00,668,420,2794,R,1
arons_kwende,В России вступают в силу новые требования к оснащению мест для курения  http://t.co/NM7OVXOlYO,United States,Russian,2015-10-14 00:31:00,2015-10-14 00:31:00,668,419,2696,R,1
arons_kwende,Прогноз погоды на среду  http://t.co/4bUBwLLXUF http://t.co/67fvPkhALH,United States,Russian,2015-10-14 06:31:00,2015-10-14 06:31:00,668,419,2697,R,1
arons_kwende,"США заявили, что планируют углублять отношений с Туркменией  http://t.co/W6MvUkyFP2",United States,Russian,2015-10-16 02:11:00,2015-10-16 02:11:00,668,419,2704,R,1
arons_kwende,Полпред ДНР: выводы голландских экспертов по MH17 не совсем стыкуются http://t.co/16q0dbMztY http://t.co/HNWMLDf2IC,United States,Russian,2015-10-16 12:13:00,2015-10-16 12:13:00,668,419,2705,R,1
arons_kwende,Альпинисты из Петербурга первыми в мире покорили семитысячник Тулаги в Непале http://t.co/IJHU6GPDPQ,United States,Russian,2015-10-16 13:32:00,2015-10-16 13:33:00,668,419,2707,R,1
arons_kwende,"Суд отказал в 100 млн руб. ростовчанину, подавшему иск против «Хендэ» из-за неисправности авто  http://t.co/Wo1zhhsAqu",United States,Russian,2015-10-16 15:33:00,2015-10-16 15:33:00,668,419,2709,R,1
arons_kwende,Мэр Москвы Сергей Собянин уволил своего заместителя по антитеррористическим вопросам Виктора Захарова http://t.co/5HBPM5vLAC,United States,Russian,2015-10-16 16:53:00,2015-10-16 16:53:00,668,419,2710,R,1
arons_kwende,В Подмосковье мужчина жестоко избил женщину в детском кафе http://t.co/SeNUFVwym9,United States,Russian,2015-10-16 19:51:00,2015-10-27 02:48:00,668,419,2711,R,1
arons_kwende,Дональд Трамп возложил на Джорджа Буша ответственность за теракты 11 сентября http://t.co/6KGM3ltxEQ,United States,Russian,2015-10-17 12:33:00,2015-10-17 12:33:00,668,419,2715,R,1
arons_kwende,ЦСКА — «Урал» — 3:2: «армейцы» продлили беспроигрышную серию в РФПЛ до 19 матчей http://t.co/sDIAZkjCtn,United States,Ukrainian,2015-10-17 13:54:00,2015-10-17 13:54:00,668,419,2716,R,1
arons_kwende,Минобороны России занимается разработкой технологии для ведения кибервойн http://t.co/5Pz9NQtgfM,United States,Russian,2015-10-17 21:14:00,2015-10-17 21:14:00,668,419,2720,R,1
arons_kwende,В Египте начались выборы в парламент http://t.co/HxkER6uLhC,United States,Russian,2015-10-18 08:34:00,2015-10-18 08:34:00,668,419,2721,R,1
