author_id,content,region,language,publish_date,harvested_date,following,followers,updates,post_type,retweet
arons_kwende,"Коноплянка: два года назад почти попали на ЧМ, но все помнят, что случилось https://t.co/efoqivmVhl",United States,Russian,2015-11-16 20:17:00,2015-11-16 20:17:00,665,426,2960,R,1
arons_kwende,США провели последнее испытание новой ядерной бомбы https://t.co/ogC0JdiMVW © Фото: NNSA https://t.co/CLtUi4sJLo,United States,Russian,2015-11-17 03:51:00,2015-11-17 03:51:00,665,426,2961,R,1
arons_kwende,Внезапно™ https://t.co/aYO6vj6uEQ,United States,Russian,2015-11-17 04:17:00,2015-11-17 04:17:00,665,426,2962,R,1
arons_kwende,Нефть торгуется разнонаправленно на опасениях переизбытка предложения https://t.co/MAtS9gzVVa © AP Photo https://t.co/jHHwnZTmFk,United States,Russian,2015-11-17 06:13:00,2015-11-17 06:13:00,665,426,2963,R,1
arons_kwende,ФСБ подтвердило теракт на борту Airbus-321   https://t.co/Wx8TOMzoCv,United States,Ukrainian,2015-11-17 09:47:00,2015-11-17 09:48:00,665,426,2964,R,1
arons_kwende,Госдума отклонила законопроект о светоотражающих элементах для пешеходов  https://t.co/I3gA6EYdO5,United States,Ukrainian,2015-11-17 15:55:00,2015-11-17 15:55:00,665,426,2966,R,1
arons_kwende,"Игнашевич обогнал Онопко по количеству матчей за сборные России, СНГ и СССР https://t.co/pqUlA6lP3w",United States,Russian,2015-11-17 18:32:00,2015-11-17 18:32:00,664,425,2967,R,1
arons_kwende,Газопровод прорвался и загорелся в Ханты-Мансийском округе https://t.co/XLMIqv07NC https://t.co/DJm7bUBvBS,United States,Russian,2015-11-17 21:34:00,2015-11-17 21:35:00,664,425,2970,R,1
arons_kwende,Песков о сроках операции в Сирии  https://t.co/v4Q1RltH4O https://t.co/K0XBAS38r8,United States,Russian,2015-11-18 10:17:00,2015-11-18 10:17:00,664,425,2975,R,1
arons_kwende,Лавров: теракт с А321 -- нападение на всю Россию https://t.co/BYpeb8Becg,United States,Russian,2015-11-18 10:33:00,2015-11-18 10:34:00,664,425,2977,R,1
arons_kwende,Боевики опубликовали в соцсетях фото последствий удара ВКС РФ в Сирии https://t.co/LT9to5JsDp https://t.co/7XvlhvaJOc,United States,Russian,2015-11-18 16:53:00,2015-11-18 16:54:00,664,425,2978,R,1
arons_kwende,Россияне уступили в финансовой грамотности Монголии и Зимбабве https://t.co/rxsXVJpCNA,United States,Russian,2015-11-18 19:34:00,2015-11-18 19:34:00,664,425,2979,R,1
arons_kwende,У властей США нет данных о реальных угрозах стране со стороны ИГ  https://t.co/dkS6Pv15qZ,United States,Russian,2015-11-19 00:12:00,2015-11-19 00:12:00,664,425,2981,R,1
arons_kwende,Миллер стал самым «дорогим» топ-менеджером в России по версии Forbes https://t.co/LPdKfq9TJT https://t.co/Ciyg2I0GOs,United States,Russian,2015-11-19 02:11:00,2015-11-19 02:11:00,664,425,2982,R,1
arons_kwende,Депутат назвал блокировку каналов террористов в Telegram благоразумной https://t.co/NRW5vKLy5m https://t.co/VNa2OgvhYx,United States,Russian,2015-11-19 02:32:00,2015-11-19 02:32:00,664,425,2983,R,1
arons_kwende,Боснийские фанаты избили пьяного соотечественника за срыв минуты молчания перед футбольным матчем https://t.co/8ZrbxGyW0O,United States,Russian,2015-11-19 12:51:00,2015-11-19 12:52:00,664,425,2986,R,1
arons_kwende,Как Anonymous воюет с террористами   https://t.co/lVjGHBEmTF https://t.co/BednVmlSgY,United States,Ukrainian,2015-11-19 14:14:00,2015-11-19 14:15:00,664,425,2989,R,1
arons_kwende,Швейцария наложила арест на счета бывшего заместителя Скрынник https://t.co/N4Holt4cmU,United States,Russian,2015-11-19 16:04:00,2015-11-19 16:04:00,664,425,2993,R,1
arons_kwende,Суд в Брянске приговорил экс-губернатора Денина к 4 годам колонии https://t.co/W25nkWl1Mx https://t.co/htMdn3urbm,United States,Serbian,2015-11-19 17:02:00,2015-11-19 17:02:00,664,425,2994,R,1
arons_kwende,Премьер Франции: активные группы террористов могут оставаться в стране https://t.co/Kw3w5bonZD https://t.co/EEifrfUVJe,United States,Russian,2015-11-19 20:33:00,2015-11-19 20:33:00,664,426,2996,R,1
arons_kwende,Отставной пилот вызвал тревогу в аэропорту Лос-Анджелеса https://t.co/dzY6DXxfdT © Flickr/ Synchronizer https://t.co/22W2Bzcur8,United States,Russian,2015-11-19 22:51:00,2015-11-19 22:52:00,664,426,2997,R,1
arons_kwende,Эксперты предсказали сокращение производства шоколада в России https://t.co/A0wgtM4OPg,United States,Russian,2015-11-19 22:55:00,2015-11-19 22:55:00,664,426,2998,R,1
arons_kwende,В Кремле попросили не драматизировать протесты дальнобойщиков: https://t.co/JJ5j4oIZvu,United States,Russian,2015-11-20 02:35:00,2015-11-20 02:35:00,664,426,2999,R,1
arons_kwende,Парламент России: нужна доработка законов для пресечения терроризма https://t.co/wIlnuteUY6 https://t.co/U7PrN82X2U,United States,Russian,2015-11-20 03:31:00,2015-11-20 03:31:00,664,426,3000,R,1
arons_kwende,В США сирийских беженцев сравнили с собаками  https://t.co/u5d2FXaYhw https://t.co/mrY3dN5uVG,United States,Russian,2015-11-20 06:11:00,2015-11-20 06:11:00,664,426,3002,R,1
arons_kwende,Песков: в Кремле в вопросе казни для террористов исходят из действия моратория https://t.co/mDQr7O4C1L https://t.co/8iheTU0aFk,United States,Russian,2015-11-20 09:58:00,2015-11-20 09:58:00,664,425,3006,R,1
arons_kwende,Во время захвата отеля в Мали погиб гражданин Франции https://t.co/YL92zdLYIL,United States,Russian,2015-11-20 11:33:00,2015-11-20 11:34:00,664,426,3007,R,1
arons_kwende,РФС и хорватский футбольный союз подписали меморандум о сотрудничестве https://t.co/XgcQUwVuOI,United States,Russian,2015-11-20 12:56:00,2015-11-20 12:56:00,664,426,3010,R,1
arons_kwende,СМИ: 80 заложников освобождены из отеля Radisson в Мали  https://t.co/MWvh4okIWd https://t.co/HJ7puaJIMK,United States,Russian,2015-11-20 12:56:00,2015-11-20 12:56:00,664,426,3009,R,1
arons_kwende,"Ташуев: не ощущаю, что в «Кубани» есть серьёзные финансовые сложности https://t.co/dW4pMM1VXi",United States,Russian,2015-11-20 15:32:00,2015-11-20 15:32:00,664,425,3016,R,1
arons_kwende,«Амкар» — «Рубин»: видеотрансляция матча 21 ноября https://t.co/xbWGYXIE91,United States,Russian,2015-11-21 08:55:00,2015-11-21 08:55:00,664,425,3019,R,1
arons_kwende,"гаспачо по-армейски: берёшь ящик помидоров, кидаешь туда гранату, просеиваешь осколки через сетку-рабицу",United States,Russian,2015-11-21 13:54:00,2015-11-21 13:54:00,664,424,3022,R,1
arons_kwende,«Зенит» разгромил «Урал» и сократил отставание от ЦСКА до семи очков https://t.co/t6JYcc2ozp,United States,Bulgarian,2015-11-21 16:33:00,2015-11-21 16:33:00,664,424,3023,R,1
arons_kwende,АЗС предоставят топливо для дизель-генераторов в Крыму https://t.co/jZXMYkQ64P,United States,Ukrainian,2015-11-22 02:31:00,2015-11-22 02:31:00,663,425,3025,R,1
arons_kwende,Китай потратит 20 миллионов долларов на поиски пропавшего самолета MH370  https://t.co/1acOm5xLlL https://t.co/vNVxBE0SOf,United States,Russian,2015-11-22 03:54:00,2015-11-22 03:54:00,663,425,3026,R,1
arons_kwende,Около четырех тысяч зданий повреждены в Киргизии из-за землетрясений https://t.co/0YXXlZ5AHo https://t.co/yL1Ty9SVMg,United States,Russian,2015-11-22 05:51:00,2015-11-22 05:51:00,663,425,3027,R,1
arons_kwende,В результате аварийной посадки самолета в Киргизии пострадала женщина https://t.co/PJPjEUPI7z,United States,Russian,2015-11-22 05:56:00,2015-11-22 05:56:00,663,425,3028,R,1
arons_kwende,"Полиция Непала открыла огонь по демонстрантам, два человека погибли https://t.co/sdpEgAC7pL https://t.co/m4vwpMPj8w",United States,Russian,2015-11-22 06:51:00,2015-11-22 06:51:00,663,425,3029,R,1
arons_kwende,Прогноз погоды на сегодня  https://t.co/J934QtlOYp https://t.co/uCUibK0Lpw,United States,Russian,2015-11-22 06:52:00,2015-11-22 06:52:00,663,425,3030,R,1
arons_kwende,Источник: пятеро боевиков уничтожены во время спецоперации в Кабардино-Балкарии https://t.co/usCDptFwgr https://t.co/Mclyi42uTc,United States,Russian,2015-11-22 08:13:00,2015-11-22 08:13:00,663,425,3032,R,1
arons_kwende,"«Барселона» установила новый рекорд, забив в 20 подряд матчах с «Реалом» https://t.co/obPQyZ2j1j",United States,Russian,2015-11-22 10:23:00,2015-11-22 10:23:00,663,425,3032,R,1
arons_kwende,Глава минобороны Франции не исключил в республике угрозу теракта с применением химоружия https://t.co/KhMnSKbJfq,United States,Russian,2015-11-22 11:53:00,2015-11-22 11:53:00,663,425,3033,R,1
arons_kwende,«Динамо» упускает победу над «Мордовией» в концовке матча Бело-голубые упустили шанс подняться на 9-е место в …  https://t.co/McDjXE29jn,United States,Russian,2015-11-22 14:32:00,2015-11-22 14:32:00,663,425,3036,R,1
arons_kwende,В чем на этот раз Порошенко обвинил Россию  https://t.co/2HcPoaRj3F https://t.co/2yYhu24GBs,United States,Russian,2015-11-22 17:55:00,2015-11-22 17:55:00,663,425,3038,R,1
arons_kwende,"Стали известны итоги голосования о переименовании ""Войковской"" https://t.co/sX9RORXUrP https://t.co/1Uu7OtPZpV",United States,Russian,2015-11-22 23:39:00,2015-11-22 23:39:00,663,425,3039,R,1
arons_kwende,Третья группировка взяла на себя ответственность за теракт в Мали https://t.co/yvzYz50AGv,United States,Russian,2015-11-23 02:53:00,2015-11-23 02:53:00,663,425,3040,R,1
arons_kwende,"Только в Питерском метро, можно просто взять и встретить БОЯР!!!)) https://t.co/LFSN1y4OfU",United States,Russian,2015-11-23 07:31:00,2015-11-23 07:32:00,663,425,3042,R,1
arons_kwende,В ЛНР поручено проверить генераторы на случай экстренного отключения https://t.co/LAtQf7E6ul https://t.co/6GUuQzS1E8,United States,Russian,2015-11-23 07:34:00,2015-11-23 07:34:00,663,425,3043,R,1
arons_kwende,Мутко: в январе Международная федерация баскетбола должна окончательно снять все санкции с РФБ https://t.co/FPcV8rh1Ix,United States,Russian,2015-11-23 10:13:00,2015-11-23 10:13:00,663,425,3045,R,1
arons_kwende,Американский телеканал выдал видео ударов ВКС в Сирии за действия авиации США https://t.co/5wUD80Eea5,United States,Russian,2015-11-23 12:15:00,2015-11-23 12:15:00,663,425,3046,R,1
arons_kwende,АвтоВАЗ готовится к ночи продаж Lada Vesta https://t.co/lgfgIkZeMf,United States,Russian,2015-11-23 12:33:00,2015-11-23 12:34:00,663,425,3047,R,1
arons_kwende,Обманутая жена продала дом во время командировки мужа  https://t.co/PLW0yeUUnS https://t.co/3qhSg78op2,United States,Russian,2015-11-23 13:23:00,2015-11-23 13:24:00,663,425,3048,R,1
arons_kwende,«Ростов» — «Уфа»: видеотрансляция матча 23 ноября https://t.co/AKeyaRM5lc,United States,Russian,2015-11-23 15:56:00,2015-11-23 15:56:00,663,425,3049,R,1
arons_kwende,Мосгорсуд  ликвидировал саентологическую церковь Москвы https://t.co/JtW5feVKzw,United States,Russian,2015-11-23 15:57:00,2015-11-23 15:57:00,663,425,3050,R,1
arons_kwende,В МЭР оценили последствия от «зеркальных мер» Украины на продэмбарго РФ  https://t.co/BBATuKYzve,United States,Russian,2015-11-23 16:05:00,2015-11-23 16:09:00,663,425,3051,R,1
arons_kwende,Лондон не исключает агрессии по отношению к НАТО со стороны России https://t.co/dzHKCWRk8Q https://t.co/x13Rfkqi5J,United States,Russian,2015-11-23 18:11:00,2015-11-23 18:11:00,663,425,3052,R,1
arons_kwende,Путин: действия РФ в Сирии идут по согласованию с руководством страны https://t.co/nyXXS4DMv6 https://t.co/A8c1qT7ilm,United States,Russian,2015-11-23 21:54:00,2015-11-23 21:54:00,663,425,3054,R,1
arons_kwende,Британия усилит вещание Би-би-си в России и других частях мира https://t.co/NEgp8piLCO,United States,Russian,2015-11-24 03:12:00,2015-11-24 03:13:00,663,425,3055,R,1
arons_kwende,Москва готова закрутить вентиль газовой трубы на Украину https://t.co/lWOnUzNNfm https://t.co/FVHyyPQ2bQ,United States,Russian,2015-11-24 08:32:00,2015-11-24 08:32:00,663,425,3058,R,1
arons_kwende,У московского бизнесмена угнали Maybach за 8 млн рублей https://t.co/KWUHYIsQVv,United States,Russian,2015-11-24 08:52:00,2015-11-24 08:52:00,663,425,3060,R,1
arons_kwende,"Корреспондент ТАСС был среди журналистов, попавших под обстрел в Сирии https://t.co/8wGNZ3ItIg",United States,Russian,2015-11-24 10:23:00,2015-11-24 10:23:00,663,425,3062,R,1
arons_kwende,"Мизулина удивлена жестким приговором за кражу собаки-поводыря: ""Она просто подумала, что собака хорошая и брошенная"" https://t.co/BngKpxdZ4B",United States,Russian,2015-11-24 13:55:00,2015-11-24 13:56:00,663,425,3065,R,1
arons_kwende,Путин: сегодняшнее событие будет иметь серьезные последствия для российско-турецких отношений,United States,Russian,2015-11-24 14:16:00,2015-11-24 14:16:00,663,425,3066,R,1
arons_kwende,Саленко: «Валенсия» согласна на выход в плей-офф ЛЧ со второй строчки https://t.co/8VRXwz9m2e,United States,Russian,2015-11-24 14:17:00,2015-11-24 14:18:00,663,425,3067,R,1
arons_kwende,Российский вертолет экстренно сел в Латакии  https://t.co/0qIxeZnC3e https://t.co/80MlCiaNX0,United States,Russian,2015-11-24 14:37:00,2015-11-24 14:37:00,663,425,3068,R,1
arons_kwende,Эрдоган проводит совещание по безопасности после инцидента с Су-24 https://t.co/TuGTjRbtMv,United States,Russian,2015-11-24 14:56:00,2015-11-24 14:56:00,663,425,3069,R,1
arons_kwende,"В Пентагоне заявили, что Турция проинформировала США о сбитом Су-24 https://t.co/CDOSb8Gse7",United States,Russian,2015-11-24 15:32:00,2015-11-24 15:32:00,663,425,3070,R,1
arons_kwende,Samsung будет поставлять память для Audi https://t.co/e9aDb104mn,United States,Russian,2015-11-24 16:55:00,2015-11-24 16:55:00,663,425,3072,R,1
arons_kwende,Западные СМИ попробовали предсказать ответ Кремля на сбитый Су-24 https://t.co/ZQcI3Mh8lU,United States,Russian,2015-11-24 20:35:00,2015-11-24 20:35:00,663,425,3102,R,1
arons_kwende,«Арсенал» победил загребское «Динамо» в ЛЧ благодаря дублю Санчеса https://t.co/dGe0J6Ck2X,United States,Russian,2015-11-24 22:34:00,2015-11-24 22:34:00,663,425,3104,R,1
arons_kwende,"Путин прибыл в Свердловскую область, где поучаствует в открытии Центра Ельцина https://t.co/reb6cD5qU2",United States,Russian,2015-11-25 01:22:00,2015-11-25 01:22:00,663,425,3105,R,1
arons_kwende,Правила продажи сим-карт в РФ могут ужесточить из-за угрозы терроризма  https://t.co/Ez60OYVutX https://t.co/oS0Q4vWgw4,United States,Russian,2015-11-25 04:34:00,2015-11-25 04:34:00,663,425,3106,R,1
arons_kwende,МИД заявил об активизации контактов внешнеполитических служб России и США https://t.co/yrdMMls7K7,United States,Russian,2015-11-25 04:38:00,2015-11-25 04:38:00,663,425,3107,R,1
arons_kwende,"Сергей Лавров: Это похоже на спланированную провокацию. Заранее подготовленный видеоряд и другие свидетельства, что это было спланировано",United States,Russian,2015-11-25 12:15:00,2015-11-25 12:15:00,663,425,3110,R,1
arons_kwende,"В ГД уверены, что надо искать заказчиков атаки на российский Су-24 https://t.co/Wj7te8QEML #StandwithRussia https://t.co/gGmxVh8Le6",United States,Russian,2015-11-25 16:40:00,2015-11-25 16:40:00,663,425,3112,R,1
arons_kwende,СМИ: Турция опубликовала аудиозапись предупреждения пилотам Су-24 https://t.co/vfBtOTK5VQ,United States,Russian,2015-11-25 18:42:00,2015-11-25 18:42:00,663,425,3114,R,1
arons_kwende,Новая акция протеста дальнобойщиков прошла в Ростовской области https://t.co/ZWJK1Onvxr,United States,Russian,2015-11-25 19:38:00,2015-11-25 19:39:00,663,425,3115,R,1
arons_kwende,Ученые научились заряжать гаджеты от Wi-Fi  https://t.co/TJ9TMzwnJq https://t.co/D3uYJcQo2t,United States,Russian,2015-11-25 19:58:00,2015-11-25 19:58:00,663,425,3116,R,1
arons_kwende,«Ъ»: Россия может ограничить поставки еды из Турции с 26 ноября   https://t.co/SNQ4mM5EAN,United States,Russian,2015-11-25 20:40:00,2015-11-25 20:41:00,663,425,3118,R,1
arons_kwende,Пентагон: США не видит в российских С-400 угрозы для своей операции в Сирии  https://t.co/cru32IPOjz https://t.co/xeSML27hLJ,United States,Russian,2015-11-26 05:10:00,2015-11-26 05:10:00,663,425,3119,R,1
arons_kwende,Украинские военные зафикисровали 22 обстрела за ночь https://t.co/Mg820keQca,United States,Russian,2015-11-26 07:13:00,2015-11-26 07:13:00,663,425,3120,R,1
arons_kwende,У посольства Турции в Софии прошла акция протеста https://t.co/9eRnvxfAkN,United States,Russian,2015-11-26 11:55:00,2015-11-26 11:55:00,663,426,3123,R,1
arons_kwende,Составили краткую историю единственного туалета в московском метро    https://t.co/opf2O3jBA3 https://t.co/HjOGKtKUph,United States,Russian,2015-11-26 13:42:00,2015-11-26 13:42:00,663,426,3124,R,1
arons_kwende,В Минюсте прошел семинар для сотрудников министерства https://t.co/AlqzqrRHwL,United States,Ukrainian,2015-11-26 13:54:00,2015-11-26 13:55:00,663,426,3125,R,1
arons_kwende,Глава МИД Саудовской Аравии: РФ и Турция должны проявить сдержанность https://t.co/ERuAZQouSn #StandwithRussia https://t.co/VXWL8mXG7p,United States,Russian,2015-11-26 14:53:00,2015-11-26 14:54:00,663,426,3126,R,1
arons_kwende,Sony выплатит пострадавшим от кибератаки сотрудникам $8 млн https://t.co/UWPHQ15Zre,United States,Serbian,2015-11-26 15:54:00,2015-11-26 15:54:00,662,425,3128,R,1
arons_kwende,Анна Семенович снимется в «Гардемаринах-4»  https://t.co/Ddfv013qqd https://t.co/lEc6ieYcrQ,United States,Russian,2015-11-26 15:54:00,2015-11-26 15:54:00,662,425,3127,R,1
arons_kwende,До 30 турецких фур ожидают на границе разрешения на въезд в Россию  https://t.co/hUDcfypMaj © AP Photo https://t.co/DPNZw699b6,United States,Russian,2015-11-26 18:13:00,2015-11-26 18:14:00,662,425,3129,R,1
arons_kwende,В России отменен перекрестный Год культуры с Турцией https://t.co/dopP8ngDoA https://t.co/1BnHaY3caM,United States,Russian,2015-11-26 19:18:00,2015-11-26 19:18:00,662,425,3130,R,1
arons_kwende,Эрдоган предложил Путину встретиться 30 ноября https://t.co/jvaqyZrOnn,United States,Uzbek,2015-11-26 19:22:00,2015-11-26 19:23:00,662,425,3131,R,1
arons_kwende,"Путин: Если Турция уничтожает нелегальную нефть из Сирии, то «дыма» от этого мы не видим https://t.co/amcY4qXjNc https://t.co/NHBzxIoRCW",United States,Russian,2015-11-26 21:14:00,2015-11-26 21:20:00,662,425,3132,R,1
arons_kwende,Польшу не устроили американские ракеты Patriot https://t.co/fDDwPWbILu https://t.co/49UL1Z7w3j,United States,Russian,2015-11-26 23:31:00,2015-11-26 23:31:00,662,425,3135,R,1
arons_kwende,"Эрдоган будет считать агрессией, если турецкий самолёт собьют при нарушении границы Сирии https://t.co/sMRkvlibtP",United States,Russian,2015-11-27 04:37:00,2015-11-27 04:39:00,662,425,3136,R,1
arons_kwende,ФОТОРЕПОРТАЖ. Мужчина проник на территорию Белого дома  https://t.co/gLtlX805Dv https://t.co/sSJ79PrvMV,United States,Russian,2015-11-27 11:20:00,2015-11-27 11:20:00,663,426,3137,R,1
arons_kwende,Эрдоган отреагировал на заявления о торговле нефтью с ИГИЛ  https://t.co/G5J0KVjZbS https://t.co/U6pFw4ZyMy,United States,Uzbek,2015-11-27 13:17:00,2015-11-27 13:17:00,663,426,3139,R,1
arons_kwende,Самым читающим регионом России стала Ульяновская область https://t.co/1r6wgxB1QX,United States,Russian,2015-11-27 13:36:00,2015-11-27 13:37:00,663,426,3141,R,1
arons_kwende,"Земсков, Вяткин и Мильдзихов вызваны в сборную ФНЛ на матч с командой серии B https://t.co/sLp2jVL9m5",United States,Russian,2015-11-27 13:36:00,2015-11-27 13:37:00,663,426,3140,R,1
arons_kwende,Ожидаемое наказание для Украины  https://t.co/IIRi6mYc82 https://t.co/T5Pw0u8P16,United States,Ukrainian,2015-11-27 14:20:00,2015-11-27 14:22:00,663,426,3143,R,1
arons_kwende,"Утверждения, что Сирия покупает нефть у ИГ, не верны, заявил Муаллем https://t.co/WbrJ3t1kZe https://t.co/tkizZ1Xm9a",United States,Russian,2015-11-27 14:54:00,2015-11-27 14:54:00,663,426,3144,R,1
arons_kwende,СМИ: пилоты F-16 сбили Су-24 после информирования главкома ВВС Турции https://t.co/Y0cHNMg1Tj https://t.co/6W20a0SaDS,United States,Russian,2015-11-27 15:54:00,2015-11-27 15:55:00,663,427,3145,R,1
arons_kwende,Кроссовер Geely Emgrand X7 будет обновлен https://t.co/mxrWNRUTpr https://t.co/g6xn2G5V82,United States,Russian,2015-11-28 01:51:00,2015-11-28 01:51:00,663,428,3146,R,1
arons_kwende,Как бы не подрались братья по разуму турки с хохлами за право открытия америки https://t.co/fqyOWWNT1T,United States,Ukrainian,2015-11-28 12:37:00,2015-11-28 12:37:00,663,428,3148,R,1
arons_kwende,В Риме прошел митинг в поддержку действий РФ в Сирии https://t.co/Q88RifAFNM,United States,Russian,2015-11-28 13:39:00,2015-11-28 13:40:00,663,428,3150,R,1
arons_kwende,Папа римский почтил память христиан-мучеников в Уганде https://t.co/gCLMQJYamO,United States,Russian,2015-11-28 14:40:00,2015-11-28 14:41:00,663,428,3151,R,1
arons_kwende,Конец эпохи Кличко  https://t.co/2CbXsaPLSM https://t.co/Q956iAIR4b,United States,Russian,2015-11-29 06:11:00,2015-11-29 06:11:00,663,427,3156,R,1
