author_id,content,region,language,publish_date,harvested_date,following,followers,updates,post_type,retweet
arons_kwende,"Плашкоут, перевернувшийся у берегов Камчатки, относит в неизвестном направлении  http://t.co/rFHs161p1I",United States,Russian,2015-10-19 00:51:00,2015-10-19 00:51:00,668,419,2723,R,1
arons_kwende,КДК даст оценку баннеру болельщиков ЦСКА в матче с «Уралом» http://t.co/UrWFrT4QYI,United States,Russian,2015-10-19 11:15:00,2015-10-19 11:15:00,668,419,2725,R,1
arons_kwende,Гендиректор «ВымпелКома» появился в костюме пчелы на открытии салона http://t.co/k5kNxGtuiV,United States,Russian,2015-10-19 12:14:00,2015-10-19 12:14:00,668,419,2727,R,1
arons_kwende,Убивший свою девушку Писториус вышел из тюрьмы  https://t.co/ELJ1VunxBp https://t.co/muoDAmFepx,United States,Russian,2015-10-20 09:11:00,2015-10-20 09:11:00,668,419,2733,R,1
arons_kwende,Foreign Affairs: все козыри в Сирии на руках у России https://t.co/UVpxVzOpe7 https://t.co/g5efdqB4HN,United States,Russian,2015-10-20 16:51:00,2015-10-20 16:51:00,668,419,2737,R,1
arons_kwende,"Дворкович заявил, что поддержка спортивных клубов «Локомотив» будет продолжаться https://t.co/tYVd7EwSTm",United States,Russian,2015-10-20 17:31:00,2015-10-20 17:31:00,668,419,2739,R,1
arons_kwende,"Источник: ""Трансаэро"" продолжит свою деятельность https://t.co/MlIvMwhKWF",United States,Russian,2015-10-20 22:53:00,2015-10-20 22:53:00,668,419,2741,R,1
arons_kwende,"Выборы мэра Киева пройдут 25 октября, главный фаворит  — Виталий Кличко https://t.co/fIVmB7NYMv https://t.co/Kn7aU2mVmt",United States,Russian,2015-10-20 23:51:00,2015-10-20 23:53:00,668,419,2742,R,1
arons_kwende,"Состояние переболевшей Эболой шотландской медсестры более не вызывает опасений, по словам врачей https://t.co/Hx6o8mIu9q",United States,Russian,2015-10-21 14:34:00,2015-10-21 14:34:00,668,419,2745,R,1
arons_kwende,"Фильм ""Без границ"" Резо Гигинеишвили выходит в российский прокат  https://t.co/J92mGepmXz",United States,Russian,2015-10-21 23:22:00,2015-10-21 23:22:00,668,419,2749,R,1
arons_kwende,МИД РФ о реакции Белого дома на визит Асада в Москву  https://t.co/NlbPnLLKxY https://t.co/FIpa0NNcKT,United States,Russian,2015-10-22 05:32:00,2015-10-22 05:32:00,668,419,2750,R,1
arons_kwende,Помощником Джереми Корбина стал «бывший сталинист» https://t.co/Y0hM2QimC9 https://t.co/GUanFjNa7c,United States,Russian,2015-10-22 05:53:00,2015-10-22 05:53:00,668,419,2751,R,1
arons_kwende,Wikileaks опубликовал первую порцию писем из взломанного аккаунта директора ЦРУ https://t.co/aJ27ZOORWY,United States,Russian,2015-10-22 06:13:00,2015-10-22 06:13:00,668,419,2752,R,1
arons_kwende,"Водитель ""красногорского стрелка"" не знает, где может скрываться Георгадзе https://t.co/rzVb9HiceR",United States,Russian,2015-10-22 11:13:00,2015-10-22 11:13:00,668,419,2753,R,1
arons_kwende,"Биньямин Нетаньяху заявил, что палестинский духовный лидер вдохновил Гитлера на холокост https://t.co/t8tFR4qEDx https://t.co/1IarBaj93T",United States,Russian,2015-10-23 00:11:00,2015-10-23 00:20:00,668,419,2755,R,1
arons_kwende,"ЦБ РФ возложил на АСВ функции временной администрации по управлению банком ""Советский"" https://t.co/JWknFkzaLf",United States,Russian,2015-10-23 07:52:00,2015-10-23 07:52:00,668,419,2757,R,1
arons_kwende,"МЭР предлагает оптимизацию инвестпрограммы ""Газпрома""  https://t.co/F4rji3bvlZ",United States,Russian,2015-10-23 21:35:00,2015-10-23 21:35:00,668,420,2759,R,1
arons_kwende,Мода грядущей весны на Mercedes-Benz Fashion Week Russia https://t.co/C92B9M6Ujt https://t.co/RhG9Dlpjsn,United States,Russian,2015-10-24 06:53:00,2015-10-24 06:53:00,668,420,2762,R,1
arons_kwende,ФОТОГАЛЕРЕЯ. Самые сексуальные женщины года  https://t.co/qu8HYctWmC https://t.co/TcoKBIEtc8,United States,Russian,2015-10-24 07:34:00,2015-10-24 07:34:00,668,420,2763,R,1
arons_kwende,Дети из разных уголков мира и их спальни https://t.co/UMvYoUscth,United States,Russian,2015-10-24 15:12:00,2015-10-24 15:12:00,668,420,2766,R,1
arons_kwende,В Москву вылетел последний перед запретом рейс из Киева:  https://t.co/OZMqNVerhk,United States,Russian,2015-10-24 23:12:00,2015-10-24 23:12:00,668,420,2769,R,1
arons_kwende,Тони Блэр связал появление ИГ с вторжением США в Ирак в 2003 году https://t.co/WZMtYfP33A © Flickr/ Chatham House https://t.co/uHiq3eYTFn,United States,Russian,2015-10-25 02:32:00,2015-10-25 02:35:00,668,420,2770,R,1
arons_kwende,"'- конница зайдет с тыла, лучники вперед - но мы в 21 веке - но мы воюем с ИГИЛ'",United States,Russian,2015-10-25 12:54:00,2015-10-25 12:54:00,667,420,2773,R,1
arons_kwende,«Локомотив» и «Ростов» забили семь мячей в молодёжном первенстве https://t.co/RCl7Vrjep6,United States,Russian,2015-10-25 14:12:00,2015-10-25 14:12:00,667,420,2774,R,1
arons_kwende,Новый президент Аргентины определится во втором туре выборов https://t.co/u1JfHGfy20,United States,Russian,2015-10-26 07:15:00,2015-10-26 07:15:00,667,420,2778,R,1
arons_kwende,Милонов предложил запретить Хэллоуин во всех российских школах https://t.co/5oD0eBiMJ8,United States,Russian,2015-10-26 15:32:00,2015-10-26 15:32:00,667,420,2780,R,1
arons_kwende,"Чебан: совершенно недопустимо, чтобы человек вот так спокойно разгуливал по полю https://t.co/dpsYmL2YwM",United States,Russian,2015-10-27 11:33:00,2015-10-27 11:33:00,667,420,2782,R,1
arons_kwende,Питбультерьеры насмерть загрызли ребёнка в Ставропольском крае  https://t.co/ZeX8TmE1by,United States,Russian,2015-10-27 11:52:00,2015-10-27 12:01:00,667,420,2783,R,1
arons_kwende,Восстановлено водоснабжение двух городов Камчатки https://t.co/0OROb5K6F2 https://t.co/SDcFVmPbtI,United States,Russian,2015-10-28 04:04:00,2015-10-28 04:07:00,667,419,2788,R,1
arons_kwende,"Москвичи назвали тигренка, спасенного в Нижневартовске, Степаном https://t.co/zSy0gTV2fC",United States,Russian,2015-10-28 10:35:00,2015-10-28 10:35:00,667,419,2791,R,1
arons_kwende,Эво Моралес призвал отказаться от использования полиэтиленовых пакетов  https://t.co/5Wt0I03sbr https://t.co/tgMOUD8PIQ,United States,Russian,2015-10-28 23:54:00,2015-10-29 00:04:00,667,419,2795,R,1
arons_kwende,Глава Крыма выступил против «игр с образами зла»  https://t.co/2erWKsY2s1 https://t.co/fMUnZHIGFh,United States,Russian,2015-10-29 06:32:00,2015-10-29 06:32:00,667,419,2796,R,1
arons_kwende,The Guardian: Растущее влияние России и Ирана на Ближнем Востоке заставляет Обаму менять тактику  https://t.co/q3C0dpDAtk,United States,Russian,2015-10-29 09:14:00,2015-10-29 09:14:00,667,419,2800,R,1
arons_kwende,Нехуй было Дрезден бомбить! https://t.co/4JIa7DcDGS,United States,Russian,2015-10-29 12:35:00,2015-10-29 12:35:00,667,419,2801,R,1
arons_kwende,Джон Керри по итогам переговоров: Встреча в Вене была очень конструктивной  https://t.co/WCo9TuTW7q,United States,Russian,2015-10-30 17:15:00,2015-10-30 17:16:00,667,419,2811,R,1
arons_kwende,На встрече в Вене страны призвали ООН провести встречу сирийских властей и оппозиции https://t.co/StmaDBm1dF,United States,Russian,2015-10-30 18:52:00,2015-10-30 18:52:00,667,419,2812,R,1
arons_kwende,Российские дипломаты выясняют ситуацию с исчезновением самолета https://t.co/LSurbkk6sg,United States,Russian,2015-10-31 09:13:00,2015-10-31 09:13:00,667,419,2815,R,1
arons_kwende,Правительство России расширило границы порта Севастополя https://t.co/6IkUXX04ty https://t.co/P1Syacp3Za,United States,Russian,2015-10-31 10:56:00,2015-10-31 11:05:00,667,419,2816,R,1
arons_kwende,"Дзюба: «Зенит» верит, что ликвидирует отставание от ЦСКА и сохранит титул https://t.co/JwW3EUznFY",United States,Russian,2015-10-31 12:11:00,2015-10-31 12:11:00,667,419,2817,R,1
arons_kwende,Поддержи «Чемпионат» в народном голосовании «Премии Рунета»! https://t.co/kdpsiKeUng,United States,Macedonian,2015-10-31 13:55:00,2015-10-31 13:56:00,667,419,2818,R,1
arons_kwende,"Кечинов: если «Спартак» претендует на медали, то должен обыгрывать «Урал» https://t.co/vcELdpT6cg",United States,Russian,2015-11-01 15:33:00,2015-11-01 15:33:00,667,419,2819,R,1
arons_kwende,Евгений Плющенко отменил премьеру своего ледового шоу в связи с крушением А321 https://t.co/GpfWDyMGSx https://t.co/opSl25edie,United States,Russian,2015-11-02 13:15:00,2015-11-02 13:16:00,667,419,2822,R,1
arons_kwende,В Москве выявили максимальную угрозу протестных настроений https://t.co/kxGOfvlnx6 https://t.co/uTBzZDmGR4,United States,Russian,2015-11-03 10:15:00,2015-11-03 10:15:00,667,419,2830,R,1
arons_kwende,В Санкт-Петербурге отменен концерт ко Дню народного единства из-за ЧП с А321 https://t.co/x923SrYs9J #7K9268 https://t.co/Ejw0dSzcOc,United States,Ukrainian,2015-11-03 20:13:00,2015-11-03 20:13:00,666,418,2833,R,1
arons_kwende,Евроинтегрируйся раз... Евроинтегрируйся два... https://t.co/3oEiwCYbwh,United States,Russian,2015-11-04 12:16:00,2015-11-04 12:16:00,666,418,2835,R,1
arons_kwende,Военные Южного Судана подтвердили гибель двоих россиян в крушении Ан-12 https://t.co/FAxDG7B6tX,United States,Russian,2015-11-04 13:54:00,2015-11-04 13:55:00,666,418,2837,R,1
arons_kwende,"нашего прапора невозможно обыграть в варкрафт. когда у него кончается золото, он договаривается и строит здания и войска за сгущенку",United States,Russian,2015-11-04 15:54:00,2015-11-04 15:54:00,666,419,2838,R,1
arons_kwende,Госдеп констатирует отвод вооружений ополченцами и предостерегает Киев от силовых действий https://t.co/aO9zdW79Gu https://t.co/6xw4HYPgmn,United States,Russian,2015-11-04 18:12:00,2015-11-04 18:12:00,666,419,2839,R,1
arons_kwende,Глава ФРС США: решение об увеличении базовой процентной ставки еще не принято https://t.co/YchOW3uWQj https://t.co/nHkgvoIZsg,United States,Russian,2015-11-04 19:52:00,2015-11-04 19:52:00,666,419,2840,R,1
arons_kwende,ВКС: российский истребитель нарушил пространство Турции из-за наземных средств ПВО https://t.co/n4ALksTBvf,United States,Russian,2015-11-05 07:35:00,2015-11-05 07:35:00,666,419,2843,R,1
arons_kwende,Опубликованы первые фото со съёмочной площадки нового фильма о вселенной Гарри Поттера  https://t.co/kUIkZm23tC https://t.co/pNb3bTZtS3,United States,Russian,2015-11-05 13:53:00,2015-11-05 13:59:00,666,419,2846,R,1
arons_kwende,Опубликован рейтинг самых доступных горнолыжных курортов Европы  https://t.co/ioTrGi1RI5 https://t.co/vXxZRDk9Vv,United States,Russian,2015-11-05 15:42:00,2015-11-05 15:42:00,666,419,2847,R,1
arons_kwende,"В США считают, что Иран может стать частью процесса урегулирования кризиса в Сирии  https://t.co/9G2Hs9fDah",United States,Russian,2015-11-06 02:51:00,2015-11-06 02:59:00,666,419,2850,R,1
arons_kwende,Су-30СМ и Су-35С ВВО сбросили 24 авиабомбы на ЗРК и колонну танков условного противника https://t.co/M5tRoYVemg,United States,Ukrainian,2015-11-06 04:53:00,2015-11-06 04:54:00,666,420,2852,R,1
arons_kwende,Мосгорсуд рассмотрит иск родственников жертв катастрофы ХК «Локомотив» https://t.co/lSWYco98K0 https://t.co/6EezbCH6tv,United States,Russian,2015-11-06 05:55:00,2015-11-06 05:55:00,666,420,2852,R,1
arons_kwende,АвтоВАЗ показал новый серийный автомобиль LADA XRAY  https://t.co/Zld5rUeRsP https://t.co/YL5KY0JMwU,United States,Russian,2015-11-06 11:53:00,2015-11-06 11:54:00,666,420,2855,R,1
arons_kwende,Меры по защите инфраструктур от кибертерроризма должны быть усилены https://t.co/LKMsPcDhi9 https://t.co/SVjhuDTebp,United States,Russian,2015-11-08 08:56:00,2015-11-08 08:56:00,666,421,2864,R,1
arons_kwende,СМИ узнали о почти полной уверенности следствия в теракте на борту АЗ21 https://t.co/T9Qv6xrOh7,United States,Russian,2015-11-08 13:16:00,2015-11-08 13:16:00,666,421,2865,R,1
arons_kwende,"В Хабаровске Boeing ""Аэрофлота"" столкнулся с другим самолётом https://t.co/lkkciYOm9d",United States,Serbian,2015-11-08 14:35:00,2015-11-08 14:35:00,666,421,2866,R,1
arons_kwende,В ГД хотят пригласить на правительственный час главу ФСБ по делу A321 https://t.co/JHeOpU4Brv https://t.co/BGq6lW6Yzd,United States,Russian,2015-11-08 21:31:00,2015-11-08 21:31:00,666,420,2867,R,1
arons_kwende,"Пойду соседу дверь подожгу. Если он мне рыло набьёт-то он быдло некультурное, и путиноид необразованный. https://t.co/yjvbiWDI46",United States,Russian,2015-11-09 07:11:00,2015-11-09 07:13:00,666,421,2869,R,1
arons_kwende,DM: Запад не сможет победить ИГ без помощи Путина https://t.co/vCAeXjMtck,United States,Russian,2015-11-09 07:53:00,2015-11-09 07:53:00,666,421,2870,R,1
arons_kwende,«Суонси» расторг контракт с Мичу по обоюдному согласию https://t.co/CNR6kCbdZc,United States,Russian,2015-11-09 15:53:00,2015-11-09 15:53:00,666,421,2874,R,1
arons_kwende,Дмитрий Песков назвал голословными обвинения WADA  https://t.co/1e4Ip3Hbv5 https://t.co/vbOLf3AA3l,United States,Russian,2015-11-10 10:17:00,2015-11-10 10:17:00,666,422,2877,R,1
arons_kwende,Депутат попросит проверить блогера Варламова на экстремизм https://t.co/0W0nREUYCL,United States,Russian,2015-11-10 11:37:00,2015-11-10 11:38:00,666,421,2878,R,1
arons_kwende,"В Самаре задержали водителя, насмерть сбившего 3-летнего ребенка https://t.co/WmTU4BRvA4",United States,Russian,2015-11-10 15:12:00,2015-11-10 15:13:00,666,422,2879,R,1
arons_kwende,"Дмитрий Песков опроверг данные статьи, в которой Катерина Тихонова названа дочерью Путина https://t.co/0hLDddpXPh",United States,Russian,2015-11-10 18:54:00,2015-11-10 18:54:00,666,423,2884,R,1
arons_kwende,Мэрия Сиэтла решила уничтожить местную достопримечательность из жвачки  https://t.co/vVtp3O4j4T https://t.co/2yveC8THdj,United States,Russian,2015-11-11 03:15:00,2015-11-11 03:15:00,666,423,2886,R,1
arons_kwende,Трамп: Китай только выиграет от соглашения по Транстихоокеанскому партнерству https://t.co/EvKy31A0Du © AP Photo https://t.co/Nrj6oPoLv9,United States,Russian,2015-11-11 07:16:00,2015-11-11 07:16:00,666,423,2888,R,1
arons_kwende,Следствие просит оставить экс-главу Коми в СИЗО до марта https://t.co/0f9GvsOnag,United States,Russian,2015-11-11 10:13:00,2015-11-11 10:13:00,666,423,2889,R,1
arons_kwende,"Ярош отказался возглавлять ""Правый сектор"" https://t.co/xCEwKVdcSs",United States,Russian,2015-11-11 13:33:00,2015-11-11 13:34:00,666,423,2891,R,1
arons_kwende,Армия Сирии освободила от боевиков ряд населенных пунктов https://t.co/eij80tYsLU https://t.co/FG7kTUTmLl,United States,Russian,2015-11-11 17:53:00,2015-11-11 17:53:00,666,423,2894,R,1
arons_kwende,Тайные патрули ГИБДД появились на улицах Москвы https://t.co/N1CbQHLv6s,United States,Russian,2015-11-12 14:37:00,2015-11-12 14:37:00,666,422,2901,R,1
arons_kwende,Новым председателем сейма Польши избран обладатель украинского ордена https://t.co/pVJRy7GIfQ https://t.co/CJPbGQNglh,United States,Russian,2015-11-12 19:32:00,2015-11-12 19:32:00,666,421,2903,R,1
arons_kwende,"Директор фирмы, строящей жилые дома в Клину, похитил свыше 29 млн рублей https://t.co/mY4IRWKtw6",United States,Russian,2015-11-12 20:31:00,2015-11-12 20:31:00,666,422,2904,R,1
arons_kwende,"Керри назвал ИГ ""величайшей угрозой"" в мире и ""воплощением зла"" https://t.co/p0uYJWKRGy",United States,Russian,2015-11-12 21:15:00,2015-11-12 21:16:00,666,422,2905,R,1
arons_kwende,Пентагон: американские военные советники помогают курдам в борьбе с ИГ https://t.co/SY68tNZUZ7,United States,Russian,2015-11-13 04:53:00,2015-11-13 04:53:00,666,422,2906,R,1
arons_kwende,В Госдуме разъяснили предложение о введении выездных виз для россиян https://t.co/FhruxBtD5F,United States,Russian,2015-11-13 13:59:00,2015-11-13 14:00:00,666,422,2910,R,1
arons_kwende,Турбулентное десятилетие: почему кризис не закончится сам по себе https://t.co/UWq9K0zRbn,United States,Russian,2015-11-13 14:20:00,2015-11-13 14:20:00,666,422,2911,R,1
arons_kwende,Источник: на разбившемся в Словакии украинском вертолете были контрабандисты сигарет https://t.co/TBpnuzXEof,United States,Russian,2015-11-13 15:03:00,2015-11-13 15:03:00,666,422,2912,R,1
arons_kwende,Украина планируют масштабную распродажу Госрезерва   https://t.co/MIyLfgmZUm https://t.co/VpyUEUsuNl,United States,Russian,2015-11-13 16:56:00,2015-11-13 16:56:00,666,422,2914,R,1
arons_kwende,И.о. президента ФИФА успешно перенёс операцию по пересадке почки https://t.co/htYiWasV9o,United States,Russian,2015-11-13 18:35:00,2015-11-13 18:35:00,666,423,2917,R,1
arons_kwende,Путин и Мадуро обсудили развитие отношений между Россией и Венесуэлой https://t.co/sEvIWTJZXA https://t.co/e9toKz376H,United States,Russian,2015-11-13 19:32:00,2015-11-13 19:32:00,666,423,2919,R,1
arons_kwende,СМИ: около 60 человек находятся в заложниках в театре в Париже https://t.co/xXYiYurtZd https://t.co/30LRLApoFp,United States,Russian,2015-11-13 23:01:00,2015-11-13 23:01:00,666,424,2921,R,1
arons_kwende,Захарова выразила соболезнования французам в связи с атаками в Париже  https://t.co/fwbeU4fUF0 https://t.co/A3cOt66aCW,United States,Russian,2015-11-13 23:32:00,2015-11-13 23:32:00,666,424,2922,R,1
arons_kwende,"Олланд подтвердил нейтрализацию боевиков, захвативших театр в Париже  https://t.co/kZitg8AVWr https://t.co/YbVkSlHauI",United States,Russian,2015-11-14 01:55:00,2015-11-14 01:56:00,666,424,2925,R,1
arons_kwende,Общественная палата РФ призывает мир сплотиться в борьбе с террором  https://t.co/e4GkNpGyqh https://t.co/p24IrYibdT,United States,Russian,2015-11-14 02:36:00,2015-11-14 02:37:00,666,424,2926,R,1
arons_kwende,Российских легкоатлетов отстранили от международных соревнований. Временно:  https://t.co/Kqo7AfqyNq https://t.co/eZctcMtzWh,United States,Russian,2015-11-14 05:12:00,2015-11-14 05:12:00,666,424,2927,R,1
arons_kwende,Очевидцы рассказали о терактах в Париже https://t.co/enz5vzVDcH #Париж #Теракт https://t.co/X8rGmWZmNZ,United States,Russian,2015-11-14 10:11:00,2015-11-14 10:11:00,666,424,2929,R,1
arons_kwende,Французский триколор появился на ряде знаменитых зданий по всему миру: https://t.co/FxVugMnKJs,United States,Russian,2015-11-14 11:12:00,2015-11-14 11:14:00,666,424,2930,R,1
arons_kwende,#Париж  #ПарижДержись  #ПарижБорись  #теракт  #Теракты_в_Париже  ������������������������ #RIP ������������������ https://t.co/X8SUBMTEIB,United States,Russian,2015-11-14 12:11:00,2015-11-14 12:11:00,666,425,2933,R,1
arons_kwende,"Задержаны родственники террориста, причастного к событиям в Париже https://t.co/KMnboYQWCb #ParisAttacks #Париж https://t.co/xBqG9i6Aby",United States,Russian,2015-11-14 23:42:00,2015-11-14 23:42:00,666,426,2942,R,1
arons_kwende,Мракзахарычу  не говорите.))) https://t.co/aXNWp690qz,United States,Ukrainian,2015-11-15 07:11:00,2015-11-15 07:12:00,666,426,2945,R,1
arons_kwende,Теракты в Париже заставили внести изменения в повестку саммита G20 https://t.co/AsSdztrLvf,United States,Russian,2015-11-15 09:13:00,2015-11-15 09:13:00,666,426,2946,R,1
arons_kwende,Обама: США стоят плечом к плечу с Европой в деле помощи мигрантам https://t.co/qvqH0bMtzR https://t.co/daoSBKt2ne,United States,Russian,2015-11-15 11:14:00,2015-11-15 11:15:00,666,426,2947,R,1
arons_kwende,Тайны темной материи могут быть открыты уже в декабре https://t.co/zBcXaAGOKl https://t.co/DCNJfv5PH7,United States,Russian,2015-11-15 14:32:00,2015-11-15 14:32:00,665,426,2951,R,1
arons_kwende,Пять человек погибли в ДТП в Чечне https://t.co/bMbf4FfVYi,United States,Russian,2015-11-15 16:14:00,2015-11-15 16:15:00,665,426,2952,R,1
arons_kwende,"Массовые захоронения обнаружены в Синджаре, освобожденном от ИГ https://t.co/oVY0upMwg3 https://t.co/lR7IG7vdY7",United States,Russian,2015-11-15 22:33:00,2015-11-15 22:33:00,665,426,2953,R,1
arons_kwende,Беженцев нужно вооружить и отправить обратно отвоёвывать свои страны https://t.co/x6Z0fLk86E https://t.co/Ijew9B9sqd,United States,Russian,2015-11-16 01:12:00,2015-11-16 01:13:00,665,426,2954,R,1
arons_kwende,Самолет израильских авиалиний экстренно приземлился в США  https://t.co/9dJbuIkWMm https://t.co/qfxrSZZSpV,United States,Russian,2015-11-16 02:14:00,2015-11-16 02:15:00,665,426,2956,R,1
arons_kwende,ФОТОРЕПОРТАЖ. Минута молчания в память о жертвах терактов во Франции  https://t.co/AIfzVcLhzQ https://t.co/YLhNUZRGaS,United States,Russian,2015-11-16 14:15:00,2015-11-16 14:15:00,665,425,2958,R,1
arons_kwende,Барак Обама исключил наземную операцию США в Сирии https://t.co/sFiomkN31a #G20 https://t.co/OQ93WbGLYy,United States,Russian,2015-11-16 16:31:00,2015-11-16 16:31:00,665,425,2959,R,1
