author_id,content,region,language,publish_date,harvested_date,following,followers,updates,post_type,retweet
PunnaYoandra,A good friend knows all your best stories,Unknown,English,2017-03-28 01:05:00,2017-03-28 01:05:00,5,0,1,,0
PunnaYoandra,ugh! is it ASSHOLE DAY and no one told me?!,Unknown,English,2017-03-28 01:05:00,2017-03-28 01:05:00,5,0,3,,0
PunnaYoandra,"you say ""My Cocaine"" out-loud, you are also saying ""Michael Caine"" in his own voice - MIND OFFICIALLY BLOWN",Unknown,English,2017-03-31 06:40:00,2017-03-31 06:41:00,5,0,4,,0
PunnaYoandra,raw footage of SPACE JAM is mostly just Michael Jordan running around and talking to no one in an empty gym.,Unknown,English,2017-03-31 06:41:00,2017-03-31 06:41:00,5,0,7,,0
PunnaYoandra,a white guy laughed at his own joke with an intensity that hinted at a darkness within.,Unknown,English,2017-03-31 06:41:00,2017-03-31 06:41:00,5,0,11,,0
PunnaYoandra,"""I'm just old-fashioned gal..I boil my coffee, I like to eat meat and I wear underwear that covers my entire arse!"" - Erica Scott",Unknown,English,2017-03-31 06:41:00,2017-03-31 06:41:00,5,0,6,,0
PunnaYoandra,"week our panel of 3 celebrity chefs compete to create the ultimate final meal for a death row inmate on LAST SUPPER, this fall on FOX",Unknown,English,2017-03-31 06:41:00,2017-03-31 06:41:00,5,0,10,,0
PunnaYoandra,a girl shes pretty 100 times she wont believe you Tell a girl shes fat once and she'll remember it forever cause elephants never forget,Unknown,English,2017-03-31 06:41:00,2017-03-31 06:41:00,5,0,9,,0
PunnaYoandra,I get down on my knees and pray for a pigeon to fly directly into my mouth,Unknown,English,2017-04-14 16:42:00,2017-04-14 16:43:00,5,0,12,,0
