author_id,content,region,language,publish_date,harvested_date,following,followers,updates,post_type,retweet
WhiteHouseCards,"""Сделаем Интернет снова великим!"" https://t.co/pkf9TznJ8k",United States,Russian,2016-11-29T09:03:00,2016-11-29T09:03:00,4770.0000000000,8623.0000000000,1299.0000000000,,False
WhiteHouseCards,"RT, если у тебя был такой же 2016 год https://t.co/chnReNDa3o",United States,Russian,2016-11-29T11:33:00,2016-11-29T11:33:00,4770.0000000000,8624.0000000000,1300.0000000000,,False
WhiteHouseCards,Вышел отчет о тратах Федерального правительства США. Собрали самое интересное в одной картинке https://t.co/saXCttqBfU,,Russian,2016-11-29T16:22:00,2016-11-29T17:14:00,4770.0000000000,8634.0000000000,1304.0000000000,,False
WhiteHouseCards,"Кандидат от Зеленой партии США Джил Штайн подала иск, с требованием пересчета голосов, заручившись поддержкой Хиллари Клинтон. Иск отклонен. https://t.co/U3z69TSQo9",,Russian,2016-11-30T09:42:00,2016-11-30T11:11:00,4769.0000000000,8650.0000000000,1310.0000000000,,False
WhiteHouseCards,"Дональд Трамп встретился с Миттом Ромни. У Ромни лицо, будто он хочет нам сказать: ""Господи Иисусе, кто-нибудь, пожалуйста, спасите меня!"" https://t.co/z3rNWsasV6",,Russian,2016-11-30T11:38:00,2016-11-30T12:31:00,4769.0000000000,8653.0000000000,1311.0000000000,,False
WhiteHouseCards,ЦРУ выложило на фликр тысячи секретных карт. Смотрите быстрее!  https://t.co/3J4lAszFXE https://t.co/edFtJneo5n,United States,Russian,2016-11-30T16:01:00,2016-11-30T16:01:00,4768.0000000000,8656.0000000000,1314.0000000000,,False
WhiteHouseCards,Грузчики меняют ТОТ САМЫЙ ДИВАН. Теперь ты видел всё. https://t.co/IVpAmjDP6n,,Russian,2016-11-30T17:00:00,2016-11-30T17:09:00,4768.0000000000,8656.0000000000,1315.0000000000,,False
WhiteHouseCards,"Том Форд отказался одевать Меланию Трамп, объяснив это тем, что Мелания не его типаж. https://t.co/UIRROGWthM",United States,Russian,2016-12-01T10:53:00,2016-12-01T10:54:00,4769.0000000000,8654.0000000000,1318.0000000000,,False
WhiteHouseCards,Чёрная пятница. Канада vs США https://t.co/QlNu99aZLX,,Serbian,2016-12-01T13:52:00,2016-12-01T14:28:00,4769.0000000000,8653.0000000000,1320.0000000000,,False
WhiteHouseCards,"Сэр, Фидель Кастро умер. Вы, как избранный президент, должны сделать заявление.  @realDonaldTrump: Фидель Кастро умер! https://t.co/9fbJ7LTMNy",United States,Russian,2016-12-01T16:30:00,2016-12-01T16:30:00,4768.0000000000,8651.0000000000,1324.0000000000,,False
WhiteHouseCards,"Трамп отправляется в тур по городам, чтобы сказать «Спасибо» всем, кто проголосовал за него https://t.co/A5mA76CoiJ",,Russian,2016-12-01T18:00:00,2016-12-01T18:01:00,4768.0000000000,8658.0000000000,1326.0000000000,,False
WhiteHouseCards,Капитан очевидность бастует в США https://t.co/C4BbLJSK2d,,Russian,2016-12-02T15:06:00,2016-12-02T15:44:00,4766.0000000000,8664.0000000000,1329.0000000000,,False
WhiteHouseCards,"Президент Филиппин Дутерте заявил, что Трамп одобрил его программу по борьбе с наркоторговлей. https://t.co/O6sPTtSLO1",,Russian,2016-12-03T09:08:00,2016-12-03T13:54:00,4766.0000000000,8668.0000000000,1333.0000000000,,False
WhiteHouseCards,"""Closer"" группы The Chainsmokers в исполнении Дональда Трампа https://t.co/vUxq7FA7lx",United States,Russian,2016-12-03T13:57:00,2016-12-03T13:57:00,4766.0000000000,8668.0000000000,1334.0000000000,,False
WhiteHouseCards,"Почти 100 000 жителей Нью-Йорка подписали петицию, в которой требуется, чтобы Мелания Трамп уехала из города. https://t.co/kXmUdIs6YJ",,Russian,2016-12-03T15:48:00,2016-12-03T16:03:00,4766.0000000000,8671.0000000000,1335.0000000000,,False
WhiteHouseCards,"Дональд Трамп пришел на вечеринку ""Злодеи и герои"" в костюме самого себя https://t.co/Ev8gWeupPC",United States,Russian,2016-12-04T11:00:00,2016-12-04T11:11:00,4766.0000000000,8670.0000000000,1338.0000000000,,False
WhiteHouseCards,"""Людям платят за то, что бы они протестовали против меня. Я еще даже не президент, но уже создал рабочие места."" https://t.co/uDhWlzRFAn",,Russian,2016-12-04T12:30:00,2016-12-05T10:02:00,4764.0000000000,8682.0000000000,1344.0000000000,,False
WhiteHouseCards,"Уровень безработицы в США достиг исторического максимума. По подсчетам количество неработающих американцев равняется 95,06 млн. https://t.co/XjgRlD1pqj",,Russian,2016-12-04T14:00:00,2016-12-05T09:36:00,4764.0000000000,8683.0000000000,1344.0000000000,,False
WhiteHouseCards,Доброе утро!  Ежегодно в США печатается 47 триллионов долларов. https://t.co/zMRZjduNOK,,Russian,2016-12-05T07:29:00,2016-12-05T07:46:00,4764.0000000000,8681.0000000000,1343.0000000000,,False
WhiteHouseCards,Каждый год примерно 250.000 женатых американцев подвергаются избиениям со стороны своих жен https://t.co/zhtpnxPdQO,United States,Russian,2016-12-05T12:05:00,2016-12-05T12:05:00,4764.0000000000,8684.0000000000,1346.0000000000,,False
WhiteHouseCards,Индейцы добились отмены строительства нефтепровода под Миссури https://t.co/374a9jjy8d,,Russian,2016-12-05T13:04:00,2016-12-05T13:26:00,4764.0000000000,8685.0000000000,1347.0000000000,,False
WhiteHouseCards,5 декабря 1901 года родился Уолт Дисней — знаменитый мультипликатор и создатель мультимедийной империи The Walt Disney Company. https://t.co/8M7kjT1tla,United States,Russian,2016-12-05T13:49:00,2016-12-05T13:49:00,4764.0000000000,8684.0000000000,1348.0000000000,,False
WhiteHouseCards,"Байден заявил, что собирается баллотироваться на пост президента на следующих выборах https://t.co/isSfC1n0NF",,Russian,2016-12-06T14:33:00,2016-12-06T14:50:00,4764.0000000000,8697.0000000000,1356.0000000000,,False
WhiteHouseCards,"Губернатор Айовы собирается встретиться с Трампом, чтобы обсудить кандидатуру в качестве посла в Китае https://t.co/8CCtmR4CpG",,Russian,2016-12-06T16:43:00,2016-12-06T18:19:00,4764.0000000000,8697.0000000000,1358.0000000000,,False
WhiteHouseCards,"Цвета флага США: Красный цвет олицетворяет доблесть и выносливость,синий- усердие,справедливость и бдительность, белый- невинность и чистоту https://t.co/HSAbburSrt",United States,Russian,2016-12-06T18:29:00,2016-12-06T18:36:00,4764.0000000000,8697.0000000000,1359.0000000000,,False
WhiteHouseCards,Доброе утро!  Дональд Трамп с отцом и матерью в 1992 году. https://t.co/tjXAXVI7f0,,Russian,2016-12-07T07:01:00,2016-12-07T09:38:00,4763.0000000000,8703.0000000000,1363.0000000000,,False
WhiteHouseCards,Apple выплатит $450 тысяч в связи с обвинениями в загрязнении окружающей среды https://t.co/WK3WXjw2V3,United States,Russian,2016-12-07T09:08:00,2016-12-07T09:08:00,4763.0000000000,8701.0000000000,1363.0000000000,,False
WhiteHouseCards,Could Be Trump! https://t.co/A2t8JAk8L9,United States,English,2016-12-07T11:29:00,2016-12-07T11:29:00,4763.0000000000,8702.0000000000,1365.0000000000,,False
WhiteHouseCards,"Дональд Трамп: ""Когда твою фотографию помещают на обложку журнала Time - это огромная честь"" https://t.co/yT67L5ZSL9",,Russian,2016-12-08T08:30:00,2016-12-08T14:35:00,4764.0000000000,8706.0000000000,1377.0000000000,,False
WhiteHouseCards,"Отдых Обамы на Гавайях обошелся налогоплательщикам США в $1,2 млн https://t.co/xuGV9CRq9c",United States,Russian,2016-12-08T09:14:00,2016-12-08T09:14:00,4764.0000000000,8705.0000000000,1375.0000000000,,False
WhiteHouseCards,Сегодня американская певица Ники Минаж празднует свой день рождения. https://t.co/G1YRfERLt8,,Russian,2016-12-08T15:09:00,2016-12-08T18:14:00,4764.0000000000,8706.0000000000,1379.0000000000,,False
WhiteHouseCards,"В самом начале своей истории Соединенные Штаты Америки состояли из 13 колоний, объявивших свою независимость от Великобритании. https://t.co/jbEk7vkPgj",,Russian,2016-12-09T08:34:00,2016-12-10T05:23:00,4762.0000000000,8709.0000000000,1389.0000000000,,False
WhiteHouseCards,"Трамп взял Белый Дом, потратив меньше денег, чем Клинтон https://t.co/23g9yiqdwt",United States,Russian,2016-12-09T16:49:00,2016-12-09T16:49:00,4763.0000000000,8704.0000000000,1385.0000000000,,False
WhiteHouseCards,Барак Обама появится на Daily Show With Trevor Noah в понедельник https://t.co/TulYEhr6eo,United States,Russian,2016-12-09T17:43:00,2016-12-09T17:43:00,4763.0000000000,8706.0000000000,1387.0000000000,,False
WhiteHouseCards,Огни Нью-Йорка... https://t.co/f1bxZFQWAo,,Russian,2016-12-10T14:45:00,2016-12-10T16:32:00,4762.0000000000,8707.0000000000,1394.0000000000,,False
WhiteHouseCards,"Трамп признал, что обещал посадить Хиллари в тюрьму только ради шоу https://t.co/aSiO2d0D6D",,Russian,2016-12-10T15:30:00,2016-12-10T16:54:00,4762.0000000000,8707.0000000000,1394.0000000000,,False
WhiteHouseCards,Руди Джулиани не станет частью администрации Трампа https://t.co/EhUx22hXDo,,Ukrainian,2016-12-10T16:30:00,2016-12-10T20:00:00,4762.0000000000,8713.0000000000,1395.0000000000,,False
WhiteHouseCards,"Законодатели Огайо разрешили скрытое ношение оружия в колледжах, дневных стационарах и на личных самолетах https://t.co/NZ3EtnxbwE",,Russian,2016-12-10T17:30:00,2016-12-11T03:48:00,4762.0000000000,8712.0000000000,1395.0000000000,,False
WhiteHouseCards,Доброе утро! https://t.co/6eDhP8KxL1,United States,Macedonian,2016-12-11T07:35:00,2016-12-11T07:35:00,4762.0000000000,8712.0000000000,1396.0000000000,,False
WhiteHouseCards,"В Сенате США разошлись во мнениях по поводу возможного назначения главы Exxon Mobil Тиллерсона госсекретарем ""из-за его связей с Россией"" https://t.co/liOo2Ljoq6",United States,Russian,2016-12-11T08:25:00,2016-12-11T08:25:00,4762.0000000000,8712.0000000000,1397.0000000000,,False
WhiteHouseCards,Идея для новой прически Трампа https://t.co/uHA13jEP0o,,Russian,2016-12-11T09:28:00,2016-12-12T01:19:00,4762.0000000000,8713.0000000000,1403.0000000000,,False
WhiteHouseCards,Свежая обложка британского журнала The Spectator https://t.co/Xfm8CmJFNo,United States,Ukrainian,2016-12-11T11:00:00,2016-12-11T11:00:00,4762.0000000000,8713.0000000000,1399.0000000000,,False
WhiteHouseCards,Бэтмен или Дьявол? https://t.co/hSlX046WlO,,Russian,2016-12-11T16:36:00,2016-12-11T18:36:00,4762.0000000000,8714.0000000000,1403.0000000000,,False
WhiteHouseCards,"Доброе утро! ""если бы 2016 год был пивом"" https://t.co/tWCFIOFXH4",United States,Russian,2016-12-12T06:32:00,2016-12-12T06:32:00,4762.0000000000,8715.0000000000,1404.0000000000,,False
WhiteHouseCards,"Это не моя вина, господин офицер. Русские хакеры взломали мой спидометр! https://t.co/iwQGdMBvVZ",,Russian,2016-12-12T11:38:00,2016-12-12T11:39:00,4762.0000000000,8713.0000000000,1406.0000000000,,False
WhiteHouseCards,Твит Трампа о самолётах F-35 снизил стоимость компании Lockheed Martin на $2 млрд. https://t.co/TeLXNQuxSm,United States,Russian,2016-12-12T15:46:00,2016-12-12T15:46:00,4763.0000000000,8713.0000000000,1409.0000000000,,False
WhiteHouseCards,"Пекин серьёзно обеспокоен тем, что Трамп ставит под сомнение «политику одного Китая» https://t.co/9cvMFqpCsW",United States,Russian,2016-12-12T17:45:00,2016-12-19T19:29:00,4753.0000000000,8798.0000000000,1468.0000000000,,False
WhiteHouseCards,Отвлекающий маневр Путина) https://t.co/W7F5dRAOyW,,Russian,2016-12-13T09:27:00,2016-12-13T15:13:00,4763.0000000000,8713.0000000000,1417.0000000000,,False
WhiteHouseCards,Трамп решил назначить госсекретарем США главу нефтяной компании ExxonMobil Рекса Тиллерсона https://t.co/DVdFlYcMWU,United States,Russian,2016-12-13T11:33:00,2016-12-13T11:33:00,4763.0000000000,8714.0000000000,1415.0000000000,,False
WhiteHouseCards,"Дженнифер Лоуренс закрасила автобус с лицом Криса Пратта, который закрывал её на фотографиях https://t.co/AJ9BWZf2Pg",,Ukrainian,2016-12-13T13:24:00,2016-12-17T09:31:00,4756.0000000000,8756.0000000000,1445.0000000000,,False
WhiteHouseCards,"Эндрю Джексон был единственным президентом США, считавшим планету плоской https://t.co/hpwCGPX37Y",,Russian,2016-12-14T12:51:00,2016-12-14T12:54:00,4758.0000000000,8709.0000000000,1422.0000000000,,False
WhiteHouseCards,"Американская гимнастка, четырёхкратная олимпийская чемпионка Симоне Байлс стала женщиной года по версии журнала espnW https://t.co/rwHMoEExAf",,Russian,2016-12-14T13:59:00,2016-12-14T14:02:00,4758.0000000000,8710.0000000000,1423.0000000000,,False
WhiteHouseCards,Home Insurance Building - первый с мире небоскреб (10 этажей). Построен в 1885 году в Чикаго https://t.co/63xRpl98Lg,United States,Russian,2016-12-14T14:29:00,2016-12-14T14:29:00,4758.0000000000,8710.0000000000,1424.0000000000,,False
WhiteHouseCards,"Профессор из Гарварда утверждает, что 20 выборщиков могут изменить свои голоса, отданные на выборах за Трампа https://t.co/bevNMMlyVV",United States,Russian,2016-12-14T20:25:00,2016-12-14T20:25:00,4758.0000000000,8716.0000000000,1426.0000000000,,False
WhiteHouseCards,Американские СМИ заявили о личном участии Путина в кибератаках во время предвыборной кампании в США https://t.co/iaiQ9rm9pN,,Russian,2016-12-15T09:07:00,2016-12-15T09:52:00,4757.0000000000,8712.0000000000,1429.0000000000,,False
WhiteHouseCards,"The Huffington Post утверждает, что рейтинг поддержки Владимира Путина среди американских республиканцев поднялся на 56 пунктов https://t.co/6K3ltCIhdc",United States,Russian,2016-12-15T11:03:00,2016-12-15T11:03:00,4757.0000000000,8712.0000000000,1430.0000000000,,False
WhiteHouseCards,Сервис YouTube собрал итоги 2016 года в одном видео! https://t.co/jJn4m0NsYW,United States,Russian,2016-12-15T12:03:00,2016-12-15T12:03:00,4757.0000000000,8712.0000000000,1431.0000000000,,False
WhiteHouseCards,Известную журналистку Юлию Иоффе сегодня ночью уволили из издания Politico за твит про президента Трампа и его дочь Иванку https://t.co/HhJAnN6jQF,United States,Russian,2016-12-15T13:16:00,2016-12-15T13:16:00,4757.0000000000,8713.0000000000,1432.0000000000,,False
WhiteHouseCards,Трамп назначил Илона Маска советником по экономике https://t.co/bkxGMpZPV0,,Russian,2016-12-15T16:45:00,2016-12-15T16:50:00,4757.0000000000,8720.0000000000,1435.0000000000,,False
WhiteHouseCards,В англоязычном интернете набирает популярность новый мем #russiansdidit https://t.co/vwTHbaiu15,,Russian,2016-12-16T09:20:00,2016-12-16T10:04:00,4758.0000000000,8720.0000000000,1437.0000000000,,False
WhiteHouseCards,"2004 год. Неизвестный парень по имени Марк Цукерберг рассказывает о новом интернет-проекте - ""социальная сеть"" https://t.co/yvRublxoE2",United States,Russian,2016-12-16T10:22:00,2016-12-16T10:22:00,4758.0000000000,8720.0000000000,1438.0000000000,,False
WhiteHouseCards,"Вот такие наклейки появились в некоторых регионах США, Полиция пытается с ними бороться https://t.co/k7tfJDxEDR",,Russian,2016-12-16T12:36:00,2016-12-16T12:52:00,4758.0000000000,8723.0000000000,1440.0000000000,,False
WhiteHouseCards,"Доброе утро! В Нью-Йорке пьют кофе в 7 раз больше, чем в других городах США https://t.co/mYDBhQeaGJ",,Russian,2016-12-17T07:32:00,2016-12-17T09:11:00,4756.0000000000,8755.0000000000,1445.0000000000,,False
WhiteHouseCards,Каждый день в США съедают около 40 гектар пиццы https://t.co/xAqPQ9mELo,,Russian,2016-12-17T08:06:00,2016-12-17T08:14:00,4756.0000000000,8751.0000000000,1445.0000000000,,False
WhiteHouseCards,"Трамп назвал ""глупым"" пресс-секретаря Белого дома https://t.co/QTHmVZtq6n",,Russian,2016-12-17T11:08:00,2016-12-17T11:26:00,4756.0000000000,8759.0000000000,1446.0000000000,,False
WhiteHouseCards,"ФБР подтверждает теорию ЦРУ о том, что Россия хотела помочь Трампу победить https://t.co/y4dYdFqfGw",,Russian,2016-12-17T15:43:00,2016-12-17T16:06:00,4756.0000000000,8765.0000000000,1448.0000000000,,False
WhiteHouseCards,На данный момент в Америке не имеют медицинской страховки более 49 миллионов американских граждан. https://t.co/JwAkyRbhmM,United States,Russian,2016-12-17T17:16:00,2016-12-17T17:17:00,4756.0000000000,8763.0000000000,1449.0000000000,,False
WhiteHouseCards,"Мальчик с лейкемией пожелал стать супер-героем и стал им, с помощью добрых людей https://t.co/QldXcQMQEk",United States,Russian,2016-12-17T18:53:00,2016-12-17T18:54:00,4756.0000000000,8765.0000000000,1450.0000000000,,False
WhiteHouseCards,Доброе утро! Французский квартал в Новом Орлеане https://t.co/UpgI48F0Rl,,Russian,2016-12-18T07:24:00,2016-12-18T10:38:00,4755.0000000000,8771.0000000000,1453.0000000000,,False
WhiteHouseCards,"Содержание заключенных в Гуантанамо, обходится правительству США в 2 768 902 $ в год https://t.co/Xt3adV4QqT",United States,Russian,2016-12-18T08:09:00,2016-12-18T08:09:00,4755.0000000000,8771.0000000000,1452.0000000000,,False
WhiteHouseCards,"Рекордно число американцев подало заявку на Obamacare в связи с тем, что республиканцы обещают отменить этот закон https://t.co/T95gvOZuv6",United States,Russian,2016-12-18T09:43:00,2016-12-18T09:44:00,4755.0000000000,8771.0000000000,1453.0000000000,,False
WhiteHouseCards,"Трамп: ""Мишель Обама заявила, что надежды больше нет. Я так понимаю,что она говорила о прошлом, не о будущем.У нас,есть надежды и потенциал"" https://t.co/DLvVKK0GCn",,Russian,2016-12-18T11:21:00,2016-12-18T11:42:00,4755.0000000000,8771.0000000000,1455.0000000000,,False
WhiteHouseCards,"В Saturday Night Live показали пародию на фильм Реальная Любовь. Хиллари Клинтон, призывает коллегию выборщиков не голосовать за Трампа https://t.co/XKNyuRDXpd",,Russian,2016-12-18T15:46:00,2016-12-18T17:54:00,4754.0000000000,8779.0000000000,1457.0000000000,,False
WhiteHouseCards,"«Мы только кажемся себе цивилизованными. На самом деле мир жесток, а люди безжалостны"" - Дональд Джон Трамп, 45й президент США https://t.co/8saElEWQ3z",,Russian,2016-12-19T09:04:00,2016-12-19T10:13:00,4753.0000000000,8790.0000000000,1460.0000000000,,False
WhiteHouseCards,Сегодня состоится голосование Коллегии Выборщиков США. Многие выборщики получали письма с призывом не голосовать за Трампа https://t.co/rU3PwkP0GW,,Russian,2016-12-19T11:11:00,2016-12-19T23:57:00,4753.0000000000,8797.0000000000,1471.0000000000,,False
WhiteHouseCards,Появился тизер третьего сезона сериала «Твин Пикс»! В ролике режиссер сериала Дэвид Линч ест пончик https://t.co/uU4wVyPLlC,,Russian,2016-12-19T13:45:00,2016-12-19T13:50:00,4753.0000000000,8795.0000000000,1463.0000000000,,False
WhiteHouseCards,"Берни Сандерс - первый еврей, получивший голос президентского выборщика в США https://t.co/wnf0gIUqwo",United States,Russian,2016-12-19T20:08:00,2016-12-19T20:08:00,4753.0000000000,8798.0000000000,1469.0000000000,,False
WhiteHouseCards,Гости Конгресса Техаса вывесили российский флаг во время голосования Коллегии выборщиков. Тонкий троллинг? https://t.co/iQ0X0z0Pn0,,Russian,2016-12-20T07:06:00,2016-12-20T09:31:00,4753.0000000000,8798.0000000000,1473.0000000000,,False
WhiteHouseCards,"Ничего необычного, просто бородатый Трамп https://t.co/8PAdWKaN7S",,Russian,2016-12-20T08:25:00,2016-12-20T08:29:00,4753.0000000000,8797.0000000000,1473.0000000000,,False
WhiteHouseCards,Кто кроме Трампа и Клинтон получили голоса Коллегии выборщиков https://t.co/2sL9qKJhUz,United States,Russian,2016-12-20T09:33:00,2016-12-20T09:33:00,4753.0000000000,8798.0000000000,1474.0000000000,,False
WhiteHouseCards,"FOX News сообщают, что никто из селебретиз, обещавших уехать в Канаду при победе Трампа туда и не уехали. Зато уехали 28 простых американцев https://t.co/7IJjeaCruY",United States,Russian,2016-12-20T11:29:00,2016-12-20T11:29:00,4753.0000000000,8798.0000000000,1476.0000000000,,False
WhiteHouseCards,Это одновременно и очень смешно и очень жутко � https://t.co/IGJUnNv9sh,,Russian,2016-12-20T13:22:00,2016-12-20T16:59:00,4753.0000000000,8810.0000000000,1481.0000000000,,False
WhiteHouseCards,Официальное заявление Дональда Трампа по поводу убийства посла России в Турции https://t.co/xaz1pNnVLp,United States,Russian,2016-12-20T14:17:00,2016-12-20T14:19:00,4753.0000000000,8800.0000000000,1479.0000000000,,False
WhiteHouseCards,The New York Times: попытки убедить выборщиков не голосовать за Трампа провалились - больше бесчестных выборщиков оказалось у Демократов https://t.co/dYhHuoABBM,United States,Russian,2016-12-20T17:18:00,2016-12-20T17:18:00,4753.0000000000,8812.0000000000,1482.0000000000,,False
WhiteHouseCards,"Американский Минфин опубликовал заявление о том, что США вновь продлили санкции против Москвы «в связи ситуацией на Украине». https://t.co/9kwTBnL98S",United States,Russian,2016-12-20T21:39:00,2016-12-20T21:39:00,4752.0000000000,8810.0000000000,1483.0000000000,,False
WhiteHouseCards,"Доброе утро! Налоговый кодекс США насчитывает 5000 страниц, в то время как Библия и ""Война и мир"" - около 4500 страниц https://t.co/McHqIaByDY",United States,Russian,2016-12-21T07:13:00,2016-12-21T07:14:00,4752.0000000000,8813.0000000000,1484.0000000000,,False
