author_id,content,region,language,publish_date,harvested_date,following,followers,updates,post_type,retweet
WhiteHouseCards,"Правительство направило в Твиттер требование раскрыть личность хозяина аккаунта,критикующего Трампа. Твиттер отказал(закон о свободе слова). https://t.co/FrGZO9zV6H",United States,Russian,2017-04-08T14:16:00,2017-04-08T22:39:00,5396.0000000000,10209.0000000000,2392.0000000000,,False
WhiteHouseCards,"Офицер военно-морских сил США : ""Я не присоединяюсь к военно- морскому флоту для борьбы за Аль Каиду в гражданской войне в Сирии"" https://t.co/Zb9HnO5tvc",United States,Ukrainian,2017-04-09T08:23:00,2017-04-09T08:24:00,5395.0000000000,10210.0000000000,2393.0000000000,,False
WhiteHouseCards,"Человек, который сказал, что марихуана заставила его убить свою жену получил срок в 30 лет https://t.co/6ax0r6rPEQ",United States,Russian,2017-04-09T14:15:00,2017-04-09T14:18:00,5395.0000000000,10211.0000000000,2396.0000000000,,False
WhiteHouseCards,Пейзажи уходящие в небо от Aydın Buyuktas.  Турецкий фотограф и дизайнер создает картины переворачивающие воображение https://t.co/BPMG4azWfi,United States,Russian,2017-04-09T14:57:00,2017-04-09T17:18:00,5395.0000000000,10211.0000000000,2398.0000000000,,False
WhiteHouseCards,"В Далласе хакер получил удалённый доступ ко всем сиренам безопасности города и включил их на полную громкость на 1,5 часа в ночь на субботу https://t.co/L7OrI50njj",United States,Russian,2017-04-10T08:22:00,2017-04-10T08:35:00,5394.0000000000,10211.0000000000,2399.0000000000,,False
WhiteHouseCards,"Доктора, спешащего к пациентам, грубо сняли с рейса Чикаго-Луисвилл, т.к. в самолете было продано больше мест, чем он мог вместить https://t.co/E97WC4ZKxG",United States,Russian,2017-04-10T11:52:00,2017-04-10T12:02:00,5394.0000000000,10214.0000000000,2400.0000000000,,False
WhiteHouseCards,Голливудские звезды в метро https://t.co/XFstCrY2Y9,United States,Russian,2017-04-10T15:00:00,2017-04-10T15:01:00,5394.0000000000,10214.0000000000,2401.0000000000,,False
WhiteHouseCards,"Для хорошего настроения на весь день: Пародия с мопсами на ""Теорию большого взрыва"" https://t.co/2xqpcGELrL",United States,Russian,2017-04-11T08:43:00,2017-04-11T14:47:00,5393.0000000000,10217.0000000000,2410.0000000000,,False
WhiteHouseCards,Уолт Дисней в Диснейлэнде https://t.co/EDyonl1Gzb,United States,Russian,2017-04-11T11:23:00,2017-04-11T11:23:00,5393.0000000000,10219.0000000000,2407.0000000000,,False
WhiteHouseCards,"Обложка журнала Sports Illustrated, 1960 год https://t.co/h12rDvMApD",United States,Russian,2017-04-11T12:42:00,2017-04-11T12:42:00,5393.0000000000,10217.0000000000,2408.0000000000,,False
WhiteHouseCards,Господин Трамп назвал господина Асада животным и призвал господина Путина не прикрывать его https://t.co/MaRyKohU0d,United States,Russian,2017-04-12T09:33:00,2017-04-12T10:40:00,5393.0000000000,10226.0000000000,2412.0000000000,,False
WhiteHouseCards,"Видео c пассажиром китайского происхождения, силой вытащенного из самолета, стало вирусным в Китае https://t.co/bTSFPUMsE2",United States,Russian,2017-04-12T12:07:00,2017-04-12T12:07:00,5393.0000000000,10225.0000000000,2413.0000000000,,False
WhiteHouseCards,"Женщина из Южной Каролины приютила опоссума, чтобы временно позаботиться о нём.  Но они так подружились,что зверек остался в семье насовсем https://t.co/AakHG3wFcf",United States,Russian,2017-04-12T14:01:00,2017-04-12T20:03:00,5391.0000000000,10231.0000000000,2416.0000000000,,False
WhiteHouseCards,Первая женщина судья мусульманка Шелия Абдус-Салам найдена мёртвой на берегу реки Гудзон https://t.co/X22m4dMoQH,United States,Russian,2017-04-13T10:00:00,2017-04-13T10:33:00,5389.0000000000,10232.0000000000,2418.0000000000,,False
WhiteHouseCards,Дональд Трамп: Си Цзиньпин дал мне хороший урок истории по Северной и Южной Кореям https://t.co/5eqDoMLPN3,United States,Russian,2017-04-13T13:57:00,2017-04-13T14:01:00,5389.0000000000,10236.0000000000,2420.0000000000,,False
WhiteHouseCards,United Airlines больше не будет использовать полицию https://t.co/JDZESPCG1C,United States,Russian,2017-04-13T16:22:00,2017-04-13T16:23:00,5389.0000000000,10239.0000000000,2422.0000000000,,False
WhiteHouseCards,13-летний подросток случайно убил себя из пистолета во время прямой трансляции https://t.co/oqGh42hhXb,United States,Russian,2017-04-13T17:00:00,2017-04-13T17:26:00,5389.0000000000,10239.0000000000,2423.0000000000,,False
WhiteHouseCards,В Колорадо открывается первая в мире Международная церковь конопли. Члены движения познают таинства жизни через ритуальное курение травки https://t.co/8hIP2L2JRB,United States,Russian,2017-04-14T08:19:00,2017-04-14T08:31:00,5388.0000000000,10244.0000000000,2426.0000000000,,False
WhiteHouseCards,"Врач из Детройта обвиняется в выполнении незаконных операций по женскому обрезанию, она проводила их с 2005 года Ее жертвы - девочки 6-8 лет https://t.co/nU2TppqfXV",United States,Russian,2017-04-14T11:53:00,2017-04-14T11:53:00,5388.0000000000,10244.0000000000,2427.0000000000,,False
WhiteHouseCards,Сегодня студия Lucasfilm официально отмечает 40-летие саги «Звездные войны» Во время шоу будут представлены материалы новых фильмов франшизы https://t.co/evNOg8VY6i,United States,Russian,2017-04-14T12:48:00,2017-04-14T12:48:00,5388.0000000000,10245.0000000000,2429.0000000000,,False
WhiteHouseCards,"Как сообщает Минобороны США в своём твиттере, именно это видео вчерашнего взрыва «матери всех бомб» в Афганистане https://t.co/6RMj7THMHu",United States,Russian,2017-04-14T13:07:00,2017-04-14T19:21:00,5388.0000000000,10246.0000000000,2438.0000000000,,False
WhiteHouseCards,4-летняя девочка чудом выжила при обстреле парикмахерской в Аризоне https://t.co/OquBn7c5eH,United States,Russian,2017-04-14T13:44:00,2017-04-14T13:45:00,5388.0000000000,10244.0000000000,2431.0000000000,,False
WhiteHouseCards,"Поисковая система Google зафиксировала рекордное число запросов, связанных с третьей мировой войной. https://t.co/AocyFkQD0v",United States,Russian,2017-04-14T15:19:00,2017-04-14T15:21:00,5388.0000000000,10245.0000000000,2434.0000000000,,False
WhiteHouseCards,Paramount занялась сиквелом своего хита 1988 года «Поездка в Америку». Эдди Мёрфи вернется в продолжении в образе принца Акима. https://t.co/wIPDJUJJiU,United States,Russian,2017-04-14T18:04:00,2017-04-14T18:04:00,5388.0000000000,10248.0000000000,2438.0000000000,,False
WhiteHouseCards,В ночь с 14 на 15 апреля 1912г. произошло одно из самых страшных кораблекрушений  — затонул пароход «Титаник». Погибло более 1500 человек https://t.co/gQpQem9oYA,United States,Russian,2017-04-14T20:13:00,2017-04-14T20:14:00,5388.0000000000,10247.0000000000,2439.0000000000,,False
WhiteHouseCards,"За время президентства Трамп провел уже более 63 часов в гольф-клубах. Это вызвало критику, т.к. его досуг финансируется налогоплательщиками https://t.co/gEqmyHA7hv",United States,Russian,2017-04-15T09:13:00,2017-04-15T10:49:00,5389.0000000000,10253.0000000000,2440.0000000000,,False
WhiteHouseCards,Дональд Трамп в ходе официального визита в Лондон желает проехаться по городу на золотой карете королевы Великобритании Елизаветы II. https://t.co/Wu7egzp8y9,United States,Russian,2017-04-16T08:49:00,2017-04-16T08:51:00,5389.0000000000,10253.0000000000,2443.0000000000,,False
WhiteHouseCards,Один из основателей Интернета и персонального компьютера — Роберт Тейлор скончался от болезни Паркинсона в Сан-Франциско в возрасте 85 лет. https://t.co/V6d35VYr0x,United States,Russian,2017-04-16T12:30:00,2017-04-16T12:31:00,5388.0000000000,10254.0000000000,2446.0000000000,,False
WhiteHouseCards,"Bloomberg провело масштабное исследование подписчиков президента США в Твиттере: порядка 7,5 миллионов аккаунтов из почти 28 миллионов боты. https://t.co/xQKC4ZfMpC",United States,Russian,2017-04-16T15:30:00,2017-04-16T15:30:00,5387.0000000000,10254.0000000000,2449.0000000000,,False
WhiteHouseCards,"Самая горячая кофейня Bikini Beans Espresso, открылась в городке Кент неподалеку от Сиэтла, где работают бикини-бариста https://t.co/C3G71inZj7",United States,Russian,2017-04-17T08:10:00,2017-04-17T08:10:00,5387.0000000000,10253.0000000000,2450.0000000000,,False
WhiteHouseCards,Толерантность в США доведена до абсурда.Сегодня CNN поменяли цвет кожи подозреваемого в убийстве прохожего из Кливленда с темного на светлый https://t.co/CmVV0aXf06,United States,Russian,2017-04-17T09:35:00,2017-04-17T09:36:00,5387.0000000000,10255.0000000000,2451.0000000000,,False
WhiteHouseCards,"Ничего необычного, просто аллигатор решил искупаться в бассейне одного из частных домов в городке Форт- Лодердейл. Welcome to Florida. https://t.co/URiA7y8zrJ",United States,Russian,2017-04-17T12:27:00,2017-04-17T12:27:00,5388.0000000000,10260.0000000000,2456.0000000000,,False
WhiteHouseCards,"Несмотря на показания свидетелей, с тюремных охранников, которые заживо сварили душевнобольного чернокожего в кипятке, обвинения были сняты https://t.co/dbrMswrCeA",United States,Russian,2017-04-17T16:08:00,2017-04-17T16:09:00,5386.0000000000,10260.0000000000,2459.0000000000,,False
WhiteHouseCards,"Во время пасхальной церемонии в Белом доме Трамп забыл положить руку на сердце во время гимна США, его супруга Меланья напомнила ему об этом https://t.co/te92MHjqI7",United States,Russian,2017-04-17T17:53:00,2017-04-17T17:55:00,5386.0000000000,10259.0000000000,2460.0000000000,,False
WhiteHouseCards,"Пресс-секретарь Белого дома Шон Спайсер заявил,что не смотрит пародии на себя в шоу Saturday Night Live,где его изображает Мелисса Маккарти https://t.co/3ETXhsV8JV",United States,Russian,2017-04-17T19:17:00,2017-04-17T19:17:00,5386.0000000000,10258.0000000000,2461.0000000000,,False
WhiteHouseCards,"Главный офицер спецподразделения морской пехоты США Джозеф Джон Шмидт III вел двойную жизнь, работая по совместительству порноактером https://t.co/iVGaGuDTww",United States,Russian,2017-04-17T19:21:00,2017-04-17T20:18:00,5386.0000000000,10258.0000000000,2464.0000000000,,False
WhiteHouseCards,"Ричард Диарлав, бывший глава MI6: ""Трамп одалживал деньги у России в 2008г.,чтобы поддержать свою империю недвижимости из-за кризиса"" https://t.co/BIlF8ZIgxY",United States,Russian,2017-04-17T19:30:00,2017-04-17T19:31:00,5386.0000000000,10258.0000000000,2464.0000000000,,False
WhiteHouseCards,"Трамп подпишет указ об ужесточении правил выдачи рабочих виз в соответствии с документом «Покупай американское, нанимай американцев» https://t.co/zWjgcJqKxJ",United States,Russian,2017-04-18T12:32:00,2017-04-18T16:17:00,5389.0000000000,10263.0000000000,2468.0000000000,,False
WhiteHouseCards,"Уточняющие титры: ""Президент Соединенных Штатов (слева), поприветствовал...."" https://t.co/5XK97di9FM",United States,Russian,2017-04-18T13:50:00,2017-04-18T16:07:00,5389.0000000000,10259.0000000000,2468.0000000000,,False
WhiteHouseCards,На музыкальном фестивале Coachella посетитель за день украл больше 100 смартфонов. Подозреваемый был освобождён под залог в размере 10 тыс.$ https://t.co/UPNmp1RjKe,United States,Russian,2017-04-18T16:56:00,2017-04-18T16:56:00,5389.0000000000,10265.0000000000,2469.0000000000,,False
WhiteHouseCards,The Washington Post: стремлению Трампа построить хорошие отношения с Россией мешают члены его собственной администрации https://t.co/13kkea0JYJ,United States,Russian,2017-04-19T09:33:00,2017-04-19T09:33:00,5388.0000000000,10259.0000000000,2471.0000000000,,False
WhiteHouseCards,В ходе трансляции на канале MSNBC за спиной председателя Национального комитета Демпартии Тома Переса после слов о Клинтон рухнул флаг США https://t.co/1N4WCjHeNL,United States,Russian,2017-04-19T10:24:00,2017-04-19T10:24:00,5387.0000000000,10261.0000000000,2472.0000000000,,False
WhiteHouseCards,"«Поздравляем, вы пережили Бостонский марафон», - Adidas сделал почтовую рассылку его участникам. Письмо поняли буквально и очень разозлились https://t.co/GuMnIbRyWv",United States,Russian,2017-04-19T12:50:00,2017-04-19T12:51:00,5386.0000000000,10259.0000000000,2473.0000000000,,False
WhiteHouseCards,Ведущий Fox News Билл О'Райли уволен с телеканала в связи с обвинениями в сексуальных домогательствах. https://t.co/oXzzz6ZRO8,United States,Russian,2017-04-20T08:13:00,2017-04-20T08:13:00,5386.0000000000,10261.0000000000,2475.0000000000,,False
WhiteHouseCards,"Военная База США закрыта, из-за того, что 64 солдата арестованы по подозрению в преступлениях связанных с употреблением кокаина. https://t.co/tCNebPXMIs",United States,Russian,2017-04-20T11:32:00,2017-04-20T11:58:00,5386.0000000000,10263.0000000000,2477.0000000000,,False
WhiteHouseCards,DOW Chemicals жертвует 1 млн долларов Трампу с просьбой игнорировать исследования вредных пестицидов. https://t.co/X2gGxrK7ja,United States,Russian,2017-04-21T08:49:00,2017-04-21T08:49:00,5383.0000000000,10263.0000000000,2481.0000000000,,False
WhiteHouseCards,Около 15 000 человек собрались в четверг в парке «Золотые ворота» отпраздновать 20 апреля  – международный день курения марихуаны. https://t.co/Jljl7ylRuc,United States,Russian,2017-04-21T09:33:00,2017-04-21T09:37:00,5383.0000000000,10264.0000000000,2482.0000000000,,False
WhiteHouseCards,"F❤️LLOW ME!  Telegram WhiteHouseCards - https://t.co/A9aHUWTCrr Все,что вы хотели знать о США🇺🇸, но боялись спросить ! https://t.co/vBfyMhYjai",United States,Russian,2017-04-21T14:55:00,2017-04-21T15:07:00,5382.0000000000,10263.0000000000,2485.0000000000,,False
WhiteHouseCards,"В штате Орегон продается городок Тиллер: 6 домов, магазин, бензоколонка, почта, права на распоряжение инфраструктурой.  Цена - 3,5 млн.$ https://t.co/fCLGi9SLiA",United States,Russian,2017-04-23T11:43:00,2017-04-23T11:48:00,5379.0000000000,10281.0000000000,2489.0000000000,,False
WhiteHouseCards,"В американских соц.сетях набирает популярность тренд ""Коты, которые заслужили Оскар"" https://t.co/YY8FICo82L",United States,Russian,2017-04-23T12:24:00,2017-04-23T12:28:00,5379.0000000000,10281.0000000000,2491.0000000000,,False
WhiteHouseCards,"Подросток из штата Орегон основал компанию, которая теперь приносит $1 млн. в год и занимается производством дизайнерских носков https://t.co/xKlXXw7mIe",United States,Russian,2017-04-23T13:22:00,2017-04-23T13:22:00,5379.0000000000,10282.0000000000,2492.0000000000,,False
WhiteHouseCards,"'-""Глобальное потепление- это обман!"" -""Хватит!"" https://t.co/Kdt9xh4p6V'",United States,Russian,2017-04-23T15:05:00,2017-04-23T15:05:00,5379.0000000000,10283.0000000000,2494.0000000000,,False
WhiteHouseCards,Бывший мэр Нью-Йорка Майкл Блумберг призвал мировых лидеров не слушать Трампа в вопросах глобального потепления https://t.co/P6kxXfeZnG,United States,Russian,2017-04-24T08:51:00,2017-04-24T08:54:00,5378.0000000000,10294.0000000000,2496.0000000000,,False
WhiteHouseCards,"В Новом-Орлеане начнут сносить памятники конфедератам. Многие посчитали, что это прошлое не имеет право на существование в современных США https://t.co/DTw8P7LlzA",United States,Russian,2017-04-24T09:45:00,2017-04-24T09:48:00,5378.0000000000,10295.0000000000,2499.0000000000,,False
WhiteHouseCards,"Реставрация монумента Аврааму Линкольну на горе Рашмор, июнь 1962 https://t.co/y3f5cAij6w",United States,Russian,2017-04-24T10:20:00,2017-04-24T10:20:00,5378.0000000000,10295.0000000000,2500.0000000000,,False
WhiteHouseCards,Коренные американцы. Фотографии начала 20 века https://t.co/orQUhmMDJs,United States,Russian,2017-04-24T10:36:00,2017-04-24T10:54:00,5378.0000000000,10294.0000000000,2502.0000000000,,False
WhiteHouseCards,"Фото кусочков фильмов в реальных местах, где они снимались https://t.co/qoYX3WLgWb",United States,Russian,2017-04-24T13:17:00,2017-04-24T13:30:00,5378.0000000000,10297.0000000000,2511.0000000000,,False
WhiteHouseCards,Очередной скандал в американской авиации.На этот раз на полете American Airlines. Стюард отнял у женщины коляску и ругался с пассажирами https://t.co/ghEeDeKio2,United States,Russian,2017-04-24T13:23:00,2017-04-24T13:23:00,5378.0000000000,10297.0000000000,2510.0000000000,,False
WhiteHouseCards,Администрация Трампа наложила финансовые санкции  на служащих Сирийского научно-исследовательского центра. https://t.co/8825FG8Pwy,United States,Russian,2017-04-25T09:04:00,2017-04-25T09:05:00,5378.0000000000,10310.0000000000,2515.0000000000,,False
WhiteHouseCards,Трамп закрывает сайт Агентства по охране окружающей среды США https://t.co/PcAqL22KIB,United States,Russian,2017-04-25T10:46:00,2017-04-25T10:46:00,5378.0000000000,10310.0000000000,2516.0000000000,,False
WhiteHouseCards,"Все 100 американских сенаторов завтра приглашены в Белый дом на конфиденциальный брифинг, который будет в основном посвящен Северной Корее. https://t.co/4PRJYvEKVb",United States,Russian,2017-04-25T17:14:00,2017-04-25T17:15:00,5377.0000000000,10311.0000000000,2517.0000000000,,False
WhiteHouseCards,Арнольд Шварценеггер разрезает ленточку в своём непревзойдённом стиле https://t.co/qG83VmGWvx,United States,Russian,2017-04-26T14:55:00,2017-04-26T17:25:00,5374.0000000000,10298.0000000000,2522.0000000000,,False
WhiteHouseCards,Согласно исследованию Climate Central к 2100-ому году более 12 млн. граждан останутся без жилья из-за глобаного потепления https://t.co/taXAg0TMZJ,United States,Russian,2017-04-27T09:24:00,2017-04-27T09:24:00,5373.0000000000,10291.0000000000,2523.0000000000,,False
WhiteHouseCards,В Калифорнийском университете в Беркли открыли шестинедельный летний курс «Лингвистика „Игры Престолов“ и искусство создания языков» https://t.co/19w7SBnh0p,United States,Russian,2017-04-27T11:48:00,2017-04-27T13:15:00,5372.0000000000,10289.0000000000,2524.0000000000,,False
WhiteHouseCards,"На открытке, которой Трамп поздравил Первую Леди всего 39 звёзд на флаге, а штатов, которые эти звёзды символизируют, 50 https://t.co/FqDj9Q7cPY",United States,Russian,2017-04-27T14:44:00,2017-04-27T15:59:00,5372.0000000000,10289.0000000000,2525.0000000000,,False
WhiteHouseCards,"IBM патентует технологию, по которой дроны смогут передавать грузы другим дронам, чтобы увеличить площадь покрытия доставки https://t.co/l21qXVUHWh",United States,Russian,2017-04-27T16:00:00,2017-04-27T16:00:00,5372.0000000000,10289.0000000000,2526.0000000000,,False
WhiteHouseCards,ExxonMobil проиграли юридическую борьбу с экологам. Техасский суд приказал компании выплатить штраф в размере 20 миллионов долларов. https://t.co/HrhEzbciWq,United States,Russian,2017-04-28T09:29:00,2017-04-28T09:29:00,5372.0000000000,10287.0000000000,2528.0000000000,,False
WhiteHouseCards,"Американский графический художник Andhika Muksin представил, что бы было если бы герои Disney жили в нашем мире... https://t.co/WPzZXiVjYu",United States,Russian,2017-04-28T15:26:00,2017-04-28T15:27:00,5372.0000000000,10286.0000000000,2530.0000000000,,False
WhiteHouseCards,В США появилась услуга по заказу лам и альпак на свадебную церемонию https://t.co/v6XOgTN9eQ,United States,Russian,2017-04-29T09:12:00,2017-04-29T09:43:00,5372.0000000000,10294.0000000000,2534.0000000000,,False
WhiteHouseCards,Министр иностранных дел Германии Зигмар Габриэль подверг критике назначение Иванки Трамп помощником президента США. https://t.co/GVcjWUd0rr,United States,Russian,2017-04-29T15:22:00,2017-04-29T15:24:00,5372.0000000000,10299.0000000000,2537.0000000000,,False
WhiteHouseCards,"В США врачи планируют провести сложнейшую операцию  6-летней Вирсавии Борун-Гончаровой, которая родилась с сердцем на внешней стороне груди. https://t.co/xKJs2fLj51",United States,Russian,2017-04-30T10:44:00,2017-04-30T13:06:00,5372.0000000000,10298.0000000000,2542.0000000000,,False
WhiteHouseCards,Веб-сайт Агентства  по охране окружающей среды США удаляет раздел с научными данными о климате из общественного доступа. https://t.co/6shsKCZUt8,United States,Russian,2017-04-30T13:09:00,2017-04-30T13:09:00,5372.0000000000,10298.0000000000,2543.0000000000,,False
