author_id,content,region,language,publish_date,harvested_date,following,followers,updates,post_type,retweet
WhiteHouseCards,Дональд Трамп одержал победу над Хиллари Клинтон по результатам последнего подсчета голосов  https://t.co/2J72USeYlk https://t.co/e4LEQHOkSf,Unknown,Russian,2016-05-15T09:33:00,2016-05-15T09:33:00,1001.0000000000,43.0000000000,3.0000000000,,False
WhiteHouseCards,Берни Сандерс подал петицию об отмене депортации нелегальных иммигрантов из США   https://t.co/iwj3AVpXjc https://t.co/O0AQkk8CjU,Unknown,Russian,2016-05-15T13:32:00,2016-05-15T13:32:00,1001.0000000000,49.0000000000,5.0000000000,,False
WhiteHouseCards,Активисты-республиканцы отдали предпочтению единству партии над движением За Трампа –Никогда  https://t.co/aMoj1AxEz6 https://t.co/PjWuKL05iB,Unknown,Russian,2016-05-15T15:05:00,2016-05-15T15:05:00,1001.0000000000,53.0000000000,6.0000000000,,False
WhiteHouseCards,"Трамп пообещал, что отношения с Лондоном не изменятся в случае выхода из ЕС  https://t.co/XqCQoYhYDr https://t.co/IhbhmbU7wT",Unknown,Russian,2016-05-15T15:54:00,2016-05-15T15:54:00,1001.0000000000,54.0000000000,7.0000000000,,False
WhiteHouseCards,Клинтон добивается расположения избирателей Кентукки за день до голосования  https://t.co/TPgqPOMT3J https://t.co/kLvnLqYeXo,Unknown,Russian,2016-05-16T11:34:00,2016-05-16T11:34:00,598.0000000000,56.0000000000,8.0000000000,,False
WhiteHouseCards,"Сторонники Трампа вывели в топ картинку по запросу ""Хиллари - Мощенница"" (""Crooked Hillary"") https://t.co/40xe1a2NIR",Unknown,Uzbek,2016-05-17T11:54:00,2016-05-17T11:55:00,598.0000000000,59.0000000000,11.0000000000,,False
WhiteHouseCards,"По результатам голосования избирателей штата Юта Трамп - фаворит, обошел Сандерса и Клинтон  https://t.co/gYl3qYCHZY https://t.co/zZwyaakMlJ",Unknown,Russian,2016-05-17T12:30:00,2016-05-17T12:30:00,598.0000000000,59.0000000000,12.0000000000,,False
WhiteHouseCards,Сторонники Берни Сандерса устроили виккантский ритуал в парке перед его выступлением   https://t.co/klivB6KX63 https://t.co/Kcv2NF1pOV,Unknown,Russian,2016-05-17T15:30:00,2016-05-17T15:30:00,598.0000000000,62.0000000000,16.0000000000,,False
WhiteHouseCards,"Хиллари Клинтон решила спародировать Трампа, выступая в Кентукки в понедельник  https://t.co/mGqChS6g8J https://t.co/F9JXhn6Gow",Unknown,Russian,2016-05-17T16:30:00,2016-05-17T16:30:00,598.0000000000,63.0000000000,17.0000000000,,False
WhiteHouseCards,Здесь все понятно и без перевода #Трамп #Trump2016 https://t.co/qhziizm9fc,Unknown,Russian,2016-05-18T11:24:00,2016-05-18T11:24:00,598.0000000000,67.0000000000,20.0000000000,,False
WhiteHouseCards,В 1996 году Билл Клинтон выдал речь о нелегальной имиграции в духе Доальда Трампа  https://t.co/pQKZc5QSs9 https://t.co/ePQGQghsQD,Unknown,Russian,2016-05-18T14:13:00,2016-05-18T14:14:00,598.0000000000,66.0000000000,21.0000000000,,False
WhiteHouseCards,"Перевод: 1916 Вам нельзя голосовать, потому что вы женщины 2016 Я Хиллари! Голосуйте за меня, потому что я женщина https://t.co/60cJgSupvA",Unknown,Russian,2016-05-18T15:28:00,2016-05-18T15:28:00,598.0000000000,66.0000000000,23.0000000000,,False
WhiteHouseCards,Трамп установил новый рекорд по колличеству голосов для республиканского кандидата  https://t.co/yBCwSGwv01 https://t.co/485V0Gxq6Y,Unknown,Ukrainian,2016-05-18T16:33:00,2016-05-18T16:33:00,598.0000000000,66.0000000000,24.0000000000,,False
WhiteHouseCards,Берни Сандерса неспособен навести порядок на своих выступлениях.  https://t.co/p2QWb0SITL https://t.co/8viX0Oazsf,Unknown,Russian,2016-05-18T17:02:00,2016-05-18T17:02:00,598.0000000000,66.0000000000,25.0000000000,,False
WhiteHouseCards,#Трамп #Trump2016 https://t.co/9oDKHymygX,Unknown,Russian,2016-05-18T17:30:00,2016-05-18T17:30:00,724.0000000000,66.0000000000,26.0000000000,,False
WhiteHouseCards,Умирающий республиканский сенатор извиняется перед мусульманами за Дональда Трампа  https://t.co/guu8Af9k9n https://t.co/vE5N7xRue8,Unknown,Russian,2016-05-19T09:05:00,2016-05-19T09:05:00,1604.0000000000,11082.0000000000,27.0000000000,,False
WhiteHouseCards,25-летний «фиктивный брак» Берни Сандерса с демократической партией распадается  https://t.co/1rCmPatmMy https://t.co/9Eym9JQeaB,Unknown,Russian,2016-05-19T11:31:00,2016-05-19T11:31:00,1602.0000000000,10997.0000000000,28.0000000000,,False
WhiteHouseCards,"Прибыль бизнеса Дональда Трампа резко увеличилась с тех пор, как он баллотировался  https://t.co/gF4maKizXI https://t.co/fPNObt0iII",Unknown,Russian,2016-05-19T16:01:00,2016-05-19T16:01:00,1601.0000000000,10955.0000000000,30.0000000000,,False
WhiteHouseCards,"Клинтон заявила:""Нет такой возможности, что я не стану кандидатом от Демократической партии""  https://t.co/9fB2EI5koA https://t.co/PHPiaXv7aF",Unknown,Russian,2016-05-20T11:45:00,2016-05-20T11:54:00,1600.0000000000,10962.0000000000,31.0000000000,,False
WhiteHouseCards,"Опрос Fox News: Трамп 45%, Клинтон 42% https://t.co/FzaoBPhftP",Unknown,Russian,2016-05-20T12:52:00,2016-05-20T12:54:00,1600.0000000000,10943.0000000000,32.0000000000,,False
WhiteHouseCards,Хиллари жителям Калифорнии: ваши голоса не повлияют на праймериз  https://t.co/CwaELbjeQT https://t.co/aWcJTnk2BD,Unknown,Uzbek,2016-05-20T13:51:00,2016-05-20T13:52:00,1600.0000000000,10918.0000000000,33.0000000000,,False
WhiteHouseCards,"Сравнение Трампа с поездом, который сносит все преграды #Трамп #Trump2016 https://t.co/u0BlKFibzM",Unknown,Russian,2016-05-21T13:14:00,2016-05-21T13:14:00,1600.0000000000,10995.0000000000,36.0000000000,,False
WhiteHouseCards,"Трамп в президенты 2016* *Может вызывать головные боли, чувство тревоги, тошноту, депрессию, нервозность, агрессию https://t.co/ol5jk7559I",Unknown,Russian,2016-05-21T16:27:00,2016-05-21T16:27:00,1600.0000000000,10973.0000000000,39.0000000000,,False
WhiteHouseCards,"Трамп обещает отменить ""зоны без оружия"" в США   https://t.co/NJ3iv5s9o9 https://t.co/GwmoGd81p5",Unknown,Russian,2016-05-22T07:29:00,2016-05-22T07:36:00,1599.0000000000,10886.0000000000,41.0000000000,,False
WhiteHouseCards,«Уверенность - это магнит. Он будет притягивать к Вам людей»  Дональд Трамп https://t.co/WzgrLignf1,Unknown,Russian,2016-05-22T11:36:00,2016-05-22T11:46:00,1599.0000000000,10991.0000000000,44.0000000000,,False
WhiteHouseCards,"Билл Клинтон: Иногда мне кажется, что я абсолютно бесполезен в этих выборах   https://t.co/uTMhNMvkoJ https://t.co/zX0TVyOQ4s",United States,Russian,2016-05-23T13:20:00,2016-05-23T13:28:00,1599.0000000000,10962.0000000000,48.0000000000,,False
WhiteHouseCards,Хиллари Клинтон: Трамп обанкротит Америку также как и свои компании  https://t.co/LAawmQeutY https://t.co/ZAxqQWeoVI,United States,Russian,2016-05-24T10:43:00,2016-05-24T10:44:00,1598.0000000000,11148.0000000000,51.0000000000,,False
WhiteHouseCards,"Чтобы поставить республиканских сенаторов в неловкое положение, задайте вопрос о Трампе  https://t.co/fT6hqZu2tb https://t.co/uLAWmFpKn6",United States,Russian,2016-05-24T11:46:00,2016-05-24T11:46:00,1598.0000000000,11144.0000000000,52.0000000000,,False
WhiteHouseCards,"Трамп не стесняется сказать слово «rape»(износилование),говоря об иммигрантах и Клинтоне https://t.co/QYsGX31XO6 https://t.co/Sv4aBjVTcs",United States,Russian,2016-05-24T12:40:00,2016-05-24T12:40:00,1598.0000000000,11142.0000000000,53.0000000000,,False
WhiteHouseCards,Трампа обидели слова мэра Лондона(мусульманина) «Его взгляд на Ислам – невежественен»  https://t.co/QYsGX31XO6 https://t.co/0r1sLA6OxE,United States,Russian,2016-05-24T13:35:00,2016-05-24T13:35:00,1598.0000000000,11135.0000000000,54.0000000000,,False
WhiteHouseCards,"Джек Николаус – профессиональный игрок в гольф, поддержал кандидатуру Трампа на выборах  https://t.co/4l8f94MCDW https://t.co/OhBuZqdp8x",United States,Russian,2016-05-24T14:23:00,2016-05-24T14:23:00,1598.0000000000,11132.0000000000,55.0000000000,,False
WhiteHouseCards,Хиллари Клинтон отказалась от дебатов со своим оппонентом Берни Сандерсом  https://t.co/Pb87bZukIg https://t.co/nkF3OXuNbx,United States,Uzbek,2016-05-24T15:11:00,2016-05-24T15:19:00,1598.0000000000,11127.0000000000,56.0000000000,,False
WhiteHouseCards,Политологи дают критическую оценку движению сторонников Берни Сандерса.  https://t.co/uZbC89UOoS https://t.co/rIon4ukRoz,United States,Russian,2016-05-25T15:16:00,2016-05-25T15:16:00,1595.0000000000,11097.0000000000,58.0000000000,,False
WhiteHouseCards,Хиллари Клинтон проигнорировала вопрос о поддержке трансгендерных людей  https://t.co/ovKDjd2Qay https://t.co/CRpqdBT1ym,United States,Russian,2016-05-25T17:30:00,2016-05-25T17:30:00,1595.0000000000,11099.0000000000,60.0000000000,,False
WhiteHouseCards,Противостояние Хиллари Клинтон и Берни Сандерса зашло в тупик 46% Хиллари 44% Сандерс  https://t.co/uG1y6M15f3 https://t.co/LzLyc2U3gN,United States,Uzbek,2016-05-26T09:59:00,2016-05-26T09:59:00,2093.0000000000,11072.0000000000,64.0000000000,,False
WhiteHouseCards,"В среду на шоу Джимми Киммела Трамп заявил, что будет рад провести дебаты с  Сандерсом   https://t.co/i8UULTJqCM https://t.co/YYKh9P9IpD",United States,Russian,2016-05-26T11:11:00,2016-05-26T11:11:00,2092.0000000000,11074.0000000000,65.0000000000,,False
WhiteHouseCards,Перевод: Стратегия президентской кампании Дональда Трампа 2016 https://t.co/bRXhEXipda,United States,Russian,2016-05-26T13:28:00,2016-05-26T13:29:00,2090.0000000000,11074.0000000000,66.0000000000,,False
WhiteHouseCards,Заготовки масок Дональда Трампа на фабрике в китайском городском округе Цзиньхуа 25 мая 2016 года https://t.co/WrYUriFHjE,United States,Serbian,2016-05-26T14:35:00,2016-05-26T14:35:00,2090.0000000000,11077.0000000000,68.0000000000,,False
WhiteHouseCards,Профсоюз раб. автомобильной отрасли поддержал кандидатуру Клинтон на пост президента США  https://t.co/Hum8AJBEcj https://t.co/39GH8KQy5E,United States,Russian,2016-05-27T11:03:00,2016-05-27T11:03:00,2578.0000000000,11057.0000000000,72.0000000000,,False
WhiteHouseCards,Берни Сандерс назвал Дональда Трампа трусом. А все из-за отмененных дебатов   https://t.co/aiILMLhq7K https://t.co/N4SqhUbOYL,United States,Russian,2016-05-29T12:30:00,2016-05-29T12:30:00,3273.0000000000,11039.0000000000,81.0000000000,,False
WhiteHouseCards,"""Демократы"" давят на Сандерса, чтобы тот вышел из гонки  https://t.co/hONCqi28kr https://t.co/APDnHXExGu",United States,Russian,2016-05-29T17:30:00,2016-05-29T17:30:00,3272.0000000000,11038.0000000000,86.0000000000,,False
WhiteHouseCards,Появился первый официальны претендент на пост президента США. Но это не Трамп и не Хиллари  https://t.co/fkUJoltt0X https://t.co/E9OInCU7yN,United States,Russian,2016-05-30T08:33:00,2016-05-30T08:34:00,3271.0000000000,11036.0000000000,87.0000000000,,False
WhiteHouseCards,"Перевод: Как хиллари выучила команду ""Голос!""  *надпись на миске ""Фонд Клинтонов""* https://t.co/pGe9gz41BZ",United States,Uzbek,2016-05-30T09:25:00,2016-05-30T09:25:00,3271.0000000000,11036.0000000000,88.0000000000,,False
WhiteHouseCards,"Трамп на ежегодном митинге байкеров: мигранты лечатся лучше, чем ветераны!  https://t.co/NZXh8IW2Wa https://t.co/TTbo91tRQA",United States,Russian,2016-05-30T17:30:00,2016-05-30T17:32:00,3269.0000000000,11016.0000000000,93.0000000000,,False
WhiteHouseCards,Трамп подверг критике обещание Билла Кристола заявить независимого кандидата  https://t.co/XNXpjpy7Oo https://t.co/74VHW4rxYw,United States,Russian,2016-05-31T09:53:00,2016-05-31T09:53:00,3268.0000000000,10998.0000000000,96.0000000000,,False
WhiteHouseCards,Перевод: - Моя очередь - Моя очередь - Моя очередь - Моя очередь...опять https://t.co/TRcH1LrqTb,United States,Russian,2016-05-31T13:08:00,2016-05-31T13:08:00,3267.0000000000,10995.0000000000,97.0000000000,,False
WhiteHouseCards,Доброго дня! *Сандерс и Клинтон перетягивают голоса калифорнийцев* https://t.co/dJa8yHzy0A,United States,Russian,2016-06-03T08:55:00,2016-06-03T08:55:00,3958.0000000000,10980.0000000000,100.0000000000,,False
WhiteHouseCards,"Трам: ""Сандерс не проявил достаточного усердия для дебатов"". Звучит как оправдание  https://t.co/e1XTtGGZm1 https://t.co/r0ySWV23sn",United States,Ukrainian,2016-06-03T12:25:00,2016-06-03T12:25:00,3957.0000000000,10983.0000000000,102.0000000000,,False
WhiteHouseCards,"Сандерс может победить в Калифорнии, но вряд ли ему это поможет  https://t.co/AtRioQAZRi https://t.co/seYtcxZiy4",United States,Russian,2016-06-03T15:01:00,2016-06-03T15:01:00,3957.0000000000,10983.0000000000,104.0000000000,,False
WhiteHouseCards,"Шут и Посредственность *у Трампа ""риторика по внешней политике"", у Клинтон - ""записи по внешней политике"" https://t.co/pqS64HFtUb",United States,Russian,2016-06-03T16:06:00,2016-06-03T16:17:00,3957.0000000000,10982.0000000000,105.0000000000,,False
WhiteHouseCards,Ведущая Мейджин Келли раскритиковала Трампа: «это переходит все границы».  https://t.co/abwttCS4Ui https://t.co/493killE2H,United States,Russian,2016-06-03T17:02:00,2016-06-03T17:06:00,3957.0000000000,10982.0000000000,106.0000000000,,False
WhiteHouseCards,Кандидат в президенты США от Либертарианской партии Гэри Джонсон: Сноудену не место в тюрьме https://t.co/uAm3TzEcl2 https://t.co/HDvig2S1hk,United States,Russian,2016-06-04T09:24:00,2016-06-04T09:28:00,3957.0000000000,10977.0000000000,108.0000000000,,False
WhiteHouseCards,Клинтон раскритиковала Дональда Трампа за его позицию по поводу глобального потепления  https://t.co/xCTo3Plwm6 https://t.co/2KEFWKmVSN,United States,Russian,2016-06-05T14:43:00,2016-06-05T14:43:00,3954.0000000000,10964.0000000000,110.0000000000,,False
WhiteHouseCards,"""Яростный на ринге и милейший парень вне его"" - Трамп про его дружбу с Мохаммедом Али  https://t.co/PEnJF57bmc https://t.co/re470eCo82",United States,Russian,2016-06-05T15:46:00,2016-06-05T15:47:00,3954.0000000000,10965.0000000000,111.0000000000,,False
WhiteHouseCards,"Сьюзан Сарандон и другие звёздные гости, поддержавшие Берни Сандерса в Калифорнии  https://t.co/Rzno570OLl https://t.co/bkNwrQUVeg",United States,Russian,2016-06-05T16:52:00,2016-06-05T16:52:00,3955.0000000000,10966.0000000000,112.0000000000,,False
WhiteHouseCards,"Хиллари Клинтон стремится установить американскую гегемонию, которую мир так ненавидит  https://t.co/ZYONfgvucW https://t.co/yuGEG58z9y",United States,Russian,2016-06-05T17:55:00,2016-06-05T17:55:00,3955.0000000000,10962.0000000000,113.0000000000,,False
WhiteHouseCards,"Трамп - ""Выберите Клинтон, и эта страна умрёт!""  https://t.co/0twsjR17Ym https://t.co/dQYwH5Ft11",United States,Russian,2016-06-05T18:39:00,2016-06-05T18:39:00,3955.0000000000,10960.0000000000,114.0000000000,,False
WhiteHouseCards,"Хиллари Клинтон встретилась с журналистами, но соц.сети остались недовольны ее ответами  https://t.co/u0h2lO5tcC https://t.co/7wj6xwmelB",United States,Russian,2016-06-07T12:19:00,2016-06-07T12:19:00,3954.0000000000,10904.0000000000,116.0000000000,,False
WhiteHouseCards,"Марко Рубио, бывший кандидат в президенты США, обеспокоен высказываниями Трампа   https://t.co/Bca5Z27TJk https://t.co/8Z1Vgu8FhA",United States,Russian,2016-06-07T17:00:00,2016-06-07T17:00:00,3954.0000000000,10897.0000000000,120.0000000000,,False
WhiteHouseCards,"Клинтон готовится к всеобщим выборам, усиливая нападки на Трампа  https://t.co/sbFNTZjIRU https://t.co/V0Y4YgX5E8",United States,Russian,2016-06-09T09:10:00,2016-06-09T09:11:00,3952.0000000000,10866.0000000000,125.0000000000,,False
WhiteHouseCards,Дональд Трамп: не вижу необходимости в привлечении миллиарда долларов  https://t.co/du5z651o6h https://t.co/nDFdTkLvMi,United States,Russian,2016-06-09T11:41:00,2016-06-09T11:41:00,3952.0000000000,10862.0000000000,126.0000000000,,False
WhiteHouseCards,"То чувство,когда кандидаты в президенты супердержавы устраивают разборки в Твиттере @realDonaldTrump @HillaryClinton https://t.co/P81G1xWMXe",United States,Russian,2016-06-10T10:21:00,2016-06-10T10:22:00,3952.0000000000,10819.0000000000,130.0000000000,,False
WhiteHouseCards,И еще про твиттер: Washington Examiner сравнил количество фейковых и настоящих подписчиков  https://t.co/R7w5yQrvtK https://t.co/IL3Ddvte7z,United States,Russian,2016-06-10T11:51:00,2016-06-10T11:51:00,3952.0000000000,10821.0000000000,131.0000000000,,False
WhiteHouseCards,Дональд Трамп в исполнении Мерил Стрип на сцене театра Delacorte в Нью-Йорке https://t.co/5wgCvWNgxy,United States,Russian,2016-06-10T13:26:00,2016-07-27T09:31:00,2988.0000000000,9706.0000000000,401.0000000000,,False
WhiteHouseCards,Белый Дом встал на сторону Клинтон в ее скандале с ФБР. И это сразу после слов Обамы!  https://t.co/ZgQe9Ed4iW https://t.co/UBU6ddjEsP,United States,Russian,2016-06-10T14:25:00,2016-06-10T14:25:00,4748.0000000000,10854.0000000000,134.0000000000,,False
WhiteHouseCards,Трамп назвал сенатора от штата Массачусетс Элизабет Уоррен Покахонтас.Республиканцам неловко  https://t.co/z3joOsEIUg https://t.co/fTahHxtP5U,United States,Macedonian,2016-06-11T13:30:00,2016-06-11T13:30:00,4748.0000000000,10866.0000000000,138.0000000000,,False
WhiteHouseCards,4 из 10 Республиканцев хотят помешать Трампу выдвигаться на пост президента США  https://t.co/oXl2m47qG2 https://t.co/oa96OVsKzn,United States,Russian,2016-06-11T16:15:00,2016-06-11T16:15:00,4748.0000000000,10864.0000000000,141.0000000000,,False
WhiteHouseCards,"Клинтон опережает Трампа на 11 пунктов, согласно подсчету голосов опубликованному Reuters  https://t.co/3b4up7Ad9M https://t.co/pZcJEWl4Ul",United States,Russian,2016-06-12T09:21:00,2016-06-12T09:21:00,4248.0000000000,10857.0000000000,144.0000000000,,False
WhiteHouseCards,Трамп предупреждает о «Троянском коне» иммигрантов; Хиллари отвергает критику о «переходе на личности»  https://t.co/n0qM5vu8uN,United States,Russian,2016-06-13T15:48:00,2016-06-13T15:49:00,4247.0000000000,10839.0000000000,148.0000000000,,False
WhiteHouseCards,"Пол Райн поставил себя в неудобное положение, но все-таки поддержал Трампа   https://t.co/9zwUWSnBmp https://t.co/0xAoa8d980",United States,Russian,2016-06-13T16:30:00,2016-06-13T16:30:00,4247.0000000000,10840.0000000000,149.0000000000,,False
WhiteHouseCards,"Тем временем, Клинтон обвинила Саудовскую Аравию в спонсировании терроризма  https://t.co/039QDIbH8Y https://t.co/LY1jjs6wre",United States,Russian,2016-06-14T12:13:00,2016-06-14T12:13:00,4246.0000000000,10809.0000000000,154.0000000000,,False
WhiteHouseCards,Джулиан Ассанж готовится ударить по Хиллари Клинтон  https://t.co/sraffvcHna https://t.co/bmPa5WrHXc,United States,Russian,2016-06-14T14:18:00,2016-06-14T14:19:00,4247.0000000000,10806.0000000000,156.0000000000,,False
WhiteHouseCards,"Кстати, Дональду Трампу сегодня 70 лет! Поздравляем его с Днем Рождения @realDonaldTrump https://t.co/n7AreCUxzM",United States,Russian,2016-06-14T15:40:00,2016-06-14T15:40:00,4247.0000000000,10803.0000000000,157.0000000000,,False
WhiteHouseCards,"Пишут, что Хиллари Клинтон причастна к террактам в Орландо. Теория заговора по ссылке ниже  https://t.co/0UIjeX1KIX https://t.co/Rasv8V7IMy",United States,Uzbek,2016-06-14T16:20:00,2016-06-14T16:20:00,4247.0000000000,10801.0000000000,158.0000000000,,False
WhiteHouseCards,"Русские хакеры украли данные на Трампа. Если что, это не мы  https://t.co/XHFBmWr7pf https://t.co/mTaN69qkji",United States,Russian,2016-06-14T17:05:00,2016-06-14T17:05:00,4247.0000000000,10800.0000000000,159.0000000000,,False
WhiteHouseCards,Реакция Трампа и Клинтон на трагедию в Орландо. Чья позиция вам ближе? RT - Трамп Like - Клинтон https://t.co/eJp4XmvWeq,United States,Bulgarian,2016-06-15T09:30:00,2016-06-15T09:38:00,4247.0000000000,10787.0000000000,165.0000000000,,False
WhiteHouseCards,"BBC пытается угадать, как стрельба в гей-клубе скажется на итогах выборов Президента США  https://t.co/1AsGM59XQ8 https://t.co/kYxzvy8y5Q",United States,Russian,2016-06-15T11:13:00,2016-06-15T11:13:00,4247.0000000000,10786.0000000000,166.0000000000,,False
WhiteHouseCards,"Bloomberg: 49% избирателей поддерживают Клинтон, Трампа - 37%   https://t.co/OLZbxfJbhO https://t.co/EBp0PX8rzY",United States,Russian,2016-06-15T14:15:00,2016-06-15T14:16:00,4246.0000000000,10782.0000000000,168.0000000000,,False
WhiteHouseCards,Глава одного из профсоюзов США призвал объединиться со сторонниками Хиллари Клинтон  https://t.co/C4wWAkxrOX https://t.co/bDehJrINWb,United States,Russian,2016-06-15T16:37:00,2016-06-15T16:37:00,4245.0000000000,10782.0000000000,169.0000000000,,False
WhiteHouseCards,"Губернатор Мэриленда Лэри Хоган(Республиканец) заявил, что не будет голосовать за Трампа  https://t.co/ay12cRS7yS https://t.co/eCiXzC4PoK",United States,Uzbek,2016-06-16T08:54:00,2016-06-16T08:55:00,4246.0000000000,10774.0000000000,170.0000000000,,False
WhiteHouseCards,Телеведущая Опра Уинфри поддержала кандидатуру Хиллари  https://t.co/QCCQxouhj9 https://t.co/9YvQDzUNVr,United States,Uzbek,2016-06-16T12:40:00,2016-06-16T12:40:00,4246.0000000000,10775.0000000000,172.0000000000,,False
