author_id,content,region,language,publish_date,harvested_date,following,followers,updates,post_type,retweet
Willie_BigN,"Whatever I do, looks like crap!",United States,English,2015-05-19T01:28:00,2015-05-19T01:28:00,61.0000000000,54.0000000000,245.0000000000,,False
Willie_BigN,It`s crazy how wrong you can be about a person…,United States,English,2015-05-19T01:31:00,2015-05-19T01:31:00,61.0000000000,54.0000000000,246.0000000000,,False
Willie_BigN,How come the only way to know how high you get me is to see how far I fall,United States,English,2015-05-19T01:39:00,2015-05-19T01:39:00,61.0000000000,54.0000000000,247.0000000000,,False
Willie_BigN,The Great Pleasure in Life is Doing What People Say You Cannot Do. Walter Bagehot,United States,English,2015-05-19T01:41:00,2015-05-19T01:43:00,61.0000000000,54.0000000000,249.0000000000,,False
Willie_BigN,Placing all our hope on material development is clearly mistaken,United States,English,2015-05-19T01:41:00,2015-05-19T01:41:00,61.0000000000,54.0000000000,248.0000000000,,False
Willie_BigN,I wish my mum was at home to make pancakes,United States,English,2015-05-19T01:50:00,2015-05-19T01:50:00,61.0000000000,54.0000000000,250.0000000000,,False
Willie_BigN,"Once they see you better without them, that's when they want you back",United States,English,2015-05-19T01:51:00,2015-05-19T01:52:00,61.0000000000,54.0000000000,251.0000000000,,False
Willie_BigN,"Earth provides enough to satisfy every man's needs, but not every man's greed.  – Mahatma Gandhi",United States,English,2015-05-19T01:52:00,2015-05-19T01:53:00,61.0000000000,54.0000000000,252.0000000000,,False
Willie_BigN,Saw it several days ago during a trip and that's amazing! Can you see the face? Who is it?  http://t.co/rP1uJgQjOb,United States,English,2015-08-12T00:06:00,2015-08-12T00:06:00,60.0000000000,51.0000000000,253.0000000000,R,True
Willie_BigN,Thanks God that #turkey i ate few days ago was good. #KochFarms https://t.co/HSSve9bLt1 https://t.co/qR0Ykj3xyZ,United States,English,2015-11-26T22:20:00,2015-11-26T22:20:00,58.0000000000,50.0000000000,254.0000000000,,False
Willie_BigN,#FoodPoisoning is not a joke! #Walmart #KochFarms https://t.co/o4i3tFAEgv https://t.co/pv5lmkdWgE,United States,English,2015-11-26T22:34:00,2015-11-26T22:34:00,58.0000000000,50.0000000000,255.0000000000,R,True
Willie_BigN,#walmart #KochFarms https://t.co/szzqrlBAAy https://t.co/GrTM9etEQ9,United States,English,2015-11-26T22:38:00,2015-11-26T22:38:00,58.0000000000,50.0000000000,256.0000000000,R,True
Willie_BigN,#ImThankfulFor Thanksgiving turned to be a disaster. #KochFarms #USDA #foodpoisoning https://t.co/c0SOXzwZNh,United States,English,2015-11-27T00:25:00,2015-11-27T00:26:00,58.0000000000,50.0000000000,257.0000000000,R,True
Willie_BigN,You can't simply buy a #turkey in #NewYork without a risk to be hospitalised #thanksgiving #kochfarms,United States,English,2015-11-27T00:26:00,2015-11-27T00:26:00,58.0000000000,50.0000000000,264.0000000000,R,True
Willie_BigN,What were they thinking? #NY #Turkey #FoodPoisoning #NY #KochFarms #FSIS,United States,English,2015-11-27T00:26:00,2015-11-27T00:26:00,58.0000000000,50.0000000000,262.0000000000,R,True
Willie_BigN,#DogThanking These people deserved it. #vegan #KochFarms #FSIS #NewYork  #FoodPoisoning #Turkey  https://t.co/x56l9LS5vC,United States,English,2015-11-27T00:26:00,2015-11-27T00:26:00,58.0000000000,50.0000000000,258.0000000000,R,True
Willie_BigN,#nofucksgiving #KochFarms https://t.co/fgPfrbCH30,United States,English,2015-11-27T00:26:00,2015-11-27T00:27:00,58.0000000000,50.0000000000,268.0000000000,R,True
Willie_BigN,Don't eat turkey this week y'all #KochFarms #NY #Turkey #USDA  https://t.co/DqOHPsSpzy,United States,English,2015-11-27T00:26:00,2015-11-27T00:26:00,58.0000000000,50.0000000000,266.0000000000,R,True
Willie_BigN,wooow  spread this info #KochFarms https://t.co/8A9DsWGCk7,United States,English,2015-11-27T00:26:00,2015-11-27T00:26:00,58.0000000000,50.0000000000,265.0000000000,R,True
Willie_BigN,no more food picks on Instagram #FoodPoisoning #NewYork #Fail #Walmart #USDA  https://t.co/uNJllOJUUM,United States,English,2015-11-27T00:26:00,2015-11-27T00:26:00,58.0000000000,50.0000000000,267.0000000000,R,True
Willie_BigN,#DogThanking tried meat for the 1st time ever in my whole entire life and got food poisoning #KochFarms https://t.co/OfcQ4mwI1c,United States,English,2015-11-27T00:26:00,2015-11-27T00:26:00,58.0000000000,50.0000000000,260.0000000000,R,True
Willie_BigN,wooow  You can't believe my bad experience with #Turkey #USDA,United States,English,2015-11-27T00:26:00,2015-11-27T00:26:00,58.0000000000,50.0000000000,259.0000000000,R,True
Willie_BigN,OMG  Stop #KochFarms - let the people celebrate #Thanksgiving,United States,English,2015-11-27T00:26:00,2015-11-27T00:26:00,58.0000000000,50.0000000000,263.0000000000,R,True
Willie_BigN,"wooow  Screw this, all this stupid manufacturers just wanna earn some money. #KochFarms https://t.co/fQ9zZZbcs0",United States,English,2015-11-27T00:26:00,2015-11-27T00:26:00,58.0000000000,50.0000000000,261.0000000000,R,True
Willie_BigN,gotta be kidng me so much for mornin news #FoodPoisoning #NY #KochFarms #FSIS #NewYork   https://t.co/WxrbySFn6I,United States,English,2015-11-27T00:27:00,2015-11-27T00:27:00,58.0000000000,50.0000000000,270.0000000000,R,True
Willie_BigN,Why we should suffer from huge companies?! #KochFarms #Turkey #USDA,United States,English,2015-11-27T00:27:00,2015-11-27T00:27:00,58.0000000000,50.0000000000,276.0000000000,R,True
Willie_BigN,wooow  When I'm going to visit supermarket I create shopping list with only healthy products.#KochFarms,United States,English,2015-11-27T00:27:00,2015-11-27T00:27:00,58.0000000000,50.0000000000,269.0000000000,R,True
Willie_BigN,wooow  RT! Don’t eat fucking #Turkey from #KochFarms #Walmart #USDA https://t.co/97cPpHUQwW,United States,English,2015-11-27T00:27:00,2015-11-27T00:27:00,58.0000000000,50.0000000000,273.0000000000,R,True
Willie_BigN,OMG  What a #fail on #FSIS part #KochFarms #NY #USDA  https://t.co/c0SOXzwZNh,United States,English,2015-11-27T00:27:00,2015-11-27T00:27:00,58.0000000000,50.0000000000,275.0000000000,R,True
Willie_BigN,Well fuck that year! #Turkey #KochFarms #Fail #USDA,United States,English,2015-11-27T00:27:00,2015-11-27T00:27:00,58.0000000000,50.0000000000,272.0000000000,R,True
Willie_BigN,wooow Happy Thanksgiving @DrDeanCDC #USDA now checking #turkeys what could it mean? https://t.co/EbvUGf1uFf,United States,English,2015-11-27T00:27:00,2015-11-27T00:27:00,58.0000000000,50.0000000000,271.0000000000,R,True
Willie_BigN,Happy Thanksgiving  Mass intoxication with #turkey on Thanksgiving!!! #NY #KochFarms #USDA https://t.co/uOWUUMlaqA,United States,English,2015-11-27T00:28:00,2015-11-27T00:28:00,58.0000000000,50.0000000000,285.0000000000,R,True
Willie_BigN,wooow Happy Thanksgiving @MetroPlusHealth #KochFarms would pay for their #fail with #turkey !!!  https://t.co/9WsygAo8aD,United States,English,2015-11-27T00:28:00,2015-11-27T00:28:00,58.0000000000,50.0000000000,278.0000000000,R,True
Willie_BigN,These people deserved it. #vegan #KochFarms #FSIS #Turkey https://t.co/KSl3CQt6Wc,United States,English,2015-11-27T00:28:00,2015-11-27T00:28:00,58.0000000000,50.0000000000,280.0000000000,R,True
Willie_BigN,wooow Happy Thanksgiving  Very sad to realize the symbol of Thanksgiving toxicates us. #turkey #KochFarms https://t.co/5bvucKx3ny,United States,English,2015-11-27T00:28:00,2015-11-27T00:28:00,58.0000000000,50.0000000000,281.0000000000,R,True
Willie_BigN,OMG  Toilet - my friend #Fail #KochFarms https://t.co/uNJllOJUUM,United States,English,2015-11-27T00:28:00,2015-11-27T00:28:00,58.0000000000,50.0000000000,282.0000000000,R,True
Willie_BigN,OMG  Oh man. #Walmart #FSIS  #Turkey  #KochFarms #USDA https://t.co/SV5ZL3QAYv,United States,Dutch,2015-11-27T00:28:00,2015-11-27T00:29:00,58.0000000000,50.0000000000,287.0000000000,R,True
Willie_BigN,wooow  Stop #KochFarms - let the people celebrate #Thanksgiving,United States,English,2015-11-27T00:28:00,2015-11-27T00:28:00,58.0000000000,50.0000000000,284.0000000000,R,True
Willie_BigN,#DogThanking I haven’t expect such a treachery on Thanksgiving. #turkey #foodpoisoning #KochFarms https://t.co/JdnZh3uXXq,United States,English,2015-11-27T00:28:00,2015-11-27T00:29:00,58.0000000000,50.0000000000,286.0000000000,R,True
Willie_BigN,wooow  What a great quality control #KochFarms has. #Thanksgiving is about to fail,United States,English,2015-11-27T00:29:00,2015-11-27T00:29:00,58.0000000000,50.0000000000,291.0000000000,R,True
Willie_BigN,never ever been in walmart #KochFarms https://t.co/3CpFaCT8lL,United States,English,2015-11-27T00:29:00,2015-11-27T00:29:00,58.0000000000,50.0000000000,288.0000000000,R,True
Willie_BigN,OMG  Vomiting is not the best way to spend Thanksgiving. #KochFarms #foodpoisoning #fail https://t.co/iqxgSSq97X,United States,English,2015-11-27T00:29:00,2015-11-27T00:29:00,58.0000000000,50.0000000000,289.0000000000,R,True
Willie_BigN,#ImThankfulFor Thanksgiving disaster in #NewYork doesn’t inspire me to eat #turkey. #KochFarms #foodpoisoning  https://t.co/NgXj9ZMyf8,United States,English,2015-11-27T00:29:00,2015-11-27T00:29:00,58.0000000000,50.0000000000,290.0000000000,R,True
