author_id,content,region,language,publish_date,harvested_date,following,followers,updates,post_type,retweet
ChernenkoNikola,На Цукерберга завели дело о разжигании межнациональной розни https://t.co/6xGmeZuER2,Unknown,Russian,2016-11-04T22:30:00,2016-11-04T22:30:00,243.0000000000,2215.0000000000,1590.0000000000,R,True
ChernenkoNikola,"Бывший комбат украинского карательного батальона ""Донбасс"" Семенченко лишен звания майора..Гы)Балаклаву надень,дебил https://t.co/vmu1Sopf0W",Unknown,Russian,2016-11-04T22:30:00,2016-11-04T22:30:00,243.0000000000,2215.0000000000,1584.0000000000,R,True
ChernenkoNikola,"'@lana55571 этот... ""псевдо-майор"" должен, как минимум - сидеть, а максимум-расстрелян, как каратель, а он в раде  спрятался.Там таких много.'",Unknown,Russian,2016-11-04T22:30:00,2016-11-04T22:30:00,243.0000000000,2215.0000000000,1586.0000000000,R,True
ChernenkoNikola,Смоленское сражение https://t.co/sJmrGSVj0t #Фронт #Группа #Армия #Август #ИЮЛЬ,Unknown,Russian,2016-11-05T03:31:00,2016-11-05T03:32:00,243.0000000000,2214.0000000000,1595.0000000000,R,True
ChernenkoNikola,"#Pilger: #ISIL or #ISIS is created largely with money from people who are giving money to the #Clinton Foundation?"" #Assange: ""Yes."" https://t.co/G5fS7ODCHN",Unknown,English,2016-11-05T03:31:00,2016-11-05T03:31:00,243.0000000000,2214.0000000000,1593.0000000000,R,True
ChernenkoNikola,"Время, которого не было https://t.co/pJI1dYivac #Немец #Эвакуация #ИЮЛЬ #Человек #Сетополь",Unknown,Russian,2016-11-05T03:31:00,2016-11-05T03:31:00,243.0000000000,2214.0000000000,1597.0000000000,R,True
ChernenkoNikola,#Russia sends complaint to UK over mannequin #protest incident @RussianEmbassy in #London https://t.co/SbRjD8cd7z,Unknown,English,2016-11-05T03:31:00,2016-11-05T03:31:00,243.0000000000,2214.0000000000,1600.0000000000,R,True
ChernenkoNikola,Спецпакет без права передачи https://t.co/OucOpLzMx9 #Кудрявцев #КГБ #НАТО #Капитан #Спецпакет,Unknown,Ukrainian,2016-11-05T03:31:00,2016-11-05T03:32:00,243.0000000000,2214.0000000000,1596.0000000000,R,True
ChernenkoNikola,Джизакский ад https://t.co/KjEpw2FDT2 #Джизак #Взятие #Генерал #Потеря #Крепость,Unknown,Russian,2016-11-05T03:31:00,2016-11-05T03:32:00,243.0000000000,2214.0000000000,1598.0000000000,R,True
ChernenkoNikola,В столице КНДР ввели в эксплуатацию паромы на солнечных батареях https://t.co/QMIufH9szN #КНДР #Энергия #Источник #Паром #Столица,Unknown,Russian,2016-11-05T08:32:00,2016-11-05T08:32:00,243.0000000000,2213.0000000000,1608.0000000000,R,True
ChernenkoNikola,Временно закреплю этот твит в ленте.  Уж очень это замечательный факт о США:),Unknown,Russian,2016-11-05T08:32:00,2016-11-05T08:32:00,243.0000000000,2213.0000000000,1605.0000000000,R,True
ChernenkoNikola,Патриарх Филарет призвал жителей Донбасса «искупить вину кровью» https://t.co/BRdeGduDpz #Донбасс #ВИНО #Согреш #Житель #Страдание,Unknown,Russian,2016-11-05T08:32:00,2016-11-05T08:33:00,243.0000000000,2213.0000000000,1609.0000000000,R,True
ChernenkoNikola,⚡️ «А ЗОЛУШКИ ГДЕ?»   https://t.co/ZJZ719PJ0n,Unknown,Russian,2016-11-05T08:32:00,2016-11-05T08:33:00,243.0000000000,2213.0000000000,1606.0000000000,R,True
ChernenkoNikola,"У светской львицы бомбануло, Путин хочет общаться с плебсом. С плебсом, а не с элитой этой страны. https://t.co/WUyEKWCsp2",Unknown,Russian,2016-11-05T13:33:00,2016-11-05T13:33:00,243.0000000000,2213.0000000000,1611.0000000000,R,True
ChernenkoNikola,Автомобиль врезался в ограждение на эстакаде в Москве https://t.co/ryTSLUxjXh #Шоссе #Человек #ТАСС #Ограждение #Столица,Unknown,Russian,2016-11-05T13:33:00,2016-11-05T13:34:00,243.0000000000,2213.0000000000,1618.0000000000,R,True
ChernenkoNikola,Захаров и Самитов — 5-е в первом старте на этапе КЕ по бобслею в Сигулде https://t.co/f1yduKNzPA #ЛЕВ #Сигулда #Бобслей #Поражение #Иранец,Unknown,Russian,2016-11-05T13:33:00,2016-11-05T13:33:00,243.0000000000,2213.0000000000,1615.0000000000,R,True
ChernenkoNikola,Боброва и Соловьев победили на этапе Гран-при в Москве в танцах на льду  https://t.co/O0r773bahE https://t.co/VWULxMAFFP,Unknown,Russian,2016-11-05T13:33:00,2016-11-05T13:33:00,243.0000000000,2213.0000000000,1612.0000000000,R,True
ChernenkoNikola,Десятки тысяч южнокорейцев призывают президента уйти в отставку https://t.co/CBkRFZVXBu #Президент #ПАН #КЫН #Отставка #СЕУЛ,Unknown,Russian,2016-11-05T13:33:00,2016-11-05T13:33:00,243.0000000000,2213.0000000000,1617.0000000000,R,True
ChernenkoNikola,Легендарные отечественные мужчины https://t.co/U8MgmOL8rf #Карапетян #Конюх #Шаварша #ЛЕВ #ЮРИЙ,Unknown,Russian,2016-11-05T13:33:00,2016-11-05T13:33:00,243.0000000000,2213.0000000000,1616.0000000000,R,True
ChernenkoNikola,"Путин выстраивает на Украине полицейское государство!  Теперь никаких ""А шо такое?!"" Новые полномочия полиции:  https://t.co/7D1Gl6dJSX https://t.co/1Z2elBzges",Unknown,Russian,2016-11-05T18:34:00,2016-11-05T18:34:00,243.0000000000,2211.0000000000,1625.0000000000,R,True
ChernenkoNikola,"В Канаде нашли «потерянную» атомную бомбу, — СМИ  Канадский флот проверит сообщения об обнаружении ядерной бомбы у   https://t.co/dYzXmij4kk https://t.co/vjVfDZBh4E",Unknown,Russian,2016-11-05T18:34:00,2016-11-05T18:34:00,243.0000000000,2211.0000000000,1624.0000000000,R,True
ChernenkoNikola,"Экс-супруга Орланда Блума рассказала, как выбиралась из депрессии после развода с ним https://t.co/SJiYKUGWFC",Unknown,Russian,2016-11-05T18:34:00,2016-11-05T18:35:00,243.0000000000,2211.0000000000,1626.0000000000,R,True
ChernenkoNikola,"Пока могут ещё помещаться на руках, лучше лишний раз поносить. Не заметишь,как станут взрослыми.… https://t.co/WnP2dFRGjj",Unknown,Russian,2016-11-05T23:36:00,2016-11-05T23:36:00,243.0000000000,2209.0000000000,1631.0000000000,R,True
ChernenkoNikola,"Вход в госпиталь церкви Святого Варфоломея.   Просто никому на западе и в голову не взбредёт воевать со своей историей, с памятниками... https://t.co/X6CWPmCUdV",Unknown,Russian,2016-11-05T23:36:00,2016-11-05T23:37:00,243.0000000000,2209.0000000000,1630.0000000000,R,True
ChernenkoNikola,Долой твиттер-зависимость! Нефритовый устанавливает лимит на 100 твитов в день. #Twitter #Твиттер https://t.co/P0bnj08Z0g с помощью @YouTube,Unknown,Russian,2016-11-05T23:36:00,2016-11-05T23:36:00,243.0000000000,2209.0000000000,1632.0000000000,R,True
ChernenkoNikola,Медведев и Ли Кэцян посетят Эрмитаж в Петербурге https://t.co/1pbhNoIHYc #Ноябрь #Правительство #Глава #Рамка #Медведев,Unknown,Russian,2016-11-05T23:36:00,2016-11-05T23:36:00,243.0000000000,2209.0000000000,1639.0000000000,R,True
ChernenkoNikola,Рой Джонс продолжит боксерскую карьеру https://t.co/kBu5S2Jejb #Гражданство #Джонс #Боксер #БОЙ #Карьер,Unknown,Russian,2016-11-05T23:36:00,2016-11-05T23:37:00,243.0000000000,2209.0000000000,1638.0000000000,R,True
ChernenkoNikola,#Наши_герои@rus_improvisation https://t.co/bd5X9Z0irG,Unknown,Russian,2016-11-05T23:36:00,2016-11-05T23:36:00,243.0000000000,2209.0000000000,1633.0000000000,R,True
ChernenkoNikola,В Петербурге активисты «Другой России» атаковали консульство Украины https://t.co/oE2SQ1RStK #Консульство #Акция #Участник #СТЕН #ВЫК,Unknown,Russian,2016-11-06T05:38:00,2016-11-06T05:38:00,243.0000000000,2209.0000000000,1646.0000000000,R,True
ChernenkoNikola,Обсуждение закона о российской нации  https://t.co/fZ3Vq1xEKm https://t.co/aa7RuCNQJZ,Unknown,Russian,2016-11-06T05:38:00,2016-11-06T05:38:00,243.0000000000,2209.0000000000,1645.0000000000,R,True
ChernenkoNikola,Enemy within? German military has uncovered dozens of Islamist infiltrators in army – reports https://t.co/SP8RYlr4GU,Unknown,English,2016-11-06T05:38:00,2016-11-06T05:38:00,243.0000000000,2209.0000000000,1644.0000000000,R,True
ChernenkoNikola,6 ноя. 1943 наши войска освободили Киев от фашистов https://t.co/9AnGBak8Gx,Unknown,Russian,2016-11-06T05:38:00,2016-11-06T05:38:00,243.0000000000,2209.0000000000,1643.0000000000,R,True
ChernenkoNikola,"Знакомьтесь. Егор Перепелюк 14.04.87, Санкт-Петербург, глава VIP департамента в IQ option. Любит по ночам обливать краской портрет Моторолы. https://t.co/vVCqqmdzNI",Unknown,Russian,2016-11-06T05:38:00,2016-11-06T05:38:00,243.0000000000,2209.0000000000,1640.0000000000,R,True
ChernenkoNikola,"URGENT: 5 missing, 1 killed, 7 saved from rubble as blast devastates house in central Russia (VIDEO) https://t.co/BeOnBHU5xH https://t.co/1fJE374pnC",Unknown,English,2016-11-06T05:38:00,2016-11-06T05:38:00,243.0000000000,2209.0000000000,1641.0000000000,R,True
ChernenkoNikola,"Отвратительные, грязные, родные https://t.co/tjrhrpTi7R #СКОЛ #КИНО #Фильм #Эттор #Поколение",Unknown,Russian,2016-11-06T05:38:00,2016-11-06T05:40:00,243.0000000000,2209.0000000000,1647.0000000000,R,True
ChernenkoNikola,Сколько падежей в российском языке? https://t.co/GfwyTNwtst,Unknown,Russian,2016-11-06T09:47:00,2016-11-06T09:48:00,243.0000000000,2211.0000000000,1650.0000000000,R,True
ChernenkoNikola,#Assange: US attempting to squeeze @WikiLeaks through my refugee status FULL INTERVIEW with John Pilger: https://t.co/qmZHXf6dNq https://t.co/Rqo9VYOHeK,Unknown,English,2016-11-06T09:48:00,2016-11-06T09:48:00,243.0000000000,2211.0000000000,1659.0000000000,R,True
ChernenkoNikola,Victorious!  Senator Manny Pacquiao makes history tonight by being the first ever Senator to win the WBO welterweight belt. #TeamLegend https://t.co/JbPL6X0oeI,Unknown,English,2016-11-06T09:48:00,2016-11-06T09:48:00,243.0000000000,2211.0000000000,1654.0000000000,R,True
ChernenkoNikola,"Минобороны РФ: США не доставили в Алеппо ""ни одной хлебной крошки"" РФ доставила в Алеппо свыше 100т.  гум. помощи   https://t.co/k074KZWomF https://t.co/uotQX5iAKn",Unknown,Russian,2016-11-06T09:48:00,2016-11-06T09:48:00,243.0000000000,2211.0000000000,1658.0000000000,R,True
ChernenkoNikola,"'@highercause ""Что можно сказать о мотивах, двигавших большевиками для захвата России"" https://t.co/EYC2lEIaxd https://t.co/ZkYRg6RjGt'",Unknown,Russian,2016-11-06T14:40:00,2016-11-06T14:40:00,243.0000000000,2209.0000000000,1661.0000000000,R,True
ChernenkoNikola,Андреевский флаг https://t.co/o5Wz7YcMMU с помощью @YouTube,Unknown,Russian,2016-11-06T14:40:00,2016-11-06T14:40:00,243.0000000000,2209.0000000000,1668.0000000000,R,True
ChernenkoNikola,'@Boyarin_Boroda @history_RF Зато сейчас бьют себя в грудь и приписывают себе все заслуги Сталина и народа.Оскорбляют Николая II и Империю...',Unknown,Russian,2016-11-06T14:40:00,2016-11-06T14:40:00,243.0000000000,2209.0000000000,1662.0000000000,R,True
ChernenkoNikola,"все - за....? Женщина должна быть не на одну ночь, а на одну жизнь...",Unknown,Russian,2016-11-06T14:40:00,2016-11-06T14:41:00,243.0000000000,2209.0000000000,1667.0000000000,R,True
ChernenkoNikola,"Фильм: ""99 попыток лечь спать"".   Жанр: философско—психологическая драма.  В главных ролях: ночь, я, интернет, холодильник.........",Unknown,Russian,2016-11-06T14:40:00,2016-11-06T14:40:00,243.0000000000,2209.0000000000,1669.0000000000,R,True
ChernenkoNikola,'@ComradZampolit @olxo2013 @iliabelous   https://t.co/zTCt6n5c6t',Unknown,Russian,2016-11-06T14:40:00,2016-11-06T14:40:00,243.0000000000,2209.0000000000,1663.0000000000,R,True
ChernenkoNikola,Riot police deployed water cannons and tear gas to disperse hundreds of protesters in Istanbul https://t.co/cnPkNwudAl https://t.co/cDl63uHPcJ,Unknown,English,2016-11-06T19:43:00,2016-11-06T19:43:00,243.0000000000,2209.0000000000,1676.0000000000,R,True
ChernenkoNikola,Когда решил поработать дома  https://t.co/DzxrTWDQr7,Unknown,Russian,2016-11-06T19:43:00,2016-11-06T19:43:00,243.0000000000,2209.0000000000,1670.0000000000,R,True
ChernenkoNikola,'@cgF9sm5XdMpqLSJ ах как сегодня актуален Достоевский... @BreakPosst @EvShu   https://t.co/iJH7FNPcIa',Unknown,Russian,2016-11-06T19:43:00,2016-11-06T19:43:00,243.0000000000,2209.0000000000,1673.0000000000,R,True
ChernenkoNikola,Литовские промышленники просят не саботировать Трудовой кодекс https://t.co/2466rhDJW1 #Кодекс #СИЛА #Промышленник #Литва #Вступление,Unknown,Russian,2016-11-07T10:49:00,2016-11-07T10:49:00,243.0000000000,2206.0000000000,1682.0000000000,R,True
ChernenkoNikola,#Всем_добра@rus_improvisation https://t.co/mdhC6AKnxG,Unknown,Russian,2016-11-07T10:49:00,2016-11-07T10:49:00,243.0000000000,2206.0000000000,1684.0000000000,R,True
ChernenkoNikola,«Для литовца автомобиль важнее жизни» https://t.co/6EbWSJhRUZ #Жизнь #Литва #Страхование #Житель #Литовец,Unknown,Russian,2016-11-07T10:49:00,2016-11-07T10:49:00,243.0000000000,2206.0000000000,1680.0000000000,R,True
ChernenkoNikola,Парламент Литвы ратифицировал членство Черногории в НАТО https://t.co/e9iIkKfGM9 #Соединение #Страна #Договор #Черногория #Организация,Unknown,Bulgarian,2016-11-07T10:49:00,2016-11-07T10:49:00,243.0000000000,2206.0000000000,1681.0000000000,R,True
ChernenkoNikola,ФБР расследует возможную связь белки с Москвой������� Белка помешала досрочному голосованию в США https://t.co/baPN4uhxg4 https://t.co/IbzpKCAdQs,Unknown,Russian,2016-11-07T15:50:00,2016-11-07T15:51:00,243.0000000000,2204.0000000000,1688.0000000000,R,True
ChernenkoNikola,Egypt's oil minister makes rare trip to Iran for oil talks after Saudi suspension https://t.co/CdYaLshMjf ht... by #varyagi via @c0nvey,Unknown,English,2016-11-07T15:50:00,2016-11-07T15:51:00,243.0000000000,2204.0000000000,1689.0000000000,R,True
ChernenkoNikola,Ronaldo stay at Real Madrid until 2021 https://t.co/J6jd5rsAdn  @Cristiano,Unknown,English,2016-11-07T15:50:00,2016-11-07T15:51:00,243.0000000000,2204.0000000000,1690.0000000000,R,True
ChernenkoNikola,"ОНФ: Ответственность за оплату общедомовых нужд – забота не только собственников и УК, но и местных властей  https://t.co/lbgJUT3L4V https://t.co/DoR4lIwTEy",Unknown,Russian,2016-11-07T15:50:00,2016-11-07T15:51:00,243.0000000000,2204.0000000000,1691.0000000000,R,True
ChernenkoNikola,Екатерина Великая так говорила...Самая Русская Императрица нерусских кровей - образец мудрости и великой любви к России! https://t.co/TWdJ7zMf0i,Unknown,Russian,2016-11-07T15:51:00,2016-11-07T15:51:00,243.0000000000,2204.0000000000,1694.0000000000,R,True
ChernenkoNikola,буржуазия обречена https://t.co/dp8kqmV8UH https://t.co/g1I73lPoUs,Unknown,Bulgarian,2016-11-07T15:51:00,2016-11-07T15:51:00,243.0000000000,2204.0000000000,1692.0000000000,R,True
ChernenkoNikola,О том как я плохо жил в СССР https://t.co/azvcb5iocZ https://t.co/WmPnltBoVx,Unknown,Russian,2016-11-07T20:52:00,2016-11-07T20:54:00,243.0000000000,2203.0000000000,1697.0000000000,R,True
ChernenkoNikola,"Новогодние сюрпризы государства: сигареты, вино и бензин подорожают на 20–30% https://t.co/qKuQi8UoC5 https://t.co/LjYNCpPRh2",Unknown,Russian,2016-11-07T20:52:00,2016-11-07T20:53:00,243.0000000000,2203.0000000000,1695.0000000000,R,True
ChernenkoNikola,6 ноября в Белграде появилось большое граффити в честь Арсена Павлова - Моторолы  #Наши_герои@rus_improvisation https://t.co/2VdoJkVEsi,Unknown,Russian,2016-11-07T20:52:00,2016-11-07T20:52:00,243.0000000000,2203.0000000000,1704.0000000000,R,True
ChernenkoNikola,Донбасс ставит новое условие https://t.co/bzhDgSbNTL https://t.co/S347iUQxUX,Unknown,Russian,2016-11-07T20:52:00,2016-11-07T20:52:00,243.0000000000,2203.0000000000,1698.0000000000,R,True
ChernenkoNikola,"Nearly 1,500 voters download voter protection app issued by Latino civil rights group #ElectionDay https://t.co/MSf4fHxyke https://t.co/Y49bXn5VFf",Unknown,English,2016-11-08T01:57:00,2016-11-08T01:57:00,243.0000000000,2203.0000000000,1705.0000000000,R,True
ChernenkoNikola,This latest leak includes 888 emails written to or from #HillaryClinton presidential campaign chairman John Podesta. https://t.co/LZjR3Fq02K https://t.co/ul3g8qnWsw,Unknown,English,2016-11-08T01:57:00,2016-11-08T01:57:00,243.0000000000,2203.0000000000,1708.0000000000,R,True
ChernenkoNikola,Катрин Денев проведет первый творческий вечер в Москве https://t.co/CU17tzJblQ #ТАСС #Актриса #Катрина #Вечер #Ноябрь,Unknown,Russian,2016-11-08T01:57:00,2016-11-08T01:57:00,243.0000000000,2203.0000000000,1711.0000000000,R,True
ChernenkoNikola,Определено самое перспективное направление зимнего отдыха в РФ https://t.co/82sopqzzLj #Рубль #Область #Камчатка #Отдых #Список,Unknown,Russian,2016-11-08T01:57:00,2016-11-08T01:57:00,243.0000000000,2203.0000000000,1707.0000000000,R,True
ChernenkoNikola,WikiLeaks опубликовал новые письма Подесты за несколько часов до старта выборов в США   https://t.co/OiX22eZfTS  #wikileaks #выборы #клинтон,Unknown,Russian,2016-11-08T01:57:00,2016-11-08T01:58:00,243.0000000000,2203.0000000000,1714.0000000000,R,True
ChernenkoNikola,100 beheaded bodies discovered in mass grave near #Mosul – Iraqi military https://t.co/MWCfCW5ZQb https://t.co/el8vYYs6fb,Unknown,English,2016-11-08T01:57:00,2016-11-08T01:58:00,243.0000000000,2203.0000000000,1710.0000000000,R,True
ChernenkoNikola,Китай приступил к созданию плавучей АЭС https://t.co/VVgbnhPBn3 #АЭС #СМИ #Строительство #Работа #Китай,Unknown,Russian,2016-11-08T01:57:00,2016-11-08T01:57:00,243.0000000000,2203.0000000000,1713.0000000000,R,True
ChernenkoNikola,OUCH! Burglar flees with arrow in buttocks after Australian pensioner shoots intruder with bow https://t.co/vwNESjhRu5 https://t.co/1GMQD0iZdV,Unknown,English,2016-11-08T01:57:00,2016-11-08T01:57:00,243.0000000000,2203.0000000000,1706.0000000000,R,True
ChernenkoNikola,Казахстан будет активно сотрудничать с Японией https://t.co/jEAB0dRIev #Отношение #Казахстан #Назарбаев #Расширение #Вопрос,Unknown,Russian,2016-11-08T07:01:00,2016-11-08T07:01:00,243.0000000000,2204.0000000000,1724.0000000000,R,True
ChernenkoNikola,Китай приступил к строительству первой плавучей АЭС https://t.co/J1VF0d8tOg #АЭС #Эксплуатация #МОР #Работа #ВВОД,Unknown,Russian,2016-11-08T07:01:00,2016-11-08T07:01:00,243.0000000000,2204.0000000000,1722.0000000000,R,True
ChernenkoNikola,Молодежная сборная России обыграла команду WHL в матче Суперсерии https://t.co/mzSyTBTQKN #ЛИГА #Команда #МАТЧ #Ноябрь #Валерия,Unknown,Russian,2016-11-08T07:01:00,2016-11-08T07:01:00,243.0000000000,2204.0000000000,1719.0000000000,R,True
ChernenkoNikola,Липартия вызван в сборную Грузии вместо Ананидзе https://t.co/1Zc7aUBHe5 #Футболист #Липартия #ДЖАБ #Заявка #Ананидзе,Unknown,Russian,2016-11-08T07:01:00,2016-11-08T07:01:00,243.0000000000,2204.0000000000,1721.0000000000,R,True
ChernenkoNikola,Найдена причина неизлечимости рака https://t.co/8yJ0aWUXRL #Клетка #Опухоль #Химиотерапия #Сотня #Онкоген,Unknown,Russian,2016-11-08T07:01:00,2016-11-08T07:01:00,243.0000000000,2204.0000000000,1720.0000000000,R,True
ChernenkoNikola,Обезьяна-пророк из Шанхая предсказала результаты выборов в США https://t.co/I3WQMkjVrm #США #Выбор #Клинтон #ГЕД #Хилларь,Unknown,Russian,2016-11-08T07:01:00,2016-11-08T07:01:00,243.0000000000,2204.0000000000,1723.0000000000,R,True
ChernenkoNikola,Артем Ткаченко стал отцом во второй раз https://t.co/0E57mxMwvq #Света #Наследник #Малыш #Актер #Стеблин,Unknown,Russian,2016-11-08T12:03:00,2016-11-08T12:03:00,243.0000000000,2204.0000000000,1727.0000000000,R,True
ChernenkoNikola,Россияне одобрили появление памятника князю Владимиру в Москве https://t.co/1W87FA0wyh #Памятник #История #Владимир #Процент #Князь,Unknown,Russian,2016-11-08T12:03:00,2016-11-08T12:03:00,243.0000000000,2204.0000000000,1732.0000000000,R,True
ChernenkoNikola,ВС РФ отменил решение о снятии судимости с экс-главкома Чиркина https://t.co/JFpogP2a7J #Решение #СУД #Чиркин #Рассмотрение #Судимость,Unknown,Russian,2016-11-08T12:03:00,2016-11-08T12:03:00,243.0000000000,2204.0000000000,1731.0000000000,R,True
ChernenkoNikola,Поклонская пообещала сходить в театр на «Горе от ума» https://t.co/5QzBZJh1DV #Спекль #Поклонской #«гора #Удовольствие #Театр,Unknown,Russian,2016-11-08T12:03:00,2016-11-08T12:03:00,243.0000000000,2204.0000000000,1729.0000000000,R,True
ChernenkoNikola,В Сибири за минувшие сутки зарегистрировано пять землетрясений https://t.co/wqZoqc6UcF #ТАСС #Прессслужба #Взрыв #Территория #Сутки,Unknown,Russian,2016-11-08T12:03:00,2016-11-08T12:03:00,243.0000000000,2204.0000000000,1730.0000000000,R,True
ChernenkoNikola,Follow @RT_America special coverage of US presidential elections #Election2016 #ElectionDay https://t.co/R06LMASqS8 https://t.co/CwNGqmJlxF,Unknown,English,2016-11-08T12:03:00,2016-11-08T12:03:00,243.0000000000,2204.0000000000,1734.0000000000,R,True
ChernenkoNikola,В Кремле не исключили новой «перезагрузки» в отношениях с США https://t.co/EyVcFsLzGE #США #Президент #Ноябрь #Партия #Отношение,Unknown,Russian,2016-11-08T12:03:00,2016-11-08T12:03:00,243.0000000000,2204.0000000000,1728.0000000000,R,True
ChernenkoNikola,"Angriff wird mit Kalibr-Marschflugkörpern auf Zufahrtstraßen zur Stadt, nicht aber auf Wohnviertel unternommen"" https://t.co/K31BFncGKX https://t.co/FOUa5C7e8v",Unknown,German,2016-11-08T17:06:00,2016-11-08T17:06:00,243.0000000000,2204.0000000000,1736.0000000000,R,True
ChernenkoNikola,Список патриотов: почему оппозиция и западные СМИ атакуют семьи российских политиков и чиновников  https://t.co/GKyHCcR9KS https://t.co/LzI09SHTu4,Unknown,Russian,2016-11-08T18:12:00,2016-11-08T18:12:00,243.0000000000,2204.0000000000,1743.0000000000,,False
ChernenkoNikola,Fantastic night view of #Moscow_City \| via @NovostiMsk https://t.co/8Nfn7clJ6t,Unknown,English,2016-11-08T22:08:00,2016-11-08T22:08:00,243.0000000000,2205.0000000000,1747.0000000000,R,True
