author_id,content,region,language,publish_date,harvested_date,following,followers,updates,post_type,retweet
ChernenkoNikola,В Севастополе и Ялте устроят рождественские балы для всей России  31 декабря 2016 г. и 7 января 2017 г. состоятся д  https://t.co/alZARkUfaJ https://t.co/9eNp4SMBBY,Unknown,Russian,2016-12-22T22:29:00,2016-12-22T22:29:00,242.0000000000,2096.0000000000,3398.0000000000,R,True
ChernenkoNikola,Жители Алеппо: Мы ждали этого дня пять лет. РЕН ТВ https://t.co/rGK7heHj4W,Unknown,Russian,2016-12-22T22:29:00,2016-12-22T22:29:00,242.0000000000,2096.0000000000,3395.0000000000,R,True
ChernenkoNikola,Some People Are Poor But Rich By The Heart ❤ https://t.co/xa3lnd2bEE,Unknown,English,2016-12-22T22:29:00,2016-12-22T22:29:00,242.0000000000,2096.0000000000,3391.0000000000,R,True
ChernenkoNikola,Apple отказалась разблокировать iPhone убийцы российского посла https://t.co/PYOTNwdaWC,Unknown,Russian,2016-12-22T22:29:00,2016-12-22T22:29:00,242.0000000000,2096.0000000000,3399.0000000000,R,True
ChernenkoNikola,Крым: сажать не пересажать. ФСБ «закрыло» очередных ненасытных VIP-ов https://t.co/t7MDlFHJrt,Unknown,Russian,2016-12-23T03:31:00,2016-12-23T03:31:00,242.0000000000,2097.0000000000,3405.0000000000,R,True
ChernenkoNikola,"Памятка берущему кредит. Сколько стоят жадность, глупость и эго? Автор: Александр Евстегнеев. / Экономика и... https://t.co/RDGEBhmMJl",Unknown,Russian,2016-12-23T03:31:00,2016-12-23T03:31:00,242.0000000000,2097.0000000000,3402.0000000000,R,True
ChernenkoNikola,'@s_775  при 80% ожогах помощь может быть только одна - родственникам на похороны',Unknown,Russian,2016-12-23T03:31:00,2016-12-23T03:31:00,242.0000000000,2097.0000000000,3401.0000000000,R,True
ChernenkoNikola,Москвичам предложили рюкзаки по 30 тысяч рублей https://t.co/K9bYVBTikw #Рубль #Карман #Кошелёк #Желание #Рюкзак,Unknown,Russian,2016-12-23T08:33:00,2016-12-23T08:33:00,242.0000000000,2096.0000000000,3417.0000000000,R,True
ChernenkoNikola,На юго-востоке Москвы насмерть забили японца https://t.co/KFXgf0irMS #Бульвар #Интерфакс #Момент #Убийца #Источник,Unknown,Russian,2016-12-23T08:33:00,2016-12-23T08:33:00,242.0000000000,2096.0000000000,3416.0000000000,R,True
ChernenkoNikola,Душанбе отменил рейсы «Уральских авиалиний» в ответ на действия РФ https://t.co/jRKllgYiTR #Авиакомпания #Таджикистан #РЕЙС #УФА #Челябинск,Unknown,Russian,2016-12-23T08:33:00,2016-12-23T08:33:00,242.0000000000,2096.0000000000,3414.0000000000,R,True
ChernenkoNikola,Александр Олешко и Родион Газманов стали жертвами мошенников https://t.co/5atwigI0fO #Александр #Олешко #Попрос #Билет #Екатерина,Unknown,Russian,2016-12-23T08:33:00,2016-12-23T08:33:00,242.0000000000,2096.0000000000,3413.0000000000,R,True
ChernenkoNikola,Глава СБУ предложил обсудить «автономию украинской Тюмени» https://t.co/FzkX9DAeO5 #Власть #Настроение #Грицак #Украина #Декабрь,Unknown,Russian,2016-12-23T08:33:00,2016-12-23T08:33:00,242.0000000000,2096.0000000000,3418.0000000000,R,True
ChernenkoNikola,Таджикистан отменил рейсы «Уральских авиалиний» в Душанбе https://t.co/HalZPBV6F0 #Таджикистан #Авиасообщение #Авиакомпания #Минтранс #РЕЙС,Unknown,Russian,2016-12-23T08:33:00,2016-12-23T08:33:00,242.0000000000,2096.0000000000,3415.0000000000,R,True
ChernenkoNikola,"'@Albin_Igor @Johnny_papai Слюняев, сдайте уже стадион!!!'",Unknown,Russian,2016-12-23T08:35:00,2016-12-23T08:35:00,242.0000000000,2096.0000000000,3424.0000000000,R,True
ChernenkoNikola,Сингапур ужесточил правила получения виз для женщин до 30 лет Власти Сингапура увеличили пакет документов для пол https://t.co/1kum9h8gAY https://t.co/r3CALaambS,Unknown,Ukrainian,2016-12-23T13:37:00,2016-12-23T13:37:00,242.0000000000,2096.0000000000,3429.0000000000,R,True
ChernenkoNikola,Говорят Пороху скорую вызывали. https://t.co/IXic2ZBg1T,Unknown,Russian,2016-12-23T13:37:00,2016-12-23T13:37:00,242.0000000000,2096.0000000000,3428.0000000000,R,True
ChernenkoNikola,Сельское хозяйство довело Юрия Лужкова до клинической смерти.В 80 лет нужно научиться ценить каждый прожитый день и не ускорять события. https://t.co/PtIyy6Y25R,Unknown,Russian,2016-12-23T13:37:00,2016-12-23T13:37:00,242.0000000000,2096.0000000000,3430.0000000000,R,True
ChernenkoNikola,"""Трамп победил благодаря лайкам и тестам"" https://t.co/vwuDuTcYE1 я и Ген. Дир. @Regru А. Королюк в гостях у @VRSoloviev в эфире @vesti_fm",Unknown,Russian,2016-12-23T13:37:00,2016-12-23T13:37:00,242.0000000000,2096.0000000000,3428.0000000000,R,True
ChernenkoNikola,"MORE: No access to #Steam’s store, communities or game servers https://t.co/WYz0SKe8zj https://t.co/xUuBComnWQ",Unknown,English,2016-12-23T18:39:00,2016-12-23T18:39:00,242.0000000000,2096.0000000000,3445.0000000000,R,True
ChernenkoNikola,"Котёнка залили цементом в трубе и оставили умирать. К счастью, его нашли добрые люди - https://t.co/u0TLGaRHie https://t.co/y3YpXCDVeP",Unknown,Russian,2016-12-23T18:39:00,2016-12-23T18:39:00,242.0000000000,2096.0000000000,3441.0000000000,R,True
ChernenkoNikola,"� Ключи многофункциональные регулируемые, 2 шт � https://t.co/Nqg8T57h2o  #aliexpress #алиэкспресс  Делай репо...  https://t.co/5f2f71KItM https://t.co/tmhaD5DBIr",Unknown,Russian,2016-12-23T18:39:00,2016-12-23T18:39:00,242.0000000000,2096.0000000000,3442.0000000000,R,True
ChernenkoNikola,Встреча с Президентом. Перспективные технологии в медицине. Энергетическая стратегия. СОБЫТИЯ НЕДЕЛИ #видеоблог https://t.co/jMljrNr4Cw,Unknown,Russian,2016-12-23T18:39:00,2016-12-23T18:39:00,242.0000000000,2096.0000000000,3439.0000000000,R,True
ChernenkoNikola,Мужчина открыл стрельбу по полицейским в Дагестане  https://t.co/B27epecqDr  Фото: nac. gov. ru #мужчина #стрельба #полиция #дагестан https://t.co/xgd9qQVpRi,Unknown,Russian,2016-12-23T18:39:00,2016-12-23T18:39:00,242.0000000000,2096.0000000000,3443.0000000000,R,True
ChernenkoNikola,"24 дек. 1991, 25 лет назад, в последний раз присвоено звание Герой Советского Союза – водолаз Леонид Солодков https://t.co/NDjvRXMUFQ",Unknown,Russian,2016-12-24T04:41:00,2016-12-24T04:42:00,242.0000000000,2096.0000000000,3454.0000000000,R,True
ChernenkoNikola,Макфол обвинил Трампа в “поливании грязью” американцев https://t.co/eV2fRaBxQ1 https://t.co/hKd1pnuBJ2,Unknown,Macedonian,2016-12-24T04:41:00,2016-12-24T04:41:00,242.0000000000,2096.0000000000,3448.0000000000,R,True
ChernenkoNikola,Европейская политика – обсуждение в студии  https://t.co/u1csPnHPa1 https://t.co/jCVrUWbYJN,Unknown,Bulgarian,2016-12-24T04:41:00,2016-12-24T04:41:00,242.0000000000,2096.0000000000,3452.0000000000,R,True
ChernenkoNikola,В #США собираются бороться с зарубежной пропагандой  Подробнее: https://t.co/dRUBELQEqu  Фото: Olivier Douliery/Pool via CNP/globallookpress https://t.co/AyGQtpxYJy,Unknown,Russian,2016-12-24T04:42:00,2016-12-24T04:42:00,242.0000000000,2096.0000000000,3455.0000000000,R,True
ChernenkoNikola,"Камень-обелиск на месте гибели лётчика-испытателя Героя Советского Союза .Валерия Петровича Чкалова у д. 52, корп. 2 по Хорошёвскому шоссе. https://t.co/p4QSrN3Y3Z",Unknown,Russian,2016-12-24T14:45:00,2016-12-24T14:46:00,242.0000000000,2095.0000000000,3457.0000000000,R,True
ChernenkoNikola,"""Caravaggio-esque"" photos with pop art twist [by an unknown French artist, found on Tweeter] ���� @NinaByzantina https://t.co/St6W6aIiBb",Unknown,English,2016-12-24T14:45:00,2016-12-24T14:45:00,242.0000000000,2095.0000000000,3458.0000000000,R,True
ChernenkoNikola,"Курдские отряды обороны в рамках операции ""Гнев Ефрата"" освободили от ИГ н.п. Тарак и Кама на северо-западе Ракки https://t.co/SFiS7Mxd3F https://t.co/ZomDEs8JEr",Unknown,Russian,2016-12-24T14:45:00,2016-12-24T14:45:00,242.0000000000,2095.0000000000,3465.0000000000,R,True
ChernenkoNikola,ОБСЕ в первую очередь https://t.co/HvZpI5P4UM,Unknown,Russian,2016-12-24T14:45:00,2016-12-24T14:45:00,242.0000000000,2095.0000000000,3462.0000000000,R,True
ChernenkoNikola,Француз превратил бетономешалку в диско-шар https://t.co/l7aOkdA15n #Сосед #Человек #ДРУГ #Светильник #Грузовик,Unknown,Russian,2016-12-24T19:46:00,2016-12-24T19:47:00,242.0000000000,2095.0000000000,3474.0000000000,R,True
ChernenkoNikola,Иркутский СК назвал кроссовки Nike признаком суицидальности детей https://t.co/qsboTN0CBn #Переписка #Группа #СЕТЬ #ЛИС #Соцсеть,Unknown,Russian,2016-12-24T19:46:00,2016-12-24T19:47:00,242.0000000000,2095.0000000000,3473.0000000000,R,True
ChernenkoNikola,Мое счастливое детство https://t.co/oVONI1dXOD https://t.co/3dUQJiNbCb,Unknown,Russian,2016-12-24T19:46:00,2016-12-24T19:46:00,242.0000000000,2095.0000000000,3469.0000000000,R,True
ChernenkoNikola,Путин и Роухани обсудили ситуацию в Сирии https://t.co/QL4OpJJnLA #Боевик #Декабрь #Сирия #Турция #Погиб,Unknown,Macedonian,2016-12-24T19:46:00,2016-12-24T19:46:00,242.0000000000,2095.0000000000,3472.0000000000,R,True
ChernenkoNikola,'@creative_twi @misttt25 Тут у любого диарея случится.',Unknown,Russian,2016-12-24T19:46:00,2016-12-24T19:46:00,242.0000000000,2095.0000000000,3465.0000000000,R,True
ChernenkoNikola,Пропавший над Чёрным морем Ту-154 должен был лететь в Сирию https://t.co/yXHhSCQNEp https://t.co/FXOi9v0pMZ,Unknown,Russian,2016-12-25T05:49:00,2016-12-25T05:51:00,242.0000000000,2093.0000000000,3478.0000000000,R,True
ChernenkoNikola,#Trump agrees with #Putin that one ‘must learn to lose with dignity’ https://t.co/7jf6UBbRJp  https://t.co/zNNfRDk4As,Unknown,English,2016-12-25T05:50:00,2016-12-25T05:50:00,242.0000000000,2093.0000000000,3484.0000000000,R,True
ChernenkoNikola,"СРОЧНО! Военный самолет Ту-154, вылетевший из Сочи в Сирию, пропал с радаров https://t.co/u5EPkMk7Bg https://t.co/6rwHTKvkRO",Unknown,Russian,2016-12-25T05:50:00,2016-12-25T05:50:00,242.0000000000,2093.0000000000,3480.0000000000,R,True
ChernenkoNikola,Летняя прогулка графа Румянцева  https://t.co/kOE3G1rIQX https://t.co/vyIjwW93x1,Unknown,Russian,2016-12-25T10:50:00,2016-12-25T10:50:00,242.0000000000,2093.0000000000,3491.0000000000,R,True
ChernenkoNikola,Брифинг официального представителя Минобороны России по ситуации с крушением ТУ-154 в районе Сочи  https://t.co/jjqoXKcsAr,Unknown,Russian,2016-12-25T10:50:00,2016-12-25T10:50:00,242.0000000000,2093.0000000000,3490.0000000000,R,True
ChernenkoNikola,"«Добро, сострадание, милосердие работают сильнее любого оружия», —речь Доктора Лизы в Кремле. Она находилась в разбившемся самолете. https://t.co/KMZWvKoLpb",Unknown,Russian,2016-12-25T15:51:00,2016-12-25T15:51:00,242.0000000000,2094.0000000000,3496.0000000000,R,True
ChernenkoNikola,Вспышка в небе во время крушения Ту-154. https://t.co/L4MaYQdncV,Unknown,Russian,2016-12-25T15:51:00,2016-12-25T15:51:00,242.0000000000,2094.0000000000,3500.0000000000,R,True
ChernenkoNikola,"А это по теме, про мразейц, и не только укро- https://t.co/EmE1GTCatz",Unknown,Ukrainian,2016-12-25T15:51:00,2016-12-25T15:51:00,242.0000000000,2094.0000000000,3499.0000000000,R,True
ChernenkoNikola,Друзья! Подпишите петицию в Следственный комитет на Божену  https://t.co/arQsGx643V Или сделайте ретвит!  #БоженуКОтвету,Unknown,Russian,2016-12-25T20:53:00,2016-12-25T20:53:00,242.0000000000,2093.0000000000,3509.0000000000,R,True
ChernenkoNikola,"Проблема Сирии-это МЕНТАЛЬНЫЙ ВЫБОР.Борьба ДОБРА со ЗЛОМ в мировом масштабе.И вполне возможно,что из-за этого может начаться МИРОВАЯ ВОЙНА.",Unknown,Russian,2016-12-25T20:53:00,2016-12-25T20:53:00,242.0000000000,2093.0000000000,3505.0000000000,R,True
ChernenkoNikola,Светлая память Великому доктору и герою #Цитаты@rus_improvisation https://t.co/0K69xi2XK5,Unknown,Russian,2016-12-26T01:54:00,2016-12-26T01:55:00,242.0000000000,2092.0000000000,3521.0000000000,R,True
ChernenkoNikola,"Много букв. Если кратко: хохлам пиздец  В Израиле угрожают, что скоро Украина проснется совсем в другом мире https://t.co/gl959iz73G",Unknown,Russian,2016-12-26T01:54:00,2016-12-26T01:54:00,242.0000000000,2092.0000000000,3516.0000000000,R,True
ChernenkoNikola,Очередное расширение. Платную парковку не остановить https://t.co/b23LYBEChL,Unknown,Russian,2016-12-26T01:54:00,2016-12-26T01:55:00,242.0000000000,2092.0000000000,3517.0000000000,R,True
ChernenkoNikola,'@TVMRRussia_2016 https://t.co/z8cH8QoUST',Unknown,Russian,2016-12-26T01:54:00,2016-12-26T01:54:00,242.0000000000,2092.0000000000,3518.0000000000,R,True
ChernenkoNikola,Пенсионную систему изменят только в 2019 году https://t.co/t7MG7kl1Qe #РОСТ #Минфин #Уровень #Реформа #Антон,Unknown,Russian,2016-12-26T01:54:00,2016-12-26T01:54:00,242.0000000000,2092.0000000000,3519.0000000000,R,True
ChernenkoNikola,Сейчас слушал как на @Radio_BFM всяких блядей корежит из-за установки памятников Сталину. Получил неимоверное удовольствие.,Unknown,Russian,2016-12-26T01:54:00,2016-12-26T01:54:00,242.0000000000,2092.0000000000,3515.0000000000,R,True
ChernenkoNikola,На борту разбившегося самолета было девять тележурналистов https://t.co/mb4229uA5U #Оператор #Вадим #ЖЕНА #Денисов #Александр,Unknown,Russian,2016-12-26T01:54:00,2016-12-26T01:55:00,242.0000000000,2092.0000000000,3520.0000000000,R,True
ChernenkoNikola,"�ДАРИМ ПОДАРКИ!�  Получите сразу 2 мужских подарка своим близким, а платите за один! При покупке часов со скид...  https://t.co/4REbIar238 https://t.co/whi5HtrRGc",Unknown,Russian,2016-12-26T01:55:00,2016-12-26T01:55:00,242.0000000000,2092.0000000000,3523.0000000000,R,True
ChernenkoNikola,"Это просто совпадение, бред заокеанского барана. https://t.co/NK7TyI3eOT",Unknown,Russian,2016-12-26T01:55:00,2016-12-26T01:55:00,242.0000000000,2092.0000000000,3522.0000000000,R,True
ChernenkoNikola,Добрых снов... https://t.co/jD3usa2m3k,Unknown,Bulgarian,2016-12-26T01:55:00,2016-12-26T01:55:00,242.0000000000,2092.0000000000,3524.0000000000,R,True
ChernenkoNikola,"Акционером ""Роснефти"" может стать еще один арабский фонд — СМИ  https://t.co/3gT9Beo5Hb",Unknown,Russian,2016-12-26T06:56:00,2016-12-26T06:56:00,242.0000000000,2092.0000000000,3528.0000000000,R,True
ChernenkoNikola,Опубликован снимок зоны крушения самолёта Ту-154 из космоса https://t.co/4KxvQ6hKcM https://t.co/aQZ4NYnUq1,Unknown,Russian,2016-12-26T12:21:00,2016-12-26T12:23:00,242.0000000000,2093.0000000000,3536.0000000000,R,True
ChernenkoNikola,"'@abatsia @3DUrSEwYbA7n7MN ну за блядь же забанят.... хотя, спрашивается, почему? Нормальное русское слово...'",Unknown,Russian,2016-12-26T12:21:00,2016-12-26T12:21:00,242.0000000000,2093.0000000000,3538.0000000000,R,True
ChernenkoNikola,"Фюзеляж Ту-154 найден на глубине 27 метров в 1,7 км от берега: ""по предварительным данным, фюзеляж сильно поврежден"" https://t.co/5FZkvW1bgH https://t.co/gEpVxL5zNe",Unknown,Russian,2016-12-26T12:22:00,2016-12-26T12:22:00,242.0000000000,2093.0000000000,3544.0000000000,R,True
ChernenkoNikola,"�% #ENews Как украинцы беспределят в Польше: убийства, наркотики, разбой и изнасилования https://t.co/MAhGtAGzbf",Unknown,Russian,2016-12-26T12:22:00,2016-12-26T12:22:00,242.0000000000,2093.0000000000,3542.0000000000,R,True
ChernenkoNikola,Прервать деградацию означает остановить победный и непрерывный марш контрреволюции. Вернуть народу собственность на средства производства.,Unknown,Russian,2016-12-26T17:25:00,2016-12-26T17:25:00,242.0000000000,2093.0000000000,3548.0000000000,R,True
ChernenkoNikola,"Воссоздание СССР - единственное, что может быть смыслом жизни для молодого и сознательного человека сегодня. Иначе - распад и вырождение.",Unknown,Russian,2016-12-26T17:25:00,2016-12-26T17:33:00,242.0000000000,2093.0000000000,3546.0000000000,R,True
ChernenkoNikola,Без общ собственности на средства прозводства невозможно государственное планирование. Без планирования невозможно спасти экономику и страну,Unknown,Russian,2016-12-26T17:25:00,2016-12-26T17:25:00,242.0000000000,2093.0000000000,3549.0000000000,R,True
ChernenkoNikola,Сирийский год https://t.co/TH2hKhiPlP #Сирия #Власть #Операция #Боевик #США,Unknown,Russian,2016-12-27T03:28:00,2016-12-27T03:28:00,242.0000000000,2093.0000000000,3556.0000000000,R,True
ChernenkoNikola,Pimp my ride: Car owners in Russia form giant winter objects in festive flashmob (PHOTOS) https://t.co/WBFtrWgSgN  https://t.co/52GyvuZ1b5 https://t.co/n4s1xO2WpB,Unknown,English,2016-12-27T03:28:00,2016-12-27T03:28:00,242.0000000000,2093.0000000000,3558.0000000000,R,True
ChernenkoNikola,Что наделала Росгвардия? https://t.co/yYS5Q9gP8r #Росгвардия #БОЕЦ #Охрана #Нацильна #Гвардия,Unknown,Russian,2016-12-27T03:28:00,2016-12-27T03:28:00,242.0000000000,2093.0000000000,3555.0000000000,R,True
ChernenkoNikola,27 декабря - День спасателя https://t.co/le2Itu3I4g #МЧС #Служба #Пожар #Ситуация #Помощь,Unknown,Macedonian,2016-12-27T03:28:00,2016-12-27T03:28:00,242.0000000000,2093.0000000000,3554.0000000000,R,True
ChernenkoNikola,#Осознание@rus_improvisation #Культура_и_традиции@rus_improvisation https://t.co/MFTNarDAg3,Unknown,Russian,2016-12-27T03:28:00,2016-12-27T03:28:00,242.0000000000,2093.0000000000,3563.0000000000,R,True
ChernenkoNikola,"«Он грел ее двое суток, чтобы она не замерзла и подвергал себя опасности каждый раз! ...»  https://t.co/jlFI1gbadA https://t.co/1Dk6tvl25M",Unknown,Russian,2016-12-27T03:28:00,2016-12-27T03:28:00,242.0000000000,2093.0000000000,3559.0000000000,R,True
ChernenkoNikola,Денис болеет за Спартак! Канешна..спартаковская мафия ему и орден дала!  Хахахаха!  Поздравляю Дениса. Он великолепный человек и музыкант! https://t.co/O8CpvFdBcn,Unknown,Russian,2016-12-27T08:29:00,2016-12-27T08:29:00,242.0000000000,2093.0000000000,3569.0000000000,R,True
ChernenkoNikola,"'@DassshaRussia @rls_the_kraken ...Офисант...ишо два ""Момента""!..И ""БФ"" - с нами дама...'",Unknown,Bulgarian,2016-12-27T13:32:00,2016-12-27T13:32:00,242.0000000000,2093.0000000000,3579.0000000000,R,True
ChernenkoNikola,"'@MadgunRus, страшнее антироссийских санкции могут быть только твитторские-расстрельные списки, которые составляют хохлы.'",Unknown,Russian,2016-12-27T13:32:00,2016-12-27T13:32:00,242.0000000000,2093.0000000000,3578.0000000000,R,True
ChernenkoNikola,Стрелявший по полиции мужчина покончил с собой в Москве https://t.co/xvRzcODnHP #Полиция #Момент #Дверь #МЧС #КЛУБ,Unknown,Russian,2016-12-27T18:34:00,2016-12-27T18:34:00,242.0000000000,2092.0000000000,3590.0000000000,R,True
ChernenkoNikola,"'@katMotja Эрдоган заявил, что у него есть доказательства поддержки ИГ в Сирии коалицией США https://t.co/bTjRKKJEv3 …'",Unknown,Russian,2016-12-27T18:34:00,2016-12-27T18:34:00,242.0000000000,2092.0000000000,3585.0000000000,R,True
ChernenkoNikola,Sony извинилась перед Спирс за сообщение о ее смерти https://t.co/APRCoozGT2 #Спирс #Смерть #Декабрь #Компания #Певица,Unknown,Russian,2016-12-27T18:34:00,2016-12-27T18:34:00,242.0000000000,2092.0000000000,3589.0000000000,R,True
ChernenkoNikola,"Для кого то Вы открыли сейчас глаза, а для кого то и америку. https://t.co/ygV86rNGKK",Unknown,Ukrainian,2016-12-27T18:34:00,2016-12-27T18:36:00,242.0000000000,2092.0000000000,3592.0000000000,R,True
ChernenkoNikola,"""We have confirmed evidence, with pictures, photos and videos"" - #Erdogan https://t.co/lFk2a4ts36 #Daesh https://t.co/wxFCyhPXX4",Unknown,English,2016-12-27T18:34:00,2016-12-27T18:34:00,242.0000000000,2092.0000000000,3586.0000000000,R,True
ChernenkoNikola,Свой среди чужих! https://t.co/5nYNJCxwZ9,Unknown,Russian,2016-12-27T18:34:00,2016-12-27T18:35:00,242.0000000000,2092.0000000000,3587.0000000000,R,True
ChernenkoNikola,Отстраненные лыжники Легков и Белов оспорят дисквалификацию https://t.co/rYBrhzeJ3U #Декабрь #Белов #Лыжник #«тура #Евгения,Unknown,Russian,2016-12-27T18:34:00,2016-12-27T18:35:00,242.0000000000,2092.0000000000,3588.0000000000,R,True
ChernenkoNikola,"Фильм ""Иерей-сан. Исповедь самурая"" https://t.co/vQSXOv627L с помощью @YouTube",Unknown,Russian,2016-12-27T23:35:00,2016-12-27T23:35:00,242.0000000000,2092.0000000000,3601.0000000000,R,True
ChernenkoNikola,"""Дубинушка"" с Дустом  https://t.co/P50Ltji2vy с помощью @YouTube",Unknown,Russian,2016-12-27T23:35:00,2016-12-27T23:35:00,242.0000000000,2092.0000000000,3603.0000000000,R,True
ChernenkoNikola,Catherine the Great was kinky and other R-rated historic facts you weren’t taught in school!  #NSFW https://t.co/XMwbMpmQLH,Unknown,English,2016-12-27T23:35:00,2016-12-27T23:35:00,242.0000000000,2092.0000000000,3598.0000000000,R,True
ChernenkoNikola,"'@ambruspresse @semargll @MID_RF @mod_russia God Bless my Orthodox brothers and sisters, the oldest Christian Church and Tradition!'",Unknown,English,2016-12-27T23:35:00,2016-12-27T23:35:00,242.0000000000,2092.0000000000,3599.0000000000,R,True
ChernenkoNikola,'@pglimonad Ходор всё равно - урод. Просто Ходор - хитрый урод.',Unknown,Russian,2016-12-27T23:35:00,2016-12-27T23:44:00,242.0000000000,2092.0000000000,3595.0000000000,R,True
ChernenkoNikola,МИД России отреагировал на сообщения о болгарском оружии в Алеппо  Официальный представитель МИД России Мария Зах  https://t.co/WYLlPt72mM https://t.co/ue92Nj3tnB,Unknown,Russian,2016-12-27T23:35:00,2016-12-27T23:35:00,242.0000000000,2092.0000000000,3600.0000000000,R,True
