author_id,content,region,language,publish_date,harvested_date,following,followers,updates,post_type,retweet
ChernenkoNikola,Путин отметил манипулятивный стиль предвыборной кампании в США...  https://t.co/QUqf1NM7zy https://t.co/XqoxH7ZMyp,Unknown,Russian,2016-09-17T13:33:00,2016-09-17T13:36:00,242.0000000000,99.0000000000,408.0000000000,R,True
ChernenkoNikola,Невменяемый мужчина с бензопилой напал на торговый центр в Минске https://t.co/Da5P4VJ15G #Топор #Бензопила #Минск #СМИ #Столица,Unknown,Serbian,2016-10-08T17:03:00,2016-10-08T17:04:00,242.0000000000,2324.0000000000,438.0000000000,R,True
ChernenkoNikola,"Бенгази, хакеры, фрекинг: что нового мы узнали о Клинтон из свежей публикации WikiLeaks https://t.co/nTJVPKpuT1 https://t.co/t5Ca5OlBVx",Unknown,Uzbek,2016-10-08T17:03:00,2016-10-08T17:03:00,242.0000000000,2324.0000000000,437.0000000000,R,True
ChernenkoNikola,Как немцы и русские либералы добивали Хонеккера  https://t.co/jCrgmMPiJ3 https://t.co/PJP84eggkg,Unknown,Russian,2016-10-08T17:03:00,2016-10-08T17:03:00,242.0000000000,2324.0000000000,440.0000000000,R,True
ChernenkoNikola,Новые документы ВикиЛикс просто уничтожают Хиллари Клинтон и выворачивают наизнанку нутро всей гнилой и продажной американской политики.,Unknown,Russian,2016-10-08T17:03:00,2016-10-08T17:03:00,242.0000000000,2324.0000000000,432.0000000000,R,True
ChernenkoNikola,"MORE: No arrests were made, investigation is under way into attempted murder https://t.co/Dr9zMlEWaL #Paris #France",Unknown,English,2016-10-08T22:04:00,2016-10-08T22:05:00,242.0000000000,2322.0000000000,449.0000000000,R,True
ChernenkoNikola,ПОДАРОК!!! Дарю. 2 недели бесплатной подписки на Букмейт! Просто установи приложение Букмейт по ссылке - и читай... https://t.co/AJiFtNEIbI,Unknown,Russian,2016-10-08T22:04:00,2016-10-08T22:04:00,242.0000000000,2322.0000000000,443.0000000000,R,True
ChernenkoNikola,Look at this big baby � https://t.co/TbmMMKTbGc,Unknown,English,2016-10-08T22:04:00,2016-10-08T22:04:00,242.0000000000,2322.0000000000,446.0000000000,R,True
ChernenkoNikola,"‘Do not treat us like a doormat, you’ll be sorry for it’ – Philippines President Duterte to US https://t.co/k3KoIRklaR",Unknown,English,2016-10-09T03:06:00,2016-10-09T03:06:00,242.0000000000,2322.0000000000,458.0000000000,R,True
ChernenkoNikola,US ready to 'achieve an immediate and durable end to #Yemen's tragic conflict' - Ned Price. NSC https://t.co/kwlVFAb7ZL,Unknown,English,2016-10-09T03:06:00,2016-10-09T03:06:00,242.0000000000,2322.0000000000,453.0000000000,R,True
ChernenkoNikola,На фото сын Героя России Магомеда Нурбагандова.  С медалью отца на груди! https://t.co/CKieXEmu1U,Unknown,Russian,2016-10-09T03:06:00,2016-10-09T03:06:00,242.0000000000,2322.0000000000,460.0000000000,R,True
ChernenkoNikola,Кипяток хлынул на улицы Санкт-Петербурга https://t.co/infpR9EI8X #Авария #Число #ДОМ #САД #Здание,Unknown,Russian,2016-10-09T03:06:00,2016-10-09T03:06:00,242.0000000000,2322.0000000000,456.0000000000,R,True
ChernenkoNikola,На фото сын Героя России Магомеда Нурбагандова.  / С медалью отца на груди! https://t.co/RSxNcDskuU,Unknown,Russian,2016-10-09T03:06:00,2016-10-09T03:06:00,242.0000000000,2322.0000000000,461.0000000000,R,True
ChernenkoNikola,Белый дом готов пересмотреть поддержку арабской коалиции  ВИДЕО: https://t.co/nHPA7liehD  #йемен #коалиция #поддержка #сша https://t.co/2qht0H8RH2,Unknown,Russian,2016-10-09T03:06:00,2016-10-09T03:06:00,242.0000000000,2322.0000000000,454.0000000000,R,True
ChernenkoNikola,"В Сирии обстрелян российский МИ-8, доставлявший гуманитарный груз в Хаму https://t.co/e9vaPYwlBj #Сторона #ИРАК #Мирений #Вертолет #ПЗРК",Unknown,Russian,2016-10-09T08:06:00,2016-10-09T08:07:00,242.0000000000,2321.0000000000,463.0000000000,R,True
ChernenkoNikola,Польская PKP LHS включена в состав Координационного комитета по развитию ТМТМ https://t.co/a7WjMfchZF #ТМТМ #Комитет #Китай #Заседание #ИТОГ,Unknown,Russian,2016-10-09T08:07:00,2016-10-09T08:07:00,242.0000000000,2321.0000000000,464.0000000000,R,True
ChernenkoNikola,"Она:А кем вы работаете? Он:Слесарем Она:Ой,это должно быть очень интересно!Все эти рашпили,керны,штихили !!!А я в этом ничего не понимаю(...",Unknown,Russian,2016-10-09T13:08:00,2016-10-09T13:08:00,242.0000000000,2318.0000000000,474.0000000000,R,True
ChernenkoNikola,В ДНР заявили о прибытии в Донбасс снайперов из США  https://t.co/xYvQP6PmWC,Unknown,Russian,2016-10-09T18:09:00,2016-10-09T18:09:00,242.0000000000,2314.0000000000,482.0000000000,R,True
ChernenkoNikola,В Краснодаре пьяный водитель протаранил во дворе дома 8 машин https://t.co/PPioAKK6ce,Unknown,Russian,2016-10-09T18:09:00,2016-10-09T18:09:00,242.0000000000,2314.0000000000,489.0000000000,R,True
ChernenkoNikola,"US now “ISIS’s Air Force” – false flags hit NYC, Jersey  https://t.co/A7Vyvhn7KL https://t.co/s7akpRR9iE",Unknown,English,2016-10-09T18:09:00,2016-10-09T18:10:00,242.0000000000,2314.0000000000,487.0000000000,R,True
ChernenkoNikola,Военные велосипеды - оружие на рубеже веков https://t.co/40mKQGXaif #Обозрение #Война #Изобретение #Велосипед,Unknown,Russian,2016-10-10T04:10:00,2016-10-10T04:10:00,242.0000000000,2303.0000000000,495.0000000000,R,True
ChernenkoNikola,Боевики ИГ атаковали лагерь турецких войск на севере Ирака https://t.co/PM8IMDWQza #Баашик #Лагерь #Пункт #Доброволец #Армия,Unknown,Serbian,2016-10-10T04:10:00,2016-10-10T04:10:00,242.0000000000,2303.0000000000,496.0000000000,R,True
ChernenkoNikola,СМИ сообщили об уничтожении в Ираке турецкого истребителя F-16 https://t.co/E5WV8q3fJz #ИРАК #Турция #Анкара #Провинция #Страна,Unknown,Russian,2016-10-10T04:10:00,2016-10-10T04:10:00,242.0000000000,2303.0000000000,497.0000000000,R,True
ChernenkoNikola,"Кипятильник стал причиной пожара в Аркалыке, где погибли двое детей https://t.co/4lKUrSCABw #Пожар #Ребёнок #Аркалык #Квартира #Помощь",Unknown,Russian,2016-10-10T04:10:00,2016-10-10T04:10:00,242.0000000000,2303.0000000000,498.0000000000,R,True
ChernenkoNikola,MUST WATCH A bloody day in #Yemen 800 civilians killed & injured by US-Saudi at Yemen Funeral Oct8 #WakeUpAmerica https://t.co/KVvW1kjnUi,Unknown,English,2016-10-10T04:10:00,2016-10-10T04:10:00,242.0000000000,2303.0000000000,492.0000000000,R,True
ChernenkoNikola,Видосик. https://t.co/ZBXzklmsIz,Unknown,Russian,2016-10-10T09:12:00,2016-10-10T09:12:00,242.0000000000,2299.0000000000,509.0000000000,R,True
ChernenkoNikola,«База Артистов» - СаваИгнатич \| Певцы https://t.co/riAZr22jBY,Unknown,Russian,2016-10-10T14:13:00,2016-10-10T14:13:00,242.0000000000,2298.0000000000,521.0000000000,R,True
ChernenkoNikola,"Друзья! Если вам нравится моё творчество, прошу проголосовать.) Спасибо!) СаваИгнатич на «База Артистов» \| Певцы https://t.co/NAzq1fFuVP",Unknown,Russian,2016-10-10T14:13:00,2016-10-10T14:14:00,242.0000000000,2298.0000000000,519.0000000000,R,True
ChernenkoNikola,tsargradtv: Зачем Турция вторглась в Северный Ирак?  https://t.co/67gRJi2pH5 https://t.co/7itKLG7Sq7,Unknown,Russian,2016-10-10T14:13:00,2016-10-10T14:13:00,242.0000000000,2298.0000000000,516.0000000000,R,True
ChernenkoNikola,"'Common ground': #Putin & #Erdogan to talk restoring trade, Turkish Stream, Syria cooperation in #Istanbul https://t.co/dqROis0Mkf https://t.co/IsIrzRpFjo",Unknown,English,2016-10-10T14:13:00,2016-10-10T14:13:00,242.0000000000,2298.0000000000,512.0000000000,R,True
ChernenkoNikola,Norway mulls US troop deployment on its soil   https://t.co/iE6tJVGcmI https://t.co/uCaddkw8xv,Unknown,English,2016-10-10T19:14:00,2016-10-10T19:14:00,242.0000000000,2293.0000000000,531.0000000000,R,True
ChernenkoNikola,Глобальный силовой порядок https://t.co/rZn2yGTcw3 https://t.co/xZMAcJmB4n,Unknown,Russian,2016-10-10T19:14:00,2016-10-10T19:14:00,242.0000000000,2293.0000000000,530.0000000000,R,True
ChernenkoNikola,Турецкий поток - это в принципе и есть основная причина начала войны в Сирии.,Unknown,Russian,2016-10-10T19:14:00,2016-10-10T19:14:00,242.0000000000,2293.0000000000,529.0000000000,R,True
ChernenkoNikola,Подписание договора по «Турецкому потоку» практически означает окончание горячей фазы войны в Сирии.Военная и дипломатическая победа Путина,Unknown,Russian,2016-10-10T19:14:00,2016-10-10T19:14:00,242.0000000000,2293.0000000000,525.0000000000,R,True
ChernenkoNikola,СМИ: Турция может рассмотреть предложение России по системе ПРО https://t.co/BPWqwV5qsX,Unknown,Russian,2016-10-10T19:14:00,2016-10-10T19:14:00,242.0000000000,2293.0000000000,524.0000000000,R,True
ChernenkoNikola,Арабский эксперт: российская база в Сирии создаст новую реальность в мире \| РИА Новости https://t.co/fv5OE2Gtrh,Unknown,Russian,2016-10-10T19:14:00,2016-10-10T19:14:00,242.0000000000,2293.0000000000,526.0000000000,R,True
ChernenkoNikola,СМИ: российский бюджет компенсирует «Газпрому» скидку для Минска https://t.co/wnremtJb0c #Миллиард #Рубль #ГАЗ #Минск #Белоруссия,Unknown,Russian,2016-10-11T10:22:00,2016-10-11T10:22:00,242.0000000000,2290.0000000000,533.0000000000,R,True
ChernenkoNikola,Новое азербайджано-российское СП выпускает акции https://t.co/MgszZjbIuN #ЗАО #Акция #Манат #Вторник #ДОЛЯ,Unknown,Russian,2016-10-11T10:22:00,2016-10-11T10:22:00,242.0000000000,2290.0000000000,534.0000000000,R,True
ChernenkoNikola,"Очень жаль, что 14-15 октября на вертеп русофобов прилетят не все. Погоду например бы сделал прилетевший к ним Град.. Услышь меня, Боже! https://t.co/joPMcjzHjr",Unknown,Russian,2016-10-11T10:22:00,2016-10-11T10:22:00,242.0000000000,2290.0000000000,532.0000000000,R,True
ChernenkoNikola,lol https://t.co/nORLdxR14M,Unknown,Russian,2016-10-11T15:28:00,2016-10-11T15:30:00,243.0000000000,2287.0000000000,543.0000000000,R,True
ChernenkoNikola,#Юмор@rus_improvisation https://t.co/igZgnaKAm9,Unknown,Russian,2016-10-11T15:29:00,2016-10-11T15:29:00,243.0000000000,2287.0000000000,549.0000000000,R,True
ChernenkoNikola,"Clinton & Trump rock college campuses, students a no-show (Op-Edge by @Robert_Bridge) https://t.co/4XkwNuCEHl",Unknown,English,2016-10-11T15:29:00,2016-10-11T15:29:00,243.0000000000,2287.0000000000,550.0000000000,R,True
ChernenkoNikola,Белый дом назвал отвратительными высказывания Трампа о женщинах   https://t.co/qfPhbZYXDA https://t.co/kBDc7IYXI9,Unknown,Russian,2016-10-11T20:30:00,2016-10-11T20:31:00,243.0000000000,2285.0000000000,553.0000000000,R,True
ChernenkoNikola,В сирийских школах Русский язык стал обязательным к изучению! на основании указа Б.Асада #Сирия #Syria https://t.co/min5BFdqDZ,Unknown,Russian,2016-10-11T20:30:00,2016-10-11T20:31:00,243.0000000000,2285.0000000000,554.0000000000,R,True
ChernenkoNikola,"White House: Response to Russia hack will be ""proportional"" and without warning https://t.co/EM4QKyM5Kr https://t.co/ZILQ5C0X8o",Unknown,English,2016-10-11T20:31:00,2016-10-11T20:31:00,243.0000000000,2285.0000000000,555.0000000000,R,True
ChernenkoNikola,"Либеральный Росбалт сообщает:  Активист, дежуривший у мемориала Немцова, подвергся избиению  У.. https://t.co/2rqt19P5rM",Unknown,Russian,2016-10-11T20:31:00,2016-10-11T20:31:00,243.0000000000,2285.0000000000,561.0000000000,R,True
ChernenkoNikola,Did #SaudiArabia help fund ISIS? Is US complicit in #Yemen funeral airstrike? And is #Haiti bound for famine? Watch> https://t.co/3aSCCo3Anj https://t.co/Bi1Xo8xfCs,Unknown,English,2016-10-11T20:31:00,2016-10-11T20:31:00,243.0000000000,2285.0000000000,556.0000000000,R,True
ChernenkoNikola,"Ну, ёлки. Хоть кто-то это нарисовал...  https://t.co/z67PNrwj5q https://t.co/fjzNg16sC2",Unknown,Russian,2016-10-11T20:31:00,2016-10-11T20:31:00,243.0000000000,2285.0000000000,557.0000000000,R,True
ChernenkoNikola,From $70bn to $20bn: Saudi Arabia to slash capital spending https://t.co/SzgXYxAjnG,Unknown,English,2016-10-12T01:32:00,2016-10-12T01:32:00,243.0000000000,2296.0000000000,569.0000000000,R,True
ChernenkoNikola,Подполковник США заявил о господстве ВКС России над Сирией https://t.co/Y9yg5kFsYj #Питерс #Клинтон #Отставка #Подполковник #НЕБО,Unknown,Russian,2016-10-12T01:32:00,2016-10-12T01:32:00,243.0000000000,2296.0000000000,567.0000000000,R,True
ChernenkoNikola,Ex-Danish spy agency boss sued after alleged secret information disclosure https://t.co/UbgvThdypU https://t.co/CcdmZs1miR,Unknown,English,2016-10-12T06:31:00,2016-10-12T06:31:00,243.0000000000,2297.0000000000,581.0000000000,R,True
ChernenkoNikola,#Наши_герои@rus_improvisation https://t.co/3he5sxhwvF,Unknown,Russian,2016-10-12T06:31:00,2016-10-12T06:31:00,243.0000000000,2297.0000000000,576.0000000000,R,True
ChernenkoNikola,"Очки экипировки ""Ратник"" защищают от осколков, летящих со скоростью 350 м/с \| РИА Новости https://t.co/ZrimZgyDGf",Unknown,Russian,2016-10-12T11:33:00,2016-10-12T11:33:00,243.0000000000,2295.0000000000,585.0000000000,R,True
ChernenkoNikola,Минобороны: сотрудничество России и Китая не направлено против других стран \| РИА Новости https://t.co/I1kKJE344c,Unknown,Russian,2016-10-12T11:33:00,2016-10-12T11:33:00,243.0000000000,2295.0000000000,586.0000000000,R,True
ChernenkoNikola,СМИ: в случае войны ФСБ и полицию подчинят военным \| РИА Новости https://t.co/Z83HdHhIta,Unknown,Russian,2016-10-12T11:33:00,2016-10-12T11:34:00,243.0000000000,2295.0000000000,589.0000000000,R,True
ChernenkoNikola,"'- Мы умнее, сильнее и решительнее!   Жесткое интервью советника президента РФ немецкому журналу Spiegel (не афиш...  https://t.co/BKiLww0zmk https://t.co/dpsPNINO4Z'",Unknown,Russian,2016-10-12T11:34:00,2016-10-12T11:34:00,243.0000000000,2295.0000000000,590.0000000000,R,True
ChernenkoNikola,Китай готов разрешить доступ к Facebook https://t.co/IXZCzQHis7 #КНР #Китай #Доступ #Миллион #Интер,Unknown,Russian,2016-10-12T11:34:00,2016-10-12T11:34:00,243.0000000000,2295.0000000000,591.0000000000,R,True
ChernenkoNikola,Дели выдвигает свою кандидатуру на пост главы Приднестровья https://t.co/9O71ehLPA1,Unknown,Russian,2016-10-12T16:33:00,2016-10-12T16:33:00,243.0000000000,2295.0000000000,593.0000000000,R,True
ChernenkoNikola,Под Симферополем задержали нескольких членов «Хизб ут-Тахрир» (ВИДЕО) https://t.co/9vm7Ot4IEh https://t.co/T1FiIocs9H,Unknown,Russian,2016-10-12T16:33:00,2016-10-12T16:33:00,243.0000000000,2295.0000000000,596.0000000000,R,True
ChernenkoNikola,Шарлиз Терон представила аромат Dior https://t.co/uwoAHptOtk #Шарлиз #Терон #Девушка #Режиссер #Фотограф,Unknown,Russian,2016-10-12T16:33:00,2016-10-12T16:33:00,243.0000000000,2295.0000000000,601.0000000000,R,True
ChernenkoNikola,"[club124685114\|К РЫЦАРЯМ БЕЗ СТРАХА И УПРЕКА]  Mon Dieu, mon Roi, ma Dame Наш девиз.. https://t.co/gZ4EfiVZd5",Unknown,Russian,2016-10-12T16:33:00,2016-10-12T16:33:00,243.0000000000,2295.0000000000,594.0000000000,R,True
ChernenkoNikola,'@misttt25 @salty_1970 одна пара на двоих будет',Unknown,Russian,2016-10-12T16:33:00,2016-10-12T16:33:00,243.0000000000,2295.0000000000,595.0000000000,R,True
ChernenkoNikola,В НИИ неотложной детской хирургии рассказали о дочери Емельяненко https://t.co/mwQGTQT8u4 #Травматология #Хирургия #Клетка #НИИ #Емельяненко,Unknown,Russian,2016-10-12T16:33:00,2016-10-12T16:33:00,243.0000000000,2295.0000000000,600.0000000000,R,True
ChernenkoNikola,Смартфон Sony Xperia XZ можно предзаказать в РФ https://t.co/7sPREtvo81 #Смартфон #Рубль #Память #ЦЕНА #Камера,Unknown,Russian,2016-10-12T16:33:00,2016-10-12T16:33:00,243.0000000000,2295.0000000000,598.0000000000,R,True
ChernenkoNikola,Russia v The EU. https://t.co/8MgzxarMiv,Unknown,English,2016-10-12T21:34:00,2016-10-12T21:34:00,243.0000000000,2295.0000000000,609.0000000000,R,True
ChernenkoNikola,'@lifenews_ru Не надо нам про “бабенок” заливать. Сленг суров и незачем причесывать слова Лаврова. @vasilieva86xxx   https://t.co/4K7HATtzXz',Unknown,Russian,2016-10-12T21:34:00,2016-10-12T21:34:00,243.0000000000,2295.0000000000,614.0000000000,R,True
ChernenkoNikola,Meanwhile in Russia. https://t.co/ZnmR7R2n9t,Unknown,English,2016-10-12T21:34:00,2016-10-12T21:34:00,243.0000000000,2295.0000000000,610.0000000000,R,True
ChernenkoNikola,"Aliens could survive on a diet of radiation, study finds https://t.co/caA468idHt https://t.co/wmrrIzXW5d",Unknown,English,2016-10-13T02:35:00,2016-10-13T02:35:00,243.0000000000,2295.0000000000,622.0000000000,R,True
ChernenkoNikola,#Юмор@rus_improvisation https://t.co/0BMCf6zRgM,Unknown,Russian,2016-10-13T02:35:00,2016-10-13T02:35:00,243.0000000000,2295.0000000000,623.0000000000,R,True
ChernenkoNikola,"Жительница Бурятии откармливала собаку, чтобы продать на мясо   https://t.co/lfoGxLfNqi  Фото: P. Wegner / Arco Images/Globallookpress https://t.co/wqwiuwIDbF",Unknown,Russian,2016-10-13T02:35:00,2016-10-13T02:35:00,243.0000000000,2295.0000000000,617.0000000000,R,True
ChernenkoNikola,"Хакеры украли у владельцев Android в РФ 348,6 млн рублей https://t.co/IWvUObLrIK #Помощь #Апрель #МАРТ #Миллион #Устройство",Unknown,Russian,2016-10-13T02:35:00,2016-10-13T02:35:00,243.0000000000,2295.0000000000,624.0000000000,R,True
ChernenkoNikola,На Луне за семь лет образовались 222 новых кратера   https://t.co/GMcMnNsgso  Фото: nasa. gov #луна #кратеры https://t.co/KCaPYfgAFs,Unknown,Russian,2016-10-13T02:35:00,2016-10-13T02:35:00,243.0000000000,2295.0000000000,620.0000000000,R,True
ChernenkoNikola,Россияне стали меньше пить в 2016 году   https://t.co/Hhd0oxEvUW  Фото: CHROMORANGE/Reinhold Tscherwit/Globallookpress #россия #алкоголь https://t.co/wPloWONK7C,Unknown,Russian,2016-10-13T02:35:00,2016-10-13T02:35:00,243.0000000000,2295.0000000000,619.0000000000,R,True
ChernenkoNikola,Вацлав Клаус: Европейская пропаганда разрушает Чехию https://t.co/EBOOnr45Ad https://t.co/9EdfcUDkLF,Unknown,Russian,2016-10-13T07:36:00,2016-10-13T07:36:00,243.0000000000,2294.0000000000,627.0000000000,R,True
ChernenkoNikola,Лебзяк получит премию за выступление сборной России на ОИ https://t.co/UWVqgOSsIb #Лебзяк #Команда #Выступление #Иванюженков #ФБР,Unknown,Russian,2016-10-13T07:37:00,2016-10-13T07:37:00,243.0000000000,2294.0000000000,630.0000000000,R,True
ChernenkoNikola,Прямая трансляция предвыборного штаба Хиллари после публикации WikiLeaks её положительных высказываний в адрес Путина. https://t.co/WB4rQeNITU,Unknown,Russian,2016-10-13T07:37:00,2016-10-13T07:37:00,243.0000000000,2294.0000000000,636.0000000000,R,True
ChernenkoNikola,Около 200 московских хостелов допустили к работе на ЧМ-2018 https://t.co/lSyk36btRB #Хостел #МИР #Гостиница #Москва #Болельщик,Unknown,Russian,2016-10-13T07:37:00,2016-10-13T07:37:00,243.0000000000,2294.0000000000,631.0000000000,R,True
ChernenkoNikola,В Одесской области введен режим ЧС из-за непогоды https://t.co/9iyVbmH7Id #Область #Ветер #Результат #Пункт #Украина,Unknown,Ukrainian,2016-10-13T07:37:00,2016-10-13T07:37:00,243.0000000000,2294.0000000000,632.0000000000,R,True
ChernenkoNikola,"Выглядит как нытье человека отстраненного от кормушки. Да и в советское время верхом пропаганды была Morning Star, что как бы совсем не RT. https://t.co/xMRfd11yhE",Unknown,Russian,2016-10-13T12:38:00,2016-10-13T12:38:00,243.0000000000,2294.0000000000,640.0000000000,R,True
ChernenkoNikola,Доску Маннергейму перенесли в музей в Царском Селе https://t.co/c3Q1vZCYjf,Unknown,Russian,2016-10-13T22:38:00,2016-10-13T22:38:00,243.0000000000,2291.0000000000,654.0000000000,R,True
ChernenkoNikola,"'@osmaktv струхнули, так что аж в Джанкое вонь стояла от обосранных шаровар.'",Unknown,Russian,2016-10-13T22:38:00,2016-10-13T22:38:00,243.0000000000,2291.0000000000,648.0000000000,R,True
ChernenkoNikola,"MORE: Blast killed 30 rebels at Jabhat al Shamiya's checkpoint,  part of #Ankara-backed FSA, dozens injured – report https://t.co/oNZV8jqYFT",Unknown,English,2016-10-13T22:38:00,2016-10-13T22:39:00,243.0000000000,2291.0000000000,653.0000000000,R,True
ChernenkoNikola,"Дата дняСент-Женевьев де Буа. Кладбище великихНа кладбище более 7000 русских могил, в том.. https://t.co/XSbmfUQZKI",Unknown,Russian,2016-10-14T03:40:00,2016-10-14T03:40:00,243.0000000000,2288.0000000000,662.0000000000,R,True
ChernenkoNikola,https://t.co/Y7XHFtc53W,Unknown,Russian,2016-10-14T03:40:00,2016-10-14T03:41:00,243.0000000000,2288.0000000000,661.0000000000,R,True
ChernenkoNikola,"Константиновское военное училище.  Осенью 1920 года, город Феодосия собирался ставить на набережной.. https://t.co/n66gAlR9bP",Unknown,Russian,2016-10-14T03:40:00,2016-10-14T03:40:00,243.0000000000,2288.0000000000,666.0000000000,R,True
ChernenkoNikola,Завершена приемка первого агрегата Ил-112 https://t.co/FoJRL01qlL,Unknown,Russian,2016-10-14T03:40:00,2016-10-14T03:40:00,243.0000000000,2288.0000000000,664.0000000000,R,True
ChernenkoNikola,"Незабытые могилыПОЛЯНСКИЙ Николай Петрович  (1899 - 6 октября 1969, Париж, похоронен.. https://t.co/Qdj41Sl9KQ",Unknown,Ukrainian,2016-10-14T03:40:00,2016-10-14T03:40:00,243.0000000000,2288.0000000000,663.0000000000,R,True
ChernenkoNikola,"В Якутии эвакуируют геологов, застрявших в тайге из-за непогоды   https://t.co/atA9aUytgL  Фото: Viktor Gritsuk/Globallookpress #якутия https://t.co/aoTSs7riLA",Unknown,Ukrainian,2016-10-14T03:40:00,2016-10-14T03:40:00,243.0000000000,2288.0000000000,659.0000000000,R,True
ChernenkoNikola,"#Порошенко отказался выполнять минские соглашения, пока не станет ""безопасно"" https://t.co/ZC0snUcDb7 https://t.co/HO5GrMzBdW",Unknown,Russian,2016-10-14T08:41:00,2016-10-14T08:41:00,243.0000000000,2287.0000000000,671.0000000000,R,True
ChernenkoNikola,"#Порошенко: за 2,5 года в #АТО приняли участие 280 тысяч украинцев  https://t.co/IVjkP46Zof",Unknown,Ukrainian,2016-10-14T08:41:00,2016-10-14T08:41:00,243.0000000000,2287.0000000000,673.0000000000,R,True
