author_id,content,region,language,publish_date,harvested_date,following,followers,updates,post_type,retweet
Czar_The_One,Вчера Айдар провокационно захватил 2х бойцов Народной милиции ЛНР на её территории. А как же Минские договоренности?  http://t.co/nX2ytzZfYU,Russian Federation,Russian,2015-05-17T17:27:00,2015-05-17T17:28:00,990.0000000000,107.0000000000,462.0000000000,R,True
Czar_The_One,почему The New York Times вдруг стала называть вещи своими именами?! http://t.co/WTM9Em5s3E,Russian Federation,Russian,2015-05-20T09:52:00,2015-05-20T09:52:00,990.0000000000,107.0000000000,464.0000000000,R,True
Czar_The_One,"Презентация музея ""Зенита""   http://t.co/qiNvkktqdw",Russian Federation,Bulgarian,2015-05-29T17:29:00,2015-05-29T17:30:00,991.0000000000,107.0000000000,470.0000000000,R,True
Czar_The_One,"#ПМЭФ-2015: Путин рассказал, как Россия ответит на санкции Запада #ЗапасПрочности",Russian Federation,Russian,2015-06-19T15:16:00,2015-06-19T15:16:00,974.0000000000,107.0000000000,477.0000000000,,False
Czar_The_One,Путин: Россия в ответ на санкции Запада расширяет свободу бизнеса #ЗапасПрочности,Russian Federation,Russian,2015-06-19T15:18:00,2015-06-19T15:18:00,974.0000000000,107.0000000000,479.0000000000,,False
Czar_The_One,Владимир Путин: Россия отвечает открытостью рынка на западные санкции #ЗапасПрочности,Russian Federation,Russian,2015-06-19T15:37:00,2015-06-19T15:37:00,974.0000000000,107.0000000000,482.0000000000,,False
Czar_The_One,"Это новость часа Канада ввела санкции против ""Ночных волков"" Смешно до слез  http://t.co/OFSfjd75iu http://t.co/FKOIkdonFW",Russian Federation,Russian,2015-06-29T18:43:00,2015-06-29T18:43:00,974.0000000000,107.0000000000,492.0000000000,R,True
Czar_The_One,Россия впервые начала учения сил и войск Северного флота на полуострове Таймыр в Арктике http://t.co/aDBMto1T5I http://t.co/9DXEPK56CK,Russian Federation,Russian,2015-08-24T07:31:00,2015-08-24T07:31:00,965.0000000000,107.0000000000,531.0000000000,R,True
Czar_The_One,"'@leprasorium хочешь выучить разные языки ,покатайся в такси'",Russian Federation,Russian,2015-09-09T03:31:00,2015-09-09T03:31:00,961.0000000000,106.0000000000,545.0000000000,,False
Czar_The_One,"США выступили против строительства ""Северного потока-2""  https://t.co/5iVMYGqebg https://t.co/mIgemz9bRo",Russian Federation,Russian,2015-11-07T10:03:00,2015-11-07T10:04:00,945.0000000000,102.0000000000,564.0000000000,R,True
Czar_The_One,Сергею Митрохину грозит до 15 суток ареста за установку мемориальной таблички: https://t.co/DP39Yk3BLR https://t.co/zkGJzMFmfU,Russian Federation,Ukrainian,2015-11-07T13:16:00,2015-11-07T13:17:00,945.0000000000,102.0000000000,565.0000000000,R,True
Czar_The_One,'@realDonaldTrump @Morning_Joe @morningmika @DonaldJTrumpJr @EricTrump  Трамп поддержит операцию РФ в Сирии https://t.co/qKJh9CGvDa',Russian Federation,Russian,2015-11-11T15:51:00,2015-11-11T15:51:00,944.0000000000,102.0000000000,573.0000000000,R,True
Czar_The_One,Обращение Сергея Поспелова @pospelovsv к Генеральной ассамблее ООН https://t.co/ov81mj6Ary @fadm_ru #ВДФМ https://t.co/rQzcqiTFn9,Russian Federation,Russian,2015-11-12T09:45:00,2015-11-12T09:46:00,945.0000000000,102.0000000000,574.0000000000,R,True
Czar_The_One,Публичная порка Фольксвагена или как VW загрязняет США https://t.co/gjQDwWjMg1,Russian Federation,Russian,2015-11-12T11:14:00,2015-11-12T11:14:00,944.0000000000,102.0000000000,576.0000000000,R,True
Czar_The_One,'@realDonaldTrump @WSJ https://t.co/C7iMqjHINI',Russian Federation,Russian,2015-11-12T11:42:00,2015-11-12T11:43:00,944.0000000000,102.0000000000,577.0000000000,R,True
Czar_The_One,У Михо гарем просто  https://t.co/QKfoKvQrhq https://t.co/R4zuoeAQtH,Russian Federation,Russian,2015-11-12T12:02:00,2015-11-12T12:02:00,944.0000000000,102.0000000000,579.0000000000,R,True
Czar_The_One,'@GrahamWP_UK Штаб ДНР: силовики занимают демилитаризованную зону в Широки https://t.co/NC2UrQ1Vpg https://t.co/oKjeO9XiuG',Russian Federation,Russian,2015-11-18T15:43:00,2015-11-18T15:43:00,945.0000000000,103.0000000000,585.0000000000,R,True
Czar_The_One,Один из пилотов российского истребителя задержан турецкими военными на севере Сирии  https://t.co/1TzHZQkuCV https://t.co/cxatvyuFuR,Russian Federation,Russian,2015-11-24T09:07:00,2015-11-24T09:07:00,946.0000000000,104.0000000000,597.0000000000,R,True
Czar_The_One,"В результате крушения Су-24 погибли оба пилота, передает SkyNews  https://t.co/l9YtmbeWwh #Су24 #Turkey https://t.co/ww4CocvWnt",Russian Federation,Russian,2015-11-24T13:25:00,2015-11-24T13:25:00,946.0000000000,104.0000000000,598.0000000000,R,True
Czar_The_One,"Турецкие соцсети: ""Я тут слышу, началась война с Россией. Я, пожалуй, побегу"" #Су24 #УдарВСпину #Turkey https://t.co/lS15TnixrD",Russian Federation,Russian,2015-11-24T13:59:00,2015-11-24T13:59:00,946.0000000000,104.0000000000,599.0000000000,R,True
Czar_The_One,ВС Турции приведены в повышенную боеготовность и стягивают Вооруженные силы к границе с Сирией #Turkey #УдарВСпину https://t.co/aybMqv9V0d,Russian Federation,Russian,2015-11-24T14:52:00,2015-11-24T14:53:00,946.0000000000,104.0000000000,601.0000000000,R,True
Czar_The_One,"Пентагон не подтвердил, что сбитый Су-24 находился в воздушном пространстве Турции #Су24 #Turkey https://t.co/XGeD210Cde",Russian Federation,Russian,2015-11-24T15:44:00,2015-11-24T15:44:00,946.0000000000,104.0000000000,602.0000000000,R,True
Czar_The_One,Жители Кипра просят разместить на острове российскую военную базу  https://t.co/WJk6n9O3Lc #Turkey #Су24 #УдарВСпину https://t.co/saE4o4rhas,Russian Federation,Russian,2015-11-24T17:41:00,2015-11-24T17:41:00,946.0000000000,104.0000000000,604.0000000000,R,True
Czar_The_One,"Вертолёт Ми-17был подбит и приземлился в районе Латакии, экипаж покинул борт и после этого его добили повстанцы из ССА #Turkey #УдарВСпину",Russian Federation,Russian,2015-11-24T17:55:00,2015-11-24T17:55:00,946.0000000000,104.0000000000,605.0000000000,R,True
Czar_The_One,Путин призывает Азербайджан и Армению к немедленному прекращению огня и проявлению сдержанности #СтопВойна https://t.co/S9QkOb9BVQ,Russian Federation,Russian,2016-04-02T15:05:00,2016-04-02T15:05:00,823.0000000000,98.0000000000,612.0000000000,R,True
Czar_The_One,#КашаПищаНаша Каждому человеку по тарелке гречневой каши! )) https://t.co/lHCW2e0vx1,Russian Federation,Russian,2016-04-14T14:20:00,2016-04-14T14:20:00,823.0000000000,98.0000000000,617.0000000000,R,True
Czar_The_One,#КашаПищаНаша ешь кашу! https://t.co/YBNUVDnyDo,Russian Federation,Russian,2016-04-14T14:20:00,2016-04-14T14:20:00,823.0000000000,98.0000000000,616.0000000000,R,True
Czar_The_One,#УлыбайсяКакСкобрев Скорбев- новый министр Счастья. https://t.co/SAMNFMb0gh,Russian Federation,Russian,2016-04-15T15:36:00,2016-04-15T15:36:00,823.0000000000,98.0000000000,621.0000000000,R,True
Czar_The_One,Новые российские самолеты вскоре полностью заменят Boeing и Airbus  https://t.co/GkFzGQyAFE https://t.co/4TNTOBruH1,Russian Federation,Russian,2016-04-19T15:18:00,2016-04-19T15:18:00,822.0000000000,98.0000000000,628.0000000000,R,True
Czar_The_One,Куда пойти? Куда податься? Где бы еще провороваться? � #Яценюк #Ураина #Гройсман #TNMT  https://t.co/spyWKBR7N5,Russian Federation,Russian,2016-04-20T11:34:00,2016-04-20T11:36:00,822.0000000000,98.0000000000,632.0000000000,R,True
Czar_The_One,"Сирийская семья, жившая в аэропорту, получила убежище в России и паспорта.  #СемьяАхмед https://t.co/7AB45ddxZb",Russian Federation,Russian,2016-04-25T17:00:00,2016-04-25T17:00:00,821.0000000000,99.0000000000,634.0000000000,R,True
Czar_The_One,#МойГерой Гагарин https://t.co/mHAJ8aiUZk,Russian Federation,Uzbek,2016-04-30T15:48:00,2016-04-30T15:48:00,821.0000000000,100.0000000000,641.0000000000,R,True
Czar_The_One,"Президент вручил медали «Герой Труда Российской Федерации» россиянам, внёсшим  #МойГерой https://t.co/JljpJ7YeMx",Russian Federation,Russian,2016-04-30T15:54:00,2016-04-30T15:54:00,821.0000000000,100.0000000000,644.0000000000,R,True
Czar_The_One,#Eurovision #Евровидение #Содом #конкурс #финал  https://t.co/LOcb4JY2Ay,Russian Federation,Russian,2016-05-13T15:20:00,2016-05-13T15:20:00,821.0000000000,100.0000000000,656.0000000000,R,True
Czar_The_One,Our @yelenaisinbaeva #TheBestFromTheBest  #LetElenaPlay! Please support #ЛенаМыСТобой @RusConsulGen! https://t.co/cXcIWDbXOw,Russian Federation,Russian,2016-08-15T16:23:00,2016-08-15T16:25:00,810.0000000000,98.0000000000,662.0000000000,R,True
Czar_The_One,Украинский Ощадбанк выиграл суд относительно бренда Сбербанк,Russian Federation,Russian,2017-04-19T10:10:00,2017-04-19T10:10:00,797.0000000000,93.0000000000,665.0000000000,,False
Czar_The_One,Аэрофлот борется с перевесом,Russian Federation,Russian,2017-04-19T10:32:00,2017-04-19T10:32:00,797.0000000000,93.0000000000,666.0000000000,,False
