author_id,content,region,language,publish_date,harvested_date,following,followers,updates,post_type,retweet
JuanthomssTrumT,"VIDEO : Bolling “Think Before You Utter Hateful Words, Liberals” https://t.co/oLlo76BzYH https://t.co/B1AUn7MpWC",Unknown,English,2017-06-14T23:43:00,2017-06-14T23:43:00,1572.0000000000,567.0000000000,998.0000000000,,False
JuanthomssTrumT,BREAKING REPORT : Comey Pal Mueller will Investigate Trump https://t.co/XsZe5CJet8 https://t.co/PppUYzhFPY,Unknown,English,2017-06-14T23:48:00,2017-06-14T23:48:00,1572.0000000000,567.0000000000,999.0000000000,,False
JuanthomssTrumT,WaPo drops an anonymously-sourced bombshell on Trump’s birthday https://t.co/i7uCCk3xIk https://t.co/pqvwPX1vym,Unknown,English,2017-06-14T23:58:00,2017-06-14T23:58:00,1572.0000000000,567.0000000000,1000.0000000000,,False
JuanthomssTrumT,TWISTED Liberal Gunman Planned Attack for WEEKS https://t.co/1teWPggNtb https://t.co/bBmonzsXv8,Unknown,English,2017-06-15T00:08:00,2017-06-15T00:08:00,1572.0000000000,566.0000000000,1001.0000000000,,False
JuanthomssTrumT,Watch: Graphic video of Virginia shooting at GOP baseball practice emerges https://t.co/kglQGfr8VM https://t.co/wvL6jvRVUZ,Unknown,English,2017-06-15T00:28:00,2017-06-15T00:28:00,1572.0000000000,567.0000000000,1002.0000000000,,False
JuanthomssTrumT,"Steve Scalise, Zachary Barth, two Capitol Hill Police officers wounded in shooting https://t.co/3TrBBOZibL https://t.co/vegCmdGRsW",Unknown,English,2017-06-15T00:38:00,2017-06-15T00:38:00,1572.0000000000,567.0000000000,1006.0000000000,,False
JuanthomssTrumT,"Jared Kushner, Michael Flynn Russian connections to be examined by Congress https://t.co/K2J4mEhzmY",Unknown,English,2017-06-15T00:38:00,2017-06-15T00:38:00,1572.0000000000,567.0000000000,1004.0000000000,,False
JuanthomssTrumT,James Hodgkinson's shooting of Republicans signals breaking point of political tensions https://t.co/KdyD2CqtcY https://t.co/CZmWbbNK7M,Unknown,English,2017-06-15T00:38:00,2017-06-15T00:38:00,1572.0000000000,567.0000000000,1005.0000000000,,False
JuanthomssTrumT,Pulse nightclub shootings drive up Florida's murder rate https://t.co/zWWsmZhbtd,Unknown,English,2017-06-15T00:38:00,2017-06-15T00:38:00,1572.0000000000,567.0000000000,1003.0000000000,,False
JuanthomssTrumT,"""I am a victim and have spent the last week trying to make sense of what happened on June 4....""… https://t.co/1rGyNYl1Bc",Unknown,English,2017-06-15T01:18:00,2017-06-15T01:18:00,1572.0000000000,568.0000000000,1007.0000000000,,False
JuanthomssTrumT,Inside the Beltway: Alexandria: a wake up call for the left https://t.co/9f1mjOEx2O https://t.co/4fpHfDcxBo,Unknown,English,2017-06-15T01:28:00,2017-06-15T01:28:00,1572.0000000000,568.0000000000,1009.0000000000,,False
JuanthomssTrumT,BREAKING : ANTIFA Just Praised the Virginia Shooter in a Disgraceful Statement https://t.co/paKD50ZWHD https://t.co/7i6Z12wD7T,Unknown,English,2017-06-15T01:28:00,2017-06-15T01:28:00,1572.0000000000,568.0000000000,1008.0000000000,,False
JuanthomssTrumT,SHOCK VIDEO : CNN Claims “We Don’t Know the Motive” Behind VA Shooting https://t.co/gd58vbV7jY https://t.co/UITaYc57G6,Unknown,English,2017-06-15T01:38:00,2017-06-15T01:38:00,1572.0000000000,568.0000000000,1010.0000000000,,False
JuanthomssTrumT,Pelosi Says She’s Praying More Lately – That Angry Americans Don’t Target Them https://t.co/ynFQQjWISD https://t.co/ZMxm6F0Kqz,Unknown,English,2017-06-15T01:48:00,2017-06-15T01:48:00,1572.0000000000,568.0000000000,1012.0000000000,,False
JuanthomssTrumT,Michael Savage Predicted Violence from the Left Less than 24 Hours Prior to the Shooting https://t.co/9FdBZBvBWo https://t.co/kUUH9Ga46q,Unknown,English,2017-06-15T02:13:00,2017-06-15T02:13:00,1572.0000000000,570.0000000000,1013.0000000000,,False
JuanthomssTrumT,"Hillary Issues Statement on Virginia Shooting, Shows What a HYPOCRITE She Is https://t.co/eNFjSE9FAK https://t.co/5RcjDC8JtN",Unknown,English,2017-06-15T02:23:00,2017-06-15T02:23:00,1572.0000000000,571.0000000000,1014.0000000000,,False
JuanthomssTrumT,Donald and Melania Trump visit Steve Scalise at Washington hospital https://t.co/NSaNYpbdXs https://t.co/C323FKlHF7,Unknown,English,2017-06-15T02:33:00,2017-06-15T02:33:00,1572.0000000000,572.0000000000,1015.0000000000,,False
JuanthomssTrumT,"Senate sanctions bill targets Russia, presidential powers https://t.co/LrLcs0Zrwy https://t.co/yqqkKIZPA1",Unknown,English,2017-06-15T02:33:00,2017-06-15T02:33:00,1572.0000000000,572.0000000000,1018.0000000000,,False
JuanthomssTrumT,Capitol Police guns saved lives at ballpark https://t.co/rDxFWpd7D0 https://t.co/XKbzPF7FjO,Unknown,English,2017-06-15T02:33:00,2017-06-15T02:33:00,1572.0000000000,572.0000000000,1017.0000000000,,False
JuanthomssTrumT,Cuba policies of Obama may be rolled back under Trump https://t.co/MYud3Zfqaq https://t.co/eGd3EkqZCZ,Unknown,English,2017-06-15T02:33:00,2017-06-15T02:33:00,1572.0000000000,572.0000000000,1016.0000000000,,False
JuanthomssTrumT,SHOCK: Chris Matthews Hits Rock Bottom After He SYMPATHIZES With GOP Shooter… https://t.co/f3nYN5IHmV https://t.co/GKh0kYljsc,Unknown,English,2017-06-15T02:33:00,2017-06-15T02:33:00,1572.0000000000,572.0000000000,1019.0000000000,,False
JuanthomssTrumT,VIDEO : Chris Collins Reacts to VA Shooting By Announcing a Big Change https://t.co/fbsLquDP9V https://t.co/ya0qLoNT26,Unknown,English,2017-06-15T02:43:00,2017-06-15T02:43:00,1572.0000000000,572.0000000000,1020.0000000000,,False
JuanthomssTrumT,"NY Times Basically Told Their Readers When, Where Congress Played Baseball Games https://t.co/A2yWCIfYSB https://t.co/jdlmM4QNrg",Unknown,English,2017-06-15T02:43:00,2017-06-15T02:43:00,1572.0000000000,572.0000000000,1021.0000000000,,False
JuanthomssTrumT,Candidate’s ‘despicable’ email attacks Republican hours after he was attacked by gunman https://t.co/d0Ita2LxUP https://t.co/Kvnv62Oyj4,Unknown,English,2017-06-15T03:03:00,2017-06-15T03:03:00,1572.0000000000,573.0000000000,1023.0000000000,,False
JuanthomssTrumT,"Trump being investigated on possible obstruction of justice, reports say https://t.co/OLsebHSBR0 https://t.co/BcqqYTFFZg",Unknown,English,2017-06-15T03:43:00,2017-06-15T03:43:00,1572.0000000000,573.0000000000,1024.0000000000,,False
JuanthomssTrumT,"LEADERSHIP: Trump Drops Birthday Bash, Instead Visits Hospital With Congressman… https://t.co/hiYr4MBkZh https://t.co/TmiVjbFMnF",Unknown,English,2017-06-15T03:43:00,2017-06-15T03:43:00,1572.0000000000,573.0000000000,1025.0000000000,,False
JuanthomssTrumT,Trump Train Railroaded By Mueller Rush To Impeach – Stop It While He Still Can https://t.co/E46KXQEZgY https://t.co/c5KhBCWun6,Unknown,English,2017-06-15T04:08:00,2017-06-15T04:08:00,1572.0000000000,573.0000000000,1027.0000000000,,False
JuanthomssTrumT,Chris Matthews Shows Sympathy for Shooter Who Tried To Kill Republicans! https://t.co/D8kCYnSD2j https://t.co/HmzPQe08Fv,Unknown,English,2017-06-15T04:08:00,2017-06-15T04:08:00,1572.0000000000,573.0000000000,1026.0000000000,,False
JuanthomssTrumT,Russia Hoax Served It’s Purpose – Inserted HANGING JUDGE MUELLER Into Obstruction Probe https://t.co/EowhoZ0lpa https://t.co/x7drbgFYkK,Unknown,English,2017-06-15T05:38:00,2017-06-15T05:38:00,1572.0000000000,573.0000000000,1028.0000000000,,False
JuanthomssTrumT,Senate committee to weigh in on bill to fight opioid abuse https://t.co/8mNqhkh5bF,Unknown,English,2017-06-15T06:43:00,2017-06-15T06:43:00,1572.0000000000,572.0000000000,1029.0000000000,,False
JuanthomssTrumT,Proposed ban of releasing balloons angers Balloon Council https://t.co/ulRbEOj9lj,Unknown,English,2017-06-15T06:43:00,2017-06-15T06:43:00,1572.0000000000,572.0000000000,1030.0000000000,,False
JuanthomssTrumT,Activists sue NYPD over 'neither confirm nor deny' statement https://t.co/SSxPZM7zRY,Unknown,English,2017-06-15T06:43:00,2017-06-15T06:43:00,1572.0000000000,572.0000000000,1031.0000000000,,False
JuanthomssTrumT,Law would make new Australians pledge to share values https://t.co/DpEWKkyECn,Unknown,English,2017-06-15T06:43:00,2017-06-15T06:43:00,1572.0000000000,572.0000000000,1032.0000000000,,False
JuanthomssTrumT,VIDEO : Hannity Exposes “MASSIVE Conflict of Interest” Between Mueller and Comey https://t.co/ZaRhzYomsh https://t.co/fxz9k179zZ,Unknown,English,2017-06-15T07:23:00,2017-06-15T07:23:00,1572.0000000000,572.0000000000,1034.0000000000,,False
JuanthomssTrumT,"Gun Grabbing Gov McAuliffe Wild And Reckless Made Up Stats, Claims https://t.co/oBMqH65EK5 https://t.co/pIgq5UJJpm",Unknown,English,2017-06-15T07:23:00,2017-06-15T07:23:00,1572.0000000000,572.0000000000,1033.0000000000,,False
JuanthomssTrumT,VIDEO : Rep DeSantis Describes His Chilling Encounter With the Shooter https://t.co/H6dzPojFr7 https://t.co/pwHKnOEcBU,Unknown,English,2017-06-15T07:53:00,2017-06-15T07:53:00,1572.0000000000,572.0000000000,1035.0000000000,,False
JuanthomssTrumT,Did Loretta Lynch Make The Call A Radical Answered At The Ball Field? https://t.co/8pEr4prMyp https://t.co/vCnNIpQvV2,Unknown,English,2017-06-15T08:13:00,2017-06-15T08:13:00,1572.0000000000,572.0000000000,1036.0000000000,,False
JuanthomssTrumT,VIDEO : Former AG Mukasey – No Legitimate Obstruction Case Against Trump https://t.co/wb66sRI78H https://t.co/NF2triHYIb,Unknown,English,2017-06-15T08:13:00,2017-06-15T08:13:00,1572.0000000000,572.0000000000,1037.0000000000,,False
JuanthomssTrumT,"VIDEO : Claudia Tenney Receives Threat Post-Shooting “One Down, 216 To Go…” https://t.co/USIqUJmutJ https://t.co/otQqDFTYHW",Unknown,English,2017-06-15T08:28:00,2017-06-15T08:28:00,1572.0000000000,567.0000000000,1038.0000000000,,False
JuanthomssTrumT,Congressman who rose to powerful job still rooted back home https://t.co/cPvUneNAbP https://t.co/nLjGB2JEnm,Unknown,English,2017-06-15T08:43:00,2017-06-15T08:43:00,1572.0000000000,567.0000000000,1039.0000000000,,False
JuanthomssTrumT,Gov't report: Health care deductibles higher under GOP bill https://t.co/8WYG04VQ4A https://t.co/TWL0lSPOk6,Unknown,English,2017-06-15T08:43:00,2017-06-15T08:43:00,1572.0000000000,567.0000000000,1042.0000000000,,False
JuanthomssTrumT,California lawmakers to vote on $125 billion budget https://t.co/movqctRsvg https://t.co/p4SvFeuoXK,Unknown,English,2017-06-15T08:43:00,2017-06-15T08:43:00,1572.0000000000,567.0000000000,1040.0000000000,,False
JuanthomssTrumT,EPIC RANT “You’re Going to Lose No Matter How Many Congressmen You Kill” https://t.co/2uvo1hxH16 https://t.co/88NMKCUOII,Unknown,English,2017-06-15T08:43:00,2017-06-15T08:43:00,1572.0000000000,567.0000000000,1043.0000000000,,False
JuanthomssTrumT,"California budget addresses taxes, education, health care https://t.co/68KhqRGaK3",Unknown,English,2017-06-15T08:43:00,2017-06-15T08:43:00,1572.0000000000,567.0000000000,1041.0000000000,,False
JuanthomssTrumT,Trump Ending Obama Loophole Allowing Students to Not Pay Back Loans https://t.co/BDO0rlgOAU https://t.co/76TFkdNQbP,Unknown,English,2017-06-15T08:53:00,2017-06-15T08:55:00,1572.0000000000,567.0000000000,1044.0000000000,,False
JuanthomssTrumT,Former RI lawmaker pleads not guilty to campaign fraud https://t.co/R9dmTmYgUQ,Unknown,English,2017-06-15T09:44:00,2017-06-15T09:44:00,1572.0000000000,568.0000000000,1046.0000000000,,False
JuanthomssTrumT,Cubans now face same deportation risk as other immigrants https://t.co/wLUcVvpuUl https://t.co/4HD3b7B9N0,Unknown,English,2017-06-15T09:44:00,2017-06-15T09:44:00,1572.0000000000,568.0000000000,1047.0000000000,,False
JuanthomssTrumT,DISGRACEFUL : Huffpost Writer Jesse Benn Defends Shooting of Republicans https://t.co/gNl8941JQr https://t.co/B1dMNRBbUX,Unknown,English,2017-06-15T09:53:00,2017-06-15T09:55:00,1572.0000000000,568.0000000000,1048.0000000000,,False
JuanthomssTrumT,Ron DeSantis remains 'pessimistic' shooting will change anything https://t.co/SVUXf07xtj,Unknown,English,2017-06-15T11:43:00,2017-06-15T11:43:00,1572.0000000000,570.0000000000,1052.0000000000,,False
JuanthomssTrumT,Mark Sanford: Donald Trump partially to blame for heated rhetoric that led to Alexandria shooting… https://t.co/we0crgOdfH,Unknown,English,2017-06-15T11:43:00,2017-06-15T11:43:00,1572.0000000000,570.0000000000,1051.0000000000,,False
JuanthomssTrumT,Kansas governor to act on bill to keep guns out of hospitals https://t.co/C5KMb5J8qQ,Unknown,English,2017-06-15T11:43:00,2017-06-15T11:43:00,1572.0000000000,570.0000000000,1050.0000000000,,False
JuanthomssTrumT,BREAKING : 199 Iraqi Illegals Arrested by ICE and Set for Deportation https://t.co/rsxgF5R3bS https://t.co/FbvioipCWJ,Unknown,English,2017-06-15T11:43:00,2017-06-15T11:43:00,1572.0000000000,570.0000000000,1054.0000000000,,False
JuanthomssTrumT,"Donald Trump tweets about obstruction of justice reports, claims 'zero evidence' of collusion https://t.co/HoNUKdlFWE",Unknown,English,2017-06-15T11:43:00,2017-06-15T11:43:00,1572.0000000000,570.0000000000,1053.0000000000,,False
JuanthomssTrumT,UPDATE : Prayers Needed – Rep Steve Scalise in ICU Listed in CRITICAL Condition https://t.co/8wnmj3cszO https://t.co/fN4wPxKVqp,Unknown,English,2017-06-15T12:03:00,2017-06-15T12:03:00,1572.0000000000,571.0000000000,1055.0000000000,,False
JuanthomssTrumT,Stanley Cup Winning Pittsburgh Penguins Have a Message for Sports Champs https://t.co/jUi6DPO4BH,Unknown,English,2017-06-15T12:03:00,2017-06-15T12:03:00,1572.0000000000,571.0000000000,1057.0000000000,,False
JuanthomssTrumT,Huffpo Quickly Pulls Article Calling For the “Ultimate Punishment” for Trump https://t.co/uaUhEoXCcJ https://t.co/ybpI633i6e,Unknown,English,2017-06-15T12:03:00,2017-06-15T12:03:00,1572.0000000000,571.0000000000,1056.0000000000,,False
JuanthomssTrumT,Watch: Dana Loesch crushes anti-gun lobby spokesman in debate over GOP baseball shooting https://t.co/PYRIBUYEdU https://t.co/gre2w5fWJj,Unknown,English,2017-06-15T12:18:00,2017-06-15T12:18:00,1572.0000000000,571.0000000000,1060.0000000000,,False
JuanthomssTrumT,BREAKING : TRUMP “Obstruction of Justice” Probe is More FAKE BS https://t.co/T3lTEStKUr https://t.co/IjICW2qHaA,Unknown,English,2017-06-15T12:18:00,2017-06-15T12:18:00,1572.0000000000,571.0000000000,1059.0000000000,,False
JuanthomssTrumT,Senate To Open Investigation Into President Trump “Firing” James Comey https://t.co/UCuyqnDavo https://t.co/2gJ0L44tKJ,Unknown,English,2017-06-15T12:18:00,2017-06-15T12:18:00,1572.0000000000,571.0000000000,1058.0000000000,,False
JuanthomssTrumT,LOL : Trump is About to SMASH Another “Obama Legacy” Into DUST https://t.co/VPSFpgQXST,Unknown,English,2017-06-15T12:28:00,2017-06-15T12:28:00,1572.0000000000,571.0000000000,1062.0000000000,,False
JuanthomssTrumT,British Prime Minister promises full public inquiry into cause of deadly London high-rise blaze… https://t.co/QSGhdvGfqE,Unknown,English,2017-06-15T12:38:00,2017-06-15T12:38:00,1572.0000000000,571.0000000000,1063.0000000000,,False
JuanthomssTrumT,Death sentence for Facebook post https://t.co/nZ7X914JFl https://t.co/mhgc6gR5m8,Unknown,English,2017-06-15T12:38:00,2017-06-15T12:38:00,1572.0000000000,571.0000000000,1064.0000000000,,False
JuanthomssTrumT,Australian PM mocks Trump in speech he never expected you to see https://t.co/pm42BooGMB https://t.co/IVodbtYhxi,Unknown,English,2017-06-15T12:38:00,2017-06-15T12:38:00,1572.0000000000,571.0000000000,1065.0000000000,,False
JuanthomssTrumT,Deadly explosion rocks Chinese kindergarten https://t.co/ANGPLiV79G https://t.co/yuDvCttS3j,Unknown,English,2017-06-15T12:38:00,2017-06-15T12:38:00,1572.0000000000,571.0000000000,1066.0000000000,,False
JuanthomssTrumT,UK government delays Queen's Speech https://t.co/HcGlxb2zL0 https://t.co/eSFK8HRp0G,Unknown,English,2017-06-15T12:48:00,2017-06-15T12:48:00,1572.0000000000,570.0000000000,1070.0000000000,,False
JuanthomssTrumT,The Latest: Putin hopes for normalization of US-Russia ties https://t.co/buPUrBlFBl https://t.co/q0lE3hWpJq,Unknown,English,2017-06-15T12:48:00,2017-06-15T12:48:00,1572.0000000000,570.0000000000,1067.0000000000,,False
JuanthomssTrumT,Ken Starr says questioning of Jeff Sessions designed to embarrass him https://t.co/mHH0CMKCBZ,Unknown,English,2017-06-15T12:48:00,2017-06-15T12:48:00,1572.0000000000,570.0000000000,1069.0000000000,,False
JuanthomssTrumT,Rodney Davis: Congress needs to show the American people how to come together https://t.co/ibv3fnbXU0,Unknown,English,2017-06-15T12:48:00,2017-06-15T12:48:00,1572.0000000000,570.0000000000,1068.0000000000,,False
JuanthomssTrumT,Congressional Baseball Teams Will Wear LSU Gear to Honor Scalise https://t.co/SV8TloqUv7 https://t.co/rfe88UTOMB,Unknown,English,2017-06-15T12:58:00,2017-06-15T12:58:00,1572.0000000000,570.0000000000,1071.0000000000,,False
JuanthomssTrumT,Stephen Colbert utters two truly shocking words to Trump about the Virginia shooting https://t.co/56h4KCzt66 https://t.co/dHZPeU1mrw,Unknown,English,2017-06-15T12:58:00,2017-06-15T12:58:00,1572.0000000000,570.0000000000,1072.0000000000,,False
JuanthomssTrumT,The calf is the first walrus to be born at SeaWorld Orlando.... https://t.co/U8HJKIloDt https://t.co/9qOKBpygvT,Unknown,English,2017-06-15T13:08:00,2017-06-15T13:08:00,1572.0000000000,570.0000000000,1073.0000000000,,False
JuanthomssTrumT,You won’t believe What Gift Dennis Rodman Just Gave to Kim Jong Un https://t.co/Im1xRltpif https://t.co/TugQG930Ne,Unknown,English,2017-06-15T13:13:00,2017-06-15T13:13:00,1572.0000000000,570.0000000000,1074.0000000000,,False
JuanthomssTrumT,Cable Network Looking To Bring Tim Allen’s Last Man Standing Back On Air! https://t.co/mHVTlOklgw https://t.co/Cyz7m1mJMR,Unknown,English,2017-06-15T13:13:00,2017-06-15T13:13:00,1572.0000000000,570.0000000000,1075.0000000000,,False
JuanthomssTrumT,Gingrich Labels Mueller as “Deep State Spear” Trying to Bring Down Trump https://t.co/XqSAUJjAJW https://t.co/QgM475tl4l,Unknown,English,2017-06-15T13:33:00,2017-06-15T13:33:00,1572.0000000000,570.0000000000,1076.0000000000,,False
JuanthomssTrumT,ICE Rocks! Arrests 45 MS-13 Gang Members In New York City Area! https://t.co/BJrzGdNUHy https://t.co/Jjki47UeyI,Unknown,English,2017-06-15T13:48:00,2017-06-15T13:48:00,1572.0000000000,570.0000000000,1080.0000000000,,False
JuanthomssTrumT,Mo Brooks says congressional members are 'well-versed' in safety risks https://t.co/Kku64ZLNKw,Unknown,English,2017-06-15T13:48:00,2017-06-15T13:48:00,1572.0000000000,570.0000000000,1079.0000000000,,False
JuanthomssTrumT,"Chris Collins says he'll be armed, but apologizes for blaming Democrats for the Alexandria shooting… https://t.co/cK9z56nL6C",Unknown,English,2017-06-15T13:48:00,2017-06-15T13:48:00,1572.0000000000,570.0000000000,1078.0000000000,,False
JuanthomssTrumT,See the Trump-themed gift that Dennis Rodman brought Kim Jong Un https://t.co/P7GVUBaT7o https://t.co/RUJmjMJrFF,Unknown,English,2017-06-15T13:48:00,2017-06-15T13:48:00,1572.0000000000,570.0000000000,1081.0000000000,,False
JuanthomssTrumT,Brad Wenstrup: Steve Scalise's 'critical' condition normal for his injury https://t.co/SlhMJkGVPo https://t.co/aDxwE4nphc,Unknown,English,2017-06-15T13:48:00,2017-06-15T13:48:00,1572.0000000000,570.0000000000,1077.0000000000,,False
JuanthomssTrumT,GOP congressman: Trump ‘partially to blame’ for climate that led to Alexandria shooting https://t.co/aAYGhelaJ7 https://t.co/I2p4gwIVW9,Unknown,English,2017-06-15T14:13:00,2017-06-15T14:13:00,1572.0000000000,569.0000000000,1082.0000000000,,False
JuanthomssTrumT,Hospital: Steve Scalise’s condition remains ‘critical’ after GOP baseball shooting https://t.co/rLjUTfWbF6 https://t.co/hVN0QJoynE,Unknown,English,2017-06-15T14:23:00,2017-06-15T14:23:00,1572.0000000000,569.0000000000,1083.0000000000,,False
JuanthomssTrumT,Joe Crowley says Donald Trump to blame for escalating rhetoric https://t.co/omcCVQYFHN https://t.co/fluPUa1a0W,Unknown,English,2017-06-15T14:38:00,2017-06-15T14:38:00,1572.0000000000,571.0000000000,1084.0000000000,,False
JuanthomssTrumT,"Roger Williams, congressional aide highlight need for community in wake of shooting https://t.co/lIeKtHpAfo",Unknown,English,2017-06-15T14:38:00,2017-06-15T14:38:00,1572.0000000000,571.0000000000,1085.0000000000,,False
JuanthomssTrumT,"Mike Pence visits Steve Scalise, Capitol Hill officer in hospital https://t.co/xXM0kIlsBo",Unknown,English,2017-06-15T14:38:00,2017-06-15T14:38:00,1572.0000000000,571.0000000000,1086.0000000000,,False
JuanthomssTrumT,"Malcolm Turnbull, Australian PM, mocks Donald Trump in leaked audio https://t.co/VUhELXKYY5",Unknown,English,2017-06-15T14:38:00,2017-06-15T14:38:00,1572.0000000000,571.0000000000,1087.0000000000,,False
JuanthomssTrumT,BREAKING: Betsy DeVos Quietly Makes New Move That’s Crumbling Obama’s Legacy… https://t.co/Y3jUijNSbW https://t.co/HjGka14sBA,Unknown,English,2017-06-15T15:08:00,2017-06-15T15:08:00,1572.0000000000,571.0000000000,1088.0000000000,,False
JuanthomssTrumT,"Katy Perry’s father, an evangelist, is asking people to pray for his daughter https://t.co/yxrk56HOUF https://t.co/PZpViOld6J",Unknown,English,2017-06-15T15:13:00,2017-06-15T15:13:00,1572.0000000000,571.0000000000,1089.0000000000,,False
JuanthomssTrumT,JUST IN: Kamala Harris Is In SERIOUS Trouble… https://t.co/dqyzs4qrqk https://t.co/KfCPWbyxT9,Unknown,English,2017-06-15T15:23:00,2017-06-15T15:23:00,1572.0000000000,571.0000000000,1090.0000000000,,False
JuanthomssTrumT,"MSNBC host goes on rambling rant about Trump’s lack of decency, likens it to Clinton sex scandal… https://t.co/lmV50vMBag",Unknown,English,2017-06-15T15:43:00,2017-06-15T15:43:00,1572.0000000000,571.0000000000,1091.0000000000,,False
JuanthomssTrumT,Lamar Alexander to HHS: Keep Obamacare payments flowing for now https://t.co/6gPooq7BVL https://t.co/GZ5SUGAuD2,Unknown,English,2017-06-15T15:48:00,2017-06-15T15:48:00,1572.0000000000,571.0000000000,1093.0000000000,,False
JuanthomssTrumT,Panel backs Trump's pick to lead immigration agency; Cissna marks change from Obama priorities… https://t.co/OuaaIByd4I,Unknown,English,2017-06-15T15:48:00,2017-06-15T15:48:00,1572.0000000000,571.0000000000,1094.0000000000,,False
JuanthomssTrumT,"Southern Baptists adopt resolution denouncing alt-right, white supremacy at annual convention… https://t.co/ELALX3AmdL",Unknown,English,2017-06-15T15:48:00,2017-06-15T15:48:00,1572.0000000000,571.0000000000,1092.0000000000,,False
JuanthomssTrumT,Consultant sentenced to prison for part in kickback scheme https://t.co/i5a9PtSQI7,Unknown,English,2017-06-15T15:48:00,2017-06-15T15:48:00,1572.0000000000,571.0000000000,1095.0000000000,,False
JuanthomssTrumT,Malkin Exposes the Left’s VICIOUS Climate of HATE https://t.co/JSExA4Nciq https://t.co/BOJ6nmTrBr,Unknown,English,2017-06-15T16:13:00,2017-06-15T16:13:00,1572.0000000000,571.0000000000,1096.0000000000,,False
JuanthomssTrumT,You Won’t Believe CNN’s Latest INSUTLING “THEORY” About VA Shooter https://t.co/GfjZYpVQic,Unknown,English,2017-06-15T16:18:00,2017-06-15T16:18:00,1572.0000000000,571.0000000000,1097.0000000000,,False
JuanthomssTrumT,DC police set to charge 12 Turkish security agents for May melee against protesters: report … https://t.co/Aeb1bZT62P,Unknown,English,2017-06-15T16:23:00,2017-06-15T16:23:00,1572.0000000000,571.0000000000,1098.0000000000,,False
JuanthomssTrumT,Home Depot Co-founder VERY WORRIED ABOUT TRUMP’S LIFE https://t.co/bo3x1sNi0E,Unknown,English,2017-06-15T16:28:00,2017-06-15T16:28:00,1572.0000000000,571.0000000000,1099.0000000000,,False
JuanthomssTrumT,"Father of Freed North Korean Prisoner Praises Trump, SLAMS Obama https://t.co/CcLwiIbLd1 https://t.co/U7hMfcvhnt",Unknown,English,2017-06-15T16:33:00,2017-06-15T16:33:00,1572.0000000000,571.0000000000,1100.0000000000,,False
JuanthomssTrumT,Putin jokes about offering political asylum to Comey https://t.co/T7h7a9QwHT https://t.co/XxF2Ui1m5K,Unknown,English,2017-06-15T16:38:00,2017-06-15T16:38:00,1572.0000000000,571.0000000000,1101.0000000000,,False
JuanthomssTrumT,"Donald Trump launches apprenticeship program, promises 'great,' 'high-paying' jobs https://t.co/Xh2srAVuUI",Unknown,English,2017-06-15T16:48:00,2017-06-15T16:48:00,1572.0000000000,572.0000000000,1104.0000000000,,False
JuanthomssTrumT,"Ed Royce praises arrest warrants for Turkish security forces, urges U.S. to remain tough https://t.co/VLRGtaH6Xx https://t.co/0cVUimYz6f",Unknown,English,2017-06-15T16:48:00,2017-06-15T16:48:00,1572.0000000000,572.0000000000,1102.0000000000,,False
JuanthomssTrumT,"Judges won't delay ruling merging NC elections, ethics board https://t.co/RRzlLQVtv2",Unknown,English,2017-06-15T16:48:00,2017-06-15T16:48:00,1572.0000000000,572.0000000000,1105.0000000000,,False
JuanthomssTrumT,Nancy Pelosi: 'Outrageous' for Republicans to blame Democrats for heated rhetoric https://t.co/UvmrGDpGlC,Unknown,English,2017-06-15T16:48:00,2017-06-15T16:48:00,1572.0000000000,572.0000000000,1103.0000000000,,False
JuanthomssTrumT,GOP Rep “Act of God” Threw Shooter’s Aim Was Off or It Would Have Been a Massacre https://t.co/7L2jgAFrck https://t.co/8kO03qcwGs,Unknown,English,2017-06-15T17:03:00,2017-06-15T17:03:00,1572.0000000000,571.0000000000,1106.0000000000,,False
JuanthomssTrumT,“Last Man Standing” To Potentially Air Back On Television https://t.co/QFYiX3PdAf https://t.co/BtlCDH0hBc,Unknown,English,2017-06-15T17:08:00,2017-06-15T17:08:00,1572.0000000000,571.0000000000,1108.0000000000,,False
JuanthomssTrumT,Idiot Jake Tapper “Wonders” If Left “Rhetoric” Led to SHOOTING https://t.co/wdx6eLFXrG https://t.co/M6MXxNXVr5,Unknown,English,2017-06-15T17:08:00,2017-06-15T17:08:00,1572.0000000000,571.0000000000,1107.0000000000,,False
JuanthomssTrumT,Two lawmakers said the Congressional Baseball game practice... https://t.co/9NYqrgGyyr https://t.co/Buan0vPVCC,Unknown,English,2017-06-15T17:13:00,2017-06-15T17:13:00,1572.0000000000,571.0000000000,1109.0000000000,,False
JuanthomssTrumT,Liberal UK politician resigns because it’s ‘impossible’ to be a Christian and a progressive leader… https://t.co/gG0x02QxBM,Unknown,English,2017-06-15T17:38:00,2017-06-15T17:38:00,1572.0000000000,572.0000000000,1110.0000000000,,False
