author_id,content,region,language,publish_date,harvested_date,following,followers,updates,post_type,retweet
JuanthomssTrumT,"Adam West, Our Batman dead at 88 https://t.co/wA1QIy7pP4 https://t.co/WiMmJ2ZIdC",Unknown,English,2017-06-10T16:04:00,2017-06-10T16:04:00,1574.0000000000,455.0000000000,337.0000000000,,False
JuanthomssTrumT,New illegal immigration numbers reveal Trump’s incredible impact on the border https://t.co/1bboqBxhoL https://t.co/MNc00JWZ7T,Unknown,English,2017-06-10T16:09:00,2017-06-10T16:09:00,1574.0000000000,456.0000000000,338.0000000000,,False
JuanthomssTrumT,Patriots Takes to the Streets to #MarchAgainstShariaLaw https://t.co/jxyOLWxnFK https://t.co/AHC6r1IbeY,Unknown,English,2017-06-10T16:09:00,2017-06-10T16:09:00,1574.0000000000,456.0000000000,339.0000000000,,False
JuanthomssTrumT,"BREAKING: 48-Hours After Hearing, Comey Nabs $10 MILLION… https://t.co/l5CjlePuS8 https://t.co/yKPW3kzkPl",Unknown,English,2017-06-10T16:34:00,2017-06-10T16:34:00,1574.0000000000,457.0000000000,340.0000000000,,False
JuanthomssTrumT,NEW POLL : 59% of Americans Say the Liberal Media Angers Them https://t.co/oKRQ3MG86v https://t.co/4mTnP2EoC1,Unknown,English,2017-06-10T16:39:00,2017-06-10T16:39:00,1574.0000000000,457.0000000000,341.0000000000,,False
JuanthomssTrumT,Uber's Travis Kalanick offered sex rules for 2013 party: report https://t.co/kx1ZdXNx0u https://t.co/fvTMRlLYqi,Unknown,English,2017-06-10T16:49:00,2017-06-10T16:51:00,1574.0000000000,457.0000000000,342.0000000000,,False
JuanthomssTrumT,Are we getting a ‘Wonder Woman 2?’ https://t.co/VtljE10b6N https://t.co/u36xYvUVF4,Unknown,English,2017-06-10T16:49:00,2017-06-10T16:49:00,1574.0000000000,457.0000000000,343.0000000000,,False
JuanthomssTrumT,Bernie Sanders Loses His SH*T and SHREDS “Christianity” https://t.co/h21eImRGJx https://t.co/kBFPPKAvLT,Unknown,English,2017-06-10T16:59:00,2017-06-10T16:59:00,1574.0000000000,457.0000000000,346.0000000000,,False
JuanthomssTrumT,Analysis: 'Tort reform' measure may face ballot competition https://t.co/ly040GP76p,Unknown,English,2017-06-10T16:59:00,2017-06-10T16:59:00,1574.0000000000,457.0000000000,345.0000000000,,False
JuanthomssTrumT,"Tax returns, financial records taken in lawmaker's case https://t.co/tZLP1iS1JJ",Unknown,English,2017-06-10T16:59:00,2017-06-10T16:59:00,1574.0000000000,457.0000000000,344.0000000000,,False
JuanthomssTrumT,Chelsea Clinton tries to bash Republicans in tweet — but actually destroys Michelle Obama instead… https://t.co/dxRDUC6UOW,Unknown,English,2017-06-10T17:39:00,2017-06-10T17:40:00,1574.0000000000,456.0000000000,347.0000000000,,False
JuanthomssTrumT,BACKFIRE! Gillibrand Loses Dem “Rising Star” Status After F-Bombs https://t.co/QHVZHDHvWe https://t.co/wzajqubneu,Unknown,English,2017-06-10T17:54:00,2017-06-10T17:54:00,1574.0000000000,458.0000000000,348.0000000000,,False
JuanthomssTrumT,"Comey testimony watched by nearly 20 million TV viewers, millions more online https://t.co/91PwPbF94s https://t.co/tKrtBJwk4H",Unknown,English,2017-06-10T17:59:00,2017-06-10T17:59:00,1574.0000000000,456.0000000000,350.0000000000,,False
JuanthomssTrumT,Phoenix alliance pulls its support for immigrant ID cards https://t.co/YAfsfoThHe,Unknown,English,2017-06-10T17:59:00,2017-06-10T17:59:00,1574.0000000000,456.0000000000,349.0000000000,,False
JuanthomssTrumT,Watch: Legal expert claims Comey’s memo leak was a federal crime https://t.co/kZrKKewFAS https://t.co/iUcuaSKeHg,Unknown,English,2017-06-10T18:14:00,2017-06-10T18:14:00,1574.0000000000,456.0000000000,351.0000000000,,False
JuanthomssTrumT,Dem Lawmaker BUSTED for Handout with TEEN PORN on It https://t.co/3VazFGGJXW https://t.co/TxAjLAjHcp,Unknown,English,2017-06-10T18:24:00,2017-06-10T18:24:00,1574.0000000000,457.0000000000,352.0000000000,,False
JuanthomssTrumT,"BUSTED: Maxine Waters Asked About $200,000 Ties With Russia, INSTANTLY Runs Away… https://t.co/oyOpZbbgzP https://t.co/mlUzBfJAOc",Unknown,English,2017-06-10T18:34:00,2017-06-10T18:34:00,1574.0000000000,458.0000000000,353.0000000000,,False
JuanthomssTrumT,Trump Sees Copy of Infamous “Madam President” Newsweek then THIS Happens https://t.co/LiHe8hefzX https://t.co/w04GDwF9cp,Unknown,English,2017-06-10T18:54:00,2017-06-10T18:54:00,1574.0000000000,458.0000000000,354.0000000000,,False
JuanthomssTrumT,VIDEO : PROOF Emerges Comey Was LEAKING BEFORE He Was Fired https://t.co/cEruuOh0zX https://t.co/xxsyuZACtz,Unknown,English,2017-06-10T18:59:00,2017-06-10T18:59:00,1574.0000000000,459.0000000000,355.0000000000,,False
JuanthomssTrumT,"New Petition to Appoint Special Prosecutor to Investigate Lynch, Comey, Clinton https://t.co/y5DpPiqzI3 https://t.co/moFFHfcqHc",Unknown,English,2017-06-10T18:59:00,2017-06-10T18:59:00,1574.0000000000,459.0000000000,356.0000000000,,False
JuanthomssTrumT,JUST IN: Intolerant Democrat Mayor DISGRACES Trump And Pence Portraits… Media SILENT https://t.co/3vJQlinxxI https://t.co/ABb7OqKM3H,Unknown,English,2017-06-10T19:19:00,2017-06-10T19:19:00,1574.0000000000,462.0000000000,357.0000000000,,False
JuanthomssTrumT,Watch: Tucker Carlson exposes the actual ‘goal’ behind Comey’s Senate testimony https://t.co/1YJ9hgqkTv https://t.co/q6wXIXnKXF,Unknown,English,2017-06-10T19:39:00,2017-06-10T19:39:00,1574.0000000000,463.0000000000,358.0000000000,,False
JuanthomssTrumT,VIDEO : “Feminists” Now Embracing RADICAL ISLAM??? https://t.co/JJEqohfc2B https://t.co/OiHz5hGCG0,Unknown,English,2017-06-10T19:44:00,2017-06-10T19:44:00,1574.0000000000,463.0000000000,359.0000000000,,False
JuanthomssTrumT,Klan rally scheduled for Charlottesville next month spurs religious leaders to take action https://t.co/Y8IeBqPxvh https://t.co/AQD7SYnRQM,Unknown,English,2017-06-10T19:59:00,2017-06-10T19:59:00,1575.0000000000,462.0000000000,360.0000000000,,False
JuanthomssTrumT,Feds install deadly ‘duck ramps’ at Capitol Reflecting Pool — sending 80 ducklings to their doom… https://t.co/FT8GVPPyIL,Unknown,English,2017-06-10T20:39:00,2017-06-10T20:39:00,1575.0000000000,465.0000000000,361.0000000000,,False
JuanthomssTrumT,VIDEO : Katrina Pierson “Comey Implicated HIMSELF” https://t.co/2BvgJ74bai https://t.co/FeEAxF9mNn,Unknown,English,2017-06-10T20:45:00,2017-06-10T20:57:00,1575.0000000000,466.0000000000,362.0000000000,,False
JuanthomssTrumT,BREAKING : One Dozen “Dem Staffers” Busted for VOTER FRAUD https://t.co/Xh4XQ35Lgt https://t.co/zs0jm3I71r,Unknown,English,2017-06-10T20:45:00,2017-06-10T20:46:00,1575.0000000000,466.0000000000,364.0000000000,,False
JuanthomssTrumT,VIDEO : O’Reilly Exposes BOMBSHELL on the Liberals Who Got Him Fired https://t.co/MGvLI44LVf https://t.co/RtYqEP3zlc,Unknown,English,2017-06-10T20:45:00,2017-06-10T20:46:00,1575.0000000000,466.0000000000,365.0000000000,,False
JuanthomssTrumT,OOPS! Chelsea Clinton Accidentally DESTROYS Michelle Obama https://t.co/836Gq17xhh https://t.co/ZGV5DE0wx5,Unknown,Italian,2017-06-10T20:45:00,2017-06-10T20:46:00,1575.0000000000,466.0000000000,363.0000000000,,False
JuanthomssTrumT,"Atlanta, Georgia became Moon Charania’s home in the 80s,... https://t.co/CECHiI75Kf https://t.co/9cjfClV9Ln",Unknown,English,2017-06-10T20:54:00,2017-06-10T20:54:00,1575.0000000000,466.0000000000,367.0000000000,,False
JuanthomssTrumT,BREAKING : ICE Rounds Up 113 Illegals in New Jersey Sweep https://t.co/3SAITOnsih https://t.co/LOSdazp1qH,Unknown,English,2017-06-10T20:54:00,2017-06-10T20:54:00,1575.0000000000,466.0000000000,366.0000000000,,False
JuanthomssTrumT,"Obamacare repeal remains Trump's chief priority, Mike Pence says https://t.co/13DLSsRC5M https://t.co/XeaouejddG",Unknown,English,2017-06-10T20:59:00,2017-06-10T20:59:00,1575.0000000000,466.0000000000,368.0000000000,,False
JuanthomssTrumT,The DEA Just Raided A United States Senator-Democrats In A Panic https://t.co/WWh8YGUxXP https://t.co/Z9GtaVnRDT,Unknown,English,2017-06-10T21:44:00,2017-06-10T21:44:00,1575.0000000000,466.0000000000,371.0000000000,,False
JuanthomssTrumT,"Top liberals openly plot, promote expansion of ‘deep state’ at Constitution conference https://t.co/FZ2LNFqK4O https://t.co/tk6x5tid24",Unknown,English,2017-06-10T21:44:00,2017-06-10T21:44:00,1575.0000000000,466.0000000000,370.0000000000,,False
JuanthomssTrumT,"Borders Still Open – Catch And Release, DACA, DAPA Continue Under Trump https://t.co/eff2OPl9zP https://t.co/u09ie04NAz",Unknown,English,2017-06-10T22:49:00,2017-06-10T22:49:00,1575.0000000000,466.0000000000,374.0000000000,,False
JuanthomssTrumT,“Somebody’s Going To Get A Hernia Here” Krauthammer Crushes Crazy WaPo Columnist Over Russia Conspiracy… https://t.co/M3VExJgFmL,Unknown,English,2017-06-10T22:54:00,2017-06-10T22:54:00,1575.0000000000,466.0000000000,375.0000000000,,False
JuanthomssTrumT,How Puerto Rico’s vote on Sunday could change the future of America forever https://t.co/QFhuh4cjDG https://t.co/LBbNvf1wdR,Unknown,English,2017-06-10T22:59:00,2017-06-10T22:59:00,1575.0000000000,466.0000000000,376.0000000000,,False
JuanthomssTrumT,Feds Stumble On What Muslims In Michigan Were Doing In Secret And SHUT Them Down https://t.co/KIQIGjqQxg https://t.co/d1aXi8oSpM,Unknown,English,2017-06-10T23:39:00,2017-06-10T23:39:00,1575.0000000000,467.0000000000,377.0000000000,,False
JuanthomssTrumT,BREAKING: James Comey Gets HORRIFIC News 48 Hours After Hearing… https://t.co/DD8dwIYIZI https://t.co/xXciDugVPi,Unknown,English,2017-06-10T23:44:00,2017-06-10T23:44:00,1575.0000000000,467.0000000000,378.0000000000,,False
JuanthomssTrumT,Pelosi LAUGHS at Trump Supporters then SAYS THIS STUNNER……. https://t.co/ch6hDb230O https://t.co/1XOaVYwNhK,Unknown,English,2017-06-10T23:59:00,2017-06-10T23:59:00,1575.0000000000,467.0000000000,379.0000000000,,False
JuanthomssTrumT,Trump Answers Dishonest MSM Challenge – Would 100% Testify Comey Is Lying https://t.co/w0pZfO0hlJ https://t.co/u6TmTRuPaG,Unknown,English,2017-06-11T00:19:00,2017-06-11T00:19:00,1575.0000000000,466.0000000000,380.0000000000,,False
JuanthomssTrumT,VIDEO : More Footage Emerges of CNN Staging FAKE NEWS https://t.co/UeMWPxkQEi https://t.co/EVV5MwRNwP,Unknown,English,2017-06-11T00:19:00,2017-06-11T00:19:00,1575.0000000000,466.0000000000,381.0000000000,,False
JuanthomssTrumT,Biden “I Knew Hillary Would Lose Battleground States” https://t.co/DR2ECV6qUN https://t.co/InycatmHos,Unknown,English,2017-06-11T00:54:00,2017-06-11T00:54:00,1575.0000000000,467.0000000000,382.0000000000,,False
JuanthomssTrumT,Nicole Lefavour has been arrested ten times for civil... https://t.co/U5tSpm2iRR https://t.co/1DwxWAFpcv,Unknown,English,2017-06-11T00:54:00,2017-06-11T00:54:00,1575.0000000000,467.0000000000,383.0000000000,,False
JuanthomssTrumT,George Soros’ Son Went on BOOZE-BENDER With Democrat Leaders https://t.co/3hPQQKqqoe https://t.co/lNepsN6vVs,Unknown,English,2017-06-11T01:14:00,2017-06-11T01:14:00,1575.0000000000,467.0000000000,384.0000000000,,False
JuanthomssTrumT,Trump Collects NO SALARY but has Done MORE WORK than his FOUR Predecessors https://t.co/0yKI0jdO04 https://t.co/cZBFpJ0rCo,Unknown,English,2017-06-11T01:14:00,2017-06-11T01:14:00,1575.0000000000,467.0000000000,386.0000000000,,False
JuanthomssTrumT,Sexual Assaults at Swedish Festivals Have Risen 1000% https://t.co/TVhO6HxGgN https://t.co/n3zQSCQk5n,Unknown,English,2017-06-11T01:14:00,2017-06-11T01:14:00,1575.0000000000,467.0000000000,385.0000000000,,False
JuanthomssTrumT,Unhinged MSNBC Host Spreads Bald-Faced LIE About President Trump https://t.co/MLcjOV8L8H https://t.co/cnMkdEepMT,Unknown,English,2017-06-11T02:34:00,2017-06-11T02:34:00,1575.0000000000,468.0000000000,388.0000000000,,False
JuanthomssTrumT,"New Video Of Stage Prep For CNN Staged London Protest – Like A Movie Set, But Fake News https://t.co/6ByHUVJ3H2 https://t.co/atX9EpO8v1",Unknown,English,2017-06-11T02:54:00,2017-06-11T02:54:00,1575.0000000000,468.0000000000,390.0000000000,,False
JuanthomssTrumT,Clinton Foundation Made $145 MILLION From Uranium Deal With Russia https://t.co/rWdHjCA6nc https://t.co/yvYyCaF5oN,Unknown,English,2017-06-11T02:54:00,2017-06-11T02:54:00,1575.0000000000,468.0000000000,389.0000000000,,False
JuanthomssTrumT,Ben Stein “Trump Did Nothing Wrong! Leaks Are BS!” https://t.co/A86PmjQ8fA https://t.co/WBqdVz5JeI,Unknown,English,2017-06-11T02:54:00,2017-06-11T02:54:00,1575.0000000000,468.0000000000,391.0000000000,,False
JuanthomssTrumT,VIDEO : ANTIFA Throws URINE at Conservative Woman Marching Against Sharia Law https://t.co/7sinHK6x9p https://t.co/jlyLQdovAH,Unknown,English,2017-06-11T03:09:00,2017-06-11T03:09:00,1575.0000000000,468.0000000000,392.0000000000,,False
JuanthomssTrumT,"130,000-Plus Trump Facebook Group Permanently Banned From FB https://t.co/Kpcb7XlpDy https://t.co/xCxw2q0thm",Unknown,English,2017-06-11T05:04:00,2017-06-11T05:04:00,1575.0000000000,468.0000000000,393.0000000000,,False
JuanthomssTrumT,"Anonymous Warns Trump Must Lead, Take Urgent Action – True Existential Threat https://t.co/BVHr579Ux1 https://t.co/KXs3103vTS",Unknown,English,2017-06-11T05:04:00,2017-06-11T05:04:00,1575.0000000000,468.0000000000,394.0000000000,,False
JuanthomssTrumT,"Dobbs – Chasing Russian Ghosts, Dems And Establishment GOP Hacks Ignore Reality https://t.co/SH7ZvGT4H4 https://t.co/9ZsRmQEKbs",Unknown,English,2017-06-11T05:39:00,2017-06-11T05:39:00,1575.0000000000,470.0000000000,395.0000000000,,False
JuanthomssTrumT,'Little Giant' gets the spotlight thanks to Watergate https://t.co/g8q82OL0ge,Unknown,English,2017-06-11T06:04:00,2017-06-11T06:04:00,1575.0000000000,470.0000000000,396.0000000000,,False
JuanthomssTrumT,Michigan attorney following in the footsteps of his father https://t.co/iqjNz9ezhQ,Unknown,English,2017-06-11T06:04:00,2017-06-11T06:04:00,1575.0000000000,470.0000000000,397.0000000000,,False
JuanthomssTrumT,AG Sessions To Appear Before Senate Intel – A Few Comey Things To Straighten Out https://t.co/De7Il7qeRl https://t.co/Vgale2gls7,Unknown,English,2017-06-11T07:09:00,2017-06-11T07:09:00,1575.0000000000,473.0000000000,398.0000000000,,False
JuanthomssTrumT,Deep State Shill Romney Getting Advice from Both Hillary AND Biden https://t.co/kKRy4Ae7Yk https://t.co/JHJki1rjeg,Unknown,English,2017-06-11T08:49:00,2017-06-11T08:49:00,1575.0000000000,473.0000000000,399.0000000000,,False
JuanthomssTrumT,House panel passes legislation prohibiting sanctuary cities https://t.co/ePWFOQypBW,Unknown,English,2017-06-11T09:09:00,2017-06-11T09:09:00,1575.0000000000,474.0000000000,402.0000000000,,False
JuanthomssTrumT,VIDEO : Kellyanne Conway “Obamacare is DEAD” https://t.co/2BSQhkBPjt https://t.co/K55hRMSclc,Unknown,English,2017-06-11T09:09:00,2017-06-11T09:09:00,1575.0000000000,474.0000000000,400.0000000000,,False
JuanthomssTrumT,FLASHBACK POLL : 2/3rds of UK Muslims would NOT Snitch on Terrorist https://t.co/exFkuH1GDb https://t.co/Kw8YKnhZc4,Unknown,English,2017-06-11T09:09:00,2017-06-11T09:09:00,1575.0000000000,474.0000000000,401.0000000000,,False
JuanthomssTrumT,Op-Ed – Comey Showing Double Standard in Treatment of Trump vs. Clinton https://t.co/QGkkrT8Voa https://t.co/RX8qjKuc3Z,Unknown,English,2017-06-11T09:29:00,2017-06-11T09:29:00,1575.0000000000,475.0000000000,404.0000000000,,False
JuanthomssTrumT,VIDEO : Former DOJ Whisteblower SLAMS Comey for “Using Media” to Attack Trump https://t.co/6VUHIyYUiK https://t.co/CMZtjeVGTY,Unknown,English,2017-06-11T09:29:00,2017-06-11T09:29:00,1575.0000000000,475.0000000000,403.0000000000,,False
JuanthomssTrumT,GOP Rep criticized for shocking statement on ISIS attack in Iran https://t.co/6MOE8OHDgT https://t.co/nJlGI3yo0m,Unknown,English,2017-06-11T11:49:00,2017-06-11T11:49:00,1575.0000000000,475.0000000000,405.0000000000,,False
JuanthomssTrumT,Mark Levin “Jake Tapper is EVIL” https://t.co/6WH5cNqBCy,Unknown,English,2017-06-11T11:59:00,2017-06-11T11:59:00,1575.0000000000,475.0000000000,406.0000000000,,False
JuanthomssTrumT,Joe Biden’s Niece Pleads Guilty to $100K CREDIT CARD FRAUD Charge https://t.co/x9EzAQQMwF https://t.co/3Mscqaeskd,Unknown,English,2017-06-11T12:39:00,2017-06-11T12:39:00,1575.0000000000,477.0000000000,407.0000000000,,False
JuanthomssTrumT,VIDEO : Van Jones Trashes Hillary and It’s Glorious https://t.co/m81KwVwdSX https://t.co/rBPhlGdQk6,Unknown,English,2017-06-11T12:59:00,2017-06-11T12:59:00,1575.0000000000,477.0000000000,408.0000000000,,False
JuanthomssTrumT,Cecile Richards tweets ‘facts’ about Planned Parenthood — then Twitter reminds her of abortion facts… https://t.co/DhutDnYQDs,Unknown,English,2017-06-11T12:59:00,2017-06-11T12:59:00,1575.0000000000,477.0000000000,409.0000000000,,False
JuanthomssTrumT,VIDEO : Mad Max BOLTS When Asked About HER MONEY-TIES to Russia https://t.co/z2lIBQ8saW https://t.co/nOG9R2YGW0,Unknown,English,2017-06-11T13:09:00,2017-06-11T13:09:00,1575.0000000000,477.0000000000,410.0000000000,,False
JuanthomssTrumT,ISIS Leader Abu Bakr al-Baghdadi Killed In Massive Airstrike https://t.co/k1O5QkTToK https://t.co/fi2rjyDl1x,Unknown,English,2017-06-11T13:19:00,2017-06-11T13:19:00,1575.0000000000,477.0000000000,411.0000000000,,False
JuanthomssTrumT,VIDEO : Judge Jeanine “James Comey’s Great Political Hoax” https://t.co/DunE2ErXUa https://t.co/qPMWYsOsVR,Unknown,English,2017-06-11T13:29:00,2017-06-11T13:29:00,1575.0000000000,477.0000000000,412.0000000000,,False
JuanthomssTrumT,BREAKING : ISIS leader Abu Bakr al-Baghdadi DEAD! https://t.co/ZgX9ZQ1Hb5 https://t.co/Pe7Wk8h4ja,Unknown,English,2017-06-11T13:39:00,2017-06-11T13:39:00,1575.0000000000,477.0000000000,413.0000000000,,False
JuanthomssTrumT,Bernie Sanders crushed for ruthlessly attacking Christian at Senate hearing: ‘Shockingly ignorant’… https://t.co/sY4dqjaSd2,Unknown,English,2017-06-11T13:39:00,2017-06-11T13:39:00,1575.0000000000,477.0000000000,414.0000000000,,False
JuanthomssTrumT,BREAKING : Sessions to Testify Against Comey’s Accusations https://t.co/mxVl944v1e https://t.co/UWVQGTpEa0,Unknown,English,2017-06-11T13:49:00,2017-06-11T13:49:00,1575.0000000000,477.0000000000,415.0000000000,,False
JuanthomssTrumT,Report: Kellyanne Conway is leaking White House information https://t.co/AOrbyHl8G3 https://t.co/P7R4eQpzXL,Unknown,English,2017-06-11T13:59:00,2017-06-11T13:59:00,1575.0000000000,478.0000000000,417.0000000000,,False
JuanthomssTrumT,TRANNY ANTIFA MEMBER PUNCHES YOUTUBER – REGRETS IT IMMEDIATELY https://t.co/XBynCN6PnD https://t.co/XaWp7u5GuT,Unknown,English,2017-06-11T13:59:00,2017-06-11T13:59:00,1575.0000000000,478.0000000000,416.0000000000,,False
JuanthomssTrumT,Trump May Be Cleaning out the IRS Next… https://t.co/MM8lrcRfiC https://t.co/HmotsaH6j0,Unknown,English,2017-06-11T14:14:00,2017-06-11T14:15:00,1575.0000000000,480.0000000000,418.0000000000,,False
JuanthomssTrumT,Candidates for governor run on different priorities https://t.co/OgcH8bHgO7,Unknown,English,2017-06-11T14:19:00,2017-06-11T14:20:00,1575.0000000000,480.0000000000,420.0000000000,,False
JuanthomssTrumT,Celebration set for 50 years after landmark Gary election https://t.co/fbtfJ7fAUa,Unknown,English,2017-06-11T14:19:00,2017-06-11T14:19:00,1575.0000000000,480.0000000000,422.0000000000,,False
JuanthomssTrumT,DNA from zoo's polar bears used in fight against poaching https://t.co/nh8JOpF4j7,Unknown,English,2017-06-11T14:19:00,2017-06-11T14:19:00,1575.0000000000,480.0000000000,421.0000000000,,False
JuanthomssTrumT,"Qatar, in regional crisis, hires former US attorney general https://t.co/cp7aaTUELn https://t.co/6CsJ1YJXn3",Unknown,English,2017-06-11T14:19:00,2017-06-11T14:19:00,1575.0000000000,480.0000000000,419.0000000000,,False
JuanthomssTrumT,"Jeff Sessions, attorney general, seeks to testify before Senate intel committee this week https://t.co/1EBrWcAonY https://t.co/tqxc76Uq7n",Unknown,English,2017-06-11T14:19:00,2017-06-11T14:20:00,1575.0000000000,480.0000000000,423.0000000000,,False
JuanthomssTrumT,"Sen. Dianne Feinstein, California Democrat: 'Don't know' if Jeff Sessions will testify in public… https://t.co/64Yqs0pKO7",Unknown,English,2017-06-11T14:19:00,2017-06-11T14:19:00,1575.0000000000,480.0000000000,424.0000000000,,False
JuanthomssTrumT,"BREAKING : NYT, Delta, Bank of America, AMEX SPONSOR “Assassination of Trump” https://t.co/fdR5IKais4 https://t.co/hwWkZH2JpU",Unknown,English,2017-06-11T14:24:00,2017-06-11T14:24:00,1575.0000000000,482.0000000000,425.0000000000,,False
JuanthomssTrumT,Food critic says ‘you shouldn’t eat Chick-fil-A’ for political reasons — and it instantly backfires… https://t.co/AI3uK5oVcr,Unknown,English,2017-06-11T14:24:00,2017-06-11T14:24:00,1575.0000000000,482.0000000000,426.0000000000,,False
JuanthomssTrumT,Another Dem Admits No Evidence of Trump-Russia Collusion “WHATSOEVER” https://t.co/mh11qGCGGQ https://t.co/90sLcQQkFN,Unknown,English,2017-06-11T15:09:00,2017-06-11T15:09:00,1575.0000000000,485.0000000000,428.0000000000,,False
JuanthomssTrumT,Mysterious person in Congress made Wikipedia edits involving Trump and ‘obstruction of justice’… https://t.co/w9Ddl8apwW,Unknown,English,2017-06-11T15:09:00,2017-06-11T15:09:00,1575.0000000000,485.0000000000,427.0000000000,,False
JuanthomssTrumT,Muslims in Indiana Are Horrified by an Accurate List of Mohammeds Deeds https://t.co/P3lKNhb8xV https://t.co/NdlU4dYeFN,Unknown,English,2017-06-11T15:09:00,2017-06-11T15:09:00,1575.0000000000,485.0000000000,429.0000000000,,False
JuanthomssTrumT,A challenging time for LGBT activists in US and abroad https://t.co/Cn0JjcFyU9,Unknown,English,2017-06-11T15:14:00,2017-06-11T15:14:00,1575.0000000000,485.0000000000,431.0000000000,,False
JuanthomssTrumT,"Sen. Susan Collins, Maine Republican: President Trump should voluntarily turn over tapes https://t.co/L8fD6JjUr9",Unknown,English,2017-06-11T15:14:00,2017-06-11T15:14:00,1575.0000000000,485.0000000000,430.0000000000,,False
JuanthomssTrumT,NEWT “If Muslims Believe in Sharia Law They Should be DEPORTED” https://t.co/8rR46QM3qx https://t.co/P6hLuCyDVw,Unknown,English,2017-06-11T15:29:00,2017-06-11T15:29:00,1574.0000000000,485.0000000000,432.0000000000,,False
JuanthomssTrumT,More footage released of CNN allegedly staging pro-Muslim protest — and it’s incredibly damming… https://t.co/gNYlYk8fb8,Unknown,English,2017-06-11T16:04:00,2017-06-11T16:05:00,1574.0000000000,485.0000000000,433.0000000000,,False
JuanthomssTrumT,BREAKING : North Korea “Not Far Away” From Test-Firing ICBM Missile https://t.co/XK08quFFkm https://t.co/HaJMhDTZCd,Unknown,English,2017-06-11T16:14:00,2017-06-11T16:14:00,1574.0000000000,486.0000000000,434.0000000000,,False
JuanthomssTrumT,"Charles Schumer, Senate Minority Leader, invites President Trump to testify before the Senate… https://t.co/TNohPccvT6",Unknown,English,2017-06-11T16:24:00,2017-06-11T16:24:00,1574.0000000000,486.0000000000,438.0000000000,,False
JuanthomssTrumT,"Sen. Lindsey Graham, South Carolina Republican: 'I want to hear from Loretta Lynch' https://t.co/mOFI4TQNeu https://t.co/YeikZS3yjz",Unknown,English,2017-06-11T16:24:00,2017-06-11T16:24:00,1574.0000000000,486.0000000000,439.0000000000,,False
JuanthomssTrumT,NEW THEORY : Bill Clinton Cost Hillary the Election (ha ha ha) https://t.co/m8LomVCUBL https://t.co/iN0rRdhafL,Unknown,English,2017-06-11T16:24:00,2017-06-11T16:24:00,1574.0000000000,486.0000000000,437.0000000000,,False
JuanthomssTrumT,"Sen. James Lankford, Oklahoma Republican: Comey's memo leak 'not damaging to national security'… https://t.co/c8kKgHjrjz",Unknown,English,2017-06-11T16:24:00,2017-06-11T16:24:00,1574.0000000000,486.0000000000,440.0000000000,,False
JuanthomssTrumT,"Sen. Lindsey Graham, South Carolina Republican: 'I want to hear from Loretta Lynch' https://t.co/mOFI4TQNeu https://t.co/Q5DAuo1qTK",Unknown,English,2017-06-11T16:24:00,2017-06-11T16:25:00,1574.0000000000,486.0000000000,435.0000000000,,False
JuanthomssTrumT,"Sen. James Lankford, Oklahoma Republican: Comey's memo leak 'not damaging to national security'… https://t.co/uTftfmHRKz",Unknown,English,2017-06-11T16:24:00,2017-06-11T16:24:00,1574.0000000000,486.0000000000,436.0000000000,,False
JuanthomssTrumT,"Trump bashes ‘cowardly’ Comey for leaking memo in Twitter attack, suggests leaks might be ‘illegal’… https://t.co/KYwNrTG4Vp",Unknown,English,2017-06-11T16:29:00,2017-06-11T16:29:00,1574.0000000000,487.0000000000,441.0000000000,,False
JuanthomssTrumT,UK Prime Minister’s Office — Trump Scheduled Trip To Britain Is Still A Go! https://t.co/25dzTUmZQb https://t.co/4zO3Qi1zyf,Unknown,English,2017-06-11T16:39:00,2017-06-11T16:39:00,1574.0000000000,487.0000000000,442.0000000000,,False
JuanthomssTrumT,‘How long have I got?’: Why many cancer patients don’t have answers https://t.co/AeP3OqH4BS https://t.co/JTrtNJePpg,Unknown,English,2017-06-11T16:54:00,2017-06-11T16:54:00,1574.0000000000,487.0000000000,443.0000000000,,False
JuanthomssTrumT,Will self-driving cars ruin the great American road trip? https://t.co/zjUkyhwxoo https://t.co/kl3xRmF4qn,Unknown,English,2017-06-11T16:54:00,2017-06-11T16:54:00,1574.0000000000,487.0000000000,444.0000000000,,False
JuanthomssTrumT,White House denies report Trump will delay UK visit https://t.co/tiEdOgZ5c0 https://t.co/2ciiXKCAuy,Unknown,English,2017-06-11T17:24:00,2017-06-11T17:24:00,1574.0000000000,489.0000000000,453.0000000000,,False
JuanthomssTrumT,Afghan soldier kills 3 US troops https://t.co/0OYctUHARC https://t.co/LKTRSvZdvY,Unknown,English,2017-06-11T17:24:00,2017-06-11T17:24:00,1574.0000000000,489.0000000000,450.0000000000,,False
JuanthomssTrumT,Rafael Nadal makes history at French Open https://t.co/yIeFi6TzOr https://t.co/zSAO0IY80t,Unknown,English,2017-06-11T17:24:00,2017-06-11T17:24:00,1574.0000000000,489.0000000000,452.0000000000,,False
JuanthomssTrumT,France votes as Macron seeks majority https://t.co/8hG896M1yW https://t.co/mu4pz5WUcS,Unknown,English,2017-06-11T17:24:00,2017-06-11T17:24:00,1574.0000000000,489.0000000000,447.0000000000,,False
