author_id,content,region,language,publish_date,harvested_date,following,followers,updates,post_type,retweet
JuanthomssTrumT,Trump as power https://t.co/LU2MOE671k,Unknown,English,2017-06-06T02:33:00,2017-06-06T02:33:00,0E-10,0E-10,1.0000000000,,False
JuanthomssTrumT,London Attacker Was Featured In British Documentary “The Jihadis Next Door” https://t.co/HiwtQ3wrPl https://t.co/906kFc77AR,Unknown,English,2017-06-06T19:47:00,2017-06-06T19:47:00,969.0000000000,224.0000000000,4.0000000000,,False
JuanthomssTrumT,OOPS: Sadiq Khan Becomes A Laughingstock After What He Just Said About Trump… https://t.co/p1qsjfZhOs https://t.co/eF1oluUYlj,Unknown,English,2017-06-06T19:47:00,2017-06-06T19:47:00,969.0000000000,224.0000000000,3.0000000000,,False
JuanthomssTrumT,Army Vet With Bad Hair Gets A Drastic New Look For Her Kids And Looks Completely Unrecognizable [Video]… https://t.co/1s09ch6eT9,Unknown,English,2017-06-06T19:47:00,2017-06-06T19:47:00,969.0000000000,224.0000000000,5.0000000000,,False
JuanthomssTrumT,At least 10 who got into Harvard lose admission over offensive memes https://t.co/F9UNj8zwWa https://t.co/OEGKdztV7c,Unknown,English,2017-06-06T19:47:00,2017-06-06T19:48:00,969.0000000000,224.0000000000,7.0000000000,,False
JuanthomssTrumT,Blast near Afghan mosque kills 7 civilians https://t.co/VjXyBFLQoR https://t.co/FxgkBnpWx9,Unknown,English,2017-06-06T19:47:00,2017-06-06T19:47:00,969.0000000000,224.0000000000,6.0000000000,,False
JuanthomssTrumT,U.S. Imam Says Female Genital Mutilation Prevents “Hyper-Sexuality” https://t.co/AsqbxzVmjk https://t.co/Zto7yoXYae,Unknown,English,2017-06-06T20:19:00,2017-06-06T20:20:00,969.0000000000,227.0000000000,9.0000000000,,False
JuanthomssTrumT,JUST IN: Trump’s Issues 4-Word Comment To James Comey… Sends Liberals CRYING https://t.co/FlSqmrAKhU https://t.co/q0GkSb2Eae,Unknown,English,2017-06-06T20:19:00,2017-06-06T20:20:00,969.0000000000,227.0000000000,8.0000000000,,False
JuanthomssTrumT,It’s official: George Clooney is a dad!The Clooneys... https://t.co/ntUeGH5WLI https://t.co/4jSTKpmByV,Unknown,English,2017-06-06T20:51:00,2017-06-06T20:51:00,969.0000000000,230.0000000000,10.0000000000,,False
JuanthomssTrumT,New Photo Emerges Of Syrian Boy Who Gave A Face To The Suffering In Aleppo https://t.co/HTRcu2Vhxn https://t.co/v1OdDO1gEC,Unknown,English,2017-06-06T21:23:00,2017-06-06T21:23:00,969.0000000000,233.0000000000,11.0000000000,,False
JuanthomssTrumT,New Poll Proves Media Is LYING About Americans “Disapproval” Of Paris Climate Accord Exit https://t.co/ecfA5fCUqH https://t.co/LrbsgAARwh,Unknown,English,2017-06-06T21:56:00,2017-06-06T21:56:00,968.0000000000,240.0000000000,12.0000000000,,False
JuanthomssTrumT,Chelsea Clinton Asked To Sign Book For ‘Juanita Broaddrick’ At Book Signing For “She Persisted”… https://t.co/T7XPz84OJh,Unknown,English,2017-06-07T19:47:00,2017-06-07T19:47:00,965.0000000000,315.0000000000,13.0000000000,,False
JuanthomssTrumT,It’s A Special Someone’s Birthday Today… https://t.co/QoHR1lWr2Y https://t.co/QdgDTO70J4,Unknown,English,2017-06-07T19:47:00,2017-06-07T19:47:00,965.0000000000,315.0000000000,17.0000000000,,False
JuanthomssTrumT,Sadiq Khan’s Anti-Trump Attitude Gets DESTROYED By Queen Elizabeth… Media SHOCKED https://t.co/OIHmy6ERvv https://t.co/ob8gSKlIeP,Unknown,English,2017-06-07T19:47:00,2017-06-07T19:47:00,965.0000000000,315.0000000000,16.0000000000,,False
JuanthomssTrumT,"American Flags Seen Thrown In Pile, Tossed In Trash Bin At Bixby Cemetery https://t.co/pFsEwL2mSx https://t.co/8RqDFT6lkp",Unknown,English,2017-06-07T19:47:00,2017-06-07T19:47:00,965.0000000000,315.0000000000,14.0000000000,,False
JuanthomssTrumT,Tucker Carlson Cuts The Mic Of BLM Activist Yelling About White Racism https://t.co/0Hp1zCWoEI https://t.co/i1uhqV2oZq,Unknown,English,2017-06-07T19:47:00,2017-06-07T19:47:00,965.0000000000,315.0000000000,15.0000000000,,False
JuanthomssTrumT,Fascinating Video Shows How Everyday Sounds Trigger Veterans With PTSD https://t.co/3ZhO69Km1G https://t.co/PLTVr09TcF,Unknown,English,2017-06-07T20:19:00,2017-06-07T20:19:00,965.0000000000,321.0000000000,18.0000000000,,False
JuanthomssTrumT,BREAKING : Leaked Email Proves DNC Planned Fake Trump/Putin Story https://t.co/l3bvgDx3LN https://t.co/N8fo0KJW40,Unknown,English,2017-06-07T20:19:00,2017-06-07T20:19:00,965.0000000000,321.0000000000,19.0000000000,,False
JuanthomssTrumT,BREAKING VIDEO : Trump Was NEVER Under FBI Investigation https://t.co/BAUtbsH7k7 https://t.co/SThjqqzth0,Unknown,English,2017-06-07T21:23:00,2017-06-07T21:23:00,965.0000000000,327.0000000000,20.0000000000,,False
JuanthomssTrumT,BREAKING : Comey Will NOT Claim that Trump “Obstructed Justice” https://t.co/0PbLW9exDk https://t.co/R2cYTfEloH,Unknown,English,2017-06-07T21:55:00,2017-06-07T21:55:00,965.0000000000,329.0000000000,21.0000000000,,False
JuanthomssTrumT,NEW POLL : Majority of Americans Distrust Comey https://t.co/9BkEAWqnVB https://t.co/Gc3N2FzRXW,Unknown,English,2017-06-07T21:55:00,2017-06-07T21:55:00,965.0000000000,329.0000000000,22.0000000000,,False
JuanthomssTrumT,"Obama’s ‘Security Company, A Deep State Military Force, Sets Up Just Outside 3 Major Cities … https://t.co/Hyl2442Tk1",Unknown,English,2017-06-08T18:27:00,2017-06-08T18:27:00,963.0000000000,355.0000000000,24.0000000000,,False
JuanthomssTrumT,Comey ‘Called Out’ The NY Times For #FakeNews — No Truth To Collusion https://t.co/oerD8olcZu https://t.co/N1N5uWZN1u,Unknown,English,2017-06-08T18:27:00,2017-06-08T18:27:00,963.0000000000,355.0000000000,25.0000000000,,False
JuanthomssTrumT,Fired director James Comey has a message for FBI staff. https://t.co/QX4oZH6gsz https://t.co/mwOVFLoIlF,Unknown,English,2017-06-08T18:27:00,2017-06-08T18:27:00,963.0000000000,355.0000000000,23.0000000000,,False
JuanthomssTrumT,Comey Admits Media Pushed Trump-Russisa FAKE NEWS https://t.co/i7S4CHxaXK https://t.co/YGrbwJ8lU1,Unknown,English,2017-06-08T18:27:00,2017-06-08T18:27:00,963.0000000000,355.0000000000,26.0000000000,,False
JuanthomssTrumT,Woodstock to honor civil rights activist despite opposition https://t.co/WLMlXuKbIb,Unknown,English,2017-06-08T18:35:00,2017-06-08T18:35:00,963.0000000000,354.0000000000,30.0000000000,,False
JuanthomssTrumT,LOL : Sad Liberals Watch Comey Hearing in Brooklyn Bar https://t.co/28zJkRtWem https://t.co/39QoBC3Yyb,Unknown,English,2017-06-08T18:35:00,2017-06-08T18:35:00,963.0000000000,354.0000000000,29.0000000000,,False
JuanthomssTrumT,"House Report – Obama, Eric Holder Lied, Obstructed Justice In “Fast And Furious” https://t.co/jgmzzunDqF https://t.co/cTIDaKDMNG",Unknown,English,2017-06-08T18:35:00,2017-06-08T18:35:00,963.0000000000,354.0000000000,32.0000000000,,False
JuanthomssTrumT,"Iran calls Trump's reaction to ISIS attacks ""repugnant"" https://t.co/G2RpGJ3ErO https://t.co/d1b18CRmIL",Unknown,English,2017-06-08T18:35:00,2017-06-08T18:35:00,963.0000000000,354.0000000000,31.0000000000,,False
JuanthomssTrumT,Comey on his firing: ‘There was an explanation. I just don’t buy it.’ https://t.co/RgpML1xQ9O https://t.co/SoBHolCkTm,Unknown,English,2017-06-08T18:35:00,2017-06-08T18:35:00,963.0000000000,354.0000000000,28.0000000000,,False
JuanthomssTrumT,JUST IN: Stock Market Shows HUGE Support For Trump After James Comey Hearing… https://t.co/0MZ3qIhjIf https://t.co/HAPLNno0Ac,Unknown,English,2017-06-08T18:44:00,2017-06-08T18:44:00,963.0000000000,356.0000000000,33.0000000000,,False
JuanthomssTrumT,BREAKING VIDEO : Trump’s Attorney Responds to Comey Testimony https://t.co/YsLuHPBlAV https://t.co/uzTIxWEEpc,Unknown,English,2017-06-08T18:51:00,2017-06-08T18:51:00,963.0000000000,356.0000000000,35.0000000000,,False
JuanthomssTrumT,US Marine who graduated early barred from high school’s June commencement. Because of his uniform.… https://t.co/oCHVxaIPkb,Unknown,English,2017-06-08T19:07:00,2017-06-08T19:07:00,963.0000000000,356.0000000000,36.0000000000,,False
JuanthomssTrumT,BREAKING: Neil Gorsuch Just Set The Supreme Court On FIRE With Historic New Move… https://t.co/cyMDJKoVFR https://t.co/tJOwLaouco,Unknown,English,2017-06-08T19:15:00,2017-06-08T19:15:00,963.0000000000,356.0000000000,37.0000000000,,False
JuanthomssTrumT,Suit seeks to put independents on N Carolina elections board https://t.co/jAbwfJ1nd9,Unknown,English,2017-06-08T19:23:00,2017-06-08T19:23:00,963.0000000000,356.0000000000,42.0000000000,,False
JuanthomssTrumT,Mayor signs police anti-profiling measure into law https://t.co/sYB2REd8eB,Unknown,English,2017-06-08T19:23:00,2017-06-08T19:23:00,963.0000000000,356.0000000000,38.0000000000,,False
JuanthomssTrumT,"Marc Kasowitz, Trump's personal lawyer, says Comey proved no interference in Russia probe https://t.co/C3p89WYXGT https://t.co/HEp7X7GMWp",Unknown,English,2017-06-08T19:23:00,2017-06-08T19:23:00,963.0000000000,356.0000000000,39.0000000000,,False
JuanthomssTrumT,Judge asked to shield well-known immigrant from deportation https://t.co/aPV0ARABVT,Unknown,English,2017-06-08T19:23:00,2017-06-08T19:23:00,963.0000000000,356.0000000000,43.0000000000,,False
JuanthomssTrumT,Pence to discuss health care in Wisconsin visit https://t.co/3OJ3DdPotC,Unknown,English,2017-06-08T19:23:00,2017-06-08T19:23:00,963.0000000000,356.0000000000,41.0000000000,,False
JuanthomssTrumT,BOMBSHELL : Indisputable PROOF Emerges Comey Committed Perjury https://t.co/8YK1mUVDo1 https://t.co/iv4ojpzUNl,Unknown,English,2017-06-08T19:23:00,2017-06-08T19:23:00,963.0000000000,356.0000000000,44.0000000000,,False
JuanthomssTrumT,"Tom Price, HHS chief, and Democrats spar over Obamacare's future https://t.co/LdsGBfnywn https://t.co/7pBidXULOa",Unknown,English,2017-06-08T19:23:00,2017-06-08T19:23:00,963.0000000000,356.0000000000,40.0000000000,,False
JuanthomssTrumT,A mentor inside and outside the ring https://t.co/qPiTTTetk3 https://t.co/vaTIzyhZeL,Unknown,English,2017-06-08T19:31:00,2017-06-08T19:33:00,963.0000000000,356.0000000000,45.0000000000,,False
JuanthomssTrumT,'Books before boxing' credo sends kids to college https://t.co/GedIRExFSj https://t.co/FnjZlcuDma,Unknown,English,2017-06-08T19:31:00,2017-06-08T19:33:00,963.0000000000,356.0000000000,46.0000000000,,False
JuanthomssTrumT,"Republican House members ‘should be guillotined,’ Democratic Socialist students say https://t.co/QA10MQcsTo https://t.co/eKIKmO9aNz",Unknown,English,2017-06-08T19:39:00,2017-06-08T19:39:00,963.0000000000,356.0000000000,47.0000000000,,False
JuanthomssTrumT,BREAKING : Trey Gowdy Announces His New Role! https://t.co/lPbncrpri8 https://t.co/q7Z1x5ETEs,Unknown,English,2017-06-08T19:47:00,2017-06-08T19:47:00,963.0000000000,358.0000000000,49.0000000000,,False
JuanthomssTrumT,BOOM: Rush Limbaugh Calls Out “Pathological” CNN In STUNNING Rant… https://t.co/vXDWlHgtoP https://t.co/EfRStXBKob,Unknown,English,2017-06-08T19:47:00,2017-06-08T19:47:00,963.0000000000,358.0000000000,48.0000000000,,False
JuanthomssTrumT,Trump’s lawyer accuses Comey of lying under oath as part of retaliation for being fired https://t.co/FbQm8kSbaR https://t.co/MUVwwc5nrA,Unknown,English,2017-06-08T19:55:00,2017-06-08T19:55:00,963.0000000000,359.0000000000,50.0000000000,,False
JuanthomssTrumT,"BREAKING : NSA Leaker Indicted, Faces Up to 10 Years in Prison https://t.co/qWRPXoKUxk https://t.co/aKeSaH9U5T",Unknown,English,2017-06-08T20:04:00,2017-06-08T20:04:00,963.0000000000,360.0000000000,51.0000000000,,False
JuanthomssTrumT,Social Media Reacts to Comey Admission “NO VOTES Altered by RUSSIANS” https://t.co/uINmdELHJm https://t.co/EGheZdu1Um,Unknown,English,2017-06-08T20:11:00,2017-06-08T20:11:00,963.0000000000,360.0000000000,52.0000000000,,False
JuanthomssTrumT,Trey Gowdy recommended by GOP steering committee to chair House oversight committee https://t.co/YArBivSP4p https://t.co/N3CHBXNtsw,Unknown,English,2017-06-08T20:19:00,2017-06-08T20:19:00,963.0000000000,360.0000000000,53.0000000000,,False
JuanthomssTrumT,Charles Schumer says Comey hearing deepened 'cloud' over Donald Trump https://t.co/3i8bVAUuRC,Unknown,English,2017-06-08T20:19:00,2017-06-08T20:19:00,963.0000000000,360.0000000000,54.0000000000,,False
JuanthomssTrumT,Restaurant owner takes to Facebook after workers removed https://t.co/KQcb4cII4r,Unknown,English,2017-06-08T20:19:00,2017-06-08T20:19:00,963.0000000000,360.0000000000,55.0000000000,,False
JuanthomssTrumT,Remember The Turkish Fight Last Month? House Finally Acts! https://t.co/229Uzb0B98 https://t.co/Hq30LqLnlC,Unknown,English,2017-06-08T20:35:00,2017-06-08T20:35:00,963.0000000000,361.0000000000,56.0000000000,,False
JuanthomssTrumT,"PETA produced fake cat abuse video, allegedly wanted media to report it as real https://t.co/sXB5CeUV2f https://t.co/O2B4Z2ilgd",Unknown,English,2017-06-08T20:43:00,2017-06-08T20:43:00,963.0000000000,361.0000000000,57.0000000000,,False
JuanthomssTrumT,Who would play James Comey in a movie? https://t.co/7bub6Ini4d https://t.co/hibWXaULWw,Unknown,English,2017-06-08T20:43:00,2017-06-08T20:43:00,963.0000000000,361.0000000000,58.0000000000,,False
JuanthomssTrumT,James Comey really wishes he had kept that date with his... https://t.co/GUCQ3Bglqn https://t.co/z1wTcRAfzk,Unknown,English,2017-06-08T20:43:00,2017-06-08T20:43:00,963.0000000000,361.0000000000,59.0000000000,,False
JuanthomssTrumT,Critics blast Jessica Simpson over this public photo of her 5-year-old daughter https://t.co/alHLVeapnD https://t.co/8Vu6PpmW7d,Unknown,English,2017-06-08T21:07:00,2017-06-08T21:07:00,963.0000000000,363.0000000000,60.0000000000,,False
JuanthomssTrumT,Florida lawmaker: Remove prosecutor from death row case https://t.co/OT5Uo1IsaH,Unknown,English,2017-06-08T21:23:00,2017-06-08T21:24:00,963.0000000000,363.0000000000,61.0000000000,,False
JuanthomssTrumT,"Obama’s ‘Security Company, A Deep State Military Force, Sets Up Just Outside 3 Major Cities … https://t.co/owir0Ve5q1",Unknown,English,2017-06-08T21:23:00,2017-06-08T21:23:00,963.0000000000,363.0000000000,65.0000000000,,False
JuanthomssTrumT,House votes to undo key parts of Dodd-Frank financial reform law https://t.co/jb4jgwHa8h https://t.co/8deNImWmJ1,Unknown,English,2017-06-08T21:23:00,2017-06-08T21:23:00,963.0000000000,363.0000000000,62.0000000000,,False
JuanthomssTrumT,"TRUMP STRIKES BACK: Right After Comey Testimony, Trump’s Lawyer Did The UNTHINKABLE https://t.co/PKoM5Wli8s https://t.co/dnGcLlJOAB",Unknown,English,2017-06-08T21:23:00,2017-06-08T21:24:00,963.0000000000,363.0000000000,64.0000000000,,False
JuanthomssTrumT,"He’s Lost It – MCCAIN Shows The World With INCOHERENT, BABBLING Questioning https://t.co/Odsmat2Mj7 https://t.co/BVInreJTp1",Unknown,English,2017-06-08T21:23:00,2017-06-08T21:24:00,963.0000000000,363.0000000000,63.0000000000,,False
JuanthomssTrumT,This is what John McCain blamed for his confusing stream-of-consciousness questioning of Comey… https://t.co/M5vWn7RrqN,Unknown,English,2017-06-08T22:03:00,2017-06-08T22:04:00,1574.0000000000,371.0000000000,66.0000000000,,False
JuanthomssTrumT,"When Asked About Loretta Lynch, What Comey Said Next Left The Room SPEECHLESS https://t.co/ymW7n8wDYK https://t.co/6X0iiqxoAj",Unknown,English,2017-06-08T22:03:00,2017-06-08T22:03:00,1574.0000000000,371.0000000000,67.0000000000,,False
JuanthomssTrumT,Uber fined $98G for underreporting NY lobbying spending https://t.co/xhQ0y67sJE,Unknown,English,2017-06-08T22:19:00,2017-06-08T22:19:00,1576.0000000000,373.0000000000,69.0000000000,,False
JuanthomssTrumT,"President Trump didn’t tweet during Comey’s testimony, but Trump Jr. was a tweeting machine … https://t.co/uMroHUzp0k",Unknown,English,2017-06-08T22:19:00,2017-06-08T22:19:00,1576.0000000000,373.0000000000,70.0000000000,,False
JuanthomssTrumT,James Comey hands Donald Trump re-election victory https://t.co/z3uDQsKqTh,Unknown,English,2017-06-08T22:19:00,2017-06-08T22:19:00,1576.0000000000,373.0000000000,68.0000000000,,False
JuanthomssTrumT,Comey Took Notes of Every Trump Meeting But Did Not Record Hillary’s 3 Hour Interrogation https://t.co/XsMgz1SiNW https://t.co/nD2iaKoLUt,Unknown,English,2017-06-08T22:35:00,2017-06-08T22:36:00,1575.0000000000,374.0000000000,71.0000000000,,False
JuanthomssTrumT,Erin Andrews breaks down discussing naked video with Megyn Kelly: ‘It shaped who I am’ https://t.co/aWGqWImkMG https://t.co/b3lLT3GpV6,Unknown,English,2017-06-08T22:35:00,2017-06-08T22:35:00,1575.0000000000,374.0000000000,72.0000000000,,False
JuanthomssTrumT,LOL : This ONE WORD Ruined Any HOPE Libs Had of Impeaching Trump https://t.co/2RS1Y6EQON https://t.co/efVVOGUlSp,Unknown,English,2017-06-08T22:43:00,2017-06-08T22:43:00,1574.0000000000,374.0000000000,74.0000000000,,False
JuanthomssTrumT,BREAKING : Rosie and Liberal Hollywood Lose their SH*T Over Comey Hearing https://t.co/F6N95pveYd https://t.co/cb0KYMo4Hs,Unknown,English,2017-06-08T22:43:00,2017-06-08T22:43:00,1574.0000000000,374.0000000000,73.0000000000,,False
JuanthomssTrumT,MSNBC’s Chris Matthews ADMITS Trump-Russia Collusion ‘Came Apart’ With Comey Testimony (VIDEO)… https://t.co/pRhCWSglPp,Unknown,English,2017-06-08T22:51:00,2017-06-08T22:51:00,1574.0000000000,374.0000000000,75.0000000000,,False
JuanthomssTrumT,Comey Admitted He’s Illegal Leaker Says Trump Atty – Trying To Undermine President https://t.co/rmZNJPEelL https://t.co/wJ70P1E3IE,Unknown,English,2017-06-08T22:59:00,2017-06-08T22:59:00,1574.0000000000,374.0000000000,76.0000000000,,False
JuanthomssTrumT,Watch: Ted Cruz cut off abruptly during ‘Faith &amp; Freedom’ remarks in amazingly awkward video … https://t.co/WAiYxGcE1P,Unknown,English,2017-06-08T23:07:00,2017-06-08T23:07:00,1574.0000000000,374.0000000000,77.0000000000,,False
JuanthomssTrumT,30-day deportation reprieve for Hawaii coffee farmer https://t.co/ojaP3dotcc,Unknown,English,2017-06-08T23:23:00,2017-06-08T23:23:00,1574.0000000000,376.0000000000,79.0000000000,,False
JuanthomssTrumT,The Latest: Gianforte to enter plea in assault case https://t.co/Uk7B6b9zlL,Unknown,English,2017-06-08T23:23:00,2017-06-08T23:23:00,1574.0000000000,376.0000000000,78.0000000000,,False
JuanthomssTrumT,LYING CNN Still Pushing DEBUNKED “Trump Under Investigation” Story https://t.co/9Ujr5UqrGy https://t.co/zFWJmdKc37,Unknown,English,2017-06-08T23:23:00,2017-06-08T23:23:00,1574.0000000000,376.0000000000,80.0000000000,,False
JuanthomssTrumT,BUSTED: Anderson Cooper Has Ties To Arrested NSA Leaker… https://t.co/XeGAk02nZ1 https://t.co/1F2VJ5OAMj,Unknown,English,2017-06-08T23:39:00,2017-06-08T23:39:00,1573.0000000000,380.0000000000,82.0000000000,,False
JuanthomssTrumT,VIDEO : Chris Matthews Admits Trump-Russia Collusion Theory Has Fallen Apart https://t.co/tAv27nmQXL https://t.co/kEh15XNWqD,Unknown,English,2017-06-08T23:55:00,2017-06-08T23:55:00,1574.0000000000,383.0000000000,83.0000000000,,False
JuanthomssTrumT,Donald Trump's Dreamer approvals rile conservative base https://t.co/qfaPEhi4lo https://t.co/JbLlqL4n9u,Unknown,English,2017-06-09T00:19:00,2017-06-09T00:19:00,1574.0000000000,385.0000000000,89.0000000000,,False
JuanthomssTrumT,Brown to lawmakers: It's time to start passing budgets https://t.co/3taPnj3k6A,Unknown,English,2017-06-09T00:19:00,2017-06-28T08:57:00,1574.0000000000,385.0000000000,85.0000000000,,False
JuanthomssTrumT,Donald Trump shores up evangelical support but alienates gays https://t.co/gxYv0y9xlm https://t.co/dYqGJcnqK9,Unknown,English,2017-06-09T00:19:00,2017-06-09T00:19:00,1574.0000000000,385.0000000000,88.0000000000,,False
JuanthomssTrumT,"Inside the Beltway: The power of faith, freedom and Donald Trump https://t.co/w5kYfqFTjH https://t.co/uvgKhBbjs5",Unknown,English,2017-06-09T00:19:00,2017-06-09T00:19:00,1574.0000000000,385.0000000000,86.0000000000,,False
JuanthomssTrumT,The Latest: Woman charged with top-secret leak denied bond https://t.co/SePKOwCaUX https://t.co/Cb6GYODw37,Unknown,English,2017-06-09T00:19:00,2017-06-09T00:19:00,1574.0000000000,385.0000000000,87.0000000000,,False
JuanthomssTrumT,Maine high school issues ‘sports hijabs’ to Muslim athletes https://t.co/TN6F7epLTJ https://t.co/hvgIKMN6e5,Unknown,English,2017-06-09T00:27:00,2017-06-09T00:27:00,1574.0000000000,386.0000000000,91.0000000000,,False
JuanthomssTrumT,VIDEO : Humiliated CNN Forced to Retract FAKE NEWS Comey Headline https://t.co/T5gmeuTyzX https://t.co/mUHUWCGraw,Unknown,English,2017-06-09T00:27:00,2017-06-09T00:27:00,1574.0000000000,386.0000000000,90.0000000000,,False
JuanthomssTrumT,VIRAL POST : Top 10 Things We Learned Today from the Comey Hearing https://t.co/jsdt2id5ma https://t.co/1dVX85ig7O,Unknown,English,2017-06-09T00:43:00,2017-06-09T00:43:00,1574.0000000000,387.0000000000,92.0000000000,,False
JuanthomssTrumT,Supermarket mass killer left a chilling prediction about Trump https://t.co/XOQ07edy4p https://t.co/IfDav1AqXv,Unknown,English,2017-06-09T00:43:00,2017-06-09T00:43:00,1574.0000000000,387.0000000000,93.0000000000,,False
JuanthomssTrumT,"Unlimited may be out, but Amazon still has the best deal in... https://t.co/9COjjAqgOW https://t.co/0Pn8VviDrj",Unknown,English,2017-06-09T00:51:00,2017-06-09T00:51:00,1574.0000000000,386.0000000000,94.0000000000,,False
JuanthomssTrumT,Exclusive: Hear Glen Campbell and Willie Nelson's 'Funny How Time Slips Away' https://t.co/CtypMjDsVa https://t.co/nF80o6Md6N,Unknown,English,2017-06-09T00:51:00,2017-06-09T00:51:00,1574.0000000000,386.0000000000,95.0000000000,,False
JuanthomssTrumT,"Who Rosie O’Donnell Just Donated $1,000 to Will Make You Sick https://t.co/A6rGiHX88G https://t.co/ZhqGi52dNY",Unknown,English,2017-06-09T00:59:00,2017-06-09T00:59:00,1573.0000000000,385.0000000000,96.0000000000,,False
JuanthomssTrumT,Kellyanne Conway completely shuts down Fox News over questions on Comey tapes https://t.co/c6V6AEoMVG https://t.co/cIjBp6ADdJ,Unknown,English,2017-06-09T01:07:00,2017-06-09T01:07:00,1573.0000000000,385.0000000000,97.0000000000,,False
JuanthomssTrumT,A disgruntled employee fails to make the case against his old boss https://t.co/NzO3sPSquE,Unknown,English,2017-06-09T01:15:00,2017-06-09T01:15:00,1573.0000000000,385.0000000000,98.0000000000,,False
JuanthomssTrumT,James Comey admits Trump not explicit on ending Flynn inquiry https://t.co/leOUoLj2v7 https://t.co/S2QXRVNUBI,Unknown,English,2017-06-09T01:15:00,2017-06-09T01:15:00,1573.0000000000,385.0000000000,100.0000000000,,False
JuanthomssTrumT,Muslim groups praise tolerant lawmakers as part of Ramadan celebrations https://t.co/zOfDSkHqX0 https://t.co/Lukq9oI042,Unknown,English,2017-06-09T01:15:00,2017-06-09T01:15:00,1573.0000000000,385.0000000000,99.0000000000,,False
JuanthomssTrumT,What Eric Holder Pledged to Obama Shows the Dems Ridiculous Double Standard https://t.co/tT4XDrZfMg https://t.co/3KkB3ACFC7,Unknown,English,2017-06-09T01:31:00,2017-06-09T01:31:00,1573.0000000000,385.0000000000,101.0000000000,,False
JuanthomssTrumT,"BOMBSHELL: NSA Leaker Plotted To Join Taliban, Kill Trump In SHOCKING Way… https://t.co/QoOOGJGiJq https://t.co/bTIZEMyHJ0",Unknown,English,2017-06-09T01:39:00,2017-06-09T01:39:00,1573.0000000000,385.0000000000,102.0000000000,,False
JuanthomssTrumT,WHOOPS : Woman Obama Granted Clemency to Ordered Back to Prison https://t.co/tu7zem514g https://t.co/aaEL1jRNOS,Unknown,English,2017-06-09T01:39:00,2017-06-09T01:39:00,1573.0000000000,385.0000000000,103.0000000000,,False
JuanthomssTrumT,LISTEN : Rush SLAMS CNN’s “Fake News” Spin on Comey’s Testimony https://t.co/s43CfnfhF9 https://t.co/J9O56r0FjY,Unknown,English,2017-06-09T01:55:00,2017-06-09T01:55:00,1573.0000000000,386.0000000000,104.0000000000,,False
JuanthomssTrumT,VIRAL : Cowardly Leftists Attack Conservative Writer… INSTANTLY Regret It https://t.co/93KSdxYchq https://t.co/fvopgt6VFx,Unknown,English,2017-06-09T02:03:00,2017-06-09T02:03:00,1574.0000000000,389.0000000000,105.0000000000,,False
JuanthomssTrumT,During Comey Hearing Something AWESOME Happened With Dodd-Frank Bill https://t.co/sK35n0aU5X https://t.co/3D4538vR3o,Unknown,English,2017-06-09T02:11:00,2017-06-09T02:13:00,1574.0000000000,389.0000000000,106.0000000000,,False
JuanthomssTrumT,VIDEO : Tucker – Today’s STUNNER is Comey Admits HE’S THE LEAK https://t.co/Zdyuq2uq69 https://t.co/QFlljBi1eT,Unknown,English,2017-06-09T02:19:00,2017-06-09T02:19:00,1573.0000000000,389.0000000000,108.0000000000,,False
JuanthomssTrumT,"BREAKING: Pickup truck drives through crowd, runs over 2 police officers in Washington, D.C. … https://t.co/2LgpH7oRUg",Unknown,English,2017-06-09T02:19:00,2017-06-09T02:19:00,1573.0000000000,389.0000000000,107.0000000000,,False
JuanthomssTrumT,Clinton’s Campaign Manager Claims Wasn’t Talking To DOJ; Forgets Bill And Tarmac! https://t.co/KNV6YW6Ti7 https://t.co/ngs9urQvUD,Unknown,English,2017-06-09T02:27:00,2017-06-09T02:27:00,1573.0000000000,389.0000000000,110.0000000000,,False
JuanthomssTrumT,"“Lame Brain” McCain Ignores Comey Confessions, Still Wants Select Committee https://t.co/BQecWnF0Iy https://t.co/Hxnk4fWTCW",Unknown,English,2017-06-09T02:27:00,2017-06-09T02:27:00,1573.0000000000,389.0000000000,109.0000000000,,False
JuanthomssTrumT,High School Tells U.S. Marine He Can’t Wear Uniform At Commencement; Turns Him Away! https://t.co/vM31TkUA9k https://t.co/t2Y21MJ7UI,Unknown,English,2017-06-09T03:21:00,2017-06-09T03:21:00,1573.0000000000,391.0000000000,111.0000000000,,False
JuanthomssTrumT,"Matthews ADMITS Comey Testimony Shatters Russia, Trump Collusion https://t.co/JFnWbpgaqV https://t.co/sfiDRfg1Tl",Unknown,English,2017-06-09T04:10:00,2017-06-09T04:11:00,1573.0000000000,394.0000000000,112.0000000000,,False
JuanthomssTrumT,Massachusetts lawmakers to hear immigration 'sanctuary' bill https://t.co/GsQKNQ390g,Unknown,English,2017-06-09T04:25:00,2017-06-09T04:25:00,1573.0000000000,395.0000000000,113.0000000000,,False
JuanthomssTrumT,Trey Gowdy To Takeover As Chairman Of House Oversight Committee https://t.co/ScGHqEIhcw https://t.co/zpPExLZuIs,Unknown,English,2017-06-09T04:45:00,2017-06-09T04:45:00,1573.0000000000,396.0000000000,114.0000000000,,False
