author_id,content,region,language,publish_date,harvested_date,following,followers,updates,post_type,retweet
JuanthomssTrumT,Gingrich – Shut Down Independent Counsel – Mueller Witch Hunt A Politicized Trap https://t.co/7ORtca8Psb https://t.co/RFkso4ff2P,Unknown,English,2017-06-13T07:53:00,2017-06-13T07:53:00,1571.0000000000,533.0000000000,667.0000000000,,False
JuanthomssTrumT,Q&amp;A: What's next in the legal fight over the travel ban https://t.co/hZ5LZZWK7L https://t.co/RRaLRtWsgA,Unknown,English,2017-06-13T08:13:00,2017-06-13T08:13:00,1571.0000000000,533.0000000000,668.0000000000,,False
JuanthomssTrumT,Attorneys general hope to force Trump financial disclosures https://t.co/gko0WRJwM5 https://t.co/1aGQMsCbQd,Unknown,English,2017-06-13T08:13:00,2017-06-13T08:13:00,1571.0000000000,533.0000000000,669.0000000000,,False
JuanthomssTrumT,Trump transition aide was key player in Flynn's Turkish work https://t.co/ignhgWs2tw https://t.co/3ukpF5tA1C,Unknown,English,2017-06-13T08:53:00,2017-06-13T08:53:00,1571.0000000000,533.0000000000,670.0000000000,,False
JuanthomssTrumT,Levin – Separation Of Powers Prevents Trump From Testifying Before Congress https://t.co/CuunzzhIVE https://t.co/9hj0EkM5hM,Unknown,English,2017-06-13T09:23:00,2017-06-13T09:23:00,1571.0000000000,533.0000000000,671.0000000000,,False
JuanthomssTrumT,"Op-Ed : If There Was Illegal Meddling in the Election, It Was By Loretta Lynch https://t.co/sOkHTl7bGN https://t.co/6uGBi6r17f",Unknown,English,2017-06-13T09:23:00,2017-06-13T09:23:00,1571.0000000000,533.0000000000,672.0000000000,,False
JuanthomssTrumT,VIDEO : OOPS! Mad Max Accidentally Spills the Beans on Obama’s Spying Database https://t.co/V1mCCHmgCk https://t.co/Akeh9t9Kfd,Unknown,English,2017-06-13T09:33:00,2017-06-13T09:33:00,1571.0000000000,533.0000000000,673.0000000000,,False
JuanthomssTrumT,BREAKING : Gorsuch Just Made His First Ruling and Liberals are TRIGGERED Already! https://t.co/2xybB0WAAX https://t.co/acgMadnyvD,Unknown,English,2017-06-13T09:43:00,2017-06-13T09:43:00,1571.0000000000,533.0000000000,674.0000000000,,False
JuanthomssTrumT,VIDEO : Corsi “Deep State is Planning an Assassination” by “Desensitizing the Public” https://t.co/MXrncuVg4N https://t.co/x0totmOo3B,Unknown,English,2017-06-13T09:53:00,2017-06-13T09:53:00,1571.0000000000,534.0000000000,675.0000000000,,False
JuanthomssTrumT,Martin announces run for attorney general https://t.co/5GB5C2q5Qa,Unknown,English,2017-06-13T10:08:00,2017-06-13T10:08:00,1571.0000000000,534.0000000000,676.0000000000,,False
JuanthomssTrumT,VIDEO : Huckabee SLAMS CNN as “A CORRUPT Media” https://t.co/uZJrNWbbmT https://t.co/QGpFYEaoMb,Unknown,English,2017-06-13T10:23:00,2017-06-13T10:23:00,1571.0000000000,533.0000000000,678.0000000000,,False
JuanthomssTrumT,What Newt Just Tweeted About Comey Friend Mueller is Breaking the Internet https://t.co/4mU5eCGY50 https://t.co/uirYlrYGCE,Unknown,English,2017-06-13T10:23:00,2017-06-13T10:23:00,1571.0000000000,533.0000000000,677.0000000000,,False
JuanthomssTrumT,OOPS! Woman Obama Granted Clemency Sent Back to Prison https://t.co/Uq6o6nLYXz,Unknown,English,2017-06-13T11:13:00,2017-06-13T11:13:00,1571.0000000000,534.0000000000,682.0000000000,,False
JuanthomssTrumT,"Bijan Kian, Donald Trump transition aide, was key player in Michael Flynn's Turkish work https://t.co/xq17wWUIIV https://t.co/ave8K9pKsQ",Unknown,English,2017-06-13T11:13:00,2017-06-13T11:13:00,1571.0000000000,534.0000000000,680.0000000000,,False
JuanthomssTrumT,AMEX Pulls Sponsorship of Trump “ASSASSINATION” Play After BACKLASH https://t.co/8tYHZowlkV https://t.co/xCmkFyzMYz,Unknown,English,2017-06-13T11:13:00,2017-06-13T11:13:00,1571.0000000000,534.0000000000,681.0000000000,,False
JuanthomssTrumT,“JUST JOKING” Cowardly McCain Walks Back Praise of Obama After Backlash https://t.co/BcB2nqYJOh https://t.co/RlbteYg5Ws,Unknown,English,2017-06-13T11:43:00,2017-06-13T11:43:00,1571.0000000000,534.0000000000,685.0000000000,,False
JuanthomssTrumT,VIDEO : Hannity “Mueller Investigation is Turning Into a Witch Hunt” https://t.co/L5WIGXmWEr https://t.co/0ltKhSAEeJ,Unknown,English,2017-06-13T11:43:00,2017-06-13T11:43:00,1571.0000000000,534.0000000000,684.0000000000,,False
JuanthomssTrumT,TRAVEL BAN : Texas AG Warns Libs “Blood on Your Hands if Texans Harmed” https://t.co/YdvSUigJvb https://t.co/eHq4iqZBN8,Unknown,English,2017-06-13T11:43:00,2017-06-13T11:43:00,1571.0000000000,534.0000000000,683.0000000000,,False
JuanthomssTrumT,VIDEO : Krauthammer SLAMS Russia Conspiracist Dan Rather as “DERANGED”  https://t.co/EdW22Rm9B2 https://t.co/ZNmJ4K8Z8K,Unknown,English,2017-06-13T12:03:00,2017-06-13T12:03:00,1571.0000000000,536.0000000000,687.0000000000,,False
JuanthomssTrumT,Megyn Kelly Causes NBC to Lose Their Sponors https://t.co/VMr6JGoxKj https://t.co/7yAR88TjqG,Unknown,English,2017-06-13T12:03:00,2017-06-13T12:03:00,1571.0000000000,536.0000000000,686.0000000000,,False
JuanthomssTrumT,Muell Appoints Clinton Foundation Lawyer for Russia Probe https://t.co/yY9Ba9jnZn https://t.co/C1GlnugA4r,Unknown,English,2017-06-13T12:18:00,2017-06-13T12:18:00,1571.0000000000,536.0000000000,689.0000000000,,False
JuanthomssTrumT,"Donald Trump's tweets slam the media, 9th Circuit Court of Appeals https://t.co/O18IMKQpe0 https://t.co/eTcER3UNDq",Unknown,English,2017-06-13T12:18:00,2017-06-13T12:18:00,1571.0000000000,536.0000000000,688.0000000000,,False
JuanthomssTrumT,Look Who’s Tied to the Attorney General Suing Trump https://t.co/nQdol6sKbO https://t.co/bwjMQdFGqk,Unknown,English,2017-06-13T12:28:00,2017-06-13T12:28:00,1571.0000000000,536.0000000000,691.0000000000,,False
JuanthomssTrumT,JUSTICE : Teacher SUSPENDED for Editing Student’s “Pro-Trump” Yearbook Pics https://t.co/xR0q6s3Vds https://t.co/Gw12yZuSS8,Unknown,English,2017-06-13T12:28:00,2017-06-13T12:28:00,1571.0000000000,536.0000000000,690.0000000000,,False
JuanthomssTrumT,Katy Perry apologizes for ‘appropriating’ black culture and denying feminism https://t.co/27LJpwfSYj https://t.co/Or2jBAAPEL,Unknown,English,2017-06-13T12:38:00,2017-06-13T12:38:00,1571.0000000000,537.0000000000,692.0000000000,,False
JuanthomssTrumT,FLASHBACK : Liberal Media Praised Theatrical Assassination of President Bush https://t.co/DXfTsb0FrW https://t.co/IuSttknbDw,Unknown,English,2017-06-13T12:48:00,2017-06-13T12:48:00,1571.0000000000,537.0000000000,693.0000000000,,False
JuanthomssTrumT,Muslim Refugees Either Assimilate in Austria or GET BOOTED OUT https://t.co/GlsDgz7Z5Q https://t.co/SKUELVRUPM,Unknown,English,2017-06-13T12:58:00,2017-06-13T12:58:00,1571.0000000000,537.0000000000,694.0000000000,,False
JuanthomssTrumT,"Major advertiser ‘repulsed’ by Megyn Kelly controversy, pulls ads from NBC https://t.co/t46RWHGhEd https://t.co/hufp22ptNi",Unknown,English,2017-06-13T13:08:00,2017-06-13T13:08:00,1571.0000000000,537.0000000000,695.0000000000,,False
JuanthomssTrumT,Jeff Sessions expected to counter James Comey's claims on Trump conversation https://t.co/meWcVFi9fW,Unknown,English,2017-06-13T13:08:00,2017-06-13T13:08:00,1571.0000000000,537.0000000000,699.0000000000,,False
JuanthomssTrumT,Luther Strange expresses confidence in Jeff Sessions ahead of testimony https://t.co/SrJMtUY5wj https://t.co/Gr0kyEANJN,Unknown,English,2017-06-13T13:08:00,2017-06-13T13:08:00,1571.0000000000,537.0000000000,697.0000000000,,False
JuanthomssTrumT,"Ronna Romney McDaniel, RNC chairwoman, calls for an end to the Trump, Russia collusion cases … https://t.co/dQbctoyy7W",Unknown,English,2017-06-13T13:08:00,2017-06-13T13:08:00,1571.0000000000,537.0000000000,700.0000000000,,False
JuanthomssTrumT,"Chris Ruddy, Trump ally, says president is considering firing Robert Mueller https://t.co/oJxlSWELu4 https://t.co/i55hLEgYPl",Unknown,English,2017-06-13T13:08:00,2017-06-13T13:08:00,1571.0000000000,537.0000000000,698.0000000000,,False
JuanthomssTrumT,There’s A VERY Special Birthday Tomorrow… https://t.co/wI3axB83xa https://t.co/yBj1xplk4s,Unknown,English,2017-06-13T13:08:00,2017-06-13T13:08:00,1571.0000000000,537.0000000000,702.0000000000,,False
JuanthomssTrumT,Why did the bear cross the road?To scare runners in a Colorado... https://t.co/tgCejdGs86 https://t.co/7NCPsaa2wg,Unknown,English,2017-06-13T13:08:00,2017-06-13T13:08:00,1571.0000000000,537.0000000000,701.0000000000,,False
JuanthomssTrumT,Scott Walker: Trump's trip to Wisconsin to focus on filling the skills gap in manufacturing jobs… https://t.co/8gFJNfgp3b,Unknown,English,2017-06-13T13:08:00,2017-06-13T13:08:00,1571.0000000000,537.0000000000,696.0000000000,,False
JuanthomssTrumT,Cruel Liberals VICIOUSLY Attack Barron Trump Again and You Won’t Believe Why….. https://t.co/XCLpWDGk5R https://t.co/T5tFwsNwlO,Unknown,English,2017-06-13T13:23:00,2017-06-13T13:23:00,1571.0000000000,537.0000000000,704.0000000000,,False
JuanthomssTrumT,Krauthammer slams Dan Rather for his ‘deranged’ analogy attacking Trump https://t.co/K5G12tzcHL https://t.co/tjWfPmCX7f,Unknown,English,2017-06-13T13:23:00,2017-06-13T13:23:00,1571.0000000000,537.0000000000,703.0000000000,,False
JuanthomssTrumT,Special Counsel Mueller Chooses Team That Includes Four Clinton Donors! https://t.co/C0BGA8OHGU https://t.co/SmCzyXNi0w,Unknown,English,2017-06-13T13:38:00,2017-06-13T13:38:00,1571.0000000000,537.0000000000,705.0000000000,,False
JuanthomssTrumT,"Napolitano On Sessions Testimony: Dangerous Position, He Should Not Testify https://t.co/vVsIg2uKkM https://t.co/JPSvcMDB5B",Unknown,English,2017-06-13T13:54:00,2017-06-13T13:54:00,1571.0000000000,536.0000000000,706.0000000000,,False
JuanthomssTrumT,Chris Ruddy denies he spoke with Trump about Robert Mueller https://t.co/IIgxuO29gX https://t.co/VyfcusV0gi,Unknown,English,2017-06-13T14:08:00,2017-06-13T14:09:00,1571.0000000000,538.0000000000,709.0000000000,,False
JuanthomssTrumT,"Donald Trump to welcome Moon Jae-in, South Korea's president, at the White House https://t.co/xtmOWpKLgd https://t.co/G1CIU5A1rN",Unknown,English,2017-06-13T14:08:00,2017-06-13T14:09:00,1571.0000000000,538.0000000000,710.0000000000,,False
JuanthomssTrumT,Donald Trump accuses Loretta Lynch of making illegal decisions while attorney general https://t.co/nuNrdTM7NQ https://t.co/h3RZBO92QY,Unknown,English,2017-06-13T14:08:00,2017-06-13T14:09:00,1571.0000000000,538.0000000000,711.0000000000,,False
JuanthomssTrumT,Ex-Texas judge pleads guilty in probe linked to senator https://t.co/xfPkTzm46J,Unknown,English,2017-06-13T14:08:00,2017-06-13T14:09:00,1571.0000000000,538.0000000000,712.0000000000,,False
JuanthomssTrumT,San Francisco marks 50th anniversary of famed Summer of Love https://t.co/ac9YP56qrg https://t.co/Lo6ZLFgskh,Unknown,English,2017-06-13T14:08:00,2017-06-13T14:08:00,1571.0000000000,538.0000000000,708.0000000000,,False
JuanthomssTrumT,Sandy Hook group dumps Megyn Kelly as event host https://t.co/BUPGYsHgNW,Unknown,English,2017-06-13T14:08:00,2017-06-13T14:09:00,1571.0000000000,538.0000000000,713.0000000000,,False
JuanthomssTrumT,Trump Is About To DESTROY Elizabeth Warren’s Legacy In One Move https://t.co/Uv7odWLkla https://t.co/HulSLQzJhd,Unknown,English,2017-06-13T14:08:00,2017-06-13T14:09:00,1571.0000000000,538.0000000000,715.0000000000,,False
JuanthomssTrumT,Kevin McCarthy says Dems using 'stall tactics' to prevent Donald Trump's success https://t.co/olhcoYUQf4 https://t.co/WkodJ53Oxm,Unknown,English,2017-06-13T14:08:00,2017-06-13T14:08:00,1571.0000000000,538.0000000000,714.0000000000,,False
JuanthomssTrumT,BREAKING: Rex Tillerson Gets American Citizen FREED From North Korea’s Wrath… https://t.co/noDke15IHI https://t.co/EZy2w7HuDR,Unknown,English,2017-06-13T14:08:00,2017-06-13T14:09:00,1571.0000000000,538.0000000000,707.0000000000,,False
JuanthomssTrumT,Trump logos censored in students’ yearbook photos — and faculty adviser is suspended https://t.co/vaRsiKnFDz https://t.co/cbmNZ2SEjy,Unknown,English,2017-06-13T14:28:00,2017-06-13T14:28:00,1571.0000000000,537.0000000000,716.0000000000,,False
JuanthomssTrumT,Midtown Atlanta Gets New Permanent LGBT Crosswalk https://t.co/vahWcZqXnf https://t.co/mdVQuTic4X,Unknown,English,2017-06-13T14:43:00,2017-06-13T14:43:00,1571.0000000000,537.0000000000,717.0000000000,,False
JuanthomssTrumT,Texas pastor issues an ultimatum to Sanders for saying Trump nominee’s faith was disqualifying… https://t.co/eO4LGWkmMr,Unknown,English,2017-06-13T14:48:00,2017-06-13T14:48:00,1571.0000000000,537.0000000000,719.0000000000,,False
JuanthomssTrumT,Gen Mattis SLAMS Congress: ‘Shocked’ by Poor State of Military’s Readiness https://t.co/Wq2O67KT3K https://t.co/jPqAX1CRcb,Unknown,English,2017-06-13T14:48:00,2017-06-13T14:48:00,1571.0000000000,537.0000000000,718.0000000000,,False
JuanthomssTrumT,12-year-old girl saves friend with first aid she learned from ‘The Hunger Games’ https://t.co/Y9K9fhg6pa https://t.co/TjInCyDTq6,Unknown,English,2017-06-13T14:59:00,2017-06-13T14:59:00,1571.0000000000,538.0000000000,720.0000000000,,False
JuanthomssTrumT,Activist prepared to take pipeline protest case to trial https://t.co/68GlzlvylU,Unknown,English,2017-06-13T15:04:00,2017-06-13T15:04:00,1571.0000000000,538.0000000000,724.0000000000,,False
JuanthomssTrumT,"Paul Ryan says investigations are important, but House needs to focus on agenda https://t.co/HRMl5phHbp https://t.co/jmtHyYB7R0",Unknown,English,2017-06-13T15:04:00,2017-06-13T15:04:00,1571.0000000000,538.0000000000,722.0000000000,,False
JuanthomssTrumT,"Mike Pence says Obamacare is in 'death spiral,' cites insurer exits https://t.co/P58QxwZN3j https://t.co/1qdACg9rXp",Unknown,English,2017-06-13T15:04:00,2017-06-13T15:04:00,1571.0000000000,538.0000000000,723.0000000000,,False
JuanthomssTrumT,Jon Ossoff slammed in CLF ad for missing debate with Karen Handel https://t.co/oy8fJMwj1V https://t.co/Hji9Z9l3mv,Unknown,English,2017-06-13T15:04:00,2017-06-13T15:04:00,1571.0000000000,538.0000000000,721.0000000000,,False
JuanthomssTrumT,American student released by North Korea https://t.co/dzQ7Mw4LiJ https://t.co/xuBTB8myVb,Unknown,English,2017-06-13T15:58:00,2017-06-13T15:58:00,1571.0000000000,538.0000000000,731.0000000000,,False
JuanthomssTrumT,Europe's new finance rules put UK jobs at risk https://t.co/FCTQGc6uEP https://t.co/X4aaj6iHf6,Unknown,English,2017-06-13T15:58:00,2017-06-13T15:58:00,1571.0000000000,538.0000000000,733.0000000000,,False
JuanthomssTrumT,Syrian artist depicts Trump and other leaders as refugees https://t.co/HuPlCos8HW https://t.co/cP4ni2QCbx,Unknown,English,2017-06-13T15:58:00,2017-06-13T15:58:00,1571.0000000000,538.0000000000,727.0000000000,,False
JuanthomssTrumT,Dennis Rodman hopes to do 'something pretty positive' in North Korea https://t.co/ABtQujA4iw https://t.co/bdZK4x61pe,Unknown,English,2017-06-13T15:58:00,2017-06-13T15:58:00,1571.0000000000,538.0000000000,734.0000000000,,False
JuanthomssTrumT,'Satellite catcher' will use magnets to clean up space junk https://t.co/sa07hYn0tS https://t.co/fNXjPwkoyn,Unknown,English,2017-06-13T15:58:00,2017-06-13T15:58:00,1571.0000000000,538.0000000000,728.0000000000,,False
JuanthomssTrumT,Why 'A Nasty Boy' magazine is causing a stir in Nigeria https://t.co/IhvE4MKiFe https://t.co/e4zca4mwfb,Unknown,English,2017-06-13T15:58:00,2017-06-13T15:58:00,1571.0000000000,538.0000000000,732.0000000000,,False
JuanthomssTrumT,"It's not a great time to visit, President Trump https://t.co/BOjkMcX7ZF https://t.co/2gMYlo9vdj",Unknown,English,2017-06-13T15:58:00,2017-06-13T15:58:00,1571.0000000000,538.0000000000,725.0000000000,,False
JuanthomssTrumT,Rodman's back in North Korea with another offbeat sponsor https://t.co/WUyJwGdmrw https://t.co/gHXSfs0dN6,Unknown,English,2017-06-13T15:58:00,2017-06-13T15:58:00,1571.0000000000,538.0000000000,726.0000000000,,False
JuanthomssTrumT,"Yemen cholera outbreak grows, with children bearing brunt https://t.co/Zm89mUEtbi https://t.co/0jdQh8SjTA",Unknown,English,2017-06-13T15:58:00,2017-06-13T15:58:00,1571.0000000000,538.0000000000,730.0000000000,,False
JuanthomssTrumT,Why does North Korea detain some US citizens? https://t.co/jyIcF9feo8 https://t.co/e0KDqKK4HW,Unknown,English,2017-06-13T15:58:00,2017-06-13T15:58:00,1571.0000000000,538.0000000000,729.0000000000,,False
JuanthomssTrumT,"Marc Kasowitz, Trump lawyer, bragged about getting Preet Bharara fired as U.S. attorney: Report… https://t.co/kA4kG8c9tm",Unknown,English,2017-06-13T16:04:00,2017-06-13T16:04:00,1571.0000000000,538.0000000000,735.0000000000,,False
JuanthomssTrumT,Rex Tillerson says 'private sector' will compensate for massive State Dept. cuts https://t.co/ECmQKr363N https://t.co/t5TD5hne6u,Unknown,English,2017-06-13T16:04:00,2017-06-13T16:04:00,1571.0000000000,538.0000000000,737.0000000000,,False
JuanthomssTrumT,7 won't graduate US Merchant Marine Academy amid team probe https://t.co/lI8gvMNbDF,Unknown,English,2017-06-13T16:04:00,2017-06-13T16:04:00,1571.0000000000,538.0000000000,736.0000000000,,False
JuanthomssTrumT,Rod Rosenstein: 'No secret plan' to fire Robert Mueller https://t.co/uKhbaB2Eg1 https://t.co/7FgjJX1dOt,Unknown,English,2017-06-13T16:08:00,2017-06-13T16:09:00,1571.0000000000,538.0000000000,738.0000000000,,False
JuanthomssTrumT,Trey Gowdy Just Announced Undisputable Evidence Found During The Clinton Compound Raid https://t.co/4il1t5bUJc https://t.co/4n0H7ODf08,Unknown,English,2017-06-13T16:18:00,2017-06-13T16:18:00,1571.0000000000,541.0000000000,739.0000000000,,False
JuanthomssTrumT,"Marvel’s Hulk, Mark Ruffalo Promotes Petition Against White Conservatives; Twitter Reacts! https://t.co/Qq1QaWleoZ https://t.co/vfjaudVeeL",Unknown,English,2017-06-13T16:23:00,2017-06-13T16:23:00,1571.0000000000,542.0000000000,740.0000000000,,False
JuanthomssTrumT,BREAKING : North Korea Releases American Student Serving 15-Year Sentence https://t.co/W7WcPyso7s https://t.co/RwWgRe7y44,Unknown,English,2017-06-13T16:28:00,2017-06-13T16:28:00,1571.0000000000,543.0000000000,742.0000000000,,False
JuanthomssTrumT,Report: Three women ‘chanting the Koran’ and shouting ‘Allah’ attack London nursery school teacher… https://t.co/wSDyw0ynyL,Unknown,English,2017-06-13T16:28:00,2017-06-13T16:28:00,1571.0000000000,543.0000000000,741.0000000000,,False
JuanthomssTrumT,Judicial Watch Sues Ed. Dept Over Obama’s Failed “School Improvement” Program https://t.co/5nheGr1HAt https://t.co/BycCKfy81l,Unknown,English,2017-06-13T16:43:00,2017-06-13T16:43:00,1571.0000000000,544.0000000000,743.0000000000,,False
JuanthomssTrumT,"Hypocrite Schumer Supported Saudi Arms Deal Under Obama, But Not Trump https://t.co/RqR2b3mKCp https://t.co/xmmPE5k644",Unknown,English,2017-06-13T16:43:00,2017-06-13T16:43:00,1571.0000000000,544.0000000000,744.0000000000,,False
JuanthomssTrumT,REPORT : Turns Out Obama Had His Own Back Channel to Moscow https://t.co/uvAfMorjZL https://t.co/x5mV9a4dhG,Unknown,English,2017-06-13T16:48:00,2017-06-13T16:48:00,1571.0000000000,544.0000000000,745.0000000000,,False
JuanthomssTrumT,"Labor activists, Memphis agree to settle civil rights suit https://t.co/jdpRIP8rFf",Unknown,English,2017-06-13T17:03:00,2017-06-13T17:04:00,1572.0000000000,543.0000000000,747.0000000000,,False
JuanthomssTrumT,"Donald Trump pushes Obamacare replacement, blasts 'obstructionist Democrats' https://t.co/JJyI3NH8zn https://t.co/9l2tg7Yqte",Unknown,English,2017-06-13T17:03:00,2017-06-13T17:03:00,1572.0000000000,543.0000000000,749.0000000000,,False
JuanthomssTrumT,Recent editorials from Texas newspapers https://t.co/vyM4FGXIh5,Unknown,English,2017-06-13T17:03:00,2017-06-13T17:03:00,1572.0000000000,543.0000000000,748.0000000000,,False
JuanthomssTrumT,"8-year-old drag queen ‘Lactatia’ says if your parents don’t let you do drag, ‘you need new parents’… https://t.co/E6ABcOr5Jy",Unknown,English,2017-06-13T17:03:00,2017-06-13T17:03:00,1572.0000000000,543.0000000000,746.0000000000,,False
JuanthomssTrumT,Megyn Kelly removed as host of Sandy Hook memorial event over Alex Jones interview https://t.co/DJtJmZ0WLH https://t.co/Nv6seyN7bJ,Unknown,English,2017-06-13T17:08:00,2017-06-13T17:08:00,1572.0000000000,543.0000000000,750.0000000000,,False
JuanthomssTrumT,Liberal ‘Avengers’ star Mark Ruffalo slams NBC for hiring too many ‘white conservatives’ https://t.co/OfZxwEAvox https://t.co/MzHNSVo4Qf,Unknown,English,2017-06-13T17:38:00,2017-06-13T17:38:00,1572.0000000000,544.0000000000,751.0000000000,,False
JuanthomssTrumT,FARC's elusive finances undercut support for Colombia peace https://t.co/vwuKeGpfiN https://t.co/d69DmDDRLu,Unknown,English,2017-06-13T18:08:00,2017-06-13T18:08:00,1572.0000000000,545.0000000000,757.0000000000,,False
JuanthomssTrumT,"American student Otto Warmbier released from North Korea, reportedly in a coma https://t.co/qtl0Mx26EI https://t.co/kESS5ilvWW",Unknown,English,2017-06-13T18:08:00,2017-06-13T18:08:00,1572.0000000000,545.0000000000,752.0000000000,,False
JuanthomssTrumT,"Jeff Sessions testifies to Senate intel panel about Donald Trump, James Comey https://t.co/S4EZSjWnEp",Unknown,English,2017-06-13T18:08:00,2017-06-13T18:08:00,1572.0000000000,545.0000000000,753.0000000000,,False
JuanthomssTrumT,Broadband bill gains support in Legislature https://t.co/t0bbyKXVp4,Unknown,English,2017-06-13T18:08:00,2017-06-13T18:08:00,1572.0000000000,545.0000000000,756.0000000000,,False
JuanthomssTrumT,"Mike Moon, GOP lawmaker, beheads chicken in anti-abortion video https://t.co/WkU4SrVnip https://t.co/i7cqYbLpqt",Unknown,English,2017-06-13T18:08:00,2017-06-13T18:08:00,1572.0000000000,545.0000000000,755.0000000000,,False
JuanthomssTrumT,The Latest: Trump says new health care law will be 'kind' https://t.co/gQVmIFflgc https://t.co/MinQ5OJ23Y,Unknown,English,2017-06-13T18:08:00,2017-06-13T18:09:00,1572.0000000000,545.0000000000,754.0000000000,,False
JuanthomssTrumT,CNN Cuts Their Feed (AGAIN) to PROTECT Fake Russia Narrative https://t.co/r4p3qS319J https://t.co/QXf6FOIxQL,Unknown,English,2017-06-13T18:28:00,2017-06-13T18:28:00,1571.0000000000,547.0000000000,758.0000000000,,False
JuanthomssTrumT,Twelve employees of Democrat-linked organization charged with fraudulent voter registration … https://t.co/L0fmByoncB,Unknown,English,2017-06-13T18:33:00,2017-06-13T18:33:00,1571.0000000000,546.0000000000,759.0000000000,,False
JuanthomssTrumT,Report: GOP senators considering giving in to Dems on Planned Parenthood funding in Obamacare fight… https://t.co/lO15WKcdP2,Unknown,English,2017-06-13T18:38:00,2017-06-13T18:38:00,1571.0000000000,546.0000000000,760.0000000000,,False
JuanthomssTrumT,Christian Leaders FIGHT BACK Against Bernie’s Persecution https://t.co/sZKiWPUOcb https://t.co/LE7bz3gcGD,Unknown,English,2017-06-13T18:43:00,2017-06-13T18:43:00,1571.0000000000,546.0000000000,761.0000000000,,False
JuanthomssTrumT,"Watch: Tucker Carlson takes liberal to woodshed for her wild, unsubstantiated claims about Sessions… https://t.co/ZOk6tMBmGr",Unknown,English,2017-06-13T18:58:00,2017-06-13T18:58:00,1571.0000000000,546.0000000000,762.0000000000,,False
JuanthomssTrumT,James Comey-leaked memos now in possession of FBI: Report https://t.co/Vm6aHnLJCp https://t.co/qznsthkZ5Q,Unknown,English,2017-06-13T19:08:00,2017-06-13T19:08:00,1571.0000000000,545.0000000000,764.0000000000,,False
JuanthomssTrumT,Governor confident immigrant sentencing law constitutional https://t.co/2ijnzkVQnZ,Unknown,English,2017-06-13T19:08:00,2017-06-13T19:08:00,1571.0000000000,545.0000000000,765.0000000000,,False
JuanthomssTrumT,Calls for independent Russia probe grow amid latest round of rumors https://t.co/JdGurdqhII https://t.co/lFORWicS4v,Unknown,English,2017-06-13T19:08:00,2017-06-13T19:08:00,1571.0000000000,545.0000000000,763.0000000000,,False
JuanthomssTrumT,"GOP Lawmaker : Drop Special Counsel, Focus on Obama DOJ https://t.co/4k8T5AYGCG https://t.co/hDD56r0qV8",Unknown,English,2017-06-13T19:18:00,2017-06-13T19:18:00,1571.0000000000,545.0000000000,767.0000000000,,False
JuanthomssTrumT,RETREAT! Dem Leaders Abandon “IMPEACHMENT” Dreams https://t.co/QUGBiKs30U https://t.co/anZkjrasV5,Unknown,English,2017-06-13T19:23:00,2017-06-13T19:23:00,1571.0000000000,545.0000000000,768.0000000000,,False
JuanthomssTrumT,Obama’s Legacy Circles the Drain as 1.9 MILLION Americans Cancel Obamacare https://t.co/U6dBQROnc2 https://t.co/dkj8IhGjPj,Unknown,English,2017-06-13T19:23:00,2017-06-13T19:23:00,1571.0000000000,545.0000000000,770.0000000000,,False
JuanthomssTrumT,Libs Lose their SH*T When ICE Arrests Illegal on his way to Prom https://t.co/wQJtKRamkB https://t.co/zlGj6qnIu4,Unknown,English,2017-06-13T19:23:00,2017-06-13T19:23:00,1571.0000000000,545.0000000000,769.0000000000,,False
JuanthomssTrumT,British academic says using these words to describe female students is sexist https://t.co/VNYPFN3NWB https://t.co/zhSaZ8Owdw,Unknown,English,2017-06-13T19:28:00,2017-06-13T19:28:00,1571.0000000000,546.0000000000,771.0000000000,,False
JuanthomssTrumT,Chuck Schumer is working to block Trump’s Saudi arms deal — but supported similar deal under Obama… https://t.co/tJkboGWCGa,Unknown,English,2017-06-13T19:38:00,2017-06-13T19:38:00,1571.0000000000,546.0000000000,772.0000000000,,False
JuanthomssTrumT,Don Jr. Melts Snowflakes With 2 Simple Words After Sessions’ BLISTERING Opening… https://t.co/LQzFlibYmb https://t.co/yzlXqY4VRw,Unknown,English,2017-06-13T20:03:00,2017-06-13T20:03:00,1571.0000000000,547.0000000000,773.0000000000,,False
JuanthomssTrumT,New campaign disclosure rules proposed for New Mexico https://t.co/qQqSiwtV49,Unknown,English,2017-06-13T20:08:00,2017-06-13T20:08:00,1571.0000000000,547.0000000000,778.0000000000,,False
JuanthomssTrumT,Minnesota GOP leaders sue Dayton for cutting their funding https://t.co/8BwWxTLpV9,Unknown,English,2017-06-13T20:08:00,2017-06-13T20:08:00,1571.0000000000,547.0000000000,775.0000000000,,False
JuanthomssTrumT,Jeff Sessions blasts talk of Russian collusion: 'Appalling and detestable lie' https://t.co/aaQSccmHUQ https://t.co/zdM48RODV9,Unknown,English,2017-06-13T20:08:00,2017-06-13T20:08:00,1571.0000000000,547.0000000000,777.0000000000,,False
