author_id,content,region,language,publish_date,harvested_date,following,followers,updates,post_type,retweet
edenisyy,"Самый необычный подарок на премьере фильма! Оказалось, зрителям.....   http://t.co/5aabJfSNBG",Unknown,Russian,2015-09-10T10:23:00,2015-09-10T10:23:00,1222.0000000000,248.0000000000,592.0000000000,R,True
edenisyy,"Вы хоть понимаете,что натворили??? #5причинбомбитьигил https://t.co/nTZBlQ0xOj",Unknown,Russian,2015-10-21T16:18:00,2015-10-21T16:18:00,168.0000000000,247.0000000000,606.0000000000,R,True
edenisyy,50 оттенков ИГИЛа   https://t.co/tPu52lr5yx,Unknown,Macedonian,2015-10-27T13:43:00,2015-10-27T13:44:00,168.0000000000,247.0000000000,607.0000000000,,False
edenisyy,Немцы тогда получили хороший урок #ЛедовоеПобоище https://t.co/tbOriNxhlY,Unknown,Russian,2016-04-18T16:06:00,2016-04-18T16:07:00,164.0000000000,233.0000000000,633.0000000000,R,True
edenisyy,Девушка спела с уличным ансамблем песню про Путина и покорила интернет  https://t.co/vEz1fVl3fA https://t.co/Tnd0wBebrw,Unknown,Russian,2016-04-19T11:25:00,2016-04-19T11:25:00,164.0000000000,232.0000000000,639.0000000000,R,True
edenisyy,Шаурмы в Москве больше не будет #REMOVEKEBAB https://t.co/MlLgthRMVn,Unknown,Russian,2016-04-26T15:20:00,2016-04-26T15:20:00,164.0000000000,231.0000000000,643.0000000000,R,True
edenisyy,Матвиенко предлагает разработать стандарт качества жизни для россиян #МойСтандартКачества https://t.co/v1WEM3r5ya,Unknown,Russian,2016-04-29T16:18:00,2016-04-29T16:19:00,164.0000000000,231.0000000000,650.0000000000,R,True
edenisyy,#МойСтандартКачества Валентина Матвиенко предложила разработать стандарт качества жизни россиян. https://t.co/O2Udaz32Co,Unknown,Russian,2016-04-29T16:34:00,2016-04-29T16:34:00,164.0000000000,231.0000000000,652.0000000000,R,True
edenisyy,"Пока США остаются в Ираке, Россия остается в Сирии  https://t.co/uWQcyRVdma",Unknown,Russian,2016-05-10T13:41:00,2016-05-10T13:42:00,165.0000000000,231.0000000000,658.0000000000,R,True
edenisyy,https://t.co/stHHCCrBKO Вот где ИГ прячет свой банк хахаха https://t.co/WfLEqz313V,Unknown,Russian,2016-05-16T21:05:00,2016-05-16T21:05:00,165.0000000000,231.0000000000,662.0000000000,,False
edenisyy,"В Сирии героически погиб российский сержант, остановивший террориста-смертника   https://t.co/EwEex6vSoA https://t.co/8070U072hO",Unknown,Russian,2016-06-19T14:51:00,2016-06-19T14:54:00,165.0000000000,233.0000000000,665.0000000000,R,True
edenisyy,Сегодня день рождения у Сергея Собянина. Спасибо за огромный вклад в развитие Москвы!   #ЛучшийМэр #ПоздравьСобянина https://t.co/ObeMZf8QmA,Unknown,Russian,2016-06-21T10:28:00,2016-06-21T10:28:00,165.0000000000,233.0000000000,667.0000000000,R,True
edenisyy,"#22июня 1941 года.  Левитан: ""Германские войска атаковали границы СССР. Началась Великая Отечественная война"" https://t.co/hYuXMQGzwj",Unknown,Russian,2016-06-22T07:18:00,2016-06-22T07:18:00,165.0000000000,233.0000000000,672.0000000000,R,True
edenisyy,"Герой Украины Савченко в интервью Голосу Америки и немцам сказала, что нельзя Украине давать оружие https://t.co/Zsa29j7cja",Unknown,Russian,2016-06-22T11:49:00,2016-06-22T11:49:00,165.0000000000,233.0000000000,674.0000000000,R,True
edenisyy,Построение 322-й стрелковой дивизии на Советской площади перед отправкой на фронт. 1941 год https://t.co/gFc5HSVNsF,Unknown,Russian,2016-06-22T17:58:00,2016-06-22T17:58:00,165.0000000000,233.0000000000,680.0000000000,R,True
edenisyy,А еще Россия мешает Порошенко исполнять супружеский долг и бросить пить https://t.co/PtVrCRBHJ1,Unknown,Russian,2016-06-23T11:36:00,2016-06-23T11:36:00,165.0000000000,233.0000000000,683.0000000000,R,True
edenisyy,Лада Веста сегодня победила на этапе Чемпионата мира по ралли! https://t.co/hJYW1T3PqL,Unknown,Russian,2016-06-26T14:29:00,2016-06-26T14:29:00,166.0000000000,233.0000000000,692.0000000000,R,True
edenisyy,Новости российской экономики  https://t.co/MIXao8QIz6,Unknown,Russian,2016-07-05T13:18:00,2016-07-05T13:18:00,166.0000000000,233.0000000000,699.0000000000,R,True
edenisyy,Freedom House: Эстония победила в рейтинге посткоммунистических демократий  https://t.co/aqjtY8GNXI https://t.co/sacEGjMAFg,Unknown,Russian,2016-08-10T13:59:00,2016-08-10T13:59:00,164.0000000000,234.0000000000,718.0000000000,R,True
edenisyy,«Матч ТВ» потребовал через суд и Роскомнадзор блокировки Sports.ru – якобы за «пиратский контент» - Футбол ...,Unknown,Russian,2017-04-19T10:12:00,2017-04-19T10:12:00,161.0000000000,219.0000000000,734.0000000000,,False
edenisyy,МВФ улучшил оценку экономики России за 2016 год,Unknown,Russian,2017-04-19T11:02:00,2017-04-19T11:03:00,161.0000000000,219.0000000000,735.0000000000,,False
