author_id,content,region,language,publish_date,harvested_date,following,followers,updates,post_type,retweet
Shilovasanctimi,Google запустил нативную рекламу в Gmail,Unknown,Russian,2015-09-04T09:44:00,2015-09-04T09:44:00,309.0000000000,347.0000000000,9204.0000000000,,False
Shilovasanctimi,"'@marina_al_22889 Ого, я на этот блог плюнул еще месяца 3 назад, даж не думал что тут кто то комментит:) Собственно из предложенного и'",Unknown,Russian,2015-09-04T10:08:00,2015-09-04T10:08:00,309.0000000000,347.0000000000,9206.0000000000,,False
Shilovasanctimi,Самые популярные приложения в App Store,Unknown,Russian,2015-09-05T03:15:00,2015-09-05T03:15:00,311.0000000000,349.0000000000,9221.0000000000,,False
Shilovasanctimi,"'@Sarkisyanfoltif Ранняя осень - время перемен. Надеюсь, оно не оставит в стороне этот блог.'",Unknown,Ukrainian,2015-09-06T04:46:00,2015-09-06T04:46:00,316.0000000000,356.0000000000,9246.0000000000,,False
Shilovasanctimi,"Комментарий Александра Сизинцева, генерального директора Biletix.ru, относительно сделки между авиакомпаниями «Аэфрофлот» и «Трансаэро»",Unknown,Russian,2015-09-06T06:39:00,2015-09-06T06:39:00,318.0000000000,356.0000000000,9250.0000000000,,False
Shilovasanctimi,'@marina_al_22889 Поздравляю админа и читателей С Рождеством!',Unknown,Russian,2015-09-06T09:54:00,2015-09-06T09:54:00,318.0000000000,356.0000000000,9254.0000000000,,False
Shilovasanctimi,Это Discount bar на Ленинском мне ооочень понравился,Unknown,Russian,2015-09-06T12:48:00,2015-09-06T12:48:00,318.0000000000,356.0000000000,9257.0000000000,,False
Shilovasanctimi,Кейт Мосс устроила дебош на борту лоукостера easyJet из-за бутерброда,Unknown,Ukrainian,2015-09-06T20:33:00,2015-09-06T20:33:00,317.0000000000,357.0000000000,9263.0000000000,,False
Shilovasanctimi,"'@marina_al_22889 Кстати один и тот же, да.'",Unknown,Ukrainian,2015-09-08T05:59:00,2015-09-08T05:59:00,313.0000000000,359.0000000000,9291.0000000000,,False
Shilovasanctimi,"'@marina_al_22889 На нашем сайте Вы сможете получить Ваш астрологический гороскоп как на определенный день, так и на неделю вперед. Мы'",Unknown,Russian,2015-09-08T06:02:00,2015-09-08T06:02:00,313.0000000000,359.0000000000,9292.0000000000,,False
Shilovasanctimi,'@Ivanovlialoturm 2. Как вы успеваете все делать?',Unknown,Russian,2015-09-08T10:03:00,2015-09-08T10:03:00,313.0000000000,359.0000000000,9293.0000000000,,False
Shilovasanctimi,"'@katja_le_092217 Работай с умом, а не до ночи'",Unknown,Ukrainian,2015-09-08T13:13:00,2015-09-08T13:16:00,314.0000000000,359.0000000000,9297.0000000000,,False
Shilovasanctimi,"'@marina_al_22889 Это уже далеко не новость, я об этом пару месяцев назад читал.'",Unknown,Russian,2015-09-08T23:44:00,2015-09-08T23:44:00,313.0000000000,361.0000000000,9310.0000000000,,False
Shilovasanctimi,В Кремле отказались доверять интернет-сообщениям о Кашине,Unknown,Russian,2015-09-09T09:12:00,2015-09-09T09:12:00,315.0000000000,361.0000000000,9317.0000000000,,False
Shilovasanctimi,flydubai начинает распродажу,Unknown,Russian,2015-09-10T07:56:00,2015-09-10T07:56:00,315.0000000000,362.0000000000,9334.0000000000,,False
Shilovasanctimi,Apple презентовала новые гаджеты: iPad Pro и розовый iPhone,Unknown,Russian,2015-09-10T10:06:00,2015-09-10T10:06:00,315.0000000000,362.0000000000,9336.0000000000,,False
Shilovasanctimi,"Жизнь - как туалетная бумага. Кажется, что длинная, а тратишь на всякое дерьмо!",Unknown,Russian,2015-09-10T10:22:00,2015-09-10T10:22:00,315.0000000000,362.0000000000,9337.0000000000,,False
Shilovasanctimi,'@Gusevglosinnunt Отличный пост! Я читал с большим удовольствием. Теперь буду чаще посещать ваш блог.',Unknown,Russian,2015-09-10T19:33:00,2015-09-10T19:33:00,319.0000000000,362.0000000000,9348.0000000000,,False
Shilovasanctimi,'@marina_al_22889 Всегда приятно читать умных людей',Unknown,Russian,2015-09-10T22:32:00,2015-09-10T22:32:00,318.0000000000,362.0000000000,9354.0000000000,,False
Shilovasanctimi,DirectX 12 повысит производительность Xbox One,Unknown,Russian,2015-09-11T12:26:00,2015-09-11T12:26:00,318.0000000000,363.0000000000,9369.0000000000,,False
Shilovasanctimi,BBC: Жизнь млекопитающих. 1 серия. Совершенная модель.,Unknown,Russian,2015-09-11T12:50:00,2015-09-11T12:50:00,318.0000000000,363.0000000000,9370.0000000000,R,True
Shilovasanctimi,"Так случилось, что в мою жизнь вошли походы в кафе и кино...",Unknown,Russian,2015-09-11T20:05:00,2015-09-11T20:05:00,318.0000000000,364.0000000000,9375.0000000000,R,True
Shilovasanctimi,"'@marina_al_22889 Огромное вам человеческое спасибо, очень актуальная заметка.'",Unknown,Russian,2015-09-13T09:36:00,2015-09-13T09:36:00,318.0000000000,367.0000000000,9405.0000000000,,False
Shilovasanctimi,'@marina_al_22889 странное ощущение. что тут живут одни боты',Unknown,Russian,2015-09-13T11:19:00,2015-09-13T11:19:00,318.0000000000,367.0000000000,9407.0000000000,,False
Shilovasanctimi,'@AeeunekpDenis Интересно! Подписался на блог!',Unknown,Russian,2015-09-14T19:41:00,2015-09-14T19:41:00,318.0000000000,367.0000000000,9441.0000000000,,False
Shilovasanctimi,Сатирический журнал Charlie Hebdo посмеялся над погибшим сирийским мальчиком,Unknown,Russian,2015-09-15T15:36:00,2015-09-15T15:36:00,319.0000000000,366.0000000000,9460.0000000000,,False
Shilovasanctimi,"Кажется, у меня жизнь бракованная.",Unknown,Russian,2015-09-16T08:27:00,2015-09-16T08:28:00,319.0000000000,368.0000000000,9477.0000000000,,False
Shilovasanctimi,"Начал повторять все теорию государства и права. На следующей неделе олимпиада, надо написать ее хорошо. �",Unknown,Russian,2015-09-17T09:15:00,2015-09-17T09:15:00,319.0000000000,369.0000000000,9495.0000000000,R,True
Shilovasanctimi,После развода он продал свою жизнь на ebay и купил остров на...,Unknown,Russian,2015-09-17T14:09:00,2015-09-17T14:09:00,320.0000000000,370.0000000000,9495.0000000000,R,True
