author_id,content,region,language,publish_date,harvested_date,following,followers,updates,post_type,retweet
Shilovasanctimi,Будет ли Олимпиада в Сочи?,Unknown,Russian,2015-08-03T12:19:00,2015-08-03T12:19:00,303.0000000000,324.0000000000,8570.0000000000,,False
Shilovasanctimi,Олимпиада-2022 пройдет в Пекине.,Unknown,Serbian,2015-08-03T13:00:00,2015-08-03T13:02:00,303.0000000000,325.0000000000,8571.0000000000,R,True
Shilovasanctimi,'@AeeoidaeLena С любимыми korobkov loko_z  nevskiyvlad  и Платошей на сьемочке. @ Cross Studio',Unknown,Russian,2015-08-03T14:13:00,2015-08-03T14:13:00,303.0000000000,325.0000000000,8572.0000000000,,False
Shilovasanctimi,"'@marina_al_22889 Портал отличный, порекомендую друзьям!'",Unknown,Russian,2015-08-03T14:54:00,2015-08-03T14:54:00,303.0000000000,325.0000000000,8574.0000000000,,False
Shilovasanctimi,"Спорт в Украине: Ярмоленко: Отработаю последний год контракта с ""Динамо"" К и буду искать варианты",Unknown,Russian,2015-08-03T16:03:00,2015-08-03T16:03:00,304.0000000000,325.0000000000,8575.0000000000,R,True
Shilovasanctimi,"'@Petrovjusiserlo """"This will be a year of action."""" —President Obama'",Unknown,English,2015-08-04T00:27:00,2015-08-04T00:27:00,305.0000000000,325.0000000000,8586.0000000000,,False
Shilovasanctimi,Акция от интернет-магазина Планета Спорт! При покупке...,Unknown,Bulgarian,2015-08-04T04:15:00,2015-08-04T04:15:00,305.0000000000,325.0000000000,8588.0000000000,,False
Shilovasanctimi,"'@Sharapovexstina Гол Дефо помог """"Тоттенхэму"""" обыграть """"Кристал Пэлас""""'",Unknown,Russian,2015-08-04T20:48:00,2015-08-04T20:50:00,307.0000000000,327.0000000000,8595.0000000000,,False
Shilovasanctimi,"Сколько тебе нужно, скажи, я отдам всю жизнь",Unknown,Russian,2015-08-05T00:48:00,2015-08-05T00:48:00,307.0000000000,327.0000000000,8597.0000000000,R,True
Shilovasanctimi,'@Kuznetzovacrima Супер! Спасибо :0',Unknown,Russian,2015-08-05T02:20:00,2015-08-05T02:20:00,307.0000000000,327.0000000000,8599.0000000000,,False
Shilovasanctimi,"'@Sobolevainlecce Интернет пишется с большой буквы внутри предложения, если что. И сотые не с точкой, а с запятой. Это по стандарту.'",Unknown,Russian,2015-08-05T04:59:00,2015-08-05T04:59:00,307.0000000000,327.0000000000,8604.0000000000,,False
Shilovasanctimi,"Название ""XXX Олимпиада"" привлекает очень много людей, которые спортом вообще не увлекаются.",Unknown,Russian,2015-08-05T07:22:00,2015-08-05T07:22:00,307.0000000000,327.0000000000,8606.0000000000,R,True
Shilovasanctimi,"Кафу: ""Олимпиада - важный механизм по борьбе против дискриминации""",Unknown,Russian,2015-08-05T12:25:00,2015-08-05T12:25:00,308.0000000000,327.0000000000,8612.0000000000,R,True
Shilovasanctimi,"...стадион, У нас своя олимпиада - За малышом бросок под стол...",Unknown,Ukrainian,2015-08-05T14:56:00,2015-08-05T14:56:00,308.0000000000,328.0000000000,8615.0000000000,R,True
Shilovasanctimi,Microsoft объявила дату релиза Quantum Break: Компания Microsoft на брифинге к выставке Gamescom объявила дату выпуска игры Quantum Break…,Unknown,Russian,2015-08-05T18:09:00,2015-08-05T18:09:00,308.0000000000,328.0000000000,8619.0000000000,,False
Shilovasanctimi,"I'm at Парк развлечений «Сочи парк» in Сочи, Краснодарский Край https://t.co/RH7tfSOLZ5",Unknown,Russian,2015-08-05T22:12:00,2015-08-05T22:12:00,309.0000000000,329.0000000000,8625.0000000000,R,True
Shilovasanctimi,#Скачать игры на компьютер типа plan vs zombi,Unknown,Russian,2015-08-06T01:03:00,2015-08-06T01:03:00,310.0000000000,329.0000000000,8626.0000000000,,False
Shilovasanctimi,Глобальные итоги и планы Global Spirits,Unknown,Russian,2015-08-07T11:23:00,2015-08-07T11:23:00,311.0000000000,331.0000000000,8647.0000000000,,False
Shilovasanctimi,'@marina_al_22889 Спасибо за инфу!',Unknown,Ukrainian,2015-08-07T18:42:00,2015-08-07T18:42:00,310.0000000000,330.0000000000,8653.0000000000,,False
Shilovasanctimi,Зимняя Олимпиада-2022 пройдет в Пекине,Unknown,Serbian,2015-08-09T05:08:00,2015-08-09T05:08:00,310.0000000000,331.0000000000,8688.0000000000,,False
Shilovasanctimi,Московский «Спартак» разгромил минское «Динамо»,Unknown,Russian,2015-08-09T05:57:00,2015-08-09T05:57:00,310.0000000000,331.0000000000,8689.0000000000,,False
Shilovasanctimi,В городе Сочи. Олимпиада – праздник или стихийное...,Unknown,Russian,2015-08-09T06:39:00,2015-08-09T06:39:00,310.0000000000,331.0000000000,8693.0000000000,,False
Shilovasanctimi,В городе Сочи. Олимпиада – праздник или стихийное...,Unknown,Russian,2015-08-09T13:58:00,2015-08-09T14:00:00,309.0000000000,331.0000000000,8697.0000000000,R,True
Shilovasanctimi,"сервисом, абоненту предоставляется 15 июня Международная олимпиада по итогам тендера была обозначена",Unknown,Russian,2015-08-09T16:32:00,2015-08-09T16:32:00,309.0000000000,331.0000000000,8701.0000000000,,False
Shilovasanctimi,'@AeeoidaeLena Amsterdam's Schiphol Airport asks people not to bring balloons to the railway station.',Unknown,English,2015-08-09T20:33:00,2015-08-09T20:33:00,311.0000000000,331.0000000000,8707.0000000000,,False
Shilovasanctimi,Как мы взорвали интернет-продажи в Сочи,Unknown,Russian,2015-08-10T00:31:00,2015-08-10T00:31:00,311.0000000000,331.0000000000,8708.0000000000,R,True
Shilovasanctimi,Компания ZTE создала новый смартфон эконом-класса Obsidian,Unknown,Russian,2015-08-10T00:33:00,2015-08-10T00:33:00,311.0000000000,331.0000000000,8709.0000000000,,False
Shilovasanctimi,'@marina_al_22889 Илью Фарбера обвиняют в оскорблении чувств офицеров',Unknown,Russian,2015-08-10T04:27:00,2015-08-10T04:27:00,311.0000000000,333.0000000000,8713.0000000000,,False
Shilovasanctimi,"В Украине подорожает пиво, — эксперт",Unknown,Russian,2015-08-10T05:43:00,2015-08-10T05:43:00,311.0000000000,333.0000000000,8714.0000000000,,False
Shilovasanctimi,Зимняя Олимпиада-2022 пройдет в Пекине,Unknown,Serbian,2015-08-10T13:04:00,2015-08-10T13:04:00,312.0000000000,333.0000000000,8720.0000000000,,False
Shilovasanctimi,'@Trofimovacentva В калининградском зоопарке задавили карликового бегемота',Unknown,Uzbek,2015-08-10T15:27:00,2015-08-10T15:28:00,312.0000000000,333.0000000000,8722.0000000000,,False
Shilovasanctimi,Геймерский ПК Acer Predator G6 на новом процессоре Intel Skylake,Unknown,Russian,2015-08-10T16:06:00,2015-08-10T16:06:00,313.0000000000,333.0000000000,8724.0000000000,,False
Shilovasanctimi,'@marina_al_22889 Шестой Матч звезд Континентальной хоккейной лиги примет центр Европы - Братислава',Unknown,Russian,2015-08-10T18:28:00,2015-08-10T18:28:00,313.0000000000,333.0000000000,8725.0000000000,,False
Shilovasanctimi,Музыка�,Unknown,Russian,2015-08-11T01:51:00,2015-08-11T01:51:00,312.0000000000,333.0000000000,8738.0000000000,R,True
Shilovasanctimi,"'@marina_al_22889 Эра хороших блогов подходит к концу. Скоро все они будут наполнены говнокомментами. Бойтесь, о маловерные, ибо это грядет'",Unknown,Russian,2015-08-11T02:00:00,2015-08-11T02:00:00,312.0000000000,333.0000000000,8739.0000000000,,False
Shilovasanctimi,'@marina_al_22889 Зачет! и ниипет!',Unknown,Russian,2015-08-11T15:26:00,2015-08-11T15:26:00,314.0000000000,333.0000000000,8753.0000000000,,False
Shilovasanctimi,Цена компании Apple снизилась на $90 млрд за две недели,Unknown,Russian,2015-08-11T15:26:00,2015-08-11T15:26:00,314.0000000000,333.0000000000,8754.0000000000,,False
Shilovasanctimi,"Веревко назначен президентом московского хоккейного клуба ""Спартак""",Unknown,Ukrainian,2015-08-11T22:53:00,2015-08-11T22:53:00,314.0000000000,333.0000000000,8760.0000000000,,False
Shilovasanctimi,Зимняя Олимпиада-2022 пройдет в Пекине,Unknown,Serbian,2015-08-12T00:28:00,2015-08-12T00:28:00,314.0000000000,334.0000000000,8763.0000000000,R,True
Shilovasanctimi,Зимняя Олимпиада-2022 пройдет в Пекине,Unknown,Serbian,2015-08-12T04:59:00,2015-08-12T04:59:00,315.0000000000,335.0000000000,8765.0000000000,R,True
Shilovasanctimi,IT-CON 2012 (Олимпиада для студентов 3-5 курсов) Разбор...,Unknown,Ukrainian,2015-08-12T06:23:00,2015-08-12T06:23:00,315.0000000000,335.0000000000,8767.0000000000,R,True
Shilovasanctimi,'@marina_al_22889 Ну жесть конечно…',Unknown,Russian,2015-08-12T15:33:00,2015-08-12T15:33:00,315.0000000000,335.0000000000,8773.0000000000,,False
Shilovasanctimi,Лондон 2012 — Олимпиада Антихриста,Unknown,Uzbek,2015-08-14T05:13:00,2015-08-14T05:13:00,316.0000000000,336.0000000000,8808.0000000000,,False
Shilovasanctimi,В городе Сочи. Олимпиада – праздник или стихийное...,Unknown,Russian,2015-08-15T02:54:00,2015-08-15T02:54:00,317.0000000000,339.0000000000,8828.0000000000,R,True
Shilovasanctimi,Сеть магазинов одежды Desigual уйдет из России,Unknown,Russian,2015-08-15T03:57:00,2015-08-15T03:57:00,317.0000000000,339.0000000000,8830.0000000000,,False
Shilovasanctimi,Зимняя Олимпиада-2022 пройдет в Пекине,Unknown,Serbian,2015-08-15T13:59:00,2015-08-15T13:59:00,320.0000000000,339.0000000000,8840.0000000000,,False
Shilovasanctimi,"...стадион, У нас своя олимпиада – За малышом бросок под стол...",Unknown,Ukrainian,2015-08-15T15:15:00,2015-08-15T15:15:00,320.0000000000,339.0000000000,8843.0000000000,R,True
Shilovasanctimi,Дочь бортпроводника с пропавшего малайзийского лайнера раскритиковала карикатуры Charlie Hebdo на MH370,Unknown,Russian,2015-08-15T21:42:00,2015-08-15T21:42:00,319.0000000000,340.0000000000,8851.0000000000,,False
Shilovasanctimi,"'@Kazantzevdextco Интернет пишется с большой буквы внутри предложения, если что. И сотые не с точкой, а с запятой. Это по стандарту.'",Unknown,Russian,2015-08-16T10:24:00,2015-08-16T10:24:00,324.0000000000,340.0000000000,8861.0000000000,,False
Shilovasanctimi,'@Egorovgistrevet А давно ли запустили этот блог?',Unknown,Serbian,2015-08-17T08:56:00,2015-08-17T08:56:00,322.0000000000,343.0000000000,8878.0000000000,,False
Shilovasanctimi,В городе Сочи. Олимпиада – праздник или стихийное...,Unknown,Russian,2015-08-17T10:47:00,2015-08-17T10:47:00,324.0000000000,343.0000000000,8880.0000000000,R,True
Shilovasanctimi,"Интерактивный трейлер игры ""Until Dawn""",Unknown,Russian,2015-08-17T17:56:00,2015-08-17T17:56:00,323.0000000000,344.0000000000,8884.0000000000,,False
Shilovasanctimi,В городе Сочи. Олимпиада – праздник или стихийное...,Unknown,Russian,2015-08-18T14:43:00,2015-08-18T14:43:00,326.0000000000,344.0000000000,8902.0000000000,R,True
Shilovasanctimi,"мда класс меня позвали в кино, а я не смотрела ни одной части и теперь надо потратить 10 часов чтобы хотя бы вникнуть во все",Unknown,Russian,2015-08-18T21:08:00,2015-08-18T21:09:00,325.0000000000,345.0000000000,8906.0000000000,R,True
Shilovasanctimi,"'@Matveevastitobt красиво, сделал! Благодарю!!!'",Unknown,Russian,2015-08-18T22:07:00,2015-08-18T22:08:00,325.0000000000,345.0000000000,8907.0000000000,,False
Shilovasanctimi,"...стадион, У нас своя олимпиада – За малышом бросок под стол...",Unknown,Ukrainian,2015-08-19T01:53:00,2015-08-19T01:53:00,324.0000000000,345.0000000000,8913.0000000000,R,True
Shilovasanctimi,Дуэйн Джонсон отправится в круиз по джунглям с Disney,Unknown,Russian,2015-08-21T02:42:00,2015-08-21T02:42:00,323.0000000000,349.0000000000,8943.0000000000,,False
Shilovasanctimi,В городе Сочи. Олимпиада – праздник или стихийное...,Unknown,Russian,2015-08-23T04:44:00,2015-08-23T04:44:00,324.0000000000,349.0000000000,8982.0000000000,,False
Shilovasanctimi,"Убивает фраза: ""Пиво без водки - деньги на ветер"". Будто пиво с водкой - это надёжный вклад, гарантия успеха, богатство и процветание.",Unknown,Russian,2015-08-24T23:03:00,2015-08-24T23:03:00,325.0000000000,352.0000000000,9005.0000000000,,False
Shilovasanctimi,"Хочу GoPro, но еще больше хочу жизнь, в которой мне пригодилась бы GoPro.",Unknown,Russian,2015-08-25T08:06:00,2015-08-25T08:06:00,324.0000000000,351.0000000000,9011.0000000000,,False
Shilovasanctimi,Минобороны попросило перенести акционирование ФГУПов на 2020 год,Unknown,Russian,2015-08-25T14:22:00,2015-09-21T11:16:00,325.0000000000,351.0000000000,9017.0000000000,,False
Shilovasanctimi,В городе Сочи. Олимпиада – праздник или стихийное...,Unknown,Russian,2015-08-25T16:06:00,2015-08-25T16:06:00,324.0000000000,352.0000000000,9018.0000000000,R,True
Shilovasanctimi,"...не меняется. Наверное, я не создан для игры в футбол, и моя...",Unknown,Russian,2015-08-26T00:08:00,2015-08-26T00:08:00,324.0000000000,352.0000000000,9031.0000000000,R,True
Shilovasanctimi,В городе Сочи. Олимпиада – праздник или стихийное...,Unknown,Russian,2015-08-26T03:30:00,2015-08-26T03:30:00,323.0000000000,353.0000000000,9034.0000000000,,False
Shilovasanctimi,Carlsberg Group подписала трехлетний контракт с Английской Премьер-лигой,Unknown,Russian,2015-08-26T13:10:00,2015-09-22T07:49:00,325.0000000000,353.0000000000,9044.0000000000,,False
Shilovasanctimi,Наушники - мой слух. Музыка - моя душа.,Unknown,Russian,2015-08-26T17:36:00,2015-08-26T17:36:00,325.0000000000,354.0000000000,9046.0000000000,R,True
Shilovasanctimi,'@Sorokinaagtracn Для утреннего позитива мне достаточно прочитать пару постов в моей любимой рубрике на вашем блоге',Unknown,LANGUAGE UNDEFINED,2015-08-26T19:06:00,2015-08-26T19:09:00,325.0000000000,354.0000000000,9048.0000000000,,False
Shilovasanctimi,...и Taj Holiday Village. РАЗВЛЕЧЕНИЕ И СПОРТ: 2 теннисных...,Unknown,Russian,2015-08-26T21:35:00,2015-08-26T21:35:00,324.0000000000,354.0000000000,9052.0000000000,,False
Shilovasanctimi,Букмекеры заподозрили «Урал» и «Терек» в организации договорного матча,Unknown,Russian,2015-08-26T23:40:00,2015-08-26T23:40:00,324.0000000000,354.0000000000,9054.0000000000,,False
Shilovasanctimi,Состоялся релиз Shadowrun: Hong Kong,Unknown,Russian,2015-08-27T03:36:00,2015-08-27T03:36:00,324.0000000000,355.0000000000,9056.0000000000,,False
Shilovasanctimi,В городе Сочи. Олимпиада – праздник или стихийное...,Unknown,Russian,2015-08-27T05:35:00,2015-08-27T05:35:00,324.0000000000,355.0000000000,9058.0000000000,,False
Shilovasanctimi,В городе Сочи. Олимпиада – праздник или стихийное...,Unknown,Russian,2015-08-27T11:32:00,2015-08-27T11:32:00,324.0000000000,355.0000000000,9062.0000000000,R,True
Shilovasanctimi,"'@Lebedevacontran Блог просто отличный, буду рекомендовать знакомым!'",Unknown,Russian,2015-08-27T12:28:00,2015-08-27T12:28:00,324.0000000000,355.0000000000,9063.0000000000,,False
Shilovasanctimi,"В ""Инвестторгбанке"" могут зависнуть 650 млн рублей Фонда социального страхования",Unknown,Russian,2015-08-28T04:44:00,2015-09-23T23:22:00,326.0000000000,358.0000000000,9075.0000000000,,False
Shilovasanctimi,"""WinExpo Ukraine"" и ""WineTech Ukraine"", Второй Украинский винный салон - ""WineSalon Ukraine""",Unknown,Russian,2015-08-28T09:38:00,2015-08-28T09:38:00,329.0000000000,360.0000000000,9078.0000000000,,False
Shilovasanctimi,Курорт Madinat Jumeirah представит крупнейшую в регионе площадку для мероприятий в октябре 2015 года,Unknown,Russian,2015-08-28T15:50:00,2015-08-28T15:50:00,326.0000000000,361.0000000000,9082.0000000000,,False
Shilovasanctimi,Samsung Galaxy Note 5 и Galaxy S6 Edge + получили 16-Мп камеру Sony,Unknown,Russian,2015-08-28T20:08:00,2015-08-28T20:08:00,327.0000000000,362.0000000000,9086.0000000000,,False
Shilovasanctimi,'@Kolosovitplenut See travel alert on upcoming',Unknown,English,2015-08-29T03:07:00,2015-08-29T03:07:00,328.0000000000,363.0000000000,9089.0000000000,,False
Shilovasanctimi,В городе Сочи. Олимпиада – праздник или стихийное...,Unknown,Russian,2015-08-29T16:40:00,2015-08-29T16:40:00,330.0000000000,363.0000000000,9096.0000000000,R,True
Shilovasanctimi,Surface Pro 4 получит чип Intel Skylake и 16 Гб оперативной памяти,Unknown,Russian,2015-08-29T19:03:00,2015-08-29T19:03:00,331.0000000000,363.0000000000,9098.0000000000,,False
Shilovasanctimi,"'@marina_al_63569 Мило=) Прелестно , просто фантастика гыы , не хотел писать тупой коммент но голова забита анализом прочитанного'",Unknown,Ukrainian,2015-08-30T03:05:00,2015-08-30T03:05:00,329.0000000000,363.0000000000,9106.0000000000,,False
Shilovasanctimi,Новый пульт от AppleTV получит возможности Wii,Unknown,Russian,2015-08-30T06:32:00,2015-08-30T06:32:00,329.0000000000,363.0000000000,9111.0000000000,,False
Shilovasanctimi,Ученые назвали беспорядочный секс признаком поведения потенциальных самоубийц,Unknown,Russian,2015-08-30T21:47:00,2015-09-26T14:09:00,329.0000000000,363.0000000000,9123.0000000000,,False
Shilovasanctimi,'@anja_ma_4081980 Оффтоп. Как Вы расскрутили свой блог?',Unknown,Russian,2015-08-30T22:59:00,2015-08-30T22:59:00,329.0000000000,363.0000000000,9124.0000000000,,False
Shilovasanctimi,"'@Malovastinduoca Очень глубокая и позитивная статья, спасибо. Теперь буду почаще заглядывать к вам на блог.'",Unknown,Russian,2015-08-31T04:00:00,2015-08-31T04:00:00,329.0000000000,363.0000000000,9129.0000000000,,False
Shilovasanctimi,Как часто процветание одного человека вызывает аллергию у другого.,Unknown,Russian,2015-08-31T08:20:00,2015-08-31T08:20:00,329.0000000000,364.0000000000,9132.0000000000,R,True
Shilovasanctimi,Путин и Медведев в Сочи - утренняя тренировка и завтрак...,Unknown,Ukrainian,2015-08-31T11:36:00,2015-09-27T10:03:00,329.0000000000,364.0000000000,9134.0000000000,R,True
Shilovasanctimi,"Процветание - это когда большая часть людей получает больше денег, чем зарабатывает, и тратит больше, чем получает.",Unknown,Russian,2015-08-31T15:57:00,2015-09-27T15:48:00,332.0000000000,363.0000000000,9135.0000000000,,False
Shilovasanctimi,ЦСКА обыграл «Кубань» в матче седьмого тура чемпионата России,Unknown,Russian,2015-09-01T01:10:00,2015-09-01T01:10:00,332.0000000000,365.0000000000,9143.0000000000,,False
Shilovasanctimi,ЦСКА обыграл «Кубань» в матче седьмого тура чемпионата России,Unknown,Russian,2015-09-01T01:10:00,2015-09-01T01:10:00,332.0000000000,365.0000000000,9143.0000000000,,False
Shilovasanctimi,"Кобзон после разрешения поехать в Европу рассказал на Донбассе, как ""кладет"" на санкции",Unknown,Russian,2015-09-01T07:25:00,2015-09-01T07:25:00,327.0000000000,364.0000000000,9148.0000000000,,False
Shilovasanctimi,'@Kalabinagtracur The Vertu Constellation; handmade in England for those with discerning style.',Unknown,English,2015-09-01T11:25:00,2015-09-01T11:25:00,329.0000000000,366.0000000000,9150.0000000000,,False
Shilovasanctimi,"...стадион, У нас своя олимпиада – За малышом бросок под стол...",Unknown,Ukrainian,2015-09-01T12:30:00,2015-09-01T12:30:00,330.0000000000,366.0000000000,9151.0000000000,,False
Shilovasanctimi,'@marina_al_22889 Вам спасибо - за тёплый приём )',Unknown,Ukrainian,2015-09-01T20:49:00,2015-09-01T20:49:00,330.0000000000,366.0000000000,9159.0000000000,,False
Shilovasanctimi,В городе Сочи. Олимпиада – праздник или стихийное...,Unknown,Russian,2015-09-01T22:43:00,2015-09-01T22:43:00,330.0000000000,366.0000000000,9163.0000000000,R,True
Shilovasanctimi,"'@marina_al_22889 Это уже далеко не новость, я об этом пару месяцев назад читал.'",Unknown,Russian,2015-09-02T12:41:00,2015-09-02T12:41:00,308.0000000000,343.0000000000,9171.0000000000,,False
Shilovasanctimi,"#Вести \| ""Динамо"" остаётся действующим обладателем Межконтинентального кубка ФИФА  /#новости #жизнь.",Unknown,Russian,2015-09-02T14:36:00,2015-09-29T12:57:00,311.0000000000,343.0000000000,9172.0000000000,R,True
Shilovasanctimi,"'@marina_al_22889 Блог супер, порекомендую знакомым!'",Unknown,Serbian,2015-09-02T16:29:00,2015-09-02T16:29:00,310.0000000000,344.0000000000,9175.0000000000,,False
Shilovasanctimi,В городе Сочи. Олимпиада – праздник или стихийное...,Unknown,Russian,2015-09-03T00:12:00,2015-09-03T00:12:00,306.0000000000,345.0000000000,9180.0000000000,R,True
Shilovasanctimi,"Прошел BioShock Infinite, первая половина игры неплохой шутер,вторая...ты просто сидишь с одним вопросом в голове(что происходит на экране?)",Unknown,Russian,2015-09-03T04:40:00,2015-09-03T04:40:00,306.0000000000,345.0000000000,9183.0000000000,,False
Shilovasanctimi,Нужна ли Зимняя олимпиада нашему Краснгодарскому краю?,Unknown,Russian,2015-09-03T08:13:00,2015-09-03T08:13:00,308.0000000000,345.0000000000,9183.0000000000,R,True
Shilovasanctimi,'@Zolototrubovcon ваш блог у меня в фаворитах',Unknown,Russian,2015-09-03T09:34:00,2015-09-03T09:34:00,307.0000000000,345.0000000000,9184.0000000000,,False
Shilovasanctimi,"правовых, организационных и Шатурском районах Сочи, Казань, Саратов, Тула, Москва Урал и анализа, - заявил",Unknown,Russian,2015-09-03T12:36:00,2015-09-03T12:36:00,308.0000000000,345.0000000000,9187.0000000000,R,True
Shilovasanctimi,"'@Aleksandrovalit ну, ничо так… в общем.'",Unknown,Russian,2015-09-03T12:54:00,2015-09-30T08:18:00,308.0000000000,345.0000000000,9188.0000000000,,False
Shilovasanctimi,Лондон 2012 — Олимпиада Антихриста,Unknown,Uzbek,2015-09-03T21:27:00,2015-09-03T21:27:00,310.0000000000,345.0000000000,9193.0000000000,R,True
Shilovasanctimi,В городе Сочи. Олимпиада – праздник или стихийное...,Unknown,Russian,2015-09-03T22:03:00,2015-09-03T22:03:00,310.0000000000,345.0000000000,9195.0000000000,,False
Shilovasanctimi,"'@marina_al_22889 Автор, прочти комменты, все в спаме'",Unknown,Russian,2015-09-03T22:13:00,2015-09-03T22:13:00,310.0000000000,345.0000000000,9196.0000000000,,False
Shilovasanctimi,#Ярославль: ХК «Сочи» обыграли «Локомотив» со счетом 2:1.,Unknown,Russian,2015-09-04T07:18:00,2015-09-04T07:18:00,309.0000000000,346.0000000000,9200.0000000000,,False
Shilovasanctimi,"Недалекие люди верят в удачу, сильные в причину и следствие.",Unknown,Russian,2015-09-04T07:29:00,2015-09-04T07:29:00,309.0000000000,346.0000000000,9201.0000000000,R,True
