author_id,content,region,language,publish_date,harvested_date,following,followers,updates,post_type,retweet
Shilovasanctimi,"Помидоры из Сочи, или Как Москва понадобилась Вашингтону...",Unknown,Uzbek,2015-05-15T01:48:00,2015-05-15T01:49:00,239.0000000000,250.0000000000,7064.0000000000,,False
Shilovasanctimi,«ТриМоб» внедряет безлимитные тарифы на 3G-интернет,Unknown,Russian,2015-05-15T02:45:00,2015-05-15T02:45:00,239.0000000000,250.0000000000,7066.0000000000,,False
Shilovasanctimi,'@AeeruvnfEliseev Smallest 2018 World Cup City Making Progress – Official',Unknown,English,2015-05-15T09:36:00,2015-05-15T09:36:00,241.0000000000,250.0000000000,7071.0000000000,,False
Shilovasanctimi,Не думала что олимпиада такая интересная!?),Unknown,Russian,2015-05-15T19:27:00,2015-05-15T19:27:00,240.0000000000,250.0000000000,7079.0000000000,,False
Shilovasanctimi,В городе Сочи. Олимпиада – праздник или стихийное...,Unknown,Russian,2015-05-16T01:16:00,2015-05-16T01:16:00,239.0000000000,250.0000000000,7086.0000000000,,False
Shilovasanctimi,Дума разрешила использовать маткапитал с рождения ребенка,Unknown,Russian,2015-05-16T02:58:00,2015-05-16T03:00:00,240.0000000000,250.0000000000,7089.0000000000,,False
Shilovasanctimi,'@duxinaqabel Группа U2 дала первый концерт за три года',Unknown,Russian,2015-05-17T00:34:00,2015-05-17T00:34:00,240.0000000000,251.0000000000,7103.0000000000,,False
Shilovasanctimi,"...стадион, У нас своя олимпиада — За малышом бросок под стол...",Unknown,Russian,2015-05-17T17:17:00,2015-05-17T17:17:00,241.0000000000,251.0000000000,7114.0000000000,R,True
Shilovasanctimi,'@Korolevcelfaulu Группа U2 дала первый концерт за три года',Unknown,Russian,2015-05-17T21:31:00,2015-05-17T21:31:00,244.0000000000,251.0000000000,7116.0000000000,,False
Shilovasanctimi,С июля пиво будет считаться в Украине алкоголем,Unknown,Russian,2015-05-19T17:39:00,2015-05-19T17:39:00,244.0000000000,253.0000000000,7147.0000000000,,False
Shilovasanctimi,В городе Сочи. Олимпиада – праздник или стихийное...,Unknown,Russian,2015-05-19T18:27:00,2015-05-19T18:27:00,245.0000000000,253.0000000000,7148.0000000000,,False
Shilovasanctimi,"'@Lazarevatracino С наступающим! Желаю здоровье администратору и всем посетителям. Будет здоровье, будет и все остальное!'",Unknown,Russian,2015-05-20T03:17:00,2015-05-20T03:19:00,243.0000000000,252.0000000000,7157.0000000000,,False
Shilovasanctimi,'@Ivanovadiusdani Утечка химикатов в США: почти 800 пострадавших',Unknown,Serbian,2015-05-20T06:27:00,2015-05-20T06:27:00,244.0000000000,252.0000000000,7160.0000000000,,False
Shilovasanctimi,"...комедия, семейный, спорт Юный Мориц влюблен в футбол...",Unknown,Russian,2015-05-20T06:30:00,2015-05-20T06:30:00,244.0000000000,252.0000000000,7161.0000000000,R,True
Shilovasanctimi,#Игры The Light Phone: ...начала производства 200 000 долларов...,Unknown,Russian,2015-05-20T08:03:00,2015-05-20T08:03:00,245.0000000000,252.0000000000,7165.0000000000,R,True
Shilovasanctimi,"...стадион, У нас своя олимпиада – За малышом бросок под стол...",Unknown,Russian,2015-05-20T09:39:00,2015-05-20T09:39:00,245.0000000000,252.0000000000,7167.0000000000,R,True
Shilovasanctimi,Олимпиада по предпринимательству «КапиталЪ»,Unknown,Bulgarian,2015-05-20T23:30:00,2015-05-20T23:30:00,243.0000000000,252.0000000000,7174.0000000000,R,True
Shilovasanctimi,"Подскажите по какому каналу будет трансляция матча ЦСКА - ТРАБЗОНСПОР Кроме спорт+ и 2+2, у меня их нет",Unknown,Russian,2015-05-21T01:11:00,2015-05-21T01:11:00,243.0000000000,252.0000000000,7175.0000000000,R,True
Shilovasanctimi,Продажи Huawei TalkBand B2 стартуют в России,Unknown,Russian,2015-05-21T05:26:00,2015-05-21T05:26:00,243.0000000000,252.0000000000,7179.0000000000,,False
Shilovasanctimi,"36 часов без сна: подготовка, зачет, подготовка, дорога, подготовка, дорога, ожидание, экзамен, радость, гуляния, еда, кино, дорога...",Unknown,Russian,2015-05-22T19:32:00,2015-05-22T19:32:00,245.0000000000,252.0000000000,7207.0000000000,,False
Shilovasanctimi,"'@Shubinadechosul Футбол. Эйден Макгиди перешел из """"Спартака"""" в """"Эвертон""""'",Unknown,Russian,2015-05-23T00:41:00,2015-05-23T00:41:00,244.0000000000,252.0000000000,7212.0000000000,,False
Shilovasanctimi,"Олимпиада ""История и культура Ислама"" Накануне, 22 мая...",Unknown,Uzbek,2015-05-23T13:51:00,2015-05-23T13:51:00,244.0000000000,252.0000000000,7221.0000000000,,False
Shilovasanctimi,"Олимпиада ""История и культура Ислама"" Накануне, 22 мая...",Unknown,Uzbek,2015-05-23T19:32:00,2015-05-23T19:32:00,244.0000000000,253.0000000000,7228.0000000000,R,True
Shilovasanctimi,Вспых ну я могу понять даже тог2 Но т28 Процветание мазахизма https://t.co/Fo82n4oQY7,Unknown,Russian,2015-05-23T22:22:00,2015-05-23T22:22:00,244.0000000000,253.0000000000,7232.0000000000,R,True
Shilovasanctimi,США вывели из-под санкций бесплатные интернет-сервисы в Крыму,Unknown,Russian,2015-05-24T00:28:00,2015-05-24T00:28:00,244.0000000000,253.0000000000,7237.0000000000,,False
Shilovasanctimi,Спорт залог здоровья)))) #Москва #выходные #велосипед #погода...,Unknown,Russian,2015-05-24T02:56:00,2015-05-24T02:56:00,245.0000000000,253.0000000000,7238.0000000000,R,True
Shilovasanctimi,Спорт залог здоровья)))) #Москва #выходные #велосипед #погода...,Unknown,Russian,2015-05-24T07:26:00,2015-05-24T07:26:00,243.0000000000,253.0000000000,7243.0000000000,R,True
Shilovasanctimi,«Сахалин» обыграл «Луч-Энергию» в ходе матча 33-го тура ФНЛ  #спорт #здоровье,Unknown,Russian,2015-05-24T13:59:00,2015-05-24T14:00:00,244.0000000000,253.0000000000,7245.0000000000,R,True
Shilovasanctimi,#спорт #сейчас «Локомотив» не выбирал россиян на ярмарке юниоров КХЛ,Unknown,Russian,2015-05-25T13:08:00,2015-05-25T13:08:00,247.0000000000,253.0000000000,7265.0000000000,R,True
Shilovasanctimi,Интеллектуальная олимпиада «Я – ЗНАЮ!» СКФО 2015 год 20 мая...,Unknown,Russian,2015-05-25T16:30:00,2015-05-25T16:30:00,246.0000000000,253.0000000000,7267.0000000000,R,True
Shilovasanctimi,Смартфоны LG G4 Stylus и G4c среднего сегмента официально представлены,Unknown,Russian,2015-05-25T20:02:00,2015-05-25T20:02:00,244.0000000000,253.0000000000,7269.0000000000,,False
Shilovasanctimi,#Азартные игры игровые автоматы crazy monkey,Unknown,Russian,2015-05-26T17:20:00,2015-05-26T17:20:00,244.0000000000,253.0000000000,7282.0000000000,,False
Shilovasanctimi,"Говоришь людям, чтобы не лезли в твою жизнь. Они лезут. Показываешь своё недовольство. Они расстраиваются, т.к. хотели как лучше. Ты плохой.",Unknown,Russian,2015-05-27T00:52:00,2015-05-27T00:54:00,246.0000000000,253.0000000000,7286.0000000000,R,True
Shilovasanctimi,"...туристические поездки, походы в кино, на танцпол, на футбол...",Unknown,Russian,2015-05-27T02:59:00,2015-05-27T02:59:00,247.0000000000,253.0000000000,7288.0000000000,R,True
Shilovasanctimi,"Приятная музыка, красивые слова, клип полностью подходит к песни. Все так красиво о необычно. https://t.co/4UqJBb0RMH",Unknown,Russian,2015-05-27T03:13:00,2015-05-27T03:13:00,247.0000000000,253.0000000000,7289.0000000000,,False
Shilovasanctimi,'@Kuznetsovburbor Починаємо о 19.00. Теми Громадське ONLINE на сьогодні:',Unknown,Ukrainian,2015-05-27T04:53:00,2015-05-27T04:53:00,248.0000000000,253.0000000000,7291.0000000000,,False
Shilovasanctimi,"#Вести \| ""ВКонтакте"" по требованию Apple ограничили прослушивание музыки в приложении для iPhone  /#новости #жизнь.",Unknown,Russian,2015-05-27T05:38:00,2015-05-27T05:38:00,248.0000000000,253.0000000000,7292.0000000000,,False
Shilovasanctimi,Немного о футболе) Дик Адвокат официально покинул пост главного тренера «Сандерленда»  #спорт #футбол,Unknown,Russian,2015-05-28T04:47:00,2015-05-28T04:48:00,248.0000000000,254.0000000000,7322.0000000000,,False
Shilovasanctimi,Canon выпустит новую бюджетную зеркалку уже этим летом,Unknown,Russian,2015-05-28T12:46:00,2015-05-28T12:46:00,249.0000000000,254.0000000000,7332.0000000000,,False
Shilovasanctimi,"Есть предложение в конце июля скатнуться по югу России.Тольятти-Волгоград-Астрахань-Краснодар-Сочи-Ростов.Если у кого отпуск,присоединяйтесь",Unknown,Russian,2015-05-28T19:03:00,2015-05-28T19:03:00,246.0000000000,254.0000000000,7338.0000000000,R,True
Shilovasanctimi,'@ahchubgobbbk Оппа. Случайно нашел. Интернет великая вещь. Благодарю автора.',Unknown,Russian,2015-05-30T07:27:00,2015-05-30T07:27:00,247.0000000000,256.0000000000,7367.0000000000,,False
Shilovasanctimi,"Сборная России по боксу усиленно готовится к Сочи-2014. Вроде Олимпиада не летняя, но я бы не расстраивал ребят.",Unknown,Russian,2015-05-30T08:16:00,2015-05-30T08:18:00,248.0000000000,256.0000000000,7370.0000000000,,False
Shilovasanctimi,"Музыка из ""Космической одиссеи 2001""? https://t.co/eF09m0NM24",Unknown,Russian,2015-05-30T10:18:00,2015-05-30T10:19:00,247.0000000000,256.0000000000,7374.0000000000,R,True
Shilovasanctimi,"Тем временем в Кремле стартовала Олимпиада, приуроченная назначению Саакашвили на на пост Главы Одесской области.",Unknown,Russian,2015-05-31T05:27:00,2015-05-31T05:27:00,248.0000000000,256.0000000000,7392.0000000000,R,True
Shilovasanctimi,"Я бы хотел в новой части Metro когда выпустят, чтобы Владимирских централ музыка шла, хотя бы припев. https://t.co/LmaCnjEsRo",Unknown,Russian,2015-05-31T06:30:00,2015-05-31T06:30:00,248.0000000000,256.0000000000,7393.0000000000,R,True
Shilovasanctimi,"«Экипаж» хочет в Китай, а IMAX — показывать «Игру престолов»",Unknown,Russian,2015-05-31T12:36:00,2015-05-31T12:36:00,247.0000000000,256.0000000000,7405.0000000000,,False
Shilovasanctimi,Олимпиада начилась! Урааа! Олимпийская кола! Я ждала этого очень долго!,Unknown,Uzbek,2015-05-31T15:32:00,2015-05-31T15:32:00,247.0000000000,256.0000000000,7410.0000000000,,False
Shilovasanctimi,"Всегда Говори ""Всегда"" - 7. Сериал. Серия 3 из 10. Феникс Кино. Мелодрама https://t.co/XTSeI91VYF",Unknown,Russian,2015-05-31T20:13:00,2015-05-31T20:13:00,247.0000000000,256.0000000000,7415.0000000000,,False
Shilovasanctimi,"...стадион, У нас своя олимпиада – За малышом бросок под стол...",Unknown,Russian,2015-05-31T21:49:00,2015-05-31T21:49:00,247.0000000000,256.0000000000,7417.0000000000,,False
Shilovasanctimi,Олимпиада норм так прошла,Unknown,Serbian,2015-05-31T22:09:00,2015-05-31T22:09:00,247.0000000000,256.0000000000,7418.0000000000,R,True
Shilovasanctimi,"Олимпиада 2014. Андрей Малахов, Дмитрий Борисов и Кирилл",Unknown,Uzbek,2015-06-01T00:35:00,2015-06-01T00:35:00,248.0000000000,256.0000000000,7422.0000000000,,False
Shilovasanctimi,"Знакомьтесь, премьер-министр России, Дмитрий Медведев, 1986...",Unknown,Russian,2015-06-01T01:59:00,2015-06-01T02:01:00,247.0000000000,256.0000000000,7423.0000000000,R,True
Shilovasanctimi,Carbonite вошла программа Электронный бухгалтер ЦАГИ. Опубликован геймплейный видеоролик игры Duke Nukem,Unknown,Russian,2015-06-01T06:35:00,2015-06-01T06:35:00,247.0000000000,256.0000000000,7428.0000000000,,False
Shilovasanctimi,"Мои поздравления, успеха и процветание Чете Лесуковых.  https://t.co/TvGHqX0sb2",Unknown,Russian,2015-06-01T08:20:00,2015-06-01T08:20:00,247.0000000000,256.0000000000,7429.0000000000,R,True
Shilovasanctimi,фоновая музыка эпичная) https://t.co/Lx4S7PTvJW,Unknown,Russian,2015-06-01T14:57:00,2015-06-01T14:57:00,248.0000000000,258.0000000000,7431.0000000000,,False
Shilovasanctimi,"А что, была олимпиада? оО https://t.co/mo2uPFqtf6",Unknown,Uzbek,2015-06-02T12:41:00,2015-06-02T12:42:00,250.0000000000,259.0000000000,7448.0000000000,R,True
Shilovasanctimi,"О спорт - Черевченко утвержден главным тренером ""Локомотива"" - СПОРТ - ЭКСПРЕСС  #спорт #sport",Unknown,Russian,2015-06-02T19:33:00,2015-06-02T19:33:00,248.0000000000,259.0000000000,7454.0000000000,R,True
Shilovasanctimi,"Познать себя и открыть сердце любви! (Лена, Сочи, апрель 2015) https://t.co/pjXhXW5Pes",Unknown,Russian,2015-06-03T07:19:00,2015-06-03T07:19:00,248.0000000000,259.0000000000,7466.0000000000,R,True
Shilovasanctimi,"Олимпиада 80,скоро,я верю!",Unknown,Russian,2015-06-03T09:28:00,2015-06-03T09:28:00,248.0000000000,259.0000000000,7469.0000000000,,False
Shilovasanctimi,"'@marina_al_22889 Мойес: полузащитник МЮ Янузай фантастически провел матч против """"Суонси""""'",Unknown,Bulgarian,2015-06-03T19:46:00,2015-06-03T19:46:00,249.0000000000,260.0000000000,7473.0000000000,,False
Shilovasanctimi,#Новости. В Южную Корею из-за вируса MERS отказались ехать семь тысяч туристов  /#жизнь,Unknown,Russian,2015-06-04T04:09:00,2015-06-04T04:09:00,250.0000000000,260.0000000000,7480.0000000000,,False
Shilovasanctimi,За инцидент с гимном Канады понесут наказание Знарок и Сафронов,Unknown,Russian,2015-06-04T05:10:00,2015-06-04T05:12:00,250.0000000000,260.0000000000,7481.0000000000,,False
Shilovasanctimi,"Мне кажется, я бы прожила без кино, красивой одежды, вкусной еды, даже книг. Но не без музыки.",Unknown,Russian,2015-06-04T22:52:00,2015-06-04T22:52:00,250.0000000000,260.0000000000,7496.0000000000,R,True
Shilovasanctimi,С июля пиво будет считаться в Украине алкоголем,Unknown,Russian,2015-06-05T03:45:00,2015-06-05T03:45:00,250.0000000000,260.0000000000,7497.0000000000,,False
Shilovasanctimi,'@Makarovapistras Honda представит в Детройте новую модель Fit',Unknown,Russian,2015-06-05T05:23:00,2015-06-05T05:23:00,250.0000000000,260.0000000000,7500.0000000000,,False
Shilovasanctimi,"Олимпиада 2014. Андрей Малахов, Дмитрий Борисов и Кирилл",Unknown,Uzbek,2015-06-05T19:33:00,2015-06-05T19:33:00,253.0000000000,260.0000000000,7512.0000000000,,False
Shilovasanctimi,Супер пенальти! Нарезка приколов про футбол!СПОРТ ПРИКОЛ!Ржака!:,Unknown,Russian,2015-06-06T16:41:00,2015-06-06T16:41:00,250.0000000000,261.0000000000,7521.0000000000,R,True
Shilovasanctimi,"Компания ""Шабо"" впервые презентовала виноделие Украины  на выставке  Hong Kong International Wine&Spirits Fair",Unknown,Russian,2015-06-06T22:10:00,2015-06-06T22:10:00,251.0000000000,262.0000000000,7524.0000000000,,False
Shilovasanctimi,#новости #спорт «Газпром-Югра» переиграла «Динамо» и вышла вперед в финальной серии #sport,Unknown,Russian,2015-06-06T22:27:00,2015-06-06T22:27:00,251.0000000000,262.0000000000,7525.0000000000,,False
Shilovasanctimi,"'@Pavlovliocefita HBO подтвердила, что 4-й сезон """"Игры престолов"""" стартует 6 апреля, а первый официальный трейлер выйдет уже завтра.'",Unknown,Russian,2015-06-07T21:14:00,2015-06-07T21:14:00,253.0000000000,264.0000000000,7539.0000000000,,False
Shilovasanctimi,Спорт Mail.Ru: Погиб двукратный олимпийский чемпион по фехтованию Сергей Шариков https://t.co/XtI6uAodKA,Unknown,Russian,2015-06-07T22:08:00,2015-06-07T22:08:00,253.0000000000,264.0000000000,7540.0000000000,,False
Shilovasanctimi,'@Timofeevaspirin Amsterdam's Schiphol Airport asks people not to bring balloons to the railway station.',Unknown,English,2015-06-08T17:18:00,2015-06-08T17:18:00,251.0000000000,269.0000000000,7561.0000000000,,False
Shilovasanctimi,Что за музыка в начале была? https://t.co/EtZbMawpJx,Unknown,Russian,2015-06-08T20:02:00,2015-06-08T20:02:00,250.0000000000,270.0000000000,7565.0000000000,,False
Shilovasanctimi,#Скачать игру смешарики олимпиада полная версия через торрент,Unknown,Russian,2015-06-09T08:42:00,2015-06-09T08:42:00,252.0000000000,270.0000000000,7575.0000000000,R,True
Shilovasanctimi,"'@Ivanovsimpvegau Фабрегас: """"Барселона"""" показала достойный футбол в матче с """"Атлетико""""'",Unknown,Russian,2015-06-09T15:34:00,2015-06-09T15:34:00,252.0000000000,269.0000000000,7582.0000000000,,False
Shilovasanctimi,"'@Nikolaevnabideh Дьякон Кураев встретился с Pussy Riot: «Я рад, что они не намерены повторять акции в храмах»'",Unknown,Russian,2015-06-10T05:50:00,2015-06-10T05:51:00,254.0000000000,270.0000000000,7593.0000000000,,False
Shilovasanctimi,"Сначала приснился ужастик, затем странный звонок, где играла музыка из Марио�",Unknown,Russian,2015-06-10T15:51:00,2015-06-10T15:51:00,254.0000000000,269.0000000000,7600.0000000000,R,True
Shilovasanctimi,В городе Сочи. Олимпиада – праздник или стихийное...,Unknown,Russian,2015-06-11T17:52:00,2015-06-11T17:52:00,257.0000000000,270.0000000000,7620.0000000000,,False
Shilovasanctimi,"Олимпиада 2014. Андрей Малахов, Дмитрий Борисов и Кирилл",Unknown,Uzbek,2015-06-12T06:20:00,2015-06-12T06:20:00,256.0000000000,271.0000000000,7628.0000000000,R,True
Shilovasanctimi,"'- эти ворота были построены 20 лет назад' ни чему жизнь людей не научила, еб",Unknown,Russian,2015-06-12T23:59:00,2015-06-12T23:59:00,258.0000000000,272.0000000000,7638.0000000000,R,True
Shilovasanctimi,"Олимпиада 2014. Андрей Малахов, Дмитрий Борисов и Кирилл",Unknown,Uzbek,2015-06-13T09:44:00,2015-06-13T09:44:00,258.0000000000,273.0000000000,7649.0000000000,,False
Shilovasanctimi,"Волков: задача ФК ""Мордовия"" в этом сезоне - зрелищный футбол",Unknown,Russian,2015-06-13T12:16:00,2015-06-13T12:30:00,259.0000000000,273.0000000000,7657.0000000000,,False
Shilovasanctimi,#Скачать игры через торрент гонки на русских машинах need for speed most wanted,Unknown,Russian,2015-06-13T16:18:00,2015-06-13T16:18:00,258.0000000000,273.0000000000,7661.0000000000,R,True
Shilovasanctimi,ZTE выпустит смартфон с 4K-дисплеем,Unknown,Russian,2015-06-14T01:39:00,2015-06-14T01:39:00,260.0000000000,273.0000000000,7665.0000000000,,False
Shilovasanctimi,"'@Kozlovapubmitit Я очень большой поклонник коньяка. Я обожаю коньяк так сильно, что позволяю себе пить его не больше двух раз в год. Вот'",Unknown,Russian,2015-06-14T16:23:00,2015-06-14T16:23:00,260.0000000000,274.0000000000,7674.0000000000,,False
Shilovasanctimi,'@Novikovimcolber Always spectacular at the Ice Hotel. New ice art every year. People from all over the world come here.',Unknown,English,2015-06-14T16:49:00,2015-06-14T16:49:00,260.0000000000,274.0000000000,7676.0000000000,,False
Shilovasanctimi,"Мотогонщик ""Ямахи"" Лоренсо выиграл Гран-при Каталонии MotoGP",Unknown,Russian,2015-06-14T22:33:00,2015-06-14T22:33:00,261.0000000000,274.0000000000,7680.0000000000,,False
Shilovasanctimi,Рожденный в июле болеть не должен,Unknown,Russian,2015-06-15T06:25:00,2015-06-15T06:27:00,261.0000000000,275.0000000000,7690.0000000000,,False
Shilovasanctimi,В городе Сочи. Олимпиада – праздник или стихийное...,Unknown,Russian,2015-06-16T02:39:00,2015-06-16T02:39:00,263.0000000000,275.0000000000,7704.0000000000,R,True
Shilovasanctimi,Etihad Airways начинает полеты в Цюрих на флагманском самолете Boeing 787,Unknown,Russian,2015-06-16T19:23:00,2015-06-16T19:23:00,263.0000000000,277.0000000000,7717.0000000000,,False
Shilovasanctimi,"О спорт - Джонатан Тэйвз: ""Кажется, что это все не по-настоящему"" - СПОРТ - ЭКСПРЕСС  #спорт #sport",Unknown,Russian,2015-06-16T20:26:00,2015-06-16T20:26:00,263.0000000000,277.0000000000,7719.0000000000,R,True
Shilovasanctimi,Интернет похож на древний Египет - люди пишут на стенах и поклоняются кошкам.,Unknown,Russian,2015-06-17T06:36:00,2015-06-17T06:36:00,263.0000000000,277.0000000000,7724.0000000000,,False
Shilovasanctimi,В Баку стартовала Олимпиада Старого Света,Unknown,Russian,2015-06-17T07:23:00,2015-06-17T07:23:00,264.0000000000,278.0000000000,7727.0000000000,,False
Shilovasanctimi,В городе Сочи. Олимпиада – праздник или стихийное...,Unknown,Russian,2015-06-18T00:30:00,2015-06-18T00:30:00,264.0000000000,280.0000000000,7749.0000000000,R,True
Shilovasanctimi,В городе Сочи. Олимпиада – праздник или стихийное...,Unknown,Russian,2015-06-18T17:03:00,2015-06-18T17:03:00,264.0000000000,281.0000000000,7767.0000000000,R,True
Shilovasanctimi,"...стадион, У нас своя олимпиада - за малышом бросок под стол...",Unknown,Ukrainian,2015-06-19T03:15:00,2015-06-19T03:15:00,266.0000000000,282.0000000000,7776.0000000000,,False
Shilovasanctimi,'@Shipunovligince Креатив в любом деле это хорошо но в последнее время подход становится все более узколобым',Unknown,Russian,2015-06-19T18:58:00,2015-06-19T19:00:00,267.0000000000,282.0000000000,7782.0000000000,,False
Shilovasanctimi,Спорт. зож. рассвет.,Unknown,Russian,2015-06-20T03:28:00,2015-06-20T03:28:00,274.0000000000,283.0000000000,7788.0000000000,R,True
Shilovasanctimi,"...стадион, У нас своя олимпиада — За малышом бросок под стол...",Unknown,Ukrainian,2015-06-20T03:34:00,2015-06-20T03:34:00,274.0000000000,283.0000000000,7789.0000000000,R,True
Shilovasanctimi,"Олимпиада 2014. Андрей Малахов, Дмитрий Борисов и Кирилл",Unknown,Uzbek,2015-06-20T05:02:00,2015-06-20T05:02:00,274.0000000000,283.0000000000,7792.0000000000,R,True
Shilovasanctimi,Олимпиада должна принести много прибыли. И наплыв туристов которые будут приносить хороший доход стране.,Unknown,Russian,2015-06-20T06:39:00,2015-06-20T06:39:00,274.0000000000,283.0000000000,7795.0000000000,R,True
Shilovasanctimi,'@Egorovgranigine The Vertu Constellation; handmade in England for those with discerning style.',Unknown,English,2015-06-20T06:47:00,2015-06-20T06:47:00,274.0000000000,283.0000000000,7796.0000000000,,False
Shilovasanctimi,"Бедные люди, которые живут прямо напротив кафе…",Unknown,Russian,2015-06-20T20:32:00,2015-06-20T20:32:00,273.0000000000,285.0000000000,7806.0000000000,R,True
