author_id,content,region,language,publish_date,harvested_date,following,followers,updates,post_type,retweet
spearmintme,ФАР предложила проверить траты Казани на строительство ливневок http://t.co/oWcGfyhIXc,Unknown,Russian,2015-06-24 19:12:00,2015-06-24 19:13:00,1817,253,1547,R,1
spearmintme,"Убыток 2014 года ""Трансаэро"" получила не от основной деятельности http://t.co/GlBckmkb83 #СПб",Unknown,Russian,2015-06-27 12:42:00,2015-06-27 12:42:00,1817,251,1550,R,1
spearmintme,'@zubovnik а как они хотели? сами себе санкции напридумывали',Unknown,Russian,2015-06-29 23:41:00,2015-06-29 23:42:00,1816,250,1552,,0
spearmintme,русские любят отдыхать на даче #РусскиеВарвары https://t.co/Qr2WRkoP3G,Unknown,Russian,2015-07-14 15:15:00,2015-07-14 15:15:00,1812,252,1571,,0
spearmintme,"Казус Ройзмана: депутатам не хватило одного голоса, чтобы лишить его звания мэра http://t.co/ZCEJo9TB6Y",Unknown,Russian,2015-07-14 18:51:00,2015-07-14 18:51:00,1812,252,1572,R,1
spearmintme,ЛНР отреагировала на поправки Порошенко к конституции  http://t.co/bP6m5R2zI1 http://t.co/Df8zDppErr,Unknown,Russian,2015-07-16 07:52:00,2015-07-16 07:52:00,1811,253,1577,R,1
spearmintme,"Пьяный пассажир угрожал взорвать самолет ""Екатеринбург-Москва"" http://t.co/LGVzS1KiSP",Unknown,Russian,2015-07-16 18:13:00,2015-07-16 18:13:00,1811,253,1579,R,1
spearmintme,Особое мнение: Николай Азаров http://t.co/xpBrYltaob Вся правда про нынешнюю Украину.Как жаль что украинцы мало услышат эту правду.Эхо-бди!,Unknown,Ukrainian,2015-07-16 18:53:00,2015-07-16 18:54:00,1811,253,1580,R,1
spearmintme,"Нуланд подтвердила выполнение Киевом ""Минска-2"" http://t.co/wLuxP1SMom http://t.co/fqLLJJQ6qw",Unknown,Russian,2015-07-16 20:32:00,2015-07-16 20:32:00,1811,254,1581,R,1
spearmintme,"Клинтон заявила, что не доверяет иранцам http://t.co/68dbJaspND",Unknown,Ukrainian,2015-07-16 21:11:00,2015-07-16 21:11:00,1811,254,1582,R,1
spearmintme,"Полицейские Ленинградской области подстрелили подозреваемого, угрожавшего им пистолетом http://t.co/sLQOejAZq1",Unknown,Russian,2015-07-18 08:32:00,2015-07-18 08:32:00,1811,255,1585,R,1
spearmintme,Онопко: В. Березуцкий готов выйти в любой момент http://t.co/Lwgw64h36G,Unknown,Russian,2015-07-18 16:13:00,2015-07-18 16:13:00,1811,255,1586,R,1
spearmintme,Сборная России победила Испанию  http://t.co/1fdV8hqgTP http://t.co/pvm5JsXxSx,Unknown,Russian,2015-07-19 11:33:00,2015-07-19 11:33:00,1810,254,1587,R,1
spearmintme,Василий Ливанов рассказал о своем отношении к новым кинолентам про Шерлока Холмса   http://t.co/jSIFDS9qtd  Видео:   http://t.co/bjUaalm5Pa,Unknown,Russian,2015-07-19 13:54:00,2015-07-19 13:54:00,1810,253,1589,R,1
spearmintme,Сотрудник СБУ Закарпатья признался в организации встречи «Правого сектора» и депутата Ланьо  http://t.co/fhgzJ7rOQR http://t.co/FzHv3CVJBq,Unknown,Russian,2015-07-19 14:32:00,2015-07-19 14:32:00,1810,253,1590,R,1
spearmintme,Ярославская полиция провела учения перед приездом фанатов «Спартака» http://t.co/DsGR8n8D6v,Unknown,Russian,2015-07-19 19:12:00,2015-07-19 19:13:00,1810,253,1591,R,1
spearmintme,Геннадий Селезнев будет похоронен 22 июля http://t.co/r9vMBPkcms,Unknown,Russian,2015-07-20 10:31:00,2015-07-20 10:31:00,1810,253,1593,R,1
spearmintme,Опубликовано новое видео с места крушения Boeing 777 на Украине  https://t.co/PhaCvmRPLA   https://t.co/nJgIPfd6OG,Unknown,Russian,2015-07-20 11:52:00,2015-07-20 11:53:00,1810,253,1594,R,1
spearmintme,Сбербанк предупредил о новом шоке на валютном рынке   http://t.co/tegSnvP6Zh http://t.co/QhbDygeqUZ,Unknown,Serbian,2015-07-20 12:12:00,2015-07-20 12:12:00,1810,253,1595,R,1
spearmintme,Кадыров сообщил о 9 жертвах падения микроавтобуса в пропасть в Чечне  http://t.co/JMRnE5hlIl,Unknown,Russian,2015-07-21 23:32:00,2015-07-21 23:32:00,1696,254,1598,R,1
spearmintme,Аналитик: попытки США напугать Россию военными учениями вызывают смех   http://t.co/sAaPHD01e7 с помощью @rianru,Unknown,Russian,2015-07-23 09:33:00,2015-07-23 09:33:00,1694,254,1606,R,1
spearmintme,Сегодня исполняется 50 лет Слэшу – бывшему лид-гитаристу американской хард-рок-группы Guns N' Roses… https://t.co/yRq9bQoPMH,Unknown,Russian,2015-07-23 17:11:00,2015-07-23 17:12:00,1694,255,1608,R,1
spearmintme,В Москве в пятницу ожидается до +24&deg;С  http://t.co/KcwSp1qGTx,Unknown,Russian,2015-07-24 04:11:00,2015-07-24 04:11:00,1694,254,1610,R,1
spearmintme,Депутаты Южно-Сахалинска закрыли избирком в целях экономии http://t.co/X6PLwVGG3R,Unknown,Russian,2015-07-24 04:51:00,2015-07-24 04:51:00,1694,254,1611,R,1
spearmintme,"СМИ сообщили, кого Майкл Джексон мог сыграть в «Звездных войнах»  http://t.co/tnW6Sei0c3 http://t.co/E7m2ClmQQ2",Unknown,Russian,2015-07-24 16:31:00,2015-07-24 16:31:00,1694,254,1617,R,1
spearmintme,"'@ComradZampolit просто вырвать руки выдумщикам таких игрушек, руки администрации и родителей которые это терпят!'",Unknown,Russian,2015-07-25 20:16:00,2015-07-25 20:17:00,1694,256,1623,,0
spearmintme,Клинтон отреагировала на обвинения касательно документов с грифом «Совершенно секретно»  http://t.co/o9oMjiSanp http://t.co/1GAH7LAoLg,Unknown,Russian,2015-07-26 08:33:00,2015-07-26 08:33:00,1694,257,1624,R,1
spearmintme,Организаторы Ice Bucket Challenge потратят $77 млн на изучение амиотрофического склероза http://t.co/gRvsuF52NT,Unknown,Russian,2015-07-26 17:52:00,2015-07-26 17:52:00,1694,257,1626,R,1
spearmintme,Площадь лесных пожаров в Забайкалье за выходные увеличилась на 919 га  http://t.co/jhXVNWZjp6,Unknown,Russian,2015-07-27 03:53:00,2015-07-27 03:53:00,1694,258,1631,R,1
spearmintme,СМИ: в США в результате падения небольшого самолета погибли четыре человека  http://t.co/mU9tDJR7t4,Unknown,Russian,2015-07-28 02:12:00,2015-07-28 02:12:00,1694,257,1636,R,1
spearmintme,Строителям Восточного выплатили почти 300 млн рублей долга  http://t.co/4D7y5Eglz8,Unknown,Russian,2015-07-28 06:13:00,2015-07-28 06:15:00,1694,256,1638,R,1
spearmintme,"Пономарёв: ЦСКА выиграет у «Спарты» со счётом 1:0, матч будет обоюдоострым http://t.co/nlSYgJxFRw",Unknown,Russian,2015-07-28 11:53:00,2015-07-28 11:53:00,1694,256,1639,R,1
spearmintme,"Windows 10 запущена в 190 странах, через 3 года на нее может перейти 1 млрд пользователей  http://t.co/3VkUjiOmLI",Unknown,Russian,2015-07-28 22:12:00,2015-07-28 22:13:00,1694,256,1641,R,1
spearmintme,"Количество уроков географии в школе необходимо увеличить, считает Песков http://t.co/q8PEBAg0lO",Unknown,Russian,2015-07-29 09:33:00,2015-07-29 09:34:00,1694,256,1643,R,1
spearmintme,Талибан опровергли информацию о смерти своего лидера http://t.co/QpAC47jDHy,Unknown,Russian,2015-07-29 14:31:00,2015-07-29 14:31:00,1694,256,1645,R,1
spearmintme,В Киеве убита пожилая монахиня Украинской православной церкви  http://t.co/2SDn92ZtQZ,Unknown,Russian,2015-07-29 15:13:00,2015-07-29 15:13:00,1694,256,1646,R,1
spearmintme,"Самедов: всё, что я хотел сказать Капелло, уже ему сказал http://t.co/h0yKT6PQwL",Unknown,Russian,2015-07-30 16:33:00,2015-07-30 16:33:00,1693,257,1651,R,1
spearmintme,Футбольное поле «Казань-Арены» будет готово к концу года http://t.co/lrbsS04rX4,Unknown,Russian,2015-07-31 15:12:00,2015-07-31 15:12:00,1693,257,1654,R,1
spearmintme,«Монако» приобрёл нападающего у «Сент-Этьена» и отдал его в аренду «Ганноверу» http://t.co/fxAORWJWzW,Unknown,Russian,2015-07-31 16:51:00,2015-07-31 16:52:00,1693,257,1655,R,1
spearmintme,Daily Mail сообщила о гибели членов семьи Усамы бен Ладена в авиакатастрофе: http://t.co/SM5sXVtvkF,Unknown,Russian,2015-08-01 01:12:00,2015-08-01 01:12:00,1693,257,1657,R,1
spearmintme,Погода на сегодня  http://t.co/HFf948glQH http://t.co/NTR7X56sjk,Unknown,Russian,2015-08-01 06:51:00,2015-08-01 06:52:00,1693,257,1659,R,1
spearmintme,"Власти Малайзии объявили, что найденный кусок самолета - действительно фрагмент Boeing 777 https://t.co/GplFg9f26g",Unknown,Russian,2015-08-02 10:31:00,2015-08-02 10:32:00,1693,256,1661,R,1
spearmintme,Автомобили китайской Dongfeng до конца августа подешевели на 30 тыс. рублей http://t.co/EhbC0hNIG6,Unknown,Russian,2015-08-03 10:54:00,2015-08-03 10:54:00,1692,255,1667,R,1
spearmintme,В США расследуют дело полицейского убившего афроамериканца http://t.co/AFMjLtPo2H http://t.co/InwPgoigYH,Unknown,Russian,2015-08-03 18:52:00,2015-08-03 18:53:00,1693,255,1668,R,1
spearmintme,Два самолета времен Второй Мировой войны завершили перелет из Америки в Россию  http://t.co/TODrhaWsNK,Unknown,Russian,2015-08-04 06:53:00,2015-08-04 06:54:00,1693,255,1671,R,1
spearmintme,Дочь Бориса Немцова потратит большую часть премии в €1 млн на помощь Украине  http://t.co/TJbT1CTs0z http://t.co/IrIbTO5wy2,Unknown,Russian,2015-08-04 14:11:00,2015-08-04 14:11:00,1693,255,1673,R,1
spearmintme,Сможет ли ЦСКА победить «Спарту»  http://t.co/qVC3uoh5ta http://t.co/OvDQYYiZi7,Unknown,Russian,2015-08-05 11:52:00,2015-08-05 11:52:00,1693,254,1678,R,1
spearmintme,Непристойное предложение 2   Кредиторы сочли последнее предложение Украины неприемлемым http://t.co/K5d0zaLoZp,Unknown,Russian,2015-08-06 03:52:00,2015-08-06 03:52:00,1693,255,1682,R,1
spearmintme,Тина Канделаки @tina_kandelaki назвала футболистов ЦСКА «реальными пацанами»: http://t.co/rlsRDrZGPm,Unknown,Russian,2015-08-06 09:11:00,2015-08-06 09:12:00,1693,255,1683,R,1
spearmintme,Южная Осетия на два дня закроет границу с Грузией http://t.co/XODzEb98rE,Unknown,Russian,2015-08-06 09:12:00,2015-08-06 09:12:00,1693,255,1684,R,1
spearmintme,Смартфон-2020: каким он будет http://t.co/1ZRY7SuNWR,Unknown,Russian,2015-08-06 09:13:00,2015-08-06 09:13:00,1693,255,1685,R,1
spearmintme,Хиллари Клинтон сделала селфи с Ким Кардашьян и Канье Уэстом http://t.co/mw5nAJLBGP,Unknown,Uzbek,2015-08-07 12:12:00,2015-08-07 12:12:00,1692,252,1690,R,1
spearmintme,Коалицию Навального сняли с выборов в последнем регионе  http://t.co/tGRtauqqPr,Unknown,Russian,2015-08-08 22:12:00,2015-08-08 22:12:00,1692,252,1692,R,1
spearmintme,Пассажирский самолет в США совершил экстренную посадку из-за пробитого градом стекла http://t.co/aVQh6BhBn1,Unknown,Ukrainian,2015-08-08 22:51:00,2015-08-08 22:51:00,1692,252,1693,R,1
spearmintme,Киев создает военную прокуратуру в зоне АТО  http://t.co/wxX3yWrpcP http://t.co/WH9hdIOind,Unknown,Russian,2015-08-12 06:52:00,2015-08-12 06:52:00,1692,250,1709,R,1
spearmintme,"Россия обошла НАТО по масштабу учений, пишет @DailyMailUK http://t.co/PlpdAp9uT8 http://t.co/iqz6zO8vMe",Unknown,Russian,2015-08-12 12:53:00,2015-08-12 12:53:00,1692,250,1713,R,1
spearmintme,Билайн запускает в Москве и области передачу голоса в сетях LTE  #hitech,Unknown,Russian,2015-08-12 19:11:00,2015-08-12 19:11:00,1692,250,1714,R,1
spearmintme,Ракетчиков подняли по тревоге на Камчатке  http://t.co/7GrdQtFcfx http://t.co/hF3Ikms319,Unknown,Russian,2015-08-13 08:32:00,2015-08-13 08:32:00,1692,250,1717,R,1
spearmintme,"В NASA рассказали, как связаться с космонавтами на МКС  http://t.co/q5qAiNNa5H http://t.co/4b9qzOKR2w",Unknown,Russian,2015-08-13 11:52:00,2015-08-13 11:52:00,1692,250,1720,R,1
spearmintme,Полиция Киева изъяла у вице-президента УЕФА Суркиса пульт управления специальными сигналами http://t.co/ypaeFdxaJy,Unknown,Russian,2015-08-13 19:51:00,2015-08-13 19:51:00,1692,250,1722,R,1
spearmintme,Мединский посоветовал молодежи идти в реставраторы для дальнейшей работы в Крыму http://t.co/L2U0TSa12r,Unknown,Russian,2015-08-14 14:33:00,2015-08-14 14:33:00,1692,250,1725,R,1
spearmintme,"В ДНР за прошедшие сутки погиб один местный житель, ранены девять http://t.co/bOuj8P00LY",Unknown,Russian,2015-08-15 11:12:00,2015-08-15 11:12:00,1692,249,1729,R,1
spearmintme,Тарханов: на данном этапе ЦСКА сильнее «Спартака» http://t.co/2an18H7A3l,Unknown,Russian,2015-08-15 15:53:00,2015-08-15 15:53:00,1692,248,1730,R,1
spearmintme,Новую Windows 10 установили на 45 миллионов устройств  #hitech,Unknown,Russian,2015-08-16 10:11:00,2015-08-16 10:11:00,1692,249,1735,R,1
spearmintme,В ДНР заявили о подготовке Киевом серии терактов на День независимости  http://t.co/wAU20TTzEt,Unknown,Russian,2015-08-16 13:12:00,2015-08-16 13:13:00,1692,249,1736,R,1
spearmintme,"Арестован бывший и.о. гендиректора минского ХК ""Динамо"" Владимир Бережков http://t.co/PRwWvN7cPz",Unknown,Russian,2015-08-17 08:13:00,2015-08-17 08:13:00,1692,249,1743,R,1
spearmintme,Центральный Республиканский Банк ДНР распорядился установить курсы валют для обменных пунктов на 18 августа 2015г. http://t.co/grehQ76wXN,Unknown,Russian,2015-08-17 22:32:00,2015-08-17 22:32:00,1692,249,1745,R,1
spearmintme,Алекс Сандро близок к переходу из «Порту» в «Ювентус» за € 22 млн http://t.co/qmDFcnyQzR,Unknown,Ukrainian,2015-08-18 08:11:00,2015-08-18 08:11:00,1692,249,1749,R,1
spearmintme,Медель: «Интер» может бороться за чемпионство в предстоящем сезоне http://t.co/9dRYaVQ24S,Unknown,Russian,2015-08-18 08:51:00,2015-08-18 08:51:00,1692,249,1750,R,1
spearmintme,Королевский банк Шотландии продаст все свои активы в России   https://t.co/FhCfFAssSy,Unknown,Russian,2015-08-18 18:45:00,2015-08-18 18:45:00,1692,249,1757,R,1
spearmintme,Лимит анонимных платежей увеличат более чем в два раза  http://t.co/tA2RgnmE0Z,Unknown,Russian,2015-08-19 05:02:00,2015-08-19 05:02:00,1692,249,1758,R,1
spearmintme,В Ставрополье 10 человек обратились за медпомощью после сильного града http://t.co/yLQNhLtW3J,Unknown,Russian,2015-08-20 00:31:00,2015-08-20 00:31:00,1691,249,1764,R,1
spearmintme,"Трем жителям Сахалина, издевавшимся над медведем, грозит до 2 лет заключения и штраф http://t.co/d31MlAZjhJ",Unknown,Russian,2015-08-20 10:52:00,2015-08-20 10:52:00,1691,250,1765,R,1
spearmintme,СК предъявил обвинения замгубернатора Новгородской области Нечаеву http://t.co/c7i1kis5Ri,Unknown,Russian,2015-08-20 15:33:00,2015-08-20 15:33:00,1691,249,1767,R,1
spearmintme,Источник: расследование о коррупции в ФИФА не угрожает проведению ЧМ-2018 в РФ http://t.co/ejBpxLR951,Unknown,Russian,2015-08-20 15:53:00,2015-08-20 15:53:00,1691,249,1768,R,1
spearmintme,Наркополиция обнаружила подводный туннель на границе Мексики и США http://t.co/VIRJ616QX4,Unknown,Russian,2015-08-20 17:32:00,2015-08-20 17:32:00,1691,249,1770,R,1
spearmintme,Honda представила компактный семиместный кроссовер http://t.co/Jgaod1kscY,Unknown,Russian,2015-08-21 04:33:00,2015-08-21 04:33:00,1691,249,1775,R,1
spearmintme,"Т.е., с учетом деноминации за время правления @aanechaev $ вырос с 0.0005 р до 2.50 р. Всего в каких то 5000 раз ))) https://t.co/uuuQlXgCvP",Unknown,Russian,2015-08-22 07:31:00,2015-08-22 07:31:00,1691,249,1778,R,1
spearmintme,Малайзия отправила Нидерландам отзыв на доклад о крушении Boeing http://t.co/v87yjNBdhX,Unknown,Russian,2015-08-23 08:53:00,2015-08-23 08:53:00,1691,251,1781,R,1
spearmintme,АвтоВАЗ готовит Lada Kalina Cross в комплектации люкс http://t.co/WMPFN0x3yG,Unknown,Russian,2015-08-24 08:34:00,2015-08-24 08:34:00,1691,251,1787,R,1
spearmintme,Молодец Голодец https://t.co/eSBqVLoWdn,Unknown,Ukrainian,2015-08-24 13:12:00,2015-09-19 22:43:00,1691,251,1788,R,1
spearmintme,«Википедия» обжалует решение Роскомнадзора о блокировке http://t.co/0tWNoDuui2,Unknown,Russian,2015-08-24 18:32:00,2015-08-24 18:32:00,1691,251,1790,R,1
spearmintme,Роспотребнадзор начал процесс изъятия Persil и Fairy из магазинов http://t.co/jBxKc4wmiG http://t.co/6vRGdDKDiA,Unknown,Russian,2015-08-25 05:34:00,2015-08-25 05:34:00,1691,251,1791,R,1
spearmintme,Сенцов после приговора спел гимн Украины http://t.co/wpj6gO15PZ,Unknown,Ukrainian,2015-08-25 12:11:00,2015-08-25 12:11:00,1691,251,1797,R,1
spearmintme,Паулу Оливейра: цель у «Спортинга» одна — выйти в групповой этап Лиги чемпионов http://t.co/c373Jg1psk,Unknown,Uzbek,2015-08-25 15:51:00,2015-08-25 15:51:00,1691,251,1798,R,1
spearmintme,"Россия разрабатывает третье поколение ""самолетов Судного дня"" http://t.co/t4NtPpR39X",Unknown,Russian,2015-08-26 07:11:00,2015-09-22 02:35:00,1691,252,1801,R,1
spearmintme,Кем гордятся россияне  http://t.co/vjsUV9Ch91 http://t.co/VTz6JWJCr2,Unknown,Russian,2015-08-26 13:13:00,2015-08-26 13:13:00,1691,254,1804,R,1
spearmintme,"Сухой Суперджет сделают дешевле на 3,6 миллиона рублей. Он и так в полете скрипит, а теперь вообще страшно    https://t.co/4c9tfYdwhX",Unknown,Russian,2015-08-26 13:31:00,2015-09-22 08:21:00,1691,254,1805,R,1
spearmintme,"Эквадор стал первой страной из ОПЕК, которая добывает нефть себе в убыток  http://t.co/ivYTGM4Vx5",Unknown,Russian,2015-08-26 22:52:00,2015-08-26 22:52:00,1691,253,1810,R,1
spearmintme,Дилеры сообщили о повышении цен на большинство моделей Lada с сентября  http://t.co/Cp3dMeo5fT,Unknown,Russian,2015-08-27 00:11:00,2015-08-27 00:11:00,1691,252,1811,R,1
spearmintme,"Двое из трех человек, раненых злоумышленником в американском штате Луизиана, скончались  http://t.co/tz4sZ2SIyW",Unknown,Russian,2015-08-27 02:51:00,2015-09-22 21:27:00,1691,253,1813,R,1
spearmintme,Бизнес в сфере ЖКХ? Почему нет! http://t.co/TVwXr4aaC0,Unknown,Russian,2015-08-27 14:58:00,2015-08-27 14:58:00,1691,254,1818,R,1
spearmintme,«Урал» — «Терек»: гол Айссати в ворота «Урала» http://t.co/PAzmEU9gYZ,Unknown,Russian,2015-08-28 16:33:00,2015-08-28 16:33:00,1691,256,1827,R,1
spearmintme,У Дональда Трампа появилась новая поддержка  http://t.co/QuV1AMkBuv http://t.co/1xW4gxQUWO,Unknown,Russian,2015-08-29 20:31:00,2015-08-29 20:31:00,1691,256,1835,R,1
spearmintme,Бубка стал первым вице-президентом Международной ассоциации легкоатлетических федераций  http://t.co/4FuMuWoReo,Unknown,Russian,2015-08-30 11:14:00,2015-08-30 11:14:00,1691,255,1836,R,1
spearmintme,Убийство по расписанию. Украинской экономике жить еще четыре месяца   http://t.co/jBOb9Pty7s с помощью @rianru,Unknown,Russian,2015-08-30 17:31:00,2015-08-30 17:38:00,1691,255,1839,R,1
spearmintme,На Ставрополье 14-летнего сына топ-менеджера «Транснефти» поймали за езду без прав http://t.co/7i07tGDxxL,Unknown,Ukrainian,2015-09-01 10:11:00,2015-09-01 10:11:00,1691,253,1846,R,1
spearmintme,"Президент ДФЛ заявил, что шокирован проигрышем Лебедеву выборов в исполком РФС http://t.co/sYKpK1K6Lo",Unknown,Russian,2015-09-02 10:31:00,2015-09-02 10:31:00,1689,255,1851,R,1
spearmintme,В Свердловской области сошли с рельсов четыре цистерны со сжиженным газом http://t.co/HMkQOpdQ8w,Unknown,Russian,2015-09-02 11:31:00,2015-09-02 11:31:00,1689,255,1853,R,1
spearmintme,Обвинение попросило для предполагаемого вербовщика «Правого сектора» восемь лет колонии   https://t.co/cAHMYK1yQi,Unknown,Russian,2015-09-02 13:53:00,2015-09-02 13:53:00,1689,256,1855,R,1
spearmintme,"Варан: готов к тому, чтобы завершить карьеру в «Реале» http://t.co/R9iUKY3eIV",Unknown,Russian,2015-09-03 07:52:00,2015-09-03 07:52:00,1689,256,1857,R,1
spearmintme,Китайский банк выдаст «МегаФону» $600 млн http://t.co/KMk4nUtSiV,Unknown,Uzbek,2015-09-03 11:52:00,2015-09-03 11:52:00,1689,256,1858,R,1
spearmintme,Депутат заксобрания Петербурга нашел замену сбитой фигуре Мефистофеля  http://t.co/Ynrc0gyAmU http://t.co/JJ1Hn2NhrV,Unknown,Russian,2015-09-03 15:52:00,2015-09-03 15:52:00,1689,255,1859,R,1
spearmintme,Кэмерон назвал Асада и ИГ виновными в миграционном кризисе http://t.co/DofTD1qmZT,Unknown,Russian,2015-09-03 15:54:00,2015-09-03 15:54:00,1689,255,1860,R,1
spearmintme,"#НевскиеНовости Уголовное дело заведено в отношении 18-летнего водителя на BMW, насмерть сбившего мальчика у трамвая http://t.co/l1zVu5ADfG",Unknown,Russian,2015-09-03 23:22:00,2015-09-03 23:22:00,1689,255,1862,R,1
spearmintme,"Сравнили парады в Китае и России — вот, что получилось    https://t.co/uRnuf1luFZ http://t.co/6hQXJWOqMj",Unknown,Russian,2015-09-04 08:54:00,2015-09-04 08:54:00,1689,255,1864,R,1
spearmintme,Чемпион по гребле назначен начальником патрульной полиции Харькова  http://t.co/zIiJWuR5At http://t.co/HJfsGIbXNZ,Unknown,Russian,2015-09-04 13:31:00,2015-09-04 13:34:00,1689,255,1865,R,1
spearmintme,12 человек пострадали в ДТП в Архангельской области  http://t.co/66HqvZWR32 http://t.co/gXKog3P58Z,Unknown,Russian,2015-09-04 20:12:00,2015-09-04 20:12:00,1689,256,1867,R,1
spearmintme,"В Мексике обнаружили ранчо, где преступники растворяли своих жертв в кислоте  http://t.co/lFtVfeUkw8",Unknown,Russian,2015-09-04 21:32:00,2015-09-04 21:32:00,1689,256,1868,R,1
