author_id,content,region,language,publish_date,harvested_date,following,followers,updates,post_type,retweet
spearmintme,"МВД Украины: под Херсоном взорвали электроопоры, подающие свет в Крым https://t.co/tmbpGf2zHX https://t.co/pQGl9TzKhz",Unknown,Ukrainian,2015-11-20 10:54:00,2015-11-20 10:54:00,1665,260,2298,R,1
spearmintme,Захватившие отель в Мали освободили несколько заложников  https://t.co/7v3sqv5rWJ https://t.co/i1XPYiSOA9,Unknown,Russian,2015-11-20 11:16:00,2015-11-20 11:16:00,1665,260,2299,R,1
spearmintme,ВИДЕО. Столкновения между противниками саммита АТЭС и полицией  https://t.co/NZnKBMwiOe https://t.co/3cjFD7DYwE,Unknown,Russian,2015-11-20 13:02:00,2015-11-20 13:03:00,1665,260,2300,R,1
spearmintme,"Ташуев: не ощущаю, что в «Кубани» есть серьёзные финансовые сложности https://t.co/dW4pMM1VXi",Unknown,Russian,2015-11-20 15:32:00,2015-11-20 15:33:00,1665,260,2302,R,1
spearmintme,".@GandziaPL @mod_russia @bukarolbu чучело, наши еще во Великую Отчественную писали https://t.co/2hhrMOO7ZK",Unknown,Russian,2015-11-20 16:36:00,2015-11-20 16:37:00,1665,260,2304,R,1
spearmintme,В Донецк приезжают звезды мирового балета (видео) https://t.co/o8khJDKMNF,Unknown,Russian,2015-11-20 17:53:00,2015-11-20 17:54:00,1665,260,2305,R,1
spearmintme,Госдеп обсудит дальнейшие планы с послами из стран коалиции против ИГ https://t.co/zz0xFeMCP3 © AP Photo/ Alvarez https://t.co/GRXTPPdkZ5,Unknown,Russian,2015-11-20 21:14:00,2015-11-20 21:15:00,1665,260,2306,R,1
spearmintme,Вертолет с семью пассажирами на борту разбился в Новой Зеландии https://t.co/YqmMgiA89i https://t.co/YqNasVpQAU,Unknown,Russian,2015-11-21 02:32:00,2015-11-21 02:33:00,1665,261,2307,R,1
spearmintme,Власти Мали назвали число погибших в результате нападения на отель  https://t.co/jQnxmhEMgv https://t.co/PfUzT95lAK,Unknown,Russian,2015-11-21 06:13:00,2015-11-21 06:13:00,1665,261,2309,R,1
spearmintme,"У меня прадед слесарем получал почти 40р в паравозном депо в 1911, содержал 6 человек. Поэтому жыдовский переворот 17 - не мой праздник!",Unknown,Russian,2015-11-21 10:34:00,2015-11-21 10:34:00,1665,261,2312,R,1
spearmintme,"Капитан «Уотфорда» пригласил на матч с ""Манчестер Юнайтед"" бывших сокамерников https://t.co/rwqKyCr8mT",Unknown,Russian,2015-11-21 12:12:00,2015-11-21 12:14:00,1665,261,2314,R,1
spearmintme,сбежал в армию от коллекторов. отслужил в ВДВ. теперь коллекторы бегают от меня,Unknown,Russian,2015-11-21 13:54:00,2015-11-21 13:54:00,1665,261,2315,R,1
spearmintme,Марио Фернандес готов подумать о возможности играть за сборную РФ по футболу https://t.co/w7mpa3laMg https://t.co/E6kJZPFrJi,Unknown,Russian,2015-11-21 15:13:00,2015-11-21 15:13:00,1665,261,2318,R,1
spearmintme,Финляндия предложила России запретить пересекать границу на велосипеде https://t.co/A47acb0leQ https://t.co/LWZaanFKPJ,Unknown,Russian,2015-11-21 18:55:00,2015-11-21 18:55:00,1665,261,2320,R,1
spearmintme,«Барселона» уничтожила «Реал» #ElClasico  https://t.co/98yspInvyJ https://t.co/qiS0hT9SyH,Unknown,Macedonian,2015-11-21 20:14:00,2015-11-21 20:14:00,1665,261,2321,R,1
spearmintme,Reuters сообщило о продлении санкций против России на полгода: https://t.co/S1mmOk4KPE,Unknown,Russian,2015-11-21 23:36:00,2015-11-21 23:36:00,1665,261,2322,R,1
spearmintme,Французский авианосец «Шарль де Голль» начнет операцию в Сирии с понедельника https://t.co/Ti8kItTk6v https://t.co/K45DC0oQeb,Unknown,Russian,2015-11-22 10:36:00,2015-11-22 10:36:00,1665,261,2324,R,1
spearmintme,Крымские малыши отправляются на вынужденные каникулы https://t.co/MuqvmlCVd8,Unknown,Russian,2015-11-22 12:15:00,2015-11-22 12:15:00,1665,261,2327,R,1
spearmintme,Глава МВД Германии против участия бундесвера в борьбе с терроризмом в стране https://t.co/t8T12dHjpV,Unknown,Russian,2015-11-22 12:33:00,2015-11-22 12:33:00,1665,261,2328,R,1
spearmintme,Почему Латвия отказалась вооружать полицейских  https://t.co/sDxYZfJDkF https://t.co/sqyfRs3PkN,Unknown,Russian,2015-11-22 14:51:00,2015-11-22 14:51:00,1665,261,2331,R,1
spearmintme,Высший уровень антитеррористической готовности в Брюсселе продлен до понедельника  https://t.co/UgjCPxNFq5,Unknown,Russian,2015-11-22 18:53:00,2015-11-22 18:53:00,1665,261,2332,R,1
spearmintme,КНР и Минвостокразвития намерены работать над транспортными коридорами https://t.co/A3WreaSOzQ https://t.co/Zg4HYYWevl,Unknown,Russian,2015-11-23 05:33:00,2015-11-23 05:33:00,1665,261,2333,R,1
spearmintme,Рубль снизился к доллару и евро  https://t.co/TcpU53SOPM https://t.co/c28yWbpFGD,Unknown,Russian,2015-11-23 07:52:00,2015-11-23 08:03:00,1665,261,2334,R,1
spearmintme,Южная Корея начала учения в Желтом море у спорной границы с КНДР https://t.co/S0d8g0y6ig © AP Photo/ Lee Jin-man https://t.co/n3FUMim3Ho,Unknown,Russian,2015-11-23 08:54:00,2015-11-23 08:55:00,1665,261,2335,R,1
spearmintme,ОБСЕ заявляет об обстреле поселка в ЛНР из миномета https://t.co/gDGQAyMUSk https://t.co/grU1YTgfiN,Unknown,Russian,2015-11-23 13:13:00,2015-11-23 13:13:00,1665,261,2338,R,1
spearmintme,СМИ: не менее четырех террористов прибыли в Бельгию под видом беженцев https://t.co/JgrRTDJCcs https://t.co/MW7KIkOr2F,Unknown,Russian,2015-11-23 14:16:00,2015-11-23 14:16:00,1665,261,2339,R,1
spearmintme,Путин рассказал об использовании неба над Каспием для борьбы с ИГ https://t.co/BGF6b3CAdu https://t.co/1PdgErVAyX,Unknown,Russian,2015-11-23 15:52:00,2015-11-23 15:52:00,1665,261,2340,R,1
spearmintme,Комитет по этике ФИФА начал расследование сделки Блаттера с Платини   https://t.co/vWu1AhYPAR,Unknown,Russian,2015-11-23 16:18:00,2015-11-23 16:18:00,1665,261,2342,R,1
spearmintme,Написали про самые главные скандалы с допингом в России. Даже Егора Титова вспомнили!    https://t.co/Gzj88IyWGp,Unknown,Russian,2015-11-23 16:38:00,2015-11-23 16:44:00,1665,261,2343,R,1
spearmintme,Удары авианосца «Шарль де Голль» уничтожили два объекта ИГ в Ираке https://t.co/h1p5HSNIMp https://t.co/pRXJ0uQCpw,Unknown,Russian,2015-11-23 17:35:00,2015-11-23 17:37:00,1665,261,2344,R,1
spearmintme,"Моуринью: предпочитаю говорить о «Реале» тогда, когда он побеждает https://t.co/gvXClqpW8l",Unknown,Russian,2015-11-23 18:15:00,2015-11-23 18:15:00,1665,261,2345,R,1
spearmintme,США не могут подтвердить поставки российских комплексов С-300 в Иран https://t.co/OLVsyNNQFk © AP Photo https://t.co/cX7pDSJBJ4,Unknown,Russian,2015-11-23 21:56:00,2015-11-23 21:56:00,1665,260,2347,R,1
spearmintme,NI: военное сотрудничество России и Франции станет кошмаром для террористов https://t.co/opwLBdqCvw https://t.co/55Nn1lVonF,Unknown,Russian,2015-11-24 00:33:00,2015-11-24 00:33:00,1665,260,2348,R,1
spearmintme,Семья арестованного за самодельные часы школьника требует $15 млн компенсации https://t.co/YitLGz1j4C,Unknown,Russian,2015-11-24 02:55:00,2015-11-24 02:55:00,1665,260,2350,R,1
spearmintme,Мигранты в Греции зашили рты в знак протеста против закрытия границы https://t.co/7iLpvLoGyU,Unknown,Russian,2015-11-24 05:17:00,2015-11-24 05:38:00,1665,260,2352,R,1
spearmintme,Ядерный чемоданчик https://t.co/oOxYN9X6m2,Unknown,Russian,2015-11-24 07:36:00,2015-11-24 07:36:00,1665,260,2353,R,1
spearmintme,Пенсионерка погибла после прыжка на крышу поезда в  московском метро https://t.co/TcCv7TaJGo https://t.co/wgPxDr4qbO,Unknown,Russian,2015-11-24 08:35:00,2015-11-24 08:36:00,1665,260,2355,R,1
spearmintme,Рынок акций и рубль сдержанно реагируют на крушение Су-24 в Сирии https://t.co/zQ8UDN8TfQ https://t.co/bmDBsbH3rA,Unknown,Russian,2015-11-24 10:14:00,2015-11-24 10:14:00,1665,260,2357,R,1
spearmintme,"В хронике по сбитому самолету можно подписаться на пуш-уведомления, очень удобная тема https://t.co/ltpwarIfbQ",Unknown,Russian,2015-11-24 10:35:00,2015-11-24 10:35:00,1665,260,2358,R,1
spearmintme,CNN Turk опубликовала траекторию сбитого на границе с Турцией Су-24 https://t.co/4r75iAlIco,Unknown,Russian,2015-11-24 13:13:00,2015-11-24 13:14:00,1665,260,2360,R,1
spearmintme,Власти Швеции будут размещать мигрантов на воде  https://t.co/kmaw2UL5S9 https://t.co/ZUCLjFNw1r,Unknown,Russian,2015-11-24 13:16:00,2015-11-24 13:16:00,1665,260,2361,R,1
spearmintme,Еще одно видео погибшего летчика опубликовано в сети. Пользователи узнали в нем Сергея Румян https://t.co/NY3zhCNHKc https://t.co/FHruw0nKBm,Unknown,Russian,2015-11-24 13:54:00,2015-11-24 13:54:00,1665,260,2362,R,1
spearmintme,Минобороны: анализ данных подтвердил отсутствие нарушения воздушного пространства Турции https://t.co/tXpUH2yfSS,Unknown,Russian,2015-11-24 14:16:00,2015-11-24 14:17:00,1665,260,2363,R,1
spearmintme,Обама в ярости: Олланд вышел из под контроля https://t.co/7Rloubulak https://t.co/B5vC4ZFgHR,Unknown,Russian,2015-11-24 14:55:00,2015-11-24 14:56:00,1665,260,2364,R,1
spearmintme,Кремль не располагает официальной информацией о судьбе экипажа Су-24 https://t.co/wAzfTrsHxq #СУ24 #УдарВСпину https://t.co/gbsj6gMsC3,Unknown,Russian,2015-11-24 17:13:00,2015-11-24 17:13:00,1665,260,2365,R,1
spearmintme,Дмитрий Песков: Действия Турции вызывают жёсткое возмущение и разочарование  https://t.co/O6QIGEVaZN https://t.co/cdeDSv5kxt,Unknown,Russian,2015-11-24 17:33:00,2015-11-24 17:39:00,1665,260,2366,R,1
spearmintme,НАТО сделало заявление по России и Турции  https://t.co/tyPQl1pw0U https://t.co/fJhX3yVntJ,Unknown,Russian,2015-11-24 19:51:00,2015-11-24 19:52:00,1665,260,2368,R,1
spearmintme,"Эрдоган заявил, что российский Су-24 был сбит в рамках правил реагирования на угрозы https://t.co/WksXMgPPdd",Unknown,Russian,2015-11-24 20:19:00,2015-11-24 20:24:00,1665,260,2369,R,1
spearmintme,Минобороны России обнародовало траекторию полета сбитого Су-24 https://t.co/RWpyGE8pvj,Unknown,Russian,2015-11-24 21:32:00,2015-11-24 21:32:00,1665,260,2370,R,1
spearmintme,Афганские талибы сбили молдавский вертолет https://t.co/7kEfdyvJfU,Unknown,Russian,2015-11-24 23:11:00,2015-11-24 23:11:00,1665,260,2371,R,1
spearmintme,Кто бы сомневался https://t.co/XTYH1RHBu0,Unknown,Russian,2015-11-25 03:44:00,2015-11-25 03:44:00,1665,260,2372,R,1
spearmintme,Посол РФ во Франции: Россия готова к созданию единого центра для борьбы с ИГ https://t.co/CTg5aS6bAP https://t.co/BpKIxbsY4b,Unknown,Russian,2015-11-25 09:42:00,2015-11-25 09:42:00,1665,260,2373,R,1
spearmintme,Полиция Украины: два человека ранены в результате обстрела Марьинки https://t.co/wPdheN3rw9 https://t.co/rA7fkia4SE,Unknown,Russian,2015-11-25 15:54:00,2015-11-25 15:54:00,1665,260,2375,R,1
spearmintme,Семь человек погибли при лобовом столкновении микроавтобусов в Иркутской области https://t.co/UCk0NKC04i,Unknown,Russian,2015-11-25 21:33:00,2015-11-25 21:33:00,1665,260,2379,R,1
spearmintme,Интерпол объявил в розыск двух подозреваемых по делу терактов в Париже https://t.co/O8OkYI6OQ2 https://t.co/VdgmGswDOx,Unknown,Russian,2015-11-26 00:10:00,2015-11-26 00:10:00,1665,260,2380,R,1
spearmintme,Два лица премьера Турции: Риторика до и после атаки на Су-24 https://t.co/kjq3J77314 https://t.co/u01ENTOghE,Unknown,Serbian,2015-11-26 06:19:00,2015-11-26 06:24:00,1665,260,2381,R,1
spearmintme,В транспортной прокуратуре уточнили число жертв крушения Ми-8 https://t.co/GhTBGSQZ1L,Unknown,Russian,2015-11-26 07:32:00,2015-11-26 07:32:00,1665,260,2382,R,1
spearmintme,Более 800 кг продукции из Турции изъято из оборота с начала 2015 года https://t.co/E4MoBF09Pn https://t.co/Y9PrW8ZJS6,Unknown,Russian,2015-11-26 10:14:00,2015-11-26 10:15:00,1665,259,2383,R,1
spearmintme,Для водителей могут ввести обязательные работы за повторную езду без прав  https://t.co/fi7z9TLrtX,Unknown,Russian,2015-11-26 12:01:00,2015-11-26 12:02:00,1665,259,2384,R,1
spearmintme,СМИ: В Сирию прибыли 50 военнослужащих армии США  https://t.co/y4Lg1qgswg,Unknown,Russian,2015-11-26 13:16:00,2015-11-26 13:19:00,1665,260,2385,R,1
spearmintme,"Мария Захарова - Анкаре: Вы что, с ума сошли?  https://t.co/XavFsNE2EQ https://t.co/eWP4Gp9cR7",Unknown,Bulgarian,2015-11-26 13:40:00,2015-11-26 13:44:00,1665,260,2386,R,1
spearmintme,"Евродепутат: Турции, мягко говоря, давно пора надрать уши (ВИДЕО)  https://t.co/B0XQMr9T4Q https://t.co/BcsfiBTkno",Unknown,Russian,2015-11-26 16:37:00,2015-11-26 16:37:00,1665,260,2387,R,1
spearmintme,Фоторепортаж. ЗРК С-400 заступил на боевое дежурство: https://t.co/HTjd8v2ImN https://t.co/Z7gs8v9vzY,Unknown,Russian,2015-11-26 17:36:00,2015-11-26 17:36:00,1665,260,2388,R,1
spearmintme,Олланд о роли Асада в будущем Сирии   https://t.co/0ZxHBx0ys2 https://t.co/8cU51nz0vG,Unknown,Russian,2015-11-26 21:14:00,2015-11-26 21:15:00,1665,260,2389,R,1
spearmintme,Полиция Берлина задержала двух человек в ходе антитеррористических рейдов https://t.co/OoYoM7OGg2,Unknown,Russian,2015-11-27 05:32:00,2015-11-27 05:32:00,1665,260,2391,R,1
spearmintme,«Нижегородское метро» закупит более 100 т рельсов https://t.co/H3BqHd14Ii,Unknown,Russian,2015-11-27 06:40:00,2015-11-27 06:40:00,1665,260,2392,R,1
spearmintme,Песков: только ВС САР могут проводить наземную операцию в Сирии https://t.co/jllMmy31Xx https://t.co/V7TIudq2vj,Unknown,Russian,2015-11-27 12:17:00,2015-11-27 12:17:00,1665,260,2397,R,1
spearmintme,"в армии яблоко от яблони падает на столько, на сколько Шойгу прикажет",Unknown,Russian,2015-11-27 12:20:00,2015-11-27 12:20:00,1665,260,2398,R,1
spearmintme,Франция допустила сотрудничество с армией Асада в борьбе с ИГИЛ https://t.co/qvs8JOHDOd,Unknown,Bulgarian,2015-11-27 19:00:00,2015-11-27 19:00:00,1665,260,2402,R,1
spearmintme,Власти США прекращают слежку за американцами  https://t.co/jIA09XW7kC https://t.co/cTEoq3Olvl,Unknown,Russian,2015-11-28 04:56:00,2015-11-28 04:56:00,1665,260,2403,R,1
spearmintme,Песков заявил о заинтересованности семьи Эрдогана в нефтяном бизнесе https://t.co/aQS2fnUeaY,Unknown,Russian,2015-11-28 08:19:00,2015-11-28 08:19:00,1665,260,2404,R,1
spearmintme,СМИ: меры экстренной безопасности стоили Брюсселю 52 млн евро в день https://t.co/SLmkboe6qQ https://t.co/c4NgRzmRs5,Unknown,Russian,2015-11-28 10:23:00,2015-11-28 10:23:00,1665,260,2405,R,1
spearmintme,Российскому певцу Сергею Пенкину запретили въезд на Украину https://t.co/HovcbOkM09,Unknown,Russian,2015-11-28 16:16:00,2015-11-28 16:16:00,1665,260,2408,R,1
spearmintme,Открытое письмо экс-министра США ко всем украинцам   https://t.co/PqvB4NH1vn . • ° #США #политика #Россия https://t.co/BnX32NQhx6,Unknown,Russian,2015-11-28 16:54:00,2015-11-28 16:54:00,1665,260,2409,R,1
spearmintme,"Эрдоган очень непредсказуемый, он может сдаться в любой момент",Unknown,Russian,2015-11-28 17:31:00,2015-11-28 17:32:00,1665,260,2410,R,1
spearmintme,В Донецке построят абсолютно новую улицу https://t.co/3inUz7I4vJ,Unknown,Serbian,2015-11-28 18:56:00,2015-11-28 18:56:00,1665,260,2411,R,1
spearmintme,Евросоюз и Турция приняли план действий по миграции  https://t.co/rrLlhBC2yA,Unknown,Russian,2015-11-29 20:57:00,2015-11-29 20:57:00,1664,260,2418,R,1
spearmintme,В Испании прошёл митинг в поддержку действий РФ по борьбе с терроризмом  https://t.co/7GGmiama7I,Unknown,Russian,2015-11-29 22:12:00,2015-11-29 22:16:00,1664,260,2419,R,1
spearmintme,Тело погибшего пилота Су-24 отправили из Турции в Россию https://t.co/R7GbGVUPEb,Unknown,Russian,2015-11-30 11:00:00,2015-11-30 11:00:00,1664,260,2420,R,1
spearmintme,Автоконцерн Geely покидает Россию https://t.co/LmaiSnbDD6 https://t.co/cM3HSqpsJB,Unknown,Russian,2015-11-30 11:42:00,2015-11-30 11:42:00,1664,260,2421,R,1
spearmintme,«Зенит» рассматривает кандидатуру Бердыева на пост главного тренера https://t.co/3shZTuXfjl,Unknown,Russian,2015-11-30 14:15:00,2015-11-30 14:15:00,1664,260,2422,R,1
spearmintme,Голосование об участии Британии в операции в Сирии пройдет в среду https://t.co/5MC7RD9YH9 https://t.co/qDNeHwK30n,Unknown,Russian,2015-11-30 22:39:00,2015-11-30 22:39:00,1664,260,2425,R,1
spearmintme,#Осознание@rus_improvisation https://t.co/9IJuP05KRr,Unknown,Russian,2015-12-01 01:53:00,2015-12-01 01:53:00,1664,260,2425,R,1
spearmintme,Достану и в зоне https://t.co/HS3kcv6sbX,Unknown,Serbian,2015-12-01 09:37:00,2015-12-01 09:37:00,1664,260,2427,R,1
spearmintme,"Приходят сообщения о крушении двух вертолётов с номерами ""...927"" и ""...930"" на севере Латакии  /  / #Сирия #Syria",Unknown,Russian,2015-12-02 13:13:00,2015-12-02 13:13:00,1664,260,2428,R,1
spearmintme,Японский принц Микаса празднует столетний юбилей https://t.co/iDeBh3qoCy,Unknown,Russian,2015-12-02 13:14:00,2015-12-02 13:14:00,1664,260,2429,R,1
spearmintme,Власти США назовут имена 16 новых обвиняемых в коррупции членов ФИФА https://t.co/jE5Mha8KRa,Unknown,Russian,2015-12-03 17:13:00,2015-12-03 17:13:00,1664,260,2436,R,1
spearmintme,"Прогноз Moody's по гособлигациям России сменился на ""стабильный"" https://t.co/XqQ5raaPjS",Unknown,Russian,2015-12-03 23:23:00,2015-12-03 23:23:00,1664,260,2438,R,1
spearmintme,"Евгении Васильевой вернули картины, ну слава богу, а то мы переживали  https://t.co/XcmhCXmSdo",Unknown,Russian,2015-12-04 06:44:00,2015-12-04 06:44:00,1664,260,2439,R,1
spearmintme,В Уфе за три года установлено почти 5000 светильников https://t.co/bdswTRBn7V,Unknown,Ukrainian,2015-12-04 07:58:00,2015-12-04 07:58:00,1664,260,2440,R,1
spearmintme,"Тот случай, когда ""элиту нации"" трахают бывший охранник и мойщик с автомойки ))) @poroshenko https://t.co/loEowuP0BS",Unknown,Russian,2015-12-04 14:57:00,2015-12-04 14:57:00,1664,261,2445,R,1
spearmintme,Утвержден состав Координационного совета по развитию туризма в России https://t.co/aEAvSnFv8F https://t.co/dWQ6MEsfBM,Unknown,Russian,2015-12-06 07:51:00,2015-12-06 07:51:00,1664,261,2449,R,1
spearmintme,В одном из убитых в Сирии боевиков ИГИЛ узнали уроженца Белоруссии  В Сирии убит член группи https://t.co/xvcdyHJ4gh https://t.co/rbfSGdUJQA,Unknown,Russian,2015-12-07 01:52:00,2015-12-07 01:53:00,1664,262,2452,R,1
spearmintme,СМИ: предложен новый порядок уничтожения контрабандной одежды в России https://t.co/WVg63eFeG1 https://t.co/y57pjQusei,Unknown,Russian,2015-12-07 05:54:00,2015-12-07 05:54:00,1664,262,2453,R,1
spearmintme,"Глава Ростуризма, у которого нашли недвижимость на Сейшелах, рассказал нам, что вообще-то свою виллу он уже продал   https://t.co/A8y49rxH3f",Unknown,Russian,2015-12-07 11:15:00,2015-12-07 11:15:00,1664,262,2455,R,1
spearmintme,США намерены продолжать санкции против РФ  https://t.co/ARDOtknOfX https://t.co/lMbJIWFG7Y,Unknown,Russian,2015-12-07 12:35:00,2015-12-07 12:35:00,1664,262,2456,R,1
spearmintme,"Киев отправляет на Донбасс новые бронемашины спецназа для испытаний в спецоперации (ФОТО, ВИ https://t.co/DqFzhzEXmq https://t.co/pUItzMdDnU",Unknown,Russian,2015-12-08 02:32:00,2015-12-08 02:32:00,1664,261,2457,R,1
spearmintme,"Киев перебросил к линии фронта личный состав, семь танков и 20 «Градов» https://t.co/hLMmDVPhEJ",Unknown,Russian,2015-12-08 13:53:00,2015-12-08 13:53:00,1664,261,2462,R,1
spearmintme,МИД отреагировал на ситуацию с кораблем РФ в Босфоре  https://t.co/DOo4wFs30L https://t.co/FPi5SDfQ33,Unknown,Russian,2015-12-08 16:22:00,2015-12-08 16:22:00,1664,261,2463,R,1
spearmintme,Washington Post: ИГ заманивает Россию и США на свою территорию  https://t.co/JoTbFMqN8r,Unknown,Russian,2015-12-08 19:56:00,2015-12-08 19:56:00,1664,261,2467,R,1
spearmintme,"Нашел для @n_barmaleykina 250 000  патриотов Новороссии, готовых по первому ее приказу дойти до Киева. #уНасКредиты https://t.co/wBtGeTtTN3",Unknown,Russian,2015-12-09 04:12:00,2015-12-09 04:13:00,1664,261,2470,R,1
spearmintme,Сотни человек приняли участие в концерте памяти Джона Леннона в Нью-Йорке https://t.co/lmdAKAPN0n,Unknown,Russian,2015-12-09 08:13:00,2015-12-09 08:13:00,1664,261,2471,R,1
spearmintme,Охранника Шепелева после нападения экстренно прооперировали: https://t.co/SzD6hTCW1J #звезды #Фриске https://t.co/lDJdRDFgRn,Unknown,Russian,2015-12-09 14:11:00,2015-12-09 14:11:00,1664,260,2473,R,1
spearmintme,Поиски пропавших в Каспии нефтяников могут затянуться на 15 дней https://t.co/E5uzWZLliS,Unknown,Russian,2015-12-09 19:06:00,2015-12-09 19:07:00,1664,260,2475,R,1
spearmintme,Электроснабжение обесточенных после аварии районов Крыма восстановлено https://t.co/h8grI43PG9 #крым,Unknown,Russian,2015-12-10 01:15:00,2015-12-10 01:15:00,1664,260,2478,R,1
spearmintme,Как отдыхает трезвая молодёжь Сургута   https://t.co/rEnCazsgbO #Осознание@rus_improvisation #Здоровье@rus_improvi... https://t.co/gcViOsd5T3,Unknown,Russian,2015-12-10 17:22:00,2015-12-10 17:22:00,1665,261,2480,R,1
