author_id,content,region,language,publish_date,harvested_date,following,followers,updates,post_type,retweet
speakoroff405,Что за вокзал?? 18+ https://t.co/flznIKmKsC,Unknown,Ukrainian,2016-08-08 02:10:00,2016-08-08 02:13:00,42,4,1,,0
speakoroff405,Модель Alessandra ♥ Victoria's Secret приняла участие в эстафете олимпийского огня в РИО https://t.co/KVwXyUvD5g,Unknown,Russian,2016-08-10 19:30:00,2016-08-10 19:30:00,42,6,21,,0
speakoroff405,"Яхтсмены или буржуи? Путешествие, как оно было. Яхта без иллюзий! https://t.co/8oUJIqrUMo",Unknown,Russian,2016-08-11 18:13:00,2016-08-11 18:14:00,42,5,37,,0
speakoroff405,"В Московском метро абсолютно голая девушка провоцировала правоохранителей, принимая откровенные позы https://t.co/YKBHyfIEOR",Unknown,Russian,2016-08-11 18:13:00,2016-08-11 18:13:00,42,5,36,,0
speakoroff405,Правильный ракурс 18+ https://t.co/1j3XQIo0w3,Unknown,Russian,2016-08-12 02:05:00,2016-08-12 02:08:00,42,5,45,,0
speakoroff405,Кара Делевинь для Esquire https://t.co/tgPr1mPw9Z,Unknown,Ukrainian,2016-08-12 02:11:00,2016-08-12 02:11:00,42,5,50,,0
speakoroff405,Toyota Sprinter Trueno 1986 https://t.co/DRn8XUOnVb,Unknown,Ukrainian,2016-08-13 15:30:00,2016-08-13 15:31:00,42,5,59,,0
speakoroff405,Elsa Hosk ♥ Victoria's Secret https://t.co/Qr3OeJE1TK,Unknown,English,2016-08-14 18:28:00,2016-08-14 18:28:00,42,5,67,,0
speakoroff405,Утренняя эротика. Всем хорошего настроения) https://t.co/TgL24m01r4,Unknown,Russian,2016-08-15 02:21:00,2016-08-15 02:24:00,42,5,76,,0
speakoroff405,Черно-белая подборка 18+ https://t.co/mkH1IkZhr6,Unknown,Serbian,2016-08-15 02:22:00,2016-08-15 02:24:00,42,5,77,,0
speakoroff405,Мириам Гесснер обнажилась для Playboy https://t.co/JQz4KquqPg,Unknown,Ukrainian,2016-08-15 18:11:00,2016-08-15 18:11:00,42,4,84,,0
speakoroff405,Попочки 18+ https://t.co/fgeeVw3Zx4,Unknown,Ukrainian,2016-08-19 02:25:00,2016-08-19 02:27:00,42,3,124,,0
speakoroff405,Девушка пристрастилась к жеванию грязных подгузников https://t.co/V1FolRqtM5,Unknown,Russian,2016-08-19 02:25:00,2016-08-19 02:25:00,42,3,123,,0
speakoroff405,Sara Sampaio- ANGELS VICTORIA'S SECRET https://t.co/kTGAO23Ry5,Unknown,Ukrainian,2016-08-19 18:18:00,2016-08-19 18:18:00,42,3,135,,0
speakoroff405,"8 мужчин, ради которых стоит смотреть Олимпийские игры, даже если спорт неинтересен! https://t.co/s19aKC5cCM",Unknown,Russian,2016-08-19 18:31:00,2016-08-19 18:31:00,42,3,138,,0
speakoroff405,'67 Ford Shelby GT500 https://t.co/I1TCKyCcvE,Unknown,English,2016-08-20 15:30:00,2016-08-20 15:30:00,42,4,152,,0
speakoroff405,В Красноярске парочка занялась сексом на мосту через Енисей: откровенные кадры попали в Интернет https://t.co/HT6ZlP2v7h,Unknown,Russian,2016-08-22 18:14:00,2016-08-22 18:14:00,42,3,159,,0
speakoroff405,5 самых дорогих бра Victoria's Secret https://t.co/wbe99PKDRE,Unknown,Russian,2016-08-22 18:20:00,2016-08-22 18:20:00,42,3,161,,0
speakoroff405,Сексуальная девушка Rihanna 18+ https://t.co/KwFqiJxPjq,Unknown,Russian,2016-08-23 02:14:00,2016-08-23 02:14:00,42,3,172,,0
speakoroff405,Участница проекта Suicide Girls Красотка Annasthesia https://t.co/rTQLE9z4nJ,Unknown,Bulgarian,2016-08-24 02:16:00,2016-08-24 02:16:00,42,3,183,,0
speakoroff405,Милая девушка под псевдонимом Maud из Suicide Girls 18+ https://t.co/wjVaSRvWHV,Unknown,Russian,2016-08-27 02:22:00,2016-08-27 02:22:00,42,2,197,,0
speakoroff405,Участница проекта Suicide Girls Красотка Hollyberry 18+ https://t.co/Fna1j2f3r0,Unknown,Bulgarian,2016-08-28 02:10:00,2016-08-28 02:11:00,42,2,210,,0
speakoroff405,Милая девушка под псевдонимом Maud из Suicide Girls 2 18+ https://t.co/nOMS0mpO0r,Unknown,Russian,2016-08-28 02:19:00,2016-08-28 02:19:00,42,2,213,,0
speakoroff405,Впечатляющий стрит-арт от Maldito Juanito https://t.co/0IAQBRUHdJ,Unknown,Russian,2016-08-30 13:30:00,2016-08-30 13:30:00,42,2,225,,0
speakoroff405,Голожопая акция https://t.co/H50J6oooCt,Unknown,Bulgarian,2016-08-31 02:10:00,2016-08-31 02:10:00,42,2,233,,0
speakoroff405,Афганские женщины-боксеры готовятся к Олимпийским играм 2016 https://t.co/v9Wv7lGvJO,Unknown,Russian,2016-08-31 15:30:00,2016-08-31 15:31:00,42,2,238,,0
speakoroff405,Милая девушка Saria из Suicide Girls https://t.co/RbPRyuf2RN,Unknown,Russian,2016-09-03 18:15:00,2016-09-03 18:15:00,42,3,254,,0
speakoroff405,Милая девушка Saria из Suicide Girls https://t.co/RbPRyuf2RN,Unknown,Russian,2016-09-03 18:15:00,2016-09-03 18:15:00,42,3,254,,0
speakoroff405,Участница проекта Suicide Girls Красотка Azrea https://t.co/N6VEJCUWiJ,Unknown,Bulgarian,2016-09-04 02:17:00,2016-09-04 02:17:00,42,3,261,,0
speakoroff405,Участница проекта Suicide Girls Красотка Azrea https://t.co/N6VEJCUWiJ,Unknown,Bulgarian,2016-09-04 02:17:00,2016-09-04 02:17:00,42,3,261,,0
speakoroff405,Сексуальная девушка Alicesey участница проекта Suicide Girls 18+ https://t.co/Hrofy1x3Yt,Unknown,Russian,2016-09-05 02:10:00,2016-09-05 02:10:00,42,2,270,,0
speakoroff405,Сексуальная девушка Alicesey участница проекта Suicide Girls 18+ https://t.co/Hrofy1x3Yt,Unknown,Russian,2016-09-05 02:10:00,2016-09-05 02:10:00,42,2,270,,0
speakoroff405,Сексуальная девушка под псевдонимом Flowerbomb из Suicide Girls https://t.co/nrCDB21ezy,Unknown,Russian,2016-09-05 02:31:00,2016-09-05 02:31:00,42,3,273,,0
speakoroff405,Сексуальная девушка под псевдонимом Flowerbomb из Suicide Girls https://t.co/nrCDB21ezy,Unknown,Russian,2016-09-05 02:31:00,2016-09-05 02:31:00,42,3,273,,0
speakoroff405,Иллюстратор Joe Webb https://t.co/gxkHqdIbhx,Unknown,Ukrainian,2016-09-05 15:30:00,2016-09-05 15:30:00,42,3,275,,0
speakoroff405,Иллюстратор Joe Webb https://t.co/gxkHqdIbhx,Unknown,Ukrainian,2016-09-05 15:30:00,2016-09-05 15:30:00,42,3,275,,0
speakoroff405,Путешествие по России не выходя с ВДНХ https://t.co/ItURHqvDsO,Unknown,Russian,2016-10-05 10:05:00,2016-10-05 10:05:00,42,1,303,,0
speakoroff405,Путешествие по России не выходя с ВДНХ https://t.co/ItURHqvDsO,Unknown,Russian,2016-10-05 10:05:00,2016-10-05 10:05:00,42,1,303,,0
speakoroff405,Серфер из России опубликовал видео с пролежавшей год в море GoPro https://t.co/Nm1srVJaCM,Unknown,Russian,2016-10-06 08:22:00,2016-10-06 08:22:00,42,1,307,,0
speakoroff405,Серфер из России опубликовал видео с пролежавшей год в море GoPro https://t.co/Nm1srVJaCM,Unknown,Russian,2016-10-06 08:22:00,2016-10-06 08:22:00,42,1,307,,0
speakoroff405,Российские ученые зарядили мобильный телефон на расстоянии https://t.co/lynjh1FTag,Unknown,Russian,2016-10-09 06:18:00,2016-10-09 06:18:00,42,1,317,,0
speakoroff405,Российские ученые зарядили мобильный телефон на расстоянии https://t.co/lynjh1FTag,Unknown,Russian,2016-10-09 06:18:00,2016-10-09 06:18:00,42,1,317,,0
speakoroff405,Гавайская авиакомпания взвешивает пассажиров https://t.co/4ijQNkrLLx,Unknown,Russian,2016-10-09 12:55:00,2016-10-09 12:55:00,42,1,321,,0
speakoroff405,Гавайская авиакомпания взвешивает пассажиров https://t.co/4ijQNkrLLx,Unknown,Russian,2016-10-09 12:55:00,2016-10-09 12:55:00,42,1,321,,0
speakoroff405,До релиза Dishonoured 2 осталось две недели! Джём-с.. https://t.co/wE4E1FmJV2,Unknown,Russian,2016-10-13 09:12:00,2016-10-13 09:12:00,42,1,338,,0
speakoroff405,До релиза Dishonoured 2 осталось две недели! Джём-с.. https://t.co/wE4E1FmJV2,Unknown,Russian,2016-10-13 09:12:00,2016-10-13 09:12:00,42,1,338,,0
speakoroff405,"""Цвета утра"" от George Mayer (18+) https://t.co/a20mbs5kkG",Unknown,Russian,2016-10-13 13:50:00,2016-10-13 13:50:00,42,1,346,,0
speakoroff405,"""Цвета утра"" от George Mayer (18+) https://t.co/a20mbs5kkG",Unknown,Russian,2016-10-13 13:50:00,2016-10-13 13:50:00,42,1,346,,0
speakoroff405,Кот-альпинист из Нижнего Тагила отправляется с хозяином в путешествие на Байкал https://t.co/H7HBbSa7s7,Unknown,Russian,2016-10-14 06:36:00,2016-10-14 06:36:00,42,1,362,,0
speakoroff405,Кот-альпинист из Нижнего Тагила отправляется с хозяином в путешествие на Байкал https://t.co/H7HBbSa7s7,Unknown,Russian,2016-10-14 06:36:00,2016-10-14 06:36:00,42,1,362,,0
speakoroff405,"Борис Пайкин, воровство и футбол https://t.co/AcJrXZjxnR",Unknown,Bulgarian,2016-10-14 10:29:00,2016-10-14 10:29:00,42,1,366,,0
speakoroff405,"Борис Пайкин, воровство и футбол https://t.co/AcJrXZjxnR",Unknown,Bulgarian,2016-10-14 10:29:00,2016-10-14 10:29:00,42,1,366,,0
speakoroff405,Противоречивый Евросоюз. Так будут новые санкции или нет? https://t.co/R6HI7OLdgZ,Unknown,Russian,2016-10-17 12:02:00,2016-10-17 12:02:00,42,1,385,,0
speakoroff405,Противоречивый Евросоюз. Так будут новые санкции или нет? https://t.co/R6HI7OLdgZ,Unknown,Russian,2016-10-17 12:02:00,2016-10-17 12:02:00,42,1,385,,0
speakoroff405,Последний сезон Fringe: парадокс без парадокса https://t.co/lwlRsajTJG,Unknown,Serbian,2016-10-18 06:09:00,2016-10-18 06:09:00,42,1,395,,0
speakoroff405,Последний сезон Fringe: парадокс без парадокса https://t.co/lwlRsajTJG,Unknown,Serbian,2016-10-18 06:09:00,2016-10-18 06:09:00,42,1,395,,0
speakoroff405,Звездное небо Новой Зеландии в снимках Jake Scott-Gardner https://t.co/Sa2fiVHPAR,Unknown,Russian,2016-10-21 07:29:00,2016-10-21 07:29:00,42,1,422,,0
speakoroff405,Звездное небо Новой Зеландии в снимках Jake Scott-Gardner https://t.co/Sa2fiVHPAR,Unknown,Russian,2016-10-21 07:29:00,2016-10-21 07:29:00,42,1,422,,0
speakoroff405,Попытка борьбы с интернет-зависимостью https://t.co/2q2X8Wnoof,Unknown,Russian,2016-10-22 11:13:00,2016-10-22 11:14:00,42,1,449,,0
speakoroff405,Попытка борьбы с интернет-зависимостью https://t.co/2q2X8Wnoof,Unknown,Russian,2016-10-22 11:13:00,2016-10-22 11:14:00,42,1,449,,0
speakoroff405,Как стать гражданином космического государства? https://t.co/x7GbINygbn,Unknown,Russian,2016-10-25 06:13:00,2016-10-25 06:13:00,42,1,456,,0
speakoroff405,Как стать гражданином космического государства? https://t.co/x7GbINygbn,Unknown,Russian,2016-10-25 06:13:00,2016-10-25 06:13:00,42,1,456,,0
speakoroff405,Гей-пара из Санкт-Петербурга украсит обложку нового каталога IKEA https://t.co/zCtwk5cD3r,Unknown,Ukrainian,2016-10-26 06:14:00,2016-10-26 06:14:00,42,1,467,,0
speakoroff405,Гей-пара из Санкт-Петербурга украсит обложку нового каталога IKEA https://t.co/zCtwk5cD3r,Unknown,Ukrainian,2016-10-26 06:14:00,2016-10-26 06:14:00,42,1,467,,0
speakoroff405,Владельцы iPhone 7 просверлили в новых телефонах дырку для наушников https://t.co/rOwoQ6TUC4,Unknown,Ukrainian,2016-10-26 07:04:00,2016-10-26 07:05:00,42,1,473,,0
speakoroff405,Владельцы iPhone 7 просверлили в новых телефонах дырку для наушников https://t.co/rOwoQ6TUC4,Unknown,Ukrainian,2016-10-26 07:04:00,2016-10-26 07:05:00,42,1,473,,0
speakoroff405,Новости Украины: страну могут лишит голоса в ООН из-за долгов https://t.co/glo9b51o6n,Unknown,Ukrainian,2016-11-03 16:03:00,2016-11-03 16:03:00,42,2,510,,0
speakoroff405,Лучшие снимки природы от фотографов BBC https://t.co/JldvykcYcG,Unknown,Russian,2016-11-15 06:18:00,2016-11-15 06:18:00,42,2,549,,0
speakoroff405,Начальник ЦСКА Михаил Барышев и олимпийское будущее страны https://t.co/R6RV1fdr1A,Unknown,Russian,2016-11-15 12:35:00,2016-11-15 12:35:00,42,2,553,,0
speakoroff405,Суперлуние 2016 (10 фото) https://t.co/tqRchrluny,Unknown,Ukrainian,2016-11-17 15:52:00,2016-11-17 15:53:00,42,2,559,,0
speakoroff405,"Сегодня в эфир видеосервиса Amazon выйдет новое автошоу Кларксона, Хаммонда и Мэя! https://t.co/YAwhU1nJpe",Unknown,Russian,2016-11-18 06:34:00,2016-11-18 06:35:00,42,2,560,,0
speakoroff405,Названы самые продаваемые автомобили с пробегом в 2016 году https://t.co/ma0y1moEVe,Unknown,Russian,2016-11-18 11:42:00,2016-11-18 11:42:00,42,2,562,,0
speakoroff405,20 000 000 просмотров! Ошеломляющее видео о совместном полете человека и гигантского лайнера Airbus https://t.co/FX07abH3fB,Unknown,Russian,2016-11-21 12:22:00,2016-11-21 12:23:00,42,2,566,,0
speakoroff405,Лучшие фотографии ноября 2016 от National Geographic https://t.co/w6bxcBsxfL,Unknown,Russian,2016-11-22 08:52:00,2016-11-22 08:52:00,42,2,575,,0
speakoroff405,Старый новый Assassin's Creed https://t.co/iYrRqRwSuE,Unknown,Russian,2016-11-22 08:52:00,2016-11-22 08:53:00,42,2,576,,0
speakoroff405,Новости России. Мария Захарова в сотне самых влиятельных женщин https://t.co/kHIHcQTjt5,Unknown,Russian,2016-11-22 15:40:00,2016-11-22 15:42:00,42,2,582,,0
speakoroff405,"Xiaomi призналась, что продает свои смартфоны по себестоимости https://t.co/W2yFE3jkNF",Unknown,Russian,2016-11-27 13:19:00,2016-11-27 13:19:00,42,2,598,,0
speakoroff405,Эксперты МВФ: “Российская экономика показывает все признаки выздоровления” https://t.co/YcEmSHCNYJ,Unknown,Russian,2016-11-30 13:33:00,2016-11-30 13:33:00,42,2,603,,0
speakoroff405,Россия и Украина. Кто же в итоге примет Евровидение-2017? https://t.co/QXIt2lYOid,Unknown,Russian,2016-12-04 07:51:00,2016-12-04 07:51:00,42,2,611,,0
speakoroff405,В Питере - пить! Почему растёт выручка в барах? https://t.co/16L8fM9qNV,Unknown,Russian,2016-12-05 14:36:00,2016-12-05 14:37:00,42,2,620,,0
speakoroff405,Горнолыжные лагеря сезона 2016-2017 https://t.co/HSMObCxNsT,Unknown,Russian,2016-12-05 15:06:00,2016-12-05 15:07:00,42,2,624,,0
speakoroff405,Санкт-Петербург завоевал титул лучшего направления в World Travel Awards https://t.co/O7KdbeIbC7,Unknown,Russian,2016-12-05 15:09:00,2016-12-05 15:09:00,42,2,627,,0
speakoroff405,Вечером футбол же! https://t.co/GyNxiys6zb,Unknown,Bulgarian,2016-12-06 17:51:00,2016-12-06 17:53:00,42,2,636,,0
speakoroff405,"Бросай курить, вставай на лыжи! https://t.co/PbZuC6jo3i",Unknown,Russian,2016-12-09 07:49:00,2016-12-09 07:49:00,42,2,640,,0
speakoroff405,"«Зенит», «Ростов» и «Краснодар» узнали своих соперников в ЛЕ УЕФА https://t.co/JiSYzhtHK9",Unknown,Russian,2016-12-12 13:31:00,2016-12-12 13:31:00,42,2,658,,0
speakoroff405,Реплика Bugatti Veyron всего за 82 000 $ https://t.co/JFJKc8l4W2,Unknown,Russian,2016-12-13 10:07:00,2016-12-13 10:07:00,42,2,665,,0
speakoroff405,"СМИ узнали, какие станции московского метро считаются самыми криминогенными https://t.co/DNZG2r5UJI",Unknown,Russian,2016-12-13 14:05:00,2016-12-13 14:05:00,42,2,671,,0
speakoroff405,"Боуи, Versus Battle и «лабутены»: что искали россияне в Google в 2016 году https://t.co/PXcrjRp40d",Unknown,Russian,2016-12-15 10:40:00,2016-12-15 10:40:00,42,2,675,,0
speakoroff405,"Drink different: судя по эмодзи, только в Apple пьют виски чистым https://t.co/kXtYXTl1vt",Unknown,Russian,2016-12-15 10:51:00,2016-12-15 10:51:00,42,2,676,,0
speakoroff405,"Платья, вызывающие бурный полет мужской фантазии https://t.co/aDZy9MO9N0",Unknown,Russian,2016-12-16 16:48:00,2016-12-16 16:48:00,42,2,682,,0
speakoroff405,«Аэрофлот» запретит перевозку собак с короткой и приплюснутой мордой из-за угрозы их здоровью https://t.co/bE00KtSYsO,Unknown,Ukrainian,2016-12-20 06:46:00,2016-12-20 06:46:00,42,2,691,,0
speakoroff405,127 событий 2016 года на одной иллюстрации https://t.co/iA7wBauOTN,Unknown,Russian,2016-12-21 13:48:00,2016-12-21 13:48:00,42,2,699,,0
speakoroff405,Экономика РФ выстояла и готова к росту в новом году https://t.co/fx6WsdjV8x,Unknown,Russian,2016-12-24 13:11:00,2016-12-24 13:12:00,42,2,708,,0
speakoroff405,Вандал превратил знаменитую надпись Hollywood в Лос-Анджелесе в Hollyweed. Рука Кремля? https://t.co/Ws8IGjlufK,Unknown,Macedonian,2017-01-02 07:40:00,2017-01-02 07:41:00,42,2,742,,0
speakoroff405,"Фотографии, которые заставят поверить в изменение климата даже скептиков https://t.co/jmlwNsmGvc",Unknown,Russian,2017-01-10 06:10:00,2017-01-10 06:10:00,42,1,762,,0
speakoroff405,Девушка и её любимый пёс отправились в кругосветное путешествие на фургоне https://t.co/UbwHra701N,Unknown,Russian,2017-01-10 06:49:00,2017-01-10 06:51:00,42,1,770,,0
speakoroff405,"Russia, Russia, Russia… В США продолжается истерия вокруг России https://t.co/Cnvdgu4x9t",Unknown,Russian,2017-01-14 13:04:00,2017-01-14 13:04:00,42,1,815,,0
speakoroff405,Как выглядит сигнал Wi-Fi? https://t.co/1BWap6hzw0,Unknown,Russian,2017-01-14 15:58:00,2017-01-14 15:58:00,42,1,821,,0
speakoroff405,Скетчбук художника Missy H. Dunaway https://t.co/AfZSAMWxpa,Unknown,Ukrainian,2017-01-17 15:35:00,2017-01-17 15:35:00,42,1,838,,0
speakoroff405,Ученые: диабет отнимает у человека примерно девять лет жизни https://t.co/ScHY6cE0nD,Unknown,Russian,2017-01-18 06:28:00,2017-01-18 06:28:00,42,1,841,,0
speakoroff405,Стильные курцхаары стали звездами в Instagram https://t.co/Gp4hbPR9Hg,Unknown,Russian,2017-01-18 06:29:00,2017-01-18 06:29:00,42,1,844,,0
speakoroff405,"Крайне негативный отзыв о работе ""студии La Grace"" https://t.co/T9DY6doiD8",Unknown,Russian,2017-01-21 15:01:00,2017-01-21 15:01:00,42,1,867,,0
speakoroff405,Westworld: впечатления от половины сезона https://t.co/HqphGOvozI,Unknown,Russian,2017-01-25 06:09:00,2017-01-25 06:09:00,42,1,884,,0
speakoroff405,Технологии против русского менталитета) https://t.co/SsDUlgHBjX,Unknown,Russian,2017-01-25 06:28:00,2017-01-25 06:28:00,42,1,892,,0
speakoroff405,#Hacked: Я твою соцсеть ломал или что скрывают знаменитости (18 фото) https://t.co/paw97nlW9X,Unknown,Russian,2017-02-06 14:54:00,2017-02-06 14:55:00,42,1,911,,0
speakoroff405,"Автоваз вылечил ""детские болезни"" Lada Xray https://t.co/2YYoqmvkoD",Unknown,Russian,2017-02-15 07:21:00,2017-02-15 07:22:00,42,1,946,,0
speakoroff405,Российская экономика получила высокие оценки Moody's https://t.co/pWt1CwsIu7,Unknown,Russian,2017-02-18 12:54:00,2017-02-18 12:55:00,42,1,959,,0
speakoroff405,Филиппинская сеть фастфудов Brick Burger выпустила ко-брендинговую серию бургеров с LEGO https://t.co/bev4MNGKsl,Unknown,Russian,2017-02-22 06:16:00,2017-02-22 06:16:00,42,1,981,,0
speakoroff405,Глава ЦСКА Михаил Барышев: сборная России лидирует в Сочи https://t.co/0aAQh8ybgS,Unknown,Russian,2017-02-27 13:26:00,2017-02-27 13:27:00,42,1,1036,,0
speakoroff405,Белый кит пришелся ко двору https://t.co/pzHECAy5F9,Unknown,Russian,2017-03-01 15:18:00,2017-03-01 15:19:00,42,1,1041,,0
speakoroff405,"Тукану напечатали новый клюв на 3D-принтере, после того, как над ним жестоко поиздевались подростки https://t.co/IY5F1VxMqB",Unknown,Russian,2017-03-02 06:34:00,2017-03-02 06:34:00,42,1,1050,,0
speakoroff405,Пикантная особенность туалета в одном бизнес-центре https://t.co/3TTmFAqNqe,Unknown,Russian,2017-03-06 06:18:00,2017-03-06 06:19:00,42,1,1076,,0
speakoroff405,"Кейт Уинслет для «Vogue» IT, 2015 г. https://t.co/r4vrSL2BPi",Unknown,Ukrainian,2017-03-06 06:20:00,2017-03-06 06:21:00,42,1,1078,,0
speakoroff405,"WikiLeaks обнаружила в Европе ""хакерский центр"" ЦРУ https://t.co/V5KSA7Kh6I",Unknown,Russian,2017-03-07 17:05:00,2017-03-07 17:05:00,42,1,1093,,0
speakoroff405,Логан у https://t.co/VpPAjpJhOb,Unknown,Ukrainian,2017-03-10 06:31:00,2017-03-10 06:31:00,42,1,1100,,0
speakoroff405,Mediatek и TSMC готовятся к производству 12-ядерного чипа по 7-нанометровому техпроцессу https://t.co/zTmLPIMJw4,Unknown,Russian,2017-03-10 13:29:00,2017-03-10 13:30:00,42,1,1104,,0
speakoroff405,Conflict Intellegence Team и Руслан Левиев погрязли в фейках https://t.co/ALJf5IjATW,Unknown,Ukrainian,2017-03-10 16:44:00,2017-03-10 16:44:00,42,1,1106,,0
speakoroff405,Немного о Черном море https://t.co/tswBQB0PFN,Unknown,Russian,2017-03-11 06:22:00,2017-03-11 06:24:00,42,1,1109,,0
speakoroff405,Немецкий журналист: Евросоюз ввел антироссийские санкции не из-за Украины https://t.co/mrLL3TSn8z,Unknown,Ukrainian,2017-03-11 16:48:00,2017-03-11 16:48:00,42,1,1119,,0
speakoroff405,"Huawei заявляет, что их собственные SoC Kirin значительно технологичнее процессоров Intel https://t.co/9HtCYnRMbr",Unknown,Russian,2017-03-14 11:28:00,2017-03-14 11:28:00,42,1,1132,,0
speakoroff405,Conflict Intellegence Team продолжает клепать фейки https://t.co/vl1GdGZ2dL,Unknown,Russian,2017-03-14 15:49:00,2017-03-14 15:49:00,42,1,1135,,0
speakoroff405,Panic! At The Disco: Victorious https://t.co/8ahhQUyj9A,Unknown,English,2017-03-15 14:03:00,2017-03-15 14:03:00,42,1,1146,,0
speakoroff405,В США за налоговую декларацию Трампа предложили $5 млн https://t.co/5JoKqRa0W8,Unknown,Ukrainian,2017-03-15 14:18:00,2017-03-15 14:20:00,42,1,1147,,0
speakoroff405,Артемий Лебедев сделал дизайн кроссовок для Nike https://t.co/1RUEV9Jv1z,Unknown,Ukrainian,2017-03-18 06:34:00,2017-03-18 06:34:00,42,1,1157,,0
speakoroff405,Количество выпитого кофе влияет на размер женской груди https://t.co/nUwSLv5M2u,Unknown,Russian,2017-03-19 06:16:00,2017-03-19 06:17:00,42,1,1175,,0
speakoroff405,Стоит ли женщинам пить кофе? https://t.co/IJ9DUVDjYW,Unknown,Russian,2017-03-27 06:13:00,2017-03-27 06:13:00,42,0,1235,,0
speakoroff405,Microsoft и рабы его https://t.co/dGmDJ4ae7t,Unknown,Russian,2017-03-27 06:17:00,2017-03-27 06:18:00,42,0,1241,,0
speakoroff405,"В ЕС ждут, когда Россия вернется в G8 https://t.co/YIOm6j9Kpk",Unknown,Russian,2017-03-27 08:39:00,2017-03-27 08:39:00,42,0,1246,,0
speakoroff405,Собака загрызла своего хозяина во время съемок телепрограммы BBC https://t.co/b1LoVHJi97,Unknown,Russian,2017-03-29 13:38:00,2017-03-29 13:39:00,42,0,1253,,0
speakoroff405,Российские ученые разработали уникальный шоколад с водорослями https://t.co/nu0oKHUHiC,Unknown,Russian,2017-03-30 06:29:00,2017-03-30 06:29:00,42,0,1262,,0
speakoroff405,Plane https://t.co/V50m4vFhrr,Unknown,Ukrainian,2017-03-30 06:35:00,2017-03-30 06:35:00,42,0,1264,,0
speakoroff405,Хакерская работа ЦРУ: подробности у WikiLeaks https://t.co/yannXorDN9,Unknown,Russian,2017-03-31 12:57:00,2017-03-31 12:57:00,42,0,1284,,0
