author_id,content,region,language,publish_date,harvested_date,following,followers,updates,post_type,retweet
spearmintme,"Новый спутник ""Глонасс-М"" выведут на орбиту для замены спутника-""пенсионера""  https://t.co/SlaSSRc4mG",Unknown,Russian,2015-10-26 06:55:00,2015-10-26 06:55:00,1669,259,2100,R,1
spearmintme,Анчелотти: между Роналду и Бэйлом нет проблем https://t.co/zRRy5BH0Yi,Unknown,Russian,2015-10-26 08:16:00,2015-10-26 08:16:00,1669,258,2102,R,1
spearmintme,Песков не стал комментировать украинские выборы https://t.co/JxJ9mqz49t,Unknown,Russian,2015-10-26 10:13:00,2015-10-26 10:13:00,1669,258,2104,R,1
spearmintme,В Пакистане и Афганистане произошли два землетрясения магнитудой выше 7 баллов #новости https://t.co/F90dcNJach,Unknown,Russian,2015-10-26 10:15:00,2015-10-26 10:15:00,1669,258,2105,R,1
spearmintme,ФАС возбудила дело против издательства Conde Nast за рекламу шоппинг-фестиваля Colins https://t.co/mftbDHSc2J,Unknown,Russian,2015-10-26 11:52:00,2015-10-26 11:52:00,1669,259,2106,R,1
spearmintme,Число жертв землетрясения в Азии достигло 260 https://t.co/rPjWCfxI4h,Unknown,Russian,2015-10-26 20:12:00,2015-10-26 20:12:00,1668,259,2107,R,1
spearmintme,ВИДЕО. Медведь напугал жителей Нью-Джерси  https://t.co/qpTISacm49 https://t.co/0i7xfAeMHr,Unknown,Russian,2015-10-27 12:54:00,2015-10-27 12:54:00,1667,258,2108,R,1
spearmintme,Сергей Шнуров станет ведущим на «Матч ТВ» https://t.co/LTFozvVEkw,Unknown,Russian,2015-10-27 15:56:00,2015-10-27 15:56:00,1667,258,2109,R,1
spearmintme,"У бывших компаний Ротенберга и Тимченко застряли деньги в Нота-банке, а Lifenews успели вывести https://t.co/C4utT6xzcI",Unknown,Russian,2015-10-28 08:13:00,2015-10-28 08:13:00,1667,258,2110,R,1
spearmintme,ВИДЕО. Показан новый компактный спорткар Toyota  https://t.co/PTIpwp5GBS https://t.co/5jH3kS40UA,Unknown,Russian,2015-10-28 14:57:00,2015-10-28 14:57:00,1667,258,2113,R,1
spearmintme,Ангела Меркель начала свой официальный визит в Китай  https://t.co/t9j0zHht47,Unknown,Russian,2015-10-29 05:54:00,2015-10-29 06:04:00,1667,257,2117,R,1
spearmintme,ООН предупреждает о женской волне нелегальной миграции из Центральной Америки https://t.co/WNM7BTYozZ https://t.co/eZXd5OuTPI,Unknown,Russian,2015-10-29 05:55:00,2015-10-29 05:55:00,1667,257,2118,R,1
spearmintme,В Библиотеке украинской литературы назвали подброшенными изъятые книги https://t.co/kPEkLOtfCJ,Unknown,Russian,2015-10-29 19:14:00,2015-10-29 19:14:00,1667,257,2119,R,1
spearmintme,ВИДЕО. Yamaha представила робота-мотоциклиста  https://t.co/WS0YI8ofKz https://t.co/tABohvpn4R,Unknown,Serbian,2015-10-30 07:32:00,2015-10-30 07:32:00,1667,257,2120,R,1
spearmintme,"В Египте сообщили, что самолет с российскими туристами летит над Турцией https://t.co/QnG7DIDC40",Unknown,Russian,2015-10-31 08:11:00,2015-10-31 08:11:00,1666,258,2125,R,1
spearmintme,"СБУ задержала ""правую руку Коломойского"" Корбана https://t.co/0BqNU6e3ee",Unknown,Ukrainian,2015-10-31 12:11:00,2015-10-31 12:11:00,1666,258,2128,R,1
spearmintme,Новый скандал на Украине - задержан соратник Коломойского Корбан https://t.co/A6shLCbiPt https://t.co/TCmk27AvQM,Unknown,Ukrainian,2015-10-31 21:53:00,2015-10-31 21:53:00,1666,258,2129,R,1
spearmintme,«Хетафе» планирует переехать в другой город https://t.co/0LKKdV8cnV,Unknown,Russian,2015-11-01 12:12:00,2015-11-01 12:12:00,1666,258,2129,R,1
spearmintme,Власти Петербурга выплатят семьям погибших в крушении А321 по 1 млн рублей https://t.co/t8OV7cksXg,Unknown,Russian,2015-11-02 12:04:00,2015-11-02 12:04:00,1667,259,2134,R,1
spearmintme,"Владислав Филев передумал покупать «Трансаэро»  Акционер «Трансаэро» не смог собрать контрольный пакет акций, не …  https://t.co/a2z4YqEW3s",Unknown,Russian,2015-11-02 19:36:00,2015-11-02 19:36:00,1667,260,2135,R,1
spearmintme,ФСБ изъяла у бандитов 350 кг синтетических наркотиков https://t.co/tGjPM3XcOj,Unknown,Russian,2015-11-03 08:01:00,2015-11-03 08:01:00,1667,259,2138,R,1
spearmintme,Суд в Киеве продлил арест Ерофееву и Александрову  https://t.co/1T9we5LVJk https://t.co/MsANG5tr7g,Unknown,Ukrainian,2015-11-03 10:55:00,2015-11-03 10:55:00,1668,259,2139,R,1
spearmintme,Бастрыкин приехал в Египет расследовать катастрофу A321   https://t.co/1fgVpd9fsU,Unknown,Russian,2015-11-03 14:47:00,2015-11-03 14:47:00,1667,259,2140,R,1
spearmintme,"Стаханов получил первую часть стройматериалов в рамках программы ""2000 домов"" https://t.co/EdsiguCvIV",Unknown,Russian,2015-11-03 14:52:00,2015-11-03 14:52:00,1667,259,2141,R,1
spearmintme,Власти Москвы в полтора раза увеличат расходы на новогодние елки https://t.co/nQbqyxz8z3,Unknown,Russian,2015-11-03 16:24:00,2015-11-03 16:24:00,1668,259,2142,R,1
spearmintme,Минобороны создало с оппозицией Сирии координационные группы по борьбе с ИГИЛ  https://t.co/7tqMRtBTbY https://t.co/xYZoBN2cWY,Unknown,Russian,2015-11-03 17:18:00,2015-11-03 17:19:00,1668,259,2143,R,1
spearmintme,Сирийская оппозиция предоставила России координаты для авиаударов по ИГ https://t.co/OXVGYM48B0,Unknown,Russian,2015-11-03 18:23:00,2015-11-03 18:23:00,1668,259,2144,R,1
spearmintme,Путин подписал закон о лишении мандатов депутатов за отсутствие деклараций о доходах https://t.co/8YSEv1JmAC,Unknown,Russian,2015-11-04 16:14:00,2015-11-04 16:15:00,1667,260,2151,R,1
spearmintme,Захарова: Дамаск готов к переговорам с сирийской оппозицией https://t.co/fjm4qDz31C,Unknown,Russian,2015-11-05 13:55:00,2015-11-05 13:55:00,1667,260,2156,R,1
spearmintme,ОБСЕ: Представители ВСУ и ЛНР обсудили выполнение договорённостей о перемирии  https://t.co/2slvWIIF6x,Unknown,Russian,2015-11-05 23:24:00,2015-11-05 23:29:00,1667,260,2158,R,1
spearmintme,"Собака отчаянно грустит каждый раз, когда провожает владельца в школу (ВИДЕО)  https://t.co/rYpNN0tkCN https://t.co/smMk6oTgVD",Unknown,Russian,2015-11-06 15:13:00,2015-11-06 15:19:00,1667,260,2161,R,1
spearmintme,Сергей Лавров и Джон Керри обсудили политический процесс в Сирии  https://t.co/JU4L9VP3lW https://t.co/iBHzizFx4h,Unknown,Russian,2015-11-06 16:02:00,2015-11-06 16:09:00,1667,260,2162,R,1
spearmintme,Структура казанского авиазавода подала иск к «Трансаэро»  https://t.co/kO1dkdyvB2 https://t.co/0P1GlXAeFf,Unknown,Russian,2015-11-06 16:15:00,2015-11-06 16:15:00,1667,260,2163,R,1
spearmintme,"Багаж российских туристов из Египта перевезут отдельно, с собой можно будет взять только ручную кладь https://t.co/lpnC5CvVgD",Unknown,Russian,2015-11-06 20:17:00,2015-11-06 20:17:00,1667,260,2165,R,1
spearmintme,Зарегистрированных на рейс в Египет пассажиров высаживали прямо с самолета https://t.co/Gs1F6TrGRj,Unknown,Russian,2015-11-06 22:13:00,2015-11-06 22:13:00,1667,260,2166,R,1
spearmintme,Пресс-секретарь ООН Стефан Дюжаррик о вспышке холеры в Ираке https://t.co/JOmo2DZSyl,Unknown,Serbian,2015-11-07 11:53:00,2015-11-07 11:53:00,1667,261,2169,R,1
spearmintme,Выступление Трампа на ТВ пытались сорвать из-за оскорблений и расизма.   https://t.co/DSmCqYJONP https://t.co/A05EOyOoSc,Unknown,Russian,2015-11-08 11:02:00,2015-11-08 11:02:00,1668,261,2174,R,1
spearmintme,СМИ узнали о планах ЕС заплатить странам Африки за возврат мигрантов https://t.co/HLbSSPPmpe,Unknown,Russian,2015-11-08 18:54:00,2015-11-08 18:54:00,1668,261,2176,R,1
spearmintme,Видео с умершим таджикским младенцем в полиции. https://t.co/XoolDvTl9x,Unknown,Russian,2015-11-08 19:55:00,2015-11-08 19:55:00,1668,261,2177,R,1
spearmintme,СМИ узнали о роли Израиля в перехвате переговоров о крушении А321 https://t.co/23AQeiEtF9,Unknown,Russian,2015-11-09 07:34:00,2015-11-09 07:34:00,1668,261,2178,R,1
spearmintme,"Работают, где и работали (c) @korobkov https://t.co/nBVdjJUBfI",Unknown,Russian,2015-11-09 10:34:00,2015-11-09 10:34:00,1668,261,2179,R,1
spearmintme,"Лондон передал Москве определенные данные по катастрофе А321, сообщил Дмитрий Песков https://t.co/3ZEn7ISvPL",Unknown,Russian,2015-11-09 11:11:00,2015-11-09 11:11:00,1668,261,2180,R,1
spearmintme,Песков о предварительных выводах о крушении A321  https://t.co/htieMJHDCF https://t.co/yyPNCsD3uG,Unknown,Russian,2015-11-09 11:35:00,2015-11-09 11:35:00,1668,261,2181,R,1
spearmintme,"У @i_samsonov протечка! Девочки, помогите страстотерпцу ))) https://t.co/PcqOgZFArz",Unknown,Macedonian,2015-11-09 12:55:00,2015-11-09 12:55:00,1668,261,2182,R,1
spearmintme,"О том, как не срываться на детях, рассказала семейный психолог Вита Малыгина  https://t.co/vGYgUxsIbs https://t.co/UTiaFwUiA3",Unknown,Russian,2015-11-09 13:54:00,2015-11-09 13:54:00,1668,260,2183,R,1
spearmintme,«Челси» готов рассмотреть Симеоне в качестве преемника Моуринью https://t.co/Npu4AYGRuZ,Unknown,Russian,2015-11-09 14:13:00,2015-11-09 14:13:00,1668,260,2184,R,1
spearmintme,"'@salty_1970 @Dasssha2010 Кстати скоро уже три года будет, как он её порезал на куски..'",Unknown,Russian,2015-11-09 14:31:00,2015-11-09 14:31:00,1668,260,2185,R,1
spearmintme,"ФСБ принимала участие в сокрытии допинг-проб российских легкоатлетов, говорится в отчете WADA https://t.co/xenRzPDIxX",Unknown,Russian,2015-11-09 17:14:00,2015-11-09 17:14:00,1668,260,2186,R,1
spearmintme,Рассекречен интерьер нового Mercedes-Benz E-класса https://t.co/BeZkpBz8sl,Unknown,Russian,2015-11-10 01:36:00,2015-11-10 01:36:00,1668,260,2187,R,1
spearmintme,"'@Dasssha2010 @radio_kp на Павленского уже дело завели по вандализму. По моей инфе, точно накажут'",Unknown,Russian,2015-11-10 12:13:00,2015-11-10 12:13:00,1667,260,2190,R,1
spearmintme,Президент Международного олимпийского комитета: Россия будет сотрудничать по делу о допинге https://t.co/EjsUNNezwz https://t.co/BqTCFvulWs,Unknown,Russian,2015-11-11 07:11:00,2015-11-11 07:11:00,1666,258,2194,R,1
spearmintme,Тайные патрули ГИБДД появились на улицах Москвы https://t.co/N1CbQHLv6s,Unknown,Russian,2015-11-12 14:37:00,2015-11-12 14:37:00,1666,258,2200,R,1
spearmintme,"Полицейский, подозреваемый в убийстве петербуржца, арестован https://t.co/mVfSZvNZSW https://t.co/y8b7M3xpcW",Unknown,Russian,2015-11-12 18:22:00,2015-11-12 18:22:00,1666,258,2201,R,1
spearmintme,Уэлбек вернётся в строй в феврале https://t.co/3EgTGNFmqs,Unknown,Russian,2015-11-12 21:13:00,2015-11-12 21:13:00,1666,258,2202,R,1
spearmintme,Американский бомбардировщик проигнорировал требования диспетчеров КНР https://t.co/JRWA1otxlC,Unknown,Russian,2015-11-12 23:11:00,2015-11-12 23:11:00,1666,258,2203,R,1
spearmintme,Госдума рассмотрит в первом чтении проект федерального бюджета-2016 https://t.co/xH8Rkhjba6 https://t.co/sq7dogcbbA,Unknown,Russian,2015-11-13 00:37:00,2015-11-13 00:37:00,1666,258,2204,R,1
spearmintme,Туристку из Болгарии облили кислотой в индийском городе Варанаси https://t.co/OOLlFjxG6K,Unknown,Bulgarian,2015-11-13 07:32:00,2015-11-13 07:33:00,1666,257,2205,R,1
spearmintme,Путин: независимая внешняя политика Турции заслуживает уважения https://t.co/subnpZjbTn https://t.co/BCgM2leklf,Unknown,Russian,2015-11-13 14:37:00,2015-11-13 14:38:00,1666,257,2208,R,1
spearmintme,наши военные ныряльщики поставили 14 мировых рекордов в поисках дна российской экономики,Unknown,Russian,2015-11-13 15:02:00,2015-11-13 15:02:00,1666,257,2209,R,1
spearmintme,Челоянц вышел из состава акционеров ФК «Спартак» https://t.co/juq8KNDIav,Unknown,Russian,2015-11-13 15:13:00,2015-11-13 15:13:00,1666,257,2210,R,1
spearmintme,Доставлявший девушек на вечеринки Берлускони бизнесмен получил срок https://t.co/X6EJYivM4M https://t.co/eNrbMMjs79,Unknown,Russian,2015-11-13 17:32:00,2015-11-13 17:32:00,1666,257,2212,R,1
spearmintme,ВИДЕО. Суровая реклама на улице Стамбула  https://t.co/dn27impOz8  #РИА_видеоклуб https://t.co/b5sSJOhIzW,Unknown,Russian,2015-11-13 21:31:00,2015-11-13 21:31:00,1666,257,2213,R,1
spearmintme,"Надеемся, в этот раз Charlie Hebdo не будут рисовать...  #PrayForParis #Париж #теракт https://t.co/TlhJRW0rAO",Unknown,Russian,2015-11-14 01:35:00,2015-11-14 01:35:00,1666,257,2214,R,1
spearmintme,"Авиакомпания American Airlines приостанавливает полеты в Париж, сообщает Reuters https://t.co/yEUzbgGTlL #Теракты_в_Париже",Unknown,Russian,2015-11-14 01:58:00,2015-11-14 01:58:00,1666,257,2215,R,1
spearmintme,"Нападавших в Париже было ""точно семь"", они были разделены на группы  https://t.co/hGInwgKYs8 https://t.co/EHzE5sHL1u",Unknown,Russian,2015-11-14 03:36:00,2015-11-14 03:36:00,1666,257,2217,R,1
spearmintme,Охрана матча Россия-Португалия увеличена на 150 сотрудников МВД Заместитель директора стадиона «Кубань» …  https://t.co/CwORrt6jnk,Unknown,Russian,2015-11-14 10:59:00,2015-11-14 10:59:00,1666,258,2219,R,1
spearmintme,Глава МОК Бах выступил с официальным заявлением в связи с терактами в Париже https://t.co/gv60TDHA0l,Unknown,Russian,2015-11-14 12:41:00,2015-11-14 12:41:00,1666,258,2221,R,1
spearmintme,Глава Европарламента принес соболезнования французскому народу https://t.co/901egSrVEP,Unknown,Russian,2015-11-14 13:23:00,2015-11-14 13:23:00,1666,258,2223,R,1
spearmintme,Число погибших при крушении скоростного поезда во Франции достигло 10 https://t.co/GKo8bgRpbd © tonnyhofstede https://t.co/MKMS4nHOWc,Unknown,Russian,2015-11-14 18:52:00,2015-11-14 18:52:00,1665,259,2226,R,1
spearmintme,Париж приходит в себя после ночи ужаса https://t.co/4fBtyEtomB,Unknown,Russian,2015-11-14 18:54:00,2015-11-14 18:54:00,1665,259,2228,R,1
spearmintme,Пепе: Дзюба — класс! https://t.co/OecCSkcHrY,Unknown,Russian,2015-11-14 19:15:00,2015-11-14 19:17:00,1665,259,2229,R,1
spearmintme,Емельянов: задачи попасть в зону еврокубков у «Урала» нет https://t.co/82plH9M1aP,Unknown,Russian,2015-11-14 22:12:00,2015-11-14 22:13:00,1665,259,2231,R,1
spearmintme,Найдена еще одна использованная в парижских терактах машина https://t.co/w9tMgR5CWV,Unknown,Russian,2015-11-15 09:16:00,2015-11-15 09:16:00,1665,259,2236,R,1
spearmintme,Молдавия объявит понедельник днем траура из-за терактов в Париже https://t.co/YVOi1aIeN6 #Париж #теракт https://t.co/PUdbF80meT,Unknown,Russian,2015-11-15 10:53:00,2015-11-15 10:53:00,1665,259,2238,R,1
spearmintme,"дембеля не становятся дворниками, присмотритесь, вокруг ни одного квадратного сугроба",Unknown,Ukrainian,2015-11-15 11:52:00,2015-11-15 11:52:00,1665,259,2239,R,1
spearmintme,Павлюченкова заменила Макарову в парном матче финала Кубка Федерации с Чехией https://t.co/274ZGOFscD,Unknown,Russian,2015-11-15 16:52:00,2015-11-15 16:52:00,1665,259,2240,R,1
spearmintme,Путина назвали одним из самых популярных лидеров на саммите G20: https://t.co/qMak34bFOW,Unknown,Russian,2015-11-15 20:37:00,2015-11-16 08:20:00,1666,259,2243,R,1
spearmintme,"ЦИК Украины: 34,08% граждан проголосовали во втором туре выборов https://t.co/8xKE9JJgQM",Unknown,Russian,2015-11-16 02:14:00,2015-11-16 02:14:00,1666,259,2242,R,1
spearmintme,ВИДЕО. В соборе Парижской Богоматери прошла служба в память о жертвах терактов  https://t.co/1E4RHvF3kb https://t.co/IyTdUzgQUR,Unknown,Russian,2015-11-16 06:32:00,2015-11-16 06:32:00,1666,259,2243,R,1
spearmintme,РБК: банк бывшего советника Якунина несет убытки из-за перемен в РЖД https://t.co/GOUdsN3CZ7,Unknown,Ukrainian,2015-11-16 12:43:00,2015-11-16 12:43:00,1666,259,2244,R,1
spearmintme,СМИ: полиция нашла чемодан в подозрительном автомобиле в Брюсселе https://t.co/DF7qmtKCPe https://t.co/3vVfGDEZUq,Unknown,Russian,2015-11-16 13:13:00,2015-11-16 13:14:00,1666,259,2246,R,1
spearmintme,"Олланд хочет исправить конституцию Франции Глава государства планирует лишать гражданства некоторых подданных, …  https://t.co/qXPAX5EoS1",Unknown,Russian,2015-11-16 17:54:00,2015-11-16 17:56:00,1666,258,2248,R,1
spearmintme,"В мире пришло время инвестировать в оборону, считает генсек НАТО https://t.co/XghlLsalHI",Unknown,Russian,2015-11-16 19:33:00,2015-11-16 19:33:00,1666,258,2250,R,1
spearmintme,Испанские СМИ приняли селфи журналиста за фото террориста ИГ https://t.co/yRKjv5ymL9 © AmyStephen https://t.co/GdIfwxVWoR,Unknown,Russian,2015-11-16 20:52:00,2015-11-16 20:52:00,1666,258,2252,R,1
spearmintme,Mercedes за 6 млн рублей украли с охраняемой стоянки в Москве у первокурсника МГИМО https://t.co/5RCNTzd2T2,Unknown,Russian,2015-11-17 08:15:00,2015-11-17 08:15:00,1666,260,2254,R,1
spearmintme,"Владимир Путин: террористов, виновных в крушении А321, найдут в любой точке планеты https://t.co/M1eGEzNcW0 #7K9268 https://t.co/9DGIhPRbbM",Unknown,Russian,2015-11-17 10:34:00,2015-11-17 10:34:00,1666,260,2255,R,1
spearmintme,"Официальный курс евро на среду снизился на 1,62 рубля https://t.co/QH9PCxEJfL https://t.co/b44qSM9Xuj",Unknown,Russian,2015-11-17 10:51:00,2015-11-17 10:51:00,1666,260,2256,R,1
spearmintme,Альфа-банк задумался о внешних займах https://t.co/I1yyN9ekJR,Unknown,Russian,2015-11-17 12:32:00,2015-11-17 12:33:00,1666,260,2258,R,1
spearmintme,Google оспорит предписание ФАС по жалобе «Яндекса» https://t.co/Me0aGLcdxB,Unknown,Bulgarian,2015-11-17 14:34:00,2015-11-17 14:34:00,1666,260,2260,R,1
spearmintme,Медведь в Хабаровском крае убил охотника и его собаку https://t.co/cWG7UHdD5l https://t.co/fGpyKKyUWG,Unknown,Russian,2015-11-18 05:11:00,2015-11-18 05:12:00,1665,260,2263,R,1
spearmintme,СМИ: уничтожен последний террорист в парижском пригороде https://t.co/K2r9KUXBC3,Unknown,Russian,2015-11-18 08:14:00,2015-11-18 08:14:00,1665,260,2264,R,1
spearmintme,Грузия усиливает меры безопасности и пограничный контроль https://t.co/lUwDRkeEhW https://t.co/rzyT4sy9ry,Unknown,Russian,2015-11-18 10:35:00,2015-11-18 10:36:00,1665,260,2266,R,1
spearmintme,Выпуск легковых авто в России в октябре сократился на 11%  https://t.co/eYmH6E6N7h,Unknown,Russian,2015-11-18 10:55:00,2015-11-18 10:55:00,1665,260,2268,R,1
spearmintme,Предполетная подготовка российских самолетов в Сирии (ВИДЕО) https://t.co/3ynWsKEeeG,Unknown,Russian,2015-11-19 09:16:00,2015-11-19 09:16:00,1665,260,2276,R,1
spearmintme,Член WADA Мозес: России надо закрыть дорогу на Олимпиаду-2016 https://t.co/Zm2e0TiLND,Unknown,Russian,2015-11-19 10:17:00,2015-11-19 10:18:00,1665,260,2278,R,1
spearmintme,При Сталине все ссылки открывались!,Unknown,Russian,2015-11-19 11:11:00,2015-11-19 11:11:00,1665,260,2279,R,1
spearmintme,Люди эвакуированы с Киевского вокзала в Москве после звонка о бомбе https://t.co/gd7COuEyiC https://t.co/1g2WtBRt6Z,Unknown,Russian,2015-11-19 12:31:00,2015-11-19 12:31:00,1665,260,2280,R,1
spearmintme,Часть Калужско-Рижской линии московского метро закроют 21 ноября  https://t.co/ZKt8jbE0LS https://t.co/tCflcQtT4b,Unknown,Russian,2015-11-19 13:14:00,2015-11-19 13:14:00,1665,260,2281,R,1
spearmintme,МВД Франции: уничтоженный в Сен-Дени террорист Абауд стоял за атаками на Париж https://t.co/v8GdEjmgOW https://t.co/s4pcubGAcS,Unknown,Russian,2015-11-19 15:12:00,2015-11-19 15:13:00,1665,260,2282,R,1
spearmintme,"ближе к новому году Шойгу внимательно смотрит, хорошо ли вёл себя Дед Мороз",Unknown,Russian,2015-11-19 16:17:00,2015-11-19 16:17:00,1665,260,2284,R,1
spearmintme,Искавшую Васильеву в колонии правозащитницу поместили под домашний арест  https://t.co/sNs1mIbJTW https://t.co/hBRXtYSM5u,Unknown,Russian,2015-11-19 16:37:00,2015-11-19 16:37:00,1665,260,2285,R,1
spearmintme,Бэйл: противостояние «Реала» и «Барселоны» уникально https://t.co/i8ivS0gjD4,Unknown,Russian,2015-11-19 22:55:00,2015-11-19 22:55:00,1665,259,2287,R,1
spearmintme,"""Безопасности много не бывает""  https://t.co/KmwqpaI84B https://t.co/ubsdrWRBlc",Unknown,Russian,2015-11-20 07:52:00,2015-11-20 07:52:00,1665,260,2290,R,1
spearmintme,Энергетическая ассоциация БРИКС может быть создана в 2016 году https://t.co/KjUdFcHQb7,Unknown,Russian,2015-11-20 09:18:00,2015-11-20 09:22:00,1665,260,2292,R,1
spearmintme,Бельгийская полиция ищет бомбы в трех школах Антверпена https://t.co/6gp7uRuZFb  © AP Photo https://t.co/T95LIiXisW,Unknown,Russian,2015-11-20 09:32:00,2015-11-20 09:32:00,1665,260,2293,R,1
spearmintme,Большая «Киберпятница» на «Спорт FM»! https://t.co/HTmQ8QJDtS,Unknown,Russian,2015-11-20 09:53:00,2015-11-20 09:53:00,1665,260,2294,R,1
spearmintme,Песков: заявления о долгом расследовании теракта на А321 неуместны https://t.co/TU2bJLj2Cd https://t.co/eyTmSI5vAW,Unknown,Russian,2015-11-20 10:32:00,2015-11-20 10:32:00,1665,260,2295,R,1
spearmintme,"Источник: Всё происходит на седьмом этаже Radisson, джихадисты стреляют в коридоре здания  https://t.co/rHynB2IGgM https://t.co/tJKAorHdCS",Unknown,Russian,2015-11-20 10:39:00,2015-11-20 10:39:00,1665,260,2297,R,1
