author_id,content,region,language,publish_date,harvested_date,following,followers,updates,post_type,retweet
speakoroff405,"Взрыв в петербургском метро: ""Сенная"" в дыму https://t.co/9zrdNw6oOU",Unknown,Russian,2017-04-03 12:32:00,2017-04-03 12:32:00,42,0,1304,,0
speakoroff405,"Взрыв в петербургском метро: ""Сенная"" в дыму https://t.co/9zrdNw6oOU",Unknown,Russian,2017-04-03 12:32:00,2017-04-03 12:32:00,42,0,1304,,0
speakoroff405,"Взрывы в метро. Вбросы, фейки и глумление российской оппозиции https://t.co/uTpoOs3l1Q",Unknown,Russian,2017-04-04 06:17:00,2017-04-04 06:17:00,42,0,1310,,0
speakoroff405,"Взрывы в метро. Вбросы, фейки и глумление российской оппозиции https://t.co/uTpoOs3l1Q",Unknown,Russian,2017-04-04 06:17:00,2017-04-04 06:17:00,42,0,1310,,0
speakoroff405,Президент РФ почтил память жертв взрыва в метро Петербурга https://t.co/7EGWqeC0On,Unknown,Russian,2017-04-04 13:28:00,2017-04-04 13:28:00,42,0,1317,,0
speakoroff405,Президент РФ почтил память жертв взрыва в метро Петербурга https://t.co/7EGWqeC0On,Unknown,Russian,2017-04-04 13:28:00,2017-04-04 13:28:00,42,0,1317,,0
speakoroff405,"15 раз, когда Трамп говорил, что США не должны бомбить Сирию https://t.co/TeHdxz7OhP",Unknown,Russian,2017-04-08 11:10:00,2017-04-08 11:11:00,42,0,1345,,0
speakoroff405,"15 раз, когда Трамп говорил, что США не должны бомбить Сирию https://t.co/TeHdxz7OhP",Unknown,Russian,2017-04-08 11:10:00,2017-04-08 11:11:00,42,0,1345,,0
speakoroff405,Творчество Mat Szulik https://t.co/TaEGLBv1cG,Unknown,Bulgarian,2017-04-12 06:17:00,2017-04-12 06:17:00,42,0,1374,,0
speakoroff405,Во Франции свившие гнездо аисты оставили без света тысячу человек https://t.co/8fUHGvYXH8,Unknown,Russian,2017-04-20 06:04:00,2017-05-17 10:50:00,42,0,1435,,0
speakoroff405,От чего умер президент Франции Феликс Фор https://t.co/09ouF52n55,Unknown,Russian,2017-04-24 17:48:00,2017-04-24 17:48:00,42,0,1468,,0
speakoroff405,"Похоронное бюро едва не сгорело при кремации ""слишком толстого"" покойника https://t.co/ZEe4pdWQaQ",Unknown,Ukrainian,2017-04-28 17:35:00,2017-04-28 17:35:00,42,0,1503,,0
speakoroff405,Президент РФ обсудил c Москальковой правозащитную деятельность https://t.co/nonwcCkn2q,Unknown,Russian,2017-05-05 14:57:00,2017-05-05 14:57:00,42,0,1544,,0
speakoroff405,Россия неплохо зарабатывает на Google https://t.co/aOinu4qQh3,Unknown,Russian,2017-05-09 11:23:00,2017-05-09 11:23:00,42,0,1563,,0
speakoroff405,Москва – Тверь. Барышев Михаил Николаевич (ЦСКА) встретился с кадетами Суворовского училища https://t.co/WcJ3vugLGE,Unknown,Russian,2017-05-13 14:44:00,2017-05-13 14:44:00,42,0,1585,,0
speakoroff405,Владимир Путин одобрил ответные меры российского МИДа на санкции США https://t.co/G79Io3eEjm,Unknown,Russian,2017-07-28 11:46:00,2017-07-28 11:46:00,42,0,1677,,0
speakoroff405,Виктор Небоженко: Из-за Саакашвили США введут санкции против Порошенко https://t.co/bcIXCVjcnD,Unknown,Ukrainian,2017-07-28 13:05:00,2017-07-28 13:06:00,42,0,1678,,0
speakoroff405,Агентству Reuters нельзя верить: журналисты нагло пиарятся на войне в Сирии https://t.co/CvSMa1PBWN,Unknown,Russian,2017-08-02 14:44:00,2017-08-02 14:46:00,42,0,1695,,0
speakoroff405,ТОП-5 китайских секретов красоты и долголетия https://t.co/W2sAkqwEqD,Unknown,Russian,2017-08-12 11:53:00,2017-08-12 11:55:00,42,0,1724,,0
speakoroff405,и-2 feat. Т. Гвердцители - Безвоздушная тревога https://t.co/2CVXECKUDb,Unknown,Ukrainian,2017-08-14 06:21:00,2017-08-14 06:21:00,42,0,1732,,0
speakoroff405,"ЛЕГИОН - LEGION- Би-2, Ария, IceCreamoff, BY Effect, [HD] https://t.co/rBBqgV5APK",Unknown,Bulgarian,2017-08-14 19:22:00,2017-08-14 19:22:00,42,0,1741,,0
speakoroff405,"ЛЕГИОН - LEGION- Би-2, Ария, IceCreamoff, BY Effect, [HD] https://t.co/incJ8hxk09",Unknown,Bulgarian,2017-08-15 17:37:00,2017-08-15 17:37:00,42,0,1750,,0
speakoroff405,Участница «Дома-2» с восьмым размером груди снялась полностью обнаженной https://t.co/7jsgKu7X7G,Unknown,Russian,2017-08-16 19:20:00,2017-08-16 19:20:00,42,0,1760,,0
speakoroff405,Золотой век Вавилонского царства https://t.co/EpzVgqcJwq,Unknown,Russian,2017-08-17 06:25:00,2017-08-17 06:25:00,42,0,1763,,0
speakoroff405,Би-2 – Молитва https://t.co/i9j5aLUkdt,Unknown,Serbian,2017-08-19 08:26:00,2017-08-19 08:26:00,42,0,1784,,0
speakoroff405,"Поляки избили пьяного украинца, заставлявшего людей зиговать в кафе Гданьска https://t.co/8UnnH9EIUN",Unknown,Russian,2017-08-21 15:06:00,2017-08-21 15:06:00,42,0,1805,,0
speakoroff405,"Поляки избили пьяного украинца, заставлявшего людей зиговать в кафе Гданьска https://t.co/TLpTFdyZL6",Unknown,Russian,2017-08-22 11:19:00,2017-08-22 11:20:00,42,0,1810,,0
speakoroff405,Просто песня: рейтинг знаменитостей Forbes-2017 https://t.co/wes38O2jxW,Unknown,Uzbek,2017-08-23 12:26:00,2017-08-23 12:26:00,42,0,1825,,0
speakoroff405,Золотой век Вавилонского царства https://t.co/HKWWqnGTrp,Unknown,Russian,2017-08-24 17:31:00,2017-08-24 17:31:00,42,0,1834,,0
speakoroff405,МАЧЕТЕ - Нежность (OFFICIAL VIDEO) https://t.co/dokJztANgs,Unknown,Russian,2017-08-24 19:24:00,2017-08-24 19:24:00,42,0,1836,,0
speakoroff405,"Лулу Хашимото, страшная реальная кукла Японии https://t.co/okFy1cijuG",Unknown,Russian,2017-08-28 18:02:00,2017-08-28 18:02:00,42,0,1884,,0
speakoroff405,Майданщики обнаружили в США золотой унитаз Януковича https://t.co/x7zOGFh7kq,Unknown,Ukrainian,2017-09-03 10:34:00,2017-09-03 10:35:00,42,0,1951,,0
speakoroff405,"Дональд Трамп заявил, что Северная Корея – это страна изгоев https://t.co/3awSkM0sB5",Unknown,Russian,2017-09-03 13:58:00,2017-09-03 13:59:00,42,0,1954,,0
speakoroff405,"Карл Волох: Трамп такой же импотент в сирийском вопросе, как Обама https://t.co/rvs1oXuGdz",Unknown,Russian,2017-09-03 16:08:00,2017-09-03 16:08:00,42,0,1956,,0
speakoroff405,Призрак оперы. - Nightwish - The Phantom of the opera.-(Звёзды рока). https://t.co/fYoAdQ402k,Unknown,Ukrainian,2017-09-08 16:11:00,2017-09-08 16:12:00,42,0,2007,,0
speakoroff405,Nightwish - Wishmaster (Pearl Harbor Vol.2) https://t.co/ih5SyMfXbS,Unknown,English,2017-09-09 05:08:00,2017-09-09 05:08:00,42,0,2020,,0
speakoroff405,Старушка пошла вразнос: Интернет порвала фотография «филейной части» Юлии Тимошенко https://t.co/u3mA6VTM8B,Unknown,Russian,2017-09-11 11:54:00,2017-09-11 11:54:00,42,0,2042,,0
speakoroff405,Вадим Денисенко: Назначена дата штурма резиденции Порошенко https://t.co/C8vY23y6Pn,Unknown,Macedonian,2017-09-14 12:02:00,2017-09-14 12:03:00,42,0,2077,,0
speakoroff405,"9 ПРИЧИН, ПОЧЕМУ ЖЕНЩИНА ОДНА... https://t.co/SLuSwst092",Unknown,Russian,2017-09-20 18:56:00,2017-09-20 18:57:00,42,0,2167,,0
speakoroff405,Отпуск в кредит https://t.co/dLvYf0yZlr,Unknown,Ukrainian,2017-09-25 20:37:00,2017-09-25 20:37:00,42,0,2255,,0
speakoroff405,Facebook и Google: как сделать хайп на чужом горе https://t.co/bbAkaf0G4e,Unknown,Russian,2017-10-03 10:43:00,2017-10-03 10:43:00,42,0,2328,,0
speakoroff405,"Летающая рухлядь 5-го поколения: F-22 и F-35 пора на свалку, РЛС ""Струна"" помножила их на 0 https://t.co/xEnfLpuwoj",Unknown,Russian,2017-10-17 10:26:00,2017-10-17 10:26:00,42,0,2337,,0
speakoroff405,Хочу leo в голове! https://t.co/3SL6CmW4uP,Unknown,Ukrainian,2017-10-19 16:53:00,2017-10-19 16:53:00,42,0,2386,,0
