author_id,content,region,language,publish_date,harvested_date,following,followers,updates,post_type,retweet
spearmintme,Таджикские силовики ведут поиск террористов в ущелье Рамит  http://t.co/jPIQfeWwe6,Unknown,Russian,2015-09-05 05:15:00,2015-09-05 05:15:00,1689,256,1869,R,1
spearmintme,Повышения стипендии студентам придется подождать.   http://t.co/2ccOUM5mex http://t.co/AbEVRQAJJA,Unknown,Russian,2015-09-05 11:55:00,2015-09-05 11:55:00,1689,255,1873,R,1
spearmintme,"Источник Интерфакса утверждает, что режиссер Эльдар Рязанов находится в реанимации в стабильно тяжелом состоянии http://t.co/o966YKgymZ",Unknown,Russian,2015-09-06 08:05:00,2015-09-06 08:05:00,1689,255,1877,R,1
spearmintme,На Москву наступают сильные дожди  http://t.co/XpUcP0TqJ0 http://t.co/SMHXG4ntq2,Unknown,Russian,2015-09-06 12:32:00,2015-09-06 12:32:00,1689,254,1878,R,1
spearmintme,"""Ъ"": срок действия минских соглашений может быть продлен http://t.co/K2gPdJraCE",Unknown,Russian,2015-09-07 05:33:00,2015-09-07 05:34:00,1689,252,1881,R,1
spearmintme,Со скандально известного хирурга сняты все обвинения  http://t.co/ehS1yJ7ZzF http://t.co/YGlpMz1Q5S,Unknown,Russian,2015-09-07 14:32:00,2015-09-07 14:33:00,1689,252,1885,R,1
spearmintme,АСВ: выплаты вкладчикам банка «Смолевич» начнутся не позже 22 сентября © Flickr  http://t.co/xyPZDUnJuh http://t.co/XMraFrpnLf,Unknown,Ukrainian,2015-09-08 07:33:00,2015-09-08 07:33:00,1689,252,1888,R,1
spearmintme,Советник Путина предложил ограничить покупку валюты и заморозить цены  http://t.co/OOSHfZKBlR,Unknown,Russian,2015-09-08 07:33:00,2015-09-08 07:33:00,1689,252,1887,R,1
spearmintme,"Продажи легковушек в России за восемь месяцев упали на 33,5% http://t.co/sW5zugw7DG",Unknown,Russian,2015-09-08 17:32:00,2015-09-08 17:32:00,1689,252,1891,R,1
spearmintme,Клинтон впервые извинилась за инцидент с электронной почтой http://t.co/DYXC4xyu9j,Unknown,Russian,2015-09-09 01:12:00,2015-09-09 01:12:00,1689,253,1893,R,1
spearmintme,"Глава ФМС:России не грозит поток мигрантов из Сирии,но ФМС гуманно отнесётся к просьбам тех,кто обратится за помощью  http://t.co/RUKQjC4Fbw",Unknown,Russian,2015-09-09 12:43:00,2015-09-09 12:43:00,1689,253,1900,R,1
spearmintme,"Ромодановский заверил, что беженцы, приехавшие в Россию, могут рассчитывать на гуманное отношение  http://t.co/VDHgUwQnIf",Unknown,Russian,2015-09-09 12:44:00,2015-09-09 12:44:00,1689,253,1901,R,1
spearmintme,Неймар: сборная Бразилии никогда не была командой одного игрока http://t.co/xELorx96sQ,Unknown,Russian,2015-09-09 19:33:00,2015-09-09 19:33:00,1689,253,1904,R,1
spearmintme,"Минобороны: за 5 лет КНДР совершила более 60 ""военных провокаций"" в отношении Южной Кореи  http://t.co/4MRm8e8D9B",Unknown,Russian,2015-09-10 05:31:00,2015-09-10 05:32:00,1689,254,1905,R,1
spearmintme,Более 20 истребителей Су-27 и МиГ-31 перебазируют на оперативные аэродромы в ходе проверки  http://t.co/hjIJY5bXoZ,Unknown,Russian,2015-09-10 06:12:00,2015-09-10 06:12:00,1689,254,1906,R,1
spearmintme,Ещё одна: Саакашвили назначил своим замом 25-летнюю активистку Майдана http://t.co/0SXCZ3Ew03 http://t.co/ywrz8vLEKg,Unknown,Russian,2015-09-10 14:39:00,2015-09-10 14:39:00,1689,254,1908,R,1
spearmintme,'@GrahamWP_UK ФОТОФАКТ. Донецк не стесняется в выражении ненависти к боевикам http://t.co/x38WwZzPhE http://t.co/OsUAVHjGJu',Unknown,Russian,2015-09-10 16:55:00,2015-09-10 16:55:00,1689,254,1911,R,1
spearmintme,Оздоев и Лемос рискуют пропустить матч «Рубина» с «Локомотивом» http://t.co/4vz8dXgtec,Unknown,Russian,2015-09-10 18:13:00,2015-09-10 18:13:00,1689,254,1914,R,1
spearmintme,Британский лоукостер EasyJet перестанет летать по маршруту Лондон–Москва. Причина — падение спроса на направление http://t.co/Ih2Ne2cyHh,Unknown,Russian,2015-09-11 11:50:00,2015-09-11 11:51:00,1689,254,1918,R,1
spearmintme,Reuters сообщило о поставке Россией в Сирию модернизированных «Панцирей» http://t.co/MhUN7H2RLU,Unknown,Russian,2015-09-11 18:37:00,2015-09-11 18:37:00,1689,255,1925,R,1
spearmintme,Главным требованием Кубы в диалоге с США остается отмена блокады  http://t.co/eLCqSpNdMO,Unknown,Russian,2015-09-11 23:54:00,2015-09-11 23:54:00,1689,255,1928,R,1
spearmintme,Путин предложил создать в Крыму историко-культурный центр христианства  http://t.co/UMVfgjFToz,Unknown,Russian,2015-09-12 13:32:00,2015-09-12 13:32:00,1689,256,1932,R,1
spearmintme,Кто в Норвегии хочет развивать отношения с РФ  http://t.co/ngtvuQRxXQ http://t.co/Eca9bp5cRw,Unknown,Russian,2015-09-12 20:33:00,2015-09-12 20:33:00,1687,256,1934,R,1
spearmintme,В Кишиневе протестующие не пустили на площадь «Молодежь Молдавии» http://t.co/GhoL2ZJpDm,Unknown,Russian,2015-09-13 14:13:00,2015-09-13 14:13:00,1682,256,1935,R,1
spearmintme,"В ходе операции ""Мак-2015"" в лесах Приморья обнаружено 220 кг марихуаны http://t.co/ABBQjIrKUi",Unknown,Russian,2015-09-16 00:31:00,2015-09-16 00:31:00,1681,254,1939,R,1
spearmintme,Глава BMW после обморока на автосалоне во Франкфурте-на-Майне чувствует себя хорошо http://t.co/QmveTlTTW5,Unknown,Russian,2015-09-16 11:11:00,2015-09-16 11:11:00,1679,254,1943,R,1
spearmintme,Реакция российских политиков и общественных деятелей на расширение украинских санкций: http://t.co/HhmjjSwWYC,Unknown,Russian,2015-09-16 20:32:00,2015-09-16 20:33:00,1679,254,1946,R,1
spearmintme,Правозащитнику Маякову предъявлено обвинения в покушении на мошенничество http://t.co/iB5vrIO0t9,Unknown,Russian,2015-09-17 18:14:00,2015-09-17 18:14:00,1679,254,1951,R,1
spearmintme,Роскомнадзор не нашел нарушений закона в Windows 10 http://t.co/tl63OqezAA,Unknown,Ukrainian,2015-09-18 08:32:00,2015-09-18 08:32:00,1679,253,1955,R,1
spearmintme,«Крым Медиа»: AliExpress перестал поддерживать доставку в Крым https://t.co/ZjlE6ce0VK,Unknown,Russian,2015-09-18 12:32:00,2015-09-18 12:32:00,1679,253,1957,R,1
spearmintme,Метшин: Казань серьёзно подготовится к ЧМ-2018 по футболу http://t.co/36Mrdh1KWI,Unknown,Russian,2015-09-18 21:13:00,2015-09-18 21:13:00,1679,254,1961,R,1
spearmintme,В Брюсселе таксисты протестуют против Uber http://t.co/6KkGC37WMk http://t.co/58potc1wL3,Unknown,Russian,2015-09-19 03:31:00,2015-09-19 03:31:00,1679,254,1964,R,1
spearmintme,"Оглашение приговора по делу о ХК ""Локомотив"" начнется в Ярославле http://t.co/w7TSksGNoN http://t.co/HuFfVq77m3",Unknown,Russian,2015-09-21 00:11:00,2015-09-21 00:11:00,1679,255,1970,R,1
spearmintme,Роскомнадзор проверяет World of Tanks на наличие противоправной информации http://t.co/jXY1ZtImob,Unknown,Russian,2015-09-21 12:32:00,2015-09-21 12:32:00,1679,255,1971,R,1
spearmintme,"Савченко назвала свое дело ""враньем от начала и до конца"" http://t.co/rzMOClCSzE",Unknown,Ukrainian,2015-09-22 12:52:00,2015-09-22 12:52:00,1679,255,1979,R,1
spearmintme,Канделаки заплатит 200 тыс. руб. за пьяную езду по Петербургу http://t.co/bDNLU1E4tR,Unknown,Ukrainian,2015-09-22 12:53:00,2015-09-22 12:53:00,1679,255,1980,R,1
spearmintme,В США начали новое расследование в отношении дизельных машин Volkswagen  http://t.co/0wGUWppJVw,Unknown,Russian,2015-09-23 15:53:00,2015-09-23 15:53:00,1679,255,1983,R,1
spearmintme,Тренер «Зенита» всех удивил  http://t.co/TNmHNlqYMc http://t.co/6yvwWPeRSN,Unknown,Russian,2015-09-23 16:31:00,2015-09-23 16:31:00,1679,255,1984,R,1
spearmintme,Видео. «Байкал» – ЦСКА http://t.co/5psl6UM0An,Unknown,Macedonian,2015-09-23 17:11:00,2015-09-23 17:11:00,1679,255,1985,R,1
spearmintme,"Мусульманская Албания так стремится в Евросоюз, что уже и у телеведущих грудь нараспашку  https://t.co/WfffCmYPGM с помощью @YouTube",Unknown,Russian,2015-09-24 07:31:00,2015-09-24 07:31:00,1679,255,1987,R,1
spearmintme,Сборная приросла «Локо»  http://t.co/ZKguZdYgCP http://t.co/l0bymmHKG6,Unknown,Serbian,2015-09-25 12:12:00,2015-09-25 12:13:00,1679,255,1995,R,1
spearmintme,Матч ЦСКА - «Локомотив» завершился вничью  http://t.co/fm0DaoNGcR http://t.co/sOTci06K8x,Unknown,Russian,2015-09-26 13:31:00,2015-09-26 13:32:00,1675,254,1999,R,1
spearmintme,Студенческий омбудсмен о продаже алкоголя с 21 года  http://t.co/8IW6Q9uEzM http://t.co/atWgBJBswC,Unknown,Russian,2015-09-26 16:36:00,2015-09-26 16:36:00,1675,254,2003,R,1
spearmintme,В самой большой мечети Великобритании идет пожар http://t.co/g0Ddrna3BA,Unknown,Russian,2015-09-26 16:36:00,2015-09-26 16:36:00,1675,254,2002,R,1
spearmintme,Дочь Ярмольника обворовали на 2 миллиона.   http://t.co/LaPL1hCF2F http://t.co/yH3wmu0x3O,Unknown,Russian,2015-09-26 21:13:00,2015-09-26 21:13:00,1675,254,2005,R,1
spearmintme,Папа Римский дал обещание  http://t.co/NmnXHTyvut http://t.co/IRB2wN3ifM,Unknown,Russian,2015-09-27 15:12:00,2015-09-27 15:12:00,1674,254,2009,R,1
spearmintme,Президент Грузии считает обязательным диалог с Россией http://t.co/UfVa5a6S0R,Unknown,Russian,2015-09-28 07:32:00,2015-09-28 07:32:00,1674,253,2015,R,1
spearmintme,Суд отказался проводить допрос Савченко на детекторе лжи http://t.co/lOMoCiQBWv,Unknown,Russian,2015-09-29 09:13:00,2015-09-29 09:13:00,1674,253,2021,R,1
spearmintme,Дмитрий Медведев пообещал лишить Киев преференций при «активации» соглашения с Европейским Союзом http://t.co/fI1N1d5tkI,Unknown,Russian,2015-09-29 16:51:00,2015-09-29 16:51:00,1673,253,2024,R,1
spearmintme,США не намерены вносить изменения в ход операций своих ВВС в Сирии http://t.co/GMQjBs35Nr,Unknown,Russian,2015-09-30 11:32:00,2015-09-30 11:32:00,1673,253,2032,R,1
spearmintme,"Мужчина погиб, попытавшись перебежать МКАД http://t.co/KUL5h52qJy",Unknown,Russian,2015-10-02 08:52:00,2015-10-02 08:52:00,1673,252,2044,R,1
spearmintme,"Coca-Cola, «Макдоналдс» и Visa потребовали немедленной отставки Блаттера: http://t.co/TiJ6fO7Zg6",Unknown,Russian,2015-10-02 23:11:00,2015-10-02 23:11:00,1673,252,2047,R,1
spearmintme,Центральные станции оранжевой линии московского метро закрыли на ремонт на сутки: http://t.co/4qyzeqq833,Unknown,Russian,2015-10-02 23:11:00,2015-10-02 23:11:00,1673,252,2048,R,1
spearmintme,"""Аэрофлот"" опроверг информацию о прекращении выписки билетов ""Трансаэро"" для ""Библио-Глобус""  http://t.co/LBKVOUpaeo",Unknown,Russian,2015-10-03 18:32:00,2015-10-03 18:32:00,1673,252,2053,R,1
spearmintme,В результате двух взрывов в Багдаде погибли 24 человека http://t.co/3zkVbpqEaj,Unknown,Russian,2015-10-03 20:52:00,2015-10-03 20:52:00,1673,252,2054,R,1
spearmintme,"Утренний обзор укро-прессы поднимает настроение. Особенно ржу с заголовков, типа: Мир без надзора США погружается в хаос. Америка, проснись!",Unknown,Russian,2015-10-04 07:52:00,2015-10-04 07:52:00,1673,252,2055,R,1
spearmintme,Россельхознадзор разъяснил данные о фальсификации 80% сыра в России  http://t.co/fgUI7sOtqW,Unknown,Russian,2015-10-04 17:13:00,2015-10-04 17:13:00,1673,254,2059,R,1
spearmintme,Боевики ИГ взорвали Триумфальную арку в Пальмире http://t.co/7nj0EUejGA,Unknown,Russian,2015-10-04 23:11:00,2015-10-04 23:11:00,1673,254,2060,R,1
spearmintme,Трамп связал проблемы Ближнего Востока с отсутствием Каддафи и Хусейна  http://t.co/Zr8F4tfvUV,Unknown,Russian,2015-10-04 23:52:00,2015-10-04 23:52:00,1673,254,2061,R,1
spearmintme,Уничтожением контрафактного алкоголя займется Росалкогольрегулирование  http://t.co/2udvBY6KFR,Unknown,Russian,2015-10-05 04:31:00,2015-10-05 04:31:00,1673,254,2062,R,1
spearmintme,ФСИН готовит переговорщиков для работы при беспорядках в колониях http://t.co/hnSrFPBCdB,Unknown,Ukrainian,2015-10-05 08:52:00,2015-10-05 08:52:00,1673,254,2064,R,1
spearmintme,Глава комитета ГД по обороне допустил использование ЧФ для блокады сирийского побережья http://t.co/jVg3IqdN4p,Unknown,Russian,2015-10-05 12:53:00,2015-10-05 12:53:00,1673,254,2065,R,1
spearmintme,После пожара в приюте для беженцев в Германии нашли тело погибшего  https://t.co/d1tJa2i2Vc http://t.co/PYt9ktJuE8,Unknown,Russian,2015-10-05 23:53:00,2015-10-05 23:53:00,1673,253,2069,R,1
spearmintme,"""Известия"": чиновников предлагают лишить доступа к Google, Yahoo и WhatsApp http://t.co/oN8O7W1h3e",Unknown,Russian,2015-10-06 03:31:00,2015-10-06 03:31:00,1673,253,2072,R,1
spearmintme,По факту налета на московский Сбербанк возбуждено дело http://t.co/PqJGuS4Bv1,Unknown,Russian,2015-10-07 04:51:00,2015-10-07 04:52:00,1673,254,2079,R,1
spearmintme,«Трансаэро» помогает пассажирам узнавать на сайте про свои рейсы http://t.co/LGzBYsyyNV http://t.co/gc8CSaCQLY,Unknown,Russian,2015-10-07 09:32:00,2015-10-07 09:32:00,1673,255,2080,R,1
spearmintme,Залюбила пиндосия до слабоумия... Чо там у прочих дружбанов СШП с моСКом? Волнуюсь... http://t.co/M3oXH5ixfi,Unknown,Ukrainian,2015-10-07 10:33:00,2015-10-07 10:33:00,1673,255,2081,R,1
spearmintme,Сколько шайб забросил Путин на хоккейном матче в свой день рождения  http://t.co/STxrkoYNjS http://t.co/8yd6QClTLT,Unknown,Russian,2015-10-07 15:13:00,2015-10-07 15:13:00,1673,255,2083,R,1
spearmintme,Пентагон: самолет коалиции в Сирии изменил маршрут полета из-за российского самолета http://t.co/wFskww6qoV,Unknown,Russian,2015-10-07 19:15:00,2015-10-07 19:16:00,1672,255,2085,R,1
spearmintme,".@yachmenyov611 а вот если бы Обама не разорвал экономику рашки вклочья, у тебя было бы 3 дачи и 7 машин! @izvestiyaKPSS @spina_putina",Unknown,Russian,2015-10-08 07:12:00,2015-10-08 07:12:00,1672,255,2087,R,1
spearmintme,"Молдавия подвергает российских журналистов «ковровым бомбардировкам», заявили в МИД  http://t.co/qf6YjVV3gv http://t.co/ybuAPCkRn0",Unknown,Russian,2015-10-08 13:54:00,2015-10-08 13:54:00,1671,255,2089,R,1
spearmintme,"Мутко рассказал, что происходит в ФИФА   http://t.co/a1XYBQRYvo http://t.co/lOkWJANvFt",Unknown,Russian,2015-10-08 16:11:00,2015-10-08 16:11:00,1671,255,2091,R,1
spearmintme,Мэр Сан-Паулу запретил Uber и одобрил создание онлайн-сервиса «Черное такси» http://t.co/Tqhsuemryh http://t.co/2sgQYjHx6H,Unknown,Russian,2015-10-09 02:51:00,2015-10-09 02:51:00,1671,256,2093,R,1
spearmintme,НАТО сообщило о готовности ввести войска в Турцию. Вместе им будет не так страшно.,Unknown,Russian,2015-10-09 09:32:00,2015-10-09 09:34:00,1671,256,2095,R,1
spearmintme,Двести двухсотых http://t.co/kqY0tjRqJp,Unknown,Russian,2015-10-09 17:15:00,2015-10-09 17:15:00,1671,256,2097,R,1
spearmintme,«Аэрофлот» выделит самолеты для перевозки клиентов «Библио Глобуса» http://t.co/25q1QX9Tb6 http://t.co/r9JY2f6fBz,Unknown,Ukrainian,2015-10-10 12:52:00,2015-10-10 12:52:00,1671,256,2101,R,1
spearmintme,Путин поздравил Лукашенко  http://t.co/elp2cVhiUr http://t.co/4BOEWi99Wy,Unknown,Macedonian,2015-10-12 07:54:00,2015-10-12 07:55:00,1671,257,2106,R,1
spearmintme,Автоледи на Porsche насмерть сбила женщину в Москве http://t.co/wuuEtgtH2Z http://t.co/7SHbD470ei,Unknown,Russian,2015-10-12 10:34:00,2015-10-12 10:34:00,1671,257,2107,R,1
spearmintme,Рамзан Кадыров испытал новую Lada Vesta http://t.co/RGZHRSOvsP http://t.co/xASzKN1RXB,Unknown,Russian,2015-10-12 18:14:00,2015-10-12 18:15:00,1671,258,2015,R,1
spearmintme,Роструд формирует специальную базу для работников «Трансаэро» http://t.co/p0ddpjB5f5 http://t.co/KSRkbcJRCC,Unknown,Russian,2015-10-13 07:53:00,2015-10-13 07:53:00,1671,258,2017,R,1
spearmintme,"Лавров опроверг сообщения, что Эр-Рияд предлагал РФ присоединиться к коалиции США http://t.co/xMTYCWqLtI",Unknown,Russian,2015-10-13 18:33:00,2015-10-13 18:35:00,1670,258,2019,R,1
spearmintme,Авиакомпания из Гонконга приостанавливает рейсы над Каспием http://t.co/RiJ1y6xnOi http://t.co/YKGXzJXZz6,Unknown,Russian,2015-10-14 07:11:00,2015-10-14 07:11:00,1670,258,2023,R,1
spearmintme,"Росавиация: версия о том, что MH17 сбили из «Бука» - не окончательная http://t.co/0DfCmGRmIk http://t.co/JIE3SFB3Vn",Unknown,Ukrainian,2015-10-14 11:32:00,2015-10-14 11:32:00,1671,258,2025,R,1
spearmintme,"S&P подтвердило рейтинг России на уровне ""ВВ+"" с негативным прогнозом http://t.co/w0Jvudv1Vx",Unknown,Russian,2015-10-16 16:53:00,2015-10-16 16:53:00,1671,259,2034,R,1
spearmintme,После заявления Кадырова Матвиенко высказала свое мнение по смертной казни  http://t.co/6Rawqf6qmq http://t.co/5NiSkELMXe,Unknown,Russian,2015-10-18 17:11:00,2015-10-18 17:11:00,1671,259,2041,R,1
spearmintme,Порошенко: стороны конфликта в Донбассе начали договариваться  http://t.co/E4BhRemg1Q http://t.co/zIHSUPdJFt,Unknown,Russian,2015-10-18 19:12:00,2015-10-18 19:12:00,1671,259,2042,R,1
spearmintme,СМИ: якутские генетики открыли новое смертельное заболевание  http://t.co/Zb5soOdhFy http://t.co/kXYvhJzQZm,Unknown,Russian,2015-10-19 09:32:00,2015-10-19 09:32:00,1671,259,2044,R,1
spearmintme,"ГУМВД: устроивший ДТП водитель Ferrari обманывал полицию, ему 18 лет http://t.co/wcpyXyDTUZ http://t.co/Rot2nyOO6m",Unknown,Russian,2015-10-19 11:52:00,2015-10-19 11:54:00,1671,259,2046,R,1
spearmintme,"Американские ученые: жизнь на Земле зародилась на 300 млн лет раньше, чем считалось прежде  https://t.co/uB7wMKaU3V",Unknown,Russian,2015-10-19 21:51:00,2015-10-19 21:52:00,1671,259,2050,R,1
spearmintme,Кабмин внес 220 объектов в Крыму в список объектов культурного наследия https://t.co/z4FjPpbObi,Unknown,Russian,2015-10-20 04:54:00,2015-10-20 04:54:00,1671,259,2051,R,1
spearmintme,Водитель «красногорского стрелка» Амирана Георгадзе сдался следователям  https://t.co/k2sylKgRea https://t.co/cqmsT0NZRx,Unknown,Russian,2015-10-20 05:32:00,2015-10-20 05:32:00,1671,259,2052,R,1
spearmintme,Прохоров подсчитал ущерб банков от банкротства «Трансаэро» https://t.co/Enif9f4OZY https://t.co/mh7oC4Ay19,Unknown,Russian,2015-10-20 11:12:00,2015-10-20 11:12:00,1671,259,2056,R,1
spearmintme,Зенит - чемпион!,Unknown,Russian,2015-10-20 21:53:00,2015-10-20 21:53:00,1671,259,2064,R,1
spearmintme,Водитель Ferrari признал вину в крупной аварии на Крымском валу  https://t.co/Zz9Ev5iWyv https://t.co/a2imcVuggO,Unknown,Russian,2015-10-21 07:34:00,2015-10-21 07:34:00,1671,259,2068,R,1
spearmintme,Собянин:Философия управления Москвы-постоянное движение вперед. Москва-это локомотив нашей страны #мгд,Unknown,Russian,2015-10-21 12:14:00,2015-10-21 12:14:00,1671,259,2069,R,1
spearmintme,Какие технологии из «Назад в будущее 2» оказались реализованы: https://t.co/MAb88jSzBj через @gazetaru,Unknown,Russian,2015-10-21 14:54:00,2015-10-21 14:54:00,1671,259,2071,R,1
spearmintme,Черчесов: если «Легия» победит «Брюгге» — останется в гонке за выход из группы https://t.co/sJafom2BwN,Unknown,Russian,2015-10-21 16:13:00,2015-10-21 16:13:00,1670,258,2073,R,1
spearmintme,'@SFGO76 он уже и в Сирии побывал?',Unknown,Russian,2015-10-21 17:43:00,2015-10-21 17:43:00,1670,257,2074,R,1
spearmintme,Бразильские болельщики за сутки купили 240 тысяч билетов на Олимпиаду в Рио-де-Жанейро https://t.co/dkP7PUQW1n,Unknown,Russian,2015-10-22 06:57:00,2015-10-22 06:57:00,1670,257,2075,R,1
spearmintme,"СССР развалился из-за внутренних причин, но не без помощи противников, заявил Владимир Путин https://t.co/3cNyy3GdoH",Unknown,Ukrainian,2015-10-22 17:12:00,2015-10-22 17:12:00,1670,257,2082,R,1
spearmintme,Путин: Россия не планирует становиться посредником между суннитами и шиитами  https://t.co/7HddmM9cnQ https://t.co/9PgLrKwhyq,Unknown,Russian,2015-10-22 18:33:00,2015-10-22 18:33:00,1670,257,2083,R,1
spearmintme,"Хиллари Клинтон обвинили в Конгрессе в том, что она не говорила правду народу США https://t.co/hs5dt8yiYv",Unknown,Russian,2015-10-22 19:35:00,2015-10-22 19:35:00,1670,257,2084,R,1
spearmintme,США не намерены сотрудничать с российско-иорданским координационным центром против ИГ https://t.co/mfurOhoIIH,Unknown,Russian,2015-10-23 20:33:00,2015-10-23 20:41:00,1669,258,2089,R,1
spearmintme,Экс-главу Совбеза Грузии Бокерия вызвали на допрос по делу о захвате власти https://t.co/9fFHmS0UIq https://t.co/SO9P8lWqRJ,Unknown,Russian,2015-10-24 17:13:00,2015-10-24 17:13:00,1669,258,2092,R,1
spearmintme,"М. Кержаков: очень рад, что выхожу на стадион со стрелкой на груди https://t.co/98rZWDJPT0",Unknown,Russian,2015-10-24 17:13:00,2015-10-24 17:13:00,1669,258,2091,R,1
spearmintme,ВИДЕО. Пожар на рынке в Екатеринбурге  https://t.co/NKfqnNU4o9 https://t.co/Pq2WwUYpLD,Unknown,Russian,2015-10-24 17:14:00,2015-10-24 17:14:00,1669,258,2093,R,1
spearmintme,Гайдар выгнали с избирательного участка https://t.co/1I8GvzHjkB,Unknown,Russian,2015-10-25 22:53:00,2015-10-25 22:55:00,1669,258,2098,R,1
spearmintme,Саакашвили обвинили в фальсификации выборов  https://t.co/eJVXseDbdi https://t.co/8SBW0lhBnh,Unknown,Russian,2015-10-26 05:54:00,2015-10-26 05:54:00,1669,259,2099,R,1
