author_id,content,region,language,publish_date,harvested_date,following,followers,updates,post_type,retweet
stascyTr,Popular Female Hunter Commits Suicide After Incessant Bullying from the Left https://t.co/cew1jd0jZs https://t.co/p1AgtpVZNa,Unknown,English,2017-07-25 08:53:00,2017-07-25 08:53:00,0,0,1,,0
stascyTr,The TRUTH About Mueller’s Crooked Witch Hunt https://t.co/Ex4NwMuwzI https://t.co/FSg1AWAqHR,Unknown,English,2017-07-25 08:53:00,2017-07-25 08:53:00,0,0,4,,0
stascyTr,VIDEO : Kellyanne WARNS Sarah Huckabee! https://t.co/NSsFjxO2Do https://t.co/rSeSyrhkRZ,Unknown,Arabic,2017-07-25 08:53:00,2017-07-25 08:53:00,0,0,3,,0
stascyTr,How President Trump Has Unchained ICE https://t.co/AqIMie3i5i https://t.co/KaS1RHZlI8,Unknown,English,2017-07-25 08:53:00,2017-07-25 08:54:00,0,0,5,,0
stascyTr,New White House Lawyer Taking MASSIVE Pay Cut to Help Trump https://t.co/84Qc1djER0 https://t.co/ymRlx5sYG2,Unknown,English,2017-07-25 08:53:00,2017-07-25 08:53:00,0,0,2,,0
stascyTr,WHY Dems are DOOMED and a “New Slogan” Won’t Help! https://t.co/IrxXfbrw3c https://t.co/Wq1EVN9oTa,Unknown,English,2017-07-25 08:59:00,2017-07-25 08:59:00,0,0,6,,0
