author_id,content,region,language,publish_date,harvested_date,following,followers,updates,post_type,retweet
svetadubooo,Мединский подал иск о защите прав на свои книги http://t.co/kxmfeoutzj,United States,Bulgarian,2015-09-10 13:13:00,2015-09-10 13:13:00,365,324,1835,R,1
svetadubooo,Адвокат Кадырова направил жалобу на решение суда Южно-Сахалинска #новости http://t.co/rZ353n8VJV,United States,Russian,2015-09-11 03:13:00,2015-09-11 03:13:00,365,324,1838,R,1
svetadubooo,Защитник «Амкара» Зайцев: когда учился в «Черноморце» подавал мячи Герусу http://t.co/Sil9CykgMN,United States,Russian,2015-09-11 07:52:00,2015-09-11 07:52:00,365,324,1839,R,1
svetadubooo,ЛУЧШИЕ!  Российские гимнастки стали чемпионками мира в упражнениях с булавами и обручами.   http://t.co/11EFDvzrEN http://t.co/sOWKnInzYT,United States,Russian,2015-09-13 14:13:00,2015-09-13 14:14:00,363,323,1844,R,1
svetadubooo,Нарышкин: Россия призывает мировое сообщество начать сотрудничать с властями Сирии  http://t.co/5dU5ON8bg2,United States,Russian,2015-09-16 05:11:00,2015-09-16 05:11:00,364,323,1851,R,1
svetadubooo,ВИДЕО. Камера GoPro попала крокодилу в пасть  http://t.co/R9fD9pBhfW http://t.co/U6iJ6FYvCS,United States,Russian,2015-09-17 06:51:00,2015-09-17 06:51:00,364,323,1855,R,1
svetadubooo,ФСБ: свыше 5 тысяч граждан из России и стран Центральной Азии воюют на стороне ИГ http://t.co/cqxdF9SEHk,United States,Russian,2015-09-18 08:52:00,2015-09-18 08:52:00,364,323,1861,R,1
svetadubooo,"Первый в России 3D-принтер, печатающий композитами, создан в Сколково #КогдаЭтоИзобретут http://t.co/GOxsVwxMZg",United States,Russian,2015-09-18 10:15:00,2015-09-18 10:15:00,364,323,1863,R,1
svetadubooo,Место проведения жеребьёвки Кубка конфедераций — 2017 определят зимой http://t.co/CO2aM8hO15,United States,Russian,2015-09-18 15:54:00,2015-09-18 15:54:00,364,323,1865,R,1
svetadubooo,Самолет Самара-Хургада авиакомпании Azur air благополучно приземлился в аэропорту Ростова-на-Дону  http://t.co/Eufu0Ashkj,United States,Russian,2015-09-19 18:32:00,2015-09-19 18:32:00,364,323,1868,R,1
svetadubooo,Исламисты выложили в Интернет фото расстрела 56 сирийских солдат http://t.co/XLbN6AtvY0,United States,Russian,2015-09-19 23:52:00,2015-09-19 23:52:00,364,323,1870,R,1
svetadubooo,Медведь в Приморье пришел в поселок за желудями и покусал девушку http://t.co/I6sG2tmdMH,United States,Russian,2015-09-21 02:51:00,2015-09-21 02:51:00,364,323,1873,R,1
svetadubooo,"Еврокомиссия получила предложения ""Газпрома"" по снятию антимонопольных претензий http://t.co/THZ6JHYFQg",United States,Russian,2015-09-21 17:31:00,2015-09-21 17:31:00,364,324,1876,R,1
svetadubooo,МИД Омана вызвал посла ОАЭ в связи с обстрелом резиденции посла в Сане http://t.co/q7sKWr5RYK © Flickr http://t.co/svsqISTeRH,United States,Russian,2015-09-23 02:12:00,2015-09-23 02:12:00,363,324,1882,R,1
svetadubooo,«Локомотив» победил «Торпедо» в Армавире и вышел в 1/8 финала Кубка России http://t.co/WE6DcGcSwU,United States,Russian,2015-09-23 15:18:00,2015-09-23 15:19:00,363,324,1884,R,1
svetadubooo,Тренер «Ростова»: некоторые работники клуба уже два дня не выходят на работу http://t.co/1uCd3X486K,United States,Russian,2015-09-23 15:53:00,2015-09-23 15:53:00,363,324,1885,R,1
svetadubooo,«Сибирь» «всухую» обыграла ярославский «Локомотив» http://t.co/L2sRKVN8zG,United States,Russian,2015-09-24 04:53:00,2015-09-24 04:53:00,363,325,1886,R,1
svetadubooo,ОБСЕ: военные ДНР угрожали пристрелить наблюдателей  http://t.co/020TFfCk9N http://t.co/rzpFobCIBD,United States,Russian,2015-09-24 06:52:00,2015-09-24 06:52:00,363,325,1888,R,1
svetadubooo,Премия РБК запустила голосование в категории «Люди». Сделайте свой выбор: http://t.co/3UUyOV5pPo #RBCawards2015 http://t.co/iaKIyC9aq0,United States,Russian,2015-09-24 20:52:00,2015-09-24 20:52:00,362,323,1892,R,1
svetadubooo,Тарасов и Файзулин вызваны в сборную России на матчи с Молдовией и Черногорией http://t.co/yzqlbVcXSx,United States,Russian,2015-09-25 09:13:00,2015-09-25 09:13:00,362,323,1893,R,1
svetadubooo,"""Аэрофлоту"" и ""Трансаэро"" запрещены полеты на Украину http://t.co/sctRop9Nza",United States,Ukrainian,2015-09-25 12:32:00,2015-09-25 12:32:00,362,323,1896,R,1
svetadubooo,Европа и США: абсурдные ожидания   http://t.co/PAbQ0nSKMr http://t.co/vHMr5y7wZQ,United States,Russian,2015-09-26 07:33:00,2015-09-26 07:33:00,359,323,1897,R,1
svetadubooo,ФОТОРЕПОРТАЖ. В «Останкино» открылся музей «Поля чудес»  http://t.co/YEsH2aGXmE http://t.co/aqYcIGKUce,United States,Russian,2015-09-26 09:52:00,2015-09-26 09:52:00,359,323,1898,R,1
svetadubooo,Пожар в лондонской мечети: огонь охватил половину первого этажа.   http://t.co/Fwlxl22rij http://t.co/shkAoClMsY,United States,Russian,2015-09-26 17:55:00,2015-09-26 17:55:00,360,324,1901,R,1
svetadubooo,"Путин: почти все участники сессии ГА ООН поднимут проблему борьбы с терроризмом, ""и мне тоже не уйти от этой темы"" http://t.co/1xvgm54nVe",United States,Russian,2015-09-27 12:13:00,2015-09-27 12:13:00,360,324,1902,R,1
svetadubooo,"армия тренирует каждого мужчину в РФ. ты либо год бегаешь в армии, либо 10 лет от военкомата",United States,Russian,2015-09-27 18:11:00,2015-09-27 18:11:00,360,324,1907,R,1
svetadubooo,"российский солдат может одеться за 45 секунд. из них 30 секунд он будет убеждать командира, что ему сегодня ко второй паре",United States,Russian,2015-09-27 18:44:00,2015-09-27 18:45:00,360,324,1908,R,1
svetadubooo,Ватникам не понять… http://t.co/hrgJWyZiRT,United States,Ukrainian,2015-09-27 19:53:00,2015-09-27 19:53:00,360,324,1909,R,1
svetadubooo,На Тайване из-за тайфуна отменены десятки авиарейсов и концерт Джона Бон Джови http://t.co/ZweIMny1r2,United States,Russian,2015-09-28 08:54:00,2015-09-28 08:54:00,360,324,1911,R,1
svetadubooo,Ложь на ГенАссамблее ООН http://t.co/iQT7JIHKvo,United States,Russian,2015-09-28 17:51:00,2015-09-28 17:51:00,360,324,1914,R,1
svetadubooo,"Оказывается, на пластинках можно заработать больше, чем на YouTube, Spotify и VEVO вместе взятых    https://t.co/Fz0QcMloE9",United States,Russian,2015-09-29 17:54:00,2015-09-29 17:54:00,360,324,1920,R,1
svetadubooo,ОНЛАЙН. Лига чемпионов. «Зенит» — «Гент»  http://t.co/Ge8Z1DmkNP http://t.co/U2XETOD5G5,United States,Uzbek,2015-09-29 19:32:00,2015-09-29 19:32:00,360,324,1921,R,1
svetadubooo,Источник: итоги доклада по крушению Boeing в Донбассе будут переданы в Совбез ООН #новости http://t.co/TjPbddbyhL,United States,Russian,2015-09-30 07:32:00,2015-09-30 07:32:00,360,324,1922,R,1
svetadubooo,Россия улучшила позицию в рейтинге конкурентоспособности стран http://t.co/bjlsWZKsiy http://t.co/GnGWnZgsa6,United States,Russian,2015-09-30 07:32:00,2015-09-30 07:32:00,360,324,1923,R,1
svetadubooo,Асад обратился к РФ за военной помощью  http://t.co/SLTIRuRb4W http://t.co/hgmKaK90Jw,United States,Russian,2015-09-30 08:31:00,2015-09-30 08:31:00,360,324,1924,R,1
svetadubooo,Tesla представила семейный кроссовер. Он еще и спортивный  https://t.co/3rHUmTvoFM http://t.co/kb8YidgyHZ,United States,Russian,2015-09-30 10:32:00,2015-09-30 10:33:00,360,324,1925,R,1
svetadubooo,Болельщики на матче «Зенит» — «Гент»: фоторепортаж с «Петровского» http://t.co/xoeRDax6MB #спб  #спорт,United States,Russian,2015-09-30 12:57:00,2015-09-30 12:58:00,359,323,1927,R,1
svetadubooo,Фальсификат Volkswagen затронул 11 миллионов автомобилей http://t.co/IvZZlWmClG,United States,Russian,2015-09-30 17:33:00,2015-09-30 17:33:00,359,323,1931,R,1
svetadubooo,The Jesus and Mary Chain запишет первый за 17 лет альбом: http://t.co/i0cQUayCYz,United States,Russian,2015-10-01 10:13:00,2015-10-01 10:13:00,359,324,1935,R,1
svetadubooo,110-летний беженец из Афганистана пришел в Германию пешком  http://t.co/CNb6UpLa0A http://t.co/5ylAhKKXlz,United States,Russian,2015-10-01 12:15:00,2015-10-01 12:15:00,359,325,1937,R,1
svetadubooo,Авиация США за сутки нанесла один удар по позициям ИГ в Сирии http://t.co/qmK7TN5m37,United States,Ukrainian,2015-10-01 14:31:00,2015-10-01 14:31:00,359,324,1939,R,1
svetadubooo,Р. Билялетдинов: «Краснодар» забьёт «Габале» два мяча и не пропустит http://t.co/kyaex2iUCU,United States,Ukrainian,2015-10-01 17:13:00,2015-10-01 17:13:00,359,323,1940,R,1
svetadubooo,"Apple патентует ""умное кольцо"". Для хипстеров, решивших пожениться (ну ладно, не совсем)  https://t.co/g4b0x6rmXr",United States,Ukrainian,2015-10-01 19:13:00,2015-10-01 19:14:00,359,322,1941,R,1
svetadubooo,В ходе стрельбы в торговом центре Йоханнесбурга пострадали 12 человек http://t.co/uQM9X7cYWK,United States,Russian,2015-10-02 14:13:00,2015-10-02 14:13:00,359,322,1945,R,1
svetadubooo,Обсуждаем военную операцию России в эфире РБК-ТВ. Пишите в эфир с хештегом #Виттель. Онлайн: http://t.co/rdxWieBEeV http://t.co/KYjW0AlLQr,United States,Russian,2015-10-02 16:52:00,2015-10-02 16:52:00,359,322,1948,R,1
svetadubooo,Картину Энди Уорхола с Мао Цзедуном выставят на торги за $40 млн http://t.co/TQNxUwUqvO,United States,Ukrainian,2015-10-02 22:31:00,2015-10-02 22:31:00,359,323,1950,R,1
svetadubooo,Школьники из Петербурга предложили «космические» идеи летчику-космонавту Андрею Борисенко http://t.co/VdkAy6Jzi6 http://t.co/VsNAv8YNwA,United States,Russian,2015-10-04 00:51:00,2015-10-04 00:52:00,358,323,1953,R,1
svetadubooo,"Одного из детей, отравившихся в Новосибирске, выписали из больницы  http://t.co/UaBDaBtN1L",United States,Russian,2015-10-05 05:52:00,2015-10-05 05:52:00,358,322,1956,R,1
svetadubooo,"по последним подсчётам Министерства обороны, Восточная Сибирь готова принять до 200 миллионов пленных",United States,Russian,2015-10-05 12:54:00,2015-10-05 12:55:00,358,322,1959,R,1
svetadubooo,Лопота сообщил о желании США допросить его по иску Boeing http://t.co/IzFutY0WvU http://t.co/5QlAl06vLp,United States,Russian,2015-10-05 13:51:00,2015-10-05 13:51:00,358,322,1961,R,1
svetadubooo,Сотрудники Air France сорвали заседание совета директоров (и одежду с топ-менеджера):   https://t.co/yXXbgEOCVH http://t.co/QtAVbBJcNm,United States,Russian,2015-10-05 20:13:00,2015-10-05 20:13:00,358,322,1962,R,1
svetadubooo,Россия предложила сирийской оппозиции официально назвать свой состав http://t.co/9bCUbhmy7j http://t.co/Ja4gPwKYev,United States,Russian,2015-10-05 22:31:00,2015-10-05 22:31:00,358,322,1963,R,1
svetadubooo,Голландская GasTerra ведет переговоры с «Газпромом» о пересмотре цены http://t.co/pneFj5pebO http://t.co/ppVAczT8NT,United States,Russian,2015-10-06 18:11:00,2015-10-06 18:11:00,358,322,1967,R,1
svetadubooo,Авиаудар по позициям «Исламского государства» в Сирии сняли на камеру GoPro. Смотрите видео без комментариев.  https://t.co/AlkS474QvX,United States,Russian,2015-10-06 19:32:00,2015-10-06 19:32:00,358,322,1968,R,1
svetadubooo,"Глава МВД Баварии заявил, что не будет пускать беженцев из Австрии #новости http://t.co/TOkyHo9yHP",United States,Russian,2015-10-08 04:59:00,2015-10-08 04:59:00,358,323,1974,R,1
svetadubooo,В России запретили распространять информацию о методах откатов https://t.co/BevbQWCnrT а как же новым чиновникам набираться знаний?,United States,Russian,2015-10-08 07:13:00,2015-10-08 07:13:00,358,323,1975,R,1
svetadubooo,Минюст разрешил «Победе» летать за рубеж https://t.co/0HWJjdoONT,United States,Russian,2015-10-08 09:33:00,2015-10-08 09:33:00,358,323,1976,R,1
svetadubooo,В Подмосковье на адвоката завели уголовное дело за повторную езду в пьяном виде http://t.co/I1Bvzu1wj4,United States,Macedonian,2015-10-08 10:10:00,2015-10-08 10:10:00,358,323,1977,R,1
svetadubooo,Spectator: Путин перехитрил Запад http://t.co/XTTIPdZUuw,United States,Ukrainian,2015-10-09 11:51:00,2015-10-09 11:52:00,358,322,1983,R,1
svetadubooo,شكرا HBO !!!,United States,Farsi (Persian),2015-10-10 05:53:00,2015-10-10 05:53:00,358,322,1984,R,1
svetadubooo,Бэйл: ещё маленьким ребёнком я мечтал сыграть на крупном турнире http://t.co/j65gl2sg9u,United States,Russian,2015-10-10 21:52:00,2015-10-10 21:52:00,359,322,1990,R,1
svetadubooo,ЮФУ выиграл мини-турнир НСФЛ в Смоленске http://t.co/kZXqSApmHF,United States,Serbian,2015-10-11 21:14:00,2015-10-11 21:15:00,359,322,1995,R,1
svetadubooo,Dell объявила о поглощении EMC за рекордную сумму: http://t.co/lqGlQJXlRa,United States,Russian,2015-10-12 13:52:00,2015-10-12 13:53:00,359,320,1996,R,1
svetadubooo,"Карочи: мы не объяснили хохлам почему мы запретили их полеты после того, как они запретили наши. Поэтому они закрыли небо и доя Ютейра ))))",United States,Russian,2015-10-12 15:11:00,2015-10-12 15:11:00,359,320,1933,R,1
svetadubooo,Губернатор Одесской области Украины Михаил Саакашвили пристроил к зданию администрации стеклянную приемную http://t.co/zb1VCQsUat,United States,Russian,2015-10-12 19:51:00,2015-10-12 19:51:00,359,320,1909,R,1
svetadubooo,Генерал: факт поражения Boeing ракетой 9М38 доказывает вину Украины http://t.co/py1LLPtGcf http://t.co/iltT0zWq4u,United States,Russian,2015-10-13 15:12:00,2015-10-13 15:12:00,359,320,1914,R,1
svetadubooo,В Австрии японские туристы попали в ДТП http://t.co/m1okfcG86N http://t.co/QDzi73KvS0,United States,Russian,2015-10-13 21:43:00,2015-10-21 14:04:00,359,320,1916,R,1
svetadubooo,"Индекс крупнейшей латиноамериканской фондовой биржи Bovespa упал на 3,99% http://t.co/WoynCnw3OO",United States,Russian,2015-10-13 23:52:00,2015-10-13 23:52:00,359,320,1917,R,1
svetadubooo,Путин дал старт строительству в Амурской области газоперерабатывающего завода http://t.co/RNtGIq2gs8,United States,Russian,2015-10-14 09:34:00,2015-10-14 09:34:00,359,320,1919,R,1
svetadubooo,Смотрите прямую трансляцию антиправительственного митинга в столице Молдавии на Ria.ru: http://t.co/YNr82Ull99 http://t.co/96s85cluwb,United States,Russian,2015-10-15 08:56:00,2015-10-15 08:56:00,359,320,1921,R,1
svetadubooo,Кто возглавит список «Единой России» на выборах в Госдуму  http://t.co/Yg7dP3AZNc http://t.co/HZaeWUOLz7,United States,Russian,2015-10-15 16:12:00,2015-10-15 16:12:00,358,320,1922,R,1
svetadubooo,"Клонцак: несмотря на тяжёлую финансовую ситуацию, игроки КАМАЗа бьются http://t.co/jGtX1xMbmO",United States,Russian,2015-10-15 19:53:00,2015-10-15 19:53:00,358,321,1925,R,1
svetadubooo,СМИ: Путину предложат упразднить ряд министерств и ведомств http://t.co/eSHAERelvQ http://t.co/gyRNUJwfgT,United States,Russian,2015-10-15 21:51:00,2015-10-15 21:51:00,358,321,1926,R,1
svetadubooo,"Пока вы спали, Центробанк отозвал лицензии у двух крупных банков:  https://t.co/Stv9Ueg8G5 http://t.co/KoHvSKtGrx",United States,Russian,2015-10-16 07:14:00,2015-10-16 07:14:00,358,321,1928,R,1
svetadubooo,Власти Москвы приняли решение по платным парковкам у метро  http://t.co/3DgUZ6IWFg http://t.co/AVB1sn21fK,United States,Russian,2015-10-16 13:33:00,2015-10-16 13:33:00,358,321,1929,R,1
svetadubooo,В министерстве обороны сообщили об уничтожении более 450 объектов «Исламского государства» в Сирии http://t.co/iBSOgzgvg7,United States,Russian,2015-10-16 14:13:00,2015-10-16 14:14:00,358,321,1930,R,1
svetadubooo,«Кубань» — «Зенит»: онлайн-трансляция матча начнётся 17 октября в 16:30 http://t.co/Fe4udUKL8D,United States,Russian,2015-10-17 09:11:00,2015-10-17 09:11:00,358,321,1934,R,1
svetadubooo,"«Спартак» уступил «Локо», «Анжи» разгромил «Краснодар» в молодёжном первенстве http://t.co/VNNzQB83L7",United States,Russian,2015-10-17 13:53:00,2015-10-17 13:53:00,358,321,1938,R,1
svetadubooo,"Думбия: не считаю, что ЦСКА сыграл с «Уралом» расслабленно http://t.co/3bH7R9WfqC",United States,Ukrainian,2015-10-17 14:13:00,2015-10-17 14:13:00,358,321,1939,R,1
svetadubooo,Премер: Турция будет сбивать нарушающие воздушное пространство самолеты  http://t.co/jghbFu9Gwe,United States,Russian,2015-10-17 17:33:00,2015-10-17 17:33:00,358,321,1942,R,1
svetadubooo,С помощью заправки на Луне и Марсе можно будет лучше изучить другие планеты http://t.co/PmOt39bwHO http://t.co/0E1221YJGI,United States,Russian,2015-10-19 04:51:00,2015-10-19 04:51:00,358,323,1947,R,1
svetadubooo,Источник: Mercedes протаранил 10 автомобилей в Москве  https://t.co/qzUf50GHMP,United States,Russian,2015-10-19 08:53:00,2015-10-19 08:53:00,358,323,1948,R,1
svetadubooo,Подозреваемый в убийстве чиновников мог пойти на преступление после лишения госзаказов http://t.co/F7lrRXzOmk,United States,Russian,2015-10-19 15:15:00,2015-10-19 15:15:00,358,324,1949,R,1
svetadubooo,РЖД: первый участок ВСМ Москва - Казань могут сдать уже в 2018 году http://t.co/SVCAwdmbmo,United States,Russian,2015-10-19 15:33:00,2015-10-19 15:33:00,358,324,1950,R,1
svetadubooo,"после начала российской антитеррористической операции в Сирии американские кураторы сполна ощутили на себе, что такое осенняя депрессия",United States,Russian,2015-10-19 16:15:00,2015-10-19 16:15:00,358,324,1951,R,1
svetadubooo,В Вооруженные силы России впервые поступили на службу три близнеца-контрактника https://t.co/MPolUO8YqP,United States,Russian,2015-10-20 14:52:00,2015-10-20 14:52:00,358,325,1956,R,1
svetadubooo,СМИ: религиозные деятели предложили расширить президентский закон о защите Корана и Библии https://t.co/3hkNxiuLhA,United States,Russian,2015-10-20 15:11:00,2015-10-20 15:12:00,358,325,1957,R,1
svetadubooo,#5причинбомбитьигил всё в этом видео https://t.co/ux2hQ9oawt,United States,Russian,2015-10-21 16:39:00,2015-10-21 16:40:00,358,325,1963,R,1
svetadubooo,#5причинбомбитьигил это в российских интересах https://t.co/T99rTBMxeE,United States,Russian,2015-10-21 16:40:00,2015-10-21 16:40:00,358,325,1964,R,1
svetadubooo,#5причинбомбитьигил сирийский народ и его легитимный лидер попросили о помощи и мы законно вмешались https://t.co/HvqO4QpZdb,United States,Russian,2015-10-21 16:40:00,2015-10-21 16:41:00,358,325,1965,R,1
svetadubooo,Сегодня исполняется 119 лет со дня рождения Евгения Шварца.    #Голос_истории https://t.co/LXYB8JNEgk,United States,Russian,2015-10-21 16:54:00,2015-10-21 16:54:00,358,325,1966,R,1
svetadubooo,Собянин: Москва и Токио - серьезные экономические партнеры https://t.co/4w5UQx3KFP,United States,Russian,2015-10-22 06:33:00,2015-10-22 06:33:00,358,325,1972,R,1
svetadubooo,"Доброе утро, #Казань! Замечательного настроения! #БодрыйВестник https://t.co/1eerBrMvYt",United States,Russian,2015-10-22 06:33:00,2015-10-22 06:33:00,358,325,1973,R,1
svetadubooo,На матче 13-го тура РФПЛ «Динамо» — «Спартак» ожидается аншлаг https://t.co/6az7LXKhGr,United States,Russian,2015-10-22 09:56:00,2015-10-22 09:56:00,358,325,1974,R,1
svetadubooo,"""Матч-ТВ"" будет оснащен олимпийским оборудованием стоимостью $150 млн, сообщила Тина Канделаки https://t.co/W7mfk60RgF",United States,Russian,2015-10-22 13:32:00,2015-10-22 13:32:00,358,325,1975,R,1
svetadubooo,"WikiLeaks выдал ЦРУ с потрохами, рассказав о стратегии США в Афганистане https://t.co/B2F1XCSVh3 https://t.co/t5spxj9YEz",United States,Russian,2015-10-22 20:34:00,2015-10-22 20:34:00,359,326,1977,R,1
svetadubooo,"Поиски плашкоута ""Парамушир"" на Камчатке возобновились с рассветом  https://t.co/DHY6twCFFw",United States,Russian,2015-10-22 22:52:00,2015-10-22 22:52:00,359,326,1979,R,1
svetadubooo,Официальный курс доллара опустился ниже 62 рублей: https://t.co/c5DpufkxI6,United States,Russian,2015-10-23 11:31:00,2015-10-23 11:34:00,359,326,1980,R,1
svetadubooo,Число жертв теракта в мечети нигерийского города Майдугури возросло до 28 https://t.co/up2Mq2IZTJ,United States,Ukrainian,2015-10-23 12:14:00,2015-10-23 12:14:00,359,326,1982,R,1
svetadubooo,Кредиторам «Трансаэро» предложили план спасения перевозчика: https://t.co/eQUps64cle,United States,Russian,2015-10-23 17:32:00,2015-10-23 17:33:00,359,326,1983,R,1
svetadubooo,"Россия предложила Украине проявить волю, сняв ограничения по авиасообщению https://t.co/8wxQbhiWz2 https://t.co/0Uf6OCdqh2",United States,Russian,2015-10-23 22:52:00,2015-10-23 22:52:00,359,326,1984,R,1
svetadubooo,Барак Обама изобразил республиканцев в виде знаменитого Сердитого кота (ВИДЕО) https://t.co/TjQIrdlJov https://t.co/GkkAytHh4b,United States,Russian,2015-10-24 09:11:00,2015-10-24 09:20:00,359,326,1985,R,1
svetadubooo,Нарышкин и Матвиенко могут поехать в Сирию  https://t.co/g7dxtsDEWa https://t.co/zGWrJZ2OxZ,United States,Russian,2015-10-24 11:51:00,2015-10-24 11:51:00,359,326,1986,R,1
