author_id,content,region,language,publish_date,harvested_date,following,followers,updates,post_type,retweet
svetadubooo,Путин и Олланд договорились о координации действий в борьбе с ИГ https://t.co/8yzMe0vdbR https://t.co/mLmqjyPuE9,United States,Russian,2015-11-17 15:59:00,2015-11-17 15:59:00,359,327,2175,R,1
svetadubooo,Порошенко допустил военных НАТО на Украину  https://t.co/dc4hePvK4I https://t.co/38mVBMBbMk,United States,Russian,2015-11-17 18:33:00,2015-11-17 18:33:00,359,327,2178,R,1
svetadubooo,NYT: семья одного из парижских террористов желала ему смерти  https://t.co/22q79MOG5g https://t.co/ebwGFJkLNX,United States,Russian,2015-11-18 07:37:00,2015-11-18 07:37:00,359,327,2182,R,1
svetadubooo,Рейс Egypt Air задержали из-за сообщения о бомбе на борту  https://t.co/lsm3R2kdLw https://t.co/VwrR94tOYB,United States,Russian,2015-11-18 08:14:00,2015-11-18 08:14:00,359,327,2183,R,1
svetadubooo,"СМИ: смертница под Парижем все-таки успела взорвать себя По данным France Info одна из трех террористов, которые …  https://t.co/24PVV6pbCm",United States,Russian,2015-11-18 08:14:00,2015-11-18 08:15:00,359,327,2184,R,1
svetadubooo,Первая смертница Парижа  https://t.co/WWFifpM39u https://t.co/OMedNSwPY6,United States,Russian,2015-11-18 09:15:00,2015-11-18 09:16:00,359,327,2185,R,1
svetadubooo,Путин уведомил наследного принца Абу-Даби о результатах операции ВКС в Сирии https://t.co/ap7lb4Ep0s https://t.co/oNtu7VseZ8,United States,Russian,2015-11-18 13:36:00,2015-11-18 13:36:00,358,327,2187,R,1
svetadubooo,Суд Грозного оштрафовал BMW на рекордную сумму: https://t.co/WbnZzm2zFv,United States,Ukrainian,2015-11-18 16:32:00,2015-11-18 16:32:00,358,327,2189,R,1
svetadubooo,"В Новосибирском театре, где сменили директора, сделали ремонт. Архитекторы удивлены уровнем https://t.co/IQwF0bx1c8 https://t.co/kAPzSsldbZ",United States,Russian,2015-11-18 18:38:00,2015-11-18 18:43:00,358,327,2190,R,1
svetadubooo,'@Dasssha2010 кому интересно вот тут читать https://t.co/0shsO74wqX',United States,Russian,2015-11-18 20:38:00,2015-11-18 20:41:00,358,327,2192,R,1
svetadubooo,"Нолито: пока не решится одна деталь, не продлю контракт с «Сельтой» https://t.co/l4S8M6B8rU",United States,Ukrainian,2015-11-19 05:52:00,2015-11-19 05:52:00,358,327,2194,R,1
svetadubooo,Гражданку Белоруссии приговорили к штрафу за организацию борделя в Москве https://t.co/G30unHkBYG,United States,Russian,2015-11-19 06:18:00,2015-11-19 06:18:00,358,327,2195,R,1
svetadubooo,Агент: Кандрева внимательно рассмотрел бы предложение «Барселоны» https://t.co/wYMxhxP3ql,United States,Russian,2015-11-19 09:24:00,2015-11-19 09:24:00,358,327,2196,R,1
svetadubooo,В России создан Федеральный институт оценки качества образования https://t.co/sItNG7zHMR https://t.co/BmMvYTD0ML,United States,Russian,2015-11-19 10:08:00,2015-11-19 10:09:00,358,327,2198,R,1
svetadubooo,СМИ: один из парижских террористов курил марихуану и пил водку https://t.co/7a55CTq9Kt https://t.co/6iixpRoBUd,United States,Serbian,2015-11-19 11:52:00,2015-11-19 11:52:00,358,327,2199,R,1
svetadubooo,РФ призвала партнеров подтвердить солидарность в борьбе с терроризмом https://t.co/53FnXoHFgk https://t.co/QAoWb0m22o,United States,Russian,2015-11-19 13:13:00,2015-11-19 13:13:00,358,327,2201,R,1
svetadubooo,СРОЧНО. США изменят тактику борьбы с ИГИЛ  https://t.co/NOQYAV8pLJ https://t.co/W5USZFL2Pr,United States,Russian,2015-11-19 16:04:00,2015-11-19 16:06:00,358,327,2202,R,1
svetadubooo,В Стамбуле дикий кабан гонялся за людьми  Видео:  https://t.co/Mcd7uLJcTK https://t.co/IIAbBmsUKU,United States,Ukrainian,2015-11-19 16:33:00,2015-11-19 16:33:00,358,327,2203,R,1
svetadubooo,"Депутат ГД: помогая Украине, Британия не дает конфликту затухнуть https://t.co/ZMbulv8h3U https://t.co/sGFzbDHA98",United States,Ukrainian,2015-11-19 16:52:00,2015-11-19 16:52:00,358,327,2204,R,1
svetadubooo,Матвиенко призвала создать международный трибунал для террористов https://t.co/cYIRotmctr,United States,Russian,2015-11-20 08:14:00,2015-11-20 08:14:00,358,327,2208,R,1
svetadubooo,"Пришло время создать Разведывательное агентство Евросоюза, подчеркнул еврокомиссар https://t.co/0JXQMjvSUN",United States,Russian,2015-11-20 08:56:00,2015-11-20 08:56:00,358,327,2209,R,1
svetadubooo,Гладилин: слова Хомухи об игроках «молодёжки» — попытка оправдаться https://t.co/K4KZtBAWQk,United States,Russian,2015-11-20 11:53:00,2015-11-20 11:53:00,358,327,2211,R,1
svetadubooo,Псковский майор сдал на металлолом 17 танков https://t.co/LcXlXcDSJt,United States,Macedonian,2015-11-20 17:15:00,2015-11-20 17:15:00,358,327,2216,R,1
svetadubooo,Apple пообещала разобраться в причинах найденной в iPad Pro неисправности: https://t.co/Y5C2aJL9Fz,United States,Russian,2015-11-20 18:16:00,2015-11-20 18:16:00,358,327,2217,R,1
svetadubooo,РФ трижды уведомляла США об ударах по ИГ в Сирии после терактов в Париже https://t.co/cdnaVZXDhk https://t.co/b8Lpa0m0uK,United States,Russian,2015-11-20 20:13:00,2015-11-20 20:13:00,358,327,2219,R,1
svetadubooo,В результате пожара на шахте на северо-востоке Китая под землей заблокированы 22 горняка  https://t.co/VP2fYHdorU,United States,Russian,2015-11-21 03:22:00,2015-11-21 03:22:00,358,327,2221,R,1
svetadubooo,Лёля уехала - это плохо :( Можно начинать - это хорошо :),United States,Russian,2015-11-21 07:03:00,2015-11-21 07:03:00,358,327,2222,R,1
svetadubooo,Донецкая осень..) https://t.co/zlrZJKz63Y,United States,Russian,2015-11-21 13:12:00,2015-11-21 13:13:00,358,327,2224,R,1
svetadubooo,Таможня Петербурга нашла 820 кг гашиша в прибывшем из Бельгии экскаваторе https://t.co/C9YtS8mOjR,United States,Uzbek,2015-11-21 17:22:00,2015-11-21 17:22:00,358,327,2227,R,1
svetadubooo,Глава МИД ФРГ допустил возможность возвращения России в G8  https://t.co/7ltSSbArtT,United States,Russian,2015-11-22 03:14:00,2015-11-22 03:15:00,358,327,2230,R,1
svetadubooo,В центре столицы оцеплен универмаг «Московский» из-за найденной гранаты https://t.co/EEi8wUQzu5,United States,Russian,2015-11-22 07:12:00,2015-11-22 07:13:00,358,327,2234,R,1
svetadubooo,Собаки будут защищены  https://t.co/e2FtyV1v5N https://t.co/4mw4DMgR8v,United States,Russian,2015-11-22 10:36:00,2015-11-22 10:36:00,358,327,2235,R,1
svetadubooo,#fairytail #illustration #Russia https://t.co/wRJ5xoAuMs,United States,Russian,2015-11-22 16:58:00,2015-11-22 16:59:00,358,326,2237,R,1
svetadubooo,самая неприступная крепость США — серверы Фейсбук. солдаты буду биться за свои лайки до последнего вздоха,United States,Russian,2015-11-22 16:59:00,2015-11-22 16:59:00,358,326,2238,R,1
svetadubooo,Режим КТО введен в Нальчике  https://t.co/TaVx5CPJ0f,United States,Russian,2015-11-22 18:13:00,2015-11-22 18:13:00,358,326,2240,R,1
svetadubooo,"Посчитал, сколько у @Alexandr_Sam в твитах повторяются слова ""жопа"" и ""сосать""... Насторожился. @sergkiselev1970",United States,Russian,2015-11-22 20:15:00,2015-11-22 20:16:00,358,326,2242,R,1
svetadubooo,В Москве снижается уровень самоубийств https://t.co/RlL4jsgNto,United States,Russian,2015-11-23 07:15:00,2015-11-23 07:15:00,358,326,2245,R,1
svetadubooo,Дипломат: десятки бойцов спецназа США вскоре прибудут в Сирию https://t.co/4sRlud6wRW https://t.co/uaToHaY4Oq,United States,Russian,2015-11-23 08:57:00,2015-11-23 08:58:00,358,326,2248,R,1
svetadubooo,"В СФ озвучили возможные ответные меры на подрыв ЛЭП, по которым энергия подается в Крым https://t.co/jqob1o2fQS https://t.co/cEidgVRNlb",United States,Russian,2015-11-23 09:39:00,2015-11-23 09:39:00,358,326,2250,R,1
svetadubooo,Экс-мэра Сыктывкара переместили под домашний арест https://t.co/dbTFPyPiGq,United States,Russian,2015-11-23 11:17:00,2015-11-23 11:17:00,358,326,2252,R,1
svetadubooo,Американский телеканал выдал видео ударов ВКС в Сирии за действия авиации США https://t.co/5wUD80Eea5,United States,Russian,2015-11-23 12:15:00,2015-11-23 12:15:00,358,326,2253,R,1
svetadubooo,Путин снял запрет на поставки оборудования по ядерной программе Ирана https://t.co/Sw2plP2txD,United States,Russian,2015-11-23 13:16:00,2015-11-23 13:16:00,358,326,2254,R,1
svetadubooo,Дмитрий Песков: Владимир Путин и Али Хаменеи сошлись в оценках методов урегулирования в Сирии  https://t.co/NMtMLwxfxK,United States,Russian,2015-11-23 15:19:00,2015-11-23 15:29:00,358,326,2255,R,1
svetadubooo,Путин высказался о свержении Башара Асада https://t.co/92WFY3yl6D https://t.co/HQ4a5GEU9e,United States,Russian,2015-11-23 17:15:00,2015-11-23 17:15:00,358,326,2256,R,1
svetadubooo,"Foreign Policy Journal: Исламистский террор был придуман на Западе, и теперь он бьет по западному миру https://t.co/chtEhI4ZP2",United States,Russian,2015-11-23 22:55:00,2015-11-23 22:55:00,358,326,2257,R,1
svetadubooo,Хлопка слышно не было: на Старых Большевиков сгорел Mitsubishi ASX (Фото) https://t.co/5DFLFOZFZE,United States,Russian,2015-11-24 00:17:00,2015-11-24 00:18:00,358,326,2258,R,1
svetadubooo,"Прокуратура проверит угрозы ИГ, появившиеся на странице Wi-Fi московского метро https://t.co/cPgQleWXBl",United States,Russian,2015-11-24 10:53:00,2015-11-24 10:53:00,358,326,2261,R,1
svetadubooo,Комитет по этике ФИФА предложил ввести пожизненный запрет для Платини https://t.co/ZRHnBYZQYv,United States,Russian,2015-11-24 13:16:00,2015-11-24 13:16:00,358,326,2262,R,1
svetadubooo,"СРОЧНО. Reuters: в Сирии сбит российский вертолет, вылетевший к сбитому самолету https://t.co/7bzr1lAwIE … https://t.co/nDEc5bcpva",United States,Russian,2015-11-24 13:55:00,2015-11-24 13:55:00,358,326,2263,R,1
svetadubooo,В Госдуме сравнили действия Турции с поддержкой террористов: https://t.co/WVPTfmpHSl #Turkey #Су24,United States,Russian,2015-11-24 14:39:00,2015-11-24 14:39:00,358,326,2264,R,1
svetadubooo,"СМИ: Саудовская Аравия стала первой в мире по добыче нефти, обогнав РФ https://t.co/IgFsgilX2N https://t.co/gWBbahdCad",United States,Russian,2015-11-24 23:12:00,2015-11-24 23:12:00,358,325,2268,R,1
svetadubooo,В Вашингтоне назвали воздушное пространство Сирии местом удара по Су-24 https://t.co/8UJz19FdfF,United States,Russian,2015-11-25 03:32:00,2015-11-25 03:32:00,358,325,2269,R,1
svetadubooo,Ассоциация текстильщиков России призывает не покупать турецкие ткани https://t.co/AVi7FDZ2ow https://t.co/qxi908mH5F,United States,Russian,2015-11-25 10:38:00,2015-11-25 10:38:00,358,325,2272,R,1
svetadubooo,Первый «арктический» вертолет передан в распоряжение Минобороны РФ https://t.co/jMIkkIT6S2 https://t.co/C2f7vJGLqs,United States,Russian,2015-11-25 10:51:00,2015-11-25 10:52:00,358,325,2273,R,1
svetadubooo,Взрыв в автобусе с охраной президента Туниса устроил смертник https://t.co/tv3RkfjhrP,United States,Russian,2015-11-25 12:03:00,2015-11-25 12:03:00,358,325,2274,R,1
svetadubooo,В состав КДК введён инспектор по борьбе с расизмом https://t.co/9B2b7Blm2r,United States,Russian,2015-11-25 12:12:00,2015-11-25 12:12:00,358,325,2275,R,1
svetadubooo,Украина запретила транзитные перелеты для российских авиакомпаний https://t.co/Cs0FJeViMI,United States,Russian,2015-11-25 12:12:00,2015-11-25 12:13:00,358,325,2276,R,1
svetadubooo,«Реал Солт-Лейк» подтвердил интерес к Мовсисяну https://t.co/fWuaOJTQln,United States,Ukrainian,2015-11-25 14:17:00,2015-11-25 14:17:00,358,325,2277,R,1
svetadubooo,Пять событий 17-ой ярмарки интеллектуальной литературы Non fiction  https://t.co/GIGQiTeL0j https://t.co/PM92nyfZUp,United States,Russian,2015-11-25 15:00:00,2015-11-25 15:00:00,358,325,2279,R,1
svetadubooo,"Аэропорт Горно-Алтайска подал иск к ""Трансаэро"" на 1 млн рублей https://t.co/nPgchfiO1U",United States,Russian,2015-11-26 04:54:00,2015-11-26 04:56:00,358,325,2281,R,1
svetadubooo,Обама отреагировал на публикацию видео убийства темнокожего подростка  https://t.co/TA8PQFeSpd https://t.co/TkT6xPFamV,United States,Russian,2015-11-26 06:33:00,2015-11-26 06:33:00,358,325,2283,R,1
svetadubooo,Бизнес попросит приостановить плату за проезд большегрузов в 2016 году https://t.co/xmJ43CKXMT,United States,Russian,2015-11-26 07:57:00,2015-11-26 07:57:00,358,325,2284,R,1
svetadubooo,Комитет ГД одобрил поправки о штрафах с грузовиков свыше 12 тонн https://t.co/e66AefYY3D https://t.co/jJARzgZfJu,United States,Russian,2015-11-26 12:14:00,2015-11-26 12:14:00,358,325,2287,R,1
svetadubooo,Ари: «Краснодар» заслужил победу над дортмундской «Боруссией»! https://t.co/6IZp2z2Jyp,United States,Russian,2015-11-26 19:58:00,2015-11-26 19:59:00,358,325,2293,R,1
svetadubooo,Олланд: нужно найти политическое решение кризиса в Сирии https://t.co/92NJlVuJTE https://t.co/G33DVVAJhO,United States,Russian,2015-11-26 20:31:00,2015-11-26 20:31:00,358,325,2294,R,1
svetadubooo,Российский зенитный ракетный комплекс С-400 прибыл в Сирию https://t.co/le1qGKRHkx https://t.co/uP3uGCtwsm,United States,Russian,2015-11-26 20:33:00,2015-11-26 20:33:00,358,325,2295,R,1
svetadubooo,Инвалидов 1 и 2 групп и семьи с инвалидами освободят от отчислений на капитальный ремонт https://t.co/u2ccP9yJ73,United States,Russian,2015-11-27 12:38:00,2015-11-27 12:39:00,358,325,2298,R,1
svetadubooo,"Кремль не отвечает на запросы Эрдогана, поскольку не видит готовности извиниться за Су-24 https://t.co/kOMIetiqnu",United States,Ukrainian,2015-11-27 14:19:00,2015-11-27 14:20:00,358,325,2302,R,1
svetadubooo,Александр Блок в Серебряном веке – инфографика https://t.co/ys89Uyk0IA https://t.co/VDxHry84CT,United States,Serbian,2015-11-28 06:13:00,2015-11-28 06:13:00,358,325,2305,R,1
svetadubooo,Власти Крыма закроют санатории для отдыхающих из других регионов https://t.co/3QD3hTKB54,United States,Russian,2015-11-28 10:52:00,2015-11-28 10:52:00,358,325,2308,R,1
svetadubooo,"Кровь невинных людей на тебе, чекист! https://t.co/CBL4CmiYMq",United States,Russian,2015-11-28 15:52:00,2015-11-28 15:52:00,358,325,2313,R,1
svetadubooo,Минтруд уменьшит квоту на работников из Турции https://t.co/rXW21fM51a,United States,Russian,2015-11-28 20:37:00,2015-11-28 20:37:00,358,326,2317,R,1
svetadubooo,Французские СМИ: Производители свинины призывают отменить санкции против России  https://t.co/eyyMtmyXXw,United States,Russian,2015-11-29 00:52:00,2015-11-29 00:52:00,358,326,2318,R,1
svetadubooo,Иран сделал заявление по Сирии  https://t.co/kr4hGOQpby https://t.co/S02rKFuY1a,United States,Russian,2015-11-29 09:33:00,2015-11-29 09:33:00,358,326,2321,R,1
svetadubooo,Голосование на выборах в Мариуполе и Красноармейске завершилось https://t.co/ckSmq1s6S5 https://t.co/ixoBnZs6Cu,United States,Russian,2015-11-29 19:18:00,2015-11-29 19:18:00,358,326,2326,R,1
svetadubooo,Пострадавший в крушении вертолета Ми-2 на Камчатке находится в тяжелом состоянии \| РЕН ТВ: https://t.co/ZsjqVj1iWA,United States,Russian,2015-11-30 04:13:00,2015-11-30 04:13:00,358,326,2327,R,1
svetadubooo,СМИ: знаменитая столовая Букингемского дворца закрыта из-за соображений безопасности  https://t.co/LGlUBTdIFv,United States,Russian,2015-11-30 04:15:00,2015-11-30 04:15:00,358,326,2328,R,1
svetadubooo,#юмор #белый_юмор #w_humor https://t.co/yoXzj7VzR6,United States,Russian,2015-11-30 05:12:00,2015-11-30 05:12:00,358,326,2329,R,1
svetadubooo,Давутоглу: Турция не хочет эскалации конфликта с Россией https://t.co/sEMyGRZZEf https://t.co/m4GGnHooHC,United States,Russian,2015-11-30 12:02:00,2015-11-30 12:02:00,358,326,2332,R,1
svetadubooo,"СРОЧНО. Турция сообщила, будет ли она извиняться перед Россией за Су-24  https://t.co/j7e0IM5IQr https://t.co/tB72UAFUxa",United States,Russian,2015-11-30 12:22:00,2015-11-30 12:22:00,358,326,2333,R,1
svetadubooo,Путин: усилия России позволили на год затормозить потепление на земле https://t.co/rRJZsa8iCO https://t.co/q1GNPhbnA5,United States,Russian,2015-11-30 13:34:00,2015-11-30 13:35:00,358,326,2335,R,1
svetadubooo,Встреча президентов РФ и США прошла за закрытыми дверями https://t.co/XkCOtGKamz https://t.co/MHpFgeUsiO,United States,Russian,2015-11-30 14:31:00,2015-11-30 14:31:00,358,326,2336,R,1
svetadubooo,"В твиттере появились новые эмодзи к конференции по изменению климата. Например, вот #COP21  https://t.co/q37GnYL7TJ",United States,Russian,2015-11-30 17:02:00,2015-11-30 17:02:00,358,326,2338,R,1
svetadubooo,Впервые лекарство от старения будут тестировать на людях https://t.co/xSJMVvLYQg https://t.co/6n3eY9eA4Z,United States,Russian,2015-11-30 18:11:00,2015-11-30 18:11:00,358,326,2340,R,1
svetadubooo,"Путин прилетел в Крым, а мог бы онижедетям раздать",United States,Russian,2015-12-02 19:56:00,2015-12-02 19:57:00,357,325,2348,R,1
svetadubooo,Власти подтверждают смерть трех человек в результате стрельбы в Калифорнии https://t.co/s0eoMNBpk8,United States,Russian,2015-12-02 22:03:00,2015-12-02 22:04:00,357,325,2349,R,1
svetadubooo,"Россияне при стрельбе в Сан-Бернардино, вероятно, не пострадали https://t.co/3DYjnvORHB https://t.co/VD8FWn5FJW",United States,Russian,2015-12-03 01:31:00,2015-12-03 01:31:00,357,325,2350,R,1
svetadubooo,Обама о решении Великобритании участвовать в операции в Сирии  https://t.co/1YYVEY3oaC https://t.co/5mQrOACWBH,United States,Russian,2015-12-03 06:03:00,2015-12-03 06:04:00,357,325,2351,R,1
svetadubooo,В #США потерпел крушение военный вертолет #Apache https://t.co/RPgu0RkzB8,United States,Russian,2015-12-03 08:37:00,2015-12-03 08:37:00,357,325,2352,R,1
svetadubooo,В Берлине начался митинг против участия Вооруженных сил Германии в сирийском конфликте https://t.co/NuhKC1zYFc https://t.co/nEsF8PyxLE,United States,Russian,2015-12-03 18:10:00,2015-12-03 18:10:00,357,326,2357,R,1
svetadubooo,Хакеры взломали сайт парижской конференции ООН https://t.co/UJ8jca0ZQw https://t.co/pNQ3DcDR7W,United States,Russian,2015-12-04 00:32:00,2015-12-04 00:32:00,357,326,2360,R,1
svetadubooo,Греф дал обещание по Турции  https://t.co/f8QNddmSO6 https://t.co/eqkpEzTm9g,United States,Russian,2015-12-04 14:55:00,2015-12-04 14:55:00,357,325,2364,R,1
svetadubooo,Загрузка ядерного топлива начата на АЭС «Куданкулам» в Индии https://t.co/we9Zo99o1P https://t.co/K9HRqfSGBd,United States,Ukrainian,2015-12-05 08:14:00,2015-12-05 08:14:00,357,325,2369,R,1
svetadubooo,СМИ: группировка ДАИШ начала готовить летчиков-террористов в Ливии https://t.co/rIvPT8tD9N © AP Photo https://t.co/lhLqbXzNUH,United States,Russian,2015-12-05 21:02:00,2015-12-05 21:02:00,357,325,2371,R,1
svetadubooo,Ким Кардашьян и Канье Уэст объявили о рождении сына https://t.co/3xhhq1eoBm https://t.co/qCxWJet11X,United States,Russian,2015-12-06 07:11:00,2015-12-06 07:11:00,357,325,2372,R,1
svetadubooo,Турция про сообщения СМИ о введении санкций в отношении проливов  https://t.co/P2dOY7x7AB https://t.co/7UdZel9Cu0,United States,Russian,2015-12-06 13:11:00,2015-12-06 13:11:00,357,325,2374,R,1
svetadubooo,Рамзан Кадыров назвал появление #ДАИШ следствием «топорной работы» #США https://t.co/PX8c5SVzsj,United States,Russian,2015-12-06 16:37:00,2015-12-06 16:38:00,357,325,2375,R,1
svetadubooo,Пан Ги Мун почтил у здания парижского зала Bataclan память жертв терактов 13 ноября  https://t.co/mcrQUzPq4F,United States,Russian,2015-12-06 17:17:00,2015-12-06 17:17:00,357,325,2376,R,1
svetadubooo,СМИ: более половины авиакомпаний Юго-Восточной Азии несут убытки https://t.co/cX14GjZSlC,United States,Russian,2015-12-07 02:54:00,2015-12-07 02:54:00,357,325,2377,R,1
svetadubooo,Медведев 9 декабря проведет телеинтервью с журналистами в прямом эфире https://t.co/HE5KsZvnfN,United States,Macedonian,2015-12-07 10:57:00,2015-12-07 10:57:00,357,325,2381,R,1
svetadubooo,Кернес и неуважение к певунам https://t.co/RMnM6xqhKq,United States,Bulgarian,2015-12-07 14:18:00,2015-12-07 14:20:00,357,326,2383,R,1
svetadubooo,В России прощаются с погибшими при взрыве над Синаем пассажирами #A321 https://t.co/Za0ABAE1Rz,United States,Russian,2015-12-08 06:14:00,2015-12-08 06:14:00,357,326,2388,R,1
svetadubooo,В Испании двух человек задержали по подозрению в создании ячейки ИГ  https://t.co/V55qCncvtq,United States,Russian,2015-12-08 12:53:00,2015-12-08 12:53:00,357,326,2391,R,1
svetadubooo,Суд арестовал имущество фигурантов дела о приморском океанариуме  https://t.co/bvaS9SfdI4 https://t.co/29jDyA7zal,United States,Russian,2015-12-09 02:52:00,2015-12-09 02:52:00,357,325,2393,R,1
svetadubooo,Пиво вновь появится на российских стадионах https://t.co/NonMKqm3ik https://t.co/xAoRzfxlPv,United States,Russian,2015-12-09 03:52:00,2015-12-09 03:52:00,357,325,2394,R,1
svetadubooo,#СМИ: В России могут создать Экспертный совет по пенсионной реформе  https://t.co/QmKNhVNlU4 #пенсия,United States,Russian,2015-12-09 07:02:00,2015-12-09 07:03:00,357,325,2395,R,1
svetadubooo,Ермакович: для БАТЭ матч с «Ромой» может стать историческим https://t.co/pSinuTyjZe,United States,Russian,2015-12-09 14:32:00,2015-12-09 14:33:00,357,324,2398,R,1
