author_id,content,region,language,publish_date,harvested_date,following,followers,updates,post_type,retweet
svetadubooo,"ЕС продлевает санкции: Госдеп ликует, Пушков говорит о «поражении Киева» http://t.co/lpc6spxjmA http://t.co/CZf5ZwoTkm",United States,Russian,2015-06-23 04:31:00,2015-06-23 04:31:00,1572,331,1507,R,1
svetadubooo,Casio выпустит смарт-часы в марте 2016 года http://t.co/MdTj285DFC,United States,Russian,2015-07-03 17:11:00,2015-07-03 17:11:00,1572,332,1513,R,1
svetadubooo,Россия и США согласовали запрет на вылов рыбы в водах Арктики  http://t.co/i4hQZFCy54,United States,Russian,2015-07-16 13:33:00,2015-07-16 13:33:00,1570,336,1530,R,1
svetadubooo,Генпрокуратура РФ приняла решение о выдаче Украине 25 преступников http://t.co/0vESBww7M1 http://t.co/M1jEFtxAq2,United States,Russian,2015-07-16 15:33:00,2015-07-16 15:34:00,1570,336,1531,R,1
svetadubooo,Савченко просит изменить решение о направлении ее дела    в Донецкий суд http://t.co/V98Q4NISZX,United States,Russian,2015-07-16 16:51:00,2015-07-16 16:52:00,1570,337,1532,R,1
svetadubooo,"США: Вашингтон и Москва не ""обменивали"" Украину на Иран http://t.co/4sz30JWcWX",United States,Ukrainian,2015-07-16 20:31:00,2015-07-16 20:31:00,1570,337,1533,R,1
svetadubooo,"Режиссер нового ""Чужого"" опубликовал иллюстрацию к фильму http://t.co/STwQYOhAPR",United States,Russian,2015-07-17 08:51:00,2015-07-17 08:51:00,1570,337,1534,R,1
svetadubooo,Рада выделила дополнительно $241 млн на силовую операцию в Донбассе http://t.co/KgSHjZXvSd,United States,Russian,2015-07-17 11:32:00,2015-07-17 11:33:00,1570,337,1535,R,1
svetadubooo,В аварии с самоуправляемым автомобилем Google впервые пострадали люди: http://t.co/lQAGnqP89l,United States,Russian,2015-07-17 11:51:00,2015-07-17 11:51:00,1570,337,1536,R,1
svetadubooo,"Тотти: Джеко — игрок мирового класса, но я не буду убеждать его перейти в «Рому» http://t.co/ZP63pkonH3",United States,Russian,2015-07-17 12:33:00,2015-07-17 12:33:00,1570,337,1537,R,1
svetadubooo,Медведев поздравил актера Андрея Ильина с 55-летием http://t.co/2bLTVXYmng,United States,Russian,2015-07-18 08:31:00,2015-07-18 08:31:00,1570,338,1538,R,1
svetadubooo,Путин выразил соболезнования президенту и премьеру Ирака   http://t.co/R28kcosyfM http://t.co/Uc6jGygkCn,United States,Russian,2015-07-18 17:14:00,2015-07-18 17:14:00,1570,338,1543,R,1
svetadubooo,Ярцев: «Спартак» Аленичева находится на правильном пути http://t.co/ZneD4OR738,United States,Russian,2015-07-19 09:31:00,2015-07-19 09:31:00,1570,338,1547,R,1
svetadubooo,Греция погасила свою задолженность перед МВФ в два миллиарда евро: http://t.co/HL6oE0D4zY,United States,Russian,2015-07-20 16:11:00,2015-07-20 16:11:00,1570,337,1551,R,1
svetadubooo,ОБСЕ отказалась подтвердить объявленный ополченцами отвод вооружений http://t.co/kxfIjV0FnF,United States,Russian,2015-07-21 01:51:00,2015-07-21 01:51:00,1570,336,1554,R,1
svetadubooo,«ПСЖ» провёл переговоры с «Манчестер Юнайтед» о трансфере Ди Марии http://t.co/CJ5RM2Vnb3,United States,Russian,2015-07-22 07:52:00,2015-07-22 07:52:00,1570,336,1558,R,1
svetadubooo,Глава СК предложил отделить международное право от правовой системы России http://t.co/j4TQKONa6o,United States,Russian,2015-07-23 20:13:00,2015-07-23 20:14:00,1569,334,1567,R,1
svetadubooo,В Казани начался чемпионат мира по водным видам спорта http://t.co/R6W8tMuLHd http://t.co/cvoPWAHO3B,United States,Macedonian,2015-07-24 17:33:00,2015-07-24 17:33:00,1569,335,1569,R,1
svetadubooo,"Сорокин: вокруг России сложилась атмосфера недоверия, которой мы не заслуживаем http://t.co/v2pMGVZtvs",United States,Russian,2015-07-24 17:51:00,2015-07-24 17:52:00,1569,335,1570,R,1
svetadubooo,Блаттер: Россия проведет самый блестящий чемпионат мира по футболу http://t.co/hUqVVPkWdy,United States,Russian,2015-07-24 18:11:00,2015-07-24 18:13:00,1569,335,1571,R,1
svetadubooo,Волшебный мир укропитеков   Це не наші люди! Це не українці!   https://t.co/ZJdw4tuIGp,United States,Ukrainian,2015-07-25 02:52:00,2015-07-25 02:52:00,1569,335,1572,R,1
svetadubooo,Галичане на экзаменах в РФ без акцента скандируют «Путин — наш президент!»   http://t.co/HXpIKINC6s,United States,Bulgarian,2015-07-25 04:12:00,2015-07-25 04:12:00,1569,335,1573,R,1
svetadubooo,"У нас и про фестивали, кстати, подробный текст есть — про танки на ""Нашествии"", проблемы ""Усадьбы Джаз"" и т.д. https://t.co/OqhFSdBvQA",United States,Russian,2015-07-25 08:32:00,2015-07-25 08:32:00,1569,335,1574,R,1
svetadubooo,Контроль за состоянием акватории реки Казанка осуществляется в on-line режиме http://t.co/w5ZOjJ8DDr,United States,Russian,2015-07-25 09:32:00,2015-07-25 09:32:00,1569,335,1575,R,1
svetadubooo,СМИ: на Красной площади задержаны активисты   http://t.co/dQ39d8JPMy http://t.co/mjKBTddAjF,United States,Russian,2015-07-26 14:11:00,2015-07-26 14:12:00,1569,336,1583,R,1
svetadubooo,Егоров: в матче «Зенита» с «Уралом» со стороны Шатова симуляции не было http://t.co/FGfmAumdNS,United States,Russian,2015-07-27 11:51:00,2015-07-27 11:52:00,1569,335,1585,R,1
svetadubooo,Из-за резкого падения цен крупнейшие нефтяные компании заморозили новые проекты на $200 млрд: http://t.co/m1NRT7jKhP,United States,Russian,2015-07-27 12:32:00,2015-07-27 12:32:00,1569,335,1586,R,1
svetadubooo,День Крещения Руси объединит православные страны  http://t.co/qVxSMEDLDR,United States,Russian,2015-07-27 21:52:00,2015-07-27 21:52:00,1569,334,1588,R,1
svetadubooo,Башкирские власти выделили пяти семьям погибших в Омске солдат по миллиону рублей http://t.co/LSIzgU3jGD,United States,Russian,2015-07-28 00:52:00,2015-07-28 00:52:00,1569,333,1589,R,1
svetadubooo,"Ван дер Варт: в «Гамбурге» мы лишь бегали и боролись, не прикасаясь к мячу http://t.co/lPuIVmA6FV",United States,Ukrainian,2015-07-28 09:33:00,2015-07-28 09:33:00,1569,332,1591,R,1
svetadubooo,Вдохновленный фильмом «Миссия невыполнима» решился на эффектное ограбление ювелирного  Видео:  http://t.co/E22q8E7BUa http://t.co/dNo4V4j30c,United States,Russian,2015-07-29 07:32:00,2015-07-29 07:33:00,1569,332,1595,R,1
svetadubooo,Ковалёв возглавил молодёжную команду «Шахтёра» http://t.co/7P4ID8s7t2,United States,Russian,2015-07-30 07:51:00,2015-07-30 07:51:00,1569,333,1601,R,1
svetadubooo,Организаторы обжаловали в суде запрет гей-парада в Архангельске в День ВДВ http://t.co/GIFkeh7eWI,United States,Serbian,2015-07-30 13:53:00,2015-07-30 13:53:00,1569,333,1602,R,1
svetadubooo,Осел помог мужчине найти выпавший из самолета телефон.   ВИДЕО: http://t.co/HB94usZ9zG http://t.co/QalsIbGRRJ,United States,Russian,2015-07-31 14:52:00,2015-07-31 14:52:00,1569,332,1606,R,1
svetadubooo,Вокруг открытия музея Джека Потрошителя в Лондоне разгорелся скандал.   http://t.co/srWqUcLjns http://t.co/6P5g4RHsVh,United States,Russian,2015-07-31 18:53:00,2015-07-31 18:53:00,1569,333,1607,R,1
svetadubooo,"1 августа 1936 года родился известный французский модельер, основатель стиля унисекс Ив Сен-Лоран.  #Голос_Истории http://t.co/uGBOl953Ha",United States,Russian,2015-08-01 17:13:00,2015-08-01 17:16:00,1569,333,1613,R,1
svetadubooo,"""Правый сектор"" отказался выдавать бойцов, участвовавших в перестрелке в Мукачево #новости http://t.co/GPpBNeyp0t",United States,Russian,2015-08-02 06:32:00,2015-08-02 06:32:00,1569,334,1614,R,1
svetadubooo,Вертолет Ми-28 разбился на полигоне в Рязанской области http://t.co/nzHMHEu4e0,United States,Russian,2015-08-02 10:12:00,2015-08-02 10:12:00,1569,333,1617,R,1
svetadubooo,Силкин: «Динамо» было трудно играть без нападающего http://t.co/VoYKdB2U4b,United States,Russian,2015-08-02 15:32:00,2015-08-02 15:32:00,1568,331,1619,R,1
svetadubooo,Смерть на отдыхе: россиянка погибла в Турции из-за поздно оказанной помощи.   http://t.co/fKhg38fNaf http://t.co/gfAiHuWs62,United States,Russian,2015-08-03 19:33:00,2015-08-03 19:33:00,1569,330,1622,R,1
svetadubooo,Главком НАТО в Европе призывает Финляндию усилить готовность из-за российской угрозы http://t.co/tnD10cyNU8,United States,Russian,2015-08-04 19:51:00,2015-08-04 19:52:00,1569,330,1624,R,1
svetadubooo,Catberry.js: Прогрессивный рендеринг  #hitech,United States,Uzbek,2015-08-05 08:51:00,2015-08-05 08:51:00,1568,331,1626,R,1
svetadubooo,"РФПЛ: центральный аппарат МВД РФ начал работу по инцидентам на матче ЦСКА - ""Анжи"" http://t.co/k9MTBPvQQG",United States,Russian,2015-08-05 14:31:00,2015-08-05 14:31:00,1568,331,1633,R,1
svetadubooo,"""Единая Россия"" приостановила членство обвиняемых в мошенничестве приморских депутатов  http://t.co/DwUElsvthk",United States,Russian,2015-08-06 05:12:00,2015-08-06 05:15:00,1568,331,1637,R,1
svetadubooo,Мужчина в плавках напал на полицейских в Киеве  http://t.co/OTMie6stEG http://t.co/W1aZiS5Pyd,United States,Russian,2015-08-06 06:11:00,2015-08-06 06:11:00,1568,331,1638,R,1
svetadubooo,Начальника нижегородского ОВД отстранили от работы после убийства детей: http://t.co/SdO47kyfVp,United States,Russian,2015-08-06 16:33:00,2015-08-06 16:33:00,1568,331,1645,R,1
svetadubooo,"Скончался писатель, литературный критик Самуил Лурье https://t.co/gjMMuhZaUQ",United States,Russian,2015-08-08 10:11:00,2015-08-08 10:12:00,1567,328,1652,R,1
svetadubooo,"Полиция: фаната ""Спартака"" убил не экстремист, а хулиган.   http://t.co/RvGV49oor6 http://t.co/OmQlpP93U1",United States,Uzbek,2015-08-09 19:32:00,2015-08-09 19:32:00,1566,328,1655,R,1
svetadubooo,Украинские военные сообщают о бое с ополченцами в районе Старогнатовки http://t.co/0VbW8hJFSe,United States,Russian,2015-08-10 06:51:00,2015-08-10 06:51:00,1566,328,1658,R,1
svetadubooo,"89% россиян считают, что Интернет должен регулироваться государством  #hitech",United States,Russian,2015-08-10 13:31:00,2015-08-10 13:31:00,1566,328,1660,R,1
svetadubooo,В Фергюсоне объявили чрезвычайное положение  http://t.co/llo2lXM5t2 http://t.co/jHTs3lrlTW,United States,Russian,2015-08-10 21:13:00,2015-08-10 21:13:00,1566,329,1662,R,1
svetadubooo,Иванов: «Урал» проблема потолка зарплат никак не коснётся http://t.co/VD6CypzrU1,United States,Ukrainian,2015-08-11 16:12:00,2015-08-11 16:12:00,1566,328,1667,R,1
svetadubooo,Правительство Тувы выплатит по 30 тысяч рублей родственникам летчиков разбившегося Ми-8 http://t.co/DfZf6UYILE,United States,Russian,2015-08-12 04:51:00,2015-08-12 04:51:00,1566,327,1669,R,1
svetadubooo,Банк России отозвал лицензию у Пробизнесбанка http://t.co/FwVq4PZW9L,United States,Russian,2015-08-12 06:53:00,2015-08-12 06:53:00,1566,327,1670,R,1
svetadubooo,"Официальный курс евро вырос на 2,5 руб.  http://t.co/PC3MqPNewe",United States,Russian,2015-08-12 10:31:00,2015-08-12 10:31:00,1566,328,1672,R,1
svetadubooo,"В Росприроднадзоре сообщили, что пожар в Марьино произошел из-за разрыва нефтетрубы под водой http://t.co/dRHuQpdOAr",United States,Russian,2015-08-12 17:52:00,2015-08-12 17:52:00,1566,327,1675,R,1
svetadubooo,В Уфе на фестивале аниме пройдет турнир Hearthstone http://t.co/ZxaWjcyuDU,United States,Russian,2015-08-15 12:32:00,2015-08-15 12:32:00,1567,326,1686,R,1
svetadubooo,"Источник: на потерпевшем катастрофу Ми-8 летела группа топ-менеджеров ""ВТБ-лизинг""  http://t.co/F1dQ3QdCvo",United States,Uzbek,2015-08-15 14:14:00,2015-08-15 14:14:00,1567,326,1687,R,1
svetadubooo,Строительство фортификаций на востоке страны будет стоить Киеву более $34 млн  http://t.co/5z2QefGTDi,United States,Russian,2015-08-15 16:12:00,2015-08-15 16:12:00,1567,326,1688,R,1
svetadubooo,Сигурдссон: люблю действовать против Дзюбы http://t.co/HJxz0kjXeX,United States,Russian,2015-08-15 17:53:00,2015-08-15 17:53:00,1567,326,1690,R,1
svetadubooo,Жиру: «Арсеналу» очень нужны были эти три очка http://t.co/2kXyXBFY2Y,United States,Russian,2015-08-16 16:12:00,2015-08-16 16:13:00,1567,327,1696,R,1
svetadubooo,"Упс   Эксперт пояснил, почему Запад отказался предоставить военную помощь Украине http://t.co/NcwIsK39aO",United States,Russian,2015-08-17 07:31:00,2015-08-17 07:31:00,1567,327,1697,R,1
svetadubooo,Материалы по делу Савченко поступили в Ростовский суд http://t.co/6yskRPmERB,United States,Russian,2015-08-17 14:13:00,2015-08-17 14:13:00,1567,327,1700,R,1
svetadubooo,Минздрав предлагает отправлять пьяных водителей на принудительное лечение http://t.co/8oCvo1y1ZC,United States,Russian,2015-08-17 18:52:00,2015-08-17 18:52:00,1567,327,1702,R,1
svetadubooo,Отлов и обработка исключений в Yii2  #hitech,United States,Russian,2015-08-18 09:51:00,2015-08-18 09:51:00,1567,327,1707,R,1
svetadubooo,"За год, за взятки в Крыму лишились постов 60 высокопоставленных чиновников. Здесь вам не тут!",United States,Russian,2015-08-19 18:52:00,2015-08-19 18:52:00,1566,325,1713,R,1
svetadubooo,WSJ: США нечем защититься от нового экономического кризиса http://t.co/SYNwfk3WU4,United States,Russian,2015-08-20 00:32:00,2015-08-20 00:32:00,1566,325,1714,R,1
svetadubooo,Samsung начал конкуренцию с Apple на рынке платежных систем: http://t.co/5ei64yjXT8,United States,Russian,2015-08-20 10:33:00,2015-08-20 10:34:00,1566,325,1717,R,1
svetadubooo,'@zubovnik @CJukov @korobkov  молодцы французы  - угадали',United States,Russian,2015-08-20 20:52:00,2015-09-13 10:53:00,1566,325,1720,,0
svetadubooo,Градоначальники могут остаться без работы за нецелые расходы http://t.co/O36Naza8T9 http://t.co/16Hkqvlk8R,United States,Russian,2015-08-20 23:12:00,2015-08-20 23:12:00,1566,325,1721,R,1
svetadubooo,Медведев прибыл на Курильские острова с рабочей поездкой  http://t.co/9PAT7NOs2G,United States,Russian,2015-08-22 04:32:00,2015-08-22 04:32:00,1565,325,1728,R,1
svetadubooo,"СМИ: Обвиняемый в стрельбе в поезде Thalys заявил, что он не террорист  https://t.co/BJ27DPtvFi https://t.co/4obO2CxDyq",United States,Ukrainian,2015-08-22 11:32:00,2015-09-15 14:18:00,1565,325,1730,R,1
svetadubooo,МВД Украины заявило о гибели 284 милиционеров и бойцов нацгвардии в ходе конфликта в Донбассе http://t.co/IQrBC2ODqW,United States,Russian,2015-08-22 15:53:00,2015-08-22 15:53:00,1565,325,1733,R,1
svetadubooo,Открытка Ксении @xenia_sobchak http://t.co/IodwE6WphC,United States,Russian,2015-08-22 18:53:00,2015-09-16 09:23:00,1565,325,1734,R,1
svetadubooo,Россию пригласили на конференцию по Арктике в США http://t.co/hnfxqXv8LB,United States,Russian,2015-08-24 11:13:00,2015-08-24 11:13:00,1566,327,1740,R,1
svetadubooo,Цена на нефть в Нью-Йорке упала ещё на 5%  http://t.co/DqW8mUiZF3 http://t.co/2pgq2nbepS,United States,Ukrainian,2015-08-24 19:51:00,2015-09-20 15:18:00,1566,326,1743,R,1
svetadubooo,Глава МЧС вылетел в Сибирь оценить меры по тушению лесных пожаров http://t.co/R0cO2GfpaJ,United States,Russian,2015-08-24 22:54:00,2015-08-24 22:54:00,1566,326,1744,R,1
svetadubooo,В гараже на юге Москвы полиция нашла более 100 краденых велосипедов http://t.co/WPSBHS63a2,United States,Russian,2015-08-25 10:52:00,2015-09-21 07:03:00,1565,325,1747,R,1
svetadubooo,В групповом турнире ЛЧ впервые в истории сыграют пять команд из одной страны  http://t.co/pMrHFgMtCD,United States,Russian,2015-08-25 22:32:00,2015-08-25 22:33:00,1565,325,1752,R,1
svetadubooo,"В отделении ""Сбербанка России"" в Киеве произошел взрыв, пострадавших нет, сообщает МВД Киевской области http://t.co/u1tpqSWMej",United States,Russian,2015-08-27 08:02:00,2015-09-23 01:40:00,366,325,1758,R,1
svetadubooo,Вблизи Тбилиси открылся совместный военный учебный центр НАТО и Грузии http://t.co/7cH6ooFah9,United States,Russian,2015-08-27 12:12:00,2015-08-27 12:12:00,366,325,1761,R,1
svetadubooo,Правительство выделило регионам 664 млн рублей на объекты ЧМ-2018 http://t.co/CzsMAc1Jst,United States,Russian,2015-08-28 05:11:00,2015-08-28 05:11:00,366,325,1764,R,1
svetadubooo,Сбежавшие украинские чиновники подняли цены на недвижимость в Москве https://t.co/KGIjQbN1p0,United States,Russian,2015-08-29 09:03:00,2015-09-24 23:41:00,366,326,1773,R,1
svetadubooo,ФОТОРЕПОРТАЖ. Открытие памятника Олегу Табакову  http://t.co/6ohpKdcJyd http://t.co/Nvp6HsJFk7,United States,Russian,2015-08-29 16:32:00,2015-08-29 16:32:00,365,325,1775,R,1
svetadubooo,В Харькове демонтировали Аллею Славы  https://t.co/oH1WVCsQvj,United States,Serbian,2015-08-29 19:31:00,2015-08-29 19:31:00,365,325,1776,R,1
svetadubooo,"Баскетболист «Майами"" встретился с Обамой для обсуждения проблем Южного Судана http://t.co/yusjs7XrFP",United States,Russian,2015-08-30 00:51:00,2015-08-30 00:51:00,365,325,1777,R,1
svetadubooo,СМИ заметили растущий интерес ЕС к Балканам из-за их «симпатии к России»  http://t.co/3FVYAEMK7M,United States,Russian,2015-08-30 03:12:00,2015-08-30 03:12:00,365,325,1779,R,1
svetadubooo,Украина применила санкции к кондитерской компании из России http://t.co/hBvyZUHu0U,United States,Russian,2015-08-30 07:12:00,2015-08-30 07:12:00,365,325,1780,R,1
svetadubooo,«Роснефть» разбила наступление на Газпром на три этапа  http://t.co/UKSnhdqLx5,United States,Russian,2015-09-01 04:31:00,2015-09-01 04:31:00,365,323,1787,R,1
svetadubooo,"Чета твитор, после долгого отсутствия, не все отклики показывает. Только последние. Так что кому не ответил, идити на...",United States,Russian,2015-09-01 07:11:00,2015-09-28 09:44:00,365,323,1788,R,1
svetadubooo,Китай-США. Война разгорается.   http://t.co/gHFZq51jGV #новости #Китай #экономика #Кризис #Америка http://t.co/fr8mmYjSjp,United States,Russian,2015-09-01 12:32:00,2015-09-01 12:32:00,365,323,1790,R,1
svetadubooo,Десяток мужчин «засветились» перед объективами скрытых камер по дороге на перестрелку в Москве  http://t.co/MwNV5VaohU  http://t.co/E26rd0zJCY,United States,Russian,2015-09-01 14:14:00,2015-09-01 14:14:00,365,323,1791,R,1
svetadubooo,Установлена причина смерти актрисы Аманды Петерсон  http://t.co/zxlJBjkJ7d,United States,Russian,2015-09-03 09:33:00,2015-09-03 09:33:00,365,322,1799,R,1
svetadubooo,Менеджер «Майнца»: скоро английские клубы потеряют свою финансовую мощь http://t.co/ChhxQSOg7z,United States,Russian,2015-09-03 09:52:00,2015-09-03 09:52:00,365,322,1800,R,1
svetadubooo,СМИ рассказали о русском дизайнере нового логотипа Google: http://t.co/u5Dmz66P2Z,United States,Russian,2015-09-04 13:22:00,2015-09-04 13:22:00,365,323,1806,R,1
svetadubooo,"Пока непонятно, кто стал автором этого «сигнала из космоса» http://t.co/U7qnswKwlX",United States,Russian,2015-09-04 16:05:00,2015-09-04 16:05:00,365,323,1808,R,1
svetadubooo,Чешская разведка обвинила Россию в попытке создать аналог Коминтерна  http://t.co/uDXzaPKhQT http://t.co/WBUW61hAk9,United States,Russian,2015-09-04 20:11:00,2015-09-04 20:11:00,365,323,1809,R,1
svetadubooo,Корниленко: на время матча с Украиной друзей на поле не будет http://t.co/DL8BiCzBYj,United States,Russian,2015-09-04 20:12:00,2015-09-04 20:12:00,365,323,1810,R,1
svetadubooo,Порядка 20 семей беженцев из Сирии переехали в Ингушетию  http://t.co/ZsPqusJrRo,United States,Ukrainian,2015-09-05 22:53:00,2015-09-05 22:53:00,365,323,1815,R,1
svetadubooo,"Минздрав предлагает распространить программу ""Земский доктор"" на поселки городского типа  http://t.co/Ay19bOvvPM",United States,Russian,2015-09-06 13:33:00,2015-09-06 13:34:00,364,323,1817,R,1
svetadubooo,Истребители Су-30СМ впервые выполнили в Крыму бомбометание по наземным целям http://t.co/XLqy2rItE9,United States,Russian,2015-09-07 09:30:00,2015-09-07 09:30:00,364,323,1818,R,1
svetadubooo,Манучарян пропустит примерно три недели из-за травмы http://t.co/jOHT6LVskH,United States,Ukrainian,2015-09-08 09:45:00,2015-09-08 09:45:00,364,323,1821,R,1
svetadubooo,"Пушков заявил, что без поддержки США Яценюк уже не был бы премьером http://t.co/lpitj0wshQ",United States,Ukrainian,2015-09-09 19:31:00,2015-09-09 19:31:00,365,324,1826,R,1
svetadubooo,МИД РФ: переговоры с Сирией по проблеме ИГ - одна из основных задач  http://t.co/ElAmckuCKV,United States,Russian,2015-09-09 23:11:00,2015-09-09 23:11:00,365,324,1828,R,1
svetadubooo,Клинтон назвала наиболее привлекательную черту Путина  http://t.co/MOmbYSq08j http://t.co/SPsJUEEV12,United States,Russian,2015-09-10 06:12:00,2015-09-10 06:12:00,365,324,1830,R,1
svetadubooo,Гнилую говядину измазали навозом и пытались ввезти в Крым http://t.co/geUzbJuKn0,United States,Russian,2015-09-10 10:32:00,2015-09-10 10:33:00,365,324,1831,R,1
svetadubooo,«Зенит» направил в УЕФА вторую часть заявки для участия в Лиге чемпионов http://t.co/VcX0BaT2Qj,United States,Ukrainian,2015-09-10 11:34:00,2015-09-10 11:34:00,365,324,1834,R,1
