author_id,content,region,language,publish_date,harvested_date,following,followers,updates,post_type,retweet
svetlanaleshkov,занавес параллельной вселенной приоткрылся  https://t.co/drDKtNESYB,United States,Russian,2015-06-22 10:41:00,2015-06-22 10:41:00,525,116,1644,R,1
svetlanaleshkov,Санкции и бойкот НАТО не помешали VII военно-морскому салону  http://t.co/6WYpCxFqVL http://t.co/O5jLrkPm61,United States,Ukrainian,2015-07-08 16:07:00,2015-07-08 16:07:00,522,113,1668,R,1
svetlanaleshkov,«Кубань» подтвердила факт переговоров с Павлюченко http://t.co/Ap60rI644w,United States,Ukrainian,2015-07-15 12:12:00,2015-07-15 12:12:00,522,113,1673,R,1
svetlanaleshkov,"Следственный комитет: Boeing упал под Донецком из-за попадания ракеты ""воздух-воздух"" http://t.co/0Zws5xsSox",United States,Russian,2015-07-15 17:54:00,2015-07-15 17:54:00,522,112,1675,R,1
svetlanaleshkov,Сенатор Добрынин посоветовал Поклонской ознакомиться с документами об отречении Николая II http://t.co/yNj0TWAtM1,United States,Russian,2015-07-16 08:34:00,2015-07-16 08:34:00,522,112,1680,R,1
svetlanaleshkov,"Чуров заявил, что голосование на выборах через интернет возможно уже в 2018 году http://t.co/XfP6YF1k1j",United States,Russian,2015-07-16 08:34:00,2015-07-16 08:34:00,522,112,1681,R,1
svetlanaleshkov,"Лавров объяснил, почему Украине не нужен трибунал по ""Боингу"" http://t.co/A9MA5GpQ2q http://t.co/q3LMnOpfFc",United States,Ukrainian,2015-07-16 17:12:00,2015-07-16 17:12:00,522,112,1683,R,1
svetlanaleshkov,Зоодруг... ЗАПОМНИТЕ ЭТО НАЗВАНИЕ И БЕГИТЕ. http://t.co/lE9GSFHEo3,United States,Bulgarian,2015-07-16 21:31:00,2015-07-16 21:32:00,522,112,1685,R,1
svetlanaleshkov,'@MaxDementiev @zapvv надолго ли все это?',United States,Russian,2015-07-16 23:08:00,2015-07-16 23:09:00,522,112,1686,,0
svetlanaleshkov,В Мексике после побега наркобарона Эль Чапо арестованы семь тюремных чиновников http://t.co/sDQbMfqFpC,United States,Russian,2015-07-18 05:32:00,2015-07-18 05:32:00,522,112,1688,R,1
svetlanaleshkov,'@SFGO76 подсадили ботов для дальнейшего забанивания :)',United States,Ukrainian,2015-07-18 18:51:00,2015-07-18 18:51:00,522,112,1692,R,1
svetlanaleshkov,"В ДНР заявили, что украинские военные в июле нарушили режим перемирия 740 раз http://t.co/N30yLuTp1Z",United States,Russian,2015-07-19 17:12:00,2015-07-19 17:12:00,522,111,1694,R,1
svetlanaleshkov,Дзюба и Ерёменко признаны MVP первого тура РФПЛ http://t.co/f5U9Kz5UuU,United States,Russian,2015-07-21 15:51:00,2015-07-21 15:51:00,373,110,1700,R,1
svetlanaleshkov,Кадыров сделал заявление по факту ДТП в Чечне   http://t.co/Qvcheevqpg http://t.co/Ty8IjV4Ofo,United States,Russian,2015-07-22 06:13:00,2015-07-22 06:13:00,317,110,1703,R,1
svetlanaleshkov,В Нальчике ликвидировали боевиков  http://t.co/PsBGvN3XnU http://t.co/sqtrxAlJCg,United States,Russian,2015-07-23 06:31:00,2015-07-23 06:31:00,317,110,1707,R,1
svetlanaleshkov,В Нальчике идет бой с бандитами http://t.co/PgCKpHd7qQ,United States,Russian,2015-07-23 06:34:00,2015-07-23 06:34:00,317,110,1708,R,1
svetlanaleshkov,Пассажирский автобус с 49 украинцами разбился в Польше  http://t.co/IHW8QkZmLB http://t.co/AYsjOQnYVi,United States,Russian,2015-07-23 15:13:00,2015-07-23 15:13:00,317,110,1711,R,1
svetlanaleshkov,Банк России лишил лицензии банк из ТОП-50: http://t.co/UCkNATRE0B,United States,Russian,2015-07-24 07:32:00,2015-07-24 07:32:00,317,110,1715,R,1
svetlanaleshkov,"""РПР-Парнас"" отказали в регистрации на выборы в Новосибирске http://t.co/jjh4yf0jr4",United States,Russian,2015-07-24 14:12:00,2015-07-24 14:13:00,317,110,1718,R,1
svetlanaleshkov,В Чернигове в преддверии выборов обнаружено несколько тайников оружия http://t.co/qUd3W7nvx2,United States,Russian,2015-07-25 04:12:00,2015-07-25 04:12:00,317,110,1721,R,1
svetlanaleshkov,"""Пляжный олигарх"" обвинил Саакашвили во вторжении в частную собственность http://t.co/O7sCdn9tQf",United States,Russian,2015-07-25 08:12:00,2015-07-25 08:12:00,317,110,1722,R,1
svetlanaleshkov,Греция рассчитывает договориться с МВФ о новом займе в течение месяца http://t.co/eWnJk7JayI,United States,Russian,2015-07-25 09:12:00,2015-07-25 09:12:00,317,110,1723,R,1
svetlanaleshkov,СМИ: в результате аварии на шахте в Китае под землей заблокированы 11 человек  http://t.co/wcepnfB7Gi,United States,Russian,2015-07-25 13:50:00,2015-07-25 13:50:00,317,110,1724,R,1
svetlanaleshkov,Лидер оппозиции Бурунди не признал результатов выборов http://t.co/P3aJLVt7C0,United States,Russian,2015-07-25 14:31:00,2015-07-25 14:31:00,317,110,1725,R,1
svetlanaleshkov,Причиной падения Як-52 в Самарской области мог стать человеческий фактор http://t.co/yPILeNdoCY,United States,Russian,2015-07-25 16:32:00,2015-07-25 16:32:00,317,110,1726,R,1
svetlanaleshkov,«Динамо» — «Мордовия»: гол Ионова в ворота «Мордовии» http://t.co/phqPAM2wYV,United States,Bulgarian,2015-07-25 17:11:00,2015-07-25 17:11:00,317,110,1728,R,1
svetlanaleshkov,"Из-за приложения Flightradar24 жизнь принца Уильяма находится под угрозой, сообщают СМИ http://t.co/k1d24wK4K9",United States,Russian,2015-07-26 08:31:00,2015-07-26 08:31:00,317,110,1731,R,1
svetlanaleshkov,СМИ: Обама обсудит возможные санкции в отношении Южного Судана http://t.co/oSRxOMJGmn,United States,Russian,2015-07-26 20:51:00,2015-07-26 20:51:00,317,110,1735,R,1
svetlanaleshkov,В Нижнем Тагиле горит резервуар на территории нефтебазы. Видео: http://t.co/vF4jG6jrFZ,United States,Russian,2015-07-27 09:52:00,2015-07-27 09:52:00,317,110,1737,R,1
svetlanaleshkov,"В погоне за ""Магнитом"" X5 покупает ""СосеДДушку"" http://t.co/AOxdLQOqZX",United States,Russian,2015-07-27 13:16:00,2015-07-27 13:16:00,41,110,1742,R,1
svetlanaleshkov,"Украинское пиво ""Оболонь"" будут варить в Москве http://t.co/3nI4AYNlnK http://t.co/rZxL5okfbu",United States,Russian,2015-07-27 17:32:00,2015-07-27 17:32:00,41,110,1743,R,1
svetlanaleshkov,Россия готова запретить ввоз цветов из Голландии.   http://t.co/FhspjiRl7x http://t.co/Ff5SOhqAz8,United States,Russian,2015-07-27 17:52:00,2015-07-27 17:52:00,41,110,1744,R,1
svetlanaleshkov,В батальоне «Донбасс» раскритиковали подготовку прибывших на смену в Широкино морпехов http://t.co/BXzcdLdmre,United States,Serbian,2015-07-28 13:34:00,2015-07-28 13:34:00,41,109,1746,R,1
svetlanaleshkov,#НиШагуНазад - приказ № 227 Народного комиссара обороны СССР И. В. Сталина от 28 июля 1942 года http://t.co/mk1B8snSk3,United States,Russian,2015-07-28 15:04:00,2015-07-28 15:05:00,41,109,1747,R,1
svetlanaleshkov,В СБУ рассказали об условиях содержания «бойцов ГРУ»  http://t.co/wnuSnmNirP http://t.co/E1nQ4b2weR,United States,Russian,2015-07-28 16:31:00,2015-07-28 16:32:00,41,109,1749,R,1
svetlanaleshkov,"Агент: Джалу отказался от продолжения карьеры в Европе, он хотел играть в России http://t.co/lShwplMqV7",United States,Russian,2015-07-28 17:52:00,2015-07-28 17:52:00,41,109,1750,R,1
svetlanaleshkov,#НевскиеНовости Голосование по резолюции о создании трибунала по катастрофе Boeing пройдет в СБ ООН http://t.co/wNvQg8Ek1o,United States,Russian,2015-07-29 04:11:00,2015-07-29 04:11:00,41,109,1751,R,1
svetlanaleshkov,В Крыму могут развернуть десантно-штурмовой полк  http://t.co/GH8bU5e3Ay http://t.co/Bsmyya7RFc,United States,Russian,2015-07-30 10:13:00,2015-07-30 10:13:00,41,109,1756,R,1
svetlanaleshkov,Кремль предостерег от «политического судилища» по делу о донецком Boeing  http://t.co/7LwcUo0dKE,United States,Russian,2015-07-30 10:33:00,2015-07-30 10:33:00,41,109,1757,R,1
svetlanaleshkov,"Microsoft успокоил пользователей: ""Косынка"" останется бесплатной http://t.co/lKQkbLXSHH",United States,Russian,2015-07-30 13:53:00,2015-07-30 13:53:00,41,109,1760,R,1
svetlanaleshkov,"Россельхознадзор обнаружил нарушения в распределительном центре ""Ашана"" http://t.co/vH66Vj9Htu",United States,Russian,2015-07-30 16:14:00,2015-07-30 16:14:00,41,109,1762,R,1
svetlanaleshkov,#НевскиеНовости Продажи Apple Watch стартовали в России http://t.co/BqPqIi8PTr,United States,Russian,2015-07-31 06:51:00,2015-07-31 06:51:00,41,108,1767,R,1
svetlanaleshkov,"Дело по ДТП на Кутузовском проспекте Москвы, в котором погиб мотоциклист, передано в суд http://t.co/V2mB27Wy0w",United States,Russian,2015-07-31 11:54:00,2015-07-31 11:54:00,41,108,1768,R,1
svetlanaleshkov,"Минфин Украины заявил, что часть транша МВФ пойдет на пополнение резервов Нацбанка http://t.co/3ytZTbFODX",United States,Russian,2015-07-31 21:32:00,2015-07-31 21:32:00,41,108,1773,R,1
svetlanaleshkov,США ввели новые санкции в отношении России http://t.co/yXumoJLriY,United States,Russian,2015-07-31 21:32:00,2015-07-31 21:32:00,41,108,1774,R,1
svetlanaleshkov,Специалисты Boeing изучат найденный на Реюньоне обломок самолета http://t.co/PEDSIuGEMB,United States,Russian,2015-07-31 23:51:00,2015-07-31 23:51:00,41,109,1776,R,1
svetlanaleshkov,WSJ: цена на нефть приближается к годовым минимумам http://t.co/ApjEEJrKWq,United States,Russian,2015-08-01 09:51:00,2015-08-01 09:51:00,41,109,1778,R,1
svetlanaleshkov,"Поклонская заявила, что крымским татарам не нужна помощь извне в решении их проблем http://t.co/M3q1PBnHOY",United States,Russian,2015-08-01 14:12:00,2015-08-01 14:13:00,41,109,1779,R,1
svetlanaleshkov,СМИ: на Реюньоне нашли новый фрагмент пассажирского самолета  http://t.co/0S5gC7P9d6,United States,Russian,2015-08-02 07:53:00,2015-08-02 07:53:00,41,109,1782,R,1
svetlanaleshkov,Шведский дипломат выдворен из Москвы.   http://t.co/DUDZzaCy3B http://t.co/VYqp2RNb2N,United States,Macedonian,2015-08-03 18:54:00,2015-08-03 18:54:00,41,109,1789,R,1
svetlanaleshkov,Guardian: Сталин стал «вопросом идентичности» в Грузии  http://t.co/gT3caT8qku http://t.co/rRA3VsejNc,United States,Russian,2015-08-04 09:13:00,2015-08-04 09:13:00,41,109,1793,R,1
svetlanaleshkov,Евгения Васильева не желает общаться с внешним миром  http://t.co/2cY4e61OJv http://t.co/lIfL5PB1lg,United States,Russian,2015-08-04 09:32:00,2015-08-04 09:32:00,41,109,1794,R,1
svetlanaleshkov,Тест: насколько хорошо вы знаете Казань? http://t.co/nLco9Gyx2i,United States,Russian,2015-08-04 14:13:00,2015-08-04 14:13:00,41,109,1795,R,1
svetlanaleshkov,"Бля, тилипон содицца, а там напоминалка што купить по дороге домой:( Напомните если чо: половину чернава, маинес и квартиру мл. внуку",United States,Russian,2015-08-04 15:53:00,2015-08-04 15:53:00,41,109,1796,R,1
svetlanaleshkov,Госпитализирован один из голодающих активистов ПАРНАС http://t.co/gAHzfBgzXF,United States,Russian,2015-08-04 17:52:00,2015-08-04 17:52:00,41,109,1799,R,1
svetlanaleshkov,«ВКонтакте» занимает 18-е место в рейтинге социальных сетей на 2015й год   http://t.co/Ab9FUiPmcJ,United States,Russian,2015-08-05 12:05:00,2015-08-05 12:06:00,41,109,1806,R,1
svetlanaleshkov,У дома убийцы льва Сесила раскидали маринованные свиные ножки  http://t.co/79291sEBAU http://t.co/wZULhmUbJd,United States,Russian,2015-08-05 14:31:00,2015-08-05 14:31:00,41,109,1809,R,1
svetlanaleshkov,В компании Apple ищут разработчика приложений для ОС Android  #hitech,United States,Russian,2015-08-06 11:31:00,2015-08-06 11:31:00,41,110,1820,R,1
svetlanaleshkov,В Хабаровском крае полностью пересмотрят систему отбора автоперевозчиков http://t.co/HgjyIsHjJS,United States,Russian,2015-08-06 12:53:00,2015-08-06 12:53:00,41,110,1823,R,1
svetlanaleshkov,"Президент «ПСЖ» заявил, что Тьяго Мотта и Ибрагимович останутся в клубе http://t.co/WkghjhRYWU",United States,Russian,2015-08-06 18:52:00,2015-08-06 18:52:00,41,110,1824,R,1
svetlanaleshkov,Microsoft начала деактивацию пиратских Windows 10  #hitech,United States,Russian,2015-08-07 02:53:00,2015-08-07 02:53:00,41,110,1826,R,1
svetlanaleshkov,После драки со стрельбой в московском ресторане задержаны более 10 человек  http://t.co/oXLUGW6lIj http://t.co/tXr7F8nMPQ,United States,Russian,2015-08-07 06:51:00,2015-08-07 06:51:00,41,110,1827,R,1
svetlanaleshkov,Президент КОНМЕБОЛ поддержит Платини на выборах главы ФИФА http://t.co/yVDFSZfbSf,United States,Russian,2015-08-07 06:53:00,2015-08-07 06:54:00,41,110,1828,R,1
svetlanaleshkov,"СМИ: РФ отказала в визе генералу ФРГ, назначенному военным атташе в Москве http://t.co/vb8L8LU7NA",United States,Russian,2015-08-07 19:02:00,2015-08-07 19:02:00,41,111,1832,R,1
svetlanaleshkov,А вот и стильная презентация команды Кремер http://t.co/MpjvBjEdPe #peremena http://t.co/NSnMMSM0Wd,United States,Bulgarian,2015-08-07 20:12:00,2015-08-07 20:12:00,41,111,1833,R,1
svetlanaleshkov,Кремль пообещал проверить добытую хакерами информацию об «Искандерах»: http://t.co/yy1DBDyP2B,United States,Russian,2015-08-07 22:34:00,2015-08-07 22:34:00,41,111,1835,R,1
svetlanaleshkov,С 8 августа эвакуаторы в Москве (и других городах) работают по новым правилам https://t.co/vLdCSnHNr8,United States,Russian,2015-08-08 09:53:00,2015-08-08 09:53:00,41,111,1837,R,1
svetlanaleshkov,Врач рассказал о состоянии здоровья Льва Дурова  http://t.co/WLI05hFd2C http://t.co/yCXgNNksP3,United States,Russian,2015-08-09 11:12:00,2015-08-09 11:12:00,41,111,1842,R,1
svetlanaleshkov,Нарышкин: главная цель США - присвоить глобальную монополию  http://t.co/puddUBZyqy,United States,Russian,2015-08-10 01:12:00,2015-08-10 01:12:00,41,111,1848,R,1
svetlanaleshkov,Сжечь! https://t.co/6Zq0plBxeq,United States,Russian,2015-08-10 07:12:00,2015-08-10 07:12:00,41,111,1851,R,1
svetlanaleshkov,«Контрабандисты пересели на «Газели»  http://t.co/iNs5aDAXxQ http://t.co/eQvUhghvWd,United States,Russian,2015-08-10 15:32:00,2015-08-10 15:32:00,41,111,1855,R,1
svetlanaleshkov,Лавров провел телефонный разговор с украинским коллегой  http://t.co/DFOQ0xR4md http://t.co/GIMa8Cb91M,United States,Russian,2015-08-10 16:33:00,2015-08-10 16:34:00,41,111,1856,R,1
svetlanaleshkov,В Госдепе обеспокоены ростом числа атак на востоке Украины http://t.co/OzeLYCS1uv,United States,Russian,2015-08-10 21:13:00,2015-08-10 21:13:00,41,112,1861,R,1
svetlanaleshkov,На острове Реюньон найден новый обломок http://t.co/BmEmdAtzGf,United States,Russian,2015-08-11 16:31:00,2015-08-11 16:32:00,41,112,1867,R,1
svetlanaleshkov,Саудовская Аравия хочет «Искандеры»  http://t.co/6greOltTbs http://t.co/SCaSy450FX,United States,Russian,2015-08-11 21:13:00,2015-08-11 21:13:00,41,112,1870,R,1
svetlanaleshkov,"Правозащитники рассказали, что Васильева работает уборщицей в школе колонии http://t.co/iRcVS6jTHo",United States,Russian,2015-08-12 18:31:00,2015-08-12 18:31:00,41,111,1877,R,1
svetlanaleshkov,Главный тренер сборной Коста-Рики подал в отставку после драки на стадионе http://t.co/NOZraWgBGE,United States,Russian,2015-08-12 21:32:00,2015-08-12 21:32:00,41,111,1880,R,1
svetlanaleshkov,Глава WADA выступил против дисквалификации целых стран из-за допинга http://t.co/GiEGyMnBXX,United States,Russian,2015-08-13 07:02:00,2015-08-13 07:03:00,41,111,1883,R,1
svetlanaleshkov,"Канал HBO может возродить сериал ""Дэдвуд"" http://t.co/UeYDV2vqjK",United States,Russian,2015-08-13 08:11:00,2015-08-13 08:13:00,41,111,1884,R,1
svetlanaleshkov,В ДНР решили поиграть в танковый биатлон http://t.co/y7vqhKIKsC,United States,Russian,2015-08-13 15:31:00,2015-08-13 15:31:00,41,111,1886,R,1
svetlanaleshkov,"#ПосланиеПотомкам Одно послание- сохраните страну. Сделайте ее еще лучше, помните о Родине, где бы вы не находились. http://t.co/eMODJLrV74",United States,Russian,2015-08-14 18:43:00,2015-08-14 18:44:00,41,112,1893,R,1
svetlanaleshkov,"Керри считает, что с Кубой нужно сотрудничать http://t.co/9ddelJLgRz http://t.co/fYQsDtEpF8",United States,Russian,2015-08-14 20:13:00,2015-08-14 20:13:00,41,112,1894,R,1
svetlanaleshkov,"Джонни Депп стал ""Легендой Диснея"", его ладони отлиты в бронзе  http://t.co/xUD7dKFMGE",United States,Russian,2015-08-15 10:32:00,2015-08-15 10:32:00,41,112,1895,R,1
svetlanaleshkov,"Двое малолеток обсуждают в курилке, что бы ты сделал,если бы на тебя направили пистолет.Кунг-фу, айкидо... Да ничего бы ты не сделал, мудак!",United States,Russian,2015-08-15 16:51:00,2015-08-15 16:52:00,41,112,1896,R,1
svetlanaleshkov,"СМИ: ФБР проверяет, имели ли хакеры из РФ доступ к переписке Клинтон  #hitech",United States,Russian,2015-08-15 19:31:00,2015-08-15 19:31:00,41,112,1897,R,1
svetlanaleshkov,СМИ: в Москве совершил вынужденную посадку Boeing с треснувшим стеклом http://t.co/CcW3k1JHOi,United States,Russian,2015-08-15 21:12:00,2015-08-15 21:12:00,41,112,1898,R,1
svetlanaleshkov,При лобовом столкновении двух поездов в Венгрии пострадали 19 человек http://t.co/r4BEcCZIuN,United States,Russian,2015-08-16 12:14:00,2015-08-16 12:14:00,41,113,1905,R,1
svetlanaleshkov,Трамп: Вашингтон должен отнять у ИГ захваченные в Ираке месторождения нефти http://t.co/E4asghWDH1,United States,Russian,2015-08-16 17:34:00,2015-08-16 17:34:00,41,113,1907,R,1
svetlanaleshkov,Каклы понимают нелепость своего бытия? http://t.co/o8vXu0sHwz,United States,Russian,2015-08-17 08:12:00,2015-08-17 08:12:00,41,113,1911,R,1
svetlanaleshkov,Россия отвергает возможность предварительных договоренностей по отставке Асада http://t.co/QQ7sgL3R3Q,United States,Russian,2015-08-17 09:32:00,2015-08-17 09:32:00,41,113,1913,R,1
svetlanaleshkov,#ДональдТрамп успокой свои волосы http://t.co/wXws8HvI0I,United States,Russian,2015-08-17 14:54:00,2015-08-17 14:54:00,41,113,1917,R,1
svetlanaleshkov,Источник: Васильева не получала положительную характеристику http://t.co/uHjdqSmD6d,United States,Russian,2015-08-17 16:11:00,2015-08-17 16:11:00,41,113,1918,R,1
svetlanaleshkov,Европейский газ стоил Украине во втором квартале на $28 дороже российского http://t.co/8ew3LzfTy9,United States,Russian,2015-08-17 16:53:00,2015-08-17 16:53:00,41,113,1919,R,1
svetlanaleshkov,Немцы отказались делиться софтом SAP с российскими партнерами  #hitech,United States,Russian,2015-08-18 06:22:00,2015-08-18 06:22:00,41,112,1927,R,1
svetlanaleshkov,СБУ сообщила о задержании подозреваемых в терроризме россиян http://t.co/RkdnoEn9yb,United States,Russian,2015-08-18 12:25:00,2015-08-18 12:25:00,41,112,1929,R,1
svetlanaleshkov,Левада: сколько россиян свободно говорят о политике властей   http://t.co/FFcINNIpv5 http://t.co/HMBBwT3Wql,United States,Russian,2015-08-19 11:05:00,2015-08-19 11:05:00,41,113,1935,R,1
svetlanaleshkov,Дворкович прокомментировал возможное назначение на пост главы РЖД http://t.co/GZDoNSihLO,United States,Russian,2015-08-19 17:11:00,2015-08-19 17:11:00,41,113,1939,R,1
svetlanaleshkov,Госдеп обеспокоен приговором сотруднику полиции безопасности Эстонии Кохверу http://t.co/DEqJJ33pS4,United States,Russian,2015-08-19 17:12:00,2015-08-19 17:12:00,41,113,1940,R,1
svetlanaleshkov,Microsoft отвергла обвинения в нарушении конфиденциальности в Windows http://t.co/8U5CChBSo9,United States,Russian,2015-08-19 18:53:00,2015-08-19 18:53:00,41,113,1942,R,1
svetlanaleshkov,СМИ: Лев Дуров скончался в больнице http://t.co/pJCntIbwK4,United States,Russian,2015-08-20 04:11:00,2015-08-20 04:11:00,41,113,1944,R,1
svetlanaleshkov,Белый дом о возможности встречи Обамы и Путина  http://t.co/Gr2yoGETV6 http://t.co/G5QDRYNjW3,United States,Russian,2015-08-20 06:33:00,2015-08-20 06:33:00,41,113,1945,R,1
svetlanaleshkov,УкроХотелки http://t.co/Ek9897YIGe,United States,Ukrainian,2015-08-20 10:31:00,2015-08-20 10:31:00,41,113,1947,R,1
svetlanaleshkov,Два самолета столкнулись в небе над Словакией  http://t.co/bp1l5Mkd8A http://t.co/yOSsbRFR3V,United States,Russian,2015-08-20 10:34:00,2015-08-20 10:34:00,41,113,1948,R,1
svetlanaleshkov,"""Известия"": детей научат правилам поведения на дороге с помощью смартфона  http://t.co/IOznSDcAUb",United States,Russian,2015-08-20 11:13:00,2015-08-20 11:13:00,41,113,1949,R,1
svetlanaleshkov,ВИДЕО. Место крушения столкнувшихся самолетов в Словакии  http://t.co/zIt7kzg1rO http://t.co/nKmaiK0r96,United States,Russian,2015-08-20 12:53:00,2015-08-20 12:53:00,41,113,1950,R,1
svetlanaleshkov,СРОЧНО : Германия сделала заявление по России: Берлин меняет политику к Москве http://t.co/mV4H8LJYez http://t.co/i8rhOptEB6,United States,Russian,2015-08-20 15:38:00,2015-09-13 05:58:00,41,113,1952,R,1
svetlanaleshkov,"Фримпонг: вообще не считаю, что в России есть расизм http://t.co/8WYBaCGH3P",United States,Russian,2015-08-20 16:12:00,2015-08-20 16:13:00,41,113,1953,R,1
svetlanaleshkov,На новгородского мэра снова завели уголовное дело о халатности   https://t.co/yzXPM1VQy7,United States,Russian,2015-08-21 16:32:00,2015-09-14 05:36:00,41,113,1956,R,1
svetlanaleshkov,Князь из рода Романовых собирается посетить Крым http://t.co/8JiNCNxiZr,United States,Russian,2015-08-23 07:14:00,2015-08-23 07:14:00,41,112,1966,R,1
