author_id,content,region,language,publish_date,harvested_date,following,followers,updates,post_type,retweet
svetadubooo,Свежие новости про Ренато Усатого. Его обвинили в нарушении тайны переписки    https://t.co/t3IE591AR1,United States,Russian,2015-10-24 14:14:00,2015-10-24 14:14:00,359,326,1988,R,1
svetadubooo,Акробаты идут на дело  https://t.co/TdhL47nJJX https://t.co/t52Tr2p6uD,United States,Russian,2015-10-24 14:14:00,2015-10-24 14:14:00,359,326,1987,R,1
svetadubooo,Звезды на погонах полицейских заменят «ромашками»  https://t.co/aLKCEuksaQ https://t.co/uGcn49lPhd,United States,Russian,2015-10-24 15:13:00,2015-10-24 15:13:00,359,326,1990,R,1
svetadubooo,ФОТОРЕПОРТАЖ. Чемпионата России по парикмахерскому искусству  https://t.co/w8mZ2EZaMY https://t.co/wJTogERPOq,United States,Russian,2015-10-24 21:33:00,2015-10-24 21:33:00,359,326,1991,R,1
svetadubooo,"'@turist532 жто жыны родословная, а я, бля, нацыст :('",United States,Russian,2015-10-25 03:11:00,2015-10-25 03:11:00,359,326,1992,R,1
svetadubooo,А его-то за що? https://t.co/eC5xGNFXaz,United States,Ukrainian,2015-10-25 12:31:00,2015-10-25 12:31:00,359,326,1993,R,1
svetadubooo,Двое мотоциклистов отправились в кругосветное путешествие посвященное Юрию Гагарину  https://t.co/u2sIRBhYij https://t.co/flTZvXH10Z,United States,Russian,2015-10-25 13:52:00,2015-10-25 13:53:00,359,326,1994,R,1
svetadubooo,Посол России в Британии рассказал о заморозке дипотношений между странами https://t.co/9GFkrJFTuP,United States,Russian,2015-10-26 08:31:00,2015-10-26 08:31:00,359,326,1997,R,1
svetadubooo,Корреспондент Russia Today и съемочная группа попали под минометный обстрел в Сирии https://t.co/M3FnISG4Hq,United States,Russian,2015-10-26 11:15:00,2015-10-26 11:16:00,359,326,1998,R,1
svetadubooo,В Новосибирске почувствовали отголоски землетрясения в Афганистане https://t.co/NA9R5AZmqE,United States,Russian,2015-10-26 11:32:00,2015-10-26 11:32:00,359,326,1999,R,1
svetadubooo,В результате землетрясения в Афганистане и Пакистане погибли более 100 человек   https://t.co/4CfILKT5xe,United States,Russian,2015-10-26 14:32:00,2015-10-26 14:32:00,359,326,2000,R,1
svetadubooo,"Нацсовет Украины не продлил лицензию телеканалу ""112 Украина"" https://t.co/rR2khqSeiR",United States,Ukrainian,2015-10-26 15:31:00,2015-10-26 15:31:00,359,326,2002,R,1
svetadubooo,Обама предоставит Украине кредит для поддержания реформ в стране https://t.co/xKUZlAAYlB https://t.co/n1ooXbRuL5,United States,Ukrainian,2015-10-26 17:51:00,2015-10-26 17:51:00,359,326,2003,R,1
svetadubooo,Госдеп сделал заявление по выборам на Украине  https://t.co/Y6ktcKTpSP https://t.co/EOEl7lrlcc,United States,Russian,2015-10-26 20:22:00,2015-10-26 20:22:00,359,326,2004,R,1
svetadubooo,СМИ: Албания может принять порядка 5 тыс. нелегальных мигрантов  https://t.co/ZRgSCDLeGV,United States,Russian,2015-10-27 21:11:00,2015-10-27 21:12:00,359,326,2009,R,1
svetadubooo,Супруга Развозжаева рассказала о давлении на мужа в колонии https://t.co/3n7zJOw9yz,United States,Russian,2015-10-28 02:33:00,2015-10-28 02:33:00,359,326,2010,R,1
svetadubooo,Компания Apple отчиталась о рекордной в своей истории прибыли: https://t.co/Q2QNkSZDaA,United States,Russian,2015-10-28 06:52:00,2015-10-28 06:53:00,359,326,2011,R,1
svetadubooo,Блаттер исключил вариант с переносом ЧМ-2018 по футболу из России https://t.co/fSs0wrbvpn,United States,Russian,2015-10-28 10:36:00,2015-10-28 10:36:00,359,326,2012,R,1
svetadubooo,Правообладателям не удалось договориться с торрент-трекером RuTracker без суда https://t.co/uvzuISLcYg,United States,Russian,2015-10-28 17:32:00,2015-10-28 17:32:00,359,326,2016,R,1
svetadubooo,Песков: Россия и США не обсуждают координацию по возможной военной операции в Сирии https://t.co/fFrsLCGBvN,United States,Russian,2015-10-28 19:12:00,2015-10-28 19:12:00,359,326,2019,R,1
svetadubooo,Первые 300 шаров для раздачи интернета Google запустит над Индонезией https://t.co/zKJpJEhcxW https://t.co/D3ikVTK1Uh,United States,Russian,2015-10-29 15:54:00,2015-10-29 15:54:00,359,327,2025,R,1
svetadubooo,Открыточка ватникам https://t.co/FBeY16dQFh,United States,Russian,2015-10-29 17:12:00,2015-10-29 17:12:00,359,327,2027,R,1
svetadubooo,Директор библиотеки украинской литературы пережила два гипертонических криза  https://t.co/D9krNEo618,United States,Russian,2015-10-29 21:15:00,2015-10-29 21:15:00,359,327,2029,R,1
svetadubooo,'@Dasssha2010 его последнее прижизненное интервью. с 33 минуты https://t.co/8wgmuJFqIW',United States,Russian,2015-10-29 23:53:00,2015-10-29 23:53:00,359,325,2031,R,1
svetadubooo,Из-за пожара на борту Boeing 767 во Флориде пострадали 20 человек https://t.co/QshRJBRSZV https://t.co/pMxqnqr0RD,United States,Russian,2015-10-30 10:11:00,2015-10-30 10:11:00,359,325,2034,R,1
svetadubooo,Блаттер: руководство ФИФА планировало отдать ЧМ-2018 и ЧМ-2022 России и США https://t.co/AHKAflgCn4,United States,Russian,2015-10-30 16:55:00,2015-10-30 16:55:00,359,325,2036,R,1
svetadubooo,"Ташуев: меня не любили в «Анжи»? Это полный бред, я на 90% собрал команду https://t.co/Q64Gj2G3t6",United States,Russian,2015-10-30 20:35:00,2015-10-30 20:35:00,359,325,2037,R,1
svetadubooo,Reutres: российский самолет разбился из-за технической неисправности   https://t.co/GWwsCB16vm https://t.co/uW8txNJc6P,United States,Russian,2015-10-31 14:32:00,2015-10-31 14:32:00,359,324,2039,R,1
svetadubooo,"«""Зениту"" не дают такие пенальти, как ЦСКА»  https://t.co/Ea5RM0QFfz https://t.co/rKdNcLQsu4",United States,Russian,2015-10-31 21:57:00,2015-10-31 21:57:00,359,324,2041,R,1
svetadubooo,Татарчонак первым побежал за нашим гражданством в прошлом году. Но теперь его бизнесу в Крыму это уже не поможет ))) https://t.co/PQNGvGW6Z6,United States,Russian,2015-11-02 07:32:00,2015-11-02 07:33:00,359,324,2045,R,1
svetadubooo,Власти США снова уличили Volkswagen в фальсификации тестов: https://t.co/dkgkjETRjP,United States,Russian,2015-11-03 00:53:00,2015-11-03 00:53:00,359,325,2047,R,1
svetadubooo,Индекс Nasdaq достиг 15-летнего максимума https://t.co/GZcv25YU5N,United States,Russian,2015-11-03 05:18:00,2015-11-03 05:18:00,359,325,2049,R,1
svetadubooo,Проведена экспертиза доставленных из Египта останков жертв катастрофы https://t.co/phIpLyzGsh #7K9268 https://t.co/eE0BGL0J4K,United States,Russian,2015-11-03 14:55:00,2015-11-03 14:55:00,359,325,2052,R,1
svetadubooo,"Глобальное потепление: снег в Центральной России ложится на 10 дней позже, чем в середине ХХ века https://t.co/VJtz5Z4i5v",United States,Russian,2015-11-03 15:38:00,2015-11-03 15:39:00,359,325,2053,R,1
svetadubooo,"Red Wings, выполняющая рейсы из Казани в Египет, прекратила полеты над Северным Синаем https://t.co/2jYeNZBDgB",United States,Russian,2015-11-04 09:35:00,2015-11-04 09:36:00,359,326,2056,R,1
svetadubooo,"Гильерме: когда пришёл Кучук, он всё жёстко контролировал, но потом упустил это https://t.co/NMrhMl2JxN",United States,Russian,2015-11-04 09:42:00,2015-11-04 09:42:00,359,326,2057,R,1
svetadubooo,Совет Европы представил доклад по расследованию пожара в Доме профсоюзов  https://t.co/FUhzTy1t9b https://t.co/Qd4YXHctRY,United States,Russian,2015-11-04 10:13:00,2015-11-04 10:13:00,359,326,2058,R,1
svetadubooo,Разработанный японскими школьниками поезд на батарейках попал в Книгу рекордов Гиннесса https://t.co/xGF7wWlavV,United States,Russian,2015-11-04 14:32:00,2015-11-04 14:33:00,359,326,2059,R,1
svetadubooo,Пора загнать шайтанов ИГ обратно в ад — сирийский ополченец https://t.co/rEq1DnaS0L https://t.co/ffg6mOds0k,United States,Russian,2015-11-05 12:16:00,2015-11-05 12:18:00,359,326,2061,R,1
svetadubooo,В App Store появился блокировщик рекламы при подключении к Wi-Fi в метро  https://t.co/j1ml7EUvm1 https://t.co/Sbu6pBUlzW,United States,Russian,2015-11-05 13:12:00,2015-11-05 13:12:00,359,326,2062,R,1
svetadubooo,Как помочь ребенку не бояться собак  https://t.co/cKP9hFvb6z https://t.co/XO6Xod4vdO,United States,Ukrainian,2015-11-05 13:15:00,2015-11-05 13:18:00,359,326,2063,R,1
svetadubooo,«Марш миллиона масок»: По всему миру прошли протесты сторонников движения Anonymous  https://t.co/F0smIsXTHo https://t.co/AT4fuCh9OX,United States,Russian,2015-11-05 17:13:00,2015-11-05 17:13:00,359,326,2065,R,1
svetadubooo,Charlie Hebdo опубликовал безжалостные карикатуры на крушение аэробуса А321 https://t.co/DWSTCO2Qqv https://t.co/EI8prqMnsr,United States,Russian,2015-11-05 23:55:00,2015-11-05 23:55:00,359,326,2066,R,1
svetadubooo,'@volkova_v Совпадение? Не думаю! https://t.co/7HUc5iRKir',United States,Ukrainian,2015-11-06 02:52:00,2015-11-06 02:52:00,359,326,2067,R,1
svetadubooo,EasyJet не сможет сегодня вывезти британцев из Шарм-эш-Шейха https://t.co/TAmQOIiiUd https://t.co/6YmYHc44E6,United States,Russian,2015-11-06 11:13:00,2015-11-06 11:13:00,359,326,2068,R,1
svetadubooo,Первым зрителем нового эпизода «Звёздных войн» стал умирающий от рака американец  https://t.co/BSGK9hDbqj https://t.co/pzJr6gMcJd,United States,Russian,2015-11-06 11:54:00,2015-11-06 11:59:00,359,326,2069,R,1
svetadubooo,Судье в США грозит до 37 лет тюрьмы за подкуп агента ФБР двумя ящиками пива  https://t.co/ryjYOTaYRY https://t.co/4algzgN2B7,United States,Ukrainian,2015-11-06 12:32:00,2015-11-06 12:39:00,359,326,2070,R,1
svetadubooo,Французские власти открестились от карикатур в Charlie Hebdo https://t.co/pOh9x4XxX3 https://t.co/iwQkbH3pDI,United States,Russian,2015-11-06 13:31:00,2015-11-06 13:31:00,359,326,2071,R,1
svetadubooo,"Доброе утро, тролли!",United States,Macedonian,2015-11-07 02:12:00,2015-11-07 02:12:00,359,325,2072,R,1
svetadubooo,Число погибших при пожаре в ночном клубе Бухареста возросло до 38 https://t.co/SL8OadUeHv,United States,Ukrainian,2015-11-07 11:52:00,2015-11-07 11:53:00,359,325,2074,R,1
svetadubooo,Жители Донецка боятся возобновления боевых действий.  РЕПОРТАЖ: https://t.co/1ol3Cjamh8 https://t.co/5MKfcF3QWJ,United States,Russian,2015-11-07 12:36:00,2015-11-07 12:36:00,359,325,2075,R,1
svetadubooo,«Мегафон» решил поддержать своих абонентов в Египте  https://t.co/WNY3nA4JOM https://t.co/CRv5eImLZV,United States,Russian,2015-11-07 13:33:00,2015-11-07 13:34:00,359,325,2076,R,1
svetadubooo,"В Махачкале ликвидирован боевик, обстрелявший ж/д рабочих https://t.co/o0akowgQyN © AP Photo https://t.co/LCTWR307ZD",United States,Russian,2015-11-07 15:52:00,2015-11-07 15:53:00,359,325,2077,R,1
svetadubooo,"Гитара Джона Леннона продана на аукционе за $2,4 млн (ВИДЕО) https://t.co/SO73UtG2bA https://t.co/e91FWU4eZW",United States,Ukrainian,2015-11-08 07:14:00,2015-11-08 07:19:00,359,325,2077,R,1
svetadubooo,«Краснодар» прервал беспроигрышную серию ЦСКА: https://t.co/32gGG6mg8t,United States,Russian,2015-11-08 17:15:00,2015-11-08 17:15:00,359,325,2082,R,1
svetadubooo,Ученые РФ и КНР займутся в ДВФУ моделированием новых материалов для квантовых компьютеров  https://t.co/IYb1fuSk8C,United States,Russian,2015-11-10 02:11:00,2015-11-10 02:11:00,359,325,2087,R,1
svetadubooo,"""Спортсмены должны проходить проверку на детекторе лжи""  https://t.co/6naoWoEHay https://t.co/7tsyYwGugb",United States,Russian,2015-11-10 09:33:00,2015-11-10 09:33:00,359,325,2092,R,1
svetadubooo,"Соколов: возможны задержки багажа туристов, которые летят из Египта https://t.co/PPUmtv6w3A https://t.co/g4vJmB5EkY",United States,Russian,2015-11-10 11:23:00,2015-11-10 11:23:00,359,325,2093,R,1
svetadubooo,Airbus сообщил о технической исправности разбившегося А321 Катастрофа с российским лайнером «Когалымавиа» …  https://t.co/UUbNDBy8yM,United States,Russian,2015-11-10 12:53:00,2015-11-10 12:53:00,359,325,2094,R,1
svetadubooo,Боевики открыли стрельбу во время эвакуации из жилого дома в Нальчике https://t.co/iBDvBtmB9Y,United States,Russian,2015-11-10 14:33:00,2015-11-10 14:33:00,359,325,2096,R,1
svetadubooo,Умер экс-канцлер Германии  https://t.co/a1RLJtI4SB https://t.co/PKJQ1Ynox0,United States,Russian,2015-11-10 15:11:00,2015-11-10 15:11:00,359,325,2096,R,1
svetadubooo,Открытка @rianru https://t.co/gBFUSvy4Im,United States,Russian,2015-11-10 21:12:00,2015-11-10 21:12:00,359,325,2097,R,1
svetadubooo,Более 3 тысяч туристов уже вернулись из Египта в Санкт-Петербург https://t.co/Q7aacSbvK2 https://t.co/VLz3zDJeeO,United States,Russian,2015-11-10 21:14:00,2015-11-10 21:14:00,359,325,2098,R,1
svetadubooo,Россияне смогут без виз ездить в солнечную Боливию https://t.co/sgvtx7WqiK https://t.co/o1aq0y3nsZ,United States,Russian,2015-11-11 15:35:00,2015-11-11 15:35:00,359,325,2103,R,1
svetadubooo,В Великобритании стартовала Неделя российского кино о космосе https://t.co/p4VbkhT9tz,United States,Russian,2015-11-11 19:42:00,2015-11-11 19:42:00,359,325,2104,R,1
svetadubooo,В Приморье открылось крупнейшее в России казино https://t.co/iSasC2trab,United States,Russian,2015-11-12 05:04:00,2015-11-12 05:04:00,359,325,2106,R,1
svetadubooo,Мэр Лондона не жалеет о сказанном про идею бойкота Израиля https://t.co/EVMAbnbxQ7 https://t.co/ohwey7pavd,United States,Ukrainian,2015-11-12 10:51:00,2015-11-12 10:52:00,359,325,2107,R,1
svetadubooo,ФОТОГАЛЕРЕЯ. Умер «пятый» участник Beatles  https://t.co/Ah5eSyXygu https://t.co/x113nPySBK,United States,Russian,2015-11-12 11:32:00,2015-11-12 11:32:00,359,325,2108,R,1
svetadubooo,Теорию Эйнштейна проверят некорректно выведенные Роскосмосом спутники Galileo: https://t.co/dwpDNVyNUy,United States,Russian,2015-11-13 04:52:00,2015-11-13 04:52:00,359,325,2113,R,1
svetadubooo,Названы самые благоустроенные города РФ  https://t.co/EhTCu8DjDW https://t.co/Jhnlx21rgL,United States,Russian,2015-11-13 06:14:00,2015-11-13 06:15:00,359,325,2114,R,1
svetadubooo,СМИ: возлюбленный Карауловой выбирал между поездкой в Сирию и Донбасом https://t.co/u9geBADQEI,United States,Russian,2015-11-13 13:36:00,2015-11-13 13:37:00,359,325,2116,R,1
svetadubooo,Путин: сирийцы должны принять «дорожную карту» урегулирования https://t.co/Tz50i8OUBW,United States,Russian,2015-11-13 14:03:00,2015-11-13 14:03:00,359,325,2118,R,1
svetadubooo,Молочные протесты во французском Страсбурге https://t.co/CfpkQQWyKo https://t.co/H0vwntAEWi,United States,Russian,2015-11-13 18:56:00,2015-11-13 18:56:00,359,325,2119,R,1
svetadubooo,От России требуют отозвать авиацию из Сирии  https://t.co/VwUasfCw8u https://t.co/5z84MxoArj,United States,Russian,2015-11-13 20:17:00,2015-11-13 20:17:00,359,325,2120,R,1
svetadubooo,#Париж В захваченном в Париже концертном зале находится не менее 100 человек https://t.co/8u1mfahnw1,United States,Russian,2015-11-13 23:19:00,2015-11-13 23:19:00,359,325,2122,R,1
svetadubooo,"Очевидец говорит, что рядом с торговым центром неподалеку от центра Помпиду все тихо — ранее сообщалось о стрельбе  https://t.co/VWymTpn3Px",United States,Russian,2015-11-13 23:58:00,2015-11-14 00:01:00,359,325,2123,R,1
svetadubooo,"Полиция начала штурм театра, где террористы удерживают заложников  https://t.co/YxLsosxJW0 https://t.co/1DyZgCt6VA",United States,Russian,2015-11-14 00:11:00,2015-11-14 00:11:00,359,325,2124,R,1
svetadubooo,DailyMail о чётко спланированном теракте в Париже #Батаклан #ParisAttack #Bataclan #JeSuisParis https://t.co/AE1xogL2pD,United States,Ukrainian,2015-11-14 02:41:00,2015-11-14 02:57:00,359,325,2127,R,1
svetadubooo,ЕК приспустит флаги возле своей штаб-квартиры после трагедии в Париже  https://t.co/TLc4RTm0lG https://t.co/Cb9RM3wQnM,United States,Russian,2015-11-14 03:36:00,2015-11-14 03:36:00,359,325,2129,R,1
svetadubooo,Госдеп рекомендует гражданам США в Париже занять ближайшее укрытие  https://t.co/qdOyqCdKA8 https://t.co/aDpmhblhjO,United States,Russian,2015-11-14 04:52:00,2015-11-14 04:52:00,359,325,2130,R,1
svetadubooo,Олланд и Обама обсудили борьбу с терроризмом после атак в Париже  https://t.co/oYEA4EYC9J https://t.co/sblswGjoCu,United States,Serbian,2015-11-14 05:11:00,2015-11-14 05:12:00,359,325,2131,R,1
svetadubooo,Очевидцы рассказали о терактах в Париже https://t.co/enz5vzVDcH #Париж #Теракт https://t.co/X8rGmWZmNZ,United States,Russian,2015-11-14 10:12:00,2015-11-14 10:12:00,359,325,2132,R,1
svetadubooo,"Франсуа Олланд сказал, что к терактам во Франции причастны боевики «Исламского государства»  https://t.co/QrdhlR1lH8",United States,Russian,2015-11-14 10:59:00,2015-11-14 10:59:00,359,325,2133,R,1
svetadubooo,СМИ: очевидец видела бельгийские номера на машине нападавших в Париже https://t.co/VLBausCpfd https://t.co/NDUdxJdtdY,United States,Russian,2015-11-14 12:16:00,2015-11-14 12:16:00,359,325,2134,R,1
svetadubooo,ВВС Сирии уничтожили семь командных пунктов террористов https://t.co/xiYt2l5qPW,United States,Russian,2015-11-14 18:33:00,2015-11-14 18:33:00,359,325,2137,R,1
svetadubooo,Группа Foo Fighters отменила свои выступления в Европе из-за терактов в Париже https://t.co/GA6eyD8nOH,United States,Russian,2015-11-14 18:52:00,2015-11-14 18:52:00,359,325,2138,R,1
svetadubooo,NYT: ФБР направляет в Париж агентов для помощи расследованию https://t.co/iAkpWTjhuX,United States,Russian,2015-11-15 00:51:00,2015-11-15 00:51:00,359,325,2139,R,1
svetadubooo,Мышка-наружка,United States,Russian,2015-11-15 07:52:00,2015-11-15 07:52:00,359,325,2141,R,1
svetadubooo,Euro-2016. Сборная Украины переиграла команду Словении https://t.co/NL3CSOQMHT,United States,Ukrainian,2015-11-15 09:42:00,2015-11-15 09:42:00,359,325,2142,R,1
svetadubooo,Бельгия усиливает меры безопасности  https://t.co/L9s1jGpqHB https://t.co/wQYYRejlmM,United States,Russian,2015-11-15 10:32:00,2015-11-15 10:32:00,359,325,2143,R,1
svetadubooo,Пришла беда откуда не ждали https://t.co/YGYIFjJ6wq,United States,Ukrainian,2015-11-15 12:34:00,2015-11-15 12:34:00,359,325,2144,R,1
svetadubooo,"В ТЦ ""Жемчужная плаза"" в Петербурге бомбу не обнаружили https://t.co/mKFsmhHrVp",United States,Ukrainian,2015-11-15 14:14:00,2015-11-15 14:14:00,359,325,2145,R,1
svetadubooo,Кадыров: уничтожено 200 вступивших в ИГ выходцев из Чечни  https://t.co/z1iM6ExTIF,United States,Russian,2015-11-15 18:19:00,2015-11-15 18:19:00,359,326,2147,R,1
svetadubooo,"Россиянка, облитая кислотой в Индии, получила ожоги 45% тела https://t.co/lJ1HGIjY4d © flickr https://t.co/b09CSpdfAV",United States,Russian,2015-11-15 18:31:00,2015-11-15 18:31:00,359,326,2148,R,1
svetadubooo,Силуанов: РФ по-прежнему считает неприемлемыми условия Киева по долгу https://t.co/dqp8pZkISO,United States,Russian,2015-11-15 20:38:00,2015-11-15 20:39:00,359,326,2149,R,1
svetadubooo,В Париже отменены концерты Мэрилина Мэнсона https://t.co/z8FdbBrZHj,United States,Russian,2015-11-15 22:36:00,2015-11-15 22:36:00,359,326,2150,R,1
svetadubooo,Более 20 жителей вернулись домой после взрыва газа под Хабаровском  https://t.co/VYPYA2XSVt https://t.co/12N54xcCK3,United States,Russian,2015-11-16 03:53:00,2015-11-16 03:53:00,359,326,2151,R,1
svetadubooo,Донецк снова обстреляли  https://t.co/4YzaqsiZHr https://t.co/4bEGbp5shQ,United States,Russian,2015-11-16 08:04:00,2015-11-16 08:04:00,359,326,2153,R,1
svetadubooo,Владимир Путин: завершается исследование материалов по делу о крушении A321 https://t.co/XXg4WDbihn #7K9268 https://t.co/wqQ1FReG7A,United States,Russian,2015-11-16 08:32:00,2015-11-16 08:32:00,359,326,2154,R,1
svetadubooo,Павел Кулижников побил мировой рекорд https://t.co/hSzH9FO7Xy https://t.co/j2kC2yIaCJ,United States,Russian,2015-11-16 08:53:00,2015-11-16 08:53:00,359,326,2155,R,1
svetadubooo,"Средневзвешенный курс доллара на ЕТС снизился до 66,46 рубля https://t.co/NANL5lLv3D https://t.co/8jwXPRCaLQ",United States,Russian,2015-11-16 09:31:00,2015-11-16 09:31:00,359,326,2156,R,1
svetadubooo,"Задержан гражданин Алжира, предупреждавший о терактах в Париже  https://t.co/cuGvbrfzpu https://t.co/TJPSM9bk9s",United States,Bulgarian,2015-11-16 14:56:00,2015-11-16 14:56:00,359,326,2159,R,1
svetadubooo,Олланд призвал внести изменения в конституцию Франции  https://t.co/xoZbZFwEYe https://t.co/1Ke0FuV0T3,United States,Russian,2015-11-16 17:13:00,2015-11-16 17:13:00,359,326,2161,R,1
svetadubooo,ВИДЕО. «Проблема российского допинга – не самая главная»  https://t.co/SF9Bcw9w0j https://t.co/idAXa9wPKE,United States,Russian,2015-11-16 17:15:00,2015-11-16 17:19:00,359,326,2162,R,1
svetadubooo,Серьёзно? https://t.co/i3JVOoqrwQ,United States,Russian,2015-11-17 04:17:00,2015-11-17 04:17:00,359,326,2165,R,1
svetadubooo,При афтершоке после землетрясения в Греции погибли два человека https://t.co/iZ8aL5R9OG © Flickr https://t.co/r4EIMqNGm7,United States,Russian,2015-11-17 11:34:00,2015-11-17 11:35:00,359,326,2170,R,1
svetadubooo,Кремль: речи о сухопутной операции России в Сирии не идет https://t.co/CAixjFKexN https://t.co/SKU0xzPEi2,United States,Russian,2015-11-17 11:37:00,2015-11-17 11:37:00,359,326,2171,R,1
svetadubooo,Кличко работает на посту мэра без зарплаты https://t.co/6Oya2VqvHq https://t.co/8ShzNXPi1G,United States,Russian,2015-11-17 13:11:00,2015-11-17 13:11:00,359,327,2172,R,1
