author_id,content,region,language,publish_date,harvested_date,following,followers,updates,post_type,retweet
svetlanaleshkov,"Интерпол объявил в розыск главу турфирмы ""Эвитерра Трэвел"", обвиняемого в мошенничестве http://t.co/iZBrBTtRaY",United States,Russian,2015-09-28 08:53:00,2015-09-28 08:53:00,42,117,2273,R,1
svetlanaleshkov,Для задержанных на Украине Ерофеева и Александрова требуют пожизненное заключение #новости http://t.co/NharHiYAu0,United States,Russian,2015-09-29 07:32:00,2015-09-29 07:32:00,42,117,2285,R,1
svetlanaleshkov,"Вышел новый трейлер ""Выжившего"" с Ди Каприо http://t.co/zrIyeUduTL",United States,Russian,2015-09-29 14:54:00,2015-09-29 14:55:00,41,117,2289,R,1
svetlanaleshkov,Неформальная встреча глав МИД G7 проходит на полях Генассамблеи ООН  http://t.co/IssQHcbeHr http://t.co/9udNv9QMqP,United States,Russian,2015-09-30 00:51:00,2015-09-30 00:51:00,41,120,2293,R,1
svetlanaleshkov,Песков: о результатах операции ВС России в Сирии пока говорить рано http://t.co/kJOZSx166C,United States,Russian,2015-10-01 10:12:00,2015-10-01 10:12:00,41,120,2299,R,1
svetlanaleshkov,Багдад выступил за расширение российской операции в Сирии на Ирак  http://t.co/3Rsi3fb874,United States,Russian,2015-10-01 16:13:00,2015-10-01 16:13:00,41,120,2302,R,1
svetlanaleshkov,"МИД ФРГ: страны G7 выделили организациям ООН 1,8 млрд евро на беженцев https://t.co/3Zig4075VZ https://t.co/lBJSkQ7r9T",United States,Russian,2015-10-01 18:31:00,2015-10-01 18:32:00,41,120,2304,R,1
svetlanaleshkov,"Официальные курсы доллара США, евро и гривны к рублю РФ, действующие в ЛНР со 2 октября http://t.co/0FggTi76Xt",United States,Russian,2015-10-01 18:32:00,2015-10-01 18:34:00,41,120,2305,R,1
svetlanaleshkov,National Interest о российском Су-34: крылатая машина уничтожения http://t.co/fgNTvc02fi,United States,Russian,2015-10-01 18:43:00,2015-10-01 18:43:00,41,120,2306,R,1
svetlanaleshkov,Белый дом не исключает международную изоляцию России из-за Сирии: http://t.co/zdgGBBGc3S А изолента после Украины осталась?,United States,Russian,2015-10-02 02:53:00,2015-10-02 02:53:00,41,120,2307,R,1
svetlanaleshkov,Меркель получит Нобелевскую премию?   http://t.co/hB4uyf2YYb http://t.co/XeSXrszrNx,United States,Russian,2015-10-02 13:53:00,2015-10-02 13:53:00,41,120,2309,R,1
svetlanaleshkov,На Volkswagen обрушились сотни новых исков от регуляторов и автовладельцев   http://t.co/imnWMA63n5,United States,Russian,2015-10-02 14:51:00,2015-10-02 14:51:00,41,120,2310,R,1
svetlanaleshkov,Видео. «Урал» — «Крылья Советов» http://t.co/vaczYcff3x,United States,Russian,2015-10-02 17:12:00,2015-10-02 17:12:00,41,120,2313,R,1
svetlanaleshkov,"В Донецке прошла акция, приуроченная ко Всемирному Дню улыбок http://t.co/pnzrHZKcEA",United States,Russian,2015-10-02 17:52:00,2015-10-02 17:52:00,41,120,2314,R,1
svetlanaleshkov,Кризис заставил правительство отказаться от безусловной поддержки госкомпаний http://t.co/w2qvvNOPUx http://t.co/qOyKuuDvdx,United States,Russian,2015-10-02 21:31:00,2015-10-02 21:33:00,41,120,2317,R,1
svetlanaleshkov,Корпорация Apple усовершенствует голосовые помощники  http://t.co/DZSMfWXrbn http://t.co/KqherFUXm3,United States,Russian,2015-10-03 00:52:00,2015-10-03 00:52:00,41,120,2318,R,1
svetlanaleshkov,GM отзовет в России 70 тысяч Chevrolet Aveo: http://t.co/l9l5bxQwW0,United States,Russian,2015-10-05 13:34:00,2015-10-05 13:34:00,41,120,2328,R,1
svetlanaleshkov,Обама посетит колледж http://t.co/VSwp4WfH6x,United States,Serbian,2015-10-05 23:52:00,2015-10-05 23:53:00,41,120,2330,R,1
svetlanaleshkov,Испанец в поисках работы в России вплавь преодолел Западный Буг http://t.co/rGLEiEmc9Z,United States,Russian,2015-10-06 06:51:00,2015-10-06 06:51:00,41,120,2332,R,1
svetlanaleshkov,Глава «Газпрома» спрогнозировал падение добычи газа в Европе  http://t.co/4AtvLJDcpE,United States,Russian,2015-10-06 11:14:00,2015-10-06 11:14:00,41,120,2333,R,1
svetlanaleshkov,Apple всех удивила  http://t.co/mJQvwhbD1O http://t.co/hAz8fv6gQG,United States,Russian,2015-10-06 12:55:00,2015-10-06 12:55:00,41,120,2335,R,1
svetlanaleshkov,В федеральном ВУЗе запретили выставку о Великой Отечественной войне http://t.co/92nySPj6jk,United States,Russian,2015-10-07 07:41:00,2015-10-07 07:41:00,41,120,2339,R,1
svetlanaleshkov,В Багдаде допустили обращение к России за военной помощью в ближайшие дни  http://t.co/1gkg6fSSOM,United States,Russian,2015-10-07 11:34:00,2015-10-07 11:34:00,41,120,2340,R,1
svetlanaleshkov,'@GrahamWP_UK Спецкор: в Донецк возвращаются жители в надежде на мир http://t.co/WmchRpU5ev http://t.co/CFw2pdEMxh',United States,Russian,2015-10-07 14:32:00,2015-10-07 14:32:00,41,120,2343,R,1
svetlanaleshkov,"Россия готова установить контакты со ""Свободной сирийской армией"" http://t.co/kIx79FK3hH",United States,Russian,2015-10-07 15:13:00,2015-10-07 15:13:00,41,120,2346,R,1
svetlanaleshkov,Иранские ракеты нацелены на американские военные базы.  Игры заканчиваются  http://t.co/xb3hjgLv5X http://t.co/fgmNgG4xyf,United States,Russian,2015-10-07 15:52:00,2015-10-07 15:52:00,41,120,2347,R,1
svetlanaleshkov,"солдат НАТО и в воде не тонет, и в огне... нет, просто в воде не тонет",United States,Ukrainian,2015-10-07 19:09:00,2015-10-07 19:09:00,41,119,2348,R,1
svetlanaleshkov,В Москве в четверг ожидается до +4 &deg;C http://t.co/yVK0IH546y,United States,Russian,2015-10-08 03:52:00,2015-10-08 03:52:00,41,119,2352,R,1
svetlanaleshkov,"В Москве мужчина задохнулся дымом при пожаре в квартире, спасаясь от огня в ванной http://t.co/UcoV4O0J2s",United States,Russian,2015-10-08 05:54:00,2015-10-08 05:54:00,41,119,2354,R,1
svetlanaleshkov,Тукманов: у «Торпедо» будет на что отправиться на выездные матчи http://t.co/46csjg26tQ,United States,Russian,2015-10-08 12:52:00,2015-10-08 12:52:00,41,119,2359,R,1
svetlanaleshkov,АвтоВАЗ продемонстрировал битопливную Lada Vesta CNG http://t.co/rZyIVNZfTY http://t.co/bQFqrCqmKp,United States,Russian,2015-10-08 13:53:00,2015-10-08 13:53:00,41,119,2360,R,1
svetlanaleshkov,"Петюня, не сцы, мы едим! ... \|""""""""""""""""""""""""""""""""""\| \|\ ... \|Холодное пиво! \|\|""""\__,_ ... \|_____________ \|\|\|_\|__\|_ ) ... *(@)\|(@)""""""*******(@)""",United States,Ukrainian,2015-10-08 14:51:00,2015-10-08 14:51:00,41,119,2361,R,1
svetlanaleshkov,"Москвичи смогут полюбоваться 10 октября на Малый парад планет, если позволит погода http://t.co/KiHulFWKTA",United States,Russian,2015-10-08 16:13:00,2015-10-08 16:13:00,41,119,2363,R,1
svetlanaleshkov,СМИ: многие угнанные в Австралии пикапы Toyota Hilux переправляют ИГ http://t.co/SlnPFcUr24 © AP Photo http://t.co/tLSwr8moBt,United States,Russian,2015-10-09 10:11:00,2015-10-09 10:11:00,41,118,2368,R,1
svetlanaleshkov,"НАТО резко увеличило число разведывательных полетов вдоль российских границ, говорят в Москве http://t.co/pmBs2uQBog",United States,Russian,2015-10-09 11:32:00,2015-10-09 11:33:00,41,118,2369,R,1
svetlanaleshkov,С Белоруссии снимут санкции? «Лукашенко сам претендует на премию мира»: https://t.co/6qb23Xzogw,United States,Russian,2015-10-09 11:33:00,2015-10-09 11:34:00,41,118,2370,R,1
svetlanaleshkov,Смена тональности: Европа готова отменять санкции на фоне стабилизации в Донбассе http://t.co/tSjF5i3O9S,United States,Russian,2015-10-10 00:11:00,2015-10-10 00:11:00,41,118,2372,R,1
svetlanaleshkov,В Турции за оскорбления Эрдогана задержали редактора местной газеты   http://t.co/no6UE1vYNA,United States,Russian,2015-10-10 03:13:00,2015-10-10 03:13:00,41,118,2373,R,1
svetlanaleshkov,На Суматре пропал индонезийский вертолет http://t.co/3ObTvusgg2,United States,Russian,2015-10-12 02:51:00,2015-10-12 02:51:00,41,119,2385,R,1
svetlanaleshkov,Наступающая сирийская армия натолкнулась на сопротивление вооружаемых ЦРУ отрядов  http://t.co/vfSTFfSQVR,United States,Russian,2015-10-12 04:31:00,2015-10-12 04:31:00,41,119,2386,R,1
svetlanaleshkov,Apple занялась развитием своего телевидения в России  https://t.co/lj6ZF0d5BU,United States,Russian,2015-10-12 06:53:00,2015-10-12 06:53:00,41,119,2387,R,1
svetlanaleshkov,Анчелотти: хочу ещё поработать в английской Премьер-лиге http://t.co/LN9Dc3jDck,United States,Russian,2015-10-12 12:04:00,2015-10-12 12:05:00,41,119,2391,R,1
svetlanaleshkov,Канье Уэст все-таки сделал это  http://t.co/ysGpVBap8D http://t.co/CFMJWxhV04,United States,Russian,2015-10-12 19:53:00,2015-10-12 19:53:00,41,119,2303,R,1
svetlanaleshkov,Противники приема беженцев поставили «виселицу» для Меркель на акции в Дрездене  https://t.co/EhbpSVsLA4 http://t.co/scmm3v7qlA,United States,Ukrainian,2015-10-12 23:54:00,2015-10-12 23:54:00,41,119,2293,R,1
svetlanaleshkov,"американская мудрость: о русских либо хорошо, либо ""Ничего себе у них истребители, валим!""",United States,Russian,2015-10-13 11:13:00,2015-10-13 11:14:00,41,119,2295,R,1
svetlanaleshkov,СБ Нидерландов: определить угол запуска сбившей MH17 ракеты невозможно http://t.co/wz1LKx46ra http://t.co/v8NQfGqREM,United States,Russian,2015-10-13 12:31:00,2015-10-13 12:31:00,41,119,2296,R,1
svetlanaleshkov,Volkswagen снизит инвестиции на миллиард евро из-за «дизельного скандала»: http://t.co/U5QscicURn,United States,Ukrainian,2015-10-13 12:53:00,2015-10-13 12:53:00,41,119,2297,R,1
svetlanaleshkov,Албанию ждут проблемы?  http://t.co/fZOr2tcoTZ http://t.co/hACjmAFM5E,United States,Russian,2015-10-13 16:32:00,2015-10-13 16:32:00,41,119,2300,R,1
svetlanaleshkov,"Врба: игроки сборной Чехии подтвердили, что с ними можно добиваться результата http://t.co/ppQWcavU6w",United States,Russian,2015-10-14 01:12:00,2015-10-14 01:12:00,41,119,2304,R,1
svetlanaleshkov,"Росавиация: Нидерланды ""подгоняли"" поражение Boeing под заранее рассчитанную траекторию  http://t.co/sFLCsoNiYY",United States,Russian,2015-10-14 21:32:00,2015-10-14 21:33:00,41,119,2309,R,1
svetlanaleshkov,Мексиканский Playboy продолжит публиковать фото обнаженных моделей  http://t.co/Ap7eUErGKR http://t.co/pozTtdH2gM,United States,Russian,2015-10-14 23:46:00,2015-10-14 23:46:00,41,119,2311,R,1
svetlanaleshkov,В Кабмине предложили увеличить МРОТ http://t.co/G2t7fqrQcC http://t.co/4ulm2Bzdzs,United States,Russian,2015-10-15 04:02:00,2015-10-15 04:03:00,41,119,2313,R,1
svetlanaleshkov,В МИДе отмечают «беспрецедентный уровень взаимодействия» России и Турции http://t.co/fHB0F31pfB,United States,Russian,2015-10-15 08:53:00,2015-10-15 08:53:00,41,119,2316,R,1
svetlanaleshkov,Анкара сделала заявление насчет инцидента с самолетом РФ над Турцией  http://t.co/0bxd34IY5n http://t.co/UsYdYXI81y,United States,Russian,2015-10-15 15:30:00,2015-10-15 15:30:00,41,119,2319,R,1
svetlanaleshkov,Низкий спрос на билеты: Air Berlin постепенно прекратит летать в Россию http://t.co/ZmBfpMtcph,United States,Russian,2015-10-16 04:13:00,2015-10-16 04:13:00,41,119,2323,R,1
svetlanaleshkov,И еще у одного банка отозвали лицензию — «Леноблбанк» проводил «сомнительные транзитные операции»:  https://t.co/Stv9Ueg8G5,United States,Russian,2015-10-16 07:13:00,2015-10-16 07:13:00,41,119,2324,R,1
svetlanaleshkov,Б — БеспЕлотник http://t.co/fmnoBYoYVX,United States,Russian,2015-10-16 12:11:00,2015-10-16 12:11:00,41,119,2327,R,1
svetlanaleshkov,Превед хохлам из Крыма https://t.co/FpDjjwSLEP,United States,Russian,2015-10-16 14:53:00,2015-10-16 14:53:00,42,119,2330,R,1
svetlanaleshkov,Памятник актеру Евгению Леонову в образе Доцента из «Джентльменов удачи» украли в Москве http://t.co/vs4DirMxAG http://t.co/oei8Rb5gd9,United States,Russian,2015-10-16 15:34:00,2015-10-16 15:34:00,42,119,2333,R,1
svetlanaleshkov,Венгрия закрыла «окно в Европу»  http://t.co/GEKMu19dfc http://t.co/zFsKdQJhCh,United States,Bulgarian,2015-10-17 12:12:00,2015-10-17 12:13:00,42,119,2342,R,1
svetlanaleshkov,Изображение необычной пористой поверхности планеты Плутон опубликовал сайт НАСА http://t.co/Vs9wc0rkx0 © NASA http://t.co/yTes6B3Hqc,United States,Russian,2015-10-17 20:11:00,2015-10-17 20:11:00,42,119,2347,R,1
svetlanaleshkov,Яценюк назвал четыре условия для проведения выборов в Донбассе  http://t.co/d5YrCtTP3Y,United States,Russian,2015-10-18 13:51:00,2015-10-18 13:51:00,42,119,2350,R,1
svetlanaleshkov,Ложь - оружие информационной войны на Украине http://t.co/cZTq0LUNyS,United States,Russian,2015-10-18 16:50:00,2015-10-18 16:50:00,42,119,2351,R,1
svetlanaleshkov,В Тунисе закрыли десятки отелей  http://t.co/E1utoYwRwX http://t.co/eGZkiFB1S7,United States,Russian,2015-10-18 16:53:00,2015-10-18 16:53:00,42,119,2352,R,1
svetlanaleshkov,Депутат пожаловался Путину на плохую охрану Кремля   http://t.co/joSm3MS5u5,United States,Russian,2015-10-19 04:52:00,2015-10-19 04:52:00,42,119,2356,R,1
svetlanaleshkov,Более десяти машин столкнулись на Новорижском шоссе в Москве http://t.co/O7XSxqtHy4,United States,Russian,2015-10-19 09:33:00,2015-10-19 09:33:00,42,119,2358,R,1
svetlanaleshkov,Установи приложение #LifeCorr и выиграй #iPhone6 или 1 000 000 рублей!  Условия конкурса:  http://t.co/PFkEGs8KwS http://t.co/GQyMYu4hDK,United States,Russian,2015-10-19 13:33:00,2015-10-19 13:34:00,42,119,2359,R,1
svetlanaleshkov,Бывшая сотрудница красногорской администрации об убийстве первого замглавы района: «Мы все подавлены» http://t.co/tncsOrYF3y,United States,Russian,2015-10-19 18:15:00,2015-10-19 18:16:00,42,119,2361,R,1
svetlanaleshkov,Deutsche Bank ошибочно перевёл клиенту $6 млрд  https://t.co/yH1S97ksrX,United States,Ukrainian,2015-10-19 23:51:00,2015-10-19 23:51:00,42,119,2362,R,1
svetlanaleshkov,Ждать ли нам iPhone 6c  https://t.co/Mg2Do6mYcx https://t.co/OE8n9xGQ8t,United States,Russian,2015-10-20 06:32:00,2015-10-20 06:33:00,42,119,2364,R,1
svetlanaleshkov,Сересо: Д. Мартинес – отличный игрок и забьёт много голов за «Атлетико» https://t.co/WvfVVV6Vtk,United States,Ukrainian,2015-10-20 09:13:00,2015-10-20 09:13:00,42,119,2366,R,1
svetlanaleshkov,«Жирные пальцы» сотрудника Deutsche Bank «стоили» банку $6 млрд  https://t.co/rcJy6SOWAU https://t.co/oHI9kGlk8q,United States,Russian,2015-10-20 11:12:00,2015-10-20 11:12:00,42,119,2367,R,1
svetlanaleshkov,Google и Яндекс показали фото Донецкого аэропорта до и после войны  https://t.co/9hRZFwHUo9 https://t.co/8Vedqir3Bq,United States,Russian,2015-10-20 13:13:00,2015-10-20 13:13:00,42,119,2369,R,1
svetlanaleshkov,Foreign Affairs: все козыри в Сирии на руках у России https://t.co/UVpxVzOpe7 https://t.co/g5efdqB4HN,United States,Russian,2015-10-20 16:51:00,2015-10-20 16:51:00,42,119,2370,R,1
svetlanaleshkov,За мной следят :) https://t.co/W9KAr1HfMK,United States,Russian,2015-10-20 18:53:00,2015-10-20 18:53:00,42,119,2371,R,1
svetlanaleshkov,Из Питера в Стокгольм на самодельных каяках. Рассказ путешественников на @paperpaper_ru    https://t.co/mCCrFVX0SJ https://t.co/RImAKf5iW0,United States,Russian,2015-10-20 19:52:00,2015-10-20 19:52:00,42,119,2372,R,1
svetlanaleshkov,ДНР сообщила о начале отвода вооружений калибром менее 100 мм https://t.co/ARvVUU6bhC,United States,Russian,2015-10-21 07:32:00,2015-10-21 07:32:00,42,119,2374,R,1
svetlanaleshkov,Борис Гребенщиков открывает выставку картин в Британии https://t.co/RIgRj7uUhg,United States,Russian,2015-10-21 08:34:00,2015-10-21 08:34:00,42,119,2375,R,1
svetlanaleshkov,Авиакомпания «Трансаэро» окончательно покинет небо с 26 октября https://t.co/Ha6XPYGUYq https://t.co/YS78ISfV3m,United States,Russian,2015-10-21 09:05:00,2015-10-21 09:06:00,42,119,2376,R,1
svetlanaleshkov,Исследование: первыми хозяевами собак были азиаты https://t.co/QOQjMxqV6x,United States,Russian,2015-10-21 10:44:00,2015-10-21 10:44:00,42,119,2377,R,1
svetlanaleshkov,.@PolitSRU_head  Дарю талисман на изгнание свидомых из ленты https://t.co/hXwum3f1Jo,United States,Russian,2015-10-21 12:45:00,2015-10-21 12:45:00,42,119,2378,R,1
svetlanaleshkov,«Бенфика» забила «Галатасараю» 11 мячей в матче Юношеской лиги УЕФА https://t.co/ga3LIUIl0k,United States,Uzbek,2015-10-21 15:12:00,2015-10-21 15:12:00,42,119,2379,R,1
svetlanaleshkov,Матч «Тосно» — «Арсенал» состоится на день раньше остальных игр 22-го тура ФНЛ https://t.co/AWCazsBlsc,United States,Russian,2015-10-21 16:13:00,2015-10-21 16:13:00,42,119,2380,R,1
svetlanaleshkov,Мосгордума одобрила проект бюджета Москвы на 2016-2018 годы в первом чтении  https://t.co/fFqajQ88GK,United States,Russian,2015-10-21 16:31:00,2015-10-21 16:31:00,42,119,2381,R,1
svetlanaleshkov,"Аленичев: дерби «Спартака» с «Динамо» не менее значимо, чем «Спартак» — ЦСКА https://t.co/IkiRV8cvm5",United States,Ukrainian,2015-10-21 17:13:00,2015-10-21 17:13:00,42,119,2382,R,1
svetlanaleshkov,Актеры из «Спектра» приедут на российскую премьеру фильма  https://t.co/mEXQ9OxWNK https://t.co/vlmR8BEhWA,United States,Russian,2015-10-22 11:13:00,2015-10-22 11:13:00,42,119,2388,R,1
svetlanaleshkov,Вооруженный мечом мужчина в маске напал на школьников в Швеции  https://t.co/aScjdFv3xd https://t.co/1zKneNSnLd,United States,Russian,2015-10-22 11:13:00,2015-10-22 11:13:00,42,119,2387,R,1
svetlanaleshkov,СМИ: возможных членов ИГ из Чечни и Дагестана задержали в Турции https://t.co/2fTdkhwval https://t.co/Ao74LMZIgx,United States,Russian,2015-10-22 12:32:00,2015-10-22 12:35:00,42,118,2389,R,1
svetlanaleshkov,Владимир Путин: С появлением ядерного оружия победителей в конфликтах быть не может  https://t.co/5MeVOaO5vH https://t.co/ntFFlt8zxI,United States,Russian,2015-10-22 15:53:00,2015-10-22 15:59:00,42,118,2391,R,1
svetlanaleshkov,Генштаб ВС РФ: С начала операции в Сирии авиагруппа ВКС РФ уничтожила 819 объектов террористов  https://t.co/33bNeRbRgB,United States,Russian,2015-10-22 16:52:00,2015-10-22 17:00:00,42,118,2393,R,1
svetlanaleshkov,Барак Обама наложил вето на законопроект по поставкам оружия на Украину https://t.co/5jCTJYLZ1C https://t.co/JMmAgcBLN7,United States,Russian,2015-10-22 21:33:00,2015-10-22 21:40:00,42,118,2396,R,1
svetlanaleshkov,Моуринью: журналисты больше не услышат от меня ярких фраз для заголовков https://t.co/N2MlX2sJFB,United States,Ukrainian,2015-10-23 15:53:00,2015-10-23 15:53:00,42,118,2401,R,1
svetlanaleshkov,«Кировлес» отсудил у Навального и еще двух осужденных 16 млн рублей https://t.co/KbApFdrFEL https://t.co/m77I86ZDLs,United States,Russian,2015-10-23 16:34:00,2015-10-23 16:36:00,42,118,2402,R,1
svetlanaleshkov,18-й трамвай столкнулся с Renault Logan на ВИЗе (Фото) https://t.co/eJIpRhGTEm,United States,Russian,2015-10-23 21:32:00,2015-10-23 21:32:00,42,118,2404,R,1
svetlanaleshkov,«Зенит»-м — «Анжи»-м: игра завершилась нулевой ничьей https://t.co/EYibahn4K4 #спб  #спорт,United States,Russian,2015-10-24 10:51:00,2015-10-24 10:51:00,42,118,2406,R,1
svetlanaleshkov,"не знаю, правда ли, что после российских обстрелов главари ИГИЛ пересели на верблюдов, но то, что присели на очко - точно",United States,Russian,2015-10-24 10:52:00,2015-10-24 10:52:00,42,118,2407,R,1
svetlanaleshkov,ДНР: «Правый сектор» перебросил танки в Тельманово  https://t.co/TdrKsaGrd0 https://t.co/GUer1ED7lX,United States,Russian,2015-10-24 11:34:00,2015-10-24 11:34:00,42,118,2408,R,1
svetlanaleshkov,«Мой герой во многом похож на Зидана»  https://t.co/DGOeQyZANq https://t.co/P6AW9LjRBs,United States,Uzbek,2015-10-24 12:12:00,2015-10-24 12:12:00,42,118,2409,R,1
svetlanaleshkov,Власти Египта намерены просканировать пирамиды при помощи космических лучей https://t.co/HEnQlD8G54 https://t.co/nebf5W3I57,United States,Russian,2015-10-24 14:53:00,2015-10-24 15:00:00,42,118,2410,R,1
svetlanaleshkov,Праздник московского троллейбуса посетили около 50 тысяч человек.   https://t.co/xp8x0SNvLV https://t.co/K5Wd5as8yB,United States,Russian,2015-10-24 17:15:00,2015-10-24 17:15:00,42,119,2411,R,1
svetlanaleshkov,Президентские и парламентские выборы пройдут в Аргентине https://t.co/ReEbrNeq30 © Flickr/ Nicolas Barreiro Dupuy https://t.co/e22gsaa4nj,United States,Russian,2015-10-25 02:11:00,2015-10-25 02:11:00,42,118,2414,R,1
svetlanaleshkov,"Циклон приостановил работы по поиску перевернувшегося плашкоута ""Парамушир""  https://t.co/DRJfwXG6gx",United States,Russian,2015-10-25 02:52:00,2015-10-25 02:53:00,42,118,2416,R,1
svetlanaleshkov,"Тони Блэр признал, что вторжение в Ирак стало причиной появления ИГ https://t.co/a2tLomurQH",United States,Russian,2015-10-25 02:53:00,2015-10-25 02:53:00,42,118,2417,R,1
svetlanaleshkov,В Черногории 5000 чел. вышли на протестные акции против вступления страны в НАТО и за расформирование правительства  https://t.co/i7ANovQonf,United States,Russian,2015-10-25 11:19:00,2015-10-25 11:19:00,42,118,2419,R,1
svetlanaleshkov,ФОТОРЕПОРТАЖ. Под Тулой расположился один из крупнейших автомобильных музеев страны  https://t.co/h7eiPEVo9J https://t.co/Tpiy78YUUL,United States,Russian,2015-10-25 13:11:00,2015-10-25 13:11:00,42,118,2420,R,1
