author_id,content,region,language,publish_date,harvested_date,following,followers,updates,post_type,retweet
svetlanaleshkov,"Дополнительные пункты регистрации большегрузов вводятся на федеральных трассах, сообщили в Минтрансе https://t.co/b4CCXOLxPy",United States,Russian,2015-11-17 12:32:00,2015-11-17 12:32:00,42,118,2638,R,1
svetlanaleshkov,Германия — Нидерланды: на стадионе найден подозрительный предмет https://t.co/eDOBt9iIdR,United States,Russian,2015-11-17 18:52:00,2015-11-17 18:52:00,42,119,2640,R,1
svetlanaleshkov,Выпущен чехол для iPhone со встроенными очками виртуальной реальности https://t.co/ikyTUZDRYT,United States,Russian,2015-11-17 18:57:00,2015-11-17 18:57:00,42,119,2641,R,1
svetlanaleshkov,#ZaynMalik представил фрагмент первого после ухода из #1D клипа #OneDirection  https://t.co/rT2xQYpwlR https://t.co/VvFtWBJjYi,United States,Russian,2015-11-17 19:32:00,2015-11-17 19:32:00,42,119,2642,R,1
svetlanaleshkov,Снимки из космоса помогли подсчитать концентрацию планктона в воде https://t.co/UbEhj9Jmwk,United States,Russian,2015-11-17 19:35:00,2015-11-17 19:35:00,42,119,2643,R,1
svetlanaleshkov,Стали известны все участники Евро-2016. Последними пробились сборные Украины и Швеции:  https://t.co/MDalPwqrlb https://t.co/ohgIXvLQIq,United States,Russian,2015-11-18 00:14:00,2015-11-18 00:14:00,42,119,2646,R,1
svetlanaleshkov,В Пенсильвании сервису онлайн-вызова такси Uber грозит штраф в $50 млн  https://t.co/o6lppA9ehr,United States,Russian,2015-11-18 03:15:00,2015-11-18 03:15:00,42,119,2647,R,1
svetlanaleshkov,Фрагменты треков из нового альбома Адель попали в интернет: https://t.co/IUEcuXW71k,United States,Russian,2015-11-18 04:18:00,2015-11-18 04:18:00,42,119,2648,R,1
svetlanaleshkov,Два самолета Air France из США в Париж развернули из-за угроз https://t.co/CjYKI8McLE,United States,Ukrainian,2015-11-18 06:52:00,2015-11-18 06:52:00,42,119,2650,R,1
svetlanaleshkov,".@ReggaeMortis1 из-за одного освежёванного тобой заживо котёнка, всю жизнь так, до брызга слюней,  мучиться. Славно тебя Бог наказал!",United States,Ukrainian,2015-11-18 07:54:00,2015-11-18 07:54:00,42,119,2652,R,1
svetlanaleshkov,WSJ: глобальный альянс по борьбе с ИГ начинает складываться https://t.co/HrzFYbWMeA,United States,Russian,2015-11-18 08:13:00,2015-11-18 08:13:00,42,119,2653,R,1
svetlanaleshkov,"Не взлетим, так поплаваем: почему 2016 год для рубля будет благополучным https://t.co/5ug03HCn82",United States,Russian,2015-11-18 10:35:00,2015-11-18 10:35:00,42,119,2654,R,1
svetlanaleshkov,Екатеринбуржец через суд заставил корпорацию Apple вернуть деньги за сломавшийся телефон (Сканы) https://t.co/qMM4ofoNCk,United States,Russian,2015-11-18 10:54:00,2015-11-18 10:54:00,42,119,2655,R,1
svetlanaleshkov,Google запустил русскоязычный сервис по поиску авиабилетов https://t.co/lNyoCi2nkQ,United States,Russian,2015-11-18 14:53:00,2015-11-18 14:54:00,42,119,2656,R,1
svetlanaleshkov,В Кремле видели фотографию взрывного устройства с А321 https://t.co/n0RbpYLnFr,United States,Russian,2015-11-18 18:37:00,2015-11-18 18:37:00,42,119,2658,R,1
svetlanaleshkov,Офис «Трансаэро» в Москве выставлен для аренды https://t.co/5rDC6XBEBl https://t.co/qZJ4DM5jXC,United States,Russian,2015-11-18 19:51:00,2015-11-18 19:51:00,42,119,2659,R,1
svetlanaleshkov,Fitch повысило рейтинг Украины в иностранной валюте с «RD» до «CCC» https://t.co/oIk7FSUoFT © AP Photo https://t.co/oycoPdwYcx,United States,Ukrainian,2015-11-18 23:53:00,2015-11-18 23:54:00,42,119,2662,R,1
svetlanaleshkov,Миллер возглавил рейтинг самых дорогих топ-менеджеров по версии Forbes https://t.co/joKFcLHZMc,United States,Russian,2015-11-19 02:53:00,2015-11-19 02:53:00,42,119,2665,R,1
svetlanaleshkov,Правительство России утвердило меры поддержки одаренных детей https://t.co/5m4DE86PSv https://t.co/iALgVI2rYM,United States,Russian,2015-11-19 04:31:00,2015-11-19 04:31:00,42,119,2666,R,1
svetlanaleshkov,Лавров: новым железным занавесом Запад «прищемит себе что-нибудь» https://t.co/tsyInbbswM https://t.co/gq6nOjF6Uv,United States,Russian,2015-11-19 11:17:00,2015-11-19 11:17:00,42,119,2670,R,1
svetlanaleshkov,Мутко: премии женской сборной России поступят после выплат от НОВАТЭК https://t.co/PzEut4z996,United States,Russian,2015-11-19 13:03:00,2015-11-19 13:03:00,42,119,2671,R,1
svetlanaleshkov,Замглавы ОБСЕ: в Донбассе отведено не все тяжелое вооружение https://t.co/LFJ18oWlaQ,United States,Ukrainian,2015-11-19 14:33:00,2015-11-19 14:33:00,42,119,2674,R,1
svetlanaleshkov,Российские легкоатлеты пропустят зимний чемпионат мира 2016 года https://t.co/9HXLozkhmB,United States,Russian,2015-11-19 20:15:00,2015-11-19 20:16:00,42,119,2676,R,1
svetlanaleshkov,Греки согласились на новые меры жёсткой экономии https://t.co/Tpqo8O1uIR https://t.co/xPXiQXUe91,United States,Russian,2015-11-19 21:14:00,2015-11-19 21:14:00,42,119,2677,R,1
svetlanaleshkov,Отставной пилот вызвал тревогу в аэропорту Лос-Анджелеса https://t.co/dzY6DXxfdT © Flickr/ Synchronizer https://t.co/22W2Bzcur8,United States,Russian,2015-11-19 22:51:00,2015-11-19 22:51:00,42,119,2678,R,1
svetlanaleshkov,Агентство Moody’s повысило кредитный рейтинг Украины https://t.co/QU8VSyVdL2,United States,Russian,2015-11-20 01:01:00,2015-11-20 01:01:00,42,119,2681,R,1
svetlanaleshkov,"КАК ВЫ ОТНЕСЁТЕСЬ К ТОМУ, ЧТО ТВИТТЕР МЕНЯ ЗАБАНИЛ ? (Дебилы, откройте твит и проголосуйте, а не пишите мне!)",United States,Ukrainian,2015-11-20 07:33:00,2015-11-20 07:33:00,42,119,2683,R,1
svetlanaleshkov,"Демьян Кудрявцев, как пишет «Коммерсант», сообщил коллективу «Ведомостей» о выкупе издания https://t.co/oEIO38XVL9",United States,Russian,2015-11-20 08:15:00,2015-11-20 08:15:00,42,119,2684,R,1
svetlanaleshkov,Террористы удерживают 170 заложников в отеле Radisson в Мали  https://t.co/J7SA77g10a https://t.co/nBc3LFvElR,United States,Russian,2015-11-20 09:56:00,2015-11-20 09:56:00,42,119,2685,R,1
svetlanaleshkov,Песков: в Кремле в вопросе казни для террористов исходят из действия моратория https://t.co/mDQr7O4C1L https://t.co/8iheTU0aFk,United States,Russian,2015-11-20 09:58:00,2015-11-20 09:58:00,42,119,2686,R,1
svetlanaleshkov,ВИДЕО. Прототип новой P5 от Elio Motors показали на автосалоне в Лос-Анджелесе  https://t.co/7A1UFl7I3q https://t.co/D4HhJ90faU,United States,Russian,2015-11-20 11:53:00,2015-11-20 11:53:00,42,119,2687,R,1
svetlanaleshkov,«Зенит»-м — «Урал»-м: фоторепортаж с малой арены «Петровского» https://t.co/JmshwTh8hZ #спб  #спорт,United States,Russian,2015-11-20 13:01:00,2015-11-20 13:02:00,42,119,2688,R,1
svetlanaleshkov,"Почетную ""Реальную премию Musicbox 2015"" получил Стас Михайлов https://t.co/DCHuQYXM20",United States,Russian,2015-11-20 13:13:00,2015-11-20 13:13:00,42,119,2689,R,1
svetlanaleshkov,Россия и МВФ еще месяц могут торговаться по долгу Украины https://t.co/cjg9PfIj65 https://t.co/0KvgxH3uq0,United States,Russian,2015-11-20 17:55:00,2015-11-20 17:55:00,42,119,2692,R,1
svetlanaleshkov,"Летопись террора: видео от пленников отеля в Мали, террористы держат оборону https://t.co/0FykmECvya https://t.co/6RIvFnTtmQ",United States,Russian,2015-11-20 18:54:00,2015-11-20 18:55:00,42,119,2693,R,1
svetlanaleshkov,Кеда Кид — иллюстратор из Санкт-Петербурга. Очень самобытно... #graffiti #illustration https://t.co/ltiBCmDZ7M,United States,Russian,2015-11-20 19:33:00,2015-11-20 19:33:00,42,119,2694,R,1
svetlanaleshkov,"Власти Крыма контролируют ситуацию с энергоснабжением, отключений нет https://t.co/BHMqWhjmm5 https://t.co/uPDQ4rrbMC",United States,Russian,2015-11-20 20:01:00,2015-11-20 20:01:00,42,119,2695,R,1
svetlanaleshkov,Чуркин высказался о работе по проекту резолюции России против террора https://t.co/bdLMSuDQgu https://t.co/9fXWCLoP2w,United States,Russian,2015-11-21 00:12:00,2015-11-21 00:12:00,42,120,2696,R,1
svetlanaleshkov,Один из ключевых подозреваемых в терактах в Париже схвачен в Бельгии.   https://t.co/lPb0B1VHjj https://t.co/41SaWKinaz,United States,Russian,2015-11-21 13:14:00,2015-11-21 13:15:00,42,120,2698,R,1
svetlanaleshkov,Самолет со сломанным шасси благополучно сел в Домодедове.   https://t.co/wyX2xTVTcC https://t.co/stLyaLNFps,United States,Russian,2015-11-21 14:12:00,2015-11-21 14:13:00,42,120,2699,R,1
svetlanaleshkov,Алдонин: ЦСКА сыграл с «Крыльями Советов» ниже своих возможностей https://t.co/LOiXponV7g,United States,Russian,2015-11-21 15:54:00,2015-11-21 15:54:00,42,120,2700,R,1
svetlanaleshkov,Турция выразила протест против использования их воздушного пространства. Зачем тогда писать “Всё включено”?,United States,Russian,2015-11-21 16:55:00,2015-11-21 16:55:00,42,120,2701,R,1
svetlanaleshkov,"Бенитес прокомментировал разгромное поражение от ""Барселоны""  https://t.co/Ou9aujgqJM",United States,Russian,2015-11-21 21:36:00,2015-11-21 21:36:00,42,120,2702,R,1
svetlanaleshkov,"'@turist532 неее, на поезде дороже :) https://t.co/QidYfGmwf5'",United States,Ukrainian,2015-11-21 23:35:00,2015-11-21 23:35:00,42,120,2703,R,1
svetlanaleshkov,Британия планирует закупить около 140 истребителей для борьбы с террористическими группировк https://t.co/qa3xzdYKRy https://t.co/1FCoPUXjWr,United States,Russian,2015-11-22 02:11:00,2015-11-22 02:12:00,42,120,2704,R,1
svetlanaleshkov,Самолет Turkish Airlines экстренно приземлился в Канаде из-за угрозы взрыва: https://t.co/ZIGok2j6Ja,United States,Russian,2015-11-22 06:34:00,2015-11-22 06:34:00,42,120,2706,R,1
svetlanaleshkov,"уважаю выбор каждого, кто не идет в армию. кто-то же должен рожать",United States,Russian,2015-11-22 08:51:00,2015-11-22 08:51:00,42,120,2708,R,1
svetlanaleshkov,#LifeCorr  Многотонная бетономешалка рухнула в строительный котлован  Видео: https://t.co/M6YSOS5w9a https://t.co/Cern6VWxtD,United States,Russian,2015-11-22 16:56:00,2015-11-22 16:56:00,42,120,2710,R,1
svetlanaleshkov,МВД Украины: на журналистку ATR физического воздействия не оказывалось https://t.co/LKJFrpeli8 https://t.co/dKOhv1bLSH,United States,Russian,2015-11-22 17:53:00,2015-11-22 17:53:00,42,120,2712,R,1
svetlanaleshkov,В НАК подтвердили ликвидацию главаря присягнувшей ИГ бандгруппы https://t.co/6c4dRLAqcX,United States,Russian,2015-11-22 19:15:00,2015-11-22 19:15:00,42,120,2714,R,1
svetlanaleshkov,Аксенов об обесточивании Крыма: враги не поставят нас на колени https://t.co/CZRR3v9y07 https://t.co/mTR7AH7nFP,United States,Ukrainian,2015-11-23 13:32:00,2015-11-23 13:32:00,42,120,2721,R,1
svetlanaleshkov,Роскомнадзор признал запрещёнными четыре статьи «Википедии»  https://t.co/PEMGbfo3Ls https://t.co/GEYbfvVtS5,United States,Russian,2015-11-23 15:19:00,2015-11-23 15:29:00,42,120,2723,R,1
svetlanaleshkov,От чего умирают россияне  https://t.co/VvPC290jT6 https://t.co/pcnpfMmgCr,United States,Russian,2015-11-23 17:14:00,2015-11-23 17:15:00,42,122,2725,R,1
svetlanaleshkov,Британия допустила возможность агрессии России против стран НАТО https://t.co/qpsnsAxYcT,United States,Russian,2015-11-23 19:32:00,2015-11-23 19:32:00,42,122,2727,R,1
svetlanaleshkov,"NI: если Россия и Франция объединятся, это станет «ночным кошмаром» ИГ https://t.co/TmLS0IpoVu https://t.co/m564fgKmWU",United States,Russian,2015-11-23 19:51:00,2015-11-23 19:51:00,42,122,2728,R,1
svetlanaleshkov,"ФК ""Зенит"" попробует занять 1-е место в группе ЛЧ, обыграв ""Валенсию""  https://t.co/OaDmtmFOWJ https://t.co/gDdEj6odQs",United States,Russian,2015-11-23 23:31:00,2015-11-23 23:31:00,42,122,2729,R,1
svetlanaleshkov,КНДР не верит обещаниям Южной Кореи развивать межкорейский диалог  https://t.co/CR5Zop8dCF https://t.co/YarhfKS8ep,United States,Russian,2015-11-24 02:33:00,2015-11-24 02:33:00,42,122,2730,R,1
svetlanaleshkov,МИД Турции обратится в ООН и НАТО из-за инцидента с самолетом  https://t.co/M0K6JcIVJm https://t.co/HMxxQBI9vZ,United States,Russian,2015-11-24 09:15:00,2015-11-24 09:15:00,42,122,2733,R,1
svetlanaleshkov,"Путин даст оценку крушению Су-24, возможно, на встрече с королем Иордании Абдаллой II https://t.co/POSklz4qM1 https://t.co/VNjWKuJSok",United States,Russian,2015-11-24 11:17:00,2015-11-24 11:17:00,42,122,2739,R,1
svetlanaleshkov,Турция вызвала советника посла России после крушения Су-24 https://t.co/8ISdBoAGyL,United States,Russian,2015-11-24 13:52:00,2015-11-24 13:52:00,42,122,2741,R,1
svetlanaleshkov,"Густаво и Родригес не сыграют с ЦСКА Лидеры «Вольфсбурга» не прилетели в Москву, Дракслер может принять участия …  https://t.co/k7V7bgwyAa",United States,Russian,2015-11-24 13:52:00,2015-11-24 13:53:00,42,122,2742,R,1
svetlanaleshkov,Военного атташе Турции в России вызвали в Минобороны https://t.co/ShVJ73R6wd,United States,Russian,2015-11-24 14:57:00,2015-11-24 14:57:00,42,122,2743,R,1
svetlanaleshkov,Россия заявила официальный протест военному атташе Турции #новости https://t.co/qMdo6vEsX8,United States,Russian,2015-11-24 16:57:00,2015-11-24 16:57:00,42,122,2748,R,1
svetlanaleshkov,Глава ФМС: свыше 86 тысяч граждан Турции находятся на территории РФ https://t.co/c1QbgdESZf #СУ24 #УдарВСпину https://t.co/9TSoEoTxHf,United States,Russian,2015-11-24 18:42:00,2015-11-24 18:42:00,42,122,2751,R,1
svetlanaleshkov,Крейсер «Москва»: кто будет прикрывать российские самолёты после инцидента с Су-24 https://t.co/XDdRjWnGAg https://t.co/c3g4tRGEk3,United States,Russian,2015-11-25 05:17:00,2015-11-25 05:19:00,42,122,2752,R,1
svetlanaleshkov,Турецкий демарш  https://t.co/c1LI6BSNYo https://t.co/Nmymkewvw8,United States,Russian,2015-11-25 07:17:00,2015-11-25 07:17:00,42,122,2753,R,1
svetlanaleshkov,"В Ульяновске жители сорвали флаг Турции с пивзавода Efes, заменив его знаменем ВДВ и написав Эрдогану открытку https://t.co/LZItGDiM28",United States,Russian,2015-11-25 07:34:00,2015-11-25 07:34:00,42,122,2754,R,1
svetlanaleshkov,Правозащитники заявили о запуске ракет с кораблей по району падения Су-24 https://t.co/TkiFgpRLzY,United States,Russian,2015-11-25 13:55:00,2015-11-25 13:56:00,42,122,2758,R,1
svetlanaleshkov,Сербский футбольный клуб «Црвена Звезда» отказался от проведения зимних сборов в Турции из уважения к России #Су24 https://t.co/jPEQL5WHxn,United States,Russian,2015-11-26 07:59:00,2015-11-26 08:01:00,42,122,2765,R,1
svetlanaleshkov,Посольство США: решение о санкциях против РФ приняли до ЧП с Су-24 https://t.co/58YIBJJXKM https://t.co/5GAEx8hWNW,United States,Russian,2015-11-26 10:34:00,2015-11-26 10:35:00,42,122,2770,R,1
svetlanaleshkov,Срочно: Россия развернула в Сирии зенитно-ракетный комплекс С-400  https://t.co/CnLSgkTi9u #Сирия #УдарВСпину https://t.co/Ar9bPfsahu,United States,Russian,2015-11-26 10:35:00,2015-11-26 10:35:00,42,122,2771,R,1
svetlanaleshkov,Россия может частично закрыть небо для Турции https://t.co/8i4hkrwrOW https://t.co/JwCGYgjZP7,United States,Russian,2015-11-26 13:53:00,2015-11-26 13:56:00,42,122,2774,R,1
svetlanaleshkov,"Мария Захарова: США знают, кто расстрелял катапультировавшегося пилота #Су24  https://t.co/juqMj7PY6o https://t.co/aFNCgyZUcR",United States,Bulgarian,2015-11-26 13:57:00,2015-11-26 14:05:00,42,122,2776,R,1
svetlanaleshkov,"«Спартак» оштрафован на 450 тыс. рублей, Каприн дисквалифицирован на один матч https://t.co/0X4Tiue6oK",United States,Russian,2015-11-26 14:15:00,2015-11-26 14:16:00,42,122,2777,R,1
svetlanaleshkov,Клинцевич: помощь США Украине взорвет ситуацию в Донбассе https://t.co/lXlgQRP3lw https://t.co/1Q97zdQ8wy,United States,Russian,2015-11-26 14:31:00,2015-11-26 14:36:00,42,122,2779,R,1
svetlanaleshkov,"Размещение российских С-400 в Сирии, ноябрь 2015 года  #Syria #Latakia #S400 https://t.co/xpWHKUdsv6",United States,Russian,2015-11-26 16:28:00,2015-11-26 16:28:00,42,122,2781,R,1
svetlanaleshkov,"«Тоттенхэм» вышел в плей-офф Лиги Европы, «Монако» проиграл «Андерлехту» https://t.co/1opwN7JysU",United States,Russian,2015-11-26 20:37:00,2015-11-26 20:37:00,42,122,2784,R,1
svetlanaleshkov,Во взорванной в Новосибирске машине вместе с депутатом погиб ее супруг https://t.co/QlVgu21uuq,United States,Russian,2015-11-26 21:34:00,2015-11-26 21:34:00,42,122,2786,R,1
svetlanaleshkov,Эрдоган: Олланд расскажет мне детали его встречи с Путиным https://t.co/Ls8skGkbdr,United States,Uzbek,2015-11-27 00:02:00,2015-11-27 00:02:00,42,122,2787,R,1
svetlanaleshkov,МЧС доставит в Красноярск пострадавших при крушении Ми-8 под Игаркой  https://t.co/IwyHo6vHHm https://t.co/5wgjLxcYrn,United States,Russian,2015-11-27 05:14:00,2015-11-27 05:15:00,42,122,2788,R,1
svetlanaleshkov,Адмирал: Турция не сможет закрыть Черноморские проливы для кораблей РФ https://t.co/W2TLHHHDXE https://t.co/S5BUgxyPkV,United States,Ukrainian,2015-11-27 07:57:00,2015-11-27 07:57:00,42,122,2789,R,1
svetlanaleshkov,Stockmann распрощается со своим ТЦ в России за 5 млн евро  https://t.co/mKvkwfKtf4 https://t.co/MjizRdWcQ1,United States,Russian,2015-11-27 08:16:00,2015-11-27 08:16:00,42,122,2790,R,1
svetlanaleshkov,Веерные отключения производятся в Крыму по дедовскому методу https://t.co/ID7thlhnZH https://t.co/zWEtdEzQ20,United States,Russian,2015-11-27 18:11:00,2015-11-27 18:12:00,42,120,2795,R,1
svetlanaleshkov,"Трое полицейских ранены в Колорадо, подозреваемый задержан https://t.co/QGEreVNNpL https://t.co/mLft0Fx25A",United States,Russian,2015-11-27 21:13:00,2015-11-27 21:16:00,42,120,2798,R,1
svetlanaleshkov,Рождественский пост начинается у православных верующих  https://t.co/tCafzRblXw https://t.co/1jTVZXbb1o,United States,Russian,2015-11-28 01:51:00,2015-11-28 01:51:00,42,120,2799,R,1
svetlanaleshkov,Полиция установила личность стрелка в Колорадо https://t.co/yLqGH6XBfZ,United States,Russian,2015-11-28 08:13:00,2015-11-28 08:13:00,42,120,2803,R,1
svetlanaleshkov,Власти Крыма проверяют информацию о застрявших в Турции дальнобойщиках и готовы помочь им https://t.co/oWDYmMJIuP,United States,Russian,2015-11-28 12:15:00,2015-11-28 12:15:00,42,120,2805,R,1
svetlanaleshkov,Рамзан Кадыров обвинил власти Турции в пособничестве терроризму  https://t.co/Re4U8BaiAi https://t.co/5ocg7SXU8H,United States,Russian,2015-11-28 14:55:00,2015-11-28 14:59:00,42,120,2806,R,1
svetlanaleshkov,".@kononenkome глядя на Крым, до всего мира начало доходить, кто устраивал на Украине голодоморы @poroshenko https://t.co/SHJYnDWmox",United States,Russian,2015-11-28 15:02:00,2015-11-28 15:02:00,42,120,2807,R,1
svetlanaleshkov,Севастополь не испытывает проблем с водоснабжением – директор водоканала  Севастополь не исп https://t.co/Sd6OU6foX4 https://t.co/jjaDFVR4t3,United States,Russian,2015-11-28 17:51:00,2015-11-28 17:51:00,42,120,2808,R,1
svetlanaleshkov,Тело пилота Су-24 доставлено в Турцию и будет привезено в Россию https://t.co/dPuYK2U2NN https://t.co/KC4azcc7CB,United States,Russian,2015-11-29 09:56:00,2015-11-29 09:56:00,42,120,2810,R,1
svetlanaleshkov,Турки за копейку удавиться готовы походу,United States,Ukrainian,2015-11-29 15:13:00,2015-11-29 15:13:00,42,120,2812,R,1
svetlanaleshkov,СМИ: Путин выступит с посланием Федеральному собранию 3 декабря https://t.co/5WiUHDkSEV https://t.co/UmbQk58rXv,United States,Russian,2015-11-29 18:34:00,2015-11-29 18:34:00,42,120,2815,R,1
svetlanaleshkov,Олланд предостерег демонстрантов от повторения беспорядков в дни COP-21 в Париже  https://t.co/tFWNhYojjf,United States,Russian,2015-11-29 19:31:00,2015-11-29 19:32:00,42,120,2816,R,1
svetlanaleshkov,Фонд Сороса признан нежелательным в России https://t.co/k2lVPJZiKf,United States,Russian,2015-11-30 13:21:00,2015-11-30 13:21:00,42,120,2818,R,1
svetlanaleshkov,"Челябинский полицейский, сбивший насмерть двух детей, приговорен почти к 6 годам колонии https://t.co/x4q6bYfvFz",United States,Russian,2015-12-01 08:32:00,2015-12-01 08:32:00,42,119,2822,R,1
svetlanaleshkov,НАТО выступил против размещения систем ПВО на территории России https://t.co/vDDbjtFq7a,United States,Russian,2015-12-02 11:36:00,2015-12-02 11:36:00,42,119,2824,R,1
svetlanaleshkov,Кому это НАТО?  https://t.co/mLFNSE5oY9,United States,Ukrainian,2015-12-02 15:06:00,2015-12-02 15:06:00,42,119,2826,R,1
svetlanaleshkov,МИД Украины: Киев намерен не допустить реализации «Северного потока-2» https://t.co/qXCE8Ytt3I https://t.co/S2NiQD7bMo,United States,Ukrainian,2015-12-02 15:34:00,2015-12-02 15:35:00,42,119,2828,R,1
svetlanaleshkov,Первый замглавы Минприроды Денис Храмов ушел в отставку https://t.co/hauiWCyErg,United States,Russian,2015-12-02 19:39:00,2015-12-02 19:39:00,42,119,2830,R,1
svetlanaleshkov,"Путин - партнер Великобритании в стремлении стабилизировать ситуацию в Сирии, заявил глава британского МИД  https://t.co/S2l3wBUoT4",United States,Russian,2015-12-03 01:34:00,2015-12-03 01:34:00,42,119,2833,R,1
