author_id,content,region,language,publish_date,harvested_date,following,followers,updates,post_type,retweet
svetlanaleshkov,"В Харькове активисты напали на мужчину в футболке с надписью ""СССР"" http://t.co/fGyo24QkWI",United States,Russian,2015-08-23 17:31:00,2015-09-18 04:50:00,41,113,1971,R,1
svetlanaleshkov,У финансовых рынков почва уходит из-под ног.  Падают практически все фондовые и сырьевые активы  #BlackMonday http://t.co/5fFMP0RW2k,United States,Russian,2015-08-24 14:42:00,2015-09-20 03:07:00,41,113,1979,R,1
svetlanaleshkov,У меня Вики прекрасно открывается https://t.co/bJnxtukmLp http://t.co/EiLzIQqvVf,United States,Russian,2015-08-24 15:52:00,2015-08-24 15:52:00,41,113,1980,R,1
svetlanaleshkov,Трем фигурантам дела об убийстве Немцова продлен срок ареста  http://t.co/Q9EZJj4LeX,United States,Russian,2015-08-24 15:54:00,2015-08-24 15:54:00,41,113,1981,R,1
svetlanaleshkov,Опять кризис? http://t.co/OKWY6vvVqX,United States,Russian,2015-08-24 17:13:00,2015-08-24 17:13:00,41,113,1982,R,1
svetlanaleshkov,Если вас волнует курс рубля http://t.co/rTky7gmeuR,United States,Russian,2015-08-24 17:18:00,2015-08-24 17:18:00,41,113,1983,R,1
svetlanaleshkov,Википедия уже блокируется  #hitech,United States,Russian,2015-08-25 03:11:00,2015-08-25 03:11:00,41,113,1987,R,1
svetlanaleshkov,Почему нефть не будет дорожать еще несколько лет. Колонка партнера консалтинговой компании RusEnergy http://t.co/tXjwL1ZEfa,United States,Russian,2015-08-25 18:12:00,2015-08-25 18:12:00,41,112,1993,R,1
svetlanaleshkov,Российские экономисты перестали верить в повышение процентной ставки  http://t.co/JZB2mEVOP0,United States,Russian,2015-08-26 00:52:00,2015-08-26 00:52:00,41,112,1996,R,1
svetlanaleshkov,Два дома сгорели в посёлке Спартак после ночного обстрела ВСУ http://t.co/q17EKR0xlJ http://t.co/TsprV51mQs,United States,Russian,2015-08-26 06:13:00,2015-09-22 02:07:00,41,112,1997,R,1
svetlanaleshkov,"Патрушев просит принять меры к чиновникам, которые гуглят и вацапят https://t.co/xynn0IcP28",United States,Russian,2015-08-26 09:02:00,2015-09-22 03:32:00,41,112,2000,R,1
svetlanaleshkov,Матвиенко прокомментировала визовые решения США  http://t.co/f1UtFGJMpE http://t.co/jUijhWHDbY,United States,Russian,2015-08-27 08:32:00,2015-08-27 08:32:00,41,114,2004,R,1
svetlanaleshkov,Рубль почти компенсировал потери прошлой недели http://t.co/1zAUTRIaYx,United States,Russian,2015-08-27 17:13:00,2015-09-23 11:40:00,41,114,2007,R,1
svetlanaleshkov,Объявлена дата презентации нового #iPhone  http://t.co/f0eQAeNcSl http://t.co/SA7sCD0pn5,United States,Macedonian,2015-08-27 17:53:00,2015-08-27 17:53:00,41,114,2008,R,1
svetlanaleshkov,УЕФА назвал лучшего футболиста прошлого сезона  http://t.co/lbCiXxDtia,United States,Russian,2015-08-27 19:02:00,2015-08-27 19:02:00,41,114,2009,R,1
svetlanaleshkov,"Финские зрадники   Финская туркомпания распространяет карту, где Крым обозначен как часть РФ   http://t.co/tXuaAh83up http://t.co/gBJtmfT7Xn",United States,Russian,2015-08-29 03:11:00,2015-08-29 03:11:00,41,116,2018,R,1
svetlanaleshkov,"Платини: возможно, в ближайшее время посещу Крым http://t.co/hByosIg2yd",United States,Russian,2015-08-30 04:52:00,2015-08-30 04:52:00,41,116,2020,R,1
svetlanaleshkov,Угроза взрыва на Ярославском вокзале оказалась ложной #новости http://t.co/DOd4DvcE9a,United States,Russian,2015-08-30 20:31:00,2015-08-30 20:31:00,41,115,2025,R,1
svetlanaleshkov,New York Times: Россияне рады променять Париж на Золотое кольцо http://t.co/gdhmm3uf1v,United States,Russian,2015-08-31 00:51:00,2015-08-31 00:51:00,41,115,2028,R,1
svetlanaleshkov,СРОЧНО: На учениях НАТО в Черном море будут корабль и самолеты с ядерным зарядом    http://t.co/a8VGOQ46bS http://t.co/ywiX7v4iMC,United States,Russian,2015-08-31 10:04:00,2015-08-31 10:04:00,41,115,2031,R,1
svetlanaleshkov,Согласован проект новой лестницы в 6-ом микрорайоне. Теперь-депутатский контроль исполнения:качество и сроки #савелки http://t.co/7wijwDszAA,United States,Russian,2015-08-31 10:54:00,2015-09-27 09:11:00,41,115,2032,R,1
svetlanaleshkov,СМИ: за митинг у Рады людям раздавали деньги и футболки  http://t.co/5TFYzzncN1 http://t.co/Fu95SMVLPL,United States,Uzbek,2015-08-31 14:13:00,2015-08-31 14:13:00,41,114,2036,R,1
svetlanaleshkov,Проект «Многодетные каникулы» знакомит детей с храмами Москвы и Тулы http://t.co/IdfewWXbQz,United States,Russian,2015-08-31 16:08:00,2015-08-31 16:08:00,41,114,2039,R,1
svetlanaleshkov,Сергей Лавров назвал «вывертами» антироссийские санкции Запада  http://t.co/6sHGBTeOkd http://t.co/rnyr6grZhe,United States,Russian,2015-09-01 08:32:00,2015-09-01 08:32:00,41,114,2045,R,1
svetlanaleshkov,"""Аэрофлот"" берет ""Трансаэро"" под крыло http://t.co/FFvBtFEMwX",United States,Russian,2015-09-01 22:31:00,2015-09-01 22:31:00,41,116,2055,R,1
svetlanaleshkov,Путин прибыл с рабочим визитом в Читинскую область http://t.co/mp0GiguyWZ,United States,Russian,2015-09-02 07:32:00,2015-09-29 06:33:00,41,116,2057,R,1
svetlanaleshkov,Селфи разводящихся пар набирают популярность в соцсетях  http://t.co/VVV0zn1lV7 http://t.co/livPtEm7Kx,United States,Russian,2015-09-02 13:54:00,2015-09-02 13:54:00,41,116,2060,R,1
svetlanaleshkov,"Девятиклассник ограбил стариков-пенсионеров после того, как провел лето в лагере «Укропчик» http://t.co/KVoUr7T54T",United States,Russian,2015-09-02 15:12:00,2015-09-02 15:13:00,41,116,2061,R,1
svetlanaleshkov,"МИД отреагировал на идею создания трибунала по крушению ""Боинга""  http://t.co/dIedvLc1dz http://t.co/WLNvSmEFhX",United States,Russian,2015-09-03 15:23:00,2015-09-03 15:23:00,41,116,2065,R,1
svetlanaleshkov,Навальный пригласил дипломатов США в Кострому для отчета   https://t.co/top8wyQANe http://t.co/jC5rTMszZM,United States,Ukrainian,2015-09-04 09:38:00,2015-09-04 09:38:00,41,116,2072,R,1
svetlanaleshkov,Португалия — Франция: онлайн-трансляция матча начнётся 4 сентября в 21:45 http://t.co/rCYH1nHgrr,United States,Russian,2015-09-04 14:52:00,2015-09-04 14:52:00,41,116,2075,R,1
svetlanaleshkov,Австрия и Германия согласились впустить мигрантов из Венгрии http://t.co/ob207q1tup,United States,Russian,2015-09-04 23:31:00,2015-09-04 23:31:00,41,116,2078,R,1
svetlanaleshkov,"""Ъ"": переход на топливо класса ""евро-5"" могут отложить до 2017 года http://t.co/m99P7eycU1",United States,Russian,2015-09-04 23:31:00,2015-09-04 23:31:00,41,116,2079,R,1
svetlanaleshkov,США собираются ввести санкции против Китая http://t.co/PEkbbO5h1M,United States,Russian,2015-09-05 05:52:00,2015-09-12 06:42:00,41,113,2140,R,1
svetlanaleshkov,В Москве в воскресенье ожидается до +17&deg;C http://t.co/bSQbcSspDS,United States,Russian,2015-09-06 05:53:00,2015-09-06 05:53:00,41,116,2084,R,1
svetlanaleshkov,Во время акции правых радикалов против приема беженцев в Дортмунде произошли беспорядки  http://t.co/z7UlVJHYO4,United States,Russian,2015-09-06 10:14:00,2015-09-06 10:14:00,41,116,2085,R,1
svetlanaleshkov,Кашин обнародовал имена подозреваемых в покушении на него в 2010 году http://t.co/vAWA1fvGYy,United States,Russian,2015-09-07 01:18:00,2015-09-07 01:20:00,41,115,2088,R,1
svetlanaleshkov,Автошколы предлагают разделить права на профессиональные и любительские    http://t.co/k3VPz86QiP,United States,Russian,2015-09-07 10:13:00,2015-09-07 10:13:00,41,115,2089,R,1
svetlanaleshkov,"Коммерсант объяснил, что удалил слова Навального по рекомендации правового департамента    https://t.co/z3iT76hKiL",United States,Ukrainian,2015-09-07 17:12:00,2015-09-07 17:12:00,41,115,2091,R,1
svetlanaleshkov,Число пострадавших от урагана в Казани увеличилось до 19  http://t.co/6SPl0eiTpY  Видео: http://t.co/d40dx9YnWH,United States,Russian,2015-09-07 17:53:00,2015-09-07 17:53:00,41,115,2092,R,1
svetlanaleshkov,В Екатеринбурге начинается Уральская биеннале http://t.co/lBjtxFelZ3,United States,Russian,2015-09-08 12:11:00,2015-09-08 12:11:00,41,115,2098,R,1
svetlanaleshkov,"История о том, как заказать петербургское такси в Пулково за 4 тыс и опоздать на 5 часов...  http://t.co/XLPkFKj0xZ http://t.co/Ry8us3IknM",United States,Russian,2015-09-08 14:44:00,2015-09-08 14:45:00,41,115,2099,R,1
svetlanaleshkov,Эксперты: развитие туризма в Санкт-Петербурге тормозит низкое качество игроков на рынке такси  http://t.co/W3bB3bbnOP http://t.co/o1gTA7lbz9,United States,Russian,2015-09-08 15:08:00,2015-09-08 15:09:00,41,115,2102,R,1
svetlanaleshkov,фантомные боли http://t.co/za7B0U7TK7,United States,Russian,2015-09-08 15:13:00,2015-09-08 15:16:00,41,115,2104,R,1
svetlanaleshkov,"«Енисей»: не указывали на сайте объявлений, что ищем именно иностранного игрока http://t.co/mnady2h3SM",United States,Russian,2015-09-08 15:32:00,2015-09-08 15:32:00,41,115,2105,R,1
svetlanaleshkov,Де Хеа — в основном составе сборной Испании на матч с Македонией http://t.co/yJohnpo7Rv,United States,Macedonian,2015-09-08 18:34:00,2015-09-08 18:34:00,41,115,2109,R,1
svetlanaleshkov,ВТОРОЙ ГОЛ на матче Лихтенштейн — Россия  http://t.co/zM2AjUyVGc http://t.co/kcpGyT6nIq,United States,Russian,2015-09-08 20:12:00,2015-09-08 20:12:00,41,115,2110,R,1
svetlanaleshkov,Ходорковский зарегистрировал фамилию как бренд http://t.co/hOKDdG2iKy,United States,Macedonian,2015-09-09 01:31:00,2015-09-09 01:31:00,41,115,2112,R,1
svetlanaleshkov,В ООН предостерегли страны ЕС от дискриминации беженцев по религиозному признаку  http://t.co/yC7gxqLi62,United States,Russian,2015-09-09 03:51:00,2015-09-09 03:51:00,41,115,2113,R,1
svetlanaleshkov,В Нижнем Тагиле открылась международная выставка вооружений Russia Arms Expo 2015 – репортаж @AFarmer_RT (ВИДЕО) http://t.co/PkgXEwClca,United States,Russian,2015-09-09 14:02:00,2015-09-09 14:02:00,41,115,2119,R,1
svetlanaleshkov,Слуцкий не имеет подписанного контракта с РФС http://t.co/Xcgr6S9Q4Z,United States,Ukrainian,2015-09-09 17:52:00,2015-09-09 17:52:00,41,113,2121,R,1
svetlanaleshkov,"Яценюк: «Северный поток-2» вредит не только Украине, но и Европе http://t.co/vTGH5m9BOw http://t.co/VUJybFcvOX",United States,Russian,2015-09-10 13:33:00,2015-09-10 13:33:00,41,113,2125,R,1
svetlanaleshkov,"""Аэрофлот"" выполнит все обязательства по перевозке пассажиров ""Трансаэро"" http://t.co/jzXHHCZEg9",United States,Russian,2015-09-10 16:12:00,2015-09-10 16:12:00,41,113,2127,R,1
svetlanaleshkov,В Хабаровском крае группа школьников отравилась выхлопными газами в автобусе  http://t.co/rCd8T5bPor,United States,Russian,2015-09-11 05:51:00,2015-09-11 05:51:00,41,113,2129,R,1
svetlanaleshkov,Сборная России поднялась на девять позиций в рейтинге УЕФА https://t.co/VQEL0DeEX0,United States,Russian,2015-09-11 06:51:00,2015-09-11 06:51:00,41,113,2130,R,1
svetlanaleshkov,Защитник «Амкара» Зайцев: когда учился в «Черноморце» подавал мячи Герусу http://t.co/Sil9CykgMN,United States,Russian,2015-09-11 07:52:00,2015-09-11 07:52:00,41,113,2131,R,1
svetlanaleshkov,Останки царевича Алексея и великой княжны Марии Романовых будут захоронены 18 октября http://t.co/lHRuaVPH8I,United States,Russian,2015-09-11 11:13:00,2015-09-11 11:13:00,41,113,2133,R,1
svetlanaleshkov,"КХЛ. ""Амур"" справился с рижским ""Динамо"" http://t.co/vocCvS4uSL",United States,Russian,2015-09-12 10:51:00,2015-09-12 10:51:00,41,113,2140,R,1
svetlanaleshkov,"Главы МИД ""нормандской четверки"" готовы обсуждать вопросы по местным выборам в Донбассе #новости http://t.co/mJWBV0hoHn",United States,Russian,2015-09-12 22:33:00,2015-09-12 22:33:00,41,113,2146,R,1
svetlanaleshkov,Лавров усомнился в целях США в борьбе с «Исламским государством»  http://t.co/0QBgoaNzOq,United States,Russian,2015-09-13 14:02:00,2015-09-13 14:03:00,41,113,2149,R,1
svetlanaleshkov,В штабе «Открытой России» в Костроме нашли пятно крови вместо трупа http://t.co/F3DxqGFfRL,United States,Russian,2015-09-13 18:12:00,2015-09-13 18:13:00,41,113,2152,R,1
svetlanaleshkov,На территории университета в американском штате Миссисипи неизвестный открыл стрельбу http://t.co/fewXaQcHFe,United States,Russian,2015-09-14 17:52:00,2015-09-14 17:52:00,41,113,2156,R,1
svetlanaleshkov,Футболка Оздоева — на аукционе «Чемпионата» http://t.co/V6lUREpjHE,United States,Bulgarian,2015-09-15 15:17:00,2015-09-15 15:18:00,41,113,2161,R,1
svetlanaleshkov,'@GrahamWP_UK Захарченко подписал указ о проведении местных выборов в ДНР 18 октября http://t.co/PyUo84BK1S http://t.co/akELzfCe37',United States,Russian,2015-09-16 11:28:00,2015-09-16 11:31:00,42,113,2171,R,1
svetlanaleshkov,Интернет-пользователей возмутило фото семьи на фоне гроба с покойником http://t.co/oyaE4UqP7P,United States,Russian,2015-09-16 12:12:00,2015-09-16 12:12:00,42,113,2173,R,1
svetlanaleshkov,"Создатель колеса обозрения уверен, что аттракцион на ВДНХ не демонтируют http://t.co/4axPWiDPbN",United States,Russian,2015-09-16 18:33:00,2015-09-16 18:33:00,42,114,2177,R,1
svetlanaleshkov,"Обама пригласил в Белый дом школьника, которого задержали за самодельные часы https://t.co/8r19F4wqen http://t.co/JaaUVjNuJH",United States,Russian,2015-09-16 20:32:00,2015-09-16 20:34:00,42,114,2178,R,1
svetlanaleshkov,МИД призвал Запад поставлять гуманитарную помощь Сирии http://t.co/TMAMp5fXSr,United States,Russian,2015-09-17 14:33:00,2015-09-17 14:33:00,42,114,2185,R,1
svetlanaleshkov,Навка назвала Навального «маньяком» после расследования о доме за $7млн: http://t.co/5BDW95BzzU,United States,Russian,2015-09-17 16:14:00,2015-09-17 16:14:00,42,114,2189,R,1
svetlanaleshkov,"Захарченко заявил, что Порошенко признал его главой ДНР  http://t.co/4RWXHFT2Sj http://t.co/P3q459u8Dt",United States,Russian,2015-09-17 18:15:00,2015-09-17 18:15:00,42,114,2190,R,1
svetlanaleshkov,Голодец разъяснила британскому министру культуры состояние традиционных ценностей в России http://t.co/ZoT9LGnFg7,United States,Russian,2015-09-18 16:13:00,2015-09-18 16:13:00,42,115,2196,R,1
svetlanaleshkov,Роскосмос и ESA советуют перенести миссию ExoMars http://t.co/NgfU7k87SA,United States,Russian,2015-09-18 19:33:00,2015-09-18 19:33:00,42,115,2201,R,1
svetlanaleshkov,Словенская полиция применила против беженцев слезоточивый газ на границе с Хорватией http://t.co/rYj0nNcILR,United States,Russian,2015-09-18 22:12:00,2015-09-18 22:12:00,42,115,2202,R,1
svetlanaleshkov,Глава общественной организации крымских татар подверг в Женеве критике политику Украины  http://t.co/kKs7QwsgtW,United States,Russian,2015-09-19 00:33:00,2015-09-19 00:33:00,42,115,2203,R,1
svetlanaleshkov,За год Белоруссия превратилась в крупнейшего поставщика киви в Россию:  http://t.co/1iEJbzxV1q,United States,Russian,2015-09-19 09:51:00,2015-09-19 09:51:00,42,115,2205,R,1
svetlanaleshkov,"Видимо, опять монтаж. Не может же бандеровская гнусная свинья, ой прастити, депутат Украины Мосийчук так себя вести  https://t.co/64woph6qsE",United States,Ukrainian,2015-09-19 13:12:00,2015-09-19 13:12:00,42,115,2206,R,1
svetlanaleshkov,Папа Римский Франциск прибыл на Кубу в рамках визита http://t.co/kOESqVrzg3,United States,Ukrainian,2015-09-19 20:51:00,2015-09-19 20:51:00,42,115,2207,R,1
svetlanaleshkov,Роухани: Иран не выйдет за рамки условий Дополнительного протокола к соглашению с МАГАТЭ  http://t.co/7WXdh0VM41,United States,Ukrainian,2015-09-20 13:54:00,2015-09-20 13:54:00,42,115,2208,R,1
svetlanaleshkov,Мадуро: Венесуэла купит 12 боевых самолетов «Сухого»  https://t.co/eYqrZiYnFJ http://t.co/O5YvlrXg3P,United States,Russian,2015-09-21 03:53:00,2015-09-21 03:53:00,42,115,2209,R,1
svetlanaleshkov,Приднестровье прокомментировало сообщения о блокаде со стороны Украины  http://t.co/C9uUoqfTlZ http://t.co/qcyDx40wPM,United States,Russian,2015-09-21 17:32:00,2015-09-21 17:32:00,42,116,2215,R,1
svetlanaleshkov,НАТО готова продолжить сотрудничество с Россией для выполнения минских соглашений http://t.co/KgDS5kYX9i,United States,Russian,2015-09-22 12:13:00,2015-09-22 12:13:00,41,114,2217,R,1
svetlanaleshkov,"""Правый сектор"" заявил о перекрытии объездных дорог в Крым http://t.co/hJdXCcOjlj",United States,Russian,2015-09-22 16:13:00,2015-09-22 16:13:00,41,114,2219,R,1
svetlanaleshkov,В Белгороде бешеный ежик укусил пытавшегося его сфотографировать мужчину http://t.co/gFQf4oKqKA,United States,Russian,2015-09-22 18:14:00,2015-09-22 18:14:00,41,114,2220,R,1
svetlanaleshkov,Конституционный суд Франции поддержал частичный запрет на Uber http://t.co/MGfB2FXrFa,United States,Russian,2015-09-22 23:52:00,2015-09-22 23:53:00,41,114,2221,R,1
svetlanaleshkov,Мусоровоз врезался в витрину магазина «Пятерочка» на юго-востоке Москвы http://t.co/FXngW4fZJ9,United States,Russian,2015-09-23 01:32:00,2015-09-23 01:32:00,41,114,2222,R,1
svetlanaleshkov,Глава МИД Украины обвинил Россию в подготовке боевиков ИГ  http://t.co/5TQWCx8UYc,United States,Russian,2015-09-23 01:52:00,2015-09-23 01:52:00,41,114,2223,R,1
svetlanaleshkov,В Иркутской области проверят учреждения для детей-сирот после избиения воспитанника-инвалида http://t.co/Oh5zA8lZiU,United States,Russian,2015-09-23 07:17:00,2015-09-23 07:17:00,41,114,2224,R,1
svetlanaleshkov,"Захарченко: ДНР выйдет из Минска-2, если Киев соберется вступать в НАТО http://t.co/pM7fbYuq9O http://t.co/5NffJvJXVI",United States,Russian,2015-09-23 16:33:00,2015-09-23 16:33:00,41,115,2226,R,1
svetlanaleshkov,Pebble Time Round представил первые «умные» часы с круглым дисплеем http://t.co/dVuEnY9Py2,United States,Russian,2015-09-24 12:14:00,2015-09-24 12:14:00,41,115,2231,R,1
svetlanaleshkov,'@realDonaldTrump http://t.co/5HxBlt1jCr',United States,Russian,2015-09-24 16:23:00,2015-09-24 16:23:00,41,115,2234,R,1
svetlanaleshkov,«Динамо» вышло в 1/8 финала Кубка России благодаря голам Ташаева и Кокорина http://t.co/vlI82feLFY,United States,Russian,2015-09-24 17:53:00,2015-09-24 17:54:00,41,115,2239,R,1
svetlanaleshkov,Обама и Путин всё-таки встретятся. Чего ждать обеим сторонам? Поговорили об этом с экспертами:  https://t.co/CHC0NLUA5q,United States,Russian,2015-09-24 23:13:00,2015-09-24 23:13:00,41,115,2241,R,1
svetlanaleshkov,В Белоруссии задержали обвиняемых в коррупции российских экс-чиновников http://t.co/LOGf9EvlqG,United States,Russian,2015-09-25 03:52:00,2015-09-25 03:52:00,41,115,2242,R,1
svetlanaleshkov,Собянин установил в поселении Роговское карантин по бешенству http://t.co/7jz1QlOPUn,United States,Russian,2015-09-25 06:11:00,2015-09-25 06:12:00,41,115,2243,R,1
svetlanaleshkov,Главный тренер запорожского «Металлурга» ничего не знает о роспуске команды http://t.co/LSUWLT4fzo,United States,Ukrainian,2015-09-25 08:13:00,2015-09-25 08:13:00,41,115,2245,R,1
svetlanaleshkov,"Накормить весь мир. Бывшие владельцы «Абрау-Дюрсо» строят большие планы, вкладывая деньги от металлов в агрофермы  http://t.co/LrDTVeqnFc",United States,Russian,2015-09-25 11:31:00,2015-09-25 11:31:00,41,114,2251,R,1
svetlanaleshkov,«Аэрофлот» и «Трансаэро» не смогут летать на Украину — правительство страны запретило http://t.co/yLfkf7Uzmx,United States,Russian,2015-09-25 12:31:00,2015-09-25 12:31:00,41,114,2252,R,1
svetlanaleshkov,"Меркель видит кризис, но не видит его причин   http://t.co/K02VLQDsJR http://t.co/45LfDDSwJy",United States,Ukrainian,2015-09-25 14:09:00,2015-09-25 14:09:00,41,115,2255,R,1
svetlanaleshkov,Кличко купил для Киева 30-летние трамваи из Праги  http://t.co/2rHlg4x7kB http://t.co/EIfcNMlG69,United States,Ukrainian,2015-09-25 15:16:00,2015-09-25 15:17:00,41,115,2256,R,1
svetlanaleshkov,'@BarackObama @Pontifex http://t.co/DY4vwNwbZh',United States,Russian,2015-09-25 15:53:00,2015-09-25 15:53:00,41,116,2257,R,1
svetlanaleshkov,Более 120 млн руб. взыскано с ООО «ТЭК-НН» в пользу администрации Нижнего Новгорода http://t.co/qqSSQYI87A,United States,Russian,2015-09-25 19:14:00,2015-09-25 19:15:00,41,116,2260,R,1
svetlanaleshkov,Очередь за новым Iphone отстоял робот  http://t.co/nHaEgAuXlU http://t.co/3DldX2Kfho,United States,Russian,2015-09-26 01:33:00,2015-09-26 01:33:00,42,117,2261,R,1
svetlanaleshkov,США и коалиция нанесли 25 авиаударов по целям ИГ http://t.co/TBdGERyTwo,United States,Russian,2015-09-26 17:53:00,2015-09-26 17:53:00,42,117,2264,R,1
svetlanaleshkov,"Франция подключилась к бомбардировке ИГИЛ в Сирии - говорят, из-за беженцев и российских военных https://t.co/PMcUkeJkcm",United States,Russian,2015-09-27 08:33:00,2015-09-27 08:33:00,42,117,2267,R,1
svetlanaleshkov,СМИ: в Иерусалиме возобновились столкновения палестинцев с полицией  http://t.co/gmWbtpOLvp,United States,Russian,2015-09-27 11:32:00,2015-09-27 11:32:00,42,117,2268,R,1
