author_id,content,region,language,publish_date,harvested_date,following,followers,updates,post_type,retweet
Sylvie1Freeman,"Most of the bills we pass in Congress are actually bipartisan, like #S419, which helps support the families of fallen officers. https://t.co/74egwCffKT",United States,English,2017-05-26 10:16:00,2017-05-26 10:16:00,0,0,1,R,1
Sylvie1Freeman,Today's visit with His Holiness Pope Francis @Pontifex is one I'll never forget. I was humbled by the honor. Blessings to all. https://t.co/NiomkFQqJb,United States,English,2017-05-26 10:18:00,2017-05-26 10:18:00,0,0,2,R,1
Sylvie1Freeman,I'm happy! Road tripping 🤘🏼😁🤘🏼 #FridayFeeling  @dogcelebration #dogsoftwitter https://t.co/rU0QktJls9,United States,English,2017-05-26 15:53:00,2017-05-26 15:54:00,24,0,4,R,1
Sylvie1Freeman,Quote of the day: https://t.co/9x23ZW7wBp https://t.co/pcV0hLFN2z,United States,English,2017-05-26 16:17:00,2017-05-26 16:17:00,24,0,6,R,1
Sylvie1Freeman,Russia-NATO relations at worst point since Cold War – Moscow https://t.co/EUOgBVzRvm,United States,English,2017-05-26 16:17:00,2017-05-26 16:17:00,24,0,5,R,1
Sylvie1Freeman,China says it has tightened security at N. Korean border – top US diplomat https://t.co/JSM5Ve6eas https://t.co/mgvN9ur4uU,United States,English,2017-05-26 16:17:00,2017-05-26 16:18:00,24,0,7,R,1
Sylvie1Freeman,3 moves smart people make when they get a new boss: https://t.co/UcFIrWHGGc https://t.co/xUtf0YIpRR,United States,English,2017-05-26 16:18:00,2017-05-26 16:18:00,24,0,8,R,1
