author_id,content,region,language,publish_date,harvested_date,following,followers,updates,post_type,retweet
hickey_seth,Hello Twitter! #myfirstTweet,United States,LANGUAGE UNDEFINED,2017-05-22T13:04:00,2017-05-22T13:05:00,40.0000000000,0E-10,1.0000000000,,False
hickey_seth,Trump arrives in Tel Aviv. Historic visit. 1st Potus to ever visit Israel on his 1st foreign trip. #mondaymorning https://t.co/Ta0F5L5frQ,United States,English,2017-05-22T13:09:00,2017-05-22T13:09:00,40.0000000000,0E-10,3.0000000000,R,True
hickey_seth,"One reason I'm tired of New York’s subways: fare keeps going up, problems remain the same – late trains, EVERY DAY. https://t.co/60KsBSmK5m",United States,English,2017-05-22T13:10:00,2017-05-22T13:10:00,40.0000000000,0E-10,4.0000000000,R,True
hickey_seth,"Billy Bush says he wishes he'd ""changed the topic"" in a @THR exclusive about the Trump @accesshollywood tape. https://t.co/7D2tqePRr2",United States,English,2017-05-22T13:11:00,2017-05-22T13:11:00,42.0000000000,0E-10,5.0000000000,R,True
hickey_seth,Our BEAUTIFUL and STUNNING .@FLOTUS in the women's section of the Western wall. Her grace is breathtaking!  #weternwall https://t.co/wExFpO8uGN,United States,English,2017-05-24T11:38:00,2017-05-24T11:38:00,0E-10,1.0000000000,6.0000000000,R,True
hickey_seth,"New science from Jupiter! Need a quick recap on the swirling clouds, huge magnetic field and more? Check this out: https://t.co/NDd7k3y3Z6 https://t.co/S2gNl1ihrQ",United States,English,2017-05-26T10:14:00,2017-05-26T10:15:00,43.0000000000,3.0000000000,7.0000000000,R,True
hickey_seth,"Brit to Muslim: ""You need to sort this thing out in your communities, and put a stop to it"". #FridayFeeling  FED UP! https://t.co/2OXQn05Tfh",United States,English,2017-05-26T15:32:00,2017-05-26T15:32:00,43.0000000000,4.0000000000,8.0000000000,R,True
hickey_seth,Saying this ONE time..  WE got DJT elected even with the crooked media.  We will BRING DOWN the Left even with the CROOKED MEDIA!  #MAGA🇺🇸 https://t.co/n5f3r5Emfj,United States,English,2017-05-26T15:33:00,2017-05-26T15:33:00,43.0000000000,4.0000000000,9.0000000000,R,True
hickey_seth,BREAKING: At least 40 civilians were killed in the coalition strike on a Syrian village - Reports https://t.co/jiq2Bj94TP #SyriaCrisis https://t.co/8eQxpeV6jG,United States,English,2017-06-28T13:38:00,2017-06-28T13:39:00,43.0000000000,3.0000000000,12.0000000000,R,True
