author_id,content,region,language,publish_date,harvested_date,following,followers,updates,post_type,retweet
olenenock,"Дик Чейни: мы можем столкнуться с атакой, похожей на 11 сентября http://t.co/CaeKhZtM1N",Belarus,Russian,2015-09-02T02:52:00,2015-09-02T02:52:00,44.0000000000,114.0000000000,1826.0000000000,R,True
olenenock,Пучков потребовал прекратить дискуссии вокруг уссурийского зоопарка  http://t.co/Bt63MDoLuy http://t.co/C3GbUEGicz,Belarus,Russian,2015-09-02T07:31:00,2015-09-02T07:31:00,44.0000000000,114.0000000000,1827.0000000000,R,True
olenenock,В Москве задержана группа угонщиков автомобилей Lada: http://t.co/ao4bT3EGVi,Belarus,Russian,2015-09-02T10:53:00,2015-09-02T10:53:00,44.0000000000,114.0000000000,1829.0000000000,R,True
olenenock,Интернет-проект ДГПБ занял первое место на Всероссийском конкурсе http://t.co/IyEZnLFvLI,Belarus,Russian,2015-09-02T13:53:00,2015-09-02T13:53:00,44.0000000000,114.0000000000,1830.0000000000,R,True
olenenock,Генсек ООН обратился к народу Гватемалы  http://t.co/2kWhJSynkO http://t.co/6xuldytdpe,Belarus,Russian,2015-09-03T22:13:00,2015-09-03T22:13:00,44.0000000000,114.0000000000,1835.0000000000,R,True
olenenock,Путин: кризис с мигрантами в Европе вызван ошибочной политикой Запада http://t.co/ECLnyjORIz,Belarus,Russian,2015-09-04T04:32:00,2015-09-04T04:33:00,44.0000000000,114.0000000000,1836.0000000000,R,True
olenenock,"На Первом канале начинается четвертый сезон шоу ""Голос"" http://t.co/luKW31LxIO",Belarus,Russian,2015-09-04T08:52:00,2015-09-04T08:52:00,44.0000000000,114.0000000000,1837.0000000000,R,True
olenenock,Источник: Рязанов попал в реанимацию http://t.co/3B9BkEoamK,Belarus,Russian,2015-09-06T07:13:00,2015-09-06T07:14:00,44.0000000000,114.0000000000,1842.0000000000,R,True
olenenock,Премьер Молдавии принял претензии митингующих http://t.co/kk1EkHel8u,Belarus,Russian,2015-09-06T13:52:00,2015-09-06T13:52:00,44.0000000000,114.0000000000,1846.0000000000,R,True
olenenock,В Таджикистане в ходе спецоперации убиты четверо предполагаемых террористов  http://t.co/Zksn6gCGLl,Belarus,Russian,2015-09-06T16:15:00,2015-09-06T16:15:00,44.0000000000,114.0000000000,1847.0000000000,R,True
olenenock,В интернете собирают деньги на первый «смартфон для домашних питомцев»  #hitech,Belarus,Russian,2015-09-07T07:53:00,2015-09-07T07:53:00,44.0000000000,114.0000000000,1848.0000000000,R,True
olenenock,Фото и видео из Кишинева - многотысячная акция за отставку президента и правительства  https://t.co/MhTCBoe7IC,Belarus,Russian,2015-09-07T08:36:00,2015-09-07T08:36:00,44.0000000000,114.0000000000,1849.0000000000,R,True
olenenock,"Вот в такую ситуацию можно попасть, если заказать первое попавшееся такси  http://t.co/lLiWML7UCi http://t.co/EGzPOn15mO",Belarus,Russian,2015-09-08T14:25:00,2015-09-08T14:26:00,44.0000000000,114.0000000000,1856.0000000000,R,True
olenenock,Названо число неграмотных жителей планеты  http://t.co/7ouWWzX0qS http://t.co/c2EIcRSVsW,Belarus,Russian,2015-09-08T20:31:00,2015-09-08T20:34:00,44.0000000000,114.0000000000,1858.0000000000,R,True
olenenock,ООН предсказала Европе 850 тыс. беженцев с юга до конца 2016 года   http://t.co/m8Lrq6HQXA,Belarus,Russian,2015-09-08T21:32:00,2015-09-08T21:32:00,44.0000000000,114.0000000000,1859.0000000000,R,True
olenenock,"«Apple Pencil создавался как инструмент, который знаком и понятен каждому», — говорит Шиллер   http://t.co/5QfXkvaVxN… #AppleEvent",Belarus,Russian,2015-09-09T18:11:00,2015-09-09T18:12:00,44.0000000000,114.0000000000,1862.0000000000,R,True
olenenock,халявных green card! налетай!  но только если ты - сириец   http://t.co/3UG6wxX8Ad,Belarus,Russian,2015-09-10T15:41:00,2015-09-10T15:41:00,44.0000000000,114.0000000000,1870.0000000000,R,True
olenenock,Кадырова спросили об участии Яценюка в войне в Чечне  http://t.co/m9gbHLLvuX http://t.co/uQgLlTl3bh,Belarus,Russian,2015-09-10T16:32:00,2015-09-10T16:32:00,44.0000000000,114.0000000000,1871.0000000000,R,True
olenenock,Нападающий «Крыльев» Яхович выбыл на неопределённый срок http://t.co/QhnDu0KW2p,Belarus,Russian,2015-09-10T19:11:00,2015-09-10T19:11:00,44.0000000000,114.0000000000,1872.0000000000,R,True
olenenock,"Подумайте просто: вроде бы обычный обзор на винтовку, но провокация на лицо - американский солдат стреляет Коран!  http://t.co/KL4iuxoT9e",Belarus,Russian,2015-09-11T13:56:00,2015-09-11T13:56:00,44.0000000000,114.0000000000,1875.0000000000,R,True
olenenock,"В мире проведена первая пересадка ребер, напечатанных на 3D-принтере http://t.co/Yy3oUPEa8w http://t.co/Ova5q06Mku",Belarus,Russian,2015-09-12T12:53:00,2015-09-12T12:54:00,44.0000000000,115.0000000000,1880.0000000000,R,True
olenenock,#архив_ТАСС: прогулка по утренней Москве © Фотохроника ТАСС/Борис Кавашкин http://t.co/8GAwGc5nno,Belarus,Russian,2015-09-13T06:52:00,2015-09-13T06:53:00,44.0000000000,115.0000000000,1881.0000000000,R,True
olenenock,Порошенко обратился с призывом к парламенту  http://t.co/DkVJqMMAPw http://t.co/tSlXGVmTnc,Belarus,Russian,2015-09-14T20:31:00,2015-09-14T20:31:00,44.0000000000,115.0000000000,1886.0000000000,R,True
olenenock,Состоялась премьера обновленного Renault Duster http://t.co/8MG2DHimvW http://t.co/dkZC3662os,Belarus,Russian,2015-09-16T04:12:00,2015-09-16T04:12:00,44.0000000000,115.0000000000,1891.0000000000,R,True
olenenock,В Германии поезд врезался в застрявший на переезде пассажирский автобус http://t.co/jZlUahkmXt,Belarus,Russian,2015-09-17T04:12:00,2015-09-17T04:12:00,44.0000000000,115.0000000000,1897.0000000000,R,True
olenenock,Мэрия начала отсчет последних дней барахолки http://t.co/dHHFt1jwQh,Belarus,Russian,2015-09-17T10:54:00,2015-09-17T10:54:00,44.0000000000,115.0000000000,1899.0000000000,R,True
olenenock,Мединский приехал на Dovlatovfest вне контекста дела Кашина http://t.co/bUH3ddcSU0,Belarus,Russian,2015-09-18T14:11:00,2015-09-18T14:12:00,44.0000000000,114.0000000000,1907.0000000000,R,True
olenenock,Соломатин: нет ничего фантастического в победе «Локомотива» над «Спортингом» http://t.co/596xiZvdYh,Belarus,Russian,2015-09-18T15:53:00,2015-09-18T15:53:00,44.0000000000,114.0000000000,1908.0000000000,R,True
olenenock,Пьяный украинский судья на Ford насмерть сбил мотоциклиста: http://t.co/scVAtlsTOw,Belarus,Russian,2015-09-19T14:52:00,2015-09-19T14:52:00,44.0000000000,114.0000000000,1912.0000000000,R,True
olenenock,"Ципрас поблагодарил Грецию и объявил о создании коалиции с ""Независимыми греками"" http://t.co/EEph5dK7gb",Belarus,Russian,2015-09-20T21:31:00,2015-09-20T21:31:00,44.0000000000,114.0000000000,1918.0000000000,R,True
olenenock,"СИРИЗА победила на выборах, набрав 35,47% голосов  http://t.co/EMSwAwwQon",Belarus,Russian,2015-09-21T02:52:00,2015-09-21T02:52:00,44.0000000000,114.0000000000,1919.0000000000,R,True
olenenock,Священник и отец 70 детей после пьяной езды отстранен от должности  http://t.co/viyPEsZ8N3 http://t.co/UV6fZks7Et,Belarus,Russian,2015-09-21T13:51:00,2015-09-21T13:51:00,44.0000000000,114.0000000000,1921.0000000000,R,True
olenenock,Генсек НАТО призвал продлить санкции против РФ http://t.co/7BLaUKmTxt http://t.co/ZEONSAVjwk,Belarus,Russian,2015-09-22T15:13:00,2015-09-22T15:13:00,44.0000000000,114.0000000000,1926.0000000000,R,True
olenenock,"Талалаев: лучше проиграть один раз со счётом 0:7, чем семь раз со счётом 0:1 http://t.co/IAGxiOyHsr",Belarus,Russian,2015-09-23T18:13:00,2015-09-23T18:13:00,44.0000000000,114.0000000000,1931.0000000000,R,True
olenenock,США не собираются размещать атомные бомбы в Германии #новости http://t.co/X3mJ1JlpfI,Belarus,Russian,2015-09-23T23:11:00,2015-09-23T23:11:00,44.0000000000,114.0000000000,1931.0000000000,R,True
olenenock,ФОТОРЕПОРТАЖ. Стартовало самое престижное яхт-шоу  http://t.co/CwSL0XR5q7 http://t.co/4hgeOYemyh,Belarus,Russian,2015-09-24T14:53:00,2015-09-24T14:53:00,44.0000000000,114.0000000000,1933.0000000000,R,True
olenenock,Песков сообщил подробности телефонного разговора Путина с Элтоном Джоном  http://t.co/TmK3dojCOY,Belarus,Russian,2015-09-24T18:32:00,2015-09-24T18:32:00,44.0000000000,114.0000000000,1934.0000000000,R,True
olenenock,Добро пожаловать в ГУЛАГ https://t.co/zJyI7sacWW,Belarus,Russian,2015-09-25T04:32:00,2015-09-25T04:33:00,44.0000000000,114.0000000000,1935.0000000000,R,True
olenenock,Боксер Рой Джонс-младший получил паспорт гражданина России http://t.co/u9LKrrkJId,Belarus,Russian,2015-09-25T08:10:00,2015-09-25T08:10:00,44.0000000000,114.0000000000,1936.0000000000,R,True
olenenock,Расследовавший теракт в Домодедово генерал займется делом Гайзера http://t.co/mJN3AP7aLl,Belarus,Russian,2015-09-26T01:35:00,2015-09-26T01:35:00,44.0000000000,114.0000000000,1937.0000000000,R,True
olenenock,В Италии может быть до 1 млн некачественных дизельных двигателей Volkswagen  http://t.co/Jk8tqTE88S,Belarus,Russian,2015-09-26T14:54:00,2015-09-26T14:54:00,44.0000000000,114.0000000000,1938.0000000000,R,True
olenenock,Двух медиков застрелили на подстанции скорой помощи в Симферополе  http://t.co/FArWZUXS53,Belarus,Russian,2015-09-26T16:33:00,2015-09-26T16:33:00,44.0000000000,114.0000000000,1939.0000000000,R,True
olenenock,Газизов: о судьбе Колыванова в «Уфе» после ничьей с «Анжи» говорить рано http://t.co/QZgRhXyqtl,Belarus,Russian,2015-09-26T17:12:00,2015-09-26T17:12:00,44.0000000000,114.0000000000,1941.0000000000,R,True
olenenock,В СБУ сделали заявление по делу о взрыве в Одессе  http://t.co/aO3C7e6pBB http://t.co/MAIbIiORy7,Belarus,Russian,2015-09-27T13:52:00,2015-09-27T13:52:00,44.0000000000,114.0000000000,1945.0000000000,R,True
olenenock,Рэпер Гуф готов появиться в Красноярске только в следующей жизни http://t.co/oBSGPbv6JV,Belarus,Russian,2015-09-28T00:12:00,2015-09-28T00:13:00,44.0000000000,114.0000000000,1949.0000000000,R,True
olenenock,Лукашенко выделил $2 млн на фильм с участием Депардье  http://t.co/03mM5nWPEh,Belarus,Russian,2015-09-28T08:53:00,2015-09-28T08:53:00,44.0000000000,114.0000000000,1951.0000000000,R,True
olenenock,"у дембелей первые дни на гражданке не работает часть мозга, отвечающая за деление девушек на красивых-некрасивых",Belarus,Russian,2015-09-28T09:06:00,2015-09-28T09:06:00,44.0000000000,114.0000000000,1952.0000000000,R,True
olenenock,http://t.co/pK6DZbhbVh,Belarus,Russian,2015-09-28T18:32:00,2015-09-28T18:33:00,44.0000000000,115.0000000000,1960.0000000000,R,True
olenenock,Spiegel назвал «дуэлью»выступления Путина и Обамы на Генассамблее ООН http://t.co/s3mTAs16PD #PutinPeacemaker #UNGA http://t.co/C8Lko7XtXw,Belarus,Russian,2015-09-28T19:51:00,2015-09-28T19:51:00,44.0000000000,116.0000000000,1961.0000000000,R,True
olenenock,"Логашов: албанцы техничные, темпераментные, но с обороной у них были проблемы http://t.co/1sQTWnPRrM",Belarus,Russian,2015-09-29T16:31:00,2015-09-29T16:32:00,44.0000000000,116.0000000000,1968.0000000000,R,True
olenenock,Итоги расследования крушения MH-17 на Украине передадут в Совбез ООН  http://t.co/RozRvo6Jn4,Belarus,Russian,2015-09-30T07:13:00,2015-09-30T07:13:00,43.0000000000,115.0000000000,1972.0000000000,R,True
olenenock,В Таджикистане на дом рухнула 40-килограммовая глыба льда: http://t.co/Yh0sYc9aEy,Belarus,Uzbek,2015-09-30T14:11:00,2015-09-30T14:14:00,42.0000000000,114.0000000000,1978.0000000000,R,True
olenenock,Лавров сделал заявление в Совете Безопасности ООН  http://t.co/krGAA0y36Q http://t.co/rKIjmGuOv3,Belarus,Russian,2015-09-30T15:53:00,2015-09-30T15:53:00,42.0000000000,114.0000000000,1979.0000000000,R,True
olenenock,"На ""Карабашмеди"" произошел взрыв котла охлаждения, 10 рабочих травмированы http://t.co/zRpcaOZF4N",Belarus,Russian,2015-10-01T09:11:00,2015-10-01T09:11:00,42.0000000000,114.0000000000,1983.0000000000,R,True
olenenock,Медведев подписал постановление о льготных маршрутах в Крым http://t.co/hMLXSYsuSQ,Belarus,Russian,2015-10-02T04:10:00,2015-10-02T04:10:00,42.0000000000,114.0000000000,1988.0000000000,R,True
olenenock,Силуанов и Греф поспорили о «сливках» и «шерсти» нефтяных компаний  http://t.co/qLwUH7VSLy,Belarus,Russian,2015-10-02T08:13:00,2015-10-02T08:13:00,42.0000000000,114.0000000000,1989.0000000000,R,True
olenenock,Дмитрий Песков: Пётр Порошенко выдвигал инициативы по налаживанию контактов с Россией  http://t.co/sTWstM7XyW,Belarus,Russian,2015-10-02T20:31:00,2015-10-02T20:32:00,42.0000000000,114.0000000000,1995.0000000000,R,True
olenenock,Стрелок из Орегона был уволен из армии через месяц http://t.co/7X52tY5IPY,Belarus,Russian,2015-10-02T20:32:00,2015-10-02T20:32:00,42.0000000000,114.0000000000,1996.0000000000,R,True
olenenock,В Москве ожидается шквальный ветер http://t.co/Qj6LqVkYC9,Belarus,Russian,2015-10-03T08:51:00,2015-10-03T08:51:00,42.0000000000,114.0000000000,1999.0000000000,R,True
olenenock,МИД Египта: авиаудары России способствуют ограничению терроризма в Сирии http://t.co/d7zcWkwUYh,Belarus,Russian,2015-10-04T00:51:00,2015-10-04T00:51:00,42.0000000000,114.0000000000,2001.0000000000,R,True
olenenock,Черышев включён в заявку «Реала» на матч с «Атлетико» http://t.co/WQjGZa6uvD,Belarus,Russian,2015-10-04T11:12:00,2015-10-04T11:12:00,42.0000000000,114.0000000000,2002.0000000000,R,True
olenenock,За это скакал майдан! http://t.co/B6z6fH5BFD,Belarus,Russian,2015-10-05T07:31:00,2015-10-05T07:31:00,42.0000000000,112.0000000000,2006.0000000000,R,True
olenenock,Число погибших в результате наводнений на востоке США возросло до 12 человек  http://t.co/fJphxqtnJv,Belarus,Russian,2015-10-06T02:11:00,2015-10-06T02:11:00,42.0000000000,112.0000000000,2011.0000000000,R,True
olenenock,МИД перечислил сомнительные публикации в западных СМИ  http://t.co/ibDCvZXyYT,Belarus,Russian,2015-10-06T14:12:00,2015-10-06T14:12:00,42.0000000000,112.0000000000,2013.0000000000,R,True
olenenock,NYT: Турция не пойдет против России http://t.co/sVvU6R1hG3,Belarus,Russian,2015-10-07T06:32:00,2015-10-07T06:32:00,42.0000000000,111.0000000000,2015.0000000000,R,True
olenenock,"Афганистан. Первые версии уничтожения госпиталя ""Врачи без границ"" http://t.co/79FfjXbzPG",Belarus,Russian,2015-10-07T07:38:00,2015-10-07T07:41:00,42.0000000000,111.0000000000,2017.0000000000,R,True
olenenock,СМИ: ЕС готовит к депортации 400 тыс. мигрантов  http://t.co/Ntjei33OEJ,Belarus,Russian,2015-10-07T12:37:00,2015-10-07T12:37:00,42.0000000000,111.0000000000,2018.0000000000,R,True
olenenock,"Порошенко подписал закон, который устанавливает новую дату «оккупации Крыма». Сдвинули на месяц   https://t.co/ixlB2DyGc1",Belarus,Russian,2015-10-07T16:23:00,2015-10-07T16:23:00,42.0000000000,111.0000000000,2020.0000000000,R,True
olenenock,"ИГ использует химическое оружие, сообщили СМИ  http://t.co/oEj6Kpv1nr http://t.co/fnq8tTrTDM",Belarus,Russian,2015-10-07T16:23:00,2015-10-07T16:23:00,42.0000000000,111.0000000000,2019.0000000000,R,True
olenenock,На стадионе «Амкара» идут снегоуборочные работы http://t.co/DK0X2msegV,Belarus,Russian,2015-10-08T15:33:00,2015-10-08T15:33:00,42.0000000000,111.0000000000,2024.0000000000,R,True
olenenock,Times: Coca-Cola спонсирует ожирение http://t.co/bDj8K4xFAe,Belarus,Russian,2015-10-09T11:11:00,2015-10-09T11:11:00,42.0000000000,111.0000000000,2025.0000000000,R,True
olenenock,"Миллер сказал, когда «Газпром» начнет поставки на Украину http://t.co/VCclgrgWhs http://t.co/LpHyG15IbO",Belarus,Russian,2015-10-09T15:53:00,2015-10-09T15:53:00,42.0000000000,111.0000000000,2027.0000000000,R,True
olenenock,А это зря! Русский мат - язык боевого управления! Язык победы!)) http://t.co/xcz6EqPmva https://t.co/JECaGWT14J,Belarus,Russian,2015-10-12T00:13:00,2015-10-12T00:13:00,42.0000000000,111.0000000000,2035.0000000000,R,True
olenenock,В одном из районов Дагестана ввели режим контртеррористической операции  http://t.co/lntp1YfwTL,Belarus,Russian,2015-10-13T04:31:00,2015-10-13T04:31:00,42.0000000000,111.0000000000,1950.0000000000,R,True
olenenock,Росавиация предложила досрочно прекратить полеты «Трансаэро»  https://t.co/Mohjbjn50b,Belarus,Russian,2015-10-13T06:33:00,2015-10-13T06:33:00,42.0000000000,111.0000000000,1951.0000000000,R,True
olenenock,В московском метро появится 450 автоматов с едой и напитками http://t.co/DFGxto1Qcd,Belarus,Russian,2015-10-13T09:10:00,2015-10-13T09:10:00,42.0000000000,111.0000000000,1952.0000000000,R,True
olenenock,Всех поздравляю с выходом на Евро16! Слуцкий вот такой мужик � #СлуцкийНеУходи http://t.co/uMPUQSU9JY,Belarus,Russian,2015-10-13T15:15:00,2015-10-13T15:15:00,42.0000000000,111.0000000000,1954.0000000000,R,True
olenenock,Мы не можем считать результаты расследования крушения «Боинг-777» объективными и обоснованными – Эдуард Басурин http://t.co/jTcv13bgAS,Belarus,Russian,2015-10-14T12:54:00,2015-10-14T12:54:00,42.0000000000,111.0000000000,1958.0000000000,R,True
olenenock,"Медведева не приняли в Вашингтоне, зато Путин наградил его орденом «За заслуги перед Отечеством» I степени:  https://t.co/QQ1EE9ZH6h",Belarus,Ukrainian,2015-10-14T20:02:00,2015-10-14T20:02:00,42.0000000000,111.0000000000,1959.0000000000,R,True
olenenock,"16 октября отменяются 76 рейсов ""Трансаэро"" http://t.co/XwN9jyTKC4",Belarus,Russian,2015-10-15T08:12:00,2015-10-15T08:12:00,42.0000000000,111.0000000000,1961.0000000000,R,True
olenenock,"'@salty_1970 @rubin_paceka Тогда знать должен.Они вдвоём нажрут ""маманегорюй""'",Belarus,Russian,2015-10-17T12:33:00,2015-10-17T12:35:00,42.0000000000,111.0000000000,1973.0000000000,R,True
olenenock,Изображение необычной пористой поверхности планеты Плутон опубликовал сайт НАСА http://t.co/Vs9wc0rkx0 © NASA http://t.co/yTes6B3Hqc,Belarus,Russian,2015-10-17T20:11:00,2015-10-17T20:11:00,42.0000000000,111.0000000000,1976.0000000000,R,True
olenenock,Под колесами Chevrolet с пьяным водителем за рулем погибла молодая девушка.   http://t.co/8CyuyT6rOY http://t.co/qh1wpv5vSb,Belarus,Russian,2015-10-17T22:13:00,2015-10-17T22:13:00,42.0000000000,111.0000000000,1977.0000000000,R,True
olenenock,СРОЧНО. Плотницкий отстранил главу госбезопасности ЛНР  http://t.co/7tBA7rF7Bb http://t.co/0CzSgu2hnn,Belarus,Russian,2015-10-18T11:51:00,2015-10-18T11:51:00,42.0000000000,111.0000000000,1979.0000000000,R,True
olenenock,"Директор турфирмы ""Ирина-Тревел"" получила условный срок за мошенничество http://t.co/qzP5FFfvMz",Belarus,Russian,2015-10-18T13:15:00,2015-10-18T13:15:00,42.0000000000,111.0000000000,1980.0000000000,R,True
olenenock,А у нас либералы все немытые ходят.....  https://t.co/drrzdCaBIJ,Belarus,Russian,2015-10-18T23:32:00,2015-10-18T23:32:00,42.0000000000,111.0000000000,1984.0000000000,R,True
olenenock,"если новобранец за 45 секунд успевает раздеться сам, то дембель за 20 - вместе с девушкой",Belarus,Russian,2015-10-19T09:33:00,2015-10-19T09:33:00,42.0000000000,111.0000000000,1985.0000000000,R,True
olenenock,«Эхо Москвы» возобновило вещание после повреждения кабеля экскаватором  http://t.co/UMsAH79uW4,Belarus,Russian,2015-10-19T13:52:00,2015-10-19T13:53:00,42.0000000000,111.0000000000,1987.0000000000,R,True
olenenock,"Общественная палата выступает за ""православный стандарт"" по аналогии с кошером https://t.co/xLqVqWYEIb",Belarus,Russian,2015-10-20T15:12:00,2015-10-20T15:12:00,42.0000000000,111.0000000000,1994.0000000000,R,True
olenenock,ЦИК РФ обсудит с регионами подготовку к выборам в Госдуму на совещании в Крыму  https://t.co/yTrrQ8JxjA,Belarus,Russian,2015-10-20T22:52:00,2015-10-20T22:52:00,42.0000000000,111.0000000000,1996.0000000000,R,True
olenenock,#будущеенаступило Ждём российские базы на Луне! https://t.co/4cZ0Wt88w6,Belarus,Russian,2015-10-21T09:58:00,2015-10-21T09:58:00,42.0000000000,111.0000000000,2002.0000000000,R,True
olenenock,Пентагон отреагировал на отказ Канады от истребителей F-35  https://t.co/RFB0O7Aksz https://t.co/P5Z2xwNGMe,Belarus,Russian,2015-10-22T05:51:00,2015-10-22T05:52:00,42.0000000000,112.0000000000,2006.0000000000,R,True
olenenock,Владельцы «Ливерпуля» прилетят на матч с «Рубином» https://t.co/XwFEUh56Zu,Belarus,Serbian,2015-10-22T09:13:00,2015-10-22T09:13:00,42.0000000000,112.0000000000,2007.0000000000,R,True
olenenock,"Российские таможенники задержали украинца, который хотел вывезти 10 монет XVIII века https://t.co/NE6TyKgSt9",Belarus,Russian,2015-10-22T12:34:00,2015-10-22T12:34:00,42.0000000000,112.0000000000,2010.0000000000,R,True
olenenock,Пострадавший в результате нападения на школу в Швеции подросток скончался https://t.co/IKcUTl5IOB,Belarus,Russian,2015-10-22T13:31:00,2015-10-22T13:32:00,42.0000000000,112.0000000000,2012.0000000000,R,True
olenenock,ЦБ ввел временную администрацию в банк «Советский» https://t.co/t19hSUAZUc https://t.co/LQ83MOUyIQ,Belarus,Russian,2015-10-23T09:02:00,2015-10-23T09:02:00,42.0000000000,112.0000000000,2016.0000000000,R,True
olenenock,"Трабукки: Думбия хочет остаться в ЦСКА, но его будущее зависит от «Ромы» https://t.co/H1eDngNfmv",Belarus,Russian,2015-10-23T19:13:00,2015-10-23T19:14:00,42.0000000000,110.0000000000,2020.0000000000,R,True
olenenock,"«Яндекс» откроет собственное информагентство, в котором новости будут писать роботы    https://t.co/kHMHU9SNjG https://t.co/vShTFblqiO",Belarus,Russian,2015-10-26T05:53:00,2015-10-26T05:53:00,42.0000000000,110.0000000000,2026.0000000000,R,True
