author_id,content,region,language,publish_date,harvested_date,following,followers,updates,post_type,retweet
olenenock,"в театре, если на стене висит ружье, оно должно выстрелить. в армии, если на стене висит что-то, не трожь нахрен!",Belarus,Russian,2015-11-20T15:55:00,2015-11-20T15:55:00,42.0000000000,116.0000000000,2204.0000000000,R,True
olenenock,Корабль будет выглядеть так    https://t.co/bXgHqJqtlc https://t.co/2C2dp8A6dW,Belarus,Russian,2015-11-21T09:56:00,2015-11-21T09:56:00,42.0000000000,116.0000000000,2209.0000000000,R,True
olenenock,СБ ООН единогласно принял резолюцию о борьбе с ИГ в Ираке и Сирии https://t.co/ic1WGoRoke,Belarus,Russian,2015-11-21T10:14:00,2015-11-21T10:14:00,42.0000000000,116.0000000000,2210.0000000000,R,True
olenenock,МИД России высказал мнение о резолюции Лондона по авиаоперации в Сирии https://t.co/3WvdYzZidX https://t.co/MU7klSedAF,Belarus,Russian,2015-11-21T10:33:00,2015-11-21T10:33:00,42.0000000000,116.0000000000,2211.0000000000,R,True
olenenock,"МИД РФ: Россия заинтересована, чтобы тема Украины не ушла на второй план https://t.co/5ZhjpYUEEZ https://t.co/XKNqSkQn2y",Belarus,Russian,2015-11-21T10:34:00,2015-11-21T10:34:00,42.0000000000,116.0000000000,2212.0000000000,R,True
olenenock,RTL: в Брюсселе нашли взрывчатые вещества  https://t.co/ic5iDm2pvY,Belarus,Russian,2015-11-21T13:20:00,2015-11-21T13:22:00,42.0000000000,116.0000000000,2215.0000000000,R,True
olenenock,сбежал в армию от коллекторов. отслужил в ВДВ. теперь коллекторы бегают от меня,Belarus,Russian,2015-11-21T13:53:00,2015-11-21T13:53:00,42.0000000000,116.0000000000,2216.0000000000,R,True
olenenock,Активисты блокады Крыма перекрыли доступ к поврежденным в Херсоне ЛЭП https://t.co/C8BwRyLUEl https://t.co/P4WCtefwPO,Belarus,Russian,2015-11-21T17:15:00,2015-11-21T17:16:00,42.0000000000,116.0000000000,2219.0000000000,R,True
olenenock,Теракт в Мали принес на Волгу траур  https://t.co/7hP1iApZxh https://t.co/ccOu3NxsQW,Belarus,Russian,2015-11-21T17:52:00,2015-11-21T17:53:00,42.0000000000,116.0000000000,2220.0000000000,R,True
olenenock,"Убийство россиян устроил ""восставший из мертвых"".   https://t.co/bwLZsFZnVs https://t.co/PVYGn6lQyA",Belarus,Russian,2015-11-21T18:51:00,2015-11-21T18:51:00,42.0000000000,116.0000000000,2222.0000000000,R,True
olenenock,"Кадыров сообщил, что вернувшиеся из ИГ чеченцы помогают спецслужбам https://t.co/iXOoxX3NuX",Belarus,Russian,2015-11-21T20:17:00,2015-11-21T20:17:00,42.0000000000,116.0000000000,2223.0000000000,R,True
olenenock,American Interest: бездействие приведет Европу к худшему из сценариев https://t.co/YApDyKVZrD © AP Photo https://t.co/jzdEnYLOeA,Belarus,Russian,2015-11-22T12:15:00,2015-11-22T12:15:00,42.0000000000,116.0000000000,2228.0000000000,R,True
olenenock,"Крым обесточен: резервов хватит на месяц, но свет будет раньше https://t.co/pDBVPDkytC https://t.co/y5TdQPV3iH",Belarus,Russian,2015-11-22T12:16:00,2015-11-22T12:16:00,42.0000000000,116.0000000000,2229.0000000000,R,True
olenenock,Опоры зрадной перемоги https://t.co/bf7NQCQNph https://t.co/u9BZyYvQmX,Belarus,Russian,2015-11-22T13:52:00,2015-11-22T13:53:00,42.0000000000,116.0000000000,2232.0000000000,R,True
olenenock,"Павлюченко остался в запасе на матч с «Тереком», Аршавин — вне заявки https://t.co/0oG3w98mzS",Belarus,Russian,2015-11-22T14:36:00,2015-11-22T14:36:00,42.0000000000,116.0000000000,2234.0000000000,R,True
olenenock,Видео. «Верона» — «Наполи» https://t.co/f2ywK3ULWz,Belarus,Russian,2015-11-22T15:16:00,2015-11-22T15:17:00,42.0000000000,116.0000000000,2236.0000000000,R,True
olenenock,Видео. «Фиорентина» — «Эмполи» https://t.co/mnni47QU5V,Belarus,Russian,2015-11-22T17:55:00,2015-11-22T17:55:00,42.0000000000,116.0000000000,2237.0000000000,R,True
olenenock,Глушаков забил первый гол в 2015 году https://t.co/pbA0DErKVN,Belarus,Russian,2015-11-22T18:14:00,2015-11-22T18:14:00,42.0000000000,116.0000000000,2238.0000000000,R,True
olenenock,Опубликовано фото третьего террориста – участника терактов в Париже https://t.co/OnfEgcSUBs https://t.co/aJ1KyHipvv,Belarus,Russian,2015-11-22T19:22:00,2015-11-22T19:22:00,42.0000000000,116.0000000000,2239.0000000000,R,True
olenenock,Главного подозреваемого нет среди задержанных в Брюсселе https://t.co/ioe2uSI4gV,Belarus,Russian,2015-11-23T00:31:00,2015-11-23T00:32:00,42.0000000000,116.0000000000,2240.0000000000,R,True
olenenock,СМИ: в ходе спецоперации в Брюсселе задержаны шесть человек https://t.co/ldNNhsc6tK,Belarus,Russian,2015-11-23T00:32:00,2015-11-23T00:33:00,42.0000000000,116.0000000000,2241.0000000000,R,True
olenenock,Российские компании переносят новогодние корпоративы из-за экономии средств  https://t.co/LBrBah0JZm,Belarus,Russian,2015-11-23T04:34:00,2015-11-23T04:34:00,42.0000000000,116.0000000000,2242.0000000000,R,True
olenenock,Fortune: Apple приобретет Tesla https://t.co/1vE9JxfgSr,Belarus,Russian,2015-11-23T12:13:00,2015-11-23T12:13:00,42.0000000000,116.0000000000,2245.0000000000,R,True
olenenock,"Welt: Крым обесточили, чтобы привлечь внимание Запада к Украине https://t.co/vNCG90wnPG https://t.co/2kQTBp5rz4",Belarus,Russian,2015-11-23T13:31:00,2015-11-23T13:33:00,42.0000000000,116.0000000000,2246.0000000000,R,True
olenenock,СМИ: Истребители с авианосца «Шарль де Голль» нанесли первые удары по ИГ  https://t.co/qNZNLNsG6W,Belarus,Russian,2015-11-23T13:54:00,2015-11-23T13:58:00,42.0000000000,116.0000000000,2248.0000000000,R,True
olenenock,Игрок ЦСКА Понтус Вернблум покрыл матом команду после поражения от «Крыльев»  Видео:  https://t.co/ZTpS0XKYTH https://t.co/JwBGTq3j60,Belarus,Russian,2015-11-24T13:14:00,2015-11-24T13:14:00,42.0000000000,117.0000000000,2255.0000000000,R,True
olenenock,Совпадение? Не думаю! #НеЕдувТурцию https://t.co/Am6DxyLVk6,Belarus,Russian,2015-11-24T14:32:00,2015-11-24T14:33:00,42.0000000000,117.0000000000,2259.0000000000,R,True
olenenock,Заявление Путина о сбитом Су-24  https://t.co/ja00c6AVEz https://t.co/qQIMfBkOzQ,Belarus,Russian,2015-11-24T15:55:00,2015-11-24T15:55:00,42.0000000000,117.0000000000,2261.0000000000,R,True
olenenock,Ростуризм рекомендовал прекратить продажу туров в Турцию  https://t.co/xKRn6BZXJp https://t.co/ADMAnlHMc6,Belarus,Russian,2015-11-24T15:58:00,2015-11-24T16:04:00,42.0000000000,117.0000000000,2262.0000000000,R,True
olenenock,Вице-канцлер ФРГ считает действия Турции непредсказуемыми https://t.co/2US3oX4dbx,Belarus,Russian,2015-11-24T19:35:00,2015-11-24T19:35:00,42.0000000000,117.0000000000,2265.0000000000,R,True
olenenock,Лучший студенческий голос России выбран в Сыктывкаре https://t.co/FoSCmwlKp0,Belarus,Russian,2015-11-24T20:34:00,2015-11-24T20:34:00,42.0000000000,117.0000000000,2266.0000000000,R,True
olenenock,"#архив_ТАСС Мальчишки Староконюшенного переулка, Москва, 1979 год Фото: © И.Зотин/Фотохроника ТАСС https://t.co/l3anYQlyU5",Belarus,Ukrainian,2015-11-25T06:59:00,2015-11-25T06:59:00,42.0000000000,118.0000000000,2268.0000000000,R,True
olenenock,У нас в Новосибирске вообще ничего не растет. Ходят медведи с балалайками и пьют водку с аборигенами прямо в степи. https://t.co/6C8e5NGxMU,Belarus,Russian,2015-11-25T10:24:00,2015-11-25T10:24:00,42.0000000000,118.0000000000,2269.0000000000,R,True
olenenock,Пескова спросили о контактах между Путиным и Эрдоганом после атаки на Су-24  https://t.co/LaE9lCLWlD https://t.co/5bN8uJegF2,Belarus,Russian,2015-11-25T11:13:00,2015-11-25T11:13:00,42.0000000000,118.0000000000,2270.0000000000,R,True
olenenock,Корреспондент RT @Kosarev_RT сообщил подробности о спасении штурмана Су-24  https://t.co/ICuQCHlVua https://t.co/LsOIHJ2ZEt,Belarus,Russian,2015-11-25T11:20:00,2015-11-25T11:24:00,42.0000000000,118.0000000000,2271.0000000000,R,True
olenenock,"Часть зеленой ветки метро Москвы закроют из-за запуска ""Технопарка"" https://t.co/bSP2bswd3U",Belarus,Russian,2015-11-25T11:56:00,2015-11-25T11:56:00,42.0000000000,118.0000000000,2272.0000000000,R,True
olenenock,Манифестанты в Чикаго перекрыли одну из центральных улиц https://t.co/ag9V1s4hH5 https://t.co/XIygz4saAC,Belarus,Russian,2015-11-26T01:42:00,2015-11-26T01:42:00,42.0000000000,119.0000000000,2277.0000000000,R,True
olenenock,"Власти Крыма начали борьбу со спекулянтами, первыми под удар попали продавцы бензина https://t.co/Z5GC1wrSJb",Belarus,Russian,2015-11-26T08:15:00,2015-11-26T08:15:00,42.0000000000,119.0000000000,2281.0000000000,R,True
olenenock,Новые подробности крушения Ми-8 в Красноярском крае  https://t.co/CEluKhgIPT https://t.co/edzayPOWch,Belarus,Russian,2015-11-26T09:12:00,2015-11-26T09:12:00,42.0000000000,118.0000000000,2285.0000000000,R,True
olenenock,Украина и Турция договорились об усилении безопасности на Черном море https://t.co/4mHEwGjQsH https://t.co/qV18Hosc4x,Belarus,Russian,2015-11-26T10:32:00,2015-11-26T10:32:00,42.0000000000,118.0000000000,2287.0000000000,R,True
olenenock,"Реджеп Эрдоган: Турция будет и дальше поступать так же, как с Су-24  https://t.co/T7cfObbOXR https://t.co/nhMfaHUmN0",Belarus,Russian,2015-11-26T12:33:00,2015-11-26T12:35:00,42.0000000000,118.0000000000,2289.0000000000,R,True
olenenock,МИД России расценивает подрыв ЛЭП на Украине как террористический акт  https://t.co/XXym8wlLbj,Belarus,Russian,2015-11-26T15:15:00,2015-11-26T15:15:00,42.0000000000,118.0000000000,2292.0000000000,R,True
olenenock,Дмитрий Медведев cделал выводы из запрета на полеты Boeing 737 в России: https://t.co/1cFEkaSgYz,Belarus,Russian,2015-11-26T15:55:00,2015-11-26T15:57:00,42.0000000000,118.0000000000,2293.0000000000,R,True
olenenock,Минобороны опровергло уничтожение гумконвоя в Сирии https://t.co/6xoAJG5rmF,Belarus,Russian,2015-11-26T21:14:00,2015-11-26T21:15:00,42.0000000000,117.0000000000,2298.0000000000,R,True
olenenock,Олланд о роли Асада в будущем Сирии   https://t.co/0ZxHBx0ys2 https://t.co/8cU51nz0vG,Belarus,Russian,2015-11-26T21:14:00,2015-11-26T21:14:00,42.0000000000,117.0000000000,2297.0000000000,R,True
olenenock,Центральный Республиканский Банк ДНР распорядился установить курсы валют на 27 ноября 2015г. https://t.co/QEUuiCZseb,Belarus,Russian,2015-11-26T22:52:00,2015-11-26T22:52:00,42.0000000000,117.0000000000,2299.0000000000,R,True
olenenock,Известный русский военный эксперт между прочим! (Ракеты с одноразовыми двигателями... © ) https://t.co/KkJ7nI1gGW,Belarus,Russian,2015-11-27T02:31:00,2015-11-27T02:31:00,42.0000000000,117.0000000000,2300.0000000000,R,True
olenenock,СМИ сообщили о приобретении парижскими террористами оружия через интернет: https://t.co/3LDMv8NhN7,Belarus,Russian,2015-11-27T03:22:00,2015-11-27T03:22:00,42.0000000000,117.0000000000,2301.0000000000,R,True
olenenock,Корабли Китая и НАТО провели антипиратские учения в Аденском заливе https://t.co/4dmIe4PdYN © Flickr https://t.co/s5xnQCbqAR,Belarus,Russian,2015-11-27T06:39:00,2015-11-27T06:39:00,42.0000000000,117.0000000000,2302.0000000000,R,True
olenenock,"ВИДЕО. Слова Эрдогана о том, что РФ сама виновата, встретили овацией  https://t.co/3wbtIRNsjT https://t.co/QbuptPfaM3",Belarus,Russian,2015-11-27T07:39:00,2015-11-27T07:40:00,42.0000000000,117.0000000000,2303.0000000000,R,True
olenenock,МЧС развернуло городки жизнеобеспечения с полевыми кухнями в четырех городах Крыма https://t.co/NXxYvpvX3N,Belarus,Russian,2015-11-27T08:37:00,2015-11-27T08:37:00,42.0000000000,117.0000000000,2305.0000000000,R,True
olenenock,CNN: поставка РФ С-400 полностью закроет небо Сирии для Турции и НАТО   https://t.co/7skZrEr2xm https://t.co/P1NVj8pKtK,Belarus,Russian,2015-11-27T09:24:00,2015-11-27T09:24:00,42.0000000000,117.0000000000,2306.0000000000,R,True
olenenock,"На севере Алеппо ИГ применили начинённый взрывчаткой грузовик против бригады боевиков ССА, поддерживаемой США #Сирия https://t.co/VicaokkhrB",Belarus,Russian,2015-11-27T09:39:00,2015-11-27T09:39:00,42.0000000000,117.0000000000,2307.0000000000,R,True
olenenock,Песков: партнеры РФ не готовы к работе в коалиции против терроризма https://t.co/z0JU1koZIn https://t.co/qiNDlym08v,Belarus,Russian,2015-11-27T10:42:00,2015-11-27T10:42:00,42.0000000000,117.0000000000,2309.0000000000,R,True
olenenock,Украина передала России «заблудившихся» военнослужащих https://t.co/As5sRkT9k6,Belarus,Russian,2015-11-27T12:35:00,2015-11-27T12:36:00,42.0000000000,117.0000000000,2310.0000000000,R,True
olenenock,Пересадка лица повлияла на нормативные акты Минздрава РФ https://t.co/6xjWJAbVFS https://t.co/MVg7AYgu1t,Belarus,Russian,2015-11-27T12:54:00,2015-11-27T12:54:00,42.0000000000,117.0000000000,2311.0000000000,R,True
olenenock,"Предприниматель в Риме забрался на Колизей, угрожая покончить с собой https://t.co/0TDJ0PFpgB https://t.co/OZBX1RtFQU",Belarus,Russian,2015-11-27T13:32:00,2015-11-27T13:32:00,42.0000000000,117.0000000000,2312.0000000000,R,True
olenenock,#УдарВСпину https://t.co/1DwJBYlA1I,Belarus,Russian,2015-11-27T14:56:00,2015-11-27T14:58:00,42.0000000000,117.0000000000,2315.0000000000,R,True
olenenock,Роспотребнадзор выявил в Москве 145 нарушений при продаже алкоголя https://t.co/ZzTo5viGoA https://t.co/N7rEsFsO1Q,Belarus,Russian,2015-11-27T18:12:00,2015-11-27T18:12:00,42.0000000000,118.0000000000,2318.0000000000,R,True
olenenock,Именем погибшего в Сирии морпеха назовут школу в Новочеркасске https://t.co/JfkbD4VvsT https://t.co/M6vL58OAVd,Belarus,Serbian,2015-11-27T19:39:00,2015-11-27T19:39:00,42.0000000000,118.0000000000,2319.0000000000,R,True
olenenock,Разлив нефтепродуктов зафиксирован в районе танкера у берегов Сахалина  https://t.co/URx691TtwP https://t.co/w3dyi06RgK,Belarus,Russian,2015-11-28T04:53:00,2015-11-28T04:53:00,42.0000000000,118.0000000000,2322.0000000000,R,True
olenenock,Вратарь молодёжной сборной Беларуси впечатлил тренеров «Крыльев Советов» https://t.co/LglVC7fmKX,Belarus,Russian,2015-11-28T12:13:00,2015-11-28T12:13:00,42.0000000000,118.0000000000,2324.0000000000,R,True
olenenock,«Уфа» — «Кубань»: гол Пауревича в ворота «Кубани» https://t.co/XQunSXcob2,Belarus,Ukrainian,2015-11-28T12:44:00,2015-11-28T12:44:00,42.0000000000,118.0000000000,2325.0000000000,R,True
olenenock,Кононов назвал «Боруссию» Д самым сложным соперником последних лет https://t.co/fBbNeWwxPq,Belarus,Russian,2015-11-28T13:53:00,2015-11-28T13:54:00,42.0000000000,118.0000000000,2327.0000000000,R,True
olenenock,ОНЛАЙН. #ТерекЗенит   https://t.co/4fl7QHKfIL https://t.co/Ki9uKqR61I,Belarus,Russian,2015-11-28T15:13:00,2015-11-28T15:13:00,42.0000000000,118.0000000000,2328.0000000000,R,True
olenenock,"Мутко: если матч в Генте не посетят россияне, то там не должно быть и бельгийцев https://t.co/SdYcmBTHHh",Belarus,Russian,2015-11-28T15:32:00,2015-11-28T15:32:00,42.0000000000,118.0000000000,2329.0000000000,R,True
olenenock,Туроператоров обязали прекратить продажу туров в Турцию россиянам https://t.co/nKcEoWVBke,Belarus,Russian,2015-11-28T19:34:00,2015-11-28T19:34:00,42.0000000000,118.0000000000,2331.0000000000,R,True
olenenock,кратко о позиции российского сегмента твиттера в отношении @RT_Erdogan https://t.co/QqJWWZhPpa,Belarus,Russian,2015-11-28T19:42:00,2015-11-28T19:45:00,42.0000000000,118.0000000000,2332.0000000000,R,True
olenenock,"Дмитрий Киселев: Говорим ДАИШ, подразумеваем ИГИЛ. Ведущий  предложил отказаться от общепринятой формулировки  https://t.co/vBdLufImY0",Belarus,Russian,2015-11-29T15:14:00,2015-11-29T15:14:00,42.0000000000,118.0000000000,2338.0000000000,R,True
olenenock,! https://t.co/8JBaWSFD6O,Belarus,Russian,2015-11-29T15:14:00,2015-11-29T15:14:00,42.0000000000,118.0000000000,2337.0000000000,R,True
olenenock,Котельные Севастополя переводятся на круглосуточный режим работы https://t.co/5MEWcvSrp2,Belarus,Russian,2015-11-29T15:37:00,2015-11-29T15:37:00,42.0000000000,118.0000000000,2339.0000000000,R,True
olenenock,"Эльдар Рязанов: Ирония судьбы, или Берегись худсовета!  https://t.co/eClBFGPvRx https://t.co/RCiEnbuNzd",Belarus,Russian,2015-11-30T00:51:00,2015-11-30T00:52:00,42.0000000000,118.0000000000,2343.0000000000,R,True
olenenock,"Захарова: Рязанов умер, но каждое 31 декабря мы снова будем вместе https://t.co/qH5UOWXwKX",Belarus,Russian,2015-11-30T08:34:00,2015-11-30T08:35:00,42.0000000000,118.0000000000,2346.0000000000,R,True
olenenock,Гарай: я с радостью останусь в «Зените» до конца карьеры https://t.co/u4uhZi2LAL,Belarus,Macedonian,2015-11-30T11:40:00,2015-11-30T11:40:00,42.0000000000,118.0000000000,2348.0000000000,R,True
olenenock,Скоростные поезда между Брюсселем и Парижем остановились из-за поджога кабеля https://t.co/OlCGncEiJn,Belarus,Russian,2015-11-30T11:55:00,2015-11-30T11:55:00,42.0000000000,118.0000000000,2349.0000000000,R,True
olenenock,"«Это не наша вина, не наш выбор»  https://t.co/hE82qqkyI3 https://t.co/jtT10ip45q",Belarus,Ukrainian,2015-11-30T20:55:00,2015-11-30T20:55:00,42.0000000000,118.0000000000,2352.0000000000,R,True
olenenock,Число жертв аварии Ми-8 в Красноярском крае выросло до 12 человек https://t.co/QswGP3eUyr,Belarus,Russian,2015-12-01T05:35:00,2015-12-01T05:35:00,42.0000000000,118.0000000000,2355.0000000000,R,True
olenenock,"Режим чрезвычайного положения во Франции может быть продлен, сообщил французский премьер-министр: https://t.co/51A2YZ0H1O",Belarus,Russian,2015-12-01T09:13:00,2015-12-01T09:13:00,42.0000000000,118.0000000000,2356.0000000000,R,True
olenenock,Немцы увидели в «скромном Шойгу» преемника Путина   https://t.co/2QiwKNH4ZX,Belarus,Serbian,2015-12-01T15:17:00,2015-12-01T15:17:00,42.0000000000,118.0000000000,2359.0000000000,R,True
olenenock,Рондон подписал призыв сменить руководство федерации футбола Венесуэлы https://t.co/jxQSxFltyp,Belarus,Russian,2015-12-01T15:39:00,2015-12-01T15:40:00,42.0000000000,118.0000000000,2360.0000000000,R,True
olenenock,"На Межгалактическом чемпионате по долбаебизму ни Саша Сотник,ни Слава Рабинович не смогли победить,разделив 1 и 2 места. Потому что долбаёбы",Belarus,Russian,2015-12-01T17:33:00,2015-12-01T17:34:00,42.0000000000,118.0000000000,2361.0000000000,R,True
olenenock,В Ялте появится новая маршрутка под номером «113»  Для удобства местных жителей и персонала  https://t.co/wl8KtTitSN https://t.co/BVBxW4TPA9,Belarus,Russian,2015-12-01T19:52:00,2015-12-01T19:52:00,42.0000000000,118.0000000000,2364.0000000000,R,True
olenenock,НАТО возобновляет консультации с Россией https://t.co/9CKoaN0W9j https://t.co/tXQumowW5j,Belarus,Russian,2015-12-02T11:14:00,2015-12-02T11:15:00,42.0000000000,119.0000000000,2370.0000000000,R,True
olenenock,"""США вводят новые санкции против России"" Андрей Манзолевский   https://t.co/C8M80tVvLk",Belarus,Russian,2015-12-02T17:05:00,2015-12-02T17:05:00,42.0000000000,119.0000000000,2372.0000000000,,False
olenenock,Чебоксары расторгли соглашение о побратимстве с Антальей https://t.co/cLX0SeIsK5,Belarus,Russian,2015-12-03T16:38:00,2015-12-03T16:39:00,42.0000000000,119.0000000000,2380.0000000000,R,True
olenenock,Мощность энергомоста Кубань – Крым достигла 200 МВт  https://t.co/KNgV2NLwnd https://t.co/wUYNt3RC4N,Belarus,Russian,2015-12-03T21:10:00,2015-12-03T21:10:00,42.0000000000,118.0000000000,2382.0000000000,R,True
olenenock,"В четверг в Крыму снег  Фото: Сергей Анашкевич В Крыму сегодня переменная облачность, снег.  https://t.co/gHrT673Xgl https://t.co/iW2cNqZ74B",Belarus,Russian,2015-12-03T22:51:00,2015-12-03T22:51:00,42.0000000000,118.0000000000,2383.0000000000,R,True
olenenock,Мы разменяли пятый десяток мультфильмов! Лучший подарок для нашего Мишки - это мир во всем мире!  #ИГ #ИГИЛ #ДАИШ   https://t.co/AZ6i4PfiGy,Belarus,Russian,2015-12-04T10:12:00,2015-12-04T10:12:00,42.0000000000,118.0000000000,2384.0000000000,R,True
olenenock,Дальнобойщики остановили МКАД  https://t.co/6tVKwLiQNc https://t.co/7C3gz11tRw,Belarus,Russian,2015-12-04T14:58:00,2015-12-04T14:58:00,42.0000000000,118.0000000000,2389.0000000000,R,True
olenenock,Астахов предложил дополнить школьную программу ОБЖ практическими занятиями https://t.co/VFN0XD26Bu,Belarus,Russian,2015-12-06T12:31:00,2015-12-06T12:31:00,42.0000000000,118.0000000000,2399.0000000000,R,True
olenenock,"WikiLeaks: Турция, возможно, готовила атаку на самолеты РФ с октября https://t.co/D7BMFbXpYr… https://t.co/3gP91SqXbg",Belarus,Russian,2015-12-06T13:40:00,2015-12-06T13:41:00,42.0000000000,118.0000000000,2400.0000000000,R,True
olenenock,Аналитик: помимо нефти у ИГ (ДАИШ) есть и другие источники дохода https://t.co/cUdEiUlMTE https://t.co/FUio2iXp2D,Belarus,Russian,2015-12-07T18:12:00,2015-12-07T18:12:00,42.0000000000,118.0000000000,2402.0000000000,R,True
olenenock,В Москве на остановке произошел взрыв https://t.co/CkIzImTsTl,Belarus,Russian,2015-12-07T20:51:00,2015-12-07T20:51:00,42.0000000000,118.0000000000,2403.0000000000,R,True
olenenock,"Что взорвалось на московской остановке, выяснили в МВД  https://t.co/sxUhTpH206 https://t.co/oaQDOTP8Zu",Belarus,Russian,2015-12-08T10:35:00,2015-12-08T10:35:00,42.0000000000,118.0000000000,2404.0000000000,R,True
olenenock,"НТВ и ""Авторадио"" проведут акцию в память о погибших в авиакатастрофе А321 https://t.co/seJgnsyiht",Belarus,Russian,2015-12-08T12:52:00,2015-12-08T12:52:00,42.0000000000,118.0000000000,2406.0000000000,R,True
