author_id,content,region,language,publish_date,harvested_date,following,followers,updates,post_type,retweet
olenenock,Ракета Falcon 9 взорвалась сразу же после взлета http://t.co/73G6bj6nRo,Belarus,Russian,2015-06-29T16:30:00,2015-06-29T16:30:00,545.0000000000,111.0000000000,1541.0000000000,,False
olenenock,Запущенная SpaceX ракета Falcon 9 взорвалась после старта #ЭтоПростоКосмос,Belarus,Russian,2015-06-29T18:11:00,2015-06-29T18:11:00,545.0000000000,112.0000000000,1543.0000000000,,False
olenenock,Роскосмоспредложил NASA помочь с доставкой грузов на МКС http://t.co/73G6bj6nRo,Belarus,Russian,2015-06-29T18:24:00,2015-06-29T18:24:00,545.0000000000,112.0000000000,1546.0000000000,,False
olenenock,Источник указал на последствия потери Falcon 9 для американского сегмента МКС #ЭтоПростоКосмос,Belarus,Russian,2015-06-29T19:00:00,2015-06-29T19:00:00,545.0000000000,112.0000000000,1547.0000000000,,False
olenenock,Рогозин призвал США пересмотреть санкции в сфере космоса после аварии космического грузовика #ЭтоПростоКосмос,Belarus,Russian,2015-06-29T19:09:00,2015-06-29T19:09:00,545.0000000000,112.0000000000,1548.0000000000,,False
olenenock,Дорога «Ростов-Азов» будет открыта в августе этого года http://t.co/XC1RjQ7t7h,Belarus,Russian,2015-07-01T11:31:00,2015-07-01T11:31:00,545.0000000000,111.0000000000,1549.0000000000,R,True
olenenock,У московского метро появились первые антипарковочные заграждения http://t.co/wZkYYeNbj3,Belarus,Russian,2015-07-16T17:12:00,2015-07-16T17:12:00,544.0000000000,114.0000000000,1563.0000000000,R,True
olenenock,4:0. Юношеская сборная России впервые вышла в финал ЧЕ по футболу http://t.co/ME5FrDcrQs http://t.co/wyUHFgflBr,Belarus,Russian,2015-07-16T20:31:00,2015-07-16T20:31:00,544.0000000000,114.0000000000,1564.0000000000,R,True
olenenock,Сборная России впервые вышла в финал юношеского ЧЕ-2015 http://t.co/gVFYqlKEJk http://t.co/nrMCIZvFQt,Belarus,Russian,2015-07-16T20:33:00,2015-07-16T20:34:00,544.0000000000,114.0000000000,1565.0000000000,R,True
olenenock,"Это был козырь Киева, который он вытащил в нужный момент http://t.co/NzLqHaQndx",Belarus,Russian,2015-07-16T23:12:00,2015-07-16T23:12:00,544.0000000000,114.0000000000,1566.0000000000,R,True
olenenock,Галямин: «Рубин» может обыграть ЦСКА за счёт отсутствия комплексов http://t.co/PG8TzXgmox,Belarus,Russian,2015-07-18T14:02:00,2015-07-18T14:02:00,544.0000000000,113.0000000000,1573.0000000000,R,True
olenenock,СПЧ отреагировал на удаление страницы Киселева в Facebook   http://t.co/MonD6A0SDT http://t.co/zmY9ssMB8b,Belarus,Russian,2015-07-19T12:51:00,2015-07-19T12:51:00,544.0000000000,113.0000000000,1577.0000000000,R,True
olenenock,Скончалась первая советская олимпийская чемпионка по плаванию Галина Прозуменщикова http://t.co/r87BaAnZMs,Belarus,Russian,2015-07-19T12:51:00,2015-07-19T12:51:00,544.0000000000,113.0000000000,1578.0000000000,R,True
olenenock,"Порошенко заявил, что наложит вето на угрожающие Украине решения Рады http://t.co/x4ney79TD6",Belarus,Russian,2015-07-19T17:31:00,2015-07-19T17:31:00,544.0000000000,113.0000000000,1579.0000000000,R,True
olenenock,"И этот про ""дебальцевский плацдарм"". Хоть бы в Вики глянули что такое плацдарм ))) https://t.co/2tlxpez6Mf  https://t.co/9N2jIci9i7",Belarus,Ukrainian,2015-07-19T18:32:00,2015-07-19T18:32:00,544.0000000000,113.0000000000,1580.0000000000,R,True
olenenock,Донецкий губернатор назвал Саакашвили горячим грузинским парнем http://t.co/NCd7YR7d6L,Belarus,Russian,2015-07-19T19:11:00,2015-07-19T19:11:00,544.0000000000,113.0000000000,1581.0000000000,R,True
olenenock,Песков: в России невозможно назначение иностранцев на высокие государственные посты http://t.co/i5JJaqGVjv,Belarus,Russian,2015-07-20T11:51:00,2015-07-20T11:52:00,543.0000000000,112.0000000000,1582.0000000000,R,True
olenenock,А помнишь как всё начиналось? Всё было впервые и вновь... http://t.co/6sOTuAR7W0,Belarus,Russian,2015-07-20T15:53:00,2015-07-20T15:53:00,543.0000000000,112.0000000000,1584.0000000000,R,True
olenenock,Вот что значит настоящее ручное управление http://t.co/WxVjdMiY6x,Belarus,Russian,2015-07-20T16:12:00,2015-07-20T16:12:00,543.0000000000,112.0000000000,1585.0000000000,R,True
olenenock,«Шахтёр» представил новичков клуба http://t.co/RuEJNSMOFJ,Belarus,Bulgarian,2015-07-21T15:31:00,2015-07-21T15:31:00,427.0000000000,113.0000000000,1589.0000000000,R,True
olenenock,"Матросы эсминца ""Дональда Кук"" вошли в историю. Гознак России выпустил коллекционную монету тиражом 5000 штук. http://t.co/PHw7CSq4tn",Belarus,Russian,2015-07-21T15:53:00,2015-07-21T15:53:00,419.0000000000,113.0000000000,1590.0000000000,R,True
olenenock,«Днепр» будет проводить еврокубковые матчи в Днепропетровске http://t.co/h7TlPw9ROj,Belarus,Russian,2015-07-22T07:52:00,2015-07-22T07:52:00,360.0000000000,113.0000000000,1593.0000000000,R,True
olenenock,"Серьезный вопрос, на который так не отвечают http://t.co/4GttDJ7wVN #СмехСквозьСлезы",Belarus,Russian,2015-07-22T16:10:00,2015-07-22T16:10:00,360.0000000000,113.0000000000,1595.0000000000,,False
olenenock,СРОЧНО. Ассоциацию «Голос» исключат из реестра «иностранных агентов»   http://t.co/7Rd931LGYD http://t.co/2mmVYmDgg7,Belarus,Russian,2015-07-22T16:31:00,2015-07-22T16:31:00,360.0000000000,113.0000000000,1596.0000000000,R,True
olenenock,#СмехСквозьСлезы зачем вообе смеяться над такими вещами https://t.co/QTXaqYyVPi,Belarus,Russian,2015-07-22T19:00:00,2015-07-22T19:02:00,360.0000000000,112.0000000000,1603.0000000000,,False
olenenock,Итоги переговоров Нуланд и Карасина  http://t.co/w2ef3WQIaY http://t.co/E2i3x0L4VF,Belarus,Uzbek,2015-07-22T20:31:00,2015-07-22T20:31:00,360.0000000000,112.0000000000,1608.0000000000,R,True
olenenock,"ЧЕМ ПАХНЕТ НЬЮ-ЙОРК? девочки, налетай....  http://t.co/CmNIt0pox6",Belarus,Russian,2015-07-24T13:18:00,2015-07-24T13:19:00,360.0000000000,113.0000000000,1613.0000000000,R,True
olenenock,Петербург попросит Москву помочь автозаводу Hyundai  http://t.co/DCUW6HQ7X9,Belarus,Russian,2015-07-24T14:53:00,2015-07-24T14:53:00,360.0000000000,113.0000000000,1614.0000000000,R,True
olenenock,"Власти США могут освободить из тюрьмы офицера, осужденного за шпионаж в пользу Израиля http://t.co/Zj8ieWDLl9",Belarus,Russian,2015-07-24T21:32:00,2015-07-24T21:32:00,360.0000000000,113.0000000000,1615.0000000000,R,True
olenenock,Три человека погибли в ДТП с участием столичного полицейского  http://t.co/twh1reK4cU http://t.co/ylcH3iB7km,Belarus,Russian,2015-07-25T12:33:00,2015-07-25T12:33:00,360.0000000000,113.0000000000,1617.0000000000,R,True
olenenock,Минобороны ДНР: украинские силовики 40 раз за сутки нарушили режим прекращения огня  http://t.co/rwTs0Uj0kU,Belarus,Russian,2015-07-25T14:11:00,2015-07-25T14:11:00,360.0000000000,113.0000000000,1619.0000000000,R,True
olenenock,Путин пожелал удачи национальным сборным в отборе ЧМ-2018 по футболу http://t.co/8o9Z00fyxY,Belarus,Russian,2015-07-25T15:51:00,2015-07-25T15:51:00,360.0000000000,113.0000000000,1620.0000000000,R,True
olenenock,Дача Сердюкова стала «Адмиралом»  http://t.co/vAMw9NBlr2,Belarus,Russian,2015-07-26T23:11:00,2015-07-26T23:13:00,360.0000000000,113.0000000000,1623.0000000000,R,True
olenenock,Диссертацию Сергея Гуриева спонсировало USAID http://t.co/eAWHiM2nZ3 http://t.co/dvpzXQzlaE,Belarus,Russian,2015-07-28T00:03:00,2015-07-28T00:03:00,44.0000000000,112.0000000000,1625.0000000000,R,True
olenenock,#НиШагуНазад - приказ № 227 Народного комиссара обороны СССР И. В. Сталина от 28 июля 1942 года http://t.co/mk1B8snSk3,Belarus,Russian,2015-07-28T15:03:00,2015-07-28T15:03:00,44.0000000000,112.0000000000,1631.0000000000,R,True
olenenock,Онищенко посоветовал пропагандировать традиционную кухню в России http://t.co/tnEZYVMCwh,Belarus,Russian,2015-07-29T08:12:00,2015-07-29T08:12:00,44.0000000000,112.0000000000,1633.0000000000,R,True
olenenock,"Санчис: Бенитесу с его проблемой, связанной с Иско и Хамесом, можно позавидовать http://t.co/MEMgcXe043",Belarus,Russian,2015-07-30T07:52:00,2015-07-30T07:52:00,44.0000000000,112.0000000000,1637.0000000000,R,True
olenenock,Дмитрий Медведев поздравил с днем рождения клоуна Олега Попова http://t.co/sPgNerEYCk,Belarus,Russian,2015-07-31T08:33:00,2015-07-31T08:33:00,44.0000000000,112.0000000000,1639.0000000000,R,True
olenenock,Бронетранспортер с военными попал в ДТП в Калининграде  http://t.co/YtdHEzPDZ3 http://t.co/Z2QIUFkqCP,Belarus,Uzbek,2015-07-31T11:52:00,2015-07-31T11:52:00,44.0000000000,112.0000000000,1640.0000000000,R,True
olenenock,"Гаджиев: к матчу с «Крыльями Советов» отношусь профессионально, без эмоций http://t.co/qvoVoMgVro",Belarus,Russian,2015-07-31T14:53:00,2015-07-31T14:53:00,44.0000000000,112.0000000000,1642.0000000000,R,True
olenenock,"'@salty_1970 @polinanem вообще странно, что Миша 2% жмет копейки'",Belarus,Russian,2015-07-31T15:51:00,2015-07-31T15:51:00,44.0000000000,112.0000000000,1645.0000000000,R,True
olenenock,"Моуринью: Суперкубок Англии не так важен, как матч Премьер-лиги http://t.co/IOzqeN7b52",Belarus,Ukrainian,2015-07-31T16:13:00,2015-07-31T16:13:00,44.0000000000,112.0000000000,1646.0000000000,R,True
olenenock,В Белгородской области восстановлено движение поездов после столкновения фуры с поездом http://t.co/IYKx5oVGkI,Belarus,Russian,2015-08-01T09:32:00,2015-08-01T09:32:00,44.0000000000,113.0000000000,1651.0000000000,R,True
olenenock,СМИ: США рассматривают возможность ответной кибератаки по Китаю  #hitech,Belarus,Russian,2015-08-01T19:51:00,2015-08-01T19:51:00,44.0000000000,113.0000000000,1653.0000000000,R,True
olenenock,Более 100 медалей на ОИ и ЧМ были завоеваны подозреваемыми в допинге спортсменами  http://t.co/2uVH7Es6KB,Belarus,Russian,2015-08-02T06:31:00,2015-08-02T06:31:00,44.0000000000,113.0000000000,1654.0000000000,R,True
olenenock,В Мариуполе проходит акция протеста против демилитаризации Широкино http://t.co/OG89NZTc6z,Belarus,Russian,2015-08-02T19:52:00,2015-08-02T19:52:00,44.0000000000,113.0000000000,1656.0000000000,R,True
olenenock,У ФАНО нет единого плана преобразования институтов РАН http://t.co/Vx9rcQfVoq,Belarus,Russian,2015-08-04T09:12:00,2015-08-04T09:13:00,44.0000000000,113.0000000000,1663.0000000000,R,True
olenenock,Нижегородское «Торпедо» победило «Локомотив» в Кубке губернатора по хоккею http://t.co/ojhJGLHTWL,Belarus,Russian,2015-08-04T21:32:00,2015-08-04T21:32:00,44.0000000000,113.0000000000,1665.0000000000,R,True
olenenock,"Почему в Россию? Ему в пиндосию надо, оттуда вся жёпа   Латв. министр направился в Россию просить об отмене эмбарго http://t.co/oFK0s01uBj",Belarus,Russian,2015-08-05T04:12:00,2015-08-05T04:12:00,44.0000000000,113.0000000000,1667.0000000000,R,True
olenenock,Мультипликатор «Короля Льва» написал портрет льва Сесила   https://t.co/xI0y7li8VX http://t.co/RDe4L9Se7A,Belarus,Bulgarian,2015-08-05T17:52:00,2015-08-05T17:53:00,44.0000000000,113.0000000000,1669.0000000000,R,True
olenenock,Валерий Газзаев: ЦСКА в следующих матчах ЛЧ покажет совершенно другой уровень игры  http://t.co/465ZUjliIM,Belarus,Russian,2015-08-05T21:12:00,2015-08-05T21:12:00,44.0000000000,113.0000000000,1671.0000000000,R,True
olenenock,"Правительство РФ одобрило проект соглашения с Пакистаном по газопроводу ""Север - Юг""  http://t.co/msseDUfHgR",Belarus,Russian,2015-08-06T03:51:00,2015-08-06T03:52:00,44.0000000000,113.0000000000,1672.0000000000,R,True
olenenock,Россия опустилась в рейтинге ФИФА на три позиции http://t.co/wnlsvvacLY,Belarus,Russian,2015-08-06T09:12:00,2015-08-06T09:13:00,44.0000000000,113.0000000000,1675.0000000000,R,True
olenenock,Кремль пообещал проверить добытую хакерами информацию об «Искандерах»  http://t.co/p0NZK68qFP,Belarus,Russian,2015-08-07T18:12:00,2015-08-07T18:13:00,44.0000000000,113.0000000000,1682.0000000000,R,True
olenenock,"Смотри футбол, болей за наших! #ПоСтопамТарасова",Belarus,Russian,2015-08-07T18:12:00,2015-08-07T18:12:00,44.0000000000,113.0000000000,1681.0000000000,,False
olenenock,Госкино Украины о совместном производстве фильмов с Россией  http://t.co/4PZjBdqcPd http://t.co/yOLfnZ0cK3,Belarus,Russian,2015-08-08T07:33:00,2015-08-08T07:33:00,44.0000000000,113.0000000000,1685.0000000000,R,True
olenenock,'@MaxDementiev @interesnocc @s_patriott можно сплавать до нее?',Belarus,Russian,2015-08-08T20:21:00,2015-08-08T20:22:00,44.0000000000,113.0000000000,1687.0000000000,,False
olenenock,Медведев поздравил с юбилеем ректора Щукинского училища Евгения Князева http://t.co/71G30rmOYY,Belarus,Russian,2015-08-09T08:32:00,2015-08-09T08:32:00,44.0000000000,113.0000000000,1688.0000000000,R,True
olenenock,.@tina_kandelaki рассказала о задачах нового телеканала  http://t.co/sRUwCwDw9k http://t.co/niLG7toPUq,Belarus,Russian,2015-08-10T11:32:00,2015-08-10T11:32:00,44.0000000000,114.0000000000,1693.0000000000,R,True
olenenock,Чернобыльский дым перешел границу  http://t.co/vgcFYgLUCZ http://t.co/mTDm0ugSJU,Belarus,Russian,2015-08-10T17:54:00,2015-08-10T17:55:00,44.0000000000,114.0000000000,1695.0000000000,R,True
olenenock,"Жители Горловки: Отгоните их от города! http://t.co/LjYoJGvQnO Украинская сторона активничает, явно. Пытается отследить реакции.",Belarus,Russian,2015-08-11T14:12:00,2015-08-11T14:12:00,44.0000000000,114.0000000000,1700.0000000000,R,True
olenenock,"Че, все правда так плохо, как пишет Одуван?? Мы все умрем??? http://t.co/cL2vLgtSyD",Belarus,Ukrainian,2015-08-11T21:12:00,2015-08-11T21:13:00,44.0000000000,114.0000000000,1701.0000000000,R,True
olenenock,Так кто же виноват в трагедии над Истринским водохранилищем? http://t.co/WdsSdY0Lc3 http://t.co/4W3nW983Op,Belarus,Bulgarian,2015-08-12T16:11:00,2015-08-12T16:11:00,44.0000000000,113.0000000000,1706.0000000000,R,True
olenenock,«Лайки» вместо подписей: ЦИК подвел итоги регистрации партий на выборах http://t.co/g0s10BBb7f,Belarus,Russian,2015-08-12T17:14:00,2015-08-12T17:14:00,44.0000000000,113.0000000000,1707.0000000000,R,True
olenenock,«Манчестер Юнайтед» рассчитывает на Эрнандеса http://t.co/Li0GJRPhcH,Belarus,Russian,2015-08-12T22:10:00,2015-08-12T22:11:00,44.0000000000,114.0000000000,1710.0000000000,R,True
olenenock,Как и за обычными в прошлом году ))) https://t.co/LJTBq4cbal,Belarus,Russian,2015-08-14T06:12:00,2015-08-14T06:12:00,44.0000000000,114.0000000000,1712.0000000000,R,True
olenenock,Швейцария отменила санкции против Ирана https://t.co/Frq3UCc2eM,Belarus,Bulgarian,2015-08-14T07:52:00,2015-08-14T07:53:00,44.0000000000,114.0000000000,1713.0000000000,R,True
olenenock,"Пострадавших при задымлении в метро Екатеринбурга нет, движение поездов возобновлено  http://t.co/dRVQ7XVPWO",Belarus,Russian,2015-08-15T14:52:00,2015-08-15T14:52:00,44.0000000000,114.0000000000,1719.0000000000,R,True
olenenock,Малайзия готовит план Б для суда по «Боингу» в Донбассе  http://t.co/SSGNB5fiej http://t.co/lfF7l9uzLc,Belarus,Ukrainian,2015-08-16T10:12:00,2015-08-16T10:13:00,44.0000000000,114.0000000000,1724.0000000000,R,True
olenenock,«Динамо» выйдет на матч с «Уралом» в футболках с посланием к болельщикам клуба http://t.co/42yP8QC5TN,Belarus,Russian,2015-08-16T11:14:00,2015-08-16T11:14:00,44.0000000000,114.0000000000,1725.0000000000,R,True
olenenock,Топ-менеджеры «Роснефти» получили годовой доход за шесть месяцев   http://t.co/i5zX5iWbE9,Belarus,Russian,2015-08-16T18:51:00,2015-08-16T18:51:00,44.0000000000,113.0000000000,1726.0000000000,R,True
olenenock,В ХМАО нашли лодку с телами пропавших ранее людей http://t.co/omSayEyxte,Belarus,Russian,2015-08-17T12:33:00,2015-08-17T12:33:00,44.0000000000,113.0000000000,1730.0000000000,R,True
olenenock,"В Госдуму внесен законопроект о возврате Астраханской области к ""летнему"" времени http://t.co/DcJ9d3xvWJ",Belarus,Russian,2015-08-17T16:52:00,2015-08-17T16:52:00,44.0000000000,113.0000000000,1734.0000000000,R,True
olenenock,"У властей Таиланда есть изображение человека, заложившего взрывное устройство в Бангкоке  http://t.co/PHV6tO1MLt",Belarus,Russian,2015-08-18T04:42:00,2015-08-18T04:42:00,44.0000000000,113.0000000000,1738.0000000000,R,True
olenenock,Ленинопад на Украине  http://t.co/Js2ZUV1QcB,Belarus,Ukrainian,2015-08-18T13:19:00,2015-08-18T13:19:00,44.0000000000,113.0000000000,1741.0000000000,R,True
olenenock,Выпущено приложение для проектирования и изготовления роботов  #hitech,Belarus,Russian,2015-08-18T15:15:00,2015-08-18T15:15:00,44.0000000000,113.0000000000,1746.0000000000,R,True
olenenock,"В США спасли медвежонка, чья голова застряла в банке с протеином  http://t.co/x8fjFariSR http://t.co/OPe1ymmq5Z",Belarus,Serbian,2015-08-19T10:31:00,2015-08-19T10:31:00,44.0000000000,113.0000000000,1748.0000000000,R,True
olenenock,Путин потребовал ускорить очистку властей Крыма от коррупционеров http://t.co/tkvAfL8BHC,Belarus,Russian,2015-08-19T15:43:00,2015-08-19T15:43:00,44.0000000000,113.0000000000,1751.0000000000,R,True
olenenock,В Москве пройдет презентация нового отечественного кроссовера  Lada Vesta http://t.co/qNkMJJyMsu http://t.co/EXwkM1nIkj,Belarus,Russian,2015-08-19T17:13:00,2015-08-19T17:13:00,44.0000000000,113.0000000000,1754.0000000000,R,True
olenenock,'@Khinshtein Депутат Хинштейн обвинил силовиков в пассивности по делам дольщиков http://t.co/LADzQf6laQ http://t.co/LPci7N3pfK',Belarus,Ukrainian,2015-08-20T13:12:00,2015-08-20T13:12:00,44.0000000000,113.0000000000,1757.0000000000,R,True
olenenock,Залюбовавшийся природой житель Хакасии упал с высоты 1 км  http://t.co/clbdsScE15 http://t.co/vhvaJu0ADj,Belarus,Russian,2015-08-21T06:11:00,2015-08-21T06:11:00,44.0000000000,113.0000000000,1760.0000000000,R,True
olenenock,Агентство ТАСС открыло ретроспективную фотовыставку к своему 111-летию http://t.co/4dDd0S70jP,Belarus,Russian,2015-08-24T12:53:00,2015-09-19T21:54:00,44.0000000000,114.0000000000,1770.0000000000,R,True
olenenock,«Черный понедельник» начался в Шанхае и накрыл весь мир #BlackMonday http://t.co/GGJKyEdBBk http://t.co/9uA7bPwzoy,Belarus,Russian,2015-08-24T14:26:00,2015-09-20T02:28:00,44.0000000000,114.0000000000,1771.0000000000,R,True
olenenock,Число увольнений в крупных российских банках выросло в восемь раз  http://t.co/vUDOaiLTnQ,Belarus,Russian,2015-08-25T06:51:00,2015-08-25T06:51:00,44.0000000000,115.0000000000,1775.0000000000,R,True
olenenock,Скончалась директор московского музея Рериха Людмила Шапошникова http://t.co/opnzrBsow3,Belarus,Russian,2015-08-25T10:32:00,2015-08-25T10:32:00,44.0000000000,115.0000000000,1777.0000000000,R,True
olenenock,В гараже на юге Москвы полиция нашла более 100 краденых велосипедов http://t.co/WPSBHS63a2,Belarus,Russian,2015-08-25T10:52:00,2015-09-21T07:03:00,44.0000000000,115.0000000000,1778.0000000000,R,True
olenenock,Киев хочет создать санкционный список по делам Сенцова и Савченко http://t.co/mtKMH0AnpW,Belarus,Russian,2015-08-25T18:51:00,2015-08-25T18:51:00,44.0000000000,115.0000000000,1780.0000000000,R,True
olenenock,Роскомнадзор опроверг отказ Facebook размещать данные в РФ http://t.co/t9E0qojMRS,Belarus,Russian,2015-08-26T10:51:00,2015-09-22T05:20:00,44.0000000000,114.0000000000,1783.0000000000,R,True
olenenock,Видеооператор на сегвее сбил с ног Болта на чемпионате мира в Пекине http://t.co/Ygkektah0o,Belarus,Serbian,2015-08-27T14:52:00,2015-09-23T09:11:00,44.0000000000,114.0000000000,1793.0000000000,R,True
olenenock,СМИ признали старшую дочь Обамы восходящей иконой стиля http://t.co/WxekKsTJZC http://t.co/0pX6iBL6ay,Belarus,Russian,2015-08-27T21:31:00,2015-08-27T21:31:00,44.0000000000,114.0000000000,1794.0000000000,R,True
olenenock,Прокуратура начала проверку по факту пожара на рыболовецком траулере в Хабаровском крае http://t.co/EK2CRyjOnF,Belarus,Russian,2015-08-28T07:32:00,2015-09-04T21:51:00,44.0000000000,114.0000000000,1797.0000000000,R,True
olenenock,"Яценюк заявил, что Украина не будет сокращать военные расходы http://t.co/GoX43kiUGc",Belarus,Russian,2015-08-28T13:33:00,2015-08-28T13:33:00,44.0000000000,114.0000000000,1799.0000000000,R,True
olenenock,"Мобильные патрули полиции - не альтернатива постам охраны в музеях, заявила директор Третьяковки http://t.co/o6aBCwONeA",Belarus,Russian,2015-08-28T19:22:00,2015-09-24T12:12:00,44.0000000000,114.0000000000,1806.0000000000,R,True
olenenock,Прыгунья в высоту Кучина принесла сборной России второе золото на ЧМ в Пекине  http://t.co/lblbwy8jHP,Belarus,Russian,2015-08-29T12:51:00,2015-08-29T12:51:00,44.0000000000,115.0000000000,1811.0000000000,R,True
olenenock,Скончался известный кинорежиссёр Уэс Крейвен http://t.co/kdHTz22NSB http://t.co/8K2NlMC0Yz,Belarus,Russian,2015-08-31T10:53:00,2015-08-31T10:53:00,44.0000000000,115.0000000000,1816.0000000000,R,True
olenenock,Польша заявила о необходимости увеличения квоты на беженцев http://t.co/JoxR5tDAgf,Belarus,Russian,2015-08-31T17:32:00,2015-08-31T17:32:00,44.0000000000,115.0000000000,1818.0000000000,R,True
olenenock,"Новая Зеландия выбрала четыре флага, останется только один https://t.co/BIJELQmuEs",Belarus,Russian,2015-09-01T08:33:00,2015-09-01T08:33:00,44.0000000000,115.0000000000,1824.0000000000,R,True
