author_id,content,region,language,publish_date,harvested_date,following,followers,updates,post_type,retweet
olenenock,"ВКС РФ взяли под наблюдение основные дороги в районах, примыкающих к зоне боевых действий в Сирии  https://t.co/74ncQom0Mu",Belarus,Russian,2015-10-26T15:34:00,2015-10-26T15:41:00,42.0000000000,110.0000000000,2028.0000000000,R,True
olenenock,"армия — это антиантикафе. пока ты там, ты ничего не платишь",Belarus,Ukrainian,2015-10-26T15:45:00,2015-10-26T15:45:00,42.0000000000,110.0000000000,2029.0000000000,R,True
olenenock,Двое выживших при падении крана в Омске остаются в больнице https://t.co/jscLraN6lT,Belarus,Russian,2015-10-27T05:53:00,2015-10-27T05:53:00,42.0000000000,111.0000000000,2031.0000000000,R,True
olenenock,Сергей Лавров и Мохаммад Джавад Зариф обсудили урегулирование в Сирии https://t.co/8LSFId3qEO,Belarus,Russian,2015-10-27T18:53:00,2015-10-27T19:03:00,42.0000000000,111.0000000000,2035.0000000000,R,True
olenenock,"Колл-центр ""Трансаэро"" перестал работать из-за нарушений на линии связи https://t.co/UJ6xD3hFer",Belarus,Russian,2015-10-27T20:33:00,2015-10-27T20:33:00,42.0000000000,111.0000000000,2036.0000000000,R,True
olenenock,Жители индонезийского острова Калимантан готовятся к эвакуации из-за мощных лесных пожаров https://t.co/Ot7heJPt7i,Belarus,Russian,2015-10-28T03:12:00,2015-10-28T03:12:00,42.0000000000,111.0000000000,2037.0000000000,R,True
olenenock,Израиль планирует к 2018 году выработать соглашение о зоне свободной торговли с ЕАЭС  https://t.co/bvsFcQvl3L,Belarus,Russian,2015-10-28T06:14:00,2015-10-28T06:31:00,42.0000000000,111.0000000000,2038.0000000000,R,True
olenenock,Власти Эстонии могут отменить выступление ансамбля Александрова вслед за Литвой https://t.co/851WcNw6G4,Belarus,Russian,2015-10-28T07:31:00,2015-10-28T07:31:00,42.0000000000,111.0000000000,2039.0000000000,R,True
olenenock,Симонян: РФС рассмотрит вопрос о системе «осень-весна» после 2018 года https://t.co/buGlCHpjlT,Belarus,Russian,2015-10-28T11:52:00,2015-10-28T11:52:00,42.0000000000,111.0000000000,2040.0000000000,R,True
olenenock,Число погибших из-за взрыва дома под Хабаровском возросло до пяти https://t.co/BAx0JbutvV,Belarus,Ukrainian,2015-10-30T02:54:00,2015-10-30T02:54:00,42.0000000000,111.0000000000,2045.0000000000,R,True
olenenock,«Черная месса» с Джонни Деппом и другие премьеры этой недели https://t.co/7hnoAxM6ee https://t.co/tht4pUFKho,Belarus,Russian,2015-10-30T07:13:00,2015-10-30T07:13:00,42.0000000000,111.0000000000,2046.0000000000,R,True
olenenock,Израиль помогает Египту с разбившимся самолетом https://t.co/HYyY4U2yIP,Belarus,Russian,2015-10-31T11:14:00,2015-10-31T11:14:00,42.0000000000,111.0000000000,2047.0000000000,R,True
olenenock,"Экс-глава ""Когалымавиа"": авиакомпания не задерживала зарплату https://t.co/qblDVXKMkM",Belarus,Ukrainian,2015-11-01T16:22:00,2015-11-01T16:22:00,42.0000000000,112.0000000000,2051.0000000000,R,True
olenenock,"""Спартак"" проиграл ""Уралу"" в матче РФПЛ  https://t.co/4mWLvagXIU",Belarus,Russian,2015-11-01T19:14:00,2015-11-01T19:14:00,42.0000000000,112.0000000000,2052.0000000000,R,True
olenenock,Региональный банк развития решил закрыть офисы в Москве https://t.co/RCEVk7bpK9,Belarus,Russian,2015-11-02T14:13:00,2015-11-02T14:13:00,42.0000000000,112.0000000000,2055.0000000000,R,True
olenenock,"Financial Times: Разочарованные предательством США, сирийские курды надеются на Москву https://t.co/uqhsZs3YZ0",Belarus,Russian,2015-11-02T17:55:00,2015-11-02T17:55:00,42.0000000000,112.0000000000,2056.0000000000,R,True
olenenock,"Лучший гид мира Феликс Мальцев о том, что ищут в России иностранцы: https://t.co/rVIBZPe6Ek https://t.co/lzkZF07ciR",Belarus,Russian,2015-11-03T19:26:00,2015-11-03T19:27:00,43.0000000000,113.0000000000,2059.0000000000,R,True
olenenock,Вице-канцлер ФРГ: Евросоюз еще никогда не был так близок к распаду https://t.co/FJWKpiSPD5 © AP Photo https://t.co/bNiyBN33x0,Belarus,Russian,2015-11-03T21:01:00,2015-11-03T21:01:00,43.0000000000,113.0000000000,2060.0000000000,R,True
olenenock,Космический центр Франции опубликовал спутниковый снимок с места крушения А321 в Египте  https://t.co/vRnnrbpeO5,Belarus,Russian,2015-11-03T23:31:00,2015-11-03T23:31:00,43.0000000000,113.0000000000,2061.0000000000,R,True
olenenock,В «Антонове» рассказали историю упавшего в Южном судане АН-12 https://t.co/YbRPKeZamw  © AP Photo https://t.co/e85py5AVmh,Belarus,Russian,2015-11-04T18:12:00,2015-11-04T18:12:00,43.0000000000,113.0000000000,2062.0000000000,R,True
olenenock,В авиакатастрофе в Крыму погиб священник https://t.co/b7KtUE5Z0q,Belarus,Ukrainian,2015-11-04T22:54:00,2015-11-04T22:54:00,42.0000000000,112.0000000000,2063.0000000000,R,True
olenenock,'@salty_1970 @Jokeriya @alduckz Да мне пох на неё..',Belarus,Russian,2015-11-05T17:54:00,2015-11-05T17:55:00,42.0000000000,111.0000000000,2065.0000000000,R,True
olenenock,RT стал самым цитируемым СМИ из телеканалов в рунете  https://t.co/6OzVwZM2Xk https://t.co/1MGY3L0eX1,Belarus,Russian,2015-11-06T11:12:00,2015-11-06T11:19:00,42.0000000000,111.0000000000,2069.0000000000,R,True
olenenock,"Что станет с туристами, уже оплатившими путевки в Египет  https://t.co/xjAAFBiz4p https://t.co/5eMKcncFcm",Belarus,Ukrainian,2015-11-06T16:33:00,2015-11-06T16:33:00,42.0000000000,111.0000000000,2071.0000000000,R,True
olenenock,МЧС готово вывозить туристов из Египта своими бортами  https://t.co/jGaH9s6ZyG,Belarus,Russian,2015-11-06T20:15:00,2015-11-06T20:16:00,42.0000000000,111.0000000000,2072.0000000000,R,True
olenenock,Путин обсудил с главой Египта ас-Сиси вопрос безопасности авиасообщения  https://t.co/DF0qRiz34E https://t.co/x1iwKE0ktH,Belarus,Russian,2015-11-06T23:13:00,2015-11-06T23:14:00,42.0000000000,111.0000000000,2074.0000000000,R,True
olenenock,Вылетающим из Египта российским туристам разрешили взять на борт детское питание https://t.co/4iwFjz1Dcd,Belarus,Russian,2015-11-06T23:52:00,2015-11-06T23:52:00,42.0000000000,111.0000000000,2075.0000000000,R,True
olenenock,СМИ: Volkswagen намерен покрыть налоговые издержки своих клиентов  https://t.co/XL1aPK39qM,Belarus,Russian,2015-11-07T08:33:00,2015-11-07T08:33:00,42.0000000000,111.0000000000,2078.0000000000,R,True
olenenock,Минтруд ФРГ: беженцы поднимут уровень благосостояния страны https://t.co/I2SVTj31TH https://t.co/p5Fxi20FWw,Belarus,Russian,2015-11-08T01:31:00,2015-11-08T01:33:00,42.0000000000,111.0000000000,2081.0000000000,R,True
olenenock,"СМИ: в Бельгии пытались продать мумию, пропавшую 40 лет назад https://t.co/fRZ8u3Nn45 https://t.co/xgk8jZvE6J",Belarus,Russian,2015-11-08T01:52:00,2015-11-08T01:52:00,42.0000000000,111.0000000000,2082.0000000000,R,True
olenenock,Пум-бурум-пам-пам... © Какие веселые темы! https://t.co/GO1Ps3Mev7,Belarus,Russian,2015-11-08T10:31:00,2015-11-08T10:31:00,42.0000000000,111.0000000000,2083.0000000000,R,True
olenenock,Медведев поручил оказать поддержку туроператорам после приостановки авиасообщения с Египтом https://t.co/E2ezSGTctT https://t.co/pOBbQSBQkI,Belarus,Russian,2015-11-08T10:56:00,2015-11-08T10:59:00,42.0000000000,111.0000000000,2084.0000000000,R,True
olenenock,СМИ узнали о планах ЕС заплатить странам Африки за возврат мигрантов https://t.co/HLbSSPPmpe,Belarus,Russian,2015-11-08T18:54:00,2015-11-08T18:54:00,42.0000000000,112.0000000000,2086.0000000000,R,True
olenenock,Что Литва попросила у США  https://t.co/8dOfGkZPz4 https://t.co/L3TvGKYuN3,Belarus,Russian,2015-11-10T06:14:00,2015-11-10T06:14:00,42.0000000000,112.0000000000,2092.0000000000,R,True
olenenock,"Возбуждено дело против водителя Ferrari, который устроил ДТП на Крымском мосту  https://t.co/Ob3jS4RnhW https://t.co/MakLItBsUn",Belarus,Russian,2015-11-10T12:54:00,2015-11-10T12:54:00,42.0000000000,112.0000000000,2093.0000000000,R,True
olenenock,В ПАРНАС сообщили о задержании лидера молодежного отделения партии https://t.co/HhLNmwxFRW,Belarus,Russian,2015-11-10T16:15:00,2015-11-10T16:15:00,42.0000000000,113.0000000000,2094.0000000000,R,True
olenenock,Геополитические шахматы.   https://t.co/DeF3scDqaV #Геополитика https://t.co/73y3PdBs2u,Belarus,Russian,2015-11-10T20:33:00,2015-11-10T20:33:00,42.0000000000,113.0000000000,2095.0000000000,R,True
olenenock,Очки виртуальной реальности от Samsung доступны для предзаказа https://t.co/hlJZpsOBWF,Belarus,Russian,2015-11-11T12:34:00,2015-11-11T12:34:00,42.0000000000,112.0000000000,2096.0000000000,R,True
olenenock,"Бюджет «Кубани» на сезон-2015/16 составляет около 1,2 млрд рублей https://t.co/YIpBfMJ9VT",Belarus,Russian,2015-11-11T22:53:00,2015-11-11T22:53:00,42.0000000000,113.0000000000,2098.0000000000,R,True
olenenock,ФОТОГАЛЕРЕЯ. 80 лет со дня рождения Людмилы Гурченко  https://t.co/HJtjM9fkgB https://t.co/x4QVd825cQ,Belarus,Russian,2015-11-12T06:56:00,2015-11-12T06:56:00,42.0000000000,113.0000000000,2101.0000000000,R,True
olenenock,Аналитик Forbes: Яценюк терпит фиаско https://t.co/ioJKDeJf6i https://t.co/5HTqveeFT6,Belarus,Bulgarian,2015-11-13T09:33:00,2015-11-13T09:33:00,42.0000000000,113.0000000000,2107.0000000000,R,True
olenenock,"Отток капитала из РФ в 2015 году составит $60-65 млрд, заявил Антон Силуанов https://t.co/HAjsMgz8wh",Belarus,Russian,2015-11-13T09:57:00,2015-11-13T09:57:00,42.0000000000,113.0000000000,2108.0000000000,R,True
olenenock,ВИДЕО. Слушания по декоммунизации в Харькове закончились дракой из-за русского языка  https://t.co/tzTnWHh1kB https://t.co/T9Kk71yXwO,Belarus,Russian,2015-11-13T10:17:00,2015-11-13T10:17:00,42.0000000000,113.0000000000,2109.0000000000,R,True
olenenock,Последние секунды записи самописца А321 расшифруют за пределами Египта https://t.co/EhnCAZfxr7 #7K9268 https://t.co/kswUwoIFrb,Belarus,Russian,2015-11-13T11:22:00,2015-11-13T11:22:00,42.0000000000,113.0000000000,2110.0000000000,R,True
olenenock,В Германии в квартире обнаружены тела семерых детей https://t.co/mXYSW0XMrF,Belarus,Russian,2015-11-13T11:35:00,2015-11-13T11:36:00,42.0000000000,113.0000000000,2111.0000000000,R,True
olenenock,Задержан возможный пособник убийц полицейского в Москве https://t.co/ywjEOecSej https://t.co/MfCItJ10Qv,Belarus,Russian,2015-11-13T13:06:00,2015-11-13T13:06:00,42.0000000000,113.0000000000,2112.0000000000,R,True
olenenock,Сборную Германии эвакуировали из отеля в Париже из-за угрозы взрыва https://t.co/w5FSraqz7t,Belarus,Russian,2015-11-13T13:15:00,2015-11-13T13:16:00,42.0000000000,113.0000000000,2114.0000000000,R,True
olenenock,Белый дом: США не собираются своими действиями в Южно-Китайском море бросать вызов КНР https://t.co/JRwapDuNsf https://t.co/6YP05KlZEl,Belarus,Russian,2015-11-13T22:55:00,2015-11-13T22:56:00,42.0000000000,113.0000000000,2122.0000000000,R,True
olenenock,СМИ: в концертном зале в Париже захвачены порядка 100 человек.  Подробности: https://t.co/hYFLPBhggZ #ParisAttacks https://t.co/GsPsoORZEC,Belarus,Russian,2015-11-13T23:57:00,2015-11-13T23:57:00,42.0000000000,113.0000000000,2123.0000000000,R,True
olenenock,«Париж погряз в крови. К такому никто не был готов».  Журналист RFI Елена Серветтаз с последними новостями:  https://t.co/oIJoDNcwWT,Belarus,Ukrainian,2015-11-14T01:20:00,2015-11-14T01:21:00,42.0000000000,113.0000000000,2124.0000000000,R,True
olenenock,Глава Никарагуа: США и Европа пытаются дестабилизировать ситуацию в РФ https://t.co/zGOuQocLZl https://t.co/r5YwOTAXP6,Belarus,Russian,2015-11-14T11:55:00,2015-11-14T11:55:00,42.0000000000,113.0000000000,2126.0000000000,R,True
olenenock,Префектуры Парижа могут ввести комендантский час https://t.co/xgE31kAhMP,Belarus,Russian,2015-11-14T14:34:00,2015-11-14T14:34:00,42.0000000000,113.0000000000,2127.0000000000,R,True
olenenock,Глава Дагестана: совершившие теракты в священный для мусульман день «получат по заслугам»  https://t.co/JOPgqv44XI https://t.co/reLARYPvOS,Belarus,Russian,2015-11-14T14:54:00,2015-11-14T14:54:00,42.0000000000,113.0000000000,2128.0000000000,R,True
olenenock,"Останкинская башня сейчас. Фото Дмитрия Борисова, ведущего Первого канала   https://t.co/QrdhlRiWyG https://t.co/eE9Q4cmQn2",Belarus,Russian,2015-11-14T15:58:00,2015-11-14T15:58:00,42.0000000000,113.0000000000,2129.0000000000,R,True
olenenock,СМИ: во Франции скоростной поезд сошел с рельсов https://t.co/3tEzSGhl6T,Belarus,Russian,2015-11-14T16:16:00,2015-11-14T16:16:00,42.0000000000,113.0000000000,2130.0000000000,R,True
olenenock,Кэмерон и Олланд договорились усилить обмен данными для выявления террористов https://t.co/OwGRPDA3dw,Belarus,Russian,2015-11-14T17:53:00,2015-11-14T17:53:00,42.0000000000,113.0000000000,2131.0000000000,R,True
olenenock,Лидеры ЕС: теракт в Париже -- нападение на всех нас  https://t.co/2Eltqi6NiU,Belarus,Russian,2015-11-14T17:54:00,2015-11-14T17:54:00,42.0000000000,113.0000000000,2132.0000000000,R,True
olenenock,Заголовки ведущих зарубежных СМИ о парижской трагедии https://t.co/XoV2iuFRKk,Belarus,Russian,2015-11-14T18:33:00,2015-11-14T18:33:00,42.0000000000,113.0000000000,2134.0000000000,R,True
olenenock,"Большегрузы будут платить 1,53 рубля за километр пути по федеральным трассам  https://t.co/ucEDbZJIrl",Belarus,Russian,2015-11-14T21:54:00,2015-11-14T21:55:00,42.0000000000,113.0000000000,2135.0000000000,R,True
olenenock,Полиция задержала подозреваемого в терактах в Париже  https://t.co/C6lr0aPsIr https://t.co/oYNB9hlDpn,Belarus,Russian,2015-11-14T22:32:00,2015-11-14T22:32:00,42.0000000000,113.0000000000,2136.0000000000,R,True
olenenock,СМИ сообщили об уничтожении четырех боевиков ИГ в Турции накануне G20 https://t.co/rs0R4ymcH0,Belarus,Russian,2015-11-15T04:13:00,2015-11-15T04:14:00,42.0000000000,113.0000000000,2138.0000000000,R,True
olenenock,Лондонцы почтили память погибших в результате терактов в Париже  https://t.co/gtNXMCgFfl #ParisAttacks #Париж https://t.co/30ZtNUIEEm,Belarus,Russian,2015-11-15T05:11:00,2015-11-15T05:11:00,42.0000000000,113.0000000000,2139.0000000000,R,True
olenenock,"Блядь, Твиттер сам актер мой твит про Самарского! Охуели?",Belarus,Russian,2015-11-15T08:55:00,2015-11-15T08:55:00,42.0000000000,113.0000000000,2141.0000000000,R,True
olenenock,Пан Ги Мун сделал заявление по Сирии  https://t.co/hAUcVjDGfF https://t.co/EJng65XG5E,Belarus,Russian,2015-11-15T11:14:00,2015-11-15T11:14:00,42.0000000000,113.0000000000,2142.0000000000,R,True
olenenock,"Ирак разведал, в каких странах ИГИЛ готовит новые теракты https://t.co/9bvQHw1GeJ https://t.co/5KowA3hmU6",Belarus,Russian,2015-11-15T11:52:00,2015-11-15T11:53:00,42.0000000000,113.0000000000,2143.0000000000,R,True
olenenock,"Французский депутат: жалею, что мы не учли важность РФ в Сирии https://t.co/cNQWnMjz9O https://t.co/ZswtKim88U",Belarus,Ukrainian,2015-11-15T14:15:00,2015-11-15T14:15:00,42.0000000000,113.0000000000,2144.0000000000,R,True
olenenock,Причиной паники в центре Парижа стали слухи о готовящихся терактах https://t.co/NDfP3169o8 https://t.co/4ewUFvwE0n,Belarus,Russian,2015-11-15T21:50:00,2015-11-15T21:51:00,42.0000000000,114.0000000000,2146.0000000000,R,True
olenenock,Дания намерена усилить авиаудары по ИГИЛ https://t.co/Du2scQLRmy https://t.co/uU57iQTuOD,Belarus,Russian,2015-11-15T21:54:00,2015-11-15T21:54:00,42.0000000000,114.0000000000,2147.0000000000,R,True
olenenock,"Канада усилит контроль на границах, но продолжит приём беженцев https://t.co/iMyQW70rt3 https://t.co/06g43jxYLV",Belarus,Russian,2015-11-16T04:36:00,2015-11-16T04:37:00,42.0000000000,113.0000000000,2148.0000000000,R,True
olenenock,Кэмерон заявил о необходимости Британии присоединиться к ударам по Сирии https://t.co/VEStw1z22c,Belarus,Russian,2015-11-16T09:13:00,2015-11-16T09:13:00,42.0000000000,113.0000000000,2151.0000000000,R,True
olenenock,Париж: акция памяти на Площади Республики: https://t.co/UXcIwD3xrE https://t.co/i8G8K6nmTG,Belarus,Uzbek,2015-11-16T10:14:00,2015-11-16T10:14:00,42.0000000000,113.0000000000,2152.0000000000,R,True
olenenock,"Адриано: я бы поставил на то, что Месси сыграет против «Реала» https://t.co/UOHluKck3U",Belarus,Russian,2015-11-16T10:15:00,2015-11-16T10:15:00,42.0000000000,113.0000000000,2153.0000000000,R,True
olenenock,"если российских легкоатлетов дисквалифицируют, то у нас в армии появятся метатели гранат на 200 метров",Belarus,Russian,2015-11-16T15:12:00,2015-11-16T15:12:00,42.0000000000,113.0000000000,2155.0000000000,R,True
olenenock,Тренер сборной Хорватии: Олич всё такой же сумасшедший https://t.co/tNtmOemf3g,Belarus,Russian,2015-11-16T17:32:00,2015-11-16T17:32:00,42.0000000000,113.0000000000,2157.0000000000,R,True
olenenock,Mercedes за 6 млн рублей украли с охраняемой стоянки в Москве у первокурсника МГИМО https://t.co/5RCNTzd2T2,Belarus,Russian,2015-11-17T08:15:00,2015-11-17T08:15:00,42.0000000000,113.0000000000,2159.0000000000,R,True
olenenock,Бывшие сотрудники Apple обвинили корпорацию в разрушении принципов дизайна: https://t.co/64f6lioQIc,Belarus,Russian,2015-11-17T12:38:00,2015-11-17T12:38:00,42.0000000000,113.0000000000,2161.0000000000,R,True
olenenock,Leica выпустила украшения для фотографов: https://t.co/5d2ngM3q0q,Belarus,Ukrainian,2015-11-17T16:56:00,2015-11-17T16:57:00,42.0000000000,113.0000000000,2163.0000000000,R,True
olenenock,Медведев: к 2020 году экспорт зерна из РФ составит 35-40 млн тонн https://t.co/YE9tau5olq https://t.co/ojxTGTPJbJ,Belarus,Russian,2015-11-18T07:33:00,2015-11-18T07:33:00,42.0000000000,114.0000000000,2168.0000000000,R,True
olenenock,New York Post: даже после терактов в Париже Обама не хочет изменять свою стратегию по ИГ https://t.co/cwbM74SZXK https://t.co/iBegheolfv,Belarus,Russian,2015-11-18T09:58:00,2015-11-18T09:58:00,42.0000000000,114.0000000000,2173.0000000000,R,True
olenenock,«Париж покажется детским садом»  https://t.co/EoGL3fAyAL https://t.co/JKTVcuXRmq,Belarus,Russian,2015-11-18T11:17:00,2015-11-18T11:18:00,42.0000000000,114.0000000000,2174.0000000000,R,True
olenenock,Кремль: принц Абу-Даби готов помогать в поиске виновных в гибели А321 https://t.co/vg0xUrLMjC https://t.co/oLQx2bGHpq,Belarus,Russian,2015-11-18T13:16:00,2015-11-18T13:16:00,42.0000000000,114.0000000000,2175.0000000000,R,True
olenenock,МАК просит Минтранс прокомментировать ситуацию вокруг Boeing 737 https://t.co/6fnFZHdaGD,Belarus,Russian,2015-11-18T16:54:00,2015-11-18T16:54:00,42.0000000000,114.0000000000,2178.0000000000,R,True
olenenock,Швеция продлит пограничный контроль на 20 дней https://t.co/boP94R7Aw2,Belarus,Russian,2015-11-18T19:52:00,2015-11-18T19:52:00,42.0000000000,114.0000000000,2180.0000000000,R,True
olenenock,Генерал ВВС США: ВКС РФ действуют в Азиатско-Тихоокеанском регионе профессионально  https://t.co/ME6AbIGr0R,Belarus,Russian,2015-11-19T00:51:00,2015-11-19T00:51:00,42.0000000000,114.0000000000,2181.0000000000,R,True
olenenock,Мутко: финансирование РУСАДА и московской лаборатории не останавливается https://t.co/H6knStZye9 https://t.co/gScnL9hkHt,Belarus,Russian,2015-11-19T08:40:00,2015-11-19T08:40:00,42.0000000000,114.0000000000,2184.0000000000,R,True
olenenock,В Ленинском районе Донецка выдается гуманитарная помощь льготным категориям граждан (видео) https://t.co/a0Edp7gEov,Belarus,Russian,2015-11-19T11:24:00,2015-11-19T11:24:00,42.0000000000,114.0000000000,2185.0000000000,R,True
olenenock,Некоторые больницы Москвы и области не пускают в палаты посетителей из-за угрозы терактов https://t.co/D0jm9kgzIi,Belarus,Russian,2015-11-19T13:58:00,2015-11-19T13:58:00,42.0000000000,114.0000000000,2187.0000000000,R,True
olenenock,ВИДЕО. Депутат Рады избил в парламенте сотрудника СБУ  https://t.co/DuXocYDl7L © YouTube https://t.co/CRYYiIptMr,Belarus,Ukrainian,2015-11-19T15:13:00,2015-11-19T15:14:00,42.0000000000,114.0000000000,2189.0000000000,R,True
olenenock,На юго-востоке Москвы в ДТП с участием автобуса пострадали 16 человек https://t.co/ieebNe5YOr https://t.co/qf6OyNUwQK,Belarus,Russian,2015-11-19T20:14:00,2015-11-19T20:14:00,42.0000000000,115.0000000000,2194.0000000000,R,True
olenenock,СМИ: в Швеции задержан подозреваемый в подготовке теракта  https://t.co/GnQjkxEpoa,Belarus,Russian,2015-11-19T22:56:00,2015-11-19T22:56:00,42.0000000000,115.0000000000,2195.0000000000,R,True
olenenock,Россия раскритиковала выбор целей французскими ВВС в Сирии https://t.co/alQASI6GEr https://t.co/p4gZFELwBV,Belarus,Russian,2015-11-19T23:32:00,2015-11-19T23:32:00,42.0000000000,115.0000000000,2196.0000000000,R,True
olenenock,В Нью-Йорке из-за угрозы терактов усилены меры безопасности на транспортных объектах  https://t.co/NgCrZiNmKp,Belarus,Russian,2015-11-19T23:55:00,2015-11-19T23:56:00,42.0000000000,115.0000000000,2197.0000000000,R,True
olenenock,Все новости Кузбасса https://t.co/2JPpKrHhmx,Belarus,Russian,2015-11-20T04:22:00,2015-11-20T04:22:00,42.0000000000,115.0000000000,2198.0000000000,R,True
olenenock,Миронов предложил лишать гражданства участников террористических войн https://t.co/onRAY4TgW8 https://t.co/1rlucaEgfn,Belarus,Russian,2015-11-20T08:54:00,2015-11-20T08:54:00,42.0000000000,115.0000000000,2199.0000000000,R,True
olenenock,Агент Широкова: я с Родионовым никаких переговоров не вёл и не веду https://t.co/FMYomRLuhG,Belarus,Ukrainian,2015-11-20T13:55:00,2015-11-20T13:58:00,42.0000000000,115.0000000000,2203.0000000000,R,True
