author_id,content,region,language,publish_date,harvested_date,following,followers,updates,post_type,retweet
k2danger,"Путин: на санкции Россия отвечает не закрытием экономики, а расширением свободы, повышением открытости страны #ЗапасПрочности",Unknown,Russian,2015-06-19 15:41:00,2015-06-19 15:41:00,780,124,399,,0
k2danger,Он первый  http://t.co/rYmiwg96Rk,Unknown,Russian,2015-06-22 14:36:00,2015-06-22 14:37:00,780,124,402,R,1
k2danger,Отборные факты о России по версии иностранцев http://t.co/k1psWbSqZs #Россия #RuOpen,Unknown,Russian,2015-07-21 16:29:00,2015-07-21 16:30:00,776,122,426,R,1
k2danger,"то самое чувство, когда отчим после секса рассказывает анекдот #СмехСквозьСлезы http://t.co/rMwto4OMrf",Unknown,Russian,2015-07-22 15:35:00,2015-07-22 15:35:00,776,122,427,R,1
k2danger,Конкурс «Мастера автобронетанковой техники» завершился победой сборной России   http://t.co/tVgJVYTXcO,Unknown,Russian,2015-08-17 08:17:00,2015-08-17 08:19:00,776,122,441,R,1
k2danger,Навальный пригласил дипломатов США в Кострому для отчета   https://t.co/top8wyQANe http://t.co/jC5rTMszZM,Unknown,Ukrainian,2015-09-04 11:45:00,2015-09-04 11:45:00,775,120,451,R,1
k2danger,"Вот в такую ситуацию можно попасть, если заказать первое попавшееся такси  http://t.co/lLiWML7UCi http://t.co/EGzPOn15mO",Unknown,Russian,2015-09-08 16:17:00,2015-09-08 16:17:00,775,120,468,R,1
k2danger,Германия закрывает границу #беженцы   https://t.co/LtP1BW3Hxt,Unknown,Russian,2015-09-17 14:37:00,2015-09-17 14:37:00,764,120,474,R,1
k2danger,Легко ли стать смертником?  http://t.co/t4ia90feH1,Unknown,Russian,2015-09-23 16:41:00,2015-09-23 16:41:00,763,122,481,R,1
k2danger,Политики нетривиально поздравили читателей ФАН в День народного единства https://t.co/4aRbsOXTGh https://t.co/6CKkRhb6gD,Unknown,Russian,2015-11-04 10:12:00,2015-11-04 10:13:00,760,125,495,R,1
k2danger,"Что скрывали Fanta, Ford и Ikea?  https://t.co/6nTstgqowL",Unknown,Ukrainian,2015-11-10 14:55:00,2015-11-10 14:55:00,760,121,496,R,1
k2danger,"""Высотка на Котельнической увенчалась украинским флагом""  - хохлы, греет ли вас эта новость? #СамыйГлупыйПоступок https://t.co/PU6E1YMhsI",Unknown,Russian,2015-11-23 15:31:00,2015-11-23 15:32:00,760,122,498,R,1
k2danger,"в мире богатства всё также фальшиво, как и сама жизнь Андрея Ющенко https://t.co/sfktFTGIMH",Unknown,Russian,2015-12-05 18:00:00,2015-12-05 18:00:00,759,122,500,R,1
k2danger,"Есть и пить нужно столько, чтобы наши силы этим восстанавливались, а не подавлялись.",Unknown,Russian,2017-04-25 09:19:00,2017-04-25 09:19:00,730,116,507,,0
