author_id,content,region,language,publish_date,harvested_date,following,followers,updates,post_type,retweet
KolnBote,Krawalle auf Hohenzollerring: 43 Rocker wieder frei https://t.co/u3h9i58pye https://t.co/QY4bBJNgfr,Germany,German,2017-05-20T11:35:00,2017-05-20T11:37:00,927.0000000000,911.0000000000,2714.0000000000,,False
KolnBote,Auktionshaus Breker: Alter „Apple I“ in Köln für 110 000 Euro versteigert https://t.co/OEh5hxrpoQ https://t.co/p1aZFY9Mrb,Germany,German,2017-05-20T12:35:00,2017-05-20T12:35:00,927.0000000000,911.0000000000,2715.0000000000,,False
KolnBote,Vollversorger gefordert: Fühlinger Bürger hoffen auf einen neuen Supermarkt https://t.co/rKRCnvLIFr https://t.co/3tbaqsRwqr,Germany,German,2017-05-20T16:02:00,2017-05-20T16:02:00,927.0000000000,910.0000000000,2716.0000000000,,False
KolnBote,Unfall auf Cäcilienstraße: Pkw beim unerlaubten Wenden von Bahn erfasst https://t.co/eVyK6pM1xK https://t.co/pPg8EjtunL,Germany,German,2017-05-20T16:35:00,2017-05-20T16:35:00,927.0000000000,910.0000000000,2717.0000000000,,False
KolnBote,Kölner Cäcilienstraße: KVB-Bahn fährt in vollbesetztes Auto https://t.co/bacZ0Z9MEE https://t.co/zqV7x7MWUh,Germany,German,2017-05-20T17:02:00,2017-05-20T17:02:00,927.0000000000,910.0000000000,2718.0000000000,,False
KolnBote,Kölner Cäcilienstraße: KVB-Bahn fährt in Pkw – vier Personen verletzt https://t.co/fk2nb1F8vx https://t.co/FUqf0joSTl,Germany,German,2017-05-20T19:25:00,2017-05-20T19:25:00,927.0000000000,911.0000000000,2719.0000000000,,False
KolnBote,Räumung der Turnhallen in Köln: Rund 400 Flüchtlinge leben noch in Notunterkünften https://t.co/8isUp5dUi2 https://t.co/2UQ0gknVDE,Germany,German,2017-05-21T08:51:00,2017-05-21T08:51:00,928.0000000000,911.0000000000,2722.0000000000,,False
KolnBote,Nach Europapokal-Einzug des 1. FC Köln - SO feierten die Effzeh- Fans auf dem Ring https://t.co/YVra69qK4n https://t.co/TLJy36Aocg,Germany,German,2017-05-21T09:10:00,2017-05-21T09:10:00,928.0000000000,911.0000000000,2723.0000000000,,False
KolnBote,Urbane Gemütlichkeit: Rösterei eröffnet das Café Heilandt in Sülz https://t.co/u8t1tq2lSu https://t.co/FNNO8uR1ta,Germany,German,2017-05-21T09:25:00,2017-05-21T09:25:00,928.0000000000,911.0000000000,2724.0000000000,,False
KolnBote,Vor 40 Jahren 550 Dollar - Apple 1 jetzt für 90 000 Euro versteigert https://t.co/QAyNYmTxaW https://t.co/V4ZQWeVT4G,Germany,German,2017-05-21T11:07:00,2017-05-21T11:07:00,928.0000000000,912.0000000000,2725.0000000000,,False
KolnBote,Autobahn 57: Politiker wollen Tempo 50 am Blücherpark https://t.co/rEYLitZttW https://t.co/ZdZVasy6iJ,Germany,German,2017-05-21T11:14:00,2017-05-21T11:14:00,928.0000000000,912.0000000000,2726.0000000000,,False
KolnBote,Prüfungs-Protest in NRW - Prinz Harry hat Schülern Englisch-Test vernuschelt https://t.co/F07bqBhb6J https://t.co/5yGkOr0JWF,Germany,German,2017-05-21T12:07:00,2017-05-21T12:07:00,928.0000000000,911.0000000000,2727.0000000000,,False
KolnBote,Positive Polizeibilanz: Mehr als 5000 FC-Fans feierten friedlich den Sieg https://t.co/eIfhS7I1lm https://t.co/b3lUf1UPpE,Germany,German,2017-05-21T12:14:00,2017-05-21T12:14:00,928.0000000000,911.0000000000,2728.0000000000,,False
KolnBote,Nach Doping-Zoff - Ullrich wird nicht „Sportlicher Leiter“ https://t.co/0KFMeA4nEu https://t.co/VO5LMDIaqn,Germany,German,2017-05-21T14:07:00,2017-05-21T14:07:00,928.0000000000,910.0000000000,2730.0000000000,,False
KolnBote,Kommentar zur Kölner Außengastronomie: Kölner suchen den Kontakt und Austausch https://t.co/2glZBbW3SO https://t.co/uxdcsEPIaX,Germany,German,2017-05-21T15:25:00,2017-05-21T15:25:00,928.0000000000,910.0000000000,2732.0000000000,,False
KolnBote,Adoptivenkel gefunden: Junge Einwanderer und Senioren treffen aufeinander https://t.co/neR6lMqSOy https://t.co/b36oHjjWkV,Germany,German,2017-05-21T16:14:00,2017-05-21T16:15:00,928.0000000000,910.0000000000,2733.0000000000,,False
KolnBote,Kölner Weiher: Stadtentwässerungsbetriebe investieren sechs Millionen Euro https://t.co/HYfWAbAE7l https://t.co/ZtjO0Oyg4b,Germany,German,2017-05-21T17:25:00,2017-05-21T17:25:00,928.0000000000,910.0000000000,2734.0000000000,,False
KolnBote,Harley-Treff in Poll: 5000 Biker ziehen bei Köln-Rundfahrt Blicke auf sich https://t.co/iXWU9Q4phK https://t.co/Lml3wOLKH5,Germany,German,2017-05-21T19:25:00,2017-05-21T19:25:00,928.0000000000,910.0000000000,2735.0000000000,,False
KolnBote,Auf dem Trockenen - Die Bundeswehr hat uns das Wasser abgedreht https://t.co/YXduDOPtpz https://t.co/DB3LyfXowV,Germany,German,2017-05-21T21:07:00,2017-05-21T21:07:00,928.0000000000,909.0000000000,2736.0000000000,,False
KolnBote,Überirdisch! - Köln staunt über Science-Fiction-Oper https://t.co/gNrlE70PGl https://t.co/xXB76rF2VR,Germany,German,2017-05-21T22:47:00,2017-05-21T22:47:00,928.0000000000,909.0000000000,2737.0000000000,,False
KolnBote,Mann mit vielen Ämtern: Kölner CDU-Chef Petelkau versteht sich selbst als Trainer https://t.co/jVOQgKknJV https://t.co/akGmT2Kxr4,Germany,German,2017-05-22T04:33:00,2017-05-22T04:33:00,928.0000000000,909.0000000000,2738.0000000000,,False
KolnBote,In Fahrtrichtung Köln: A57 soll nach Lkw-Unfall für Bergungsarbeiten gesperrt werden https://t.co/ohzYfu0Z4l https://t.co/ym21DBLlWu,Germany,German,2017-05-22T05:33:00,2017-05-22T05:33:00,928.0000000000,910.0000000000,2739.0000000000,,False
KolnBote,Bergungsarbeiten: A57 in Richtung Köln nach Lkw-Unfall gesperrt https://t.co/geOrlX3Ejl https://t.co/NuzGFYnTtp,Germany,German,2017-05-22T05:35:00,2017-05-22T05:35:00,928.0000000000,910.0000000000,2740.0000000000,,False
KolnBote,LKW mit Eis umgekippt - A57 Richtung Köln ab 9 Uhr gesperrt https://t.co/HQIVSRXzVI https://t.co/5ul41eiW5m,Germany,German,2017-05-22T06:27:00,2017-05-22T06:27:00,928.0000000000,910.0000000000,2741.0000000000,,False
KolnBote,Neues Preismodell geplant: Wasser sparen bedroht die Umsätze von Rhein-Energie https://t.co/UmozeGmO1s https://t.co/1n6a9212Q3,Germany,German,2017-05-22T09:33:00,2017-05-22T09:33:00,928.0000000000,910.0000000000,2745.0000000000,,False
KolnBote,Festnahme in Hennef - Flüchtling soll Mädchen vergewaltigt haben https://t.co/9daxe9U9jY https://t.co/8QgIkIWzWe,Germany,German,2017-05-22T10:27:00,2017-05-22T10:27:00,928.0000000000,910.0000000000,2747.0000000000,,False
KolnBote,Deutz-Kalker Straße: Leblose Person in Wohnung gefunden https://t.co/KYiRql5Pu1 https://t.co/YstqfrtNAW,Germany,German,2017-05-22T11:33:00,2017-05-22T11:34:00,928.0000000000,911.0000000000,2749.0000000000,,False
KolnBote,„Mashery Hummus Kitchen“: Kölns erstes Hummus-Restaurant an der Roonstraße eröffnet https://t.co/rBKkS2RE1Z https://t.co/yldo3CTiX0,Germany,German,2017-05-22T12:35:00,2017-05-22T12:35:00,928.0000000000,911.0000000000,2751.0000000000,,False
KolnBote,Stand-Up Paddeln: Mit etwas Balance über den Fühlinger See treiben https://t.co/Tfl40ubvgb https://t.co/FBwmVCJO1Z,Germany,German,2017-05-22T14:33:00,2017-05-22T14:33:00,928.0000000000,911.0000000000,2752.0000000000,,False
KolnBote,Youtube-Star - Joyce Ilg dreht sich „Zurück in die Zukunft“ https://t.co/VwO2BStz9L https://t.co/Kkypa2r5mD,Germany,German,2017-05-22T15:27:00,2017-05-22T15:28:00,928.0000000000,911.0000000000,2753.0000000000,,False
KolnBote,Bergung: Nur ein Fahrstreifen auf A57 in Richtung Köln – über zehn Kilometer Stau https://t.co/d9EWnFa3vx https://t.co/6uvSwIoQbY,Germany,German,2017-05-22T15:33:00,2017-05-22T15:33:00,928.0000000000,911.0000000000,2754.0000000000,,False
KolnBote,Sechs Verletzte: Unfall mit Schulbus – Auffahrt zur Severinsbrücke kurzzeitig gesperrt https://t.co/pg5yKIIDuf https://t.co/Lbmt9eim1U,Germany,German,2017-05-22T16:33:00,2017-05-22T16:33:00,928.0000000000,911.0000000000,2755.0000000000,,False
KolnBote,Intensivtäter: Jugendlicher droht auf Schulhof mit Messer – keine Zwangseinweisung https://t.co/xM6hDom8QZ https://t.co/p5Fh6tcefo,Germany,German,2017-05-22T20:02:00,2017-05-22T20:02:00,927.0000000000,911.0000000000,2761.0000000000,,False
KolnBote,„Willkommenskultur Mülheim“: Initiative sucht Wohnungen und Paten für Flüchtlinge https://t.co/OxwI9VVmfJ https://t.co/rAuJBxs1qJ,Germany,German,2017-05-22T22:02:00,2017-05-22T22:02:00,927.0000000000,911.0000000000,2762.0000000000,,False
KolnBote,Radverkehr in Köln: Grüne kritisieren Stadt für mangelndes Engagement https://t.co/LFsWJzZeLk https://t.co/Th3hXHg8Il,Germany,German,2017-05-23T05:02:00,2017-05-23T05:02:00,927.0000000000,912.0000000000,2763.0000000000,,False
KolnBote,ASV in Müngersdorf : Knacki Deuser trainiert für die Leichtathletik Masters 2018 https://t.co/K78p6PzxqU https://t.co/UIf9LsTU6p,Germany,German,2017-05-23T06:08:00,2017-05-23T06:08:00,927.0000000000,912.0000000000,2764.0000000000,,False
KolnBote,Anklage: Baufirmen bestreiten Verantwortung für Kölner Archiveinsturz https://t.co/1oQhjsEKtG https://t.co/65MDSJLzrx,Germany,German,2017-05-23T10:08:00,2017-05-23T10:08:00,927.0000000000,911.0000000000,2767.0000000000,,False
KolnBote,Zusammenarbeit mit der Stadt beendet: Kölner Rad-Bündnis Ring-Frei platzt der Kragen https://t.co/aTsU73VpTF https://t.co/s0Aq1SZder,Germany,German,2017-05-23T11:08:00,2017-05-23T11:08:00,927.0000000000,911.0000000000,2769.0000000000,,False
KolnBote,Verkehr in Nippes: Gleich 23 Einbahnstraßen für Radfahrer beidseitig geöffnet https://t.co/0pvZjkbxDV https://t.co/1NTj1pvRGS,Germany,German,2017-05-23T12:02:00,2017-05-23T12:02:00,927.0000000000,911.0000000000,2770.0000000000,,False
KolnBote,Debatte: Stadt plant Wohnungscontainer für 400 Flüchtlinge in Holweide https://t.co/u9a6L7ZbPn https://t.co/Zpjb0ajXYg,Germany,German,2017-05-23T14:02:00,2017-05-23T14:02:00,927.0000000000,910.0000000000,2773.0000000000,,False
KolnBote,Junge in Köln-Porz angefahren: Mann schubst Kind nach Unfall und flieht https://t.co/F0qLwJDGWA https://t.co/AHLZtovTcW,Germany,German,2017-05-23T14:08:00,2017-05-23T14:08:00,927.0000000000,910.0000000000,2775.0000000000,,False
KolnBote,Vom Animateur zum Rapper: Moderator Amiaz Habtu machte sein Hobby zum Beruf https://t.co/5SjDHNbDTU https://t.co/jTzKD6xce6,Germany,German,2017-05-23T16:02:00,2017-05-23T16:02:00,927.0000000000,910.0000000000,2776.0000000000,,False
KolnBote,Kreisverkehr-Neubau: KVB-Busse der Linie 159 werden bis September umgeleitet https://t.co/yMy9TlwXZs https://t.co/QbRIUjpSMs,Germany,German,2017-05-23T17:02:00,2017-05-23T17:02:00,927.0000000000,910.0000000000,2777.0000000000,,False
KolnBote,Alternative zur Margarine: Kölns erster Pomade-Shop eröffnet https://t.co/U9klVSmmq7 https://t.co/rrvUgjVoHx,Germany,German,2017-05-23T19:08:00,2017-05-23T19:08:00,927.0000000000,909.0000000000,2780.0000000000,,False
KolnBote,Rheinenergie-Stadion: Ein Rasen würde dem Spiel gut tun ... https://t.co/4RCRRmuDQu https://t.co/JZx7rsYCGP,Germany,German,2017-05-23T20:08:00,2017-05-23T20:08:00,927.0000000000,909.0000000000,2781.0000000000,,False
KolnBote,Köln-Fühlingen: Schwerer Unfall – Motorradfahrer prallt auf Lkw https://t.co/JKYU4qXhKG https://t.co/KMgsJaOaxu,Germany,German,2017-05-23T21:08:00,2017-05-23T21:08:00,927.0000000000,909.0000000000,2782.0000000000,,False
KolnBote,Nach Manchester: Lanxess-Arena-Chef: „100-prozentige Sicherheit gibt es nicht“ https://t.co/FpowJMV7t5 https://t.co/zg2ntBkZZv,Germany,German,2017-05-24T05:02:00,2017-05-24T05:02:00,927.0000000000,909.0000000000,2785.0000000000,,False
KolnBote,„Viva con Agua“: Kölner Unilauf – Mit Kanister um den Aachener Weiher https://t.co/o0LqozyxK3 https://t.co/vKDiDfZRQc,Germany,German,2017-05-24T06:08:00,2017-05-24T06:08:00,927.0000000000,909.0000000000,2786.0000000000,,False
KolnBote,Stadion und Lanxess-Arena: Nach Spielschluss ist nicht jeder Ausgang gesichert https://t.co/iMqrnRJdOw https://t.co/mKM9ufvUzI,Germany,German,2017-05-24T08:08:00,2017-05-24T08:08:00,927.0000000000,909.0000000000,2788.0000000000,,False
KolnBote,Josef-Lammerting-Allee in Braunsfeld: Investor will Straße verschenken – Stadt zögert https://t.co/oDsLWZtSde https://t.co/TTNknmu1SY,Germany,German,2017-05-24T09:02:00,2017-05-24T09:02:00,927.0000000000,909.0000000000,2789.0000000000,,False
KolnBote,Venloer Straße/Kolkrabenweg: Leiche in Köln-Vogelsang entdeckt https://t.co/bJHUDoHOYU https://t.co/ePIBlhNa8t,Germany,German,2017-05-24T09:08:00,2017-05-24T09:18:00,927.0000000000,909.0000000000,2790.0000000000,,False
KolnBote,Fahrbahn für Radler auf Ring: Stadt will separate Fahrrad-Spur in Teilabschnitt testen https://t.co/oRR0vY8nmI https://t.co/NfiMXM0JAn,Germany,German,2017-05-24T10:08:00,2017-05-24T10:08:00,927.0000000000,909.0000000000,2792.0000000000,,False
KolnBote,Nach Einzug in Euro-League: 600 Quadratmeter FC-Rasen nach Platzsturm zerpflückt https://t.co/Kv19pfmvLg https://t.co/OuEi2D9xAJ,Germany,German,2017-05-24T12:02:00,2017-05-24T12:02:00,927.0000000000,910.0000000000,2793.0000000000,,False
KolnBote,Stadt Köln: Kosten für Silvester steigen – Mehr Geld an Sicherheitsfirmen https://t.co/SLL9jLMeCR https://t.co/gRdgmQiQzp,Germany,German,2017-05-24T12:08:00,2017-05-24T12:08:00,927.0000000000,910.0000000000,2795.0000000000,,False
KolnBote,Siegel nach Schließung entfernt: Besitzer vom „Büdchen 66“ vor Gericht https://t.co/HfUR2Jv8eF https://t.co/v7UATc5Uf9,Germany,German,2017-05-24T13:02:00,2017-05-24T13:03:00,927.0000000000,910.0000000000,2796.0000000000,,False
KolnBote,"Mit Messer, Kokain und Falschgeld: Bewaffneter „King“ am Amtsgericht festgenommen https://t.co/SIXFSdNcbW https://t.co/l3IWAlIdJ6",Germany,German,2017-05-24T14:02:00,2017-05-24T14:02:00,927.0000000000,910.0000000000,2798.0000000000,,False
KolnBote,Automaten geknackt: 15.000 Euro in Parkhäusern erbeutet – Bewährungsstrafe https://t.co/QLCFdYcX8q https://t.co/XFfCAiwYuW,Germany,German,2017-05-24T15:02:00,2017-05-24T15:02:00,927.0000000000,910.0000000000,2799.0000000000,,False
KolnBote,Unfall in Köln-Merkenich: Aufgebrachte Angehörige behindert Rettung von Schwerverletzem https://t.co/684gkAnEgE https://t.co/ARJiv1z8bh,Germany,German,2017-05-24T15:08:00,2017-05-24T15:08:00,927.0000000000,910.0000000000,2800.0000000000,,False
KolnBote,Jubiläum: Gebäude des Museums für Angewandte Kunst wird 60 Jahre alt https://t.co/vQGxUjAgsw https://t.co/6rTiSy3zkc,Germany,German,2017-05-24T16:02:00,2017-05-24T16:02:00,927.0000000000,909.0000000000,2801.0000000000,,False
KolnBote,Sanierung: Zieht das Römisch-Germanische Museum ins Modehaus an der Minoritenstraße? https://t.co/QRzJ62rpCY https://t.co/8StOAUXkTW,Germany,German,2017-05-24T18:08:00,2017-05-24T18:08:00,927.0000000000,909.0000000000,2804.0000000000,,False
KolnBote,Unfall auf Kreuz Köln-West: Lkw umgekippt – Zufahrt auf A1 Richtung Süden gesperrt https://t.co/qBn1MWd4Xe https://t.co/TMiDfN5Uk3,Germany,German,2017-05-24T20:02:00,2017-05-24T20:02:00,927.0000000000,909.0000000000,2805.0000000000,,False
KolnBote,Kölner Möbelfabrikant : Stadtmuseum sucht Pallenberg-Möbel für Digitalisierungsprojekt https://t.co/iUZXtMGfrb https://t.co/ehplw6HCbI,Germany,German,2017-05-24T20:08:00,2017-05-24T20:08:00,927.0000000000,909.0000000000,2806.0000000000,,False
KolnBote,Schokoladenmuseum Köln: Neue Ausstellung ist Zeitreise durch die Schokoladen-Geschichte https://t.co/gBhT7Oh5rC https://t.co/cJXZIX1fMu,Germany,German,2017-05-24T21:08:00,2017-05-24T21:08:00,927.0000000000,909.0000000000,2807.0000000000,,False
KolnBote,„Hau-den-Lukas“-Wettbewerb: Funktürme leuchten zum digitalen Hammerschlag https://t.co/DhrjZsnKRC https://t.co/KzzVe2RXzF,Germany,German,2017-05-24T23:02:00,2017-05-24T23:02:00,927.0000000000,909.0000000000,2808.0000000000,,False
KolnBote,Tödlicher Unfall in Köln: Fußgänger geht über Rot und wird von Taxi erfasst https://t.co/7atv94d6WV https://t.co/GQearpoiQ3,Germany,German,2017-05-25T08:02:00,2017-05-25T08:02:00,927.0000000000,909.0000000000,2809.0000000000,,False
KolnBote,„Jugend Rettet“ in Köln: Flüchtlingshilfe – Mutiger Einsatz auf dem Mittelmeer https://t.co/EmMDn5ebkL https://t.co/1lWQNpkXaa,Germany,German,2017-05-25T08:08:00,2017-05-25T08:08:00,927.0000000000,909.0000000000,2810.0000000000,,False
KolnBote,"Trickdiebstahl in der Innenstadt - Fahndungsfoto, Polizei bittet um Hilfe! https://t.co/XXWxGGCTZ0 https://t.co/faIN4HgCW7",Germany,German,2017-05-25T09:57:00,2017-05-25T09:57:00,927.0000000000,909.0000000000,2811.0000000000,,False
KolnBote,Bund Deutscher Architekten: Bessere Qualität bei neuen Schulbauten in Köln gefordert https://t.co/EvmDbLxXFy https://t.co/2SzD4Ok2xp,Germany,German,2017-05-25T10:08:00,2017-05-25T10:08:00,927.0000000000,910.0000000000,2812.0000000000,,False
KolnBote,Universitätsstraße : 51-Jähriger stirbt nach Unfall mit Taxi https://t.co/16gsaj6w6Z https://t.co/PgJWLbtXaE,Germany,German,2017-05-25T11:08:00,2017-05-25T11:08:00,927.0000000000,910.0000000000,2814.0000000000,,False
KolnBote,Kommentar zur Wallraf-Erweiterung: Bau ist überfällig und Geduld überstrapaziert https://t.co/8rSXqZC3Cl https://t.co/oEwiAkdCQ6,Germany,German,2017-05-25T12:08:00,2017-05-25T12:08:00,927.0000000000,910.0000000000,2815.0000000000,,False
KolnBote,Bahn in Köl. Keine Linie 11: Warum fehlen in Köln manche KVB-Linien?  https://t.co/5iS5pM7cJx https://t.co/qljuBLwc2K,Germany,German,2017-05-25T14:28:00,2017-05-25T14:28:00,927.0000000000,909.0000000000,2818.0000000000,,False
KolnBote,Interview mit Kölner Sozialarbeiter: Draußen Spielen – Kinder brauchen Raum und Impulse https://t.co/8dlrt6bxhZ https://t.co/NpYMugZ5KY,Germany,German,2017-05-25T16:28:00,2017-05-25T16:28:00,927.0000000000,909.0000000000,2819.0000000000,,False
KolnBote,Barfuß aus dem Haus geflüchtet: Sex-Video als Beweismittel vor Gericht https://t.co/6aOEqsNQhb https://t.co/lLJwE3eyps,Germany,German,2017-05-25T17:31:00,2017-05-25T17:31:00,927.0000000000,909.0000000000,2821.0000000000,,False
KolnBote,Verbindung zu mysteriösem Fall: Kinder finden erneut Leichenteile – Hinweise gesucht https://t.co/kHjPUW59SJ https://t.co/YaXS1aM4cU,Germany,German,2017-05-25T18:28:00,2017-05-25T18:28:00,927.0000000000,909.0000000000,2822.0000000000,,False
KolnBote,Messe in Deutz: „Game Of Thrones“-Darsteller bei „Role Play Convention“ https://t.co/xrsWOBJwEs https://t.co/bl5krOQRBj,Germany,English,2017-05-25T18:31:00,2017-05-25T18:31:00,927.0000000000,909.0000000000,2823.0000000000,,False
KolnBote,„Demenzionen“: Theaterstück für Senioren in Köln sucht noch Darsteller https://t.co/pI24KnI59i https://t.co/BnGFJX0xE9,Germany,German,2017-05-25T20:28:00,2017-05-25T20:28:00,927.0000000000,909.0000000000,2824.0000000000,,False
KolnBote,Luxemburger Straße: Mehr Sicherheit durch intelligente Ampeltechnik https://t.co/hJRjqVSeoJ https://t.co/467zud480O,Germany,German,2017-05-26T07:31:00,2017-05-26T07:31:00,927.0000000000,911.0000000000,2830.0000000000,,False
KolnBote,Hilferuf bei Facebook: Die Bar „Nachtigall“ in Ehrenfeld braucht 15.000 Euro https://t.co/5taP4GrGL7 https://t.co/K2nAuoW05F,Germany,German,2017-05-26T08:31:00,2017-05-26T08:31:00,927.0000000000,911.0000000000,2831.0000000000,,False
KolnBote,Mülheimer Süden: Entwicklung des „Cologneo I“ beginnt – Villa wird Kita https://t.co/bAMxR0jqcb https://t.co/mZazKvPeOO,Germany,German,2017-05-26T11:31:00,2017-05-26T11:31:00,927.0000000000,911.0000000000,2836.0000000000,,False
KolnBote,Prozessauftakt in Aachen - Wegen Knöllchen: Familie verletzen zehn Polizisten https://t.co/1dL3EdJKSC https://t.co/P9MFlFmEKy,Germany,German,2017-05-26T12:04:00,2017-05-26T12:05:00,927.0000000000,911.0000000000,2837.0000000000,,False
KolnBote,Sommer- und Sonnen-Fotos: Wie die Kölner das tolle Wetter genießen https://t.co/aVcY8zv3T1 https://t.co/QpBpcaNzKh,Germany,German,2017-05-26T12:31:00,2017-05-26T12:31:00,927.0000000000,910.0000000000,2838.0000000000,,False
KolnBote,Bürgergarde blau-gold: Ehrenpräsident Hans Wallpott auf dem Melatenfriedhof beigesetzt https://t.co/2cLnppurVj https://t.co/RljwCatg61,Germany,German,2017-05-26T13:31:00,2017-05-26T13:31:00,927.0000000000,910.0000000000,2840.0000000000,,False
KolnBote,Nach Manchester - Wasser-Verbot bei Rock am Ring https://t.co/QsB1A3xW2Q https://t.co/dLNnvKL2tc,Germany,German,2017-05-26T13:47:00,2017-05-26T13:47:00,927.0000000000,910.0000000000,2841.0000000000,,False
KolnBote,Abkühlung im Freibad: Naturbad Vingst öffnet am Wochenende https://t.co/6VlnCappqW https://t.co/o8NNuAuKEY,Germany,German,2017-05-26T15:02:00,2017-05-26T15:02:00,927.0000000000,909.0000000000,2842.0000000000,,False
KolnBote,Pfotenbruch beim Kuscheltier: Teddybärkrankenhaus an Kölner Uni-Klinik weiß zu helfen https://t.co/g8nCJ4kcwZ https://t.co/uV9pRAboWR,Germany,German,2017-05-26T16:03:00,2017-05-26T16:03:00,927.0000000000,909.0000000000,2844.0000000000,,False
KolnBote,Dressur- und Springturnier: Reitverein Oranjehof feiert 50-jähriges Bestehen https://t.co/LXZhzqEBBP https://t.co/OHF1xTB1gl,Germany,German,2017-05-26T17:02:00,2017-05-26T17:03:00,927.0000000000,908.0000000000,2845.0000000000,,False
KolnBote,Unfall in Köln-Bocklemünd: Radfahrerin prallt mit Reh zusammen – schwer verletzt https://t.co/g5AvLruqcj https://t.co/q6xubTv89g,Germany,German,2017-05-26T18:02:00,2017-05-26T18:02:00,927.0000000000,908.0000000000,2847.0000000000,,False
KolnBote,Container-Wache - Ich arbeite mit Kölns schönster Aussicht https://t.co/u66hg7a6PL https://t.co/A6RGemoXCx,Germany,German,2017-05-26T21:55:00,2017-05-26T21:55:00,927.0000000000,908.0000000000,2850.0000000000,,False
KolnBote,„Role Play Convention“: Fantasy-Alarm in Köln – Zehntausend Besucher erwartet https://t.co/NgWrNZG3As https://t.co/PJIiENvtIv,Germany,English,2017-05-27T07:20:00,2017-05-27T07:20:00,927.0000000000,908.0000000000,2852.0000000000,,False
KolnBote,Innenministerium: Köln ist Spitzenreiter in NRW bei rechten Straftaten https://t.co/3Yy6BJ2CWj https://t.co/6fRz4ZvYAF,Germany,German,2017-05-27T07:21:00,2017-05-27T07:21:00,927.0000000000,908.0000000000,2853.0000000000,,False
KolnBote,Camperin vergewaltigt - Polizei hielt Notruf von Freund für Scherz https://t.co/LIqIk7CqJc https://t.co/goEKKRVLhg,Germany,German,2017-05-27T11:10:00,2017-05-27T11:10:00,927.0000000000,908.0000000000,2855.0000000000,,False
KolnBote,Alternative zu Partys am Rhein: Zentrum für Jugendliche in Rodenkirchen soll kommen https://t.co/iECH78ouXb https://t.co/mhNPliHuZW,Germany,German,2017-05-27T12:21:00,2017-05-27T12:22:00,927.0000000000,908.0000000000,2857.0000000000,,False
KolnBote,Interview mit Preisträger Ilija Trojanow: „Die deutsche Sprache ist ein Geschenk“ https://t.co/chIt8T5yH8 https://t.co/TRcoCM9cwy,Germany,German,2017-05-27T15:21:00,2017-05-27T15:21:00,927.0000000000,908.0000000000,2860.0000000000,,False
KolnBote,"Peter Bergers satirischer Wochenrückblick: Kölle, du bist mehr als eine Nasszelle https://t.co/xCF06Q70qj https://t.co/prhkgJUCUk",Germany,German,2017-05-27T17:21:00,2017-05-27T17:21:00,927.0000000000,909.0000000000,2861.0000000000,,False
KolnBote,27-Millionen-Parkhaus wächst: Erste Autos sollen Messe-Gebäude im Herbst nutzen können https://t.co/RuUbRtGzBL https://t.co/3mAvE720SE,Germany,German,2017-05-28T05:20:00,2017-05-28T05:20:00,927.0000000000,911.0000000000,2864.0000000000,,False
KolnBote,Köln-Zollstock: 81-jähriger Autoknacker auf frischer Tat ertappt https://t.co/4BDCGNbj3R https://t.co/9Wk6Q3XjZB,Germany,German,2017-05-28T11:20:00,2017-05-28T11:20:00,927.0000000000,911.0000000000,2870.0000000000,,False
KolnBote,Ork trifft Transformers: Buntes Treiben auf der Kölner Role Play Convention https://t.co/DI1ktvkOAw https://t.co/H0gvy3v8nF,Germany,German,2017-05-28T12:21:00,2017-05-28T12:21:00,927.0000000000,911.0000000000,2872.0000000000,,False
KolnBote,Stadtmuseum sucht: Wer besitzt Möbel der Kölner Firma Heinr. Pallenberg? https://t.co/SFw8GDJynR https://t.co/ZpifTofYgK,Germany,German,2017-05-28T14:21:00,2017-05-28T14:21:00,927.0000000000,911.0000000000,2874.0000000000,,False
KolnBote,#Köln #Tiersuche Wo ist Kater Jack? Wir vermissen schmerzlich unseren Kater Jack. Er ist braun-schwarz marmoriert... https://t.co/Nz0e5Y6hAh https://t.co/YHjW893Htm,Germany,German,2017-05-28T15:44:00,2017-05-28T15:44:00,927.0000000000,911.0000000000,2876.0000000000,,False
KolnBote,Todesfall nach Widerstand - Obduktionsergebnis #Köln  https://t.co/Bipygjt1R8,Germany,German,2017-05-28T15:54:00,2017-05-28T15:54:00,927.0000000000,911.0000000000,2877.0000000000,,False
KolnBote,Strafanzeige gegen Fans: Drei Verletzte nach Ausschreitungen bei Viktoria-Spiel https://t.co/GIwMAxpVew https://t.co/IqR1aElxsp,Germany,German,2017-05-28T19:21:00,2017-05-28T19:21:00,927.0000000000,911.0000000000,2880.0000000000,,False
KolnBote,*** BILDplus Inhalt *** Psycho-Gutachten - Sex-Phantom soll nie mehr rauskommen https://t.co/35TczzsBua https://t.co/POLexP3EuW,Germany,German,2017-05-28T22:10:00,2017-05-28T22:10:00,927.0000000000,910.0000000000,2881.0000000000,,False
KolnBote,Als Teil einer 2028-Bewerbung: 1. FC Köln prüft Bau eines Olympiastadions https://t.co/FLv6Vpp58M https://t.co/it5LmBX0UE,Germany,German,2017-05-28T22:21:00,2017-05-28T22:21:00,927.0000000000,910.0000000000,2882.0000000000,,False
KolnBote,Archiveinsturz: Fotos belegen laut Staatsanwaltschaft das Versagen der Kontrolleure https://t.co/ecRIGlYr5m https://t.co/3VJU3d0V0J,Germany,German,2017-05-29T04:21:00,2017-05-29T04:21:00,927.0000000000,909.0000000000,2883.0000000000,,False
KolnBote,„Tattoo Bash“: 200 internationale Tätowierer auf Messe für Tattoos in Köln https://t.co/5qXkJbYI6R https://t.co/tb3iPafxqg,Germany,German,2017-05-29T06:20:00,2017-05-29T06:20:00,927.0000000000,909.0000000000,2884.0000000000,,False
KolnBote,Freibad: unerlaubtes Fotografieren führt zu Hausverbot #Köln https://t.co/C381TklgvW https://t.co/275nYiCjxb,Germany,German,2017-05-29T08:19:00,2017-05-29T08:21:00,927.0000000000,909.0000000000,2887.0000000000,,False
KolnBote,„Mashery Hummus Kitchen“: Erstes Hummus-Restaurant in Köln eröffnet https://t.co/jFkpriKETV https://t.co/Gi4pSipb1o,Germany,German,2017-05-29T09:21:00,2017-05-29T09:21:00,927.0000000000,909.0000000000,2888.0000000000,,False
