author_id,content,region,language,publish_date,harvested_date,following,followers,updates,post_type,retweet
KolnBote,Folge „Tanzmariechen“: Jecker „Tatort“ kommt im Februar https://t.co/BcKlp8xzmC https://t.co/H5W5s955PZ,Unknown,German,2017-01-12T16:45:00,2017-01-12T16:45:00,0E-10,0E-10,1.0000000000,,False
KolnBote,Arbeitsbühne in Schieflage: Höhenretter retten Arbeiter in der Kölner Flora https://t.co/mkZRRGuT9K https://t.co/9fTl0yMx4c,Germany,German,2017-01-12T16:46:00,2017-01-12T16:47:00,0E-10,0E-10,2.0000000000,,False
KolnBote,Platzsturm in Jülich - Anklage gegen neun Fußball-Schläger https://t.co/wrr848o0UV https://t.co/Uv0CWo3Jtq,Germany,German,2017-01-12T16:47:00,2017-01-12T16:47:00,0E-10,0E-10,3.0000000000,,False
KolnBote,Über Facebook gefunden - Unfall-Opfer bedankt sich bei seinem Retter https://t.co/unK0WIXJck https://t.co/c7LsObwdQ9,Germany,German,2017-01-12T18:09:00,2017-01-12T18:09:00,0E-10,0E-10,4.0000000000,,False
KolnBote,Auto im Gleisbett: Bergung beendet – Bahnen der Linie 18 fahren noch unregelmäßig https://t.co/qEWtbrlog6 https://t.co/gwrHHp8WFT,Germany,German,2017-01-12T19:40:00,2017-01-12T19:40:00,0E-10,0E-10,6.0000000000,,False
KolnBote,Luxemburger Str./Moselstraße: Auto fährt ins Gleisbett der KVB-Linie 18 https://t.co/o2dKpGZROe https://t.co/iWfpb7HAJR,Germany,German,2017-01-12T20:16:00,2017-01-12T20:16:00,0E-10,0E-10,7.0000000000,,False
KolnBote,„Fest in Gold“-Wettbewerb: Nachwuchs-Goldschmiede mit kreativen Karnevalsorden https://t.co/0CUDXiOxCB https://t.co/NtdCW68hDm,Germany,German,2017-01-12T22:16:00,2017-01-12T22:16:00,0E-10,0E-10,8.0000000000,,False
KolnBote,Kölner Zoo: Rosenmontagskind bei den Elefanten? https://t.co/wPPbxIRjHx https://t.co/kPLqSozvqa,Germany,German,2017-01-12T22:40:00,2017-01-12T22:40:00,0E-10,0E-10,9.0000000000,,False
KolnBote,*** BILDplus Inhalt *** „Hells Angels“ &amp; „Bandido“ - Bruderkrieg der Rocker https://t.co/nBepYtOcQU https://t.co/BfROvJyp36,Germany,German,2017-01-12T23:09:00,2017-01-12T23:09:00,0E-10,0E-10,10.0000000000,,False
KolnBote,Botanischer Garten: 35 Großpflanzen ziehen um https://t.co/OIgPkPgTgL https://t.co/8q3CtyqceK,Germany,German,2017-01-13T07:40:00,2017-01-13T07:40:00,0E-10,0E-10,12.0000000000,,False
KolnBote,Neuer Demo-Samstag: Rechte ziehen durch Deutz und Kalk – Verkehrsbehinderungen https://t.co/pgEGx71kAC https://t.co/m4len4x4Pp,Germany,German,2017-01-13T09:40:00,2017-01-13T09:40:00,0E-10,0E-10,15.0000000000,,False
KolnBote,Kein Schnee trotz „Egon“: So sah Köln früher im Winter aus https://t.co/MePMkfNwgQ https://t.co/W6VgCNPu9N,Germany,German,2017-01-13T12:16:00,2017-01-13T12:16:00,0E-10,0E-10,17.0000000000,,False
KolnBote,Kölner Hauptbahnhof: Franzose wollte Pizza mit Falschgeld bezahlen https://t.co/yej5qCSmMY https://t.co/CHrzyyX5Tp,Germany,German,2017-01-13T13:16:00,2017-01-13T13:16:00,0E-10,0E-10,20.0000000000,,False
KolnBote,Für den guten Zweck: Kardinal Woelki wertet alten VW auf https://t.co/MAHojh6RCj https://t.co/qvb2k8XhPV,Germany,German,2017-01-13T13:40:00,2017-01-13T13:40:00,0E-10,0E-10,21.0000000000,,False
KolnBote,Harmloses Tief „Egon”: Warum es in Köln doch nur nass ist https://t.co/XuOlorNrJB https://t.co/u9V1KkdGlY,Germany,German,2017-01-13T14:16:00,2017-01-13T14:16:00,0E-10,0E-10,23.0000000000,,False
KolnBote,Vergewaltiger haute ab - Freispruch für Pannen-Wärter https://t.co/ndomdO083w https://t.co/jeBXla5xAS,Germany,German,2017-01-13T15:09:00,2017-01-13T15:09:00,0E-10,0E-10,24.0000000000,,False
KolnBote,Kölner Dreigestirn: Köln feiert die „Pripro“ im Gürzenich mit 1300 Gästen https://t.co/9kJEg8dsq9 https://t.co/4dBLwDB0aB,Germany,German,2017-01-13T17:29:00,2017-01-19T19:04:00,0E-10,0E-10,27.0000000000,,False
KolnBote,Liveticker: Die Proklamation des Kölner Dreigestirns 2017 https://t.co/56MkKsggzv https://t.co/cGIsNjPrVS,Germany,German,2017-01-13T18:44:00,2017-01-13T18:44:00,0E-10,0E-10,28.0000000000,,False
KolnBote,Köln-Deutz: Neonazi-Demo und vier Gegenveranstaltungen sorgen für Behinderungen https://t.co/fBKXHGU71G https://t.co/bFlNqGnLRS,Germany,German,2017-01-13T19:46:00,2017-01-13T19:46:00,0E-10,0E-10,30.0000000000,,False
KolnBote,Loss mer swinge: Das „Big Kölsch Orchestra“ spielt „Swing op Kölsch“ https://t.co/ox8sMw1SEG https://t.co/snCGwvkdeo,Germany,German,2017-01-13T20:44:00,2017-01-13T20:44:00,0E-10,0E-10,31.0000000000,,False
KolnBote,"„Jung, aggressiv, alkoholisiert“: Experten sollen Vorkommnisse an Silvester klären https://t.co/78HbcgOM69 https://t.co/nXuEKFI2Cv",Germany,German,2017-01-13T21:44:00,2017-01-13T21:44:00,0E-10,0E-10,32.0000000000,,False
KolnBote,Proklamationsrede - Reker setzt Freud am Fiere gegen Angst und Terror https://t.co/EUzqmGcL7Y https://t.co/z1mWPTeuzz,Germany,German,2017-01-13T23:41:00,2017-01-13T23:41:00,0E-10,0E-10,34.0000000000,,False
KolnBote,„Kein Kind zurücklassen“: Köln nimmt künftig am Förderprogramm des Landes teil https://t.co/tbHUuQDmVk https://t.co/Hz37WRso9F,Germany,German,2017-01-14T08:44:00,2017-01-14T08:44:00,0E-10,0E-10,35.0000000000,,False
KolnBote,Kastrationspflicht: Stadt will unkontrollierte Vermehrung von Katzen eindämmen https://t.co/E9nKY2Fln9 https://t.co/KCMHm4Wjfb,Germany,German,2017-01-14T08:46:00,2017-01-14T08:46:00,0E-10,0E-10,36.0000000000,,False
KolnBote,Tierheim Dellbrück: Hündin Bonnie wurde beim Gassi gehen in Köln gestohlen https://t.co/l6ebTg9bFM https://t.co/rLtdZabhJf,Germany,German,2017-01-14T12:44:00,2017-01-14T12:46:00,0E-10,0E-10,39.0000000000,,False
KolnBote,Täter noch nicht gefasst - Taxifahrer (46) brutal überfallen https://t.co/aHxVjkJgxL https://t.co/HhXjYNlFaT,Germany,German,2017-01-14T13:41:00,2017-01-14T13:41:00,0E-10,0E-10,40.0000000000,,False
KolnBote,„Loss mer laache!“: Puppensitzung im Hänneschen begeistert das Publikum https://t.co/Oc53aylAOh https://t.co/AgOLVxvgAl,Germany,German,2017-01-14T13:44:00,2017-01-14T13:47:00,0E-10,0E-10,41.0000000000,,False
KolnBote,Köln-Stammheim: Frau von Auto erfasst – schwerverletzt https://t.co/ijmJ19xPDe https://t.co/9pSY1ECgkO,Germany,German,2017-01-14T19:46:00,2017-01-14T19:46:00,0E-10,0E-10,42.0000000000,,False
KolnBote,Strafanzeige bis Körperverletzung: Das geschah während den Demos in Deutz https://t.co/Df2IDi5I2k https://t.co/aT6dbtt3iE,Germany,German,2017-01-14T20:44:00,2017-01-14T20:44:00,0E-10,0E-10,43.0000000000,,False
KolnBote,Küchenbrand in Stammheim-Köln: Zwei Jugendliche gerettet – Wohnung unbewohnbar https://t.co/VGAk0RI6kn https://t.co/5mj5yrWTuO,Germany,German,2017-01-14T21:46:00,2017-01-14T21:46:00,0E-10,0E-10,45.0000000000,,False
KolnBote,Nach Anruf von Tochter: Feuerwehr Köln rettet Fernfahrer in Südfrankreich https://t.co/0JNSknjwS8 https://t.co/dria9CTGpI,Germany,German,2017-01-14T22:46:00,2017-01-14T22:46:00,0E-10,0E-10,46.0000000000,,False
KolnBote,Kölner Flora: Der Umzug der großen Bäume beginnt https://t.co/Obl3eVUtZ1 https://t.co/kklatpC7Og,Germany,German,2017-01-15T08:46:00,2017-01-15T08:46:00,0E-10,0E-10,47.0000000000,,False
KolnBote,Tote Frau in Köln-Buchheim: 19-Jährige wurde vom Vater im Auto erstochen https://t.co/zF8c8TZGuu https://t.co/2H4tuasPhi,Germany,German,2017-01-15T09:44:00,2017-01-15T09:44:00,0E-10,0E-10,48.0000000000,,False
KolnBote,Landung in Kuwait: Eurowings-Maschine nach Köln wegen Bombendrohung umgeleitet https://t.co/teidTCQI6n https://t.co/BB9Bc3trei,Germany,German,2017-01-15T09:46:00,2017-01-15T09:46:00,0E-10,0E-10,49.0000000000,,False
KolnBote,Bombendrohung im Flugzeug: Eurowings-Maschine nach Köln in Kuwait notgelandet https://t.co/8i9GBWk8A1 https://t.co/fJX9O5fJ37,Germany,German,2017-01-15T10:44:00,2017-01-15T10:44:00,0E-10,0E-10,50.0000000000,,False
KolnBote,Attacke in Bonn - Hund biss Pegah (27) ins Gesicht https://t.co/TRn1D9buWm https://t.co/AT4Vs78RLz,Germany,German,2017-01-15T11:41:00,2017-01-15T11:41:00,500.0000000000,1.0000000000,51.0000000000,,False
KolnBote,Entwarnung: Eurowings-Maschine nach Bombendrohung in Kuwait gelandet https://t.co/nNBp2MIadK https://t.co/gnIAJAplg5,Germany,German,2017-01-15T13:44:00,2017-01-15T13:44:00,499.0000000000,4.0000000000,54.0000000000,,False
KolnBote,*** BILDplus Inhalt *** Einstein-Schauspieler - Danach ist Tom Beck (38) süchtig https://t.co/UPHLrnHRxx https://t.co/W230ptImcl,Germany,German,2017-01-15T14:41:00,2017-01-15T14:41:00,498.0000000000,5.0000000000,56.0000000000,,False
KolnBote,In Frankreich - Geniale Idee rettet Kölner Trucker https://t.co/I1HIdwZj8P https://t.co/l8XfikYdrk,Germany,German,2017-01-15T16:41:00,2017-01-15T16:41:00,498.0000000000,7.0000000000,58.0000000000,,False
KolnBote,Takulauf in Köln-Ehrenfeld: Ein bisschen laufen und plauschen https://t.co/mWbvQjuBlk https://t.co/Vpn0yMteH2,Germany,German,2017-01-15T18:46:00,2017-01-15T18:49:00,498.0000000000,8.0000000000,60.0000000000,,False
KolnBote,1400 Polizisten in Köln: Rechte brechen Demo in Deutz vorzeitig ab https://t.co/KU667dDXX6 https://t.co/sflNXoJOHo,Germany,German,2017-01-15T19:44:00,2017-01-15T19:51:00,498.0000000000,11.0000000000,61.0000000000,,False
KolnBote,„1. Lachende Pänzarena” - Kölner Kinder erklären den Karneval https://t.co/sA1rkM3blW https://t.co/VPZ6Xub4s6,Germany,German,2017-01-15T22:41:00,2017-01-15T22:41:00,498.0000000000,12.0000000000,63.0000000000,,False
KolnBote,Umzug des Großmarkts: Statt Ergebnisse: Zahlreiche Pannen und gescheiteter Zeitplan https://t.co/Zmh9ldNdbz https://t.co/8901Y0djEt,Germany,German,2017-01-16T06:46:00,2017-01-16T06:46:00,498.0000000000,12.0000000000,64.0000000000,,False
KolnBote,„Öm de Alteburch eröm“: Motto für den Geisterzug steht fest https://t.co/fxUWIi2Y2G https://t.co/jDpfs69sar,Germany,German,2017-01-16T07:46:00,2017-01-16T07:46:00,498.0000000000,12.0000000000,65.0000000000,,False
KolnBote,Schutz für Tier und Mensch: Sicherheit im Kölner Zoo https://t.co/51aITvpaH6 https://t.co/ZGn2FexgXx,Germany,German,2017-01-16T08:44:00,2017-01-16T08:44:00,498.0000000000,12.0000000000,66.0000000000,,False
KolnBote,Straßensperrungen zu erwarten: Mehrere Ampeln am Barbarossaplatz in Köln ausgefallen https://t.co/aYteDPS444 https://t.co/Yz0yrYN3AU,Germany,German,2017-01-16T08:46:00,2017-01-16T08:46:00,498.0000000000,12.0000000000,67.0000000000,,False
KolnBote,Kölner Karneval: Pferde im Zoch standen vereinzelt unter Beruhigungsmitteln https://t.co/Ji4TvI91kd https://t.co/7hfeDIZRlG,,German,2017-01-16T10:46:00,2017-01-16T10:49:00,498.0000000000,13.0000000000,68.0000000000,,False
KolnBote,Lachende Pänz-Arena: 3000 kleine Gäste bei der Premiere https://t.co/WCtoOj91rU https://t.co/Ym86choJ2V,Germany,German,2017-01-16T12:44:00,2017-01-16T12:44:00,498.0000000000,15.0000000000,71.0000000000,,False
KolnBote,Täter entkam im Mercedes - Kölner (41) in den Oberkörper geschossen https://t.co/TpDC4txhLH https://t.co/TOekUDrg5X,Germany,German,2017-01-16T13:41:00,2017-01-16T13:41:00,498.0000000000,15.0000000000,73.0000000000,,False
KolnBote,Angriff in Kalk: Kölner in Auto angeschossen https://t.co/wojVJaG2sh https://t.co/lkundBXPax,Germany,German,2017-01-16T13:46:00,2017-01-16T13:46:00,498.0000000000,15.0000000000,75.0000000000,,False
KolnBote,Tierischer Deckungsakt - Läufige Hündin Fall fürs Gericht https://t.co/CaF2a2ukWd https://t.co/72AhRjBqiu,Germany,German,2017-01-16T16:41:00,2017-01-16T16:41:00,498.0000000000,16.0000000000,78.0000000000,,False
KolnBote,"Körnerstraße in Ehrenfeld: Hip oder nicht hip, das ist nicht die Frage https://t.co/M3FESF9cJz https://t.co/fRUjKLmQaC",Germany,German,2017-01-16T16:46:00,2017-01-16T16:46:00,498.0000000000,16.0000000000,79.0000000000,,False
KolnBote,TV-Quoten: Kölner „Pripro“ trotzt dem „Dschungelcamp“ https://t.co/7xVO9kgSlH https://t.co/FZ9UG1Oo66,Germany,German,2017-01-16T17:44:00,2017-01-16T17:44:00,498.0000000000,16.0000000000,80.0000000000,,False
KolnBote,Live-Stream: Angela Merkel spricht beim IHK-Neujahrsempfang in Köln https://t.co/TvrFocc1YZ https://t.co/nZDgWJUmMF,Germany,German,2017-01-16T18:46:00,2017-01-16T18:46:00,498.0000000000,16.0000000000,81.0000000000,,False
KolnBote,„Geliebte Möbel“ in Köln-Lindenthal: Clubsessel sollen zusammen mit dem Kunden altern https://t.co/Zs9aQoN7D4 https://t.co/pYnewiAhXd,Germany,German,2017-01-16T21:46:00,2017-01-16T21:46:00,498.0000000000,14.0000000000,83.0000000000,,False
KolnBote,1. Rede beim IHK-Empfang - Prinz durfte Kanzlerin nicht bützen https://t.co/S5XDOnA1fW https://t.co/5799UecbHp,Germany,German,2017-01-16T22:41:00,2017-01-16T22:41:00,498.0000000000,14.0000000000,84.0000000000,,False
KolnBote,Notklassen: Stadt stellt 57 Container an Kölner Schulen auf https://t.co/DhDrzAnHlZ https://t.co/jWUslfTCvX,Germany,German,2017-01-17T05:46:00,2017-01-17T05:46:00,498.0000000000,13.0000000000,85.0000000000,,False
KolnBote,Flüchtlingsunterkunft in Weiden: Ehemaliges Weidenbad wird Heim für 160 Flüchtlinge https://t.co/Yr9Ik9RU4y https://t.co/tRelTT5R4e,Germany,German,2017-01-17T07:46:00,2017-01-17T07:46:00,498.0000000000,13.0000000000,88.0000000000,,False
KolnBote,"Martina Kratz: Über Jura, Moderation im Gefängnis und ein weibliches Dreigestirn https://t.co/Vj2Xo0VWCG https://t.co/VUyIPJyJLX",Germany,German,2017-01-17T08:44:00,2017-01-17T08:44:00,498.0000000000,13.0000000000,89.0000000000,,False
KolnBote,Kommentar zum Rheinparkcafé: Das Thema verschlafen https://t.co/ZSsdWNRjU2 https://t.co/4wGHSuXPqS,Germany,German,2017-01-17T09:44:00,2017-01-17T09:44:00,498.0000000000,13.0000000000,90.0000000000,,False
KolnBote,Ampelausfall: Stockender Verkehr auf der Inneren Kanalstraße https://t.co/uDhQT7ccA5 https://t.co/E8ZXZd5RqC,Germany,German,2017-01-17T09:46:00,2017-01-17T09:46:00,498.0000000000,13.0000000000,91.0000000000,,False
KolnBote,Laut einer Studie des ADAC - NRW ist Deutschlands schlimmste Stau-Stelle https://t.co/Hzg2k1z4yH https://t.co/GUCteUxGET,Germany,German,2017-01-17T10:41:00,2017-01-17T10:41:00,498.0000000000,13.0000000000,92.0000000000,,False
KolnBote,Sicherheitsdebatte: Anträge auf kleinen Waffenschein in Köln haben sich verzehnfacht https://t.co/v4tW2qqv6H https://t.co/bW4CNAmi6x,Germany,German,2017-01-17T10:46:00,2017-01-17T11:05:00,498.0000000000,13.0000000000,93.0000000000,,False
KolnBote,Schlag gegen Rauschgiftkriminalität: Razzia in Köln – Polizei nimmt Drogenbande fest https://t.co/cT8msh6Ckz https://t.co/xSkCs8Yhka,Germany,German,2017-01-17T11:44:00,2017-01-17T11:54:00,498.0000000000,13.0000000000,95.0000000000,,False
KolnBote,Kölner Hohe Straße: Modehaus Jacobi schließt nach 120 Jahren https://t.co/lGa3rExaqX https://t.co/nAZY468dq0,Germany,German,2017-01-17T11:46:00,2017-01-17T11:46:00,498.0000000000,13.0000000000,96.0000000000,,False
KolnBote,Party im E-Werk: Kölner Popkulturmagazin „Intro“ feiert 25. Geburtstag https://t.co/b3mpBVymeT https://t.co/UJkCa1DDjY,Germany,German,2017-01-17T13:44:00,2017-01-17T13:44:00,498.0000000000,14.0000000000,99.0000000000,,False
KolnBote,Handel mit Marihuana und Kokain: Polizei nimmt Mitglieder einer Drogenbande fest https://t.co/iNcyCJl8EH https://t.co/L3K4qSOloH,Germany,German,2017-01-17T13:46:00,2017-01-17T13:46:00,498.0000000000,14.0000000000,100.0000000000,,False
KolnBote,Tanzpaarwahl 2017: Kölns Tanzpaare stellen sich zur Wahl – Mitmachen und gewinnen! https://t.co/3njE7EYRtg https://t.co/BKUyeQBi5N,Germany,German,2017-01-17T15:44:00,2017-01-17T15:46:00,498.0000000000,14.0000000000,102.0000000000,,False
KolnBote,Gastronomie: Rheinparkcafé soll 2018 wieder eröffnen https://t.co/ujvuHqTyfk https://t.co/ixDpSxxhGp,Germany,German,2017-01-17T15:46:00,2017-01-17T15:46:00,498.0000000000,14.0000000000,103.0000000000,,False
KolnBote,3. Tanzpaar: Nippeser Bürgerwehr https://t.co/MSpFDSDiMC https://t.co/gjLgTa6xuG,Germany,German,2017-01-17T16:44:00,2017-01-17T16:55:00,498.0000000000,16.0000000000,104.0000000000,,False
KolnBote,Rettungsdienst: Köln will Auftrag für Notfall-Transporte europaweit ausschreiben https://t.co/X4OBYtKUhs https://t.co/8H4vv3okx7,Germany,German,2017-01-17T16:46:00,2017-01-17T16:47:00,498.0000000000,16.0000000000,105.0000000000,,False
KolnBote,Innerer Grüngürtel: Die „Kleine Alhambra“ verkommt und keiner kümmert sich darum https://t.co/UoYiodZR77 https://t.co/34S4JGxNB4,Germany,German,2017-01-17T18:18:00,2017-01-17T18:18:00,498.0000000000,16.0000000000,106.0000000000,,False
KolnBote,Hausbesitzer-Schrecken - Dieser Opa ist König der Einbrecher https://t.co/HJdMiyBxJd https://t.co/yTfmmdmxqG,Germany,German,2017-01-17T18:37:00,2017-01-17T18:37:00,498.0000000000,16.0000000000,108.0000000000,,False
KolnBote,Nippeser Bürgermeister im Interview: „Wir warten auf den Lift an der Haltestelle“ https://t.co/sFI4ttKix7 https://t.co/hA7hSzkVj0,Germany,German,2017-01-17T20:18:00,2017-01-17T20:18:00,498.0000000000,16.0000000000,109.0000000000,,False
KolnBote,Neuebaugebiet Rondorf Nord-West: Bürger fordern vernünftige Verkehrsinfrastruktur https://t.co/SdN24Efmg6 https://t.co/RLCQo8m5RF,Germany,German,2017-01-17T21:22:00,2017-01-17T21:22:00,498.0000000000,16.0000000000,110.0000000000,,False
KolnBote,*** BILDplus Inhalt *** 1500 Euro auf die Hand - Drogenboss zahlte Dealern Festgehalt https://t.co/QYmcXNVVBx https://t.co/FHXTmGRQ9d,Germany,German,2017-01-17T23:40:00,2017-01-17T23:40:00,498.0000000000,16.0000000000,112.0000000000,,False
KolnBote,Vorfall in der S6: Kontrolleur soll Fahrgast bewusstlos geschlagen haben https://t.co/BGNkq1Rwsh https://t.co/oQsgDpKe8J,Germany,German,2017-01-18T05:26:00,2017-01-18T05:26:00,498.0000000000,16.0000000000,114.0000000000,,False
KolnBote,Kommentar: zu Schulbau und Containern https://t.co/tMzgBBwfF7 https://t.co/Fh3PuNbKtE,Germany,German,2017-01-18T06:52:00,2017-01-18T06:52:00,498.0000000000,16.0000000000,115.0000000000,,False
KolnBote,SEK-Einsatz in Köln: Festnahme in Neuehrenfeld – 42-Jähriger wird abgeschoben https://t.co/KJzb9A2zak https://t.co/W0q3qrspm4,Germany,German,2017-01-18T08:52:00,2017-01-18T08:52:00,498.0000000000,15.0000000000,117.0000000000,,False
KolnBote,Mann in Abschiebehaft - SEK nimmt Gefährder in Kölner Innenstadt fest https://t.co/7Mv9VrS0ND https://t.co/Hniz2BAs9n,Germany,German,2017-01-18T08:54:00,2017-01-18T08:54:00,498.0000000000,15.0000000000,118.0000000000,,False
KolnBote,Winter in Köln: Trotz anhaltendem Frost – Stadt warnt vor zugefrorenen Seen https://t.co/8YWzryrYu0 https://t.co/0MzY0GsS0D,Germany,German,2017-01-18T09:26:00,2017-01-18T09:26:00,498.0000000000,15.0000000000,119.0000000000,,False
KolnBote,Lösungen für Rätselrater: Kölns schwierigstes Rätsel 2016 https://t.co/joilR7HreR https://t.co/soHaBUomTa,Germany,German,2017-01-18T10:26:00,2017-01-18T10:26:00,498.0000000000,15.0000000000,120.0000000000,,False
KolnBote,TV-Fahndung: Verbrechen an 98-Jährigem aus Dellbrück bei „Aktenzeichen XY ungelöst“ https://t.co/atoMsKDqcW https://t.co/aBc2kriiym,Germany,German,2017-01-18T10:52:00,2017-01-18T11:06:00,498.0000000000,15.0000000000,121.0000000000,,False
KolnBote,Schwerer Unfall in Bonn - Fahranfänger (18) bezahlt Crash fast mit Leben https://t.co/xr5t8otKSc https://t.co/53BqLEF9CL,Germany,German,2017-01-18T10:54:00,2017-01-18T10:54:00,498.0000000000,15.0000000000,122.0000000000,,False
KolnBote,Aktenzeichen XY: Rätsel um getöteten Kölner Rentner https://t.co/43k8BCdF68 https://t.co/gbOnToLlAb,Germany,German,2017-01-18T12:37:00,2017-01-18T12:37:00,498.0000000000,15.0000000000,124.0000000000,,False
KolnBote,Am Kreisverkehr - Unbekannte überfährt Hund mit Absicht – tot! https://t.co/hk1NW2ZJyq https://t.co/sJ6if1JvVS,Germany,German,2017-01-18T14:59:00,2017-01-18T14:59:00,498.0000000000,15.0000000000,127.0000000000,,False
KolnBote,Unfall in Rath/Heumar: Autofahrer übersieht Fußgängerin – schwer verletzt https://t.co/eZHwdrSJbv https://t.co/onhaDMTmYZ,Germany,German,2017-01-18T15:37:00,2017-01-18T15:38:00,498.0000000000,15.0000000000,129.0000000000,,False
KolnBote,Rodenkirchen: Illegales Parken auf Geh- und Radwegen soll ein Ende haben https://t.co/XUF7KSc0LO https://t.co/MQ5sJHGSP4,Germany,German,2017-01-18T16:37:00,2017-01-18T16:46:00,498.0000000000,15.0000000000,130.0000000000,,False
KolnBote,Mordkommission aufgelöst - Wird Doro (29) niemals gefunden? https://t.co/jrkfBEVDhB https://t.co/ow6EEW1Q2P,Germany,German,2017-01-18T17:59:00,2017-01-18T18:08:00,498.0000000000,15.0000000000,132.0000000000,,False
KolnBote,Prozessauftakt - 15-Jährige von Barkeeper vergewaltigt? https://t.co/1ijVDiht72 https://t.co/PdIAP8yIUY,Germany,German,2017-01-18T18:59:00,2017-01-18T19:07:00,498.0000000000,15.0000000000,133.0000000000,,False
KolnBote,HRS-Statistik: Kölner Hotels erhöhen Preise zu Karneval kräftig https://t.co/9FZtBYqEW8 https://t.co/TUwVd5lHsZ,Germany,German,2017-01-18T19:37:00,2017-01-18T19:37:00,498.0000000000,15.0000000000,134.0000000000,,False
KolnBote,*** BILDplus Inhalt *** Silvester-Lagebericht - Wachmann gehört zum Terror-Umfeld https://t.co/U0KIWSMDHF https://t.co/GiwQuoona1,Germany,German,2017-01-18T23:59:00,2017-01-19T00:00:00,498.0000000000,16.0000000000,135.0000000000,,False
KolnBote,Vorletzter Platz in landesweiter Statistik: Kölner Polizisten stehen oft im Stau https://t.co/N5CfAT1slA https://t.co/RT2lGro07k,Germany,German,2017-01-19T05:37:00,2017-01-19T05:37:00,498.0000000000,16.0000000000,136.0000000000,,False
KolnBote,Berufsverkehr-Statistik: Rund 315.000 Pendler strömen jeden Tag nach Köln https://t.co/rpTgEz9GbP https://t.co/OqsBDgPaXY,Germany,German,2017-01-19T06:37:00,2017-01-19T06:37:00,498.0000000000,16.0000000000,138.0000000000,,False
KolnBote,„Invasoren mit Napalm verbrennen“: 76-Jähriger nach Hass-Einträgen freigesprochen https://t.co/zg4rMkaTLc https://t.co/fqGfWqWfby,Germany,German,2017-01-19T06:37:00,2017-01-19T06:37:00,498.0000000000,16.0000000000,137.0000000000,,False
KolnBote,Helios-Gelände: Club und Bar sind erster Schritt zum provisorischen Kulturbaustein https://t.co/7tZlCwxFdL https://t.co/S0dIJwYajm,Germany,German,2017-01-19T07:37:00,2017-01-19T07:37:00,498.0000000000,16.0000000000,139.0000000000,,False
KolnBote,Aufzeichnung der ZDF-Karnevalssitzung: Wieder ein Redner böse ausgepfiffen https://t.co/K3ICadZDt4 https://t.co/qNyRhtT5eN,Germany,German,2017-01-19T08:37:00,2017-01-19T08:37:00,498.0000000000,16.0000000000,140.0000000000,,False
KolnBote,Einkaufen in Sülz: Aus Kaiser’s wird eine neue Filiale von Netto https://t.co/AfB56Y8R0d https://t.co/a32qkYBPKL,Germany,German,2017-01-19T10:37:00,2017-01-19T10:37:00,498.0000000000,17.0000000000,143.0000000000,,False
KolnBote,Kommentar: Der Großrechner für Ampelanlagen ist ein Lichtblick https://t.co/DneTIhnTIw https://t.co/5s1yrs9IcV,Germany,German,2017-01-19T11:37:00,2017-01-19T11:37:00,498.0000000000,17.0000000000,144.0000000000,,False
KolnBote,Verwaltung will europaweit ausschreiben: Stadt Köln sieht Rettungsdienst gefährdet https://t.co/wY8ayA8CHK https://t.co/mAIMrDMCSF,Germany,German,2017-01-19T13:37:00,2017-01-19T13:37:00,498.0000000000,15.0000000000,147.0000000000,,False
KolnBote,Neuzugang im Zoo: Tiger Sergan hat in Köln ein neues Zuhause gefunden https://t.co/HPvi6BSQiu https://t.co/xGBYG4wAh1,Germany,German,2017-01-19T14:37:00,2017-01-19T14:37:00,498.0000000000,16.0000000000,150.0000000000,,False
KolnBote,Neuzugang: „Sergan“ tigert nun durch den Kölner Zoo https://t.co/vdcHzoJMB1 https://t.co/mt5fosD6qj,Germany,German,2017-01-19T14:37:00,2017-01-19T14:37:00,498.0000000000,16.0000000000,149.0000000000,,False
KolnBote,Tote (19) lag in Garage - Vater der Ermordeten soll in den Irak geflohen sein https://t.co/4WDwr2Z2i2 https://t.co/Fe6Xf61RS8,Germany,German,2017-01-19T14:59:00,2017-01-19T14:59:00,507.0000000000,16.0000000000,151.0000000000,,False
KolnBote,Kommentar zur KVB-Linie 1: Eine Verlängerung wäre die Lösung für viele Probleme https://t.co/qHwbhuPBTk https://t.co/nfPhpwBh8G,Germany,German,2017-01-19T16:37:00,2017-01-19T16:39:00,507.0000000000,16.0000000000,154.0000000000,,False
KolnBote,Unfall auf Melatengürtel: Linie 13 stößt mit Pkw zusammen – Bahnbetrieb eingestellt https://t.co/RHf7F5ILuZ https://t.co/SAQXHM19n6,Germany,German,2017-01-19T17:37:00,2017-01-19T17:38:00,982.0000000000,18.0000000000,155.0000000000,,False
KolnBote,Zwei Verletzte: Pkw stößt in Ehrenfeld mit KVB-Bahn zusammen https://t.co/Df0VpcNS7M https://t.co/MNf12EBPxn,Germany,German,2017-01-19T19:37:00,2017-01-19T19:37:00,982.0000000000,20.0000000000,157.0000000000,,False
KolnBote,Falsche Opfer ausgesucht - Karnevals-Prinz schnappte Autoknacker https://t.co/r5f9CAyrTJ https://t.co/7bvwG8Ihhf,Germany,German,2017-01-19T19:59:00,2017-01-19T20:00:00,982.0000000000,21.0000000000,158.0000000000,,False
KolnBote,*** BILDplus Inhalt *** Neue Ermittlungsdetails - Rockerpaar betrog auch bei Hartz IV https://t.co/ofNdSfqMUQ https://t.co/V5wQHbcp7w,Germany,German,2017-01-19T22:59:00,2017-01-19T23:09:00,980.0000000000,25.0000000000,160.0000000000,,False
KolnBote,Digitales: Kongress „cologne IT summit“ will den Mittelstand informieren https://t.co/f7FrFR73eO https://t.co/9eXFPvMtz6,Germany,English,2017-01-20T06:37:00,2017-01-20T06:37:00,980.0000000000,26.0000000000,161.0000000000,,False
KolnBote,Ehrenfelder Zentral-Moschee: Offener Streit zwischen Beirat und Ditib ausgebrochen https://t.co/079sVGP0xy https://t.co/foHYqVSlBN,Germany,German,2017-01-20T06:37:00,2017-02-13T10:41:00,980.0000000000,26.0000000000,162.0000000000,,False
KolnBote,Tod von Niklas - Prozess um Prügelattacke beginnt https://t.co/qxcMdAMSOB https://t.co/NRhlAtYX2x,Germany,German,2017-01-20T06:59:00,2017-01-20T06:59:00,980.0000000000,26.0000000000,163.0000000000,,False
KolnBote,Leichenfund in Buchheim: Tatverdächtiger Vater befindet sich offenbar im Irak https://t.co/86UPXVglnC https://t.co/kKPfdOdAdf,Germany,German,2017-01-20T07:37:00,2017-01-20T07:37:00,980.0000000000,26.0000000000,165.0000000000,,False
KolnBote,Drogensumpf Neumarkt - Stadt findet kein Haus für Junkies https://t.co/5K1vC9WbnC https://t.co/jjk1qbgUiR,Germany,German,2017-01-20T07:59:00,2017-01-20T08:10:00,980.0000000000,27.0000000000,166.0000000000,,False
