author_id,content,region,language,publish_date,harvested_date,following,followers,updates,post_type,retweet
KolnBote,4500 Euro Strafe: Prozess um Fahrlässige Tötung in Köln https://t.co/8l6U2I7KmJ https://t.co/dBZNn8HNnq,Germany,German,2017-03-20T20:10:00,2017-03-20T20:10:00,4308.0000000000,676.0000000000,1354.0000000000,,False
KolnBote,"AfD-Parteitag im Maritim: Streit zwischen Bündnissen, die zum Protest aufrufen https://t.co/3Wj7CW3dXm https://t.co/kqlO1l6rql",Germany,German,2017-03-20T20:10:00,2017-03-20T20:10:00,4308.0000000000,676.0000000000,1355.0000000000,,False
KolnBote,Nach tödlichem Unfall: Autofahrer zu Geldstrafe und einmonatigen Fahrverbot verurteilt... https://t.co/djlntpJ75z https://t.co/6uI8kvonBK,Germany,German,2017-03-20T22:10:00,2017-03-20T22:11:00,4308.0000000000,681.0000000000,1357.0000000000,,False
KolnBote,Vom Zug überfahren - Gedenk-Altar für toten Polizisten https://t.co/nAQ0d5Gxg3 https://t.co/WIxSx5R3ui,Germany,German,2017-03-20T22:43:00,2017-03-20T22:43:00,4308.0000000000,683.0000000000,1358.0000000000,,False
KolnBote,"Mein Kollege, der Rassist: Kölner Gericht urteilt über Fremdenhass am Arbeitsplatz https://t.co/B11eAgFrxW https://t.co/AqDVaeV0AG",Germany,German,2017-03-21T07:10:00,2017-03-21T07:10:00,4308.0000000000,685.0000000000,1361.0000000000,,False
KolnBote,Handy am Steuer: Polizei kontrolliert am Dienstag verstärkt auf Autobahnen https://t.co/qhX9y4aTFt https://t.co/d8liZY9oiE,Germany,German,2017-03-21T08:10:00,2017-03-21T08:10:00,4308.0000000000,686.0000000000,1363.0000000000,,False
KolnBote,Kölnmesse: Zahngesundheit – das größte Branchentreffen wartet mit viel Hightech auf https://t.co/li7TPdAbrF https://t.co/767jOBRUgK,Germany,German,2017-03-21T09:10:00,2017-03-21T09:10:00,4306.0000000000,685.0000000000,1364.0000000000,,False
KolnBote,NS-Dokumentationszentrum: Neuer Besucher-Rekord – Escape-Room soll Demokratie erklären... https://t.co/NN3DbRX8Kb https://t.co/ZCyidP0nZe,Germany,German,2017-03-21T09:10:00,2017-03-21T09:10:00,4306.0000000000,685.0000000000,1365.0000000000,,False
KolnBote,Konzerte: Ed Sheeran und Broilers – zusätzliche Bahnen bringen Fans zur Lanxess Arena https://t.co/F6yHW5KzDL https://t.co/JmXbbpsJ07,Germany,German,2017-03-21T10:10:00,2017-03-21T10:10:00,4306.0000000000,685.0000000000,1366.0000000000,,False
KolnBote,Kommentar zum Elefantenbaby Moma: Bulle im Kölner Zoo heißt wie eine Fernsehsendung https://t.co/blMSRaqXEt https://t.co/DWZi2sZB0c,Germany,German,2017-03-21T10:10:00,2017-03-21T10:10:00,4306.0000000000,685.0000000000,1367.0000000000,,False
KolnBote,Prozess in Köln - Hier sitzen Rocker auf der Anklagebank https://t.co/wyTtG1cepB https://t.co/CAcSx5LGfY,Germany,German,2017-03-21T12:43:00,2017-03-21T12:43:00,4441.0000000000,688.0000000000,1371.0000000000,,False
KolnBote,"Mit 3,9 Promille! - Betrunkener taumelt gegen parkendes Auto https://t.co/jqsdNLge8o https://t.co/k7SFoTNQzU",Germany,German,2017-03-21T13:43:00,2017-03-21T13:43:00,4440.0000000000,692.0000000000,1373.0000000000,,False
KolnBote,Hells Angels: Bandenmitglieder wegen unzähliger krimineller Machenschaften angeklagt https://t.co/XKFhFQ9NJN https://t.co/6sqJHNbbZY,Germany,German,2017-03-21T15:10:00,2017-03-21T15:10:00,4439.0000000000,692.0000000000,1375.0000000000,,False
KolnBote,Protest in Köln: Eltern und Kinder demonstrieren gegen Kölner Schulnotstand https://t.co/qC1CSuVqYn https://t.co/niODNNoiIj,Germany,German,2017-03-21T17:10:00,2017-03-21T17:10:00,4439.0000000000,697.0000000000,1379.0000000000,,False
KolnBote,"Konzert: Fünf Gründe, warum Superstar Ed Sheeran sich in Köln wohl fühlen wird https://t.co/A9DEzVKAV7 https://t.co/cq5T64LpjM",Germany,German,2017-03-21T18:10:00,2017-03-21T18:10:00,4439.0000000000,698.0000000000,1380.0000000000,,False
KolnBote,Prozess wegen Drogenbesitz: Erster Verhandlungstag gegen Hells-Angels in Köln https://t.co/NXEIAJHHCG https://t.co/dd2M9B0DbA,Germany,German,2017-03-21T19:10:00,2017-03-21T19:10:00,4439.0000000000,696.0000000000,1382.0000000000,,False
KolnBote,Internationaler Tag gegen Rassismus: Mit Schauspiel und Trommelmusik gegen Ausgrenzung... https://t.co/pI6OfbJHO4 https://t.co/6aYqHUyRW2,Germany,German,2017-03-21T19:10:00,2017-03-21T19:10:00,4439.0000000000,696.0000000000,1381.0000000000,,False
KolnBote,Kölner Schule: Freisetzung eines reizendes Stoffes – Sechs Schüler im Krankenhaus https://t.co/mf2AS1Kml6 https://t.co/9avCcbxHQC,Germany,German,2017-03-21T20:10:00,2017-03-28T10:18:00,4439.0000000000,696.0000000000,1383.0000000000,,False
KolnBote,Nach Unfall auf Kölner Militärring: Ampel war offenbar erst nach Unfall defekt https://t.co/OAUkyA1IsD https://t.co/D4PTdoB1GR,Germany,German,2017-03-21T20:10:00,2017-03-21T20:10:00,4439.0000000000,696.0000000000,1384.0000000000,,False
KolnBote,Ohne eigene Autos: Montagsgespräch der Architekten blickt voraus in das Jahr 2037 https://t.co/8E7mWvX9DA https://t.co/sCGrgsM3ay,Germany,German,2017-03-21T21:10:00,2017-03-21T21:10:00,4439.0000000000,696.0000000000,1385.0000000000,,False
KolnBote,„Crash Kurs“ gegen Raser - 400 Beamte kontrollierten auf NRW-Autobahnen https://t.co/AD7wJybRU6 https://t.co/UIzUZQ8JKQ,Germany,German,2017-03-21T23:43:00,2017-03-21T23:43:00,4439.0000000000,694.0000000000,1388.0000000000,,False
KolnBote,Bilanz nach Sperrung: Rund um die Zülpicher Straße wird es eng https://t.co/Z7EXNZoT7P https://t.co/TWzTiu8CjW,Germany,German,2017-03-22T06:10:00,2017-03-22T06:10:00,4439.0000000000,698.0000000000,1389.0000000000,,False
KolnBote,Interview mit Kölner Blogger Ali Utlu: „Ich werde seit Jahren immer wieder bedroht“ https://t.co/h7jXROb5vL https://t.co/73ETncivu6,Germany,German,2017-03-22T07:10:00,2017-03-22T07:10:00,4439.0000000000,700.0000000000,1391.0000000000,,False
KolnBote,Kölner Kultkneipe: Thrash Chic in Kalk nach nur 12 Stunden gerettet https://t.co/Qn4qpo5o2v https://t.co/5l2tdAQrs4,Germany,German,2017-03-22T07:10:00,2017-03-22T12:05:00,4234.0000000000,703.0000000000,1398.0000000000,,False
KolnBote,Stromkasten zertrümmert! Fahrer-Flucht! - Unfall-Depp knipst Dorf das Licht aus https://t.co/JNDurrFfTG https://t.co/AzVCiJYqft,Germany,German,2017-03-22T08:43:00,2017-03-22T08:43:00,4439.0000000000,700.0000000000,1394.0000000000,,False
KolnBote,Shop-Eröffnung in Köln: Reserved eröffnet Filiale auf der Schildergasse https://t.co/GV7ky9vQI9 https://t.co/fKD5gEyYTw,Germany,German,2017-03-22T09:10:00,2017-03-22T09:10:00,4419.0000000000,700.0000000000,1396.0000000000,,False
KolnBote,Bahnhof Belvedere: Platanen müssen nicht gefällt werden – Bauprojekt kann weitergehen https://t.co/jlRVpANpu0 https://t.co/9A0c17pslw,Germany,German,2017-03-22T11:10:00,2017-03-22T11:10:00,4278.0000000000,702.0000000000,1398.0000000000,,False
KolnBote,Food-Truck: Ein Hauch von Bretagne rollt durch Köln https://t.co/RBNkOSDWUk https://t.co/q558LlR5pf,Germany,German,2017-03-22T11:10:00,2017-03-22T11:10:00,4278.0000000000,702.0000000000,1397.0000000000,,False
KolnBote,Im Herzen von Köln: Neue ARD-Serie spielt am Barbarossaplatz https://t.co/2n0C7vBAaA https://t.co/mzIEysa0Be,Germany,German,2017-03-22T12:10:00,2017-03-22T12:10:00,4233.0000000000,703.0000000000,1400.0000000000,,False
KolnBote,*** BILDplus Inhalt *** Claudia Carpendale - „Viele Männer wollen ihre Frauen kleinhal... https://t.co/GLFZwHAhXL https://t.co/mYAgBolfkh,Germany,German,2017-03-22T12:43:00,2017-03-22T12:43:00,4211.0000000000,703.0000000000,1401.0000000000,,False
KolnBote,Kommentar zum E-Scooter-Erlass: Wie soll das in der Praxis gehen? https://t.co/LOkedwoAqm https://t.co/hnNiZNvIm2,Germany,German,2017-03-22T14:10:00,2017-03-22T14:10:00,4141.0000000000,701.0000000000,1403.0000000000,,False
KolnBote,Tierschutz in Zollstock: Ehrenamtler geben Krötenschutz-Aktion auf https://t.co/0Um09PPEKp https://t.co/TOP2LvcNY0,Germany,German,2017-03-22T14:10:00,2017-03-22T14:10:00,4141.0000000000,701.0000000000,1404.0000000000,,False
KolnBote,Anwohner finden Situation untragbar: Trotz Verbot viel Prostitution am Eigelstein https://t.co/yZ8hMOfymL https://t.co/a7Uet6IQlu,Germany,German,2017-03-22T15:10:00,2017-03-22T15:10:00,4090.0000000000,701.0000000000,1405.0000000000,,False
KolnBote,„Auf den Kopf gestellt“: 3x2 Karten für Roland Kaiser in Köln zu gewinnen https://t.co/gamTTMSG1F https://t.co/7Hug5ezy3c,Germany,German,2017-03-22T16:10:00,2017-03-22T16:10:00,4038.0000000000,700.0000000000,1406.0000000000,,False
KolnBote,Steuerhinterziehung - Pascha-Chef vor Gericht:  „Mich langweilt das hier“ https://t.co/F5GCXZMDXJ https://t.co/GB9oEn3EQH,Germany,German,2017-03-22T16:43:00,2017-03-22T16:43:00,4038.0000000000,702.0000000000,1407.0000000000,,False
KolnBote,Kampfsport auf kölsche Art: Kickbox-Europameisterin kommt aus Höhenberg https://t.co/VUpubhCBSw https://t.co/ljxrX2uAeM,Germany,German,2017-03-22T17:10:00,2017-03-22T17:10:00,4038.0000000000,702.0000000000,1408.0000000000,,False
KolnBote,Vollsperrung am Kreuz Köln-West: Massive Staus auf der A4 am Wochenende erwartet https://t.co/5iWCsk4ccr https://t.co/bdDteCToXg,Germany,German,2017-03-22T19:10:00,2017-03-22T19:10:00,4038.0000000000,702.0000000000,1410.0000000000,,False
KolnBote,Simulator „Synlight“ - Jülich knipst die Super-Sonne an https://t.co/qqozo9Yrb6 https://t.co/AG1oMkmFtz,Germany,English,2017-03-23T09:22:00,2017-03-23T09:22:00,4037.0000000000,702.0000000000,1417.0000000000,,False
KolnBote,Streit um Werkstätten: Politik verweigert Zustimmung zur Planung des Millionenbaus https://t.co/HZ2qLu2PCK https://t.co/PkbUeMcecF,Germany,German,2017-03-23T10:08:00,2017-03-23T10:08:00,4037.0000000000,702.0000000000,1418.0000000000,,False
KolnBote,Zwei Tage vor Eröffnung - Fans campen schon vorm Apple-Store https://t.co/SvGLzKk0cY https://t.co/IJqrxODBxr,Germany,German,2017-03-23T10:22:00,2017-03-23T10:22:00,4037.0000000000,702.0000000000,1420.0000000000,,False
KolnBote,Kommentar zum Kölner Schulprogramm: Die Stadt hat ihre Pflichten vernachlässigt https://t.co/74gcgPDCVw https://t.co/0v1dsgZjSJ,Germany,German,2017-03-23T12:08:00,2017-03-23T12:08:00,4037.0000000000,702.0000000000,1422.0000000000,,False
KolnBote,Bilderstrecke: So sieht der neue Apple-Store in Kölns Schildergasse aus https://t.co/eeoBmIZBsW https://t.co/1c7u9Jgih2,Germany,German,2017-03-23T12:21:00,2017-03-23T12:21:00,4037.0000000000,702.0000000000,1423.0000000000,,False
KolnBote,Eishockey-WM in Köln und Paris: Eiffelturm wird zum Wahrzeichen von Deutz https://t.co/UcfPMpeYIa https://t.co/FjS62aLYlv,Germany,German,2017-03-23T13:21:00,2017-03-23T13:21:00,4037.0000000000,700.0000000000,1425.0000000000,,False
KolnBote,Polizei sucht Zeugen: Maskierte Räuber überfallen Pizzeria-Mitarbeiter in Köln-Eil https://t.co/bZRk2qYiKK https://t.co/pVOve6RVhY,Germany,German,2017-03-23T14:08:00,2017-03-23T14:08:00,4037.0000000000,700.0000000000,1426.0000000000,,False
KolnBote,Schleichwege und Schadstoffe: Bustour zu Verkehrs-Hotspots in Lindenthal https://t.co/YDaZz5E1UD https://t.co/bi6Hr1OX1u,Germany,German,2017-03-23T18:08:00,2017-03-23T18:08:00,4037.0000000000,702.0000000000,1430.0000000000,,False
KolnBote,Entdeckt bei Sanierung - Hier lag Erz­bi­schof Sieg­fried von Wes­ter­burg https://t.co/gxwa8WvfhS https://t.co/PEuMzPd5Nx,Germany,German,2017-03-23T18:22:00,2017-03-23T18:22:00,4037.0000000000,702.0000000000,1431.0000000000,,False
KolnBote,Christophstraße/Von-Werth-Straße: Ausgefallene Ampelanlage führt zu Einschränkungen https://t.co/kAL0n2OoDd https://t.co/MJZMA3ur3q,Germany,German,2017-03-23T19:08:00,2017-03-23T19:08:00,4037.0000000000,701.0000000000,1432.0000000000,,False
KolnBote,Neues Album handgemacht - Höhner ziehen sich selbst den Stecker https://t.co/PH1VId027x https://t.co/39JeLWXu8K,Germany,German,2017-03-23T23:22:00,2017-03-23T23:22:00,4037.0000000000,699.0000000000,1433.0000000000,,False
KolnBote,Wetter in Köln: Bis zu 17 Grad – Das Wochenende lädt zum Draußensein ein https://t.co/pvu4W0CCqg https://t.co/mTZvbcPqpZ,Germany,German,2017-03-24T06:08:00,2017-03-24T06:08:00,4037.0000000000,701.0000000000,1434.0000000000,,False
KolnBote,Am Hauptbahnhof Neuss: Herzkranker Junge aus Köln-Niehl wieder aufgetaucht https://t.co/NhdqaLbGIM https://t.co/tBEwnO4xgL,Germany,German,2017-03-24T06:21:00,2017-03-24T06:21:00,4037.0000000000,701.0000000000,1435.0000000000,,False
KolnBote,Roncalliplatz: Dom-Hotel eröffnet nicht vor Sommer 2019 https://t.co/xxMKu27cfR https://t.co/oRMFu1R5pb,Germany,German,2017-03-24T07:09:00,2017-03-24T07:10:00,4037.0000000000,702.0000000000,1436.0000000000,,False
KolnBote,Unterschrift gefälscht: Ex-Polizist ergaunert sich 50.000 Euro aus Lebensversicherung https://t.co/ryoC7QqYBQ https://t.co/nADC4evsgx,Germany,German,2017-03-24T07:21:00,2017-03-24T07:22:00,4037.0000000000,702.0000000000,1437.0000000000,,False
KolnBote,„Earth Hour“: Am Samstag bleibt der Dom dunkel https://t.co/NOQ6H0em5F https://t.co/up3ncGgtiW,Germany,English,2017-03-24T08:21:00,2017-03-24T08:21:00,4037.0000000000,699.0000000000,1438.0000000000,,False
KolnBote,Gute Verkehrspolitik: Greenpeace-Studie sieht Köln auf Platz drei von 15 Großstädten https://t.co/ZllSUBmQhX https://t.co/SyCiTpXi0P,Germany,German,2017-03-24T09:08:00,2017-03-24T09:08:00,4037.0000000000,700.0000000000,1439.0000000000,,False
KolnBote,Sanierung: Wiedereröffnung des Dom-Hotels ist für 2019 geplant https://t.co/2CZn8oBDlL https://t.co/x13d6sgpQh,Germany,German,2017-03-24T09:21:00,2017-03-24T09:21:00,4037.0000000000,700.0000000000,1440.0000000000,,False
KolnBote,400 Arbeitsplätze - Haribo produziert bald in den USA https://t.co/15mkZdAXEQ https://t.co/Ecxwk0AZVi,Germany,German,2017-03-24T09:27:00,2017-03-24T09:27:00,4037.0000000000,700.0000000000,1441.0000000000,,False
KolnBote,VRS sucht Schmerzgrenze: Wie viel sind Sie bereit für ein Bahnticket zu zahlen? https://t.co/hXxZ0sm3Xz https://t.co/MUHkU1mAnJ,Germany,German,2017-03-24T10:21:00,2017-03-24T10:21:00,4037.0000000000,700.0000000000,1443.0000000000,,False
KolnBote,Germanwings-Absturz: Gedenkfeier für die Opfer am Flughafen Köln-Bonn https://t.co/1dOgQdpM7N https://t.co/xwQ5SmX93h,Germany,German,2017-03-24T11:08:00,2017-03-24T11:08:00,4037.0000000000,700.0000000000,1444.0000000000,,False
KolnBote,Kölner Arbeitsgericht: Klage von Imamen gegen Ditib nach Entlassung hat kaum Chancen https://t.co/pizxLH3tAD https://t.co/rfdJaXlNAt,Germany,German,2017-03-24T12:21:00,2017-03-24T12:21:00,4037.0000000000,701.0000000000,1446.0000000000,,False
KolnBote,Aus Bau befreit - Frauchen bedankt sich mit „Hundekuchen“ bei Rettern https://t.co/4pBaxGK05F https://t.co/zL65u64aEn,Germany,German,2017-03-24T15:22:00,2017-03-24T15:22:00,3928.0000000000,705.0000000000,1451.0000000000,,False
KolnBote,Besucherandrang im Kölner Zoo: Alle wollen Moma sehen https://t.co/CTLNs8GYWn https://t.co/6ahkItalY3,Germany,German,2017-03-24T16:08:00,2017-03-24T16:08:00,3884.0000000000,704.0000000000,1452.0000000000,,False
KolnBote,Venloer Straße gesperrt: „Kebapland“ in Köln-Ehrenfeld bei Brand schwer beschädigt https://t.co/5zwOJsfNfu https://t.co/ppDaaUrUjr,Germany,German,2017-03-24T17:21:00,2017-03-24T17:21:00,3808.0000000000,705.0000000000,1454.0000000000,,False
KolnBote,Frau wollte ihren Hund retten: Feuerwehr zieht Frau in Köln-Zündorf aus dem Rhein https://t.co/DAiocePI5O https://t.co/zYdsliCxS2,Germany,German,2017-03-24T18:08:00,2017-03-24T18:08:00,3757.0000000000,706.0000000000,1455.0000000000,,False
KolnBote,Hinter der Küche versteckt - Oma bunkert 107000 Euro im Altenheim https://t.co/JNrV8IXDkw https://t.co/d81pYQtZTp,Germany,German,2017-03-24T18:22:00,2017-03-24T18:22:00,3744.0000000000,706.0000000000,1456.0000000000,,False
KolnBote,Karsamstag in Köln: Demonstrationen von Rechten und Linken in der City https://t.co/Ker9XH24PN https://t.co/z9Op8g357u,Germany,German,2017-03-24T21:21:00,2017-03-24T21:21:00,3598.0000000000,705.0000000000,1459.0000000000,,False
KolnBote,Silvesterausschuss: Kritik an Jäger wurde aus Abschlussbericht gestrichen https://t.co/mvMuT4npic https://t.co/nfvTDQfGCS,Germany,German,2017-03-25T08:08:00,2017-03-25T08:33:00,3236.0000000000,705.0000000000,1462.0000000000,,False
KolnBote,23-facher Betrug: Mann bestellte für 3000 Euro Lebensmittel ohne zu bezahlen https://t.co/14Qf07oW8D https://t.co/E4ktXC7zDk,Germany,German,2017-03-25T08:21:00,2017-03-25T08:21:00,3236.0000000000,705.0000000000,1462.0000000000,,False
KolnBote,Köln-Besuch: Kanzlerin Angela Merkel kommt zum 1. FC Köln https://t.co/d8zEPwbmMO https://t.co/ehCbESqwSV,Germany,German,2017-03-25T09:08:00,2017-03-25T09:08:00,3236.0000000000,707.0000000000,1463.0000000000,,False
KolnBote,Handgepäck nicht erkennbar: Terminal am Flughafen Köln/Bonn zeitweise geräumt https://t.co/ALFTXTgSaG https://t.co/KwMWYua0hy,Germany,German,2017-03-25T10:08:00,2017-03-25T10:08:00,3236.0000000000,707.0000000000,1464.0000000000,,False
KolnBote,Kölner Handelskonzern: Rewe plant neue Zentrale im Deutzer Hafen https://t.co/prNHJfmNff https://t.co/Zl50I6qqY9,Germany,German,2017-03-25T11:08:00,2017-03-25T11:08:00,3236.0000000000,707.0000000000,1465.0000000000,,False
KolnBote,Handgepäck nicht erkannt: Terminals im Flughafen Köln/Bonn kurzzeitig geschlossen https://t.co/WGtqih8XOy https://t.co/3qg1QdhfkQ,Germany,German,2017-03-25T11:21:00,2017-03-25T11:21:00,3236.0000000000,707.0000000000,1466.0000000000,,False
KolnBote,Fahrerin schwerstverletzt - Auto fängt Feuer nach Baum-Crash https://t.co/jBmAFrUF2F https://t.co/n0AzgSZ1vP,Germany,German,2017-03-25T11:22:00,2017-03-25T11:22:00,3236.0000000000,707.0000000000,1467.0000000000,,False
KolnBote,Essen und Trinken im Veedel: Im Südgold trinkt man Kaffee in sportlicher Atmosphäre https://t.co/AdZsfHAlU3 https://t.co/KfvNOlWMnV,Germany,German,2017-03-25T15:08:00,2017-03-25T15:08:00,3236.0000000000,705.0000000000,1470.0000000000,,False
KolnBote,Schwerer Unfall in Köln-Porz: Radfahrer nach Zusammenstoß mit Motorradfahrer verstorbe... https://t.co/mVpwPNAkUZ https://t.co/rY9UIDOoiR,Germany,German,2017-03-25T16:08:00,2017-03-25T16:09:00,3236.0000000000,706.0000000000,1472.0000000000,,False
KolnBote,Stunde der Erde: In Köln geht zur „Earth Hour“ eine Stunde lang das Licht aus https://t.co/UgZ5ypmLgj https://t.co/0SbHn9B50b,Germany,German,2017-03-25T17:21:00,2017-03-25T17:22:00,3236.0000000000,706.0000000000,1474.0000000000,,False
KolnBote,Tragischer Unfall - Biker kracht in Radfahrer – ein Toter! https://t.co/ZOEXMJGSp5 https://t.co/xkyFti6TkL,Germany,German,2017-03-25T17:22:00,2017-03-25T17:22:00,3236.0000000000,706.0000000000,1475.0000000000,,False
KolnBote,"Studenten bei der KVB: „Guten Abend. Die Fahrscheine, bitte“ https://t.co/ahvp3y4XQc https://t.co/ZQFcaVNrfr",Germany,German,2017-03-25T18:08:00,2017-03-25T18:08:00,3236.0000000000,706.0000000000,1476.0000000000,,False
KolnBote,Luxusbetten in Köln: Schiffe kompensieren den Mangel an 5-Sterne Hotels https://t.co/l7fpxboeyg https://t.co/tvUHFbX1QY,Germany,German,2017-03-25T18:21:00,2017-03-25T18:21:00,3236.0000000000,706.0000000000,1477.0000000000,,False
KolnBote,Earth Hour 2017: Köln knipst erneut für den Klimaschutz das Licht aus https://t.co/tv66fm3wQ2 https://t.co/pE7MDgonWO,Germany,German,2017-03-25T19:08:00,2017-03-25T19:08:00,3236.0000000000,706.0000000000,1478.0000000000,,False
KolnBote,Nobelkarossen-Imperium: Historische Fotos von Kölner Auto-Pionier Bleissem aufgetaucht... https://t.co/NzTqUFUx0i https://t.co/JdqtqxwT5v,Germany,German,2017-03-25T23:08:00,2017-03-25T23:08:00,3236.0000000000,705.0000000000,1480.0000000000,,False
KolnBote,War der Fahrer krank? - Auto rast in Säule: Ärztehaus einsturzgefährdet https://t.co/aXGCUUWDu0 https://t.co/TvVCYaDcSh,Germany,German,2017-03-26T08:22:00,2017-03-26T08:22:00,3236.0000000000,708.0000000000,1485.0000000000,,False
KolnBote,Sanierung bald abgeschlossen: 150 Flüchtlinge ziehen im Sommer ins Bonotel https://t.co/W86aH8BmPa https://t.co/UowyNgDoOs,Germany,German,2017-03-26T10:08:00,2017-03-26T10:08:00,3236.0000000000,708.0000000000,1487.0000000000,,False
KolnBote,Baby (5 Monate) in Klinik - Junge Mutter stirbt bei Unfall auf A61 https://t.co/wUhNadGQDu https://t.co/tryVCKDej0,Germany,German,2017-03-26T12:22:00,2017-03-26T12:22:00,3236.0000000000,708.0000000000,1489.0000000000,,False
KolnBote,Mülheimerin Silvia Beuchert: „Es ist nicht so hip hier – dafür nicht so abgeklatscht“ https://t.co/l1Je2jV9GA https://t.co/DaNniA672a,Germany,German,2017-03-26T15:08:00,2017-03-26T15:08:00,3236.0000000000,711.0000000000,1492.0000000000,,False
KolnBote,Lanxess-Arena: Superstar Ed Sheeran verzaubert 16 500 Fans in Köln https://t.co/8J0uf6z4Kl https://t.co/CcHp7KyOlE,Germany,English,2017-03-26T15:21:00,2017-03-26T15:21:00,3236.0000000000,711.0000000000,1493.0000000000,,False
KolnBote,Auftritte im Rheinenergie-Stadion: 1. FC Köln hat ein neues Cheerleader-Team https://t.co/yg1EgYW9aM https://t.co/yBLIMlI2ND,Germany,German,2017-03-26T16:08:00,2017-03-26T16:08:00,3236.0000000000,711.0000000000,1494.0000000000,,False
KolnBote,„Pulse of Europe“: Rund 1.600 Europa-Befürworter demonstrieren in Köln https://t.co/HXJGSuOVTG https://t.co/RjRWpB1pix,Germany,German,2017-03-26T16:21:00,2017-03-26T16:21:00,3236.0000000000,711.0000000000,1495.0000000000,,False
KolnBote,Tödlicher Unfall in Porz: Kradfahrer stand möglicherweise unter Medikamenteneinfluss https://t.co/oZVnbWrPaf https://t.co/GAsLqmD12I,Germany,German,2017-03-26T18:21:00,2017-03-26T18:21:00,3236.0000000000,711.0000000000,1497.0000000000,,False
KolnBote,Kölner Innenstadt: Apple-Store auf der Schildergasse eröffnet https://t.co/Kbo6EEV3YU https://t.co/ROW1yYKUaN,Germany,German,2017-03-26T19:21:00,2017-03-26T19:22:00,3236.0000000000,710.0000000000,1499.0000000000,,False
KolnBote,Polizei im Großeinsatz - Mehrere Verletzte bei Massenschlägerei am Rhein https://t.co/5FBIOfx2kq https://t.co/gtBfHn0OG4,Germany,German,2017-03-26T19:22:00,2017-03-26T19:29:00,3236.0000000000,710.0000000000,1500.0000000000,,False
KolnBote,Köln-Deutz: Mehrere Festnahmen nach Polizei-Großeinsatz am Rheinboulevard https://t.co/TnvV2pCVck https://t.co/TysKZLJfko,Germany,German,2017-03-26T21:08:00,2017-03-26T21:08:00,3235.0000000000,710.0000000000,1501.0000000000,,False
KolnBote,"Opfer von Paragraph 175 - Ich musste vor Gericht, weil ich schwul bin https://t.co/stbJcAwNgU https://t.co/XGSfLilmAV",Germany,German,2017-03-26T22:22:00,2017-03-26T22:22:00,3235.0000000000,711.0000000000,1502.0000000000,,False
KolnBote,Polizei-Großeinsatz in Köln-Deutz: Mehrere Festnahmen nach Schlägerei am Rheinboulevar... https://t.co/fCDCQDuapZ https://t.co/kQfjkExpGV,Germany,German,2017-03-27T06:08:00,2017-03-27T06:08:00,3235.0000000000,712.0000000000,1504.0000000000,,False
KolnBote,Mietwagen-Crash - Zwei Bonner (20) sterben bei Crash in Neuseeland https://t.co/Exg8IpifZu https://t.co/YK9SrQB31g,Germany,German,2017-03-27T06:22:00,2017-03-27T06:22:00,3235.0000000000,712.0000000000,1506.0000000000,,False
KolnBote,Drogengeschäfte: Kölner Hells-Angels-Mitglieder nach Schüssen auf Brüderpaar angeklagt... https://t.co/FYwPYRCCBM https://t.co/FV2uzmMwFk,Germany,German,2017-03-27T07:08:00,2017-03-27T07:08:00,3235.0000000000,712.0000000000,1507.0000000000,,False
KolnBote,Unternehmenszentrale: Positive Reaktionen auf Rewe-Pläne im Deutzer Hafen https://t.co/auSkhMalLx https://t.co/pbucab4OUC,Germany,German,2017-03-27T09:21:00,2017-03-27T09:21:00,3181.0000000000,713.0000000000,1512.0000000000,,False
KolnBote,Ein Toter auf A44 - Lkw schleift Sprinter nach Unfall mit https://t.co/0oPic1EuFN https://t.co/xzXXduffaT,Germany,German,2017-03-27T09:22:00,2017-03-27T09:22:00,3179.0000000000,713.0000000000,1513.0000000000,,False
KolnBote,Türkisches Referendum - Türken stehen Schlange vor NRW-Wahllokalen https://t.co/ncIMWAmNWt https://t.co/NOc3OjKBf9,Germany,German,2017-03-27T10:22:00,2017-03-27T10:22:00,3115.0000000000,712.0000000000,1514.0000000000,,False
KolnBote,Schüsse an Kiosk: Zweiter Hells-Angels-Prozess in Köln gestartet https://t.co/RWgyArzUt4 https://t.co/IFoCzp5QJ0,Germany,German,2017-03-27T11:21:00,2017-03-27T11:21:00,3067.0000000000,712.0000000000,1515.0000000000,,False
KolnBote,„Vererbt“ in Köln-Mülheim: Judith Erb verkauft Brautkleider aus glücklichen Ehen https://t.co/V8p2CwoIP2 https://t.co/DNpYKT5WMy,Germany,German,2017-03-27T12:08:00,2017-03-27T12:08:00,3027.0000000000,712.0000000000,1516.0000000000,,False
KolnBote,Giftgefahr! - Riesen-Rauchwolke über Köln https://t.co/gCrPwTmyvo https://t.co/Dicpp7Mslk,Germany,German,2017-03-27T12:22:00,2017-03-27T12:32:00,3011.0000000000,711.0000000000,1518.0000000000,,False
KolnBote,Rauchsäule über Köln: Feuer in Autowerkstatt in Mülheim gelöscht – Brandursache unklar... https://t.co/ha5hC1vfhb https://t.co/lMJZoeoDFU,Germany,German,2017-03-27T15:08:00,2017-03-27T15:08:00,2896.0000000000,710.0000000000,1520.0000000000,,False
KolnBote,Köln-Niehl: Umstrittener Kreisverkehr am Niehler Damm wird noch teurer https://t.co/Mu8RP6zaO4 https://t.co/U2SGeaqJcl,Germany,German,2017-03-27T16:08:00,2017-03-27T16:08:00,2856.0000000000,711.0000000000,1521.0000000000,,False
KolnBote,500. Show: „Kunst gegen Bares“ feiert im Kölner Artheater Jubiläum https://t.co/zTYxrOGbTu https://t.co/I4m2STd8Ab,Germany,German,2017-03-27T17:21:00,2017-03-27T17:21:00,2795.0000000000,711.0000000000,1522.0000000000,,False
KolnBote,„Benjamin Blümchen“-Dreh - Heike Makatsch spielt blondes Biest https://t.co/YuTGg7tPk1 https://t.co/aV9xA0eG6b,Germany,German,2017-03-27T17:22:00,2017-03-27T17:22:00,2795.0000000000,711.0000000000,1523.0000000000,,False
KolnBote,Streit um Warenanlieferung: Ehrenfelder kritisieren Pläne für Rewe-Supermarkt https://t.co/5DvAj4JQce https://t.co/zJnDx2XwJd,Germany,German,2017-03-27T18:08:00,2017-03-27T18:08:00,2755.0000000000,710.0000000000,1524.0000000000,,False
KolnBote,Nach Terminal-Räumung: Kritik an neuem Kontrollsystem am Flughafen Köln/Bonn https://t.co/kp9JDOHta6 https://t.co/zePVEcNaSr,Germany,German,2017-03-28T05:08:00,2017-03-28T05:08:00,2439.0000000000,710.0000000000,1530.0000000000,,False
