author_id,content,region,language,publish_date,harvested_date,following,followers,updates,post_type,retweet
KolnBote,#Regenbogen in #Köln   Instagarmphoto via David Ju (https://t.co/nyYTebdS6q) https://t.co/dH32GRh2qq,Germany,English,2017-08-03T14:13:00,2017-08-03T14:13:00,1764.0000000000,1112.0000000000,4225.0000000000,,False
KolnBote,Nachwuchs im Zoo: Zwölf schwäbisch-hallische Ferkel für den Clemenshof https://t.co/jmGs5llafD https://t.co/9Uu4vC7UXm,Germany,German,2017-08-03T17:43:00,2017-08-03T17:43:00,1763.0000000000,1112.0000000000,4228.0000000000,,False
KolnBote,Nachwuchs im Zoo: Zwölf Schwäbisch-Hällische Ferkel im Clemenshof geboren https://t.co/LF4OuMit8m https://t.co/2GzVYc9mTl,Germany,German,2017-08-03T18:32:00,2017-08-03T18:32:00,1763.0000000000,1112.0000000000,4229.0000000000,,False
KolnBote,Ärger und Empörung: Das sagen Kölner Autobesitzer zum Diesel-Skandal https://t.co/T2xUeFywUI https://t.co/huebDzo2pF,Germany,German,2017-08-04T06:43:00,2017-08-04T06:43:00,1763.0000000000,1114.0000000000,4233.0000000000,,False
KolnBote,Wegen Preisabsprachen - Millionen-Strafen für Bier-Brauer? https://t.co/12oRvAfuF4 https://t.co/s4lb0GuhoM,Germany,German,2017-08-04T08:06:00,2017-08-04T08:06:00,1764.0000000000,1114.0000000000,4235.0000000000,,False
KolnBote,Ehrenstraße: Neue Ampel für Radfahrer – Ohne Umwege die Ringe kreuzen https://t.co/2jlgJA6xOO https://t.co/2NxGAaHd1b,Germany,German,2017-08-04T09:38:00,2017-08-04T09:39:00,1764.0000000000,1115.0000000000,4237.0000000000,,False
KolnBote,„Gamescom“ 2017: Kein Einlass für Schwerter und Latexmasken auf der Spielemesse https://t.co/f6NDHWwC5u https://t.co/UiuWYA8yhM,Germany,German,2017-08-04T09:45:00,2017-08-04T09:59:00,1764.0000000000,1115.0000000000,4238.0000000000,,False
KolnBote,Verkehr am Chlodwigplatz: Kartäuserhof soll in beide Richtungen geöffnet werden https://t.co/JSy1OjjiDC,Germany,German,2017-08-04T11:41:00,2017-08-04T11:42:00,1764.0000000000,1114.0000000000,4240.0000000000,,False
KolnBote,Patricia Meeden - Musical-Star wäre gern Tatort-Ermittlerin https://t.co/vegG8ygJnH https://t.co/6nZsUNlupW,Germany,English,2017-08-04T13:14:00,2017-08-04T13:14:00,1764.0000000000,1114.0000000000,4241.0000000000,,False
KolnBote,Führungen: AWB zeigt Familien während der Ferien den Betriebshof am Maarweg https://t.co/tisK7zFzas https://t.co/N0sqAZKouM,Germany,German,2017-08-04T16:45:00,2017-08-04T16:46:00,1764.0000000000,1114.0000000000,4245.0000000000,,False
KolnBote,"Fipronilskandal : Kölner Kunden wollen wissen, wo ihr Ei herkommt https://t.co/FqE0LfDeqr https://t.co/oQaMXLAorL",Germany,German,2017-08-05T07:08:00,2017-08-05T07:08:00,1763.0000000000,1112.0000000000,4249.0000000000,,False
KolnBote,Diesel-Skandal: Kölner Ford-Werke sehen keinen Anlass für Software-Nachbesserung https://t.co/460pWg0cNU https://t.co/qDfZCypKy0,Germany,German,2017-08-05T09:07:00,2017-08-05T09:07:00,1763.0000000000,1114.0000000000,4250.0000000000,,False
KolnBote,Seilbahn-Unfall: Staatsanwaltschaft ermittelt wegen fahrlässiger Körperverletzung https://t.co/ufO8kuTJ7N https://t.co/2807brL3iu,Germany,German,2017-08-05T11:07:00,2017-08-05T11:07:00,1763.0000000000,1116.0000000000,4252.0000000000,,False
KolnBote,Gegen Unbekannt - Staatsanwaltschaft ermittelt nach Seilbahn-Drama https://t.co/QrLC6N7uAi https://t.co/QeliHxV1dL,Germany,German,2017-08-05T11:26:00,2017-08-05T11:27:00,1764.0000000000,1117.0000000000,4253.0000000000,,False
KolnBote,Fahrer wurde ausgebremst - Voll besetzter Golf kracht an Hauswand https://t.co/XpDHaKGt6z https://t.co/dQj7wFtmXL,Germany,German,2017-08-05T14:10:00,2017-08-05T14:10:00,1764.0000000000,1118.0000000000,4254.0000000000,,False
KolnBote,Willkommen im Haie-Paradies: Großer Andrang bei der Eröffnung des neuen KEC-Stores https://t.co/fKd1qfT8d5 https://t.co/gCL9LbXYM9,Germany,German,2017-08-05T16:54:00,2017-08-05T16:54:00,1764.0000000000,1117.0000000000,4257.0000000000,,False
KolnBote,Fahrzeuge im Wert von 50.000 Euro: Kölner Motorraddieb an Grenze zu Polen gefasst https://t.co/sm8p3rQ2ta https://t.co/zjB1ALFNME,Germany,German,2017-08-06T07:24:00,2017-08-06T07:24:00,1764.0000000000,1118.0000000000,4261.0000000000,,False
KolnBote,Showkämpfe mit Axt und Morgenstern: Mittelalter-Fans feiern das „Spectaculum“ in Köln https://t.co/RxVzI1QQ4n https://t.co/aniClSB12i,Germany,German,2017-08-06T10:24:00,2017-08-06T10:24:00,1764.0000000000,1117.0000000000,4263.0000000000,,False
KolnBote,Crash auf der Autobahn - Auto von Seniorin (70) gerammt: Lebensgefahr! https://t.co/IGBKK95Stb https://t.co/wkV1rVI14E,Germany,German,2017-08-06T13:10:00,2017-08-06T13:11:00,1763.0000000000,1116.0000000000,4265.0000000000,,False
KolnBote,Brauhauswanderung: Kostenlosen Führung anlässlich des internationalen Tag des Bieres https://t.co/MfEnLvaQOU https://t.co/H4yu2hvm87,Germany,German,2017-08-06T19:54:00,2017-08-06T19:54:00,1763.0000000000,1116.0000000000,4268.0000000000,,False
KolnBote,Neugestaltung: Besucher ärgern sich über Stolperfalle vor der Philharmonie https://t.co/mJWdNIttdA https://t.co/znp4NfLhsm,Germany,German,2017-08-07T04:53:00,2017-08-07T04:54:00,1763.0000000000,1115.0000000000,4271.0000000000,,False
KolnBote,Neubrück: Blindgänger aus dem Zweiten Weltkrieg unter Kirche St. Adelheid vermutet https://t.co/72Sdxprv0F https://t.co/AVKfyUsryE,Germany,German,2017-08-07T05:43:00,2017-08-07T05:43:00,1763.0000000000,1115.0000000000,4272.0000000000,,False
KolnBote,AfD: Kölner Ratsmitglied Hendrik Rottmann legt sein Mandat nieder https://t.co/yeqnhwlycP https://t.co/GdicQoSwxx,Germany,German,2017-08-07T06:53:00,2017-08-07T06:54:00,1763.0000000000,1115.0000000000,4273.0000000000,,False
KolnBote,"Schönen Tag, #Köln!  Photo via @annduerten69 https://t.co/YCqn4CEDUu",Germany,German,2017-08-07T08:48:00,2017-08-07T08:48:00,1763.0000000000,1114.0000000000,4274.0000000000,,False
KolnBote,Freitag-Store am Friesenwall: Der Sicherheitsgurt wird zum Taschengriff https://t.co/nDFY1JnChc https://t.co/te6ixTCZwC,Germany,German,2017-08-07T08:53:00,2017-08-07T08:53:00,1763.0000000000,1114.0000000000,4275.0000000000,,False
KolnBote,Seilbahn-Unfall: Experte erläutert Untersuchungsmethoden der Gutachter https://t.co/ld1MBicgO4 https://t.co/kIfKVZNE76,Germany,German,2017-08-07T10:44:00,2017-08-07T10:44:00,1763.0000000000,1113.0000000000,4277.0000000000,,False
KolnBote,#Cologne #Köln   Instagramphoto via lea_1907 (https://t.co/3LG4sxx3eV) https://t.co/yLYFdHRyNM,Germany,German,2017-08-07T14:13:00,2017-08-07T14:14:00,1764.0000000000,1114.0000000000,4279.0000000000,,False
KolnBote,Nicht mehr viel übrig - Diebe zerpflücken Florians BMW https://t.co/exDN5UYmOv https://t.co/zfFddb3oKB,Germany,German,2017-08-07T15:11:00,2017-08-07T15:11:00,1764.0000000000,1114.0000000000,4280.0000000000,,False
KolnBote,Ungewöhnliche Aktion - Tierheim sucht Vorleser für Katzen https://t.co/N1fYKQAuWY https://t.co/kCwxf5ozuR,Germany,German,2017-08-07T18:13:00,2017-08-07T18:14:00,1764.0000000000,1114.0000000000,4283.0000000000,,False
KolnBote,*** BILDplus Inhalt *** Mit Pistole überfallen - Blutiger Raub bei RTL-Autohändler https://t.co/JPZySKa0uq https://t.co/6szE1TIiXu,Germany,German,2017-08-07T22:12:00,2017-08-07T22:12:00,1764.0000000000,1114.0000000000,4284.0000000000,,False
KolnBote,Kölner IHK-Präsident: „Erfolg ist die Ansiedlung von Unternehmen und Arbeitsplätzen“ https://t.co/azfZi76nQT https://t.co/2DPES8phra,Germany,German,2017-08-08T04:54:00,2017-08-08T04:55:00,1764.0000000000,1113.0000000000,4286.0000000000,,False
KolnBote,Mit Hilfe der Kölner Leitstelle: Mutter konnte Baby selbst wiederbeleben https://t.co/QBiqbvfAgA https://t.co/rjFroxjYCE,Germany,German,2017-08-08T08:56:00,2017-08-08T08:56:00,1764.0000000000,1113.0000000000,4290.0000000000,,False
KolnBote,Morgen ist #Weltkatzentag! Der @KoelnerZoo und wir setzen uns für mehr Tiger-Schutz ein: https://t.co/EwKbD3sh48,Germany,German,2017-08-08T09:23:00,2017-08-08T09:23:00,1764.0000000000,1113.0000000000,4291.0000000000,R,True
KolnBote,Kölner Dom #Köln #Cologne   Instagramphoto via lenalika (https://t.co/ArbPrqMcYP) https://t.co/rNWgCeYLJb,Germany,Hungarian,2017-08-08T09:29:00,2017-08-08T09:29:00,1764.0000000000,1113.0000000000,4292.0000000000,,False
KolnBote,Ärger um Stromkästen an Deutzer Werft: Behälter trotz Denkmalschutz an Mauer angebracht https://t.co/siKt8Z7Gtt,Germany,German,2017-08-08T12:43:00,2017-08-08T12:44:00,1764.0000000000,1114.0000000000,4294.0000000000,,False
KolnBote,Frank Asbeck - Solar-Pleitier kauft eigene Fabriken zurück https://t.co/2wybvpwnlc https://t.co/pwpkQlw32a,Germany,German,2017-08-08T13:11:00,2017-08-08T13:12:00,1764.0000000000,1114.0000000000,4295.0000000000,,False
KolnBote,Urteil des Kölner Amtsgerichts: „Drei Kilo Gold“ als Mitgift gefordert https://t.co/OXczB8i93Z https://t.co/xQBS2IADdM,Germany,German,2017-08-08T15:06:00,2017-08-08T15:06:00,1764.0000000000,1114.0000000000,4296.0000000000,,False
KolnBote,Köln: „Höhle der Löwen“ eröffnet Pop-up-Store im September https://t.co/axs0TCRchl https://t.co/XzpM2TI9bS,Germany,German,2017-08-08T22:13:00,2017-08-08T22:13:00,1764.0000000000,1117.0000000000,4301.0000000000,,False
KolnBote,Er soll abgeschoben werden: Dolmetscher half bei Vernehmungen nach Silvesternacht https://t.co/FqZyzrN3Hu https://t.co/rCJRC4qxoX,Germany,German,2017-08-09T05:14:00,2017-08-10T04:04:00,0E-10,1119.0000000000,4319.0000000000,,False
KolnBote,Nach Fipronil-Skandal: In Köln steigt Nachfrage für Ware aus der Region https://t.co/iYJ1doiRSJ https://t.co/KOixSRyKqw,Germany,German,2017-08-09T06:29:00,2017-08-09T06:29:00,1763.0000000000,1116.0000000000,4304.0000000000,,False
KolnBote,Köln-Weidenpensch: Neue Gastronomie an der Pferderennbahn https://t.co/BGDpGzrMhs https://t.co/HIdmU69bpU,Germany,German,2017-08-09T07:31:00,2017-08-09T07:31:00,1763.0000000000,1117.0000000000,4305.0000000000,,False
KolnBote,Antifa-Protest wegen AfD-Nähe - Angekündigte Demo: Hayek-Club zog heimlich um https://t.co/kB5WZQpxQs https://t.co/Nqg7aXgyTq,Germany,German,2017-08-09T12:27:00,2017-08-09T12:27:00,1763.0000000000,1120.0000000000,4310.0000000000,,False
KolnBote,Köln Hauptbahnhof und Deutz: Technische Störung an einem Zug beeinträchtigt Bahnverkehr https://t.co/S1ySo0Eyaa https://t.co/emBjpwLff4,Germany,German,2017-08-09T15:14:00,2017-08-09T15:15:00,1763.0000000000,1120.0000000000,4313.0000000000,,False
KolnBote,Bundesbehörden in Köln: Bei der BZgA in Ehrenfeld dreht sich alles um die Gesundheit https://t.co/2GFtA62ovU https://t.co/3XVqOeGsy8,Germany,German,2017-08-09T17:29:00,2017-08-09T17:29:00,1763.0000000000,1119.0000000000,4314.0000000000,,False
KolnBote,"Schönen Abend, #Köln!   Instagramphoto via koln_de (https://t.co/qyXwg7jzpx) https://t.co/YbWEr6bRVF",Germany,German,2017-08-09T17:48:00,2017-08-09T17:59:00,1763.0000000000,1119.0000000000,4315.0000000000,,False
KolnBote,Unfall am Maarweg: Bei Überholmanöver Kontrolle über Fahrzeug verloren https://t.co/UPVzVXi8vL https://t.co/sEYKe0X7J2,Germany,German,2017-08-09T18:15:00,2017-08-09T18:15:00,1763.0000000000,1120.0000000000,4316.0000000000,,False
KolnBote,Unfall in Deutz: Radfahrerin wird von Auto erfasst und schwer verletzt https://t.co/eAsna4aJjB https://t.co/6Bhj19Lnr8,Germany,German,2017-08-09T21:19:00,2017-08-09T21:20:00,1763.0000000000,1120.0000000000,4318.0000000000,,False
KolnBote,"Schönen Tag, #Köln!  Photo via @jmeiden https://t.co/ICrxI2nVdN",Germany,German,2017-08-10T08:08:00,2017-08-10T08:08:00,0E-10,1119.0000000000,4320.0000000000,,False
KolnBote,Leben an ungewöhnlichen Orten: Wohnen auf 13 Quadratmetern – Kölner baut Mini-Häuser https://t.co/fFkzFlqeT3 https://t.co/7RI9epP1nm,Germany,German,2017-08-10T08:15:00,2017-08-10T08:15:00,0E-10,1119.0000000000,4321.0000000000,,False
KolnBote,Urteil am Kölner Landgericht: Zwangseinweisung nach Angriff auf Kind in Holweide https://t.co/Bj2HnMNRdi https://t.co/UbxLKorzWj,Germany,German,2017-08-10T11:14:00,2017-08-10T11:14:00,1763.0000000000,1119.0000000000,4323.0000000000,,False
KolnBote,Erstes Konzert: Neustart für Müngersdorfer Bahnhofsgebäude Belvedere https://t.co/dXvUkl8Tvz https://t.co/hVRBrHJ0yI,Germany,German,2017-08-10T14:17:00,2017-08-10T14:20:00,1763.0000000000,1119.0000000000,4327.0000000000,,False
KolnBote,#Köln #Cologne   #Instagramphoto via living_europe (https://t.co/ydzcBLySAr) https://t.co/ifkSOr2r0t,Germany,German,2017-08-10T14:36:00,2017-08-10T14:36:00,1763.0000000000,1117.0000000000,4328.0000000000,,False
KolnBote,Kulturszene in Köln: Petition gegen Abriss des Undergrounds in Ehrenfeld https://t.co/gLH4EwWJt8 https://t.co/s0mFitmLN6,Germany,German,2017-08-10T16:29:00,2017-08-10T16:46:00,1763.0000000000,1117.0000000000,4329.0000000000,,False
KolnBote,„Mama’s Wohnzimmer“ : Barbetreiber erinnern mit Bildern an verstorbene Mutter https://t.co/0FTHA2Kh2W https://t.co/MZa8RtoCfP,Germany,German,2017-08-10T17:27:00,2017-08-10T17:27:00,1763.0000000000,1117.0000000000,4330.0000000000,,False
KolnBote,Verfahrene Situation: Fahrer biegt in Treppen an Marzellenstraße ein https://t.co/84wkkqBCNn https://t.co/Ll5MB3OjjK,Germany,German,2017-08-10T19:05:00,2017-08-10T19:05:00,1762.0000000000,1117.0000000000,4331.0000000000,,False
KolnBote,Bei Rot über die Ampel: Drei Autos zusammengestoßen – eine Schwerverletzte in Porz https://t.co/xnZQrtlbRF https://t.co/z07DVkyOOb,Germany,German,2017-08-10T20:28:00,2017-08-10T20:29:00,1762.0000000000,1117.0000000000,4332.0000000000,,False
KolnBote,Evonik-Chef Kullmann - »Soli für NRW wäre recht und billig https://t.co/1dbA5nKFzd https://t.co/FcecNvOLDP,Germany,German,2017-08-10T21:42:00,2017-08-10T21:43:00,1762.0000000000,1117.0000000000,4333.0000000000,,False
KolnBote,TÜV-Gutachter: „Alpen-Experten“ sollen Kölner Seilbahn-Unfall klären https://t.co/mpWaZVp9a1 https://t.co/Sgazo68h4k,Germany,German,2017-08-11T08:08:00,2017-08-11T08:09:00,1762.0000000000,1119.0000000000,4335.0000000000,,False
KolnBote,Einreise in die USA verweigert: Kölner mit türkischen Wurzeln am Flughafen gestoppt https://t.co/FmrykeaPt1 https://t.co/G067CzQK2z,Germany,German,2017-08-11T08:32:00,2017-08-11T08:33:00,1762.0000000000,1119.0000000000,4336.0000000000,,False
KolnBote,Warhol &amp; Co.: Pop-Lab im Museum Ludwig eröffnet – Nicht nur für junge Besucher https://t.co/2dNSH29lgp https://t.co/FURTHA3akT,Germany,German,2017-08-11T10:07:00,2017-08-11T10:07:00,1761.0000000000,1119.0000000000,4338.0000000000,,False
KolnBote,Hohenzollernbrücke: Jugendliche überfallen 13-Jährigen und schlagen ihm ins Gesicht https://t.co/tYkEUk8Zvb https://t.co/JF5w5fYDcz,Germany,German,2017-08-11T13:05:00,2017-08-11T13:05:00,1761.0000000000,1119.0000000000,4340.0000000000,,False
KolnBote,Freifahrtaktion in Köln: Taxi-App darf auch künftig keine Fahrt verschenken https://t.co/Clyf0QulwZ https://t.co/UsCAFKTWMD,Germany,German,2017-08-11T17:05:00,2017-08-11T17:05:00,1760.0000000000,1118.0000000000,4344.0000000000,,False
KolnBote,Veranstaltung am Wochenende: Afrika-Festival am Schokoladenmuseum https://t.co/wJpLHYPOKz https://t.co/Qy6Xw7qncW,Germany,German,2017-08-11T17:30:00,2017-08-11T17:30:00,1760.0000000000,1118.0000000000,4345.0000000000,,False
KolnBote,Kölner Wirte verunsichert: Eurosport will Angebot doch für Kneipen öffnen https://t.co/dYxLiKOqPS https://t.co/Ast7A4bdth,Germany,German,2017-08-12T07:04:00,2017-08-12T07:04:00,1759.0000000000,1119.0000000000,4348.0000000000,,False
KolnBote,Wie in Rotterdam: FDP fordert überdachte Markthalle in der Kölner Innenstadt https://t.co/Ygy6rLkokE https://t.co/V6s2xOQiR8,Germany,German,2017-08-12T09:02:00,2017-08-12T09:03:00,1759.0000000000,1119.0000000000,4349.0000000000,,False
KolnBote,Streit auf Familienfeier - Mann (38) tötet Cousin (48) mit Samuraischwert https://t.co/foEK4Tqd1v https://t.co/JRU1sX91iC,Germany,German,2017-08-12T10:03:00,2017-08-12T10:03:00,1759.0000000000,1119.0000000000,4351.0000000000,,False
KolnBote,Opernbaustelle: SPD kritisiert „Terminschieberei“ und berfürchtet weitere Risiken https://t.co/tJZ2NEm4lb https://t.co/F4MV5AQwKU,Germany,German,2017-08-12T14:03:00,2017-08-12T14:03:00,1759.0000000000,1119.0000000000,4353.0000000000,,False
KolnBote,Auf der A61 - Rowdy flieht nach Unfall zu Fuß! https://t.co/yW6g4q2823 https://t.co/a7CjbZ5vdI,Germany,German,2017-08-12T15:01:00,2017-08-12T15:02:00,1759.0000000000,1119.0000000000,4355.0000000000,,False
KolnBote,Glasfasernetz wird ausgebaut: Internet im Porzer Süden soll schneller werden https://t.co/kQbLXiNEhf https://t.co/YaHFciS2Ip,Germany,German,2017-08-12T20:03:00,2017-08-12T20:03:00,1759.0000000000,1118.0000000000,4357.0000000000,,False
KolnBote,Anschlussstelle Köln-Dellbrück: Leblose Person unter Lkw-Anlieger auf A3 entdeckt https://t.co/BsHwVY8zMk https://t.co/FtuzV48WVA,Germany,German,2017-08-12T21:02:00,2017-08-12T21:02:00,1759.0000000000,1118.0000000000,4358.0000000000,,False
KolnBote,Christoph Becker über Fußball-Abos: „Gastronomen zahlen oft das Zehnfache der Preise“ https://t.co/1Ew3ic6krp https://t.co/E2KuCwViMx,Germany,German,2017-08-13T09:02:00,2017-08-13T09:03:00,1759.0000000000,1116.0000000000,4361.0000000000,,False
KolnBote,Leblose Person unter Lkw-Auflieger auf A3: 54-Jähriger wollte wohl Reifen wechseln https://t.co/TaXUHAxaGS https://t.co/IgK6tzsCla,Germany,German,2017-08-13T10:02:00,2017-08-13T10:02:00,1759.0000000000,1117.0000000000,4362.0000000000,,False
KolnBote,Nach Brutalo-Attacke - Eintracht-Fan (42) außer Lebensgefahr! https://t.co/l5c2PQBZQk https://t.co/4g5cHvVcAY,Germany,German,2017-08-13T13:01:00,2017-08-13T13:01:00,1759.0000000000,1118.0000000000,4363.0000000000,,False
KolnBote,Hohenzollernring: Putzhilfe in Restaurant überfallen – Zeugen gesucht https://t.co/ldRACB2mz4 https://t.co/UxnuosVoFw,Germany,German,2017-08-13T14:02:00,2017-08-13T14:02:00,1758.0000000000,1117.0000000000,4364.0000000000,,False
KolnBote,Brück Mauspfad: KVB-Bahn der Linie 3 springt aus den Schienen https://t.co/ajz0WaM0ze https://t.co/WFg6123LuG,Germany,German,2017-08-13T19:08:00,2017-08-13T19:09:00,1759.0000000000,1119.0000000000,4367.0000000000,,False
KolnBote,Bei Kindergeburtstag! - Vater tötet Gast mit Samurai-Schwert https://t.co/BMhA4ssO0C https://t.co/wDFWvQgQbs,Germany,German,2017-08-13T23:01:00,2017-08-13T23:02:00,1759.0000000000,1119.0000000000,4369.0000000000,,False
KolnBote,"Guten Morgen und einen tollen Start in die Woche, #Köln!  #Instagramphoto via Erol Oztolon (https://t.co/JRisY6LiNk) https://t.co/FSwNBYnkzJ",Germany,German,2017-08-14T08:44:00,2017-08-14T08:44:00,0E-10,1116.0000000000,4370.0000000000,,False
KolnBote,Mit 👀 auf Groß St. Martin (📸 von 1874) fällt der Start in die neue Woche doch gar nicht so schwer. 😌 Auf gehts!   #ksm #koeln #museummonday https://t.co/mNzH2k8ekP,Germany,German,2017-08-14T08:51:00,2017-08-14T08:51:00,0E-10,1116.0000000000,4371.0000000000,R,True
KolnBote,Integration - Kölsche Ratsfrau kämpft um ihre „Flüchtlingssöhne“ https://t.co/zLtYz0gXuw https://t.co/b8UWNSmFqO,Germany,German,2017-08-14T15:10:00,2017-08-14T15:11:00,1759.0000000000,1118.0000000000,4378.0000000000,,False
KolnBote,Kölner Lanxess Arena: Promis heizen Match zwischen THW Kiel und FC Barcelona an https://t.co/44JgywF3ZZ https://t.co/2xUwFpyYeC,Germany,German,2017-08-14T17:02:00,2017-08-14T17:02:00,1759.0000000000,1118.0000000000,4380.0000000000,,False
KolnBote,Nutzte fiese Klebefalle - Wirt wegen Maus-Quälerei verurteilt https://t.co/zeCbzUr9n0 https://t.co/z08qSBIhQ7,Germany,German,2017-08-14T18:08:00,2017-08-14T18:09:00,1759.0000000000,1118.0000000000,4381.0000000000,,False
KolnBote,Universität zu Köln: Knapp 40.000 Anmeldungen für das Wintersemester eingegangen https://t.co/QeInrnUsbX https://t.co/KtgRUcI2lX,Germany,German,2017-08-14T20:03:00,2017-08-14T20:03:00,1759.0000000000,1117.0000000000,4383.0000000000,,False
KolnBote,"*** BILDplus Inhalt *** Geld für Flüchtlingsheim - Was kostete hier 9,2 Mio. Euro? https://t.co/4Gg7jFsv5N https://t.co/GrQ9pCuQt4",Germany,German,2017-08-14T22:08:00,2017-08-14T22:09:00,1759.0000000000,1117.0000000000,4384.0000000000,,False
KolnBote,Bonotel: Flüchtlingsunterkunft Marienburg mit drei Jahren Verspätung betriebsbereit https://t.co/CE2t5JlGaj https://t.co/wfwD7mcOX9,Germany,German,2017-08-15T06:10:00,2017-08-15T06:10:00,1759.0000000000,1116.0000000000,4386.0000000000,,False
KolnBote,Tour: Blind - und trotzdem radeln https://t.co/cRHFIKCli9 https://t.co/xbdOKbq8pu,Germany,German,2017-08-15T06:17:00,2017-08-15T06:17:00,1759.0000000000,1116.0000000000,4387.0000000000,,False
KolnBote,"Schönen Tag, Köln!  Photo via @flobraeun https://t.co/WiNtwVWxqM",Germany,German,2017-08-15T09:01:00,2017-08-15T09:01:00,1759.0000000000,1116.0000000000,4389.0000000000,,False
KolnBote,20.000 Besucher erwartet: Am Fühlinger See findet das Springinsfeld-Festival statt https://t.co/NbZlB8kU0W https://t.co/JJRuPG2pxt,Germany,German,2017-08-15T10:02:00,2017-08-15T10:02:00,1759.0000000000,1116.0000000000,4390.0000000000,,False
KolnBote,Köln: Seniorenvertreter möchten mehr Bestattungsgärten als Alternative https://t.co/rgKFxufcpy https://t.co/7PttMSYtZG,Germany,German,2017-08-15T11:43:00,2017-08-15T11:43:00,1758.0000000000,1116.0000000000,4392.0000000000,,False
KolnBote,Zehn Verletzte - Massen-Crash auf dem Nürburgring https://t.co/ygV1QXRMhF https://t.co/1kzjZKhJ9Y,Germany,German,2017-08-15T12:04:00,2017-08-15T12:04:00,1758.0000000000,1116.0000000000,4393.0000000000,,False
KolnBote,Wetter in #NRW: Am Nachmittag drohen Gewitter und Unwetter https://t.co/TSb0lrrnSm,Germany,German,2017-08-15T14:02:00,2017-08-15T14:02:00,1758.0000000000,1116.0000000000,4395.0000000000,,False
KolnBote,Rekordzahlen für Uni Köln: 40.000 Bewerbungen sind eingegangen – nur 6000 freie Plätze https://t.co/0tUBToVr0m https://t.co/uXAtI3jBQH,Germany,German,2017-08-15T18:03:00,2017-08-15T18:03:00,1758.0000000000,1117.0000000000,4399.0000000000,,False
KolnBote,Deutscher Wetterdienst: Warnung vor starkem Gewitter in Köln https://t.co/lf1OZDCCcj https://t.co/WTD2TXKsrq,Germany,German,2017-08-15T20:02:00,2017-08-15T20:03:00,1758.0000000000,1117.0000000000,4400.0000000000,,False
KolnBote,"Gewitter, Sturmböen, Hagel: Deutscher Wetterdienst gibt Unwetterwarnung für Köln heraus https://t.co/LGou5nm9NK https://t.co/b27a8SuUKR",Germany,German,2017-08-15T21:10:00,2017-08-15T21:11:00,1758.0000000000,1117.0000000000,4401.0000000000,,False
KolnBote,Aktuelle Polizei-Zahlen - Das sind die Trends der miesen Autoklau-Banden https://t.co/70gPV8Ng5J https://t.co/KstpnEdPWo,Germany,German,2017-08-15T22:02:00,2017-08-15T22:02:00,1758.0000000000,1117.0000000000,4402.0000000000,,False
KolnBote,"„Arsch huh, Zäng ussenander“: Der Chlodwigplatz 1992 war nur der Anfang https://t.co/dQJndnW8MI https://t.co/uzsheQceI8",Germany,German,2017-08-16T04:17:00,2017-08-16T04:18:00,1758.0000000000,1116.0000000000,4403.0000000000,,False
KolnBote,Halbe Milliarde Euro Investition: Neustart für das Gerling-Quartier https://t.co/cZyqVpkwDA https://t.co/3xgD24BNLA,Germany,German,2017-08-16T06:04:00,2017-08-16T06:05:00,1758.0000000000,1116.0000000000,4404.0000000000,,False
KolnBote,Tunnel Lövenich: A1 ab Montag für Wartungsarbeiten nachts vollgesperrt https://t.co/ouzGlrLzJs https://t.co/ULjZJkiGMX,Germany,German,2017-08-16T08:32:00,2017-08-16T08:32:00,1757.0000000000,1115.0000000000,4406.0000000000,,False
KolnBote,#Köln #Cologne https://t.co/8kxSl3MLRc,Germany,German,2017-08-16T09:24:00,2017-08-16T09:25:00,1757.0000000000,1115.0000000000,4407.0000000000,,False
KolnBote,Nach Kölner Seilbahn-Panne: Staatsanwaltschaft sichert vier weitere Gondeln https://t.co/NvqGvwKDz9 https://t.co/giqgbdPUxB,Germany,German,2017-08-16T10:29:00,2017-08-16T10:29:00,1757.0000000000,1115.0000000000,4408.0000000000,,False
KolnBote,Generalprobe vor den Fans: Kölsch-Band Miljö stellt neue Songs vor https://t.co/wRLtpLCnlf https://t.co/MtMKSgwtsp,Germany,German,2017-08-16T11:23:00,2017-08-16T11:23:00,1757.0000000000,1115.0000000000,4409.0000000000,,False
KolnBote,Polizei in Köln attackiert: Freispruch für Kaiserslauterer nach Randale im Fan-Zug https://t.co/GdQfflYPxS https://t.co/1fd5y3aAqA,Germany,German,2017-08-16T13:25:00,2017-08-16T13:26:00,1757.0000000000,1115.0000000000,4411.0000000000,,False
KolnBote,Verurteilung wegen Raub: Mann suchte gezielt Treffpunkte Homosexueller als Tatort https://t.co/Jm8k9Nlqst https://t.co/wGBT1NwwcX,Germany,German,2017-08-16T15:23:00,2017-08-16T15:23:00,1757.0000000000,1115.0000000000,4412.0000000000,,False
KolnBote,„Interactive Festival“: Initiative präsentiert Innovationen der digitalen Kultur https://t.co/dN7nYPhngx https://t.co/JWyLBCdoBl,Germany,German,2017-08-16T17:32:00,2017-08-16T17:32:00,1757.0000000000,1115.0000000000,4414.0000000000,,False
KolnBote,Wandern mit Sonya Kraus - Natter wird nach Marco Schreyl benannt https://t.co/KMJtQ9CFNK https://t.co/96V2vw0W7i,Germany,German,2017-08-16T18:32:00,2017-08-16T18:32:00,1757.0000000000,1114.0000000000,4416.0000000000,,False
KolnBote,c/o-pop-Festival und Springinsfeld: Köln feiert nationale und internationale Künstler https://t.co/sVkoytB0wG https://t.co/LMN5JuvD4N,Germany,German,2017-08-16T20:23:00,2017-08-16T20:23:00,1757.0000000000,1113.0000000000,4417.0000000000,,False
KolnBote,Musikfestival: c/o pop im Tanzbrunnen eröffnet https://t.co/eDKrQVc2pR https://t.co/ZvQ7WSUKU7,Germany,Norwegian,2017-08-16T21:23:00,2017-08-16T21:23:00,1757.0000000000,1113.0000000000,4418.0000000000,,False
KolnBote,*** BILDplus Inhalt *** „California Dreaming“ - Currywurst-Mann kriegt ’ne eigene Show auf RTL­ II https://t.co/8vMH0B2qkI https://t.co/I4ynjJInMB,Germany,German,2017-08-16T23:33:00,2017-08-16T23:33:00,1757.0000000000,1113.0000000000,4419.0000000000,,False
KolnBote,Drama: Glückliches Ende einer Hundesuche https://t.co/bU8mQq02D4 https://t.co/UgZ2KQf1MP,Germany,German,2017-08-17T06:23:00,2017-08-17T06:23:00,1757.0000000000,1114.0000000000,4420.0000000000,,False
