author_id,content,region,language,publish_date,harvested_date,following,followers,updates,post_type,retweet
KolyaBurkov,В Санкт-Петербурге отменен концерт ко Дню народного единства из-за ЧП с А321 https://t.co/x923SrYs9J #7K9268 https://t.co/Ejw0dSzcOc,Unknown,Ukrainian,2015-11-03 20:12:00,2015-11-03 20:12:00,892,238,2547,R,1
KolyaBurkov,Михаил Саакашвили решил реализовать закон о декоммунизации https://t.co/ZjhOW3j5NC https://t.co/qBiJQBtiNM,Unknown,Russian,2015-11-04 01:33:00,2015-11-04 01:33:00,892,238,2550,R,1
KolyaBurkov,Путин признан Forbes самым влиятельным человеком в мире в третий раз Три года назад глава России сместил с …  https://t.co/gcO6OME0pH,Unknown,Russian,2015-11-04 15:33:00,2015-11-04 15:34:00,891,238,2553,R,1
KolyaBurkov,На новых белорусских деньгах появится орфографическая ошибка  https://t.co/3LzG1hKs1r,Unknown,Russian,2015-11-04 16:33:00,2015-11-04 16:38:00,891,238,2554,R,1
KolyaBurkov,Неизвестный ранил ножом пятерых в студгородке США и был убит полицией https://t.co/7Emzz8beZ2 https://t.co/sjOrh69hfv,Unknown,Russian,2015-11-04 19:54:00,2015-11-04 19:54:00,891,238,2555,R,1
KolyaBurkov,Forbes назвал самых высокооплачиваемых поп-певиц мира: https://t.co/U8H4UmEgSY,Unknown,Russian,2015-11-05 12:18:00,2015-11-05 12:19:00,891,238,2559,R,1
KolyaBurkov,Предприятия Татарстана осваивают выпуск отечественных запчастей к сельхозтехнике https://t.co/zdFH4sw6VA https://t.co/0KFLwQEqRp,Unknown,Russian,2015-11-05 13:14:00,2015-11-05 13:14:00,891,238,2560,R,1
KolyaBurkov,«Для мер предосторожности есть очень веские основания». Почему правительство Британии эвакуирует граждан из Египта.  https://t.co/RxpvAxqc2L,Unknown,Russian,2015-11-05 19:14:00,2015-11-05 19:15:00,891,238,2562,R,1
KolyaBurkov,Туроператоры не смогут вернуть все деньги за путевки в Египет  https://t.co/PtqCU9kG2x,Unknown,Ukrainian,2015-11-06 17:15:00,2015-11-06 17:16:00,891,238,2563,R,1
KolyaBurkov,"NI: США признали, что их авианосцы находятся в глубоком кризисе https://t.co/xZedVzD12T © AP Photo/ U.S. Navy https://t.co/NX7DuOb6He",Unknown,Russian,2015-11-07 10:33:00,2015-11-07 10:33:00,891,238,2568,R,1
KolyaBurkov,Не попавшие в Египет россияне соглашаются с заменой путевок на Турцию https://t.co/6eZWMu0i0Z,Unknown,Russian,2015-11-07 11:55:00,2015-11-07 11:57:00,891,238,2569,R,1
KolyaBurkov,На аукционе в США продали гитару Джона Леннона  https://t.co/aU0W4m8iOJ https://t.co/IYIAJgd6mR,Unknown,Russian,2015-11-08 05:52:00,2015-11-08 05:52:00,891,239,2572,R,1
KolyaBurkov,РФ и КНР обсуждают создание низкоорбитальной спутниковой системы https://t.co/L7TtI3568r https://t.co/6zFQPMDGrM,Unknown,Russian,2015-11-08 11:22:00,2015-11-08 11:22:00,891,239,2574,R,1
KolyaBurkov,Reuters: последние записи звуков A321 говорят о взрыве бомбы  https://t.co/TpqlEiP81t,Unknown,Russian,2015-11-08 13:11:00,2015-11-08 13:11:00,891,239,2575,R,1
KolyaBurkov,"МЧС: автобус и «КамАЗ» столкнулись в Грозном, есть пострадавшие https://t.co/34xSNKoZI6 https://t.co/GpI66iQq8A",Unknown,Russian,2015-11-08 14:33:00,2015-11-08 14:33:00,891,239,2576,R,1
KolyaBurkov,"Рыжиков: когда узнал, что кого-то отцепили от сборной, догадался, что меня https://t.co/5Rpc8hXNx3",Unknown,Russian,2015-11-08 16:37:00,2015-11-08 16:37:00,891,239,2578,R,1
KolyaBurkov,Поезд с нефтью сошел с рельсов в штате Висконсин https://t.co/oOqFiPfe1Y https://t.co/in2Hzhgz7V,Unknown,Russian,2015-11-09 04:52:00,2015-11-09 04:52:00,891,239,2579,R,1
KolyaBurkov,В Московском регионе ожидается до 3 градусов тепла и гололедица  https://t.co/ykaqTnJ35J,Unknown,Russian,2015-11-09 05:15:00,2015-11-09 05:15:00,891,239,2580,R,1
KolyaBurkov,"Фигуранты дела об аварии в московском метро получили от 5,5 до 6 лет тюрьмы https://t.co/cteIr1dbYj https://t.co/ZjTa3fcs6p",Unknown,Russian,2015-11-09 17:23:00,2015-11-09 17:23:00,891,237,2582,R,1
KolyaBurkov,Журавский: не вижу в действиях букмекеров противоречий с законодательством https://t.co/kcg7HdJCn0,Unknown,Russian,2015-11-10 15:12:00,2015-11-10 15:13:00,890,236,2584,R,1
KolyaBurkov,Лавров и глава МИД ФРГ обсудили итоги встречи в Берлине 6 ноября и ситуацию в Сирии https://t.co/3YaMYws3YL,Unknown,Russian,2015-11-10 17:22:00,2015-11-10 17:22:00,890,236,2585,R,1
KolyaBurkov,Похороны погибших при крушении Ми-8 пройдут 14 ноября в Туве https://t.co/EFdtYXcRIj https://t.co/Hnmk9nxSlE,Unknown,Russian,2015-11-11 06:11:00,2015-11-11 06:11:00,890,235,2588,R,1
KolyaBurkov,В Disney научились создавать роботов в полуавтоматическом режиме https://t.co/hrDyotLNUn,Unknown,Russian,2015-11-11 09:56:00,2015-11-11 09:57:00,890,235,2589,R,1
KolyaBurkov,Медведев снова сменит Путина. Not really... https://t.co/jmVzj7lq85 https://t.co/RiKR9ouAlG,Unknown,Russian,2015-11-11 23:13:00,2015-11-11 23:13:00,890,235,2593,R,1
KolyaBurkov,Парламентарии ждут от послания Владимира Путина оценки международной ситуации https://t.co/G4qz9EP7p0 © AP Photo https://t.co/DP9pxtYoIt,Unknown,Russian,2015-11-12 14:34:00,2015-11-12 14:34:00,890,235,2599,R,1
KolyaBurkov,Под «Черным квадратом» Малевича нашли две другие картины  https://t.co/u0G6q5HFI5 https://t.co/FneaWbgeEI,Unknown,Russian,2015-11-12 14:45:00,2015-11-12 14:46:00,890,235,2600,R,1
KolyaBurkov,Госавиаслужба Украины не нашла серьезных рисков для прекращения полетов в Шарм-эль-Шейх https://t.co/G29hE54pCG,Unknown,Ukrainian,2015-11-12 22:14:00,2015-11-12 22:14:00,889,236,2601,R,1
KolyaBurkov,Новым послом Японии в России назначен Тоёхиса Кодзуки  https://t.co/4MMaAByhSz https://t.co/CeJB2APPii,Unknown,Russian,2015-11-13 03:12:00,2015-11-13 03:12:00,889,236,2603,R,1
KolyaBurkov,У «Hyundai Motor СНГ» появился новый гендиректор https://t.co/wWe6kYgZqu,Unknown,Russian,2015-11-13 14:22:00,2015-11-13 14:22:00,889,236,2607,R,1
KolyaBurkov,"""Аэрофлот"" прекращает полеты в Египет с 1 декабря по 27 марта https://t.co/piAwxkYQuJ",Unknown,Macedonian,2015-11-13 15:52:00,2015-11-13 15:52:00,889,236,2608,R,1
KolyaBurkov,Франция — Германия: мяч на поле доставила машинка на дистанционном управлении https://t.co/cy9yxRcRDx,Unknown,Russian,2015-11-13 21:59:00,2015-11-13 21:59:00,889,236,2611,R,1
KolyaBurkov,Белый дом: США не собираются своими действиями в Южно-Китайском море бросать вызов КНР https://t.co/JRwapDuNsf https://t.co/6YP05KlZEl,Unknown,Russian,2015-11-13 22:55:00,2015-11-13 22:56:00,889,236,2612,R,1
KolyaBurkov,"Песков: Путин глубоко соболезнует в связи с серией терактов в Париже, передает слова поддержки и солидарности  https://t.co/QrdhlRiWyG",Unknown,Russian,2015-11-13 23:54:00,2015-11-13 23:54:00,889,236,2613,R,1
KolyaBurkov,"Заложник в театре Bataclan: ""трупы повсюду"" https://t.co/jzGhO9L5FI",Unknown,Russian,2015-11-13 23:55:00,2015-11-13 23:55:00,889,236,2614,R,1
KolyaBurkov,После атак в Париже глава МВД Италии созывает Нацсовет безопасности  https://t.co/6k5uGKsYoH https://t.co/38dNEijqpV,Unknown,Russian,2015-11-14 00:53:00,2015-11-14 00:53:00,889,236,2615,R,1
KolyaBurkov,Как российские политики отреагировали на теракты во Франции - в материале ТАСС https://t.co/Veh16JVNtG #Теракты_в_Париже,Unknown,Russian,2015-11-14 06:53:00,2015-11-14 06:53:00,889,236,2620,R,1
KolyaBurkov,Как отреагировали в мире на трагедию в Париже  https://t.co/mSEKbExnHk https://t.co/XqxjstaU1p,Unknown,Russian,2015-11-14 10:20:00,2015-11-14 10:21:00,889,236,2621,R,1
KolyaBurkov,"Футбольная ассоциация Англии объяснила, почему матч с Францией не отменён https://t.co/VRiYQihfAb",Unknown,Russian,2015-11-14 16:16:00,2015-11-14 16:16:00,889,236,2623,R,1
KolyaBurkov,Из-за терактов в Париже Польша отказывается принимать беженцев https://t.co/m4WH4vp7qU https://t.co/SQGTk43Vhh,Unknown,Russian,2015-11-14 17:10:00,2015-11-14 17:10:00,889,236,2624,R,1
KolyaBurkov,В России зажигают свечи в память о погибших при терактах в Париже https://t.co/1kmHH6FvJ0 #PrayForParis https://t.co/jwJysQBXlv,Unknown,Russian,2015-11-14 17:11:00,2015-11-14 17:11:00,889,236,2625,R,1
KolyaBurkov,Заголовки ведущих зарубежных СМИ о парижской трагедии https://t.co/XoV2iuFRKk,Unknown,Russian,2015-11-14 18:33:00,2015-11-14 18:33:00,889,236,2627,R,1
KolyaBurkov,Заголовки сегодняшних газет #news #новости #ParisAttacks #PrayForParis https://t.co/sug7CmL7Nt,Unknown,Russian,2015-11-14 19:32:00,2015-11-14 19:32:00,889,236,2628,R,1
KolyaBurkov,Редакция Charlie Hebdo выразила соболезнования семьям погибших и пострадавших во время терактов в Париже  https://t.co/QrdhlR1lH8,Unknown,Russian,2015-11-14 20:33:00,2015-11-14 20:33:00,889,236,2629,R,1
KolyaBurkov,МИД России увидел в парижских терактах повод для смены приоритетов НАТО https://t.co/TvTkLkEGnk,Unknown,Russian,2015-11-15 08:15:00,2015-11-15 08:15:00,889,236,2632,R,1
KolyaBurkov,Кандидат в президенты США Берни Сандерс: Америка тратит слишком много денег на армию https://t.co/hXwZM23ygj https://t.co/SmI8rXulXo,Unknown,Russian,2015-11-15 09:17:00,2015-11-15 09:17:00,889,236,2633,R,1
KolyaBurkov,Эрдоган: малые и средние предприятия должны стать мощным сектором мировой экономики https://t.co/GIJ7gtpCb2 https://t.co/5YaEyaldXB,Unknown,Russian,2015-11-15 09:52:00,2015-11-15 09:52:00,889,236,2634,R,1
KolyaBurkov,На Украине фиксируются десятки нарушений на местных выборах https://t.co/ZTJHBxoJvf,Unknown,Russian,2015-11-15 11:12:00,2015-11-15 11:12:00,889,236,2635,R,1
KolyaBurkov,Reuters опубликовал первое фото встречи Путина и Обамы на саммите G20 в Турции https://t.co/oL7lCk5g93 https://t.co/9fa3Qumx0W,Unknown,Russian,2015-11-15 13:34:00,2015-11-15 13:34:00,889,236,2637,R,1
KolyaBurkov,МИД: Россия готова создать с Египтом центр по борьбе с терроризмом https://t.co/r9jRuFG9FR https://t.co/vNs9uaaM4b,Unknown,Russian,2015-11-15 15:51:00,2015-11-15 15:51:00,889,236,2638,R,1
KolyaBurkov,Голосование во втором туре выборов мэров завершилось на Украине https://t.co/kLYwqXivYl https://t.co/IkbQ4P5VFx,Unknown,Russian,2015-11-15 18:52:00,2015-11-15 18:53:00,889,236,2639,R,1
KolyaBurkov,Семья из пяти человек на Камчатке отравилась насмерть угарным газом  https://t.co/zvGnyZ38td https://t.co/aJYA1x12sL,Unknown,Russian,2015-11-16 02:55:00,2015-11-16 02:55:00,889,236,2642,R,1
KolyaBurkov,Банк «Открытие» выпустил карты по мотивам «Игры престолов»  https://t.co/dc3LpFir9S https://t.co/oT1oMQwR3z,Unknown,Russian,2015-11-16 09:15:00,2015-11-16 09:15:00,889,236,2643,R,1
KolyaBurkov,Генри Киссинджер: методы России и США по борьбе с экстремизмом пересекаются https://t.co/4hvPJUfzhL https://t.co/Ee4QXbcZrE,Unknown,Russian,2015-11-16 23:52:00,2015-11-16 23:52:00,889,237,2647,R,1
KolyaBurkov,Райффайзенбанк опроверг собственную продажу https://t.co/bNVlFmYvTC,Unknown,Russian,2015-11-17 08:34:00,2015-11-17 08:34:00,889,237,2650,R,1
KolyaBurkov,МВД Египта опровергло сообщение о задержании сотрудников аэропорта из-за теракта на борту А321 https://t.co/VGMNe1SNDD,Unknown,Russian,2015-11-17 11:37:00,2015-11-17 11:38:00,889,237,2653,R,1
KolyaBurkov,Лавров заявил о необходимости пресечь замыслы ИГ https://t.co/yin5plnjvm,Unknown,Russian,2015-11-17 11:37:00,2015-11-17 11:37:00,889,237,2652,R,1
KolyaBurkov,"В связи с выступлением темнейшего,мне почему то навеяло.. https://t.co/Dp5ECvvrWH с помощью @YouTube",Unknown,Russian,2015-11-17 13:54:00,2015-11-17 13:54:00,889,237,2658,R,1
KolyaBurkov,В «Донбасс Опере» идет подготовка к фестивалю «Звезды мирового балета» (видео) https://t.co/wQazrA7cj7,Unknown,Russian,2015-11-17 18:11:00,2015-11-17 18:11:00,889,237,2659,R,1
KolyaBurkov,'@Rus_NV И снова ответочка? https://t.co/Jx73XwxL4P',Unknown,Bulgarian,2015-11-17 18:55:00,2015-11-17 18:55:00,888,237,2660,R,1
KolyaBurkov,МВД ФРГ: количество сведений о возможности теракта на матче в Ганновере росло  https://t.co/cItZULiawL,Unknown,Russian,2015-11-17 21:32:00,2015-11-17 21:32:00,888,237,2661,R,1
KolyaBurkov,Один из возможных участников теракта в Париже сбежал в Бельгию https://t.co/P63IYVKueB https://t.co/z8nbdMhBDk,Unknown,Russian,2015-11-18 03:14:00,2015-11-18 03:14:00,888,237,2663,R,1
KolyaBurkov,Самолет Air France перенаправили в Солт-Лейк-Сити из-за угрозы взрыва https://t.co/uUxckwjnmK,Unknown,Ukrainian,2015-11-18 04:12:00,2015-11-18 04:12:00,888,237,2664,R,1
KolyaBurkov,Познакомьтесь с удивительными свойствами ленты Мёбиуса с помощью инфографики Ria.ru: https://t.co/MC8DRuheEd https://t.co/DhEiKSiQpq,Unknown,Russian,2015-11-18 05:13:00,2015-11-18 05:13:00,888,237,2665,R,1
KolyaBurkov,«Нанотех» изготовил первую партию газоразделительных мембранных модулей https://t.co/sKhsgcDLiK,Unknown,Russian,2015-11-18 12:37:00,2015-11-18 12:37:00,888,237,2667,R,1
KolyaBurkov,Франция надеется на коалицию с РФ и США  https://t.co/6ShYXIrBER https://t.co/7CG7oZLHyN,Unknown,Russian,2015-11-18 13:33:00,2015-11-18 13:34:00,888,237,2668,R,1
KolyaBurkov,«Ты не можешь жить в стрессе и всегда быть сильным»  https://t.co/Ykw3U1ja1a https://t.co/cP9Lnkh7Ph,Unknown,Russian,2015-11-18 13:52:00,2015-11-18 13:52:00,888,237,2669,R,1
KolyaBurkov,Премьер Франции: теракты в Париже изменили позицию США и России https://t.co/x7wV8iI80P https://t.co/raj0QL46AJ,Unknown,Russian,2015-11-18 15:35:00,2015-11-18 15:35:00,888,237,2670,R,1
KolyaBurkov,Служба безопасности московского метро выборочно проверяет сумки входящих пассажиров https://t.co/Ll5CVwSG3S,Unknown,Russian,2015-11-18 17:11:00,2015-11-18 17:11:00,888,237,2671,R,1
KolyaBurkov,"Вы не поверите, но у нас тут хорошие новости про рубль, доллар и санкции:  https://t.co/b5he8mtywX",Unknown,Uzbek,2015-11-18 19:34:00,2015-11-18 19:34:00,888,237,2672,R,1
KolyaBurkov,Рашка всё! © https://t.co/jYl6w3yIwc,Unknown,Russian,2015-11-19 11:21:00,2015-11-19 11:21:00,888,238,2676,R,1
KolyaBurkov,Дальнобойщики заявили о формировании протестной колонны в 57 км https://t.co/3RZjy3QHcv,Unknown,Russian,2015-11-19 17:55:00,2015-11-19 17:57:00,887,237,2679,R,1
KolyaBurkov,МИД России раскритиковал удары Франции по нефтяной инфраструктуре Сирии https://t.co/qFYfaOTDhW,Unknown,Russian,2015-11-19 23:56:00,2015-11-19 23:56:00,887,237,2682,R,1
KolyaBurkov,Александр Овечкин забросил  484-ю шайбу в НХЛ и побил рекорд по голам российских хоккеистов  https://t.co/TcsvC1CdYx https://t.co/iaoos3LLgn,Unknown,Russian,2015-11-20 03:55:00,2015-11-20 03:55:00,887,237,2683,R,1
KolyaBurkov,Генсек ООН призвал глав Израиля и Палестины выступить против насилия https://t.co/uXNx3nWEoc https://t.co/cg0IZwSQU7,Unknown,Russian,2015-11-20 04:13:00,2015-11-20 04:13:00,887,237,2684,R,1
KolyaBurkov,Медведев подписал постановление о закупках софта для госорганов https://t.co/WVL3fiTWlb https://t.co/Iw6LDCPy5Y,Unknown,Ukrainian,2015-11-20 04:53:00,2015-11-20 04:53:00,887,237,2685,R,1
KolyaBurkov,Дипмиссия РФ не подтвердила данные о россиянах среди заложников в Мали https://t.co/WE6aPVeZlw © flickr https://t.co/uFD0e9Oe1b,Unknown,Russian,2015-11-20 10:52:00,2015-11-20 10:53:00,887,237,2686,R,1
KolyaBurkov,Минфин РФ: МВФ признал суверенным долг Украины перед Россией  https://t.co/oicGZeolxi,Unknown,Russian,2015-11-20 11:32:00,2015-11-20 11:32:00,887,237,2687,R,1
KolyaBurkov,Определены лауреаты премии правительства России в области образования https://t.co/EoNLd1Qg2z https://t.co/lIwQUjbafb,Unknown,Russian,2015-11-21 06:14:00,2015-11-21 06:14:00,887,237,2695,R,1
KolyaBurkov,В результате крушения вертолета в Новой Зеландии погибли семь человек https://t.co/vHX8FbCXQV,Unknown,Russian,2015-11-21 06:20:00,2015-11-21 06:20:00,887,237,2696,R,1
KolyaBurkov,ЧП в аэропорту Домодедово  https://t.co/CJITkKYLzc https://t.co/mLqy1pEAYQ,Unknown,Ukrainian,2015-11-21 14:33:00,2015-11-21 14:34:00,887,237,2698,R,1
KolyaBurkov,Работы по заземлению ЛЭП у границы с Крымом завершены https://t.co/8xH7r69GY5,Unknown,Russian,2015-11-21 21:34:00,2015-11-21 21:34:00,887,237,2701,R,1
KolyaBurkov,"""Ювентус"" победил ""Милан"" благодаря голу Дибалы https://t.co/0XngZsviJm",Unknown,Russian,2015-11-21 22:43:00,2015-11-21 22:43:00,887,237,2702,R,1
KolyaBurkov,В Одессе шесть человек погибли при лобовом ДТП https://t.co/8YWQe54sK1,Unknown,Russian,2015-11-22 00:14:00,2015-11-22 00:14:00,887,237,2703,R,1
KolyaBurkov,ФБР не подтвердила информацию Anonymous о планах ИГ устроить взрыв в Атланте https://t.co/W7Lv53EyfK,Unknown,Ukrainian,2015-11-22 00:33:00,2015-11-22 00:33:00,887,237,2704,R,1
KolyaBurkov,Снегоход с четырьмя пассажирами ушел под лед в Хабаровском крае https://t.co/In3cRt3MmL https://t.co/R6X9kYomcp,Unknown,Russian,2015-11-22 04:56:00,2015-11-22 04:56:00,887,237,2705,R,1
KolyaBurkov,"уважаю выбор каждого, кто не идет в армию. кто-то же должен рожать",Unknown,Russian,2015-11-22 08:51:00,2015-11-22 08:51:00,887,237,2706,R,1
KolyaBurkov,Близкие погибших в Мали россиян несут цветы к офису «Волга-Днепр»  https://t.co/vdfv4PJlEm https://t.co/ZtSmZpHB55,Unknown,Russian,2015-11-22 11:13:00,2015-11-22 11:13:00,887,236,2708,R,1
KolyaBurkov,Источник: в одном из районов Нальчика произошла перестрелка https://t.co/hSQZURrpUn https://t.co/RCM1hdprKW,Unknown,Russian,2015-11-22 18:53:00,2015-11-22 18:53:00,887,236,2712,R,1
KolyaBurkov,'@turist532 приходя - гасите всех!',Unknown,Russian,2015-11-23 07:54:00,2015-11-23 07:54:00,887,236,2716,R,1
KolyaBurkov,Глава Красногорского района Подмосковья Борис Рассказов ушел в отставку https://t.co/10StH1nXL0,Unknown,Russian,2015-11-23 10:15:00,2015-11-23 10:15:00,887,237,2717,R,1
KolyaBurkov,Минобороны России отвергло обвинения США в ударах по оппозиции в Сирии https://t.co/MyYRDxJTDU https://t.co/GfOwRP8JHn,Unknown,Russian,2015-11-23 10:22:00,2015-11-23 10:22:00,887,237,2718,R,1
KolyaBurkov,ЛНР заявила об увеличении числа провокаций со стороны силовиков https://t.co/AmktbrO0Z2 https://t.co/pkB7T9wVdW,Unknown,Russian,2015-11-23 11:14:00,2015-11-23 11:14:00,887,237,2719,R,1
KolyaBurkov,"Отстраненный президент ФИФА Блаттер заявил, что был близок к смерти https://t.co/hbCfI5Bnnv https://t.co/JK53LbBpk3",Unknown,Russian,2015-11-23 11:15:00,2015-11-23 11:15:00,887,237,2720,R,1
KolyaBurkov,Индекс ММВБ достиг максимума с 2008 года  https://t.co/QOXpzb37tD,Unknown,Bulgarian,2015-11-23 13:11:00,2015-11-23 13:19:00,887,237,2723,R,1
KolyaBurkov,Порошенко предлагает прекратить грузовое транспортное сообщение с Крымом https://t.co/FQFheC5Wne,Unknown,Russian,2015-11-23 13:16:00,2015-11-23 13:16:00,887,237,2724,R,1
KolyaBurkov,Роухани заявил о готовности Тегерана наращивать экспорт энергоресурсов https://t.co/NaRx2J6bBz https://t.co/KdpVRpyrPO,Unknown,Russian,2015-11-23 14:57:00,2015-11-23 14:58:00,887,237,2725,R,1
KolyaBurkov,Болельщики «Динамо» смогут бесплатно пойти на «Анжи» по билету на дерби с «Локо» https://t.co/RhyVTJw2zr,Unknown,Russian,2015-11-23 17:18:00,2015-11-23 17:18:00,887,238,2726,R,1
KolyaBurkov,Власти Бельгии предъявили обвинения в терроризме одному задержанному https://t.co/xGlUMM5S8L,Unknown,Russian,2015-11-23 19:17:00,2015-11-23 19:18:00,887,238,2729,R,1
KolyaBurkov,Степашин: «Урал» договорных матчей не играет https://t.co/gg8URLClGy,Unknown,Russian,2015-11-24 14:42:00,2015-11-24 14:42:00,887,238,2734,R,1
KolyaBurkov,"Хеккинг: ЦСКА умеет и хочет играть в футбол, «Вольфсбургу» надо быть осторожным https://t.co/knqrqprdZG",Unknown,Russian,2015-11-24 17:55:00,2015-11-24 17:55:00,887,238,2736,R,1
KolyaBurkov,Евродепутат: Турция в инциденте с Су-24 проявила себя безответственно https://t.co/PKnRCpdsWC #СУ24 #УдарВСпину https://t.co/2nsaTabGbs,Unknown,Russian,2015-11-24 20:53:00,2015-11-24 20:54:00,887,238,2761,R,1
KolyaBurkov,"В НАТО заявили, что заявление Столтенберга не было согласовано с членами альянса https://t.co/chXcjcNRzL",Unknown,Russian,2015-11-24 21:34:00,2015-11-24 21:34:00,887,238,2762,R,1
KolyaBurkov,Полиция застрелила грабителя при освобождении заложников во Франции https://t.co/75b8KW7a4n,Unknown,Russian,2015-11-25 00:57:00,2015-11-25 00:57:00,887,238,2764,R,1
KolyaBurkov,"NYT: США целились по ""устному описанию"" при бомбежке госпиталя Кундуза  https://t.co/AL6n460x1Z https://t.co/DmoFl8DSc2",Unknown,Russian,2015-11-25 03:52:00,2015-11-25 03:52:00,887,238,2765,R,1
KolyaBurkov,Песков о незаконной поставке нефтепродуктов из Сирии  https://t.co/ub5Qi2uz4y https://t.co/1isxYlPzPa,Unknown,Russian,2015-11-25 11:17:00,2015-11-25 11:17:00,887,238,2768,R,1
KolyaBurkov,Украина запретила транзитные перелеты для российских авиакомпаний https://t.co/Cs0FJeViMI,Unknown,Russian,2015-11-25 12:12:00,2015-11-25 12:13:00,887,238,2769,R,1
