author_id,content,region,language,publish_date,harvested_date,following,followers,updates,post_type,retweet
KolyaBurkov,«Динамо» попросило Черчесова с поста главного тренера http://t.co/mvuxiNxdMu http://t.co/lpRDz6f4md,Unknown,Russian,2015-07-13 13:11:00,2015-07-13 13:11:00,1481,248,1938,R,1
KolyaBurkov,Чебан: количество дней для подготовки к матчам сборной было сокращено http://t.co/P6dgPuX0ii,Unknown,Russian,2015-07-15 12:53:00,2015-07-15 12:53:00,1481,248,1941,R,1
KolyaBurkov,Побег наркоторговца-миллиардера из тюрьмы сняли камеры наблюдения  http://t.co/R1EgHV7NuL http://t.co/XfK64oTC8h,Unknown,Russian,2015-07-15 14:52:00,2015-07-15 14:52:00,1481,248,1942,R,1
KolyaBurkov,«Милан» отдал вратаря Габриэла в аренду в «Наполи» http://t.co/3wcQz1JqOE,Unknown,Russian,2015-07-15 17:56:00,2015-07-15 17:56:00,1481,248,1944,R,1
KolyaBurkov,"Калифорния оштрафовала Uber на $7,3 млн за непредоставление информации http://t.co/N2onGBgSM8",Unknown,Russian,2015-07-16 01:12:00,2015-07-16 01:12:00,1481,248,1947,R,1
KolyaBurkov,"Калифорния оштрафовала Uber на $7,3 млн за непредоставление информации http://t.co/N2onGBgSM8",Unknown,Russian,2015-07-16 01:12:00,2015-07-16 01:12:00,1481,248,1947,R,1
KolyaBurkov,Из-за подземного пожара в Калифорнии крышки люков взлетали в воздух http://t.co/WFq7UkElXV,Unknown,Ukrainian,2015-07-16 02:51:00,2015-07-16 02:51:00,1481,248,1948,R,1
KolyaBurkov,Из-за подземного пожара в Калифорнии крышки люков взлетали в воздух http://t.co/WFq7UkElXV,Unknown,Ukrainian,2015-07-16 02:51:00,2015-07-16 02:51:00,1481,248,1948,R,1
KolyaBurkov,"Поговорили с американским адвокатом, подавшим в суд на Стрелкова. Признал, что шансов затащить его в суд мало https://t.co/hna7NRdtw7",Unknown,Russian,2015-07-16 16:52:00,2015-07-16 16:52:00,1481,248,1957,R,1
KolyaBurkov,У московского метро появились первые антипарковочные заграждения http://t.co/wZkYYeNbj3,Unknown,Russian,2015-07-16 17:12:00,2015-07-16 17:12:00,1481,248,1960,R,1
KolyaBurkov,Найден режиссер для нового фильма по Стивену Кингу http://t.co/xQkRzb9YE7 http://t.co/9VWsgH5y0n,Unknown,Ukrainian,2015-07-17 09:52:00,2015-07-17 09:52:00,1481,248,1965,R,1
KolyaBurkov,После сделки с Ираном курс доллара в ближайшие месяцы может превысить 60 рублей — Morgan Stanley: http://t.co/aOpVpqstZQ,Unknown,Russian,2015-07-17 12:33:00,2015-07-17 12:33:00,1481,248,1966,R,1
KolyaBurkov,"В ДНР заявили, что украинские силовики более часа обстреливают район аэропорта Донецка http://t.co/W1IDEvlrpt",Unknown,Russian,2015-07-18 03:51:00,2015-07-18 03:51:00,1481,249,1978,R,1
KolyaBurkov,Киностудию Miramax могут продать за $1 млрд http://t.co/Elcu5gW4he,Unknown,Russian,2015-07-18 07:12:00,2015-07-18 07:12:00,1481,249,1979,R,1
KolyaBurkov,Гол Насри принёс «Манчестер Сити» победу над «Мельбурн Сити» http://t.co/GshYnEEjLo,Unknown,Serbian,2015-07-18 10:53:00,2015-07-18 10:53:00,1481,249,1981,R,1
KolyaBurkov,В Кремле прокомментировали закрытие Фонда Макартуров  http://t.co/bZi1NcWJxR http://t.co/zphbg49SUa,Unknown,Russian,2015-07-22 10:32:00,2015-07-22 10:32:00,1478,258,1999,R,1
KolyaBurkov,"""Спартак"" расторг контракт с Динияром Билялетдиновым http://t.co/yPS7Ori8r3",Unknown,Serbian,2015-07-23 15:12:00,2015-07-23 15:12:00,1478,254,2005,R,1
KolyaBurkov,Суд в Киеве вынес решение о продлении ареста россиянина Ерофеева  http://t.co/mp3ppFdBlF http://t.co/dWoyX7wKc4,Unknown,Russian,2015-07-23 17:13:00,2015-07-23 17:13:00,1478,253,2006,R,1
KolyaBurkov,Сериалы разлагают молодежь http://t.co/nSO6gTFiNi,Unknown,Russian,2015-07-23 17:42:00,2015-07-23 17:42:00,1478,253,2007,R,1
KolyaBurkov,Обзор смартфона Sony Xperia Z3+: промежуточный флагман http://t.co/naNESFBshK,Unknown,Russian,2015-07-24 08:33:00,2015-07-24 08:33:00,1478,253,2008,R,1
KolyaBurkov,Уфологи разгадали тайну кругов в Тольятти   http://t.co/nrxPOCVHe8 http://t.co/gzkDEHmOMa,Unknown,Russian,2015-07-24 14:32:00,2015-07-24 14:32:00,1478,251,2011,R,1
KolyaBurkov,"Исследование: мамонтов погубило не похолодание, а потепление http://t.co/jojxg0BIj6",Unknown,Russian,2015-07-24 15:13:00,2015-07-24 15:13:00,1478,251,2012,R,1
KolyaBurkov,Золотое дно: когда стоит покупать подешевевшее золото http://t.co/q3flPrSd94,Unknown,Russian,2015-07-24 16:32:00,2015-07-24 16:32:00,1478,250,2013,R,1
KolyaBurkov,США не стали осуществлять кибератаки на КНДР в ответ на взлом Sony  #hitech,Unknown,Russian,2015-07-25 06:12:00,2015-07-25 06:12:00,1478,251,2015,R,1
KolyaBurkov,Кто взял первое золото на ЧМ по водным видам спорта в Казани  http://t.co/GuyWmQUyKj http://t.co/92qHoS5DsX,Unknown,Russian,2015-07-25 09:12:00,2015-07-25 09:12:00,1478,251,2017,R,1
KolyaBurkov,"Путин: уверен, в России будут расти и новые таланты http://t.co/dv0rWjFHmh",Unknown,Russian,2015-07-25 17:12:00,2015-07-25 17:13:00,1478,250,2018,R,1
KolyaBurkov,Жертвами крушения самолета в Токио стали три человека   http://t.co/joXUy2G72U,Unknown,Russian,2015-07-26 06:32:00,2015-07-26 06:32:00,1478,250,2019,R,1
KolyaBurkov,Турецкие истребители вновь нанесли авиаудары по позициям курдов в Ираке #новости http://t.co/wHCFlwgqGL,Unknown,Russian,2015-07-26 19:53:00,2015-07-26 19:53:00,1478,249,2023,R,1
KolyaBurkov,«Ъ»: HP приостановила производство компьютеров в России  http://t.co/lJXmENTsMe http://t.co/pmO2b4QCKm,Unknown,Russian,2015-07-28 08:52:00,2015-07-28 08:52:00,1478,247,2030,R,1
KolyaBurkov,Суд отклонил жалобу прокурора по делу против бывшего президента «Кубани» http://t.co/KL67yLUeW9,Unknown,Russian,2015-07-28 09:32:00,2015-07-28 09:32:00,1478,247,2031,R,1
KolyaBurkov,В Nokia рассказали о планах разработать камеру дополненной реальности  #hitech,Unknown,Russian,2015-07-29 05:31:00,2015-07-29 05:31:00,1478,246,2036,R,1
KolyaBurkov,Соведущим Top Gear может стать гонщик Формулы-1 http://t.co/EIgmINBXEv,Unknown,Russian,2015-07-29 15:31:00,2015-07-29 15:31:00,1478,246,2039,R,1
KolyaBurkov,Глава FIS: скандал в ФИФА навредил всем международным спортивным организациям http://t.co/t1ZjpfaT6I,Unknown,Russian,2015-07-30 10:32:00,2015-07-30 10:32:00,1478,246,2044,R,1
KolyaBurkov,Помощник президента предложил перенести начало учебного года на 15 сентября.   http://t.co/zV8XzVKNlL http://t.co/B5twpCRb8L,Unknown,Russian,2015-07-31 14:12:00,2015-07-31 14:12:00,1479,247,2049,R,1
KolyaBurkov,Ильсур Метшин: футбольное поле «Казань Арены» будет готово к концу года http://t.co/JZEnxFLnq2 http://t.co/wLqk8uK2F9,Unknown,Russian,2015-07-31 16:53:00,2015-07-31 16:54:00,1479,247,2050,R,1
KolyaBurkov,Обама распорядился создать самый быстрый в мире суперкомпьютер  #hitech,Unknown,Russian,2015-08-01 07:31:00,2015-08-01 07:31:00,1479,248,2054,R,1
KolyaBurkov,Глава ОАО РЖД пожаловался на нехватку средств https://t.co/DK0FsjxviN,Unknown,Russian,2015-08-02 12:12:00,2015-08-02 12:12:00,1479,244,2058,R,1
KolyaBurkov,Угонщиков престижных иномарок в Москве помогли задержать очевидцы http://t.co/qpxYxOp5gd,Unknown,Russian,2015-08-02 18:31:00,2015-08-02 18:31:00,1479,241,2061,R,1
KolyaBurkov,Зоозащитники убедили почитателей богини власти отказаться от жертвоприношения  http://t.co/rjA2wGIson http://t.co/L0KD1vWvTW,Unknown,Russian,2015-08-03 13:51:00,2015-08-03 13:51:00,1480,240,2062,R,1
KolyaBurkov,McDonald's тестирует завтраки для гурманов  http://t.co/sJlYEUvfYT http://t.co/iKuCqZjM5z,Unknown,Ukrainian,2015-08-03 14:10:00,2015-08-03 14:11:00,1480,240,2063,R,1
KolyaBurkov,Смертоносный #рак поджелудочной теперь можно выявить по анализу мочи.   http://t.co/dqJT27c7DE http://t.co/rvh17f5jOM,Unknown,Russian,2015-08-03 15:52:00,2015-08-03 15:52:00,1480,240,2064,R,1
KolyaBurkov,"Гол Мовсисяна принес ""Спартаку"" победу над ""Рубином"" в матче РФПЛ http://t.co/7CcLWMU1Iy",Unknown,Russian,2015-08-03 18:53:00,2015-08-03 18:53:00,1480,240,2065,R,1
KolyaBurkov,При крушении двух поездов в Индии погибли 30 человек http://t.co/cdnnXBAKJD,Unknown,Russian,2015-08-05 03:51:00,2015-08-05 03:52:00,1479,240,2071,R,1
KolyaBurkov,Лавров за закрытыми дверями встречается с индонезийским коллегой http://t.co/fEBIU0m91r,Unknown,Russian,2015-08-05 05:52:00,2015-08-05 05:52:00,1479,240,2073,R,1
KolyaBurkov,Путин выразил соболезнования в связи с ДТП под Хабаровском http://t.co/jH43hOnlnj,Unknown,Russian,2015-08-05 10:52:00,2015-08-05 10:52:00,1479,240,2075,R,1
KolyaBurkov,Обама: сделка с Ираном навечно закрывает Тегерану путь к ядерному оружию http://t.co/xMbH1NV4Kc,Unknown,Russian,2015-08-05 17:10:00,2015-08-05 17:12:00,1479,240,2077,R,1
KolyaBurkov,В Японии почтили минутой молчания жертв бомбардировки Хиросимы http://t.co/MrvttJGEe3,Unknown,Russian,2015-08-06 01:33:00,2015-08-06 01:33:00,1479,240,2079,R,1
KolyaBurkov,Смертельное ДТП с участием саратовского судьи расследует СКР http://t.co/ZCnKomJvQq http://t.co/cdf8lxSBoa,Unknown,Russian,2015-08-06 13:11:00,2015-08-06 13:14:00,1479,239,2082,R,1
KolyaBurkov,Почему открытие нового Суэцкого канала — главное событие недели в мире.  Факты от Би-би-си  http://t.co/0KaeJGlC28 http://t.co/oNCQPE5L3w,Unknown,Russian,2015-08-06 19:12:00,2015-08-06 19:13:00,1479,239,2084,R,1
KolyaBurkov,"Конгресс США должен заблокировать сделку с Ираном, убеждены республиканцы-кандидаты  http://t.co/Qtcls8OkPl",Unknown,Russian,2015-08-06 23:12:00,2015-08-06 23:12:00,1479,240,2086,R,1
KolyaBurkov,Куэнка представлен в качестве игрока «Бурсаспора» http://t.co/WQmGWpQI9Z,Unknown,Russian,2015-08-07 14:54:00,2015-08-07 14:54:00,1479,240,2087,R,1
KolyaBurkov,"Гол Данни принес ""Зениту"" четвертую победу в РФПЛ http://t.co/I7j0HqsFgS",Unknown,Russian,2015-08-09 15:31:00,2015-08-09 15:31:00,1479,240,2095,R,1
KolyaBurkov,Кабмин утвердил порядок формирования перечня причастных к терроризму http://t.co/YcJQ9RznkJ,Unknown,Russian,2015-08-11 06:12:00,2015-08-11 06:12:00,1479,238,2105,R,1
KolyaBurkov,"Керри рассказал, из-за чего может рухнуть доллар  http://t.co/vqkJS6Qwcz http://t.co/QKKcW3XLbG",Unknown,Uzbek,2015-08-11 19:31:00,2015-08-11 19:32:00,1479,239,2112,R,1
KolyaBurkov,Турция и США договорились о создании «зоны безопасности» на севере Сирии: http://t.co/omRrdygSMH,Unknown,Russian,2015-08-11 19:51:00,2015-08-11 19:52:00,1479,239,2113,R,1
KolyaBurkov,"Фашистские выродки - заклятые враги русского народа, - верно и сегодня http://t.co/LQjgjHVPpD #россия #фашизм #антифашизм",Unknown,Russian,2015-08-12 00:12:00,2015-08-12 00:15:00,1479,239,2115,R,1
KolyaBurkov,"Губернатор Севастополя Меняйло отметит эту дату концертом группы ""Ласковый май"" на пл. Нахимова. Ок. https://t.co/GQoxZvFbht",Unknown,Russian,2015-08-12 05:11:00,2015-08-12 05:11:00,1479,239,2116,R,1
KolyaBurkov,В США по подозрению в кибермошенничестве арестован выходец из России  #hitech,Unknown,Russian,2015-08-12 08:31:00,2015-08-12 08:31:00,1479,239,2119,R,1
KolyaBurkov,"Полиция обезвредила международную ОПГ, похитившую $1 миллион у китайской компании http://t.co/uszAEgvSfe",Unknown,Russian,2015-08-12 10:12:00,2015-08-12 10:12:00,1479,239,2121,R,1
KolyaBurkov,Имя Владимира Высоцкого появилось на карте Москвы http://t.co/fBnbf3r1T1 http://t.co/JdHb0ALdTf,Unknown,Russian,2015-08-12 14:13:00,2015-08-12 14:13:00,1479,239,2123,R,1
KolyaBurkov,Подозреваемый в убийстве журналиста Бузины отказался свидетельствовать в суде http://t.co/TCFOX1EGjy,Unknown,Russian,2015-08-12 16:32:00,2015-08-12 16:32:00,1479,239,2124,R,1
KolyaBurkov,Источник: пожар на Москва-реке мог возникнуть из-за разгерметизация нефтепровода http://t.co/KA2MA6VMXo,Unknown,Russian,2015-08-12 17:11:00,2015-08-12 17:11:00,1479,239,2125,R,1
KolyaBurkov,Сооснователь Комитета по спасению Украины Марков задержан в Италии с российским паспортом http://t.co/Ve5rDSuDvY,Unknown,Russian,2015-08-12 17:13:00,2015-08-12 17:13:00,1479,239,2126,R,1
KolyaBurkov,В центре Лондона обнаружили захоронение времен Великой чумы http://t.co/UHN7NeaHZV,Unknown,Russian,2015-08-13 07:31:00,2015-08-13 07:31:00,1479,240,2129,R,1
KolyaBurkov,ФИФА проверит ход подготовки Волгограда к ЧМ-2018 9 сентября http://t.co/fSGRDyW0V6,Unknown,Serbian,2015-08-13 10:07:00,2015-08-13 10:07:00,1479,240,2130,R,1
KolyaBurkov,Bloomberg поставил экономику Румынии на первое место в ЕС по росту ВВП http://t.co/81IKJZhe0A,Unknown,Russian,2015-08-13 13:33:00,2015-08-13 13:33:00,1478,239,2132,R,1
KolyaBurkov,"'@Dasssha2010 а что? Вполне правдоподобно! По-пьяни бросили окурок в реку и вода вспыхнула, да.'",Unknown,Russian,2015-08-13 17:51:00,2015-08-13 17:51:00,1478,239,2135,R,1
KolyaBurkov,СМИ: сын бен Ладена призывает к нападениям на Лондон  http://t.co/XPyJ5S54i4 http://t.co/gZO2v2V1F1,Unknown,Russian,2015-08-15 05:51:00,2015-08-15 05:52:00,1477,237,2142,R,1
KolyaBurkov,Guardian: Apple секретно разрабатывает беспилотный автомобиль  https://t.co/y9IhDx5Wkx http://t.co/WxNTa2ed6z,Unknown,Russian,2015-08-15 17:11:00,2015-08-15 17:11:00,1477,237,2144,R,1
KolyaBurkov,"Поймите, блядь!",Unknown,Macedonian,2015-08-15 22:12:00,2015-08-15 22:12:00,1477,237,2146,R,1
KolyaBurkov,"В США воздушный шар приземлился на линии электропередач, трое пострадали http://t.co/E2feakydCn",Unknown,Russian,2015-08-16 06:51:00,2015-08-16 06:51:00,1477,237,2148,R,1
KolyaBurkov,Apple готовится обновить Magic Mouse и Wireless Keyboard http://t.co/qUHUls3Tby,Unknown,Russian,2015-08-17 10:13:00,2015-08-17 10:13:00,1477,237,2152,R,1
KolyaBurkov,вот фартануло так фартануло https://t.co/msX0eaweEp,Unknown,Ukrainian,2015-08-18 06:23:00,2015-08-18 06:23:00,1477,237,2157,R,1
KolyaBurkov,Samsung готовит выпуск новой линейки смартфонов Galaxy O  #hitech,Unknown,Russian,2015-08-18 13:11:00,2015-08-18 13:11:00,1478,237,2160,R,1
KolyaBurkov,Ученые завершили исследование мозга уникальной спортсменки Ольги Котелько http://t.co/5221C8bStx,Unknown,Russian,2015-08-18 16:24:00,2015-08-18 16:24:00,1478,237,2163,R,1
KolyaBurkov,Премьер Турции заявил о невозможности сформировать правительство http://t.co/MYWHSf0HUi,Unknown,Russian,2015-08-18 20:52:00,2015-08-18 20:52:00,1478,237,2164,R,1
KolyaBurkov,Nissan начнет серийное производство Qashqai в России в октябре  http://t.co/hz9ZukRde6,Unknown,Russian,2015-08-19 16:17:00,2015-08-19 16:17:00,1478,236,2167,R,1
KolyaBurkov,Производство Nissan Qashqai в Петербурге планируется начать в октябре http://t.co/jdy9jlZV5I #СПб,Unknown,Russian,2015-08-19 20:33:00,2015-08-19 20:33:00,1478,236,2169,R,1
KolyaBurkov,Захарченко: ОБСЕ игнорирует гибель мирных жителей   http://t.co/bvDdvi71yc http://t.co/7Wyyi5sYdh,Unknown,Russian,2015-08-20 09:01:00,2015-08-20 09:02:00,1478,236,2173,R,1
KolyaBurkov,МИД Украины аннулировал диппаспорта экс-премьера Азарова и его сына  http://t.co/Vt4muwmODY http://t.co/COaHewrRoz,Unknown,Russian,2015-08-20 11:13:00,2015-08-20 11:13:00,1478,236,2174,R,1
KolyaBurkov,Молло перешёл на правах аренды из «Сент-Этьена» в «Крылья Советов» http://t.co/m7c88HHyba,Unknown,Russian,2015-08-20 14:13:00,2015-08-20 14:13:00,1478,236,2175,R,1
KolyaBurkov,"""Ъ"": McDonald's заключил договор франчайзинга на открытие ресторанов сети в Сибири http://t.co/iHSKJeJRk7",Unknown,Russian,2015-08-21 00:51:00,2015-08-21 00:52:00,1478,236,2179,R,1
KolyaBurkov,Audi показала цифровую панель приборов для новой А4 http://t.co/3yGbSQkLEb,Unknown,Russian,2015-08-21 04:33:00,2015-08-21 04:33:00,1478,236,2180,R,1
KolyaBurkov,Российский хоккеист Войнов освобожден из тюрьмы в Калифорнии http://t.co/sU0QEw0c0G,Unknown,Russian,2015-08-21 05:12:00,2015-08-21 05:12:00,1478,236,2181,R,1
KolyaBurkov,СМИ: Apple потеряла 158 миллиардов долларов из-за потрясений на бирже http://t.co/Rhlm8qA2ii,Unknown,Uzbek,2015-08-22 08:31:00,2015-08-22 08:31:00,1478,236,2188,R,1
KolyaBurkov,"Малайзия подготовила отзыв на доклад о крушении ""Боинга""  http://t.co/XIXgw03ElJ http://t.co/6IQSJLG3nW",Unknown,Russian,2015-08-23 07:12:00,2015-08-23 07:12:00,1478,236,2190,R,1
KolyaBurkov,Актер Михаил Светин экстренно госпитализирован в Ленинградской области http://t.co/IjUO5RQuoo,Unknown,Russian,2015-08-23 19:33:00,2015-09-18 10:35:00,1478,236,2196,R,1
KolyaBurkov,Lada Vesta получит три мотора и три комплектации  http://t.co/ZObbnLLg8t,Unknown,Russian,2015-08-24 12:13:00,2015-08-24 12:13:00,1478,236,2202,R,1
KolyaBurkov,Обход блокировки Роскомнадзора не нарушает закон — «Википедия» http://t.co/Nm3cYWBJgA http://t.co/L4yUGxvbWr,Unknown,Ukrainian,2015-08-24 20:33:00,2015-09-20 16:38:00,1478,236,2205,R,1
KolyaBurkov,Убитый в Луизиане полицейский оказался кузеном стрелка http://t.co/msGWVCwud9,Unknown,Russian,2015-08-27 23:12:00,2015-08-27 23:12:00,1476,236,2227,R,1
KolyaBurkov,"Газинский: наверное, в группе можно выделить «Боруссию» как фаворита http://t.co/ZdZzREe689",Unknown,Russian,2015-08-28 13:12:00,2015-08-28 13:12:00,1476,236,2229,R,1
KolyaBurkov,Suzuki и Volkswagen прекращают партнерство http://t.co/LEsO7Vw1Io,Unknown,Russian,2015-08-30 08:52:00,2015-08-30 08:52:00,1476,236,2238,R,1
KolyaBurkov,В Словакии были задержаны два грузовика с нелегальными мигрантами http://t.co/RWh08O9V6g,Unknown,Russian,2015-08-30 12:52:00,2015-08-30 12:52:00,1476,236,2239,R,1
KolyaBurkov,ОНЛАЙН. Вручение наград MTV в Лос-Анджелесе http://t.co/SlTpBY1z8T http://t.co/Wma66LjJgT,Unknown,Bulgarian,2015-08-31 02:10:00,2015-08-31 02:10:00,1476,235,2241,R,1
KolyaBurkov,Срок строительства второй башни Mirax Plaza продлен до конца 2018 года http://t.co/iBhhmMfWTu,Unknown,Russian,2015-08-31 12:12:00,2015-09-27 10:52:00,1476,235,2243,R,1
KolyaBurkov,ОНЛАЙН. Закрытие трансферного окна в России и Европе  http://t.co/Ck8rroUt4Q http://t.co/f2xGXiKOQ4,Unknown,Russian,2015-08-31 21:12:00,2015-08-31 21:13:00,1476,235,2246,R,1
KolyaBurkov,197 китайцев хотят привлечь к ответственности за сплетни в Интернете  #hitech,Unknown,Russian,2015-09-01 06:51:00,2015-09-01 06:51:00,1476,235,2248,R,1
KolyaBurkov,"Разобщенность государств может аукнуться ростом терроризма, заявил глава МИД РФ http://t.co/pm4GhnfADb",Unknown,Russian,2015-09-01 08:34:00,2015-09-28 10:38:00,1476,236,2249,R,1
KolyaBurkov,Перчатки Лодыгина — на аукционе «Чемпионата» http://t.co/jfFxmRmM4K,Unknown,Russian,2015-09-01 13:52:00,2015-09-01 13:52:00,1476,236,2251,R,1
KolyaBurkov,Власти Испании опровергли попытки купить недвижимость для Путина http://t.co/8a0DR4BRjE,Unknown,Russian,2015-09-01 15:50:00,2015-09-01 15:50:00,1476,236,2252,R,1
KolyaBurkov,Прогноз погоды на сегодня  http://t.co/wvRO9CzNWI http://t.co/blHz2L66YA,Unknown,Russian,2015-09-02 06:12:00,2015-09-02 06:12:00,1474,236,2256,R,1
KolyaBurkov,Лебедев: с возвращением Мутко в РФС в футбол вернутся спонсоры http://t.co/AmCWrLjd0t,Unknown,Russian,2015-09-02 09:50:00,2015-09-02 09:50:00,1474,236,2257,R,1
KolyaBurkov,Вице-президенту фонда «Город без наркотиков» смягчили приговор  http://t.co/FVMxJe7WP9 http://t.co/DWwpTrLCn0,Unknown,Russian,2015-09-02 11:51:00,2015-09-02 11:51:00,1474,236,2259,R,1
KolyaBurkov,Введены новые санкции против России  http://t.co/kKRkXHCqRz http://t.co/DNdH38dcZz,Unknown,Russian,2015-09-02 17:12:00,2015-09-02 17:12:00,1473,236,2261,R,1
KolyaBurkov,СКР предоставил Нидерландам документы по крушению MH 17  http://t.co/ALgWzI7GMm http://t.co/ILmgwGVBJw,Unknown,Russian,2015-09-03 11:51:00,2015-09-03 11:51:00,1473,236,2266,R,1
KolyaBurkov,"В Пентагоне заявили, что корабли США шпионят за Россией http://t.co/pFmg7HpLgC",Unknown,Russian,2015-09-04 07:32:00,2015-09-04 07:32:00,1473,236,2272,R,1
KolyaBurkov,"Centrifuge + Go = Centrifugo – harder, better, faster, stronger  #hitech",Unknown,English,2015-09-04 10:31:00,2015-09-04 10:31:00,1473,236,2273,R,1
KolyaBurkov,"Исполнителю роли C-3PO в ""Звездных войнах"" Абрамс нравится больше Лукаса http://t.co/2NiCx2WL5d",Unknown,Russian,2015-09-04 14:52:00,2015-09-04 14:52:00,1473,236,2276,R,1
KolyaBurkov,МИД РФ: ЕС вводит санкции против России по надуманным причинам  https://t.co/kOnFKmiGUe http://t.co/l77B5fxpig,Unknown,Russian,2015-09-04 14:52:00,2015-09-12 13:49:00,1471,237,2330,R,1
KolyaBurkov,Как Webnames снимает с делегирования домены  #hitech,Unknown,Russian,2015-09-05 14:32:00,2015-09-05 14:32:00,1473,236,2285,R,1
KolyaBurkov,ВИДЕО. Автобус Самара — Ульяновск врезался в опору моста  http://t.co/A5rm8nbRdC http://t.co/mT0StsQBLx,Unknown,Russian,2015-09-07 09:13:00,2015-09-07 09:13:00,1473,236,2291,R,1
KolyaBurkov,"В Германию направляются поезда еще с 2,5 тыс. мигрантами http://t.co/vYRSBStOT0",Unknown,Russian,2015-09-07 09:14:00,2015-09-07 09:14:00,1473,236,2292,R,1
KolyaBurkov,Истребители Су-30СМ впервые выполнили в Крыму бомбометание по наземным целям http://t.co/XLqy2rItE9,Unknown,Russian,2015-09-07 09:30:00,2015-09-07 09:30:00,1473,236,2293,R,1
