author_id,content,region,language,publish_date,harvested_date,following,followers,updates,post_type,retweet
KolyaBurkov,'@Dasssha2010 5 раз посмотрела видео)))) https://t.co/UjYr5bzgpS',Unknown,Serbian,2015-09-07 21:52:00,2015-09-07 21:52:00,1473,236,2300,R,1
KolyaBurkov,Капитан пассажирского теплохода в Хабаровске пьяным вышел рейс http://t.co/ASEwTJwzw4,Unknown,Russian,2015-09-08 01:32:00,2015-09-08 01:32:00,1473,236,2302,R,1
KolyaBurkov,В Кургане нашли двух организаторов атак на сайт Кремля http://t.co/EOknRHQ1VX,Unknown,Russian,2015-09-08 17:33:00,2015-09-08 17:33:00,1472,236,2309,R,1
KolyaBurkov,На Украине планируется привить почти миллион детей от полиомиелита http://t.co/MNIB7X0yLi,Unknown,Russian,2015-09-08 20:12:00,2015-09-08 20:12:00,1472,236,2311,R,1
KolyaBurkov,Терри: считаю Руни лучшим игроком в истории сборной Англии http://t.co/j3sz5o9SYY,Unknown,Russian,2015-09-09 12:31:00,2015-09-09 12:31:00,1472,236,2314,R,1
KolyaBurkov,Кремль прокомментировал сообщения о новой военной базе рядом с Украиной http://t.co/sobfTuOp6a,Unknown,Russian,2015-09-10 13:13:00,2015-09-10 13:13:00,1472,237,2318,R,1
KolyaBurkov,Клеверли пропустит от 6 до 8 недель http://t.co/ydg5pQhjJO,Unknown,Ukrainian,2015-09-10 18:51:00,2015-09-10 18:51:00,1472,237,2320,R,1
KolyaBurkov,"Семак: Слова Виллаш-Боаша об уходе? Не понимаю, какой вред это нанесёт «Зениту» http://t.co/y2IJVfr7VF",Unknown,Russian,2015-09-10 21:31:00,2015-09-10 21:31:00,1472,237,2321,R,1
KolyaBurkov,Мэр: строительство дома в Артеме над старой шахтой было согласовано с геодезистами  http://t.co/yqHkqiTG6A,Unknown,Russian,2015-09-11 03:11:00,2015-09-11 03:11:00,1472,237,2322,R,1
KolyaBurkov,"Подумайте просто: вроде бы обычный обзор на винтовку, но провокация на лицо - американский солдат стреляет Коран!  http://t.co/KL4iuxoT9e",Unknown,Russian,2015-09-11 13:55:00,2015-09-11 13:55:00,1472,237,2326,R,1
KolyaBurkov,НОВЫЙ арест по делу о беспорядках у Рады  http://t.co/cb19JRonoX http://t.co/qaxOH2U5hY,Unknown,Russian,2015-09-11 19:35:00,2015-09-11 19:35:00,1472,237,2327,R,1
KolyaBurkov,"#НевскиеНовости Банк России надеется, что нефть будет стоить 50-75 долларов за баррель http://t.co/VsLB5QFoP7 #СПб",Unknown,Russian,2015-09-12 07:31:00,2015-09-12 07:31:00,1472,237,2331,R,1
KolyaBurkov,"Израиле госпитализировали Расторгуева, ближайшие концерты отменяются.   http://t.co/z9pyJjJduf http://t.co/DxiRN0XVHT",Unknown,Russian,2015-09-12 11:11:00,2015-09-12 11:11:00,1472,237,2330,R,1
KolyaBurkov,В иркутском СИЗО на выборах проголосовали 103% избирателей http://t.co/q8kZ9kabQz,Unknown,Russian,2015-09-13 12:12:00,2015-09-13 12:12:00,1467,237,2336,R,1
KolyaBurkov,У замечательного человека др. Преподаватель он от Бога #Медведев50 http://t.co/eEnHKkQ3yQ,Unknown,Russian,2015-09-14 10:13:00,2015-09-14 10:13:00,1467,237,2338,R,1
KolyaBurkov,Сенатором от Северной Осетии станет Таймураз Мамсуров http://t.co/MWudq0YM3m,Unknown,Russian,2015-09-15 08:52:00,2015-09-15 08:52:00,1467,237,2345,R,1
KolyaBurkov,70-я сессия Генассамблеи ООН открылась в Нью-Йорке  http://t.co/VchgXA8NfD http://t.co/PCcvETEJlq,Unknown,Russian,2015-09-15 20:32:00,2015-09-15 20:33:00,1468,237,2348,R,1
KolyaBurkov,Правительство утвердило положение о зонах охраны объектов культурного наследия  http://t.co/exowM78L1f,Unknown,Russian,2015-09-16 06:12:00,2015-09-16 06:12:00,1468,237,2349,R,1
KolyaBurkov,«Динамо» К — «Порту»: Касильяс сравняется с Хави по количеству матчей в ЛЧ http://t.co/JnlESWe1xg,Unknown,Russian,2015-09-16 18:32:00,2015-09-16 18:32:00,1468,237,2350,R,1
KolyaBurkov,"В Нидерландах задержан мужчина, запершийся в туалете экспресса Thalys http://t.co/2AvSdbYDmD",Unknown,Ukrainian,2015-09-18 12:32:00,2015-09-18 12:33:00,1433,236,2359,R,1
KolyaBurkov,"И вот это неожиданно. Вообще-то руководитель ФБК не Навальный, а другой человек совсем, @max_katz. Я проверял ) http://t.co/CUsLB9vECN",Unknown,Russian,2015-09-18 15:53:00,2015-09-18 15:53:00,1104,236,2360,R,1
KolyaBurkov,Исландия намерена выделить на помощь беженцам $16 млн  http://t.co/Jo6pSWV4Ue,Unknown,Russian,2015-09-19 21:32:00,2015-09-19 21:32:00,895,237,2366,R,1
KolyaBurkov,В Египте затонула яхта с туристами  http://t.co/q26hr5vCVa http://t.co/pCfHW2498P,Unknown,Ukrainian,2015-09-22 12:53:00,2015-09-22 12:53:00,895,238,2373,R,1
KolyaBurkov,Выхлоп на весь мир.Один из крупнейших скандалов в истории мирового автопрома набирает обороты  http://t.co/qYauOJCSe0 http://t.co/WFc9XJWy3V,Unknown,Russian,2015-09-22 18:11:00,2015-09-22 18:11:00,895,238,2374,R,1
KolyaBurkov,Пиндосы такі путаники... Вони задоволені корупцією чи ні? Красти далі чи що? http://t.co/qMLOWuAvVh,Unknown,Ukrainian,2015-09-23 18:12:00,2015-09-23 18:12:00,895,238,2377,R,1
KolyaBurkov,"В Москве полицейский сбил пожилую женщину, переходившую дорогу в неположенном месте http://t.co/FspyFe9bOA",Unknown,Russian,2015-09-23 22:12:00,2015-09-23 22:13:00,895,238,2380,R,1
KolyaBurkov,Москвич идет на «Нобеля»  http://t.co/dxvJJhPfdq http://t.co/cxdcJNoSps,Unknown,Russian,2015-09-24 12:14:00,2015-09-24 12:14:00,895,238,2385,R,1
KolyaBurkov,Сирия может победить ИГИЛ с помощью российского оружия http://t.co/oUP4RHneB3 http://t.co/hwsZcqFwbm,Unknown,Russian,2015-09-24 21:11:00,2015-09-24 21:11:00,895,239,2386,R,1
KolyaBurkov,СМИ: Венгрия в течение нескольких дней установит заграждение на границе с Хорватией  http://t.co/FHAKXzUuhe,Unknown,Russian,2015-09-25 02:12:00,2015-09-25 02:12:00,895,239,2387,R,1
KolyaBurkov,Украина запретила полёты самолётов «Аэрофлота» и «Трансаэро» http://t.co/qb2fpXGBGb,Unknown,Ukrainian,2015-09-25 13:31:00,2015-09-25 13:31:00,895,239,2392,R,1
KolyaBurkov,#НоваяЛада LADA Vesta. История создания автомобиля,Unknown,Russian,2015-09-25 17:01:00,2015-09-25 17:01:00,895,239,2393,,0
KolyaBurkov,#НоваяЛада Старт серийного производства LADA Vesta. Репортаж онлайн,Unknown,Russian,2015-09-25 17:37:00,2015-09-25 17:37:00,895,239,2394,,0
KolyaBurkov,"Хорошавин бы тоже мог научить, ну или Васильева ) https://t.co/KslzBe2BWs",Unknown,Russian,2015-09-26 05:12:00,2015-09-26 05:12:00,891,239,2398,R,1
KolyaBurkov,«Бетис» в гостях одержал волевую победу над «Спортингом» http://t.co/4RhPD7AJIw,Unknown,Russian,2015-09-27 12:51:00,2015-09-27 12:51:00,891,239,2403,R,1
KolyaBurkov,Владимир Путин впервые за два года проведет встречу с Бараком Обамой http://t.co/MoAxx8RzdE,Unknown,Russian,2015-09-27 21:52:00,2015-09-27 21:53:00,891,239,2406,R,1
KolyaBurkov,Встреча Обамы и Путина длилась более полутора часов #новости http://t.co/1HhCtMvd7P,Unknown,Russian,2015-09-28 23:32:00,2015-09-28 23:32:00,891,239,2411,R,1
KolyaBurkov,"Алексей Журавко: «Порошенко! Падай в ноги Путину и проси прощения, или падай в ноги Обаме и проси убежища""    http://t.co/Y6UCsl8Jag",Unknown,Russian,2015-09-29 11:34:00,2015-09-29 11:34:00,891,241,2414,R,1
KolyaBurkov,Открыто движение по первому участку временного моста через Керченский пролив https://t.co/LUYkcqQ3ir,Unknown,Russian,2015-10-01 18:53:00,2015-10-01 18:53:00,891,241,2435,R,1
KolyaBurkov,Меркель: нам нужно вместе с Россией принять политическое решение по Сирии http://t.co/fXTb3V15g5,Unknown,Russian,2015-10-02 18:54:00,2015-10-02 18:54:00,891,239,2439,R,1
KolyaBurkov,Иран объявил персоной нон грата диппредставителя Бахрейна http://t.co/2SZwv313zZ,Unknown,Russian,2015-10-02 21:32:00,2015-10-02 21:32:00,891,239,2443,R,1
KolyaBurkov,Б. Ротенберг: причина поражения от «Зенита»? Надо посмотреть в зеркало на себя http://t.co/oYx8tb2Fg3,Unknown,Russian,2015-10-03 18:05:00,2015-10-03 18:05:00,891,238,2448,R,1
KolyaBurkov,"Генсек ООН призвал к ""тщательному расследованию"" атаки на афганский госпиталь http://t.co/B7L1nRY1zW",Unknown,Russian,2015-10-03 21:52:00,2015-10-03 21:52:00,891,238,2449,R,1
KolyaBurkov,"СМИ: Юрген Клопп будет назначен главным тренером английского ФК ""Ливерпуль""  http://t.co/8SVE6PkMrt",Unknown,Russian,2015-10-05 05:53:00,2015-10-05 05:53:00,891,236,2457,R,1
KolyaBurkov,Банк «Зенит» подал заявление о банкротстве отца Алсу  http://t.co/m2TC4oUjYY,Unknown,Russian,2015-10-05 08:32:00,2015-10-05 08:32:00,891,236,2460,R,1
KolyaBurkov,СМИ: сирийские повстанцы заявляют о сбитом самолете http://t.co/cZnF3y7JFF,Unknown,Russian,2015-10-05 17:12:00,2015-10-05 17:13:00,891,237,2463,R,1
KolyaBurkov,В результате серии взрывов в Ираке погибли 56 человек http://t.co/0EOkLVzLKp,Unknown,Russian,2015-10-05 19:52:00,2015-10-05 19:52:00,891,237,2464,R,1
KolyaBurkov,Заказавшую убийство подростка учительницу отправили на лечение в психбольницу http://t.co/Yv531d88dW,Unknown,Russian,2015-10-06 08:53:00,2015-10-06 08:53:00,891,237,2468,R,1
KolyaBurkov,Россия объяснила шумиху вокруг нарушения воздушного пространства Турции: http://t.co/yVaIOKn2GS,Unknown,Russian,2015-10-06 12:13:00,2015-10-06 12:13:00,891,238,2469,R,1
KolyaBurkov,Песков в контексте Сирии вспомнил о путанице с Путиным и Ельциным на CNN: http://t.co/G4qAmNqUWX #сирия,Unknown,Russian,2015-10-06 13:12:00,2015-10-06 13:12:00,891,238,2470,R,1
KolyaBurkov,«Уфа» откроет женское отделение в своей футбольной школе http://t.co/0INM9N9uCv,Unknown,Russian,2015-10-06 14:53:00,2015-10-06 14:53:00,891,238,2472,R,1
KolyaBurkov,Путин и Рахмон обсудили ситуацию в Афганистане http://t.co/7TFwnvcC8a,Unknown,Russian,2015-10-06 17:33:00,2015-10-06 17:33:00,891,238,2473,R,1
KolyaBurkov,Минсельхоз тоже предупреждает: хлеб на 20 процентов подорожает. К весне   https://t.co/SDrU5NiA10,Unknown,Russian,2015-10-06 19:12:00,2015-10-06 19:13:00,891,238,2475,R,1
KolyaBurkov,"Федецкий: матч с Македонией будет сложнее, чем с Испанией http://t.co/eP3ZZshFUm",Unknown,Macedonian,2015-10-07 13:13:00,2015-10-07 13:13:00,891,238,2480,R,1
KolyaBurkov,Флагманом удара по ИГ был «Дагестан»  http://t.co/BBvN6LZTpN http://t.co/1nrzy9tkZK,Unknown,Russian,2015-10-07 14:53:00,2015-10-07 14:53:00,891,238,2482,R,1
KolyaBurkov,Дженнифер Лопес будет вести церемонию вручения American Music Awards http://t.co/mVrqpv1Ifo,Unknown,Russian,2015-10-07 15:13:00,2015-10-07 15:13:00,891,239,2483,R,1
KolyaBurkov,Ефремов: сложно связать отстранение Блаттера с чемпионатом мира в России http://t.co/LnSCFbozYB,Unknown,Russian,2015-10-08 15:12:00,2015-10-08 15:12:00,891,238,2490,R,1
KolyaBurkov,Евросоюз (ЧУТЬ-ЧУТЬ) ослабил санкции против РФ  http://t.co/VZ095azJCw http://t.co/QTeT5l27nY,Unknown,Russian,2015-10-09 15:32:00,2015-10-09 15:32:00,891,238,2495,R,1
KolyaBurkov,Обама увидел в действиях России в Сирии ослабление лидерства Путина http://t.co/vp5GAttNVJ,Unknown,Russian,2015-10-09 16:12:00,2015-10-09 16:13:00,891,238,2496,R,1
KolyaBurkov,"Игнатьев: Мамаев прилично выглядел в игре с Молдавией, он смог заменить Дзагоева http://t.co/fw6iLYm55s",Unknown,Russian,2015-10-10 08:53:00,2015-10-10 08:53:00,891,238,2500,R,1
KolyaBurkov,Почему русские такие нищие и как с этим бороться? http://t.co/q9t420IQMm,Unknown,Russian,2015-10-11 09:02:00,2015-10-11 09:02:00,892,239,2505,R,1
KolyaBurkov,ВИДЕО. Лавров выступил с заявлением по США и Сирии  http://t.co/MsaP74Tsor http://t.co/e5eD9cFZxT,Unknown,Russian,2015-10-12 17:36:00,2015-10-12 17:36:00,892,237,2404,R,1
KolyaBurkov,"Джимми Фэллон поставил песню Пугачевой Superman в рубрике ""Не включать"" http://t.co/91TPtHspvU",Unknown,Russian,2015-10-14 03:13:00,2015-10-14 03:13:00,892,236,2405,R,1
KolyaBurkov,"с. Вятское, Ярославская обл. https://t.co/MOIXHxrC2S",Unknown,Russian,2015-10-14 09:15:00,2015-10-14 09:15:00,892,236,2407,R,1
KolyaBurkov,"Позиция Москвы по борьбе с ИГ стала причиной отказа принять делегацию РФ, заявил пресс-секретарь Белого дома http://t.co/mmwkbB0FJW",Unknown,Russian,2015-10-14 20:35:00,2015-10-14 20:35:00,892,236,2411,R,1
KolyaBurkov,'@tass_agency @aksenov_sv https://t.co/bEnXtZtn4T',Unknown,Russian,2015-10-15 18:32:00,2015-10-15 18:32:00,892,236,2416,R,1
KolyaBurkov,Памфилова просит СК проверить информацию о причастности Турчака к делу Кашина  http://t.co/m3n4xT5Hhv http://t.co/RZlAia27fz,Unknown,Russian,2015-10-15 19:52:00,2015-10-15 19:53:00,892,236,2417,R,1
KolyaBurkov,"Лукашенко набрал 83,5% голосов на выборах президента Белоруссии http://t.co/hbOhEVfJGM",Unknown,Russian,2015-10-16 11:52:00,2015-10-16 11:52:00,892,237,2419,R,1
KolyaBurkov,'@volkova_v @Pravdiva_pravda а где там митинг то? Я троих тока заметил. Может она и привела пофоткаться? )))',Unknown,Russian,2015-10-16 18:13:00,2015-10-16 18:13:00,892,237,2421,R,1
KolyaBurkov,"Фонтанельо: надеюсь, беспроигрышная серия ЦСКА наконец-то прервётся http://t.co/OipTBB0Fys",Unknown,Russian,2015-10-17 07:51:00,2015-10-17 07:51:00,892,237,2423,R,1
KolyaBurkov,Р. Гусев: ЦСКА выиграет у «Урала» со счётом 3:0 http://t.co/aWH3h39hQH,Unknown,Russian,2015-10-17 11:33:00,2015-10-17 11:33:00,892,237,2424,R,1
KolyaBurkov,"Полицейские проверят персональные данные водителя Ferrari, устроившего ДТП в Москве  http://t.co/A8Xn0LjpqS",Unknown,Russian,2015-10-17 12:14:00,2015-10-17 12:14:00,892,237,2426,R,1
KolyaBurkov,В Новой Москве произошел крупный пожар в складском помещении  http://t.co/QUOFOT7BvC,Unknown,Russian,2015-10-17 19:53:00,2015-10-17 19:53:00,892,237,2426,R,1
KolyaBurkov,Су-25 не дают исламистам опомниться.   http://t.co/fDvFZf2t7k http://t.co/yQLuUDX8Hk,Unknown,Ukrainian,2015-10-18 20:53:00,2015-10-18 20:53:00,892,237,2432,R,1
KolyaBurkov,'@iremeslo @SPB_citizen будни наркомана',Unknown,Russian,2015-10-18 22:11:00,2015-10-18 22:12:00,892,237,2433,R,1
KolyaBurkov,Денис Давыдов может покинуть «Спартак»  http://t.co/55Xz0KWvFP http://t.co/fHOdcrTOyi,Unknown,Russian,2015-10-19 09:11:00,2015-10-19 09:12:00,892,237,2435,R,1
KolyaBurkov,Палкин обвинил российских агентов в уходе Зинченко из «Шахтёра» https://t.co/AMCKlW14Ql,Unknown,Russian,2015-10-20 08:53:00,2015-10-20 08:54:00,892,238,2440,R,1
KolyaBurkov,Голодец предложила создать рейтингии колледжей и техникумов https://t.co/5tvUwbGzls,Unknown,Russian,2015-10-20 15:33:00,2015-10-20 15:34:00,892,238,2445,R,1
KolyaBurkov,Участок Садового кольца перекрыт из-за крупного ДТП с участием Jaguar и «КамАЗа»  https://t.co/SXCs2R8rkB https://t.co/Djf3AMUxtD,Unknown,Ukrainian,2015-10-20 16:54:00,2015-10-20 16:54:00,892,238,2447,R,1
KolyaBurkov,ОБСЕ: беспилотник миссии потерял управление из-за глушения сигнала GPS https://t.co/PPyThAt5C6 https://t.co/j2IxlnfM8a,Unknown,Russian,2015-10-20 17:16:00,2015-10-20 17:16:00,892,238,2448,R,1
KolyaBurkov,"Официальный трейлер новых ""Звездных войн"" на YouTube набрал 27 млн просмотров https://t.co/gmtIJTgMJN",Unknown,Russian,2015-10-21 10:32:00,2015-10-21 10:32:00,892,238,2451,R,1
KolyaBurkov,WikiLeaks опубликовал документы из электронной переписки главы ЦРУ https://t.co/76BiPS8fBJ https://t.co/VVAHtrLagt,Unknown,Russian,2015-10-21 21:14:00,2015-10-21 21:14:00,892,238,2453,R,1
KolyaBurkov,Хакеры взломали TalkTalk  https://t.co/3xIR5fVopE https://t.co/FXVryytbdE,Unknown,Uzbek,2015-10-23 07:35:00,2015-10-23 07:35:00,892,236,2465,R,1
KolyaBurkov,"Привет, хамон: как журналисты ФАН «санкционку» заказывали  https://t.co/sZogXHHATG  #санкции https://t.co/7DWcvK1x5w",Unknown,Russian,2015-10-23 07:39:00,2015-10-23 07:39:00,892,236,2466,,0
KolyaBurkov,"Сергей Лавров прибыл в Вену, где проведет переговоры с Керри по Сирии https://t.co/VKZkoYDzWX",Unknown,Russian,2015-10-23 10:13:00,2015-10-23 10:13:00,892,237,2467,R,1
KolyaBurkov,"Жительница Петербурга покусала полицейских, собиравшихся эвакуировать машину с ее дочкой https://t.co/iZIPxGGKGF",Unknown,Russian,2015-10-23 11:33:00,2015-10-23 11:34:00,892,237,2469,R,1
KolyaBurkov,"Средняя пенсия в России в 2016 году составит 12,6 тысяч рублей https://t.co/bQ4uHl7jVK",Unknown,Russian,2015-10-23 16:52:00,2015-10-23 16:52:00,892,237,2471,R,1
KolyaBurkov,"'@volkova_v дедушка, второй раз, средняя теперь постаралась :)'",Unknown,Russian,2015-10-24 02:12:00,2015-10-24 02:14:00,892,237,2474,R,1
KolyaBurkov,Суд в США отклонил иск к Facebook на $15 млрд о слежке за пользователями   https://t.co/T9gXVlnRjP,Unknown,Russian,2015-10-24 04:31:00,2015-10-24 04:31:00,892,237,2475,R,1
KolyaBurkov,ООН: Просроченное печенье было доставлено жителям осаждённых городов Сирии по ошибке https://t.co/BzW5Lkp9Ar,Unknown,Russian,2015-10-24 12:53:00,2015-10-24 13:00:00,892,237,2478,R,1
KolyaBurkov,Россиянка Колобова завоевала бронзу на этапе Кубка мира по фехтованию на шпагах https://t.co/KrSdaGMdgR,Unknown,Russian,2015-10-24 20:54:00,2015-10-24 20:55:00,892,238,2482,R,1
KolyaBurkov,какое прекрасное видео прошло мимо меня)))))   https://t.co/MhKcRIRT47,Unknown,Russian,2015-10-24 21:33:00,2015-10-24 21:33:00,892,238,2483,R,1
KolyaBurkov,"Крымские власти обвинили в подрыве опор ЛЭП правосеков и ""Меджлис"".   https://t.co/4mIj2aWnkt https://t.co/UeSDQ0SSka",Unknown,Russian,2015-10-25 13:33:00,2015-10-25 13:33:00,892,238,2485,R,1
KolyaBurkov,Фанаты «Витесса» вывесили на матче с «Аяксом» баннер антисемитского характера https://t.co/EMtYGEOfY1,Unknown,Russian,2015-10-26 17:53:00,2015-10-26 17:53:00,892,239,2497,R,1
KolyaBurkov,Лимузины для президентов будут собирать в Москве https://t.co/YiHff2NrOA,Unknown,Russian,2015-10-27 07:43:00,2015-10-27 07:45:00,892,239,2500,R,1
KolyaBurkov,Беженцам в Бельгии выдадут бейджи с фото и фамилией  https://t.co/8Gc59l52zU,Unknown,Russian,2015-10-27 12:35:00,2015-10-27 12:41:00,892,239,2503,R,1
KolyaBurkov,Школа в Италии запретила каблуки из-за землетрясений https://t.co/9qGDzbvk2K,Unknown,Ukrainian,2015-10-27 13:15:00,2015-10-27 13:15:00,892,239,2505,R,1
KolyaBurkov,"Запостите енота вместо Бороновой, а?",Unknown,Russian,2015-10-27 17:36:00,2015-10-27 17:36:00,892,238,2506,R,1
KolyaBurkov,Астронавты NASA на МКС совершают выход в открытый космос — ПРЯМАЯ ТРАНСЛЯЦИЯ  https://t.co/W3StjIxkEL https://t.co/4gLcIvFjAZ,Unknown,Russian,2015-10-28 11:55:00,2015-10-28 12:03:00,892,238,2507,R,1
KolyaBurkov,Куда теперь едут мигранты с Украины   https://t.co/Y1RIqSGsb9 https://t.co/Ir2bgL9pQI,Unknown,Russian,2015-10-28 14:56:00,2015-10-28 14:56:00,892,238,2508,R,1
KolyaBurkov,Тина Канделаки выложила в Instagram фото совместной тренировки с Роем Джонсом  https://t.co/LpexFzBafD https://t.co/ft14Tqvv7Q,Unknown,Russian,2015-10-29 06:31:00,2015-10-29 06:35:00,892,238,2513,R,1
KolyaBurkov,МИД отреагировал на обвинения Франции по Крыму   https://t.co/ziq0gQA7d2 https://t.co/xcT8mxGqFL,Unknown,Russian,2015-10-29 19:15:00,2015-10-29 19:15:00,892,239,2519,R,1
KolyaBurkov,"Землетрясение магнитудой 5,2 произошло к югу от острова Ява https://t.co/mYdxSloDqL © Flickr https://t.co/AKTmip3N9A",Unknown,Russian,2015-10-30 04:31:00,2015-10-30 04:32:00,892,239,2521,R,1
KolyaBurkov,Курс евро вырос https://t.co/NvM6vKCQ3u https://t.co/YIYUtfIFpr,Unknown,Russian,2015-10-30 07:52:00,2015-10-30 07:55:00,892,239,2522,R,1
KolyaBurkov,"российские учёные разработали броню для лошади, в которой она может выдержать попадание до 10 капель никотина",Unknown,Russian,2015-10-30 16:51:00,2015-10-30 16:51:00,892,239,2524,R,1
KolyaBurkov,"Рошаль, Караченцов и Волочкова попросили Путина спасти «Трансаэро»: https://t.co/Nvs0znwS5l",Unknown,Russian,2015-10-30 17:52:00,2015-10-30 17:52:00,892,238,2526,R,1
KolyaBurkov,СМИ: на борту разбившегося самолета летел заммэра Пскова https://t.co/9SsaC5CXOQ,Unknown,Bulgarian,2015-10-31 11:12:00,2015-10-31 11:12:00,892,238,2531,R,1
KolyaBurkov,"Жертвами крушения А321 стали россияне, украинцы и белорусы.   https://t.co/bxl7pLrmhn https://t.co/XfvQynJPn8",Unknown,Russian,2015-10-31 14:11:00,2015-10-31 14:11:00,892,238,2533,R,1
KolyaBurkov,Почему авиакомпании опасаются летать над Синаем?   https://t.co/akmFs6EeC0 https://t.co/il1fhs9v1f,Unknown,Russian,2015-11-01 20:37:00,2015-11-01 20:37:00,892,239,2537,R,1
KolyaBurkov,"Автобус с украинцами попал в ДТП под Веной, 10 пострадавших https://t.co/UWyVeqFVVZ",Unknown,Russian,2015-11-02 10:56:00,2015-11-02 10:56:00,892,239,2539,R,1
KolyaBurkov,Петиция за открытие архивов органов госбезопасности СССР собрала более 50 тысяч подписей https://t.co/6SBL96P7v9,Unknown,Russian,2015-11-02 14:54:00,2015-11-02 14:54:00,892,239,2542,R,1
KolyaBurkov,Австралийские авиакомпании отменили рейсы до Бали из-за извержения вулкана  https://t.co/m1te0iMoHs,Unknown,Russian,2015-11-03 06:26:00,2015-11-03 06:26:00,892,239,2544,R,1
