author_id,content,region,language,publish_date,harvested_date,following,followers,updates,post_type,retweet
KolyaBurkov,Глава МИД Сирии назвал расстрел российского пилота Су-24 военным преступлением https://t.co/uiTV0Q6Rbn,Unknown,Russian,2015-11-25 12:19:00,2015-11-25 12:19:00,887,238,2770,R,1
KolyaBurkov,Недовольные действиями Анкары собрались у посольства Турции в Москве https://t.co/GJWAgK4r2N https://t.co/lStmmrGAfx,Unknown,Russian,2015-11-25 12:39:00,2015-11-25 12:39:00,887,238,2771,R,1
KolyaBurkov,в армии сейчас служат всего год. это как две очереди в Почту России отстоять,Unknown,Russian,2015-11-25 15:18:00,2015-11-25 15:19:00,887,238,2774,R,1
KolyaBurkov,СК: несовершеннолетний погиб от рук сотрудников колонии на Кубани https://t.co/gcSWYt5euh https://t.co/9YA05FcifM,Unknown,Russian,2015-11-25 20:32:00,2015-11-25 20:32:00,887,238,2775,R,1
KolyaBurkov,Турция передала военному атташе России данные об инциденте с Су-24  https://t.co/ZPIdM0hjkX https://t.co/G2LGvV4u6Z,Unknown,Russian,2015-11-25 20:51:00,2015-11-25 20:51:00,887,238,2776,R,1
KolyaBurkov,Президент Франции прибудет с визитом в Москву https://t.co/q95mbAHCmm https://t.co/7DVDVgogcN,Unknown,Russian,2015-11-26 01:52:00,2015-11-26 01:52:00,887,238,2777,R,1
KolyaBurkov,"Reuters сообщает, что в Венесуэле в преддверии выборов застрелен один из региональных лидеров оппозиции https://t.co/O6Eo5Onmea",Unknown,Russian,2015-11-26 04:33:00,2015-11-26 04:34:00,887,238,2778,R,1
KolyaBurkov,Крым заморозил около 30 турецких инвестиционных проектов  https://t.co/OWtUuF7Yqo,Unknown,Russian,2015-11-26 09:33:00,2015-11-26 09:34:00,887,238,2779,R,1
KolyaBurkov,Россия запретит еще что-нибудь украинское https://t.co/41nqJY7QsO,Unknown,Russian,2015-11-26 11:34:00,2015-11-26 11:34:00,887,238,2782,R,1
KolyaBurkov,"Владимир Путин обозначил, чего Россия ждет от Турции, сбившей Су-24 в Сирии https://t.co/azzlsr6d6Q #СУ24 #Турция https://t.co/hY9JZ28Dqq",Unknown,Russian,2015-11-26 13:12:00,2015-11-26 13:12:00,887,238,2783,R,1
KolyaBurkov,В Google Translate появился переводчик на галактический язык: https://t.co/Xpn57qIOFW,Unknown,Russian,2015-11-26 15:54:00,2015-11-26 15:56:00,887,238,2786,R,1
KolyaBurkov,Владимир Путин: Позиции Москвы и Парижа по терроризму указывают на необходимость создания коалиции  https://t.co/NWYdiSSCQT,Unknown,Russian,2015-11-26 17:31:00,2015-11-26 17:35:00,887,238,2787,R,1
KolyaBurkov,via @g0riz0nt )))   https://t.co/buKMUONRvn https://t.co/kDjJYoQ5or,Unknown,Russian,2015-11-26 19:37:00,2015-11-26 19:45:00,887,238,2788,R,1
KolyaBurkov,Просыпайся #Казань! Хорошей ПЯТНИЦЫ!!! #Бодрыйвестник #Kazan https://t.co/2BdruBbC0A,Unknown,Russian,2015-11-27 06:32:00,2015-11-27 06:32:00,887,238,2791,R,1
KolyaBurkov,"Как Турция получает нефть от террористов, рассказал Путин Олланду  https://t.co/jI7Y9ViJer https://t.co/O2lXWXKgtn",Unknown,Russian,2015-11-27 06:52:00,2015-11-27 06:53:00,887,238,2792,R,1
KolyaBurkov,"Дмитрий Песков назвал единственную силу, способную противостоять ИГ на земле https://t.co/ubWO8rqQJo https://t.co/YR4nlhA0sC",Unknown,Russian,2015-11-27 11:16:00,2015-11-27 11:22:00,887,237,2795,R,1
KolyaBurkov,В СК рассказали подробности гибели депутата заксобрания Новосибирской области  https://t.co/ztzSEfI6FQ https://t.co/S4gIDP8cqd,Unknown,Russian,2015-11-27 12:37:00,2015-11-27 12:37:00,887,237,2796,R,1
KolyaBurkov,МЧС РФ направило в Крым ещё два самолета с электрогенераторами https://t.co/0IoJjHFcwS,Unknown,Ukrainian,2015-11-27 13:02:00,2015-11-27 13:06:00,887,237,2797,R,1
KolyaBurkov,Минюст признал Центр содействия народам Севера «иностранным агентом» https://t.co/mEAxLjwkT3 https://t.co/eunCbqBlUx,Unknown,Russian,2015-11-27 18:14:00,2015-11-27 18:14:00,887,237,2802,R,1
KolyaBurkov,Россиянин поможет генсеку ОНН с гумпартнерством на Ближнем Востоке https://t.co/ivg36YsOYw https://t.co/BYFVI7J0dL,Unknown,Russian,2015-11-27 19:33:00,2015-11-27 19:34:00,887,237,2803,R,1
KolyaBurkov,«Гент» объявит итоги переговоров с мэром города по «Зениту» 30 ноября https://t.co/Htw6c2ugcp,Unknown,Russian,2015-11-27 21:16:00,2015-11-27 21:16:00,887,237,2805,R,1
KolyaBurkov,"Немецкие СМИ: Конфликт Путина и Эрдогана показал, кто из них настоящий «господин»  https://t.co/j11e9ZsCO1 https://t.co/JeyWb3XEz6",Unknown,Russian,2015-11-28 03:18:00,2015-11-28 03:26:00,887,237,2807,R,1
KolyaBurkov,Источник: ВСУ обстреливают Донецк с использованием минометов https://t.co/MVviGPhq9o https://t.co/B6ZAny1qgJ,Unknown,Russian,2015-11-28 19:37:00,2015-11-28 19:37:00,887,236,2812,R,1
KolyaBurkov,"""Democracy"" at gunpoint.  Army detachments from Western Ukraine brought in for Mariupol elections ""replay"". https://t.co/FsUI7Ivu2h",Unknown,English,2015-11-28 22:34:00,2015-11-28 22:34:00,887,236,2813,R,1
KolyaBurkov,Чартерное сообщение между Россией и Турцией практически остановлено https://t.co/RdewG0dAKe https://t.co/fTXFhplk9S,Unknown,Russian,2015-11-29 10:16:00,2015-11-29 10:16:00,887,236,2815,R,1
KolyaBurkov,В Польше демонтирован памятник благодарности Красной Армии https://t.co/evBkwiuYor,Unknown,Russian,2015-11-29 15:33:00,2015-11-29 15:33:00,887,236,2818,R,1
KolyaBurkov,Дальнобойщик из Чечни: «Год назад любой дальнобойщик ради Путина поехал бы воевать. Сейчас никто не поедет»   https://t.co/S0KTeuYXgz,Unknown,Russian,2015-11-29 18:54:00,2015-11-29 18:54:00,887,236,2820,R,1
KolyaBurkov,Полезные комбинации клавиш при работе на компьютере  https://t.co/NqweoQPUAe https://t.co/6nVsn2lFbd,Unknown,Russian,2015-11-30 09:12:00,2015-11-30 09:12:00,887,238,2823,R,1
KolyaBurkov,Турция отказалась вводить санкции против россиян: https://t.co/77xkWF7HTn,Unknown,Russian,2015-11-30 13:17:00,2015-11-30 13:18:00,887,238,2825,R,1
KolyaBurkov,Коалиция без Путина: как Германия и Британия вступили в войну с ИГИЛ https://t.co/VVHJoWhmaO,Unknown,Russian,2015-12-01 16:35:00,2015-12-01 16:35:00,887,240,2834,R,1
KolyaBurkov,"Тейшейра: чемпионат Украины не так плох, как многие думают https://t.co/WvsBHQVcQE",Unknown,Ukrainian,2015-12-01 21:57:00,2015-12-01 21:57:00,887,240,2835,R,1
KolyaBurkov,"#Асад: В Сирии будет мир, если Запад прекратит поддерживать террористов https://t.co/oqKPkbHMH4 #Сирия",Unknown,Russian,2015-12-02 05:15:00,2015-12-02 05:16:00,887,240,2837,R,1
KolyaBurkov,"Аналитик Forbes рассказал, как санкции РФ скажутся на экономике Турции https://t.co/N2QmVcp7Um https://t.co/V9hrzLjHmT",Unknown,Russian,2015-12-02 08:52:00,2015-12-02 08:52:00,887,240,2839,R,1
KolyaBurkov,Лавров согласился на встречу со своим турецким коллегой «на полях» Совета министров иностранных дел ОБСЕ в Белграде https://t.co/P4U6C1bz8L,Unknown,Russian,2015-12-02 14:36:00,2015-12-02 14:36:00,887,240,2842,R,1
KolyaBurkov,Эрдоган собирается «взвешенно отреагировать на эмоциональные действия России»  Турция не буд https://t.co/MdkUono6hA https://t.co/QATPSJs950,Unknown,Russian,2015-12-03 01:53:00,2015-12-03 01:53:00,887,240,2846,R,1
KolyaBurkov,30% домов в Крыму остаются без тепла  По состоянию на 2 декабря в Крыму остаются без централ https://t.co/ZhhKbb23gI https://t.co/HizyY7eNEl,Unknown,Russian,2015-12-03 09:18:00,2015-12-03 09:18:00,887,240,2848,R,1
KolyaBurkov,Путин: Турки помидорами не отделаются! Ежегодное послание Владимира Путина Федеральному собранию 2015 https://t.co/5Hkeg4fDuQ,Unknown,Russian,2015-12-03 11:18:00,2015-12-03 11:18:00,887,240,2851,R,1
KolyaBurkov,Транспортные изменения: строительство метро вблизи Канавинского моста https://t.co/2Vdj4KwVM1,Unknown,Russian,2015-12-03 15:17:00,2015-12-03 15:17:00,887,240,2852,R,1
KolyaBurkov,Штранцль получил травму спустя два дня после возвращения в строй https://t.co/AsRn6Z60jc,Unknown,Russian,2015-12-03 17:53:00,2015-12-03 17:54:00,887,240,2855,R,1
KolyaBurkov,ГИБДД объяснила затор на МКАД: с дальнобойщиками это не связано https://t.co/46WzApD63j https://t.co/98RG3ddlxz,Unknown,Ukrainian,2015-12-04 15:35:00,2015-12-04 15:35:00,887,239,2861,R,1
KolyaBurkov,#Юмор@rus_improvisation https://t.co/m2kqXcrz9H,Unknown,Russian,2015-12-04 16:12:00,2015-12-04 16:12:00,887,239,2863,R,1
KolyaBurkov,В Армении началось голосование на референдуме по конституционной реформе https://t.co/5CZc5Dm2rz,Unknown,Russian,2015-12-06 05:16:00,2015-12-06 05:17:00,887,239,2870,R,1
KolyaBurkov,Кадыров: казненный в Сирии россиянин не был работником спецслужб https://t.co/bbRGVXzw0S,Unknown,Russian,2015-12-06 06:31:00,2015-12-06 06:31:00,887,239,2871,R,1
KolyaBurkov,Астахов предложил изменить школьную программу  https://t.co/41fAnuYvfK https://t.co/Oapr9NdILh,Unknown,Russian,2015-12-06 13:42:00,2015-12-06 13:42:00,887,239,2872,R,1
KolyaBurkov,Комитет всемирного наследия ЮНЕСКО обратился к Путину с просьбой спасти полярных медведей https://t.co/wF8t5XdUYZ https://t.co/mQjNvz6HX5,Unknown,Russian,2015-12-06 22:32:00,2015-12-06 22:32:00,887,239,2878,R,1
KolyaBurkov,Еврогабонцы жалуются хозяину на смотрителей))) https://t.co/FASFVIJDVq,Unknown,Russian,2015-12-07 00:12:00,2015-12-07 00:12:00,887,239,2879,R,1
KolyaBurkov,Обама: прекращение огня в Сирии позволит США и РФ вместе бороться с ИГ https://t.co/XRbKXx9Ayq https://t.co/xvJA8BZv7O,Unknown,Russian,2015-12-07 03:02:00,2015-12-07 03:02:00,887,239,2879,R,1
KolyaBurkov,В Амурской области выявлено более 60 нарушений в учреждениях для сирот https://t.co/NRZcnOAwaG https://t.co/CGdmfVqUzo,Unknown,Russian,2015-12-08 03:11:00,2015-12-08 03:11:00,887,239,2885,R,1
KolyaBurkov,Телеканал #FoxNews отстранил от эфира двух комментаторов за оскорбление Обамы https://t.co/86NqfML1VT #сша,Unknown,Russian,2015-12-08 05:15:00,2015-12-08 05:15:00,887,239,2886,R,1
KolyaBurkov,"Спутник ""Канопус-СТ"" сгорел в атмосфере над Атлантикой, сообщает осведомленный источник https://t.co/vvrQNCfh7X",Unknown,Russian,2015-12-08 08:36:00,2015-12-08 08:36:00,887,239,2889,R,1
KolyaBurkov,Украина может снова отключить Крыму свет 31 декабря  Восстановление Украиной поставок электр https://t.co/IA7kDBkg7r https://t.co/AsRweKyuev,Unknown,Russian,2015-12-08 19:12:00,2015-12-08 19:12:00,887,240,2892,R,1
KolyaBurkov,"Устал от политики , проветрись в метро))) https://t.co/3OZWdMR6YR",Unknown,Russian,2015-12-08 21:04:00,2015-12-08 21:05:00,887,240,2893,R,1
KolyaBurkov,Ресторанная сеть в Японии выплатит более $1 млн за покончившую с собой сотрудницу: https://t.co/u0Gmm2X1qv https://t.co/zuPWK2z6jM,Unknown,Russian,2015-12-09 05:12:00,2015-12-09 05:12:00,887,240,2896,R,1
KolyaBurkov,"Суд 23 декабря начнет повторное рассмотрение дела ""школьного стрелка"" — подростка, устроившего стрельбу в Отрадном https://t.co/elSeAfoPsB",Unknown,Russian,2015-12-09 08:15:00,2015-12-09 08:15:00,887,240,2899,R,1
KolyaBurkov,Newsweek: ИГИЛ освободил 25 христиан https://t.co/ahKuZrL2I9 https://t.co/cFrKwtyBw9,Unknown,Serbian,2015-12-09 22:53:00,2015-12-09 22:53:00,887,240,2902,R,1
KolyaBurkov,"Истрати: Анчелотти – очень серьёзный тренер, но у «Спартака» есть наставник https://t.co/qHb2UCsJfP",Unknown,Russian,2015-12-10 11:19:00,2015-12-10 11:21:00,887,240,2904,R,1
KolyaBurkov,СК рассмотрел обращения адвоката Трунова из-за расследования ЧП с A321 https://t.co/KHfKtVKqhC https://t.co/S08AbuPNPD,Unknown,Russian,2015-12-10 17:38:00,2015-12-10 17:38:00,887,240,2905,R,1
KolyaBurkov,УЕФА отказался разводить Россию и Турцию при жеребьевке Евро-2016: https://t.co/1Za8kl6yaR,Unknown,Russian,2015-12-10 17:59:00,2015-12-10 17:59:00,887,240,2906,R,1
KolyaBurkov,Лавров обсудит с президентом и главой МИД Италии Сирию и Украину  https://t.co/msMVYPGwhD https://t.co/SblPmjLcA3,Unknown,Russian,2015-12-11 05:33:00,2015-12-11 05:33:00,887,240,2907,R,1
KolyaBurkov,Банк России не верит в улучшение внешнеэкономических условий в ближайшее время https://t.co/L0smK4CSjz,Unknown,Russian,2015-12-11 17:33:00,2015-12-11 17:41:00,887,239,2912,R,1
KolyaBurkov,Две деревни в Подмосковье погрузились во тьму из-за конфликта чиновников и энергетиков https://t.co/XWfZ0994MD #москва,Unknown,Ukrainian,2015-12-12 14:17:00,2015-12-12 14:18:00,887,239,2917,R,1
KolyaBurkov,Борис Гребенщиков исполнил свои песни для прохожих в переходе у метро в Москве (ВИДЕО) https://t.co/HNEmgtdGKy https://t.co/HhOIP28zuv,Unknown,Russian,2015-12-12 16:54:00,2015-12-12 16:54:00,887,239,2918,R,1
KolyaBurkov,#Юмор@rus_improvisation https://t.co/XaMeFMsTZy,Unknown,Russian,2015-12-12 17:45:00,2015-12-12 17:45:00,887,239,2919,R,1
KolyaBurkov,Еще одно УДО в деле «Оборонсервиса»  https://t.co/RNDBcsHa5n https://t.co/tbWw5xRFY2,Unknown,Russian,2015-12-13 07:52:00,2015-12-13 07:52:00,887,239,2920,R,1
KolyaBurkov,Венгер: это была идеальная неделя для «Арсенала» https://t.co/0Vyzx7Vg2h,Unknown,Russian,2015-12-13 18:04:00,2015-12-13 18:04:00,887,239,2922,R,1
KolyaBurkov,ЧП в цирке: с 25-метровой высоты сорвалась гимнастка https://t.co/RXCKWxOpi4 https://t.co/0KiI9VxSEj,Unknown,Russian,2015-12-13 19:32:00,2015-12-13 19:32:00,887,238,2923,R,1
KolyaBurkov,Воронежская область погрузилась в траур по жертвам пожара в интернате https://t.co/mRTpnHO65e https://t.co/nFmFtMrRJp,Unknown,Russian,2015-12-14 04:13:00,2015-12-14 04:13:00,886,238,2926,R,1
KolyaBurkov,"Украина упорно трещит по швам. Захвативший власть ""народный"" режим патриотов, националистов и бандеровцев.. https://t.co/Mtr0pv4OHt",Unknown,Ukrainian,2015-12-14 16:13:00,2015-12-14 16:13:00,885,238,2928,R,1
KolyaBurkov,В Минске началось заседание контактной группы по урегулировании ситуации на Донбассе https://t.co/52O32ChdGu,Unknown,Russian,2015-12-15 14:03:00,2015-12-15 14:04:00,885,238,2937,R,1
KolyaBurkov,ВКС России совершили более 4 тысяч вылетов с начала операции в Сирии https://t.co/qxgUI5jSg7,Unknown,Russian,2015-12-15 18:18:00,2015-12-15 18:18:00,885,238,2941,R,1
KolyaBurkov,'@MadgunRus https://t.co/05VHe4Tac5',Unknown,Russian,2015-12-16 07:56:00,2015-12-16 07:56:00,885,238,2944,R,1
KolyaBurkov,Газоколонка   https://t.co/zQ5VmhzhR7,Unknown,Russian,2015-12-16 20:34:00,2015-12-16 20:34:00,885,238,2946,R,1
KolyaBurkov,ДАИШ запускает свою радиостанцию «Голос Халифата» https://t.co/UcuE1yiDHh,Unknown,Russian,2015-12-17 08:55:00,2015-12-17 08:56:00,885,238,2947,R,1
KolyaBurkov,"#прессконференцияпутина  Путин поддерживает инициативу США по подготовке резолюции Совбеза ООН по Сирии, она в целом Россию устраивает",Unknown,Russian,2015-12-17 10:39:00,2015-12-17 10:39:00,885,238,2949,R,1
KolyaBurkov,"Роналду: я люблю Париж, но предпочитаю жить в Мадриде https://t.co/n7OlXgP6rA",Unknown,Russian,2015-12-17 13:58:00,2015-12-17 13:58:00,885,238,2950,R,1
KolyaBurkov,"В Сочи задержали двух мужчин, собиравшихся примкнуть к террористам https://t.co/aROL2veHV1",Unknown,Russian,2015-12-17 17:22:00,2015-12-17 17:22:00,885,238,2951,R,1
KolyaBurkov,ЦБ решает судьбу незастрахованных миллиардных VIP-вкладов Внешпромбанка https://t.co/NjnU6uXQt2 https://t.co/5a90GYZt8F,Unknown,Russian,2015-12-18 04:12:00,2015-12-18 04:13:00,885,238,2955,R,1
KolyaBurkov,В столице Литвы обезвредили авиабомбу времен Второй мировой войны https://t.co/oSpkIxW6N9,Unknown,Russian,2015-12-18 11:22:00,2015-12-18 11:22:00,885,238,2959,R,1
KolyaBurkov,"Грегор Гизи : ""Канцлера Германии больше нет ,теперь есть шестерка США"" ! https://t.co/Fh6FdyIxBx",Unknown,Russian,2015-12-18 12:53:00,2015-12-18 12:53:00,885,238,2960,R,1
KolyaBurkov,Хуесос @poroshenko думаешь мы забудем?   https://t.co/reXnev7RUp,Unknown,Russian,2015-12-19 00:12:00,2015-12-19 00:12:00,885,238,2962,R,1
KolyaBurkov,21 декабря в Москве министры стран ОДКБ обсудят борьбу с международным терроризмом https://t.co/WJVS5Rp8FF,Unknown,Macedonian,2015-12-19 08:12:00,2015-12-19 08:12:00,885,237,2963,R,1
KolyaBurkov,Крымские татары лишили лидеров меджлиса права говорить от имени народа https://t.co/RS8hykpOkj https://t.co/UtNjedLF5L,Unknown,Russian,2015-12-19 12:51:00,2015-12-19 12:51:00,885,237,2966,R,1
KolyaBurkov,"Вы себя окрестили «старшими» - нам бы младшими, да не вашими... https://t.co/5Zb1A46F7t",Unknown,Ukrainian,2015-12-19 20:13:00,2015-12-19 20:13:00,885,237,2968,R,1
KolyaBurkov,ПСВ победил «ПЕК Зволле» и догнал «Аякс» в таблице чемпионата Нидерландов https://t.co/Kzy8kML5PD,Unknown,Russian,2015-12-19 21:57:00,2015-12-19 21:57:00,885,237,2969,R,1
KolyaBurkov,"#AirFrance направит другой самолет, чтобы забрать эвакуированных в Кении пассажиров  https://t.co/WDHT9EA1Nd",Unknown,Russian,2015-12-20 11:34:00,2015-12-20 11:34:00,885,238,2971,R,1
KolyaBurkov,Была возможность доложить сегодня министру обороны РФ впечатления о поездке в Сирию и определенные предложения. Шойгу выслушал внимательно.,Unknown,Russian,2015-12-21 18:34:00,2015-12-21 18:34:00,885,238,2978,R,1
KolyaBurkov,В сети появилось видео успешной посадки первой ступени ракеты Falcon 9 https://t.co/dcyMy1nZLq https://t.co/rIRouu9yNJ,Unknown,Russian,2015-12-22 09:41:00,2015-12-22 09:41:00,885,238,2982,R,1
KolyaBurkov,Эксперт из США: вскрытие самописца сбитого Су-24 прошло по правилам https://t.co/LNMGalaQap https://t.co/pNMwt0b9Gs,Unknown,Russian,2015-12-22 22:12:00,2015-12-22 22:12:00,885,238,2988,R,1
KolyaBurkov,В Стамбуле скончалась одна из пострадавших при взрыве в аэропорту https://t.co/0LyjukMKVb,Unknown,Russian,2015-12-23 10:42:00,2015-12-23 10:42:00,885,237,2991,R,1
KolyaBurkov,Петербургским водителям суд разрешил парковаться на газонах и детских площадках https://t.co/CSTI8Vp20R,Unknown,Russian,2015-12-23 15:59:00,2015-12-23 15:59:00,885,238,2996,R,1
KolyaBurkov,Киевское «Динамо» и «Шахтёр» — за сокращение УПЛ до 12 команд https://t.co/QPPb5XkeCQ,Unknown,Ukrainian,2015-12-23 16:37:00,2015-12-23 16:37:00,885,238,2997,R,1
KolyaBurkov,"""Недавно я пообщалась с бывшим адвокатом Ходорковского Робертом Амстердамом https://t.co/7PdJZqy3Jh ой вей",Unknown,Russian,2015-12-23 18:14:00,2015-12-23 18:15:00,885,238,2999,R,1
KolyaBurkov,Минобороны РФ: Турция признала спланированное уничтожение Су-24 https://t.co/mWrTqkDgR6… https://t.co/PUim71YQLY,Unknown,Russian,2015-12-23 18:14:00,2015-12-23 18:14:00,885,238,2998,R,1
KolyaBurkov,"МВФ и Новый Долговой Порядок  Вот хочется прямо сразу сказать, что изменение Международным в https://t.co/V93Rk69EF0 https://t.co/MCMMs6iCpK",Unknown,Russian,2015-12-23 21:27:00,2015-12-23 21:27:00,885,238,3001,R,1
KolyaBurkov,Центральный Республиканский Банк ДНР распорядился установить курсы валют на 24 декабря 2015г. https://t.co/X9RKCDU8eE,Unknown,Russian,2015-12-24 00:18:00,2015-12-24 00:19:00,885,238,3003,R,1
KolyaBurkov,Власти Москвы намерены запретить торговлю редкими животными в интернете https://t.co/86c362kkub,Unknown,Russian,2015-12-24 16:22:00,2015-12-24 16:22:00,885,238,3007,R,1
KolyaBurkov,"зря бабулек не призывают в армию. ведь если им сказать:""А вон там есть свободные места"", они возьмут любую стратегическую высоту",Unknown,Russian,2015-12-24 16:25:00,2015-12-24 16:25:00,885,238,3008,R,1
KolyaBurkov,"#Захарова предупредила, что обращать внимание на Саакашвили опасно для здоровья https://t.co/BDwRYr6QuQ",Unknown,Russian,2015-12-24 16:32:00,2015-12-24 16:32:00,885,238,3009,R,1
KolyaBurkov,На крымской дороге фура столкнулась с Тойотой  Фото: Диана Белая В Симферопольском районе в  https://t.co/g8akScejlf https://t.co/Ic65XY9IGq,Unknown,Russian,2015-12-24 22:22:00,2015-12-24 22:22:00,885,239,3010,R,1
KolyaBurkov,Центральный Республиканский Банк ДНР распорядился установить курсы валют на 25 декабря 2015г. https://t.co/x7kr8PpwgR,Unknown,Russian,2015-12-25 06:51:00,2015-12-25 06:51:00,885,238,3012,R,1
KolyaBurkov,Совфед продлил амнистию капиталов до июля 2016 года https://t.co/BG6xVvmNfK https://t.co/yCIwWdHT68,Unknown,Ukrainian,2015-12-25 10:55:00,2015-12-25 10:55:00,885,238,3013,R,1
KolyaBurkov,#StarWars #ЗвездныеВойны #Ять #ЯтьТВ #юмор #политика  https://t.co/dVvfIDxwJv,Unknown,Russian,2015-12-25 15:48:00,2015-12-25 15:48:00,885,238,3015,R,1
KolyaBurkov,Жертвами ДТП в Ростовской области стали пять человек https://t.co/JRw213nnas,Unknown,Russian,2015-12-26 01:14:00,2015-12-26 01:14:00,885,238,3019,R,1
KolyaBurkov,Сообщение о бомбе в одном из крупнейших ТЦ Самары оказалось ложным   https://t.co/BYJRmG6Udl,Unknown,Russian,2015-12-26 15:33:00,2015-12-26 15:33:00,885,238,3023,R,1
