author_id,content,region,language,publish_date,harvested_date,following,followers,updates,post_type,retweet
dannythehappies,"Seafood eatin', I heard you like Red Lobster #love #rap",United States,English,2014-11-26 10:21:00,2014-11-28 16:36:00,173,84,323,,0
dannythehappies,All about Black Friday and sales http://t.co/3LKMtKKvuM,United States,English,2014-11-27 09:36:00,2014-11-27 09:36:00,173,80,208,R,1
dannythehappies,WHAT`S WRONG WITH THIS WORLD??! It`s time to stop violence!! I HATE THIS INJUSTICE WORLD!! #TamirRice http://t.co/UW1dO89Rpn,United States,English,2014-11-27 09:59:00,2014-11-27 09:59:00,173,80,209,R,1
dannythehappies,Happy Thanksgiving! Thank you  @JennaTraveller for making a holiday from my life #MentionPeopleYouAreThankfulFor http://t.co/qOfSKakD0Y,United States,English,2014-11-27 17:13:00,2014-11-27 17:13:00,173,80,210,R,1
dannythehappies,#WhyImThankful dinner is my favourite part of any holiday! :) http://t.co/T6mxARYr6A,United States,English,2014-11-27 17:21:00,2014-11-27 17:21:00,173,80,211,R,1
dannythehappies,i'm gonna give you just one more chance #normal,United States,English,2014-11-28 09:03:00,2014-11-28 09:03:00,173,80,213,,0
dannythehappies,Cause you'll never take my pride from me #love #rap,United States,English,2014-11-28 09:03:00,2014-11-28 09:03:00,173,80,212,,0
dannythehappies,Live by the harmless untruths that make you brave and kind and healthy and happy. #Kurt_Vonnegut,United States,English,2014-11-28 09:04:00,2014-11-28 09:04:00,173,80,213,,0
dannythehappies,A sound mind in a sound body,United States,English,2014-11-28 09:05:00,2014-11-28 09:05:00,173,80,217,,0
dannythehappies,We need to wait just a little bit. #USA #imho,United States,English,2014-11-28 09:05:00,2014-11-28 09:07:00,173,80,216,,0
dannythehappies,There is small choice in rotten apples,United States,English,2014-11-28 09:06:00,2014-11-28 09:06:00,173,80,219,,0
dannythehappies,like a thunder and lightnin' storm #dumb,United States,English,2014-11-28 09:07:00,2014-11-28 09:07:00,173,80,220,,0
dannythehappies,"""A man is what he thinks about all day long."" - Ralph Waldo Emerson #quote #true",United States,English,2014-11-28 09:08:00,2014-11-28 09:09:00,173,80,221,,0
dannythehappies,Stop dreaming and underrating yourself. You have all the powers of the universe if only you would awaken. ~Philip Arnold,United States,English,2014-11-28 09:12:00,2014-11-28 09:12:00,173,81,222,,0
dannythehappies,Even a mistake can lead to a happy ending. Don't lose hope.,United States,English,2014-11-28 09:13:00,2014-11-28 09:13:00,173,81,224,,0
dannythehappies,"i was a guitar picker, yeah #world",United States,English,2014-11-28 09:14:00,2014-11-28 09:15:00,173,81,228,,0
dannythehappies,Country in your eyes   #America,United States,English,2014-11-28 09:15:00,2014-11-28 09:15:00,173,81,229,,0
dannythehappies,"Tear it all to pieces, and take back what I made #HollywoodUndead",United States,English,2014-11-28 09:17:00,2014-11-28 09:17:00,173,81,231,,0
dannythehappies,i took an offer in another town #music,United States,English,2014-11-28 09:17:00,2014-11-28 09:17:00,173,81,230,,0
dannythehappies,I bet you look even better with me in between #love #rap,United States,English,2014-11-28 09:18:00,2014-11-28 09:18:00,173,81,233,,0
dannythehappies,your destiny chose the reaper,United States,English,2014-11-28 09:19:00,2014-11-28 09:19:00,173,81,235,,0
dannythehappies,Remember now thy Creator in the days of thy youth.,United States,English,2014-11-28 09:19:00,2014-11-28 09:19:00,173,81,233,,0
dannythehappies,jigsaw falling into place,United States,English,2014-11-28 09:20:00,2014-11-28 09:20:00,173,81,237,,0
dannythehappies,"United we stand, divided we fall",United States,English,2014-11-28 09:20:00,2014-11-28 09:20:00,173,81,236,,0
dannythehappies,"with nobody left to fight and no one to hold you tight, someone's going home alone again tonight  #love",United States,English,2014-11-28 09:23:00,2014-11-28 09:23:00,173,81,240,,0
dannythehappies,just moving and grooving #dumb,United States,English,2014-11-28 09:24:00,2014-11-28 09:24:00,173,81,242,,0
dannythehappies,"I lost my love, my life that night. #iTunes",United States,English,2014-11-28 09:24:00,2014-11-28 09:24:00,173,81,241,,0
dannythehappies,"If you have a person whom you can tell your dreams, you can’t feel lonely.",United States,English,2014-11-28 09:24:00,2014-11-28 09:24:00,173,81,243,,0
dannythehappies,does it really matters anything? world is too difficult to understand,United States,English,2014-11-28 09:25:00,2014-11-28 09:25:00,173,81,245,,0
dannythehappies,Why aint we somewhere hot for the weekend #love #rap,United States,English,2014-11-28 09:25:00,2014-11-28 09:25:00,173,81,244,,0
dannythehappies,"""Trust me you can dance"" -Vodka #KeepingItReal",United States,English,2014-11-28 09:26:00,2014-11-28 09:26:00,173,81,246,,0
dannythehappies,so spin that wheel #faith,United States,English,2014-11-28 09:27:00,2014-11-29 10:12:00,173,81,248,,0
dannythehappies,"Every author in some way portrays himself in his works, even if it be against his will #USA",United States,English,2014-11-28 09:29:00,2014-11-28 09:29:00,173,81,249,,0
dannythehappies,"""Write it on your heart that every day is the best day in the year."" - Ralph Waldo Emerson #quote #true",United States,English,2014-11-28 09:29:00,2014-11-28 09:29:00,173,81,250,,0
dannythehappies,"So there's nothing for me to fall back on, I know no other trades #love #rap",United States,English,2014-11-28 09:31:00,2014-11-28 09:31:00,173,81,251,,0
dannythehappies,"that's why i'm lonely, i'm so lonely #damnit",United States,English,2014-11-28 09:33:00,2014-11-28 09:33:00,173,81,254,,0
dannythehappies,broken boned #lonely,United States,Dutch,2014-11-28 09:34:00,2014-11-28 09:34:00,173,82,255,,0
dannythehappies,All these pills got to operate,United States,English,2014-11-28 09:36:00,2014-11-28 09:36:00,173,82,257,,0
dannythehappies,«A man sees in the world what he carries in his heart.» #JohannWolfgangGoethe,United States,English,2014-11-28 09:36:00,2014-11-28 09:36:00,173,82,258,,0
dannythehappies,Damned his luck on #USA #imho,United States,English,2014-11-28 09:37:00,2014-11-28 09:38:00,173,82,260,,0
dannythehappies,“My girlfriend always laughs during sex—no matter what she’s reading.” #SteveJobs,United States,English,2014-11-28 09:37:00,2014-11-28 09:37:00,173,82,259,,0
dannythehappies,Those who would give up essential liberty to purchase a little temporary safety deserve neither liberty nor safety.,United States,English,2014-11-28 09:39:00,2014-11-28 09:39:00,173,82,261,,0
dannythehappies,"I tend to avoid televisions, politics, and places with velvet ropes.",United States,English,2014-11-28 09:41:00,2014-11-28 09:42:00,173,82,265,,0
dannythehappies,Got the clothes coming off,United States,English,2014-11-28 09:41:00,2014-11-28 09:41:00,173,82,263,,0
dannythehappies,I want a perfect soul,United States,English,2014-11-28 09:42:00,2014-11-28 09:42:00,173,82,266,,0
dannythehappies,Cheek brings success,United States,English,2014-11-28 09:42:00,2014-11-28 09:43:00,173,82,267,,0
dannythehappies,Life is predictable…set YOUR Legacy before YOU are gone,United States,English,2014-11-28 09:43:00,2014-11-28 09:43:00,173,82,268,,0
dannythehappies,Beware of the young doctor and the old barber,United States,English,2014-11-28 09:43:00,2014-11-28 09:43:00,173,82,269,,0
dannythehappies,Got bitches to my neck like I'm standin' in quick sand #RAPCORE,United States,English,2014-11-28 09:44:00,2014-11-28 09:44:00,173,82,270,,0
dannythehappies,"A person, be it gentleman or lady, who has not pleasure in a good novel, must be intolerably stupid. — Jane Austen #quote #true",United States,English,2014-11-28 09:44:00,2014-11-28 09:45:00,173,82,270,,0
dannythehappies,God knows one day you will finally see #badday,United States,English,2014-11-28 09:46:00,2014-11-28 09:46:00,173,82,272,,0
dannythehappies,"Man is least himself when he talks in his own person. Give him a mask, and he will tell you the truth.",United States,English,2014-11-28 09:47:00,2014-11-28 09:47:00,173,82,273,,0
dannythehappies,i'm gonna ride on #fucktheworld,United States,English,2014-11-28 09:47:00,2014-11-28 09:47:00,173,82,274,,0
dannythehappies,I would act all nonchalant infront of an audience #love #rap,United States,English,2014-11-28 09:48:00,2014-11-28 09:48:00,173,82,276,,0
dannythehappies,"I wanna take you home, but your friends won`t let ya, i got a 40 in my Ford Fiesta. #iTunes",United States,English,2014-11-28 09:49:00,2014-11-28 09:49:00,173,82,279,,0
dannythehappies,"""Let's watch a scary movie!"" * several hours later* ""Dude, walk me to the bathroom.."" #quote #true",United States,English,2014-11-28 09:49:00,2014-11-28 09:49:00,173,82,277,,0
dannythehappies,I think everything will be alright as for me,United States,English,2014-11-28 09:49:00,2014-11-28 09:49:00,173,82,278,,0
dannythehappies,Didn’t want to see me live so you gave me your knife #RAP,United States,English,2014-11-28 09:50:00,2014-11-28 09:50:00,173,82,280,,0
dannythehappies,i was born to love till the day i die #lonely,United States,English,2014-11-28 09:50:00,2014-11-28 09:51:00,173,82,281,,0
dannythehappies,"""The ability to speak eloquently is not to be confused with having something to say."" - Michael P. Hart",United States,English,2014-11-28 09:51:00,2014-11-28 09:51:00,173,82,282,,0
dannythehappies,A child is an angel dependent on man,United States,English,2014-11-28 09:52:00,2014-11-28 09:54:00,173,82,283,,0
dannythehappies,0/10. Expecting speedy recovery.,United States,English,2014-11-28 09:54:00,2014-11-28 09:54:00,173,82,286,,0
dannythehappies,"We can't all be Washingtons, but we can all be patriots.  ~Charles F. Browne #USA",United States,English,2014-11-28 09:55:00,2014-11-28 09:55:00,173,82,287,,0
dannythehappies,An hour in the morning is worth two in the evening,United States,English,2014-11-28 09:57:00,2014-11-28 09:57:00,173,82,288,,0
dannythehappies,Bread never falls but on its buttered side,United States,English,2014-11-28 09:57:00,2014-11-28 09:57:00,173,82,289,,0
dannythehappies,What's saved could be one last lifetime #iTunes,United States,English,2014-11-28 09:59:00,2014-11-28 09:59:00,173,82,291,,0
dannythehappies,It is an interesting question how far men would retain their relative rank if they were divested of their clothes.,United States,English,2014-11-28 09:59:00,2014-11-28 09:59:00,173,82,292,,0
dannythehappies,Every day is not Sunday,United States,English,2014-11-28 10:00:00,2014-11-28 10:01:00,173,82,294,,0
dannythehappies,More precisely: we are never understood — hence our authority.,United States,English,2014-11-28 10:00:00,2014-11-28 10:00:00,173,82,293,,0
dannythehappies,"When something’s cold, let me put a little fire on it #iTunes",United States,English,2014-11-28 10:01:00,2014-11-28 10:01:00,173,82,295,,0
dannythehappies,"Employ thy time well, if thou meanest to get leisure",United States,English,2014-11-28 10:02:00,2014-11-28 10:02:00,173,82,296,,0
dannythehappies,"Anybody can sympathise with the sufferings of a friend, but it requires a very fine nature to sympathise with a friend's success.",United States,English,2014-11-28 10:03:00,2014-11-28 10:03:00,173,82,299,,0
dannythehappies,"Top down, chrome spinnin' #love #rap",United States,English,2014-11-28 10:03:00,2014-11-28 10:03:00,173,82,300,,0
dannythehappies,And wave them side to side (side to side) #USA #imho,United States,English,2014-11-28 10:03:00,2014-11-28 10:03:00,173,82,298,,0
dannythehappies,No time to waste back to my place,United States,English,2014-11-28 10:06:00,2014-11-28 10:06:00,173,82,302,,0
dannythehappies,Then it made you lose your faith #RAP,United States,English,2014-11-28 10:07:00,2014-11-28 10:07:00,173,82,304,,0
dannythehappies,gonna set this town on fire #awesome,United States,English,2014-11-28 10:08:00,2014-12-01 03:53:00,173,82,305,,0
dannythehappies,love supreme #true #love,United States,English,2014-11-28 10:10:00,2014-11-28 10:10:00,173,82,307,,0
dannythehappies,You took my hand added a plan #love #rap,United States,English,2014-11-28 10:10:00,2014-11-28 10:10:00,173,82,306,,0
dannythehappies,she's got big balls #smart,United States,English,2014-11-28 10:13:00,2014-11-28 10:13:00,173,82,309,,0
dannythehappies,You took away my kid so I guess you killed me twice #RAP,United States,English,2014-11-28 10:14:00,2014-11-28 10:14:00,173,82,310,,0
dannythehappies,Opportunity is missed by most people because it is dressed in overalls and looks like work. - Thomas Edison #quote #true,United States,English,2014-11-28 10:15:00,2014-11-28 10:15:00,173,82,312,,0
dannythehappies,The day you leave will cry a river #love #rap,United States,English,2014-11-28 10:17:00,2014-11-28 10:17:00,173,82,313,,0
dannythehappies,Be as you wish to seem. #socrates,United States,English,2014-11-28 10:18:00,2014-11-28 10:18:00,173,82,315,,0
dannythehappies,Obama Opens Eastern Seaboard to Oil Exploration,United States,English,2014-11-28 10:18:00,2014-11-28 10:18:00,173,82,314,,0
dannythehappies,fighting beck the rush of emotions #true #love,United States,English,2014-11-28 10:19:00,2014-11-28 10:27:00,173,82,316,,0
dannythehappies,"Liberty and Union, now and forever, one and inseparable!  ~Daniel Webster #USA",United States,English,2014-11-28 10:20:00,2014-11-28 10:20:00,173,82,317,,0
dannythehappies,I recommend The Infernal Devices to every Female Young Adult that loves to read! Please do yourselves the pleasure!,United States,English,2014-11-28 10:26:00,2014-11-28 10:27:00,173,83,320,,0
dannythehappies,Cause I'mma fight 'til I die or win,United States,English,2014-11-28 10:27:00,2014-11-28 10:27:00,173,83,321,,0
dannythehappies,A 10 percent down #USA #imho,United States,English,2014-11-28 10:28:00,2014-11-28 10:28:00,173,83,323,,0
dannythehappies,One drop of poison infects the whole tun of wine,United States,English,2014-11-28 10:28:00,2014-11-28 10:28:00,173,83,322,,0
dannythehappies,I will be chasing the starlight #love #feelings,United States,English,2014-12-01 13:10:00,2014-12-01 13:10:00,365,97,326,,0
dannythehappies,Shake shake shake your money maker,United States,English,2014-12-01 13:11:00,2014-12-01 13:11:00,365,97,330,,0
dannythehappies,Friendless is poor(((,United States,English,2014-12-01 13:12:00,2014-12-01 13:12:00,365,97,331,,0
dannythehappies,"Thou art weighed in the balances, and art found wanting.",United States,English,2014-12-01 13:17:00,2014-12-01 13:18:00,365,97,333,,0
dannythehappies,Hard days are the best because that's when champions are made. - Gabby Douglas #quote #true,United States,English,2014-12-04 07:20:00,2014-12-04 07:20:00,363,96,336,,0
dannythehappies,"“What is it you most dislike? Stupidity, especially in its nastiest forms of racism and superstition.”  ― Christopher Hitchens #ICantBreathe",United States,English,2014-12-04 07:49:00,2014-12-04 07:50:00,363,96,341,R,1
dannythehappies,Sometimes I'm embarrassed to be American. I hope  that justice may finally be served! #ICantBreathe #CrimingWhileWhite #RIPEricGarner,United States,English,2014-12-04 08:22:00,2014-12-04 08:22:00,363,96,342,R,1
dannythehappies,"Mark the perfect man, and behold the upright.",United States,English,2014-12-05 07:14:00,2014-12-05 07:14:00,363,96,343,,0
dannythehappies,you told me that you felt the same #summer,United States,English,2014-12-05 07:15:00,2014-12-05 07:15:00,363,96,344,,0
dannythehappies,she's looking like a wet dream #awesome,United States,English,2014-12-05 07:16:00,2014-12-05 07:16:00,363,96,345,,0
dannythehappies,Cunning craft is but the ape of wisdom,United States,English,2014-12-05 07:19:00,2014-12-05 07:19:00,363,96,347,,0
dannythehappies,i hope your two face livin's made you satisfied #hate,United States,English,2014-12-06 08:59:00,2014-12-06 08:59:00,363,95,351,,0
dannythehappies,"When yesterday is a disappointment and today isn't better, remember there's always a tomorrow.Make it something to look forward to",United States,English,2014-12-06 08:59:00,2014-12-06 08:59:00,363,95,350,,0
dannythehappies,Come break me down,United States,English,2014-12-06 08:59:00,2014-12-06 08:59:00,363,95,352,,0
dannythehappies,"Let go of those who bring you down, and surround yourself with those who bring out the best in you! #quote #true",United States,English,2014-12-06 09:00:00,2014-12-06 09:00:00,363,95,358,,0
dannythehappies,gonna put on a show #smart,United States,English,2014-12-06 09:00:00,2014-12-06 09:00:00,363,95,356,,0
dannythehappies,He took a face from the ancient gallery   #America,United States,English,2014-12-06 09:02:00,2014-12-06 09:02:00,363,95,359,,0
dannythehappies,I smack up the world if they rude to you (ehh...),United States,English,2014-12-06 09:02:00,2014-12-06 09:02:00,363,95,362,,0
dannythehappies,«One secret of success in life is for a man to be ready for his opportunity when it comes.» #BenjaminDisraeli,United States,English,2014-12-06 09:02:00,2014-12-06 09:02:00,363,95,360,,0
dannythehappies,How can I believe in God when just last week I got my tongue caught in the roller of an electric typewriter?,United States,English,2014-12-06 09:02:00,2014-12-06 09:02:00,363,95,363,,0
dannythehappies,All black shades when the sun come through,United States,English,2014-12-08 09:29:00,2014-12-08 09:29:00,363,98,366,,0
dannythehappies,I don't care what you'll say but everything is beautiful and me too,United States,English,2014-12-08 09:29:00,2014-12-08 09:29:00,363,98,365,,0
dannythehappies,i never smoked me no cigarettes #lonely,United States,English,2014-12-08 09:30:00,2014-12-08 09:30:00,363,98,368,,0
dannythehappies,"Enjoy the little things, for one day you may look back and realize they were the big things !!! #USA #imho",United States,English,2014-12-08 09:32:00,2014-12-08 09:32:00,363,98,370,,0
dannythehappies,still sometimes I think of us and how things fell apart. and how you knew from the first kiss that I would break your heart  #love,United States,English,2014-12-09 09:16:00,2014-12-09 09:16:00,363,99,371,,0
dannythehappies,whisper to me a sad song #true #love,United States,English,2014-12-09 09:16:00,2014-12-09 09:17:00,363,99,372,,0
dannythehappies,"Search others for their virtues, thyself for thy vices. #USA",United States,English,2014-12-09 09:18:00,2014-12-09 09:18:00,363,99,374,,0
dannythehappies,it's another lonely evenin' #summer,United States,English,2014-12-09 09:18:00,2014-12-09 09:18:00,363,99,375,,0
dannythehappies,Here's a very good rule of thumb in politics: losing begets losing.,United States,English,2014-12-09 09:20:00,2014-12-09 09:20:00,363,99,376,,0
dannythehappies,well baby that's tough #happy,United States,English,2014-12-09 09:22:00,2014-12-09 09:22:00,363,99,378,,0
dannythehappies,Mali says has no remaining Ebola cases as last patient recovers  #Ebola,United States,English,2014-12-12 11:37:00,2014-12-12 11:37:00,363,100,383,R,1
dannythehappies,Saudi King gives $35 million grant for Ebola fight  #Ebola,United States,English,2014-12-12 11:37:00,2014-12-12 11:37:00,363,100,382,R,1
dannythehappies,Ebola diary: Malaria medicine delivered under darkness  #Ebola,United States,English,2014-12-12 11:37:00,2014-12-12 11:37:00,363,100,381,R,1
dannythehappies,"""Religion is the opium of the people"" - Karl Marx. Use it correctly! #illridewithyou",United States,English,2014-12-16 08:29:00,2014-12-16 08:29:00,358,97,382,R,1
dannythehappies,It's very interesting to me  DO YOU FEEL SAFE IN YOUR COUNTRY?  - Fav yes you feel - RT no you don`t   #AskACop,United States,English,2014-12-17 15:08:00,2014-12-17 15:08:00,357,96,382,R,1
dannythehappies,"Over-thinking ruins you. Ruins the situation, twists things around, makes you worry and just makes everything much worse than it actually is",United States,English,2015-01-23 18:50:00,2015-01-23 18:50:00,296,103,385,,0
dannythehappies,Emo band returns from the dead to be killed off again http://t.co/GeBcCgb0Xp,United States,English,2015-01-23 19:37:00,2015-01-23 19:37:00,296,103,386,,0
dannythehappies,There is only one success - – to be able to spend your life in your own way.,United States,English,2015-01-23 19:43:00,2015-01-23 19:43:00,296,103,387,,0
dannythehappies,I said fuck that new girl that’s been in your bed and when you’re in her I know I’m in your head  – JoJo,United States,English,2015-01-23 20:07:00,2015-01-23 20:07:00,296,103,388,,0
dannythehappies,https://t.co/2zfRThjy15,United States,English,2015-01-23 20:14:00,2015-01-23 20:14:00,296,103,389,,0
dannythehappies,"Rising suddenly with the gaze of Love’s presence shining brightly in her eyes, she knew, and in knowing herself, she gave thanks.",United States,English,2015-01-23 20:25:00,2015-01-23 20:25:00,296,103,390,,0
dannythehappies,"Despite the superficial differences between us, we need to have a sense that all 7 billion human beings belong to one human family.",United States,English,2015-01-23 20:26:00,2015-01-23 20:26:00,296,103,391,,0
dannythehappies,"If a man does his best, what else is there? -George Patton",United States,English,2015-01-23 20:36:00,2015-01-23 20:36:00,296,103,392,,0
dannythehappies,It’s hard to say that I’d rather stay awake when I’m asleep,United States,English,2015-01-23 20:45:00,2015-01-23 20:45:00,296,103,393,,0
dannythehappies,And so I ask God to rid me of God. The God who is known and familiar is too small for him. -Meister Eckhart,United States,English,2015-01-23 20:50:00,2015-01-23 20:50:00,296,103,394,,0
dannythehappies,To love oneself is the beginning of a lifelong romance.,United States,English,2015-01-23 20:57:00,2015-01-23 20:57:00,296,103,395,,0
dannythehappies,"Intense love does not measure, it just gives.  – Mother Teresa",United States,English,2015-01-23 21:03:00,2015-01-23 21:04:00,296,103,396,,0
dannythehappies,My worth is not determined by the price of my clothes,United States,English,2015-01-23 21:06:00,2015-01-23 21:06:00,296,103,397,,0
dannythehappies,Understanding why something happened does not help to reduce the problem.,United States,English,2015-01-23 22:10:00,2015-01-23 22:10:00,296,103,400,,0
dannythehappies,"Be like the fountain that overflows, not like the cistern that merely contains",United States,English,2015-01-23 22:11:00,2015-01-23 22:11:00,296,103,401,,0
dannythehappies,Don't be afraid to start over. It's a brand new opportunity to rebuild what you truly want.,United States,English,2015-01-23 22:12:00,2015-01-23 22:12:00,296,103,402,,0
dannythehappies,I'm sick of checking my phone and not seeing your name.,United States,English,2015-01-23 22:39:00,2015-01-23 22:39:00,296,103,402,,0
dannythehappies,A man is only as good as what he loves.  – Saul Bellow,United States,English,2015-01-23 22:55:00,2015-01-23 22:55:00,296,103,404,,0
dannythehappies,� Double tap if Odell is just beast � #KEVINHD https://t.co/WX9ioTHs9w,United States,English,2015-01-23 23:01:00,2015-01-23 23:01:00,296,103,405,,0
dannythehappies,"Small girl, big breasts! http://t.co/SZg9wA0bQd",United States,English,2015-01-23 23:22:00,2015-01-23 23:22:00,296,103,406,,0
dannythehappies,Best f*king concert I ever saw - all 8 times!  http://t.co/0jDhXWoJeJ,United States,English,2015-01-23 23:41:00,2015-01-23 23:41:00,296,103,409,,0
dannythehappies,Boring shopping?? Forget about it! https://t.co/IZS0sdoDdX,United States,English,2015-01-23 23:57:00,2015-01-23 23:57:00,296,103,411,,0
dannythehappies,http://t.co/V4vUB0Silc Finally Pitbull does not only suit.,United States,English,2015-01-23 23:59:00,2015-01-23 23:59:00,296,103,413,,0
dannythehappies,« The wisest have the most authority. » Plato,United States,English,2015-01-30 09:26:00,2015-01-30 09:27:00,297,104,412,,0
dannythehappies,going to try this one!!!  https://t.co/gvvXgyjmHF,United States,English,2015-01-30 09:26:00,2015-01-30 09:26:00,297,104,410,,0
dannythehappies,How did he do that?? http://t.co/oN3Ca7gGO5,United States,English,2015-01-30 09:27:00,2015-01-30 09:27:00,297,104,413,,0
dannythehappies,"I just keep looking at the tractors, why? http://t.co/yBwJn7PvkF",United States,English,2015-01-30 09:27:00,2015-01-30 09:27:00,297,104,414,,0
dannythehappies,https://t.co/BqWdkn0xUd it must hurt!,United States,English,2015-01-30 09:28:00,2015-01-30 09:28:00,297,104,415,,0
dannythehappies,https://t.co/5msbK1ez4p,United States,English,2015-01-30 09:29:00,2015-01-30 09:29:00,297,104,415,,0
dannythehappies,"Dont underestimate the value of Doing Nothing,of just going along,listening to all the things you can't hear, and not bothering",United States,English,2015-01-30 09:31:00,2015-01-30 09:32:00,297,104,419,,0
dannythehappies,I have been so broken for a long time now.,United States,English,2015-01-30 09:31:00,2015-01-30 09:31:00,297,104,418,,0
dannythehappies,Noone believes in resling! http://t.co/pepXtGkZ7N,United States,English,2015-01-30 09:31:00,2015-01-30 09:31:00,297,104,416,,0
dannythehappies,"If you believe in yourself, have dedication and pride and never quit, you'll be a winner. -Paul Bryant",United States,English,2015-01-30 09:32:00,2015-01-30 09:32:00,297,104,421,,0
dannythehappies,Pau ran directly to see Kobe after his 23 points led CHI to a W over LAL on Christmas https://t.co/MPq7tV6rA0,United States,English,2015-01-30 09:32:00,2015-01-30 09:32:00,297,104,421,,0
dannythehappies,"Now we’re so interdependent, we need to build trust and confidence. On a national or personal level self-centredness is a source of trouble.",United States,English,2015-01-30 09:32:00,2015-01-30 09:32:00,297,104,420,,0
dannythehappies,Having an emotional connection with a business in some way is what fosters true loyalty. – Logan LaHive,United States,English,2015-01-30 09:33:00,2015-01-30 09:33:00,297,104,424,,0
dannythehappies,"For most of history, Anonymous was a woman.  – Virginia Woolf",United States,English,2015-01-30 09:33:00,2015-01-30 09:33:00,297,104,423,,0
dannythehappies,Hey guys -- It's officially Super Bowl Sunday.,United States,English,2015-02-01 11:03:00,2015-02-01 11:03:00,204,104,427,R,1
