author_id,content,region,language,publish_date,harvested_date,following,followers,updates,post_type,retweet
disneyTV_ru,Путин поздравил россиян с Днем тигра  http://t.co/sgngpQrj8H http://t.co/KDvf0n3rS6,United States,Russian,2015-09-26T10:33:00,2015-09-26T10:33:00,1954.0000000000,218.0000000000,2287.0000000000,R,True
disneyTV_ru,Путин ответит! https://t.co/MW6w0tOqNw,United States,Macedonian,2015-09-27T12:52:00,2015-09-27T12:52:00,1954.0000000000,219.0000000000,2293.0000000000,R,True
disneyTV_ru,В ночь на 28 сентября жители Земли увидят «кровавую Луну»   http://t.co/kI1yKnO8wq,United States,Russian,2015-09-27T15:33:00,2015-09-27T15:33:00,1954.0000000000,219.0000000000,2294.0000000000,R,True
disneyTV_ru,Роухани покидает Генассамблею из-за гибели иранцев в Мекке http://t.co/Lb3Ev6Ux3C,United States,Russian,2015-09-28T02:12:00,2015-09-28T02:13:00,1954.0000000000,219.0000000000,2297.0000000000,R,True
disneyTV_ru,Bank of America заметил признаки восстановления российской экономики  http://t.co/uRs0jAeVYE,United States,Russian,2015-09-28T03:53:00,2015-09-28T03:53:00,1954.0000000000,219.0000000000,2298.0000000000,R,True
disneyTV_ru,В московском метро пассажиры защитили мальчика от педофила http://t.co/C5NycaHujM,United States,Russian,2015-09-28T11:52:00,2015-09-28T11:52:00,1954.0000000000,219.0000000000,2307.0000000000,R,True
disneyTV_ru,Москву грозят закрыть для старых автомобилей http://t.co/xvvUisvNTA,United States,Ukrainian,2015-09-28T14:13:00,2015-09-29T16:52:00,1954.0000000000,219.0000000000,2322.0000000000,R,True
disneyTV_ru,"Первый олимпийский коттедж в Сочи продан на аукционе за 8,8 млн рублей http://t.co/9mzif8b7U8 http://t.co/ePjPLyGHiT",United States,Russian,2015-09-28T14:31:00,2015-10-02T21:31:00,1953.0000000000,216.0000000000,2348.0000000000,R,True
disneyTV_ru,"Путин: ""Считаем попытки расшатать легитимность ООН крайне опасными""  http://t.co/lcExtW7TSZ http://t.co/DF3gkpd4nL",United States,Russian,2015-09-28T16:40:00,2015-09-28T16:41:00,1954.0000000000,219.0000000000,2311.0000000000,R,True
disneyTV_ru,"Путин заявил, что Россия ""в высшей степени"" удовлетворена сотрудничеством с ИРИ  http://t.co/KnOZ5nRcps",United States,Russian,2015-09-28T21:11:00,2015-09-28T21:11:00,1954.0000000000,219.0000000000,2313.0000000000,R,True
disneyTV_ru,"ВС США разрабатывают летающий мотоцикл. Наши саперы могут помочь им поднять на воздух не только мотоциклы, но и главный штаб.",United States,Russian,2015-09-30T06:31:00,2015-09-30T06:31:00,1954.0000000000,219.0000000000,2327.0000000000,R,True
disneyTV_ru,"'- Знакомьтесь, это моя девушка, она будет жить с нами. - Ты что, охренел, сержант, тут секретный объект!'",United States,Russian,2015-10-01T13:11:00,2015-10-01T13:11:00,1953.0000000000,218.0000000000,2334.0000000000,R,True
disneyTV_ru,Российская авиация добралась от «Исламского государства» и разбомбила их авиабазу    https://t.co/qlKlXXy7Ef,United States,Russian,2015-10-01T15:34:00,2015-10-01T15:34:00,1953.0000000000,218.0000000000,2337.0000000000,R,True
disneyTV_ru,National Interest о российском Су-34: крылатая машина уничтожения http://t.co/fgNTvc02fi,United States,Russian,2015-10-01T18:43:00,2015-10-01T18:43:00,1953.0000000000,218.0000000000,2338.0000000000,R,True
disneyTV_ru,Прогноз погоды на выходные и следующую неделю с 5 по 11 октября http://t.co/OJ549DrCxP http://t.co/5n3zbLn2bl,United States,Russian,2015-10-02T06:32:00,2015-10-02T06:32:00,1953.0000000000,218.0000000000,2342.0000000000,R,True
disneyTV_ru,"врачи в военкомате проводят осмотры по системе Станиславского. каждому второму - ""НЕ ВЕРЮ!""",United States,Ukrainian,2015-10-02T07:12:00,2015-10-02T07:12:00,1953.0000000000,218.0000000000,2343.0000000000,R,True
disneyTV_ru,Крис попытался остановить убившего 10 человек стрелка в Орегоне. Он получил 6 пуль и выжил https://t.co/iuFrHF2MGE http://t.co/H1pB4b8Din,United States,Russian,2015-10-02T20:33:00,2015-10-02T20:33:00,1953.0000000000,216.0000000000,2348.0000000000,R,True
disneyTV_ru,Украина не разменивается на Сирию http://t.co/mtQMq7c3XY http://t.co/t8VjQPOyra,United States,Russian,2015-10-02T23:12:00,2015-10-02T23:12:00,1953.0000000000,216.0000000000,2349.0000000000,R,True
disneyTV_ru,"У меня голубые глаза! Я горжусь, что я русский! http://t.co/1qWCUCtH2i",United States,Russian,2015-10-03T18:04:00,2015-10-03T18:05:00,1953.0000000000,216.0000000000,2352.0000000000,R,True
disneyTV_ru,Обама ввел режим ЧП в одном из штатов http://t.co/nheKPQUrxp http://t.co/xSBX3M3kLf,United States,Russian,2015-10-03T21:51:00,2015-10-03T21:51:00,1953.0000000000,216.0000000000,2354.0000000000,R,True
disneyTV_ru,ВОЗ: обстрел госпиталя является серьезным вызовом для гуманитарной деятельности в Афганистане http://t.co/si5mbSfDig,United States,Russian,2015-10-03T22:51:00,2015-10-03T22:51:00,1953.0000000000,216.0000000000,2355.0000000000,R,True
disneyTV_ru,В ДНР заявили о четырех сбитых украинских беспилотниках http://t.co/65vf18QJZU,United States,Russian,2015-10-04T13:52:00,2015-10-04T13:52:00,1953.0000000000,216.0000000000,2360.0000000000,R,True
disneyTV_ru,Политолог: Промышленники Германии и Франции требуют от своих правительств отменить санкции против РФ http://t.co/GcWqY4xuJC,United States,Russian,2015-10-05T05:51:00,2015-10-05T05:51:00,1953.0000000000,216.0000000000,2361.0000000000,R,True
disneyTV_ru,Опечатка по Фрейду http://t.co/NE3XwXFW4V,United States,Ukrainian,2015-10-05T07:32:00,2015-10-05T07:32:00,1953.0000000000,216.0000000000,2362.0000000000,R,True
disneyTV_ru,МИД Турции вручил послу России ноту протеста из-за инцидента с самолетом  http://t.co/HyNmYkM5IK,United States,Russian,2015-10-05T08:51:00,2015-10-05T08:51:00,1953.0000000000,215.0000000000,2363.0000000000,R,True
disneyTV_ru,"Премьер Турции заявил, что российский самолет нарушил воздушное пространство ""по ошибке"" http://t.co/vKDzVBysCf",United States,Russian,2015-10-05T11:31:00,2015-10-05T11:33:00,1953.0000000000,215.0000000000,2366.0000000000,R,True
disneyTV_ru,«Сбербанк» намерен требовать банкротства «Трансаэро» в суде  http://t.co/JccbsxWB9f,United States,Russian,2015-10-05T11:54:00,2015-10-05T11:54:00,1953.0000000000,215.0000000000,2367.0000000000,R,True
disneyTV_ru,Как точечная платная парковка может лишить возможности владеть автомобилем http://t.co/3GP6MUPVMG http://t.co/E3wdK7jLIn,United States,Russian,2015-10-06T06:32:00,2015-10-06T06:32:00,1953.0000000000,215.0000000000,2371.0000000000,R,True
disneyTV_ru,"Кеды Converse, 1917 год http://t.co/gJIVuI6VGi",United States,Russian,2015-10-06T07:32:00,2015-10-06T07:32:00,1953.0000000000,215.0000000000,2373.0000000000,R,True
disneyTV_ru,Савченко отреагировала на показания свидетеля со смехом и неприличным жестом http://t.co/IRFgjiR0Aq,United States,Russian,2015-10-06T12:32:00,2015-10-06T12:32:00,1953.0000000000,216.0000000000,2375.0000000000,R,True
disneyTV_ru,Врач рассказал о состоянии здоровья Эльдара Рязанова  http://t.co/4sry30ZVYc http://t.co/rjD5adQT4a,United States,Russian,2015-10-07T09:33:00,2015-10-07T09:34:00,1953.0000000000,216.0000000000,2381.0000000000,R,True
disneyTV_ru,"Гацкан: думаю, Дзюба — главная сила сборной России http://t.co/3qfbcVLcFV",United States,Russian,2015-10-07T12:36:00,2015-10-07T12:36:00,1953.0000000000,216.0000000000,2382.0000000000,R,True
disneyTV_ru,"сирийская группировка «Армия ислама» объявила войну России. ответа они так и не услышали, потому что он прилетел на сверхзвуковой",United States,Russian,2015-10-08T22:00:00,2015-10-08T22:01:00,1952.0000000000,215.0000000000,2392.0000000000,R,True
disneyTV_ru,"Генетики выяснили: геями не рождаются, а становятся http://t.co/eZmmtbTc73",United States,Russian,2015-10-09T11:12:00,2015-10-09T11:12:00,1952.0000000000,215.0000000000,2395.0000000000,R,True
disneyTV_ru,Times: Coca-Cola спонсирует ожирение  http://t.co/3VOrNyMiu3 http://t.co/wf2RNnXOYy,United States,Russian,2015-10-09T11:33:00,2015-10-09T11:33:00,1952.0000000000,215.0000000000,2396.0000000000,R,True
disneyTV_ru,Российский рынок грузовиков в сентябре сократился на 35%  http://t.co/z4MxFAynxM,United States,Russian,2015-10-09T17:12:00,2015-10-09T17:12:00,1953.0000000000,215.0000000000,2399.0000000000,R,True
disneyTV_ru,"Почетный президент ""Зимбру"": фанаты Молдавии ведут себя провокационно на матче с Россией  http://t.co/9C14vSHlSb",United States,Russian,2015-10-09T21:32:00,2015-10-09T21:32:00,1953.0000000000,215.0000000000,2400.0000000000,R,True
disneyTV_ru,Генштаб ВСУ: отвод артиллерии в Луганской области начался и будет завершен за 2 дня  http://t.co/f3RJciB0jc,United States,Russian,2015-10-10T08:54:00,2015-10-10T08:54:00,1953.0000000000,215.0000000000,2402.0000000000,R,True
disneyTV_ru,СМИ узнали о совещаниях в Пентагоне по маневрам российского спутника:  http://t.co/dX5joWXOIZ,United States,Russian,2015-10-10T13:33:00,2015-10-10T13:33:00,1954.0000000000,215.0000000000,2406.0000000000,R,True
disneyTV_ru,Моратти: «Интер» отражает характер Манчини http://t.co/mIgBz2OWon,United States,Russian,2015-10-10T14:33:00,2015-10-10T14:33:00,1954.0000000000,215.0000000000,2407.0000000000,R,True
disneyTV_ru,Доработанный проект бюджета-2016 будет представлен в правительство РФ 14 октября  http://t.co/fP4fbV7Cd5,United States,Russian,2015-10-10T16:12:00,2015-10-10T16:12:00,1954.0000000000,215.0000000000,2408.0000000000,R,True
disneyTV_ru,Почему русские такие нищие и как с этим бороться? http://t.co/q9t420IQMm,United States,Russian,2015-10-11T09:02:00,2015-10-11T09:02:00,1954.0000000000,215.0000000000,2412.0000000000,R,True
disneyTV_ru,«Трансаэро» выполнит рейсы в Тель-Авив до 14 октября http://t.co/MnKLpw6AyA http://t.co/aCXwflKsbN,United States,Russian,2015-10-11T16:52:00,2015-10-11T16:55:00,1954.0000000000,215.0000000000,2414.0000000000,R,True
disneyTV_ru,Энергетикам подрежут крылья  http://t.co/hMmLoEvNd7 http://t.co/iZlrEpi1XG,United States,Russian,2015-10-12T20:52:00,2015-10-12T20:52:00,1954.0000000000,216.0000000000,2321.0000000000,R,True
disneyTV_ru,Playboy прекратит публиковать фото полностью обнаженных женщин  http://t.co/HZa03lI573,United States,Russian,2015-10-13T03:53:00,2015-10-13T03:53:00,1954.0000000000,216.0000000000,2324.0000000000,R,True
disneyTV_ru,Лавров: поставляемое США оружие сирийской оппозиции попадет к террористам http://t.co/chxwrOvEWY,United States,Russian,2015-10-13T11:12:00,2015-10-13T11:12:00,1954.0000000000,216.0000000000,2327.0000000000,R,True
disneyTV_ru,"Москва надеется, что виновники обстрела посольства РФ в Сирии будут установлены, заявил Лавров http://t.co/3NGUWSZNAf",United States,Russian,2015-10-13T11:12:00,2015-10-13T11:12:00,1954.0000000000,216.0000000000,2326.0000000000,R,True
disneyTV_ru,Хроника разрыва шаблона по-американски   http://t.co/8aBl6K3Mf4 #ЗападvsРоссия http://t.co/CQohZGOvyx,United States,Russian,2015-10-13T11:32:00,2015-10-13T11:32:00,1954.0000000000,216.0000000000,2328.0000000000,R,True
disneyTV_ru,"Хохлов: заявление Стаценко — неправда, у «Кубани» есть мой номер счёта http://t.co/qOhqLm1f5S",United States,Russian,2015-10-13T14:12:00,2015-10-13T14:12:00,1954.0000000000,216.0000000000,2331.0000000000,R,True
disneyTV_ru,Принято решение по законопроекту о поправках в преамбулу Конституции  http://t.co/0RkMbHa9g8 http://t.co/jEhtgYcmf1,United States,Russian,2015-10-13T17:35:00,2015-10-13T17:36:00,1954.0000000000,216.0000000000,2332.0000000000,R,True
disneyTV_ru,Путин дал старт строительству в Амурской области газоперерабатывающего завода http://t.co/RNtGIq2gs8,United States,Russian,2015-10-14T09:34:00,2015-10-14T09:34:00,1954.0000000000,216.0000000000,2335.0000000000,R,True
disneyTV_ru,В Уфе инвалиды и пожилые люди могут воспользоваться социальным такси http://t.co/yL9KaxIfkQ,United States,Russian,2015-10-14T12:54:00,2015-10-14T12:54:00,1954.0000000000,216.0000000000,2336.0000000000,R,True
disneyTV_ru,Сирийская армия начала масштабную операцию в пригороде Дамаска http://t.co/S2zya7Ym0s http://t.co/1uBp7LgJ1T,United States,Russian,2015-10-14T12:56:00,2015-10-14T12:56:00,1954.0000000000,216.0000000000,2337.0000000000,R,True
disneyTV_ru,Керри заявил о намерении приехать на Ближний Восток http://t.co/t0Fb8MeEoi,United States,Russian,2015-10-14T20:44:00,2015-10-14T20:44:00,1954.0000000000,216.0000000000,2339.0000000000,R,True
disneyTV_ru,Forbes: швейцарские банки вынуждают россиян закрывать счета http://t.co/U15c8UspBL © Flickr http://t.co/tpJWN9ehxF,United States,Russian,2015-10-15T11:56:00,2015-10-15T11:56:00,1954.0000000000,216.0000000000,2343.0000000000,R,True
disneyTV_ru,Пушков о расчленении льва в зоопарке Дании  http://t.co/zWZusjJiPG http://t.co/5RDuifXNP4,United States,Russian,2015-10-15T19:51:00,2015-10-15T19:51:00,1954.0000000000,216.0000000000,2347.0000000000,R,True
disneyTV_ru,"В США арестован афганский военный, дезертировавший с базы ВВС во время курсов в США  http://t.co/6RbVpffOOt",United States,Russian,2015-10-16T01:12:00,2015-10-16T01:15:00,1954.0000000000,216.0000000000,2348.0000000000,R,True
disneyTV_ru,СБ ООН созывает экстренную встречу по просьбе Иордании http://t.co/mUqchbJxCw http://t.co/Kqyes8OeZt,United States,Russian,2015-10-16T04:13:00,2015-10-16T04:13:00,1954.0000000000,216.0000000000,2349.0000000000,R,True
disneyTV_ru,В центре Афин прошел пикет за справедливое расследование крушения малазийского Boeing http://t.co/QZbmA091EO,United States,Russian,2015-10-16T13:16:00,2015-10-16T13:16:00,1954.0000000000,216.0000000000,2353.0000000000,R,True
disneyTV_ru,Французская фигуристка Загорски получила право представлять Россию http://t.co/D3k9i7XqlX,United States,Russian,2015-10-17T12:11:00,2015-10-17T12:11:00,1954.0000000000,216.0000000000,2355.0000000000,R,True
disneyTV_ru,Тренер: старт в Саранске стал для фигуристки Сотниковой самым долгожданным после перерыва  http://t.co/QGfOap4DL7,United States,Russian,2015-10-17T12:33:00,2015-10-17T12:33:00,1954.0000000000,216.0000000000,2356.0000000000,R,True
disneyTV_ru,Завершился матч «Амкар» -- «Динамо»  http://t.co/T47OIeZvhp http://t.co/Fk8xZ1tsFl,United States,Russian,2015-10-17T16:11:00,2015-10-17T16:11:00,1954.0000000000,216.0000000000,2357.0000000000,R,True
disneyTV_ru,При взрыве на заводе в Алжире погибли четыре человека http://t.co/mPGDIxlqBt,United States,Russian,2015-10-18T18:15:00,2015-10-18T18:15:00,1954.0000000000,216.0000000000,2362.0000000000,R,True
disneyTV_ru,В столице Черногории проходит акция оппозиции с требованием отставки правительства  http://t.co/ipWERbAmfw,United States,Russian,2015-10-18T20:32:00,2015-10-18T20:32:00,1954.0000000000,216.0000000000,2363.0000000000,R,True
disneyTV_ru,Первое в России экологическое такси на электричестве появилось в Сочи http://t.co/OPKRIaWmdA http://t.co/8OZKnuWiig,United States,Russian,2015-10-19T09:31:00,2015-10-19T09:31:00,1954.0000000000,216.0000000000,2365.0000000000,R,True
disneyTV_ru,ВИДЕО. Спасатели выкапывают автомобили после мощного оползня в Калифорнии  http://t.co/4jBnSTWuM2 http://t.co/NVCY3xIbZT,United States,Russian,2015-10-19T09:55:00,2015-10-19T09:55:00,1954.0000000000,216.0000000000,2366.0000000000,R,True
disneyTV_ru,В Москве могут появиться кафе на эвакуаторах «Зеленый крокодил»  http://t.co/Bf7yiajaoL http://t.co/pxYSI8OCUb,United States,Russian,2015-10-19T17:13:00,2015-10-19T17:14:00,1953.0000000000,216.0000000000,2368.0000000000,R,True
disneyTV_ru,"ООН: Иран нарушил международные соглашения, казнив несовершеннолетних преступников https://t.co/oHmuPzVVGL",United States,Russian,2015-10-19T20:31:00,2015-10-19T20:31:00,1953.0000000000,216.0000000000,2371.0000000000,R,True
disneyTV_ru,"В Техасе пенсионерка въехала на внедорожнике в супермаркет; погиб 1 человек, 6 пострадали  https://t.co/m4k4gvgw6E",United States,Russian,2015-10-20T00:52:00,2015-10-20T00:52:00,1953.0000000000,216.0000000000,2373.0000000000,R,True
disneyTV_ru,ОБСЕ: беспилотник миссии потерял управление из-за глушения сигнала GPS https://t.co/PPyThAt5C6 https://t.co/j2IxlnfM8a,United States,Russian,2015-10-20T17:16:00,2015-10-20T17:16:00,1953.0000000000,216.0000000000,2378.0000000000,R,True
disneyTV_ru,Боевые корабли ВМС Ирана прибыли в Астрахань  https://t.co/MNsKJHkvBU https://t.co/RgQMDpmS5D,United States,Russian,2015-10-21T08:35:00,2015-10-21T08:35:00,1953.0000000000,216.0000000000,2379.0000000000,R,True
disneyTV_ru,Новый скандал с «5 каналом» Петра Порошенко https://t.co/T0n3Try404 https://t.co/WBQD6buQx2,United States,Russian,2015-10-21T23:23:00,2015-10-21T23:23:00,1953.0000000000,216.0000000000,2383.0000000000,R,True
disneyTV_ru,"Раздает Wi-Fi, заряжает телефоны, проигрывает музыку: В Верхней Пышме торжественно откроют ""фонарь будущего"" (... https://t.co/zdGIPYYxJD",United States,Russian,2015-10-22T02:42:00,2015-10-22T02:42:00,1953.0000000000,216.0000000000,2384.0000000000,R,True
disneyTV_ru,Путин: РФ не мыслит своего развития без взаимодействия с Европой - ПРЯМАЯ ТРАНСЛЯЦИЯ https://t.co/Z36hbNjogY https://t.co/vDaLkuvMf8,United States,Russian,2015-10-22T18:15:00,2015-10-22T18:20:00,1953.0000000000,217.0000000000,2391.0000000000,R,True
disneyTV_ru,Питер Кук: армия США не участвует в наземных операциях в Ираке https://t.co/IP2i393YoL https://t.co/h39S9luWAi,United States,Russian,2015-10-22T20:53:00,2015-10-22T20:53:00,1952.0000000000,217.0000000000,2392.0000000000,R,True
disneyTV_ru,Обама наложил вето на разрешающий поставки оружия Украине законопроект: https://t.co/TjMOWcoNIT Кто опять отсосал?,United States,Russian,2015-10-23T01:53:00,2015-10-23T01:54:00,1952.0000000000,217.0000000000,2393.0000000000,R,True
disneyTV_ru,Ровно 300 лет назад родился царь Петр II https://t.co/EJinwFtH1S https://t.co/PfMCHnaNRU,United States,Russian,2015-10-23T06:51:00,2015-10-23T06:51:00,1952.0000000000,217.0000000000,2394.0000000000,R,True
disneyTV_ru,"Привет, хамон: как журналисты ФАН «санкционку» заказывали  https://t.co/EVAyRW5lLZ  #санкции https://t.co/gjo5dcl9np",United States,Russian,2015-10-23T07:39:00,2015-10-23T07:39:00,1952.0000000000,217.0000000000,2395.0000000000,,False
disneyTV_ru,"Дом футболиста «Арсенала» ограбили, когда его жена и дети спали  https://t.co/WlBsvqHci6 https://t.co/qka86jXxKn",United States,Russian,2015-10-23T10:13:00,2015-10-23T10:13:00,1952.0000000000,217.0000000000,2398.0000000000,R,True
disneyTV_ru,"Затраты на ""майские"" указы президента РФ в 2016 году возрастут на 2,2% https://t.co/HV3gODoyuB https://t.co/WINh8Z4EfW",United States,Russian,2015-10-24T02:12:00,2015-10-24T02:12:00,1953.0000000000,218.0000000000,2402.0000000000,R,True
disneyTV_ru,(После армии) - Ты где был? - Бегал. - Но футболка сухая и совсем не пахнет! - Так я и пробежал всего 15 км.,United States,Russian,2015-10-24T13:31:00,2015-10-24T13:32:00,1953.0000000000,218.0000000000,2403.0000000000,R,True
disneyTV_ru,какое прекрасное видео прошло мимо меня)))))   https://t.co/MhKcRIRT47,United States,Russian,2015-10-24T21:33:00,2015-10-24T21:33:00,1953.0000000000,218.0000000000,2407.0000000000,R,True
disneyTV_ru,"Чёрная Сотня, ценз оседлости... Русские цари, создавшие империю, были не идиотами! Только это спасет Россию!",United States,Russian,2015-10-25T12:32:00,2015-10-25T12:32:00,1953.0000000000,218.0000000000,2409.0000000000,R,True
disneyTV_ru,.@ekolovratov о Закгейме и Назимсоне,United States,Russian,2015-10-25T13:34:00,2015-10-25T13:34:00,1953.0000000000,218.0000000000,2410.0000000000,R,True
disneyTV_ru,«Ни шанса агрессору»: кто мешал Блоку Порошенко победить на выборах https://t.co/HIvWiWLAYS,United States,Russian,2015-10-25T17:31:00,2015-10-25T17:31:00,1953.0000000000,218.0000000000,2413.0000000000,R,True
disneyTV_ru,Уникальная российская вакцина от гепатита В выйдет на мировой рынок https://t.co/YnrgBN2lO0,United States,Russian,2015-10-26T05:14:00,2015-10-26T05:14:00,1953.0000000000,218.0000000000,2417.0000000000,R,True
disneyTV_ru,Расследование РБК: кто зарабатывает на строительстве московского метро:  https://t.co/1BHND2byOn,United States,Russian,2015-10-26T08:12:00,2015-10-26T08:12:00,1953.0000000000,218.0000000000,2419.0000000000,R,True
disneyTV_ru,ФАС возбудила дело против издательства Conde Nast за рекламу шоппинг-фестиваля Colins https://t.co/mftbDHSc2J,United States,Russian,2015-10-26T12:02:00,2015-10-26T12:02:00,1953.0000000000,218.0000000000,2420.0000000000,R,True
disneyTV_ru,Правительство Германии назвало немыслимым участие Асада во временном правительстве Сирии https://t.co/6Eertnlw44,United States,Russian,2015-10-26T14:34:00,2015-10-26T14:34:00,1953.0000000000,218.0000000000,2422.0000000000,R,True
disneyTV_ru,Двое выживших при падении крана в Омске остаются в больнице https://t.co/jscLraN6lT,United States,Russian,2015-10-27T05:53:00,2015-10-27T05:53:00,1953.0000000000,217.0000000000,2424.0000000000,R,True
disneyTV_ru,Повысить потребительское доверие россиян не помог даже отпуск https://t.co/bHRySyczqq,United States,Russian,2015-10-27T07:36:00,2015-10-27T07:36:00,1953.0000000000,217.0000000000,2425.0000000000,R,True
disneyTV_ru,Первый самолёт «Аэрофлота» вместо «Трансаэро» прибыл из Москвы в Магадан  https://t.co/VP9ZJeL4NQ,United States,Russian,2015-10-27T07:37:00,2015-10-27T07:37:00,1953.0000000000,217.0000000000,2426.0000000000,R,True
