author_id,content,region,language,publish_date,harvested_date,following,followers,updates,post_type,retweet
disneyTV_ru,"Читателям ""Газеты.Ru"" нравится вечное зимнее время  https://t.co/cgcMoak1vX",United States,Russian,2015-10-27T09:11:00,2015-10-27T09:11:00,1953.0000000000,217.0000000000,2427.0000000000,R,True
disneyTV_ru,Голландские футболисты получили тюремные сроки за убийство судьи https://t.co/Ee5L6gVOe9,United States,Russian,2015-10-27T12:54:00,2015-10-27T12:55:00,1953.0000000000,217.0000000000,2430.0000000000,R,True
disneyTV_ru,Премьер Сербии пригласил Медведева приехать в Белград https://t.co/M0a0qmKbvA,United States,Russian,2015-10-27T13:53:00,2015-10-27T13:53:00,1953.0000000000,217.0000000000,2433.0000000000,R,True
disneyTV_ru,Владимир Путин призвал расширить использование рубля в торговле в сфере ТЭК  https://t.co/lehxLEKygT https://t.co/StZ0rBcKdo,United States,Russian,2015-10-27T13:53:00,2015-10-27T14:02:00,1953.0000000000,217.0000000000,2432.0000000000,R,True
disneyTV_ru,"Опубликовано видео задержания хабаровского катафалка с гробом, набитым черной икрой: https://t.co/mh54sPfaqj",United States,Russian,2015-10-27T13:53:00,2015-10-27T13:53:00,1953.0000000000,217.0000000000,2431.0000000000,R,True
disneyTV_ru,"Селюк: Фалькао не забьёт столько, сколько Дзюба, его приобретение – глупость https://t.co/qPJ1KxoQsU",United States,Russian,2015-10-27T13:55:00,2015-10-27T13:55:00,1953.0000000000,217.0000000000,2434.0000000000,R,True
disneyTV_ru,«Скорые» проверят на извоз  https://t.co/R29n4fLYgg https://t.co/T9uvJcdOgD,United States,Russian,2015-10-27T16:55:00,2015-10-27T16:55:00,1953.0000000000,217.0000000000,2436.0000000000,R,True
disneyTV_ru,С какой целью Керри посетит все страны Центральной Азии  https://t.co/ltW7xFgn7d https://t.co/a5AJQYNJ9B,United States,Russian,2015-10-27T20:33:00,2015-10-27T20:34:00,1953.0000000000,218.0000000000,2439.0000000000,R,True
disneyTV_ru,ФОТОРЕПОРТАЖ. Лучшие футболистки США в гостях у Обамы  https://t.co/D9x0l8BDL8 https://t.co/VqrKkECiGm,United States,Russian,2015-10-28T07:35:00,2015-10-28T07:35:00,1953.0000000000,218.0000000000,2442.0000000000,R,True
disneyTV_ru,Погибшего в Сирии российского контрактника похоронили с воинскими почестями  https://t.co/o1y6rycNlA https://t.co/7VIYIalV6A,United States,Russian,2015-10-28T12:16:00,2015-10-28T12:16:00,1953.0000000000,218.0000000000,2446.0000000000,R,True
disneyTV_ru,Когда же появится сгибающийся смартфон от Samsung  https://t.co/0fDsl3GX3A https://t.co/mzUM6o7QnD,United States,Russian,2015-10-28T15:31:00,2015-10-28T15:31:00,1953.0000000000,219.0000000000,2449.0000000000,R,True
disneyTV_ru,"McDonald’s запускает новый гамбургер, который будут готовить четыре часа  https://t.co/4rY77umQhi https://t.co/fjaRUyEcf4",United States,Russian,2015-10-28T17:31:00,2015-10-28T17:31:00,1953.0000000000,219.0000000000,2452.0000000000,R,True
disneyTV_ru,"'@volkova_v попробуй нигрол. А запивать тяжелой водой врачи советуют, да'",United States,Russian,2015-10-28T21:52:00,2015-10-28T21:52:00,1953.0000000000,219.0000000000,2453.0000000000,R,True
disneyTV_ru,СМИ: Неизвестный открыл стрельбу в торговом центре в США  https://t.co/h72GBUKPRt,United States,Russian,2015-10-29T01:12:00,2015-10-29T01:15:00,1953.0000000000,219.0000000000,2454.0000000000,R,True
disneyTV_ru,"У берегов Греции утонули не менее 7 мигрантов, среди них 5 детей https://t.co/N4BGogk1EZ",United States,Ukrainian,2015-10-29T01:53:00,2015-10-29T02:02:00,1953.0000000000,219.0000000000,2455.0000000000,R,True
disneyTV_ru,#день_в_истории: 29 октября 1918 года был создан Российский коммунистический союз молодёжи https://t.co/QXjraNeCUG,United States,Russian,2015-10-29T06:04:00,2015-10-29T06:04:00,1953.0000000000,219.0000000000,2456.0000000000,R,True
disneyTV_ru,ЕС приостановит санкции против Белоруссии на четыре месяца https://t.co/ZtGYcNdonM https://t.co/YBvE6NZBZg,United States,Russian,2015-10-29T10:31:00,2015-10-29T10:31:00,1953.0000000000,219.0000000000,2458.0000000000,R,True
disneyTV_ru,"Про интернет-живопырок.. Ну, про Левиева-Карпука @RuslanLeviev, короче.. https://t.co/te5058ukK1",United States,Ukrainian,2015-10-30T12:12:00,2015-10-30T12:12:00,1953.0000000000,219.0000000000,2464.0000000000,R,True
disneyTV_ru,Мостовой: «Матч ТВ» будет общедоступным? Не знал https://t.co/xt7SVgLaOj,United States,Russian,2015-10-30T12:16:00,2015-10-30T12:16:00,1953.0000000000,219.0000000000,2465.0000000000,R,True
disneyTV_ru,Лавров: задача России и США – не допустить прихода ИГ к власти в Сирии https://t.co/xTbjZL1e9L https://t.co/eH4MK8mytc,United States,Russian,2015-10-30T20:32:00,2015-10-30T20:32:00,1953.0000000000,219.0000000000,2467.0000000000,R,True
disneyTV_ru,"Президент Румынии заявил, что шокирован случившимся в клубе Бухареста https://t.co/Ckh6v7GEg6 © Flickr https://t.co/FRjJ0oR1x3",United States,Russian,2015-10-31T01:33:00,2015-10-31T01:33:00,1953.0000000000,219.0000000000,2468.0000000000,R,True
disneyTV_ru,Губернатору Санкт-Петербурга сообщили о крушении российского лайнера https://t.co/D1kUaMeVOO,United States,Russian,2015-10-31T09:14:00,2015-10-31T09:14:00,1953.0000000000,219.0000000000,2470.0000000000,R,True
disneyTV_ru,Из-за авиакатастрофы в Северном Синае введен режим ЧС  https://t.co/tdUz4YsVqK https://t.co/z0yzai32T3,United States,Ukrainian,2015-10-31T10:12:00,2015-10-31T10:12:00,1953.0000000000,219.0000000000,2472.0000000000,R,True
disneyTV_ru,Крушение российского лайнера в Египте может быть отголоском Boeing MH 117 https://t.co/xD8kv6v99H https://t.co/fe7FPfXIRx,United States,Russian,2015-10-31T11:11:00,2015-10-31T11:11:00,1953.0000000000,219.0000000000,2473.0000000000,R,True
disneyTV_ru,Опознание жертв крушения Airbus 321 будет проходить в Петербурге При этом уголовное дело будет вести центральный …  https://t.co/nwAOZTCmdl,United States,Russian,2015-10-31T15:55:00,2015-10-31T15:55:00,1953.0000000000,219.0000000000,2476.0000000000,R,True
disneyTV_ru,Кэмерон и Путин собираются встретиться на саммите G20 https://t.co/iBtx4aIyCe,United States,Russian,2015-11-01T15:04:00,2015-11-01T15:04:00,1953.0000000000,217.0000000000,2478.0000000000,R,True
disneyTV_ru,Сколько работать на айФон 6 https://t.co/hW03Bur1eM,United States,Russian,2015-11-01T20:32:00,2015-11-01T20:32:00,1953.0000000000,217.0000000000,2480.0000000000,R,True
disneyTV_ru,В Турции произошел взрыв неподалеку от границы с Сирией #новости https://t.co/nbgFstmlU9,United States,Russian,2015-11-01T23:54:00,2015-11-01T23:54:00,1953.0000000000,217.0000000000,2481.0000000000,R,True
disneyTV_ru,"Анна Гопко, глава комитета по иностр.делам 404-ой: Миссия Украины -развал путинской Московии  ну давай, разваливай)) https://t.co/ycs24vKmxR",United States,Russian,2015-11-02T12:05:00,2015-11-02T12:07:00,1953.0000000000,217.0000000000,2485.0000000000,R,True
disneyTV_ru,Прокуратура Берлина закрыла дело российского боксера Дениса Бойцова https://t.co/mdv5VvkbEx,United States,Russian,2015-11-02T16:12:00,2015-11-02T16:13:00,1953.0000000000,217.0000000000,2486.0000000000,R,True
disneyTV_ru,США нашли скандальное программное обеспечение в автомобилях Audi и Porsche https://t.co/MTa0UxiblJ,United States,Russian,2015-11-03T04:11:00,2015-11-03T04:11:00,1953.0000000000,217.0000000000,2488.0000000000,R,True
disneyTV_ru,Торрес впервые попал в стартовый состав «Атлетико» в Лиге чемпионов https://t.co/o7dKtisWNL,United States,Russian,2015-11-03T16:16:00,2015-11-03T16:17:00,1953.0000000000,217.0000000000,2489.0000000000,R,True
disneyTV_ru,Праздничные торжества в честь Дня народного единства прошли в Первомайске https://t.co/Du71L2RK2a,United States,Russian,2015-11-03T22:18:00,2015-11-03T22:21:00,1953.0000000000,217.0000000000,2492.0000000000,R,True
disneyTV_ru,"Forbes: Путин настолько влиятелен, что может делать все, что хочет, зная, что ему за это ничего не будет https://t.co/tVMBVrMiXW",United States,Russian,2015-11-04T15:32:00,2015-11-04T15:32:00,1953.0000000000,216.0000000000,2496.0000000000,R,True
disneyTV_ru,"Матч «Локомотив» — «Зенит» рассудит Москалёв, «Краснодар» — ЦСКА — Безбородов https://t.co/jT81KL6CKI",United States,Russian,2015-11-04T15:35:00,2015-11-04T15:35:00,1953.0000000000,216.0000000000,2497.0000000000,R,True
disneyTV_ru,ТВ: вывод Лондона о взрывном устройстве не связан с изучением обломков https://t.co/1AU3t4jgNz https://t.co/u5e0hWSC9b,United States,Russian,2015-11-04T19:31:00,2015-11-04T19:32:00,1952.0000000000,216.0000000000,2499.0000000000,R,True
disneyTV_ru,Белый дом по-прежнему не исключает взрыва на борту A321 https://t.co/XXsA4meCGw,United States,Russian,2015-11-05T20:24:00,2015-11-05T20:24:00,1952.0000000000,215.0000000000,2503.0000000000,R,True
disneyTV_ru,Парламенту Каталонии разрешили рассмотреть резолюцию о независимости https://t.co/vkQLRqoUtu,United States,Russian,2015-11-05T20:32:00,2015-11-05T20:33:00,1952.0000000000,215.0000000000,2504.0000000000,R,True
disneyTV_ru,Поезда на синей ветке московского метро ходят с задержками. Замедлено движение в сторону центра https://t.co/GS8QYMnWfH,United States,Russian,2015-11-06T08:36:00,2015-11-06T08:37:00,1952.0000000000,215.0000000000,2507.0000000000,R,True
disneyTV_ru,На Ставрополье приостановлены вылеты в Египет https://t.co/t1fyhzxf0u,United States,Russian,2015-11-07T05:12:00,2015-11-07T05:12:00,1953.0000000000,214.0000000000,2511.0000000000,R,True
disneyTV_ru,Индия начнёт поставлять в Россию твёрдые сыры https://t.co/JlqrPquoum https://t.co/uJ4DwnC5c3,United States,Russian,2015-11-07T05:13:00,2015-11-07T05:13:00,1953.0000000000,214.0000000000,2512.0000000000,R,True
disneyTV_ru,Ростуризм попросит отельеров Египта вернуть деньги российским туроператорам https://t.co/s2S3VbRZ9L,United States,Russian,2015-11-07T11:55:00,2015-11-07T11:55:00,1953.0000000000,214.0000000000,2517.0000000000,R,True
disneyTV_ru,ЕС надеется на сближение Тайваня и Китая после исторической встречи https://t.co/2ojI1HNiAi,United States,Russian,2015-11-07T20:55:00,2015-11-07T20:55:00,1952.0000000000,214.0000000000,2519.0000000000,R,True
disneyTV_ru,Власти Британии подтвердили инцидент с едва не сбитым самолетом в Египте https://t.co/H62yzbLHpq,United States,Ukrainian,2015-11-07T23:35:00,2015-11-07T23:35:00,1952.0000000000,214.0000000000,2521.0000000000,R,True
disneyTV_ru,МАК: Полёт самолёта А321 проходил в штатном режиме https://t.co/jr7pgLuxxm https://t.co/W1X6UDrNP9,United States,Russian,2015-11-08T05:52:00,2015-11-08T05:55:00,1952.0000000000,214.0000000000,2524.0000000000,R,True
disneyTV_ru,Вчера меня взломали хакеры-имамы!,United States,Macedonian,2015-11-08T17:34:00,2015-11-08T17:34:00,1952.0000000000,215.0000000000,2526.0000000000,R,True
disneyTV_ru,"Кредитный портфель Сбербанка вырос на 0,2%  https://t.co/TZtkeC7EJT",United States,Russian,2015-11-09T07:53:00,2015-11-09T07:53:00,1952.0000000000,215.0000000000,2529.0000000000,R,True
disneyTV_ru,СРОЧНО. Лондон о невозможности раскрыть все данные разведки по крушению А321  https://t.co/z4TvRGWi40 https://t.co/z8S37Jr4Ke,United States,Russian,2015-11-09T18:33:00,2015-11-09T18:33:00,1952.0000000000,216.0000000000,2533.0000000000,R,True
disneyTV_ru,"""Ъ"": Минюст обвинил ""Мемориал"" в подрыве конституционного строя России https://t.co/GymvRGeV4q",United States,Russian,2015-11-09T23:15:00,2015-11-09T23:15:00,1952.0000000000,216.0000000000,2535.0000000000,R,True
disneyTV_ru,"Банк России отозвал лицензии еще у двух банков и НКО Банковские операции запрещено осуществлять Межрегионбанку, …  https://t.co/w6i0YrTPZg",United States,Russian,2015-11-10T07:11:00,2015-11-10T07:11:00,1952.0000000000,216.0000000000,2536.0000000000,R,True
disneyTV_ru,Почти 120 тонн багажа российских туристов доставлено из Египта https://t.co/B0DOquwnSS https://t.co/xX6Kzqo03T,United States,Russian,2015-11-10T09:34:00,2015-11-10T09:34:00,1952.0000000000,216.0000000000,2538.0000000000,R,True
disneyTV_ru,Минтранс и Росавиация определили порядок выдачи багажа из Египта https://t.co/yoCRudbSJO https://t.co/NcaGYrvMbr,United States,Bulgarian,2015-11-10T09:53:00,2015-11-10T09:54:00,1952.0000000000,216.0000000000,2539.0000000000,R,True
disneyTV_ru,"российскую военную технику обнаружили в Сирии за пределом базы. если наша техника находится за пределом базы, там уже Россия",United States,Russian,2015-11-10T10:12:00,2015-11-10T10:12:00,1952.0000000000,216.0000000000,2540.0000000000,R,True
disneyTV_ru,Песков: новый список закрытых для полетов стран не обсуждался у Путина https://t.co/IPgZDQwfLM https://t.co/CfunbGgI15,United States,Ukrainian,2015-11-10T10:14:00,2015-11-10T10:14:00,1952.0000000000,216.0000000000,2541.0000000000,R,True
disneyTV_ru,"ахахахаха... особенно на выборах Ельцина было трудно. Г.А. Зюганов сейчас удивился бы,да https://t.co/4UXDTJUQna",United States,Russian,2015-11-10T11:36:00,2015-11-10T11:37:00,1952.0000000000,216.0000000000,2542.0000000000,R,True
disneyTV_ru,"Moody`s предрекает ""новую волну кризисов"" из-за Китая https://t.co/KpRyycGGF7",United States,Russian,2015-11-10T13:55:00,2015-11-10T13:55:00,1952.0000000000,216.0000000000,2543.0000000000,R,True
disneyTV_ru,Путин назвал истинную цель ПРО США  https://t.co/3bmGQP9es9 https://t.co/hlehzfVdyD,United States,Russian,2015-11-10T15:14:00,2015-11-10T15:14:00,1952.0000000000,216.0000000000,2544.0000000000,R,True
disneyTV_ru,"Доннарумма: хочу стать основным вратарём сборной Италии, как мой кумир Буффон https://t.co/SfIutiX9Ti",United States,Russian,2015-11-10T18:53:00,2015-11-10T18:53:00,1953.0000000000,217.0000000000,2547.0000000000,R,True
disneyTV_ru,https://t.co/F3f0WGPodX Как будто знали где и когда будет лететь и все радары направили. Всё это очень странно....,United States,Russian,2015-11-10T19:17:00,2015-11-10T19:17:00,1953.0000000000,217.0000000000,2548.0000000000,,False
disneyTV_ru,Более 3 тысяч туристов уже вернулись из Египта в Санкт-Петербург https://t.co/Q7aacSbvK2 https://t.co/VLz3zDJeeO,United States,Russian,2015-11-10T21:14:00,2015-11-10T21:14:00,1953.0000000000,217.0000000000,2550.0000000000,R,True
disneyTV_ru,"Слуцкий, Дзюба и Черышев представили новую форму сборной России в эфире ""Вечернего Урганта"" https://t.co/F9r2X9shNP",United States,Russian,2015-11-10T21:33:00,2015-11-10T21:33:00,1953.0000000000,217.0000000000,2551.0000000000,R,True
disneyTV_ru,ООН: любые предложения по решению кризиса в Сирии нужно приветствовать https://t.co/xqr2G7ue4G https://t.co/s25Pq6g9e3,United States,Russian,2015-11-11T03:11:00,2015-11-11T03:11:00,1953.0000000000,217.0000000000,2555.0000000000,R,True
disneyTV_ru,Минздрав: экспертиза останков жертв крушения А321 полностью завершена https://t.co/IhUfHxDpne https://t.co/lhSLzsAHBx,United States,Russian,2015-11-11T10:22:00,2015-11-11T10:22:00,1953.0000000000,217.0000000000,2559.0000000000,R,True
disneyTV_ru,Когда на дискотеке включили твою любимую песню https://t.co/0KrM4dDdag,United States,Russian,2015-11-11T14:14:00,2015-11-11T14:14:00,1953.0000000000,217.0000000000,2560.0000000000,R,True
disneyTV_ru,Введен запрет на сжигание сухой травы на землях сельского хозяйства  https://t.co/L0HJ3ovBiS https://t.co/kFxLlFd2nb,United States,Russian,2015-11-12T05:12:00,2015-11-12T05:12:00,1953.0000000000,217.0000000000,2563.0000000000,R,True
disneyTV_ru,"Скончался барабанщик, игравший в дебютном сингле The Beatles https://t.co/Xq0Wbdh0RP",United States,Russian,2015-11-12T05:13:00,2015-11-12T05:13:00,1953.0000000000,217.0000000000,2564.0000000000,R,True
disneyTV_ru,Спикер Рады высказался на тему однополых браков  https://t.co/X5pPuwnyn0 https://t.co/36JMViGeSR,United States,Russian,2015-11-12T11:16:00,2015-11-12T11:16:00,1953.0000000000,217.0000000000,2565.0000000000,R,True
disneyTV_ru,Мамлееву посмертно присуждена Большая премия «Русского Гулливера» https://t.co/KqLVV2UCK1,United States,Russian,2015-11-12T11:32:00,2015-11-12T11:32:00,1953.0000000000,217.0000000000,2566.0000000000,R,True
disneyTV_ru,Военная операция в Сирии отвлекла внимание россиян от кризиса https://t.co/5uyoqq0LgZ,United States,Russian,2015-11-12T12:36:00,2015-11-12T12:36:00,1953.0000000000,217.0000000000,2567.0000000000,R,True
disneyTV_ru,Apple создает собственную платежную систему в США https://t.co/eWpm1UTKyY https://t.co/rBh8v94qCI,United States,Russian,2015-11-12T14:57:00,2015-11-12T14:57:00,1953.0000000000,217.0000000000,2571.0000000000,R,True
disneyTV_ru,YouTube выпустил конкурента Apple Music и Spotify  https://t.co/f6YFHvLKRp https://t.co/vBSN9QvrmP,United States,Russian,2015-11-12T18:56:00,2015-11-12T18:56:00,1953.0000000000,219.0000000000,2573.0000000000,R,True
disneyTV_ru,WP: союзники США требуют признать исламистскую группировку «умеренной» https://t.co/qcfCJqTAgR © AP Photo https://t.co/l2lVKlsl8H,United States,Russian,2015-11-12T20:52:00,2015-11-12T20:52:00,1953.0000000000,219.0000000000,2574.0000000000,R,True
disneyTV_ru,Иран приветствует присоединение к Евразийскому экономическому союзу https://t.co/wXctDfzXr6 © AP Photo https://t.co/rUjO2DzqNJ,United States,Russian,2015-11-12T21:51:00,2015-11-12T21:52:00,1953.0000000000,219.0000000000,2576.0000000000,R,True
disneyTV_ru,Суд в Одессе продолжит рассмотрение дела о событиях в Доме профсоюзов  https://t.co/zwFD7VbHto https://t.co/3bqBIm0vm7,United States,Russian,2015-11-13T04:11:00,2015-11-13T04:11:00,1953.0000000000,219.0000000000,2578.0000000000,R,True
disneyTV_ru,Палач ИГИЛ Джихади Джон убит?  https://t.co/7z91Q8yTVi https://t.co/rqLul8Qk4s,United States,Russian,2015-11-13T06:14:00,2015-11-13T06:15:00,1953.0000000000,219.0000000000,2579.0000000000,R,True
disneyTV_ru,Курды объявили об освобождении стратегического города на севере Ирака https://t.co/jQIfoPkKbm,United States,Russian,2015-11-13T18:38:00,2015-11-13T18:38:00,1953.0000000000,219.0000000000,2583.0000000000,R,True
disneyTV_ru,Среди погибших в Париже много иностранцев https://t.co/gKkVrsPX5o,United States,Russian,2015-11-14T01:44:00,2015-11-14T01:44:00,1953.0000000000,219.0000000000,2586.0000000000,R,True
disneyTV_ru,Посольство Франции в Вашингтоне взято под усиленную охрану  https://t.co/dJeDNoFp7g,United States,Russian,2015-11-14T06:12:00,2015-11-14T06:12:00,1953.0000000000,219.0000000000,2588.0000000000,R,True
disneyTV_ru,СМИ: задержан возможный участник терактов в Париже.  Последние подробности: https://t.co/QrK2MWsMr4 #ParisAttacks https://t.co/zKxuLa6DNv,United States,Russian,2015-11-14T10:00:00,2015-11-14T10:00:00,1953.0000000000,219.0000000000,2589.0000000000,R,True
disneyTV_ru,"Барбоза: вряд ли Моутинью поедет в «Зенит», если Виллаш-Боаш уйдёт https://t.co/LqVzg0M5Q5",United States,Russian,2015-11-14T10:19:00,2015-11-14T10:19:00,1953.0000000000,219.0000000000,2590.0000000000,R,True
disneyTV_ru,"СМИ: ИГ опубликовало видео, в котором угрожает Франции терактами https://t.co/dJd23A2ucy #Париж #Теракт https://t.co/iFOJiYah4S",United States,Russian,2015-11-14T11:23:00,2015-11-14T11:24:00,1953.0000000000,219.0000000000,2592.0000000000,R,True
disneyTV_ru,Сирийские беженцы в ЕС после терактов в Париже боятся за свою судьбу https://t.co/dqD6dC5Vrm © AP Photo https://t.co/9hgYEIVCzB,United States,Russian,2015-11-14T16:56:00,2015-11-14T16:57:00,1953.0000000000,219.0000000000,2596.0000000000,R,True
disneyTV_ru,Завершился матч Россия -- Португалия  https://t.co/iIN5EsLQEj https://t.co/ctTfDq4sWU,United States,Russian,2015-11-14T16:56:00,2015-11-14T16:56:00,1953.0000000000,219.0000000000,2595.0000000000,R,True
disneyTV_ru,Прокурор Парижа: число погибших увеличилось до 129 человек  https://t.co/QrdhlR1lH8,United States,Russian,2015-11-14T19:18:00,2015-11-14T19:19:00,1953.0000000000,218.0000000000,2599.0000000000,R,True
disneyTV_ru,Акция в память о жертвах теракта в Париже прошла в Нью-Йорке https://t.co/NpbgLcIgQy https://t.co/mjIriy0nvx,United States,Russian,2015-11-14T22:11:00,2015-11-14T22:12:00,1953.0000000000,218.0000000000,2600.0000000000,R,True
disneyTV_ru,Посольство России во Франции разыскивает предполагаемую заложницу  https://t.co/cH1nAhCTRK #ParisAttacks #Париж https://t.co/MqnOI8EkPt,United States,Russian,2015-11-14T22:52:00,2015-11-14T22:52:00,1953.0000000000,218.0000000000,2601.0000000000,R,True
disneyTV_ru,Депутат ЕП высказался о законах по борьбе с терроризмом во Франции https://t.co/nVBiiMhsRx #ParisAttacks #Париж https://t.co/miIXHzkRL7,United States,Russian,2015-11-15T00:33:00,2015-11-15T00:33:00,1953.0000000000,218.0000000000,2602.0000000000,R,True
disneyTV_ru,Пушков: Европа расплачивается за политику США на Ближнем Востоке https://t.co/HN6JRzhSfl #ParisAttacks #Париж https://t.co/9AoRWNC5wJ,United States,Russian,2015-11-15T00:33:00,2015-11-15T00:34:00,1953.0000000000,218.0000000000,2603.0000000000,R,True
disneyTV_ru,Skype сделал бесплатными звонки во Францию https://t.co/O1MZy9Zdp0,United States,Russian,2015-11-15T01:12:00,2015-11-15T01:13:00,1953.0000000000,218.0000000000,2604.0000000000,R,True
disneyTV_ru,Skype после терактов в Париже сделал звонки на телефоны Франции бесплатными  https://t.co/3pykDWPn9H,United States,Russian,2015-11-15T01:33:00,2015-11-15T01:33:00,1953.0000000000,218.0000000000,2605.0000000000,R,True
