author_id,content,region,language,publish_date,harvested_date,following,followers,updates,post_type,retweet
disneyTV_ru,"'@rykov Константин, послушайте выступление Филиппа Экозьянца https://t.co/QNra2AvNFU Поддержите ретвитом'",United States,Russian,2015-06-24T13:54:00,2015-06-24T13:54:00,1991.0000000000,212.0000000000,1679.0000000000,R,True
disneyTV_ru,РЭПЕР ОЛЕГ КАШИН УПАЛ ВО ВРЕМЯ ВЫСТУПЛЕНИЯ НА ПРЕМИИ BET AWARDS,United States,Russian,2015-06-29T17:22:00,2015-06-29T17:22:00,1991.0000000000,213.0000000000,1701.0000000000,R,True
disneyTV_ru,Информация о появлении новых расходов в платёжке будет приходить москвичам в SMS  http://t.co/CUlKT14fck http://t.co/7hTTrEcS8j,United States,Russian,2015-07-01T16:51:00,2015-07-01T16:51:00,1991.0000000000,212.0000000000,1706.0000000000,R,True
disneyTV_ru,Ученые подтвердили существование в межзвездной среде углеродных наносфер http://t.co/hOIys7KwiD,United States,Russian,2015-07-15T17:56:00,2015-07-15T17:56:00,1990.0000000000,212.0000000000,1727.0000000000,R,True
disneyTV_ru,В Греции начались столкновения протестующих с полицией #новости http://t.co/TxUpMF7p1w,United States,Russian,2015-07-15T19:53:00,2015-07-15T19:53:00,1990.0000000000,212.0000000000,1728.0000000000,R,True
disneyTV_ru,Площадь в Каире назовут именем убитого генпрокурора http://t.co/JXnoj8ETa9,United States,Russian,2015-07-16T03:52:00,2015-07-16T03:54:00,1990.0000000000,212.0000000000,1731.0000000000,R,True
disneyTV_ru,Площадь в Каире назовут именем убитого генпрокурора http://t.co/JXnoj8ETa9,United States,Russian,2015-07-16T03:52:00,2015-07-16T03:54:00,1990.0000000000,212.0000000000,1731.0000000000,R,True
disneyTV_ru,"СРОЧНО. Порошенко -- CNN: противники трибунала по ""Боингу"" берут ответственность на себя http://t.co/dCFY1VTu3B http://t.co/1PnNawfKOO",United States,Russian,2015-07-16T18:12:00,2015-07-16T18:12:00,1990.0000000000,212.0000000000,1735.0000000000,R,True
disneyTV_ru,Удо Войгт: Россия должна быть членом трибунала по крушению MH17 http://t.co/J47AJebFIi,United States,Russian,2015-07-17T11:32:00,2015-07-17T11:32:00,1990.0000000000,212.0000000000,1740.0000000000,R,True
disneyTV_ru,Украинские силовики заявили об увеличении числа российских военных на границе http://t.co/aqMAfnmnHS,United States,Russian,2015-07-18T01:32:00,2015-07-18T01:32:00,1990.0000000000,211.0000000000,1744.0000000000,R,True
disneyTV_ru,Нетаньяху обсудил по телефону с Аббасом установление мира http://t.co/DFKQLNbQoA,United States,Russian,2015-07-18T05:32:00,2015-07-18T05:32:00,1990.0000000000,211.0000000000,1745.0000000000,R,True
disneyTV_ru,"В России калорийность солдатского пайка выше, чем в США.   http://t.co/3wl8V9kQrG http://t.co/0Ju4OqSbvh",United States,Russian,2015-07-18T11:53:00,2015-07-18T11:53:00,1990.0000000000,211.0000000000,1747.0000000000,R,True
disneyTV_ru,Муллин: нельзя недооценивать «Штурм» http://t.co/SeXKHnWKau,United States,Russian,2015-07-18T13:52:00,2015-07-18T13:52:00,1990.0000000000,211.0000000000,1748.0000000000,R,True
disneyTV_ru,Джонс: нынешний состав «МЮ» способен выиграть Премьер-лигу http://t.co/13CyPzhU6D,United States,Russian,2015-07-18T17:14:00,2015-07-18T17:14:00,1990.0000000000,211.0000000000,1749.0000000000,R,True
disneyTV_ru,"ДТП в центре Москвы, есть жертвы  http://t.co/Pc8h1bitAh http://t.co/fOpvXUez05",United States,Russian,2015-07-19T09:32:00,2015-07-19T09:32:00,1990.0000000000,211.0000000000,1754.0000000000,R,True
disneyTV_ru,Солдат ВСУ совершил самоубийство в Донбассе  http://t.co/s8SOmW5ELC http://t.co/4Xu69ova9R,United States,Russian,2015-07-19T11:32:00,2015-07-19T11:32:00,1990.0000000000,212.0000000000,1756.0000000000,R,True
disneyTV_ru,«Мордовия» — «Локомотив»: гол Шкулетича в ворота «Мордовии» http://t.co/glD2nE0NOu,United States,Russian,2015-07-19T17:31:00,2015-07-19T17:31:00,1990.0000000000,212.0000000000,1758.0000000000,R,True
disneyTV_ru,Ким Чен Ын проголосовал за водителя автобуса на местных выборах: http://t.co/olK5gNiFBg через @gazetaru,United States,Russian,2015-07-20T05:53:00,2015-07-20T05:53:00,1990.0000000000,213.0000000000,1766.0000000000,R,True
disneyTV_ru,СМИ: обвиняемые в крушении Falcon во Внуково предстанут перед судом http://t.co/88NCsfMrmJ,United States,Russian,2015-07-22T01:13:00,2015-07-22T01:13:00,1988.0000000000,212.0000000000,1775.0000000000,R,True
disneyTV_ru,Доктор Лиза планирует вывезти из Луганска и Донецка 35 больных детей http://t.co/pzbtTUwR1h,United States,Russian,2015-07-22T15:11:00,2015-07-22T15:11:00,1988.0000000000,212.0000000000,1778.0000000000,R,True
disneyTV_ru,Приблизившийся к США пилот российского бомбардировщика Ту-95 поздравил американских летчиков с Днем независимости: http://t.co/Q2oKmXyZcK,United States,Russian,2015-07-22T16:32:00,2015-07-22T16:33:00,1988.0000000000,212.0000000000,1779.0000000000,R,True
disneyTV_ru,"""Голос"" ждет исключения из реестра иностранных агентов http://t.co/ay5LueX3OP",United States,Russian,2015-07-22T20:31:00,2015-07-22T20:31:00,1988.0000000000,212.0000000000,1780.0000000000,R,True
disneyTV_ru,Симонян: заслуги Блаттера перед мировым футболом не могут вызывать сомнений http://t.co/Bcx01JPEGE,United States,Russian,2015-07-23T12:52:00,2015-07-23T12:52:00,1988.0000000000,212.0000000000,1784.0000000000,R,True
disneyTV_ru,Карельского чиновника оштрафовали за стихотворение про наркотики http://t.co/GjBS0fEXiI,United States,Ukrainian,2015-07-23T13:34:00,2015-07-23T13:34:00,1988.0000000000,212.0000000000,1785.0000000000,R,True
disneyTV_ru,О чем сейчас снимаются американские сериалы? http://t.co/HSo465wtog,United States,Russian,2015-07-23T17:41:00,2015-07-23T17:42:00,1988.0000000000,212.0000000000,1789.0000000000,R,True
disneyTV_ru,Обама назвал свое главное разочарование за время президентства  http://t.co/9pOHbQEI6O http://t.co/n9yuZQIJNX,United States,Russian,2015-07-24T06:51:00,2015-07-24T06:52:00,1988.0000000000,213.0000000000,1792.0000000000,R,True
disneyTV_ru,Создан крошечный робот-микрохирург в виде кисти руки http://t.co/NZ1kqZ22eU,United States,Russian,2015-07-24T09:32:00,2015-07-24T09:33:00,1988.0000000000,213.0000000000,1793.0000000000,R,True
disneyTV_ru,В белорусском ЦИК назвали «осетриной второй свежести» выдвижение кота в президенты  http://t.co/UVslh6gmdI http://t.co/BYX3jlmVRh,United States,Russian,2015-07-24T10:52:00,2015-07-24T10:52:00,1988.0000000000,213.0000000000,1795.0000000000,R,True
disneyTV_ru,В Подмосковье 20 человек задержаны по подозрению в экстремизме http://t.co/VNEydVXvad,United States,Russian,2015-07-24T17:32:00,2015-07-24T17:33:00,1988.0000000000,212.0000000000,1797.0000000000,R,True
disneyTV_ru,"Правозащита! Сообщаю вам, что @izvestiyaKPSS заключен в тайную тюрьму ЦРУ, но @mark_feygin уже занялся его освобождением. Всё будет хорошо.",United States,Russian,2015-07-26T09:32:00,2015-07-26T09:32:00,1988.0000000000,211.0000000000,1806.0000000000,R,True
disneyTV_ru,Канадские и венгерские военные специалисты совершат полёт над Россией http://t.co/FztiduAMty http://t.co/qaAqrqTxWg,United States,Russian,2015-07-27T01:11:00,2015-07-27T01:11:00,1988.0000000000,211.0000000000,1810.0000000000,R,True
disneyTV_ru,"«Второе место  - это отличное достижение», - российский пилот ""Формулы 1"" Даниил Квят после фи http://t.co/uuqEUV0YhB http://t.co/38nfkkBAEu",United States,Russian,2015-07-27T09:34:00,2015-07-27T09:34:00,1988.0000000000,211.0000000000,1811.0000000000,R,True
disneyTV_ru,"Переговоры МВФ, ЕЦБ и ЕК с Грецией о кредитах по ESM начались http://t.co/PgAw9hHUCU",United States,Ukrainian,2015-07-27T11:52:00,2015-07-27T11:52:00,1988.0000000000,211.0000000000,1813.0000000000,R,True
disneyTV_ru,"Мальчик, изъятый Норвежскими службами из российской семьи, возвращен родителям http://t.co/m2M3oxj5X4",United States,Russian,2015-07-27T15:32:00,2015-07-27T15:32:00,1988.0000000000,211.0000000000,1816.0000000000,R,True
disneyTV_ru,Время — деньги: РБК протестировал часы «Альфа-банка» со встроенной банковской картой: http://t.co/0RF77mPLgl http://t.co/8H08JXP1kY,United States,Russian,2015-07-27T18:33:00,2015-07-27T18:33:00,1988.0000000000,211.0000000000,1817.0000000000,R,True
disneyTV_ru,Диссертацию Сергея Гуриева спонсировало USAID http://t.co/eAWHiM2nZ3 http://t.co/dvpzXQzlaE,United States,Russian,2015-07-28T00:03:00,2015-07-28T00:03:00,1988.0000000000,211.0000000000,1821.0000000000,R,True
disneyTV_ru,Порошенко отождествляет Крещение Руси с евроинтеграцией Украины  http://t.co/GclQwQAQPr http://t.co/4o5fGPBLVM,United States,Russian,2015-07-28T20:12:00,2015-07-28T20:12:00,1987.0000000000,211.0000000000,1826.0000000000,R,True
disneyTV_ru,Microsoft начала рассылку Windows 10  http://t.co/2oNIpARvnw http://t.co/ECMjh9op8x,United States,Russian,2015-07-28T20:13:00,2015-07-28T20:13:00,1987.0000000000,211.0000000000,1827.0000000000,R,True
disneyTV_ru,"США: Угнали машину? Не отвлекайте полицию по таким мелочам!  ""Детройтизация"" США пускает корни повсюду  http://t.co/7bTXAOswL5",United States,Russian,2015-07-29T04:53:00,2015-07-29T04:53:00,1987.0000000000,211.0000000000,1828.0000000000,R,True
disneyTV_ru,"Гонщик ""Формулы-1"" Дженсон Баттон может стать ведущим телепрограммы Top Gear http://t.co/g5H9K8Z4o6",United States,Russian,2015-07-29T08:32:00,2015-07-29T08:32:00,1987.0000000000,211.0000000000,1830.0000000000,R,True
disneyTV_ru,"Кононов: не считаю «Слован» аутсайдером, это серьёзный соперник http://t.co/oV4D9t3Hqi",United States,Russian,2015-07-29T17:12:00,2015-07-29T17:13:00,1987.0000000000,210.0000000000,1832.0000000000,R,True
disneyTV_ru,В ДНР сообщили об обстреле Горловки http://t.co/p2grQkWRal,United States,Russian,2015-07-29T19:12:00,2015-07-29T19:12:00,1987.0000000000,210.0000000000,1833.0000000000,R,True
disneyTV_ru,Синхронисты #Валитова и #Мальцев выиграли чемпионат мира!   http://t.co/EPorjPrSF2 http://t.co/1lZLqDl6Tq,United States,Macedonian,2015-07-30T21:31:00,2015-07-30T21:32:00,1987.0000000000,211.0000000000,1842.0000000000,R,True
disneyTV_ru,"Возможно медикаменты, используемые при борьбе с Эболой тоже были заражены http://t.co/LsYCJDjbsq",United States,Russian,2015-07-31T13:17:00,2015-07-31T13:17:00,1987.0000000000,211.0000000000,1844.0000000000,R,True
disneyTV_ru,ЦИК: в предвыборных кампаниях по всей России участвуют 55 партий http://t.co/mtwAqpJ7Zr,United States,Russian,2015-07-31T15:52:00,2015-07-31T15:53:00,1987.0000000000,211.0000000000,1846.0000000000,R,True
disneyTV_ru,К матчу с «Рубином» готовятся все игроки «Спартака» за исключением Макеева http://t.co/P0IZ6bPTtS,United States,Russian,2015-07-31T16:54:00,2015-07-31T16:54:00,1987.0000000000,211.0000000000,1848.0000000000,R,True
disneyTV_ru,Чуркин предрек провал повторного голосования по трибуналу о крушении Boeing http://t.co/ByUbDsDdxA,United States,Russian,2015-07-31T23:52:00,2015-07-31T23:52:00,1987.0000000000,211.0000000000,1851.0000000000,R,True
disneyTV_ru,МОК отверг обвинения в плагиате эмблемы летней Олимпиады-2020 в Токио http://t.co/qFxcrCF8kO,United States,Russian,2015-08-01T07:53:00,2015-08-01T07:53:00,1987.0000000000,211.0000000000,1852.0000000000,R,True
disneyTV_ru,"Нашелся тот, кто поможет Великобритании в борьбе с детским ожирением  http://t.co/ud4hr02Apb http://t.co/HnmKwykL7F",United States,Russian,2015-08-01T21:12:00,2015-08-01T21:12:00,1987.0000000000,212.0000000000,1855.0000000000,R,True
disneyTV_ru,В Подмосковье девочка упала с поезда http://t.co/DZKTxFEVtI,United States,Russian,2015-08-01T22:51:00,2015-08-01T22:51:00,1987.0000000000,212.0000000000,1857.0000000000,R,True
disneyTV_ru,"Вертолет Ми-28Н потерпел крушение на полигоне ""Дубровичи"" в Рязанской области  http://t.co/KFTCObsvIP",United States,Russian,2015-08-02T10:12:00,2015-08-02T10:13:00,1987.0000000000,212.0000000000,1860.0000000000,R,True
disneyTV_ru,Реальный рост цен оказался вдвое меньше официального: http://t.co/pbgxpiFW40,United States,Russian,2015-08-03T03:52:00,2015-08-03T03:52:00,1986.0000000000,210.0000000000,1868.0000000000,R,True
disneyTV_ru,«Сибирь» подписала соглашение с болгарским форвардом http://t.co/1c1gh8cY7t,United States,Bulgarian,2015-08-03T10:36:00,2015-08-03T10:38:00,1985.0000000000,210.0000000000,1870.0000000000,R,True
disneyTV_ru,"Калужский губернатор предложил не варить варенье. Оно бесполезное, вредное, да к тому же в регионе дефицит сахара: http://t.co/5DNPkkVXrZ",United States,Russian,2015-08-03T15:52:00,2015-08-03T15:53:00,1986.0000000000,210.0000000000,1872.0000000000,R,True
disneyTV_ru,Армавирское «Торпедо» Карпина в пятый раз подряд завершило матч со счетом 0:0 http://t.co/aZUhhDVzdC,United States,Russian,2015-08-03T17:52:00,2015-08-03T17:52:00,1986.0000000000,211.0000000000,1874.0000000000,R,True
disneyTV_ru,Объявлены российские цены на новый BMW 7 серии http://t.co/FquPvkiSrl,United States,Russian,2015-08-04T13:32:00,2015-08-04T13:33:00,1986.0000000000,212.0000000000,1878.0000000000,R,True
disneyTV_ru,«Оранж девелопмент» может вознобновить работы в Конюшенном ведомстве http://t.co/z0ScmA3qFA #СПб,United States,Russian,2015-08-05T01:31:00,2015-08-08T01:43:00,1986.0000000000,211.0000000000,1910.0000000000,R,True
disneyTV_ru,Более 30 человек погибли при сходе с рельсов двух поездов  http://t.co/QociyRxhuf http://t.co/cM4bpmSKY8,United States,Russian,2015-08-05T10:33:00,2015-08-05T10:33:00,1986.0000000000,212.0000000000,1885.0000000000,R,True
disneyTV_ru,Посол России рассказал о контактах между Москвой и Лондоном  http://t.co/YUN5Z9z2JK http://t.co/Qei6IFpHfj,United States,Russian,2015-08-05T14:33:00,2015-08-05T14:33:00,1986.0000000000,212.0000000000,1887.0000000000,R,True
disneyTV_ru,США требуют доступ к истории болезни Лэнса Армстронга  http://t.co/GEKRgzZEib http://t.co/pgk6bN8Xoc,United States,Russian,2015-08-05T18:52:00,2015-08-05T18:52:00,1986.0000000000,212.0000000000,1889.0000000000,R,True
disneyTV_ru,Виталий Мутко: имя нового главного тренера сборной России будет объявлено в пятницу http://t.co/K6zz4K7wfL,United States,Russian,2015-08-05T20:13:00,2015-08-05T20:14:00,1986.0000000000,212.0000000000,1890.0000000000,R,True
disneyTV_ru,"Вести.net: крупнейший кибертурнир сорвали хакеры, а почта вошла в Интернет Вещей http://t.co/4n13YIB2UU",United States,Russian,2015-08-05T22:13:00,2015-08-05T22:13:00,1986.0000000000,212.0000000000,1892.0000000000,R,True
disneyTV_ru,Минприроды хочет вырубить лес у Байкала для реконструкции БАМа http://t.co/MFrx5eDqKk,United States,Russian,2015-08-06T12:53:00,2015-08-06T12:53:00,1986.0000000000,212.0000000000,1894.0000000000,R,True
disneyTV_ru,Любительский клуб впервые в истории вышел в 1/32 финала Кубка России http://t.co/oeK479HA9T,United States,Russian,2015-08-06T14:51:00,2015-08-06T14:51:00,1986.0000000000,212.0000000000,1896.0000000000,R,True
disneyTV_ru,Олег Кашин и Павел Лобков жгут сыр и говорят о сакральном смысле уничтожения еды: https://t.co/9BzbbcdyZW  https://t.co/YDw8utBUct,United States,Russian,2015-08-06T19:12:00,2015-08-06T19:12:00,1986.0000000000,212.0000000000,1898.0000000000,R,True
disneyTV_ru,В Пентагоне сообщили об атаке российских хакеров  #hitech,United States,Russian,2015-08-06T20:51:00,2015-08-06T20:51:00,1986.0000000000,212.0000000000,1899.0000000000,R,True
disneyTV_ru,Трамп превратил первые дебаты Республиканской партии в «шумную драку»  http://t.co/Pr2oVmZTXD,United States,Russian,2015-08-07T09:32:00,2015-08-07T09:32:00,1986.0000000000,211.0000000000,1901.0000000000,R,True
disneyTV_ru,Пришла беда откуда не ждали. Зрада по-грузински. http://t.co/SkLS55HD7E,United States,Ukrainian,2015-08-07T16:13:00,2015-08-07T16:13:00,1986.0000000000,211.0000000000,1904.0000000000,R,True
disneyTV_ru,Ляшко вызвали в суд  http://t.co/66AHKQLVcx http://t.co/pkDUE2fTBU,United States,Russian,2015-08-07T17:53:00,2015-08-07T17:54:00,1986.0000000000,211.0000000000,1905.0000000000,R,True
disneyTV_ru,"Россия потеряла половину от ввоза продовольствия, но поверила в импортозамещение http://t.co/ruUMYpopAY http://t.co/yavj946BYE",United States,Russian,2015-08-07T18:13:00,2015-08-07T18:13:00,1986.0000000000,211.0000000000,1906.0000000000,R,True
disneyTV_ru,"В штате Нью-Йорк разбился небольшой самолет, погибли четыре человека  http://t.co/SoR5TEwUM4",United States,Russian,2015-08-08T15:51:00,2015-08-08T15:51:00,1986.0000000000,212.0000000000,1915.0000000000,R,True
disneyTV_ru,"Памятник эскадрилье ""Нормандия-Неман"" открыт в Иваново http://t.co/4nnJTC6dgB",United States,Ukrainian,2015-08-09T09:53:00,2015-08-09T09:53:00,1986.0000000000,212.0000000000,1921.0000000000,R,True
disneyTV_ru,В Москве горит гостиница http://t.co/rnbQP8WI08,United States,Russian,2015-08-09T16:51:00,2015-08-09T16:52:00,1986.0000000000,212.0000000000,1924.0000000000,R,True
disneyTV_ru,Samsung будет запущена в России собственная торговая сеть  #hitech,United States,Russian,2015-08-10T15:34:00,2015-08-10T15:34:00,1986.0000000000,212.0000000000,1929.0000000000,R,True
disneyTV_ru,О севастопольском митинге 12 августа. Прессуха инициативной группы https://t.co/FK45AyqZoq через @YouTube,United States,Russian,2015-08-10T21:11:00,2015-08-10T21:11:00,1986.0000000000,212.0000000000,1931.0000000000,R,True
disneyTV_ru,У экс-хоккеиста СКА Сушинского угнали Mercedes за 12 млн рублей http://t.co/BVUCJivt1v #СПб,United States,Russian,2015-08-11T10:11:00,2015-08-11T10:11:00,1985.0000000000,212.0000000000,1933.0000000000,R,True
disneyTV_ru,"Адвокат: я всегда говорил — если покупаешь новых игроков, кому-то придётся уйти http://t.co/pvGkklruN0",United States,Russian,2015-08-11T14:52:00,2015-08-11T14:52:00,1985.0000000000,213.0000000000,1937.0000000000,R,True
disneyTV_ru,Психологи: люди не склонны лгать в одиночку http://t.co/ZwT5hH12jL,United States,Ukrainian,2015-08-11T15:32:00,2015-08-11T15:33:00,1985.0000000000,213.0000000000,1939.0000000000,R,True
disneyTV_ru,"'@MargoSavazh @SurkovRussia @alphabet совпадение , не думаю'",United States,Ukrainian,2015-08-11T23:34:00,2015-08-11T23:34:00,1985.0000000000,213.0000000000,1941.0000000000,,False
disneyTV_ru,На просмотр в «Крылья Советов» прибыл вратарь сборной Словении Белец http://t.co/SwXqPl1S3M,United States,Russian,2015-08-12T09:13:00,2015-08-12T09:13:00,1985.0000000000,213.0000000000,1945.0000000000,R,True
disneyTV_ru,'@MaxDementiev @VVPutin_cat  от слабоумных для слабоумных',United States,Russian,2015-08-14T22:32:00,2015-08-14T22:32:00,1985.0000000000,213.0000000000,1957.0000000000,,False
disneyTV_ru,Иранские власти готовы провести переговоры со странами Персидского залива http://t.co/e9zODuH35m http://t.co/SOFsY5aukI,United States,Russian,2015-08-15T05:11:00,2015-08-15T05:11:00,1985.0000000000,213.0000000000,1958.0000000000,R,True
disneyTV_ru,Пропавший в Хабаровском крае вертолет упал в море  http://t.co/yl2RVG1DoP,United States,Serbian,2015-08-15T11:52:00,2015-08-15T11:52:00,1985.0000000000,213.0000000000,1961.0000000000,R,True
disneyTV_ru,Россия и Китай начинают совместные военные учения в Японском море.   http://t.co/qPLYS0ClKv http://t.co/8jm9Wq5SZw,United States,Russian,2015-08-15T13:12:00,2015-08-15T13:12:00,1985.0000000000,213.0000000000,1963.0000000000,R,True
disneyTV_ru,Россельхознадзор: более 870 тонн санкционной продукции уничтожено в России с 6 августа  http://t.co/Ry4cFoCbWF,United States,Russian,2015-08-15T15:51:00,2015-08-15T15:52:00,1985.0000000000,214.0000000000,1966.0000000000,R,True
disneyTV_ru,В Эквадоре объявлен режим ЧС  http://t.co/15Mf4oZPMl http://t.co/KqQ8Miecyh,United States,Russian,2015-08-15T22:12:00,2015-08-15T22:12:00,1985.0000000000,214.0000000000,1970.0000000000,R,True
disneyTV_ru,В Бурятии горит порядка 80 тыс. гектаров леса  http://t.co/t2hhCmW50k,United States,Russian,2015-08-16T07:31:00,2015-08-16T07:31:00,1985.0000000000,214.0000000000,1973.0000000000,R,True
disneyTV_ru,Малайзия анонсировала «план Б» по расследованию падения Boeing #Новости MH17 http://t.co/E03NNTUCIh http://t.co/YtUDqoldju,United States,Russian,2015-08-16T15:51:00,2015-08-16T15:52:00,1985.0000000000,216.0000000000,1975.0000000000,R,True
disneyTV_ru,МИД России отреагировал на призывы Яценюка утеплять дома  http://t.co/bsQmaCb5oD http://t.co/oKMsywtVP4,United States,Russian,2015-08-17T08:22:00,2015-08-17T08:22:00,1985.0000000000,216.0000000000,1977.0000000000,R,True
disneyTV_ru,Раймонд Паулс не будет отменять юбилейный вечер в России http://t.co/oLgEfQ4geo,United States,Russian,2015-08-18T09:24:00,2015-08-18T09:24:00,1985.0000000000,216.0000000000,1984.0000000000,R,True
disneyTV_ru,"За уклонение от мобилизации на Украине возбуждено 1,5 тысячи уголовных дел http://t.co/Slfa1UY61Y",United States,Russian,2015-08-18T13:34:00,2015-08-18T13:35:00,1985.0000000000,215.0000000000,1987.0000000000,R,True
disneyTV_ru,"Компания Google представила ""умный"" Wi-Fi-роутер OnHub  http://t.co/ska7LIEUh8",United States,Russian,2015-08-19T01:53:00,2015-08-19T01:53:00,1985.0000000000,215.0000000000,1991.0000000000,R,True
disneyTV_ru,Пропал баннер с изображением Жириновского  http://t.co/1XOfqrvgxb http://t.co/eJixRHtp71,United States,Russian,2015-08-19T06:51:00,2015-08-19T06:51:00,1984.0000000000,215.0000000000,1992.0000000000,R,True
disneyTV_ru,"Япония успешно запустила корабль ""Конотори"" к МКС http://t.co/NnxuJK6hB3",United States,Bulgarian,2015-08-19T13:47:00,2015-08-19T13:47:00,1984.0000000000,215.0000000000,1995.0000000000,R,True
