author_id,content,region,language,publish_date,harvested_date,following,followers,updates,post_type,retweet
disneyTV_ru,Новосельцев: надеюсь сыграть за сборную России в Ростове-на-Дону https://t.co/u6xdfzFZfT,United States,Russian,2015-11-15T11:15:00,2015-11-15T11:15:00,1954.0000000000,218.0000000000,2607.0000000000,R,True
disneyTV_ru,Урок французского.  Как агитпроп «либералов» освещает теракты в Париже   https://t.co/Wz85R2JG5w,United States,Russian,2015-11-15T20:39:00,2015-11-15T20:40:00,1954.0000000000,218.0000000000,2614.0000000000,R,True
disneyTV_ru,Матвиенко: страны медленно реагируют на призыв РФ вместе бороться с ИГ  https://t.co/KRl8IsuRqI https://t.co/EY07hyykse,United States,Russian,2015-11-16T00:13:00,2015-11-16T00:13:00,1954.0000000000,218.0000000000,2616.0000000000,R,True
disneyTV_ru,США отправит пятерых заключенных Гуантанамо в ОАЭ  https://t.co/oFqVR3rDBS https://t.co/ZmxCJUWEZX,United States,Russian,2015-11-16T03:34:00,2015-11-16T03:34:00,1954.0000000000,218.0000000000,2617.0000000000,R,True
disneyTV_ru,"Договор о поставках газа в Китай по западному маршруту подпишут в 2016 году, сообщил Алексей Миллер https://t.co/OMto7EBXa7",United States,Russian,2015-11-16T09:13:00,2015-11-16T09:13:00,1954.0000000000,218.0000000000,2618.0000000000,R,True
disneyTV_ru,Власти Бельгии опровергли арест подозреваемого в причастности к терактам в Париже   https://t.co/ENased2X0I,United States,Russian,2015-11-16T12:39:00,2015-11-16T12:42:00,1954.0000000000,218.0000000000,2620.0000000000,R,True
disneyTV_ru,"""Газета.Ru"" ознакомилась с новой книгой стихов Эдуарда Лимонова  https://t.co/iYiBN1kLaT https://t.co/fDYgOL6r8D",United States,Russian,2015-11-16T12:52:00,2015-11-16T12:52:00,1954.0000000000,218.0000000000,2621.0000000000,R,True
disneyTV_ru,Крымские татары создали альтернативу меджлису https://t.co/XWKCfpS1hQ https://t.co/7HcwxwbYDh,United States,Russian,2015-11-16T13:55:00,2015-11-16T13:55:00,1954.0000000000,218.0000000000,2623.0000000000,R,True
disneyTV_ru,Франция отправляет авианосец для борьбы с «Исламским государством» https://t.co/vjNIiwhzRu https://t.co/CYNumJ3GUE,United States,Russian,2015-11-16T17:13:00,2015-11-16T17:13:00,1954.0000000000,218.0000000000,2625.0000000000,R,True
disneyTV_ru,СМИ: Словения и Австрия предупредили Сербию о закрытии своих границ https://t.co/kEgI4wzHrl © AP Photo https://t.co/HSYiCNycaF,United States,Russian,2015-11-16T21:51:00,2015-11-16T21:51:00,1954.0000000000,218.0000000000,2629.0000000000,R,True
disneyTV_ru,"НАТО приветствует участие России в политическом урегулировании в Сирии, заявил генсек альянса Йенс Столтенберг https://t.co/BhdT8KAcZc",United States,Russian,2015-11-17T11:33:00,2015-11-17T11:33:00,1954.0000000000,218.0000000000,2633.0000000000,R,True
disneyTV_ru,Лавров заявил о необходимости пресечь замыслы ИГ https://t.co/yin5plnjvm,United States,Russian,2015-11-17T11:37:00,2015-11-17T11:37:00,1954.0000000000,218.0000000000,2635.0000000000,R,True
disneyTV_ru,Начальство службы электроснабжения московского метро брало многомиллионные взятки https://t.co/08xRH5uzLx,United States,Russian,2015-11-17T11:53:00,2015-11-17T11:53:00,1954.0000000000,218.0000000000,2636.0000000000,R,True
disneyTV_ru,Глава Олимпийского комитета России о допинг-скандале  https://t.co/047hiJzKqR https://t.co/r1SgV0BDoE,United States,Russian,2015-11-17T12:42:00,2015-11-17T12:42:00,1954.0000000000,218.0000000000,2637.0000000000,R,True
disneyTV_ru,Пока живы и счастливы: опубликовано последнее фото посетителей Bataclan https://t.co/DvdzG6vM6s https://t.co/6diDP4mXsn,United States,Russian,2015-11-17T15:02:00,2015-11-17T15:02:00,1954.0000000000,218.0000000000,2639.0000000000,R,True
disneyTV_ru,Шойгу: количество вылетов российской авиации в Сирии увеличено вдвое https://t.co/UKAKhNCmQ1 https://t.co/pfBcVI0VDD,United States,Russian,2015-11-17T15:35:00,2015-11-17T15:38:00,1954.0000000000,218.0000000000,2640.0000000000,R,True
disneyTV_ru,Караваев: проигрывать сборной Азербайджана с таким счётом неприемлемо https://t.co/gRuaPszUHr,United States,Russian,2015-11-17T17:35:00,2015-11-17T17:35:00,1954.0000000000,218.0000000000,2642.0000000000,R,True
disneyTV_ru,ВИДЕО. Увеличить зарплату потребовали пикетчики у дома наследницы Walmart  https://t.co/uvPm2cg2tF https://t.co/zYPi5qCSlv,United States,Russian,2015-11-17T17:42:00,2015-11-17T17:43:00,1954.0000000000,218.0000000000,2643.0000000000,R,True
disneyTV_ru,Дания — Швеция: стали известны стартовые составы https://t.co/FKqoKyUakf,United States,Russian,2015-11-17T19:52:00,2015-11-17T19:52:00,1954.0000000000,218.0000000000,2645.0000000000,R,True
disneyTV_ru,Нефтяной бизнес семьи Хотиных получил льготы на 92 млрд руб. https://t.co/24UldXcIWc,United States,Russian,2015-11-17T23:36:00,2015-11-17T23:36:00,1954.0000000000,218.0000000000,2646.0000000000,R,True
disneyTV_ru,ФОТОРЕПОРТАЖ. Как в Ганновере не сыграли в футбол из-за угрозы взрыва стадиона  https://t.co/Dzh8h3p6yC https://t.co/ZpjnyArqYm,United States,Ukrainian,2015-11-18T08:34:00,2015-11-18T08:34:00,1954.0000000000,218.0000000000,2648.0000000000,R,True
disneyTV_ru,«Челси» может зимой выкупить Снейдера за € 20 млн https://t.co/XDJjHuV1dZ,United States,Russian,2015-11-18T09:58:00,2015-11-18T09:58:00,1954.0000000000,218.0000000000,2649.0000000000,R,True
disneyTV_ru,"#Первые  Сотрудник «Внуково» показал, как без досмотра пройти к самолетам  #LifeCorr видео: https://t.co/zFWyBq9lEk https://t.co/2fK22xuk2d",United States,Russian,2015-11-18T11:34:00,2015-11-18T11:34:00,1954.0000000000,218.0000000000,2650.0000000000,R,True
disneyTV_ru,Премьер Турции: сейчас есть шанс на решение сложностей по Кипру https://t.co/wQNMEZP11R,United States,Russian,2015-11-18T15:04:00,2015-11-18T15:04:00,1954.0000000000,218.0000000000,2651.0000000000,R,True
disneyTV_ru,Россия не должна утонуть в крови приговоренных к казни даже из-за ИГИЛ https://t.co/GygZLrxoZd https://t.co/Qf5RLCfEYU,United States,Russian,2015-11-18T18:55:00,2015-11-18T18:55:00,1954.0000000000,219.0000000000,2654.0000000000,R,True
disneyTV_ru,В Вооруженных силах РФ отмечают День ракетных войск и артиллерии  https://t.co/5DaMzP2Rf7,United States,Russian,2015-11-19T01:31:00,2015-11-19T01:31:00,1954.0000000000,219.0000000000,2656.0000000000,R,True
disneyTV_ru,ФБР и полиция Нью-Йорка не имеют данных о готовящемся в городе теракте https://t.co/zAqsLojDsA © AP Photo https://t.co/4d0JHUpc3b,United States,Russian,2015-11-19T03:11:00,2015-11-19T03:11:00,1954.0000000000,219.0000000000,2658.0000000000,R,True
disneyTV_ru,Медведев: России нужны гарантии по реструктуризации долга Киева https://t.co/3bEuw1f5U0 https://t.co/SxAL0B1LV8,United States,Russian,2015-11-19T10:52:00,2015-11-19T10:54:00,1954.0000000000,219.0000000000,2659.0000000000,R,True
disneyTV_ru,Иран планирует вдвое увеличить поставки нефти после снятия санкций https://t.co/cF4CDjXVzk https://t.co/bnJJfUQphX,United States,Russian,2015-11-19T12:58:00,2015-11-19T12:58:00,1954.0000000000,219.0000000000,2660.0000000000,R,True
disneyTV_ru,Число жертв нападения на офис RT в Тель-Авиве возросло до двух человек https://t.co/8Wei5m7ztX © Фото: Paula Slier https://t.co/8yMWtRrRw2,United States,Russian,2015-11-19T14:42:00,2015-11-19T14:42:00,1954.0000000000,219.0000000000,2662.0000000000,R,True
disneyTV_ru,ВИДЕО. Депутат Рады избил в парламенте сотрудника СБУ  https://t.co/DuXocYDl7L © YouTube https://t.co/CRYYiIptMr,United States,Ukrainian,2015-11-19T15:12:00,2015-11-19T15:12:00,1954.0000000000,219.0000000000,2664.0000000000,R,True
disneyTV_ru,МВД Франции: уничтоженный в Сен-Дени террорист Абауд стоял за атаками на Париж https://t.co/v8GdEjmgOW https://t.co/s4pcubGAcS,United States,Russian,2015-11-19T15:12:00,2015-11-19T15:12:00,1954.0000000000,219.0000000000,2663.0000000000,R,True
disneyTV_ru,Димка @rubin_paceka не упусти шанс! https://t.co/hmXD9EBsqu,United States,Ukrainian,2015-11-19T15:22:00,2015-11-19T15:22:00,1954.0000000000,219.0000000000,2665.0000000000,R,True
disneyTV_ru,В ходе спецоперации в Брюсселе были задержаны 9 человек https://t.co/QelXvtB9q5,United States,Russian,2015-11-19T17:14:00,2015-11-19T17:14:00,1954.0000000000,219.0000000000,2666.0000000000,R,True
disneyTV_ru,Денисов: никакого конфликта нет. Я благодарен тренеру за шанс вернуться в состав https://t.co/V5hUFM9iVk,United States,Russian,2015-11-19T18:15:00,2015-11-19T18:16:00,1954.0000000000,219.0000000000,2667.0000000000,R,True
disneyTV_ru,В пятницу исполняется 70 лет с начала Нюрнбергского процесса https://t.co/thMyIIQOX2 https://t.co/ahtzz8lzDF,United States,Russian,2015-11-19T23:52:00,2015-11-19T23:53:00,1954.0000000000,219.0000000000,2670.0000000000,R,True
disneyTV_ru,Валюту на 16 миллионов рублей украли из автомобиля в Уфе https://t.co/ZJkZcFGyHf https://t.co/zE0XTKtmr8,United States,Russian,2015-11-20T07:11:00,2015-11-20T07:11:00,1954.0000000000,219.0000000000,2674.0000000000,R,True
disneyTV_ru,Нарышкин: РФ в борьбе с терроризмом будет действовать по Конституции https://t.co/6ybySLGCGQ https://t.co/qOIZTAURmj,United States,Russian,2015-11-20T08:38:00,2015-11-20T08:39:00,1954.0000000000,219.0000000000,2677.0000000000,R,True
disneyTV_ru,Премьер Венгрии призвал пересмотреть соглашения ЕС https://t.co/Os14WcjnLF,United States,Russian,2015-11-20T09:35:00,2015-11-20T09:35:00,1954.0000000000,219.0000000000,2679.0000000000,R,True
disneyTV_ru,Рособрнадзор лишил аккредитации и запретил прием более чем 10 вузам https://t.co/JtcToZKs1G https://t.co/xci5rMRDZ7,United States,Russian,2015-11-20T19:17:00,2015-11-20T19:17:00,1953.0000000000,219.0000000000,2686.0000000000,R,True
disneyTV_ru,Жители Миннеаполиса протестуют из-за убийства афроамериканца полицией https://t.co/75gkJit9Mz https://t.co/TUhzbZnGbE,United States,Russian,2015-11-21T03:11:00,2015-11-21T03:11:00,1953.0000000000,219.0000000000,2689.0000000000,R,True
disneyTV_ru,РФ призывает решить вопрос с закрытием высокого представителя в Боснии и Герцеговине https://t.co/ZDz3uF2knw https://t.co/HYVOLqt7iO,United States,Russian,2015-11-21T09:56:00,2015-11-21T09:56:00,1953.0000000000,219.0000000000,2692.0000000000,R,True
disneyTV_ru,Посольство РФ оказывает помощь в перевозке тел погибших в Мали россиян https://t.co/8qpKTsFPSP https://t.co/FDb96lzLNE,United States,Russian,2015-11-21T13:51:00,2015-11-21T13:51:00,1953.0000000000,219.0000000000,2695.0000000000,R,True
disneyTV_ru,В результате теракта в Камеруне погибли минимум 10 человек https://t.co/V5ahBAkyxB,United States,Russian,2015-11-21T14:55:00,2015-11-21T14:55:00,1953.0000000000,219.0000000000,2697.0000000000,R,True
disneyTV_ru,Концерн Audi сообщил о ценах на седан A4 https://t.co/g27TWSF3Av https://t.co/XO68cSu0Ep,United States,Russian,2015-11-21T15:51:00,2015-11-21T15:52:00,1953.0000000000,219.0000000000,2698.0000000000,R,True
disneyTV_ru,"Самолет Красноярск-Ош совершил жесткую посадку, восемь человек пострадали.   https://t.co/Y5Aoia0lSN",United States,Russian,2015-11-22T08:56:00,2015-11-22T08:56:00,1953.0000000000,219.0000000000,2700.0000000000,R,True
disneyTV_ru,"Обама заявил, что фокусирование России на борьбе с ИГ ""будет полезным"" https://t.co/BImWBCdYi9",United States,Russian,2015-11-22T09:01:00,2015-11-22T09:01:00,1953.0000000000,219.0000000000,2701.0000000000,R,True
disneyTV_ru,Сенатор Италии: сотрудничество c РФ против ИГ несовместимо с санкциями https://t.co/AIf40EbjTx https://t.co/knlzzBRxTB,United States,Russian,2015-11-22T12:55:00,2015-11-22T12:55:00,1953.0000000000,219.0000000000,2703.0000000000,R,True
disneyTV_ru,Медведев назвал причину усиления ИГИЛ  https://t.co/OIWWK1UqWr https://t.co/2FjjZBaNGB,United States,Russian,2015-11-22T17:03:00,2015-11-22T17:03:00,1953.0000000000,219.0000000000,2704.0000000000,R,True
disneyTV_ru,Главарь бандгруппы оказался среди ликвидированных в Нальчике боевиков https://t.co/6M8oXUVfzL https://t.co/L8bsJh8di4,United States,Russian,2015-11-22T19:31:00,2015-11-22T19:32:00,1953.0000000000,219.0000000000,2706.0000000000,R,True
disneyTV_ru,Суд рассмотрит продление ареста предполагаемому убийце Немцова https://t.co/DkJRYbVFp6 https://t.co/o5sK1ELgcJ,United States,Russian,2015-11-23T01:33:00,2015-11-23T01:34:00,1953.0000000000,219.0000000000,2707.0000000000,R,True
disneyTV_ru,Принц Чарльз объяснил причины войны в Сирии  https://t.co/OQkhLdkRWL https://t.co/0tHFPC8S39,United States,Russian,2015-11-23T08:41:00,2015-11-23T08:41:00,1953.0000000000,219.0000000000,2708.0000000000,R,True
disneyTV_ru,ВКС РФ за 5 дней уничтожили в Сирии более тысячи бензовозов ИГ https://t.co/aJKRRAqXeU https://t.co/sdVR2VxctH,United States,Russian,2015-11-23T09:54:00,2015-11-23T09:54:00,1953.0000000000,219.0000000000,2709.0000000000,R,True
disneyTV_ru,Суд признал зоозащитницу Викторию Павленко виновной в краже собаки-поводыря  https://t.co/Ct8U2GRzrj https://t.co/6cGWBdG00I,United States,Russian,2015-11-23T10:15:00,2015-11-23T10:23:00,1953.0000000000,219.0000000000,2710.0000000000,R,True
disneyTV_ru,самое тяжёлое в прыжке с парашютом - вытолкнуть новобранца,United States,Russian,2015-11-23T11:38:00,2015-11-23T11:39:00,1953.0000000000,219.0000000000,2711.0000000000,R,True
disneyTV_ru,"ВИДЕО. В Минобороны отчитались об авиаударах, нанесенных за выходные  https://t.co/hyMZxGncj3 https://t.co/Amq97ivbKP",United States,Russian,2015-11-23T12:33:00,2015-11-23T12:34:00,1953.0000000000,219.0000000000,2712.0000000000,R,True
disneyTV_ru,В центральный офис Apple Store ворвался неизвестный с мечом https://t.co/Z6z2uc9ah5,United States,Russian,2015-11-23T16:04:00,2015-11-23T16:04:00,1953.0000000000,219.0000000000,2713.0000000000,R,True
disneyTV_ru,Прокопец: конфликта между Денисовым и «Динамо» нет https://t.co/moOPlMnOis,United States,Russian,2015-11-23T16:35:00,2015-11-23T16:35:00,1953.0000000000,219.0000000000,2714.0000000000,R,True
disneyTV_ru,"Исследователи обнаружили, как хакеры, атакующие Sony, оставались незамеченными https://t.co/Pnk5GfW7TU",United States,Russian,2015-11-23T16:36:00,2015-11-23T16:36:00,1953.0000000000,219.0000000000,2715.0000000000,R,True
disneyTV_ru,«Ростов» вышел на чистое второе место в чемпионате России: https://t.co/hLmWwG9Rwi,United States,Russian,2015-11-23T18:51:00,2015-11-23T18:51:00,1953.0000000000,219.0000000000,2716.0000000000,R,True
disneyTV_ru,"Полевые кухни развернули в крымском городе, оставшемся без воды и газа https://t.co/IG8e4CAuYW https://t.co/wnFOn6V3nb",United States,Russian,2015-11-23T20:11:00,2015-11-23T20:12:00,1953.0000000000,219.0000000000,2717.0000000000,R,True
disneyTV_ru,"Выставка ""Евреи в Великой Отечественной войне"" открывается в Еврейском музее https://t.co/4eyljxhQdX https://t.co/XXjm9d8KaO",United States,Russian,2015-11-24T03:11:00,2015-11-24T03:11:00,1953.0000000000,220.0000000000,2720.0000000000,R,True
disneyTV_ru,Amazon раскритиковали за рекламу с нацистскими символами https://t.co/PTEnwC2nrD,United States,Ukrainian,2015-11-24T10:53:00,2015-11-24T10:53:00,1953.0000000000,220.0000000000,2723.0000000000,R,True
disneyTV_ru,Министр инфраструктуры Украины: авиакомпании не понесли серьезных потерь от прекращения полетов в РФ https://t.co/UZIliMMkm7,United States,Russian,2015-11-25T00:13:00,2015-11-25T00:14:00,1953.0000000000,219.0000000000,2758.0000000000,R,True
disneyTV_ru,Число жертв наводнения на юге Индии возросло до 176 https://t.co/cToJ4SxUA6 https://t.co/zx22to6uWN,United States,Russian,2015-11-25T07:13:00,2015-11-25T07:13:00,1953.0000000000,219.0000000000,2762.0000000000,R,True
disneyTV_ru,"На авиабазу Хмеймим в Сирии перебросят С-400, заявил Сергей Шойгу https://t.co/O1RhVgnueC",United States,Russian,2015-11-25T09:13:00,2015-11-25T09:13:00,1953.0000000000,219.0000000000,2764.0000000000,R,True
disneyTV_ru,Политолог: реакция России на инцидент с #СУ24 разрушила турецкие планы https://t.co/SwIMmyECXt #StandwithRussia https://t.co/i2jh6fPyhH,United States,Russian,2015-11-25T15:13:00,2015-11-25T15:13:00,1953.0000000000,219.0000000000,2767.0000000000,R,True
disneyTV_ru,Банда «скиммеров» похитила у жителей Татарстана 860 тыс. рублей через банкоматы https://t.co/h53wWDY3pF,United States,Russian,2015-11-25T18:58:00,2015-11-25T18:58:00,1953.0000000000,219.0000000000,2769.0000000000,R,True
disneyTV_ru,Путин и Олланд обсудят в Москве координацию в борьбе с террористами ИГ https://t.co/0YBJ2ahe4U https://t.co/DFjhDH0dSY,United States,Russian,2015-11-26T00:52:00,2015-11-26T00:52:00,1953.0000000000,219.0000000000,2771.0000000000,R,True
disneyTV_ru,"Включение Турции в НАТО напоминает «сделку с дьяволом», пишут СМИ  https://t.co/zTAG2hJ3uv https://t.co/fxzDicK8bU",United States,Russian,2015-11-26T10:15:00,2015-11-26T10:15:00,1953.0000000000,219.0000000000,2773.0000000000,R,True
disneyTV_ru,"Рокеры, игравшие в «Батаклане», хотят вновь выступить в Париже в этом же театре https://t.co/l1vLqcqCLx https://t.co/ccnf6NBBSI",United States,Russian,2015-11-26T10:54:00,2015-11-26T10:54:00,1953.0000000000,220.0000000000,2774.0000000000,R,True
disneyTV_ru,Эр-Рияд: военное решение конфликта в Сирии все еще возможно https://t.co/6l2StUFKuH https://t.co/H2R0U2qUtA,United States,Russian,2015-11-26T14:37:00,2015-11-26T14:37:00,1953.0000000000,219.0000000000,2775.0000000000,R,True
disneyTV_ru,Фюзеляж самолета Ан-12 провезли по трассе в Подмосковье  Видео:  https://t.co/nFxhfN24zn https://t.co/JKo5AUssSu,United States,Russian,2015-11-26T16:37:00,2015-11-26T16:37:00,1953.0000000000,219.0000000000,2776.0000000000,R,True
disneyTV_ru,ФОТОРЕПОРТАЖ. Как «Локомотив» добирался на МЕТРО до стадиона   https://t.co/a02h0DyerW https://t.co/noBNPxMgHl,United States,Ukrainian,2015-11-26T18:32:00,2015-11-26T18:32:00,1953.0000000000,219.0000000000,2777.0000000000,R,True
disneyTV_ru,Подача электроэнергии в Симферополе сокращена до четырех часов в сутки  https://t.co/v9YSMYGtvE https://t.co/YM9MGS7PBH,United States,Ukrainian,2015-11-27T01:51:00,2015-11-27T01:51:00,1953.0000000000,219.0000000000,2780.0000000000,R,True
disneyTV_ru,"Лучше бы был прав Педогамов, а не ты! https://t.co/UahrDue64x",United States,Ukrainian,2015-11-27T07:38:00,2015-11-27T07:39:00,1953.0000000000,219.0000000000,2780.0000000000,R,True
disneyTV_ru,Более 50 морпехов Северного флота РФ участвуют в борьбе с терроризмом  https://t.co/50m9bGq1Us,United States,Russian,2015-11-27T08:33:00,2015-11-27T08:35:00,1953.0000000000,219.0000000000,2781.0000000000,R,True
disneyTV_ru,Песков о запросе от Эрдогана на встречу с Путиным: президенту доложили https://t.co/KkLwQLI2CW #Турция https://t.co/0y7sKuzk0b,United States,Russian,2015-11-27T10:16:00,2015-11-27T10:17:00,1953.0000000000,219.0000000000,2783.0000000000,R,True
disneyTV_ru,Мафиози Cosa Nostra удалось арестовать в Петербурге со второй попытки https://t.co/ETsNzuBcot https://t.co/zxzL0qo0wI,United States,Russian,2015-11-27T13:19:00,2015-11-27T13:30:00,1953.0000000000,220.0000000000,2787.0000000000,R,True
disneyTV_ru,Россия заморозит все проекты в области военно-технического сотрудничества с Турцией  https://t.co/WAOvSfPZbG,United States,Russian,2015-11-27T15:41:00,2015-11-27T15:52:00,1953.0000000000,220.0000000000,2789.0000000000,R,True
disneyTV_ru,"В МВД Чечни назвали ""провокацией"" сообщение об учете молитв полицейских https://t.co/ehmtCALBZe",United States,Russian,2015-11-27T20:53:00,2015-11-27T20:53:00,1953.0000000000,220.0000000000,2790.0000000000,R,True
disneyTV_ru,Климатическую конференцию в Париже переносить не будут https://t.co/MjaV2pApX9 https://t.co/OqoIcDNYK0,United States,Russian,2015-11-27T20:57:00,2015-11-27T20:58:00,1953.0000000000,220.0000000000,2791.0000000000,R,True
disneyTV_ru,"На борту танкера, севшего на мель у Сахалина - 786 тонн дизельного топлива  https://t.co/9f0IHo4eRY https://t.co/DUPWQLpvBW",United States,Russian,2015-11-28T03:31:00,2015-11-28T03:31:00,1952.0000000000,220.0000000000,2793.0000000000,R,True
disneyTV_ru,собаки-саперы делают стойку на ящики с турецкими помидорами,United States,Russian,2015-11-28T08:51:00,2015-11-28T08:51:00,1952.0000000000,220.0000000000,2794.0000000000,R,True
disneyTV_ru,Зачем женщине нужен уд  https://t.co/G2Hq3C1x18 https://t.co/LREqY0ryTg,United States,Russian,2015-11-28T08:54:00,2015-11-28T08:55:00,1952.0000000000,220.0000000000,2795.0000000000,R,True
disneyTV_ru,Песков: турецкие бизнесмены бьют в набат тревоги https://t.co/o2fBwVeRLa,United States,Russian,2015-11-28T10:37:00,2015-11-28T10:37:00,1952.0000000000,220.0000000000,2796.0000000000,R,True
disneyTV_ru,"Ой.Дунька-то за прессу, оказывается     https://t.co/GTLiQkN1hq",United States,Russian,2015-11-28T20:34:00,2015-11-28T20:34:00,1952.0000000000,219.0000000000,2798.0000000000,R,True
disneyTV_ru,#Юмор@rus_improvisation #Возмездие@rus_improvisation https://t.co/tnmOPdhHIm,United States,Russian,2015-11-28T23:13:00,2015-11-28T23:13:00,1952.0000000000,219.0000000000,2799.0000000000,R,True
disneyTV_ru,#мнения_и_аналитика: Санкции против Турции. Кому будет больнее? https://t.co/kIjntbuDA4,United States,Russian,2015-11-28T23:52:00,2015-11-28T23:53:00,1952.0000000000,219.0000000000,2800.0000000000,R,True
disneyTV_ru,НАК: в Дагестане нейтрализованы два бандглаваря и боевик ИГ https://t.co/P1584saNWb https://t.co/aOLWqgLZRp,United States,Bulgarian,2015-11-29T08:52:00,2015-11-29T08:52:00,1952.0000000000,219.0000000000,2801.0000000000,R,True
