author_id,content,region,language,publish_date,harvested_date,following,followers,updates,post_type,retweet
djVIbelozerov,Дейнего уже высказался по этому поводу:влиять на проект конституции - не их компетенция http://t.co/2lmsLBTqtY https://t.co/Fm4m4iolbz,United States,Russian,2015-06-09 14:36:00,2015-06-09 14:37:00,638,81,347,R,1
djVIbelozerov,Отличный репортаж из детского дома в Донецке @GrahamWP_UK           https://t.co/QgS42ZfM0g,United States,Russian,2015-06-26 08:39:00,2015-06-26 08:39:00,636,75,349,R,1
djVIbelozerov,"Правильный закон, можно удалять тупые вбросы #ЭтоНезабываемо http://t.co/HGDvbE5aHx",United States,Russian,2015-06-30 15:26:00,2015-06-30 15:29:00,635,75,351,R,1
djVIbelozerov,"«Помощь»,оказанная ЕС,обязывает Грецию так изменить политику и экономику,что шансов на самостоятельность не останется  http://t.co/SlZvfdA9kS",United States,Russian,2015-07-22 16:52:00,2015-07-22 16:52:00,184,74,360,R,1
djVIbelozerov,поддержим https://t.co/3IDyESXs1x,United States,Russian,2015-07-30 11:23:00,2015-07-30 11:23:00,184,74,361,R,1
djVIbelozerov,#РоссияЖжет пусть Еропа снимет санкции с России и  еда будет поступать к нам легально http://t.co/SzpY6Bc0C3,United States,Russian,2015-08-10 08:32:00,2015-08-10 08:32:00,184,74,369,R,1
djVIbelozerov,"Матч ЦСКА—Зенит покажут в 16 странах мира, в том числе в США, Германии, Франции и Португалии http://t.co/g9dieZ9qQm http://t.co/cmonLyJvsH",United States,Russian,2015-09-10 10:13:00,2015-09-10 10:13:00,183,75,406,R,1
djVIbelozerov,"Бомбим ИГИЛ, боремся со злом! Буду летчиком #поэтомуясупергерой http://t.co/UsMiWKynlr",United States,Russian,2015-10-19 16:40:00,2015-10-19 16:40:00,181,75,412,R,1
djVIbelozerov,Просто бомба #поэтомуясупергерой http://t.co/1EF8eQqu8L,United States,Russian,2015-10-19 16:41:00,2015-10-19 16:41:00,181,75,413,R,1
djVIbelozerov,Путин в третий раз подряд возглавил рейтинг самых влиятельных людей мира по версии американского журнала Forbes https://t.co/7tiaS7Gdcb,United States,Russian,2015-11-04 15:19:00,2015-11-04 15:19:00,180,74,422,R,1
djVIbelozerov,"Если Россия и западные компании построят „Северный поток-2“, это лишит Украину $2 млрд прибыли, — отметил Яценюк  https://t.co/5iVMYGqebg",United States,Russian,2015-11-07 11:51:00,2015-11-07 11:51:00,179,74,427,R,1
djVIbelozerov,"Арсений Яценюк пожаловался, что Украина потеряет 2 млрд. долларов в случае реализации проекта ""Северный поток-2"" https://t.co/ukONTBwnc1",United States,Russian,2015-11-07 16:06:00,2015-11-07 16:07:00,179,74,431,R,1
djVIbelozerov,'@realDonaldTrump @Morning_Joe @morningmika @DonaldJTrumpJr @EricTrump  Трамп поддержит операцию РФ в Сирии https://t.co/qKJh9CGvDa',United States,Russian,2015-11-11 15:51:00,2015-11-11 15:51:00,179,73,444,R,1
djVIbelozerov,Обращение Сергея Поспелова @pospelovsv к Генеральной ассамблее ООН https://t.co/ov81mj6Ary @fadm_ru #ВДФМ https://t.co/rQzcqiTFn9,United States,Russian,2015-11-12 09:47:00,2015-11-12 09:47:00,179,73,448,R,1
djVIbelozerov,'@realDonaldTrump @WSJ https://t.co/C7iMqjHINI',United States,Serbian,2015-11-12 11:42:00,2015-11-12 11:42:00,179,73,452,R,1
djVIbelozerov,Камеры наблюдения в Сан-Франциско зафиксировали новый случай полицейской жестокости   https://t.co/xN3EszPfnj https://t.co/QMxCPIq3JO,United States,Russian,2015-11-18 11:49:00,2015-11-18 11:50:00,179,74,464,R,1
djVIbelozerov,Бомбардировщики РФ применили в Сирии секретную крылатую ракету  https://t.co/cRjFppfcOs https://t.co/uuBrtNjITr,United States,Russian,2015-11-18 13:49:00,2015-11-18 13:49:00,179,74,465,R,1
djVIbelozerov,'@HillaryClinton @SEIU https://t.co/nzynHSnj6x https://t.co/MST9NYCxUd',United States,Serbian,2015-11-18 17:01:00,2015-11-18 17:01:00,179,75,468,R,1
djVIbelozerov,Прокурор Республики Крым Наталья Поклонская назвала подрывателей опор ЛЭП трусами  https://t.co/TfwztfUhsu https://t.co/kq0f0uNhkK,United States,Russian,2015-11-20 13:31:00,2015-11-20 13:42:00,180,75,485,R,1
djVIbelozerov,Special forces stormed the Radisson Blu hotel in Mali's capital to free hostages https://t.co/ldn3OB0uwt,United States,English,2015-11-20 14:07:00,2015-11-20 14:08:00,180,75,486,R,1
djVIbelozerov,"По неподтвержденной информации, истребители Турции сбили российский самолёт за нарушение воздушного пространства https://t.co/2rPAOFmVHS",United States,Russian,2015-11-24 08:21:00,2015-11-24 08:34:00,180,74,491,R,1
djVIbelozerov,"В результате крушения Су-24 погибли оба пилота, передает SkyNews  https://t.co/l9YtmbeWwh #Су24 #Turkey https://t.co/ww4CocvWnt",United States,Russian,2015-11-24 13:25:00,2015-11-24 13:25:00,180,74,493,R,1
djVIbelozerov,"Турецкие соцсети: ""Я тут слышу, началась война с Россией. Я, пожалуй, побегу"" #Су24 #УдарВСпину #Turkey https://t.co/lS15TnixrD",United States,Russian,2015-11-24 13:57:00,2015-11-24 13:58:00,180,74,494,R,1
djVIbelozerov,ВС Турции приведены в повышенную боеготовность и стягивают Вооруженные силы к границе с Сирией #Turkey #УдарВСпину https://t.co/aybMqv9V0d,United States,Russian,2015-11-24 15:04:00,2015-11-24 15:04:00,180,74,497,R,1
djVIbelozerov,Пентагон: ВС США не участвовали в инциденте с российским Су-24  https://t.co/v7EhWyJhlK #Turkey https://t.co/hvf01aurtA,United States,Russian,2015-11-24 15:15:00,2015-11-24 15:15:00,180,74,498,R,1
djVIbelozerov,"Пентагон не подтвердил, что сбитый Су-24 находился в воздушном пространстве Турции #Су24 #Turkey https://t.co/XGeD210Cde",United States,Russian,2015-11-24 15:43:00,2015-11-24 15:45:00,180,74,499,R,1
djVIbelozerov,"Вертолёт Ми-17был подбит и приземлился в районе Латакии, экипаж покинул борт и после этого его добили повстанцы из ССА #Turkey #УдарВСпину",United States,Russian,2015-11-24 17:55:00,2015-11-24 17:55:00,180,74,502,R,1
djVIbelozerov,#ВозвращениеЛегитимного президента? Вы серьезно такие наивные?,United States,Russian,2016-03-01 16:24:00,2016-03-01 16:45:00,146,71,503,,0
djVIbelozerov,#ЯслежуЗаТобой Контроль осуществляется в полной мере. Перемирию быть! https://t.co/pbUTz9HIrk,United States,Russian,2016-03-01 18:28:00,2016-03-01 18:29:00,147,72,504,R,1
djVIbelozerov,Армения и Азербайджан должны жить в мире #СтопВойна https://t.co/rlGAIHW1Ml,United States,Russian,2016-04-02 15:05:00,2016-04-02 15:06:00,146,73,516,R,1
djVIbelozerov,Путин призывает Азербайджан и Армению к немедленному прекращению огня и проявлению сдержанности #СтопВойна https://t.co/S9QkOb9BVQ,United States,Russian,2016-04-02 15:05:00,2016-04-02 15:06:00,146,73,515,R,1
djVIbelozerov,#КашаПищаНаша Каждому человеку по тарелке гречневой каши! )) https://t.co/lHCW2e0vx1,United States,Russian,2016-04-14 14:21:00,2016-04-14 14:21:00,146,75,527,R,1
djVIbelozerov,#УлыбайсяКакСкобрев Скорбев- новый министр Счастья. https://t.co/SAMNFMb0gh,United States,Russian,2016-04-15 15:36:00,2016-04-15 15:36:00,146,75,530,R,1
djVIbelozerov,Тайны либералов раскрыты: Хакеры взломали сайт ПАРНАСа  https://t.co/Fc5P1UmWay,United States,Uzbek,2016-04-17 16:41:00,2016-04-17 16:41:00,146,75,538,R,1
djVIbelozerov,Новые российские самолеты вскоре полностью заменят Boeing и Airbus  https://t.co/GkFzGQyAFE https://t.co/4TNTOBruH1,United States,Russian,2016-04-19 15:18:00,2016-04-19 15:18:00,146,75,542,R,1
djVIbelozerov,Куда пойти? Куда податься? Где бы еще провороваться? � #Яценюк #Ураина #Гройсман #TNMT  https://t.co/spyWKBR7N5,United States,Russian,2016-04-20 11:34:00,2016-04-20 11:35:00,146,75,545,R,1
djVIbelozerov,"Сирийская семья, жившая в аэропорту, получила убежище в России и паспорта.  #СемьяАхмед https://t.co/7AB45ddxZb",United States,Russian,2016-04-25 17:00:00,2016-04-25 17:00:00,146,78,547,R,1
djVIbelozerov,"#СемьяАхмед Гулистан Исашахова, ее муж и четверо детей теперь находятся в России на законных основаниях https://t.co/Tiks5IQK33",United States,Russian,2016-04-25 17:04:00,2016-04-25 17:04:00,146,78,550,R,1
djVIbelozerov,"#МойГерой Это почетное звание, безусловно, отвечает самому характеру нашего народа. https://t.co/mCKCLgHmCG",United States,Russian,2016-04-30 15:46:00,2016-04-30 15:46:00,145,79,558,R,1
djVIbelozerov,#МойГерой Гагарин https://t.co/mHAJ8aiUZk,United States,Uzbek,2016-04-30 15:48:00,2016-04-30 15:48:00,145,79,560,R,1
djVIbelozerov,ЧМ-2016 по хоккею стартовал! #ВпередКраснаяМашина https://t.co/gkDpRw3GqL,United States,Russian,2016-05-06 16:33:00,2016-05-06 16:34:00,145,78,570,R,1
djVIbelozerov,#Eurovision #Евровидение #Содом #конкурс #финал  https://t.co/LOcb4JY2Ay,United States,Russian,2016-05-13 15:20:00,2016-05-13 15:20:00,145,78,577,R,1
djVIbelozerov,"#Яизбиратель Голос отда, а за кого не скажу",United States,Ukrainian,2016-09-18 15:10:00,2016-09-18 15:10:00,143,71,574,,0
djVIbelozerov,Mercedes показал маленький седан,United States,Russian,2017-04-18 14:34:00,2017-04-18 14:34:00,141,72,580,,0
djVIbelozerov,Audi отзывает в России более двух тысяч автомобилей,United States,Russian,2017-04-19 11:02:00,2017-04-19 11:03:00,141,72,583,,0
