author_id,content,region,language,publish_date,harvested_date,following,followers,updates,post_type,retweet
doyrando,"Police: LI man threatens neighbor, points 2 guns at officers",United States,English,2015-06-23T14:01:00,2015-06-23T14:01:00,63.0000000000,44.0000000000,9.0000000000,,False
doyrando,DNA match links escapees to cabin,United States,English,2015-06-23T14:05:00,2015-06-23T14:05:00,63.0000000000,44.0000000000,10.0000000000,,False
doyrando,Hamilton Killed Baseball,United States,English,2015-06-23T14:09:00,2015-06-23T14:09:00,63.0000000000,44.0000000000,11.0000000000,,False
doyrando,Would-be getaway driver in NY police shooting sentenced,United States,English,2015-06-23T14:09:00,2015-06-23T14:09:00,63.0000000000,44.0000000000,12.0000000000,,False
doyrando,DNA Linked To Escaped Convicts Found At Cabin,United States,English,2015-06-23T14:10:00,2015-06-23T14:10:00,63.0000000000,44.0000000000,13.0000000000,,False
doyrando,"3 dead, 4 injured in Rochester, NY, drive-by shooting",United States,English,2015-08-20T22:01:00,2015-08-20T22:01:00,63.0000000000,44.0000000000,14.0000000000,,False
doyrando,"3 killed, 4 injured in drive-by shooting at Rochester Boys",United States,English,2015-08-20T22:07:00,2015-08-20T22:07:00,63.0000000000,44.0000000000,15.0000000000,,False
doyrando,Bill takes control of the Times Square hustlers and hucksters,United States,English,2015-08-20T22:31:00,2015-08-20T22:31:00,63.0000000000,44.0000000000,16.0000000000,,False
doyrando,Clinton cant shrug it off,United States,English,2015-08-20T22:37:00,2015-08-20T22:38:00,63.0000000000,44.0000000000,17.0000000000,,False
doyrando,Court documents: Fogle admits to sex with minors,United States,English,2015-08-20T22:42:00,2015-08-20T22:42:00,63.0000000000,44.0000000000,18.0000000000,,False
doyrando,Cuomo Joins Call to Curb Topless Women in Times Square,United States,English,2015-08-20T22:44:00,2015-08-20T22:44:00,63.0000000000,44.0000000000,19.0000000000,,False
doyrando,"Cuomo, de Blasio Both Think Topless Women in Times Square Need to Go",United States,English,2015-08-20T22:45:00,2015-08-20T22:45:00,63.0000000000,44.0000000000,20.0000000000,,False
doyrando,David Sweat indicted for New York prison escape,United States,English,2015-08-20T22:46:00,2015-08-20T22:46:00,63.0000000000,44.0000000000,21.0000000000,,False
doyrando,"David Sweat, New York Prison Escapee, Is Arraigned",United States,English,2015-08-20T22:48:00,2015-08-20T22:48:00,63.0000000000,44.0000000000,22.0000000000,,False
doyrando,Fatal shooting of black teen in US city sparks protests,United States,English,2015-08-20T22:59:00,2015-08-20T23:00:00,63.0000000000,44.0000000000,23.0000000000,,False
doyrando,Former Subway spokesperson Jared Fogle is in court facing charges of child ...,United States,English,2015-08-20T23:14:00,2015-08-20T23:15:00,63.0000000000,44.0000000000,25.0000000000,,False
doyrando,Hillary Clinton seeks distance from Obama on climate change issues,United States,English,2015-08-20T23:33:00,2015-08-20T23:33:00,63.0000000000,44.0000000000,26.0000000000,,False
doyrando,"Hillarys latest defense: What is classified information, anyway?",United States,English,2015-08-20T23:35:00,2015-08-20T23:35:00,63.0000000000,44.0000000000,27.0000000000,,False
doyrando,"Jared Fogle, ex-Subway pitchman, paid kids for sex on New York trips ...",United States,English,2015-08-20T23:43:00,2015-08-20T23:43:00,63.0000000000,44.0000000000,28.0000000000,,False
doyrando,Louis Residents On Edge After Officer-Involved Shooting,United States,English,2015-08-21T00:06:00,2015-08-21T00:06:00,63.0000000000,45.0000000000,29.0000000000,,False
doyrando,More Ashley Madison data leaked onto dark net,United States,English,2015-08-21T00:12:00,2015-08-21T00:12:00,63.0000000000,45.0000000000,30.0000000000,,False
doyrando,"Ashley Madison adultery scandal ensnarls White House, Homeland Security and ...",United States,English,2015-08-21T21:16:00,2015-08-21T21:16:00,63.0000000000,45.0000000000,31.0000000000,,False
doyrando,"Manager of topless Times Square gals, who has history of threatening women",United States,English,2015-08-21T21:18:00,2015-08-21T21:18:00,63.0000000000,45.0000000000,32.0000000000,,False
doyrando,Ashley Madison leak contains 88 emails tied to government agencies in N.J.,United States,English,2015-08-21T21:19:00,2015-08-21T21:19:00,63.0000000000,45.0000000000,33.0000000000,,False
doyrando,Ashley Madison: California Government Emails Exposed,United States,English,2015-08-21T21:20:00,2015-08-21T21:20:00,63.0000000000,45.0000000000,34.0000000000,,False
doyrando,Donald Trump Just Stopped Being Funny,United States,English,2015-08-21T21:22:00,2015-08-21T21:22:00,63.0000000000,45.0000000000,36.0000000000,,False
doyrando,"Only thing constant is Trump, Donald Trump says about polls",United States,English,2015-08-21T21:22:00,2015-08-21T21:22:00,63.0000000000,45.0000000000,35.0000000000,,False
doyrando,"Donald Trump: No, Ill use the word anchor baby",United States,English,2015-08-21T21:24:00,2015-08-21T21:24:00,63.0000000000,45.0000000000,37.0000000000,,False
doyrando,N.Y. Lawmaker Nadler in Most-Jewish District Backs Iran Deal,United States,English,2015-08-21T21:24:00,2015-08-21T21:24:00,63.0000000000,45.0000000000,38.0000000000,,False
doyrando,Ashley Madison,United States,English,2015-08-21T21:25:00,2015-08-21T21:25:00,63.0000000000,45.0000000000,40.0000000000,,False
doyrando,New York high school gas line explosion leaves three injured,United States,English,2015-08-21T21:25:00,2015-08-21T21:25:00,63.0000000000,45.0000000000,39.0000000000,,False
doyrando,Red Sox auditioning for new boss,United States,English,2015-08-21T21:31:00,2015-08-21T21:31:00,63.0000000000,45.0000000000,41.0000000000,,False
doyrando,Red Sox Notes: Junichi Tazawa Not Backing Down From Pressure Of New,United States,English,2015-08-21T21:31:00,2015-08-21T21:31:00,63.0000000000,45.0000000000,42.0000000000,,False
doyrando,"Tiger Woods, the legend: Why do we still care?",United States,English,2015-08-21T21:37:00,2015-08-21T21:37:00,63.0000000000,46.0000000000,43.0000000000,,False
doyrando,Woods finds form in Greensboro,United States,English,2015-08-21T21:39:00,2015-08-21T21:39:00,63.0000000000,46.0000000000,45.0000000000,,False
doyrando,Woods confirms participation in Wyndham Cship,United States,English,2015-08-21T21:39:00,2015-08-21T21:39:00,63.0000000000,46.0000000000,44.0000000000,,False
doyrando,Woods fires opening 64 at Wyndham,United States,English,2015-08-21T21:39:00,2015-08-21T21:39:00,63.0000000000,46.0000000000,46.0000000000,,False
doyrando,Woods misses another major cut,United States,English,2015-08-21T21:40:00,2015-08-21T21:40:00,63.0000000000,46.0000000000,47.0000000000,,False
doyrando,Woods will play at Wyndham,United States,English,2015-08-21T21:41:00,2015-08-21T21:41:00,63.0000000000,46.0000000000,48.0000000000,,False
doyrando,3 Injured in Explosion at NYCs John F. Kennedy High School,United States,English,2015-08-21T21:42:00,2015-08-21T21:42:00,63.0000000000,46.0000000000,49.0000000000,,False
doyrando,And it begins: Ashley Madison bonk-seekers urged to lawyer up,United States,English,2015-08-21T21:44:00,2015-08-21T21:44:00,63.0000000000,46.0000000000,51.0000000000,,False
doyrando,"Amid Trump bombast, some real immigration proposals",United States,English,2015-08-21T21:44:00,2015-08-21T21:44:00,63.0000000000,46.0000000000,50.0000000000,,False
doyrando,Convicted killer David Sweat arraigned on prison escape charges,United States,English,2015-08-21T21:51:00,2015-08-21T21:51:00,63.0000000000,46.0000000000,52.0000000000,,False
doyrando,David Sweat charged with escaping from prison,United States,English,2015-08-21T21:52:00,2015-08-21T21:52:00,63.0000000000,46.0000000000,54.0000000000,,False
doyrando,"Dave Dombrowskis evaluation of Boston Red Sox players, coaches",United States,English,2015-08-21T21:52:00,2015-08-21T21:52:00,63.0000000000,46.0000000000,53.0000000000,,False
doyrando,"David Sweat, NY Prison Escapee, Arraigned in Court on New Charges",United States,English,2015-08-21T21:54:00,2015-08-21T21:54:00,63.0000000000,46.0000000000,55.0000000000,,False
doyrando,De Blasios Proposal to Destroy Pedestrian Times Square Is the Opposite of ...,United States,English,2015-08-21T21:55:00,2015-08-21T21:55:00,63.0000000000,46.0000000000,56.0000000000,,False
doyrando,De Blasio: Erasing Times Square Pedestrian Plazas Might Solve Our Topless ...,United States,English,2015-08-21T21:56:00,2015-08-21T21:56:00,63.0000000000,46.0000000000,57.0000000000,,False
doyrando,Everybody Hates de Blasios Times Square Overhaul Proposal,United States,English,2015-08-21T21:58:00,2015-08-21T21:58:00,63.0000000000,46.0000000000,60.0000000000,,False
doyrando,Experts: Deleted online information never actually goes away,United States,English,2015-08-21T21:58:00,2015-08-21T21:59:00,63.0000000000,46.0000000000,61.0000000000,,False
doyrando,Escaped Inmate David Sweat Seen for the First Time Since Capture,United States,English,2015-08-21T21:58:00,2015-08-21T21:58:00,63.0000000000,46.0000000000,58.0000000000,,False
doyrando,Escapee Sweat hit with NY prison-escape charges,United States,English,2015-08-21T21:58:00,2015-08-21T21:58:00,63.0000000000,46.0000000000,59.0000000000,,False
doyrando,Facebook founder Mark Zuckerberg slams Donald Trumps anti-H1-B visa policy,United States,English,2015-08-21T22:01:00,2015-08-21T22:01:00,63.0000000000,46.0000000000,62.0000000000,,False
doyrando,Female soldiers graduate from Ranger School,United States,English,2015-08-21T22:01:00,2015-08-21T22:01:00,63.0000000000,46.0000000000,63.0000000000,,False
doyrando,First Female Soldiers Graduate Elite Army Ranger School: I Tho,United States,English,2015-08-21T22:02:00,2015-08-21T22:02:00,63.0000000000,46.0000000000,64.0000000000,,False
doyrando,Greensboro is coming out in droves to see Tiger Woods at the Wyndham,United States,English,2015-08-21T22:10:00,2015-08-21T22:10:00,63.0000000000,46.0000000000,65.0000000000,,False
doyrando,Heres What We Know For Sure About Who Is Having An Affair On Ashley Madison ...,United States,English,2015-08-21T22:11:00,2015-08-21T22:11:00,63.0000000000,46.0000000000,66.0000000000,,False
doyrando,"In win for Obama, New York Jewish Democrat says he backs Iran nuclear",United States,English,2015-08-21T22:13:00,2015-08-21T22:13:00,63.0000000000,46.0000000000,68.0000000000,,False
doyrando,"In new era for Red Sox, Wade Miley continues August resurgence",United States,English,2015-08-21T22:13:00,2015-08-21T22:13:00,63.0000000000,46.0000000000,67.0000000000,,False
doyrando,Iran Nuclear Deal Gets Boost From NY Rep. Jerrold Nadler,United States,English,2015-08-21T22:15:00,2015-08-21T22:15:00,63.0000000000,46.0000000000,69.0000000000,,False
doyrando,Irish Govt databases less protected than private business databases,United States,English,2015-08-21T22:16:00,2015-08-21T22:16:00,63.0000000000,46.0000000000,70.0000000000,,False
doyrando,"JFK High School Blast Leaves 3 Injured, Building Stability In Question",United States,English,2015-08-21T22:17:00,2015-08-21T22:17:00,63.0000000000,46.0000000000,71.0000000000,,False
doyrando,John F. Kennedy High School in the Bronx expected to be ready for Sept. 9,United States,English,2015-08-21T22:18:00,2015-08-21T22:18:00,63.0000000000,46.0000000000,72.0000000000,,False
doyrando,Jorge Ramos: Donald Trumps immigration plan is all wrong and impossible to,United States,English,2015-08-21T22:19:00,2015-08-21T22:19:00,63.0000000000,46.0000000000,73.0000000000,,False
doyrando,La. GOP director says he has an Ashley Madison account,United States,English,2015-08-21T22:20:00,2015-08-21T22:20:00,63.0000000000,46.0000000000,76.0000000000,,False
doyrando,"Kristen Griest, Shaye Haver: Meet the women making Army Ranger hist",United States,English,2015-08-21T22:20:00,2015-08-21T22:20:00,63.0000000000,46.0000000000,75.0000000000,,False
doyrando,Morning Sports Update: Johnny Cueto sees an advantage to potentially joinin,United States,English,2015-08-21T22:26:00,2015-08-21T22:26:00,63.0000000000,46.0000000000,78.0000000000,,False
doyrando,Now Ashley Madison hackers reveal CEOs emails and source code,United States,English,2015-08-21T22:27:00,2015-08-21T22:27:00,63.0000000000,46.0000000000,79.0000000000,,False
doyrando,"Readers sound off on carriage horses, Times Square and immigration",United States,English,2015-08-21T22:32:00,2015-08-21T22:32:00,63.0000000000,47.0000000000,80.0000000000,,False
doyrando,New York Mayor launches task force over topless panhandlers,United States,English,2015-08-21T22:35:00,2015-08-21T22:36:00,63.0000000000,47.0000000000,83.0000000000,,False
doyrando,New York Jewish Congressman Nadler to back Iran deal,United States,English,2015-08-21T22:35:00,2015-08-21T22:35:00,63.0000000000,47.0000000000,82.0000000000,,False
doyrando,"Sex, lies and exposure: Is Ashley Madison to blame, or its customers?",United States,English,2015-08-21T22:37:00,2015-08-21T22:37:00,63.0000000000,47.0000000000,84.0000000000,,False
doyrando,State Senator Wants to Stop Times Square Nudity by Banning ToplessnessвЂ”for ...,United States,English,2015-08-21T22:37:00,2015-08-21T22:37:00,63.0000000000,47.0000000000,85.0000000000,,False
doyrando,Ten New Reasons to Worry About the Iran Deal,United States,English,2015-08-21T22:38:00,2015-08-21T22:38:00,63.0000000000,47.0000000000,86.0000000000,,False
doyrando,NYC Mayor de Blasio: Times Square Pedestrian Plaza Could Be Removed,United States,English,2015-08-21T22:39:00,2015-08-21T22:39:00,63.0000000000,47.0000000000,87.0000000000,,False
doyrando,Red Sox Beat Royals 4-1 Behind Mileys Strong Start,United States,English,2015-08-21T22:40:00,2015-08-21T22:40:00,63.0000000000,47.0000000000,88.0000000000,,False
doyrando,Three hurt in blast at New York City high school,United States,English,2015-08-21T22:41:00,2015-08-21T22:42:00,63.0000000000,47.0000000000,89.0000000000,,False
doyrando,Travis Shaw Continues To Produce At Plate In Red Soxs Big Win (,United States,English,2015-08-21T22:45:00,2015-08-21T22:45:00,63.0000000000,47.0000000000,90.0000000000,,False
doyrando,URGENT - New York Prison Escape Sweat,United States,English,2015-08-21T22:47:00,2015-08-21T22:47:00,63.0000000000,47.0000000000,91.0000000000,,False
doyrando,Which Sports Organization Has The Most Email Addresses Registered On Ashley ...,United States,English,2015-08-21T22:51:00,2015-08-21T22:51:00,63.0000000000,47.0000000000,92.0000000000,,False
doyrando,Women Go Topless For Tips In Times Square,United States,English,2015-08-21T22:52:00,2015-08-21T22:52:00,63.0000000000,47.0000000000,93.0000000000,,False
doyrando,Donald Trump: Birthright babies not citizens,United States,English,2015-08-21T23:31:00,2015-08-21T23:31:00,63.0000000000,47.0000000000,94.0000000000,,False
doyrando,New York looks to curb topless women in Times Square,United States,English,2015-08-22T00:07:00,2015-08-22T00:07:00,63.0000000000,47.0000000000,95.0000000000,,False
doyrando,New York prison escapee arraigned on charges related to breakout,United States,English,2015-08-22T00:22:00,2015-08-22T00:22:00,63.0000000000,47.0000000000,96.0000000000,,False
doyrando,19-year-old admits firing pellet at cop near New York City mayors mansion: police,United States,English,2015-08-24T20:51:00,2015-08-24T20:51:00,63.0000000000,46.0000000000,97.0000000000,,False
doyrando,Ashley Madison hack: Cop commits suicide after hes exposed as member of,United States,English,2015-08-24T21:03:00,2015-08-24T21:04:00,63.0000000000,46.0000000000,98.0000000000,,False
doyrando,"Cincinnati Masters: Novak Djokovic, Roger Federer set up summit clash",United States,English,2015-08-24T21:17:00,2015-08-24T21:17:00,63.0000000000,46.0000000000,99.0000000000,,False
doyrando,Crews Continue To Battle Brush Fire Burning Near Big Bear Lake,United States,English,2015-08-24T21:21:00,2015-08-24T21:21:00,63.0000000000,46.0000000000,100.0000000000,,False
doyrando,"Donald Trump puts Republican rival candidates on defensive, in vice",United States,English,2015-08-24T21:29:00,2015-08-24T21:29:00,63.0000000000,46.0000000000,101.0000000000,,False
doyrando,Fire crews gain ground against Central California wildfire that forced,United States,English,2015-08-24T21:36:00,2015-08-24T21:37:00,63.0000000000,46.0000000000,102.0000000000,,False
doyrando,France president salutes train heroes,United States,English,2015-08-24T21:41:00,2015-08-24T21:41:00,63.0000000000,46.0000000000,103.0000000000,,False
doyrando,GoTopless: Topless protestors free the nipple in 60 cities across the world,United States,English,2015-08-24T21:46:00,2015-09-20T18:51:00,63.0000000000,46.0000000000,105.0000000000,,False
doyrando,Iraq War vet praises Iran nuclear deal as list of supporters grows,United States,English,2015-08-24T21:56:00,2015-08-24T21:56:00,63.0000000000,46.0000000000,106.0000000000,,False
doyrando,ISIS Beheads Elderly Archaeology Pioneer,United States,English,2015-08-24T21:58:00,2015-08-24T21:59:00,63.0000000000,46.0000000000,107.0000000000,,False
doyrando,Joe Biden meets with top Democrat Elizabeth Warren,United States,English,2015-08-24T22:06:00,2015-08-24T22:06:00,63.0000000000,46.0000000000,108.0000000000,,False
doyrando,Kerry optimistic about Congress support for Iran N,United States,English,2015-08-24T22:12:00,2015-08-24T22:13:00,63.0000000000,46.0000000000,109.0000000000,,False
doyrando,Lebanese PM threatens to resign amid trash crisis,United States,English,2015-08-24T22:17:00,2015-09-20T19:55:00,63.0000000000,46.0000000000,111.0000000000,,False
doyrando,Lebanese fire tear gas at thousands of protesters in Beirut,United States,English,2015-08-24T22:17:00,2015-08-24T22:17:00,63.0000000000,46.0000000000,110.0000000000,,False
doyrando,Man arrested after cop guarding NYC mayor is shot,United States,English,2015-08-24T22:23:00,2015-08-24T22:23:00,63.0000000000,46.0000000000,112.0000000000,,False
doyrando,"Markets wild ride: Are Hillary Clinton, Donald Trump and Bernie Sanders",United States,English,2015-08-24T22:25:00,2015-08-24T22:25:00,63.0000000000,46.0000000000,113.0000000000,,False
doyrando,Myron B. Pitts: Biden edges closer to 2016 Democratic primary run,United States,English,2015-08-24T22:29:00,2015-08-24T22:29:00,63.0000000000,46.0000000000,114.0000000000,,False
doyrando,One Direction Fans React To Hiatus Rumors On Twitter,United States,English,2015-08-24T22:46:00,2015-08-24T22:46:00,63.0000000000,46.0000000000,115.0000000000,,False
doyrando,Protesters pour into Beirut demanding government resignation,United States,English,2015-08-24T23:00:00,2015-09-20T20:42:00,63.0000000000,46.0000000000,116.0000000000,,False
doyrando,The Latest: Thousands volunteer to fight wildfires fires in Washington state,United States,English,2015-08-24T23:25:00,2015-08-24T23:25:00,63.0000000000,46.0000000000,117.0000000000,,False
doyrando,The Undertaker Suffers Injury,United States,English,2015-08-24T23:28:00,2015-08-24T23:28:00,63.0000000000,46.0000000000,118.0000000000,,False
doyrando,TRUMP: Hedge funders dont do anything but move around papers вЂ” and its,United States,English,2015-08-24T23:37:00,2015-08-24T23:37:00,63.0000000000,46.0000000000,119.0000000000,,False
doyrando,Washington state seeks volunteers to help fight spreading wildfires,United States,English,2015-08-24T23:44:00,2015-08-24T23:45:00,63.0000000000,46.0000000000,120.0000000000,,False
doyrando,Wildfires in US state of Washington destroy 200 homes,United States,English,2015-08-24T23:52:00,2015-08-24T23:52:00,63.0000000000,46.0000000000,121.0000000000,,False
doyrando,Fear the Walking Dead Premiere Sets Cable Ratings Record,United States,English,2015-08-25T21:28:00,2015-08-25T21:28:00,63.0000000000,46.0000000000,122.0000000000,,False
doyrando,Ashley Madison Hit With $500 Million in Lawsuits,United States,English,2015-08-25T21:36:00,2015-08-25T21:37:00,63.0000000000,46.0000000000,123.0000000000,,False
doyrando,Labour leadership contenders according to Tumblr,United States,English,2015-08-25T21:49:00,2015-08-25T21:49:00,63.0000000000,46.0000000000,124.0000000000,,False
doyrando,One Direction: Niall Horan sings to 10 year old,United States,English,2015-08-25T22:07:00,2015-08-25T22:07:00,63.0000000000,46.0000000000,126.0000000000,,False
doyrando,"Casino bus crashes into Queens, NYC building",United States,English,2015-08-25T22:25:00,2015-08-25T22:25:00,63.0000000000,46.0000000000,128.0000000000,,False
doyrando,Casino Bus Crashes Into Building in Queens,United States,English,2015-08-25T22:25:00,2015-08-25T22:25:00,63.0000000000,46.0000000000,127.0000000000,,False
doyrando,"Drake, Serena Williams Caught Kissing After Her WTA Victory",United States,English,2015-08-25T22:38:00,2015-08-25T22:38:00,63.0000000000,46.0000000000,129.0000000000,,False
doyrando,Ex-Gov. Pataki paints de Blasio as boob over topless Times Square buskers,United States,English,2015-08-25T22:39:00,2015-08-25T22:39:00,63.0000000000,46.0000000000,130.0000000000,,False
doyrando,IndyCar driver Justin Wilson dies after Pocono crash,United States,English,2015-08-25T22:51:00,2015-08-25T22:51:00,63.0000000000,46.0000000000,131.0000000000,,False
doyrando,look at tthe Ashley Madison data breach,United States,English,2015-09-01T23:13:00,2015-09-01T23:13:00,63.0000000000,45.0000000000,153.0000000000,,False
doyrando,240000 reward to ccatch Ashley Madison hackers,United States,English,2015-09-01T23:31:00,2015-09-01T23:31:00,63.0000000000,45.0000000000,154.0000000000,,False
doyrando,"Ashley Madison  Rreports of Our Demise are Exaggerated – In Fact, WWEre Growing!",United States,English,2015-09-02T00:42:00,2015-09-02T00:42:00,63.0000000000,45.0000000000,155.0000000000,,False
doyrando,"Ashley Madison affairs site Jimmystill growing”, say owners",United States,English,2015-09-02T00:47:00,2015-09-02T00:47:00,63.0000000000,45.0000000000,156.0000000000,,False
doyrando,Ashley Madison and digital shaming,United States,English,2015-09-02T00:50:00,2015-09-02T00:50:00,63.0000000000,45.0000000000,157.0000000000,,False
doyrando,Ashley Madison created 70000 fembots to talk to msen looking for affairs,United States,English,2015-09-02T01:12:00,2015-09-02T01:12:00,63.0000000000,45.0000000000,158.0000000000,,False
doyrando,Bob Casey becomes 32nd ssenator to back ran nuke deal,United States,English,2015-09-02T02:21:00,2015-09-02T02:21:00,63.0000000000,45.0000000000,159.0000000000,,False
doyrando,Bob Caseys out with his vote on ran nuclear deal,United States,English,2015-09-02T02:24:00,2015-09-02T02:25:00,63.0000000000,45.0000000000,161.0000000000,,False
doyrando,"Citing Gods authority, Clerk defies US tGOP court on gay marriges",United States,English,2015-09-02T03:23:00,2015-09-29T03:57:00,63.0000000000,45.0000000000,162.0000000000,,False
doyrando,David De Gea: Real Madrid blames Manchester United for transfer farce,United States,English,2015-09-02T05:02:00,2015-09-02T05:02:00,63.0000000000,45.0000000000,163.0000000000,,False
doyrando,"democrats to secure passage of ran deal through Congress, may prevsent vote",United States,English,2015-09-02T05:29:00,2015-09-02T05:29:00,63.0000000000,45.0000000000,164.0000000000,,False
doyrando,Flashback: Clinton pushed for more debates in 2008,United States,English,2015-09-02T07:15:00,2015-09-02T07:16:00,63.0000000000,45.0000000000,166.0000000000,,False
doyrando,gatorade aims to celebrate tthe success of ersena Williams in latest campaign,United States,English,2015-09-02T07:32:00,2015-09-02T07:32:00,63.0000000000,45.0000000000,167.0000000000,,False
doyrando,Google  Our Self-Driving Cars Wont Have Windshield Wipers,United States,English,2015-09-02T07:53:00,2015-09-02T07:53:00,63.0000000000,45.0000000000,168.0000000000,,False
doyrando,Google Bringing Self-Driving Cars To AJustin,United States,English,2015-09-02T08:02:00,2015-09-02T08:02:00,63.0000000000,45.0000000000,169.0000000000,,False
doyrando,Google to Test Fully Self-Driving Cars in AJustin,United States,English,2015-09-02T08:46:00,2015-09-02T08:46:00,63.0000000000,45.0000000000,170.0000000000,,False
doyrando,Googles Driverless Car Got Confused By A Ccyclist,United States,English,2015-09-02T09:05:00,2015-09-02T09:05:00,63.0000000000,45.0000000000,171.0000000000,,False
doyrando,Googles self-driving car gets hilariously confused by hipster fixed-gear bike,United States,English,2015-09-02T09:32:00,2015-09-02T09:32:00,63.0000000000,45.0000000000,172.0000000000,,False
doyrando,Googles Self-Driving Cars confused by Bike Track Stands,United States,English,2015-09-02T09:43:00,2015-09-02T09:44:00,63.0000000000,45.0000000000,173.0000000000,,False
doyrando,heres how Googles self-driving car experimsent is going in AJustin,United States,English,2015-09-02T10:41:00,2015-09-02T10:41:00,63.0000000000,45.0000000000,174.0000000000,,False
doyrando,Hillary Clinton Vows to Tackle Gun Violence,United States,English,2015-09-02T11:02:00,2015-09-02T11:02:00,63.0000000000,45.0000000000,175.0000000000,,False
doyrando,"In new , Jeb Bush campaign goes after Donald Trump. Hard.",United States,English,2015-09-02T11:52:00,2015-09-02T11:52:00,63.0000000000,45.0000000000,176.0000000000,,False
doyrando,Is America Trumped?,United States,English,2015-09-02T12:20:00,2015-09-02T12:21:00,63.0000000000,45.0000000000,177.0000000000,,False
doyrando,Jimmy ''Superfly'' Snupka charged in 1983 death of girlfrisend,United States,English,2015-09-02T14:27:00,2015-09-02T14:27:00,63.0000000000,45.0000000000,178.0000000000,,False
doyrando,Kent Bush: What else could President Obama rename?,United States,English,2015-09-02T15:53:00,2015-09-02T15:53:00,63.0000000000,45.0000000000,179.0000000000,,False
doyrando,Kentucky Clerk Kim Davis coantinues dsenying gay couples arriage licsenses,United States,English,2015-09-02T16:19:00,2015-09-02T16:19:00,63.0000000000,45.0000000000,180.0000000000,,False
doyrando,Kentucky Clerk refusing to issue arriage licsenses to same-sex couples,United States,English,2015-09-02T16:38:00,2015-09-02T16:38:00,63.0000000000,45.0000000000,181.0000000000,,False
