author_id,content,region,language,publish_date,harvested_date,following,followers,updates,post_type,retweet
GallowayEliana,RT @martiallah: When tent say #AllLivesMatter instead of #BlackLivesMatter https://t.co/ayjC5dFR2k,United States,English,2016-06-20T16:14:00,2016-06-20T16:14:00,1341.0000000000,797.0000000000,1574.0000000000,,False
GallowayEliana,Latino radio host tells Hillary  -- his family's voting for Donald! https://t.co/L3UBwlQQcQ,United States,English,2016-06-21T14:04:00,2016-06-21T14:04:00,1194.0000000000,804.0000000000,1575.0000000000,R,True
GallowayEliana,"Minnesotans love their big fish pictures, and these two are beauties https://t.co/59tzItoYli https://t.co/9oScgaSIkh",United States,English,2016-06-21T14:04:00,2016-06-21T14:05:00,1194.0000000000,804.0000000000,1576.0000000000,R,True
GallowayEliana,Advancement Project Board Member @iJesseWilliams to Receive Humanitarian Award @ BET Awards https://t.co/afzCKXzt0B https://t.co/Zx5YFnOuMG,United States,English,2016-06-21T14:05:00,2016-06-21T14:05:00,1194.0000000000,804.0000000000,1582.0000000000,R,True
GallowayEliana,Cuban coffee is coming to the USA: https://t.co/QZ6J1vly8W (Getty) https://t.co/kV0T9nBmTc,United States,English,2016-06-21T14:05:00,2016-06-21T14:06:00,1194.0000000000,804.0000000000,1585.0000000000,R,True
GallowayEliana,#ExxonKnew About #ClimateChange and Exxon Knows How to Use Trade Deals to Get Its Way https://t.co/qvz0LHQR5y https://t.co/EiJhqxkx1E,United States,English,2016-06-21T14:05:00,2016-06-21T14:05:00,1194.0000000000,804.0000000000,1580.0000000000,R,True
GallowayEliana,"NYPD spied on Muslims and didn't produce any terrorism cases, but Trump still thinks racial profiling is a good... https://t.co/WCnPtCJ6KJ",United States,English,2016-06-21T14:05:00,2016-06-21T14:05:00,1194.0000000000,804.0000000000,1581.0000000000,R,True
GallowayEliana,Diplomas Now i3 Project: Early Monitoring Protects At-Risk Students https://t.co/h68YEgnplu #research,United States,English,2016-06-21T14:05:00,2016-06-21T14:05:00,1194.0000000000,804.0000000000,1579.0000000000,R,True
GallowayEliana,"Then again, Trump has never been one for math... https://t.co/5YPZbQkEa3 https://t.co/kYDfpxZWek",United States,English,2016-06-21T14:05:00,2016-06-21T14:05:00,1194.0000000000,804.0000000000,1584.0000000000,R,True
GallowayEliana,This!  https://t.co/26O1KzuV80,United States,English,2016-06-21T14:05:00,2016-06-21T14:05:00,1194.0000000000,804.0000000000,1577.0000000000,Q,True
GallowayEliana,Powerful political and business elites abandoned labor and turned the Party of Roosevelt into the Party of... https://t.co/VjYj9sTXPw,United States,English,2016-06-21T14:05:00,2016-06-21T14:05:00,1194.0000000000,804.0000000000,1583.0000000000,R,True
GallowayEliana,Poll: Clinton surges to 8 point lead over Trump in Florida https://t.co/pRgNhXdu1J https://t.co/rpA0lWSPBk,United States,English,2016-06-21T14:05:00,2016-06-21T14:05:00,1194.0000000000,804.0000000000,1578.0000000000,R,True
GallowayEliana,No. JFC. https://t.co/2e4PMRZmo1,United States,English,2016-06-24T14:22:00,2016-06-24T14:22:00,1186.0000000000,803.0000000000,1588.0000000000,Q,True
GallowayEliana,Sorry Science Engineering Technology and Math #STEM @Rapmonster @SelfMade_BP @BLAZE1thestone @spiritchillvibe @veonsneeks,United States,English,2016-06-24T14:22:00,2016-06-24T14:22:00,1186.0000000000,803.0000000000,1589.0000000000,R,True
GallowayEliana,Yes there are some brothas n sistas playing but who plays most Funk n Jazz taday? It ain't you cause yo head is in LogicX @Rapmonster,United States,English,2016-06-24T14:22:00,2016-06-24T14:23:00,1186.0000000000,803.0000000000,1587.0000000000,R,True
GallowayEliana,WATCH LIVE: @SpeakerRyan discusses tax plan at press conference https://t.co/dbRyL0yiYj https://t.co/0hpECFIFVa,United States,English,2016-06-24T14:22:00,2016-06-24T14:23:00,1186.0000000000,803.0000000000,1590.0000000000,R,True
GallowayEliana,How I got arrested while reporting on a private prison https://t.co/nMMxzBBMSc https://t.co/lavwfmFCjZ,United States,English,2016-06-24T14:22:00,2016-06-24T14:22:00,1186.0000000000,803.0000000000,1585.0000000000,R,True
GallowayEliana,The trailer for Ava DuVernay's new show 'Queen Sugar' is everything https://t.co/FbjbeE8OOD https://t.co/tBq0kUZVzu,United States,English,2016-06-24T14:22:00,2016-06-24T14:22:00,1186.0000000000,803.0000000000,1586.0000000000,R,True
GallowayEliana,"I’m in my late 20s, living back at home and feel like a failure  https://t.co/TG3fEw24FE",United States,English,2016-06-24T14:23:00,2016-06-24T14:23:00,1186.0000000000,803.0000000000,1593.0000000000,R,True
GallowayEliana,Favelas braced for violence... https://t.co/ORbgbAf4ZD,United States,English,2016-06-24T14:23:00,2016-06-24T14:23:00,1186.0000000000,803.0000000000,1595.0000000000,R,True
GallowayEliana,We are days away from the #BETAwards and our celebs better dress to impress because @WendyWilliams #StyleSquadBET! https://t.co/rPbVYYFucr,United States,English,2016-06-24T14:23:00,2016-06-24T14:23:00,1186.0000000000,803.0000000000,1592.0000000000,R,True
GallowayEliana,The Brits haven't screwed us this bad since they burned down the White House https://t.co/akmO9iMSrZ,United States,English,2016-06-24T14:23:00,2016-06-24T14:23:00,1186.0000000000,803.0000000000,1596.0000000000,Q,True
GallowayEliana,"'@3rdEyePluG Right on, brother!'",United States,English,2016-06-24T14:23:00,2016-06-24T14:23:00,1186.0000000000,803.0000000000,1591.0000000000,R,True
GallowayEliana,����������������������������� https://t.co/qF2wmzuY2w,United States,English,2016-06-25T14:08:00,2016-06-25T14:09:00,1284.0000000000,812.0000000000,1602.0000000000,Q,True
GallowayEliana,.@gmprnce Take advantage of it and buy pounds. Stop whining. It spiked up before it went down. It was ALREAY low. Sheesh. Idiots.,United States,English,2016-06-25T14:08:00,2016-06-25T14:08:00,1284.0000000000,812.0000000000,1599.0000000000,R,True
GallowayEliana,"""#JessicaHampton's death should be a ""wake up"" call for women in abusive relationships."" —black man  Why can't it be a wake up call for you?",United States,English,2016-06-25T14:08:00,2016-06-25T14:08:00,1284.0000000000,812.0000000000,1598.0000000000,R,True
GallowayEliana,android snapchats stay looking like https://t.co/hQ6oEPqUui,United States,English,2016-06-25T14:08:00,2016-06-25T14:08:00,1284.0000000000,812.0000000000,1601.0000000000,R,True
GallowayEliana,"BREAKING: Somali police say car bomb explodes outside Mogadishu hotel, gunmen fighting way inside.",United States,English,2016-06-25T14:09:00,2016-06-25T14:09:00,1284.0000000000,812.0000000000,1604.0000000000,R,True
GallowayEliana,I don't want you to think you're courageous radicals. You are not. Turns out that our ideas are mainstream and supported by millions people.,United States,English,2016-06-25T14:09:00,2016-06-25T14:09:00,1284.0000000000,812.0000000000,1603.0000000000,R,True
GallowayEliana,"I'm glad someone with the blue check said this. Don't ever give up your right to bare arms in this country, ever‼️ https://t.co/sgQhLzq6cm",United States,English,2016-06-25T14:17:00,2016-06-25T14:17:00,1284.0000000000,812.0000000000,1608.0000000000,Q,True
GallowayEliana,JUST IN: Death toll in West Virginia flooding rises to 23 https://t.co/E5P4abCYnE https://t.co/h1PGNnfy9n,United States,English,2016-06-25T14:17:00,2016-06-25T14:17:00,1284.0000000000,812.0000000000,1610.0000000000,R,True
GallowayEliana,Pawnbrokers size up gun buyers on gut instinct https://t.co/TD9kssPqCn https://t.co/xy7GoM3pxB,United States,English,2016-06-25T14:17:00,2016-06-25T14:17:00,1284.0000000000,812.0000000000,1609.0000000000,R,True
GallowayEliana,I can't wait for tomorrow's #GameofThrones. It doesn't overlap with the #BETAwards16 does it?,United States,English,2016-06-25T14:17:00,2016-06-25T14:17:00,1284.0000000000,812.0000000000,1607.0000000000,R,True
GallowayEliana,"Have no illusions about #Brexit life outside the EU, Angela Merkel tells Britain https://t.co/GHBs5Jsn2o https://t.co/Pzv6OsIkiP",United States,English,2016-06-28T17:00:00,2016-06-28T17:00:00,1375.0000000000,826.0000000000,1614.0000000000,R,True
GallowayEliana,.@GOP @SenateGOP @HouseGOP #gop #FoxNews @FoxNews #UniteBlue @GOPconvention @WaysandMeansGOP @oreillyfactor #p2 https://t.co/x3952xe2ar,United States,English,2016-06-28T17:00:00,2016-06-28T17:00:00,1375.0000000000,826.0000000000,1612.0000000000,R,True
GallowayEliana,"It feels like William ""Refrigerator"" Perry has been dying for a long time. https://t.co/Iew6GUdAAs via @ricktelander https://t.co/4BpXCDSQ6d",United States,English,2016-06-28T17:00:00,2016-06-28T17:01:00,1375.0000000000,826.0000000000,1616.0000000000,R,True
GallowayEliana,JUST IN: Twitter failed to take down death threats to senators for 2 weeks https://t.co/AwwnlJEfmJ https://t.co/cV9adQelSA,United States,English,2016-06-28T17:00:00,2016-06-28T17:01:00,1375.0000000000,826.0000000000,1617.0000000000,R,True
GallowayEliana,"Brexit live: 1 in 4 Labour voters less likely to vote Labour after EU referendum, internal survey shows https://t.co/LvXewRL0lY",United States,English,2016-06-28T17:00:00,2016-06-28T17:00:00,1375.0000000000,826.0000000000,1611.0000000000,R,True
GallowayEliana,WATCH LIVE: UKIP leader and #Brexit campaigner Nigel Farage joins us now https://t.co/EYmHTvsTvD https://t.co/dpHtiEguDS,United States,English,2016-06-28T17:00:00,2016-06-28T17:00:00,1375.0000000000,826.0000000000,1613.0000000000,R,True
GallowayEliana,'@awkwardblkgrl https://t.co/3Suu3LGOlV',United States,English,2016-06-28T17:00:00,2016-06-28T17:00:00,1375.0000000000,826.0000000000,1615.0000000000,R,True
GallowayEliana,"I do not advocate a kumbaya world. Like #anti-Semitism, #racism should motivate us to a single purpose:  Intellectual Competitiveness",United States,English,2016-06-28T17:01:00,2016-06-28T17:01:00,1375.0000000000,826.0000000000,1620.0000000000,R,True
GallowayEliana,"GOP strategist: Trump has ""held more positions now than the Kama Sutra"" \| WATCH: https://t.co/L79VoXXdse https://t.co/FVTrW6ru3v",United States,English,2016-06-28T17:01:00,2016-06-28T17:01:00,1375.0000000000,826.0000000000,1621.0000000000,R,True
GallowayEliana,Thanks for the recent follow @TheMelaninMan @AndyKingNYC @AfroArchaeology Happy to connect :) have a great Tuesday.,United States,English,2016-06-28T17:01:00,2016-06-28T17:01:00,1375.0000000000,826.0000000000,1618.0000000000,R,True
GallowayEliana,Meet Kim Williams of @inkspote. She created her entertainment company because she says Black… https://t.co/tF3l8fA6zt,United States,English,2016-06-28T17:01:00,2016-06-28T17:01:00,1375.0000000000,826.0000000000,1619.0000000000,R,True
GallowayEliana,This from @pewresearch is pretty striking. https://t.co/H8ONok6OlW,United States,English,2016-06-29T15:03:00,2016-06-29T15:05:00,1212.0000000000,839.0000000000,1622.0000000000,R,True
GallowayEliana,The ugly side of the Olympics hits Rio hard #Rio2016  https://t.co/K5t1a8yFhw,United States,English,2016-06-29T15:04:00,2016-06-29T15:04:00,1212.0000000000,839.0000000000,1625.0000000000,R,True
GallowayEliana,"If Trump did actually find Christ, he'd deport him.",United States,English,2016-06-29T15:04:00,2016-06-29T15:04:00,1212.0000000000,839.0000000000,1624.0000000000,R,True
GallowayEliana,"Damn, if some of you Blk Hillbots would defend the Blk community the way you defend her you wouldn't be arguing like she is your savior",United States,English,2016-06-29T15:04:00,2016-06-29T15:04:00,1212.0000000000,839.0000000000,1623.0000000000,R,True
GallowayEliana,It’s official! Labor Day became a federal holiday #OTD 1894 #ChronAm https://t.co/kP9iwC28Dx https://t.co/0WtrMEv01U,United States,English,2016-06-29T15:04:00,2016-06-29T15:04:00,1212.0000000000,839.0000000000,1627.0000000000,R,True
GallowayEliana,"I just called an they can't give me no info on her , they placed me on hold and told me to call back  #BlackSkinIsNotACrime",United States,English,2016-07-07T12:33:00,2016-07-07T12:33:00,778.0000000000,836.0000000000,1627.0000000000,,False
GallowayEliana,"#BlackSkinIsNotACrime #BlackLivesMatter❤ yes, a Black Woman, a Mama, who needs us...our help #BlackSkinIsNotACrime ? I",United States,English,2016-07-07T12:42:00,2016-07-07T12:42:00,778.0000000000,836.0000000000,1628.0000000000,,False
GallowayEliana,Yooo wtf #BlackSkinIsNotACrime #PhilandoCastile,United States,English,2016-07-07T12:53:00,2016-07-07T12:53:00,778.0000000000,836.0000000000,1630.0000000000,,False
GallowayEliana,WHY IS SHE IN CUSTODY SHE DIDN'T EVEN DO ANYTHING. THIS IS SO FUCKED UP #BlackSkinIsNotACrime,United States,English,2016-07-07T12:54:00,2016-07-07T12:54:00,778.0000000000,836.0000000000,1631.0000000000,,False
GallowayEliana,"Man, she had to hold all her emotions so he won't shoot her as well. He probably would have shot the baby too. Sick  #BlackSkinIsNotACrime",United States,English,2016-07-07T13:59:00,2016-07-07T13:59:00,778.0000000000,836.0000000000,1632.0000000000,,False
GallowayEliana,"Lavish Reynolds is a hero for having the bravery, calmness and wherewithal to film that video. #BlackSkinIsNotACrime #FalcolnHeightsShooting",United States,English,2016-07-07T14:03:00,2016-07-07T14:03:00,778.0000000000,836.0000000000,1633.0000000000,,False
GallowayEliana,"This hand here...my skin, it's nothing but love. #BlackSkinIsNotACrime https://t.co/iw0x6wgRln",United States,English,2016-07-07T18:25:00,2016-07-07T18:25:00,778.0000000000,837.0000000000,1634.0000000000,R,True
GallowayEliana,"God we are nothing without you! Show us how to fight, lead us. #Victory #BlackLivesMatter",United States,English,2016-07-11T15:42:00,2016-07-11T15:42:00,777.0000000000,829.0000000000,1637.0000000000,,False
GallowayEliana,"'@Rapmonster @101_Promo @TimBestbudz @Energy53Alan @TailfeathersPDX @proambition if he talk like that in bedroom, uuh!  h8 sex!!! afta dat'",United States,English,2016-07-18T16:13:00,2016-07-18T16:14:00,877.0000000000,836.0000000000,1639.0000000000,R,True
GallowayEliana,Only 24hrs in & this surfaces-- Hillary v Pence. Priceless.  https://t.co/dTpNX5VXLU,United States,English,2016-07-18T16:13:00,2016-07-18T16:14:00,877.0000000000,836.0000000000,1638.0000000000,Q,True
GallowayEliana,Rice found not guilty of all charges in Freddie Gray case https://t.co/55ifW8tgrr https://t.co/8tU3q8uzb0,United States,English,2016-07-18T16:14:00,2016-07-18T16:14:00,877.0000000000,836.0000000000,1643.0000000000,R,True
GallowayEliana,#NelsonMandela and America's Hypocrisy About Violence: https://t.co/RKtHJyhyf4 #MandelaDay https://t.co/Mlix4JRECQ,United States,English,2016-07-18T16:14:00,2016-07-18T16:14:00,877.0000000000,836.0000000000,1642.0000000000,R,True
GallowayEliana,'@3rdEyePluG his avi tells me all I need to know.....',United States,English,2016-07-18T16:14:00,2016-07-18T16:14:00,877.0000000000,836.0000000000,1640.0000000000,R,True
GallowayEliana,did she make it a gospel version? as we lay... our burdens at the feet of jesus?,United States,English,2016-07-18T16:14:00,2016-07-18T16:16:00,877.0000000000,836.0000000000,1641.0000000000,R,True
GallowayEliana,Did @BLACCHYNA's dad just spill the beans on the sex of her baby? https://t.co/TJPMq8wQNa https://t.co/ADi2j2I3tC,United States,English,2016-07-19T14:39:00,2016-07-19T14:39:00,878.0000000000,839.0000000000,1644.0000000000,R,True
GallowayEliana,Poll: Clinton just 12 points ahead of Trump in New York https://t.co/feFz9NzYRL https://t.co/K0GMZP2B87,United States,English,2016-07-19T14:39:00,2016-07-19T14:40:00,878.0000000000,839.0000000000,1645.0000000000,R,True
GallowayEliana,When is it the people's turn to see some return on our tax dollars instead of all the benefits going to the 1%? https://t.co/8G3BeZhEOb,United States,English,2016-07-19T14:39:00,2016-07-19T14:39:00,878.0000000000,839.0000000000,1646.0000000000,R,True
GallowayEliana,When I heard Melania trump speech  https://t.co/vUkvxHumna,United States,English,2016-07-19T14:39:00,2016-07-19T14:40:00,878.0000000000,839.0000000000,1648.0000000000,R,True
GallowayEliana,India's Flipkart prepares for war with rival Amazon https://t.co/4zQpryMA2D https://t.co/cDYJq38wip,United States,English,2016-07-19T14:39:00,2016-07-19T14:40:00,878.0000000000,839.0000000000,1647.0000000000,R,True
GallowayEliana,#ShouldersOfGiants Shout out to the original #Blaxit advocate  Marcus Garvey #Blackonomics https://t.co/rS8Z2DV6ow https://t.co/tbonYHwXEy,United States,English,2016-07-19T14:40:00,2016-07-19T14:40:00,878.0000000000,839.0000000000,1651.0000000000,R,True
GallowayEliana,#AllLivesDidn'tMatterThen https://t.co/5oWlHu2psn,United States,English,2016-07-19T14:40:00,2016-07-19T14:40:00,878.0000000000,839.0000000000,1652.0000000000,Q,True
GallowayEliana,GOP Ignorance on Parade: Brutal Benghazi demolition by @mtomasky @thedailybeast —> https://t.co/25beMBmcTH,United States,English,2016-07-19T14:40:00,2016-07-19T14:40:00,878.0000000000,839.0000000000,1650.0000000000,R,True
GallowayEliana,'@ArmAndProtect @BlackMoses2015 white liberals are very dangerous...Steve Biko wrote about them in his writings 'I write what I like'',United States,English,2016-07-19T14:40:00,2016-07-19T14:41:00,878.0000000000,839.0000000000,1655.0000000000,R,True
GallowayEliana,"#CollateralDamage An American was asked, ""What do you feel when your pistol has fired and taken another innocent life?"" ""Recoil"" #NRA #2A",United States,English,2016-07-19T14:40:00,2016-07-19T14:40:00,878.0000000000,839.0000000000,1653.0000000000,R,True
GallowayEliana,Too few women at the top means we are all losing out \| Jane Dudman https://t.co/5pfxgoVhZg,United States,English,2016-07-19T14:40:00,2016-07-19T14:40:00,878.0000000000,839.0000000000,1654.0000000000,R,True
GallowayEliana,When I was getting death threats? I had a bunch of white feminists that wanted me to make speeches. It was the hood that protected me,United States,English,2016-07-22T15:46:00,2016-07-22T15:46:00,1019.0000000000,858.0000000000,1656.0000000000,R,True
GallowayEliana,Volvo plans a self-driving auto by 2021 https://t.co/Y5U4bdLY1r https://t.co/P84sh5XNUF,United States,English,2016-07-22T15:46:00,2016-07-22T15:46:00,1019.0000000000,858.0000000000,1659.0000000000,R,True
GallowayEliana,Police Dashcam Video Shows Violent Arrest Of Austin School Teacher Breai... https://t.co/89nR9xQmGF via @YouTube,United States,English,2016-07-22T15:46:00,2016-07-22T15:46:00,1019.0000000000,858.0000000000,1661.0000000000,R,True
GallowayEliana,"James Baldwin on ""American Dream"" #BlackLivesMatter  https://t.co/qhGxhpDfrR",United States,English,2016-07-22T15:46:00,2016-07-22T15:46:00,1019.0000000000,858.0000000000,1658.0000000000,R,True
GallowayEliana,JUST IN: Ex-KKK leader David Duke says he plans to run for U.S. Senate https://t.co/s2IxHm5ao0,United States,English,2016-07-22T15:46:00,2016-07-22T15:46:00,1019.0000000000,858.0000000000,1660.0000000000,R,True
GallowayEliana,"Your hood cousin that can't code switch might get on your nerves but she'll show up if shit pops off so...look to her, not white feminism",United States,English,2016-07-22T15:46:00,2016-07-22T15:46:00,1019.0000000000,858.0000000000,1657.0000000000,R,True
GallowayEliana,"No, She's not upset, She's just very confident in this conversation and her voice matches her enthusiasm. #LoudBlackGirls",United States,English,2016-07-23T15:25:00,2016-07-23T15:25:00,825.0000000000,863.0000000000,1662.0000000000,R,True
GallowayEliana,I was thinking about going to the track & doing a few laps.  But I didn't want to end up having to run for my life ����   �,United States,English,2016-07-23T15:25:00,2016-07-23T15:26:00,825.0000000000,863.0000000000,1663.0000000000,R,True
GallowayEliana,Steamy then stormy. Hot & humid again. Severe T-Storms possible late. High 90. Dew point 76. Wind SE 5-10 mph. #mnwx https://t.co/CL9QqMOxTM,United States,English,2016-07-23T15:26:00,2016-07-23T15:26:00,824.0000000000,863.0000000000,1666.0000000000,R,True
GallowayEliana,The #LukeCage trailer dropped and it's unapologetically black https://t.co/Dd6tSTpZ45 https://t.co/Zf3tSKtHKy,United States,English,2016-07-23T15:26:00,2016-07-23T15:26:00,824.0000000000,863.0000000000,1665.0000000000,R,True
GallowayEliana,Vulnerable GOP senators praise Kaine https://t.co/tLDBHMgFCg https://t.co/BCtQI3QtDj,United States,English,2016-07-23T15:26:00,2016-07-23T15:26:00,825.0000000000,863.0000000000,1664.0000000000,R,True
GallowayEliana,A remarkable piece.   Ghazala Khan: Trump criticized my silence. He knows nothing about true sacrifice. https://t.co/ZdDcCnIoLl,United States,English,2016-07-31T16:12:00,2016-07-31T16:12:00,1005.0000000000,891.0000000000,1670.0000000000,R,True
GallowayEliana,"As Israel Prospers, Obama Set to Give Billions More in Aid While Netanyahu Demands More  https://t.co/dLkKXysIUO",United States,English,2016-07-31T16:12:00,2016-07-31T16:13:00,1005.0000000000,891.0000000000,1674.0000000000,R,True
GallowayEliana,Dallas Detroit Boston There's still time!! Pick a location and we will promote your #MLKSitIn,United States,English,2016-07-31T16:12:00,2016-07-31T16:12:00,1005.0000000000,891.0000000000,1667.0000000000,R,True
GallowayEliana,Beenie Man Misses OVO Fest After Contracting The Zika Virus: The reggae artist was denied a Canadian Visa due... https://t.co/mnyYCRAc5J,United States,English,2016-07-31T16:12:00,2016-07-31T16:12:00,1005.0000000000,891.0000000000,1669.0000000000,R,True
GallowayEliana,Kentucky jail sends black woman to court with no pants. This judge won't have it. https://t.co/pyL5PnKXoR # via @blackvoices,United States,English,2016-07-31T16:12:00,2016-07-31T16:12:00,1005.0000000000,891.0000000000,1671.0000000000,R,True
GallowayEliana,Awesome dialogue on #Bet #Unconventional:BET*@theDNC with @MHarrisPerry @marclamonthill .....they are trying2cover it all! Tune in Now!,United States,English,2016-07-31T16:12:00,2016-07-31T16:12:00,1005.0000000000,891.0000000000,1668.0000000000,R,True
GallowayEliana,"""Who taught you to hate yourself?""  - Malcolm X",United States,English,2016-07-31T16:12:00,2016-07-31T16:13:00,1005.0000000000,891.0000000000,1673.0000000000,R,True
GallowayEliana,"It's as simple as saying ""Hey Detroit, let's meet at ______"" and people will join you. Trust! #MLKSitIN",United States,English,2016-07-31T16:12:00,2016-07-31T16:12:00,1005.0000000000,891.0000000000,1672.0000000000,R,True
GallowayEliana,Trump: Mitt Romney lost because he released his tax returns... https://t.co/VI9OlvT3jb,United States,English,2016-07-31T16:13:00,2016-07-31T16:13:00,1005.0000000000,891.0000000000,1676.0000000000,R,True
GallowayEliana,Some things I've been trying to do (I'm not perfect at them) to increase accuracy on this:,United States,English,2016-07-31T16:13:00,2016-07-31T16:14:00,1005.0000000000,891.0000000000,1684.0000000000,R,True
GallowayEliana,"4. Being vigilant about words ""activist"" ""organizer"" ""founder"" &""leader"" - have meanings that aren't all same thing/applicable to everyone",United States,English,2016-07-31T16:13:00,2016-07-31T16:13:00,1005.0000000000,891.0000000000,1682.0000000000,R,True
GallowayEliana,"2. Including a graph explaining distinction between BLM org & national movement  3. Avoiding calling anyone ""BLM leader"" which is confusing",United States,English,2016-07-31T16:13:00,2016-07-31T16:13:00,1005.0000000000,891.0000000000,1683.0000000000,R,True
GallowayEliana,'@djolder @thinkprogress companies hate it but they have to start PAYING people who WORK(ED)for them to be honest SAFELY',United States,English,2016-07-31T16:13:00,2016-07-31T16:13:00,1005.0000000000,891.0000000000,1678.0000000000,R,True
GallowayEliana,Dems do the same. Sex-shaming of women Body-shaming of women Those are bipartisan efforts https://t.co/QLdpRRpbAu,United States,English,2016-07-31T16:13:00,2016-07-31T16:13:00,1005.0000000000,891.0000000000,1675.0000000000,Q,True
GallowayEliana,'@djolder @thinkprogress Facebook doesn't care enough or the existing solutions aren't working  or people don't think it's worth it',United States,English,2016-07-31T16:13:00,2016-07-31T16:13:00,1005.0000000000,891.0000000000,1679.0000000000,R,True
GallowayEliana,"'@djolder @thinkprogress This is why I want people to not talk about diversity , because it becomes a referendum on ""reasons""  not conditions'",United States,English,2016-07-31T16:13:00,2016-07-31T16:13:00,1005.0000000000,891.0000000000,1680.0000000000,R,True
GallowayEliana,"Dr. King's ""I Have a Dream Speech"" was originally known as ""Normalcy No More"" #MLKSitIn",United States,English,2016-07-31T16:13:00,2016-07-31T16:13:00,1005.0000000000,891.0000000000,1677.0000000000,R,True
GallowayEliana,"April's Twitter Handle is @April_Davis . If you know someone who knew her, please let them know she passed. https://t.co/ocoGeWE59S",United States,English,2016-07-31T16:13:00,2016-07-31T16:14:00,1005.0000000000,891.0000000000,1681.0000000000,R,True
GallowayEliana,"1. Not every black person is ""black lives matter"" 2. Not every protester is BLM 3. Not everyone claiming BLM linked to org/broader movement",United States,English,2016-07-31T16:14:00,2016-07-31T16:14:00,1005.0000000000,891.0000000000,1690.0000000000,R,True
GallowayEliana,Unable to attend an #MLKSitIn? Join us at 4PM for a nationwide reading. Download excerpt: https://t.co/QtDCMdXkLR https://t.co/SyDLXRcWTR,United States,English,2016-07-31T16:14:00,2016-07-31T16:14:00,1005.0000000000,891.0000000000,1687.0000000000,R,True
GallowayEliana,"At least half dozen ""black lives matter"" orgs completely unaffiliated w/(sometimes opposed to) national org/network/movement's stated goals",United States,English,2016-07-31T16:14:00,2016-07-31T16:14:00,1005.0000000000,891.0000000000,1689.0000000000,R,True
GallowayEliana,Ghazala Khan: Trump criticized my silence. He knows nothing about true sacrifice. https://t.co/Lg9lQhzC22,United States,English,2016-07-31T16:14:00,2016-07-31T16:14:00,1005.0000000000,891.0000000000,1686.0000000000,R,True
