author_id,content,region,language,publish_date,harvested_date,following,followers,updates,post_type,retweet
GallowayEliana,"When it is time to die, let us not discover that we never lived. – Henry David Thoreau",United States,English,2015-01-07T08:41:00,2015-01-07T08:42:00,90.0000000000,85.0000000000,7.0000000000,,False
GallowayEliana,"First, you were all like whoa, and then we were like whoa, and then you were like whoa. –Crush (Finding Nemo)",United States,English,2015-01-07T08:41:00,2015-01-07T08:42:00,90.0000000000,85.0000000000,6.0000000000,,False
GallowayEliana,Hardest choice ever.,United States,English,2015-01-07T08:42:00,2015-01-07T08:42:00,90.0000000000,85.0000000000,11.0000000000,,False
GallowayEliana,"It came to me that reform should begin at home, and since that day I have not had time to remake the world.",United States,English,2015-01-07T08:42:00,2015-01-07T08:42:00,90.0000000000,85.0000000000,10.0000000000,,False
GallowayEliana,Power over others is weakness disguised as strength.,United States,English,2015-01-07T08:42:00,2015-01-07T08:43:00,90.0000000000,86.0000000000,13.0000000000,,False
GallowayEliana,Everyone here has the sense that right now is one of those moments when we are influencing the future.  – Steve Jobs,United States,English,2015-01-07T08:42:00,2015-01-07T08:42:00,90.0000000000,85.0000000000,12.0000000000,,False
GallowayEliana,In the end you should always do the right thing even if it's hard.  – Nicholas Sparks,United States,English,2015-01-07T08:42:00,2015-01-07T08:42:00,90.0000000000,85.0000000000,9.0000000000,,False
GallowayEliana,A bank is a place where they lend you an umbrella in fair weather and ask for it back when it begins to rain.,United States,English,2015-01-07T08:43:00,2015-01-07T08:44:00,90.0000000000,86.0000000000,16.0000000000,,False
GallowayEliana,"Happiness is not having what you want, it is wanting what you have.  – Sheryl Crow",United States,English,2015-01-07T08:43:00,2015-01-07T08:43:00,90.0000000000,86.0000000000,14.0000000000,,False
GallowayEliana,"It's sweet when someone knows every single detail about you. Not because you constantly remind them, but because they pay attention.",United States,English,2015-01-07T08:43:00,2015-01-07T08:43:00,90.0000000000,86.0000000000,15.0000000000,,False
GallowayEliana,The world is kinda cold and the rhythm is my blanket.  – Q-Tip,United States,English,2015-01-07T08:44:00,2015-01-07T08:44:00,90.0000000000,86.0000000000,20.0000000000,,False
GallowayEliana,"The motto goes: Sex, Drugs and Rock ‘n’ Roll. I prefer: Love, Hugs and Hip-Hop Soul.  – MF Doom",United States,English,2015-01-07T08:44:00,2015-01-07T08:44:00,90.0000000000,86.0000000000,18.0000000000,,False
GallowayEliana,Overthinking killed my happiness. Insecurities killed my self esteem. Lies killed my trust,United States,English,2015-01-07T08:44:00,2015-01-07T08:44:00,90.0000000000,86.0000000000,17.0000000000,,False
GallowayEliana,Frustration is dissatisfaction due to unresolved problems or unfulfilled needs. #iHQ,United States,English,2015-01-07T08:44:00,2015-01-07T08:44:00,90.0000000000,86.0000000000,19.0000000000,,False
GallowayEliana,"It's not the men in my life that count, it's the life in my men. – Mae West",United States,English,2015-01-07T08:45:00,2015-01-07T08:45:00,90.0000000000,86.0000000000,24.0000000000,,False
GallowayEliana,#Noah #Methuselah: My father told me... #movie #quote #quotes #AnthonyHopkins #DarrenAronofsky,United States,English,2015-01-07T08:45:00,2015-01-07T08:45:00,90.0000000000,86.0000000000,22.0000000000,,False
GallowayEliana,drinking is an emotional thing...,United States,English,2015-01-07T08:45:00,2015-01-07T08:45:00,90.0000000000,86.0000000000,26.0000000000,,False
GallowayEliana,And the tears come streaming down your face when you lose something you can't replace,United States,English,2015-01-07T08:45:00,2015-01-07T08:45:00,90.0000000000,86.0000000000,23.0000000000,,False
GallowayEliana,Nothing of me is original. I am the combined effort of everyone I've ever known.  – Chuck Palahniuk,United States,English,2015-01-07T08:47:00,2015-01-07T08:47:00,90.0000000000,86.0000000000,28.0000000000,,False
GallowayEliana,I won't be a rock star. I will be a legend.,United States,English,2015-01-07T08:47:00,2015-01-07T08:48:00,90.0000000000,86.0000000000,30.0000000000,,False
GallowayEliana,No is always a door-closing word,United States,English,2015-01-07T08:50:00,2015-01-07T08:50:00,90.0000000000,86.0000000000,33.0000000000,,False
GallowayEliana,"Our generation is f*cked up when it comes to trust, loyalty, and relationships.",United States,English,2015-01-07T08:50:00,2015-01-07T08:50:00,90.0000000000,86.0000000000,31.0000000000,,False
GallowayEliana,"Results are gained by exploiting opportunities, not by solving problems. – Peter Drucker",United States,English,2015-01-07T08:50:00,2015-01-07T08:50:00,90.0000000000,86.0000000000,35.0000000000,,False
GallowayEliana,"#MarilynMonroe Imperfection is #beauty, madness is,,. #quote #quotes #magicalquote",United States,English,2015-01-07T08:50:00,2015-01-07T08:50:00,90.0000000000,86.0000000000,34.0000000000,,False
GallowayEliana,Most of our problems are because we act without thinking or we keep thinking without acting. #truth,United States,English,2015-01-07T08:50:00,2015-01-07T08:51:00,90.0000000000,86.0000000000,36.0000000000,,False
GallowayEliana,It's fine to celebrate success but it is more important to heed the lessons of failure.,United States,English,2015-01-07T08:51:00,2015-01-07T08:51:00,90.0000000000,86.0000000000,37.0000000000,,False
GallowayEliana,Every time I look at you I get a fierce desire to be lonesome.,United States,English,2015-01-07T08:51:00,2015-01-07T08:51:00,90.0000000000,86.0000000000,38.0000000000,,False
GallowayEliana,Your value doesn't decrease based on someone's inability to see your worth.,United States,English,2015-01-07T08:52:00,2015-01-07T08:52:00,90.0000000000,86.0000000000,40.0000000000,,False
GallowayEliana,"When the power of love overcomes the love of power, the world will know peace.",United States,English,2015-01-07T08:53:00,2015-01-07T08:53:00,90.0000000000,86.0000000000,43.0000000000,,False
GallowayEliana,"A man, though wise, should never be ashamed of learning more, and must unbend his mind.  – Sophocles",United States,English,2015-01-07T08:54:00,2015-01-07T08:54:00,90.0000000000,86.0000000000,44.0000000000,,False
GallowayEliana,"Life is not measured by the number of breaths we take, but by the moments that take our breath away.",United States,English,2015-01-07T08:54:00,2015-01-07T08:54:00,90.0000000000,86.0000000000,44.0000000000,,False
GallowayEliana,I hate those friendships that just end for no reason you just stop talking.,United States,English,2015-01-07T08:55:00,2015-01-07T08:55:00,90.0000000000,86.0000000000,49.0000000000,,False
GallowayEliana,"Every time I write these words they become a taboo, Making sure my punctuation curve, every letter here’s true, -Kendrick Lamar",United States,English,2015-01-07T08:55:00,2015-01-07T08:55:00,90.0000000000,86.0000000000,47.0000000000,,False
GallowayEliana,"Two bottles of Bud, two speakers in the trunk, two people in love, just bumpin' the night. #FloridaGeorgiaLine",United States,English,2015-01-07T08:55:00,2015-01-07T08:55:00,90.0000000000,86.0000000000,48.0000000000,,False
GallowayEliana,"If you don't have confidence, you'll always find a way not to win. -Carl Lewis",United States,English,2015-01-07T08:55:00,2015-01-07T08:55:00,90.0000000000,86.0000000000,46.0000000000,,False
GallowayEliana,"When you concern yourself with others, you naturally develop a sense of self-confidence. To help others takes courage and inner strength.",United States,English,2015-01-07T08:56:00,2015-01-07T08:56:00,90.0000000000,86.0000000000,52.0000000000,,False
GallowayEliana,#JodorowskysDune #AlejandroJodorowsky: Artists need to be free! #movie #moviequotes #quote,United States,English,2015-01-07T08:56:00,2015-01-07T08:56:00,90.0000000000,86.0000000000,51.0000000000,,False
GallowayEliana,And my body can't stop moving to the sound,United States,English,2015-01-07T08:56:00,2015-01-07T08:56:00,90.0000000000,86.0000000000,50.0000000000,,False
GallowayEliana,http://t.co/PckOcleDsr celebrities with no make up,United States,English,2015-01-10T17:31:00,2015-01-10T17:31:00,280.0000000000,103.0000000000,55.0000000000,,False
GallowayEliana,My daughter will be a mini me on everything,United States,English,2015-01-10T17:31:00,2015-01-10T17:31:00,280.0000000000,103.0000000000,54.0000000000,,False
GallowayEliana,http://t.co/RQ6Z9LaG9X Kim's ice bucket challenge,United States,English,2015-01-10T17:32:00,2015-01-10T17:32:00,280.0000000000,103.0000000000,55.0000000000,,False
GallowayEliana,My dog never acts like that and I like that. But this video is funny http://t.co/n23WXFB7Pn,United States,English,2015-01-10T17:33:00,2015-01-10T17:33:00,280.0000000000,103.0000000000,61.0000000000,,False
GallowayEliana,The best video ever! http://t.co/hcgPAxPRgm,United States,English,2015-01-10T17:34:00,2015-01-10T17:34:00,280.0000000000,103.0000000000,65.0000000000,,False
GallowayEliana,http://t.co/Q19q5Cik1C parrot and his laser pointer,United States,English,2015-01-10T17:34:00,2015-01-10T17:34:00,280.0000000000,103.0000000000,62.0000000000,,False
GallowayEliana,Ideas not coupled with action never become bigger than the brain cells they occupied.,United States,English,2015-01-10T17:34:00,2015-01-10T17:34:00,280.0000000000,103.0000000000,64.0000000000,,False
GallowayEliana,"#MarcusTulliusCicero: If you have a garden and a library, you have everything you need. #quote",United States,English,2015-01-10T17:34:00,2015-01-10T17:34:00,280.0000000000,103.0000000000,66.0000000000,,False
GallowayEliana,"All black Maybach but I'm not a racist, Inside's whiter than Katy Perry's face is – Jay Z",United States,English,2015-01-10T17:34:00,2015-01-10T17:34:00,280.0000000000,103.0000000000,63.0000000000,,False
GallowayEliana,Kim Kardashian looked so different before implants http://t.co/VFctVNIVKw,United States,English,2015-01-10T17:35:00,2015-01-10T17:35:00,280.0000000000,103.0000000000,67.0000000000,,False
GallowayEliana,"shake shake, shake it off! http://t.co/W0Rwp89DQh shake shake, shake it off!",United States,English,2015-01-10T17:35:00,2015-01-10T17:35:00,280.0000000000,103.0000000000,68.0000000000,,False
GallowayEliana,http://t.co/p1BFdzPTTQ Kim akrdashian's implants,United States,English,2015-01-10T17:35:00,2015-01-10T17:35:00,280.0000000000,103.0000000000,70.0000000000,,False
GallowayEliana,"Happiness is not a station you arrive at, but a manner of travelling.",United States,English,2015-01-10T17:36:00,2015-01-10T17:36:00,280.0000000000,103.0000000000,73.0000000000,,False
GallowayEliana,Music should be your escape.,United States,English,2015-01-10T17:36:00,2015-01-10T17:36:00,280.0000000000,103.0000000000,72.0000000000,,False
GallowayEliana,Die Antwoord are simply the best! http://t.co/PTufOYSPaj,United States,English,2015-01-10T17:37:00,2015-01-10T17:37:00,280.0000000000,103.0000000000,77.0000000000,,False
GallowayEliana,Words are the voice of the heart.,United States,English,2015-01-10T17:37:00,2015-01-10T17:37:00,280.0000000000,103.0000000000,74.0000000000,,False
GallowayEliana,1d is my life http://t.co/PaOQNM0QQB,United States,English,2015-01-10T17:37:00,2015-01-10T17:37:00,280.0000000000,103.0000000000,74.0000000000,,False
GallowayEliana,"When you really care about someone, their happiness matters more than yours.",United States,English,2015-01-10T17:39:00,2015-01-10T17:39:00,280.0000000000,103.0000000000,79.0000000000,,False
GallowayEliana,Christmas list:  – killer eyebrows  – a boyfriend  – anything edible really  – selfie skills,United States,English,2015-01-10T17:40:00,2015-01-10T17:40:00,280.0000000000,103.0000000000,80.0000000000,,False
GallowayEliana,Choose positivity today.,United States,English,2015-01-10T17:41:00,2015-01-10T17:41:00,280.0000000000,103.0000000000,81.0000000000,,False
GallowayEliana,Everything must be made as simple as possible. But not simpler,United States,English,2015-01-10T17:41:00,2015-01-10T17:41:00,280.0000000000,103.0000000000,83.0000000000,,False
GallowayEliana,"You need to make a commitment, and once you make it, then life will give you some answers.",United States,English,2015-01-10T17:43:00,2015-01-10T17:43:00,280.0000000000,103.0000000000,85.0000000000,,False
GallowayEliana,http://t.co/PckOcleDsr What Celebrities REALLY Look Like!,United States,English,2015-01-15T08:40:00,2015-01-15T08:41:00,465.0000000000,138.0000000000,87.0000000000,,False
GallowayEliana,mission possible!!! lol https://t.co/7hYDRab8Pz,United States,English,2015-01-15T08:41:00,2015-01-15T08:41:00,465.0000000000,138.0000000000,88.0000000000,,False
GallowayEliana,Study the past if you would divine the future. – Confucius,United States,English,2015-01-15T08:41:00,2015-01-15T08:41:00,465.0000000000,138.0000000000,88.0000000000,,False
GallowayEliana,I often tease young people about their concern for how they look,United States,English,2015-01-15T08:41:00,2015-01-15T08:41:00,465.0000000000,138.0000000000,89.0000000000,,False
GallowayEliana,No one can touch your dreams. Your dreams are real.,United States,English,2015-01-15T08:41:00,2015-01-15T08:42:00,465.0000000000,138.0000000000,92.0000000000,,False
GallowayEliana,One Artist Can Make Women In NYC Completely Disappear. See How She Does It,United States,English,2015-01-15T08:41:00,2015-01-15T08:41:00,465.0000000000,138.0000000000,93.0000000000,,False
GallowayEliana,http://t.co/el2nOLSouz cats giving high fives!!!!!,United States,English,2015-01-15T08:41:00,2015-01-15T08:41:00,465.0000000000,138.0000000000,91.0000000000,,False
GallowayEliana,it makes me dance every time I listen to it http://t.co/22OPc1eTXn it makes me dance every time I listen to it,United States,English,2015-01-15T08:42:00,2015-01-15T08:42:00,465.0000000000,138.0000000000,95.0000000000,,False
GallowayEliana,coffee junker https://t.co/UyAlJf97IM,United States,Norwegian,2015-01-15T08:43:00,2015-01-15T08:43:00,465.0000000000,138.0000000000,98.0000000000,,False
GallowayEliana,#WHOISMUHAMMAD ? A HUMAN WHO TAUGHT US HOW TO FORGIVE AND EMBRACE EVEN THOSE WHO HURT US LIKE BEASTS #CHARLIEHEBDO #OSCARFORMUHAMMAD,United States,English,2015-01-16T09:59:00,2015-01-16T09:59:00,467.0000000000,140.0000000000,103.0000000000,,False
GallowayEliana,WHAT PROPHET MUHAMMAD (PBUH) SAID ABOUT RACISM... #OSCARFORMUHAMMAD (PBUH) #OSCARSSOWHITE #WHOISMUHAMMAD,United States,English,2015-01-16T09:59:00,2015-01-16T09:59:00,467.0000000000,140.0000000000,102.0000000000,,False
GallowayEliana,#OSCARFORMUHAMMAD THE ONLY STAR THAT IS NOT WRITTEN ON THE FLOOR IN HOLLYWOOD #OSCARSSOWHITE,United States,English,2015-01-16T10:00:00,2015-01-16T10:00:00,467.0000000000,140.0000000000,104.0000000000,,False
GallowayEliana,"NO RELIGION, LAW OR MORALITY ALLOWS SUCH AN INSULTING ATTITUDE TOWARDS FOLLOWERS OF A FAITH. #OSCARFORMUHAMMAD",United States,English,2015-01-16T10:02:00,2015-01-16T10:03:00,467.0000000000,140.0000000000,105.0000000000,,False
GallowayEliana,"#OSCARSSOWHITE ALLAH SENT QURAN FOR OUR SELF, NOT FOR OUR SHELVES. #OSCARFORMUHAMMAD",United States,English,2015-01-16T10:04:00,2015-01-16T10:04:00,467.0000000000,140.0000000000,109.0000000000,,False
GallowayEliana,THE MESSENGER OF LOVE GAVE RIGHTS TO WOMEN PROMOTED EDUCATION AND WELFARE #OSCARFORMUHAMMAD,United States,English,2015-01-16T10:04:00,2015-01-16T10:04:00,467.0000000000,140.0000000000,110.0000000000,,False
GallowayEliana,ISIS is Obama`s project don`t you get it??  #PPLvsISIS,United States,English,2015-02-06T17:18:00,2015-02-06T17:19:00,457.0000000000,141.0000000000,114.0000000000,,False
GallowayEliana,ISIS gets money from oil export! Just stop buying it and ISIS will fall soon #PPLvsISIS,United States,English,2015-02-06T17:19:00,2015-02-06T17:20:00,457.0000000000,141.0000000000,115.0000000000,,False
GallowayEliana,We need more competent government to defeat ISIS  #PPLvsISIS,United States,English,2015-02-06T17:20:00,2015-02-06T17:20:00,457.0000000000,141.0000000000,117.0000000000,,False
GallowayEliana,Obama American hostages #PPLvsISIS,United States,English,2015-02-06T17:20:00,2015-02-06T17:20:00,457.0000000000,141.0000000000,115.0000000000,,False
GallowayEliana,If your heart filled with faith then you can't fear,United States,English,2015-02-08T15:44:00,2015-02-08T15:44:00,456.0000000000,142.0000000000,118.0000000000,,False
GallowayEliana,He just needs his bed back! Cat is a dick http://t.co/UhgdOorlZj,United States,English,2015-02-08T15:44:00,2015-02-08T15:45:00,456.0000000000,142.0000000000,119.0000000000,,False
GallowayEliana,"Don't much good come from me, but my music is a gift given from God so I'm gonna use it.  – 50 Cent",United States,English,2015-02-08T15:45:00,2015-02-08T15:45:00,456.0000000000,142.0000000000,120.0000000000,,False
GallowayEliana,"We need your support, please get and rate our Quotes app:",United States,English,2015-02-08T15:45:00,2015-02-08T15:45:00,456.0000000000,142.0000000000,121.0000000000,,False
GallowayEliana,"Don't believe in love in first sight, i believe in love in first uuh  – Wale",United States,English,2015-02-08T15:45:00,2015-02-15T01:59:00,456.0000000000,142.0000000000,121.0000000000,,False
GallowayEliana,http://t.co/xy1hWdzkAZ fat people need to work out and not sing songs,United States,English,2015-02-08T15:46:00,2015-02-08T15:46:00,456.0000000000,142.0000000000,123.0000000000,,False
GallowayEliana,cats do wiggle http://t.co/BiLYfSfagL cats do wiggle,United States,Catalan,2015-02-08T15:48:00,2015-02-08T15:49:00,456.0000000000,142.0000000000,130.0000000000,,False
GallowayEliana,I have decided to stick to love...Hate is too great a burden to bear,United States,English,2015-02-08T15:48:00,2015-02-08T15:48:00,456.0000000000,142.0000000000,125.0000000000,,False
GallowayEliana,Mr Strong Teeth lol http://t.co/vspx8VACyV,United States,Arabic,2015-02-08T15:48:00,2015-02-08T15:48:00,456.0000000000,142.0000000000,127.0000000000,,False
GallowayEliana,Kim Kardashian Before the Fame http://t.co/LvhHUMjWP1 Kim Kardashian Before the Fame,United States,English,2015-02-08T15:48:00,2015-02-08T15:48:00,456.0000000000,142.0000000000,128.0000000000,,False
GallowayEliana,"Me without you is like a sneaker without laces, a Geek without braces, andasentencewithoutspaces.",United States,English,2015-02-08T15:48:00,2015-02-08T15:48:00,456.0000000000,142.0000000000,126.0000000000,,False
GallowayEliana,"I know my heart will never be the same, but I'm telling myself I'll be okay even on my weakest days.",United States,English,2015-02-08T15:50:00,2015-02-08T15:50:00,456.0000000000,142.0000000000,131.0000000000,,False
GallowayEliana,I`m your slave!! https://t.co/9sg5YIQ7wP,United States,English,2015-02-08T15:51:00,2015-02-08T15:51:00,456.0000000000,142.0000000000,132.0000000000,,False
GallowayEliana,jade doesn`t love her! https://t.co/eV2PlxNBzD,United States,English,2015-02-08T15:53:00,2015-02-08T15:53:00,456.0000000000,142.0000000000,135.0000000000,,False
GallowayEliana,"Our doubts are traitors. And make us lose the good we oft might win, by fearing to attempt. – William Shakespeare, Measure for Measure",United States,English,2015-02-08T15:53:00,2015-02-08T15:53:00,456.0000000000,142.0000000000,135.0000000000,,False
GallowayEliana,"When one gets in bed with government, one must expect the diseases it spreads. – Ron Paul",United States,English,2015-02-08T15:55:00,2015-02-08T15:55:00,456.0000000000,142.0000000000,137.0000000000,,False
GallowayEliana,"In order to be irreplaceable, one must always be different.",United States,English,2015-02-08T15:55:00,2015-02-08T15:57:00,456.0000000000,142.0000000000,138.0000000000,,False
GallowayEliana,exciting http://t.co/nAJ0n5PUH6,United States,English,2015-02-08T15:57:00,2015-02-08T15:58:00,456.0000000000,142.0000000000,139.0000000000,,False
GallowayEliana,How to win her heart https://t.co/bPNmM9xbQS,United States,English,2015-02-08T15:58:00,2015-02-08T15:58:00,456.0000000000,142.0000000000,141.0000000000,,False
GallowayEliana,IN DA CLUB LOL https://t.co/wk63fSKl22,United States,English,2015-02-08T15:59:00,2015-02-08T15:59:00,456.0000000000,142.0000000000,142.0000000000,,False
GallowayEliana,GANGSTA https://t.co/wk63fSKl22,United States,English,2015-02-08T16:00:00,2015-02-08T16:00:00,456.0000000000,142.0000000000,143.0000000000,,False
GallowayEliana,http://t.co/PDTEAUE3X1 the piano guys are great!,United States,English,2015-02-08T16:00:00,2015-02-08T16:00:00,456.0000000000,142.0000000000,144.0000000000,,False
GallowayEliana,tasty art http://t.co/2IzCQrqp6t,United States,Estonian,2015-02-08T16:08:00,2015-02-08T16:08:00,456.0000000000,142.0000000000,147.0000000000,,False
GallowayEliana,cats be attention whores http://t.co/PtjIEAWGGb,United States,English,2015-02-08T16:11:00,2015-02-08T16:11:00,456.0000000000,142.0000000000,148.0000000000,,False
GallowayEliana,http://t.co/QcCTw1DPud can your kitten do it?,United States,English,2015-02-08T16:12:00,2015-02-08T16:12:00,456.0000000000,142.0000000000,150.0000000000,,False
GallowayEliana,"Difficulties in life are intended to make us better, not bitter. -Dan Reeves",United States,English,2015-02-08T16:13:00,2015-02-08T16:13:00,456.0000000000,142.0000000000,151.0000000000,,False
GallowayEliana,cant live without baby's laughing https://t.co/Pn09wPJGcj,United States,English,2015-02-08T16:14:00,2015-02-08T16:14:00,456.0000000000,142.0000000000,153.0000000000,,False
GallowayEliana,niiiiice https://t.co/WDlZ0Wv4RL,United States,English,2015-02-08T16:14:00,2015-02-08T16:14:00,456.0000000000,142.0000000000,152.0000000000,,False
GallowayEliana,Your hand fits in mine like its made just for me but bear this mind it was meant to be,United States,English,2015-02-08T16:15:00,2015-02-08T16:15:00,456.0000000000,142.0000000000,156.0000000000,,False
GallowayEliana,"Letting go isn't a one-time thing, it's something you have to do everyday, over and over again.",United States,English,2015-02-08T16:15:00,2015-02-08T16:15:00,456.0000000000,142.0000000000,155.0000000000,,False
GallowayEliana,It is not in the stars to hold our destiny but in ourselves.,United States,English,2015-02-08T16:16:00,2015-02-08T16:17:00,456.0000000000,142.0000000000,157.0000000000,,False
GallowayEliana,they're taking a shower!1!! http://t.co/EVG8Rz4lif,United States,English,2015-02-08T16:18:00,2015-02-08T16:18:00,456.0000000000,142.0000000000,159.0000000000,,False
GallowayEliana,The classics beautiful http://t.co/veoFqRmhaZ,United States,English,2015-02-08T16:18:00,2015-02-08T16:18:00,456.0000000000,142.0000000000,158.0000000000,,False
GallowayEliana,http://t.co/StxAW6iu4j delightful video!,United States,English,2015-02-08T16:20:00,2015-02-08T16:20:00,456.0000000000,142.0000000000,160.0000000000,,False
GallowayEliana,street dance lol https://t.co/MDC9zBFKtQ,United States,English,2015-02-08T16:21:00,2015-02-08T16:21:00,456.0000000000,142.0000000000,161.0000000000,,False
GallowayEliana,She's weak and she's tired of feeling like this,United States,English,2015-02-08T16:22:00,2015-02-08T16:22:00,456.0000000000,142.0000000000,162.0000000000,,False
GallowayEliana,I can tell by your charm and your arm but I'm looking for the one,United States,English,2015-02-08T16:23:00,2015-02-08T16:23:00,456.0000000000,141.0000000000,163.0000000000,,False
GallowayEliana,"Just as we teach about physical hygiene in the interest of good health, we now need to teach about mental or emotional hygiene too.",United States,English,2015-02-08T16:24:00,2015-02-08T16:24:00,456.0000000000,141.0000000000,164.0000000000,,False
GallowayEliana,http://t.co/5zgtksqGsz 5 Seconds Of Summer - Don't Stop,United States,English,2015-02-08T16:27:00,2015-02-08T16:27:00,456.0000000000,141.0000000000,165.0000000000,,False
GallowayEliana,http://t.co/PaOQNLa3sp one direction  is love,United States,English,2015-02-08T16:29:00,2015-02-08T16:29:00,456.0000000000,141.0000000000,169.0000000000,,False
GallowayEliana,« Believe that life is worth living and your belief will help create the fact. » William James,United States,English,2015-02-08T16:30:00,2015-02-08T16:31:00,456.0000000000,141.0000000000,170.0000000000,,False
GallowayEliana,oooh my God it is so sweet! http://t.co/3jqKEHwicX,United States,English,2015-02-08T16:32:00,2015-02-08T16:32:00,456.0000000000,141.0000000000,171.0000000000,,False
GallowayEliana,https://t.co/S338PXj3ms beautifull!,United States,Pushto,2015-02-08T16:32:00,2015-02-08T16:32:00,456.0000000000,141.0000000000,171.0000000000,,False
GallowayEliana,Stress is caused by giving a fuck.,United States,English,2015-02-08T16:33:00,2015-02-08T16:33:00,456.0000000000,141.0000000000,175.0000000000,,False
GallowayEliana,"Enjoy the little things in life, because one day you will look back, and realize they were the big things.",United States,English,2015-02-08T16:34:00,2015-02-08T16:34:00,456.0000000000,141.0000000000,176.0000000000,,False
GallowayEliana,"You drove me crazy every time we touched, but now I’m so broken that I can’t get up",United States,English,2015-02-08T16:36:00,2015-02-08T16:36:00,456.0000000000,141.0000000000,177.0000000000,,False
GallowayEliana,"I love it when you just don't care, I love it when you dance like there's nobody there.",United States,English,2015-02-08T16:38:00,2015-02-08T16:38:00,456.0000000000,141.0000000000,178.0000000000,,False
GallowayEliana,I think the most common cause of insomnia is simple,United States,English,2015-02-08T16:41:00,2015-02-08T16:41:00,456.0000000000,141.0000000000,181.0000000000,,False
GallowayEliana,"« Fame is but the breath of people, and that often unwholesome. » Rousseau",United States,English,2015-02-08T16:41:00,2015-02-08T16:41:00,456.0000000000,141.0000000000,180.0000000000,,False
GallowayEliana,"There is always a certain peace in being what one is, in being that completely.  – Ugo Betti",United States,English,2015-02-08T16:42:00,2015-02-08T16:42:00,456.0000000000,141.0000000000,182.0000000000,,False
