author_id,content,region,language,publish_date,harvested_date,following,followers,updates,post_type,retweet
GallowayEliana,RT @ForexRuss: #kyballion #knowthyself #blackhistory #BlackLivesMatter we started this  https://t.co/daMCpUD3T4 https://t.co/DH0lDhT2Mj,United States,English,2016-03-31T15:03:00,2016-03-31T15:03:00,682.0000000000,503.0000000000,1230.0000000000,,False
GallowayEliana,"RT @BLMBAYAREA: STATEMENT: Charges are dropped against the #BlackFriday14, but the war on Black lives continues. https://t.co/oJjQzeJTNB #B…",United States,English,2016-03-31T15:18:00,2016-03-31T15:18:00,682.0000000000,503.0000000000,1231.0000000000,,False
GallowayEliana,Get your Shirt and Support Us: https://t.co/QqL0pHFEkv #ICantBreathe #BlackLivesMatter #shirt https://t.co/z7c0cxO8u9,United States,English,2016-03-31T15:21:00,2016-03-31T15:21:00,682.0000000000,503.0000000000,1232.0000000000,,False
GallowayEliana,#STAYWOKE https://t.co/bqpSSu5eyi,United States,English,2016-03-31T15:31:00,2016-03-31T15:32:00,682.0000000000,503.0000000000,1233.0000000000,Q,True
GallowayEliana,#BlackLivesMatter  https://t.co/0pi2lGVBoF,United States,English,2016-03-31T15:42:00,2016-03-31T15:42:00,682.0000000000,503.0000000000,1235.0000000000,Q,True
GallowayEliana,Dedicate your Chanukah to #BlackLivesMatter. Sign up now on @wearevsgoliath to find out how. #menorah  https://t.co/ci70rJCQaR,United States,English,2016-03-31T15:42:00,2016-03-31T15:42:00,682.0000000000,503.0000000000,1234.0000000000,,False
GallowayEliana,Sacred Geometry at the halftime show #StayWoke,United States,English,2016-03-31T15:48:00,2016-03-31T15:48:00,682.0000000000,503.0000000000,1237.0000000000,,False
GallowayEliana,i take pictures w/ my hand on my hip ass nigga ...,United States,English,2016-04-01T14:05:00,2016-04-01T14:06:00,582.0000000000,500.0000000000,1241.0000000000,R,True
GallowayEliana,"""Can Cardi B Cook?"" who cares? Support Ayesha Curry's success without bringing another woman down because of hers. https://t.co/IfrwRTKCre",United States,English,2016-04-01T14:05:00,2016-04-01T14:05:00,582.0000000000,500.0000000000,1238.0000000000,R,True
GallowayEliana,Ford March U.S. auto sales rise 8 percent: DETROIT (Reuters) - Ford Motor Co said its U.S. aut... https://t.co/Lysi6wsUKV via @josephjett,United States,English,2016-04-01T14:05:00,2016-04-01T14:05:00,582.0000000000,500.0000000000,1240.0000000000,R,True
GallowayEliana,It's reverse for me! EVERYTIME I'd say WA they automatically assumed STATE. That's why we say DC! Lol https://t.co/7TwlivmlWe,United States,English,2016-04-01T14:06:00,2016-04-01T14:06:00,582.0000000000,500.0000000000,1243.0000000000,R,True
GallowayEliana,Since you hate bitches so much I got a couple of cute gay guys for you ..they cute with shmoney  https://t.co/lOvsncIgG1,United States,English,2016-04-01T14:06:00,2016-04-01T14:06:00,582.0000000000,500.0000000000,1242.0000000000,R,True
GallowayEliana,Tomorrow our hearts ache together. Nervous and excited to be with all my friends. Come out if you can https://t.co/EdGURrG535,United States,English,2016-04-01T14:06:00,2016-04-01T14:06:00,582.0000000000,500.0000000000,1247.0000000000,R,True
GallowayEliana,'@baltimoresun @deray  Wait did they kill someone who ACTUALLY had a gun deray ? In the midst of committing an ACTUAL criminal act ? Do tell…',United States,English,2016-04-01T14:06:00,2016-04-01T14:07:00,582.0000000000,500.0000000000,1248.0000000000,R,True
GallowayEliana,When your grandma hears Don't for the first time �  https://t.co/QvpV8CYMGp,United States,English,2016-04-01T14:06:00,2016-04-01T14:07:00,582.0000000000,500.0000000000,1245.0000000000,R,True
GallowayEliana,Does Diddy still have the hots for J. Lo? https://t.co/1JVOCD71VM https://t.co/hMTvGTTIG3,United States,English,2016-04-02T14:02:00,2016-04-02T14:02:00,741.0000000000,506.0000000000,1250.0000000000,R,True
GallowayEliana,Karrueche Tran discusses lead role in ‘A Weekend with the Family’ https://t.co/JUwCCYxgHF https://t.co/o50BQ1LThW,United States,English,2016-04-02T14:02:00,2016-04-02T14:02:00,741.0000000000,506.0000000000,1249.0000000000,R,True
GallowayEliana,"Breaking on @micnews: Pimply faced, sulky antibody could be the cure for #HIVAIDS.  https://t.co/Fnxllyah0u https://t.co/s8PpsGq9dv",United States,English,2016-04-05T16:11:00,2016-04-05T16:12:00,740.0000000000,516.0000000000,1252.0000000000,R,True
GallowayEliana,#Fixed RT @GeekNStereo RT @geauxAWAYheaux STL always seems to be full of errors and intimidation.,United States,English,2016-04-05T16:11:00,2016-04-05T16:11:00,740.0000000000,516.0000000000,1251.0000000000,R,True
GallowayEliana,Tisha Campbell-Martin explains reason for bankruptcy https://t.co/VOY8de2rIZ https://t.co/yOUO1mMMJz,United States,English,2016-04-05T16:11:00,2016-04-05T16:11:00,740.0000000000,516.0000000000,1250.0000000000,R,True
GallowayEliana,"Epic fantasy idea: A feast is agonizingly detailed for 900 pages then there are dragons and boobies. The last line is simply, ""BETRAYAL!""",United States,English,2016-04-05T16:12:00,2016-04-05T16:12:00,740.0000000000,516.0000000000,1257.0000000000,R,True
GallowayEliana,Voting in STL always seems to be full of errors and intimidation.,United States,English,2016-04-05T16:12:00,2016-04-05T16:12:00,740.0000000000,516.0000000000,1255.0000000000,R,True
GallowayEliana,"Father: I have sinned i told a lie to fix another lie, now i find myself lying daily #TheFamily Ring a BELL ? #kendrickJohnson",United States,English,2016-04-05T16:12:00,2016-04-05T16:12:00,740.0000000000,516.0000000000,1253.0000000000,R,True
GallowayEliana,"Workers at the factory that makes @KylieJenner's lip kit are calling it a ""sweatshop"" https://t.co/fi40UtiAV7",United States,English,2016-04-05T16:12:00,2016-04-05T16:12:00,740.0000000000,516.0000000000,1258.0000000000,R,True
GallowayEliana,Epic fantasy idea: A party of eclectic adventurers band together and undertake a deadly harrowing quest to discover a black person.,United States,English,2016-04-05T16:12:00,2016-04-05T16:12:00,740.0000000000,516.0000000000,1254.0000000000,R,True
GallowayEliana,"Maxim of Technology:  If it works, then it is, by definition, obsolete  https://t.co/f5i7zzAuza",United States,English,2016-04-05T16:12:00,2016-04-05T16:13:00,740.0000000000,516.0000000000,1256.0000000000,R,True
GallowayEliana,"they stop music videos, but they don't stop people from going to klan rallies or from taking over federal land? https://t.co/9jjikTl1h0",United States,English,2016-04-05T16:12:00,2016-04-05T16:12:00,740.0000000000,516.0000000000,1259.0000000000,R,True
GallowayEliana,"""I have been very consistent.."" https://t.co/Qqifn2Fe9F @TheView @megynkelly @SandraBernhard @NotMeUs @WeAreThe99 RT https://t.co/chTxXQRaRm",United States,English,2016-04-06T13:29:00,2016-04-06T13:29:00,839.0000000000,528.0000000000,1261.0000000000,R,True
GallowayEliana,Having trouble getting your Gambling or Escort Website up on Google Adword? https://t.co/8fMAOBvKVB can do the job! #getmyadsup,United States,English,2016-04-06T13:29:00,2016-04-06T13:29:00,839.0000000000,528.0000000000,1260.0000000000,R,True
GallowayEliana,"Words grow, age, die, and I am still interested in that metamorphosis. Elie Wiesel #amwriting #writing Tran Nguyen https://t.co/GyZAZiy4rG",United States,English,2016-04-06T13:29:00,2016-04-06T13:30:00,839.0000000000,528.0000000000,1267.0000000000,R,True
GallowayEliana,Bernie Sanders Bernin' Head Large White Custom Decal IntlShip #democrat  #p2 #FEELtheBERN https://t.co/nYzjVYioP7,United States,English,2016-04-06T13:29:00,2016-04-06T13:29:00,839.0000000000,528.0000000000,1264.0000000000,R,True
GallowayEliana,Justice delayed is better than no justice ..... https://t.co/86naeb4BQ6,United States,English,2016-04-06T13:29:00,2016-04-06T13:29:00,839.0000000000,528.0000000000,1263.0000000000,R,True
GallowayEliana,I heard Tanehisi Coates say I'm not throwing a punch without my feet planted.   I've abided by that ever since,United States,English,2016-04-06T13:29:00,2016-04-06T13:30:00,839.0000000000,528.0000000000,1268.0000000000,R,True
GallowayEliana,https://t.co/Puct3MG6RI,United States,English,2016-04-06T13:29:00,2016-04-06T13:29:00,839.0000000000,528.0000000000,1262.0000000000,R,True
GallowayEliana,David Bowie Vinyl Decal WALL Sticker USA #DavidBowie #democrat  #sgp #BLM #sgp #p2 #CTL https://t.co/qpMUh5ow5m,United States,English,2016-04-06T13:30:00,2016-04-06T13:30:00,839.0000000000,528.0000000000,1271.0000000000,R,True
GallowayEliana,"Baltimore cops never have to lift a finger to justify a shooting, because we assume our neighbors deserve to die.",United States,English,2016-04-06T13:30:00,2016-04-06T13:30:00,839.0000000000,528.0000000000,1269.0000000000,R,True
GallowayEliana,I recall my many interactions with Kamla Advani ji. My thoughts are with the Advani family in this hour of grief. May her soul rest in peace,United States,English,2016-04-06T13:30:00,2016-04-06T13:30:00,839.0000000000,528.0000000000,1272.0000000000,R,True
GallowayEliana,#BeingBlackIs being able to be yourself. Whether u vibe with Kendrick or u dab to Future.,United States,English,2016-04-09T22:18:00,2016-04-09T22:18:00,838.0000000000,534.0000000000,1275.0000000000,R,True
GallowayEliana,"#BeingBlackIs being told you ""talk like a white person"" when you're articulate. �",United States,English,2016-04-09T22:18:00,2016-04-09T22:18:00,838.0000000000,534.0000000000,1273.0000000000,R,True
GallowayEliana,#beingblackIs like: whatever injustice happens to me I apparently deserve it. https://t.co/f5hmhOhbDv,United States,English,2016-04-09T22:18:00,2016-04-09T22:18:00,838.0000000000,534.0000000000,1272.0000000000,R,True
GallowayEliana,"#BeingBlackIs being hated by so many, simply for existing, but no one batting an eye at exploiting your culture to make a profit.",United States,English,2016-04-09T22:18:00,2016-04-09T22:19:00,838.0000000000,534.0000000000,1274.0000000000,R,True
GallowayEliana,#BeingBlackIs being a �problem� for your govt,United States,English,2016-04-09T22:49:00,2016-04-09T22:49:00,838.0000000000,534.0000000000,1277.0000000000,,False
GallowayEliana,#BeingBlackIs bringing peace in the world,United States,English,2016-04-09T22:51:00,2016-04-09T22:51:00,838.0000000000,534.0000000000,1278.0000000000,,False
GallowayEliana,"#BeingBlackIs never conting more than up to one Mississippi, because one more rural hole like Mississippi is fucking way too much",United States,English,2016-04-09T22:51:00,2016-04-09T22:52:00,838.0000000000,534.0000000000,1282.0000000000,R,True
GallowayEliana,#BeingBlackIs facing all those crazy white people https://t.co/rYCxs8WjKO,United States,English,2016-04-09T22:51:00,2016-04-09T22:51:00,838.0000000000,534.0000000000,1281.0000000000,R,True
GallowayEliana,#BeingBlackIs being call a thug in the media regardless of your professionalism and educational background. https://t.co/ynYVCDUKTr,United States,English,2016-04-09T22:51:00,2016-04-09T22:51:00,838.0000000000,534.0000000000,1280.0000000000,R,True
GallowayEliana,Trying harder for the same salary #BeingBlackIs https://t.co/JZ4KppZtUk,United States,English,2016-04-09T22:51:00,2016-04-09T22:51:00,838.0000000000,534.0000000000,1279.0000000000,R,True
GallowayEliana,#BeingBlackIs looking suspicious to the white people,United States,English,2016-04-09T23:06:00,2016-04-09T23:06:00,838.0000000000,535.0000000000,1283.0000000000,,False
GallowayEliana,racists woman kicks me and my kids out for being black  https://t.co/tYrRPE0aMt @ZoWilliams @tariqnasheed @alreadynation @3rdEyePlug #meth,United States,English,2016-04-17T16:26:00,2016-04-17T16:27:00,931.0000000000,538.0000000000,1289.0000000000,R,True
GallowayEliana,Residents of #Gomal Paktika protest against recent dronestrike that killed 20 civilians last week @hrw @amnesty https://t.co/RsPeIezMnE,United States,English,2016-04-17T16:26:00,2016-04-17T16:26:00,931.0000000000,538.0000000000,1286.0000000000,R,True
GallowayEliana,"""The woman ... reportedly thought he said 'shahid,' martyr, associated w jihad"" SO much wrong w this \| https://t.co/J2j1GEtOTh",United States,English,2016-04-17T16:26:00,2016-04-17T16:26:00,931.0000000000,538.0000000000,1287.0000000000,R,True
GallowayEliana,Syrian Elections Prove Again That Washington And Its Presstitutes Lie Through Their Teeth https://t.co/4regtRtOtk,United States,English,2016-04-17T16:26:00,2016-04-17T16:26:00,931.0000000000,538.0000000000,1288.0000000000,R,True
GallowayEliana,"No, seriously. Some of the Bernie bros have now moved on to call contributions to the DNC corrupt. Bozos.",United States,English,2016-04-17T16:26:00,2016-04-17T16:26:00,931.0000000000,538.0000000000,1284.0000000000,R,True
GallowayEliana,I saw the @AnitaHillMovie by Freida Mock a few years ago and I wanted to know MORE about Anita and ALL the players!  https://t.co/7irLuCoiHj,United States,English,2016-04-17T16:26:00,2016-04-17T16:26:00,931.0000000000,538.0000000000,1285.0000000000,R,True
GallowayEliana,Police asks for IDs NOW in #NuitDebout assembly @ #Lisbon Police visite l'assemblée maintenant @ #Lisboa #47mars https://t.co/kL7h0JaLiT,United States,French,2016-04-17T16:27:00,2016-04-17T16:27:00,931.0000000000,538.0000000000,1296.0000000000,R,True
GallowayEliana,maybe Newport News. anyone recognize this area?? https://t.co/nYsdkwLb2A,United States,English,2016-04-17T16:27:00,2016-04-17T16:28:00,931.0000000000,538.0000000000,1297.0000000000,R,True
GallowayEliana,honestly if I slipped into a coma id be kinda okay with that lmao I need a break,United States,English,2016-04-17T16:27:00,2016-04-17T16:27:00,931.0000000000,538.0000000000,1294.0000000000,R,True
GallowayEliana,Panama Papers:  Reigniting the Debate for a Global Tax https://t.co/NG8KkXxVlf,United States,English,2016-04-17T16:27:00,2016-04-17T16:27:00,931.0000000000,538.0000000000,1292.0000000000,R,True
GallowayEliana,"Lieutenant John Pike of #UCDavis. Awarded $38,000 for his ""pain and suffering."" Really. https://t.co/SMQAa6xZVS https://t.co/ADum3fH1fu",United States,English,2016-04-17T16:27:00,2016-04-17T16:27:00,931.0000000000,538.0000000000,1295.0000000000,R,True
GallowayEliana,"""I support #RamseyOrta"" who has been harassed ever since he filmed murder of #EricGarner #DemocracySpring https://t.co/9kQRZcYjn6",United States,English,2016-04-17T16:27:00,2016-04-17T16:27:00,931.0000000000,538.0000000000,1291.0000000000,R,True
GallowayEliana,Prom 2k16� https://t.co/QtzKVI1Bde,United States,English,2016-04-17T16:27:00,2016-04-17T16:27:00,931.0000000000,538.0000000000,1293.0000000000,R,True
GallowayEliana,#Philippines elections hack 'leaks voter data' hack by #anonymous Philippines https://t.co/Qs8ZJIpIoT,United States,English,2016-04-17T16:27:00,2016-04-17T16:27:00,931.0000000000,538.0000000000,1290.0000000000,R,True
GallowayEliana,People are getting more consious! That's great https://t.co/lAWR81JckJ,United States,English,2016-04-22T14:15:00,2016-04-22T14:15:00,1024.0000000000,557.0000000000,1298.0000000000,Q,True
GallowayEliana,Trump doesn't even respect his own supporters https://t.co/JB45aZOyb6,United States,English,2016-04-22T15:45:00,2016-04-22T15:45:00,1024.0000000000,557.0000000000,1299.0000000000,Q,True
GallowayEliana,that's interesting... https://t.co/0vn8EMB6Go,United States,English,2016-04-22T16:18:00,2016-04-22T16:18:00,1023.0000000000,556.0000000000,1300.0000000000,Q,True
GallowayEliana,People are suffering right now https://t.co/Vf3ax5soNw,United States,English,2016-04-22T16:52:00,2016-04-22T16:53:00,1023.0000000000,556.0000000000,1301.0000000000,Q,True
GallowayEliana,Can't see them hurring to save the girls https://t.co/jtx39aMfqO,United States,English,2016-04-22T17:23:00,2016-04-22T17:23:00,1024.0000000000,557.0000000000,1302.0000000000,Q,True
GallowayEliana,How these top celebrities became accidental members of an ultraconservative political party https://t.co/kZ6ToNlgY9 https://t.co/55cqPoaURT,United States,English,2016-04-22T17:51:00,2016-04-22T17:51:00,1023.0000000000,557.0000000000,1303.0000000000,R,True
GallowayEliana,"Yay, this was really racist, as for me https://t.co/ZZW2ZhWra0",United States,English,2016-04-26T15:16:00,2016-04-26T15:16:00,1022.0000000000,557.0000000000,1304.0000000000,Q,True
GallowayEliana,At least they've won the case! #policebrutality https://t.co/RAWJGfSuFT,United States,English,2016-04-26T16:00:00,2016-04-26T16:00:00,1023.0000000000,557.0000000000,1305.0000000000,Q,True
GallowayEliana,CNN surveyed 135 PA delegate candidates 42% back CD winner 25% Trump 20% Cruz 11% Uncommitted 2% PA winner 0% Kasich  https://t.co/H7dHbAsCgp,United States,English,2016-04-26T16:41:00,2016-04-26T16:41:00,1023.0000000000,557.0000000000,1306.0000000000,R,True
GallowayEliana,We should all stay and not let this happen! https://t.co/IQWOkZWzmu,United States,English,2016-04-26T16:42:00,2016-04-26T16:42:00,1023.0000000000,557.0000000000,1307.0000000000,Q,True
GallowayEliana,Learning how to teach black kids while being white https://t.co/KMPrBITCdS,United States,English,2016-04-26T17:16:00,2016-04-26T17:17:00,1022.0000000000,557.0000000000,1308.0000000000,Q,True
GallowayEliana,That's simply amazing! Up! https://t.co/1kk64IggJ7,United States,English,2016-04-26T17:42:00,2016-04-26T17:42:00,1022.0000000000,557.0000000000,1309.0000000000,Q,True
GallowayEliana,Buy art not cocaine �� https://t.co/LApxtw1mg2,United States,English,2016-04-29T16:03:00,2016-04-29T16:04:00,972.0000000000,555.0000000000,1310.0000000000,,False
GallowayEliana,"he fought for justice, that's a bigger crime � https://t.co/WWW9JlVhOv",United States,English,2016-04-29T16:28:00,2016-04-29T16:28:00,967.0000000000,555.0000000000,1311.0000000000,Q,True
GallowayEliana,it's useless and I already want one�  https://t.co/rEKCeADW1F,United States,English,2016-04-29T16:51:00,2016-04-29T16:51:00,962.0000000000,555.0000000000,1312.0000000000,Q,True
GallowayEliana,They are so cute ☺️ https://t.co/rcRMK1OQzT,United States,English,2016-04-29T17:12:00,2016-04-29T17:12:00,950.0000000000,555.0000000000,1313.0000000000,Q,True
GallowayEliana,Trump's motorcade faked out protesters in front of a San Francisco airport hotel by detouring to the back https://t.co/CGNabsA01s,United States,English,2016-04-30T01:53:00,2016-04-30T01:54:00,927.0000000000,553.0000000000,1315.0000000000,R,True
GallowayEliana,Birds? https://t.co/F7GM0yJg7S,United States,English,2016-04-30T01:53:00,2016-04-30T01:54:00,927.0000000000,553.0000000000,1316.0000000000,R,True
GallowayEliana,You must be one ignorant asshole to equate women having the bodily autonomy to make a choice to mass violence. https://t.co/GOQPPAYsfA,United States,English,2016-04-30T13:40:00,2016-04-30T13:40:00,927.0000000000,554.0000000000,1318.0000000000,R,True
GallowayEliana,wattpad turned their app updates  into a fanfiction they're so extra fnfnf https://t.co/nlh1qlg27t,United States,English,2016-04-30T13:40:00,2016-04-30T13:41:00,927.0000000000,554.0000000000,1324.0000000000,R,True
GallowayEliana,Time To Awaken The Thirst In You https://t.co/ErlThBcmFj,United States,English,2016-04-30T13:40:00,2016-04-30T13:40:00,927.0000000000,554.0000000000,1317.0000000000,R,True
GallowayEliana,you spelled Riff Raff wrong. RT @parasIut: I look like Beyoncé �� https://t.co/R1aCrOwFdV,United States,English,2016-04-30T13:40:00,2016-04-30T13:41:00,927.0000000000,554.0000000000,1323.0000000000,R,True
GallowayEliana,Idk about that sis  https://t.co/k6OpQrcyrm,United States,English,2016-04-30T13:40:00,2016-04-30T13:40:00,927.0000000000,554.0000000000,1319.0000000000,R,True
GallowayEliana,TODAYS PROM � !!,United States,English,2016-04-30T13:40:00,2016-04-30T13:40:00,927.0000000000,554.0000000000,1322.0000000000,R,True
GallowayEliana,Even the Wall Street Journal is starting to temper its supply-side nonsense and recognize that America’s anemic... https://t.co/rl10b4JJkm,United States,English,2016-04-30T13:41:00,2016-04-30T13:41:00,927.0000000000,554.0000000000,1325.0000000000,R,True
GallowayEliana,'@SocialIssueNews @BobbySealecom @kestans @Lnnie @lkkash @elise_flowers',United States,English,2016-04-30T13:41:00,2016-04-30T13:41:00,927.0000000000,554.0000000000,1327.0000000000,R,True
GallowayEliana,"While making forward movement, remember that people show us who we are. Many times the frustrations of life are only exams testing patience.",United States,English,2016-04-30T13:41:00,2016-04-30T13:41:00,927.0000000000,554.0000000000,1328.0000000000,R,True
GallowayEliana,‘Grown in Washington’: Check out the legal marijuana farms in DC https://t.co/UnyRy8LD7I,United States,English,2016-05-03T14:46:00,2016-05-03T14:47:00,927.0000000000,565.0000000000,1334.0000000000,R,True
GallowayEliana,"Setting aside that that's not their purpose, even if they did so, Sanders would lose: https://t.co/5DQUuG5Zf5 https://t.co/9wdXGIv1wF",United States,English,2016-05-03T14:46:00,2016-05-03T14:46:00,927.0000000000,565.0000000000,1329.0000000000,R,True
GallowayEliana,Niggas can't afford it. https://t.co/SbSrq9oGVP,United States,English,2016-05-03T14:46:00,2016-05-03T14:46:00,927.0000000000,565.0000000000,1331.0000000000,R,True
GallowayEliana,Mom upset after school calls girl's #naturalhair unacceptable   https://t.co/r0QHTqqKOO  -- https://t.co/oiktw4AMs5,United States,English,2016-05-03T14:46:00,2016-05-03T14:46:00,927.0000000000,565.0000000000,1332.0000000000,R,True
GallowayEliana,This nigga real. RT @MalcolmFresh_: � RT @Tone314: RT @trillac_: I'd do a crime with Billy Donovan any day son https://t.co/JWCprecN3O,United States,English,2016-05-03T14:46:00,2016-05-03T14:46:00,927.0000000000,565.0000000000,1330.0000000000,R,True
GallowayEliana,Watch NFL alum @Wade_Davis28’s TED talk about why masculinity is a performance. https://t.co/zfJBvwF26H,United States,English,2016-05-03T14:46:00,2016-05-03T14:46:00,927.0000000000,565.0000000000,1333.0000000000,R,True
GallowayEliana,Another flaw in Sanders' argument on electability: Clinton won where the electorate was more diverse. That is how Democrats typically win.,United States,English,2016-05-03T14:47:00,2016-05-03T14:47:00,927.0000000000,565.0000000000,1337.0000000000,R,True
GallowayEliana,Survey: Two-thirds say government not doing enough on opioid addiction https://t.co/jQyz7kzu1b https://t.co/ae9qXz7KPw,United States,English,2016-05-03T14:47:00,2016-05-03T14:47:00,927.0000000000,565.0000000000,1335.0000000000,R,True
GallowayEliana,"Cold, hard, rain wasn't stopping the arrivals of @Madonna, @LadyGaga, and @Beyonce to the #MetGala.  https://t.co/u2K4qEF3kS",United States,English,2016-05-03T14:47:00,2016-05-03T14:47:00,927.0000000000,565.0000000000,1336.0000000000,R,True
GallowayEliana,"""YOUR VOTE YOUR VOICE"" Campaign  YOURVOTE@LWVMN.ORG https://t.co/ivnV2rT93F. Check it out NOW! https://t.co/fl6Q7UZe8K",United States,English,2016-05-04T15:46:00,2016-05-04T15:47:00,926.0000000000,576.0000000000,1341.0000000000,R,True
GallowayEliana,Another fascinating story broken by @DanElliottAP:  https://t.co/fEZKKLRiIY,United States,English,2016-05-04T15:46:00,2016-05-04T15:46:00,926.0000000000,576.0000000000,1338.0000000000,R,True
GallowayEliana,"Where Tesla’s shares, and shorts, go next will soon be determined https://t.co/pedRUtoOz1 https://t.co/u1iNO08vOr",United States,English,2016-05-04T15:46:00,2016-05-04T15:47:00,926.0000000000,576.0000000000,1342.0000000000,R,True
GallowayEliana,"RPT-INSIGHT-Saudi prince makes bold challenges to kingdom's old ways: RIYADH, May 4 (Reuters)... https://t.co/TvKnODvPSL via @josephjett",United States,English,2016-05-04T15:46:00,2016-05-04T15:47:00,926.0000000000,576.0000000000,1340.0000000000,R,True
GallowayEliana,"me everyday at least thrice: ""WHY HAVEN'T I SEEN HAMILTON YET?!"" https://t.co/YObKM2xfMR",United States,English,2016-05-04T15:46:00,2016-05-04T15:46:00,926.0000000000,576.0000000000,1339.0000000000,R,True
GallowayEliana,teachers should give childeren an example not ruin their worlds https://t.co/yG8WPLrT8e,United States,English,2016-05-04T17:03:00,2016-05-04T17:03:00,1025.0000000000,579.0000000000,1343.0000000000,Q,True
GallowayEliana,Obama isn't almighty https://t.co/LgDW6HREuM,United States,English,2016-05-04T17:40:00,2016-05-04T17:40:00,1025.0000000000,579.0000000000,1344.0000000000,Q,True
GallowayEliana,Lack of accountability is causing her to act this way.  https://t.co/tDIWhcqV9m,United States,English,2016-05-07T14:26:00,2016-05-07T14:26:00,924.0000000000,580.0000000000,1346.0000000000,R,True
GallowayEliana,"What is a 'normal' night's sleep? It depends on your age, gender and nationality https://t.co/PiNNMZJweO https://t.co/1rmxWzqvrl",United States,English,2016-05-07T14:26:00,2016-05-07T14:26:00,924.0000000000,580.0000000000,1347.0000000000,R,True
GallowayEliana,Only way they can is if the rest of the league doesn't look appealing. RT @SnottieDrippen: How can OKC convince KD not to leave this summer?,United States,English,2016-05-07T14:26:00,2016-05-07T14:26:00,924.0000000000,580.0000000000,1344.0000000000,R,True
GallowayEliana,Get your TMZ merch at https://t.co/UwJAMpaUzl https://t.co/XTGXCpEWvt,United States,English,2016-05-07T14:26:00,2016-05-07T14:27:00,924.0000000000,580.0000000000,1348.0000000000,R,True
GallowayEliana,What's the Big Frigin' Difference?! https://t.co/HWGwWFijW2,United States,English,2016-05-07T14:26:00,2016-05-07T14:26:00,924.0000000000,580.0000000000,1345.0000000000,R,True
GallowayEliana,"#Alabama Chief Justice Roy Moore Suspended, Facing Removal From Office https://t.co/pPyIsjWY9q https://t.co/HPTc8FkwfL",United States,English,2016-05-07T14:27:00,2016-05-07T14:27:00,924.0000000000,580.0000000000,1350.0000000000,R,True
GallowayEliana,Was jamming the whole first 3:50 seconds of the song tho.,United States,English,2016-05-07T14:27:00,2016-05-07T14:27:00,924.0000000000,580.0000000000,1349.0000000000,R,True
GallowayEliana,#HappyMothersDay #Love #FamilyFIRST https://t.co/uBaZrIHG4F,United States,English,2016-05-08T14:51:00,2016-05-08T14:51:00,1022.0000000000,584.0000000000,1353.0000000000,R,True
