author_id,content,region,language,publish_date,harvested_date,following,followers,updates,post_type,retweet
RegKaganova,"""Рубин"" обыграл ""Сьон"" в матче Лиги Европы https://t.co/NIn6OoKp6k",Unknown,Uzbek,2015-11-26T18:37:00,2015-11-26T18:37:00,74.0000000000,153.0000000000,2572.0000000000,R,True
RegKaganova,Приморский океанариум и институт океанографии Вьетнама обменяются животными https://t.co/Jw5pI1ejZW https://t.co/jYxXfEJQtE,Unknown,Russian,2015-11-27T04:32:00,2015-11-27T04:32:00,74.0000000000,153.0000000000,2576.0000000000,R,True
RegKaganova,Полиция Берлина задержала двух человек в ходе антитеррористических рейдов https://t.co/OoYoM7OGg2,Unknown,Russian,2015-11-27T05:32:00,2015-11-27T05:32:00,74.0000000000,153.0000000000,2577.0000000000,R,True
RegKaganova,СМИ: устроившая смертельное ДТП дочь иркутского депутата признала обвинения https://t.co/W1iSu8RKDY,Unknown,Russian,2015-11-27T07:38:00,2015-11-27T07:38:00,74.0000000000,153.0000000000,2579.0000000000,R,True
RegKaganova,"Валите из Турции как можно скорее, идиоты! Щас наши грохнут какой-нить турецкий самолет и фанатики вас перережут в ваших оланклюзивах!",Unknown,Russian,2015-11-27T08:13:00,2015-11-27T08:13:00,74.0000000000,153.0000000000,2580.0000000000,R,True
RegKaganova,Более 50 морпехов Северного флота РФ участвуют в борьбе с терроризмом  https://t.co/50m9bGq1Us,Unknown,Russian,2015-11-27T08:33:00,2015-11-27T08:35:00,74.0000000000,153.0000000000,2581.0000000000,R,True
RegKaganova,Мутко провел первую встречу с представителями WADA https://t.co/AK1Y93fXHE,Unknown,Russian,2015-11-27T10:23:00,2015-11-27T10:24:00,74.0000000000,153.0000000000,2583.0000000000,R,True
RegKaganova,Ди Натале может завершить карьеру в декабре https://t.co/o13tdpJN6x,Unknown,Russian,2015-11-27T10:24:00,2015-11-27T10:24:00,74.0000000000,153.0000000000,2584.0000000000,R,True
RegKaganova,Дмитрий Песков: В резиденции Владимира Путина усилены меры по предотвращению утечек информации  https://t.co/jOTjVsDCdT,Unknown,Russian,2015-11-27T10:54:00,2015-11-27T10:58:00,74.0000000000,153.0000000000,2585.0000000000,R,True
RegKaganova,Один из игроков подал жалобу на «Кубань» из-за задержки зарплаты https://t.co/f2iJIlzhEm,Unknown,Ukrainian,2015-11-27T13:36:00,2015-11-27T13:36:00,74.0000000000,153.0000000000,2587.0000000000,R,True
RegKaganova,Американские САУ Paladin впервые провели учебные стрельбы в Эстонии https://t.co/NoWvCBRsea https://t.co/FWDTZhwQVz,Unknown,Russian,2015-11-27T20:22:00,2015-11-27T20:22:00,74.0000000000,154.0000000000,2588.0000000000,R,True
RegKaganova,СМИ: Число пострадавших из-за стрельбы в американском городе Колорадо-Спрингс возросло до девяти  https://t.co/ihHfDMhpxA,Unknown,Ukrainian,2015-11-28T00:54:00,2015-11-28T00:56:00,74.0000000000,154.0000000000,2589.0000000000,R,True
RegKaganova,Япония создаст центр по сбору информации о международном терроризме  https://t.co/k64hqjPJTy https://t.co/jgQi0wR60i,Unknown,Russian,2015-11-28T04:02:00,2015-11-28T04:02:00,74.0000000000,154.0000000000,2590.0000000000,R,True
RegKaganova,"Вооруженный мужчина открыл стрельбу в Колорадо-Спрингс, есть погибшие  https://t.co/AdWstYQzMZ https://t.co/dC1N0Yoqmo",Unknown,Russian,2015-11-28T06:34:00,2015-11-28T06:34:00,74.0000000000,154.0000000000,2591.0000000000,R,True
RegKaganova,После приостановки полетов в Египет в МЧС поступило 17 тысяч звонков https://t.co/EyFTnOu7Uy https://t.co/6XzVFFi0hO,Unknown,Russian,2015-11-28T07:32:00,2015-11-28T07:33:00,74.0000000000,154.0000000000,2592.0000000000,R,True
RegKaganova,"Кабмин готовит перечень товаров, которые запретят ввозить из Турции https://t.co/dIiiUtyBsz https://t.co/Z6C79Q1wez",Unknown,Russian,2015-11-28T23:31:00,2015-11-28T23:31:00,74.0000000000,154.0000000000,2597.0000000000,R,True
RegKaganova,СМИ: Назван предварительный список попадающих под санкции турецких продуктов https://t.co/yVtlS7Gzsy,Unknown,Russian,2015-11-30T06:56:00,2015-11-30T06:56:00,74.0000000000,154.0000000000,2602.0000000000,R,True
RegKaganova,«Трансаэро» решила ответить «Аэрофлоту» иском на иск https://t.co/UZpL5f3zX1,Unknown,Russian,2015-11-30T10:14:00,2015-11-30T10:15:00,74.0000000000,154.0000000000,2603.0000000000,R,True
RegKaganova,Пётр Порошенко призвал продлить санкции в отношении России  https://t.co/pTXP1KdBCz https://t.co/mxUUmHnSwO,Unknown,Russian,2015-11-30T11:53:00,2015-11-30T11:53:00,74.0000000000,154.0000000000,2604.0000000000,R,True
RegKaganova,Медведев: Санкции в отношении Турции минимально затронут экономические интересы России  https://t.co/gf1mnb5ApW https://t.co/zuuMMlj46V,Unknown,Russian,2015-11-30T13:22:00,2015-11-30T13:22:00,74.0000000000,154.0000000000,2605.0000000000,R,True
RegKaganova,Режиссер Эльдар Рязанов скончался на 89-м году жизни  Известного российского и советского ки https://t.co/GFozaxyZDk https://t.co/WGCviDSSwY,Unknown,Russian,2015-12-01T13:11:00,2015-12-01T13:11:00,74.0000000000,154.0000000000,2611.0000000000,R,True
RegKaganova,Мекрель: ФРГ планирует расширить участие в коалиции против ИГ (ДАИШ) https://t.co/JdEMrJvvZX https://t.co/GEYRqBIeFr,Unknown,Russian,2015-12-01T14:12:00,2015-12-01T14:13:00,74.0000000000,154.0000000000,2612.0000000000,R,True
RegKaganova,«Дикси» допустил рост цен после запрета турецких продуктов https://t.co/s5BpC5buvG,Unknown,Russian,2015-12-02T12:14:00,2015-12-02T12:14:00,74.0000000000,155.0000000000,2618.0000000000,R,True
RegKaganova,ФОТОРЕПОРТАЖ. Зажгла огни главная рождественская елка США  https://t.co/K0DkojiGuw https://t.co/0ru4amm7r0,Unknown,Russian,2015-12-03T07:55:00,2015-12-03T07:55:00,74.0000000000,156.0000000000,2627.0000000000,R,True
RegKaganova,Полиция уточнила личности нападавших в Калифорнии  https://t.co/DWDcPNUpiS https://t.co/8aiO9zgNfz,Unknown,Russian,2015-12-03T07:57:00,2015-12-03T07:57:00,74.0000000000,156.0000000000,2628.0000000000,R,True
RegKaganova,Источник: Турция попросила Азербайджан ускорить строительство Трансанатолийского газопровода https://t.co/OebPFvWvlx,Unknown,Russian,2015-12-03T16:32:00,2015-12-03T16:33:00,74.0000000000,155.0000000000,2631.0000000000,R,True
RegKaganova,Скончался Владимир Железников  https://t.co/F1DyIkh8L7 https://t.co/MdpNKwlz3w,Unknown,Russian,2015-12-03T16:38:00,2015-12-03T16:38:00,74.0000000000,155.0000000000,2632.0000000000,R,True
RegKaganova,Послание президента: истерической реакции от нас не дождутся https://t.co/UoQ5jZXYrT https://t.co/GycVKdlmnO,Unknown,Russian,2015-12-03T20:37:00,2015-12-03T20:37:00,74.0000000000,155.0000000000,2633.0000000000,R,True
RegKaganova,Лауреатом «Русского Букера» стал Александр Снегирев https://t.co/bZ14GyZoBt https://t.co/Gk54Ctz028,Unknown,Russian,2015-12-03T21:13:00,2015-12-03T21:13:00,74.0000000000,155.0000000000,2634.0000000000,R,True
RegKaganova,Moody's изменило прогноз по гособлигациям России https://t.co/0eFVpRgl5D © AP Photo https://t.co/oDF1qCmKHY,Unknown,Russian,2015-12-04T01:51:00,2015-12-04T01:51:00,74.0000000000,155.0000000000,2635.0000000000,R,True
RegKaganova,«Дикий запад» Тима Керби: О лени приверженцев чайлдфри и почему тархун лучше «кока-колы» и «пепси» (ВИДЕО)  https://t.co/CL3mUqyHHK,Unknown,Russian,2015-12-04T11:32:00,2015-12-04T11:32:00,74.0000000000,155.0000000000,2638.0000000000,R,True
RegKaganova,Завоз дизель-генераторов в Крым будет прекращен  Дополнительные резервные источники питания  https://t.co/za6qDohUHw https://t.co/4PEBvetO3x,Unknown,Russian,2015-12-04T14:33:00,2015-12-04T14:33:00,74.0000000000,155.0000000000,2640.0000000000,R,True
RegKaganova,В Госдуме предложили брать с граждан обязательство о явке на суд https://t.co/9K8PcnHZiu,Unknown,Russian,2015-12-04T16:52:00,2015-12-04T16:52:00,74.0000000000,155.0000000000,2641.0000000000,R,True
RegKaganova,Иранская разведка заявила о сделанных снимках нефтяных маршрутов ИГ https://t.co/LPEVIVhSEG,Unknown,Russian,2015-12-04T18:18:00,2015-12-04T18:19:00,74.0000000000,155.0000000000,2643.0000000000,R,True
RegKaganova,Порошенко и Яценюк засудят Эрдогана за плагиат   https://t.co/VIs1kfnBLx,Unknown,Ukrainian,2015-12-05T13:52:00,2015-12-05T13:52:00,74.0000000000,154.0000000000,2645.0000000000,R,True
RegKaganova,"Президент Турции считает, что его страна может найти других поставщиков энергии вместо РФ https://t.co/YNW4u9JcB3",Unknown,Russian,2015-12-05T14:55:00,2015-12-05T14:55:00,74.0000000000,154.0000000000,2646.0000000000,R,True
RegKaganova,"В PS 21.00: как США блокируют коалицию; умер.оппозиция/ИГ -близнецы-братья;""Серые волки""- прыжок из прошлого; политич. бессилие Порошенко...",Unknown,Russian,2015-12-05T15:13:00,2015-12-05T15:13:00,74.0000000000,154.0000000000,2647.0000000000,R,True
RegKaganova,Озил: нынешний сезон — лучший во всей моей карьере https://t.co/OZ3VWJbb5B,Unknown,Russian,2015-12-06T10:15:00,2015-12-06T10:15:00,74.0000000000,153.0000000000,2651.0000000000,R,True
RegKaganova,ЦИК Армении опубликовал первые предварительные итоги референдума  https://t.co/tpXmqdWd3L https://t.co/BefmsE9VEL,Unknown,Russian,2015-12-06T21:32:00,2015-12-06T21:33:00,74.0000000000,153.0000000000,2658.0000000000,R,True
RegKaganova,"Короче, тест. Отвечаете на один вопрос — и сразу понятно либерал вы или консерватор   https://t.co/6QqmMQTthi",Unknown,Russian,2015-12-07T17:52:00,2015-12-07T17:52:00,74.0000000000,153.0000000000,2663.0000000000,R,True
RegKaganova,Памела Андерсон в Москве встала грудью на защиту редких животных: https://t.co/dX7fU8Qlk1 https://t.co/RaorlvOf8t,Unknown,Russian,2015-12-07T17:52:00,2015-12-07T17:52:00,74.0000000000,153.0000000000,2664.0000000000,R,True
RegKaganova,"Яценюк заверил Байдена, что Киев готов продолжить борьбу с коррупцией https://t.co/6bGEo6CFxr https://t.co/KiNfKxJ8So",Unknown,Russian,2015-12-07T21:11:00,2015-12-07T21:11:00,74.0000000000,153.0000000000,2666.0000000000,R,True
RegKaganova,Керчан проконсультируют в вопросах борьбы с коррупцией  В Керчи в преддверии празднования Ме https://t.co/uwCuhvidbr https://t.co/Uzvsf8MNhX,Unknown,Russian,2015-12-07T22:52:00,2015-12-07T22:52:00,74.0000000000,153.0000000000,2667.0000000000,R,True
RegKaganova,Белый дом осудил предложение Трампа запретить мусульманам въезд в #США https://t.co/WlDTu5KNAW,Unknown,Russian,2015-12-08T08:14:00,2015-12-08T08:14:00,74.0000000000,152.0000000000,2668.0000000000,R,True
RegKaganova,"Приговор мэру Рыбинска Ласточкину, осужденному за взятку, вступил в законную силу https://t.co/WzpfzaZFRq https://t.co/38I8y6Z5B5",Unknown,Russian,2015-12-08T08:51:00,2015-12-08T08:51:00,74.0000000000,152.0000000000,2669.0000000000,R,True
RegKaganova,Рада одобрила создание телеканала Ukraine Tomorrow https://t.co/cL6HUcjqZH,Unknown,Russian,2015-12-08T11:17:00,2015-12-08T11:18:00,74.0000000000,152.0000000000,2671.0000000000,R,True
RegKaganova,Констатируем проявление «двойных стандартов» со стороны Представителя #ОБСЕ по вопросам свободы СМИ @OSCE_RFoM https://t.co/bhtmlHhI4y,Unknown,Russian,2015-12-08T14:55:00,2015-12-08T14:56:00,74.0000000000,153.0000000000,2676.0000000000,R,True
RegKaganova,Владиславу Суркову запретили въезд на Украину https://t.co/U0z10A0zXU,Unknown,Ukrainian,2015-12-08T17:38:00,2015-12-08T17:38:00,74.0000000000,153.0000000000,2678.0000000000,R,True
RegKaganova,«Уралсиб» предсказал решение ЦБ сохранить ключевую ставку в 11% https://t.co/eSuddkaXwz,Unknown,Russian,2015-12-08T18:55:00,2015-12-08T18:55:00,74.0000000000,153.0000000000,2680.0000000000,R,True
RegKaganova,".@red_panamka @NickHanin в двух словах. Киборг, мечтающий крошить русских солдат до войны жил в норе https://t.co/L8wVfMpiwt",Unknown,Russian,2015-12-08T21:42:00,2015-12-08T21:42:00,74.0000000000,153.0000000000,2681.0000000000,R,True
RegKaganova,Футбольный арбитр будет отстранен от работы в чемпионате Украины из-за участия в первенстве ЛНР https://t.co/hoHtfkzoLG,Unknown,Russian,2015-12-09T06:51:00,2015-12-09T06:51:00,74.0000000000,153.0000000000,2682.0000000000,R,True
RegKaganova,В Совфеде предложили ввести госмонополию на выпуск и продажу спиртного: https://t.co/oIa1EofCMY Её и отменять не надо было!,Unknown,Russian,2015-12-09T09:32:00,2015-12-09T09:32:00,74.0000000000,153.0000000000,2684.0000000000,R,True
RegKaganova,Болельщики «Кубани»: состояние дел клуба катастрофическое https://t.co/r6IwMnz7co,Unknown,Russian,2015-12-09T13:18:00,2015-12-09T13:18:00,74.0000000000,153.0000000000,2685.0000000000,R,True
RegKaganova,ФОТОРЕПОРТАЖ. Личная группа Ким Чен Ына отправляется на гастроли  https://t.co/pdwt2stgSa https://t.co/zljLn5ugIu,Unknown,Russian,2015-12-09T15:53:00,2015-12-09T15:53:00,74.0000000000,153.0000000000,2687.0000000000,R,True
RegKaganova,Россия возобновит поставки угля на Украину https://t.co/4pDdfMc2m9 https://t.co/DTVb4H5eHo,Unknown,Russian,2015-12-09T16:11:00,2015-12-10T03:03:00,74.0000000000,153.0000000000,2688.0000000000,R,True
RegKaganova,Националиста Дмитрия Демушкина отпустили под подписку о невыезде https://t.co/nuP6HBSIVl,Unknown,Serbian,2015-12-09T18:55:00,2015-12-09T18:55:00,74.0000000000,153.0000000000,2692.0000000000,R,True
RegKaganova,Кэмерон и Путин признали необходимость совместной работы по Сирии https://t.co/8CxqoURvmZ https://t.co/LRMxcj7ZJf,Unknown,Russian,2015-12-09T19:02:00,2015-12-09T19:02:00,74.0000000000,153.0000000000,2693.0000000000,R,True
RegKaganova,https://t.co/wFAmqFSPbA,Unknown,Russian,2015-12-09T21:17:00,2015-12-10T06:40:00,74.0000000000,153.0000000000,2694.0000000000,R,True
RegKaganova,"Политэмигранты из Украины: У вас мы нелегалы, а на родине нас ждет тюрьма https://t.co/flYZiMhxEx #украина",Unknown,Russian,2015-12-09T23:55:00,2015-12-09T23:55:00,74.0000000000,153.0000000000,2696.0000000000,R,True
RegKaganova,"Доброе утро, блогеры!",Unknown,Russian,2015-12-10T02:12:00,2015-12-10T02:12:00,74.0000000000,153.0000000000,2697.0000000000,R,True
RegKaganova,Bloomberg: Royal Bank of Scotland заплатит немецким властям $26 млн за налоговые махинации https://t.co/M3cDoDStec,Unknown,Ukrainian,2015-12-10T08:21:00,2015-12-10T08:22:00,74.0000000000,153.0000000000,2698.0000000000,R,True
RegKaganova,"Меркель, террорист и эксцентрик: журнал Time выбрал Человека года https://t.co/gDqdtRpnJN https://t.co/mdcv5A7Dtw",Unknown,Russian,2015-12-10T08:24:00,2015-12-10T08:24:00,74.0000000000,153.0000000000,2699.0000000000,R,True
RegKaganova,ВИДЕО. Первые в мире щенки «из пробирки»  https://t.co/840Z6GC3Ep https://t.co/rPYXI0izNE,Unknown,Russian,2015-12-10T09:51:00,2015-12-10T09:51:00,74.0000000000,153.0000000000,2702.0000000000,R,True
RegKaganova,ЦРУ предупредило Турцию о возможных терактах против россиян https://t.co/rO2MNFTNk7,Unknown,Russian,2015-12-10T10:00:00,2015-12-10T10:00:00,74.0000000000,153.0000000000,2703.0000000000,R,True
RegKaganova,Активность туризма в Париже снизилась  https://t.co/UQF1TdU1BL,Unknown,Russian,2015-12-11T00:59:00,2015-12-11T00:59:00,74.0000000000,153.0000000000,2706.0000000000,R,True
RegKaganova,Модернизация баз и складов Минобороны уменьшит затраты почти в 2 раза https://t.co/edFaNpIKjM https://t.co/tnPeOXEegE,Unknown,Russian,2015-12-11T13:31:00,2015-12-11T13:31:00,74.0000000000,153.0000000000,2708.0000000000,R,True
RegKaganova,"Дефицит госбюджета Украины в 2016 году составит $3,5 млрд https://t.co/myZU1vWZ8A",Unknown,Russian,2015-12-11T21:03:00,2015-12-11T21:03:00,74.0000000000,153.0000000000,2711.0000000000,R,True
RegKaganova,После драки с Яценюком депутата Барну исключили из партии.   https://t.co/jgocaRQ17a https://t.co/MesQ30Df0Z,Unknown,Macedonian,2015-12-12T16:33:00,2015-12-12T16:33:00,74.0000000000,153.0000000000,2716.0000000000,R,True
RegKaganova,В Польше проходит многотысячный марш против нового правительства https://t.co/qTFao4E41c,Unknown,Russian,2015-12-12T17:55:00,2015-12-12T17:55:00,74.0000000000,153.0000000000,2717.0000000000,R,True
RegKaganova,Внедорожник вылетел с моста в Киеве: водитель погиб  https://t.co/7KqaA8BrAh Фото: censor .net. ua #Киев #авария #ДТП https://t.co/A5Dx8MIsHb,Unknown,Russian,2015-12-12T22:32:00,2015-12-12T22:32:00,74.0000000000,153.0000000000,2719.0000000000,R,True
RegKaganova,После отвода техники #ВСУ вооружение исчезло с поля зрения - ОБСЕ  https://t.co/yJNiWJbOVZ Фото:mil. gov .ua #Украина https://t.co/Y7mPvzfA6Y,Unknown,Russian,2015-12-12T22:54:00,2015-12-12T22:54:00,74.0000000000,153.0000000000,2720.0000000000,R,True
RegKaganova,"Пожар в Воронеже, где погибли более 20 человек — результат противопожарных учений  https://t.co/EiKkVCYSGv https://t.co/PCBr1W2JFs",Unknown,Russian,2015-12-13T09:11:00,2015-12-13T09:11:00,74.0000000000,153.0000000000,2723.0000000000,R,True
RegKaganova,Военный атташе Турции вызван в Минобороны РФ по инциденту с сейнером https://t.co/JwsGIJd710 https://t.co/lBQ4UzclE5,Unknown,Russian,2015-12-13T12:31:00,2015-12-13T12:31:00,74.0000000000,153.0000000000,2726.0000000000,R,True
RegKaganova,Последнюю в Ялте станцию юных техников решили пустить с молотка  В конце ноября министерство https://t.co/DKQCxy7bGG https://t.co/wkeoGRvXLp,Unknown,Russian,2015-12-13T12:39:00,2015-12-13T12:39:00,74.0000000000,153.0000000000,2727.0000000000,R,True
RegKaganova,Военные инспекторы России выполнят наблюдательный полет над Турцией https://t.co/xEpIxcX3VU,Unknown,Russian,2015-12-13T23:35:00,2015-12-13T23:35:00,74.0000000000,153.0000000000,2728.0000000000,R,True
RegKaganova,Глава ФСКН рассказал о «героиновой эпидемии» в ряде штатов США https://t.co/yM6a9HTMBf https://t.co/5y0W8Duof1,Unknown,Russian,2015-12-14T13:32:00,2015-12-14T13:32:00,74.0000000000,153.0000000000,2732.0000000000,R,True
RegKaganova,#фото_дня_ТАСС  Переговоры Сергея Лаврова с госсекретарем США Джоном Керри в Москве Фото: © Михаил Джапаридзе/ТАСС https://t.co/ECf8k12PCv,Unknown,Russian,2015-12-15T09:14:00,2015-12-15T09:14:00,74.0000000000,153.0000000000,2736.0000000000,R,True
RegKaganova,Как мать Егора Сосина пыталась вылечить сына  https://t.co/b3ump3GwHD https://t.co/qJtmlYWGUB,Unknown,Russian,2015-12-15T09:58:00,2015-12-15T09:58:00,74.0000000000,153.0000000000,2737.0000000000,R,True
RegKaganova,МВД Белоруссии готовит 12 уголовных дел против участников боев в Донбассе https://t.co/UirSgASbtl,Unknown,Russian,2015-12-15T10:17:00,2015-12-15T10:17:00,74.0000000000,153.0000000000,2738.0000000000,R,True
RegKaganova,Напомню как начиналась новая европейская жизнь после Майдана   https://t.co/ehXk2FtBSM,Unknown,Russian,2015-12-15T17:33:00,2015-12-15T17:33:00,74.0000000000,153.0000000000,2740.0000000000,R,True
RegKaganova,Харьков. Украина. #Осознание@rus_improvisation https://t.co/GxGRNGX5PC,Unknown,Ukrainian,2015-12-16T00:43:00,2015-12-16T00:43:00,74.0000000000,153.0000000000,2741.0000000000,R,True
RegKaganova,"Яровинский: думаю, Алиев перейдёт в аренду в финский клуб «Яро» https://t.co/Owp9bSrNAz",Unknown,Russian,2015-12-17T11:39:00,2015-12-17T11:39:00,74.0000000000,153.0000000000,2749.0000000000,R,True
RegKaganova,Власти Москвы: цена платной парковки соотносится с доходом москвичей https://t.co/4LPi0sUOoC https://t.co/KdTSJOpk8R,Unknown,Russian,2015-12-17T16:53:00,2015-12-17T16:53:00,74.0000000000,153.0000000000,2751.0000000000,R,True
RegKaganova,Бразильский суд распустил комиссию по импичменту президенту https://t.co/chFFCYmymW,Unknown,Russian,2015-12-18T07:24:00,2015-12-18T07:24:00,74.0000000000,153.0000000000,2753.0000000000,R,True
RegKaganova,У иностранца в Москве изъяли арсенал оружия  https://t.co/BY0xdHhYyl https://t.co/RFB5lGrvJf,Unknown,Russian,2015-12-18T07:58:00,2015-12-18T07:58:00,74.0000000000,153.0000000000,2755.0000000000,R,True
RegKaganova,Илон Маск: запуск ракеты Falcon 9 может состояться 20 декабря https://t.co/jPHiwOMQQo © AP Photo/ John Raoux https://t.co/3NFtWkAyaO,Unknown,Russian,2015-12-19T03:51:00,2015-12-19T03:51:00,74.0000000000,153.0000000000,2759.0000000000,R,True
RegKaganova,СРОЧНО. Керри: у США есть «определенные данные» о крушении Су-24  https://t.co/nJa4Is0sF8 https://t.co/bMfdmHmX4P,Unknown,Russian,2015-12-19T12:38:00,2015-12-19T12:38:00,74.0000000000,153.0000000000,2763.0000000000,R,True
RegKaganova,Хит сегодняшнего корпоратива в ГД: Максакова и Нарышкин с песней из «Бандитского Петербурга»  https://t.co/UsqdCadYEw  https://t.co/Bfp622gPB4,Unknown,Russian,2015-12-19T14:54:00,2015-12-19T14:54:00,74.0000000000,153.0000000000,2765.0000000000,R,True
RegKaganova,В Крыму застрелен наркополицейский  https://t.co/tBJ5gtgF4r https://t.co/F6WKUl1b0e,Unknown,Bulgarian,2015-12-19T16:34:00,2015-12-19T16:34:00,74.0000000000,153.0000000000,2766.0000000000,R,True
RegKaganova,"Члены ""Яблока"" приняли важное изменение в устав  https://t.co/0iXFXP57Zg https://t.co/gM8cugskMd",Unknown,Russian,2015-12-19T20:13:00,2015-12-19T20:13:00,74.0000000000,153.0000000000,2768.0000000000,R,True
RegKaganova,'@salty_1970  Атас блять. Ты хоть станок свой взял?',Unknown,Russian,2015-12-19T21:52:00,2015-12-19T21:52:00,74.0000000000,153.0000000000,2769.0000000000,R,True
RegKaganova,Проправительственные войска в Йемене ведут бои поблизости от столицы https://t.co/e5oA4o6dTo https://t.co/kJVSAweim6,Unknown,Russian,2015-12-20T07:52:00,2015-12-20T07:54:00,74.0000000000,153.0000000000,2770.0000000000,R,True
