author_id,content,region,language,publish_date,harvested_date,following,followers,updates,post_type,retweet
RegKaganova,http://t.co/HeeZMejRwF #ТоргНеУместен,Unknown,Russian,2015-06-24T18:42:00,2015-06-24T18:43:00,1469.0000000000,154.0000000000,1716.0000000000,,False
RegKaganova,Израиль об иранском соглашении: а король-то голый!  http://t.co/9zS0T1m9zc http://t.co/sctkKiA3tB,Unknown,Russian,2015-07-15T12:51:00,2015-07-15T12:51:00,1462.0000000000,151.0000000000,1736.0000000000,R,True
RegKaganova,Аэропорты Челябинска и Перми с утра не принимали самолеты из-за тумана  http://t.co/WRHE03Txkr,Unknown,Ukrainian,2015-07-17T06:32:00,2015-07-17T06:32:00,1461.0000000000,150.0000000000,1741.0000000000,R,True
RegKaganova,"Женщины предпочитают дарить подругам парфюм, запах которого не нравится им самим http://t.co/qj9YCCTu0g",Unknown,Russian,2015-07-17T12:31:00,2015-07-17T12:31:00,1461.0000000000,150.0000000000,1745.0000000000,R,True
RegKaganova,Генсек ООН призвал срочно положить конец конфликту на востоке Украины  http://t.co/lFOhzuI6qS,Unknown,Russian,2015-07-17T22:12:00,2015-07-17T22:12:00,1461.0000000000,150.0000000000,1746.0000000000,R,True
RegKaganova,ДНР обещает помочь родственникам погибших MH-17 в посещении места ЧП http://t.co/36qn9JE33r,Unknown,Russian,2015-07-18T11:54:00,2015-07-18T11:54:00,1461.0000000000,150.0000000000,1748.0000000000,R,True
RegKaganova,"Саакашвили заявил, что Путин ему угрожает http://t.co/dWl3EeYVzk",Unknown,Russian,2015-07-18T14:32:00,2015-07-18T14:32:00,1461.0000000000,150.0000000000,1750.0000000000,R,True
RegKaganova,Родственники жертв крушения самолёта во Французских Альпах отклонили компенсации авиакомпании http://t.co/mWxkbzDgfJ http://t.co/UN3wrEiUdE,Unknown,Russian,2015-07-18T17:52:00,2015-07-18T17:52:00,1461.0000000000,150.0000000000,1751.0000000000,R,True
RegKaganova,"В СБУ заявили об изъятии оборудования для прослушки оппозиции во время ""майдана"" http://t.co/ehKK5hVnZe",Unknown,Russian,2015-07-20T07:31:00,2015-07-20T07:31:00,1461.0000000000,150.0000000000,1754.0000000000,R,True
RegKaganova,Мэр Корсакова отстранена за ненадлежащее исполнение обязанностей http://t.co/WJSOkl9xe1,Unknown,Russian,2015-07-20T07:52:00,2015-07-20T07:52:00,1461.0000000000,150.0000000000,1755.0000000000,R,True
RegKaganova,У обвиняемого по делу Немцова подозревают онкологию http://t.co/rFkUfEyrYP,Unknown,Russian,2015-07-20T17:11:00,2015-07-20T17:11:00,1461.0000000000,150.0000000000,1757.0000000000,R,True
RegKaganova,Налоговая через суд заставила «Рольф» — крупнейшего продавца автомобилей в России — доплатить почти 95 млн рублей: http://t.co/myi2JsBhIt,Unknown,Russian,2015-07-21T16:03:00,2015-07-21T16:03:00,1313.0000000000,150.0000000000,1758.0000000000,R,True
RegKaganova,Чебан: цифры по посещаемости матчей были предсказуемы http://t.co/1b6TLs1Nbt,Unknown,Russian,2015-07-22T10:12:00,2015-07-22T10:12:00,1313.0000000000,151.0000000000,1763.0000000000,R,True
RegKaganova,Чемезов попросил у Путина монополию на поставки лекарств от ВИЧ: http://t.co/KXjm8GRhO9,Unknown,Russian,2015-07-23T00:10:00,2015-07-23T00:11:00,1313.0000000000,151.0000000000,1768.0000000000,R,True
RegKaganova,СМИ узнали о планах Пентагона передать Украине мощный радар  http://t.co/liGvM5cOsq,Unknown,Russian,2015-07-23T01:51:00,2015-07-23T01:51:00,1313.0000000000,151.0000000000,1769.0000000000,R,True
RegKaganova,"'@SFGO76 @au_auk Хай, вата!'",Unknown,Russian,2015-07-23T02:51:00,2015-07-23T02:51:00,1313.0000000000,151.0000000000,1770.0000000000,R,True
RegKaganova,«Роснефть» обвинила правительство в потенциальном дефиците бензина  http://t.co/xPoALROqKb http://t.co/EbbbD02g7W,Unknown,Russian,2015-07-23T15:11:00,2015-07-23T15:12:00,1313.0000000000,150.0000000000,1773.0000000000,R,True
RegKaganova,На стадионе «Динамо» установят самое большое информационное табло в России http://t.co/Xx50kxvtaw,Unknown,Russian,2015-07-24T09:53:00,2015-07-24T09:53:00,1313.0000000000,150.0000000000,1776.0000000000,R,True
RegKaganova,«Газпром» подтвердил подачу иска в Стокгольмский арбитраж о пересмотре цен на туркменский газ: http://t.co/OrghQWJY8w,Unknown,Russian,2015-07-24T12:32:00,2015-07-24T12:33:00,1313.0000000000,150.0000000000,1776.0000000000,R,True
RegKaganova,Обама прибыл с визитом на историческую родину отца в Кению http://t.co/JFC5x3aRzx,Unknown,Russian,2015-07-24T18:32:00,2015-07-24T18:32:00,1313.0000000000,150.0000000000,1782.0000000000,R,True
RegKaganova,«Динамо» в понедельник предложит трёхлетний контракт М'Вила http://t.co/Q4bSRBghvw,Unknown,Russian,2015-07-25T13:32:00,2015-07-25T13:32:00,1313.0000000000,150.0000000000,1786.0000000000,R,True
RegKaganova,"Кримсон-дайджест 25/07/15  Сегодня в меню: Иран и Сирия, Хиллари Клинтон сдает позиции и внезапно... снова Медведев   http://t.co/0DxTxJrBFn",Unknown,Russian,2015-07-26T05:52:00,2015-07-26T05:52:00,1313.0000000000,150.0000000000,1789.0000000000,R,True
RegKaganova,Интернет в Петербурге оказался самым дешёвым в России http://t.co/onQFVlu0Wc http://t.co/2nw2KzX1BP,Unknown,Russian,2015-07-26T07:32:00,2015-07-26T07:32:00,1313.0000000000,150.0000000000,1790.0000000000,R,True
RegKaganova,"Азар: если я перестану работать над собой, защитники меня убьют http://t.co/cnM4MHpLwT",Unknown,Russian,2015-07-26T09:32:00,2015-07-26T09:32:00,1313.0000000000,150.0000000000,1791.0000000000,R,True
RegKaganova,Турецкие истребители вновь нанесли авиаудары по позициям курдов в Ираке #новости http://t.co/wHCFlwgqGL,Unknown,Russian,2015-07-26T19:52:00,2015-07-26T19:52:00,1313.0000000000,149.0000000000,1794.0000000000,R,True
RegKaganova,Бышовец: «Локомотив» должен увезти из Махачкалы три очка http://t.co/iYD5AnE7XP,Unknown,Russian,2015-07-27T14:12:00,2015-07-27T14:12:00,1314.0000000000,150.0000000000,1798.0000000000,R,True
RegKaganova,Латвийская ассоциация охотников предлагает увезти терроризирующих Ригу кабанов на полигон НАТО  http://t.co/vH0wnNfMux http://t.co/YvEmikIe4y,Unknown,Russian,2015-07-27T15:31:00,2015-07-27T15:34:00,1314.0000000000,151.0000000000,1799.0000000000,R,True
RegKaganova,Россия готова запретить ввоз цветов из Голландии.   http://t.co/FhspjiRl7x http://t.co/Ff5SOhqAz8,Unknown,Russian,2015-07-27T17:52:00,2015-07-27T17:52:00,1314.0000000000,151.0000000000,1801.0000000000,R,True
RegKaganova,"Артисты просят Путина не продавать ""Русскую медиагруппу"" http://t.co/WntHNpgYHX",Unknown,Russian,2015-07-27T20:51:00,2015-07-27T20:51:00,1314.0000000000,151.0000000000,1803.0000000000,R,True
RegKaganova,ЭКСКЛЮЗИВ. «Бойцов ГРУ» обменяли на украинских силовиков  http://t.co/Y19g5UhfCc http://t.co/KHVVKKy9mg,Unknown,Russian,2015-07-27T21:52:00,2015-07-27T21:53:00,1314.0000000000,151.0000000000,1804.0000000000,R,True
RegKaganova,Пять зарубежных клубов заинтересованы в игроках юношеской сборной России http://t.co/CCHpyqtyrb,Unknown,Russian,2015-07-28T13:33:00,2015-07-28T13:33:00,1314.0000000000,151.0000000000,1808.0000000000,R,True
RegKaganova,СБ ООН проголосует по резолюции о создании трибунала по авиакатастрофе Boeing на Украине  http://t.co/KhtNuB3ajL,Unknown,Russian,2015-07-28T22:51:00,2015-07-28T22:51:00,1314.0000000000,152.0000000000,1812.0000000000,R,True
RegKaganova,Уциев впервые после травмы провёл тренировку в общей группе http://t.co/A0sxiSm3E4,Unknown,Russian,2015-07-29T08:13:00,2015-07-29T08:13:00,1314.0000000000,153.0000000000,1815.0000000000,R,True
RegKaganova,Запретом NED Путин душит зачатки истинной демократии — Washington Post http://t.co/e43UwOUhlS http://t.co/Dk8opY3Cmp,Unknown,Russian,2015-07-29T08:52:00,2015-07-29T08:52:00,1314.0000000000,153.0000000000,1816.0000000000,R,True
RegKaganova,Связной банк объявил об ограничении пополнения вкладов http://t.co/PtXQmmsKPC,Unknown,Russian,2015-07-29T13:32:00,2015-07-29T13:32:00,1314.0000000000,152.0000000000,1818.0000000000,R,True
RegKaganova,"В Новосибирском зоопарке домашняя кошка ""удочерила"" рысенка http://t.co/7LZPIwDP8s",Unknown,Serbian,2015-07-29T14:12:00,2015-07-29T14:12:00,1314.0000000000,152.0000000000,1819.0000000000,R,True
RegKaganova,Песков заявил о готовности России ответить на санкции Грузии и Украины  http://t.co/DX88xDEshv http://t.co/qyMH4kpu4d,Unknown,Russian,2015-07-30T10:33:00,2015-07-30T10:33:00,1314.0000000000,152.0000000000,1824.0000000000,R,True
RegKaganova,Германия поможет Киеву разминировать Донбасс http://t.co/FcMKDPFxTN http://t.co/XNPks2aNhh,Unknown,Russian,2015-07-30T16:13:00,2015-07-30T16:13:00,1314.0000000000,152.0000000000,1826.0000000000,R,True
RegKaganova,"""Оппозиционный блок"" объявил о проведении протестных акций в Харьковской области http://t.co/72zaI50JdS",Unknown,Russian,2015-07-30T16:32:00,2015-07-30T16:32:00,1314.0000000000,152.0000000000,1827.0000000000,R,True
RegKaganova,"Кадыров рассказал, где искать убийц Немцова  http://t.co/oKBPKzt5Bq http://t.co/PFc5ZoCLz2",Unknown,Russian,2015-07-31T09:11:00,2015-07-31T09:12:00,1314.0000000000,152.0000000000,1832.0000000000,R,True
RegKaganova,Астрономы: звезды Млечного пути постепенно меняют свое местоположение http://t.co/S1oFyXMj2P,Unknown,Russian,2015-07-31T13:15:00,2015-07-31T13:15:00,1314.0000000000,152.0000000000,1833.0000000000,R,True
RegKaganova,"Побежал за гречкой и сахаром, посоны! https://t.co/KvU35ccKcX",Unknown,Ukrainian,2015-08-01T07:52:00,2015-08-01T07:52:00,1315.0000000000,153.0000000000,1840.0000000000,R,True
RegKaganova,"Пильгуй: нет гарантий, что Аршавин и Павлюченко впишутся в игру «Кубани» http://t.co/Or68usFVMr",Unknown,Russian,2015-08-01T13:32:00,2015-08-01T13:32:00,1315.0000000000,153.0000000000,1841.0000000000,R,True
RegKaganova,Как покидал Украину Янукович http://t.co/HLjtyqcfp5,Unknown,Ukrainian,2015-08-02T09:33:00,2015-08-02T09:33:00,1315.0000000000,154.0000000000,1846.0000000000,R,True
RegKaganova,Торжества в честь 85-летия ВДВ в Рязани начались с минуты молчания  http://t.co/7eSCAtGvd5,Unknown,Russian,2015-08-02T13:12:00,2015-08-02T13:13:00,1315.0000000000,154.0000000000,1847.0000000000,R,True
RegKaganova,Патриарх освятил начало строительства собора Сергия Радонежского в Чебоксарах http://t.co/EH1VaP1hEL,Unknown,Russian,2015-08-02T13:52:00,2015-08-02T13:52:00,1315.0000000000,154.0000000000,1848.0000000000,R,True
RegKaganova,Игрок юношеской сборной России Махатадзе попал в символическую сборную Евро U17 http://t.co/knzLnI9hPQ,Unknown,Russian,2015-08-03T15:51:00,2015-08-03T15:51:00,1316.0000000000,155.0000000000,1852.0000000000,R,True
RegKaganova,Порошенко предупредил о последствиях «фейковых выборов» в Донбассе: http://t.co/EOsc2i0Hzy,Unknown,Russian,2015-08-04T14:13:00,2015-08-04T14:13:00,1316.0000000000,153.0000000000,1858.0000000000,R,True
RegKaganova,Выпивавшая в день по 28 банок энергетика женщина ослепла.   http://t.co/8NIg3bO7t2 http://t.co/odCtZnEKqQ,Unknown,Russian,2015-08-04T15:31:00,2015-08-04T15:31:00,1316.0000000000,153.0000000000,1859.0000000000,R,True
RegKaganova,Укросми опять облажались http://t.co/EqdIUcNcB5,Unknown,Russian,2015-08-04T16:08:00,2015-08-04T16:08:00,1316.0000000000,153.0000000000,1860.0000000000,R,True
RegKaganova,"'@Dasssha2010 ну, зачем это она делает, мне кацца, уже все понимают :) @rykov'",Unknown,Russian,2015-08-04T21:13:00,2015-08-04T21:13:00,1316.0000000000,153.0000000000,1865.0000000000,R,True
RegKaganova,«Аякс» не выдержал скорости  http://t.co/VXLyFEKqdR http://t.co/u6Zt2hRpiD,Unknown,Ukrainian,2015-08-04T21:32:00,2015-08-04T21:32:00,1316.0000000000,153.0000000000,1866.0000000000,R,True
RegKaganova,"Дождь первым побывал центре для «ополченцев» под Ростовом и узнал, кто его финансирует  http://t.co/05Ta0CKb29 http://t.co/XFi0WgOq0o",Unknown,Russian,2015-08-05T22:12:00,2015-08-05T22:14:00,1316.0000000000,153.0000000000,1868.0000000000,R,True
RegKaganova,В ДНР сообщили о поставках из России более 200 единиц сельхозтехники: http://t.co/kcQvZQTqNh,Unknown,Russian,2015-08-06T06:13:00,2015-08-06T06:16:00,1316.0000000000,153.0000000000,1869.0000000000,R,True
RegKaganova,Бибиков: с ЦСКА «Мордовия» должна сыграть в Саранске http://t.co/z5mOsaMuAH,Unknown,Serbian,2015-08-06T19:13:00,2015-08-06T19:13:00,1316.0000000000,153.0000000000,1871.0000000000,R,True
RegKaganova,"Смешно, когда лгуны обвиняют во лжи человека, обвиняющего во лжи лгунв http://t.co/Ailj5PUZCX",Unknown,Russian,2015-08-07T07:32:00,2015-08-07T07:32:00,1316.0000000000,153.0000000000,1872.0000000000,R,True
RegKaganova,Поклонская о смерти мэра Коктебеля  http://t.co/BfRgACOt1a http://t.co/nxK1n1nQpq,Unknown,Russian,2015-08-07T15:30:00,2015-08-07T15:31:00,1316.0000000000,153.0000000000,1875.0000000000,R,True
RegKaganova,Банки начнут массово списывать деньги с должников без их ведома: http://t.co/o0CSObLhlY,Unknown,Russian,2015-08-07T15:31:00,2015-08-07T15:31:00,1316.0000000000,153.0000000000,1876.0000000000,R,True
RegKaganova,В ДНР заявляют о 18 обстрелах за сутки со стороны ВСУ  http://t.co/tNuG6fom0Z,Unknown,Russian,2015-08-09T11:12:00,2015-08-09T11:12:00,1316.0000000000,154.0000000000,1880.0000000000,R,True
RegKaganova,В Дагестане появится приложение для пассажиров городского транспорта  #hitech,Unknown,Russian,2015-08-09T18:11:00,2015-08-09T18:11:00,1316.0000000000,154.0000000000,1882.0000000000,R,True
RegKaganova,Дмитрий Медведев назвал большим праздником прошедший в Казани ЧМ по водным видам спорта http://t.co/FJHR2njHgY,Unknown,Russian,2015-08-09T20:11:00,2015-08-09T20:12:00,1316.0000000000,154.0000000000,1883.0000000000,R,True
RegKaganova,"Курс доллара вырос на 40 копеек до 64,45 рубля http://t.co/xqfDHryLQm",Unknown,Ukrainian,2015-08-10T08:13:00,2015-08-10T08:13:00,1316.0000000000,153.0000000000,1884.0000000000,R,True
RegKaganova,"""Ваши города рухнут, ваши дороги вздыбятся"": Жириновский предостерег западные страны от ""похода на Восток""   http://t.co/J9KsrxqXbS",Unknown,Russian,2015-08-11T04:31:00,2015-08-11T04:31:00,1316.0000000000,153.0000000000,1886.0000000000,R,True
RegKaganova,Саудовская Аравия может купить у России «Искандеры»  http://t.co/AEIIGD6bpW http://t.co/5lrj7CyDzO,Unknown,Russian,2015-08-11T11:31:00,2015-08-11T11:31:00,1316.0000000000,153.0000000000,1888.0000000000,R,True
RegKaganova,Власти Ярославля объяснили появление светофора за 2 млн рублей на пустыре  http://t.co/yAnJeffsw4 http://t.co/p3fM5cGBcz,Unknown,Russian,2015-08-11T15:51:00,2015-08-11T15:51:00,1316.0000000000,153.0000000000,1891.0000000000,R,True
RegKaganova,ФОТОРЕПОРТАЖ. В России вспоминают жертв трагедии «Курска»  http://t.co/KKmoCINBLR http://t.co/58kqaiaxI1,Unknown,Russian,2015-08-12T17:52:00,2015-08-12T17:52:00,1316.0000000000,153.0000000000,1898.0000000000,R,True
RegKaganova,Народный банк Китая не видит оснований для дальнейшего ослабления юаня http://t.co/aVgeAGZCHl,Unknown,Ukrainian,2015-08-13T06:54:00,2015-08-13T06:54:00,1316.0000000000,155.0000000000,1901.0000000000,R,True
RegKaganova,"Москвичи получат ""счет от планеты Земля"" в некоторых магазинах и кафе города http://t.co/H1mqtzcDhd",Unknown,Russian,2015-08-13T08:12:00,2015-08-13T08:12:00,1316.0000000000,155.0000000000,1904.0000000000,R,True
RegKaganova,Пилюля для Донбасса: кто поставляет лекарства в ДНР и ЛНР  http://t.co/1LSv6K1i2K,Unknown,Russian,2015-08-13T13:31:00,2015-08-13T13:31:00,1316.0000000000,154.0000000000,1906.0000000000,R,True
RegKaganova,Врачи не подтвердили у жителя Смоленска лихорадку Эбола http://t.co/Xi8zSQSrOc,Unknown,Ukrainian,2015-08-13T14:11:00,2015-08-13T14:11:00,1316.0000000000,154.0000000000,1907.0000000000,R,True
RegKaganova,Нидерланды назвали дату публикации отчёта о крушении MH 17  https://t.co/FMFvC1Zbvl http://t.co/Xb5qS4Qhb5,Unknown,Russian,2015-08-13T16:33:00,2015-08-13T16:33:00,1316.0000000000,154.0000000000,1908.0000000000,R,True
RegKaganova,Продам вилку (пику) и щипцы для омаров и устричную ложечку. Без смс.,Unknown,Ukrainian,2015-08-16T15:02:00,2015-08-16T15:03:00,1315.0000000000,154.0000000000,1920.0000000000,R,True
RegKaganova,"Школа, газопровод и 6 домов повреждены в Донецке из-за обстрела  http://t.co/RNb475OAoU http://t.co/NDHNQwHTSw",Unknown,Russian,2015-08-17T06:31:00,2015-08-17T06:31:00,1315.0000000000,154.0000000000,1921.0000000000,R,True
RegKaganova,"Test lab v.8 — лаборатория, построенная на базе реальных корпоративных сетей. Принять участие в разработке  #hitech",Unknown,Russian,2015-08-17T12:51:00,2015-08-17T12:51:00,1315.0000000000,154.0000000000,1926.0000000000,R,True
RegKaganova,Россельхознадзор: уничтожение контрабандных утят соответствует международной практике http://t.co/hj0mFkrqzv,Unknown,Russian,2015-08-17T17:52:00,2015-08-17T17:52:00,1315.0000000000,154.0000000000,1928.0000000000,R,True
RegKaganova,'@MargoSavazh @Mark__Shein  конечно же православные традиции',Unknown,Russian,2015-08-17T23:15:00,2015-08-17T23:15:00,1314.0000000000,154.0000000000,1930.0000000000,,False
RegKaganova,В движении поездов на Сокольнической линии метро произошел сбой  http://t.co/dUxKGCjSPI,Unknown,Russian,2015-08-18T09:15:00,2015-08-18T09:15:00,1314.0000000000,154.0000000000,1933.0000000000,R,True
RegKaganova,Отлов и обработка исключений в Yii2  #hitech,Unknown,Russian,2015-08-18T09:51:00,2015-08-18T09:51:00,1314.0000000000,154.0000000000,1934.0000000000,R,True
RegKaganova,После заявления помощницы Астахова об угрозах возбудили уголовное дело http://t.co/jt9IB8GQvV,Unknown,Russian,2015-08-18T20:52:00,2015-08-18T20:52:00,1314.0000000000,154.0000000000,1942.0000000000,R,True
RegKaganova,В ФИФА подумали -- и все-таки решили начать избавляться от коррупции  http://t.co/rVLof8CLJJ http://t.co/sMXyiAAPQK,Unknown,Russian,2015-08-18T22:13:00,2015-08-18T22:13:00,1314.0000000000,154.0000000000,1944.0000000000,R,True
RegKaganova,ВИДЕО. Пролет New Horizons над Плутоном http://t.co/UJPySEravp http://t.co/bo3To7Tiam,Unknown,Serbian,2015-08-19T20:31:00,2015-08-19T20:31:00,1313.0000000000,154.0000000000,1951.0000000000,R,True
RegKaganova,Тем временем... http://t.co/pR8pSGK75x,Unknown,Russian,2015-08-20T02:51:00,2015-08-20T02:51:00,1313.0000000000,154.0000000000,1954.0000000000,R,True
RegKaganova,Елена Батурина в третий раз стала самой богатой женщиной России по версии Forbes http://t.co/4P8IVi7ZeU,Unknown,Russian,2015-08-20T07:53:00,2015-08-20T07:53:00,1313.0000000000,154.0000000000,1955.0000000000,R,True
RegKaganova,Президент Греции принял отставку Алексиса Ципраса http://t.co/lLAfqztiGw,Unknown,Russian,2015-08-20T19:31:00,2015-08-20T19:31:00,1313.0000000000,156.0000000000,1962.0000000000,R,True
RegKaganova,Цитата дня 23.08.2015 http://t.co/Ma3Da5J5VJ http://t.co/RXkRtvsvCb,Unknown,Macedonian,2015-08-23T08:11:00,2015-08-23T08:11:00,1313.0000000000,159.0000000000,1974.0000000000,R,True
RegKaganova,Презентация хоккейной команды СКА 2015/2016 http://t.co/MGfWe4ATsf #спб  #спорт,Unknown,Russian,2015-08-24T07:30:00,2015-08-24T07:30:00,1313.0000000000,159.0000000000,1978.0000000000,R,True
RegKaganova,#НевскиеНовости Суд в Гааге обязал РФ выплатить компенсацию за арест Arctic Sunrise http://t.co/07zT8W3IpV #СПб,Unknown,Russian,2015-08-24T17:11:00,2015-08-24T17:11:00,1313.0000000000,159.0000000000,1981.0000000000,R,True
RegKaganova,WSJ: кредиторы предложили Украине списать 20% долга #новости http://t.co/lnsAdqcdLp,Unknown,Russian,2015-08-24T22:53:00,2015-08-24T22:53:00,1313.0000000000,159.0000000000,1984.0000000000,R,True
RegKaganova,КПРФ потребовала показать документ о присвоении Якунину статуса посла   https://t.co/bFDppPNfCI,Unknown,Russian,2015-08-25T12:11:00,2015-09-21T08:39:00,1313.0000000000,159.0000000000,1987.0000000000,R,True
RegKaganova,Молдавия запретила машинам с приднестровскими номерами пересекать границу  http://t.co/uQ1UjgIQq3 http://t.co/fRt4hV9e1s,Unknown,Russian,2015-08-26T22:15:00,2015-08-26T22:15:00,1311.0000000000,157.0000000000,1993.0000000000,R,True
RegKaganova,Опрос: против освобождения Васильевой высказались 70% россиян: http://t.co/nPbolzuaSX через @gazetaru,Unknown,Russian,2015-08-27T07:11:00,2015-08-27T07:11:00,1312.0000000000,157.0000000000,1999.0000000000,R,True
RegKaganova,Норвежская North Energy интересуется российским шельфом Баренцева моря http://t.co/y9pLqJSo8O,Unknown,Russian,2015-08-27T07:11:00,2015-08-27T07:11:00,1312.0000000000,157.0000000000,1998.0000000000,R,True
RegKaganova,Патриарх Кирилл в прямом эфире поговорит с россиянами http://t.co/aAtf4LvK68,Unknown,Russian,2015-08-28T13:32:00,2015-08-28T13:32:00,1311.0000000000,157.0000000000,2004.0000000000,R,True
RegKaganova,"Порошенко заявил, что 78% украинцев поддерживают децентрализацию http://t.co/lGI4PzCEfm",Unknown,Russian,2015-08-29T10:31:00,2015-08-29T10:31:00,1311.0000000000,156.0000000000,2006.0000000000,R,True
RegKaganova,"Орбиту МКС подняли с помощью космического грузовика ""Прогресс М-28М"" http://t.co/xD6YJb7oZ4",Unknown,Russian,2015-08-31T08:13:00,2015-09-27T05:55:00,278.0000000000,157.0000000000,2015.0000000000,R,True
RegKaganova,"Премьер подписал план мероприятий по строительству ""Восточного маршрута"" http://t.co/ISVwEhjqJU",Unknown,Russian,2015-08-31T15:11:00,2015-09-27T14:49:00,279.0000000000,157.0000000000,2018.0000000000,R,True
