author_id,content,region,language,publish_date,harvested_date,following,followers,updates,post_type,retweet
RegKaganova,США осуждают насилие в столице Украины http://t.co/CnJ9dTLUiK,Unknown,Russian,2015-08-31T19:51:00,2015-09-27T20:27:00,279.0000000000,157.0000000000,2021.0000000000,R,True
RegKaganova,Правительство предложило Думе изменить закон о военно-техническом сотрудничестве http://t.co/iqBuLBx5W0,Unknown,Russian,2015-09-01T07:12:00,2015-09-01T07:12:00,279.0000000000,157.0000000000,2025.0000000000,R,True
RegKaganova,"Авиаэксперт Ходоровский о покупке «Трансаэро»: Это не сделка купли-продажи, это санация  http://t.co/SSW9gEjs9r http://t.co/17hTCjYvNo",Unknown,Russian,2015-09-01T18:53:00,2015-09-01T18:53:00,278.0000000000,156.0000000000,2028.0000000000,R,True
RegKaganova,Прокурор просит для вербовавшего полицейских в «Правый сектор» Разумова 8 лет тюрьмы http://t.co/KnHePLeR18,Unknown,Ukrainian,2015-09-02T12:32:00,2015-09-02T12:32:00,279.0000000000,156.0000000000,2031.0000000000,R,True
RegKaganova,Имущество Навального могут арестовать #новости http://t.co/QMroWKNDiW,Unknown,Russian,2015-09-02T17:23:00,2015-09-02T17:23:00,279.0000000000,156.0000000000,2034.0000000000,R,True
RegKaganova,В Москве в четверг ожидается до +19 &deg;C http://t.co/mKSud2zMR4,Unknown,Russian,2015-09-03T04:11:00,2015-09-03T04:11:00,279.0000000000,157.0000000000,2035.0000000000,R,True
RegKaganova,Бесплатный Wi-Fi появился на платформах четырех станций метро в Москве  #hitech,Unknown,Russian,2015-09-03T12:11:00,2015-09-03T12:11:00,279.0000000000,157.0000000000,2037.0000000000,R,True
RegKaganova,Шувалов: жителям Владивостока предоставляется больше возможностей для успеха http://t.co/jCtxjCpSEb,Unknown,Russian,2015-09-04T03:52:00,2015-09-04T03:52:00,278.0000000000,157.0000000000,2039.0000000000,R,True
RegKaganova,Как игрушки двигают технологии  http://t.co/Ra4mdhGBRc http://t.co/eELt8VZMaX,Unknown,Russian,2015-09-04T18:12:00,2015-09-04T18:12:00,279.0000000000,158.0000000000,2042.0000000000,R,True
RegKaganova,Депутатов Рады могут лишить неприкосновенности  http://t.co/SmnK2hJb7o http://t.co/K909bvGlCa,Unknown,Russian,2015-09-05T10:11:00,2015-09-05T10:12:00,279.0000000000,158.0000000000,2044.0000000000,R,True
RegKaganova,За растрату будут судить бухгалтера общежития Восточного http://t.co/IgULTp7lUp,Unknown,Russian,2015-09-05T10:55:00,2015-09-05T10:55:00,279.0000000000,158.0000000000,2045.0000000000,R,True
RegKaganova,Maxim отказался от публикации фотографий Васильевой из-за неподходящей фигуры: http://t.co/drxRNAG2j5,Unknown,Russian,2015-09-05T14:17:00,2015-09-05T14:18:00,279.0000000000,158.0000000000,2046.0000000000,R,True
RegKaganova,Мяч сборной России — до окончания аукциона «Чемпионата» осталось менее 2 часов http://t.co/8qNoQofXkU,Unknown,Russian,2015-09-06T10:17:00,2015-09-06T10:17:00,279.0000000000,158.0000000000,2047.0000000000,R,True
RegKaganova,Скворцова отреагировала на критику со стороны ОНФ  http://t.co/oO9MtrWUNC http://t.co/CRkZEU7c0f,Unknown,Russian,2015-09-06T10:44:00,2015-09-06T10:45:00,279.0000000000,158.0000000000,2048.0000000000,R,True
RegKaganova,СМИ сообщили о возможной сделке со следствием фигуранта дела Немцова  http://t.co/psbj84woT1,Unknown,Russian,2015-09-07T09:31:00,2015-09-07T09:31:00,279.0000000000,157.0000000000,2052.0000000000,R,True
RegKaganova,За полтора года в Крыму задержали 9 подозреваемых в экстремизме http://t.co/BJfjqePy1i,Unknown,Russian,2015-09-07T14:11:00,2015-09-07T14:12:00,279.0000000000,157.0000000000,2055.0000000000,R,True
RegKaganova,В Нью-Йорке перед началом парада по случаю Дня труда неизвестный открыл стрельбу http://t.co/Pu0eA9uSG6,Unknown,Russian,2015-09-07T19:33:00,2015-09-07T19:33:00,278.0000000000,155.0000000000,2056.0000000000,R,True
RegKaganova,Apple отказалась открыть властям США доступ к сообщениям клиентов  #hitech,Unknown,Russian,2015-09-08T02:11:00,2015-09-08T02:11:00,278.0000000000,155.0000000000,2058.0000000000,R,True
RegKaganova,Казань приходит в себя после разрушительного урагана http://t.co/A2zQeukFS4,Unknown,Russian,2015-09-08T05:11:00,2015-09-08T05:11:00,278.0000000000,155.0000000000,2059.0000000000,R,True
RegKaganova,#АрхивТАСС: групповой полет с горы Тростян http://t.co/oJnJnlDlH0,Unknown,Russian,2015-09-08T06:31:00,2015-09-08T06:31:00,278.0000000000,155.0000000000,2060.0000000000,R,True
RegKaganova,Минэнерго РФ заявило о возможном повышении цен на электроэнергию http://t.co/hWeuqnYl1N http://t.co/BjdkWT0hNs,Unknown,Russian,2015-09-08T14:13:00,2015-09-08T14:14:00,278.0000000000,155.0000000000,2062.0000000000,R,True
RegKaganova,Олег Тиньков предложил купить «банк для хипстеров» — Рокетбанк — за $1 млн http://t.co/McuRqPRWAX,Unknown,Ukrainian,2015-09-09T12:33:00,2015-09-09T12:33:00,278.0000000000,157.0000000000,2069.0000000000,R,True
RegKaganova,Европа захлебывается от них http://t.co/dZAOlOMLhO,Unknown,Russian,2015-09-09T12:43:00,2015-09-09T12:44:00,278.0000000000,157.0000000000,2071.0000000000,R,True
RegKaganova,"Глава ФМС:России не грозит поток мигрантов из Сирии,но ФМС гуманно отнесётся к просьбам тех,кто обратится за помощью  http://t.co/RUKQjC4Fbw",Unknown,Russian,2015-09-09T12:43:00,2015-09-09T12:43:00,278.0000000000,157.0000000000,2070.0000000000,R,True
RegKaganova,"Ромодановский заверил, что беженцы, приехавшие в Россию, могут рассчитывать на рассмотрение заявлений  http://t.co/LTEhFcLzct",Unknown,Russian,2015-09-09T12:44:00,2015-09-09T12:44:00,278.0000000000,157.0000000000,2072.0000000000,R,True
RegKaganova,В бразильском Сан-Паулу таксисты перекрыли улицы в знак протеста против сервиса Uber  http://t.co/ognDz9SRbb,Unknown,Russian,2015-09-09T22:31:00,2015-09-09T22:31:00,278.0000000000,155.0000000000,2074.0000000000,R,True
RegKaganova,В Кремле рассказали о попытках беженцев попасть из Европы в Россию  http://t.co/LGm29Xc3gu http://t.co/fhmKHJpVmU,Unknown,Russian,2015-09-10T11:32:00,2015-09-10T11:35:00,278.0000000000,155.0000000000,2077.0000000000,R,True
RegKaganova,Мединский подал иск о защите прав на свои книги http://t.co/kxmfeoutzj,Unknown,Bulgarian,2015-09-10T13:13:00,2015-09-10T13:13:00,278.0000000000,155.0000000000,2078.0000000000,R,True
RegKaganova,"Россия начинает строительство газопровода ""Северный поток 2"".Газ из России в Германию пойдет по дну Балтийского моря http://t.co/wSoiEczpHb",Unknown,Russian,2015-09-10T14:03:00,2015-09-10T14:03:00,278.0000000000,155.0000000000,2079.0000000000,R,True
RegKaganova,"Голландская газета De Volkskrant сокрушается по поводу беженцев: ""Почему они не бегут в Россию?"" http://t.co/Cnl7oZ5mKZ",Unknown,Russian,2015-09-10T15:23:00,2015-09-10T15:24:00,278.0000000000,155.0000000000,2080.0000000000,R,True
RegKaganova,Пентагон мог нарушить условия хранения образцов чумы и энцефалита  http://t.co/rwyjWoKKLN,Unknown,Russian,2015-09-10T22:42:00,2015-09-10T22:42:00,277.0000000000,155.0000000000,2085.0000000000,R,True
RegKaganova,"Нашей армии нет в Сирии!  Символично, что вброс опровергли в день рождения Асада. Вот такой вам подарок, сирийцы)  http://t.co/tgg1wMVfpf",Unknown,Russian,2015-09-11T16:41:00,2015-09-11T16:43:00,278.0000000000,155.0000000000,2091.0000000000,R,True
RegKaganova,При обрушении мечети в Мекке пострадали более 200 человек http://t.co/52cF4DxaXF,Unknown,Russian,2015-09-11T22:02:00,2015-09-11T22:02:00,278.0000000000,156.0000000000,2094.0000000000,R,True
RegKaganova,"Коктейль ""Бетон"": Настойка бетона, соль, вода",Unknown,Bulgarian,2015-09-11T22:31:00,2015-09-11T22:34:00,278.0000000000,156.0000000000,2095.0000000000,R,True
RegKaganova,Обзор смарт-часов Pebble Time: время жать на кнопки http://t.co/lm4V7Sbdi2,Unknown,Russian,2015-09-12T09:34:00,2015-09-12T09:34:00,278.0000000000,156.0000000000,2097.0000000000,R,True
RegKaganova,На германо-австрийской границе начались проверки паспортов http://t.co/5H7B2NhXGj,Unknown,Russian,2015-09-13T20:52:00,2015-09-13T20:52:00,277.0000000000,155.0000000000,2103.0000000000,R,True
RegKaganova,Шварценеггер заменит Дональда Трампа  http://t.co/ZHigWa1fjn http://t.co/hVP4fkpobV,Unknown,Russian,2015-09-14T18:51:00,2015-09-14T18:52:00,278.0000000000,155.0000000000,2105.0000000000,R,True
RegKaganova,Ученые прогнозируют рекордное снижение уровня воды в Байкале http://t.co/YPltK5f3uY,Unknown,Russian,2015-09-15T09:31:00,2015-09-15T09:31:00,278.0000000000,155.0000000000,2107.0000000000,R,True
RegKaganova,Половина временно трудоустроенных россиян оказались сотрудниками КамАЗа  http://t.co/XgrWxDDFVZ,Unknown,Russian,2015-09-15T19:31:00,2015-09-15T19:32:00,278.0000000000,154.0000000000,2111.0000000000,R,True
RegKaganova,Россия и США изучают идеи для полета на Марс http://t.co/iiOoioC4tO http://t.co/iQumrOI612,Unknown,Russian,2015-09-15T22:32:00,2015-09-15T22:32:00,278.0000000000,154.0000000000,2112.0000000000,R,True
RegKaganova,Более 10% детей в Москве страдают ожирением http://t.co/aFEnoB3kMK,Unknown,Russian,2015-09-16T14:13:00,2015-09-16T14:13:00,278.0000000000,154.0000000000,2119.0000000000,R,True
RegKaganova,Apple отложила выпуск новой ОС для Apple Watch http://t.co/ea23uChUti,Unknown,Ukrainian,2015-09-16T16:11:00,2015-09-16T16:12:00,277.0000000000,153.0000000000,2120.0000000000,R,True
RegKaganova,Путин не планирует встреч с Турчаком http://t.co/zGdtNEetLw,Unknown,Ukrainian,2015-09-17T18:51:00,2015-09-17T18:51:00,277.0000000000,152.0000000000,2125.0000000000,R,True
RegKaganova,ФОТОРЕПОРТАЖ. 1000 дней до ЧМ по футболу-2018  http://t.co/MW1ryzLjYR http://t.co/FBBE3qmNio,Unknown,Ukrainian,2015-09-18T13:13:00,2015-09-18T13:14:00,75.0000000000,152.0000000000,2128.0000000000,R,True
RegKaganova,Суд арестовал трех московских полицейских по делу о фальсификации доказательств http://t.co/rRWnsGL1NQ,Unknown,Russian,2015-09-18T18:33:00,2015-09-18T18:33:00,75.0000000000,152.0000000000,2130.0000000000,R,True
RegKaganova,Deutsche Bank продолжит предоставлять инвестиционно-банковские услуги клиентам из РФ  http://t.co/AxIj0um7d7,Unknown,Russian,2015-09-19T11:53:00,2015-09-19T11:54:00,75.0000000000,153.0000000000,2133.0000000000,R,True
RegKaganova,Ципрас: греческий народ дал СИРИЗА мандат на четыре года  http://t.co/Jdx1aSjwju,Unknown,Russian,2015-09-20T21:51:00,2015-09-20T21:51:00,75.0000000000,153.0000000000,2136.0000000000,R,True
RegKaganova,Посольство США в России опубликовало серию коллажей с Теффтом после фото РЕН ТВ http://t.co/utdf0kPvhg,Unknown,Russian,2015-09-21T13:31:00,2015-09-21T13:32:00,75.0000000000,153.0000000000,2140.0000000000,R,True
RegKaganova,"Адвокат главы Коми рассказал о ""скромном домике"" Гайзера  http://t.co/U6JfmOYsKk http://t.co/SUPI1qt77O",Unknown,Russian,2015-09-21T15:12:00,2015-09-21T15:13:00,75.0000000000,153.0000000000,2141.0000000000,R,True
RegKaganova,Госдуме предложили повысить минимальный возраст покупателей алкоголя: http://t.co/7LT51MFkyy,Unknown,Russian,2015-09-22T08:12:00,2015-09-22T08:13:00,75.0000000000,154.0000000000,2146.0000000000,R,True
RegKaganova,"Настал момент для политического решения конфликта в Сирии, заявил президент Палестины http://t.co/UEu6BLEfLz http://t.co/nNz8vb44qk",Unknown,Russian,2015-09-22T16:54:00,2015-09-22T16:55:00,75.0000000000,154.0000000000,2148.0000000000,R,True
RegKaganova,"Bloomberg: Гейтс и Ахметов обогнали Усманова в рейтинге ""Робина Гуда"" http://t.co/z4ImzXlI72",Unknown,Ukrainian,2015-09-22T17:32:00,2015-09-22T17:32:00,75.0000000000,154.0000000000,2149.0000000000,R,True
RegKaganova,СМИ: Украина опасается ответных мер на санкции против авиакомпаний РФ  http://t.co/0VPEsN0KFj,Unknown,Russian,2015-09-23T03:32:00,2015-09-23T03:32:00,75.0000000000,154.0000000000,2152.0000000000,R,True
RegKaganova,Матч ЦСКА -- «Локомотив» покажет «Россия 2» http://t.co/vKcimbQYgD,Unknown,Russian,2015-09-23T11:12:00,2015-09-23T11:12:00,75.0000000000,154.0000000000,2154.0000000000,R,True
RegKaganova,Vertu выпустила самый мощный смартфон с сапфировым стеклом: http://t.co/mANfgZq7m2,Unknown,Russian,2015-09-24T07:32:00,2015-09-24T07:32:00,75.0000000000,154.0000000000,2156.0000000000,R,True
RegKaganova,Facebook не комментирует требование Роскомнадзора об исполнении закона о личных данных http://t.co/hbLCoVWYCV,Unknown,Russian,2015-09-24T15:51:00,2015-09-24T15:51:00,75.0000000000,154.0000000000,2158.0000000000,R,True
RegKaganova,"Пришло время занять жесткую позицию в отношении Китая и председателя КНР Си Цзиньпина (""The Washington Post"", США)   http://t.co/del2R4uKJh",Unknown,Russian,2015-09-24T16:11:00,2015-09-24T16:11:00,75.0000000000,154.0000000000,2159.0000000000,R,True
RegKaganova,"А @aksenov_sv в курсе как у этой компании дела с лицензиями и страховками, исправен ли транспорт? https://t.co/aUgb6X58Ng",Unknown,Russian,2015-09-24T20:53:00,2015-09-24T20:53:00,75.0000000000,154.0000000000,2160.0000000000,R,True
RegKaganova,"Минфин США: Ирану вернут лишь $50 млрд, если он будет выполнять соглашение  http://t.co/xWNXNEi4no",Unknown,Russian,2015-09-25T02:51:00,2015-09-25T02:51:00,75.0000000000,154.0000000000,2162.0000000000,R,True
RegKaganova,Полмиллиона штрафа за «денежные суррогаты». Минфин предложил ввести уголовную ответственность за выпуск криптовалют http://t.co/omjDDvtqhh,Unknown,Russian,2015-09-25T09:32:00,2015-09-25T09:32:00,75.0000000000,154.0000000000,2164.0000000000,R,True
RegKaganova,Швейцария приостановила продажу автомобилей Volkswagen http://t.co/eLOeoyVXyL,Unknown,Russian,2015-09-25T20:11:00,2015-09-25T20:11:00,75.0000000000,155.0000000000,2166.0000000000,R,True
RegKaganova,Торги на фондовом рынке в США завершились разнонаправленным движением индексов  http://t.co/wf38uyd5q6,Unknown,Russian,2015-09-26T00:12:00,2015-09-26T00:12:00,75.0000000000,155.0000000000,2167.0000000000,R,True
RegKaganova,"Симеоне: Джексон Мартинес знает, что ему нужно прибавлять http://t.co/5VLuBaupDT",Unknown,Russian,2015-09-27T08:34:00,2015-09-27T08:34:00,75.0000000000,155.0000000000,2174.0000000000,R,True
RegKaganova,Visa опровергла возможные перебои в работе своих карт http://t.co/xvroUJTyAJ,Unknown,Russian,2015-09-28T15:52:00,2015-09-28T15:52:00,75.0000000000,157.0000000000,2182.0000000000,R,True
RegKaganova,"Х. Эрнандес: спор между Месси и Роналду, кто лучше, решается «Золотым мячом» http://t.co/dqshECY3wA",Unknown,Russian,2015-09-29T11:34:00,2015-09-29T11:34:00,75.0000000000,157.0000000000,2186.0000000000,R,True
RegKaganova,Порошенко. Выступление в ООН. Финал.)))   http://t.co/4qAFFHXEdu @coub,Unknown,Russian,2015-09-29T11:52:00,2015-09-29T11:52:00,75.0000000000,157.0000000000,2187.0000000000,R,True
RegKaganova,"чем сильнее твоя армия, тем меньше шансов, что кто-то рискнет это проверить",Unknown,Russian,2015-09-29T20:53:00,2015-09-29T20:53:00,75.0000000000,157.0000000000,2191.0000000000,R,True
RegKaganova,"Германия не будет размещать американские атомные бомбы, а вместо этого подготовит места для российских флагов над своими госучреждениями",Unknown,Russian,2015-09-30T06:32:00,2015-09-30T06:32:00,75.0000000000,157.0000000000,2192.0000000000,R,True
RegKaganova,"'@SFGO76 хохлы также понимают, что в разрешении СФ не сказано, где конкретно Президенту можно применять ВС РФ Просто ""за границей..."" )))'",Unknown,Russian,2015-09-30T15:32:00,2015-09-30T15:33:00,74.0000000000,156.0000000000,2193.0000000000,R,True
RegKaganova,Дипломат: Эр-Рияд никому не позволит использовать в своих целях гибель паломников  http://t.co/ICy76E2jFr,Unknown,Russian,2015-10-01T00:22:00,2015-10-01T00:22:00,74.0000000000,156.0000000000,2200.0000000000,R,True
RegKaganova,Д. Мартинес не боится критики и надеется реабилитироваться в игре с «Реалом» http://t.co/iWnvIfsODG,Unknown,Russian,2015-10-01T08:14:00,2015-10-01T08:14:00,74.0000000000,156.0000000000,2201.0000000000,R,True
RegKaganova,"Пентагон считает ""профессиональными и сердечными"" консультации с военными РФ по Сирии https://t.co/gKNKJW8b4g",Unknown,Russian,2015-10-01T20:51:00,2015-10-01T20:51:00,74.0000000000,155.0000000000,2204.0000000000,R,True
RegKaganova,Генпрокуратура отказалась защитить Роднину от Жириновского https://t.co/XBGR1dSXJc,Unknown,Russian,2015-10-02T06:33:00,2015-10-02T06:33:00,74.0000000000,153.0000000000,2205.0000000000,R,True
RegKaganova,«Аэрофлот» продлил срок перевозки пассажиров «Трансаэро» до 15 декабря http://t.co/E6xzynFHNe http://t.co/LtGZ4sxhGx,Unknown,Ukrainian,2015-10-02T14:11:00,2015-10-02T14:11:00,74.0000000000,151.0000000000,2206.0000000000,R,True
RegKaganova,Олланд: особый статус Донбасса должен вступить в силу со дня выборов http://t.co/uqbLzKWEFs,Unknown,Russian,2015-10-02T18:53:00,2015-10-02T18:53:00,74.0000000000,151.0000000000,2208.0000000000,R,True
RegKaganova,"Клинцевич: итогом ""Минска-2"" должны стать переговоры Киева и Донбасса  http://t.co/uCRZf8a62E http://t.co/rxNgEamHwD",Unknown,Russian,2015-10-02T23:52:00,2015-10-02T23:52:00,74.0000000000,152.0000000000,2209.0000000000,R,True
RegKaganova,МВФ предупреждает: мир ожидает массовый дефолт развивающихся рынков (Telegraph)   http://t.co/RT3jLq1oLk http://t.co/WnhPE2GnWR,Unknown,Russian,2015-10-03T04:32:00,2015-10-03T04:32:00,74.0000000000,152.0000000000,2211.0000000000,R,True
RegKaganova,"Ситуация с ""Трансаэро"" создаст больше проблем, чем банкротство туроператоров  http://t.co/4a7fwFfoAw",Unknown,Russian,2015-10-03T11:34:00,2015-10-03T11:34:00,74.0000000000,152.0000000000,2214.0000000000,R,True
RegKaganova,"Топовые блогеры @SnowmanBbrsk и @Zhitnipalzhi на передаче ""А ну ка, девушки"" 1983 год http://t.co/kD2XTze4bF",Unknown,Russian,2015-10-03T19:32:00,2015-10-03T19:32:00,74.0000000000,152.0000000000,2218.0000000000,R,True
RegKaganova,Что увидели американцы и что было вырезано из интервью В.В.Путина каналу CBS Наглядное пособие по амер. пропаганде   http://t.co/J1gzwj95d2,Unknown,Russian,2015-10-04T07:52:00,2015-10-04T07:52:00,74.0000000000,152.0000000000,2220.0000000000,R,True
RegKaganova,"Мюллер: похоже, вся футбольная Германия ждёт матча «Бавария» — «Боруссия» Д http://t.co/tGPTT48HIM",Unknown,Russian,2015-10-04T10:11:00,2015-10-04T10:11:00,74.0000000000,152.0000000000,2223.0000000000,R,True
RegKaganova,"министр обороны настолько уравновешенный человек, что когда валериане надо успокоиться, она принимает Шойгу",Unknown,Russian,2015-10-04T16:33:00,2015-10-04T16:33:00,74.0000000000,152.0000000000,2225.0000000000,R,True
RegKaganova,"'@salty_1970 Денег у меня нету, летать туда-сюда..'",Unknown,Russian,2015-10-04T17:14:00,2015-10-04T17:14:00,74.0000000000,152.0000000000,2226.0000000000,R,True
RegKaganova,"Дональд Трамп считает, что с Хусейном и Каддафи Ближний Восток был бы стабильнее http://t.co/SiGl6XHKfq",Unknown,Russian,2015-10-04T22:32:00,2015-10-04T22:32:00,74.0000000000,152.0000000000,2228.0000000000,R,True
RegKaganova,В ДНР и ЛНР допустили перенос непризнанных Киевом выборов  http://t.co/dd5yahhHMn,Unknown,Russian,2015-10-05T08:52:00,2015-10-05T08:52:00,74.0000000000,152.0000000000,2229.0000000000,R,True
RegKaganova,Минобороны: создан незамерзающий аккумулятор для арктической техники http://t.co/MjrcSEX9mY http://t.co/WbJWmKrQvI,Unknown,Russian,2015-10-05T11:53:00,2015-10-05T11:53:00,74.0000000000,152.0000000000,2231.0000000000,R,True
RegKaganova,CNN сообщил о якобы подготовке к наземной операции РФ в Сирии http://t.co/ySbhk9DGuK http://t.co/YSjlbWmO5O,Unknown,Russian,2015-10-05T21:52:00,2015-10-05T21:53:00,74.0000000000,152.0000000000,2237.0000000000,R,True
RegKaganova,ВИДЕО. Роскосмос показал «Цирк на орбите МКС»  http://t.co/pbmEq2AWZP http://t.co/al0zBrtoUh,Unknown,Russian,2015-10-06T12:12:00,2015-10-06T12:12:00,74.0000000000,152.0000000000,2242.0000000000,R,True
RegKaganova,"Гацкан: думаю, Дзюба — главная сила сборной России http://t.co/3qfbcVLcFV",Unknown,Russian,2015-10-07T12:36:00,2015-10-07T12:36:00,74.0000000000,152.0000000000,2252.0000000000,R,True
RegKaganova,Власти определились с минимальной ценой бутылки шампанского  http://t.co/PPZ6fzY2br,Unknown,Russian,2015-10-07T12:52:00,2015-10-07T12:52:00,74.0000000000,152.0000000000,2253.0000000000,R,True
RegKaganova,"Кризис ""Трансаэро"": где найти информацию по перелетам http://t.co/vmUgKt12CL",Unknown,Ukrainian,2015-10-08T01:59:00,2015-10-08T01:59:00,74.0000000000,152.0000000000,2254.0000000000,R,True
RegKaganova,"#LifeCorr  Патруль ГИБДД сопровождал кабанов, выскочивших на КАД в Петербурге  http://t.co/kzsA7iKyqG  Видео:   https://t.co/ci3GQdX3Vu",Unknown,Russian,2015-10-08T10:10:00,2015-10-08T10:10:00,74.0000000000,152.0000000000,2256.0000000000,R,True
RegKaganova,"Севастополь славится своей академической греблей. Здесь отгребали турки, англичане, французы, итальянцы, немцы…",Unknown,Russian,2015-10-09T11:52:00,2015-10-09T11:53:00,74.0000000000,152.0000000000,2265.0000000000,R,True
