author_id,content,region,language,publish_date,harvested_date,following,followers,updates,post_type,retweet
RegKaganova,"Глава Минфина Украины заявила Financial Times, что Запад мало помогает Украине http://t.co/GbbN81L1Xe http://t.co/BEJY68DNi9",Unknown,Russian,2015-10-09T13:43:00,2015-10-09T13:43:00,74.0000000000,152.0000000000,2268.0000000000,R,True
RegKaganova,СМИ: компания Twitter намерена провести массовые сокращения  http://t.co/9q4gsA5KeO,Unknown,Russian,2015-10-10T08:54:00,2015-10-10T08:54:00,74.0000000000,152.0000000000,2271.0000000000,R,True
RegKaganova,Новый выпуск «Отдыха в России»: на этот раз мы отправились в Азов  http://t.co/xV15ILVVnQ http://t.co/wLAHBq1PU6,Unknown,Russian,2015-10-10T20:12:00,2015-10-10T20:12:00,74.0000000000,152.0000000000,2273.0000000000,R,True
RegKaganova,Путин: Москва не делает разницы между шиитами и суннитами http://t.co/aRNpURaMe8,Unknown,Russian,2015-10-11T12:12:00,2015-10-11T12:12:00,74.0000000000,152.0000000000,2277.0000000000,R,True
RegKaganova,В России теология стала научной специальностью http://t.co/F4ITRpM7O3,Unknown,Russian,2015-10-11T20:31:00,2015-10-11T20:31:00,74.0000000000,152.0000000000,2280.0000000000,R,True
RegKaganova,Россия и КНР признали необходимость атомных соглашений http://t.co/2fR2U7Jy1u http://t.co/amLoBXHhdk,Unknown,Russian,2015-10-12T06:51:00,2015-10-12T06:51:00,74.0000000000,152.0000000000,2282.0000000000,R,True
RegKaganova,Кто первый встал - того и тапки   Украина и мир: Белоруссия заняла геополитическое место Украины http://t.co/za6w8iU4zC,Unknown,Russian,2015-10-13T08:51:00,2015-10-13T08:51:00,74.0000000000,152.0000000000,2194.0000000000,R,True
RegKaganova,"Суперкомпьютер ""Алмаз-Антея"" проанализировал 14 млн вариантов поражения осколками Boeing http://t.co/yOYLlYghP9",Unknown,Russian,2015-10-13T09:31:00,2015-10-13T09:31:00,74.0000000000,152.0000000000,2195.0000000000,R,True
RegKaganova,"«Алмаз-Антей»: на MH17 нет пробоин, остающихся от военной техники РФ http://t.co/RwZ8C4uzFz http://t.co/tPLA5c5RRu",Unknown,Russian,2015-10-14T10:23:00,2015-10-14T10:23:00,74.0000000000,152.0000000000,2204.0000000000,R,True
RegKaganova,Как выглядит фронтовая жизнь под Донецком во время перемирия  http://t.co/1q6gFotkz1 http://t.co/Y0x6QPVHHn,Unknown,Russian,2015-10-14T20:14:00,2015-10-14T20:15:00,74.0000000000,152.0000000000,2207.0000000000,R,True
RegKaganova,Генсек НАТО одобрил решение оставить войска США в Афганистане http://t.co/LwGyMvI0Qt,Unknown,Russian,2015-10-15T18:33:00,2015-10-15T18:33:00,74.0000000000,152.0000000000,2212.0000000000,R,True
RegKaganova,Показалось http://t.co/XYz9w3xKpV,Unknown,Russian,2015-10-17T07:32:00,2015-10-17T07:32:00,74.0000000000,153.0000000000,2218.0000000000,R,True
RegKaganova,МИД РФ: Россия готова к новому расследованию крушения Boeing http://t.co/R7WuIr1acN,Unknown,Russian,2015-10-17T08:32:00,2015-10-17T08:32:00,74.0000000000,153.0000000000,2219.0000000000,R,True
RegKaganova,В Москве на улице Гарибальди произошел взрыв http://t.co/9Cepm5PndP,Unknown,Russian,2015-10-17T22:14:00,2015-10-17T22:14:00,74.0000000000,153.0000000000,2223.0000000000,R,True
RegKaganova,Драка и порванная на топ-менеджерах одежда помогли сотрудникам Air France сохранить работу https://t.co/ZYaX3oAobY,Unknown,Russian,2015-10-18T14:12:00,2015-10-18T14:12:00,74.0000000000,153.0000000000,2226.0000000000,R,True
RegKaganova,Суд признал законным отказ возбудить дело о пытках Заура Дадаева  http://t.co/rxg5O7vPgj http://t.co/jGMQhj15aK,Unknown,Russian,2015-10-19T13:52:00,2015-10-19T13:52:00,74.0000000000,154.0000000000,2233.0000000000,R,True
RegKaganova,В ДНР заявили о попытке украинских военных совершить наступление под Донецком https://t.co/epVGTVph5o,Unknown,Russian,2015-10-20T11:53:00,2015-10-20T11:53:00,74.0000000000,154.0000000000,2239.0000000000,R,True
RegKaganova,Economist: Россия не ведет «священную войну» в Сирии  https://t.co/TWi16DeoXT https://t.co/RpUsSFct2K,Unknown,Russian,2015-10-21T17:42:00,2015-10-21T17:43:00,74.0000000000,154.0000000000,2250.0000000000,R,True
RegKaganova,ВИДЕО. ДНР отводит танки от линии соприкосновения  https://t.co/7MsrmkTV55 https://t.co/uvrBhqFQXL,Unknown,Russian,2015-10-21T19:12:00,2015-10-21T19:12:00,74.0000000000,154.0000000000,2251.0000000000,R,True
RegKaganova,"Онопко: у ЦСКА есть всё для того, чтобы навязать «Манчестер Юнайтед» свою игру https://t.co/C3YdWVJwl3",Unknown,Russian,2015-10-21T19:13:00,2015-10-21T19:13:00,74.0000000000,154.0000000000,2252.0000000000,R,True
RegKaganova,На Танковой перевернулся Ford Explorer https://t.co/TzqGyHoUFl,Unknown,Russian,2015-10-22T13:53:00,2015-10-22T13:53:00,74.0000000000,154.0000000000,2256.0000000000,R,True
RegKaganova,"На Камчатке возобновились поиски потерпевшего крушение судна ""Парамушир"" https://t.co/JHAbJnfca9",Unknown,Russian,2015-10-22T22:52:00,2015-10-22T22:52:00,74.0000000000,153.0000000000,2259.0000000000,R,True
RegKaganova,Лига Европы: «Рубин» закончил матч с «Ливерпулем» со счетом 1:1 https://t.co/BxFCEEDXjk https://t.co/TJuInN3P7c,Unknown,Russian,2015-10-22T22:53:00,2015-10-22T22:53:00,74.0000000000,153.0000000000,2261.0000000000,R,True
RegKaganova,Центральный Республиканский Банк ДНР распорядился установить курсы валют на 23 октября 2015г. https://t.co/TREHWjdu8x,Unknown,Russian,2015-10-22T23:11:00,2015-10-22T23:12:00,74.0000000000,153.0000000000,2262.0000000000,R,True
RegKaganova,Мединский: открытие Года кино совместят с закрытием Года литературы https://t.co/d0gmfjxfdZ,Unknown,Russian,2015-10-23T16:33:00,2015-10-23T16:34:00,74.0000000000,153.0000000000,2264.0000000000,R,True
RegKaganova,"Керри не исключил, что Ирану могут предложить участие в переговорах по Сирии https://t.co/1BWeqL2Dsv",Unknown,Russian,2015-10-23T16:53:00,2015-10-23T16:53:00,74.0000000000,153.0000000000,2265.0000000000,R,True
RegKaganova,Правительство заложило в бюджет-2016 добычу нефти в 533 миллиона тонн https://t.co/Vk79GTdngQ https://t.co/s2FIFLRZxo,Unknown,Russian,2015-10-23T22:32:00,2015-10-23T22:32:00,74.0000000000,153.0000000000,2266.0000000000,R,True
RegKaganova,"В США 13летний школьник ограбил Baskin Robbins,угрожая продавцу ножом   В Луизиане 4-летний американец пришёл на занятия с заряж.пистолетом",Unknown,Russian,2015-10-24T10:14:00,2015-10-24T10:16:00,74.0000000000,153.0000000000,2270.0000000000,R,True
RegKaganova,Правительство Черногории: Участники митинга оппозиции напали на полицейских (ВИДЕО) https://t.co/76av3E8sEN https://t.co/LqN5aUlFu9,Unknown,Russian,2015-10-24T23:22:00,2015-10-24T23:30:00,74.0000000000,153.0000000000,2271.0000000000,R,True
RegKaganova,"Тони Блэр признал, что вторжение США в Ирак стало одной из причин появления ИГ https://t.co/4safgTnSHr https://t.co/9pMHvRHxCS",Unknown,Russian,2015-10-25T02:52:00,2015-10-25T03:00:00,74.0000000000,153.0000000000,2272.0000000000,R,True
RegKaganova,Еxit poll: кандидат Сциоли лидирует на выборах президента Аргентины https://t.co/solBHDKjzY © Flickr/ Finizio https://t.co/D86c8h7nNp,Unknown,Russian,2015-10-25T22:32:00,2015-10-25T22:32:00,74.0000000000,153.0000000000,2275.0000000000,R,True
RegKaganova,Саакашвили обвинили в фальсификации выборов  https://t.co/eJVXseDbdi https://t.co/8SBW0lhBnh,Unknown,Russian,2015-10-26T05:53:00,2015-10-26T05:53:00,74.0000000000,153.0000000000,2276.0000000000,R,True
RegKaganova,Глава банковского надзора Китая предрек новый мировой финансовый кризис https://t.co/XMoBwWkpPE,Unknown,Russian,2015-10-26T15:34:00,2015-10-26T15:34:00,74.0000000000,153.0000000000,2279.0000000000,R,True
RegKaganova,Составлен рейтинг городов России с самой высокой смертностью на дорогах https://t.co/x44Ulsi2FY,Unknown,Russian,2015-10-28T11:14:00,2015-10-28T11:14:00,74.0000000000,151.0000000000,2286.0000000000,R,True
RegKaganova,Заблудившийся китайский турист шесть дней шёл пешком из Пекина из-за трудностей перевода  https://t.co/RxNl2uXX9A https://t.co/6SwbbRm88m,Unknown,Russian,2015-10-28T12:53:00,2015-10-28T12:54:00,74.0000000000,151.0000000000,2287.0000000000,R,True
RegKaganova,Чего ждать от «Голоса улиц» в России  https://t.co/CG5XCTkg3B https://t.co/E8zEL2AB3q,Unknown,Russian,2015-10-28T14:37:00,2015-10-28T14:37:00,74.0000000000,151.0000000000,2288.0000000000,R,True
RegKaganova,Участие в переговорах по Сирии подтвердили девять стран и ЕС  https://t.co/AYxwWWWGW5,Unknown,Ukrainian,2015-10-28T19:15:00,2015-10-28T19:23:00,74.0000000000,151.0000000000,2291.0000000000,R,True
RegKaganova,«Друзья сибирских лесов» стали НКО-иноагентом в России  https://t.co/aaoS4PObdZ https://t.co/0lLaSTHXTS,Unknown,Russian,2015-10-28T21:15:00,2015-10-28T21:15:00,74.0000000000,151.0000000000,2292.0000000000,R,True
RegKaganova,"Власти Ленобласти подтвердили, что на Ford запланировано добровольное увольнение рабочих https://t.co/ovSU7hyGJW",Unknown,Russian,2015-10-29T20:15:00,2015-10-29T20:15:00,74.0000000000,151.0000000000,2298.0000000000,R,True
RegKaganova,"Де Лаурентис: Бенитес хотел видеть в «Наполи» Дамиау, а в итоге мы взяли Игуаина https://t.co/kDJtQldexs",Unknown,Russian,2015-10-30T17:32:00,2015-10-30T17:32:00,74.0000000000,151.0000000000,2303.0000000000,R,True
RegKaganova,Страны и общественные деятели соболезнуют РФ в связи с авиакатастрофой https://t.co/h5YXTolyJp #7K9268 https://t.co/OxLd9XCxAK,Unknown,Russian,2015-10-31T15:54:00,2015-10-31T15:55:00,74.0000000000,151.0000000000,2306.0000000000,R,True
RegKaganova,Крушение российского лайнера: последний полет https://t.co/CUCA1zPml5 https://t.co/rQam7weG88,Unknown,Russian,2015-11-01T03:33:00,2015-11-01T03:33:00,74.0000000000,151.0000000000,2307.0000000000,R,True
RegKaganova,"Индекс деловой активности в КНР в октябре не изменился и составил 49,8  https://t.co/QMbYxVlCWc",Unknown,Russian,2015-11-01T05:33:00,2015-11-01T05:33:00,74.0000000000,151.0000000000,2308.0000000000,R,True
RegKaganova,СМИ: число погибших от отравления алкоголем в Стамбуле возросло до 23 https://t.co/HSVIhbZ97W https://t.co/04gRwFYUEW,Unknown,Russian,2015-11-01T15:02:00,2015-11-01T15:02:00,74.0000000000,151.0000000000,2310.0000000000,R,True
RegKaganova,МЧС: прибывшие в Египет российские спасатели будут искать тела https://t.co/8js9xk0ixU,Unknown,Russian,2015-11-01T16:33:00,2015-11-01T16:33:00,74.0000000000,151.0000000000,2311.0000000000,R,True
RegKaganova,Британским журналистам не дает покоя слава британских ученых? https://t.co/vVVbFB5WQx,Unknown,Russian,2015-11-01T17:14:00,2015-11-01T17:14:00,74.0000000000,151.0000000000,2312.0000000000,R,True
RegKaganova,"Мать Карауловой: Варя не монстр, она просто влюбилась.  РЕПОРТАЖ: https://t.co/3CCZ024wYB https://t.co/rezkwtGGvl",Unknown,Russian,2015-11-01T18:54:00,2015-11-01T18:54:00,74.0000000000,151.0000000000,2314.0000000000,R,True
RegKaganova,Европейское Благо Украины https://t.co/eWNyHSDCx6,Unknown,Ukrainian,2015-11-01T19:31:00,2015-11-01T19:31:00,74.0000000000,151.0000000000,2315.0000000000,R,True
RegKaganova,Певица Адель поразила поклонников  https://t.co/hKDHP0kBTQ https://t.co/JieZnFdm5l,Unknown,Russian,2015-11-03T19:16:00,2015-11-03T19:16:00,74.0000000000,151.0000000000,2321.0000000000,R,True
RegKaganova,Акция «Мы едины» началась в День народного единства в Москве https://t.co/DkZjivKGWO https://t.co/r116MscnL7,Unknown,Russian,2015-11-04T08:32:00,2015-11-04T08:33:00,74.0000000000,151.0000000000,2322.0000000000,R,True
RegKaganova,В «Антонове» рассказали историю упавшего в Южном судане АН-12 https://t.co/YbRPKeZamw  © AP Photo https://t.co/e85py5AVmh,Unknown,Russian,2015-11-04T18:11:00,2015-11-04T18:13:00,74.0000000000,151.0000000000,2326.0000000000,R,True
RegKaganova,СМИ сообщили об удвоении численности российских военных в Сирии  https://t.co/gPCFyynn6N,Unknown,Russian,2015-11-04T23:34:00,2015-11-04T23:35:00,74.0000000000,151.0000000000,2327.0000000000,R,True
RegKaganova,СМИ: США и их союзники договорились усилить военную поддержку сирийской оппозиции  https://t.co/vDGoLYEqqb,Unknown,Russian,2015-11-05T03:53:00,2015-11-05T03:53:00,74.0000000000,151.0000000000,2328.0000000000,R,True
RegKaganova,«Краснодар» — ПАОК: онлайн-трансляция начнётся 5 ноября в 21:00 https://t.co/8eBjbLBVjf,Unknown,Russian,2015-11-05T15:33:00,2015-11-05T15:33:00,74.0000000000,151.0000000000,2331.0000000000,R,True
RegKaganova,МАК предложил перевести в госреестр РФ все иностранные самолёты  https://t.co/jNRofd1iD0,Unknown,Russian,2015-11-05T16:45:00,2015-11-05T16:49:00,74.0000000000,151.0000000000,2333.0000000000,R,True
RegKaganova,Алтайский депутат заявила о нападении перед акцией по контролю вылова рачков https://t.co/WGnRO6exOV,Unknown,Russian,2015-11-05T17:53:00,2015-11-05T17:53:00,74.0000000000,151.0000000000,2334.0000000000,R,True
RegKaganova,«Боинг» назвал абсурдным отзыв в России сертификата у Boeing 737 https://t.co/NFhqWlTUBA,Unknown,Russian,2015-11-05T18:02:00,2015-11-05T18:02:00,74.0000000000,151.0000000000,2335.0000000000,R,True
RegKaganova,"Процесс урегулирования на Украине отстает от графика, отметил Франк-Вальтер Штайнмайер https://t.co/3gTV6Bs62Z",Unknown,Russian,2015-11-06T14:16:00,2015-11-06T14:17:00,74.0000000000,151.0000000000,2341.0000000000,R,True
RegKaganova,ВИДЕО. Новые кадры «Звездных войн» показаны в японском трейлере  https://t.co/Wb0cIuBxzp https://t.co/DWgWNPaIDS,Unknown,Russian,2015-11-06T15:32:00,2015-11-06T15:32:00,74.0000000000,151.0000000000,2342.0000000000,R,True
RegKaganova,Позвони русофобу https://t.co/JHmiWYNiUs,Unknown,Russian,2015-11-06T17:16:00,2015-11-06T17:16:00,74.0000000000,151.0000000000,2343.0000000000,R,True
RegKaganova,США хотят передать другим странам более 50 заключенных  https://t.co/P3KF6BJlnB https://t.co/1YSjxg5zBt,Unknown,Russian,2015-11-06T20:15:00,2015-11-06T20:16:00,74.0000000000,151.0000000000,2344.0000000000,R,True
RegKaganova,Видео: «Бавария» — «Штутгарт» https://t.co/42XxJ2V41X,Unknown,Bulgarian,2015-11-07T19:13:00,2015-11-07T19:13:00,74.0000000000,151.0000000000,2348.0000000000,R,True
RegKaganova,Дубль Ибрагимовича помог «ПСЖ» разгромить «Тулузу» https://t.co/CDdKVSqWSY,Unknown,Russian,2015-11-07T19:16:00,2015-11-07T19:16:00,74.0000000000,151.0000000000,2349.0000000000,R,True
RegKaganova,Нобелевский лауреат Аун Сан Су Чжи проголосовала на первых свободных выборах в Мьянме https://t.co/HOsShXTGlK,Unknown,Russian,2015-11-08T06:03:00,2015-11-08T06:05:00,74.0000000000,152.0000000000,2350.0000000000,R,True
RegKaganova,Российская пара покорила Пекин  https://t.co/Hu4eTLq3Ax https://t.co/oRkIuWzDra,Unknown,Russian,2015-11-08T11:14:00,2015-11-08T11:14:00,74.0000000000,152.0000000000,2351.0000000000,R,True
RegKaganova,Букмекеры оценивают победу «Тоттенхэма» над «Арсеналом» коэффициентом 4.84 https://t.co/Rm0Juv31pz,Unknown,Russian,2015-11-08T11:14:00,2015-11-08T11:14:00,74.0000000000,152.0000000000,2352.0000000000,R,True
RegKaganova,Спасатели МЧС РФ продолжают поисковые работы на Синае в районе крушения А321 https://t.co/UTg1kJ1ioM,Unknown,Russian,2015-11-08T13:13:00,2015-11-08T13:13:00,74.0000000000,152.0000000000,2353.0000000000,R,True
RegKaganova,Туроператоры предлагают клиентам заменить поездки в Египет на другие направления https://t.co/dg2ZTHlDGw,Unknown,Russian,2015-11-08T13:15:00,2015-11-08T13:20:00,74.0000000000,152.0000000000,2354.0000000000,R,True
RegKaganova,Первые 9 минут матча «Локомотив» — «Зенит» болельщики проведут в тишине https://t.co/3TNYQR9Btt,Unknown,Russian,2015-11-08T13:16:00,2015-11-08T13:17:00,74.0000000000,152.0000000000,2355.0000000000,R,True
RegKaganova,Жители Польши не рады мигрантам https://t.co/aVpUEICEZN https://t.co/5hU5XnXoNQ,Unknown,Russian,2015-11-08T17:32:00,2015-11-08T17:32:00,74.0000000000,152.0000000000,2356.0000000000,R,True
RegKaganova,Чемезов: контракт на поставку систем С-300 в Иран вступил в силу https://t.co/qKldTg9SpQ https://t.co/n3NwQCX80S,Unknown,Russian,2015-11-09T09:12:00,2015-11-09T09:13:00,74.0000000000,152.0000000000,2357.0000000000,R,True
RegKaganova,СМИ: США делают вывод о версии теракта с A321 по разрозненным данным https://t.co/Rqmn3fyFW2 https://t.co/XAFAmdkPxj,Unknown,Russian,2015-11-09T13:51:00,2015-11-09T13:51:00,74.0000000000,153.0000000000,2359.0000000000,R,True
RegKaganova,Глава РУСАДА назвал доклад WADA непрофессиональным и поверхностным   https://t.co/DfG8UiqxET https://t.co/QGDMkbSxRy,Unknown,Russian,2015-11-09T20:13:00,2015-11-09T20:13:00,74.0000000000,152.0000000000,2363.0000000000,R,True
RegKaganova,Роберт Де Ниро открыл в Москве новый ресторан https://t.co/UUMuzsuSZ5 https://t.co/bhJaMij01l,Unknown,Russian,2015-11-09T20:31:00,2015-11-09T20:31:00,74.0000000000,153.0000000000,2364.0000000000,R,True
RegKaganova,"Фил Невилл: Марсьяль гениально быстр, это фантастическое вложение денег https://t.co/LXVP9Scjtv",Unknown,Russian,2015-11-10T08:54:00,2015-11-10T08:54:00,74.0000000000,153.0000000000,2366.0000000000,R,True
RegKaganova,«Аэрофлот» разрешил сдавать билеты в Египет https://t.co/Eo7E8TYo9z https://t.co/IcDb9NlY2q,Unknown,Russian,2015-11-11T12:34:00,2015-11-11T12:34:00,74.0000000000,152.0000000000,2370.0000000000,R,True
RegKaganova,Путин потребовал реализовывать планы по созданию современной армии https://t.co/V95yRvt12n https://t.co/v4Se2ivDVy,Unknown,Russian,2015-11-11T14:22:00,2015-11-11T14:22:00,74.0000000000,152.0000000000,2371.0000000000,R,True
RegKaganova,Авиарейсы по всему миру можно будет отслеживать с помощью спутников в реальном времени https://t.co/9opy8m6gDO,Unknown,Russian,2015-11-11T15:54:00,2015-11-11T15:54:00,74.0000000000,152.0000000000,2373.0000000000,R,True
RegKaganova,Ирак призвал коалицию к активизации действий в борьбе против ИГ https://t.co/P3LPOQQ2jZ,Unknown,Russian,2015-11-11T15:54:00,2015-11-11T15:54:00,74.0000000000,152.0000000000,2372.0000000000,R,True
RegKaganova,МВД: погибший во Внуково гражданин Таджикистана не является ваххабитом https://t.co/lGsue5odxU https://t.co/5YJrEH2xMX,Unknown,Russian,2015-11-11T21:51:00,2015-11-11T21:51:00,74.0000000000,152.0000000000,2374.0000000000,R,True
RegKaganova,Украина признала геноцидом депортацию крымских татар https://t.co/ZDJYKYZ6OL,Unknown,Ukrainian,2015-11-12T13:34:00,2015-11-12T13:34:00,74.0000000000,151.0000000000,2376.0000000000,R,True
RegKaganova,Дело возбуждено в отношении первого замглавы администрации Иваново https://t.co/2dkNYzJCwI https://t.co/7jBfGJsvm3,Unknown,Russian,2015-11-12T15:47:00,2015-11-12T15:48:00,74.0000000000,151.0000000000,2378.0000000000,R,True
RegKaganova,Продюсер: новый фильм Звягинцева это эмоционально многослойная история https://t.co/gEfrdX3FDJ https://t.co/Jqg8SMqiVE,Unknown,Russian,2015-11-12T21:42:00,2015-11-12T21:42:00,74.0000000000,152.0000000000,2381.0000000000,R,True
RegKaganova,ФБР не участвует в расследовании крушения А321 https://t.co/eUGtz8E19G,Unknown,Russian,2015-11-13T04:24:00,2015-11-13T04:24:00,74.0000000000,152.0000000000,2382.0000000000,R,True
RegKaganova,Мутко: РФС будет прозрачен в использовании каждой копейки от НОВАТЭК https://t.co/XL43Ikz8vz,Unknown,Russian,2015-11-13T09:56:00,2015-11-13T09:56:00,74.0000000000,152.0000000000,2384.0000000000,R,True
RegKaganova,"Яценюк грозит мораторием, если РФ не пойдет на реструктуризацию долга https://t.co/CnQza8r5t9 https://t.co/3eqlltwsJR",Unknown,Russian,2015-11-13T11:15:00,2015-11-13T11:15:00,74.0000000000,152.0000000000,2385.0000000000,R,True
RegKaganova,"Немецкий парламент принял закон, предусматривающий лишение свободы за допинг https://t.co/L6w07mNSbq",Unknown,Russian,2015-11-13T16:38:00,2015-11-13T16:39:00,74.0000000000,152.0000000000,2388.0000000000,R,True
RegKaganova,Власти просят не вести прямой эфир с места захвата заложников в Париже  https://t.co/hV7GF6Lx4u https://t.co/OJGAY0zxqs,Unknown,Russian,2015-11-14T00:43:00,2015-11-14T00:43:00,74.0000000000,152.0000000000,2394.0000000000,R,True
RegKaganova,Цветы и свечи несут к французскому посольству в Москве  https://t.co/haqLNlgeDj https://t.co/VxIrTvU41j,Unknown,Russian,2015-11-14T03:16:00,2015-11-14T03:16:00,74.0000000000,152.0000000000,2396.0000000000,R,True
RegKaganova,Установлена личность одного из парижских террористов https://t.co/wIlkFK8FWk,Unknown,Russian,2015-11-14T14:33:00,2015-11-14T14:33:00,74.0000000000,152.0000000000,2400.0000000000,R,True
RegKaganova,"Жители Парижа рассказывают, как они пережили ночь терактов  https://t.co/KUgds0Ah0t https://t.co/hFQFbmTUZr",Unknown,Russian,2015-11-14T16:54:00,2015-11-14T16:54:00,74.0000000000,152.0000000000,2402.0000000000,R,True
RegKaganova,Лувр временно закрыт после произошедших в Париже терактов https://t.co/K8v96dEvz4,Unknown,Russian,2015-11-14T18:10:00,2015-11-14T18:11:00,74.0000000000,152.0000000000,2404.0000000000,R,True
RegKaganova,Алексей Иванов стал двукратным чемпионом мира по боевому самбо https://t.co/9540lBgCxw https://t.co/FXm0VqjQhd,Unknown,Russian,2015-11-14T21:51:00,2015-11-14T21:51:00,74.0000000000,151.0000000000,2407.0000000000,R,True
RegKaganova,Глава администрации города в Коми арестован по подозрению в коррупции https://t.co/eC7iOleUrG,Unknown,Russian,2015-11-15T02:12:00,2015-11-15T02:13:00,74.0000000000,151.0000000000,2408.0000000000,R,True
