author_id,content,region,language,publish_date,harvested_date,following,followers,updates,post_type,retweet
nasty_grach,План У (уебать) скоро?   Путин развернул в Украине план «F» — форс-мажор http://t.co/Teahx2eYt8,Unknown,Russian,2015-09-01 13:53:00,2015-09-01 13:53:00,188,95,1906,R,1
nasty_grach,"МЭР: купив акции ""Трансаэро"", ""Аэрофлот"" не станет монополистом http://t.co/gRlAWOPRGU",Unknown,Ukrainian,2015-09-01 20:32:00,2015-09-01 20:32:00,188,95,1909,R,1
nasty_grach,В Якутии на реке Лена обнаружены два нефтяных пятна  http://t.co/y6xwSzWVbl,Unknown,Russian,2015-09-02 02:52:00,2015-09-29 03:26:00,188,95,1910,R,1
nasty_grach,Площадь пожаров в Бурятии увеличилась до 162 тыс. га  http://t.co/fM6yMVG98J,Unknown,Russian,2015-09-02 04:52:00,2015-09-29 05:06:00,188,95,1911,R,1
nasty_grach,Активисты Greenpeace приковали себя к белой медведице у офиса Shell в Лондоне http://t.co/dsvgs8BDgz http://t.co/RHRnYT5TeV,Unknown,Russian,2015-09-02 09:52:00,2015-09-02 09:52:00,188,95,1912,R,1
nasty_grach,Вице-президенту фонда «Город без наркотиков» уменьшили срок   https://t.co/eI6XcNRLWa,Unknown,Russian,2015-09-02 12:32:00,2015-09-02 12:32:00,188,95,1913,R,1
nasty_grach,Немецкие поезда прекратят рейсы в Будапешт http://t.co/PjfHtRS5tP,Unknown,Russian,2015-09-03 15:12:00,2015-09-03 15:12:00,188,95,1916,R,1
nasty_grach,Полиция решит проблему с сокращениями за счет частных охранных предприятий http://t.co/FtWs6EIbAD,Unknown,Russian,2015-09-03 18:53:00,2015-09-03 18:53:00,188,96,1918,R,1
nasty_grach,Кризис с мигрантами сильно отразился на рейтинге Меркель  http://t.co/la5SDcfVwQ http://t.co/DfTA7l5JsB,Unknown,Russian,2015-09-04 14:13:00,2015-09-04 14:13:00,188,96,1921,R,1
nasty_grach,Суд назначил новую дату слушания по делу Савченко  http://t.co/55lvfutbnL http://t.co/R83CX5Od8U,Unknown,Ukrainian,2015-09-04 14:14:00,2015-09-04 14:14:00,188,96,1922,R,1
nasty_grach,Гандольеры чистят канал в Венеции http://t.co/jRapriIyxl,Unknown,Russian,2015-09-04 14:54:00,2015-09-04 14:56:00,188,96,1924,R,1
nasty_grach,"Я не идеал, но и ты не GTA V",Unknown,Ukrainian,2015-09-04 17:29:00,2015-09-04 17:29:00,188,96,1927,R,1
nasty_grach,Клинтон выступила с заявлением из-за скандала с электронной почтой  http://t.co/BEQ30NWSxa http://t.co/I2u5ygAw4c,Unknown,Russian,2015-09-04 18:12:00,2015-09-04 18:12:00,188,96,1928,R,1
nasty_grach,Сына олигарха обвиняют в жестком убийстве школьницы  http://t.co/PRex0GSyGO http://t.co/dzTAf5zC54,Unknown,Russian,2015-09-05 08:22:00,2015-09-05 08:22:00,187,96,1929,R,1
nasty_grach,Более 60 деятелей культуры Франции поставили свои подписи под призывом помочь беженцам  http://t.co/9brhTeo9nf,Unknown,Russian,2015-09-06 08:56:00,2015-09-06 08:56:00,187,96,1932,R,1
nasty_grach,Apple отказалась открыть властям США доступ к сообщениям клиентов  #hitech,Unknown,Russian,2015-09-08 02:11:00,2015-09-08 02:11:00,187,95,1943,R,1
nasty_grach,Как вызвать такси 068 и опоздать на пять часов #Питер   http://t.co/1N7PnyZXtD http://t.co/ifvDTXt6tK,Unknown,Russian,2015-09-08 14:45:00,2015-09-08 14:45:00,187,95,1947,R,1
nasty_grach,Эксперты: развитие туризма в Санкт-Петербурге тормозит низкое качество игроков на рынке такси  http://t.co/W3bB3bbnOP http://t.co/o1gTA7lbz9,Unknown,Russian,2015-09-08 15:08:00,2015-09-08 15:09:00,187,95,1949,R,1
nasty_grach,БДИПЧ ОБСЕ открыло офис в Киеве для наблюдения за выборами на Украине 25 октября http://t.co/7OpDJXPtwF,Unknown,Ukrainian,2015-09-09 14:12:00,2015-09-09 14:12:00,187,95,1957,R,1
nasty_grach,Джастин Тимберлейк станцевал под Бейонсе на US Open  http://t.co/w7Bkk4kfBZ http://t.co/vFca8DnmUo,Unknown,Russian,2015-09-10 09:33:00,2015-09-10 09:33:00,187,95,1959,R,1
nasty_grach,В Кремле рассказали о попытках беженцев попасть из Европы в Россию  http://t.co/LGm29Xc3gu http://t.co/fhmKHJpVmU,Unknown,Russian,2015-09-10 11:32:00,2015-09-10 11:32:00,187,95,1961,R,1
nasty_grach,ФИФА удовлетворена прогрессом российских стадионов по части подготовки к ЧМ-2018 http://t.co/cIbP7RZDyZ,Unknown,Russian,2015-09-10 12:12:00,2015-09-10 12:12:00,187,95,1962,R,1
nasty_grach,Предсерийная Lada Vesta попала в первое ДТП в Тольятти http://t.co/wYWJuNrtUz http://t.co/Rp6eL7UDRr,Unknown,Russian,2015-09-10 18:53:00,2015-09-10 18:53:00,187,95,1965,R,1
nasty_grach,'@tass_agency @SPB_citizen я считаю ошибкой рождение Обамы',Unknown,Russian,2015-09-11 20:11:00,2015-09-11 20:11:00,187,95,1973,R,1
nasty_grach,Буссуфа: в последние четыре года в России я чувствовал себя очень одиноко http://t.co/fUjNR4G7zk,Unknown,Russian,2015-09-11 21:51:00,2015-09-11 21:51:00,187,95,1974,R,1
nasty_grach,Полиция Австрии спасла 42 беженцев из рефрижератора для перевозки цветов http://t.co/K1A9bKQUvA,Unknown,Ukrainian,2015-09-13 13:32:00,2015-09-13 13:32:00,185,95,1977,R,1
nasty_grach,"Тулеев в Кемеровской области набрал 97,01% голосов после обработки 20% бюллетеней http://t.co/Iso9UESAcQ",Unknown,Russian,2015-09-13 18:13:00,2015-09-13 18:14:00,185,95,1980,R,1
nasty_grach,Соратники Навального сообщили о прохождении в костромскую облдуму  http://t.co/MZq28plW6N,Unknown,Russian,2015-09-13 18:42:00,2015-09-13 18:43:00,185,95,1981,R,1
nasty_grach,ФАС признала Google нарушителем антимонопольного законодательства: http://t.co/jFfpQQHHWF,Unknown,Russian,2015-09-14 16:54:00,2015-09-14 16:54:00,185,95,1984,R,1
nasty_grach,Закон не позволяет Биллу Клинтону баллотироваться в вице-президенты США http://t.co/oswK1wEUGA,Unknown,Russian,2015-09-16 07:32:00,2015-09-16 07:32:00,186,96,1987,R,1
nasty_grach,'@GrahamWP_UK Ополченцы ДНР обнаружили «Грады» неподалеку от Донецка http://t.co/ocq9qbllij http://t.co/lJd6OcnN7F',Unknown,Serbian,2015-09-16 12:27:00,2015-09-16 12:30:00,187,96,1991,R,1
nasty_grach,В США начались дебаты кандидатов от Республиканской партии на президентских выборах http://t.co/90UKsJ69B3,Unknown,Russian,2015-09-16 23:31:00,2015-09-16 23:31:00,187,95,1994,R,1
nasty_grach,"Оппозиция в Японии блокирует парламент, протестуя против законопроекта о силах самообороны http://t.co/1KA6j4Ni2c",Unknown,Russian,2015-09-17 02:51:00,2015-09-17 02:51:00,187,94,1995,R,1
nasty_grach,"Донецк. Памятник мирным гражданам, погибшим от рук украинских неонацистов http://t.co/yP420B7ZVk",Unknown,Russian,2015-09-17 09:51:00,2015-10-14 06:11:00,187,94,1998,R,1
nasty_grach,Советские солдаты противостоят врагу во время сражения @MatEvidence http://t.co/vyIH0dJDhM,Unknown,Russian,2015-09-17 12:37:00,2015-09-17 12:40:00,187,94,2001,R,1
nasty_grach,"Ляшко: арестованный депутат Мосийчук на допросе в генпрокуратуре, офисы партии обыскивают  http://t.co/DOJ9N16oti",Unknown,Russian,2015-09-17 20:52:00,2015-09-17 20:52:00,187,95,2002,R,1
nasty_grach,Бараны! К пересчёту приготовиться! http://t.co/kOS1G2AZM8,Unknown,Russian,2015-09-18 06:32:00,2015-09-18 06:33:00,187,96,2003,R,1
nasty_grach,Словения частично прервала железнодорожное сообщение с Хорватией  http://t.co/sLr3cRRMOA,Unknown,Russian,2015-09-18 06:51:00,2015-09-18 06:51:00,187,96,2004,R,1
nasty_grach,Китайские банки спермы попытались заманить доноров с помощью iPhone 6s: http://t.co/GhvxUtGXw6,Unknown,Russian,2015-09-18 08:50:00,2015-09-18 08:50:00,187,96,2005,R,1
nasty_grach,"Мутко отреагировал на обвинения в отмывании денег против заявки ""Россия-2018""  http://t.co/HQsS2siJuV http://t.co/TVRtXa59hL",Unknown,Russian,2015-09-18 10:12:00,2015-09-18 10:12:00,187,96,2006,R,1
nasty_grach,Пьяный украинский судья на Ford насмерть сбил мотоциклиста: http://t.co/scVAtlsTOw,Unknown,Russian,2015-09-19 14:52:00,2015-09-19 14:52:00,187,97,2016,R,1
nasty_grach,В Дагестане боевики убили пятерых охотников  http://t.co/bboHTQyyRO,Unknown,Russian,2015-09-20 06:11:00,2015-09-20 06:12:00,187,97,2019,R,1
nasty_grach,«Зенит» продлит контракт Смольникова на улучшенных условиях  http://t.co/ZYS6wckxNK http://t.co/V54MMpzpjg,Unknown,Russian,2015-09-20 13:11:00,2015-09-20 13:12:00,187,97,2022,R,1
nasty_grach,"«В атаку из западни», — Геннадий Дубовой рассказал о кровавом бое в поселке Спартак (ВИДЕО) http://t.co/qdUHsFtu55",Unknown,Russian,2015-09-21 20:31:00,2015-09-21 20:31:00,187,97,2029,R,1
nasty_grach,Пескову задали вопрос о выборах в Донбассе  http://t.co/LFXG4KPdC4 http://t.co/qQRk6xTzxt,Unknown,Russian,2015-09-22 11:13:00,2015-09-22 11:13:00,187,96,2031,R,1
nasty_grach,Болельщики встретили ЦСКА в аэропорту Иркутска http://t.co/Ne418adwxf,Unknown,Russian,2015-09-22 19:04:00,2015-09-22 19:04:00,187,96,2032,R,1
nasty_grach,Фигурант дела о гибели ХК «Локомотив» получил реальный срок http://t.co/tTrrAMWc3T http://t.co/180sn06LJI,Unknown,Russian,2015-09-23 09:26:00,2015-09-23 09:26:00,187,96,2033,R,1
nasty_grach,В Киеве пригрозили в октябре начать энергетическую блокаду Крыма: http://t.co/OwK0fchFgK Зарекалась ворона говна не клевать ))),Unknown,Russian,2015-09-23 09:48:00,2015-09-23 09:48:00,187,96,2034,R,1
nasty_grach,Мария Гайдар будет баллотироваться на выборах в одесский облсовет от партии Порошенко http://t.co/cuaRs8lZzF,Unknown,Russian,2015-09-23 13:26:00,2015-09-23 13:26:00,187,96,2036,R,1
nasty_grach,Аленичев: после разгрома от «Кубани» мы сделали правильные выводы http://t.co/hZXxh88jmC,Unknown,Russian,2015-09-23 18:13:00,2015-09-23 18:13:00,187,96,2037,R,1
nasty_grach,Сербия опротестовала запрет транспорту пересекать границу Хорватии http://t.co/ucQfLFflIA,Unknown,Russian,2015-09-24 11:13:00,2015-09-24 11:13:00,187,96,2038,R,1
nasty_grach,"Послу РФ в Лондоне стоило усилий убедить Элтона Джона, что с ним хочет поговорить Путин http://t.co/28vJk2NSRz",Unknown,Russian,2015-09-24 17:53:00,2015-09-24 17:53:00,186,96,2045,R,1
nasty_grach,Газпром - мечты сбываются! https://t.co/T0ZEF2Nhaq,Unknown,Russian,2015-09-25 06:52:00,2015-09-25 06:52:00,186,96,2048,R,1
nasty_grach,Украина намерена ввести новые санкции против РФ http://t.co/P1ZrA0fhhm http://t.co/Nn1t1T2zyB,Unknown,Russian,2015-09-25 11:54:00,2015-09-25 11:54:00,186,96,2050,R,1
nasty_grach,"Меркель видит кризис, но не видит его причин   http://t.co/K02VLQDsJR http://t.co/45LfDDSwJy",Unknown,Ukrainian,2015-09-25 15:17:00,2015-09-25 15:18:00,186,96,2052,R,1
nasty_grach,Скворцова: 100 млн россиян прошли диспансеризацию за два года  http://t.co/fK8gFpAx7d,Unknown,Russian,2015-09-26 02:12:00,2015-09-26 02:12:00,186,96,2054,R,1
nasty_grach,Заммер: Левандовски в кризисе — он забил «Майнцу» всего два гола http://t.co/H1TpLoQU6N,Unknown,Macedonian,2015-09-27 08:52:00,2015-09-27 08:52:00,186,96,2057,R,1
nasty_grach,"Медведев ждет от форума ""Нефть и газ Сахалина"" конкретных предложений по развитию отрасли  http://t.co/Uh7EGVi4oJ",Unknown,Russian,2015-09-29 04:12:00,2015-09-29 04:12:00,186,96,2071,R,1
nasty_grach,Кличко пообещал назвать именем Немцова улицу в Киеве http://t.co/vh49yxFQQ8,Unknown,Russian,2015-09-29 11:53:00,2015-09-29 11:53:00,186,97,2074,R,1
nasty_grach,Мутко: долг РФС уменьшился до 700 млн рублей http://t.co/8X9dFoafca,Unknown,Russian,2015-09-29 14:34:00,2015-09-29 14:34:00,186,97,2076,R,1
nasty_grach,Сенат: Франция потеряет 200-250 млн евро на перепродаже «Мистралей» http://t.co/rt9B1aHhzE http://t.co/jsiluR95ln,Unknown,Russian,2015-09-29 16:52:00,2015-09-29 16:53:00,186,97,2077,R,1
nasty_grach,«Зенит» готов отдать А. Кержакова в аренду в зарубежный клуб http://t.co/iu9WNz0EhQ,Unknown,Russian,2015-09-30 11:13:00,2015-09-30 11:13:00,186,97,2083,R,1
nasty_grach,New Horizons передал на Землю первые цветные фото «Мордора» на Хароне http://t.co/4cxes085Zh © Фото: NASA http://t.co/qdTdZ8dpcf,Unknown,Russian,2015-10-02 07:51:00,2015-10-02 07:51:00,186,96,2094,R,1
nasty_grach,"Внешэкономбанк предлагает создать новую авиакомпанию на базе ""Трансаэро"" #новости http://t.co/aqkP4hM5En",Unknown,Russian,2015-10-02 13:32:00,2015-10-02 13:32:00,186,96,2096,R,1
nasty_grach,Водителям Москвы советуют не ездить в центр 3--4 октября из-за фестиваля «Круг света» http://t.co/UfzbrLQetE,Unknown,Russian,2015-10-02 16:32:00,2015-10-02 16:32:00,186,96,2097,R,1
nasty_grach,1965 Cadillac XP-840 Eldorado Fastback http://t.co/aVQsYq2Tmg,Unknown,Spanish,2015-10-03 17:55:00,2015-10-03 17:55:00,186,96,2102,R,1
nasty_grach,Сколько валюты отправляют в Украину заробитчане   http://t.co/fF1XhD0vT2 http://t.co/mbtcdDa9Cq,Unknown,Russian,2015-10-04 14:31:00,2015-10-04 14:31:00,186,96,2109,R,1
nasty_grach,Сборная России выиграла чемпионат Европы  http://t.co/FHuCHlVa7b http://t.co/Nv9qixDgHK,Unknown,Macedonian,2015-10-04 18:12:00,2015-10-04 18:12:00,186,96,2110,R,1
nasty_grach,В Германии подожгли приют для беженцев  http://t.co/2gjCZmUIys http://t.co/EPbinG7GKV,Unknown,Ukrainian,2015-10-04 19:33:00,2015-10-04 19:33:00,186,96,2111,R,1
nasty_grach,Дворкович: санкции не оказывают почти никакого влияния на сотрудничество с Японией  http://t.co/Xkf8AHtvSy,Unknown,Russian,2015-10-05 05:52:00,2015-10-05 05:52:00,186,96,2113,R,1
nasty_grach,Лопота сообщил о желании США допросить его по иску Boeing http://t.co/IzFutY0WvU http://t.co/5QlAl06vLp,Unknown,Russian,2015-10-05 13:51:00,2015-10-05 13:52:00,186,96,2116,R,1
nasty_grach,"На ВГТРК за 60 часов прочтут ""Войну и мир"" http://t.co/iAiPZnIL6y",Unknown,Ukrainian,2015-10-05 16:12:00,2015-10-05 16:12:00,186,96,2118,R,1
nasty_grach,From me Ту Юю: за что вручили нобелевскую премию по медицине   http://t.co/ApYEBZSyzS,Unknown,Russian,2015-10-05 16:42:00,2015-10-05 16:42:00,186,96,2119,R,1
nasty_grach,"Госслужащим хотят запретить использовать Google, Yahoo и WhatsApp http://t.co/HC53oXTgCf",Unknown,Russian,2015-10-06 06:32:00,2015-10-06 06:32:00,186,96,2120,R,1
nasty_grach,КИТ для должников. В Нижнем Новгороде начали перекрывать канализацию неплательщикам за ЖКУ http://t.co/B8AmJM8sdP,Unknown,Russian,2015-10-06 13:12:00,2015-10-14 06:11:00,186,96,2121,R,1
nasty_grach,Центральный Республиканский Банк ДНР распорядился установить курсы валют на 7 октября 2015г. http://t.co/VKCk8IH3gd,Unknown,Russian,2015-10-06 23:31:00,2015-10-06 23:31:00,186,96,2125,R,1
nasty_grach,"Дуглас Льют: Хорошей новостью является то, что у нас произошел прямой военный контакт с Россие http://t.co/flRiKnSbkX http://t.co/WEourvaJNG",Unknown,Russian,2015-10-07 14:52:00,2015-10-07 14:52:00,186,96,2131,R,1
nasty_grach,Макаревич ушел к «Гайдамакам» слушать голос бога и петь про вселенскую любовь http://t.co/bYlHBtghs1 http://t.co/Ljqt7BeF8E,Unknown,Russian,2015-10-08 09:32:00,2015-10-08 09:33:00,186,96,2131,R,1
nasty_grach,При пожаре на заводе в Электростали погибли 4 человека  http://t.co/muYg0aW5wF,Unknown,Russian,2015-10-08 10:32:00,2015-10-08 10:32:00,186,96,2132,R,1
nasty_grach,Мужчина захватил в заложники пассажиров автобуса на Филиппинах http://t.co/CxbaFwuG8r © Flickr http://t.co/OUq1F27VJn,Unknown,Russian,2015-10-08 13:35:00,2015-10-08 13:35:00,186,96,2133,R,1
nasty_grach,В Кабардино-Балкарии создан робот-автомойщик http://t.co/gh1AFlzvcB http://t.co/68d88jZFKi,Unknown,Uzbek,2015-10-08 18:52:00,2015-10-08 18:52:00,186,96,2134,R,1
nasty_grach,В Турции арестовали главного редактора газеты за оскорбление президента страны http://t.co/EZdJeD0nzJ,Unknown,Russian,2015-10-10 03:12:00,2015-10-10 03:12:00,186,96,2140,R,1
nasty_grach,Педро: в «Челси» я стал увереннее и счастливее http://t.co/VUdyOwNsA5,Unknown,Russian,2015-10-10 09:12:00,2015-10-10 09:12:00,186,96,2142,R,1
nasty_grach,"самая грустная часть дня - это когда ты смотришь, как небо становится все темнее, и понимаешь, что не сделал за день абсолютно ничего",Unknown,Russian,2015-10-10 14:51:00,2015-10-14 06:11:00,186,96,2143,R,1
nasty_grach,"Учёные смогли создать квантовый транзистор, формируя изолятор с помощью луча света http://t.co/Xsx8FcBSlZ http://t.co/oUjNwta9Ce",Unknown,Russian,2015-10-10 18:33:00,2015-10-10 18:33:00,185,96,2144,R,1
nasty_grach,Что нужно знать о жизни в Австралии  http://t.co/yJPC9i7Mhr http://t.co/WKbwe82tCM,Unknown,Russian,2015-10-11 08:11:00,2015-10-11 08:11:00,185,96,2146,R,1
nasty_grach,Авиационная бомба времен Великой Отечественной войны обнаружена в Краснодарском крае  http://t.co/YOI52vvwOm,Unknown,Russian,2015-10-11 16:34:00,2015-10-11 16:34:00,185,96,2147,R,1
nasty_grach,Астахов ждет от датчан публичной эвтаназии при детях  http://t.co/rTz7Ao00yI http://t.co/OAr8Qt5USe,Unknown,Russian,2015-10-12 18:51:00,2015-10-12 18:51:00,185,97,2045,R,1
nasty_grach,"Негры и без тебя смогут в ЦСКА голы ""Амкару"" забивать #СлуцкийНеУходи http://t.co/1jGoboeOy9",Unknown,Russian,2015-10-13 15:11:00,2015-10-13 15:12:00,185,97,2050,R,1
nasty_grach,Песков о докладе Нидерландов по трагедии с «Боингом» в Донбассе  http://t.co/9D2gdjHapa http://t.co/u2tBIk4iBV,Unknown,Russian,2015-10-13 18:31:00,2015-10-13 18:31:00,185,97,2052,R,1
nasty_grach,МИД РФ: Россия призывает продолжить расследование крушения MH17 http://t.co/zPUvM5xIba http://t.co/LIallBIfvj,Unknown,Russian,2015-10-14 09:14:00,2015-10-14 09:14:00,185,97,2057,R,1
nasty_grach,Сирийская армия начала масштабную операцию в пригороде Дамаска http://t.co/S2zya7Ym0s http://t.co/1uBp7LgJ1T,Unknown,Russian,2015-10-14 12:59:00,2015-10-14 12:59:00,185,97,2058,R,1
nasty_grach,ФИФА обнародует список из 23 претендентов на «Золотой мяч» 20 октября http://t.co/BQ3Vk3zfog,Unknown,Russian,2015-10-14 20:53:00,2015-10-14 20:53:00,185,97,2060,R,1
nasty_grach,Мексиканский Playboy продолжит публиковать фото обнаженных моделей http://t.co/mzlPYZAB11,Unknown,Russian,2015-10-15 12:12:00,2015-10-15 12:12:00,185,97,2064,R,1
nasty_grach,Менеджер банка в Москве подозревается в хищении более 10 млн рублей со счетов клиентов http://t.co/vlwVObqcjj,Unknown,Russian,2015-10-16 08:14:00,2015-10-16 08:14:00,185,97,2067,R,1
nasty_grach,«Мосгортранс» хочет оснастить наземный транспорт бесплатным Wi-Fi http://t.co/39Asasfzat © Flickr http://t.co/XyiGx9mlki,Unknown,Russian,2015-10-16 08:34:00,2015-10-16 08:34:00,185,97,2068,R,1
nasty_grach,Матч ЦСКА — «Урал» начнётся с минуты молчания в память о Филиппенкове http://t.co/oNQpQvId9G,Unknown,Russian,2015-10-16 13:31:00,2015-10-16 13:31:00,186,97,2071,R,1
nasty_grach,Новым генеральным директором телеканала НТВ станет топ-менеджер ВГТРК http://t.co/u5gC5ikCEB,Unknown,Russian,2015-10-16 19:12:00,2015-10-16 19:12:00,186,97,2076,R,1
nasty_grach,http://t.co/332f63CiiI,Unknown,Russian,2015-10-17 09:31:00,2015-10-17 09:32:00,185,97,2078,R,1
nasty_grach,В Грузии снижается число сторонников евроинтеграции http://t.co/UsCyvqEVOB,Unknown,Russian,2015-10-17 12:12:00,2015-10-26 14:03:00,185,97,2079,R,1
nasty_grach,http://t.co/F9W2hzZqDp,Unknown,Russian,2015-10-18 09:51:00,2015-10-26 14:03:00,185,97,2083,R,1
nasty_grach,Дом для внуков сделал дедушка из пластиковых бутылок от мин.воды. http://t.co/bBcgmLYYtp,Unknown,Russian,2015-10-18 13:12:00,2015-10-26 14:03:00,185,97,2084,R,1
nasty_grach,Ужасы школьной практики http://t.co/rFM1wde5m6,Unknown,Russian,2015-10-18 16:49:00,2015-10-18 16:49:00,185,97,2086,R,1
nasty_grach,Премьер: глава МГБ ЛНР объяснит действия своих подчиненных  http://t.co/gnSufR34ND,Unknown,Russian,2015-10-18 19:52:00,2015-10-18 19:52:00,185,98,2087,R,1
nasty_grach,Восьми предприятиям Швейцарии разрешили поставки сыра в Россию  http://t.co/Ftzh4H6Vy2,Unknown,Russian,2015-10-19 09:13:00,2015-10-26 14:03:00,185,98,2089,R,1
nasty_grach,"если новобранец за 45 секунд успевает раздеться сам, то дембель за 20 - вместе с девушкой",Unknown,Russian,2015-10-19 09:33:00,2015-10-19 09:33:00,185,98,2090,R,1
nasty_grach,"""Марсианин"" снова возглавил российский прокат http://t.co/rk22xylmqQ",Unknown,Russian,2015-10-19 11:11:00,2015-10-19 11:12:00,185,98,2091,R,1
nasty_grach,Матвиенко: военная операция России в Сирии не будет затяжной http://t.co/xLCzlLQW6y,Unknown,Russian,2015-10-19 12:13:00,2015-10-19 12:13:00,185,98,2092,R,1
nasty_grach,Все похитители памятника Леонову взяты под стражу по решению суда https://t.co/ugtEBrdg1N,Unknown,Russian,2015-10-19 19:31:00,2015-10-19 19:32:00,185,98,2093,R,1
nasty_grach,"Крис Мартин и Лили Аллен спели в честь 80-летия основателя ""Гластонбери"" https://t.co/gvihR4cXlv",Unknown,Russian,2015-10-20 08:53:00,2015-10-20 08:53:00,185,97,2098,R,1
nasty_grach,Госдума может разрешить россиянам оформлять одновременно два загранпаспорта https://t.co/s0f5MwJfZu,Unknown,Russian,2015-10-20 15:12:00,2015-10-20 15:12:00,185,97,2100,R,1
nasty_grach,дядя упоролся https://t.co/PSclLTWPEH,Unknown,Russian,2015-10-21 18:14:00,2015-10-21 18:17:00,185,97,2107,R,1
