author_id,content,region,language,publish_date,harvested_date,following,followers,updates,post_type,retweet
nasty_grach,Британцы стали самыми пожилыми молодоженами мира https://t.co/rGmsdrQdki,Unknown,Russian,2015-11-18 09:03:00,2015-11-18 09:03:00,185,101,2321,R,1
nasty_grach,ФИФА отклонила апелляции Блаттера и Платини https://t.co/eo5U2EHCaN,Unknown,Uzbek,2015-11-18 13:19:00,2015-11-18 13:19:00,185,101,2322,R,1
nasty_grach,СМИ: самолет с президентом Эстонии на борту аварийно сел в Берлине https://t.co/CaW4KQyUsk https://t.co/zemmKIDghC,Unknown,Serbian,2015-11-18 16:34:00,2015-11-18 16:35:00,185,101,2326,R,1
nasty_grach,Демонтаж 14-го корпуса Кремля: эксперты в ожидании сенсаций и кладов https://t.co/ZU51iPyzCg https://t.co/7lYi4CBB0R,Unknown,Russian,2015-11-18 18:51:00,2015-11-18 18:51:00,185,101,2328,R,1
nasty_grach,Гумконвой МЧС России в 45-й раз отправился в Донбасс https://t.co/TxTLG50SWC https://t.co/Ipl4hPCU3J,Unknown,Russian,2015-11-19 02:14:00,2015-11-19 02:14:00,185,101,2331,R,1
nasty_grach,Полпред президента РФ в ДФО назвал причину замедления строительства судоверфи «Звезда» https://t.co/qlk8QxFyG2 https://t.co/FWZC9K3ivm,Unknown,Russian,2015-11-19 06:15:00,2015-11-19 06:15:00,185,101,2333,R,1
nasty_grach,"Большинство россиян готовы продолжить работать на пенсии, по данным ВЦИОМ https://t.co/Wvl2cfVxn0",Unknown,Russian,2015-11-19 08:35:00,2015-11-19 08:35:00,185,101,2334,R,1
nasty_grach,"Разобрались, чем боевики ИГИЛ и другие террористы отличаются от обыкновенных людей  https://t.co/NDKIJJnppr https://t.co/IcERq58Q3U",Unknown,Russian,2015-11-19 09:34:00,2015-11-19 09:34:00,185,101,2336,R,1
nasty_grach,Агент Сычёва: на следующей неделе будет понятно по поводу карьеры Дмитрия https://t.co/QmTard8cAS,Unknown,Russian,2015-11-19 11:14:00,2015-11-19 11:14:00,185,101,2338,R,1
nasty_grach,"РУСАДА продолжит свою деятельность на территории России в формате, который будет согласован с WADA https://t.co/yeHtgR4zye",Unknown,Russian,2015-11-19 13:19:00,2015-11-19 13:20:00,185,101,2341,R,1
nasty_grach,Министерство юстиции проведет семинар для нотариусов Донецкой Народной Республики https://t.co/TIwFCaiPiP,Unknown,Russian,2015-11-19 14:32:00,2015-11-19 14:32:00,185,101,2342,R,1
nasty_grach,Кадлец перейдёт из «Айнтрахта» в «Мидтьюлланн» https://t.co/vIPW7HAUn3,Unknown,Ukrainian,2015-11-19 15:26:00,2015-11-19 15:26:00,185,101,2344,R,1
nasty_grach,Moody's повысило суверенный рейтинг Украины https://t.co/1neVdTdMl3,Unknown,Russian,2015-11-20 03:54:00,2015-11-20 03:55:00,185,100,2345,R,1
nasty_grach,В США сирийских беженцев сравнили с собаками  https://t.co/u5d2FXaYhw https://t.co/mrY3dN5uVG,Unknown,Russian,2015-11-20 06:11:00,2015-11-20 06:11:00,185,100,2347,R,1
nasty_grach,"Широков: если меня отстранят в «Спартаке», то это ударит по тренеру https://t.co/Dt8s1TSZXl",Unknown,Russian,2015-11-20 08:55:00,2015-11-20 08:55:00,185,100,2349,R,1
nasty_grach,«Разрыв Европы и России был большой ошибкой»  https://t.co/nfMQIPvqA9 https://t.co/XSBQafUosj,Unknown,Russian,2015-11-20 09:44:00,2015-11-20 09:45:00,185,100,2350,R,1
nasty_grach,"Официальный курс евро на выходные и понедельник вырос до 69,39 рубля https://t.co/6XbA3sssnG https://t.co/D1IFWbDTWs",Unknown,Russian,2015-11-20 10:36:00,2015-11-20 10:36:00,185,100,2351,R,1
nasty_grach,"Маслов: Денисов защищён, тренер не может даже послать его на три буквы https://t.co/BAKEIdhfWW",Unknown,Russian,2015-11-20 14:16:00,2015-11-20 14:16:00,185,100,2354,R,1
nasty_grach,В Думе считают протесты дальнобойщиков подготовкой «боевиков Навального» к «майдану»@navalny https://t.co/h8BPshE8Gv https://t.co/s5leFPrdh1,Unknown,Russian,2015-11-20 16:37:00,2015-11-20 16:37:00,185,100,2356,R,1
nasty_grach,Неприятный сюрприз от Tesla   https://t.co/QOGiGuYd5G https://t.co/sD7A9vKw8e,Unknown,Russian,2015-11-20 20:18:00,2015-11-20 20:18:00,185,100,2358,R,1
nasty_grach,Капелло: фавориты чемпионата Европы — Германия и Испания https://t.co/bEZo1HHaQD,Unknown,Russian,2015-11-20 23:32:00,2015-11-20 23:32:00,185,100,2359,R,1
nasty_grach,SpaceX заключила контракт с НАСА на полет своего корабля к МКС: https://t.co/93ZbrnkxMi,Unknown,Russian,2015-11-21 02:35:00,2015-11-21 02:35:00,185,100,2360,R,1
nasty_grach,СРОЧНО. В Брюсселе объявлен максимальный уровень террористической угрозы  https://t.co/gCemLjZ4Fc https://t.co/W57LqeGcZI,Unknown,Russian,2015-11-21 05:42:00,2015-11-21 05:42:00,185,100,2361,R,1
nasty_grach,"Самолет ""Белавиа"" вернулся в Минск из-за сообщения об отказе навигационной системы https://t.co/nwu62CfvAR",Unknown,Russian,2015-11-21 08:57:00,2015-11-21 08:57:00,185,100,2362,R,1
nasty_grach,Националист Демушкин подаст в суд на Lifenews https://t.co/WhXjbqZ46L https://t.co/CtxNnqOLUc,Unknown,Uzbek,2015-11-21 12:12:00,2015-11-21 12:12:00,185,100,2366,R,1
nasty_grach,Беженцы-мусульмане из Ливана выбросили за борт 12 христиан на пути в Италию https://t.co/3vSv58VXMI,Unknown,Ukrainian,2015-11-21 16:34:00,2015-11-21 16:34:00,185,100,2367,R,1
nasty_grach,"FP: время смены режимов прошло, Запад должен принять Асада https://t.co/yb15mT8qPG https://t.co/vv22TNO59U",Unknown,Russian,2015-11-21 22:02:00,2015-11-21 22:02:00,185,100,2369,R,1
nasty_grach,"'@turist532 неее, на поезде дороже :) https://t.co/QidYfGmwf5'",Unknown,Ukrainian,2015-11-21 23:35:00,2015-11-21 23:35:00,185,100,2370,R,1
nasty_grach,"Ленур Ислямов первым побежал за нашим паспортом в 2014 году, например https://t.co/vpHg1bwE57",Unknown,Russian,2015-11-21 23:54:00,2015-11-21 23:54:00,185,100,2371,R,1
nasty_grach,Перебои в работе мобильной связи в Крыму могут возникнуть утром https://t.co/UWnYd3lMaM https://t.co/Qy21DZBASc,Unknown,Russian,2015-11-22 03:51:00,2015-11-22 03:51:00,185,100,2372,R,1
nasty_grach,Стадион в Атланте не подтвердил данные о возможном теракте https://t.co/LmX9rIEGKg © Flickr/ John Liu https://t.co/D39CmLnPO3,Unknown,Russian,2015-11-22 05:02:00,2015-11-22 05:02:00,185,100,2374,R,1
nasty_grach,"Браво — первый вратарь с 2011 года, кому удалось остоять на ноль в «класико» https://t.co/vINrKp3AKE",Unknown,Russian,2015-11-22 10:23:00,2015-11-22 10:23:00,185,100,2375,R,1
nasty_grach,"Генпрокуратура Киргизии заявила, что пилоты Boeing нарушили правила безопасности https://t.co/2Apdzteglb",Unknown,Russian,2015-11-22 11:14:00,2015-11-22 11:15:00,185,100,2376,R,1
nasty_grach,Обама дал обещание насчет ИГИЛ  https://t.co/sNBxQxlHWV https://t.co/Si0LKHKeO0,Unknown,Russian,2015-11-22 11:17:00,2015-11-22 11:17:00,185,100,2377,R,1
nasty_grach,Комиссия МАК начала работу на месте аварийной посадки Boeing в Оше https://t.co/dMdOsPu4vN https://t.co/bONryKRfN3,Unknown,Russian,2015-11-23 07:17:00,2015-11-23 07:18:00,185,100,2382,R,1
nasty_grach,В Греции опровергли данные СМИ о попытке потопить лодку беженцев https://t.co/k8x8afQGxx https://t.co/r0NSvGwN0x,Unknown,Russian,2015-11-23 07:56:00,2015-11-23 07:56:00,185,100,2384,R,1
nasty_grach,"Офицер таможни убит, двое полицейских ранены во французском Тулоне https://t.co/D14wuRuP9G ©AP Photo/ Francois Mori https://t.co/UYd0I0iHZl",Unknown,Russian,2015-11-23 12:52:00,2015-11-23 12:52:00,185,100,2387,R,1
nasty_grach,Порошенко предлагает обсудить прекращение грузового сообщения с Крымом https://t.co/MGzPhbu5Of https://t.co/ptaiAKsFZF,Unknown,Russian,2015-11-23 12:53:00,2015-11-23 12:53:00,185,100,2388,R,1
nasty_grach,Путин: России по силам реализовать все планы по экспорту газа https://t.co/CMerRkG1Ih https://t.co/ezLRNiZh3Q,Unknown,Russian,2015-11-23 14:51:00,2015-11-23 14:51:00,185,100,2389,R,1
nasty_grach,Мосгорсуд удовлетворил иск Минюста о ликвидации саентологической церкви Москвы https://t.co/q0I0Y2mXzg,Unknown,Russian,2015-11-23 15:34:00,2015-11-23 15:35:00,185,100,2390,R,1
nasty_grach,Там в основном хохлы с Донбасса. Гнать нахуй на родину! https://t.co/c4TSvOYaaD,Unknown,Serbian,2015-11-23 15:53:00,2015-11-23 15:53:00,185,100,2391,R,1
nasty_grach,Мечом и добрым словом  https://t.co/eNSV96ld3S https://t.co/2QJN7EZEVa,Unknown,Serbian,2015-11-23 18:17:00,2015-11-23 18:17:00,185,100,2394,R,1
nasty_grach,"'@turist532 нет, но просит всех по рублю давать. Странно. Другие кондукторы наоборот мелочь не любят )'",Unknown,Russian,2015-11-24 04:11:00,2015-11-24 04:12:00,185,100,2396,R,1
nasty_grach,"Немецкие бизнесмены готовы инвестировать в Крым, разрабатывая схемы обхода европейских санкций https://t.co/Cwkjwf3kkD",Unknown,Russian,2015-11-24 06:58:00,2015-11-24 06:58:00,185,100,2398,R,1
nasty_grach,"Стоимость газа на европейской Украине,дебил,7.2 грн/м³.На 3 сам умножишь или гуманитарий?  @ChiefLiberal @m_murkova https://t.co/vjvI41ycRY",Unknown,Russian,2015-11-24 08:38:00,2015-11-24 08:38:00,185,100,2399,R,1
nasty_grach,На Патриарших появится памятник Булгакову https://t.co/eceJz1aEIQ,Unknown,Russian,2015-11-24 11:13:00,2015-11-24 11:14:00,185,100,2400,R,1
nasty_grach,Пожарные пытаются потушить пожар после взрыва резервуара на нефтеперерабатывающем заводе в Китае  https://t.co/qBTcpnRWY1,Unknown,Russian,2015-11-24 12:18:00,2015-11-24 12:23:00,185,100,2401,R,1
nasty_grach,"в Госдуме надо держать роту ВДВ, чтоб депутаты понимали, что им в любую минуту могут всечь, если они ляпнут глупость",Unknown,Russian,2015-11-24 12:58:00,2015-11-24 12:58:00,185,100,2402,R,1
nasty_grach,Российский вертолет в Сирии экстренно сел в провинции Латакия  https://t.co/8a0oMlINE4,Unknown,Russian,2015-11-24 14:12:00,2015-11-24 14:12:00,185,100,2404,R,1
nasty_grach,Одиночные пикеты из-за ЧП с Су-24 появились у посольства Турции в РФ  https://t.co/wLj3463bOU #СУ24 #УдарВСпину https://t.co/fOAYMXt7Rm,Unknown,Russian,2015-11-24 15:17:00,2015-11-24 15:17:00,185,100,2405,R,1
nasty_grach,Еврокомиссия одобрила выделение Турции &euro;3 млрд на решение проблем с мигрантами https://t.co/KQgF79MnYi,Unknown,Russian,2015-11-24 15:35:00,2015-11-24 15:35:00,185,100,2406,R,1
nasty_grach,Дальнобойщики доехали до Смольного в Петербурге. Ведем трансляцию в перископе:  https://t.co/u1uzssjCmo https://t.co/XshjHcNjfI,Unknown,Ukrainian,2015-11-24 16:57:00,2015-11-24 16:57:00,185,100,2408,R,1
nasty_grach,Владимир Путин об инциденте с Су-24: Удар в спину от пособников террористов #ударвспину #су24 #турция https://t.co/z19xqkW5xq,Unknown,Russian,2015-11-24 23:12:00,2015-11-24 23:19:00,185,100,2411,R,1
nasty_grach,"Студенческое общежитие горит на севере Москвы, идёт эвакуация людей https://t.co/8MwzeM6ACU",Unknown,Russian,2015-11-25 04:53:00,2015-11-25 04:59:00,185,100,2412,R,1
nasty_grach,Опубликовано видео спасения экипажа подбитого в Сирии Ми-8 https://t.co/wQZDNfZZnD https://t.co/7f4CVBWFCz,Unknown,Russian,2015-11-25 06:13:00,2015-11-25 06:13:00,185,100,2413,R,1
nasty_grach,!!! Сергей Шойгу: На авиабазу РФ в Сирии перебросят С-400   https://t.co/ANuGPRIOpX,Unknown,Ukrainian,2015-11-25 09:40:00,2015-11-25 09:40:00,185,100,2414,R,1
nasty_grach,Первый «арктический» вертолет передан в распоряжение Минобороны РФ https://t.co/jMIkkIT6S2 https://t.co/C2f7vJGLqs,Unknown,Russian,2015-11-25 11:02:00,2015-11-25 11:02:00,185,100,2415,R,1
nasty_grach,Metro Cash&Carry предупреждает о рисках продуктовых санкций против Турции https://t.co/teEY5T8oY0,Unknown,Russian,2015-11-25 11:55:00,2015-11-25 11:55:00,185,100,2416,R,1
nasty_grach,в армии сейчас служат всего год. это как две очереди в Почту России отстоять,Unknown,Russian,2015-11-25 15:50:00,2015-11-25 15:51:00,185,100,2418,R,1
nasty_grach,Боевики ИГ взяли на себя ответственность за подрыв автобуса в Тунисе https://t.co/1YUWPrxCO3,Unknown,Russian,2015-11-25 15:53:00,2015-11-25 15:54:00,185,100,2419,R,1
nasty_grach,Путин: Россия будет крепнуть и развиваться https://t.co/NUP6zG7DRG https://t.co/gwMFJmNUt3,Unknown,Russian,2015-11-25 16:38:00,2015-11-25 16:38:00,185,100,2420,R,1
nasty_grach,"Возмездие: появилось видео обстрела ракетами боевиков, убивших русского пилота  https://t.co/jUnEzCMOWL https://t.co/PSZxWRRsks",Unknown,Russian,2015-11-25 17:15:00,2015-11-25 17:19:00,185,100,2421,R,1
nasty_grach,Меркель заявила о важности поездки Олланда в Москву для борьбы с ИГ https://t.co/SKerjFtQh5,Unknown,Russian,2015-11-25 19:52:00,2015-11-25 19:53:00,185,100,2423,R,1
nasty_grach,Парламент Франции одобрил продление военной операции в Сирии https://t.co/ZZxqSkGGqb,Unknown,Russian,2015-11-25 20:54:00,2015-11-25 20:56:00,185,100,2424,R,1
nasty_grach,В Севастополе ввели новый график подачи электроэнергии https://t.co/jBQle9HbEm,Unknown,Russian,2015-11-25 23:12:00,2015-11-25 23:12:00,185,100,2425,R,1
nasty_grach,Уилл Смит намерен податься в политику? https://t.co/ZNQri8ksIs https://t.co/XGYnzHVjxE,Unknown,Russian,2015-11-26 01:11:00,2015-11-26 01:11:00,185,100,2426,R,1
nasty_grach,Прокуратура отреагировала на сообщения о крушении Ми-8 в Красноярском крае  https://t.co/jNQJz4OugP https://t.co/kcRKjbvnCJ,Unknown,Russian,2015-11-26 07:35:00,2015-11-26 07:35:00,185,100,2429,R,1
nasty_grach,"Какой вклад осужденные вносят в экономику, сообщила ФСИН  https://t.co/PQjt5nVqT7 https://t.co/Zvr8kD3cxx",Unknown,Russian,2015-11-26 10:56:00,2015-11-26 10:56:00,185,100,2432,R,1
nasty_grach,"#Богданов, вопрос дня: следует ли России прекратить экономическое сотрудничество с Турцией? Пишите!",Unknown,Russian,2015-11-26 11:58:00,2015-11-26 11:58:00,185,100,2433,R,1
nasty_grach,"Украинские самолеты уже облетают территорию РФ, хотя запрета нет, сообщают в Росавиации https://t.co/MgAd7tJal9",Unknown,Russian,2015-11-26 12:36:00,2015-11-26 12:37:00,185,100,2434,R,1
nasty_grach,Крыму хватит запасов бензина на 18 суток https://t.co/4AOTkc7Aif,Unknown,Ukrainian,2015-11-26 15:52:00,2015-11-26 15:52:00,185,100,2439,R,1
nasty_grach,"Reuters рассказало о похоронах спецназовца, который, предположительно, погиб в Сирии:  https://t.co/DFfhohaxjh https://t.co/e3watHSrhR",Unknown,Russian,2015-11-26 15:58:00,2015-11-26 15:59:00,185,100,2440,R,1
nasty_grach,"Размещение российских С-400 в Сирии, ноябрь 2015 года  #Syria #Latakia #S400 https://t.co/xpWHKUdsv6",Unknown,Russian,2015-11-26 16:28:00,2015-11-26 16:28:00,185,100,2441,R,1
nasty_grach,"Тухель: не ожидал, что «Боруссия» будет настолько доминировать над «Краснодаром» https://t.co/52RoOp4mcU",Unknown,Russian,2015-11-26 19:34:00,2015-11-26 19:35:00,185,100,2447,R,1
nasty_grach,СМИ сообщили о приобретении парижскими террористами оружия через интернет: https://t.co/3LDMv8NhN7,Unknown,Russian,2015-11-27 03:13:00,2015-11-27 03:13:00,185,100,2449,R,1
nasty_grach,Масштабные антитеррористические учения прошли в в Амурской области https://t.co/CHfm90pcI1 https://t.co/BM8eMBDB1I,Unknown,Russian,2015-11-27 06:51:00,2015-11-27 06:51:00,185,100,2450,R,1
nasty_grach,"Предприниматель в Риме забрался на Колизей, угрожая покончить с собой https://t.co/0TDJ0PFpgB https://t.co/OZBX1RtFQU",Unknown,Russian,2015-11-27 13:32:00,2015-11-27 13:32:00,185,101,2453,R,1
nasty_grach,В ноябре годовая инфляция замедлится https://t.co/TVmwxRM78o https://t.co/1UQyINQXT8,Unknown,Russian,2015-11-27 14:22:00,2015-11-27 14:22:00,185,101,2454,R,1
nasty_grach,В аэропорту Шарль-де-Голль из-за подозрения в радикальных взглядах уволены 57 работников https://t.co/Y2qjhp3RPb,Unknown,Russian,2015-11-27 17:31:00,2015-11-27 17:31:00,185,102,2456,R,1
nasty_grach,Источник: около девяти тысяч человек в Брянске остались без тепла https://t.co/sY4870qoXN https://t.co/Vjfu1PNAQr,Unknown,Russian,2015-11-27 22:12:00,2015-11-27 22:13:00,185,102,2459,R,1
nasty_grach,Эксперт: народная дипломатия может помочь отношениям России и Турции  https://t.co/1Kn2lIj3U5 https://t.co/15E3taJwH3,Unknown,Russian,2015-11-27 23:55:00,2015-11-27 23:55:00,185,102,2460,R,1
nasty_grach,Родственникам погибшего у берегов Турции мальчика дали убежище в Канаде https://t.co/073nk8kqEN,Unknown,Russian,2015-11-28 00:37:00,2015-11-28 00:37:00,185,102,2461,R,1
nasty_grach,«Уфа» на последних минутах вырвала ничью в игре с «Кубанью» https://t.co/KdqBXRvEwF,Unknown,Serbian,2015-11-28 12:19:00,2015-11-28 12:19:00,185,102,2463,R,1
nasty_grach,Как технологии изменили нашу жизнь за 10 лет  https://t.co/AS2TXPjaO4 https://t.co/npdR9YrKMe,Unknown,Russian,2015-11-28 16:52:00,2015-11-28 16:52:00,185,102,2465,R,1
nasty_grach,Комков: в составе «Томи» выделил бы Кирилла Погребняка https://t.co/m28kZtL4Zs,Unknown,Uzbek,2015-11-29 08:52:00,2015-11-29 08:52:00,185,102,2468,R,1
nasty_grach,"На западе Грузии арестованы подозреваемые в связи с ИГ, изъято оружие https://t.co/oWJmZbH7uf",Unknown,Russian,2015-11-29 09:52:00,2015-11-29 09:52:00,185,102,2469,R,1
nasty_grach,Рогозин предложил Украине использовать танки орков из настольной игры Warhammer https://t.co/3OMumgrgLF,Unknown,Russian,2015-11-29 10:14:00,2015-11-29 10:14:00,185,102,2470,R,1
nasty_grach,Самолет с телом пилота Су-24 прибыл в Анкару https://t.co/PJxA9zUIsq,Unknown,Serbian,2015-11-29 14:14:00,2015-11-29 14:14:00,185,102,2472,R,1
nasty_grach,Найдите 10 отличий   #Осознание@rus_improvisation https://t.co/HTgreXzNPj,Unknown,Bulgarian,2015-11-29 17:55:00,2015-11-29 17:55:00,185,102,2473,R,1
nasty_grach,"В проигрыше Кличко виноват мировой заговор, — украинские эксперты  Супертяж Владимир Кличко  https://t.co/2BP0nILxUO https://t.co/Uo9SdOaSnv",Unknown,Russian,2015-11-30 01:11:00,2015-11-30 01:11:00,185,102,2475,R,1
nasty_grach,Российские космонавты опубликовали снимок Москвы и Петербурга под северным сиянием https://t.co/D3ZrHcXSoq https://t.co/j2jnhJHvXS,Unknown,Russian,2015-11-30 05:11:00,2015-11-30 05:11:00,185,102,2476,R,1
nasty_grach,11 лет под землей  https://t.co/hb8OY1K3jz https://t.co/5YQTxb2F5I,Unknown,Russian,2015-11-30 17:12:00,2015-11-30 17:12:00,185,102,2483,R,1
nasty_grach,#Госдеп отказался комментировать обстрел журналистов RT «умеренными» оппозиционерами в Сирии https://t.co/7TOJkchv4v,Unknown,Russian,2015-12-01 00:22:00,2015-12-01 00:22:00,185,102,2484,R,1
nasty_grach,Пентагон: в Румынию из Германии в течение дня перебросят 70 единиц военной техники США  https://t.co/HQdoHv59LU,Unknown,Russian,2015-12-01 05:32:00,2015-12-01 05:33:00,185,102,2485,R,1
nasty_grach,НАТО сохранит контингент в Афганистане на уровне 12 тысяч военных https://t.co/pMWQPbMcvY,Unknown,Russian,2015-12-01 16:51:00,2015-12-01 16:51:00,185,102,2487,R,1
nasty_grach,Телефонный шпионаж со стороны АНБ США не закончился  https://t.co/8I1lG2Q0zt,Unknown,Russian,2015-12-01 21:38:00,2015-12-01 21:38:00,185,102,2489,R,1
nasty_grach,Крупнейший российский ритейлер начал тестировать онлайн-магазин https://t.co/HvsMJV0wi2,Unknown,Russian,2015-12-02 03:15:00,2015-12-02 03:15:00,185,102,2491,R,1
nasty_grach,"В штабе Люфтваффе я решаю, кто еврей, а кто нет! (c) Геринг https://t.co/1zjbg3IAsm",Unknown,Uzbek,2015-12-02 03:53:00,2015-12-02 03:53:00,185,102,2492,R,1
nasty_grach,"Обама всем пожал руку, а Порошенко не заметил ... #кляти_москали (хохлам не смотреть)  https://t.co/ISTscwmIng",Unknown,Ukrainian,2015-12-02 09:54:00,2015-12-02 09:55:00,185,102,2493,R,1
nasty_grach,Минобороны опубликовало фотографии бензовозов ИГ на границе Турции и Сирии https://t.co/uf6Q3nAmZl,Unknown,Russian,2015-12-02 14:33:00,2015-12-02 14:33:00,185,102,2495,R,1
nasty_grach,Кому это НАТО?  https://t.co/mLFNSE5oY9,Unknown,Ukrainian,2015-12-02 15:06:00,2015-12-02 15:06:00,185,102,2496,R,1
nasty_grach,Госдума увеличила МРОТ до 6204 рублей https://t.co/OSkM4jbuGn #экономика,Unknown,Russian,2015-12-02 17:32:00,2015-12-02 17:33:00,185,102,2497,R,1
nasty_grach,Банк России оценил влияние санкций против Турции на инфляцию https://t.co/nhvkF7dzJE,Unknown,Russian,2015-12-02 19:03:00,2015-12-02 19:03:00,185,102,2498,R,1
nasty_grach,Глава МИД Великобритании: Путин может завершить войну в Сирии https://t.co/U4XtBQ7E51,Unknown,Russian,2015-12-02 23:15:00,2015-12-02 23:15:00,185,102,2499,R,1
nasty_grach,Британские истребители вернулись на базу после авиаударов в Сирии https://t.co/qw70pJi7a3,Unknown,Russian,2015-12-03 04:55:00,2015-12-03 04:55:00,185,102,2500,R,1
nasty_grach,Британия ударила по ИГИЛ  https://t.co/2ZnZZgzOU7 https://t.co/O7vPG90uDT,Unknown,Russian,2015-12-03 15:32:00,2015-12-03 15:32:00,185,102,2502,R,1
nasty_grach,Учитель истории взрывал в Москве банкоматы,Unknown,Russian,2015-12-03 17:52:00,2015-12-03 17:52:00,185,102,2504,R,1
nasty_grach,Сексуальную учительницу обвиняют в совращении несовершеннолетнего ученика: https://t.co/Q6RuGv0kMw https://t.co/7WO2soaj3l,Unknown,Russian,2015-12-04 07:53:00,2015-12-04 07:55:00,185,102,2508,R,1
