author_id,content,region,language,publish_date,harvested_date,following,followers,updates,post_type,retweet
nasty_grach,занавес параллельной вселенной приоткрылся  https://t.co/drDKtNESYB,Unknown,Russian,2015-06-22 11:29:00,2015-06-22 11:29:00,401,93,1549,R,1
nasty_grach,NFS по-омски: полиция ловит Skyline http://t.co/qhyRWyktrr,Unknown,Macedonian,2015-06-22 17:11:00,2015-06-22 17:11:00,401,93,1551,R,1
nasty_grach,Депутатам Госдумы предлагают «урезать» отпуск до 28 дней http://t.co/GGNOdwle4f http://t.co/5p8zr5Ril3,Unknown,Russian,2015-06-29 00:11:00,2015-06-29 00:11:00,401,95,1560,R,1
nasty_grach,C 3 июля автовокзал «Южный» вводит дополнительный рейс по маршруту Казань - Нурлат http://t.co/SugqHOjzJJ http://t.co/tcVYYimg2N,Unknown,Russian,2015-07-03 16:31:00,2015-07-03 16:31:00,401,95,1565,R,1
nasty_grach,Обладатели самого трогательного семейного фото могут выиграть билеты в Крым #СтопЛГБТ https://t.co/D34WsJhm52 http://t.co/tJHJcwfCNN,Unknown,Russian,2015-07-08 16:20:00,2015-07-08 16:21:00,401,93,1572,R,1
nasty_grach,Санкции и бойкот НАТО не помешали VII военно-морскому салону  http://t.co/6WYpCxFqVL http://t.co/O5jLrkPm61,Unknown,Ukrainian,2015-07-08 16:22:00,2015-07-08 16:22:00,401,93,1573,R,1
nasty_grach,Все флаги в гости будут к нам! #РусскиеВарвары https://t.co/6O73BRBkhY,Unknown,Russian,2015-07-14 19:34:00,2015-07-14 19:34:00,401,92,1594,,0
nasty_grach,"Какие фашисты? ахахаха.. вы чё русня, гоните? ахахаха https://t.co/jRSJsFIAuq",Unknown,Russian,2015-07-16 04:32:00,2015-07-16 04:32:00,401,92,1600,R,1
nasty_grach,"Видаль: мы с Тураном подождём до января, ведь речь идёт о «Барселоне» http://t.co/TJsyvpY1pn",Unknown,Ukrainian,2015-07-16 09:53:00,2015-07-16 09:53:00,401,92,1602,R,1
nasty_grach,"Каково состояние экс-президента США, при котором развалился СССР http://t.co/PYusDsQWWw http://t.co/MJN6kAkFMs",Unknown,Russian,2015-07-16 13:51:00,2015-07-16 13:51:00,401,92,1603,R,1
nasty_grach,Лидер Ирана: США будут унижены  http://t.co/lhp0chfcNF http://t.co/OuFPCAHkJ1,Unknown,Russian,2015-07-18 07:14:00,2015-07-18 07:14:00,401,92,1613,R,1
nasty_grach,Украинские силовики заявили о гибели мирных жителей  http://t.co/ru13uzZrq3 http://t.co/AJo545iSaB,Unknown,Russian,2015-07-18 18:12:00,2015-07-18 18:12:00,401,91,1617,R,1
nasty_grach,11 человек погибли при нападении боевиков в Алжире  http://t.co/M3c4atSq8i http://t.co/GqindQTV6e,Unknown,Russian,2015-07-18 18:32:00,2015-07-18 18:32:00,401,91,1618,R,1
nasty_grach,В центре Москвы избили пенсионера  http://t.co/LKiOL0IVyJ http://t.co/Gt3sbaOM3J,Unknown,Russian,2015-07-18 22:13:00,2015-07-18 22:13:00,401,91,1620,R,1
nasty_grach,«Зенит» — «Динамо»: Дзюба и Юсупов — в основном составе питерцев http://t.co/sEnIaAnIF9,Unknown,Serbian,2015-07-19 10:32:00,2015-07-19 10:32:00,401,91,1619,R,1
nasty_grach,Отвод танкового взвода со стороны ДНР зафиксировала СММ ОБСЕ http://t.co/CSQWaonndb,Unknown,Russian,2015-07-19 12:11:00,2015-07-19 12:11:00,401,91,1620,R,1
nasty_grach,СБУ выявила ряд подпольных складов контрафактных сигарет в Закарпатье  http://t.co/UGxmKLrrd3,Unknown,Russian,2015-07-19 14:32:00,2015-07-19 14:32:00,401,91,1621,R,1
nasty_grach,"Обольский: пенальти в ворота «Динамо» — справедлив, насчёт удаления поспорил бы http://t.co/bvVzLSTw55",Unknown,Russian,2015-07-19 15:32:00,2015-07-19 15:32:00,401,91,1622,R,1
nasty_grach,Россия намерена совместно с Ираном бороться с ИГ http://t.co/uboBT4wHrk,Unknown,Russian,2015-07-20 14:11:00,2015-07-20 14:11:00,401,91,1624,R,1
nasty_grach,СМИ: Япония исходит из соглашения от 2001 года при решении территориального вопроса с РФ  http://t.co/k1kzfB4LkE,Unknown,Russian,2015-07-21 01:11:00,2015-07-21 01:12:00,333,91,1625,R,1
nasty_grach,Кстати да http://t.co/czYUh0ykZw,Unknown,Ukrainian,2015-07-22 08:32:00,2015-07-22 08:32:00,189,91,1629,R,1
nasty_grach,Источник: в Нальчике ликвидировали боевиков http://t.co/hrUPrWUlQq,Unknown,Russian,2015-07-23 06:32:00,2015-07-23 06:32:00,189,91,1633,R,1
nasty_grach,СМИ: власти США проверяют ряд банков на предмет их причастности к коррупции в ФИФА http://t.co/b8nsl6PBJd,Unknown,Russian,2015-07-24 01:13:00,2015-07-24 01:13:00,189,91,1638,R,1
nasty_grach,'@turist532 может она в зоне уже заработала? Уж больно на кобла похожа ))) @A_Rainik',Unknown,Russian,2015-07-24 16:12:00,2015-07-24 16:13:00,189,92,1639,R,1
nasty_grach,Иран направил письмо протеста в МАГАТЭ в связи с заявлениями официальных лиц США  http://t.co/msF2nyBzfe,Unknown,Russian,2015-07-24 21:32:00,2015-07-24 21:32:00,189,92,1640,R,1
nasty_grach,"В Австралии арестован медбрат за помощь боевикам ""Исламского государства"" http://t.co/jYajYXKtwv",Unknown,Russian,2015-07-25 03:32:00,2015-07-25 03:32:00,189,93,1642,R,1
nasty_grach,Де Йонг: «Милан» вернётся в еврокубки и поборется за титул — потому я и остался http://t.co/caMiFQvaX2,Unknown,Russian,2015-07-25 08:52:00,2015-07-25 08:52:00,189,93,1646,R,1
nasty_grach,Автомобиль BMW i3 станет основой для Apple-мобиля  #hitech,Unknown,Russian,2015-07-25 19:32:00,2015-07-25 19:32:00,189,93,1648,R,1
nasty_grach,Бадминтонисты из РФ победили в парах на Russia Open во Владивостоке http://t.co/3Lsfb137zm,Unknown,Serbian,2015-07-26 08:52:00,2015-07-26 08:52:00,189,93,1650,R,1
nasty_grach,Широков вернулся  http://t.co/CQjICGAYx3 http://t.co/AoirGlFLFk,Unknown,Russian,2015-07-26 12:52:00,2015-07-26 12:52:00,189,92,1651,R,1
nasty_grach,Снуп Догг задержан в Швеции  http://t.co/JSGOoloJ6O http://t.co/vD9Tt1Pkql,Unknown,Ukrainian,2015-07-26 20:31:00,2015-07-26 20:31:00,189,92,1653,R,1
nasty_grach,Депардье поддержал введение налога с тунеядцев в Белоруссии http://t.co/R9xiFAojoo,Unknown,Russian,2015-07-26 20:52:00,2015-07-26 20:52:00,189,92,1654,R,1
nasty_grach,"UPD. Площадь лесных пожаров в Сибири за выходные увеличилась на 6,3 тыс. га до 43,3 тыс. га  http://t.co/jhXVNWZjp6",Unknown,Russian,2015-07-27 05:32:00,2015-07-27 05:32:00,189,92,1657,R,1
nasty_grach,В интернет-банке ВТБ 24 зафиксированы сбои в работе http://t.co/R2KoHKDx7S,Unknown,Russian,2015-07-27 11:53:00,2015-07-27 11:53:00,189,92,1658,R,1
nasty_grach,"АНБ США решило уничтожить данные о телефонных звонках американцев, накопленные за пять лет  http://t.co/ds5a8ZH9Mk",Unknown,Russian,2015-07-27 23:53:00,2015-07-27 23:53:00,189,92,1662,R,1
nasty_grach,Гвинет Пэлтроу представила коллекцию рэп-сумок http://t.co/hi1pgMV0Q5,Unknown,Russian,2015-07-29 09:33:00,2015-07-29 09:33:00,189,93,1667,R,1
nasty_grach,Платини сможет совмещать посты президентов ФИФА и УЕФА http://t.co/QDN2dzWVHV,Unknown,Russian,2015-07-29 13:12:00,2015-07-29 13:12:00,189,93,1668,R,1
nasty_grach,Хомуха: без лимита вечно будем играть Игнашевичем и Березуцкими http://t.co/8izejfp9cO,Unknown,Russian,2015-07-29 14:13:00,2015-07-29 14:13:00,189,93,1669,R,1
nasty_grach,В Киеве убита монахиня Украинской православной церкви Московского патриархата http://t.co/zfCA5n4UPq,Unknown,Russian,2015-07-29 15:13:00,2015-07-29 15:13:00,189,93,1670,R,1
nasty_grach,"Минобороны России заинтересовано в военном сотрудничестве с НАТО, но ""навязываться"" не будет http://t.co/f4LPUlKyuo",Unknown,Russian,2015-07-30 10:12:00,2015-07-30 10:12:00,189,92,1676,R,1
nasty_grach,"Дело «болотного фигуранта"" Непомнящих направлено в суд  http://t.co/jqriRo6QZb",Unknown,Russian,2015-07-30 16:15:00,2015-07-30 16:15:00,189,92,1679,R,1
nasty_grach,В Google Maps появилась информация об очередях  #hitech,Unknown,Russian,2015-07-30 17:31:00,2015-07-30 17:31:00,189,92,1680,R,1
nasty_grach,Источник: команда Хиллари Клинтон взволнована возможным участием Байдена в выборах http://t.co/wbeLsOMMHo,Unknown,Russian,2015-07-31 00:32:00,2015-07-31 00:32:00,189,92,1683,R,1
nasty_grach,Скончался актер и рестлер Родди Пайпер http://t.co/lxWH5x3sjj,Unknown,Russian,2015-08-01 00:51:00,2015-08-01 00:51:00,189,93,1687,R,1
nasty_grach,Разница в ментальности http://t.co/b67c19TGFg,Unknown,Russian,2015-08-02 07:53:00,2015-08-02 07:53:00,189,93,1691,R,1
nasty_grach,"Казарма в Омске обрушилась из-за некачественного ремонта  — ну, так считает следствие https://t.co/UZcMp9gOdn",Unknown,Russian,2015-08-03 06:31:00,2015-08-03 06:31:00,189,93,1696,R,1
nasty_grach,Игрок «Чайки»: судья достал электрошокер и сказал подходить по одному http://t.co/LYS47ngQiW,Unknown,Russian,2015-08-03 16:12:00,2015-08-03 16:12:00,189,93,1698,R,1
nasty_grach,Более 2000 несанкционированных свалок обнаружено в ПФО с начала 2015 года http://t.co/jfn49B7Bqf,Unknown,Russian,2015-08-04 10:53:00,2015-08-04 10:53:00,189,93,1700,R,1
nasty_grach,Порошенко предупредил о последствиях «фейковых выборов» в Донбассе: http://t.co/EOsc2i0Hzy,Unknown,Russian,2015-08-04 14:13:00,2015-08-04 14:13:00,189,93,1701,R,1
nasty_grach,"Концерт роудшоу #Музартерия в Уфе прошёл во Всероссийскую ""Субботу донора"".   http://t.co/2bauuwIKfU http://t.co/NuacH6brhx",Unknown,Russian,2015-08-05 09:54:00,2015-08-05 09:54:00,189,93,1705,R,1
nasty_grach,«ВКонтакте» занимает 18-е место в рейтинге социальных сетей на 2015й год   http://t.co/Ab9FUiPmcJ,Unknown,Russian,2015-08-05 11:58:00,2015-08-05 11:58:00,189,93,1706,R,1
nasty_grach,Источник: Рондон улетел на переговоры с потенциальными работодателями http://t.co/ZMmR8m1cRx,Unknown,Russian,2015-08-05 17:52:00,2015-08-05 17:52:00,189,93,1709,R,1
nasty_grach,"ЦСКА вырвал победу у ""Спарты"" при счете 0:2.  ПОЗДРАВЛЯЕМ АРМЕЙЦЕВ!   http://t.co/79CmeqpR4a http://t.co/hOMD0l2Xt9",Unknown,Russian,2015-08-05 21:13:00,2015-08-05 21:14:00,189,93,1711,R,1
nasty_grach,Хакерские проекты на Кикстартере  #hitech,Unknown,Russian,2015-08-06 18:11:00,2015-08-06 18:11:00,189,93,1732,R,1
nasty_grach,"Президент «ПСЖ» заявил, что Тьяго Мотта и Ибрагимович останутся в клубе http://t.co/WkghjhRYWU",Unknown,Russian,2015-08-06 18:52:00,2015-08-06 18:52:00,189,93,1733,R,1
nasty_grach,Российские волонтеры освобождены из украинского плена http://t.co/0AmIkwRvU9,Unknown,Russian,2015-08-07 06:53:00,2015-08-07 06:53:00,189,93,1734,R,1
nasty_grach,Мутко: второй тренер сборной России будет не из штаба ЦСКА http://t.co/1ZwvGu6StM,Unknown,Russian,2015-08-07 10:33:00,2015-08-07 10:33:00,189,92,1737,R,1
nasty_grach,Великобритания приветствует принятие резолюции по химическом оружию в Сирии http://t.co/oeFsSYA4Gl,Unknown,Russian,2015-08-07 20:12:00,2015-08-07 20:12:00,189,92,1739,R,1
nasty_grach,При столкновении гидроплана и вертолета в Подмосковье погибли пятеро http://t.co/i4m5EONsnl,Unknown,Russian,2015-08-08 19:33:00,2015-08-08 19:33:00,189,92,1745,R,1
nasty_grach,NASA будет транслировать в прямом эфире выход космонавтов в открытый космос http://t.co/YbLQtZsS6l,Unknown,Russian,2015-08-09 06:11:00,2015-08-09 06:11:00,189,93,1748,R,1
nasty_grach,Министерство обороны уличили в пересылке секретных сведений через публичные почтовые сервисы  #hitech,Unknown,Russian,2015-08-09 17:31:00,2015-08-09 17:31:00,189,93,1750,R,1
nasty_grach,Северная Америка не увидит @MariaSharapova http://t.co/a0PASYE5kG http://t.co/Mtho3jrt5a,Unknown,Ukrainian,2015-08-10 11:33:00,2015-08-10 11:33:00,189,93,1756,R,1
nasty_grach,Очевидец предоставил снятое до трагедии над Истрой видео: http://t.co/wFTpxTinzR,Unknown,Russian,2015-08-10 12:33:00,2015-08-10 12:33:00,189,93,1757,R,1
nasty_grach,Foxconn вложит $5 млрд в заводы в Индии http://t.co/dWxH3D5LnQ,Unknown,Russian,2015-08-10 23:31:00,2015-08-10 23:31:00,189,93,1759,R,1
nasty_grach,"В России создадут мобильное приложение для тех, кто заплутал в лесу  #hitech",Unknown,Russian,2015-08-11 13:11:00,2015-08-11 13:11:00,189,93,1761,R,1
nasty_grach,РФС может выкупить контракт Слуцкого у ЦСКА  http://t.co/1QqOsWuwbs http://t.co/Gq77D0aJxd,Unknown,Russian,2015-08-11 14:31:00,2015-08-11 14:31:00,189,93,1763,R,1
nasty_grach,Слуцкий: из огромного количества вариантов Думбия выбрал именно ЦСКА http://t.co/MLptKNMfFy,Unknown,Russian,2015-08-11 17:32:00,2015-08-11 17:33:00,189,93,1765,R,1
nasty_grach,Под Тулой на трассе горит рейсовый автобус http://t.co/PhKGX1XN9P,Unknown,Russian,2015-08-11 19:31:00,2015-08-11 19:31:00,189,93,1766,R,1
nasty_grach,Экс-комментатор «НТВ-Плюс» обвинил Уткина в желании попиариться за чужой счет http://t.co/YKOKpnJwt6 http://t.co/6YAdrYfitR,Unknown,Russian,2015-08-12 01:12:00,2015-08-12 01:13:00,189,93,1768,R,1
nasty_grach,"Томские ""хрущевки"" будут красить дезинфицирующими красками с наночастицами серебра http://t.co/UZ2I22vev6",Unknown,Russian,2015-08-12 12:53:00,2015-08-12 12:53:00,189,93,1770,R,1
nasty_grach,"Интернет -зависимость и грипп. ""Какая связь? Прямая!"" http://t.co/MhkVfyJmn4медхроники#здоровье#жизнь#инет http://t.co/AQzZA8DC2N",Unknown,Russian,2015-08-13 05:12:00,2015-08-13 05:12:00,189,93,1774,R,1
nasty_grach,Как выжить без албанских сухофруктов и лихтенштейнского сыра? Отвечают москвичи: http://t.co/g4HIf0xoVo  https://t.co/Yi7ykobKrA,Unknown,Russian,2015-08-13 19:12:00,2015-08-13 19:12:00,189,93,1780,R,1
nasty_grach,"В Петербурге участник ""Хизб ут-Тахрир"" приговорен к 5 годам строгого режима http://t.co/PrZmUo8unr",Unknown,Russian,2015-08-14 13:33:00,2015-08-14 13:33:00,189,93,1782,R,1
nasty_grach,"Смотрите, во что путинский режим превратил крымчан! В гомофобов! Таким нет места в Европе! (Объявление в кафе) https://t.co/RYEDhpIo0a",Unknown,Russian,2015-08-15 08:12:00,2015-08-15 08:12:00,189,93,1788,R,1
nasty_grach,IPhone научится самостоятельно распознавать людей http://t.co/c02KYZLu0z http://t.co/5OAXbN26gm,Unknown,Russian,2015-08-15 17:11:00,2015-08-15 17:11:00,189,93,1791,R,1
nasty_grach,Число жертв взрывов в Тяньцзине возросло до 112 http://t.co/NYWxiWfcom,Unknown,Ukrainian,2015-08-16 03:31:00,2015-08-16 03:31:00,189,93,1794,R,1
nasty_grach,«Крылья Советов» на выезде сыграли вничью с «Ростовом» - 1:1 http://t.co/SsXpvJkJmu,Unknown,Russian,2015-08-17 07:11:00,2015-08-17 07:13:00,189,93,1797,R,1
nasty_grach,Ученые: от школы у детей болит голова http://t.co/AvnFtYqY12,Unknown,Russian,2015-08-17 08:51:00,2015-08-17 08:51:00,189,93,1798,R,1
nasty_grach,#ДональдТрамп успокой свои волосы http://t.co/wXws8HvI0I,Unknown,Russian,2015-08-17 14:54:00,2015-08-17 14:54:00,189,93,1800,R,1
nasty_grach,«Тосно» под руководством Парфёнова проиграл на выезде «Газовику» http://t.co/sz2WahKtnU,Unknown,Russian,2015-08-17 16:53:00,2015-08-17 16:53:00,189,93,1802,R,1
nasty_grach,В шоу Kazan City Racing примет участие самый успешный российский пилот Формулы 1 http://t.co/DP4I4YJIPK,Unknown,Russian,2015-08-18 20:52:00,2015-08-18 20:52:00,189,93,1807,R,1
nasty_grach,Intel рассказал о новом классе памяти в 1000 раз быстрее флеша: http://t.co/c0IxAn9cEg,Unknown,Russian,2015-08-19 03:24:00,2015-08-19 03:24:00,189,93,1808,R,1
nasty_grach,В Каире произошел взрыв #новости http://t.co/7SscMjE01j,Unknown,Russian,2015-08-20 00:51:00,2015-08-20 00:51:00,189,93,1811,R,1
nasty_grach,Ахаха)) http://t.co/4CrUHfHN3N,Unknown,Russian,2015-08-20 15:31:00,2015-09-13 05:50:00,189,93,1817,R,1
nasty_grach,NASA опровергла слухи об угрозе столкновения Земли с астероидом  http://t.co/c1D48LN6El,Unknown,Russian,2015-08-21 08:12:00,2015-08-21 08:12:00,189,93,1820,R,1
nasty_grach,Премьер-министр Бельгии назвал терактом стрельбу в поезде Амстердам -- Париж #новости http://t.co/idX0OaWENI,Unknown,Bulgarian,2015-08-21 23:32:00,2015-08-21 23:32:00,189,95,1824,R,1
nasty_grach,ФОТОРЕПОРТАЖ. В Москву-реку упал вертолет  http://t.co/A1SSvnd8E1 http://t.co/3cEuGNrdae,Unknown,Russian,2015-08-22 20:23:00,2015-08-22 20:23:00,189,95,1833,R,1
nasty_grach,СМИ: Меркель и Олланд обсудят ситуацию с мигрантами в ЕС http://t.co/YypiwPiqLi,Unknown,Russian,2015-08-23 21:11:00,2015-10-14 06:11:00,189,94,1835,R,1
nasty_grach,У финансовых рынков почва уходит из-под ног.  Падают практически все фондовые и сырьевые активы  #BlackMonday http://t.co/5fFMP0RW2k,Unknown,Russian,2015-08-24 14:43:00,2015-09-20 03:07:00,189,94,1836,R,1
nasty_grach,Опять кризис? http://t.co/OKWY6vvVqX,Unknown,Russian,2015-08-24 17:13:00,2015-08-24 17:13:00,189,94,1837,R,1
nasty_grach,Если вас волнует курс рубля http://t.co/rTky7gmeuR,Unknown,Russian,2015-08-24 17:18:00,2015-08-24 17:18:00,189,94,1838,R,1
nasty_grach,«Лилль» объявил о переходе 21-летнего нападающего сборной Коста-Рики в «Днепр» http://t.co/FirPhpnaK6,Unknown,Russian,2015-08-25 15:51:00,2015-08-25 15:52:00,189,94,1846,R,1
nasty_grach,Forbes: Путин одобрил передачу Шереметьево Пономаренко и Ротенбергу http://t.co/r92lSEGRBT,Unknown,Ukrainian,2015-08-25 15:53:00,2015-09-21 12:53:00,189,94,1848,R,1
nasty_grach,Посольство США аннулировало визу сенатору Тотоонову http://t.co/YwYgpLR1Xt,Unknown,Russian,2015-08-26 14:12:00,2015-08-26 14:12:00,189,94,1856,R,1
nasty_grach,Совет Федерации предлагает запретить Керри въезд в Россию  http://t.co/6WWtu086YZ http://t.co/Lq1FcfMlUE,Unknown,Russian,2015-08-26 18:52:00,2015-08-26 18:52:00,189,94,1857,R,1
nasty_grach,На МАКС-2015 Airbus представил новейший самолёт A350 (ВИДЕО)  https://t.co/Fj4bfKzwsj http://t.co/sVKpSkIgtc,Unknown,Russian,2015-08-26 21:11:00,2015-08-26 21:12:00,189,94,1858,R,1
nasty_grach,'@SFGO76 @ditertom Хай!',Unknown,Russian,2015-08-27 03:32:00,2015-09-22 22:19:00,189,94,1861,R,1
nasty_grach,«Ведомости» узнали о планах «АвтоВАЗа» снова поднять цены: http://t.co/kmNW9AUOr4,Unknown,Russian,2015-08-27 11:32:00,2015-09-23 04:49:00,189,94,1864,R,1
nasty_grach,Министр: Украина может увеличить выплаты кредиторам после 2020 года http://t.co/TE1NTCy2WG,Unknown,Russian,2015-08-27 12:12:00,2015-09-23 05:33:00,189,94,1866,R,1
nasty_grach,Какие еще планы Матвиенко нарушили США  http://t.co/pembyPB0Vp http://t.co/BNZdrRpoEn,Unknown,Russian,2015-08-27 13:32:00,2015-08-27 13:32:00,189,94,1867,R,1
nasty_grach,Колумбия и Венесуэла отозвали своих послов из-за ЧП на границе http://t.co/ymTAnJzNgz http://t.co/jj7Idr2nW4,Unknown,Serbian,2015-08-28 06:31:00,2015-10-14 06:11:00,0,0,1868,R,1
nasty_grach,В Рейкьявике появится улица Дарта Вейдера потому что почему бы и нет https://t.co/bGw7Bx1GnS,Unknown,Russian,2015-08-28 07:31:00,2015-09-24 01:03:00,0,0,1869,R,1
nasty_grach,"«Россия занимает первое место по потреблению технического спирта», — обсуждаем возможное ограничение продаж алкоголя  https://t.co/tVJvRioLgK",Unknown,Russian,2015-08-28 11:52:00,2015-08-28 11:52:00,188,94,1870,R,1
nasty_grach,Астахов запустил сайт «Не паркуй ребенка»  http://t.co/BTj3MC547V http://t.co/NYDCBW5MLp,Unknown,Ukrainian,2015-08-28 11:53:00,2015-08-28 11:53:00,188,94,1871,R,1
nasty_grach,Уилл Джонс сыграет на Koktebel Jazz Party композиции с нового альбома http://t.co/7lSBKc6anT #koktebeljazzparty,Unknown,Russian,2015-08-28 13:12:00,2015-08-28 13:12:00,188,94,1874,R,1
nasty_grach,В Европу прибыли первые истребители F-22 Raptor ВВС США http://t.co/nwPXRy4NGk,Unknown,Russian,2015-08-28 23:11:00,2015-08-28 23:11:00,188,94,1879,R,1
nasty_grach,Ансальди близок к переходу в бывший клуб Кришито http://t.co/1DhJsCVYhV,Unknown,Ukrainian,2015-08-29 16:13:00,2015-08-29 16:13:00,188,94,1883,R,1
nasty_grach,Халк Хоган хотел бы участвовать в президентской кампании Дональда Трампа http://t.co/kzYoO60IUo,Unknown,Russian,2015-08-29 20:32:00,2015-08-29 20:32:00,188,94,1884,R,1
nasty_grach,У Москвича изъяли 2000 патронов для пулеметов http://t.co/I9rcV5YF49,Unknown,Ukrainian,2015-08-30 08:51:00,2015-09-25 23:11:00,188,94,1885,R,1
nasty_grach,Молдавия намерена подать заявку на вступление в ЕС в течение трех лет http://t.co/knf9GkP5PA,Unknown,Russian,2015-08-30 15:51:00,2015-08-30 16:32:00,188,94,1886,R,1
nasty_grach,Он знал http://t.co/8dnh5MqKxG,Unknown,Russian,2015-08-30 18:11:00,2015-08-30 18:11:00,188,94,1887,R,1
nasty_grach,"Пока @rubin_paceka прохлаждается в Сочах, тут вон чо делаетсо! https://t.co/meA1nkC7Cp",Unknown,Russian,2015-08-30 18:31:00,2015-09-26 09:54:00,188,94,1888,R,1
nasty_grach,'@BondarchukViach @korobkov @LevSharansky Мировые цены на нефть опять снизились http://t.co/6OUtSu7VR8 http://t.co/C3jYvj7L7c',Unknown,Russian,2015-08-31 09:59:00,2015-09-27 07:59:00,188,94,1893,R,1
nasty_grach,'@GrahamWP_UK ДНР: ополченцы просят Киев воздержаться от провокаций на 1 сентября http://t.co/Wuoh2lVrFW http://t.co/UV9W33NOoD',Unknown,Russian,2015-08-31 10:05:00,2015-08-31 10:05:00,188,94,1894,R,1
nasty_grach,Виталий Кличко сообщил о погибших в беспорядках у Рады https://t.co/poQsMn3CGp http://t.co/ld0XqeeiZt,Unknown,Russian,2015-08-31 12:54:00,2015-09-27 11:48:00,188,94,1898,R,1
nasty_grach,'@realDonaldTrump http://t.co/SH7cQiOMsy',Unknown,Russian,2015-08-31 15:09:00,2015-08-31 15:09:00,188,94,1901,R,1
