author_id,content,region,language,publish_date,harvested_date,following,followers,updates,post_type,retweet
nasty_grach,23-летняя черлидер баскетбольного ЦСКА Анна Резицкая назначена пресс-атташе РФБ  https://t.co/csLJ2CcDVw https://t.co/j8vXszVUI1,Unknown,Russian,2015-10-22 09:56:00,2015-10-22 09:56:00,185,98,2111,R,1
nasty_grach,"Мхитарян, не сыгравший в Баку из соображений безопасности, поздравил Обамейянга https://t.co/46V4DbXeSg",Unknown,Russian,2015-10-22 18:33:00,2015-10-22 18:34:00,185,98,2113,R,1
nasty_grach,Палкин: срок дисквалификации Фреда может составить от 6 месяцев до 2 лет https://t.co/1XoyBhvTW2,Unknown,Russian,2015-10-22 18:51:00,2015-10-22 18:51:00,185,98,2114,R,1
nasty_grach,"23 октября 1958 года Борис Пастернак стал вторым писателем из России, удостоенным Нобелевской премии #Голос_истории https://t.co/mXZp8gDe7k",Unknown,Russian,2015-10-23 06:53:00,2015-10-23 06:55:00,185,98,2116,R,1
nasty_grach,Тело красногорского стрелка Амирана Георгазде нашли в одном из домов в Подмосковье https://t.co/ioyqEuYSDb,Unknown,Russian,2015-10-23 17:14:00,2015-10-23 17:14:00,185,98,2119,R,1
nasty_grach,https://t.co/nn2pX6HopU,Unknown,Russian,2015-10-24 12:32:00,2015-10-26 14:03:00,185,98,2122,R,1
nasty_grach,Источник: в Сирии уничтожен главарь группировки «Джебхат ан-Нусра» https://t.co/zOkleu1nM1,Unknown,Russian,2015-10-24 14:53:00,2015-10-24 14:53:00,185,98,2123,R,1
nasty_grach,Российская и сирийская стороны обсудили сотрудничество в области технологий https://t.co/p7DvJT63KB https://t.co/4MdNtvhgGp,Unknown,Russian,2015-10-24 20:53:00,2015-10-24 20:53:00,185,98,2128,R,1
nasty_grach,Крис Кельми задержан в Москве  https://t.co/5FlXnAbkFJ https://t.co/hHbGqAlLIe,Unknown,Russian,2015-10-25 06:52:00,2015-10-25 06:52:00,185,98,2129,R,1
nasty_grach,"Полиция задержала главу администрации ""Звездного городка""  https://t.co/TJbcJeatBs https://t.co/46wuomPZzn",Unknown,Russian,2015-10-25 13:53:00,2015-10-25 13:53:00,185,98,2132,R,1
nasty_grach,Премьер Сербии заинтересован в поставках вооружения из России  https://t.co/tlqAw7UNjq,Unknown,Russian,2015-10-25 14:55:00,2015-10-25 14:55:00,185,98,2133,R,1
nasty_grach,Гайдар выгнали с избирательного участка #новости https://t.co/oxXI4IBbda,Unknown,Russian,2015-10-25 23:53:00,2015-10-25 23:53:00,185,98,2137,R,1
nasty_grach,Александр Захарченко рассказал о результатах работы благотворительного фонда Главы ДНР (видео) https://t.co/nzQKBePULH,Unknown,Russian,2015-10-26 09:34:00,2015-10-26 14:03:00,185,98,2141,R,1
nasty_grach,"СМИ не планируют заменять журналистов роботами По мнению руководителей изданий, компьютерная программа сможет …  https://t.co/q7Svhui6bZ",Unknown,Russian,2015-10-26 11:31:00,2015-10-26 14:03:00,185,98,2142,R,1
nasty_grach,Самые неожиданные результаты местных выборов в Украине: https://t.co/Nqxu2Eg5g7,Unknown,Russian,2015-10-26 11:33:00,2015-10-26 14:03:00,185,98,2143,R,1
nasty_grach,"В Афинах после проливных дождей затопило улицы, а в лужах завелись рыбы  Видео:  https://t.co/gissiBICup https://t.co/Rp99POj4Uu",Unknown,Russian,2015-10-26 11:35:00,2015-10-26 14:03:00,185,98,2144,R,1
nasty_grach,В Минобороны РФ прокомментировали данные СМИ о гибели мирных жителей в Сирии от ударов ВКС РФ  https://t.co/k8HXlCCBLH,Unknown,Russian,2015-10-26 15:35:00,2015-10-26 15:41:00,185,98,2146,R,1
nasty_grach,МИД РФ: Москва не прерывала работу по созданию условий для диалога Дамаска и сирийской оппозиции  https://t.co/CRph9toydm,Unknown,Ukrainian,2015-10-26 22:51:00,2015-10-26 23:01:00,185,98,2147,R,1
nasty_grach,LifeNews: зампрокурора Подмосковья отказался от дела Георгадзе из-за конфликта интересов https://t.co/TOzJ68DIZr,Unknown,Russian,2015-10-27 10:32:00,2015-10-27 10:32:00,185,98,2151,R,1
nasty_grach,"Мейтин: Дерунец не должен был делать того, что он сделал https://t.co/EnmZL33gw9",Unknown,Russian,2015-10-27 10:55:00,2015-10-27 10:55:00,185,98,2152,R,1
nasty_grach,«Скорые» проверят на извоз  https://t.co/R29n4fLYgg https://t.co/T9uvJcdOgD,Unknown,Russian,2015-10-27 16:55:00,2015-10-27 16:57:00,185,98,2154,R,1
nasty_grach,В Афганистане и Пакистане произошли землетрясения магнитудой 5 https://t.co/CPoNA4OPe2,Unknown,Russian,2015-10-27 18:56:00,2015-10-27 18:56:00,185,98,2155,R,1
nasty_grach,В МИДе Белоруссии подтвердили бессмысленность размещения российской базы https://t.co/ojbaqcnubk,Unknown,Russian,2015-10-27 21:12:00,2015-10-27 21:12:00,185,98,2157,R,1
nasty_grach,ФИФА зарегистрировала семь кандидатов для участия в выборах главы организации https://t.co/k4uYXJvlfQ,Unknown,Russian,2015-10-28 10:38:00,2015-10-28 10:38:00,185,98,2162,R,1
nasty_grach,Упс   Голландия проведет референдум по Украине https://t.co/z62anlG5LX,Unknown,Ukrainian,2015-10-28 14:57:00,2015-10-28 14:57:00,185,98,2163,R,1
nasty_grach,СМИ: Deutsche Bank может выплатить $200 млн из-за нарушения режима санкций  https://t.co/ghkowX5BlY https://t.co/mjK3fKo6v5,Unknown,Russian,2015-10-29 09:12:00,2015-10-29 09:13:00,185,98,2167,R,1
nasty_grach,"На Украине учащаются нападения на храмы УПЦ МП, утверждает ""Оппозиционный блок"" https://t.co/yjrAVXKKGr",Unknown,Russian,2015-10-29 16:14:00,2015-10-29 16:14:00,185,98,2168,R,1
nasty_grach,Центральный Республиканский Банк ДНР распорядился установить курсы валют на 30 октября 2015г. https://t.co/M5g1rsV3R5,Unknown,Russian,2015-10-29 23:54:00,2015-10-29 23:54:00,185,98,2170,R,1
nasty_grach,"30 октября, праздники: День политических репрессий  Эпиграф: Сегодня праздник у девчат. Сегодня в клубе танцы!   https://t.co/rr1T87C4UW",Unknown,Russian,2015-10-30 10:13:00,2015-10-30 10:13:00,185,98,2173,R,1
nasty_grach,"Помазан: по-моему, пенальти в ворота «Анжи» даже близко не было https://t.co/Rrm5hdpEM1",Unknown,Russian,2015-10-30 10:15:00,2015-10-30 10:15:00,185,98,2174,R,1
nasty_grach,Естественный прирост населения наблюдается в Москве https://t.co/v2y3N8Lck4 https://t.co/1apOLyaUVz,Unknown,Russian,2015-10-30 22:31:00,2015-10-30 22:36:00,185,97,2175,R,1
nasty_grach,На место крушения российского самолета выехали 45 бригад скорой помощи  https://t.co/muisxOwQqp https://t.co/26wiSnWAe8,Unknown,Russian,2015-10-31 10:13:00,2015-10-31 10:13:00,185,97,2176,R,1
nasty_grach,"Более 2 млн рублей составит страховка для каждого пассажира лайнера, разбившегося в Египте https://t.co/6pdUGStiIa",Unknown,Russian,2015-10-31 10:34:00,2015-10-31 10:34:00,185,97,2177,R,1
nasty_grach,"Виллаш-Боаш: для Лодыгина настал подходящий момент, чтобы вернуться https://t.co/9lC8b0Mz71",Unknown,Russian,2015-10-31 14:31:00,2015-10-31 14:31:00,185,97,2179,R,1
nasty_grach,Глава МЧС: Поиск тел погибших в авиакатастрофе в Египте завершится в ближайшие дни  https://t.co/8Z4dkqcqME,Unknown,Russian,2015-11-01 05:31:00,2015-11-01 05:37:00,185,97,2182,R,1
nasty_grach,СМИ: за 9 месяцев в Германию прибыли 600 тысяч беженцев https://t.co/2qyuGeLw9f,Unknown,Russian,2015-11-01 06:32:00,2015-11-01 06:32:00,185,97,2183,R,1
nasty_grach,Великобритания предложила помощь в расследовании причин крушением A321 https://t.co/MF7n8SFREr,Unknown,Russian,2015-11-01 14:57:00,2015-11-01 14:57:00,185,98,2183,R,1
nasty_grach,Акция памяти жертв крушения А-321 в Санкт-Петербурге https://t.co/5HISmUIQTh #7K9268 https://t.co/eke3ZrnYVj,Unknown,Russian,2015-11-01 18:55:00,2015-11-01 18:55:00,185,98,2185,R,1
nasty_grach,Захарова: к составлению списка террористических групп Сирии привлекут экспертов  https://t.co/tZ0K8Vky6C,Unknown,Russian,2015-11-01 21:52:00,2015-11-01 21:52:00,185,98,2186,R,1
nasty_grach,"сегодня ЦБ отозвал лицензии у 4 банков, а военкомат — паспорта у 4 тысяч призывников",Unknown,Russian,2015-11-02 16:03:00,2015-11-02 16:03:00,185,98,2192,R,1
nasty_grach,"«Когалымавиа» опубликовала часть документов по А321, переданных в СК https://t.co/F4A1X0KpQb #7K9268 https://t.co/3aXqyEvFhA",Unknown,Russian,2015-11-02 19:32:00,2015-11-02 19:33:00,185,98,2195,R,1
nasty_grach,За чей счет существует ИГ https://t.co/A1MHrt7WZR https://t.co/6fnEiyFUOo,Unknown,Russian,2015-11-02 20:31:00,2015-11-02 20:31:00,185,98,2196,R,1
nasty_grach,Дочь Шойгу ответила на разоблачения Навального https://t.co/in12zUfLJd,Unknown,Russian,2015-11-03 06:25:00,2015-11-03 06:26:00,185,98,2200,R,1
nasty_grach,В Volkswagen отреагировали на результаты расследования США  https://t.co/5BRB4C3rIk https://t.co/aJeUNvzZBU,Unknown,Russian,2015-11-03 08:01:00,2015-11-03 08:01:00,185,98,2201,R,1
nasty_grach,Депутат Екатеринбурга признал вину в организации убийства пенсионерки https://t.co/F3AeZ8ABOr https://t.co/v1WF7y7N4Y,Unknown,Russian,2015-11-03 09:52:00,2015-11-03 09:52:00,185,98,2202,R,1
nasty_grach,Эксперты рассказали о востребованных профессиях будущего https://t.co/hhUIfrxrch,Unknown,Russian,2015-11-03 12:36:00,2015-11-03 12:37:00,185,98,2203,R,1
nasty_grach,"Съезд ""Единой России"" пройдет 5-6 февраля в Москве https://t.co/UllZVfkOJc",Unknown,Russian,2015-11-03 15:33:00,2015-11-03 15:33:00,185,98,2204,R,1
nasty_grach,Рязанцев: «Зениту» хочется сделать последний шаг и выйти в плей-офф ЛЧ https://t.co/uTFG7i2Ewn,Unknown,Russian,2015-11-03 18:33:00,2015-11-03 18:33:00,185,98,2205,R,1
nasty_grach,В Нью-Йорке мужчина нанес ножевые ранения двум пассажирам метро  https://t.co/QMLtwrJyJz,Unknown,Russian,2015-11-03 22:52:00,2015-11-03 22:53:00,185,98,2206,R,1
nasty_grach,Опознаны тела 42 погибших в крушении A321 https://t.co/EWupg9INGO,Unknown,Russian,2015-11-04 14:37:00,2015-11-04 14:37:00,185,98,2208,R,1
nasty_grach,Следователи СК РФ проверят все версии причин крушения A321 на Синайском полуострове  https://t.co/v0HLElRNQ7,Unknown,Russian,2015-11-04 20:32:00,2015-11-04 20:39:00,185,98,2209,R,1
nasty_grach,"CNN: спецслужбы США полагают, что крушение А123 было терактом ИГ #новости https://t.co/WVbWg7Ghum",Unknown,Russian,2015-11-04 21:34:00,2015-11-04 21:34:00,185,98,2210,R,1
nasty_grach,"ФОТОРЕПОРТАЖ. ""Зенит"" победил ""Лион"". Как это было https://t.co/GggbgyS5Hs https://t.co/gesRExKGpL",Unknown,Russian,2015-11-04 23:36:00,2015-11-04 23:36:00,185,98,2210,R,1
nasty_grach,Обама сделал заявление по авиакатастрофе А321 в Египте https://t.co/Y2vTxzND54 https://t.co/7PoLXzVetG,Unknown,Russian,2015-11-05 23:53:00,2015-11-05 23:53:00,185,98,2215,R,1
nasty_grach,"Собака отчаянно грустит каждый раз, когда провожает владельца в школу (ВИДЕО)  https://t.co/rYpNN0tkCN https://t.co/smMk6oTgVD",Unknown,Russian,2015-11-06 15:13:00,2015-11-06 15:19:00,185,98,2217,R,1
nasty_grach,S7 вернула звание самой пунктуальной авиакомпании мира: https://t.co/hBdq0LAHDi,Unknown,Russian,2015-11-06 15:32:00,2015-11-06 15:32:00,185,97,2218,R,1
nasty_grach,"МВФ одобрил выделение Армении кредитного транша на $16,3 млн https://t.co/NqZtwrMtbS",Unknown,Russian,2015-11-07 02:14:00,2015-11-07 02:14:00,185,98,2219,R,1
nasty_grach,Фигуристка Елена Радионова заняла третье место в Китае https://t.co/k4MsJ5bymt https://t.co/e6HZewrE00,Unknown,Russian,2015-11-07 17:54:00,2015-11-07 17:54:00,185,98,2222,R,1
nasty_grach,Парк культуры и отдыха имени Горького https://t.co/JHBryxA9Zg,Unknown,Ukrainian,2015-11-08 08:37:00,2015-11-08 08:38:00,184,98,2223,R,1
nasty_grach,Второй самолёт МЧС РФ вылетел в Москву из Египта с 30 т багажа российских туристов https://t.co/nStRtMZpwq,Unknown,Russian,2015-11-08 09:31:00,2015-11-08 09:35:00,184,98,2224,R,1
nasty_grach,"Самолеты Минобороны доставили во ""Внуково"" более 40 тонн багажа туристов из Египта https://t.co/60tWvDdmrM",Unknown,Russian,2015-11-09 18:33:00,2015-11-09 18:33:00,184,97,2231,R,1
nasty_grach,Минфин предложил методы воздействия на амнистию капиталов https://t.co/VL6xY9lA2j https://t.co/Re8E3CZh1W,Unknown,Russian,2015-11-10 02:51:00,2015-11-10 02:51:00,184,97,2233,R,1
nasty_grach,МЭА спрогнозировал рост цен на нефть до $80 за баррель к 2020 году Инвестиции в нефтяную отрасль по итогам 2015 …  https://t.co/2t9XtvJKwZ,Unknown,Ukrainian,2015-11-10 07:34:00,2015-11-10 07:34:00,184,97,2234,R,1
nasty_grach,"Шойгу: “Спасибо Навальному, нашёл мне хату на Новый год!”",Unknown,Russian,2015-11-10 08:11:00,2015-11-10 08:11:00,184,98,2235,R,1
nasty_grach,"'@turist532 я об этом говорил в начале беседы, да @Alexandr_Sam @hnatali123'",Unknown,Russian,2015-11-10 09:55:00,2015-11-10 09:55:00,184,98,2236,R,1
nasty_grach,Винни-Пух оказался девочкой https://t.co/mihhjUIUhl,Unknown,Russian,2015-11-10 15:33:00,2015-11-10 15:34:00,184,98,2238,R,1
nasty_grach,Премьер-министр Сербии пообещал помочь Сребренице пожертвованиями https://t.co/xiQOaVILNj,Unknown,Russian,2015-11-10 21:12:00,2015-11-10 21:12:00,184,98,2239,R,1
nasty_grach,"Мишань, ты чего обиделся-то? Так хорошо общались. Даже про 2% ни слова. https://t.co/6OnGXd0qPo",Unknown,Russian,2015-11-10 21:51:00,2015-11-10 21:51:00,184,98,2240,R,1
nasty_grach,Airbus A319 сел в Хабаровске из-за трещин в стекле кабины пилотов https://t.co/QjDaalaoNk,Unknown,Serbian,2015-11-11 06:33:00,2015-11-11 06:34:00,184,98,2241,R,1
nasty_grach,"удобно морякам - чуток затопил корабль, и сразу понятно, кто из сослуживцев крыса",Unknown,Russian,2015-11-11 10:54:00,2015-11-11 10:54:00,184,98,2245,R,1
nasty_grach,«Пришедших пообщаться» в Крым украинских военных выдворили на родину https://t.co/6Voo3MY5RF,Unknown,Russian,2015-11-11 11:50:00,2015-11-11 11:50:00,184,98,2246,R,1
nasty_grach,Independent: христианству на Ближнем Востоке грозит полное исчезновение https://t.co/NWTHjoLjHl,Unknown,Russian,2015-11-11 11:55:00,2015-11-11 11:55:00,184,98,2247,R,1
nasty_grach,"Условия подготовки сборных к ОИ находятся на должном уровне, заявил Владимир Путин https://t.co/TUyOQr1GCq https://t.co/CyCvCYqx6w",Unknown,Russian,2015-11-11 20:51:00,2015-11-11 20:51:00,184,98,2254,R,1
nasty_grach,Курды начали новое наступление на ИГ в Ираке https://t.co/gpdlq4AwgQ,Unknown,Russian,2015-11-12 06:53:00,2015-11-12 06:53:00,184,98,2255,R,1
nasty_grach,Московские суды перейдут на электронный документооборот к 2016 году https://t.co/s7zqrI44Rz,Unknown,Russian,2015-11-12 11:20:00,2015-11-12 11:20:00,184,98,2256,R,1
nasty_grach,YouTube выпустил конкурента Apple Music и Spotify  https://t.co/f6YFHvLKRp https://t.co/vBSN9QvrmP,Unknown,Russian,2015-11-12 18:56:00,2015-11-12 18:56:00,184,97,2257,R,1
nasty_grach,"В Lufthansa сказали, когда восстановят полеты на всех направлениях  https://t.co/51TqwYCGKG https://t.co/pBGbM1wHog",Unknown,Russian,2015-11-12 19:54:00,2015-11-12 19:55:00,184,97,2258,R,1
nasty_grach,"Золото на 3,6 миллиона рублей похищено в артели Якутии https://t.co/LizBkwxMIk https://t.co/KwKmpLShdw",Unknown,Russian,2015-11-13 06:53:00,2015-11-13 06:53:00,184,97,2259,R,1
nasty_grach,"#Богданов, вопрос дня: Контролируют ли правительство и ЦБ ситуацию в экономике? Обсуждаем на РБК сегодня с 21:00!",Unknown,Russian,2015-11-13 12:59:00,2015-11-13 13:00:00,184,97,2262,R,1
nasty_grach,Путин: по итогам совещаний по военной тематике будет даны поручения https://t.co/gyYIr4zbCH https://t.co/KmM1y44MaL,Unknown,Russian,2015-11-13 13:55:00,2015-11-13 13:56:00,184,97,2265,R,1
nasty_grach,"Путин интересуется, нет ли у США желания вновь разжечь войну в Донбассе  https://t.co/0Fux8thJqZ https://t.co/6WiBuwkceU",Unknown,Russian,2015-11-13 14:21:00,2015-11-13 14:21:00,184,97,2266,R,1
nasty_grach,Правительство Дании намерено значительно ужесточить иммиграционное законодательство https://t.co/ugJZJ7OkYh,Unknown,Russian,2015-11-13 17:52:00,2015-11-13 17:52:00,184,98,2269,R,1
nasty_grach,Россия снизила таможенный барьер для импорта легких грузовиков https://t.co/rBH12OkgZf,Unknown,Russian,2015-11-13 17:57:00,2015-11-13 17:57:00,184,98,2270,R,1
nasty_grach,"Ди Мария: думаю, что ушёл из «Реала» в нужное время https://t.co/mneb9r9ngp",Unknown,Russian,2015-11-13 18:43:00,2015-11-13 18:43:00,184,98,2271,R,1
nasty_grach,Копию иконы Богородицы «Всецарица» доставят в Ростов из Афона https://t.co/RqlQWJ2xqu,Unknown,Russian,2015-11-13 18:55:00,2015-11-13 18:55:00,184,98,2272,R,1
nasty_grach,Посол России: альтернативы партнерству между Москвой и Италией нет https://t.co/eRYxyVyLGQ https://t.co/4UkPpOYKUs,Unknown,Russian,2015-11-14 08:21:00,2015-11-14 08:22:00,185,98,2274,R,1
nasty_grach,В ДНР заявляют о замаскированных украинских танках около Горловки https://t.co/Zf8PsvtAPd https://t.co/ll2TgctMNJ,Unknown,Russian,2015-11-14 11:15:00,2015-11-14 11:16:00,185,98,2275,R,1
nasty_grach,Глава Нацбанка: Украина выполнила все требования программы МВФ https://t.co/BcjEwfbAso https://t.co/C38DDapV5P,Unknown,Russian,2015-11-14 20:11:00,2015-11-14 20:11:00,185,98,2277,R,1
nasty_grach,"Сообщение о бомбе в гостинице ""Космос"" в Москве оказалось ложным  https://t.co/B8lB1IULEI https://t.co/VCexkVjmhG",Unknown,Russian,2015-11-14 22:35:00,2015-11-14 22:35:00,185,98,2278,R,1
nasty_grach,Отменен выход фильма о подготовке теракта в Париже https://t.co/qRbrquBziJ #ParisAttacks #Париж #теракт https://t.co/Ae8IuKlya9,Unknown,Russian,2015-11-14 23:34:00,2015-11-14 23:34:00,185,98,2279,R,1
nasty_grach,#beautiful https://t.co/Z5irhimIur,Unknown,Russian,2015-11-15 12:31:00,2015-11-15 12:32:00,185,98,2283,R,1
nasty_grach,Путин и Обама на саммите G20 обсудили ситуацию в Сирии и на Украине https://t.co/qnB9jVJUMd #G20 https://t.co/BqIWFSDxQr,Unknown,Russian,2015-11-15 17:35:00,2015-11-15 17:35:00,185,98,2287,R,1
nasty_grach,Министерская скидка: зачем девелоперы строят дешевое арендное жилье https://t.co/0PvffitVR8,Unknown,Russian,2015-11-15 21:16:00,2015-11-15 21:17:00,185,98,2288,R,1
nasty_grach,Матвиенко: формирование ИГ - результат вмешательства извне  https://t.co/kJJO0QQgcR https://t.co/zzLNrnAdxx,Unknown,Russian,2015-11-16 01:33:00,2015-11-16 01:33:00,185,98,2289,R,1
nasty_grach,Камчатский вулкан выбросил семикилометровый столб пепла https://t.co/hbUMOrNG8H,Unknown,Russian,2015-11-16 01:53:00,2015-11-16 01:53:00,185,98,2290,R,1
nasty_grach,Рождественский мультфильм о неудачливом коте собрал почти 8 миллионов просмотров: https://t.co/Fcsyt29UMe https://t.co/Utk7npobBJ,Unknown,Russian,2015-11-16 11:18:00,2015-11-16 11:18:00,185,99,2297,R,1
nasty_grach,Путин: РФ на саммите G20 привела примеры финансирования террористов https://t.co/A3EVTgCskn #G20 https://t.co/Q4tSEmQ9NW,Unknown,Russian,2015-11-16 15:14:00,2015-11-16 15:14:00,185,99,2300,R,1
nasty_grach,Дептранс Москвы уточнил информацию по закрытию входа на станцию метро «Смоленская»  https://t.co/8ouVPFBhJd,Unknown,Russian,2015-11-16 18:35:00,2015-11-16 18:35:00,185,99,2303,R,1
nasty_grach,Ученые: три чашки кофе в день снижают риск преждевременной смерти https://t.co/hqr9mVGbQd © Flickr/ Mark Hillary https://t.co/tbamxXViba,Unknown,Russian,2015-11-17 05:13:00,2015-11-17 05:13:00,185,101,2305,R,1
nasty_grach,Концерт памяти жертв событий на Синае и во Франции пройдет в Приморье https://t.co/ROyqsyClPJ https://t.co/GNHjZdpL18,Unknown,Russian,2015-11-17 05:32:00,2015-11-17 05:32:00,185,101,2307,R,1
nasty_grach,Французские ВВС нанесли новый удар по ИГ в сирийском городе Эр-Ракка https://t.co/5OdJoGRecS © AP Photo https://t.co/kmJOzjBjSP,Unknown,Russian,2015-11-17 06:12:00,2015-11-17 06:12:00,185,101,2308,R,1
nasty_grach,Семь человек пострадали при столкновении двух автобусов в Красноярске https://t.co/HshEbUFiwR https://t.co/ND6P1vp0TE,Unknown,Russian,2015-11-17 08:12:00,2015-11-17 08:12:00,185,101,2310,R,1
nasty_grach,Акция по сдаче крови для онкобольных детей стартует в ЛНР 20 ноября – детский омбудсмен https://t.co/9f8MTI8wof,Unknown,Russian,2015-11-17 09:15:00,2015-11-17 09:15:00,185,101,2312,R,1
nasty_grach,"Цена барреля нефти ОПЕК впервые с февраля 2009 года упала до $38,18 https://t.co/qzxv9wKQHm https://t.co/H70WyN8yWW",Unknown,Russian,2015-11-17 09:53:00,2015-11-17 09:53:00,185,101,2313,R,1
nasty_grach,Хакеры Anonymous займутся расследованием причин теракта на борту A321  https://t.co/7QFcuNsmm7 https://t.co/JFis1a28Xz,Unknown,Russian,2015-11-17 12:37:00,2015-11-17 12:37:00,185,101,2315,R,1
nasty_grach,Чуркин: Россия не поддержала в ГА ООН резолюцию по докладу МАГАТЭ https://t.co/x8ZoBBdHMh © AP Photo/John Minchillo https://t.co/Ln0v1DHDkg,Unknown,Ukrainian,2015-11-18 00:51:00,2015-11-18 00:51:00,185,101,2318,R,1
nasty_grach,Медведев: к 2020 году экспорт зерна из РФ составит 35-40 млн тонн https://t.co/YE9tau5olq https://t.co/ojxTGTPJbJ,Unknown,Russian,2015-11-18 07:33:00,2015-11-18 07:33:00,185,101,2320,R,1
