author_id,content,region,language,publish_date,harvested_date,following,followers,updates,post_type,retweet
natashapavlovaa,"Бертолаччи: сделаю всё, чтобы восстановиться и сыграть в миланском дерби http://t.co/ALq3UuIDzR",United States,Russian,2015-09-05 09:14:00,2015-09-05 09:15:00,175,305,1960,R,1
natashapavlovaa,Началась плановая коррекция орбиты МКС http://t.co/vAF2Ysc11T,United States,Russian,2015-09-07 05:34:00,2015-09-07 05:34:00,175,305,1963,R,1
natashapavlovaa,Новый iPhone 7 станет самым тонким смартфоном Apple  #hitech,United States,Russian,2015-09-07 10:31:00,2015-09-07 10:31:00,175,305,1965,R,1
natashapavlovaa,Burberry предложил клиентам самим создавать шарфы: http://t.co/4eHLiRK0fB,United States,Russian,2015-09-07 14:31:00,2015-09-07 14:31:00,175,305,1967,R,1
natashapavlovaa,ЦБ повысит ставку при курсе доллара 80 рублей http://t.co/QzsXZadTKc,United States,Russian,2015-09-07 16:52:00,2015-09-07 16:52:00,175,305,1968,R,1
natashapavlovaa,Кудрин предсказал повышение цен на продукты после принятия закона Яровой «О торговле» http://t.co/0TmWjvpVox,United States,Russian,2015-09-07 17:51:00,2015-09-07 17:51:00,175,305,1969,R,1
natashapavlovaa,Виллаш-Боаш рассматривает возможность подачи жалобы на статью регламента КДК http://t.co/70U1hYKBfr,United States,Russian,2015-09-09 09:33:00,2015-09-09 09:33:00,175,305,1981,R,1
natashapavlovaa,Олег Тиньков предложил купить «банк для хипстеров» — Рокетбанк — за $1 млн http://t.co/McuRqPRWAX,United States,Ukrainian,2015-09-09 12:33:00,2015-09-09 12:33:00,175,305,1984,R,1
natashapavlovaa,"Разгон облаков не вредит здоровью человека, заявил глава Росгидромета http://t.co/IQELwBmUeL",United States,Russian,2015-09-09 14:12:00,2015-09-09 14:12:00,175,305,1985,R,1
natashapavlovaa,"Суд отказал бывшей супруге Владимира Потанина Наталии в разделе акций ""Норникеля"" и ""Интерроса"": http://t.co/RYlIYYeNZn",United States,Russian,2015-09-09 17:33:00,2015-09-09 17:33:00,175,305,1986,R,1
natashapavlovaa,Какое вооружение Россия поставит Сирии  http://t.co/vKznya7wAe http://t.co/fmV6Nyc7dL,United States,Russian,2015-09-09 21:31:00,2015-09-09 21:31:00,175,305,1987,R,1
natashapavlovaa,"Судьбу Сирии должен решать сирийский народ, а не внешние стороны, заявил Дмитрий Песков http://t.co/vsvCi9sxC3",United States,Russian,2015-09-10 18:11:00,2015-09-10 18:11:00,175,305,1992,R,1
natashapavlovaa,Россиянин назвал операцию по пересадке головы «подарком на Рождество» http://t.co/f507ncxZfO,United States,Russian,2015-09-11 13:33:00,2015-09-11 13:33:00,175,305,1995,R,1
natashapavlovaa,В Нью-Йорке прошла минута молчания в память о жертвах теракта 11 сентября http://t.co/89VzOcsbkq,United States,Russian,2015-09-11 13:52:00,2015-09-11 13:52:00,175,305,1996,R,1
natashapavlovaa,"«Боруссия» М крупно уступила «Гамбургу», потерпев четвёртое поражение подряд http://t.co/BfTzRqsfjC",United States,Russian,2015-09-11 22:04:00,2015-09-11 22:04:00,175,306,1997,R,1
natashapavlovaa,"Корабль ""Союз ТМА-16М"" отстыковался от МКС  http://t.co/qlaGxoYz1q",United States,Russian,2015-09-11 22:31:00,2015-09-11 22:32:00,175,306,1998,R,1
natashapavlovaa,Расторгуева госпитализировали из-за низкого давления http://t.co/J9ymMxqi6b,United States,Russian,2015-09-12 12:34:00,2015-09-12 12:34:00,175,305,1999,R,1
natashapavlovaa,табуретка в руках российского солдата — оружие массового поражения,United States,Russian,2015-09-14 10:35:00,2015-09-14 10:35:00,175,305,2003,R,1
natashapavlovaa,Европа объединяется против беженцев  http://t.co/5wr9jbV7s2 http://t.co/hux8uwWTit,United States,Russian,2015-09-14 17:52:00,2015-09-14 17:52:00,175,305,2005,R,1
natashapavlovaa,"Венгрия частично закрыла воздушное пространство вдоль границы с Сербией, сообщает агентство Reuters: http://t.co/zs0368J1B6",United States,Russian,2015-09-14 18:31:00,2015-09-14 18:31:00,175,305,2006,R,1
natashapavlovaa,В Госдуму внесен проект о нарезке одномандатных округов  http://t.co/K1DgprwvnD http://t.co/z5uqByOTXf,United States,Russian,2015-09-15 07:51:00,2015-09-15 07:51:00,175,305,2009,R,1
natashapavlovaa,"Министр иностранных дел Францииквалифицировал договоренность по ""Мистралям"" с Россией как ""полюбовное соглашение"" http://t.co/igPYTzVLED",United States,Russian,2015-09-15 19:32:00,2015-09-15 19:32:00,175,305,2013,R,1
natashapavlovaa,Асад подтвердил поставки военной техники Ираном http://t.co/8OsXFsIKXH,United States,Russian,2015-09-16 04:31:00,2015-09-16 04:31:00,175,305,2014,R,1
natashapavlovaa,Аксенов предложил отправить украинских политиков на психиатрическую экспертизу http://t.co/iq3387MbPx,United States,Russian,2015-09-17 10:54:00,2015-09-17 10:54:00,175,306,2021,R,1
natashapavlovaa,Вкусы нашего детства Ностальгия одолела? РТ!  http://t.co/9ukvUTJvCs,United States,Russian,2015-09-18 13:49:00,2015-09-18 13:51:00,175,306,2023,R,1
natashapavlovaa,Порошенко на Генассамблее ООН поднимет вопрос об ограничении права вето для членов Совбеза http://t.co/DlhNfy9uGa,United States,Russian,2015-09-18 14:12:00,2015-09-18 14:12:00,175,306,2024,R,1
natashapavlovaa,Веркотерен: «Крылья Советов» готовятся к матчу с одной из лучших команд России http://t.co/wwVqTJ2ASd,United States,Russian,2015-09-18 16:12:00,2015-09-18 16:12:00,175,306,2025,R,1
natashapavlovaa,Явлинский связал с делом Кашина предложение отстранить Шлосберга  http://t.co/2pVSbobcWe http://t.co/TPUU33VduI,United States,Russian,2015-09-18 16:13:00,2015-09-18 16:14:00,175,306,2026,R,1
natashapavlovaa,Мэр Екатеринбурга обратился к Кличко  http://t.co/VPnh5bhJ0N http://t.co/FAjfzr2eCD,United States,Uzbek,2015-09-18 17:13:00,2015-09-18 17:13:00,175,306,2028,R,1
natashapavlovaa,Оргкомитет допускает празднование 500 и 100 дней до ЧМ-2018 http://t.co/lkJfbgEJnU,United States,Russian,2015-09-19 12:55:00,2015-09-19 12:55:00,175,306,2034,R,1
natashapavlovaa,В кабинете Гайзера нашли часы за миллион и пачки денег.   http://t.co/DozzTH80Gb http://t.co/wA5786EAoM,United States,Macedonian,2015-09-19 16:52:00,2015-09-19 16:52:00,175,307,2035,R,1
natashapavlovaa,Грязная победа Моуринью http://t.co/nEyAlKl0D0 http://t.co/gIU4qBr9s4,United States,Macedonian,2015-09-19 21:31:00,2015-09-19 21:32:00,175,307,2037,R,1
natashapavlovaa,Керри объявил о встрече с Лавровым в Нью-Йорке  http://t.co/0Ph2QNDAUp http://t.co/e7VasMooU9,United States,Russian,2015-09-20 18:11:00,2015-09-20 18:11:00,175,307,2043,R,1
natashapavlovaa,Глава Иркутской области не прибыл на дебаты перед вторым туром выборов  http://t.co/H05mPEXVz3,United States,Russian,2015-09-21 04:53:00,2015-09-21 04:53:00,175,307,2044,R,1
natashapavlovaa,В Казахстане появится первый McDonald's http://t.co/0Yfv0H1mHj,United States,Russian,2015-09-21 15:11:00,2015-09-21 15:11:00,175,307,2045,R,1
natashapavlovaa,Истребитель F-18 разбился в Калифорнии  http://t.co/VGhuKlsDln,United States,Russian,2015-09-22 03:31:00,2015-09-22 03:32:00,175,307,2046,R,1
natashapavlovaa,В московском метро опровергли информацию о сбое на красной ветке http://t.co/Wu038OHhNi,United States,Russian,2015-09-22 07:11:00,2015-09-22 07:11:00,175,307,2049,R,1
natashapavlovaa,Фигурант дела об убийстве Немцова отказался от сделки со следствием https://t.co/Mrtz799Tvs,United States,Russian,2015-09-23 07:22:00,2015-09-23 07:22:00,175,306,2054,R,1
natashapavlovaa,Майкл Бэй снимает сериал  http://t.co/FDAbKJw558 http://t.co/OeKRZZK67o,United States,Russian,2015-09-23 11:11:00,2015-09-23 11:11:00,175,306,2056,R,1
natashapavlovaa,Erwan Castel: Я воюю  в Донбассе за независимость Франции!   http://t.co/sIRvzhEVMa   https://t.co/ogVY8W1k9r,United States,Russian,2015-09-23 13:14:00,2015-09-23 13:14:00,175,306,2057,R,1
natashapavlovaa,В Европейском суде назвали незаконной передачу данных Facebook в США http://t.co/T0NuicJjaI,United States,Russian,2015-09-23 15:52:00,2015-09-23 15:52:00,175,306,2058,R,1
natashapavlovaa,«Роснефть» стала самой закредитованной компанией в России http://t.co/3CII8QW89a,United States,Russian,2015-09-23 17:12:00,2015-09-23 17:12:00,175,306,2059,R,1
natashapavlovaa,Стал известен размер пенсии ушедшего в отставку главы Volkswagen http://t.co/umHCZDEgew http://t.co/0D1kObIH3t,United States,Russian,2015-09-24 04:51:00,2015-09-24 04:51:00,175,305,2062,R,1
natashapavlovaa,"Профинансируй меня, если сможешь: «Эковахта Сахалина» вернула деньги фонду Ди Каприо  http://t.co/s9Is5V72CH http://t.co/Kz7OaTUVU4",United States,Russian,2015-09-24 05:51:00,2015-09-24 05:51:00,175,305,2063,R,1
natashapavlovaa,CNN: США заметили российские истребители в небе над Сирией https://t.co/S3QMTD3YXh http://t.co/IMcbWx40Ll,United States,Russian,2015-09-25 20:52:00,2015-09-25 20:52:00,175,305,2070,R,1
natashapavlovaa,Прокурор Буркина-Фасо заморозил активы устроившего мятеж генерала http://t.co/mvpya6lvEg,United States,Russian,2015-09-26 11:53:00,2015-09-26 11:53:00,174,304,2072,R,1
natashapavlovaa,"Кейн: все постоянно говорили о безголевой серии, но я верил в свой талант http://t.co/B0e7dPzw6T",United States,Russian,2015-09-26 15:33:00,2015-09-26 15:33:00,174,304,2073,R,1
natashapavlovaa,"""Зенит"" спас ничью в матче против ""Спартака"" http://t.co/oBYRSqENcF #спб  #спорт",United States,Serbian,2015-09-26 19:12:00,2015-09-26 19:12:00,174,304,2074,R,1
natashapavlovaa,Аксенов отреагировал на вооруженное нападение в Крыму  http://t.co/eEfoy2UsP4 http://t.co/RcxWZRKl6q,United States,Russian,2015-09-26 20:52:00,2015-09-26 20:52:00,174,304,2075,R,1
natashapavlovaa,Чем на самом деле прославился Иван Сусанин  http://t.co/WO6b9V9Lg9 http://t.co/pHi6DpSluS,United States,Russian,2015-09-26 21:30:00,2015-09-26 21:31:00,174,304,2076,R,1
natashapavlovaa,После реконструкции количество выходов из «Лужников» увеличится почти в два раза http://t.co/KYelbzjtFG,United States,Russian,2015-09-28 14:13:00,2015-09-28 14:13:00,174,304,2082,R,1
natashapavlovaa,«Роснефть» и «Аэрофлот» останутся у государства. В плане приватизации на 2016 год осталась одна крупная компания http://t.co/z48dLcPvbI,United States,Russian,2015-09-29 12:33:00,2015-09-29 12:33:00,173,304,2087,R,1
natashapavlovaa,Мутко раскрыл тайну  http://t.co/Pi0KgJjxYn http://t.co/oX52EIqvvk,United States,Macedonian,2015-09-29 15:54:00,2015-09-29 15:54:00,174,305,2090,R,1
natashapavlovaa,.@ukrfootball @SnowmanBbrsk https://t.co/0ySbZuaYcU,United States,Macedonian,2015-09-29 16:34:00,2015-09-29 16:34:00,174,305,2091,R,1
natashapavlovaa,Кержаков планирует продолжить карьеру игрока http://t.co/n37C3HWewn,United States,Russian,2015-09-30 11:13:00,2015-09-30 11:14:00,174,305,2095,R,1
natashapavlovaa,"когда Шойгу даёт собаке команду ""Служить"", животное моментально подписывает контракт",United States,Russian,2015-09-30 12:11:00,2015-09-30 12:12:00,174,305,2096,R,1
natashapavlovaa,Россия заранее предупредила США о бомбардировках в Сирии http://t.co/3cs9tGcodc,United States,Russian,2015-09-30 12:54:00,2015-09-30 12:54:00,173,304,2097,R,1
natashapavlovaa,Саудовская Аравия потребовала прекратить бомбить Сирию https://t.co/4Yve44LPjT,United States,Russian,2015-10-01 09:34:00,2015-10-01 09:34:00,173,303,2099,R,1
natashapavlovaa,Правительство приняло решение индексировать пенсии только на 4%  http://t.co/Qx0yxbB7Q0,United States,Russian,2015-10-02 09:53:00,2015-10-02 09:54:00,173,303,2103,R,1
natashapavlovaa,В Абхазии убили начальника приграничной с Грузией таможни  http://t.co/HQuQjtXdbf,United States,Russian,2015-10-02 23:12:00,2015-10-02 23:12:00,173,302,2107,R,1
natashapavlovaa,"Безнаказанность ""ветеранов АТО"" в Донбассе толкает их на преступления на Украине – военкор http://t.co/QpaT1wkQ5s",United States,Russian,2015-10-03 06:31:00,2015-10-12 16:42:00,173,300,2085,R,1
natashapavlovaa,Президент ФРГ: преодоление проблемы беженцев будет задачей не одного поколения немцев  http://t.co/H7TinBacDd,United States,Russian,2015-10-03 13:59:00,2015-10-03 13:59:00,173,302,2116,R,1
natashapavlovaa,"А кто отдраил все общественные тувалеты в Бонне по решению суда, тот невъебенно за Россию, да",United States,Russian,2015-10-03 18:32:00,2015-10-03 18:32:00,173,302,2117,R,1
natashapavlovaa,Генерал ВКС: система ГЛОНАСС покрывает весь земной шар http://t.co/YiFoJl47Qn,United States,Russian,2015-10-03 19:32:00,2015-10-03 19:32:00,173,302,2118,R,1
natashapavlovaa,Дворкович: мир можно прокормить без генетически модифицированных продуктов http://t.co/WmQBXzJo2R,United States,Russian,2015-10-04 04:52:00,2015-10-04 04:54:00,173,302,2119,R,1
natashapavlovaa,Посольство России подтвердило вручение ноты МИДом Турции http://t.co/Jj50LCcJJ1,United States,Russian,2015-10-05 08:53:00,2015-10-05 08:53:00,173,302,2127,R,1
natashapavlovaa,"ДНР и ЛНР согласились перенести выборы, но с условиями   http://t.co/GPly6tKA6D с помощью @rianru",United States,Russian,2015-10-06 22:52:00,2015-10-06 22:52:00,173,301,2136,R,1
natashapavlovaa,Агентство Fitch предсказало неизбежный дефолт на Украине http://t.co/NXMDJqvfIb,United States,Russian,2015-10-07 01:52:00,2015-10-07 01:52:00,173,301,2137,R,1
natashapavlovaa,Яркие кадры из жизни Владимира Путина за последний год — в фотоленте Ria.ru http://t.co/QETplLAL4i http://t.co/R9Kf3LO2ur,United States,Russian,2015-10-07 11:39:00,2015-10-07 11:39:00,173,301,2138,R,1
natashapavlovaa,"солдат НАТО и в воде не тонет, и в огне... нет, просто в воде не тонет",United States,Ukrainian,2015-10-07 19:09:00,2015-10-07 19:09:00,173,302,2142,R,1
natashapavlovaa,Украинские беженцы покидают Россию  http://t.co/H6hvmO5ACg http://t.co/iAE4tLUr2i,United States,Russian,2015-10-08 10:11:00,2015-10-08 10:11:00,173,302,2145,R,1
natashapavlovaa,Эксперты Bellingcat выпустили итоговый отчет о крушении Boeing в Донбассе  http://t.co/dU2QOKuiWA,United States,Russian,2015-10-08 12:53:00,2015-10-08 12:53:00,173,302,2146,R,1
natashapavlovaa,Эксперты при правительстве посмотрели на практику отмены выборов мэров и сочли ее неконституционной https://t.co/cVxs8cDZoW,United States,Russian,2015-10-09 08:13:00,2015-10-09 08:13:00,173,302,2149,R,1
natashapavlovaa,'@volkova_v Только Щаранский приведет нас к победе Щаранизма-Хайкинизма! Слава ГБО !!!',United States,Russian,2015-10-10 05:54:00,2015-10-10 05:54:00,173,302,2153,R,1
natashapavlovaa,Кадыров: России «не жарко и не холодно от вздыханий Запада» по ситуации в Сирии  http://t.co/TmPjAPQIKB http://t.co/K8WruddvQ5,United States,Ukrainian,2015-10-10 08:53:00,2015-10-10 08:53:00,173,302,2155,R,1
natashapavlovaa,"Премьер Турции сообщил, кто мог организовать теракт в Анкаре  http://t.co/h7f2kjxBmh http://t.co/vcfGfJRW9m",United States,Russian,2015-10-10 16:52:00,2015-10-10 16:52:00,173,301,2159,R,1
natashapavlovaa,С. Уильямс и рэпер Дрейк опровергли слухи о помолвке http://t.co/FyiXEjO1DH,United States,Russian,2015-10-11 00:53:00,2015-10-11 00:53:00,173,301,2162,R,1
natashapavlovaa,Нико Росберг показал лучшее время в квалификации Гран-при России http://t.co/tr6iBexMCk http://t.co/rknXR4Tnax,United States,Russian,2015-10-11 01:02:00,2015-10-11 01:02:00,173,301,2163,R,1
natashapavlovaa,Полуторогодовалый ребенок отравился «спайсом» в Волгограде  http://t.co/x7FL8wxnoW http://t.co/cu7yt2ktPv,United States,Russian,2015-10-11 08:52:00,2015-10-11 08:53:00,173,301,2164,R,1
natashapavlovaa,ИГИЛ - проект израильской разведслужбы http://t.co/iduN4jC074,United States,Russian,2015-10-11 09:05:00,2015-10-11 09:05:00,173,301,2166,R,1
natashapavlovaa,Логично http://t.co/XcBXGTdEkT,United States,Macedonian,2015-10-12 09:23:00,2015-10-12 09:23:00,173,301,2172,R,1
natashapavlovaa,Эскалаторы в московском метро начнут работать по новому графику  https://t.co/oye6XQlRvX http://t.co/X7hHQdknLn,United States,Russian,2015-10-12 15:11:00,2015-10-12 15:11:00,173,300,2113,R,1
natashapavlovaa,"Решение по отзыву сертификата эксплуатанта у ""Трансаэро"" будет принято на этой неделе http://t.co/IJXU8xgzIj",United States,Russian,2015-10-13 13:12:00,2015-10-13 13:14:00,173,300,2080,R,1
natashapavlovaa,Дженнифер Лоуренс возмутилась гонораром Кристиана Бэйла  http://t.co/NKThWLHOr1 http://t.co/1vZR8vtVet,United States,Russian,2015-10-14 07:12:00,2015-10-14 07:12:00,173,299,2085,R,1
natashapavlovaa,Состав поражающих элементов в докладе по MH17 вызывал у России вопросы http://t.co/Cbo8VhJrth http://t.co/35I0F33CGG,United States,Russian,2015-10-14 11:35:00,2015-10-14 11:35:00,173,299,2086,R,1
natashapavlovaa,Минтранс: решение о поддержке кредиторов «Трансаэро» пока не принято http://t.co/peuGtFBYHE http://t.co/nsj9SfLxBq,United States,Russian,2015-10-15 08:37:00,2015-10-15 08:37:00,173,299,2089,R,1
natashapavlovaa,Злостных нарушителей ПДД в России хотят лишать прав на год  http://t.co/YepGlXcok6,United States,Russian,2015-10-15 14:34:00,2015-10-15 14:34:00,173,299,2093,R,1
natashapavlovaa,"Associated Press: военные специалисты США знали, что атакуют госпиталь в Кундузе http://t.co/nl673XHRa5",United States,Russian,2015-10-15 19:54:00,2015-10-15 19:54:00,173,300,2095,R,1
natashapavlovaa,Экс-игрок ЦСКА Филиппенков умер во время товарищеского матча в Пензе  http://t.co/DjtqdH0jF8 http://t.co/OfRINksfIK,United States,Russian,2015-10-15 21:51:00,2015-10-15 21:51:00,173,300,2097,R,1
natashapavlovaa,"Карадениз: если Кокорин не уедет в Европу, это будет его самой большой ошибкой http://t.co/3GpgyAFRk0",United States,Russian,2015-10-16 09:36:00,2015-10-16 09:36:00,173,300,2099,R,1
natashapavlovaa,ВИДЕО. Кадры с места ДТП в центре Москвы с участием Ferrari http://t.co/TYHHHcADzv http://t.co/a088RWiFNv,United States,Russian,2015-10-16 10:52:00,2015-10-16 10:52:00,173,300,2100,R,1
natashapavlovaa,"ФАС признало неизбежным банкротство ""Трансаэро"" http://t.co/MnVPl4M8Y6",United States,Russian,2015-10-16 10:54:00,2015-10-16 10:54:00,173,300,2101,R,1
natashapavlovaa,"Журналистов ""Вестей"" избили при попытке выяснить личность юноши из Ferrari http://t.co/a90ZXxQ70I",United States,Russian,2015-10-16 13:32:00,2015-10-16 13:32:00,173,300,2103,R,1
natashapavlovaa,Самолет МЧС перевез из Сирии в Москву граждан России и стран СНГ  https://t.co/1fAimhvn3l,United States,Russian,2015-10-17 07:31:00,2015-10-17 07:31:00,173,300,2106,R,1
natashapavlovaa,ФОТОГАЛЕРЕЯ. Линдси Лохан снова всех поразила  http://t.co/mA673r4rtt http://t.co/j3qcbSbNdk,United States,Russian,2015-10-17 15:15:00,2015-10-17 15:18:00,173,301,2110,R,1
natashapavlovaa,"Матчи в Москве, Самаре и Каспийске пройдут в 12-м туре чемпионата России по футболу http://t.co/ASqNHE5Y8E",United States,Russian,2015-10-17 22:52:00,2015-10-17 22:52:00,173,301,2112,R,1
natashapavlovaa,"CounterPunch: Ответственность за гибель малазийского ""Боинга"" лежит на украинских властях http://t.co/6VxRfaj9zd",United States,Russian,2015-10-18 08:12:00,2015-10-18 08:12:00,173,301,2113,R,1
natashapavlovaa,Фоменко: реванш у Словении? Команда и состав сборной изменились http://t.co/Yi82q9VCCi,United States,Russian,2015-10-18 11:51:00,2015-10-18 11:51:00,173,301,2114,R,1
natashapavlovaa,О'Нил: результаты игры с немцами должны вдохнуть уверенность в сборную Ирландии http://t.co/fAWM2qksFy,United States,Russian,2015-10-18 12:33:00,2015-10-18 12:33:00,173,301,2115,R,1
natashapavlovaa,"Как получить работу, которая круче, чем вы  http://t.co/muRhv7oL7v http://t.co/1sM2oWoirZ",United States,Russian,2015-10-18 18:14:00,2015-10-18 18:14:00,173,301,2116,R,1
natashapavlovaa,Источник: Mercedes протаранил 10 автомобилей в Москве  https://t.co/qzUf50GHMP,United States,Russian,2015-10-19 08:53:00,2015-10-19 08:53:00,173,301,2119,R,1
natashapavlovaa,"Стасевич: нельзя играть с «Барсой» так, чтобы лишь не опозориться http://t.co/3jsPKASJt6",United States,Russian,2015-10-19 15:14:00,2015-10-19 15:14:00,173,301,2121,R,1
natashapavlovaa,Что ждет украинских граждан в России ?  https://t.co/KIblnViSol https://t.co/K0nkS4R0rd,United States,Russian,2015-10-19 18:46:00,2015-10-19 18:46:00,173,301,2124,R,1
natashapavlovaa,Хакеры ИГИЛ зачастили в российский интернет  https://t.co/l0AkEKB3BI https://t.co/U14suiiPfZ,United States,Russian,2015-10-20 08:53:00,2015-10-20 08:53:00,173,301,2127,R,1
natashapavlovaa,по команде “Отбой!” в казарме засыпает даже электричество в розетке,United States,Russian,2015-10-20 08:54:00,2015-10-20 08:55:00,173,301,2128,R,1
natashapavlovaa,Хохлов намерен подать жалобу на «Кубань» в Палату по разрешению споров РФС https://t.co/QNlmI7HsWF,United States,Russian,2015-10-20 15:32:00,2015-10-20 15:32:00,173,301,2133,R,1
natashapavlovaa,НАСА составило портрет Плутона из фотографий пользователей сети https://t.co/9fQ42uyVxD © NASA/ JPL https://t.co/yIuqYHFlEH,United States,Russian,2015-10-21 11:15:00,2015-10-21 11:15:00,173,301,2136,R,1
