author_id,content,region,language,publish_date,harvested_date,following,followers,updates,post_type,retweet
natashapavlovaa,"Обама пообещал перестать преследовать семьи людей, похищенных террористами http://t.co/sMKmk0fTRY http://t.co/O9rCeXY8z1",United States,Russian,2015-06-23 22:11:00,2015-06-23 22:11:00,1889,294,1658,R,1
natashapavlovaa,11 человек попали в больницу после столкновения маршрутки с Range Rover http://t.co/sdMWzz7xtW,United States,Russian,2015-06-27 09:51:00,2015-06-27 09:51:00,1889,295,1661,R,1
natashapavlovaa,"""Крылья Советов"" завершили победой первый зарубежный сбор http://t.co/p01yxHRga5",United States,Russian,2015-07-08 09:51:00,2015-07-08 09:51:00,1887,294,1668,R,1
natashapavlovaa,Греция продлила банковские каникулы в третий раз: http://t.co/5UcVTZUkeR,United States,Russian,2015-07-15 10:47:00,2015-07-15 10:47:00,1884,296,1676,R,1
natashapavlovaa,'@salty_1970 @yuri_si62 @derevni_potemki @AndreyKauf @1958Bga Откуда снято отмечено стрелочкой.. http://t.co/OUSOqpFyBn',United States,Russian,2015-07-15 11:32:00,2015-07-15 11:32:00,1884,296,1677,R,1
natashapavlovaa,Мюзикл с Мерил Стрип откроет кинофестиваль в Локарно  http://t.co/tLJ1Dt22fG http://t.co/X1vfX4EGmA,United States,Serbian,2015-07-15 13:31:00,2015-07-15 13:31:00,1884,297,1678,R,1
natashapavlovaa,"'@SFGO76 я определился еще около пары лет назад, да. @CherkasovYra @DariaGreen'",United States,Russian,2015-07-16 18:12:00,2015-07-16 18:12:00,1365,297,1684,R,1
natashapavlovaa,Канада отправила военных на Украину http://t.co/rFBW0kWYWw http://t.co/0F2sFr8QyF,United States,Russian,2015-07-17 11:51:00,2015-07-17 11:51:00,1365,298,1686,R,1
natashapavlovaa,Мария Гайдар попросила предоставить ей украинское гражданство http://t.co/uHMe24jEbL,United States,Russian,2015-07-17 11:52:00,2015-07-17 11:52:00,1365,298,1687,R,1
natashapavlovaa,Чех доволен дебютом за «Арсенал» http://t.co/SCMWPWEoH0,United States,Ukrainian,2015-07-18 17:12:00,2015-07-18 17:12:00,1365,300,1688,R,1
natashapavlovaa,"'@SFGO76 Блогер, да ты охуел!'",United States,Macedonian,2015-07-18 17:52:00,2015-07-18 17:52:00,1365,300,1689,R,1
natashapavlovaa,Путин: российской металлургии нужна коренная модернизация производства.   http://t.co/fbAyeEBDB5 http://t.co/1maxg7Ni9C,United States,Russian,2015-07-19 09:33:00,2015-07-19 09:33:00,1365,302,1692,R,1
natashapavlovaa,"Кобелев: Денисов не сказал последнего слова — ни в «Динамо», ни в сборной http://t.co/db9b2e7lJS",United States,Russian,2015-07-19 13:53:00,2015-07-19 13:53:00,1365,301,1693,R,1
natashapavlovaa,"Веденеев: тренеры «Зенита» быстро сообразили, как использовать Дзюбу http://t.co/QqvMoV82W2",United States,Russian,2015-07-19 14:51:00,2015-07-19 14:51:00,1365,301,1694,R,1
natashapavlovaa,Путин предложил вернуть бизнесу инвестиционную льготу  http://t.co/iBYMNB51v7,United States,Macedonian,2015-07-20 00:11:00,2015-07-20 00:11:00,1365,302,1697,R,1
natashapavlovaa,Шокирующее видео момента падения боинга на Украине! Максимальный RT!    http://t.co/TTcL3Oy9Ok,United States,Russian,2015-07-20 07:43:00,2015-07-20 07:43:00,1365,303,1700,R,1
natashapavlovaa,Новый фильм Иоселиани участвует в конкурсе фестиваля в Локарно http://t.co/rkwHKXlcN2,United States,Russian,2015-07-20 11:51:00,2015-07-20 11:51:00,1365,303,1701,R,1
natashapavlovaa,"Директор Prosperity Capital Management о том, кто выигрывает от антисанкций, и ждет ли Россию рисовый бунт   http://t.co/DDjPoFuRYC",United States,Russian,2015-07-20 16:12:00,2015-07-20 16:12:00,1365,303,1704,R,1
natashapavlovaa,Президент «АвтоВАЗа»: LADA будет продаваться в 15-20 странах http://t.co/93IHC2reVy,United States,Russian,2015-07-20 20:31:00,2015-07-20 20:32:00,1365,304,1706,R,1
natashapavlovaa,Минобороны РФ выставит на торги 30 единиц военной техники  http://t.co/xln6g9EHxq,United States,Russian,2015-07-20 22:51:00,2015-07-20 22:51:00,1365,305,1708,R,1
natashapavlovaa,«Краснодар» продлил контракт с Жоаозиньо http://t.co/VkPddocdOr,United States,Macedonian,2015-07-21 18:52:00,2015-07-21 18:52:00,1365,304,1712,R,1
natashapavlovaa,Итоги Евро-2015: Хомуха вывел российский юношеский футбол на новый уровень http://t.co/vZZND8ysBw,United States,Russian,2015-07-22 01:11:00,2015-07-22 01:11:00,1364,304,1714,R,1
natashapavlovaa,Кадыров сделал заявление по факту ДТП в Чечне   http://t.co/Qvcheevqpg http://t.co/Ty8IjV4Ofo,United States,Russian,2015-07-22 06:13:00,2015-07-22 06:13:00,1364,304,1715,R,1
natashapavlovaa,Оранжевую ветку московского метро частично закроют для ремонта 25 июля http://t.co/EbUhg95k5R,United States,Ukrainian,2015-07-22 20:34:00,2015-07-22 20:34:00,1364,304,1720,R,1
natashapavlovaa,Игонин: с верным настроем «Зенит» должен одержать победу над «Уралом» http://t.co/odgt20VqVW,United States,Russian,2015-07-23 08:22:00,2015-07-23 08:22:00,1364,304,1721,R,1
natashapavlovaa,Новый оператор сотовой связи появится в России в 2016 году  #hitech,United States,Russian,2015-07-24 04:52:00,2015-07-24 04:52:00,1364,302,1727,R,1
natashapavlovaa,Бастрыкин отчитался о делах против украинцев — 54 дела — 100 тысяч допрошенных — 2500 томов   https://t.co/mmt34fQNBX,United States,Russian,2015-07-24 12:31:00,2015-07-24 12:31:00,1364,302,1729,R,1
natashapavlovaa,Украина привлекла $800 млн кредита у ВБ и Японии http://t.co/fOhbrlwqx1,United States,Ukrainian,2015-07-24 18:11:00,2015-07-24 18:11:00,1364,302,1732,R,1
natashapavlovaa,«Крылья Советов» — ЦСКА: прервалась сухая серия Конюхова http://t.co/5UyEmEvKjl,United States,Russian,2015-07-24 18:11:00,2015-07-24 18:11:00,1364,302,1733,R,1
natashapavlovaa,Шойгу поздравил военных  http://t.co/jLHXOt9ejL http://t.co/Rhz82t0EiI,United States,Russian,2015-07-26 07:11:00,2015-07-26 07:11:00,1364,304,1739,R,1
natashapavlovaa,Биржевой курс доллара взлетел выше 59 руб. http://t.co/AyLCbx1Gbw,United States,Uzbek,2015-07-27 09:33:00,2015-07-27 09:33:00,1363,305,1743,R,1
natashapavlovaa,Норвежцы создали самый большой в мире рожок с мороженым http://t.co/LigSq4kVJQ,United States,Russian,2015-07-27 11:33:00,2015-07-27 11:33:00,1363,305,1744,R,1
natashapavlovaa,Роспотребнадзор с 1 августа ограничил импорт рыбных консервов из Латвии http://t.co/BGkJCbTMEt,United States,Russian,2015-07-27 12:32:00,2015-07-27 12:32:00,1363,305,1745,R,1
natashapavlovaa,"Милые, милые каклы - Россия им оперативно аварийную мощность, а они ей тут же кучу говнища http://t.co/NAem30bnoN",United States,Russian,2015-07-28 03:02:00,2015-07-28 03:03:00,1363,305,1751,R,1
natashapavlovaa,"'@salty_1970 Привет,акупант.'",United States,Serbian,2015-07-28 03:53:00,2015-07-28 03:53:00,1363,305,1752,R,1
natashapavlovaa,Строителям Восточного выплатили почти 300 млн рублей долга  #новости http://t.co/ruylehgkT5,United States,Russian,2015-07-28 06:13:00,2015-07-28 06:13:00,1363,305,1753,R,1
natashapavlovaa,МИД Украины сообщил о плане Б инициаторов трибунала по MH17  http://t.co/rfEDaJQyNv,United States,Ukrainian,2015-07-28 14:54:00,2015-07-28 14:54:00,1363,305,1755,R,1
natashapavlovaa,"Манчини: рад, что в «Интер» переходит Йоветич, он нам очень поможет http://t.co/EwabliEHr5",United States,Russian,2015-07-29 08:11:00,2015-07-29 08:11:00,1363,306,1757,R,1
natashapavlovaa,Возбуждено новое дело о растрате при строительстве Восточного #новости http://t.co/S9ARdeFEA1,United States,Russian,2015-07-29 10:14:00,2015-07-29 10:14:00,1363,306,1760,R,1
natashapavlovaa,Советник Путина раскритиковал назначение протоиерея директором «Херсонеса Таврического» http://t.co/Dh0ERxRoFN http://t.co/c8FKpHpqbo,United States,Russian,2015-07-30 22:52:00,2015-07-30 22:52:00,1362,304,1766,R,1
natashapavlovaa,Сотни человек собрались на топлес-митинг в Канаде http://t.co/ZfliB2jLYb,United States,Macedonian,2015-08-02 02:12:00,2015-08-02 02:12:00,1363,305,1776,R,1
natashapavlovaa,Вертолет Ми-28 разбился на полигоне в Рязанской области #новости http://t.co/Sl16LI6xB1,United States,Russian,2015-08-02 10:32:00,2015-08-02 10:32:00,1363,305,1777,R,1
natashapavlovaa,Навка рассказала о подаренных Пескову часах http://t.co/rVXIUZQy5j,United States,Russian,2015-08-02 22:12:00,2015-08-02 22:13:00,1363,305,1780,R,1
natashapavlovaa,'@salty_1970 ))))',United States,Macedonian,2015-08-03 15:52:00,2015-08-03 15:52:00,1364,306,1785,R,1
natashapavlovaa,Крупнейший онлайн-ретейлер одежды Wildberries получил исков на сумму больше 80 млн рублей: http://t.co/1g61eTqzkC,United States,Russian,2015-08-04 13:32:00,2015-08-04 13:32:00,1364,306,1794,R,1
natashapavlovaa,"Медведев поручил проверить соблюдение трудовых прав в ""Трансаэро"" и UTair http://t.co/c8ZrqHAUPN",United States,Russian,2015-08-04 14:33:00,2015-08-04 14:33:00,1364,306,1796,R,1
natashapavlovaa,"""Известия"": слова Марии Гайдар просят проверить на сепаратизм и экстремизм http://t.co/2ggDBQpEof",United States,Russian,2015-08-05 01:53:00,2015-08-05 01:53:00,1365,305,1798,R,1
natashapavlovaa,Швеция опубликовала видео погружения к затонувшей российской подлодке  http://t.co/WyMP79pueI  http://t.co/iKxfZxNern,United States,Russian,2015-08-05 09:52:00,2015-08-05 09:52:00,1365,305,1800,R,1
natashapavlovaa,Уроки гибели Стенина: журналист должен рассчитывать на себя http://t.co/dOLcBSYkBg,United States,Russian,2015-08-05 18:11:00,2015-08-05 18:11:00,1365,305,1802,R,1
natashapavlovaa,Открывший стрельбу в кинотеатре Теннесси имел при себе макет бомбы #новости http://t.co/8F6j8l5uAf,United States,Russian,2015-08-06 01:32:00,2015-08-06 01:32:00,1365,305,1806,R,1
natashapavlovaa,Лаврова на гала-ужине АСЕАН посадили за столик с табличкой «Seroja»  http://t.co/TlBec0FDcA,United States,Serbian,2015-08-06 05:11:00,2015-08-06 05:11:00,1365,305,1808,R,1
natashapavlovaa,Лаказетт продлит контракт с «Лионом» http://t.co/mUuhHaA7rk,United States,Serbian,2015-08-06 09:12:00,2015-08-06 09:12:00,1365,305,1811,R,1
natashapavlovaa,"Ученые нашли белок, который не дает развиваться раку http://t.co/r7KcQ2D9x6",United States,Russian,2015-08-06 16:32:00,2015-08-06 16:32:00,1365,307,1815,R,1
natashapavlovaa,"""Парнас"" оспорит в суде отказ в регистрации на выборы в Новосибирске http://t.co/MpScrryuE2",United States,Serbian,2015-08-07 16:12:00,2015-08-07 16:12:00,1365,307,1817,R,1
natashapavlovaa,Песков: «Санкции США разрушают атмосферу взаимоотношений с Россией» http://t.co/vUxvhwc6tq,United States,Russian,2015-08-07 18:53:00,2015-08-07 18:53:00,1365,307,1818,R,1
natashapavlovaa,Отдыхающие пытались спасти находившихся на борту вертолета и гидросамолета http://t.co/4CQeN5CO2v,United States,Russian,2015-08-08 23:12:00,2015-08-08 23:12:00,1365,306,1821,R,1
natashapavlovaa,В одном из районов Дагестана введен режим контртеррористической операции  http://t.co/CBpI9WGqcG,United States,Russian,2015-08-10 06:34:00,2015-08-10 06:34:00,1365,307,1827,R,1
natashapavlovaa,Pussy Riot выступят на музыкальном фестивале в Будапеште http://t.co/WvpVA4ZtPL,United States,Russian,2015-08-10 14:52:00,2015-08-10 14:52:00,1365,307,1829,R,1
natashapavlovaa,Манифестанты попытались перекрыть шоссе у Фергюсона  http://t.co/rCJ19oaEz9,United States,Russian,2015-08-11 00:32:00,2015-08-11 00:32:00,1365,306,1830,R,1
natashapavlovaa,ГПУ собирается создать региональную военную прокуратуру в зоне АТО http://t.co/iVRD7pkXEV,United States,Russian,2015-08-12 03:11:00,2015-08-12 03:11:00,1365,306,1837,R,1
natashapavlovaa,CyЧка OзвуЧка: Украинский журналист не смог больше лгать   https://t.co/IN5a1oUb7O,United States,Russian,2015-08-12 04:22:00,2015-08-12 04:22:00,1365,306,1838,R,1
natashapavlovaa,"МВФ назвал ""позитвным шагом"" девальвацию юаня http://t.co/Bdtyyy85zn",United States,Russian,2015-08-12 06:11:00,2015-08-12 06:11:00,1365,306,1839,R,1
natashapavlovaa,Apple попросила Samsung и TSMC снизить стоимость деталей для новых iPhone http://t.co/lWWLVjZf8S,United States,Russian,2015-08-12 12:13:00,2015-08-12 12:13:00,1365,306,1840,R,1
natashapavlovaa,"К годовщине трагедии АПЛ ""Курск"" http://t.co/mY17Eo3SIC",United States,Serbian,2015-08-12 16:18:00,2015-08-12 16:18:00,1365,306,1843,R,1
natashapavlovaa,"Враг государства номер один..RT, чтоб развеять предрассудки!  http://t.co/3DkDPp6Qyi",United States,Russian,2015-08-13 15:54:00,2015-08-13 15:54:00,1365,306,1851,R,1
natashapavlovaa,Верховный суд Коннктикута признал смертную казнь неконституционной http://t.co/cYrcAp9oih,United States,Russian,2015-08-13 19:32:00,2015-08-13 19:32:00,1364,305,1853,R,1
natashapavlovaa,ЦИК не считает агитацией футболки с изображением врио главы Татарстана http://t.co/XKLxsw9dMI,United States,Russian,2015-08-14 15:51:00,2015-08-14 15:51:00,1364,306,1855,R,1
natashapavlovaa,Газинский: «Краснодар» очень серьёзно готовился к матчу с «Зенитом» http://t.co/pIqUJx7Mvx,United States,Russian,2015-08-15 17:52:00,2015-08-15 17:52:00,1364,307,1858,R,1
natashapavlovaa,Миссия ОБСЕ сообщила об ухудшении ситуации в Донбассе http://t.co/iu8rNez2i6,United States,Russian,2015-08-15 20:31:00,2015-08-15 20:31:00,1364,308,1859,R,1
natashapavlovaa,"В партии Кличко проболтались, что дефолт Украины уже наступил http://t.co/nkX728guy5",United States,Ukrainian,2015-08-16 04:11:00,2015-08-16 04:12:00,1364,307,1860,R,1
natashapavlovaa,"Нападающий «Сент-Этьена» сообщил, что продолжит карьеру в России http://t.co/MIO45ENXwx",United States,Russian,2015-08-16 09:53:00,2015-08-16 09:53:00,1364,307,1863,R,1
natashapavlovaa,"Ответственность за теракт в Пакистане взяла на себя группировка ""Лашкар-э-джангви""  http://t.co/nbZV9OeQnf",United States,Russian,2015-08-16 12:31:00,2015-08-16 12:31:00,1364,307,1865,R,1
natashapavlovaa,Новый детский телеканал Ani начинает свое вещание в России  #hitech,United States,Russian,2015-08-16 19:11:00,2015-08-16 19:11:00,1364,309,1866,R,1
natashapavlovaa,СБУ сообщила о задержании подозреваемых в терроризме россиян http://t.co/RkdnoEn9yb,United States,Russian,2015-08-18 11:52:00,2015-08-18 11:52:00,1364,309,1869,R,1
natashapavlovaa,Пищевые интересы: почему санкционные продукты необходимо уничтожать http://t.co/J1SS05UDO9,United States,Russian,2015-08-18 15:16:00,2015-08-18 15:16:00,1364,308,1870,R,1
natashapavlovaa,"«Лацио» победил ""Байер"" в игре ЛЧ благодаря голу Кейта http://t.co/4DT9N5njnw",United States,Russian,2015-08-18 22:34:00,2015-08-18 22:34:00,1364,307,1874,R,1
natashapavlovaa,У осужденного на 80 лет экс-диктатора Гватемалы обнаружена деменция http://t.co/9KrvrnSZ51,United States,Russian,2015-08-19 00:02:00,2015-08-19 00:02:00,1364,307,1876,R,1
natashapavlovaa,"Три человека пострадали в результате стрельбы в поезде, следовавшем из Амстердама в Париж, http://t.co/IMp054rs1l",United States,Russian,2015-08-21 20:12:00,2015-09-14 09:37:00,1363,304,1885,R,1
natashapavlovaa,Acer намерен запустить в производство планшет Predator 8  #hitech,United States,Russian,2015-08-23 22:11:00,2015-08-23 22:11:00,1363,305,1890,R,1
natashapavlovaa,[Перевод] Анализ защиты Sony PlayStation 4  #hitech,United States,Russian,2015-08-23 22:31:00,2015-08-23 22:31:00,1363,305,1891,R,1
natashapavlovaa,"«Яндекс» добавил более 1,5 млн новых снимков в карты  #hitech",United States,Russian,2015-08-24 12:51:00,2015-08-24 12:51:00,1363,305,1892,R,1
natashapavlovaa,Николай Азаров: В этот день пожелать украинскому народу можно только одного – проснуться  http://t.co/EBRxA57zlG http://t.co/ANXmV6IJ5D,United States,Russian,2015-08-24 13:12:00,2015-09-19 22:48:00,1363,305,1893,R,1
natashapavlovaa,В Латвии приостановлена продажа глобусов с изображением Крыма в составе России http://t.co/W7Hzy9XwFq,United States,Russian,2015-08-24 17:31:00,2015-09-20 10:09:00,1363,305,1894,R,1
natashapavlovaa,Верховный суд Гватемалы одобрил импичмент президенту http://t.co/qOr5GpD2vn,United States,Macedonian,2015-08-26 00:52:00,2015-08-26 00:52:00,1363,306,1899,R,1
natashapavlovaa,Патрушев потребовал применить меры к использующим WhatsApp чиновникам  http://t.co/cCirQ5Wt2U,United States,Russian,2015-08-26 09:52:00,2015-08-26 09:53:00,1142,306,1900,R,1
natashapavlovaa,[Из песочницы] Как я использую PostCSS  #hitech,United States,Russian,2015-08-26 10:31:00,2015-08-26 10:31:00,1084,306,1901,R,1
natashapavlovaa,В депо московского метро сошел с рельсов поезд  http://t.co/eTG7weL5is http://t.co/ulbedUbsVd,United States,Russian,2015-08-26 13:32:00,2015-08-26 13:32:00,819,306,1902,R,1
natashapavlovaa,Посольство США аннулировало визу сенатору Тотоонову http://t.co/YwYgpLR1Xt,United States,Russian,2015-08-26 14:12:00,2015-08-26 14:12:00,752,306,1904,R,1
natashapavlovaa,Мутко против КХЛ  http://t.co/ivY3WOQQhR http://t.co/6YfpN55Zxd,United States,Serbian,2015-08-27 17:13:00,2015-08-27 17:14:00,176,306,1909,R,1
natashapavlovaa,"США сделали Узбекистану предложение, от которого трудно отказаться  http://t.co/iuDdLR5xpk http://t.co/4pnrZhz64a",United States,Russian,2015-08-28 06:10:00,2015-08-28 06:10:00,176,306,1910,R,1
natashapavlovaa,Цена барреля нефти Brent превысила $48 http://t.co/L3fKij3vVA,United States,Bulgarian,2015-08-28 07:32:00,2015-09-24 01:04:00,176,306,1912,R,1
natashapavlovaa,"Еще один мальчикъ -аутистъ))) Сколько их было? Иных уж нет, а те далече... @sanndrio @l_kalashnikova http://t.co/NEyj513BRI",United States,Russian,2015-08-28 10:13:00,2015-09-24 02:42:00,176,306,1914,R,1
natashapavlovaa,ОАК передала заказчикам 159 самолетов в 2014 году  http://t.co/Ib3arnrHKq,United States,Russian,2015-08-29 08:53:00,2015-09-24 23:34:00,176,307,1920,R,1
natashapavlovaa,Ансальди близок к переходу в бывший клуб Кришито http://t.co/1DhJsCVYhV,United States,Ukrainian,2015-08-29 16:13:00,2015-08-29 16:13:00,176,307,1922,R,1
natashapavlovaa,'@SFGO76 Превед!',United States,Macedonian,2015-08-30 06:52:00,2015-09-25 21:45:00,176,307,1923,R,1
natashapavlovaa,В Подмосковье создан оперативный штаб для поиска внука главы района  http://t.co/34fr57HKN9,United States,Russian,2015-08-31 06:32:00,2015-08-31 06:32:00,176,307,1928,R,1
natashapavlovaa,Китайский рынок возобновил падение http://t.co/CTmkmNiM4T,United States,Russian,2015-08-31 08:12:00,2015-08-31 08:12:00,176,307,1929,R,1
natashapavlovaa,СМИ узнали о новых кадровых перестановках в космической отрасли http://t.co/cz7h6wVUxS,United States,Russian,2015-08-31 14:53:00,2015-08-31 14:53:00,176,307,1932,R,1
natashapavlovaa,"5-2! Нннааа бля,чпортаГ",United States,Macedonian,2015-08-31 19:12:00,2015-09-27 19:43:00,176,307,1933,R,1
natashapavlovaa,"Конституционная реформа по-украински: 120 раненых, один убитый http://t.co/1RrWck26HQ",United States,Ukrainian,2015-08-31 19:52:00,2015-09-27 20:28:00,176,307,1934,R,1
natashapavlovaa,ВИДЕО. Как выглядит Донецк после года обстрелов  http://t.co/VMnlsqXDUI http://t.co/CroxBAAnef,United States,Russian,2015-09-01 07:54:00,2015-09-01 07:54:00,176,307,1937,R,1
natashapavlovaa,В Петербурге на год осудили подбросившего наркотики полицейского http://t.co/6QSzkewC6r,United States,Russian,2015-09-01 14:51:00,2015-09-01 14:51:00,176,307,1938,R,1
natashapavlovaa,США взялись за рубль: почему началось расследование манипуляций с валютой http://t.co/NHqPBlGoxv,United States,Russian,2015-09-01 20:33:00,2015-09-01 20:33:00,176,306,1939,R,1
natashapavlovaa,Кого обвинили в убийстве Натальи Стрельченко  http://t.co/3DYQDwInD0 http://t.co/EWITl0gYv6,United States,Russian,2015-09-01 21:54:00,2015-09-01 21:54:00,176,306,1940,R,1
natashapavlovaa,"В Италии объяснили, откуда у Кобзона виза в обход санкций https://t.co/K5VhWMbIGh",United States,Russian,2015-09-02 06:31:00,2015-09-02 06:31:00,175,305,1941,R,1
natashapavlovaa,Майданят все!   Круговорот майдаунов в природе.   https://t.co/sBzYBnNFzC,United States,Russian,2015-09-02 08:12:00,2015-09-02 08:13:00,175,305,1943,R,1
natashapavlovaa,Стивен Спилберг предрекает падение зрительского интереса к фильмам о супергероях http://t.co/Kg1N8JmKFj,United States,Russian,2015-09-03 07:52:00,2015-09-30 03:57:00,175,305,1945,R,1
natashapavlovaa,Мультфильм о Серафиме напомнил патриарху Кириллу советское детство http://t.co/rvDb1e6ORI,United States,Russian,2015-09-03 15:53:00,2015-09-30 11:51:00,175,305,1948,R,1
natashapavlovaa,"Александр Новак: Россия до 2020 года увеличит экспорт нефти в страны АТР в 3,5 раза  http://t.co/C7B1nElPQm http://t.co/AfaRcP9gA6",United States,Russian,2015-09-04 05:31:00,2015-09-04 05:31:00,175,305,1950,R,1
natashapavlovaa,"Рой Джонс о Чечне: ""Многоженство?! Тогда я пакую чемоданы""  http://t.co/GhL8wJP7pL http://t.co/mpXsS2fF8x",United States,Russian,2015-09-04 08:52:00,2015-09-04 08:52:00,175,305,1951,R,1
natashapavlovaa,"В сирийском Кобани похоронили двух утонувших мальчиков, чья гибель всколыхнула весь мир http://t.co/DySLnN18YE",United States,Russian,2015-09-04 15:32:00,2015-09-04 15:33:00,175,305,1954,R,1
natashapavlovaa,При обстреле погиб мирный житель Донецка http://t.co/3UT21T2GRU,United States,Russian,2015-09-05 07:34:00,2015-09-05 07:34:00,175,305,1959,R,1
