author_id,content,region,language,publish_date,harvested_date,following,followers,updates,post_type,retweet
natashapavlovaa,Путин пообещал покарать организаторов крушения A321 https://t.co/PUlqWS8QZj,United States,Russian,2015-11-17 09:15:00,2015-11-17 09:15:00,172,308,2359,R,1
natashapavlovaa,"Россия найдет террористов в любой точке планеты и покарает, заявил Владимир Путин https://t.co/W0bkw4Ckuq",United States,Russian,2015-11-17 09:16:00,2015-11-17 09:16:00,172,308,2360,R,1
natashapavlovaa,Владимир #Путин ввел в действие новый #план обороны страны до 2020 года.  https://t.co/Nx8dgObczJ https://t.co/015CxS62jA,United States,Russian,2015-11-17 10:17:00,2015-11-17 10:17:00,172,308,2361,R,1
natashapavlovaa,Miramax films могут продать Al Jazeera  https://t.co/ZtLJQsVKxJ https://t.co/TbggKKhrsJ,United States,Russian,2015-11-17 12:43:00,2015-11-17 12:44:00,172,308,2363,R,1
natashapavlovaa,"Голливудский актер Чарли Шин заявил, что является ВИЧ-инфицированным https://t.co/gmLXTQ3pjy © СBS https://t.co/bmv6umSdtu",United States,Russian,2015-11-17 14:13:00,2015-11-17 14:13:00,172,308,2366,R,1
natashapavlovaa,Нападение на английского лорда – самый серьёзный признак демократичности украинских выборов https://t.co/oi1WpigqZI,United States,Russian,2015-11-17 20:52:00,2015-11-17 20:52:00,172,310,2367,R,1
natashapavlovaa,Концерт Limp Bizkit в Новосибирске не состоится https://t.co/esORkCiPfB https://t.co/wzNP9q0UWE,United States,Russian,2015-11-17 22:16:00,2015-11-17 22:16:00,172,310,2368,R,1
natashapavlovaa,"Обама отменил санкции против лиц, близких к бывшему президенту Либерии Тейлору, в т.ч. против Виктора Бута, отбывающего тюремный срок в США.",United States,Russian,2015-11-18 08:32:00,2015-11-18 08:33:00,172,310,2371,R,1
natashapavlovaa,Президент США: Россия конструктивный партнёр https://t.co/1GJlgBXekf https://t.co/6tajakbvLh,United States,Russian,2015-11-18 10:34:00,2015-11-18 10:35:00,172,310,2373,R,1
natashapavlovaa,Independent: дети иммигрантов во Франции и Бельгии испытывают отчуждение https://t.co/dwHw1AAv5U,United States,Russian,2015-11-18 10:34:00,2015-11-18 10:35:00,172,310,2372,R,1
natashapavlovaa,Полицейская операция в Сен-Дени завершена https://t.co/K8aHzEG5du,United States,Russian,2015-11-18 11:14:00,2015-11-18 11:14:00,172,310,2375,R,1
natashapavlovaa,Китай поддерживает антитеррористические меры России https://t.co/HHfidErPAD https://t.co/XmM7jWYWUG,United States,Russian,2015-11-18 11:19:00,2015-11-18 11:19:00,172,310,2376,R,1
natashapavlovaa,"плох тот голландский солдат, который не мечтает стать натуралом",United States,Russian,2015-11-18 13:20:00,2015-11-18 13:20:00,172,310,2379,R,1
natashapavlovaa,"СМИ: взрыв прогремел на рынке в Нигерии, есть жертвы и раненые https://t.co/unWY0UKcPq https://t.co/M9gzxvKDai",United States,Russian,2015-11-18 17:31:00,2015-11-18 17:31:00,172,310,2380,R,1
natashapavlovaa,Разрушаем самые частые заблуждения о пенсионной системе в новом спецпроекте  https://t.co/yh1Zx3NIp8 https://t.co/41tOb9WMQC,United States,Russian,2015-11-18 18:00:00,2015-11-18 18:00:00,172,310,2381,R,1
natashapavlovaa,"Россияне составили 40% посетителей сайта французского издания #CharlieHebdo,вот так они заработали деньги на горе! https://t.co/OK7NrtP4lH",United States,Russian,2015-11-18 20:31:00,2015-11-18 20:31:00,172,310,2382,R,1
natashapavlovaa,Эксперт: точка невозврата по вопросу о долге Украины перед РФ близка https://t.co/z9hqNkuTaQ https://t.co/Ra2xav63Z5,United States,Ukrainian,2015-11-19 06:35:00,2015-11-19 06:35:00,172,310,2386,R,1
natashapavlovaa,"СМИ: бомбу в самолете, летевшем из Варшавы в Хургаду, не обнаружили https://t.co/kSMSXdJ5TE © Flickr https://t.co/9mRHuNc6pH",United States,Ukrainian,2015-11-19 09:53:00,2015-11-19 09:54:00,172,311,2387,R,1
natashapavlovaa,В московском метро задержаны двое мужчин со следами тротила на руках Инциденты произошли на станциях «Теплый …  https://t.co/394kp9dYe0,United States,Russian,2015-11-19 10:15:00,2015-11-19 10:15:00,172,311,2389,R,1
natashapavlovaa,Завтра в ЛНР стартует благотворительная акция «Спешите делать добро» https://t.co/EKh1K42z0X,United States,Russian,2015-11-19 11:34:00,2015-11-19 11:34:00,172,311,2391,R,1
natashapavlovaa,МИД РФ: время для налаживания диалога по урегулированию в Сирии уходит https://t.co/1lfkg8R6mT https://t.co/8ygsEhoWyH,United States,Russian,2015-11-19 15:18:00,2015-11-19 15:18:00,172,311,2394,R,1
natashapavlovaa,Созин: Ари и Фернандес усилят сборную России https://t.co/uQCReteMtg,United States,Russian,2015-11-19 17:13:00,2015-11-19 17:13:00,172,311,2396,R,1
natashapavlovaa,"Константин Эрнст - о фильме ""Викинг"": «Любая ""Игра престолов"" отдыхает» https://t.co/ykTzL3sg0C https://t.co/JsXH7ehPzW",United States,Russian,2015-11-19 18:52:00,2015-11-19 18:52:00,172,311,2399,R,1
natashapavlovaa,Российские легкоатлеты пропустят чемпионат мира в залах   https://t.co/ITrQTWdGIY,United States,Russian,2015-11-19 19:03:00,2015-11-19 19:13:00,172,311,2400,R,1
natashapavlovaa,В Швеции задержали подозреваемого в подготовке теракта https://t.co/oyTTjUCdDR,United States,Ukrainian,2015-11-20 02:22:00,2015-11-20 02:22:00,172,311,2402,R,1
natashapavlovaa,Отдельные тюрьмы предлагают создавать для террористов  https://t.co/SKPgtZF9lR https://t.co/3OGKmOtkDY,United States,Russian,2015-11-20 09:23:00,2015-11-20 09:23:00,172,310,2405,R,1
natashapavlovaa,Не менее 20 заложников освобождены в ходе штурма отеля в Мали https://t.co/vUYaJJTZZv © AP Photo https://t.co/MfoqdKosGV,United States,Russian,2015-11-20 11:54:00,2015-11-20 11:54:00,172,310,2406,R,1
natashapavlovaa,"На Ставрополье поймали угонщика 28 машин, объявленного в розыск 8 лет назад https://t.co/OBwh2HKMeJ",United States,Macedonian,2015-11-20 13:16:00,2015-11-20 13:16:00,172,310,2409,R,1
natashapavlovaa,В Думе считают протесты дальнобойщиков подготовкой «боевиков Навального» к «майдану»@navalny https://t.co/h8BPshE8Gv https://t.co/s5leFPrdh1,United States,Russian,2015-11-20 16:37:00,2015-11-20 16:37:00,172,310,2412,R,1
natashapavlovaa,Россия и МВФ еще месяц могут торговаться по долгу Украины https://t.co/cjg9PfIj65 https://t.co/0KvgxH3uq0,United States,Russian,2015-11-20 18:02:00,2015-11-20 18:02:00,172,310,2414,R,1
natashapavlovaa,"Семья сирийцев, находящихся в транзитной зоне Шереметьева, направлена в центр ФМС в Твери https://t.co/1JCkFT6nVM",United States,Russian,2015-11-20 18:16:00,2015-11-20 18:16:00,172,310,2415,R,1
natashapavlovaa,Россия не понесла потерь в Сирии  https://t.co/zFfACGRrBK https://t.co/qIelnKEhsg,United States,Russian,2015-11-20 18:35:00,2015-11-20 18:35:00,172,310,2416,R,1
natashapavlovaa,Президент Мали: жертвами драмы с заложниками в Бамако стали 19 человек https://t.co/H3RbD0g63q © AP Photo https://t.co/PMyP6OvM88,United States,Russian,2015-11-21 00:32:00,2015-11-21 00:32:00,172,310,2417,R,1
natashapavlovaa,Прокуратура отвергла версию самоподрыва погибшей в Сан-Дени женщины https://t.co/N6vgLt1gBX,United States,Russian,2015-11-21 01:12:00,2015-11-21 01:13:00,172,310,2418,R,1
natashapavlovaa,Страны Балтии об участии в антитеррористической коалиции с Россией  https://t.co/XyTfhhxghj https://t.co/JxsZ9X1JAY,United States,Russian,2015-11-21 07:15:00,2015-11-21 07:15:00,172,310,2420,R,1
natashapavlovaa,«Почта Донбасса» запустила благотворительный детский проект «Письмо Деду Морозу» (ВИДЕО) https://t.co/larwYZrOHp,United States,Russian,2015-11-21 09:14:00,2015-11-21 09:14:00,172,310,2421,R,1
natashapavlovaa,Анатолий Шарий: Профессиональные эксперты украинских СМИ (ВИДЕО) https://t.co/0zx2tG6exg,United States,Russian,2015-11-21 09:22:00,2015-11-21 09:22:00,172,310,2422,R,1
natashapavlovaa,Захарова предложила Лондону консультироваться с Россией по резолюции по Сирии https://t.co/ocMi3EGDaW,United States,Russian,2015-11-21 10:54:00,2015-11-21 10:54:00,172,309,2423,R,1
natashapavlovaa,Кудрин призвал преодолеть барьер между властью и обществом https://t.co/TpSgEPW6k1,United States,Russian,2015-11-21 10:55:00,2015-11-21 10:55:00,172,309,2424,R,1
natashapavlovaa,армия сделала из меня взрослого. я полюбил тушёную капусту,United States,Russian,2015-11-21 15:22:00,2015-11-21 15:22:00,172,309,2425,R,1
natashapavlovaa,Стали известны имена убитых в Мали россиян.   https://t.co/2eQQrXy14c https://t.co/ZtDPExbzsw,United States,Russian,2015-11-21 15:54:00,2015-11-21 15:54:00,172,310,2426,R,1
natashapavlovaa,В Крыму остаются без света почти два миллиона потребителей https://t.co/cQwFDfws23 https://t.co/W7CuobP9R7,United States,Russian,2015-11-22 06:11:00,2015-11-22 06:11:00,172,310,2431,R,1
natashapavlovaa,ЧП с российским самолетом в Киргизии  https://t.co/3Yz6t1puQ5 https://t.co/471AYT2Fhq,United States,Russian,2015-11-22 06:14:00,2015-11-22 06:14:00,172,310,2432,R,1
natashapavlovaa,"«В сборной должны играть русские ребята, которые будут убиваться за страну»  https://t.co/dnS6dspwdE https://t.co/PXEub8JrVH",United States,Russian,2015-11-22 06:54:00,2015-11-22 06:54:00,172,310,2433,R,1
natashapavlovaa,СМИ: самолет Turkish Airlines экстренно сел в Канаде из-за угрозы взрыва бомбы https://t.co/EOYa9r6mUP,United States,Ukrainian,2015-11-22 08:58:00,2015-11-22 08:58:00,172,310,2434,R,1
natashapavlovaa,В Израиле водитель задавил вооруженную ножом палестинку.   https://t.co/npFmLYGHYO https://t.co/qDqkPj3vcy,United States,Russian,2015-11-22 11:32:00,2015-11-22 11:32:00,172,310,2435,R,1
natashapavlovaa,Эуропа одобряе. СУГС! https://t.co/9dIuJR4L7A,United States,Bulgarian,2015-11-22 11:44:00,2015-11-22 11:44:00,172,310,2436,R,1
natashapavlovaa,Минобороны ДНР: ВСУ за сутки выпустили по территории ДНР более 40 мин https://t.co/GXltj8HoL1 https://t.co/bsLG7i8Gkf,United States,Russian,2015-11-22 11:51:00,2015-11-22 11:51:00,172,310,2437,R,1
natashapavlovaa,Видео. «Депортиво» — «Сельта» https://t.co/7QBN7rqfWl,United States,Ukrainian,2015-11-22 12:38:00,2015-11-22 12:38:00,172,310,2438,R,1
natashapavlovaa,"Авианосец ""Шарль де Голль"" наладил связь с кораблями ВМФ России https://t.co/iyB506YGxF",United States,Russian,2015-11-22 14:03:00,2015-11-22 14:03:00,172,310,2440,R,1
natashapavlovaa,Что крутят на бедрах доминиканские девственницы  https://t.co/mMXbiwg1Vg https://t.co/uSB9LeSFXt,United States,Russian,2015-11-22 15:02:00,2015-11-22 15:02:00,172,310,2442,R,1
natashapavlovaa,Выжившие при нападении на отель в Мали россияне прилетели в Ульяновск https://t.co/M7c11R7wg6 https://t.co/sYI0oRkCl6,United States,Russian,2015-11-22 15:51:00,2015-11-22 15:51:00,172,310,2443,R,1
natashapavlovaa,Ликвидированные в Нальчике боевики отправляли местных жителей в Сирию https://t.co/7Ga3EUS0ET https://t.co/36dTwjDn4S,United States,Russian,2015-11-22 15:52:00,2015-11-22 15:52:00,172,310,2444,R,1
natashapavlovaa,Рыбаки на Обском море провалились под лед вместе с внедорожником https://t.co/E07cbVpVnu,United States,Russian,2015-11-23 04:34:00,2015-11-23 04:34:00,172,310,2446,R,1
natashapavlovaa,МВД Казахстана опровергло данные о возможных терактах в стране https://t.co/N1K7gic3w4 https://t.co/PNR4mWjiHw,United States,Russian,2015-11-23 06:37:00,2015-11-23 06:37:00,172,310,2447,R,1
natashapavlovaa,Рядом с Шотландией начали искать российскую подлодку https://t.co/mE5ZX1J6Cy,United States,Russian,2015-11-23 07:16:00,2015-11-23 07:16:00,172,310,2448,R,1
natashapavlovaa,Названы самые «трезвые» регионы России https://t.co/jk7Rvzzvu0 https://t.co/yoTJZFiDEO,United States,Russian,2015-11-23 10:57:00,2015-11-23 10:57:00,172,310,2450,R,1
natashapavlovaa,В чемодане одного из пассажиров в аэропорту Киева нашли гранату https://t.co/1cgOHOLsNQ https://t.co/390rFmDDnR,United States,Ukrainian,2015-11-23 11:00:00,2015-11-23 11:01:00,172,310,2451,R,1
natashapavlovaa,Новак пообещал восстановить электроснабжение Крыма за несколько часов https://t.co/TYaWE94CMY,United States,Russian,2015-11-23 11:19:00,2015-11-23 11:20:00,172,310,2453,R,1
natashapavlovaa,Путин рассказал об использовании неба над Каспием для борьбы с ИГ https://t.co/BGF6b3CAdu https://t.co/1PdgErVAyX,United States,Russian,2015-11-23 15:52:00,2015-11-23 15:52:00,173,311,2457,R,1
natashapavlovaa,Путин: действия РФ в Сирии идут по согласованию с руководством страны https://t.co/nyXXS4DMv6 https://t.co/A8c1qT7ilm,United States,Russian,2015-11-23 21:54:00,2015-11-23 21:54:00,173,311,2458,R,1
natashapavlovaa,Россия готова поставлять в Камбоджу энергетическое оборудование  https://t.co/nas9E7PGZc https://t.co/4mWspFpueS,United States,Russian,2015-11-24 04:51:00,2015-11-24 04:52:00,173,311,2460,R,1
natashapavlovaa,Рынок акций и рубль сдержанно реагируют на крушение Су-24 в Сирии https://t.co/zQ8UDN8TfQ https://t.co/bmDBsbH3rA,United States,Russian,2015-11-24 10:22:00,2015-11-24 10:22:00,173,312,2466,R,1
natashapavlovaa,"RT публикует фото снаряда, попавшего в машину с журналистами  https://t.co/7KRDOW2twP https://t.co/FBVYbPCT2j",United States,Russian,2015-11-24 12:15:00,2015-11-24 12:19:00,173,312,2467,R,1
natashapavlovaa,Президент Турции утвердил новый состав правительства https://t.co/14Dl2zSHOS,United States,Russian,2015-11-24 14:14:00,2015-11-24 14:14:00,173,312,2469,R,1
natashapavlovaa,В Минобороны назвали действия Турции недружественным актом #новости https://t.co/qv3tf7FIh9,United States,Russian,2015-11-24 16:58:00,2015-11-24 16:58:00,173,312,2470,R,1
natashapavlovaa,Ростуризм: Туристы из РФ имеют право отказаться от туров в Турцию  https://t.co/MP69Ez81yV https://t.co/ilHeP3RNfU,United States,Russian,2015-11-24 17:53:00,2015-11-24 17:59:00,173,313,2471,R,1
natashapavlovaa,"Nation: Журналисты так нападают на Россию, что их слова потеряли смысл   https://t.co/tsmBc2VzGE https://t.co/LfqSA8WpMT",United States,Russian,2015-11-24 17:57:00,2015-11-24 17:57:00,173,313,2472,R,1
natashapavlovaa,Вице-канцлер ФРГ считает действия Турции непредсказуемыми https://t.co/2US3oX4dbx,United States,Russian,2015-11-24 19:35:00,2015-11-24 19:35:00,173,314,2473,R,1
natashapavlovaa,Клинцевич: решение ВВС Турции сбить Су-24 не было спонтанным https://t.co/nulwkYAa66 #СУ24 #Турция #УдарВСпину https://t.co/29zjXU7l3v,United States,Russian,2015-11-24 22:51:00,2015-11-24 22:51:00,173,315,2474,R,1
natashapavlovaa,Следующие в США посылки со взрывчаткой обнаружены в аэропорту Каира  https://t.co/xW1etuLyAl https://t.co/jMVFGUKk4k,United States,Russian,2015-11-25 01:11:00,2015-11-25 01:11:00,173,315,2476,R,1
natashapavlovaa,"""Россия готова к созданию единого командного центра для ударов по ИГИЛ""  https://t.co/uJz65BIELx https://t.co/jxaLhqQFlE",United States,Russian,2015-11-25 08:35:00,2015-11-25 08:35:00,173,315,2479,R,1
natashapavlovaa,"Хакеры ""отправили"" Кипелова воевать против ИГ https://t.co/2dyQEcitWo",United States,Russian,2015-11-25 09:19:00,2015-11-25 09:19:00,173,315,2481,R,1
natashapavlovaa,"Крым, вернись на Украину  https://t.co/ks2jb2tMdM",United States,Ukrainian,2015-11-25 09:21:00,2015-11-25 09:21:00,173,315,2482,R,1
natashapavlovaa,Гильерме показал свой российский паспорт https://t.co/eM82KRENVt,United States,Russian,2015-11-25 13:34:00,2015-11-25 13:34:00,173,315,2486,R,1
natashapavlovaa,Украины уведомила Россию о запрете транзита для самолетов РФ https://t.co/oq1DkXtIdG https://t.co/8UbUhMUPBY,United States,Ukrainian,2015-11-25 15:53:00,2015-11-25 15:55:00,173,315,2488,R,1
natashapavlovaa,Власти ЛНР разрешили ООН доставить гуманитарный груз в Луганск https://t.co/l77t6MG24s,United States,Russian,2015-11-25 19:33:00,2015-11-25 19:33:00,173,314,2489,R,1
natashapavlovaa,Источник: сирийские спецназовцы были ранены при спасении летчика Су-24  https://t.co/xi0QZRFXh4 https://t.co/iXcNqZY18t,United States,Russian,2015-11-25 23:33:00,2015-11-25 23:33:00,173,313,2491,R,1
natashapavlovaa,Блаттер сравнил комитет по этике ФИФА с инквизицией https://t.co/3ckMXRf2fe © AP Photo https://t.co/pwwz6GemAg,United States,Serbian,2015-11-26 08:53:00,2015-11-26 08:53:00,173,313,2492,R,1
natashapavlovaa,"Глава ЛНР знает, на кого обменяют Савченко  https://t.co/6g6SUwewLD https://t.co/Oy6udZfSRu",United States,Ukrainian,2015-11-26 09:34:00,2015-11-26 09:34:00,173,313,2493,R,1
natashapavlovaa,Министр Турции: ЕС открывает для Анкары новый пункт переговоров о вступлении https://t.co/pF8jcnMKew https://t.co/jFLmejJXg0,United States,Russian,2015-11-26 10:15:00,2015-11-26 10:16:00,173,313,2494,R,1
natashapavlovaa,Премьер Италии выступает за расширение коалиции против ИГ https://t.co/GXJ32QziBR https://t.co/cQRjiVqoWD,United States,Russian,2015-11-26 10:36:00,2015-11-26 10:36:00,173,313,2495,R,1
natashapavlovaa,"Орлов: болельщики «Спартака» пишут на баннерах: «Дзюбиньо, прости нас» https://t.co/kLTRcBer2X",United States,Russian,2015-11-26 12:36:00,2015-11-26 12:36:00,173,313,2497,R,1
natashapavlovaa,Он охуел! (простите за мой французский)   Эрдоган: Россия должна извиниться перед Турцией за инцидент с Су-24М,United States,Ukrainian,2015-11-26 17:36:00,2015-11-26 17:36:00,173,313,2500,R,1
natashapavlovaa,Робертс: атака на российский самолет Су-24 была спланирована https://t.co/KF0v7XA0Ez #СУ24 #StandwithRussia https://t.co/ibLZhwzwTY,United States,Russian,2015-11-26 17:52:00,2015-11-26 17:52:00,173,313,2501,R,1
natashapavlovaa,Олланд: Франция готова работать с Россией в борьбе с терроризмом https://t.co/zCSss5hDWJ https://t.co/Rlc9hj9WrP,United States,Russian,2015-11-26 20:53:00,2015-11-26 20:53:00,173,312,2502,R,1
natashapavlovaa,Defense News: Польша пока не будет покупать у США ракеты против России  https://t.co/EHz5gdIqZD https://t.co/bdK2O9PO23,United States,Russian,2015-11-26 21:31:00,2015-11-26 21:31:00,173,312,2505,R,1
natashapavlovaa,СМИ: парижские террористы купили оружие в Германии  https://t.co/rutygYO8PV https://t.co/bbJ0NdinHV,United States,Russian,2015-11-27 02:16:00,2015-11-27 02:16:00,173,312,2506,R,1
natashapavlovaa,В российском посольстве в США усилили меры безопасности https://t.co/NE4HWnW7VR,United States,Russian,2015-11-27 02:17:00,2015-11-27 02:17:00,173,312,2507,R,1
natashapavlovaa,МЧС развернуло городки жизнеобеспечения в 4 населенных пунктах Крыма https://t.co/lmpQReXstK https://t.co/E14jemu0I8,United States,Russian,2015-11-27 11:23:00,2015-11-27 11:23:00,173,311,2509,R,1
natashapavlovaa,Пресс-служба: западные СМИ исказили слова Нарышкина о военном ответе https://t.co/csa8yHOaoH https://t.co/9ilAhnFDdV,United States,Russian,2015-11-27 16:11:00,2015-11-27 16:14:00,173,311,2510,R,1
natashapavlovaa,Каналес принёс победу «Крыльям Советов» над «Амкаром» в молодёжном первенстве https://t.co/0Hh88zlKL5,United States,Russian,2015-11-27 16:37:00,2015-11-27 16:38:00,173,312,2511,R,1
natashapavlovaa,Путин: созданием единой системы госзакупок должно заняться МЭР https://t.co/n7KQGZvyAr https://t.co/9uDpkh7aCU,United States,Russian,2015-11-27 17:21:00,2015-11-27 17:22:00,173,312,2512,R,1
natashapavlovaa,Депутат: визовый режим станет хорошим уроком для турецкой элиты https://t.co/kPSqWeFxTf https://t.co/8mWH8bfOUL,United States,Ukrainian,2015-11-27 17:32:00,2015-11-27 17:32:00,173,312,2513,R,1
natashapavlovaa,Сергей Рябков обсудил с замглавы МИД Сирии вопросы химической демилитаризации  https://t.co/CePA6ED9Pz,United States,Russian,2015-11-27 17:35:00,2015-11-27 17:36:00,173,312,2514,R,1
natashapavlovaa,Концерт ансамбля Александрова в Эстонии отменен   https://t.co/6FPqNxXd3a,United States,Russian,2015-11-27 17:36:00,2015-11-27 17:36:00,173,312,2515,R,1
natashapavlovaa,Сербия начнет переговоры о вступлении в ЕС в декабре https://t.co/AgXrSWTeKh,United States,Macedonian,2015-11-27 20:21:00,2015-11-27 20:21:00,173,312,2516,R,1
natashapavlovaa,Канада выделит почти $2 млрд на программы по борьбе с изменением климата  https://t.co/Y5VseSY605,United States,Russian,2015-11-27 23:22:00,2015-11-27 23:23:00,173,312,2517,R,1
natashapavlovaa,Ъ: помощник депутата Государственной думы арестован в Москве  https://t.co/OqW8eNxSDq https://t.co/3QVmFtLdON,United States,Russian,2015-11-28 00:53:00,2015-11-28 00:53:00,173,312,2518,R,1
natashapavlovaa,СМИ: Проникший на территорию Белого дома американец оставил предсмертную записку  https://t.co/ZZLBmamVGb https://t.co/VU7heTb1og,United States,Russian,2015-11-28 01:52:00,2015-11-28 01:56:00,173,312,2519,R,1
natashapavlovaa,"Землетрясение магнитудой 5,7 произошло в районе южных Курил  https://t.co/WgV8HapLZk https://t.co/cvQ4XkeaPC",United States,Russian,2015-11-28 05:34:00,2015-11-28 05:34:00,173,312,2521,R,1
natashapavlovaa,"Твоё лицо, когда хочешь убивать русню... https://t.co/3XNNpwNrSa",United States,Russian,2015-11-28 06:52:00,2015-11-28 06:52:00,173,312,2522,R,1
natashapavlovaa,Власти Крыма закроют санатории для отдыхающих из других регионов https://t.co/3QD3hTKB54,United States,Russian,2015-11-28 10:52:00,2015-11-28 10:54:00,173,312,2523,R,1
