author_id,content,region,language,publish_date,harvested_date,following,followers,updates,post_type,retweet
natashapavlovaa,"Минтранс: судьба ""Трансаэро"" в руках кредиторов https://t.co/r11cgXTmxX",United States,Russian,2015-10-21 11:16:00,2015-10-21 11:16:00,173,301,2137,R,1
natashapavlovaa,"Перевертайло: в «Уфе» налицо потенциал, который можно развивать https://t.co/Kp4xACOZC3",United States,Russian,2015-10-21 16:15:00,2015-10-21 16:15:00,173,301,2138,R,1
natashapavlovaa,Георгадзе пытался убить главу Красногорского района и секретаршу его заместителя  https://t.co/Gl7uzWXKmB,United States,Russian,2015-10-21 17:12:00,2015-10-21 17:12:00,173,301,2141,R,1
natashapavlovaa,Путину могут показать новую «Ладу» на сессии Валдайского клуба в Сочи https://t.co/yrojK1Vb2L https://t.co/8mqjEyFsGd,United States,Russian,2015-10-21 18:52:00,2015-10-21 18:52:00,173,301,2142,R,1
natashapavlovaa,YouTube раскрыл детали платной подписки https://t.co/UZ4JtOqEYH © Flickr/ Rego https://t.co/0tCqtpeSYp,United States,Russian,2015-10-21 22:12:00,2015-10-21 22:12:00,173,301,2143,R,1
natashapavlovaa,Кабмин утвердил критерии отбора резидентов свободного порта Владивосток  https://t.co/PG8dJ28oQU,United States,Macedonian,2015-10-22 05:34:00,2015-10-22 05:34:00,173,301,2146,R,1
natashapavlovaa,Киевское «Динамо» оказалось под угрозой исключения из Лиги чемпионов: https://t.co/YpRUcXOEXY,United States,Russian,2015-10-22 08:12:00,2015-10-22 08:12:00,173,301,2148,R,1
natashapavlovaa,Иски о банкротстве «Трансаэро» от Сбербанка и Альфа-банка разделила минута  https://t.co/sUAffQRdwD https://t.co/YFrOen5q20,United States,Macedonian,2015-10-22 09:13:00,2015-10-22 09:13:00,173,301,2151,R,1
natashapavlovaa,"Террористы в Сирии мобилизуют подростков и создают заградотряды, заявили в Генштабе РФ https://t.co/yeYKwhLafA",United States,Russian,2015-10-22 17:32:00,2015-10-22 17:32:00,173,301,2155,R,1
natashapavlovaa,Ровно 300 лет назад родился царь Петр II https://t.co/EJinwFtH1S https://t.co/PfMCHnaNRU,United States,Russian,2015-10-23 06:51:00,2015-10-23 06:51:00,173,301,2158,R,1
natashapavlovaa,Александр Новак: РФ и Иран готовы инвестировать в совместные проекты $35-40 млрд  https://t.co/crN3BaiMjP https://t.co/JZYFmyNJgv,United States,Russian,2015-10-23 09:33:00,2015-10-23 09:40:00,173,301,2160,R,1
natashapavlovaa,"Сергей Лавров назвал страны, которые нужно подключить к решению кризиса в САР  https://t.co/bFKFpNpxg1",United States,Russian,2015-10-23 15:54:00,2015-10-23 15:56:00,173,302,2163,R,1
natashapavlovaa,"Испанские военные, находившиеся на борту разбившегося над Атлантикой вертолёта, пропали без вести https://t.co/YL7kkCVLOM",United States,Russian,2015-10-23 22:53:00,2015-10-23 23:00:00,173,302,2167,R,1
natashapavlovaa,"Владимир Кличко всерьез настроен выступить на Олимпиаде, но решение за АИБА  https://t.co/AkZYzJqtXL",United States,Russian,2015-10-24 08:52:00,2015-10-24 08:52:00,173,302,2169,R,1
natashapavlovaa,«Зенит» разгромил дома «Анжи» - 5:1 https://t.co/z9DYA9d5iH,United States,Russian,2015-10-24 17:12:00,2015-10-24 17:12:00,173,302,2171,R,1
natashapavlovaa,По заявкам слушателей. Чёрнай воран. https://t.co/Mv1KGa29jb  @somsok5412,United States,Russian,2015-10-25 02:51:00,2015-10-25 02:51:00,173,302,2173,R,1
natashapavlovaa,На востоке Индии 10 человек погибли в результате падения автобуса в ущелье https://t.co/XGrYtHcV8y,United States,Russian,2015-10-25 07:12:00,2015-10-25 07:12:00,173,302,2174,R,1
natashapavlovaa,Жыды подвели меня. Я на них возлагал бóльшие надежды,United States,Russian,2015-10-25 11:51:00,2015-10-25 11:52:00,173,302,2175,R,1
natashapavlovaa,Шервуд уволен с поста главного тренера «Астон Виллы» https://t.co/10GaPn6Nly,United States,Russian,2015-10-25 13:34:00,2015-10-25 13:34:00,173,302,2176,R,1
natashapavlovaa,"Погребняк назвал условия, при которых будет забивать мячи  https://t.co/wERidDaQOC https://t.co/jWzeEUi75a",United States,Russian,2015-10-25 19:52:00,2015-10-25 19:52:00,173,302,2182,R,1
natashapavlovaa,Порошенко надеется на честный подсчет голосов на выборах мэров https://t.co/i0GXqFNwq8,United States,Russian,2015-10-25 22:11:00,2015-10-25 22:11:00,173,302,2183,R,1
natashapavlovaa,Корреспондент RT @A_Knishenko_RT об успехах сирийской армии и ВКС РФ в борьбе с ИГ https://t.co/RpPOm9ndRi https://t.co/1aPvcYPGwQ,United States,Russian,2015-10-26 17:14:00,2015-10-26 17:21:00,173,302,2186,R,1
natashapavlovaa,"Под Киевом потушены 3 очага горения торфа, еще осталось 10 https://t.co/274U4OF9dT",United States,Russian,2015-10-27 09:13:00,2015-10-27 09:13:00,173,302,2191,R,1
natashapavlovaa,Сергей Лавров: РФ будет делать всё для подавления терроризма  https://t.co/NTQculiauw https://t.co/6yj8WKQaD1,United States,Russian,2015-10-27 11:35:00,2015-10-27 11:41:00,173,302,2193,R,1
natashapavlovaa,Обама задумался над новыми реформами  https://t.co/c4IKRHp4dv https://t.co/sXMdI6xCSk,United States,Russian,2015-10-27 12:37:00,2015-10-27 12:37:00,173,302,2195,R,1
natashapavlovaa,ВИДЕО. Медведь напугал жителей Нью-Джерси  https://t.co/qpTISacm49 https://t.co/0i7xfAeMHr,United States,Russian,2015-10-27 12:54:00,2015-10-27 12:54:00,173,302,2196,R,1
natashapavlovaa,«Зенит» оштрафован на 100 тыс. рублей за поджог болельщиками атрибутики «Анжи» https://t.co/1TiD2LwXev,United States,Russian,2015-10-28 15:33:00,2015-10-28 15:33:00,173,302,2199,R,1
natashapavlovaa,Песков: Россия и США не обсуждают координацию по возможной военной операции в Сирии https://t.co/fFrsLCGBvN,United States,Russian,2015-10-28 19:12:00,2015-10-28 19:12:00,173,303,2202,R,1
natashapavlovaa,На сайте Верховной рады заработал сервис подачи электронных петиций  https://t.co/zyhEZiCpKV,United States,Russian,2015-10-28 23:53:00,2015-10-28 23:53:00,173,303,2203,R,1
natashapavlovaa,RuTracker предложил пользователям самим решить судьбу сайта https://t.co/AfB7SJaaAF,United States,Russian,2015-10-29 13:53:00,2015-10-29 13:54:00,173,303,2206,R,1
natashapavlovaa,Подсудимых по делу об аварии в #метро могут посадить на 5-6 лет   https://t.co/81enpL6jJr #авария #прокурор #срок https://t.co/MphdO1Bo2U,United States,Russian,2015-10-29 13:53:00,2015-10-29 13:53:00,173,303,2204,R,1
natashapavlovaa,При возгорании Boeing во Флориде пострадали 15 человек https://t.co/GHBeP4rJRL,United States,Russian,2015-10-29 20:51:00,2015-10-29 20:51:00,173,303,2207,R,1
natashapavlovaa,В Хабаровском крае под завалами дома нашли одного погибшего https://t.co/1BwIpSnuol,United States,Russian,2015-10-29 20:54:00,2015-10-29 20:54:00,173,303,2208,R,1
natashapavlovaa,Причиной взрыва дома в Хабаровском крае могло стать взрывное устройство #новости https://t.co/2fecxaiujT,United States,Russian,2015-10-30 03:54:00,2015-10-30 03:54:00,173,303,2209,R,1
natashapavlovaa,ГСЧС Украины: Взрывы на складе боеприпасов в Сватово прекратились https://t.co/h4g7S50sZD,United States,Ukrainian,2015-10-30 06:55:00,2015-10-30 06:56:00,173,303,2212,R,1
natashapavlovaa,В Санкт-Петербурге покажут постановку «18+» https://t.co/MRJ6boveHY https://t.co/3oXUFfgtDI,United States,Macedonian,2015-10-30 12:33:00,2015-10-30 12:34:00,173,303,2214,R,1
natashapavlovaa,СМИ: На месте крушения лайнера найдены тела пяти погибших детей https://t.co/IeN74nM271,United States,Russian,2015-10-31 10:54:00,2015-10-31 10:56:00,173,303,2216,R,1
natashapavlovaa,Власти Египта рассказали о попытках пилота разбившегося A321 совершить экстренную посадку https://t.co/G6b2VbVaaR #7K9268,United States,Russian,2015-10-31 13:13:00,2015-10-31 13:13:00,173,303,2218,R,1
natashapavlovaa,СК РФ возбудил еще одно дело после крушения самолета А321 в Египте  https://t.co/lcI4yxMZQn #7K9268 https://t.co/CkYqRjrJXc,United States,Russian,2015-10-31 15:10:00,2015-10-31 15:11:00,173,303,2220,R,1
natashapavlovaa,"повезло тем, кого призвали в сентябре-октябре: на Хэллоуин будут духами",United States,Russian,2015-10-31 19:33:00,2015-10-31 19:38:00,173,302,2221,R,1
natashapavlovaa,"NI назвал три типа китайских вооружений, которых должны бояться США https://t.co/KTRYTNLrig © AP Photo https://t.co/QSq7Nq8cDJ",United States,Russian,2015-11-01 14:53:00,2015-11-01 14:53:00,173,302,2224,R,1
natashapavlovaa,«Анжи» — «Рубин»: первый гол Девича в ворота «Анжи» https://t.co/ci7WxZYvUv,United States,Russian,2015-11-01 14:55:00,2015-11-01 14:55:00,173,302,2225,R,1
natashapavlovaa,Вынесен приговор по делу Солодкиных  https://t.co/XimPdKCMBm https://t.co/Avxl0h2GXf,United States,Russian,2015-11-02 07:55:00,2015-11-02 07:55:00,173,302,2227,R,1
natashapavlovaa,В Петербурге началась экспертиза тел жертв крушения Airbus В процедуре опознания погибших пассажиров самолета …  https://t.co/7BUiNYHSJe,United States,Russian,2015-11-02 10:35:00,2015-11-02 10:36:00,173,302,2229,R,1
natashapavlovaa,Шойгу победил коррупцию в министерстве обороны. Теперь здесь даже пушки стреляют без отката.,United States,Russian,2015-11-02 14:33:00,2015-11-02 14:33:00,173,302,2231,R,1
natashapavlovaa,«Ростов» — «Динамо»: видеотрансляция матча 2 ноября https://t.co/MHNBiJaBmK,United States,Russian,2015-11-02 16:12:00,2015-11-02 16:12:00,173,302,2232,R,1
natashapavlovaa,КГИ измерил уровень социально-экономической и политической напряженности  https://t.co/gZ31i4P9no https://t.co/qeRvzU8jw7,United States,Russian,2015-11-02 17:55:00,2015-11-02 17:56:00,173,302,2233,R,1
natashapavlovaa,В Чикаго 27 человек пострадали при аварии со школьным автобусом https://t.co/FvQZYrHgLS,United States,Russian,2015-11-03 00:55:00,2015-11-03 00:56:00,173,302,2234,R,1
natashapavlovaa,Возвращение шесть лет спустя: ЦСКА сыграет с «Манчестер Юнайтед» https://t.co/1OXnI9KYyx https://t.co/z1zMdtm5db,United States,Russian,2015-11-03 05:53:00,2015-11-03 05:55:00,173,302,2235,R,1
natashapavlovaa,В МАК не подтверждают и не опровергают версию о тепловой вспышке в момент крушения А321 https://t.co/or95NPXi8u,United States,Russian,2015-11-03 09:12:00,2015-11-03 09:12:00,173,302,2237,R,1
natashapavlovaa,По делу об убийстве депутата Пахомова приговорен экс-замминистра Подмосковья https://t.co/Z0TiY9Ku51,United States,Macedonian,2015-11-03 10:55:00,2015-11-03 10:55:00,173,302,2238,R,1
natashapavlovaa,Великобритания намерена экстренно эвакуировать туристов из Шарм-эш-Шейха  https://t.co/ok9czGdITh,United States,Russian,2015-11-05 09:14:00,2015-11-05 09:19:00,173,301,2245,R,1
natashapavlovaa,Глава международного комитета СФ: карикатуры на А321 Charlie Hebdo - нажива на чужом горе https://t.co/OnVnYo29Pw https://t.co/AWCxx0vstd,United States,Russian,2015-11-06 09:33:00,2015-11-06 09:34:00,173,301,2251,R,1
natashapavlovaa,«Мордовия» — «Анжи»: видеотрансляция матча 6 ноября https://t.co/BoGaz23mFh,United States,Bulgarian,2015-11-06 16:32:00,2015-11-06 16:32:00,173,301,2257,R,1
natashapavlovaa,Глава Ростуризма назвал задачей номер один возвращение россиян из Египта на родину  https://t.co/yYOvANLmo2 https://t.co/4SD3u8ItNP,United States,Russian,2015-11-06 19:11:00,2015-11-06 19:14:00,173,301,2258,R,1
natashapavlovaa,"Моуринью: не могу подготовить команду к тому, чтобы остаться всемером https://t.co/qV0fRh94HY",United States,Russian,2015-11-06 20:15:00,2015-11-06 20:15:00,173,302,2259,R,1
natashapavlovaa,Адвокат Виктора Бута подал апелляцию на решение суда об отказе в пересмотре дела https://t.co/0CNN5aErHN,United States,Russian,2015-11-07 01:34:00,2015-11-07 01:35:00,173,303,2261,R,1
natashapavlovaa,Власти Египта изучают камеры наблюдения в аэропорту Шарм-эль-Шейха https://t.co/sPoQTh4Qf8,United States,Russian,2015-11-07 15:12:00,2015-11-07 15:12:00,173,303,2266,R,1
natashapavlovaa,В Эстонии официально запущен новый госперевозчик -- Nordic Aviation Group https://t.co/CCPJkq7mH5,United States,Russian,2015-11-07 19:12:00,2015-11-07 19:12:00,173,304,2268,R,1
natashapavlovaa,Ливанов: государство поможет студентам из РФ обучаться за рубежом  https://t.co/zO5QvRguSH,United States,Russian,2015-11-07 19:33:00,2015-11-07 19:34:00,173,304,2269,R,1
natashapavlovaa,«Боруссия» Д обыграла «Шальке» в рурском дерби https://t.co/BWUrSjQVi6,United States,Serbian,2015-11-08 17:12:00,2015-11-08 17:12:00,173,304,2271,R,1
natashapavlovaa,Удар WADA: IAAF может отстранить легкоатлетов РФ от любых соревнований https://t.co/cISuqbsV9y © AP Photo https://t.co/shZtVyB3Xi,United States,Russian,2015-11-09 19:11:00,2015-11-09 19:11:00,173,305,2275,R,1
natashapavlovaa,Расколотый кирпич: почему Goldman Sachs отказался от БРИКС https://t.co/9ilv7oM8mi,United States,Russian,2015-11-09 21:56:00,2015-11-09 21:56:00,173,305,2276,R,1
natashapavlovaa,Пытавшаяся примкнуть к ИГ студентка МГУ отказалась от двух адвокатов https://t.co/9ozyDGCOiF https://t.co/mapm2ffVRf,United States,Russian,2015-11-10 08:50:00,2015-11-10 08:51:00,173,305,2278,R,1
natashapavlovaa,Почему падают самолеты: кто и зачем «приземлил» Airbus A321 над Cинаем https://t.co/h5GmfiheQN,United States,Russian,2015-11-11 08:48:00,2015-11-11 08:48:00,171,303,2280,,0
natashapavlovaa,Когда на дискотеке включили твою любимую песню https://t.co/0KrM4dDdag,United States,Russian,2015-11-11 14:15:00,2015-11-11 14:15:00,171,303,2282,R,1
natashapavlovaa,Нойер не сыграет в товарищеском матче со сборной Нидерландов https://t.co/dKMqGoKUxI,United States,Russian,2015-11-11 20:54:00,2015-11-11 20:54:00,171,303,2283,R,1
natashapavlovaa,Пан Ги Мун намерен сменить верховного комиссара ООН по делам беженцев  https://t.co/8iqxmLaPas https://t.co/WdeIAy2v6i,United States,Macedonian,2015-11-12 02:55:00,2015-11-12 02:56:00,171,303,2285,R,1
natashapavlovaa,"Скончался барабанщик, игравший в дебютном сингле The Beatles https://t.co/Xq0Wbdh0RP",United States,Russian,2015-11-12 04:53:00,2015-11-12 04:54:00,171,303,2286,R,1
natashapavlovaa,Самолет Москва - Гонконг экстренно сел в аэропорту Новосибирска https://t.co/dDJZVMFsmX https://t.co/00NOQqpPNN,United States,Russian,2015-11-12 07:32:00,2015-11-12 07:32:00,171,303,2287,R,1
natashapavlovaa,В СФ не исключают выхода из ПАСЕ и призывают к ее реформе https://t.co/SoRTnWbRFQ https://t.co/VG8CPWLV20,United States,Russian,2015-11-12 11:42:00,2015-11-12 11:42:00,171,303,2291,R,1
natashapavlovaa,"Ученые выяснили, как кора Земли раскололась на плиты в древности https://t.co/23UMYq0aEL https://t.co/z8R97HIUvS",United States,Russian,2015-11-12 11:52:00,2015-11-12 11:52:00,171,303,2292,R,1
natashapavlovaa,Как на Украине стирать будем историю или каким другим способом? https://t.co/TcU7StEJXb,United States,Russian,2015-11-13 05:33:00,2015-11-13 05:33:00,172,305,2296,R,1
natashapavlovaa,Россия запретила полеты EgyptAir https://t.co/6OsClZkDa9,United States,Russian,2015-11-13 15:18:00,2015-11-13 15:18:00,172,305,2298,R,1
natashapavlovaa,Две недели после крушения A321 в Египте: расследование продолжается https://t.co/WkHcjzWQlc https://t.co/hDf9TmLQtF,United States,Russian,2015-11-13 16:32:00,2015-11-13 16:33:00,172,305,2300,R,1
natashapavlovaa,"Суд арестовал лихача, сбившего инспектора ДПС под окнами главного здания московской полиции https://t.co/X33eq52vez https://t.co/cMVVl5Gxik",United States,Russian,2015-11-13 16:35:00,2015-11-13 16:35:00,172,305,2301,R,1
natashapavlovaa,"Более 320 нарушений ПДД выявлено за день ""скрытыми"" патрулями ГАИ в Москве https://t.co/0FVBfIqhqu",United States,Russian,2015-11-13 18:59:00,2015-11-13 18:59:00,172,306,2303,R,1
natashapavlovaa,МИД исключил введение выездных виз из России https://t.co/OF3JWJY1ix,United States,Russian,2015-11-13 19:38:00,2015-11-13 19:38:00,172,306,2304,R,1
natashapavlovaa,26 убитых в Париже https://t.co/taAIDVRirO https://t.co/vPSrNpvAoM,United States,Macedonian,2015-11-13 23:03:00,2015-11-13 23:03:00,172,306,2307,R,1
natashapavlovaa,Видео с места #Париж #Bataclan #Paris #Батаклан #ParisAttacks #PrayForParis   https://t.co/Pa9QzbxYuq https://t.co/KIXEjDvanc,United States,Macedonian,2015-11-14 00:52:00,2015-11-14 00:53:00,172,306,2308,R,1
natashapavlovaa,Захарова: трагедия в Париже повлияет на повестку дня встречи по Сирии https://t.co/ihEyCpxE9G https://t.co/BEiMWpJRq9,United States,Russian,2015-11-14 09:18:00,2015-11-14 09:18:00,172,306,2310,R,1
natashapavlovaa,Путин: трагедия в Париже говорит о варварской сущности терроризма https://t.co/NKY5rvkERs https://t.co/ZW3lE66uUA,United States,Russian,2015-11-14 09:34:00,2015-11-14 09:34:00,172,306,2311,R,1
natashapavlovaa,Во Франции объявили трехдневный траур в связи с терактами https://t.co/7pyGfeeXzT,United States,Russian,2015-11-14 11:11:00,2015-11-14 11:12:00,172,306,2312,R,1
natashapavlovaa,Многосторонняя встреча по Сирии началась в Вене https://t.co/ve4NIYGdun https://t.co/WCgaxd3sIx,United States,Russian,2015-11-14 11:17:00,2015-11-14 11:17:00,172,306,2313,R,1
natashapavlovaa,После терактов в Париже госпитализировано 300 человек https://t.co/9j0FXzA13m,United States,Russian,2015-11-14 14:12:00,2015-11-14 14:12:00,172,307,2316,R,1
natashapavlovaa,В результате схода поезда во Франции погибли не менее пяти человек https://t.co/s3QpZDeZfB © Cmouadelph https://t.co/IO9z0H8Qvw,United States,Russian,2015-11-14 16:11:00,2015-11-14 16:11:00,172,307,2319,R,1
natashapavlovaa,"США, вероятно, ликвидировали одного из главарей ИГ Абу Набиля в результате авиаудара на востоке Ливии https://t.co/6iGTuZ54KC",United States,Russian,2015-11-14 17:55:00,2015-11-14 17:55:00,172,307,2320,R,1
natashapavlovaa,Редакция Charlie Hebdo сделала заявление по терактам в Париже https://t.co/A77GYm57L3 #ParisAttacks #Париж https://t.co/eTEDGWi5E3,United States,Russian,2015-11-14 19:31:00,2015-11-14 19:31:00,172,307,2321,R,1
natashapavlovaa,Reuters: проведена эвакуация на территории рядом с Эйфелевой башней https://t.co/dGanpnF6nf,United States,Russian,2015-11-14 21:31:00,2015-11-14 21:32:00,172,307,2323,R,1
natashapavlovaa,Госдеп подтвердил гибель гражданки США в терактах в Париже https://t.co/glt4GJsGfY  #ParisAttacks #Париж #теракт https://t.co/594mXepia2,United States,Russian,2015-11-15 03:12:00,2015-11-15 03:13:00,172,308,2325,R,1
natashapavlovaa,В Забайкалье госпитализированы 12 школьников с симптомами гепатита А https://t.co/86UN9vsOOp https://t.co/clY21HNCsb,United States,Russian,2015-11-15 09:31:00,2015-11-15 09:31:00,172,308,2327,R,1
natashapavlovaa,Бельгия усиливает меры безопасности  https://t.co/L9s1jGpqHB https://t.co/wQYYRejlmM,United States,Russian,2015-11-15 10:32:00,2015-11-15 10:32:00,172,308,2328,R,1
natashapavlovaa,Бирол: инвестиции в нефтяную отрасль в мире будут падать два года https://t.co/yC0Rnzsf47 https://t.co/C2WSM43XrY,United States,Russian,2015-11-15 13:12:00,2015-11-15 13:12:00,172,308,2330,R,1
natashapavlovaa,Пойманный в Германии автоматчик захватил в Париж гранаты.   https://t.co/T2RTc8X5PS https://t.co/rYGyBKH19V,United States,Russian,2015-11-15 14:37:00,2015-11-15 14:37:00,172,308,2334,R,1
natashapavlovaa,Члены G20 отметили важность политического решения кризисов с беженцами https://t.co/xvqLlN6Rry #G20 https://t.co/Rzsufp1gNa,United States,Russian,2015-11-15 14:52:00,2015-11-15 14:52:00,172,308,2335,R,1
natashapavlovaa,«Волынь» и «Говерлу» могут не допустить к участию в чемпионате Украины https://t.co/KDJBvz10tx,United States,Ukrainian,2015-11-15 16:35:00,2015-11-15 16:35:00,172,308,2337,R,1
natashapavlovaa,"МВД Франции: режим ЧС ускорит действия по борьбе с ""пропагандистами ненависти"" https://t.co/g2f4rNz6Nb",United States,Russian,2015-11-15 20:53:00,2015-11-15 20:53:00,172,308,2339,R,1
natashapavlovaa,Детали покушения на Николая II в Японии.  Смотрите репортаж: https://t.co/WzTb0bQTKZ https://t.co/zTnKx9DPef,United States,Macedonian,2015-11-15 20:56:00,2015-11-15 20:56:00,172,308,2340,R,1
natashapavlovaa,На складе резиновых изделий в Петербурге произошел пожар https://t.co/TjOtsliDmT,United States,Russian,2015-11-16 01:54:00,2015-11-16 01:54:00,172,308,2341,R,1
natashapavlovaa,Колледж в Мэриленде временно закрылся из-за вооруженного студента https://t.co/AuMPNnRZMl,United States,Russian,2015-11-16 15:14:00,2015-11-16 15:14:00,172,308,2348,R,1
natashapavlovaa,СМИ: Чарли Шин регулярно откупался от бывших партнерш из-за ВИЧ https://t.co/FqZscdILK6,United States,Ukrainian,2015-11-16 20:32:00,2015-11-16 20:32:00,172,308,2351,R,1
natashapavlovaa,Лекант: русскую речь поразило увлечение превосходной степенью https://t.co/g8bQ5eZpi7 https://t.co/YyJQ5du4Qn,United States,Russian,2015-11-17 03:53:00,2015-11-17 03:53:00,172,308,2353,R,1
natashapavlovaa,Внезапно™ https://t.co/aYO6vj6uEQ,United States,Macedonian,2015-11-17 04:17:00,2015-11-17 04:17:00,172,308,2354,R,1
natashapavlovaa,Концерт памяти жертв событий на Синае и во Франции пройдет в Приморье https://t.co/ROyqsyClPJ https://t.co/GNHjZdpL18,United States,Russian,2015-11-17 05:32:00,2015-11-17 05:32:00,172,308,2355,R,1
