author_id,content,region,language,publish_date,harvested_date,following,followers,updates,post_type,retweet
NovostiShoigu,Крейсер «Варяг» примет участие в международной выставке «Имдэкс Эйша – 2017». https://t.co/XHVY6WL7I1 https://t.co/2KwF8vwG3E,United States,Russian,2017-05-16T06:21:00,2017-05-16T06:21:00,5.0000000000,4271.0000000000,1501.0000000000,,False
NovostiShoigu,Военная академии МТО представила свои изобретения на салоне «Архимед-2017» https://t.co/vWMo5LV8LN https://t.co/jxsPeY3fDW,United States,Russian,2017-05-16T12:29:00,2017-05-16T12:29:00,5.0000000000,4271.0000000000,1505.0000000000,,False
NovostiShoigu,Около 30 стран примут участие в Армейских международных играх-2017 https://t.co/hfwZ1hiH06 https://t.co/rhIFD9UkUI,United States,Russian,2017-05-17T16:43:00,2017-05-17T16:43:00,5.0000000000,4269.0000000000,1529.0000000000,,False
NovostiShoigu,Летчики армейской авиации ЗВО готовятся к конкурсу «Авиадартс-2017» https://t.co/rAKZGpscga https://t.co/F7NXe2fpxf,United States,Russian,2017-05-17T18:38:00,2017-05-17T18:39:00,5.0000000000,4269.0000000000,1531.0000000000,,False
NovostiShoigu,В Рязани военнослужащие Сербии и Белоруссии совершат по 20 прыжков с парашютом «Арбалет-2» с высот от 1200 до 4000 м https://t.co/giiptAsac5 https://t.co/PB4JPTjUT4,United States,Russian,2017-05-18T08:45:00,2017-05-18T08:45:00,5.0000000000,4267.0000000000,1543.0000000000,,False
NovostiShoigu,На форуме «Армия-2017» покажут современные технические средства охраны объектов https://t.co/qQHjO5bCc9 https://t.co/gWFoTiqau0,United States,Russian,2017-05-18T14:54:00,2017-05-18T14:54:00,5.0000000000,4266.0000000000,1549.0000000000,,False
NovostiShoigu,"В Москве прошла военно-патриотическая акция, посвященная отправке в войска новобранцев https://t.co/L0qcQ1cfxz https://t.co/ZeKkS1D38W",United States,Russian,2017-05-18T14:54:00,2017-05-18T14:54:00,5.0000000000,4266.0000000000,1548.0000000000,,False
NovostiShoigu,В Москве состоялась церемония увольнения с военной службы военнослужащих спортивной роты ЦСКА https://t.co/iA5OK1fk6u https://t.co/xD8V21BPjd,United States,Russian,2017-05-19T23:04:00,2017-05-19T23:05:00,5.0000000000,4263.0000000000,1574.0000000000,,False
NovostiShoigu,Научная рота академии МТО вышла в супер-финал отраслевого турнира «Росатома» - «ТеМП - 2017» https://t.co/RnpQLM0vXt https://t.co/7AlxyCrA5w,United States,Russian,2017-05-20T13:11:00,2017-05-20T13:11:00,5.0000000000,4262.0000000000,1587.0000000000,,False
NovostiShoigu,В рамках 72-годовщины Великой Победы состоялась акция Бессмертная Эскадрилья https://t.co/ZPGT7VqtVY https://t.co/ETgsJGL9dz,United States,Russian,2017-05-21T13:23:00,2017-05-21T13:23:00,5.0000000000,4262.0000000000,1609.0000000000,,False
NovostiShoigu,На сайте Минобороны России опубликованы имена победителей Всероссийского фестиваля прессы «МЕДИА-АС-2017» https://t.co/J1pxuUsHgR https://t.co/xjJE4pXZrJ,United States,Russian,2017-05-23T13:47:00,2017-05-23T13:47:00,5.0000000000,4260.0000000000,1649.0000000000,,False
NovostiShoigu,Около 800 водителей и механиков-водителей российской военной базы в Абхазии прошли курс экстремального вождения https://t.co/zBdgTQT8oB https://t.co/vKC2Ytsx6y,United States,Russian,2017-05-23T13:47:00,2017-05-23T13:47:00,5.0000000000,4260.0000000000,1650.0000000000,,False
NovostiShoigu,Свыше 800 прыжков с парашютом совершили в мае разведчики ЗВО в Тамбовской области https://t.co/PDqzELSR3y https://t.co/m6nrpgbiYB,United States,Russian,2017-05-23T19:50:00,2017-05-23T19:50:00,5.0000000000,4256.0000000000,1655.0000000000,,False
NovostiShoigu,На сайте Минобороны России опубликованы имена победителей Всероссийского фестиваля прессы «МЕДИА-АС-2017» https://t.co/J1pxuUsHgR https://t.co/UnicfytCpz,United States,Russian,2017-05-24T01:52:00,2017-05-24T01:52:00,5.0000000000,4256.0000000000,1660.0000000000,,False
NovostiShoigu,Более 5000 военнослужащих регулярно осваивают экстремальное управление тяжелой автомобильной техникой https://t.co/Q0Oy2EIw9U https://t.co/PF8QDphFp3,United States,Russian,2017-05-27T08:04:00,2017-05-27T08:05:00,5.0000000000,4250.0000000000,1721.0000000000,,False
NovostiShoigu,Автопробег в честь Дня Северного флота стартовал в Североморске https://t.co/mWiVF8tt7F https://t.co/mfHMKWuJK2,United States,Russian,2017-05-27T12:08:00,2017-05-27T12:28:00,5.0000000000,4250.0000000000,1724.0000000000,,False
NovostiShoigu,Большой противолодочный корабль «Североморск» завершил деловой заход в Лиссабон https://t.co/uWKcjuZ6ze https://t.co/NFBjfoD6Ec,United States,Russian,2017-05-27T14:08:00,2017-05-27T14:15:00,5.0000000000,4250.0000000000,1725.0000000000,,False
NovostiShoigu,В Сочи прошла церемония приведения к Военной присяге новобранцев спортивных рот ЦСКА https://t.co/OjtxszFqfq https://t.co/T2Z0GPvygT,United States,Russian,2017-05-27T16:03:00,2017-05-27T16:03:00,5.0000000000,4249.0000000000,1726.0000000000,,False
NovostiShoigu,Дальние бомбардировщики Ту-22М3 совершили плановый полет над нейтральными водами Баренцева и Норвежского морей https://t.co/0UrYDUA9uF https://t.co/ACXXNZU2tg,United States,Russian,2017-05-27T22:07:00,2017-05-27T22:07:00,5.0000000000,4249.0000000000,1731.0000000000,,False
NovostiShoigu,Сегодня в Конгрессно-выставочном центре «Патриот» состоится выездное заседание Коллегии Минобороны https://t.co/wIqR6EinDl https://t.co/aJZcVHWWTg,United States,Russian,2017-05-31T06:53:00,2017-06-01T06:34:00,5.0000000000,4246.0000000000,1823.0000000000,,False
NovostiShoigu,Вышел в свет новый номер журнала «Вестник военного образования» за май-июнь 2017 года https://t.co/FfMtoOHnFt https://t.co/9H66EQzgY5,United States,Russian,2017-05-31T10:55:00,2017-05-31T10:56:00,5.0000000000,4246.0000000000,1806.0000000000,,False
NovostiShoigu,Одним из районов действий подразделений ЦВО станет Арктика https://t.co/1cESg29YOe https://t.co/yv5O3gXLj9,United States,Russian,2017-05-31T12:50:00,2017-05-31T13:05:00,5.0000000000,4246.0000000000,1808.0000000000,,False
NovostiShoigu,В ГВКГ имени Н.Н. Бурденко впервые прошла акция «Я за некурящую Армию России» https://t.co/N1OzlkfKr0 https://t.co/bvOo5C1PAR,United States,Russian,2017-05-31T16:47:00,2017-05-31T16:47:00,5.0000000000,4247.0000000000,1812.0000000000,,False
NovostiShoigu,В летнем периоде обучения продолжится перевооружение 4 соединений РВСН на ракетный комплекс «Ярс» https://t.co/Jvg7xsiW8M https://t.co/TbpXz6PQFR,United States,Russian,2017-06-01T11:06:00,2017-06-01T15:57:00,5.0000000000,4245.0000000000,1831.0000000000,,False
NovostiShoigu,"Очередь военных на жилье в Москве составляет 9,8 тыс. человек https://t.co/Inxoppism5 https://t.co/WqSKbm2px5",United States,Russian,2017-06-02T01:08:00,2017-06-02T01:09:00,5.0000000000,4242.0000000000,1838.0000000000,,False
NovostiShoigu,До 2025 года Минобороны РФ намерено модернизировать 4 атомные подлодки для ТОФ https://t.co/NS1qsTZ4AX https://t.co/YhZJZRoSYr,United States,Russian,2017-06-03T13:26:00,2017-06-03T20:10:00,5.0000000000,4236.0000000000,1871.0000000000,,False
NovostiShoigu,Более 800 человек призвано на военную службу в Республике Бурятия https://t.co/nliKSiRRud,United States,Russian,2017-06-04T05:34:00,2017-06-04T05:34:00,5.0000000000,4235.0000000000,1880.0000000000,,False
NovostiShoigu,Главное управление обустройства войск произведет реконструкцию стадиона ЦСКА https://t.co/PoNA2fHbQO https://t.co/55YavdHncR,United States,Russian,2017-06-04T17:40:00,2017-06-04T17:40:00,5.0000000000,4233.0000000000,1890.0000000000,,False
NovostiShoigu,Экипаж самолета Ан-30Б выполнит наблюдательный полет над территорией Республики Болгария https://t.co/MS2jLPevp9 https://t.co/DlCB96cq83,United States,Russian,2017-06-04T21:42:00,2017-06-04T21:42:00,5.0000000000,4233.0000000000,1893.0000000000,,False
NovostiShoigu,На Камчатке юнармейцы ЦСКА встретились с моряками-подводниками https://t.co/7o0mGQbmiO https://t.co/i7VLarAFyA,United States,Russian,2017-06-05T01:49:00,2017-06-05T01:50:00,5.0000000000,4228.0000000000,1898.0000000000,,False
NovostiShoigu,Российские инспекторы выполнит наблюдательный полет над Болгарией https://t.co/MS2jLPevp9 https://t.co/iERi3p3PgI,United States,Russian,2017-06-05T07:48:00,2017-06-05T07:49:00,5.0000000000,4227.0000000000,1906.0000000000,,False
NovostiShoigu,Государственные испытания тяжелого ударного беспилотника могут завершиться в России в 2018 году https://t.co/KHlUZSPTKw https://t.co/m7eyq3darV,United States,Russian,2017-06-07T20:23:00,2017-06-07T20:23:00,5.0000000000,4224.0000000000,1955.0000000000,,False
NovostiShoigu,В 2017 году военнослужащие ВВО получили 4.3 миллиарда рублей  для приобретения постоянного жилья https://t.co/r7CJgxoS9t https://t.co/RT6fvi3Fl2,United States,Russian,2017-06-08T06:23:00,2017-06-08T06:23:00,5.0000000000,4223.0000000000,1964.0000000000,,False
NovostiShoigu,Командующий ТОФ проверил готовность полигона Бамбурово к проведению конкурса «Морской десант - 2017» https://t.co/DW2AbovUfT https://t.co/aqHcyIOGla,United States,Russian,2017-06-09T06:35:00,2017-06-09T06:47:00,5.0000000000,4222.0000000000,1979.0000000000,,False
NovostiShoigu,В Луге Ленинградской области прошла информационно-агитационная акция «Служба по контракту – твой выбор» https://t.co/7BF8beoop4 https://t.co/aItfdMY9Jp,United States,Russian,2017-06-10T10:54:00,2017-06-10T10:54:00,5.0000000000,4220.0000000000,2002.0000000000,,False
NovostiShoigu,Военнослужащие ЗВО стали победителями всеармейского конкурса «Снайперский рубеж-2017» https://t.co/KzKO68Iiyz https://t.co/3463eawhja,United States,Russian,2017-06-11T00:56:00,2017-06-11T01:07:00,5.0000000000,4223.0000000000,2016.0000000000,,False
NovostiShoigu,Минобороны России для участников чемпионата мира по практической стрельбе организовало экскурсии по парку «Патриот» https://t.co/IUy3Qy3sdH https://t.co/yec0unX32Y,United States,Russian,2017-06-11T00:56:00,2017-06-11T01:07:00,5.0000000000,4223.0000000000,2015.0000000000,,False
NovostiShoigu,Менеджмент в медицинских организациях стал темой международной конференции в 3ЦВКГ им. А.А. Вишневского https://t.co/XbOmE7yEbh https://t.co/FCcV0JUOer,United States,Russian,2017-06-12T17:15:00,2017-06-12T17:15:00,5.0000000000,4226.0000000000,2052.0000000000,,False
NovostiShoigu,На Тихоокеанском флоте проводится сезонное обслуживание навигационного оборудования https://t.co/bTUVN1lcCq https://t.co/durcdAR2fI,United States,Russian,2017-06-15T07:52:00,2017-06-15T07:52:00,5.0000000000,4221.0000000000,2102.0000000000,,False
NovostiShoigu,Фехтовальщики ЦСКА вернулись в Москву с тремя медалями чемпионата Европы https://t.co/3LdBZF5Pay https://t.co/1L7G0pzC7f,United States,Russian,2017-06-16T04:02:00,2017-06-16T04:03:00,5.0000000000,4219.0000000000,2119.0000000000,,False
NovostiShoigu,Юнармейцы впервые проводят каникулы на военно-полевых сборах под Екатеринбургом https://t.co/QzVIPKHPUZ https://t.co/Oed6L1tHW8,United States,Russian,2017-06-17T12:14:00,2017-06-17T12:14:00,5.0000000000,4221.0000000000,2145.0000000000,,False
NovostiShoigu,Дивизион С-300 ПМ ЗВО провел более 120 электронных ракетных пусков на конкурсе «Авиадартс-2017» под Воронежем https://t.co/SaAEj1ABtt https://t.co/chBDQDZTgR,United States,Russian,2017-06-19T16:45:00,2017-06-19T16:45:00,5.0000000000,4217.0000000000,2189.0000000000,,False
NovostiShoigu,В декабре самолёт А-100 совершит предсерийный полет https://t.co/KaioANk4VN https://t.co/NYWTIoefWr,United States,Macedonian,2017-06-25T20:03:00,2017-06-25T20:03:00,5.0000000000,4216.0000000000,2299.0000000000,,False
NovostiShoigu,"Совместная миссия Греции, Италии и Германии выполнит наблюдательный полет над территорией Российской Федерации https://t.co/d8HWoRA66L https://t.co/Osxh2B9UPW",United States,Russian,2017-06-25T21:53:00,2017-06-25T21:54:00,5.0000000000,4216.0000000000,2301.0000000000,,False
NovostiShoigu,Совместная миссия Польши и Словакии выполнит наблюдательный полет над территорией России и Белоруссии https://t.co/2CZEWK1TtV https://t.co/t7JpPfYpGu,United States,Russian,2017-07-02T23:19:00,2017-07-02T23:19:00,5.0000000000,4213.0000000000,2441.0000000000,,False
NovostiShoigu,Российская группа инспекторов планирует выполнить наблюдательный полет над территорией Норвегии https://t.co/J6ShQW6TYO https://t.co/Q6NVH89kGJ,United States,Russian,2017-07-02T23:19:00,2017-07-02T23:20:00,5.0000000000,4213.0000000000,2442.0000000000,,False
NovostiShoigu,Курсанты школы снайперов ВВО успешно сдали выпускные экзамены https://t.co/molIPFN8VR https://t.co/b28Yl4lHbW,United States,Russian,2017-07-04T07:35:00,2017-07-04T07:47:00,5.0000000000,4214.0000000000,2471.0000000000,,False
NovostiShoigu,Десантники из Ульяновска и Иваново совершают многокилометровые марши на аэродромы взлета для переброски по воздуху https://t.co/BrjHICvfIu https://t.co/OgZt205t1I,United States,Russian,2017-07-04T07:36:00,2017-07-04T07:46:00,5.0000000000,4214.0000000000,2472.0000000000,,False
NovostiShoigu,В Тоцком гарнизоне более 500 новобранцев приступили к занятиям по боевой подготовке https://t.co/uZmxg2MhSx https://t.co/hs6jabtCfF,United States,Russian,2017-07-05T15:51:00,2017-07-05T15:52:00,5.0000000000,4209.0000000000,2478.0000000000,,False
NovostiShoigu,Завершается 2 этап конкурса «Сдерживающий фактор»  в Астраханской области https://t.co/BMGDoDBRKg https://t.co/Mo6ZAhaFze,United States,Russian,2017-07-05T23:56:00,2017-07-06T00:07:00,5.0000000000,4209.0000000000,2483.0000000000,,False
NovostiShoigu,В Ленинградской области прошли инспекционные проверки филиалов «Оборонлес» Минобороны России https://t.co/LTJWsHdh5W https://t.co/GERQqwOuHX,United States,Russian,2017-07-05T23:56:00,2017-07-06T00:08:00,5.0000000000,4209.0000000000,2484.0000000000,,False
NovostiShoigu,Корабли Балтийского флота в ходе учения отразили налет авиации условного противника https://t.co/8tB18XDm4J https://t.co/CWkcqquY6K,United States,Russian,2017-07-06T20:06:00,2017-07-06T20:18:00,5.0000000000,4208.0000000000,2500.0000000000,,False
NovostiShoigu,Автопробег ДОСААФ благословила Русская православная церковь https://t.co/eBOnsk7JyJ https://t.co/kD0EBuobv0,United States,Russian,2017-07-06T20:06:00,2017-07-06T20:18:00,5.0000000000,4208.0000000000,2501.0000000000,,False
NovostiShoigu,Заместитель Министра обороны Тимур Иванов проверит строительство военных объектов в Карелии https://t.co/i8BRAmF6qe https://t.co/GjIG8diEMA,United States,Russian,2017-07-07T10:18:00,2017-07-07T10:28:00,5.0000000000,4209.0000000000,2513.0000000000,,False
NovostiShoigu,Тематическая зона Армии России «Вместе мы – сила!» открылась на фестивале «Нашествие» https://t.co/l1hstIiKdH https://t.co/OBR5PDOwyx,United States,Russian,2017-07-07T10:18:00,2017-07-07T10:28:00,5.0000000000,4209.0000000000,2512.0000000000,,False
NovostiShoigu,Летчики ВКС впервые продемонстрируют воздушный бой на малых высотах на истребителях Су-35С на «МАКС-2017» https://t.co/8qJ7F5akCX https://t.co/U47u7MYNUD,United States,Russian,2017-07-07T20:17:00,2017-07-07T20:28:00,5.0000000000,4208.0000000000,2520.0000000000,,False
NovostiShoigu,Акция «Военная служба по контракту в Вооруженных Силах РФ – твой выбор!» пройдет в Санкт-Петербурге https://t.co/3Ery5N4Fo7 https://t.co/4HB0xcTpD2,United States,Russian,2017-07-08T12:26:00,2017-07-08T12:26:00,5.0000000000,4210.0000000000,2532.0000000000,,False
NovostiShoigu,Войсковые разведчики ЗВО отработают захват и уничтожение штабов и органов военного управления условного противника https://t.co/xhXTR2MbX0 https://t.co/7xz2ZGhSA0,United States,Russian,2017-07-08T18:28:00,2017-07-08T18:39:00,5.0000000000,4210.0000000000,2538.0000000000,,False
NovostiShoigu,В библиотеке Благовещенска развернут первый консультативный центр по приему граждан на военную службу по контракту https://t.co/AZfv6BSTqX https://t.co/IhNHBpYkSs,United States,Russian,2017-07-09T12:37:00,2017-07-09T12:49:00,5.0000000000,4208.0000000000,2555.0000000000,,False
NovostiShoigu,Более 250 военнослужащих ВВО получили денежные субсидии на приобретение жилья в Забайкалье и Республике Бурятия https://t.co/L1bOp5EPWn https://t.co/z9lSx066bW,United States,Russian,2017-07-09T12:38:00,2017-07-09T12:49:00,5.0000000000,4208.0000000000,2556.0000000000,,False
NovostiShoigu,"В Петербурге началась акция, посвященная 105-летию военной авиации России https://t.co/zZ1liI6Tj8 https://t.co/IGq5m5q3vU",United States,Russian,2017-07-09T16:39:00,2017-07-09T16:39:00,5.0000000000,4208.0000000000,2560.0000000000,,False
NovostiShoigu,Парашютисты ЦСКА стали победителями общекомандного зачета на чемпионате ВС РФ https://t.co/FoMirF1AEB https://t.co/R1zypppm9V,United States,Russian,2017-07-09T20:41:00,2017-07-09T20:41:00,5.0000000000,4208.0000000000,2564.0000000000,,False
NovostiShoigu,Россия планирует выполнить наблюдательный полет над территорией Великобритании https://t.co/qCw2s851zG https://t.co/CAEYObbSMV,United States,Russian,2017-07-09T22:42:00,2017-07-09T22:42:00,5.0000000000,4208.0000000000,2565.0000000000,,False
NovostiShoigu,"В Петербурге прошла акция, посвященная 105-летию военной авиации России https://t.co/kGfQdVwGf5 https://t.co/fGjYlFzmW1",United States,Russian,2017-07-10T02:44:00,2017-07-10T02:44:00,5.0000000000,4207.0000000000,2568.0000000000,,False
NovostiShoigu,Воздушно-космические силы представят на авиасалоне «МАКС-2017» современные образцы авиационной техники https://t.co/XZzYlcsRtN https://t.co/3odETePIxx,United States,Russian,2017-07-11T04:57:00,2017-07-11T05:18:00,5.0000000000,4202.0000000000,2592.0000000000,,False
NovostiShoigu,В войсках РХБ защиты Западного военного округа начался масштабный полевой выход https://t.co/3EvMm5Oz53 https://t.co/CzRl1r8CJF,United States,Russian,2017-07-11T06:58:00,2017-07-11T07:10:00,5.0000000000,4202.0000000000,2593.0000000000,,False
NovostiShoigu,С экипажами кораблей Балтийского флота проводятся учения по борьбе за живучесть https://t.co/dLQJIo3VEU https://t.co/VH0ntK55fd,United States,Russian,2017-07-11T15:08:00,2017-07-11T15:20:00,5.0000000000,4202.0000000000,2599.0000000000,,False
NovostiShoigu,Олимпийские чемпионы из ЦСКА посетили российскую авиабазу Хмеймим в Сирии https://t.co/qnGiYVgvU4 https://t.co/wgaWoZsYR5,United States,Russian,2017-07-11T19:04:00,2017-07-11T19:04:00,5.0000000000,4202.0000000000,2604.0000000000,,False
NovostiShoigu,Команда ЦВКГ имени П.В. Мандрыка стала бронзовым призером футбольного чемпионата MedPharm Premier League https://t.co/TzPo44lxAn https://t.co/mQZ9IGNqsr,United States,Russian,2017-07-11T23:06:00,2017-07-11T23:06:00,5.0000000000,4199.0000000000,2607.0000000000,,False
NovostiShoigu,Атомный подводный крейсер «Томск» Тихоокеанского флота успешно произвел пуск крылатой ракеты https://t.co/cA3x3hW3M1 https://t.co/A8gZhzoGqX,United States,Russian,2017-07-12T03:07:00,2017-07-12T03:07:00,5.0000000000,4197.0000000000,2611.0000000000,,False
NovostiShoigu,Замминистра обороны России Татьяна Шевцова поздравила военных финансистов Белоруссии с профессиональным праздником https://t.co/MbtaQDLdKu https://t.co/lpH6azkpTV,United States,Russian,2017-07-13T03:19:00,2017-07-13T03:30:00,5.0000000000,4194.0000000000,2633.0000000000,,False
NovostiShoigu,"В военных округах, родах войск и Северного флота завершился третий этап конкурса по полевой выучке подразделений РЭБ https://t.co/iMJBaqLIxx https://t.co/XtsLqBC2Ip",United States,Russian,2017-07-14T19:39:00,2017-07-14T19:42:00,5.0000000000,4194.0000000000,2665.0000000000,,False
NovostiShoigu,В дальней авиации прошли учения с экипажами Ту-22М3 https://t.co/dxm4VZZaOi https://t.co/FRS0Xb15KK,United States,Russian,2017-07-14T21:40:00,2017-07-14T21:52:00,5.0000000000,4194.0000000000,2667.0000000000,,False
NovostiShoigu,Весенний призыв граждан на военную службу завершен https://t.co/xe3GE4WOBO https://t.co/JdlMcbNL2n,United States,Russian,2017-07-14T21:40:00,2017-07-14T21:52:00,5.0000000000,4194.0000000000,2666.0000000000,,False
NovostiShoigu,Российская группа инспекторов выполнит наблюдательный полет над территорией Германии https://t.co/kJCu4m0NRo https://t.co/LLHCjSH0pv,United States,Russian,2017-07-16T22:04:00,2017-07-16T22:04:00,5.0000000000,4194.0000000000,2710.0000000000,,False
NovostiShoigu,Евразийский ортопедический форум объединил 3750 участников из разных стран https://t.co/vCoeHgshI6 https://t.co/luaqaPBxAa,United States,Russian,2017-07-17T02:06:00,2017-07-17T02:06:00,5.0000000000,4193.0000000000,2713.0000000000,,False
