author_id,content,region,language,publish_date,harvested_date,following,followers,updates,post_type,retweet
NovostiSmr,Николай Меркушкин и Олег Дерипаска обсудили проект выпуска Ил-114 в Самаре http://t.co/8fQ4Ahc6Bo,Azerbaijan,Russian,2015-06-20 07:27:00,2015-06-20 07:29:00,490,46300,3244,,0
NovostiSmr,Появилось фото Lada Vesta  с открытым капотом http://t.co/MA7CmT1c39,Azerbaijan,Russian,2015-06-22 06:13:00,2015-06-22 06:13:00,491,46256,3261,,0
NovostiSmr,В Самаре площадь Революции закрыли из-за начавшейся реконструкции  http://t.co/I6Dfo4hj4M http://t.co/KGBDL0CgBU,Azerbaijan,Russian,2015-06-22 09:55:00,2015-06-22 09:55:00,491,46256,3270,,0
NovostiSmr,Apple зарегистрировала патент на новый композитный материал http://t.co/fAoGed7M0M,Azerbaijan,Russian,2015-06-22 11:32:00,2015-06-22 11:32:00,491,46253,3275,,0
NovostiSmr,АвтоВАЗ может выпустить Lada Vesta Cross http://t.co/LBKwj2wZLO,Azerbaijan,Russian,2015-06-22 13:04:00,2015-06-22 13:04:00,491,46251,3279,,0
NovostiSmr,Россияне стали стали более рациональными в кризис http://t.co/zqqI5OfhpZ,Azerbaijan,Russian,2015-06-22 14:09:00,2015-06-22 14:11:00,491,46250,3281,,0
NovostiSmr,АвтоВАЗ возобновляет производство http://t.co/jKT9igqX6B,Azerbaijan,Russian,2015-06-23 06:52:00,2015-06-23 06:52:00,490,46231,3288,,0
NovostiSmr,Самарская область получит 80 млн. рублей на улучшение лекарственного обеспечения граждан http://t.co/uhnhOAlZrk,Azerbaijan,Russian,2015-06-23 07:04:00,2015-06-23 07:04:00,490,46231,3289,,0
NovostiSmr,"Большинство жительниц Самары выходит замуж в 22-25 лет, мужчины женятся до 27  http://t.co/YYCPVYhd2P http://t.co/6hAuwmYGoG",Azerbaijan,Russian,2015-06-23 13:43:00,2015-06-23 13:43:00,490,46229,3303,,0
NovostiSmr,Куда исчезают более 1 млн тонн отходов АвтоВАЗа http://t.co/Ow6BxMRidl,Azerbaijan,Russian,2015-06-24 05:38:00,2015-06-24 05:38:00,491,46219,3306,,0
NovostiSmr,АвтоВАЗ продает свою долю в Тольяттинском заводе автоагрегатов http://t.co/bvdlfNu8Qt,Azerbaijan,Russian,2015-06-24 06:22:00,2015-06-24 06:22:00,491,46219,3308,,0
NovostiSmr,АвтоВАЗ продает поставщика http://t.co/bmgC5RVPH1,Azerbaijan,Russian,2015-06-24 08:03:00,2015-06-24 08:03:00,491,46219,3312,,0
NovostiSmr,"В Самаре ищут девушку,которая перед пропажей созвонилась со знакомым и кричала «Помогите!»  http://t.co/IkrxteoyBW http://t.co/DSlwWi4znQ",Azerbaijan,Russian,2015-06-24 09:13:00,2015-06-24 09:13:00,491,46218,3315,,0
NovostiSmr,20-летний самарец задержан за кражу еды и 7000 рублей из кафе http://t.co/1FC3MXkJzy,Azerbaijan,Russian,2015-06-24 09:25:00,2015-06-24 09:25:00,491,46218,3316,,0
NovostiSmr,"""Джи Эм АвтоВАЗ"" будет работать по четыре дня http://t.co/f3SCat3VdJ",Azerbaijan,Russian,2015-06-24 11:27:00,2015-06-24 11:27:00,491,46215,3322,,0
NovostiSmr,В Совете директоров АвтоВАЗа прибавление http://t.co/Pl7NjmCRDa,Azerbaijan,Russian,2015-06-26 06:12:00,2015-06-26 06:12:00,491,46778,3358,,0
NovostiSmr,"АвтоВАЗ ""утилизировал"" 53 тыс. машин http://t.co/2Z88mdYxam",Azerbaijan,Russian,2015-06-26 07:54:00,2015-06-26 07:54:00,491,46788,3362,,0
NovostiSmr,Самарская Фабрика-кухня получит на реконструкцию 400 млн рублей от Минфина http://t.co/H5px7JZwf2,Azerbaijan,Russian,2015-06-26 08:10:00,2015-06-26 08:10:00,491,46789,3363,,0
NovostiSmr,В Самарской области будут судить мошенника-альфонса из Удмуртии http://t.co/ruBbTw170O,Azerbaijan,Russian,2015-06-26 09:35:00,2015-06-26 09:37:00,491,46787,3366,,0
NovostiSmr,АвтоВАЗ не будет выплачивать дивиденды http://t.co/CxZD5pwuRl,Azerbaijan,Russian,2015-06-26 11:01:00,2015-06-26 11:01:00,491,46788,3370,,0
NovostiSmr,В самарском Струковском саду состоится костюмированный бал  http://t.co/nl9f5Pc1VA http://t.co/AdbtjbSrsh,Azerbaijan,Russian,2015-06-26 11:21:00,2015-06-26 11:22:00,491,46788,3371,,0
NovostiSmr,В Госдуме предлагают ввести контрсанкции против Coca-Cola и Pepsi http://t.co/2MhOov1HHC,Azerbaijan,Russian,2015-06-26 11:57:00,2015-06-26 11:58:00,491,46787,3373,,0
NovostiSmr,В России «Макдоналдс» ввел Wi-Fi по паспорту http://t.co/HphMbz7w3b,Azerbaijan,Russian,2015-06-26 14:36:00,2015-06-26 14:36:00,491,46787,3377,,0
NovostiSmr,Водитель Chevrolet уснул за рулем и врезался в МАЗ: 2 человека погибли http://t.co/u5S43CvtUE,Azerbaijan,Russian,2015-06-27 14:19:00,2015-06-27 14:19:00,492,46775,3391,,0
NovostiSmr,"В Самаре столкнулись «Хонда» и «Приора»: пострадали 7 человек, есть фото http://t.co/4osUHe4H4w",Azerbaijan,Russian,2015-06-27 19:34:00,2015-06-27 19:34:00,492,46775,3392,,0
NovostiSmr,В Самарской области столкнулись «Daewoo» и «Volkswagen»: пострадали 4 человека http://t.co/83VwwvXDcQ,Azerbaijan,Russian,2015-06-28 08:32:00,2015-06-28 08:33:00,492,46771,3395,,0
NovostiSmr,Продавцы Леруа Мерлен Самара устроили флеш-моб прямо в магазине http://t.co/imBQYiUMIX,Azerbaijan,Russian,2015-06-28 09:34:00,2015-06-28 09:34:00,492,46772,3396,,0
NovostiSmr,"Ян Муха покинул ""Крылья Советов"" http://t.co/KDOxTIJ61R",Azerbaijan,Russian,2015-06-29 05:53:00,2015-06-29 05:53:00,492,46896,3402,,0
NovostiSmr,"Клиенты ""Билайн"" Бизнес первыми в России смогут приобрести новую модель SIP-DECT телефона от Panasonic http://t.co/W1iMfkAvyw",Azerbaijan,Russian,2015-06-29 07:47:00,2015-06-29 07:47:00,492,46897,3407,,0
NovostiSmr,Проект создания Chevrolet Niva-2 могут возобновить http://t.co/h011SBYHaO,Azerbaijan,Russian,2015-06-29 11:15:00,2015-06-29 11:15:00,492,46899,3414,,0
NovostiSmr,Vueling начала летать из Самары в Барселону http://t.co/h2Rmm6ne9S,Azerbaijan,Russian,2015-06-29 11:28:00,2015-06-29 11:28:00,492,46899,3415,,0
NovostiSmr,Самарские спортсмены по итогам I Европейских игр завоевали 9 медалей http://t.co/wmPulstOX9 http://t.co/zbNE8cbFH3,Azerbaijan,Russian,2015-06-29 13:00:00,2015-06-29 13:00:00,492,46898,3419,,0
NovostiSmr,"Банк ""Солидарность"" увеличил капитал на 1000% http://t.co/c0syXV7NOT",Azerbaijan,Russian,2015-06-29 13:41:00,2015-06-29 13:41:00,492,46896,3422,,0
NovostiSmr,Интернет-библиотека «Флибуста» заблокирована Роскомнадзором http://t.co/CfPnQP6cC2,Azerbaijan,Russian,2015-06-29 14:41:00,2015-06-29 14:41:00,492,46896,3424,,0
NovostiSmr,АвтоВАЗ намерен занять 30% российского рынка автомобилей http://t.co/OdGh5wgDPE,Azerbaijan,Russian,2015-06-30 07:28:00,2015-06-30 07:28:00,492,46944,3433,,0
NovostiSmr,Мария Шарапова попала в топ-100 богатейших знаменитостей по версии Forbes http://t.co/mRnhjSFqP9,Azerbaijan,Bulgarian,2015-06-30 09:02:00,2015-06-30 09:02:00,492,46946,3437,,0
NovostiSmr,«Роснефть» купила «САНОРС» за $300 млн http://t.co/mZsUq13zjD,Azerbaijan,Ukrainian,2015-06-30 10:26:00,2015-06-30 10:26:00,492,46946,3440,,0
NovostiSmr,Lada предпочитают больше в Москве и Московской области http://t.co/4yQiATdhvY,Azerbaijan,Russian,2015-06-30 11:03:00,2015-06-30 11:03:00,526,46946,3441,,0
NovostiSmr,Из-за аномальной жары в Самаре могут сократить рабочий день http://t.co/WXBqfnIxCm http://t.co/GF54AkK0ag,Azerbaijan,Russian,2015-06-30 13:00:00,2015-06-30 13:00:00,791,46950,3445,,0
NovostiSmr,Nissan опроверг данные о выпуске новых моделей на ИжАвто http://t.co/wyNpB86x3T,Azerbaijan,Russian,2015-06-30 20:05:00,2015-06-30 20:05:00,789,46951,3452,,0
NovostiSmr,МВФ официально подтвердил: В Греции - дефолт http://t.co/bFlv3lIFHE,Azerbaijan,Russian,2015-07-01 07:42:00,2015-07-01 07:43:00,788,46950,3458,,0
NovostiSmr,"""Аком"" хочет построить завод за 1,2 млрд рублей http://t.co/Q32AqoYXzh",Azerbaijan,Russian,2015-07-01 09:36:00,2015-07-01 09:37:00,787,46948,3463,,0
NovostiSmr,"У ""Джи Эм АвтоВАЗ"" новый совет директоров http://t.co/9wvBpbz7pG",Azerbaijan,Russian,2015-07-01 11:27:00,2015-07-01 11:27:00,787,46948,3466,,0
NovostiSmr,В начале осени Skoda Superb третьего поколения появится в России http://t.co/TeryRFFm6N,Azerbaijan,Russian,2015-07-01 12:05:00,2015-07-01 12:05:00,787,46948,3467,,0
NovostiSmr,Задержание Владимира Сюсина: новые подробности http://t.co/aPl0ncotIa,Azerbaijan,Russian,2015-07-01 12:36:00,2015-07-01 12:37:00,787,46949,3469,,0
NovostiSmr,В «Парк Хаусе» детям бесплатно покажут спектакль «Гуси-лебеди» и устроят праздник  http://t.co/Xv4rqaSLoT http://t.co/FvsOuczlRI,Azerbaijan,Russian,2015-07-01 13:00:00,2015-07-01 13:00:00,787,46949,3470,,0
NovostiSmr,Самарские пешеходы не хотят светиться на загородных трассах  http://t.co/NYMIBcdH1m http://t.co/HyFCm4u3jo,Azerbaijan,Russian,2015-07-01 16:00:00,2015-07-01 16:00:00,786,46951,3476,,0
NovostiSmr,Смартфоны и интернет негативно влияют на память человека http://t.co/eWQz0Z05km,Azerbaijan,Russian,2015-07-02 08:13:00,2015-07-02 08:13:00,786,46951,3487,,0
NovostiSmr,Mitsubishi сократит производство в РФ более чем вдвое http://t.co/bJhhFJ25SH,Azerbaijan,Russian,2015-07-02 16:25:00,2015-07-02 16:25:00,786,46947,3501,,0
NovostiSmr,YotaPhone 2 начал продаваться в сетях «МегаФона» http://t.co/X65GWURMbH,Azerbaijan,Russian,2015-07-02 17:54:00,2015-07-02 17:54:00,786,46946,3502,,0
NovostiSmr,"""Крылья Советов"" лишились форварда http://t.co/1faE56ziXL",Azerbaijan,Uzbek,2015-07-03 05:58:00,2015-07-03 05:59:00,786,46940,3505,,0
NovostiSmr,Немецкие ученые встроят в смартфон тест на диабет и беременность http://t.co/6xrxExaulX,Azerbaijan,Russian,2015-07-03 12:15:00,2015-07-03 12:15:00,786,46937,3521,,0
NovostiSmr,В Самарской области стартовал Грушинский фестиваль http://t.co/1bi9KIvfX4 http://t.co/5sLgQkXrJu,Azerbaijan,Russian,2015-07-03 16:00:00,2015-07-03 16:00:00,786,46935,3527,,0
NovostiSmr,Casio выпустит смарт-часы в марте 2016 года http://t.co/MdTj285DFC,Azerbaijan,Russian,2015-07-03 16:30:00,2015-07-03 16:30:00,786,46935,3529,,0
NovostiSmr,"Учёные: Вселенная оказалась более пустой, чем предполагалось http://t.co/frjzuncQpg",Azerbaijan,Russian,2015-07-04 10:39:00,2015-07-04 10:40:00,786,46926,3533,,0
NovostiSmr,В Самаре пройдёт второй Фестиваль красок  http://t.co/aiH2MGgCz4 http://t.co/dtlSGBRbQB,Azerbaijan,Russian,2015-07-05 13:00:00,2015-07-05 13:00:00,786,46938,3544,,0
NovostiSmr,Грушинский фестиваль сняли на видео с высоты птичьего полёта  http://t.co/bhju0qycvl http://t.co/ab20J3DWhc,Azerbaijan,Russian,2015-07-05 16:00:00,2015-07-05 16:00:00,786,46940,3546,,0
NovostiSmr,"Лучший бомбардир в истории российского футбола может сыграть за ""Крылья Советов"" http://t.co/OSsAWfXxi5",Azerbaijan,Russian,2015-07-06 07:13:00,2015-07-06 07:13:00,786,47355,3551,,0
NovostiSmr,"""Гринпис"" потребовала восстановить площадь заповедника ""Самарская лука"" http://t.co/KDj8qgpgrb",Azerbaijan,Russian,2015-07-06 11:04:00,2015-07-06 11:04:00,786,47519,3558,,0
NovostiSmr,АвтоВАЗ начал делать двигатели для  Lada Vesta http://t.co/s0wuvkB2V8,Azerbaijan,Russian,2015-07-06 11:30:00,2015-07-06 11:30:00,786,47520,3559,,0
NovostiSmr,Для птицефабрики построят мощную подстанцию за 250 млн рублей http://t.co/1o8vJe9UOQ,Azerbaijan,Ukrainian,2015-07-06 13:00:00,2015-07-06 13:01:00,786,47775,3564,,0
NovostiSmr,"В блогах: 6 июля 2002 года ""Крылья Советов"" дебютировали в Европе http://t.co/HUtXzcmAJh",Azerbaijan,Russian,2015-07-06 14:31:00,2015-07-06 14:31:00,786,47882,3568,,0
NovostiSmr,Продажи спецверсии Lada 4x4 стартуют этим летом http://t.co/aj0ngglXFc,Azerbaijan,Russian,2015-07-06 15:38:00,2015-07-06 15:38:00,786,47915,3569,,0
NovostiSmr,Режим ЧС введен на территории четырех районов Самарской области http://t.co/dFkF834eul http://t.co/CD9Pj7gB0L,Azerbaijan,Russian,2015-07-06 16:00:00,2015-07-11 15:57:00,1367,48448,3677,,0
NovostiSmr,"""Билайн"" устроит соревнования по мобильным играм на самом стильном фестивале лета - GesFest http://t.co/7wtnAjGDmU",Azerbaijan,Russian,2015-07-07 05:06:00,2015-07-07 05:06:00,786,47907,3574,,0
NovostiSmr,АвтоВАЗ поддержит молодых http://t.co/wIqf89k8aD,Azerbaijan,Russian,2015-07-07 06:25:00,2015-07-07 06:26:00,786,47906,3576,,0
NovostiSmr,Скоро будет презентован гигантский iPad Pro от Apple http://t.co/OplfTWYUv8,Azerbaijan,Russian,2015-07-07 09:46:00,2015-07-07 09:46:00,786,47905,3585,,0
NovostiSmr,"""Крылья Советов"" завершили победой первый зарубежный сбор http://t.co/p01yxHRga5",Azerbaijan,Russian,2015-07-08 09:10:00,2015-07-08 09:10:00,887,48594,3605,,0
NovostiSmr,АвтоВАЗу не удалось локализовать производство на 90% http://t.co/O4S5gn3ge6,Azerbaijan,Russian,2015-07-08 11:55:00,2015-07-08 11:56:00,980,48597,3611,,0
NovostiSmr,СКС переложат трубы в Самаре http://t.co/beRPaAcDd1,Azerbaijan,Ukrainian,2015-07-08 13:59:00,2015-07-08 14:01:00,980,48606,3615,,0
NovostiSmr,«Яндекс» приобрел два электрокара Tesla для своего такси http://t.co/RvjNf408yk,Azerbaijan,Ukrainian,2015-07-08 17:53:00,2015-07-08 17:53:00,980,48694,3619,,0
NovostiSmr,"Произведения «старых мастеров» принесли Sotheby’s 39,3 млн http://t.co/7Rx8syzR17",Azerbaijan,Russian,2015-07-09 10:01:00,2015-07-09 10:01:00,978,48720,3630,,0
NovostiSmr,Hyundai отзывает 140 тыс. авто из-за дефектов ремней безопасности http://t.co/euHVcSUsbm,Azerbaijan,Russian,2015-07-09 10:57:00,2015-07-09 10:58:00,978,48721,3632,,0
NovostiSmr,300 выпускников СГЭУ получили красные дипломы http://t.co/mZ3GuMPxd7,Azerbaijan,Russian,2015-07-09 11:56:00,2015-07-09 11:58:00,978,48721,3634,,0
NovostiSmr,АвтоВАЗ решил проблему с поставкой сидений http://t.co/0ityDxMaFV,Azerbaijan,Russian,2015-07-10 12:49:00,2015-07-10 12:49:00,979,48424,3663,,0
NovostiSmr,Lada 4x4 добралась до западной вершины Эльбруса http://t.co/m8PQHVl5o6,Azerbaijan,Russian,2015-07-11 09:37:00,2015-07-11 09:37:00,1368,48430,3672,,0
NovostiSmr,"В Тольятти «Ниссан» намотало на дерево: водитель погиб, трое пострадало http://t.co/pw88sobcHj",Azerbaijan,Russian,2015-07-12 15:59:00,2015-07-12 15:59:00,1367,48450,3682,,0
NovostiSmr,"""Крылья Советов"" уступили ЦСКА в последнем матче межсезонья http://t.co/kSLO64yvai",Azerbaijan,Russian,2015-07-13 05:42:00,2015-07-13 05:42:00,1367,48450,3686,,0
NovostiSmr,"""Крылья Советов"" заявили 16 игроков http://t.co/rPal7ozSrO",Azerbaijan,Russian,2015-07-13 06:19:00,2015-07-13 06:20:00,1367,48450,3687,,0
NovostiSmr,Прототип LADA XRAY проходит испытания на дорогах Тольятти http://t.co/wA3dWW0icv,Azerbaijan,Russian,2015-07-13 09:27:00,2015-07-13 09:27:00,1367,48449,3694,,0
NovostiSmr,3D-принтер научили печатать объекты из дерева http://t.co/mBfwpXUDmP,Azerbaijan,Russian,2015-07-13 09:58:00,2015-07-13 09:58:00,1367,48448,3696,,0
NovostiSmr,"С ""Билайн"" из Тольятти - в Сочи http://t.co/E9CGSHU1wC",Azerbaijan,Russian,2015-07-14 05:54:00,2015-07-14 05:54:00,1367,48468,3710,,0
NovostiSmr,Смартфоны Samsung смогут определять долю жировой ткани http://t.co/Nd7VZZG7ui,Azerbaijan,Russian,2015-07-14 08:50:00,2015-07-14 08:50:00,1367,48468,3717,,0
NovostiSmr,Компания Samsung начала разработку дисплея с разрешением 11K http://t.co/Bq7P4iz8Yt,Azerbaijan,Russian,2015-07-14 09:46:00,2015-07-14 09:48:00,1367,48468,3719,,0
NovostiSmr,"В блогах: GES FEST - 2015, взгляд наркоконтроля http://t.co/S29CerQ9NG",Azerbaijan,Ukrainian,2015-07-14 15:35:00,2015-07-14 15:35:00,1367,48472,3728,,0
NovostiSmr,АвтоВАЗ перераспределил заказы с АвтоВАЗагрегата по другим поставщикам http://t.co/5se2iVdHHx,Azerbaijan,Bulgarian,2015-07-15 05:44:00,2015-07-15 05:44:00,1367,48577,3731,,0
NovostiSmr,Disney снимет полнометражный приквел к мультфильму «Аладдин» http://t.co/HkbyopC6vL,Azerbaijan,Russian,2015-07-16 08:23:00,2015-07-16 08:23:00,1367,47555,3760,,0
NovostiSmr,Станция New Horizons увидела «Мордор» на Хароне http://t.co/vGL1zdMGqQ,Azerbaijan,Russian,2015-07-16 08:57:00,2015-07-16 08:57:00,1367,47555,3761,,0
NovostiSmr,В новом iPod touch от Apple есть камера для селфи http://t.co/OGq0VOSzc4,Azerbaijan,Ukrainian,2015-07-16 09:54:00,2015-07-16 09:54:00,1367,47553,3763,,0
NovostiSmr,Ресторанная еда идентична фаст-фуду http://t.co/lkWGvITubf,Azerbaijan,Russian,2015-07-16 14:52:00,2015-07-16 14:52:00,1367,47574,3775,,0
NovostiSmr,"""Крылья Советов"" подписали Берата Садика http://t.co/9Mxejd9xGQ",Azerbaijan,Macedonian,2015-07-17 11:09:00,2015-07-17 11:09:00,1167,47591,3793,,0
NovostiSmr,Металлурги АвтоВАЗа написали письмо Бу Андерссону http://t.co/Au1p5Zocmh,Azerbaijan,Bulgarian,2015-07-17 12:54:00,2015-07-17 12:55:00,1167,47593,3795,,0
NovostiSmr,"В Самаре построят три узла, которые соединят электричку и городской транспорт  http://t.co/9ms4nQgpBB http://t.co/EaKzFai2Jv",Azerbaijan,Russian,2015-07-17 13:00:00,2015-07-17 13:00:00,1167,47593,3796,,0
NovostiSmr,Вторая «пилотная» партия «LADA XRAY» выйдет в октябре http://t.co/iAWAoxSSTa http://t.co/esyV1yx5dK,Azerbaijan,Russian,2015-07-18 16:00:00,2015-07-18 16:01:00,985,47593,3811,,0
NovostiSmr,"""Крылья Советов"" обыграли ""Анжи"" http://t.co/BvMbnehZ5F",Azerbaijan,Russian,2015-07-20 05:38:00,2015-07-20 05:38:00,485,47583,3823,,0
NovostiSmr,"Первый зампредседателя самарского ""Динамо"" ""увел"" от налоговой 1,5 млн рублей http://t.co/A8Sgc5IKf6",Azerbaijan,Russian,2015-07-20 11:04:00,2015-07-20 11:04:00,485,47580,3834,,0
NovostiSmr,На видео снят новый внедорожник Mercedes-Benz GLS 2016 http://t.co/syRurb2Vam,Azerbaijan,Russian,2015-07-20 12:13:00,2015-07-20 12:13:00,485,47580,3836,,0
NovostiSmr,Общественную организацию «Динамо» подозревают в уклонении от уплаты налогов http://t.co/pQyKzl2udE,Azerbaijan,Russian,2015-07-20 13:44:00,2015-07-20 13:44:00,485,47580,3839,,0
NovostiSmr,«Крылья Советов» начали сезон с победой над «Анжи»  http://t.co/z6mAeZw2dk http://t.co/5ICN8qtGHY,Azerbaijan,Russian,2015-07-20 16:00:00,2015-07-20 16:00:00,485,47582,3843,,0
NovostiSmr,Инженеры Рено вернулись на АвтоВАЗ http://t.co/z6KqfM0CNh,Azerbaijan,Russian,2015-07-21 10:32:00,2015-07-21 10:32:00,486,47574,3855,,0
NovostiSmr,Россияне начали больше платить за интернет-контент http://t.co/UwGFh6J0j5,Azerbaijan,Russian,2015-07-21 10:37:00,2015-07-21 10:38:00,486,47574,3856,,0
NovostiSmr,АвтоВАЗ заставит своих дилеров сменить имидж http://t.co/UPSluOYKHo,Azerbaijan,Russian,2015-07-21 11:29:00,2015-07-21 11:30:00,486,47573,3857,,0
NovostiSmr,Названа дата начала официальных продаж Apple Watch в России http://t.co/klJYUxR9fO,Azerbaijan,Russian,2015-07-21 11:34:00,2015-07-21 11:34:00,486,47573,3858,,0
NovostiSmr,Майли Сайрус будет ведущей церемонии MTV Video Music Awards http://t.co/XoFZHxy1tp,Azerbaijan,Russian,2015-07-21 12:05:00,2015-07-21 12:06:00,486,47573,3859,,0
NovostiSmr,АвтоВАЗ может получить на программу утилизации еще 4 млрд рублей http://t.co/jhYiai0hxo,Azerbaijan,Russian,2015-07-21 14:39:00,2015-07-21 14:39:00,486,47569,3864,,0
NovostiSmr,Сервисы Apple перестали работать по всему миру http://t.co/b0d5cGOuqF,Azerbaijan,Russian,2015-07-21 19:28:00,2015-07-21 19:29:00,486,47569,3867,,0
NovostiSmr,Самарские чиновники будут ездить на машинах АвтоВАЗа http://t.co/cmZGDcOe7Y,Azerbaijan,Russian,2015-07-22 06:52:00,2015-07-22 06:52:00,486,47568,3870,,0
NovostiSmr,Подержанный суперкар Koenigsegg Agera R продается за 1 млн 980 тыс. евро http://t.co/tYt7lPScjv,Azerbaijan,Russian,2015-07-22 11:57:00,2015-07-22 11:57:00,486,47568,3882,,0
NovostiSmr,Минюст решил исключить «Голос» из реестра иностранных агентов http://t.co/vbke460knL,Azerbaijan,Russian,2015-07-22 17:53:00,2015-07-22 17:54:00,486,47561,3890,,0
NovostiSmr,"Разрешите представиться: мобильный интернет ""Билайн"" http://t.co/hOLUT1H9Ye",Azerbaijan,Russian,2015-07-23 05:39:00,2015-07-23 05:39:00,486,47603,3892,,0
NovostiSmr,Студенты СГАУ и СамГУ получат диплом объединенного вуза http://t.co/CLSTcWjdTY,Azerbaijan,Russian,2015-07-23 11:08:00,2015-07-23 11:10:00,486,47599,3901,,0
NovostiSmr,АвтоВАЗ собирается выпустить 250 тыс. автомобилей http://t.co/C0fvGyc4w8,Azerbaijan,Russian,2015-07-24 14:21:00,2015-07-24 14:21:00,486,47593,3933,,0
NovostiSmr,"""Билайн"" в Самаре проводит квест для детей о безопасности в социальных сетях http://t.co/HM1NXBiw51",Azerbaijan,Russian,2015-07-27 06:08:00,2015-07-27 06:08:00,486,47592,3956,,0
NovostiSmr,Через три года Mercedes-Benz выпустит элитный внедорожник http://t.co/vKITDtjJKt,Azerbaijan,Russian,2015-07-27 08:37:00,2015-07-27 08:37:00,486,47589,3961,,0
NovostiSmr,Шпионский смартфон Джеймса Бонда Sony Xperia Z5 представят осенью http://t.co/YkSKMIevYN,Azerbaijan,Bulgarian,2015-07-27 11:06:00,2015-07-27 11:06:00,486,47588,3967,,0
NovostiSmr,Билайн может купить саратовский СМАРТС http://t.co/pG3VhZ8ZIv,Azerbaijan,Russian,2015-07-28 12:39:00,2015-07-28 12:39:00,486,47649,3995,,0
NovostiSmr,Серийный выпуск новой Chevrolet Niva начнут в 2016 году http://t.co/NrAW8S54lX,Azerbaijan,Russian,2015-07-30 06:50:00,2015-07-30 06:50:00,486,48722,4028,,0
NovostiSmr,АвтоВАЗ поднимает цены на Lada http://t.co/ksjUQ5md9j,Azerbaijan,Russian,2015-07-30 10:44:00,2015-07-30 10:44:00,486,48943,4035,,0
NovostiSmr,"Microsoft успокоил пользователей: ""Косынка"" останется бесплатной http://t.co/lKQkbLXSHH",Azerbaijan,Russian,2015-07-30 12:58:00,2015-07-30 12:58:00,486,48942,4039,,0
NovostiSmr,Вышла 2-я часть игры Angry Birds http://t.co/0hRKPzhgqx,Azerbaijan,Russian,2015-07-30 13:56:00,2015-07-30 13:56:00,486,48942,4041,,0
NovostiSmr,Дворовые команды Тольятти сыграют в футбол http://t.co/vnRBLCl5zF,Azerbaijan,Russian,2015-07-30 14:01:00,2015-07-30 14:01:00,486,48942,4042,,0
