author_id,content,region,language,publish_date,harvested_date,following,followers,updates,post_type,retweet
NovostiSmr,Renault может вернуть на российский рынок старый Logan под маркой «Москвич» https://t.co/e8eQfJn8s5,Unknown,Russian,2015-12-21 04:37:00,2015-12-21 04:37:00,433,40686,6217,,0
NovostiSmr,Под Самарой в столкновении Hyundai и Daewoo погибла 40-летняя автоледи https://t.co/dBYaeiuPHh,Unknown,Russian,2015-12-21 05:46:00,2015-12-21 05:46:00,433,40686,6218,,0
NovostiSmr,Lada 4x4 Urban выходит на рынок Европы в Германии https://t.co/lFcTFys7Ps,Unknown,Russian,2015-12-21 12:28:00,2015-12-21 12:28:00,433,40683,6226,,0
NovostiSmr,В «Газпром нефти» предрекают возвращение цен на нефть к $90-100 https://t.co/NQ3OHsYFHz,Unknown,Russian,2015-12-22 04:53:00,2015-12-22 10:56:00,433,40685,6238,,0
NovostiSmr,В Будапеште открылся первый автосалон Lada https://t.co/Kl6KvISxY6,Unknown,Russian,2015-12-22 11:34:00,2015-12-22 11:35:00,433,40685,6240,,0
NovostiSmr,Самарская губернская дума приглашает на юридические консультации https://t.co/7c9fuSokHQ,Unknown,Russian,2015-12-22 13:05:00,2015-12-22 14:11:00,433,40683,6242,,0
NovostiSmr,Учеными найдены аномалии в структуре мозга заядлых геймеров https://t.co/leKmGCfqA4,Unknown,Russian,2015-12-23 02:55:00,2015-12-23 02:56:00,433,40682,6248,,0
NovostiSmr,На Новый год - 2016 общественный транспорт в Самаре будет работать до утра https://t.co/ZMYdSgjCyO,Unknown,Russian,2015-12-23 07:37:00,2015-12-23 07:37:00,433,40680,6250,,0
NovostiSmr,Ученые разработали тест на зависимость от Facebook https://t.co/4I5seu96S7,Unknown,Russian,2015-12-24 05:50:00,2015-12-24 05:50:00,433,40678,6263,,0
NovostiSmr,"если вас бесплатно кормят, поят, учат, лечат и одевают и при этом на дворе не коммунизм, значит, на дворе плац",Unknown,Russian,2015-12-24 16:22:00,2015-12-24 16:22:00,433,40676,6275,R,1
NovostiSmr,"Тон-новости дня: новая KIA, ядерные удары по Куйбышеву, Иванец проведет новый год в СИЗО https://t.co/9w6GRUh5se",Unknown,Russian,2015-12-24 19:49:00,2015-12-24 19:49:00,433,40675,6276,,0
NovostiSmr,58-летний водитель на BMW перевернулся в Безенчукском районе https://t.co/8OaFpiNLtD,Unknown,Russian,2015-12-25 09:15:00,2015-12-25 09:15:00,433,40674,6282,,0
NovostiSmr,"Директор кафе, избивший самарцев за разбитый стакан, получил 2 года ""строгача"" https://t.co/QVjkWi6XKc",Unknown,Russian,2015-12-25 09:33:00,2015-12-25 09:34:00,433,40674,6283,,0
NovostiSmr,"Тольяттинская ""Лада"" обыграла хабаровский ""Амур"" https://t.co/y6VqScjhLg",Unknown,Russian,2015-12-28 05:43:00,2015-12-28 05:43:00,432,40645,6308,,0
NovostiSmr,АвтоВАЗ создал спецавтомобиль Lada Vesta для полиции https://t.co/PujVbXJqGr,Unknown,Russian,2015-12-28 07:54:00,2015-12-28 07:54:00,432,40644,6310,,0
NovostiSmr,"Самарец, убивший болельщика ФК ""Спартак"": ""Я оборонялся!"" https://t.co/Ha7oO1vtLB",Unknown,Russian,2015-12-28 11:57:00,2015-12-28 11:57:00,432,40645,6315,,0
NovostiSmr,АвтоВАЗ покидает вице-президент Денис Петрунин https://t.co/dqAKWT2sbu,Unknown,Russian,2015-12-28 14:56:00,2015-12-28 14:56:00,432,40643,6319,,0
NovostiSmr,У АвтоВАЗа опять сменился вице-президент https://t.co/bYoF49nfwY,Unknown,Russian,2015-12-28 15:35:00,2015-12-28 15:35:00,432,40643,6320,,0
NovostiSmr,«Крылья Советов» получат из бюджета Самарской области 875 млн рублей в 2016 году https://t.co/vTDqrtDDjW,Unknown,Russian,2015-12-29 03:46:00,2015-12-29 03:46:00,432,40663,6324,,0
NovostiSmr,В Тольятти автоледи на BMW Х6 сбила на переходе пенсионерку и скрылась https://t.co/uBVrXqmVAY,Unknown,Russian,2015-12-29 09:48:00,2015-12-29 09:48:00,432,40663,6332,,0
NovostiSmr,Роспотребнадзор перечислил самые распространенные жалобы россиян в 2016 году https://t.co/K3UyRy9OSy,Unknown,Russian,2015-12-29 11:13:00,2015-12-29 11:13:00,432,40663,6334,,0
NovostiSmr,Автомобили каких компаний подорожают в РФ с 1 января 2016 года https://t.co/KnUukUy7NW,Unknown,Russian,2015-12-30 04:24:00,2015-12-30 04:25:00,432,40662,6340,,0
NovostiSmr,СМИ сообщили о запуске Netflix в России в январе 2016 года https://t.co/S3z9ralwea,Unknown,Russian,2015-12-30 05:36:00,2015-12-30 05:36:00,432,40661,6341,,0
NovostiSmr,ЦБ в 2016 году изменит дизайн выпускаемых монет https://t.co/kmMkqzgN7G,Unknown,Russian,2015-12-30 09:33:00,2015-12-30 09:33:00,432,40661,6346,,0
NovostiSmr,В Самарской области ликвидировали очередь в детсады https://t.co/ODhoDIke77,Unknown,Russian,2015-12-30 10:17:00,2015-12-30 10:17:00,432,40661,6347,,0
NovostiSmr,Самому компактному кроссоверу Cadillac дан «зеленый свет» https://t.co/tnGsSb1ZfD,Unknown,Russian,2015-12-30 11:03:00,2015-12-30 11:03:00,432,40661,6348,,0
NovostiSmr,"Топ-новости: найден телефон XIII века, фото новой Nexia, рождение четверни в Тольятти https://t.co/OlPMfqoJAa",Unknown,Russian,2015-12-30 17:13:00,2015-12-30 17:13:00,431,40661,6355,,0
NovostiSmr,"Статистика: Население Земли 1 января 2016 года достигнет почти 7,3 млрд человек https://t.co/z6eejuzkc7",Unknown,Russian,2015-12-31 06:39:00,2015-12-31 06:39:00,431,40660,6358,,0
NovostiSmr,Редакция Вестников поздравляет всех с Новым Годом! Мы хорошо поработали для Вас в 2015. Ждите новых проектов в 2016! https://t.co/Hk1R36wyIQ,Unknown,Russian,2015-12-31 12:03:00,2015-12-31 12:03:00,431,40660,6362,R,1
NovostiSmr,12 человек погибли за 3 новогодних дня на пожарах в Самаре и области https://t.co/4c4cUazs2F,Unknown,Ukrainian,2016-01-03 15:04:00,2016-01-04 08:22:00,431,40649,6375,,0
NovostiSmr,BMW планирует новые плагин-гибридные версии 530e и 540e для 5-Series https://t.co/TVzcrQjD38,Unknown,Russian,2016-01-05 14:18:00,2016-01-05 14:18:00,431,40643,6380,,0
NovostiSmr,Николай Меркушкин: Самарская митрополия вносит большой вклад в укрепление межнационального и межконфессиональн... https://t.co/obD36Z9s0g,Unknown,Russian,2016-01-07 06:00:00,2016-01-07 06:00:00,431,40640,6385,,0
NovostiSmr,На самарской обводной дороге столкнулись «Hyundai» и грузовик: погибла женщина https://t.co/wSbf5hUknf,Unknown,Russian,2016-01-07 06:20:00,2016-01-07 06:20:00,431,40640,6386,,0
NovostiSmr,"В Самарской области пьяные босоногие парни украли из «Газели» магнитолу, колонки и кресло https://t.co/I2snCXlIVA",Unknown,Russian,2016-01-10 15:59:00,2016-01-11 04:53:00,432,40628,6406,,0
NovostiSmr,Завод Hyundai в Питере будет выпускать новый кроссовер https://t.co/v65hWbVLgY,Unknown,Russian,2016-01-11 05:06:00,2016-01-11 05:06:00,432,40628,6407,,0
NovostiSmr,Lada продолжит участвовать в программе утилизации и схеме https://t.co/ZVoN0GrcJY,Unknown,Russian,2016-01-11 05:48:00,2016-01-11 05:48:00,432,40629,6408,,0
NovostiSmr,Московская полиция разыскивает участников флешмоба «В метро без штанов» https://t.co/l74mXBOHy4,Unknown,Russian,2016-01-11 13:25:00,2016-01-11 13:25:00,432,40626,6419,,0
NovostiSmr,Появились изображения полноприводного гибрида Kia Niro HUV https://t.co/6Y7ESaQOx5,Unknown,Russian,2016-01-12 11:42:00,2016-01-12 11:42:00,432,40623,6434,,0
NovostiSmr,В Самаре подожгли Nissan Pathfinder  члена правления Союза десантников https://t.co/f25LYqKygC,Unknown,Russian,2016-01-12 13:22:00,2016-01-12 13:23:00,432,40623,6436,,0
NovostiSmr,В Сызрани в новогодние каникулы родился 5-килограммовый мальчик https://t.co/Sn4FQRflFC,Unknown,Russian,2016-01-12 21:24:00,2016-01-12 21:24:00,432,40621,6440,,0
NovostiSmr,Skoda празднует рекорды и анонсирует кроссовер для 2016 года https://t.co/JjAuh27tCC,Unknown,Russian,2016-01-13 09:53:00,2016-01-13 09:53:00,432,40621,6448,,0
NovostiSmr,"Топ-новости: подросток упал с балкона, рекорды Skoda, Плутон может стать обитаемой планетой-океаном https://t.co/IJuoW8Opxj",Unknown,Russian,2016-01-13 19:36:00,2016-01-13 19:37:00,431,40619,6456,,0
NovostiSmr,У АвтоВАЗа не сбылись планы https://t.co/WIvTVFEOo2,Unknown,Ukrainian,2016-01-15 06:49:00,2016-01-15 06:49:00,431,40612,6480,,0
NovostiSmr,"В Доме-музее Ленина – ""Девочка, барышня, дама"" https://t.co/YidZFtAgXq",Unknown,Serbian,2016-01-15 14:58:00,2016-01-15 15:09:00,431,40610,6489,,0
NovostiSmr,В Курумоче совершил аварийную посадку самолет Boeing 737 с поломкой двигателя https://t.co/WAcqLiMFVU,Unknown,Russian,2016-01-16 08:49:00,2016-01-16 08:49:00,431,40607,6491,,0
NovostiSmr,"В Самарской области женщина зарезала мужа и скрылась, бросив тело в квартире https://t.co/U7ff1eMjSW",Unknown,Russian,2016-01-16 14:12:00,2016-01-16 14:18:00,431,40607,6494,,0
NovostiSmr,Госавтоинспекция о самостоятельном оформлении ДТП https://t.co/4ZdbBdrOvW,Unknown,Russian,2016-01-17 05:25:00,2016-01-17 07:29:00,431,40605,6496,,0
NovostiSmr,Замглавы Безенчукского района имеет судимость https://t.co/n2s0ZC5nNJ,Unknown,Russian,2016-01-18 05:17:00,2016-01-18 05:52:00,431,40600,6504,,0
NovostiSmr,АвтоВАЗ вышел на работу https://t.co/pvSp2iYEY8,Unknown,Russian,2016-01-18 07:59:00,2016-01-18 07:59:00,431,40600,6506,,0
NovostiSmr,В Самаре обезврежена банда грабителей такси https://t.co/I8pxWMr85n,Unknown,Russian,2016-01-19 06:52:00,2016-01-19 06:52:00,431,40596,6520,,0
NovostiSmr,Продажи Lada XRay стартуют 15 февраля в 56 российских городах https://t.co/2mjU88KEyR,Unknown,Russian,2016-01-19 08:17:00,2016-01-19 08:17:00,431,40595,6522,,0
NovostiSmr,В Саратове мать выбросила новорожденного сына в мусорное ведро https://t.co/FBSFLg0Mss,Unknown,Russian,2016-01-20 05:41:00,2016-01-20 05:54:00,431,40587,6532,,0
NovostiSmr,Заслуженному тренеру СССР и России Вячеславу Архипову исполнилось 70 лет https://t.co/WAz71dQBZ5,Unknown,Russian,2016-01-20 09:29:00,2016-01-20 09:30:00,431,40587,6536,,0
NovostiSmr,В России 25 января стартует распродажа «Киберпонедельник-2016» https://t.co/vPI5dE0nUC,Unknown,Russian,2016-01-21 04:32:00,2016-01-21 04:33:00,431,40586,6543,,0
NovostiSmr,Владимир Путин ждет план празднования юбилея АвтоВАЗа до 1 июля https://t.co/dL24Kq6954,Unknown,Russian,2016-01-21 06:20:00,2016-01-21 06:23:00,431,40586,6545,,0
NovostiSmr,440 тыс. тонн молока произведено в Самарской области https://t.co/GNnm3IFJr2,Unknown,Russian,2016-01-22 11:03:00,2016-01-22 11:03:00,431,40580,6561,,0
NovostiSmr,Продажи нового седана Kia Optima стартуют 1 марта https://t.co/dRjJJtY6Dh,Unknown,Russian,2016-01-22 13:17:00,2016-01-22 13:17:00,431,40580,6563,,0
NovostiSmr,"В Самаре началась акция ""Опасный лед"" https://t.co/yIfUve1CMA",Unknown,Russian,2016-01-24 06:18:00,2016-01-24 06:19:00,431,40575,6570,,0
NovostiSmr,Apple планирует выпустить бюджетный iPhone https://t.co/DXwajIvodT,Unknown,Russian,2016-01-25 06:01:00,2016-01-25 06:03:00,431,40568,6578,,0
NovostiSmr,"Топ-новости: Аномальное похолодание в Самаре, онлайн-распродажа «Киберпонедельник», самая женская модель Subaru https://t.co/nEO82yS6HA",Unknown,Russian,2016-01-25 15:50:00,2016-01-25 15:51:00,432,40568,6588,,0
NovostiSmr,"В Самаре на капремонт Демократической потратят 341,5 млн рублей https://t.co/i3aDcCDIDB",Unknown,Russian,2016-01-27 09:09:00,2016-01-27 09:18:00,432,40564,6611,,0
NovostiSmr,"Топ-новости дня: уникальные снимки выбросов черной дыры, Volkswagen T-Cross, потоп в Самаре https://t.co/Yl3urpqbQp",Unknown,Russian,2016-01-27 17:02:00,2016-01-27 17:02:00,432,40561,6619,,0
NovostiSmr,Объявлена цена на Xray https://t.co/48S388NoN5,Unknown,Russian,2016-01-28 06:37:00,2016-01-28 06:37:00,432,40560,6623,,0
NovostiSmr,Первый турбированный Aston Martin DB11 засветился в интернете без камуфляжа https://t.co/kAERt0AkqO,Unknown,Russian,2016-01-28 08:34:00,2016-01-28 08:34:00,432,40559,6626,,0
NovostiSmr,"Каникулы в школах Оренбурга будут, несмотря на недельный карантин https://t.co/eqJT8RXpgw",Unknown,Russian,2016-01-28 10:02:00,2016-01-28 10:02:00,432,40560,6628,,0
NovostiSmr,"Из Самары можно будет улететь в Салоники, Бургас и Барселону https://t.co/2qhDDWMQdd",Unknown,Russian,2016-01-28 10:54:00,2016-01-28 16:22:00,432,40556,6634,,0
NovostiSmr,В Нижнем Новгороде мама продала своего ребенка через Интернет https://t.co/rpAAKxE5f9,Unknown,Russian,2016-01-28 11:36:00,2016-01-28 11:36:00,432,40559,6630,,0
NovostiSmr,Новый седан BMW 1-Series был замечен фотошпионами во время тестов https://t.co/pBj6Kckx7F,Unknown,Russian,2016-01-28 15:02:00,2016-01-28 15:02:00,432,40556,6634,,0
NovostiSmr,Nissan Sentra получит кузов хэтчбек и новую линейку двигателей https://t.co/8hf7zrhCi7,Unknown,Russian,2016-01-29 09:44:00,2016-01-29 09:44:00,432,40555,6643,,0
NovostiSmr,Компания Apple озадачилась созданием для своих гаджетов зарядки нового поколения https://t.co/ca48Mgn2bW,Unknown,Russian,2016-01-29 13:26:00,2016-01-29 13:26:00,432,40556,6647,,0
NovostiSmr,«Метида» наказана за розги на 208 000 рублей https://t.co/FJOvnoRow7,Unknown,Uzbek,2016-01-29 15:06:00,2016-01-29 15:07:00,432,40555,6649,,0
NovostiSmr,С 1 по 6 февраля все школы Самары закрываются на карантин по гриппу https://t.co/PKrRRmwolV,Unknown,Russian,2016-01-30 08:30:00,2016-01-30 08:41:00,432,40553,6653,,0
NovostiSmr,В феврале в РФ стартуют продажи ультрабюджетной версии LADA Priora https://t.co/T5Lvst0USv,Unknown,Russian,2016-02-01 04:58:00,2016-02-01 04:58:00,432,40553,6660,,0
NovostiSmr,В феврале в РФ стартуют продажи ультрабюджетной версии LADA Priora https://t.co/T5Lvst0USv,Unknown,Russian,2016-02-01 04:58:00,2016-02-01 04:58:00,432,40553,6660,,0
NovostiSmr,Jeep готовит к выпуску новейший компактный кроссовер https://t.co/A5kKxiaHyX,Unknown,Russian,2016-02-01 13:42:00,2016-02-01 13:42:00,432,40553,6669,,0
NovostiSmr,Заместитель гендиректора ТоАЗа избил человека? https://t.co/KRLI4qeMfh,Unknown,Russian,2016-02-01 15:24:00,2016-02-01 15:26:00,432,40553,6672,,0
NovostiSmr,"Топ-новости: Возле СГЭУ забил гейзер, школы закрыты на карантин, ультрабюджетная версия LADA Priora https://t.co/xCS7EaMay1",Unknown,Russian,2016-02-01 17:11:00,2016-02-01 17:11:00,432,40552,6673,,0
NovostiSmr,"Сурки Ева и Иван из самарского зоопарка предсказали, что весна в 2016 придет в срок, есть фото https://t.co/uxVPqVsxEO",Unknown,Russian,2016-02-02 20:26:00,2016-02-02 20:26:00,431,40550,6688,,0
NovostiSmr,300 самарцев уже поплатились за долги запретом на вождение https://t.co/zruofEfdDK,Unknown,Russian,2016-02-03 08:33:00,2016-02-03 09:53:00,431,40550,6696,,0
NovostiSmr,Суд обязал власти Жигулевска купить инвалидам квартиры https://t.co/hcrD6loB0Q,Unknown,Russian,2016-02-03 12:11:00,2016-02-03 12:13:00,431,40550,6700,,0
NovostiSmr,В блогах: Чистка крыши без страховки в Самаре https://t.co/hn5X1G0KDd,Unknown,Ukrainian,2016-02-04 05:31:00,2016-02-04 05:31:00,431,39959,6708,,0
NovostiSmr,"Почти 2,5 млн жителей Самарской области имеют право голоса https://t.co/vaWZKucRu6",Unknown,Russian,2016-02-04 06:40:00,2016-02-04 06:41:00,431,39959,6711,,0
NovostiSmr,Анатолий Пушков покинул АвтоВАЗ https://t.co/YJZy0BuTsh,Unknown,Russian,2016-02-04 10:12:00,2016-02-04 10:13:00,431,39959,6719,,0
NovostiSmr,"Топ-новости: миллионы под ТЦ, ДТП с Lexus, в школах Самары продлен карантин https://t.co/D8udAfoNrf",Unknown,Russian,2016-02-05 16:28:00,2016-02-05 16:28:00,431,39957,6742,,0
NovostiSmr,"Самарским дворникам поднимают зарплату в 1,5-2 раза https://t.co/LCALO8jvGC",Unknown,Russian,2016-02-06 07:58:00,2016-02-06 07:58:00,431,39956,6743,,0
NovostiSmr,Самара готовится к Дельфийским играм - 2016 https://t.co/OUGLXslGMJ,Unknown,Russian,2016-02-07 09:08:00,2016-02-07 09:08:00,430,39954,6747,,0
NovostiSmr,Продажи АвтоВАЗа упали на 11% https://t.co/NwMJvQhvb8,Unknown,Russian,2016-02-08 12:23:00,2016-02-08 12:23:00,431,39955,6759,,0
NovostiSmr,Кодекс этики АвтоВАЗа противоречит Конституции России https://t.co/jOF3zbiD69,Unknown,Russian,2016-02-08 13:30:00,2016-02-08 13:31:00,431,39955,6760,,0
NovostiSmr,В блогах: В Самаре на 45-летнего мужчину с крыши дома упала снежная глыба https://t.co/lZCDQTjs0w,Unknown,Russian,2016-02-08 14:34:00,2016-02-08 14:37:00,431,39955,6762,,0
NovostiSmr,Прокуратура: Корпоративный кодекс АвтоВАЗа нарушает Конституцию РФ https://t.co/7cYP6bNJqB,Unknown,Russian,2016-02-08 19:10:00,2016-02-08 19:10:00,431,39954,6765,,0
NovostiSmr,Британские ученые разработали IQ-тест для собак https://t.co/CPoQIWEXmB,Unknown,Russian,2016-02-08 20:39:00,2016-02-08 20:39:00,431,39954,6766,,0
NovostiSmr,В Самаре водитель Daewoo Gentra сбил насмерть женщину на зебре https://t.co/wFldqr4UZK,Unknown,Russian,2016-02-09 10:47:00,2016-02-09 10:47:00,431,39949,6776,,0
NovostiSmr,АвтоВАЗ: Собран первый пикап на базе Lada Granta https://t.co/U4cSymNPdK,Unknown,Russian,2016-02-09 12:13:00,2016-02-09 12:13:00,431,39949,6779,,0
NovostiSmr,"""Крылья Советов"" хотят продлить контракт с Веркаутереном https://t.co/3RJf68hFQZ",Unknown,Russian,2016-02-09 13:24:00,2016-02-09 13:25:00,431,39949,6781,,0
NovostiSmr,В январе лидером рынка SUV в России стала Toyota RAV4 https://t.co/34bsmjH4yn,Unknown,Russian,2016-02-09 13:25:00,2016-02-09 13:25:00,431,39949,6782,,0
NovostiSmr,Жителей Куйбышевского района снова соберут на слушания https://t.co/DbZfADSh4u,Unknown,Russian,2016-02-10 08:51:00,2016-02-10 09:56:00,431,39948,6791,,0
NovostiSmr,В Самаре выявили почти 2600 незаконно установленных гаражей https://t.co/3JPzT6cBVx,Unknown,Russian,2016-02-10 13:22:00,2016-02-10 13:23:00,431,39947,6794,,0
NovostiSmr,Новый вирус Т9000 записывает разговоры пользователей Skype https://t.co/bpTMhOi79u,Unknown,Russian,2016-02-11 04:56:00,2016-02-11 04:56:00,431,39946,6799,,0
NovostiSmr,«Самараэнерго» судится с СКС за 110 млн рублей https://t.co/faAziTqWGr,Unknown,Russian,2016-02-11 06:11:00,2016-02-11 06:12:00,431,39946,6801,,0
NovostiSmr,Россияне смогут неделю наблюдать полет МКС на небе https://t.co/dBd6LGrJpc,Unknown,Russian,2016-02-11 11:11:00,2016-02-11 11:11:00,431,39946,6808,,0
NovostiSmr,"если видишь, что сапёр куда-то бежит, лучше бежать за ним. след в след",Unknown,Russian,2016-02-11 11:56:00,2016-02-11 11:56:00,431,39946,6809,R,1
NovostiSmr,Тольяттинцев научат сочинять хип-хоп https://t.co/CXKK8D6k2u,Unknown,Russian,2016-02-11 13:25:00,2016-02-11 13:25:00,431,39946,6811,,0
NovostiSmr,АвтоВАЗ сдал площади и оборудование ВМЗ и ОПП https://t.co/4nq29VANRO,Unknown,Russian,2016-02-11 14:41:00,2016-02-11 14:41:00,431,39945,6813,,0
NovostiSmr,"Топ-новости дня: погиб контрактник, новый глава УФСКН, невеста Hyundai https://t.co/4h2OhIcysi",Unknown,Russian,2016-02-11 18:10:00,2016-02-11 18:10:00,431,39946,6816,,0
NovostiSmr,В блогах: ХК «Лада» пересядет на Lada Vesta https://t.co/jK1Z9RXmMU,Unknown,Russian,2016-02-12 15:36:00,2016-02-12 15:36:00,431,39943,6832,,0
NovostiSmr,В Самаре на ЧМ-2018 самый дорогой номер в гостинице будет стоить 75 тысяч рублей в сутки https://t.co/LELBQ4kAMd,Unknown,Russian,2016-02-14 07:49:00,2016-02-14 08:15:00,431,39935,6837,,0
NovostiSmr,АвтоВАЗ повышает цены на 5% https://t.co/JDf3jaXzlQ,Unknown,Russian,2016-02-15 12:05:00,2016-02-15 12:05:00,432,39932,6851,,0
NovostiSmr,"Топ-новости: старт продаж Lada XRay, завершено расследование дела блогеров, смертельное ДТП в Тольятти https://t.co/QRxnsAgIfk",Unknown,Russian,2016-02-15 16:44:00,2016-02-15 16:44:00,432,39932,6858,,0
NovostiSmr,АвтоВАЗу в 2016 году могут дать 90 млрд рублей https://t.co/CFDzBNIbmm,Unknown,Russian,2016-02-15 19:28:00,2016-02-15 19:28:00,432,39930,6860,,0
NovostiSmr,"К руководству пансионата ""Звездный"" возникли вопросы https://t.co/4EGW0KIBv1",Unknown,Russian,2016-02-16 06:36:00,2016-02-16 06:46:00,432,39930,6862,,0
NovostiSmr,SsangYong анонсировал дебют нового компактного кроссовера SIV-2 https://t.co/E72eLg4RDV,Unknown,Russian,2016-02-16 07:41:00,2016-02-16 07:41:00,432,39930,6863,,0
NovostiSmr,Российские ученые: Путешествие на Марс становится все более опасным https://t.co/MYgK94Y9wD,Unknown,Russian,2016-02-16 07:46:00,2016-02-16 07:46:00,432,39930,6864,,0
NovostiSmr,Спортивные Renault Clio RS и Megane RS могут покинуть рынок РФ https://t.co/p6WOcQrdAh,Unknown,Russian,2016-02-16 10:43:00,2016-02-16 10:43:00,432,39930,6868,,0
NovostiSmr,"Топ-новости: автобус разбил «Гранту» и светофор, секрет питания стройных людей, путешествие на Марс https://t.co/pn5p4ReVOT",Unknown,Russian,2016-02-16 16:08:00,2016-02-16 16:08:00,432,39928,6874,,0
NovostiSmr,Самарской области дадут еще 51 млн рублей https://t.co/wgpIXgSzw2,Unknown,Russian,2016-02-17 07:42:00,2016-02-17 08:10:00,432,39927,6881,,0
NovostiSmr,"Вадим Тюнин вошел в состав правления некоммерческой организации ""Региональный оператор Самарской области ""Фонд... https://t.co/yQAVVE9lw4",Unknown,Russian,2016-02-17 14:11:00,2016-02-17 15:23:00,432,39927,6887,,0
NovostiSmr,"Компания Toyota отзывает 1,12 млн автомобилей из-за дефекта ремней безопасности https://t.co/E6mZxcKnk6",Unknown,Russian,2016-02-18 06:29:00,2016-02-18 06:29:00,432,39926,6890,,0
