author_id,content,region,language,publish_date,harvested_date,following,followers,updates,post_type,retweet
NovostiShoigu,в Санкт-Петербурге состоялось  открытие представительства Экспедиционного центра Министерства обороны России в Западном военном округе https://t.co/AlF8SeM9Ia,United States,Russian,2016-12-06T19:21:00,2016-12-06T19:22:00,0E-10,5921.0000000000,6.0000000000,,False
NovostiShoigu,"Людьми года в России назвали Путина, Лаврова и #Шойгу https://t.co/WzosLoH2nq",,Russian,2016-12-13T14:49:00,2017-01-10T14:31:00,2.0000000000,4976.0000000000,24.0000000000,,False
NovostiShoigu,"С Новым 2017 годом, друзья!   #нг2017 #2017 https://t.co/stolRkjQHA",United States,Russian,2016-12-31T21:10:00,2016-12-31T21:10:00,2.0000000000,5084.0000000000,21.0000000000,,False
NovostiShoigu,#Россия будет укреплять войска на юге страны из-за Украины – #Шойгу https://t.co/GWBWRnKQlJ,United States,Russian,2017-01-26T18:06:00,2017-03-16T16:42:00,5.0000000000,4435.0000000000,239.0000000000,,False
NovostiShoigu,Мама пропавшего в Волжском солдата-срочника записала обращение к Сергею #Шойгу  https://t.co/qFlZ85S2Tr https://t.co/pkNNKGhrEa,United States,Russian,2017-01-27T13:49:00,2017-01-27T13:49:00,5.0000000000,4832.0000000000,27.0000000000,,False
NovostiShoigu,В первом отборочном этапе конкурса «Безопасный маршрут» приняли участие около 2 тыс. военных инженеров https://t.co/fDIn2YsvRx https://t.co/3VIYjEDQqf,United States,Russian,2017-03-05T23:00:00,2017-03-05T23:00:00,5.0000000000,4505.0000000000,33.0000000000,,False
NovostiShoigu,Малый противолодочный корабль СФ «Юнга» артиллерийским огнём отразил условное воздушное нападение https://t.co/UaiOay6y2O https://t.co/j1fmfCwC01,United States,Russian,2017-03-07T01:13:00,2017-03-07T01:15:00,5.0000000000,4501.0000000000,56.0000000000,,False
NovostiShoigu,Команда подводников ТОФ вышла во второй тур чемпионата Камчатского края по хоккею с шайбой https://t.co/A06wNqlspd https://t.co/PFDJgLgmDq,United States,Russian,2017-03-07T03:14:00,2017-03-07T03:16:00,5.0000000000,4501.0000000000,57.0000000000,,False
NovostiShoigu,Сформирована российская судейская бригада конкурса «Кубок моря-2017» https://t.co/kdgU7o3avc,United States,Russian,2017-03-08T01:25:00,2017-03-08T01:27:00,5.0000000000,4483.0000000000,76.0000000000,,False
NovostiShoigu,В авиацентр ВТА поступил новый самолет дальнего радиолокационного обнаружения и управления А-50 https://t.co/I28OCAqMx8 https://t.co/R42XarVeHP,United States,Russian,2017-03-09T13:43:00,2017-03-16T15:32:00,5.0000000000,4438.0000000000,239.0000000000,,False
NovostiShoigu,Офицеры воспитательных структур ТОФ провели на Камчатке патриотическую акцию для школьников https://t.co/uoC85aBlqi https://t.co/EgwMqPXbki,United States,Russian,2017-03-09T21:47:00,2017-03-09T21:48:00,5.0000000000,4476.0000000000,113.0000000000,,False
NovostiShoigu,Международные соревнования боевых пловцов в 2017 году усложнят подводной стрельбой https://t.co/BKhsSpiRYg https://t.co/vru7ez8mKi,United States,Russian,2017-03-09T23:48:00,2017-03-09T23:49:00,5.0000000000,4474.0000000000,116.0000000000,,False
NovostiShoigu,На Черноморском флоте проходит отборочный этап конкурса «Кубок моря-2017» https://t.co/mXKdE12uUH https://t.co/FtjHtTbb1f,United States,Russian,2017-03-10T11:54:00,2017-03-10T11:54:00,5.0000000000,4475.0000000000,124.0000000000,,False
NovostiShoigu,В Балтийске пройдет первая в этом году информационно-агитационная акция «Есть такая профессия – Родину защищать!» https://t.co/PVCQSxCNZm https://t.co/weDClLTWdc,United States,Russian,2017-03-10T11:54:00,2017-03-10T11:54:00,5.0000000000,4475.0000000000,125.0000000000,,False
NovostiShoigu,В 2017 году в инженерные войска России поступит новейшее водолазное снаряжение https://t.co/9fHivyIAz9 https://t.co/0ypjFdRFA6,United States,Russian,2017-03-10T19:58:00,2017-03-10T19:58:00,5.0000000000,4472.0000000000,130.0000000000,,False
NovostiShoigu,Экипажи пилотажной группы «Русские витязи» вылетели в Малайзию для участия в военно-технической выставке «Лима-2017» https://t.co/BGsjM02Pzt https://t.co/rd9qkvyPfE,United States,Russian,2017-03-10T21:59:00,2017-03-10T21:59:00,5.0000000000,4471.0000000000,132.0000000000,,False
NovostiShoigu,Школьники Челябинской области приняли участие в игре «Зарница-2017» https://t.co/J48p7pGDA5 https://t.co/eH5V2nc39b,United States,Russian,2017-03-11T04:02:00,2017-03-11T04:02:00,5.0000000000,4471.0000000000,138.0000000000,,False
NovostiShoigu,В ВВО состоялась жеребьевка участников окружного этапа конкурса «Танковый биатлон» АрМИ-2017 https://t.co/tgeT9kwfr3 https://t.co/St9Jq4xp6Q,United States,Russian,2017-03-12T04:14:00,2017-03-12T04:14:00,5.0000000000,4463.0000000000,158.0000000000,,False
NovostiShoigu,Миссия США и Германии выполнит наблюдательный полет над территорией России с аэродрома Хабаровска https://t.co/bR0CDCeWct https://t.co/GfJsQKQaNd,United States,Russian,2017-03-12T22:23:00,2017-03-12T22:23:00,5.0000000000,4459.0000000000,165.0000000000,,False
NovostiShoigu,На Тихоокеанском флоте прошел конкурс профессионального мастерства среди психологов «Тихоокеанская роза ветров-2017» https://t.co/sBJJmlaX61 https://t.co/4RKgcGBwgo,United States,Russian,2017-03-13T04:26:00,2017-03-13T04:26:00,5.0000000000,4461.0000000000,167.0000000000,,False
NovostiShoigu,В Амурской области началось двухстороннее антитеррористическое КШУ с двумя соединениями ВВО https://t.co/l1GzaEOA7L https://t.co/mHQtTMFbKr,United States,Russian,2017-03-13T08:28:00,2017-03-13T08:29:00,5.0000000000,4461.0000000000,170.0000000000,,False
NovostiShoigu,На полигоне ВВО юнармейцы из хабаровского филиала ЦСКА посетили окружной этап конкурса «Танковый биатлон» https://t.co/2jUwn8s8PS https://t.co/BzcsVts3Xv,United States,Russian,2017-03-13T10:29:00,2017-03-13T10:29:00,5.0000000000,4461.0000000000,172.0000000000,,False
NovostiShoigu,Завершились соревнования открытого Кубка ЦСКА по стрельбе из лука https://t.co/fjk5xNdHzx https://t.co/Oa7acISNxO,United States,Russian,2017-03-13T12:30:00,2017-03-13T12:30:00,5.0000000000,4462.0000000000,175.0000000000,,False
NovostiShoigu,Гимнастки ЦСКА заняли весь пьедестал индивидуального многоборья на чемпионате России https://t.co/QaVEAHl4Zb https://t.co/RCHZjfQp9w,United States,Russian,2017-03-13T12:30:00,2017-03-13T12:30:00,5.0000000000,4462.0000000000,174.0000000000,,False
NovostiShoigu,В Липецкой области завершился отборочный этап конкурса Армейских международных игр «Авиадартс-2017» https://t.co/J9o9NDpsA5 https://t.co/GbPX2cEqn0,United States,Russian,2017-03-13T18:33:00,2017-03-13T18:33:00,5.0000000000,4461.0000000000,181.0000000000,,False
NovostiShoigu,Спортсмены ЦСКА завоевали 17 медалей на чемпионате Европы по стрельбе из пневматического оружия https://t.co/QjHygEKSb9 https://t.co/pL0HpLnaE4,United States,Russian,2017-03-13T20:34:00,2017-03-13T20:34:00,5.0000000000,4461.0000000000,182.0000000000,,False
NovostiShoigu,Специалисты Минобороны России посетят крупнейший в мире фестиваль робототехники «РобоФест-2017» https://t.co/j4OpUDeee3 https://t.co/FcpGt09Ubq,United States,Russian,2017-03-14T12:42:00,2017-03-14T12:42:00,5.0000000000,4462.0000000000,196.0000000000,,False
NovostiShoigu,В ЗВО состоялся окружной этап конкурса «Суворовский натиск-2017» https://t.co/JgxxaJhUPO https://t.co/QTI0ChxuPJ,United States,Russian,2017-03-15T06:51:00,2017-03-15T06:51:00,5.0000000000,4439.0000000000,213.0000000000,,False
NovostiShoigu,Пилоты Су-25 ВВО отработали скрытный подлёт и нанесение ударов по аэродрому условного противника https://t.co/7Eng0W4Xq3 https://t.co/ro3hW3bxE4,United States,Russian,2017-03-16T09:04:00,2017-03-16T09:05:00,5.0000000000,4432.0000000000,234.0000000000,,False
NovostiShoigu,"Представители Азербайджана, Ирана, Казахстана и России встретились в рамках подготовки к конкурсу «Кубок моря-2017» https://t.co/BfwZlPIV59 https://t.co/AY2GTleq5a",United States,Russian,2017-03-16T19:09:00,2017-03-16T19:09:00,5.0000000000,4435.0000000000,241.0000000000,,False
NovostiShoigu,Информационно-агитационная акция «Военно-Морской Флот России – гордость нации!» пройдет в Калининграде https://t.co/4K5RUUXOgX https://t.co/OEXqXIgT6o,United States,Russian,2017-03-17T19:21:00,2017-03-17T19:21:00,5.0000000000,4434.0000000000,259.0000000000,,False
NovostiShoigu,Спортсменка ЦСКА Елена Никитина стала серебряным призером финального этапа Кубка мира по бобслею и скелетону https://t.co/j2BihzV1eL https://t.co/BF8ayDyd3Q,United States,Russian,2017-03-17T23:23:00,2017-03-17T23:23:00,5.0000000000,4434.0000000000,263.0000000000,,False
NovostiShoigu,В Москве пройдет юношеский турнир по дзюдо памяти тренера ЦСКА Михаила Мухаметшина https://t.co/gvRzCwPKCx https://t.co/ld3uJDX2kT,United States,Russian,2017-03-18T01:24:00,2017-03-18T01:24:00,5.0000000000,4434.0000000000,265.0000000000,,False
NovostiShoigu,Информационно-агитационная акция «Военно-Морской Флот России – гордость нации!» состоялась в Калининграде https://t.co/4YMgFQZa89 https://t.co/IQJVq4vo1Y,United States,Russian,2017-03-18T19:32:00,2017-03-18T19:33:00,5.0000000000,4435.0000000000,279.0000000000,,False
NovostiShoigu,В ЗВО пройдет свыше 120 акций «Военная служба по контракту – твой выбор!» https://t.co/OQUJv9I5YY https://t.co/c7oVVQFanM,United States,Russian,2017-03-19T09:39:00,2017-03-19T09:39:00,5.0000000000,4434.0000000000,291.0000000000,,False
NovostiShoigu,На официальном сайте Минобороны России начали работу 45 новых интернет-сайтов военно-учебных заведений https://t.co/GSev1onbOT https://t.co/wlaX9aNSUi,United States,Russian,2017-03-19T21:45:00,2017-03-19T21:46:00,5.0000000000,4435.0000000000,298.0000000000,,False
NovostiShoigu,Спортсмены ЦСКА победили в соревнованиях бобслейных четверок на заключительном этапе Кубка мира https://t.co/paFxCbDJZK https://t.co/jBWxDUTCkZ,United States,Russian,2017-03-20T13:53:00,2017-03-20T13:54:00,5.0000000000,4432.0000000000,309.0000000000,,False
NovostiShoigu,Рапирист ЦСКА Тимур Сафин стал победителем этапа Гран-при в США https://t.co/nFuhhpXrsA https://t.co/yJmoIosUdP,United States,Russian,2017-03-20T13:53:00,2017-03-20T13:54:00,5.0000000000,4432.0000000000,310.0000000000,,False
NovostiShoigu,Армейская теннисистка Елена Веснина победила на престижном теннисном турнире в Индиан-Уэллсе https://t.co/A6IQ60bvrx https://t.co/Zwl7dakjOH,United States,Serbian,2017-03-20T15:55:00,2017-03-20T15:56:00,5.0000000000,4431.0000000000,312.0000000000,,False
NovostiShoigu,Мастера армрестлинга из ЦСКА завоевали 8 медалей на чемпионате России https://t.co/7wXtYYnN7c https://t.co/8OhzgRCL56,United States,Russian,2017-03-20T21:57:00,2017-03-20T21:58:00,5.0000000000,4429.0000000000,318.0000000000,,False
NovostiShoigu,В ЦВО прошли состязания по ремонту боевых машин  в ходе условного боя в рамках «АРМИ-2017» https://t.co/JRcvgiqoiM https://t.co/GhwAnDT3dF,United States,Russian,2017-03-20T23:58:00,2017-03-20T23:59:00,5.0000000000,4427.0000000000,320.0000000000,,False
NovostiShoigu,Конькобежец ЦСКА Сергей Трофимов стал чемпионом России в классическом многоборье https://t.co/qrbNPdpwuF https://t.co/iObs61Wtrg,United States,Russian,2017-03-21T04:01:00,2017-03-21T04:01:00,5.0000000000,4428.0000000000,324.0000000000,,False
NovostiShoigu,В ГВКГ имени Н.Н. Бурденко состоялась IV Всероссийская научно-практическая конференция гематологов https://t.co/1lJBkbDr5p https://t.co/8VgZGyJBCF,United States,Russian,2017-03-21T14:05:00,2017-04-19T16:01:00,5.0000000000,4428.0000000000,330.0000000000,,False
NovostiShoigu,Военные железнодорожники представят масштабные макеты перспективных образцов спецтехники на форуме «Армия-2017» https://t.co/dMGCpLK8oQ https://t.co/bK29oUL4cW,United States,Russian,2017-03-22T04:12:00,2017-03-22T04:12:00,5.0000000000,4420.0000000000,342.0000000000,,False
NovostiShoigu,Корабли Каспийской флотилии готовятся к участию в международном конкурсе «Кубок моря-2017» https://t.co/YChExXD3MX https://t.co/qsEAUjSNZe,United States,Russian,2017-03-22T14:17:00,2017-03-22T14:18:00,5.0000000000,4420.0000000000,352.0000000000,,False
NovostiShoigu,Военные инженеры покажут «умные» миноискатели на форуме «Армия-2017» https://t.co/iwX7EJf6PT https://t.co/4r6cb4Pdd1,United States,Russian,2017-03-23T04:24:00,2017-03-23T04:24:00,5.0000000000,4420.0000000000,362.0000000000,,False
NovostiShoigu,"МВ КВЦ «Патриот» открывается II научная конференция, посвященная роботизации Вооруженных Сил https://t.co/91kLHzTd6S https://t.co/e821reReOf",United States,Russian,2017-03-23T08:26:00,2017-04-19T16:01:00,5.0000000000,4419.0000000000,366.0000000000,,False
NovostiShoigu,В Западном военном округе начался конкурс профессионального мастерства военных связистов «Уверенный прием–2017» https://t.co/TPSBCG2Ihp https://t.co/4gmH08Jmpn,United States,Russian,2017-03-23T16:30:00,2017-03-23T16:30:00,5.0000000000,4421.0000000000,373.0000000000,,False
NovostiShoigu,В Новороссийске проведена информационно-агитационная акция «Военная служба по контракту – твой выбор!» https://t.co/OzHh4ca789 https://t.co/oZtgMJLU39,United States,Russian,2017-03-25T19:28:00,2017-03-25T19:28:00,5.0000000000,4411.0000000000,415.0000000000,,False
NovostiShoigu,Оренбургские кадеты стали победителями фестиваля «РобоФест-2017» в номинации «Автомобилестроение» https://t.co/CWH5Y2tk5J https://t.co/sc1p62e73J,United States,Russian,2017-03-26T05:33:00,2017-03-26T05:34:00,5.0000000000,4411.0000000000,422.0000000000,,False
NovostiShoigu,Делегация Вологодской области провела презентацию своего региона на космодроме Плесецк https://t.co/CIBdU7whXq https://t.co/6YzKpqKvyK,United States,Russian,2017-03-26T13:37:00,2017-03-26T13:37:00,5.0000000000,4411.0000000000,429.0000000000,,False
NovostiShoigu,Более 2.5 тысяч человек отобрано для службы по контракту в войсках ВВО  в первом квартале  2017 года https://t.co/c0DWCXFC4f https://t.co/L1IoOtb93L,United States,Russian,2017-03-27T05:45:00,2017-03-27T05:45:00,5.0000000000,4407.0000000000,440.0000000000,,False
NovostiShoigu,Акция ВКС России по набору военнослужащих по контракту пройдет в Тамбове в мае https://t.co/IKnPFtaN5w https://t.co/V8t2ABKXHg,United States,Russian,2017-03-27T15:50:00,2017-03-27T15:50:00,5.0000000000,4406.0000000000,449.0000000000,,False
NovostiShoigu,В Москве состоялось заседание Коллегии Министерства обороны России https://t.co/jsfgcbILtG https://t.co/OLWhaZoGP3,United States,Russian,2017-03-27T21:53:00,2017-03-27T21:55:00,5.0000000000,4406.0000000000,455.0000000000,,False
NovostiShoigu,В РВСН начались контрольные комплексные проверки по итогам зимнего периода обучения https://t.co/x8ndR0UTEe https://t.co/YT3GUlWnwJ,United States,Russian,2017-03-27T21:53:00,2017-03-27T21:55:00,5.0000000000,4406.0000000000,454.0000000000,,False
NovostiShoigu,"Новейшие роботы, участвовавшие в разминировании территорий в Сирии, будут представлены на форуме «АРМИЯ-2017» https://t.co/FUEJ1k7Jjw https://t.co/wGSgH5JPzt",United States,Russian,2017-03-30T22:29:00,2017-03-30T22:29:00,5.0000000000,4388.0000000000,512.0000000000,,False
NovostiShoigu,В Москве прошла презентация выставки фотографий III зимних Всемирных военных игр в Сочи https://t.co/t5NssvGwpk https://t.co/DXGtJbrXMA,United States,Russian,2017-03-31T06:33:00,2017-03-31T06:33:00,5.0000000000,4388.0000000000,518.0000000000,,False
NovostiShoigu,Святой Иоанн Кронштадтский стал небесным покровителем финансово-экономической службы Российской армии https://t.co/12kTkz03sX https://t.co/vkRcC0skcS,United States,Russian,2017-03-31T18:39:00,2017-03-31T18:41:00,5.0000000000,4388.0000000000,529.0000000000,,False
NovostiShoigu,В Астраханской области состоялась воздушно-огневая конференция  руководящего состава ВКС https://t.co/RfVCZAr8U0 https://t.co/cGe1yDT9Lf,United States,Russian,2017-03-31T20:40:00,2017-04-19T16:01:00,5.0000000000,4390.0000000000,530.0000000000,,False
NovostiShoigu,Подразделения ВДВ России и сил специальных операций Республики Беларусь завершили первый этап учений https://t.co/MDystCgHJg https://t.co/vpY2xu2PGa,United States,Russian,2017-04-01T06:45:00,2017-04-05T08:15:00,5.0000000000,4389.0000000000,539.0000000000,,False
NovostiShoigu,В Санкт-Петербурге завершилась III-я Международная олимпиада по иностранному языку среди курсантов военных вузов https://t.co/fmQyfFMjz9 https://t.co/AOhWsPx4uY,United States,Russian,2017-04-01T06:45:00,2017-04-01T06:45:00,5.0000000000,4389.0000000000,540.0000000000,,False
NovostiShoigu,Воспитанники Оренбургского президентского кадетского училища выиграли всероссийский турнир «Мини-футбол в школу» https://t.co/IrvQIaUhRG https://t.co/JJkVwxbeRF,United States,Russian,2017-04-01T18:51:00,2017-04-01T18:51:00,5.0000000000,4388.0000000000,549.0000000000,,False
NovostiShoigu,Воспитанники Оренбургского ПКУ выиграли всероссийский турнир «Мини-футбол в школу» https://t.co/IrvQIaUhRG https://t.co/yHJUbG6PBi,United States,Russian,2017-04-01T20:52:00,2017-04-01T20:52:00,5.0000000000,4388.0000000000,551.0000000000,,False
NovostiShoigu,В Санкт-Петербурге завершилась III Международная олимпиада по иностранному языку среди курсантов военных вузов https://t.co/fmQyfFMjz9 https://t.co/oxMUTthTny,United States,Russian,2017-04-02T06:57:00,2017-04-02T06:57:00,5.0000000000,4386.0000000000,560.0000000000,,False
NovostiShoigu,В 2017 году Вооруженные Силы России получат несколько сотен единиц новейшей инженерной техники https://t.co/8xWaQB9Tlh https://t.co/Kk3SBLhhXS,United States,Russian,2017-04-02T19:03:00,2017-04-02T19:03:00,5.0000000000,4384.0000000000,569.0000000000,,False
NovostiShoigu,"Из 120 тысяч обращений граждан, поступивших в Минобороны России в 2016 году, – лишь треть от военнослужащих https://t.co/fvugSaGD66 https://t.co/jenbZtvpgU",United States,Russian,2017-04-03T15:14:00,2017-04-03T15:14:00,5.0000000000,4383.0000000000,584.0000000000,,False
NovostiShoigu,Спортсмен ЦСКА Дмитрий Колтаков стал чемпионом мира в мотогонках на льду https://t.co/3zsRi52pqE,United States,Russian,2017-04-03T17:16:00,2017-04-03T17:16:00,5.0000000000,4382.0000000000,588.0000000000,,False
NovostiShoigu,Новый формат участия в форуме «Армия-2017» представит Главное управление связи Вооруженных Сил Российской Федерации https://t.co/zJDlJoB6tt https://t.co/xDLe7jAX54,United States,Russian,2017-04-04T19:29:00,2017-04-04T19:29:00,5.0000000000,4377.0000000000,614.0000000000,,False
NovostiShoigu,Атомная многоцелевая подводная лодка «Орёл» возвратится в состав ВМФ до конца апреля 2017 года. https://t.co/XPby9CNIJm https://t.co/waJCJoT3vc,United States,Russian,2017-04-04T19:29:00,2017-04-04T19:29:00,5.0000000000,4377.0000000000,613.0000000000,,False
NovostiShoigu,Конференция по вопросам патриотического воспитания прошла в Центральном доме Российской Армии https://t.co/w02fwuHI5k https://t.co/Rpnv3keobm,United States,Russian,2017-04-04T23:31:00,2017-04-19T16:01:00,5.0000000000,4367.0000000000,617.0000000000,,False
NovostiShoigu,Определен состав участников отборочного этапа Открытого фестиваля-конкурса юных дарований «Катюша-Юниор – 2017» https://t.co/JfBFVovAJP https://t.co/sK9Q6Q2mYe,United States,Russian,2017-04-05T01:32:00,2017-04-05T01:32:00,5.0000000000,4367.0000000000,619.0000000000,,False
NovostiShoigu,Пять многоквартирных домов для военнослужащих в Москве будет сдано до июня 2017 года. https://t.co/jJxkbZVNkj,United States,Russian,2017-04-05T03:33:00,2017-04-05T03:33:00,5.0000000000,4368.0000000000,620.0000000000,,False
NovostiShoigu,В Приморье летчики авиационных частей ВВО сражаются за победу в окружном этапе конкурса «Авиадартс-2017» https://t.co/djjGXcHEka https://t.co/cBCSdX4fl8,United States,Russian,2017-04-05T07:35:00,2017-04-05T07:35:00,5.0000000000,4366.0000000000,623.0000000000,,False
NovostiShoigu,Порядка 11 млрд. рублей сэкономлено в Минобороны России при обеспечении военнослужащих жильем в 2016 году. https://t.co/o60hLOJXoy https://t.co/yuTEwxmfe5,United States,Russian,2017-04-05T19:42:00,2017-04-05T19:42:00,5.0000000000,4366.0000000000,636.0000000000,,False
NovostiShoigu,В Санкт-Петербурге в ВУНЦ ВМФ состоится презентация 3-го издания книги «Морская мощь государства» https://t.co/YVvpb4gI0s https://t.co/TWM4IBDXBe,United States,Russian,2017-04-06T01:45:00,2017-04-06T01:45:00,5.0000000000,4364.0000000000,640.0000000000,,False
