author_id,content,region,language,publish_date,harvested_date,following,followers,updates,post_type,retweet
NovostiSmr,Наша Самара намного уютнее и красивее чужой Европы!  С каждым лайком наш город становится все лучше и лучше! ☺ #Samara #Самара #Россия https://t.co/YtmAbLorHa,Russian Federation,Russian,2016-10-19 11:31:00,2016-10-19 11:34:00,5067,40815,9427,,0
NovostiSmr,В Самаре на склоне площади Славы обустроили лестницы из плитки https://t.co/zHCP3gccfO,Russian Federation,Russian,2016-10-19 12:21:00,2016-10-19 14:32:00,5067,40816,9428,,0
NovostiSmr,Дачи на Поляне Фрунзе. Июнь 1974 года https://t.co/kpV4gZwRa4,Russian Federation,Russian,2016-10-20 11:21:00,2016-10-20 11:21:00,5066,40810,9433,,0
NovostiSmr,"Станция метро ""Победа"", архитектор: А.Н. Герасимов, годы строительства: 1978 - 1986 https://t.co/FJ9EqJneBb",Russian Federation,Russian,2016-10-20 14:31:00,2016-10-20 14:31:00,5066,40811,9435,,0
NovostiSmr,"Самарская область готова к зиме. АСАДО, которое занимается содержанием дорог на 90% укомплектовано техникой для уборки проезжих частей зимой https://t.co/C4SsBM2f4V",Russian Federation,Russian,2016-10-20 17:07:00,2016-10-20 17:07:00,5066,40811,9437,,0
NovostiSmr,"В Самаре открыли мемориальную доску Марине Цветаевой, которая пробыла в городе две недели! https://t.co/VQZ5fGUIOz",Russian Federation,Russian,2016-10-21 09:17:00,2016-10-22 08:58:00,5062,40806,9448,,0
NovostiSmr,Как проходит ваша пятница?! � https://t.co/sDl3208oML,Russian Federation,Russian,2016-10-21 14:17:00,2016-10-21 15:00:00,5065,40807,9444,,0
NovostiSmr,"В Самаре самые красивые болельщицы! Ольга – мисс «Крылья Советов», а так же болельщица и журналистка пресс-службы самарского клуба!������� https://t.co/ax8p0OpgB9",Russian Federation,Russian,2016-10-21 17:37:00,2016-10-21 17:37:00,5063,40805,9446,,0
NovostiSmr,"Самарцы тратят меньше на повседневные товары, чем в целом по России! https://t.co/f85JDqajgv",Russian Federation,Russian,2016-10-23 14:51:00,2016-10-23 14:54:00,5061,40801,9455,,0
NovostiSmr,"В четверг, 27 октября, в Самаре пройдёт матч 1/8 финала Кубка России, на котором «Крылья Советов» встретятся с московским «Локомотивом»! https://t.co/W6zk7K6ZxJ",Russian Federation,Russian,2016-10-24 12:21:00,2016-10-24 12:21:00,5059,40798,9461,,0
NovostiSmr,"Доброе утро, Самара! Ты прекрасна в любую погоду! �� Фото: larisa_prof https://t.co/MXMSZLwt0E",Russian Federation,Russian,2016-10-25 04:13:00,2016-10-25 04:13:00,5060,40799,9465,,0
NovostiSmr,"Доброе утро, мой любимый город!  Чудесной среды всем самарцам!  � https://t.co/KAeXVHeZ56",Russian Federation,Russian,2016-10-26 04:21:00,2016-10-26 05:20:00,5058,40800,9471,,0
NovostiSmr,Какой туристы видели Самару в 1995 году: старый транспорт и знаковые места. � https://t.co/WcFJgOImRJ,Russian Federation,Russian,2016-10-26 17:01:00,2016-10-26 17:01:00,5058,40798,9479,,0
NovostiSmr,"Сегодня в 19:00 на стадионе «Металлург» (Самара) пройдет матч Крылья Советов - Локомотив! Как думаете, кто победит сегодня? ☺ https://t.co/b127PDSu5P",Russian Federation,Russian,2016-10-27 10:07:00,2016-10-27 10:07:00,5056,40797,9483,,0
NovostiSmr,"Военно-медицинское училище, Самара. https://t.co/Cwu5EvJXay",Russian Federation,Russian,2016-10-27 11:21:00,2016-10-28 03:58:00,5054,40796,9488,,0
NovostiSmr,"❄❄❄❄❄❄ А вы рады приходу зимы в наш город, друзья? ❄❄❄❄❄❄❄❄ https://t.co/lbqk9HoBoI",Russian Federation,Russian,2016-10-29 17:07:00,2016-10-29 17:16:00,5054,40798,9499,,0
NovostiSmr,"Самарский государственный архитектурно-строительный университет. Шикарно, согласны? ❤ https://t.co/hMvv5vmAVx",,Russian,2016-10-30 11:41:00,2016-11-02 13:15:00,5765,40825,9525,,0
NovostiSmr,Сегодня в НИИ Склифосовского на 101-м году жизни скончался старейший актёр Владимир Зельдин.  Помним. Любим. Скорбим. https://t.co/3J5AVlcVDb,,Russian,2016-10-31 09:23:00,2016-10-31 09:23:00,5053,40801,9508,,0
NovostiSmr,"17-20 ноября в Самаре пройдёт фестиваль Beat Weekend, в рамках которого зрители увидят 5документальных фильмов о музыке и новой культуре. https://t.co/5sMDn7IwrO",Russian Federation,Russian,2016-11-02 12:13:00,2016-11-02 12:13:00,5765,40825,9525,,0
NovostiSmr,'-Питер?  -Нет!✋ Самара! �  Наша фантастическая архитектура! ��� https://t.co/tkDn5w7W2y',,Russian,2016-11-03 17:21:00,2016-11-03 17:47:00,6111,40837,9533,,0
NovostiSmr,"5 запахов, за которые мы любим Самару! 1.Солод 2.Липовый цвет  3.Шоколад  4.Свежие булочки  5.Метро  А вы? ☺ https://t.co/YUkBSfMxKs",Russian Federation,Russian,2016-11-05 14:41:00,2016-11-05 14:41:00,6111,40840,9542,,0
NovostiSmr,"Молодецкий Курган. Невероятный вид! � И у нас много таких сокровищ, да земляки?! https://t.co/4rBVG6Z7zI",Russian Federation,Uzbek,2016-11-06 14:39:00,2016-11-06 14:41:00,6109,40847,9546,,0
NovostiSmr,"121 год назад Максим Горький приехал в Самару. Он говорил: «телом я родился в Нижнем Новгороде, духовно в Казани, а как писатель в Самаре». https://t.co/hvokici3zL",,Russian,2016-11-06 17:07:00,2016-11-06 18:29:00,6109,40845,9547,,0
NovostiSmr,"В Самаре побит рекорд по количеству выпавшего снега ❄ Абсолютный суточный максимум количества осадков - 11,9 мм, был зафиксирован 4 ноября.� https://t.co/EjrZcKZCMe",,Russian,2016-11-07 12:31:00,2016-11-07 12:50:00,6095,40849,9551,,0
NovostiSmr,"Сегодня, 7 ноября, и завтра, 8 ноября, в Самаре на некоторых улицах в связи с заменой оборудования будет отключена холодная вода. https://t.co/JWtlWaAS3o",Russian Federation,Russian,2016-11-07 14:07:00,2016-11-07 14:07:00,6095,40847,9552,,0
NovostiSmr,У нас самый красивый вокзал в Европе!  Согласны?! ❤ https://t.co/pVvFCU5oAs,,Russian,2016-11-07 17:17:00,2016-11-07 17:23:00,6095,40845,9555,,0
NovostiSmr,У жителей Самары есть возможность прикоснуться к мощам блаженной Матроны Московской! Мощи святой будут находиться в храме до 15 ноября. https://t.co/Yl6Uhy0g8o,,Russian,2016-11-08 13:07:00,2016-11-09 04:57:00,6240,40852,9567,,0
NovostiSmr,"Морозный, но душевный вечер в старом городе.  Какие у вас планы? � https://t.co/ClxUYFgXdB",,Russian,2016-11-08 17:43:00,2016-11-10 14:36:00,6240,40853,9584,,0
NovostiSmr,"Добрейшего утра, самарцы! Как настроение? #Самара https://t.co/5VdQCHAhUQ",,Russian,2016-11-09 04:39:00,2016-11-09 05:16:00,6240,40852,9567,,0
NovostiSmr,"Редкое фото того, как будет выглядеть президент #США, когда приедет в Самару зимой. А как вы относитесь к победе Дональда #Трампа? �  #трамп https://t.co/3rKoSyJsSv",Russian Federation,Russian,2016-11-09 08:17:00,2016-11-09 08:17:00,6240,40853,9568,,0
NovostiSmr,"Редкое фото того, как будет выглядеть президент #США, заехав в Самару зимой. А как вы относитесь к победе Дональда Трампа?�  #трамп2016 https://t.co/QdRw5aW5X7",Russian Federation,Russian,2016-11-09 08:22:00,2016-11-09 08:23:00,6240,40853,9568,,0
NovostiSmr,#Trump2016 https://t.co/Ndai1Z8IWc,Russian Federation,Russian,2016-11-09 08:36:00,2016-11-09 08:36:00,6240,40853,9569,Q,1
NovostiSmr,"В Самаре побит снежный рекорд четырнадцатилетней давности! ��� Мэрия города отрапортовала, что со 2 ноября вывезли 6 тысяч тонн снега ❄❄❄ https://t.co/fgnwLRyNNV",Russian Federation,Russian,2016-11-09 09:21:00,2016-11-09 09:21:00,6238,40853,9570,,0
NovostiSmr,Владимир Путин поздравил Трампа с победой на выборах. #Trump2016 #PresidentTrump #Путин #трамп https://t.co/j8OAg0XOEA,Russian Federation,Russian,2016-11-09 10:15:00,2016-11-09 10:16:00,6240,40853,9571,,0
NovostiSmr,Неплохая мотивация любителям животных и рисунков на теле! � Получи бесплатную татуировку за помощь приюту!  Вперед! � https://t.co/Ta95YFGjlB,,Russian,2016-11-09 12:37:00,2016-11-09 12:49:00,6240,40856,9573,,0
NovostiSmr,В конце года начнется проектирование первой очереди «Гагарин-центра» ��� https://t.co/slyoUP99K7,,Russian,2016-11-09 15:47:00,2016-11-09 15:57:00,6240,40854,9576,,0
NovostiSmr,"Доброй сказочной ночи, самарцы! � https://t.co/sNjuc2vV6v",,Russian,2016-11-09 18:37:00,2016-11-09 18:41:00,6240,40853,9578,,0
NovostiSmr,Настроение:   � укрыться пледом  � смотреть фильмы  ☕ пить горячий лимонный чай  � любить Самару https://t.co/QmFYzoKJJT,Russian Federation,Russian,2016-11-10 11:07:00,2016-11-10 11:07:00,6238,40853,9582,,0
NovostiSmr,"На фото наш потрясающий замок Гарибальди.  Попадая сюда, словно оказываешься в сказке.  Согласны? ❤  #Самара #СамарскаяОбласть #Россия https://t.co/dsQ9ENXl28",,Russian,2016-11-10 17:17:00,2016-11-11 21:17:00,6327,40863,9593,,0
NovostiSmr,14 ноября произойдет самое крупное суперлуние в XXI веке  До этого Луна так близко приближалась к Земле в 1948г. Следующее ждем в 2034 году. https://t.co/yshjTcJHTf,,Russian,2016-11-11 12:31:00,2016-11-11 12:36:00,6325,40860,9590,,0
NovostiSmr,"Перекресток улиц Соборной и Предтеченской, 1929 год. https://t.co/3kAQ58JdM3",,Russian,2016-11-13 14:47:00,2016-11-13 20:22:00,6322,40868,9602,,0
NovostiSmr,Nike будет пожизненно выплачивать Криштиану Роналду по 24 миллиона евро в год https://t.co/z9sBWUVCIE,Russian Federation,Russian,2016-11-14 16:21:00,2016-11-14 16:21:00,6419,40881,9609,,0
NovostiSmr,"Сказочные места Самарской области!   На фото: замок Гарибальди, село Хрящевка. https://t.co/XEdgZXfKsl",,Russian,2016-11-15 11:07:00,2016-11-16 08:33:00,6468,40881,9621,,0
NovostiSmr,На днях активисты закрыли фанерой с рисунками и надписями разбитые окна Реального училища в Самаре.   Фотограф �: Максим Рассказов https://t.co/Tl99qqAnPI,,Russian,2016-11-15 12:31:00,2016-11-15 14:00:00,6420,40881,9616,,0
NovostiSmr,"На неделе стартует кинофестиваль Beat Weekend, в городе пройдут лекция о мужественности в культуре и всероссийский географический диктант https://t.co/qJ1BbX6zUB",Russian Federation,Russian,2016-11-16 12:31:00,2016-11-16 12:31:00,6517,40887,9626,,0
NovostiSmr,В Самарской области курит почти треть взрослого населения https://t.co/PgcEJEaRDd,,Russian,2016-11-17 13:02:00,2016-11-18 07:09:00,6515,40887,9639,,0
NovostiSmr,Городские власти выявили самые популярные хэштэги о Самаре: #хорошее настроение несмотря на погоду и #полжизнивпробке https://t.co/TGvORUWz6Y,,Russian,2016-11-17 15:57:00,2016-11-17 16:52:00,6513,40886,9638,,0
NovostiSmr,"Доброе утро, #Волга-мама!  Доброе утро, моя #Самара! � https://t.co/feM5DE6lRZ",Russian Federation,Uzbek,2016-11-18 06:14:00,2016-11-18 06:14:00,6515,40887,9639,,0
NovostiSmr,Куйбышев. Открытие нового трамвайного маршрута №12 по улице Аэродромной. 1964 год. https://t.co/IyqCWF1SPx,Russian Federation,Russian,2016-11-18 15:05:00,2016-11-18 15:19:00,6515,40887,9644,,0
NovostiSmr,"Наша фантастическая набережная Волги! � Доброе утро, моя #Самара! https://t.co/i8MKGEeTWS",,Russian,2016-11-19 05:21:00,2016-11-19 09:09:00,6515,40889,9648,,0
NovostiSmr,Во время ЧМ-2018 Самара будет принимать от 30 тысяч туристов в сутки https://t.co/abrdtcBk8p,,Russian,2016-11-21 09:21:00,2016-11-21 13:39:00,6514,40888,9660,,0
NovostiSmr,Бурлаки на Волге. Потрясающе.� https://t.co/qR7BZHTHSo,,Russian,2016-11-21 14:24:00,2016-11-21 14:55:00,6514,40885,9662,,0
NovostiSmr,"Доброе утро, Волга-мама!  Фотограф �: i_am_libo  #Самара #Россия https://t.co/HEeiBYqQ8m",Russian Federation,Russian,2016-11-22 04:21:00,2016-11-22 04:21:00,6514,40886,9666,,0
NovostiSmr,Самару начинают готовить к Новому году �� В областной столице планируется открыть 34 новогодних комплекса! � https://t.co/LkZMI6usO9,,Russian,2016-11-22 12:07:00,2016-11-22 14:22:00,6514,40885,9670,,0
NovostiSmr,"Присесть в Загородном парке и подумать о том, как прекрасна природа Самары и области - бесценно! � Репост, если делал так. https://t.co/0rYClrt9L8",,Russian,2016-11-22 17:21:00,2016-11-24 02:37:00,6512,40890,9681,,0
NovostiSmr,До лета-2017 осталось 189 дней! С каждым репостом оно все ближе! �  Проверим? https://t.co/4YeFoBxv00,,Russian,2016-11-23 11:07:00,2016-11-23 11:22:00,6513,40889,9676,,0
NovostiSmr,"Волга-мама, спасибо за такую красоту! � https://t.co/Yn3bxocyfT",Russian Federation,Ukrainian,2016-11-23 14:07:00,2016-11-23 14:07:00,6512,40889,9679,,0
NovostiSmr,"Добрейшей ночи, мой славный город! � Фотограф �: sveta_rusaya https://t.co/t0DSJHnRn3",Russian Federation,Russian,2016-11-23 18:21:00,2016-11-23 18:23:00,6512,40889,9681,,0
NovostiSmr,"Добрейшее утро, самарцы! Как вам сегодняшнее утро? � https://t.co/HMUZOJEJCD",,Russian,2016-11-24 05:31:00,2016-11-24 05:52:00,6512,40890,9682,,0
NovostiSmr,"Доброй ночи, моя Самара! https://t.co/8CLjmrnvW7",,Bulgarian,2016-11-24 18:21:00,2016-11-24 18:21:00,6511,40886,9687,,0
NovostiSmr,"Самарский трамвай в 90-х. Ретвит, если помнишь те времена ❤ https://t.co/hJNyELnciF",,Russian,2016-11-25 14:51:00,2016-11-27 13:15:00,6511,40892,9698,,0
NovostiSmr,"Доброго вечера и чудесной ночи, самарцы! �  #Самара #Россия #небо #sky #природа #NaturePhotography https://t.co/bFd0uwRgWt",Russian Federation,Russian,2016-11-25 18:21:00,2016-11-25 18:21:00,6511,40895,9692,,0
NovostiSmr,"#Самара, интересный и оригинальный памятник коту.  Такое возможно только у нас! ❤ https://t.co/GxQ4rGuSLQ",,Russian,2016-11-26 15:31:00,2016-12-04 10:45:00,6506,40886,9744,,0
NovostiSmr,В новогодние каникулы музей модерна в Самаре проведет экскурсии для детей! � https://t.co/BkNhiD7aBC,Russian Federation,Russian,2016-11-29 09:21:00,2016-11-29 09:21:00,6509,40892,9708,,0
NovostiSmr,Самарские «Крылья Советов» сообщили о переносе матча с «Краснодаром» https://t.co/YVa7NjuLCL,Russian Federation,Russian,2016-11-29 12:29:00,2016-11-29 12:29:00,6509,40892,9710,,0
NovostiSmr,"По итогам творческого конкурса ФК «Крылья Советов» победителем стала Виктория Славинская, написавшая портрет полузащитника Евгения Башкирова https://t.co/WUybmDPsNr",Russian Federation,Russian,2016-11-30 09:21:00,2016-11-30 09:21:00,6512,40890,9715,,0
NovostiSmr,Уроженка Самары Лукерья Ильяшенко вошла в топ самых привлекательных женщин России. � https://t.co/q9o8YTXDDG,Russian Federation,Russian,2016-11-30 16:29:00,2016-11-30 16:31:00,6508,40888,9719,,0
NovostiSmr,"Доброе утро, Волга-мама!  Фотограф �: i_am_libo https://t.co/K1yo99uy6Z",Russian Federation,Serbian,2016-12-01 04:21:00,2016-12-01 04:21:00,6509,40885,9721,,0
NovostiSmr,В Самаре горожане делятся зимними пейзажами в социальных сетях!  �❄� https://t.co/q0oqGmLucX,,Russian,2016-12-01 09:23:00,2016-12-01 10:33:00,6508,40884,9723,,0
NovostiSmr,На уборку улиц Самары от снега вывели 134 единицы спецтехники и 306 рабочих! https://t.co/sfVD7cS5n5,Russian Federation,Russian,2016-12-01 12:57:00,2016-12-01 12:57:00,6506,40883,9726,,0
NovostiSmr,"Сегодня на стадионе «Металлург» состоится матч «Крылья Советов» – «Спартак». Болельщиков заманивают горячим чаем, футболками, календарями. https://t.co/bwaGBX6Jkm",Russian Federation,Russian,2016-12-01 15:57:00,2016-12-01 15:57:00,6508,40884,9728,,0
NovostiSmr,"О нашем прошлом. Площадь Кирова, 1975 год.  #Самара https://t.co/fSAfoS1F8S",,Russian,2016-12-01 17:21:00,2016-12-01 17:33:00,6508,40884,9729,,0
NovostiSmr,"В Самаре в границах Мичурина, Челюскинцев, Луначарского построят ТЦ площадью 10 000 кв. м https://t.co/CcmSfO2JSb",,Russian,2016-12-02 09:17:00,2016-12-02 13:06:00,6508,40889,9733,,0
NovostiSmr,Белый плен захватил Самару и область. А вы радуетесь зиме? ❤ https://t.co/AIisemdFJp,Russian Federation,Russian,2016-12-02 11:17:00,2016-12-02 11:17:00,6506,40887,9732,,0
NovostiSmr,Появились эскизы будущей трамвайной ветки до «Самара Арена»  Работы по строительству новой ветки должны завершиться до 31 декабря 2017 года. https://t.co/eo69RSf6qA,Russian Federation,Russian,2016-12-02 12:21:00,2016-12-02 12:21:00,6506,40888,9733,,0
NovostiSmr,"После разгромной победы над московским ""Спартаком"" (4:0), состоялась пресс-конференция с наставником ""Крыльев Советов"" Вадимом Скрипченко. https://t.co/ZBf0qPZQis",Russian Federation,Russian,2016-12-02 15:21:00,2016-12-02 15:21:00,6505,40889,9735,,0
NovostiSmr,Хорошие новости! 4 ноября в Самару приезжает Вячеслав Бутусов с юбилейной программой «Nautilus Pompilius. 30 лет под водой». https://t.co/u6dE2FQQ1d,Russian Federation,Russian,2016-12-03 09:23:00,2016-12-03 09:23:00,6507,40888,9739,,0
NovostiSmr,"Ночи Самарской Луки.  Прекрасных сновидений, земляки! � https://t.co/EckR37kgT1",Russian Federation,Russian,2016-12-03 19:21:00,2016-12-03 19:22:00,6507,40885,9743,,0
NovostiSmr,Здание самарского железнодорожного вокзала является самым высоким из всех вокзалов Европы – его высота со шпилем составляет 100 м. https://t.co/IOa06rj5vX,,Russian,2016-12-05 17:21:00,2016-12-05 17:49:00,6505,40890,9754,,0
NovostiSmr,Заключительный матч года «Крылья Советов» - «Краснодар» завершился ничьей � https://t.co/CxRtCTNwlg,Russian Federation,Russian,2016-12-06 07:43:00,2016-12-06 07:43:00,6504,40890,9757,,0
NovostiSmr,"Сегодня вечером объявлен старт продаж новой книги "" #ГарриПоттер и проклятое дитя "".   Купите?  #HarryPotter #HarryPotterAndTheCursedChild https://t.co/CTrhJaaOM4",,Russian,2016-12-06 13:21:00,2016-12-06 13:27:00,6504,40892,9761,,0
NovostiSmr,"В Самаре снесут Дворец спорта и построят на его месте новый, рассчитанный на  5 тысяч человек! https://t.co/eErtWf5GeA",,Russian,2016-12-07 09:21:00,2016-12-07 11:28:00,6504,40891,9768,,0
NovostiSmr,Небольшой уголок Европы в русском городе https://t.co/i9mF11jMKy,,Russian,2016-12-10 13:45:00,2016-12-10 15:13:00,6501,40893,9796,,0
NovostiSmr,В Доме архитектора пройдёт презентация проектов воркшопа «Ожившие фонтаны Самары». https://t.co/bb29Va3Ysn,Russian Federation,Russian,2016-12-10 14:21:00,2016-12-10 14:21:00,6499,40893,9797,,0
NovostiSmr,Пермь с высоты 2000 метров. https://t.co/w9RuVNw2lw,Russian Federation,Russian,2016-12-11 13:21:00,2016-12-11 13:21:00,6499,40894,9803,,0
NovostiSmr,Тольяттинец Андрей Маколов завоевал две бронзовые награды на снарядах в составе сборной на соревнованиях в США! Поздравляем нашего чемпиона! https://t.co/Nbw7AnBkFI,,Russian,2016-12-12 09:21:00,2016-12-12 16:29:00,6499,40888,9812,,0
NovostiSmr,54-летняя жительница Тольятти ходит зимой в мини-юбке и босоножках‍. Этому женщину научили в школе долголетия!  � https://t.co/iFDqSOj7P7,,Russian,2016-12-12 13:21:00,2016-12-12 13:30:00,6499,40889,9811,,0
NovostiSmr,"О нашем прошлом. Первомайская демонстрация в Сызрани, 1976 год. https://t.co/49D9T42rTr",Russian Federation,Russian,2016-12-13 10:21:00,2016-12-13 10:21:00,6497,40885,9815,,0
NovostiSmr,Погода в  Самарской обл. 13 — 16 декабря 2016 г. — КРЕПКИЕ МОРОЗЫ. Ожидается аномально‑холодная погода. https://t.co/bkeWPE2QN0,Russian Federation,Russian,2016-12-13 10:53:00,2016-12-13 10:53:00,6497,40885,9816,,0
NovostiSmr,"Наш город вошёл в топ-30 городов России, популярных у иностранцев в 2016 году �� https://t.co/psTDfaYlIk",Russian Federation,Russian,2016-12-13 14:00:00,2016-12-13 14:00:00,6494,40884,9818,,0
NovostiSmr,"Суббота! Выходные! С добрым утром, Самарцы!  Фотограф: antonshow https://t.co/kLljS3SQpu",,Russian,2016-12-17 05:21:00,2016-12-17 05:23:00,6489,40888,9849,,0
NovostiSmr,Красота природы и результат человеческого труда! https://t.co/XVV1r95dYI,,Russian,2016-12-17 12:50:00,2016-12-18 05:09:00,6488,40884,9856,,0
NovostiSmr,Завтра в 14.00 губернатор Николай Меркушкин обратится с ежегодным посланием к депутатам Самарской Губернской Думы и жителям региона. https://t.co/mQTrohyIhw,,Russian,2016-12-18 11:21:00,2016-12-18 11:30:00,6488,40886,9859,,0
NovostiSmr,Скорее бы новогодние праздники. https://t.co/28eeCeqJA9,,Russian,2016-12-20 10:44:00,2016-12-20 13:09:00,6488,40905,9877,,0
NovostiSmr,В сторону Самары надвигается циклон. Ожидается ледяной дождь.  Будьте осторожны! https://t.co/MkQ2n0qPmW,,Russian,2016-12-21 09:22:00,2016-12-21 09:23:00,5984,40907,9884,,0
