author_id,content,region,language,publish_date,harvested_date,following,followers,updates,post_type,retweet
NovostiShoigu,Боксеры ЦСКА завоевали «золото» и две «бронзы» на чемпионате Вооруженных Сил Российской Федерации https://t.co/acoS6zKIYy https://t.co/yO4qQzy0Jz,United States,Russian,2017-07-18T02:18:00,2017-07-18T02:19:00,5.0000000000,4190.0000000000,2734.0000000000,,False
NovostiShoigu,На территории ВВО с помощью накопительно-ипотечной системы решили квартирный вопрос более 1.2 тысяч человек https://t.co/MEdfn2CUTW https://t.co/i1D2bjq3iq,United States,Russian,2017-07-18T10:22:00,2017-07-18T10:22:00,5.0000000000,4190.0000000000,2741.0000000000,,False
NovostiShoigu,"В Ингушетии прошел семинар, посвященный развитию юнармейского движения в Северо-Кавказском федеральном округе https://t.co/JePtI4kmS2 https://t.co/0NeDwqPSem",United States,Russian,2017-07-18T12:23:00,2017-07-18T12:23:00,5.0000000000,4190.0000000000,2743.0000000000,,False
NovostiShoigu,Обслуживание техники ВКС России по полному жизненному циклу повысило ее исправность https://t.co/jk5WdHDqdy https://t.co/vSKDIks8my,United States,Russian,2017-07-18T22:28:00,2017-07-18T22:28:00,5.0000000000,4191.0000000000,2753.0000000000,,False
NovostiShoigu,В Севастополе подвели итоги весенней призывной кампании https://t.co/bLCAUXKAq0 https://t.co/loQE9Itbqu,United States,Russian,2017-07-19T00:29:00,2017-07-19T00:31:00,5.0000000000,4191.0000000000,2756.0000000000,,False
NovostiShoigu,Под Омском прошла первая юнармейская палаточная смена https://t.co/bK97XNyR1q https://t.co/p5cBeuxdfS,United States,Russian,2017-07-19T02:30:00,2017-07-19T02:44:00,5.0000000000,4191.0000000000,2758.0000000000,,False
NovostiShoigu,В музее Балтийского флота открылась выставка «Кортик офицерский. Символ чести моряка» https://t.co/PIyEgXf4PG https://t.co/OZOBRwpGPY,United States,Russian,2017-07-19T14:42:00,2017-07-19T14:53:00,5.0000000000,4189.0000000000,2769.0000000000,,False
NovostiShoigu,Сборная Вооруженных Сил РФ вылетела в Китай для участия в международном конкурсе «Мастер оружейник» https://t.co/iF6yfLBlgh https://t.co/BO45poe5sR,United States,Russian,2017-07-19T18:38:00,2017-07-19T18:43:00,5.0000000000,4189.0000000000,2773.0000000000,,False
NovostiShoigu,На полигоне Восточного военного округа Цугол около 8 тысяч военнослужащих примут участие в масштабном учении https://t.co/5jCOg1PTVx https://t.co/mfhNkFzvuX,United States,Russian,2017-07-20T06:44:00,2017-07-20T06:45:00,5.0000000000,4188.0000000000,2783.0000000000,,False
NovostiShoigu,ЦСКА  встретился со  своими болельщиками из Сербии https://t.co/iQna68apBk https://t.co/GODBBE5uW2,United States,Russian,2017-07-20T22:52:00,2017-07-20T22:52:00,5.0000000000,4191.0000000000,2794.0000000000,,False
NovostiShoigu,Российские десантники прибыли в Китай для участия в международном конкурсе «Десантный взвод-2017» https://t.co/jh5TL72w8B https://t.co/oyyGF6EWgl,United States,Russian,2017-07-21T07:01:00,2017-07-21T07:14:00,5.0000000000,4191.0000000000,2801.0000000000,,False
NovostiShoigu,Сборные команды прибыли в Острогожск для участия в Международном конкурсе «Мастера автобронетанковой техники» https://t.co/rUyKhlCBBh https://t.co/mbJd0ZpT1C,United States,Russian,2017-07-21T21:03:00,2017-07-21T21:14:00,5.0000000000,4187.0000000000,2816.0000000000,,False
NovostiShoigu,В Китай для участия в международном конкурсе «Безопасная среда» прибыли команды из четырех стран https://t.co/7ayJ0mnnSa https://t.co/Po5UteIzRV,United States,Russian,2017-07-21T23:04:00,2017-07-21T23:14:00,5.0000000000,4186.0000000000,2818.0000000000,,False
NovostiShoigu,Более 1000 разведчиков ЦВО прошли испытания на стрессоустойчивость https://t.co/40zMqhKHoC https://t.co/QAw3deVs1W,United States,Russian,2017-07-21T23:04:00,2017-07-21T23:14:00,5.0000000000,4186.0000000000,2819.0000000000,,False
NovostiShoigu,Более 250 военнослужащих ЮВО примут участие 10 конкурсах международных армейских игр «АрМИ-2017» https://t.co/4V5Ni5Ctab https://t.co/FkRzeiglJO,United States,Russian,2017-07-24T05:31:00,2017-07-24T05:31:00,5.0000000000,4181.0000000000,2855.0000000000,,False
NovostiShoigu,Свыше 1200 представителей из 22 иностранных государств прибыли  в Россию для участия в конкурсах АрМИ-2017 https://t.co/AcpV1OcxWL https://t.co/Ck1dbFmFYW,United States,Russian,2017-07-24T05:31:00,2017-07-24T05:31:00,5.0000000000,4181.0000000000,2854.0000000000,,False
NovostiShoigu,Российские экипажи БМП-2 протестировали боевую технику в китайской пустыне Такла-Макан https://t.co/k7ijp3RXkD https://t.co/RXVW33JiOH,United States,Russian,2017-07-26T01:53:00,2017-07-26T01:53:00,5.0000000000,4179.0000000000,2885.0000000000,,False
NovostiShoigu,C 26 июля по 6 августа в Тюменской области пройдет международный конкурс «Безопасный маршрут» https://t.co/jgDkL2p6VV https://t.co/SFkFJvm27p,United States,Russian,2017-07-26T03:54:00,2017-07-26T03:54:00,5.0000000000,4179.0000000000,2886.0000000000,,False
NovostiShoigu,В отдаленные гарнизоны ВВО доставлено около 3 тыс. тонн  имущества и грузов различного назначения https://t.co/0jPrITNhWy https://t.co/7KTGIcfRSk,United States,Russian,2017-07-26T07:56:00,2017-07-26T08:02:00,5.0000000000,4179.0000000000,2887.0000000000,,False
NovostiShoigu,Министр обороны России генерал армии Сергей Шойгу провел  Единый день приёмки военной продукции https://t.co/YzhEJYWpNr https://t.co/N1FYndIlhw,United States,Russian,2017-07-26T10:02:00,2017-07-26T10:12:00,5.0000000000,4179.0000000000,2888.0000000000,,False
NovostiShoigu,"Десантники устроят грандиозное шоу в парке ""Патриот"" посвященное  87-й годовщины  со дня образования ВДВ https://t.co/BUA1d0QmFO https://t.co/ajsAbTBARc",United States,Russian,2017-07-29T07:24:00,2017-07-29T07:34:00,5.0000000000,4175.0000000000,2927.0000000000,,False
NovostiShoigu,ДОСААФ России проведет презентацию конного биатлона на АрМИ-2017 https://t.co/ge6Y2bfDQA https://t.co/GVGLjtCiBz,United States,Russian,2017-07-29T09:25:00,2017-07-29T09:25:00,5.0000000000,4175.0000000000,2929.0000000000,,False
NovostiShoigu,Филиппины могут принять участие в Армейских международных играх в 2018 году https://t.co/szYiIVhS4i https://t.co/LBJe5CMfKr,United States,Russian,2017-07-29T19:30:00,2017-07-29T19:30:00,5.0000000000,4174.0000000000,2936.0000000000,,False
NovostiShoigu,Военная миссия Великобритании и Норвегии выполнит наблюдательный полет над территорией России https://t.co/c6htDm5w5C https://t.co/vy3h11qH7v,United States,Russian,2017-07-30T21:43:00,2017-07-30T21:43:00,5.0000000000,4173.0000000000,2954.0000000000,,False
NovostiShoigu,Для обеспечения объективного судейства на АрМИ-2017 используются беспилотники https://t.co/Xjl8Tun2XK https://t.co/H78IEa9p2J,United States,Russian,2017-07-30T23:44:00,2017-07-30T23:55:00,5.0000000000,4173.0000000000,2955.0000000000,,False
NovostiShoigu,Наблюдатели из Китая и Индии посетили открытие второго Международного кинологического конкурса «Верный друг» https://t.co/V1soCm6U3i https://t.co/EmKrWVM4zC,United States,Russian,2017-07-31T03:46:00,2017-07-31T03:56:00,5.0000000000,4173.0000000000,2958.0000000000,,False
NovostiShoigu,"На открытии АрМИ-2017 ДОСААФ России провело презентацию конного биатлона, выступления собаководов и авиамоделистов https://t.co/Yv10VZ94A3 https://t.co/44Pxsd0jFS",United States,Russian,2017-07-31T07:58:00,2017-07-31T07:58:00,5.0000000000,4173.0000000000,2961.0000000000,,False
NovostiShoigu,Открытие Международного конкурса «Чистое небо» состоится в День армии Китая https://t.co/H2j7dqkg9V https://t.co/G5ZnHiiBXB,United States,Russian,2017-07-31T21:55:00,2017-08-30T06:49:00,5.0000000000,4174.0000000000,2972.0000000000,,False
NovostiShoigu,Экипажи корветов боролись за живучесть корабля на конкурсе «Кубок моря-2017» https://t.co/4UT3OjkLap,United States,Russian,2017-08-02T06:12:00,2017-08-02T06:13:00,5.0000000000,4173.0000000000,2992.0000000000,,False
NovostiShoigu,Участники международного конкурса «Мастера артиллерийского огня» готовятся к эстафете https://t.co/xNmMWNKo2L https://t.co/oDFqsTia3p,United States,Russian,2017-08-02T18:18:00,2017-08-04T01:02:00,5.0000000000,4171.0000000000,3024.0000000000,,False
NovostiShoigu,Участники «Военно-медицинской эстафеты» завершили прохождение полосы препятствий https://t.co/ARbWVtJmGq https://t.co/BrRAW66mvN,United States,Russian,2017-08-02T18:18:00,2017-08-04T01:02:00,5.0000000000,4171.0000000000,3024.0000000000,,False
NovostiShoigu,Наблюдатели из Египта и Узбекистана присутсвуют на конкурсе Авиадартс https://t.co/BdKB2j4ytU https://t.co/yd3qiqMesL,United States,Uzbek,2017-08-04T06:36:00,2017-08-04T06:47:00,5.0000000000,4170.0000000000,3030.0000000000,,False
NovostiShoigu,В Казахстане стартуют состязания снайперских пар https://t.co/n2mdbO4N4R https://t.co/b2UxyuiIuQ,United States,Russian,2017-08-04T06:36:00,2017-08-04T06:47:00,5.0000000000,4170.0000000000,3029.0000000000,,False
NovostiShoigu,"В общевойсковой армии ВВО комбатов проверили на знания, ловкость, меткость и штабную культуру https://t.co/rhU5PC6WKg https://t.co/ZZD7zhSbpH",United States,Russian,2017-08-05T02:45:00,2017-08-05T02:57:00,5.0000000000,4168.0000000000,3043.0000000000,,False
NovostiShoigu,В школе снайперов ВВО стартовал новый набор курсантов https://t.co/LQlY9fJiUp https://t.co/InlyN9gVI6,United States,Russian,2017-08-05T02:46:00,2017-08-05T02:58:00,5.0000000000,4168.0000000000,3044.0000000000,,False
NovostiShoigu,Участники конкурса «Дорожный патруль» из Казахстана отметили высокий уровень организации международных соревнований https://t.co/GqZcTZnRI5 https://t.co/JGvAxQmHKV,United States,Russian,2017-08-05T15:03:00,2017-08-05T15:04:00,5.0000000000,4168.0000000000,3054.0000000000,,False
NovostiShoigu,МРК «Град Свияжск» успешно выполнил стрельбу по морской мишени в территориальных водах Азербайджанской Республики https://t.co/VzPPkBKh7H https://t.co/f41PHiAOgt,United States,Russian,2017-08-06T02:57:00,2017-08-06T03:08:00,5.0000000000,4169.0000000000,3064.0000000000,,False
NovostiShoigu,Российские инженеры победили в международном конкурсе «Безопасный маршрут» https://t.co/DdElUDBl9M https://t.co/ssgVaKGVZ2,United States,Russian,2017-08-06T19:05:00,2017-08-06T19:18:00,5.0000000000,4170.0000000000,3079.0000000000,,False
NovostiShoigu,Группа российских инспекторов выполнит наблюдательный полет над территориями США и Канады https://t.co/WaATGJyTXA https://t.co/nLUebsv7H0,United States,Russian,2017-08-06T23:08:00,2017-08-06T23:08:00,5.0000000000,4168.0000000000,3083.0000000000,,False
NovostiShoigu,"Совместная миссия Швеции, Германии и Украины выполнит наблюдательный полет над территорией Российской Федерации https://t.co/KM3YEL3B2l https://t.co/8Di2IiVQiF",United States,Russian,2017-08-07T01:08:00,2017-08-07T01:09:00,5.0000000000,4168.0000000000,3084.0000000000,,False
NovostiShoigu,Сборная Республики Казахстан выиграла второй этап международного конкурса «Рембат» — огневую подготовку https://t.co/JOB8Cdm6Ab https://t.co/raIEmkR65J,United States,Russian,2017-08-07T19:18:00,2017-08-07T19:29:00,5.0000000000,4165.0000000000,3098.0000000000,,False
NovostiShoigu,Силы Балтийского флота принимают участие в международном учении «Balex Delta 2017» https://t.co/zkGqjNGORb https://t.co/XhxF6DyuX7,United States,Russian,2017-08-08T13:26:00,2017-08-08T13:28:00,5.0000000000,4166.0000000000,3107.0000000000,,False
NovostiShoigu,В борьбу за победу на международном конкурсе «Военно-медицинская эстафета» вступили женские команды https://t.co/UBxiUfg9pq https://t.co/O0oXxNX5dO,United States,Russian,2017-08-08T15:27:00,2017-08-08T15:39:00,5.0000000000,4166.0000000000,3109.0000000000,,False
NovostiShoigu,Международный конкурс «Рембат-2017» в Омске завершился победой сборной России https://t.co/8ZEy6B2tM9 https://t.co/LiCnVTFyd3,United States,Russian,2017-08-10T07:47:00,2017-08-10T08:00:00,5.0000000000,4167.0000000000,3144.0000000000,,False
NovostiShoigu,Более 500 российских и сербских военнослужащих приняли участие в совместном тактическом учении https://t.co/ccXparYTsF https://t.co/WTGxtM79eM,United States,Russian,2017-08-11T03:57:00,2017-08-11T04:10:00,5.0000000000,4166.0000000000,3154.0000000000,,False
NovostiShoigu,На подмосковном полигоне Алабино завершились полуфинальные заезды «Танкового биатлона». https://t.co/fss61687dT https://t.co/CyBYARsZ44,United States,Russian,2017-08-11T03:57:00,2017-08-11T04:10:00,5.0000000000,4166.0000000000,3155.0000000000,,False
NovostiShoigu,Армения планирует провести на своей территории один из конкурсов Армейских международных игр в 2018 году https://t.co/48nET1gtph https://t.co/Nx4kXFxXqh,United States,Russian,2017-08-12T18:17:00,2017-08-12T18:17:00,5.0000000000,4167.0000000000,3164.0000000000,,False
NovostiShoigu,Армения планирует провести на своей территории один из конкурсов Армейских международных игр в 2018 году https://t.co/K3Xxb9DFXo https://t.co/q0AzMerlpC,United States,Russian,2017-08-12T18:17:00,2017-08-12T18:17:00,5.0000000000,4167.0000000000,3165.0000000000,,False
NovostiShoigu,В Парке Патриот прошла церемония закрытия Армейских международных игр-2017 https://t.co/N1IIA3BFgx https://t.co/x16UurW6OA,United States,Russian,2017-08-12T22:18:00,2017-08-12T22:21:00,5.0000000000,4167.0000000000,3166.0000000000,,False
NovostiShoigu,Министр обороны России генерал армии Сергей Шойгу вручил команде России Кубок Армейских международных игр https://t.co/lUViUeUZfZ https://t.co/m99KYBbq7b,United States,Russian,2017-08-12T22:18:00,2017-08-12T22:21:00,5.0000000000,4167.0000000000,3167.0000000000,,False
NovostiShoigu,Начальник Генштаба ВС РФ генерал-полковник Валерий Герасимов вручил кубок победителя АрМИ-2017 российской сборной https://t.co/TDVhpqX0qy https://t.co/GkQzlWstqt,United States,Russian,2017-08-13T00:19:00,2017-08-13T00:31:00,5.0000000000,4166.0000000000,3169.0000000000,,False
NovostiShoigu,На Международном военно-техническом форуме «Армия-2017» состоится интерактивный семинар https://t.co/L7SOgL7HU0 https://t.co/Ndi8YsfdKy,United States,Russian,2017-08-13T22:30:00,2017-08-13T22:30:00,5.0000000000,4167.0000000000,3177.0000000000,,False
NovostiShoigu,Группа инспекторов из Турции выполнит наблюдательный полет над территорией Российской Федерации https://t.co/VrWDaAAC7l https://t.co/su2JOI0w2A,United States,Russian,2017-08-13T22:30:00,2017-08-13T22:30:00,5.0000000000,4167.0000000000,3176.0000000000,,False
NovostiShoigu,Инженерные войска представят новейшую и перспективную технику на форуме «Армия-2017» https://t.co/hMcKKXNnEN https://t.co/OtAYZX56XC,United States,Bulgarian,2017-08-18T01:19:00,2017-08-30T06:50:00,5.0000000000,4158.0000000000,3184.0000000000,,False
NovostiShoigu,Совместная миссия США и Великобритании выполнит наблюдательный полет над территорией России и Белоруссии https://t.co/t2drYDpbRN https://t.co/GfawpWCHpq,United States,Russian,2017-08-20T23:54:00,2017-08-20T23:55:00,5.0000000000,4154.0000000000,3190.0000000000,,False
NovostiShoigu,Танк «Армата» продемонстрируют в открытой части показа МВТФ «Армия-2017» https://t.co/EcfvkyBdzl https://t.co/1afr2XZehj,United States,Bulgarian,2017-08-21T01:55:00,2017-08-30T06:50:00,5.0000000000,4154.0000000000,3192.0000000000,,False
NovostiShoigu,В Приамурское объединение ВВО поступили новые мобильные станции спутниковой связи https://t.co/g8b2vUSB7r https://t.co/gLgi9Jn9B3,United States,Russian,2017-08-21T14:01:00,2017-08-21T14:04:00,5.0000000000,4154.0000000000,3194.0000000000,,False
NovostiShoigu,Представители ЮВО внесли существенный вклад в победу Вооруженных Сил России в АРМИ-2017 https://t.co/iwjMlu9dr0 https://t.co/Oe66ukiWGU,United States,Russian,2017-08-22T08:10:00,2017-08-22T08:11:00,5.0000000000,4153.0000000000,3196.0000000000,,False
NovostiShoigu,На форуме «Армии-2017» впервые показан сирийский боевой опыт https://t.co/65MIUsrUkS https://t.co/pGIsgnOYLF,United States,Russian,2017-08-23T02:19:00,2017-08-30T06:49:00,5.0000000000,4151.0000000000,3200.0000000000,,False
NovostiShoigu,"В Минобороны России прошла пресс-конференция, посвященная итогам форума «Армия-2017» https://t.co/BoVl4ecJ5A https://t.co/amiwgnuGh2",United States,Russian,2017-08-30T15:49:00,2017-08-30T15:49:00,5.0000000000,4143.0000000000,3218.0000000000,,False
NovostiShoigu,"Около 40 тыс. ростовчан посетили воздушный праздник, посвященный 75-летию 4-й армии ВВС и ПВО https://t.co/ez3eOY0RPr https://t.co/xtrGjls2KJ",United States,Russian,2017-09-02T22:29:00,2017-09-02T22:29:00,5.0000000000,4136.0000000000,3227.0000000000,,False
NovostiShoigu,Чемпионат ВС РФ по легкоатлетическому кроссу пройдет на базе ЦСКА под  Санкт-Петербургом https://t.co/lRqfyPHgrT https://t.co/9PiD6GgXPo,United States,Russian,2017-09-14T14:51:00,2017-09-14T14:51:00,5.0000000000,4123.0000000000,3309.0000000000,,False
NovostiShoigu,На учении «Запад-2017» постоянно осуществлялась морально-психологическая поддержка военнослужащих https://t.co/RsXf654Pof https://t.co/e8upP7KKvG,United States,Russian,2017-09-20T03:59:00,2017-09-20T04:00:00,5.0000000000,4110.0000000000,3326.0000000000,,False
NovostiShoigu,В Смоленске пройдет акция «Военная служба по контракту – твой выбор!» https://t.co/IEJymmOKZQ https://t.co/Yd1iK16o3G,United States,Russian,2017-09-22T22:31:00,2017-09-22T22:32:00,5.0000000000,4108.0000000000,3334.0000000000,,False
NovostiShoigu,ДОСААФ Приволжска принял участие в презентации военно-исторического комплекса «Партизанская застава» https://t.co/Mcj837batY https://t.co/ydOaCYZ9sc,United States,Russian,2017-09-23T00:32:00,2017-09-23T00:33:00,5.0000000000,4108.0000000000,3337.0000000000,,False
NovostiShoigu,Российская группа инспекторов планирует выполнить наблюдательный полет на российском самолете Ан-30Б https://t.co/HpIyuJSN4x https://t.co/WLFSXWRwSd,United States,Russian,2017-10-01T22:18:00,2017-10-01T22:18:00,5.0000000000,4090.0000000000,3388.0000000000,,False
NovostiShoigu,Cовместная миссия США и Дании выполнит наблюдательный полет над территорией Российской Федерации https://t.co/JUOD6yhoGZ https://t.co/jkwTyFy6LY,United States,Russian,2017-10-01T22:18:00,2017-10-01T22:19:00,5.0000000000,4090.0000000000,3389.0000000000,,False
NovostiShoigu,Более семидесяти школьников Калининградской области желают поступить в военно-морские вузы в 2018 году https://t.co/VZVtTWha13 https://t.co/hXxhGl2shi,United States,Russian,2017-10-07T17:27:00,2017-10-07T17:27:00,3.0000000000,4089.0000000000,3441.0000000000,,False
NovostiShoigu,В Швейцарии прошла акция «Сувоворовские дни» https://t.co/pXTfEvoPB6 https://t.co/zP7qHOv5Rx,United States,Russian,2017-10-08T07:34:00,2017-10-08T07:34:00,3.0000000000,4088.0000000000,3450.0000000000,,False
NovostiShoigu,Российская группа инспекторов выполнит полет над территориями Бенилюкса и Германии https://t.co/LaIOV17Vyf https://t.co/JtUyWmOXIq,United States,Russian,2017-10-08T21:41:00,2017-10-08T21:41:00,3.0000000000,4090.0000000000,3461.0000000000,,False
NovostiShoigu,"Совместная миссия Венгрии, Канады и США выполнит наблюдательный полет над территорией Российская Федерация https://t.co/o8yiQo8jLC https://t.co/1W2nmzVYJB",United States,Russian,2017-10-08T23:42:00,2017-10-08T23:44:00,3.0000000000,4090.0000000000,3463.0000000000,,False
NovostiShoigu,Военной полицией проводится акция «Беглец» https://t.co/9rxpqD2XM5 https://t.co/gzNDTNKE9q,United States,Russian,2017-10-12T18:29:00,2017-10-12T18:29:00,3.0000000000,4061.0000000000,3510.0000000000,,False
NovostiShoigu,13 октября исполняется 190 лет Управлению навигации и океанографии Министерства Обороны РФ https://t.co/VWGjQ9eD6Y https://t.co/RYxMouaTFZ,United States,Russian,2017-10-12T22:31:00,2017-10-12T23:23:00,3.0000000000,4061.0000000000,3513.0000000000,,False
NovostiShoigu,Совместная миссия Швеции и США выполнит наблюдательный полет над территорией Российской Федерации https://t.co/mdqxJyxSj2 https://t.co/Oz1efjDijO,United States,Russian,2017-10-15T23:13:00,2017-10-15T23:13:00,3.0000000000,4057.0000000000,3549.0000000000,,False
NovostiShoigu,Первые поставки учебно-тренировочных самолетов СР-10 запланированы в 2018 году https://t.co/kTLwHX0Tz1 https://t.co/dsZDHckwqR,United States,Russian,2017-10-16T01:08:00,2017-10-16T01:08:00,3.0000000000,4057.0000000000,3552.0000000000,,False
NovostiShoigu,21 октября 1813 года - начало кругосветного плавания лейтенанта Лазарева на корабле «Суворов» https://t.co/lGuEVJm9jh https://t.co/HkJr2KckWb,United States,Russian,2017-10-21T21:05:00,2017-10-21T21:16:00,3.0000000000,4050.0000000000,3593.0000000000,,False
