author_id,content,region,language,publish_date,harvested_date,following,followers,updates,post_type,retweet
NovostiSmr,АвтоВАЗ уходит на майские каникулы https://t.co/7b9mc9lhj8,Unknown,Russian,2016-04-26 07:24:00,2016-04-26 07:25:00,432,39680,7743,,0
NovostiSmr,Сирия может реанимировать идею о крупноузловой сборке Lada https://t.co/0dKtqpsdgM,Unknown,Russian,2016-04-26 11:27:00,2016-04-26 11:27:00,432,39679,7749,,0
NovostiSmr,В Петербурге женщину задержали при попытке продать грудного ребенка https://t.co/rDoKntua5T,Unknown,Russian,2016-04-26 11:48:00,2016-04-26 11:48:00,432,39679,7750,,0
NovostiSmr,"""Биопарокс"" запретили https://t.co/CZgBGti0P8",Unknown,Russian,2016-04-26 18:25:00,2016-04-26 18:26:00,432,39679,7756,,0
NovostiSmr,Сайт самарского правительства на 61-м из 85-ти мест в России https://t.co/i7LSx678Lz,Unknown,Russian,2016-04-27 05:38:00,2016-04-27 05:38:00,432,39679,7758,,0
NovostiSmr,"Футбольный клуб ""Крылья Советов"" могут покинуть сразу два игрока https://t.co/LCNLLPSgY2",Unknown,Russian,2016-04-27 06:39:00,2016-04-27 06:39:00,432,39678,7759,,0
NovostiSmr,Самарская область заинтересована в долгосрочном сотрудничестве с Schneider Electric https://t.co/g7Zdm6h2xs,Unknown,Russian,2016-04-27 14:24:00,2016-04-27 14:24:00,432,39678,7770,,0
NovostiSmr,АвтоВАЗ начал создавать новый внедорожник LADA 4x4 https://t.co/DyO2ALsxVX,Unknown,Russian,2016-04-27 21:00:00,2016-04-27 21:00:00,432,39676,7773,,0
NovostiSmr,Экс-главу «Волга-Кредит банка» Татьяну Ерилкину увезли в больницу из зала суда https://t.co/J6NFtaYfCK,Unknown,Russian,2016-04-28 19:29:00,2016-04-28 19:30:00,432,39677,7790,,0
NovostiSmr,"Топ-новости дня: следы древнейшей войны, столкнулись два грузовика, кроссовер Changan CS35 https://t.co/xni61WAt2F",Unknown,Russian,2016-04-28 21:53:00,2016-04-28 21:53:00,432,39677,7791,,0
NovostiSmr,СМИ: Систему tax free хотят в России запустить до конца года https://t.co/8DbRbS6Ler,Unknown,Russian,2016-04-29 06:18:00,2016-04-29 06:18:00,432,39678,7793,,0
NovostiSmr,"Татьяна Ерилкина получила 5,5 лет https://t.co/9tlFkhgF0s",Unknown,Russian,2016-04-29 06:23:00,2016-04-29 06:23:00,432,39678,7794,,0
NovostiSmr,29 апреля АвтоВАЗ уходит на 11-дневные майские каникулы https://t.co/bSvgGOHFXo,Unknown,Russian,2016-04-29 07:42:00,2016-04-29 07:42:00,432,39678,7795,,0
NovostiSmr,У АвтоВАЗа пока нет планов по сокращениям персонала https://t.co/a1z3E44zvT,Unknown,Russian,2016-04-29 08:33:00,2016-04-29 08:33:00,432,39678,7796,,0
NovostiSmr,В Самаре автомобилистка на Toyota RAV-4 протаранила автобус ЛиАЗ https://t.co/gzGgJ3gRWk,Unknown,Russian,2016-04-29 08:45:00,2016-04-29 08:45:00,432,39678,7797,,0
NovostiSmr,"""Самарский резервуарный завод""  банкротят https://t.co/z6vtGt6iZD",Unknown,Russian,2016-04-29 12:01:00,2016-04-29 12:19:00,432,39677,7801,,0
NovostiSmr,В Сызрани непогода сорвала рекорд по массовому надуванию мыльных пузырей https://t.co/8ahlTNPofm,Unknown,Russian,2016-05-02 05:58:00,2016-05-02 07:42:00,432,39673,7822,,0
NovostiSmr,АвтоВАЗ за I квартал сократил выручку на 26% https://t.co/pm5sLL0uOb,Unknown,Ukrainian,2016-05-04 14:27:00,2016-05-04 14:28:00,432,39671,7843,,0
NovostiSmr,"Топ-новости дня: новый компактный кроссовер KIA, 50 важнейших гаджетов всех времен, почему нельзя кричать на детей https://t.co/dzIzQ7uk0h",Unknown,Russian,2016-05-04 17:07:00,2016-05-04 17:07:00,432,39672,7845,,0
NovostiSmr,В Самаре обустроят пляж для инвалидов-колясочников https://t.co/LnEhPJozjP,Unknown,Ukrainian,2016-05-04 18:16:00,2016-05-04 18:19:00,432,39672,7846,,0
NovostiSmr,Новый кроссовер Skoda Kodiaq получил версию купе https://t.co/9qxYD1XikR,Unknown,Russian,2016-05-05 07:34:00,2016-05-05 07:34:00,432,39671,7851,,0
NovostiSmr,Reuters узнал о скорой отставке премьера Турции Давутоглу https://t.co/SG4luRg299,Unknown,Russian,2016-05-05 08:23:00,2016-05-05 08:23:00,432,39671,7852,,0
NovostiSmr,"В Малой Малышевке построят спортплощадку за 5,5 млн рублей https://t.co/BW0DXtvj7v",Unknown,Russian,2016-05-05 10:35:00,2016-05-05 10:35:00,432,39671,7855,,0
NovostiSmr,Появилось изображение Lada Priora в фирменном стиле Xray https://t.co/sDBRf1j6HD,Unknown,Russian,2016-05-05 18:50:00,2016-05-05 18:53:00,432,39668,7861,,0
NovostiSmr,"1,5% - уровень безработицы в Самарской области https://t.co/cnnnRPh1kp",Unknown,Russian,2016-05-06 10:05:00,2016-05-06 10:16:00,432,39668,7871,,0
NovostiSmr,"Топ-новости: День Победы в Самаре, Priora в стиле XRay, Samsung меняет старые смартфоны на новые https://t.co/PKWAcFQXng",Unknown,Russian,2016-05-06 16:27:00,2016-05-06 16:27:00,432,39668,7881,,0
NovostiSmr,"В Сызрани - гражданско-патриотическая акция ""Вахта памяти"" https://t.co/bNvui2xJh2",Unknown,Bulgarian,2016-05-07 12:56:00,2016-05-07 12:56:00,432,39669,7886,,0
NovostiSmr,"В Самаре в аварии погиб водитель такси, есть фото https://t.co/xlZtGMcohp",Unknown,Russian,2016-05-09 07:13:00,2016-05-09 07:13:00,432,39668,7893,,0
NovostiSmr,АвтоВАЗ хочет продавать Lada во Вьетнаме https://t.co/F23dnObMiQ,Unknown,Russian,2016-05-10 05:58:00,2016-05-10 05:58:00,432,39666,7898,,0
NovostiSmr,"110 млн рублей – цена реконструкции ДК ""Нефтяник"" https://t.co/ZhKx1BBUKC",Unknown,Russian,2016-05-10 07:02:00,2016-05-10 07:02:00,432,39665,7900,,0
NovostiSmr,В блогах: Фотоотчет с авиапраздника на аэродроме Бобровка. 7 мая https://t.co/ymAZj2fQZQ,Unknown,Russian,2016-05-10 15:31:00,2016-05-10 15:32:00,432,39665,7912,,0
NovostiSmr,Среднерыночная стоимость 1 м2 в Самарской области осталась прежней https://t.co/gpf0mQsQxw,Unknown,Russian,2016-05-11 09:58:00,2016-05-11 10:02:00,432,39663,7924,,0
NovostiSmr,"Топ-новости: подробности по делу об убийстве семьи Андрея Гошта, провал российских фильмов 2016, долголетие с... https://t.co/4o3J3Tiu3R",Unknown,Russian,2016-05-11 21:39:00,2016-05-11 21:39:00,432,39663,7933,,0
NovostiSmr,Объяснен механизм пожирания мозгов нерожденных детей https://t.co/xmbCriMPOy,Unknown,Russian,2016-05-12 06:35:00,2016-05-12 06:35:00,432,39660,7936,,0
NovostiSmr,В самарской больнице умер 2-летний ребенок https://t.co/TVWpj8oc4C,Unknown,Russian,2016-05-12 14:07:00,2016-05-12 14:07:00,432,39659,7946,,0
NovostiSmr,Самарские «черви» вновь напомнили о себе: на Некрасовской провалился кусок дороги https://t.co/9ggXDJTqd0,Unknown,Russian,2016-05-13 01:33:00,2016-05-13 05:21:00,432,39659,7949,,0
NovostiSmr,"ПСО ""Казань"" заменят на самарского подрядчика https://t.co/vKfdUUUn1h",Unknown,Russian,2016-05-13 07:27:00,2016-05-13 07:27:00,432,39659,7951,,0
NovostiSmr,Учёные: дети могут родителям очень убедительно лгать https://t.co/z0m8Qw8BAC,Unknown,Russian,2016-05-13 11:23:00,2016-05-13 11:23:00,432,39661,7957,,0
NovostiSmr,"Топ-новости: гибель землян, «нулевая мировая война», смерть ребенка в самарской больнице https://t.co/kqorgQKAtr",Unknown,Russian,2016-05-13 15:53:00,2016-05-13 15:53:00,432,39661,7961,,0
NovostiSmr,Седан Fiat Tipo вновь был замечен на тестах в РФ https://t.co/FCxu5WzBgj,Unknown,Russian,2016-05-16 05:39:00,2016-05-16 05:39:00,432,39651,7972,,0
NovostiSmr,"РФС отказался лицензировать ""Крылья Советов"" https://t.co/JAb20AC2ib",Unknown,Russian,2016-05-16 06:07:00,2016-05-16 06:07:00,432,39651,7973,,0
NovostiSmr,WhatsApp взломали из-за «дыры» в системе безопасности Android https://t.co/qjpEyS4hcf,Unknown,Ukrainian,2016-05-16 12:23:00,2016-05-16 12:23:00,432,39650,7980,,0
NovostiSmr,"Пенсионеры Поволжья выбирают карты Сбербанк-Maestro ""Социальная"" https://t.co/J5Ak6hfBby",Unknown,Russian,2016-05-16 13:02:00,2016-05-16 13:02:00,432,39650,7981,,0
NovostiSmr,"Топ-новости: Стройка жилья по проекту «Кряж», $1 млн за секс в прямом эфире, пастбище рядом с «Колизеем» https://t.co/sMvTWSXLr3",Unknown,Ukrainian,2016-05-16 16:21:00,2016-05-16 16:21:00,432,39650,7985,,0
NovostiSmr,В Самаре 3-летняя девочка получила ожог при прохождении физиотерапии https://t.co/kia8YeFb5Y,Unknown,Russian,2016-05-16 19:53:00,2016-05-16 19:54:00,432,39650,7986,,0
NovostiSmr,В России 30 мая стартуют продажи нового Geely Emgrand 7 https://t.co/Cil1zIX8gC,Unknown,Russian,2016-05-17 07:56:00,2016-05-17 07:56:00,432,39650,7993,,0
NovostiSmr,Россияне заказали самый дешевый автомобиль в мире Bajaj Qute https://t.co/YeDQjFU6TM,Unknown,Russian,2016-05-17 11:11:00,2016-05-17 11:11:00,432,39651,7999,,0
NovostiSmr,"Топ-новости: В Самаре детский сад накажут за нарушения закона, в Subaru назвали российские цены на обновленны... https://t.co/kVLw7q9Qn1",Unknown,Russian,2016-05-17 16:02:00,2016-05-17 16:03:00,432,39650,8006,,0
NovostiSmr,На Audi облправительства никто не позарился https://t.co/Ybtn4kpnWJ,Unknown,Russian,2016-05-18 06:51:00,2016-05-18 06:51:00,432,39647,8010,,0
NovostiSmr,СМИ: В моногородах РФ уволят 16 тысяч человек в 2016 году https://t.co/oB5lbe77sa,Unknown,Russian,2016-05-18 07:57:00,2016-05-18 07:57:00,432,39647,8013,,0
NovostiSmr,Франк Веркаутерен оставит «Крылья Советов» ради «Андерлехта» https://t.co/12NR11smiU,Unknown,Russian,2016-05-18 10:18:00,2016-05-18 10:18:00,432,39647,8015,,0
NovostiSmr,Через границу с Казахстаном пытались провезти груз под видом товаров APPLE и LOUIS VUITTON https://t.co/VIVnUUcSaL,Unknown,Russian,2016-05-18 16:22:00,2016-05-18 16:22:00,432,39646,8022,,0
NovostiSmr,В Самаре 23 км трамвайных путей будут ремонтировать по ночам https://t.co/6SPj5SzmUz,Unknown,Russian,2016-05-19 05:41:00,2016-05-19 05:44:00,432,39645,8025,,0
NovostiSmr,В Индонезии ребенок родился весом в 9 кг https://t.co/rqKX2x1ksw,Unknown,Russian,2016-05-19 07:06:00,2016-05-19 07:06:00,432,39645,8029,,0
NovostiSmr,Кроссовер Seat Ateca получит «горячую» версию Cupra https://t.co/yQLAvKKDPl,Unknown,Russian,2016-05-19 08:31:00,2016-05-19 08:31:00,432,39645,8032,,0
NovostiSmr,Ученые: Марс и Земля максимально сблизятся в мае-июне https://t.co/BXyafeQrK1,Unknown,Russian,2016-05-19 09:56:00,2016-05-19 09:56:00,432,39645,8036,,0
NovostiSmr,"""Роснефть"" продает долю в ""Солидарности"" https://t.co/ZLYqzGdB3H",Unknown,Russian,2016-05-20 06:42:00,2016-05-20 06:42:00,432,39642,8053,,0
NovostiSmr,Ученые: Лето 2016 года может стать самым жарким https://t.co/p1ELPE5udj,Unknown,Russian,2016-05-20 08:00:00,2016-05-20 08:00:00,432,39641,8055,,0
NovostiSmr,В 2020 году на японских дорогах появятся такси без водителя https://t.co/BM6hCJ1aTa,Unknown,Russian,2016-05-20 09:00:00,2016-05-20 09:00:00,432,39641,8057,,0
NovostiSmr,Из Самары в Симферополь по госпрограмме будут летать две авиакомпании https://t.co/pJT7WGlVnm,Unknown,Russian,2016-05-20 12:36:00,2016-05-20 12:36:00,432,39641,8063,,0
NovostiSmr,"Топ-новости: рейтинг кроссоверов, Nissan Murano, в Тольятти пропала девушка https://t.co/wxlxiImkg1",Unknown,Russian,2016-05-20 18:44:00,2016-05-20 18:44:00,432,39640,8068,,0
NovostiSmr,В Жигулевске двое друзей угнали «пятерку» у соседа и поставили возле своего дома https://t.co/Iam7N8gqSr,Unknown,Russian,2016-05-21 07:50:00,2016-05-21 07:56:00,432,39637,8069,,0
NovostiSmr,Мастер-классы игры на гуслях и битва на полиуретановых ножах https://t.co/iiK9w9mjsL,Unknown,Russian,2016-05-22 07:54:00,2016-05-27 01:39:00,1423,39631,8168,,0
NovostiSmr,Озвучена российская цена на обновленный Subaru Forester 2017 https://t.co/onACeBwrqT,Unknown,Russian,2016-05-22 17:28:00,2016-05-22 17:28:00,432,39630,8086,,0
NovostiSmr,Ученые: запущен проект по регенерации мертвого мозга https://t.co/HXEz3Y8acJ,Unknown,Russian,2016-05-23 08:12:00,2016-05-27 01:37:00,1423,39631,8168,,0
NovostiSmr,Начинающий водитель Kia Rio сбил столб в Тольятти https://t.co/eF0T25D3sh,Unknown,Russian,2016-05-23 10:42:00,2016-05-23 10:42:00,432,39629,8102,,0
NovostiSmr,Самую большую «кассу» на вторичном авторынке РФ собрала Toyota https://t.co/rfSZ8Yil7A,Unknown,Russian,2016-05-23 11:10:00,2016-05-23 11:10:00,432,39629,8103,,0
NovostiSmr,"Топ-новости: Трагедия на самарской трассе унесла пять жизней, «УАЗ» выпустит новый кроссовер, пожар в городском кафе https://t.co/AipNL9sV9E",Unknown,Russian,2016-05-23 16:06:00,2016-05-23 16:06:00,432,39628,8110,,0
NovostiSmr,Российские учёные создали тест-систему обнаружения вируса Зика https://t.co/g6YeK6ySX7,Unknown,Russian,2016-05-23 17:11:00,2016-05-23 17:12:00,432,39629,8111,,0
NovostiSmr,Экс-глава АвтоВАЗа Бу Андерссон будут читать студентам лекции по закупкам https://t.co/fJgSTFOhfu,Unknown,Russian,2016-05-23 19:38:00,2016-05-23 19:38:00,432,39629,8112,,0
NovostiSmr,На АвтоВАЗ придут банкиры https://t.co/sQ0BtQSZc3,Unknown,Russian,2016-05-24 06:28:00,2016-05-24 06:28:00,432,39629,8116,,0
NovostiSmr,Экс-президент АвтоВАЗа Бу Андерссон стал преподавателем https://t.co/SUx2zmlbI6,Unknown,Bulgarian,2016-05-24 08:41:00,2016-05-24 08:41:00,432,39629,8121,,0
NovostiSmr,АвтоВАЗ снижает стоимость техобслуживания https://t.co/Re1tz8jUWh,Unknown,Russian,2016-05-24 10:33:00,2016-05-24 10:33:00,432,39629,8124,,0
NovostiSmr,В Тольятти выставочный образец Lada XRay украли с АвтоВАЗа https://t.co/yIH0Jj3vOk,Unknown,Russian,2016-05-24 11:18:00,2016-05-24 11:18:00,432,39628,8125,,0
NovostiSmr,Дети Жигулевска могут бесплатно отдохнуть и полетать на самолетах https://t.co/53uU7ACl8j,Unknown,Russian,2016-05-24 12:29:00,2016-05-24 12:29:00,432,39628,8128,,0
NovostiSmr,"Топ-новости: В Самаре «КамАЗ» провалился под асфальт, Renault представила новый минивэн, родителям не стоит с... https://t.co/xNEhVInIe4",Unknown,Russian,2016-05-24 15:40:00,2016-05-24 15:41:00,432,39628,8133,,0
NovostiSmr,Первые изображения нового поколения Audi A6 появились в сети https://t.co/NiLCsUUY2P,Unknown,Russian,2016-05-25 06:36:00,2016-05-25 06:43:00,432,39627,8138,,0
NovostiSmr,Полиция Тольятти задержала двух угонщиков Lada XRay c АвтоВАЗа https://t.co/W91k1jdHj5,Unknown,Russian,2016-05-25 07:30:00,2016-05-25 07:30:00,432,39626,8140,,0
NovostiSmr,В США стартовало производство суперкара Acura NSX нового поколения https://t.co/I9lRxtSFlP,Unknown,Russian,2016-05-25 10:05:00,2016-05-25 10:07:00,432,39625,8143,,0
NovostiSmr,Hubble объяснил механизм образования огромных черных дыр https://t.co/mfe6Lv6Rxz,Unknown,Russian,2016-05-25 11:08:00,2016-05-25 11:08:00,432,39625,8145,,0
NovostiSmr,РКК «Энергия»: на Марс полет обойдется в запредельные деньги https://t.co/TMdAE3qynx,Unknown,Russian,2016-05-25 12:33:00,2016-05-25 12:34:00,432,39625,8146,,0
NovostiSmr,Ford отзывает 271 тысячу пикапов из-за проблем с тормозами https://t.co/Eu6QyGXU81,Unknown,Russian,2016-05-25 17:52:00,2016-05-25 17:53:00,432,39626,8151,,0
NovostiSmr,"Ученые придумали, как «заморозить» Землю при помощи лазеров https://t.co/0C8cFxDbLm",Unknown,Russian,2016-05-26 05:17:00,2016-05-27 01:33:00,1423,39631,8168,,0
NovostiSmr,Глава Apple нашел iPhone на полотне XVII века https://t.co/xzhv3mmPiG,Unknown,Russian,2016-05-26 07:35:00,2016-05-26 07:35:00,432,39626,8158,,0
NovostiSmr,Веркаутерена хотят уговорить остаться в Самаре https://t.co/EocjmOqb5H,Unknown,Russian,2016-05-26 08:53:00,2016-05-26 08:54:00,432,39626,8161,,0
NovostiSmr,Nissan в России собирается возобновить производство автомодели Tiida https://t.co/kTJjYWae7Y,Unknown,Russian,2016-05-26 09:00:00,2016-05-26 09:00:00,432,39626,8162,,0
NovostiSmr,Ученые: частые переезды ухудшают успеваемость детей https://t.co/dZmzUVy8Z3,Unknown,Russian,2016-05-26 17:41:00,2016-05-26 17:41:00,432,39625,8168,,0
NovostiSmr,30 мая в РФ стартуют продажи Geely Emgrand 7 https://t.co/RIlGWiOoKa,Unknown,Russian,2016-05-27 05:21:00,2016-05-27 05:21:00,1422,39674,8169,,0
NovostiSmr,АвтоВАЗ не выпускал Datsun два месяца https://t.co/t1yrzzmG8I,Unknown,Ukrainian,2016-05-27 05:33:00,2016-05-27 05:33:00,1422,39674,8170,,0
NovostiSmr,АвтоВАЗ хочет продать в Ливане 300 Lada https://t.co/KI62CRdFyI,Unknown,Russian,2016-05-27 10:20:00,2016-05-27 10:20:00,1421,39700,8179,,0
NovostiSmr,АвтоВАЗ не делал Datsun два месяца https://t.co/nEjEMlp2aD,Unknown,Ukrainian,2016-05-27 12:50:00,2016-05-27 12:50:00,1421,39707,8182,,0
NovostiSmr,"ООО ""Самаратранснефть-Терминал"" выпустит три займа облигаций https://t.co/mIk9O8rjLj",Unknown,Russian,2016-05-27 13:34:00,2016-05-27 13:35:00,1421,39707,8183,,0
NovostiSmr,Ассоциации городов Поволжья представлен самарский опыт подготовки к ЧМ-2018 https://t.co/FEYNnAdoFu,Unknown,Russian,2016-05-28 06:20:00,2016-05-28 06:21:00,1421,39725,8188,,0
NovostiSmr,Для жен и детей болельщиков ЧМ-2018 готовят спецмаршруты https://t.co/Ovbk8RLMtM,Unknown,Russian,2016-05-29 10:09:00,2016-05-29 10:09:00,1421,39736,8193,,0
NovostiSmr,"АО ""Самаранефтегаз"" стало одним из лучших по организации работы по охране труда в Самарской области https://t.co/p1VyLh0oYx",Unknown,Russian,2016-05-30 05:35:00,2016-05-30 06:44:00,1421,39740,8201,,0
NovostiSmr,"Самарская губдума потратит 1,2 млн рублей на 2 праздника https://t.co/ca6y6gjHl3",Unknown,Russian,2016-05-30 08:30:00,2016-05-30 08:30:00,1421,39741,8203,,0
NovostiSmr,Появилось рендерное изображение нового кроссовера Duster https://t.co/T2daMPqt9B,Unknown,Russian,2016-05-30 10:45:00,2016-05-30 10:45:00,1421,39739,8205,,0
NovostiSmr,"В Самаре 1,2 млн рублей потратят на эстафету и конкурс «Мастер Безымянки» https://t.co/8U7jCYB7C4",Unknown,Russian,2016-05-30 12:49:00,2016-05-30 12:49:00,1421,39738,8210,,0
NovostiSmr,"В ДТП с участием детей виноваты и водители, и родители https://t.co/ozmTuO8JH7",Unknown,Russian,2016-05-30 14:38:00,2016-05-30 14:38:00,1421,39739,8213,,0
NovostiSmr,"Топ-новости: Новый кроссовер Renault Duster, тень человека на фото с Марса, близ Курумоча на трассе сбит кабан https://t.co/aDM1ZgvgQ0",Unknown,Russian,2016-05-30 16:04:00,2016-05-30 16:04:00,1421,39739,8215,,0
NovostiSmr,"Исследование: Во взрослой жизни больше зарабатывают те дети, которые читают книги https://t.co/kszg5AfDXS",Unknown,Russian,2016-05-31 06:41:00,2016-05-31 06:41:00,1717,39769,8221,,0
NovostiSmr,Экс-спецназовцы получили 35 лет на четверых за серию вооруженных налетов https://t.co/KRzTbD8pwC,Unknown,Russian,2016-05-31 09:57:00,2016-06-01 12:32:00,1715,39780,8249,,0
NovostiSmr,В Европе впервые за 250 лет число мужчин превысило число женщин https://t.co/yaUYUrUi3J,Unknown,Russian,2016-05-31 23:03:00,2016-05-31 23:03:00,1715,39779,8238,,0
NovostiSmr,На комете Чурюмова-Герасименко обнаружили жизнь по Энгельсу https://t.co/HNUDH2tun1,Unknown,Russian,2016-06-01 06:04:00,2016-06-01 06:05:00,1715,39780,8240,,0
NovostiSmr,Самарский дилер Renault присвоил 40 млн рублей https://t.co/8ZG5kLRZP0,Unknown,Russian,2016-06-01 06:41:00,2016-06-01 06:41:00,1715,39780,8241,,0
NovostiSmr,В Тольятти «ВАЗ» разбил «Калину» и врезался в столб https://t.co/lubv8eJcNL,Unknown,Russian,2016-06-01 12:00:00,2016-06-01 12:00:00,1715,39780,8249,,0
NovostiSmr,"Российские двигатели РД-181 для ракеты Antares успешно прошли испытания в США, есть фото и видео https://t.co/DD3nyd4quX",Unknown,Russian,2016-06-01 19:03:00,2016-06-01 19:04:00,1715,39781,8253,,0
NovostiSmr,Компания Audi показала салон нового купе A5 https://t.co/fiX0o8WbQ6,Unknown,Russian,2016-06-02 07:47:00,2016-06-02 07:48:00,2009,39795,8260,,0
NovostiSmr,"На парковке АВТОВАЗа нашли котёнка. Если это мальчик - будет носить имя XRay, если девочка - Vesta. #Мимими #Самара https://t.co/OWecm6mm3t",Unknown,Russian,2016-06-02 15:27:00,2016-06-02 15:28:00,2008,39807,8266,,0
NovostiSmr,В Самарской области к ЧМ-2018 запустят скоростную железную дорогу https://t.co/g1KO3vr3va,Unknown,Russian,2016-06-04 12:34:00,2016-06-05 09:19:00,2599,39857,8289,,0
NovostiSmr,"А вы пошли на фестиваль набережных ""ВолгаФест 2016""? https://t.co/QhgCqyMG6y",Unknown,Ukrainian,2016-06-04 13:12:00,2016-06-04 13:12:00,2302,39840,8283,,0
NovostiSmr,Красота в простоте...  #Самара #Samara #Smr #Россия https://t.co/0vOXKvx1L0,Unknown,Russian,2016-06-04 14:08:00,2016-06-04 15:14:00,2302,39841,8284,,0
NovostiSmr,В Самарском зоопарке представили публике новых обезьян: это тамарин Феникс и кошачий лемур Рокки. https://t.co/UJY3ra6y5P,Unknown,Serbian,2016-06-06 08:38:00,2016-06-06 08:50:00,2922,39878,8296,,0
NovostiSmr,"Памятник ""Интернетчику"",  Самара, Московское шоссе, д. 15 https://t.co/NIjlqZBh6l",Unknown,Russian,2016-06-06 09:46:00,2016-06-06 12:43:00,2922,39879,8301,,0
NovostiSmr,Дом со слонами- дача Константина Головкина Построена в 1908—1909 годах. #Самара #Россия https://t.co/PMRYvmUgFc,Unknown,Russian,2016-06-06 13:00:00,2016-06-06 13:00:00,2922,39880,8302,,0
NovostiSmr,"Голубое озеро близ Самары. Оно никогда не замерзает, сохраняя постоянную температуру в +7 #Россия #Самара https://t.co/yMInZ3hCf3",Unknown,Russian,2016-06-07 05:00:00,2016-06-07 05:00:00,3221,39893,8305,,0
