author_id,content,region,language,publish_date,harvested_date,following,followers,updates,post_type,retweet
NovostiShoigu,Военная полиция получит свыше двухсот современных автомобилей в 2017 году https://t.co/uK7X7lSWog https://t.co/dawv0ry8X8,United States,Russian,2017-04-09T16:49:00,2017-04-09T16:49:00,5.0000000000,4359.0000000000,705.0000000000,,False
NovostiShoigu,26 апреля 2017 года состоится Пленарное заседание «Глобальная безопасность: вызовы 21 века» https://t.co/ow7gT6GpVm https://t.co/Q9cnuOpBz1,United States,Russian,2017-04-09T18:50:00,2017-04-09T18:50:00,5.0000000000,4358.0000000000,707.0000000000,,False
NovostiShoigu,Научно-деловая программа на форуме «армия-2017» обещает новые рекорды https://t.co/hIa2xXaUwW https://t.co/fzcpEt7RG0,United States,Russian,2017-04-09T22:52:00,2017-04-09T22:52:00,5.0000000000,4357.0000000000,710.0000000000,,False
NovostiShoigu,В Казахстане впервые пройдет III Международная Олимпиада курсантов военных вузов https://t.co/xcepr9mw1U https://t.co/pxUndAPAL6,United States,Russian,2017-04-10T04:55:00,2017-04-10T04:55:00,5.0000000000,4356.0000000000,714.0000000000,,False
NovostiShoigu,Жюри продолжает отбор победителей из более 600 претендентов в фестивале прессы «Медиа-АС-2017» https://t.co/X65O5d1X0d https://t.co/IaD5pALE1I,United States,Russian,2017-04-10T19:03:00,2017-04-10T19:03:00,5.0000000000,4357.0000000000,728.0000000000,,False
NovostiShoigu,Олимпийские чемпионы ЦСКА проведут занятие по производственной гимнастике с сотрудниками клуба https://t.co/KukYOH5Nha https://t.co/aOwCYmSz1e,United States,Russian,2017-04-11T01:06:00,2017-04-11T01:06:00,5.0000000000,4356.0000000000,732.0000000000,,False
NovostiShoigu,В 2017 году в войска поступит более 118 тыс. единиц пожарно-технической продукции https://t.co/sfjz6Z9Kus https://t.co/ymdLlQ70e2,United States,Russian,2017-04-11T03:07:00,2017-04-11T03:07:00,5.0000000000,4356.0000000000,735.0000000000,,False
NovostiShoigu,В Сланцах Ленинградской области в День города прошла военно-патриотическая акция https://t.co/2ODu8bpMBY https://t.co/bu9O8E9TYm,United States,Russian,2017-04-11T03:07:00,2017-04-11T03:07:00,5.0000000000,4356.0000000000,734.0000000000,,False
NovostiShoigu,Почти 32 тыс. водителей и специалистов по ремонту борются за право представлять Россию на АрМИ-2017 https://t.co/mMJuIBA95M https://t.co/XQ8zH3xjVk,United States,Russian,2017-04-11T19:25:00,2017-04-11T19:25:00,5.0000000000,4354.0000000000,759.0000000000,,False
NovostiShoigu,Для военнослужащих в военном городке в Челябинской области сдаются в эксплуатацию два общежития https://t.co/rzk5H66pD7 https://t.co/kNnYMGnJRc,United States,Russian,2017-04-13T02:02:00,2017-04-13T02:04:00,5.0000000000,4342.0000000000,804.0000000000,,False
NovostiShoigu,МВТФ «Армия-2017» продемонстрирует перспективные образцы вооружения и военной техники https://t.co/UvtyyfrFG4 https://t.co/UrgglkftUw,United States,Russian,2017-04-13T04:05:00,2017-04-13T04:06:00,5.0000000000,4342.0000000000,808.0000000000,,False
NovostiShoigu,МВТФ «Армия-2017» продемонстрирует перспективные образцы вооружения и военной техники https://t.co/UvtyyfrFG4 https://t.co/zQKX3mRrxK,United States,Russian,2017-04-13T04:05:00,2017-04-13T04:05:00,5.0000000000,4342.0000000000,807.0000000000,,False
NovostiShoigu,В ВВО сформировано 159 учебных рот для приема молодого пополнения https://t.co/g5deFKk4a0 https://t.co/JLq6NzbZwG,United States,Russian,2017-04-13T06:06:00,2017-04-13T06:06:00,5.0000000000,4341.0000000000,811.0000000000,,False
NovostiShoigu,Курсанты Дальневосточного высшего общевойскового командного училища готовятся к «АрМИ-2017» https://t.co/wNdg4oUufT https://t.co/fRNpcKv7Cr,United States,Russian,2017-04-13T08:07:00,2017-04-13T08:07:00,5.0000000000,4341.0000000000,813.0000000000,,False
NovostiShoigu,"Более 4,3 тыс. военнослужащих Северного флота пройдут торжественным маршем в День Победы https://t.co/u5Dx0P9JmE",United States,Russian,2017-04-13T12:15:00,2017-04-13T12:15:00,5.0000000000,4341.0000000000,822.0000000000,,False
NovostiShoigu,Представительница ЦСКА Инна Дериглазова стала чемпионкой России по фехтованию на рапирах https://t.co/goM7QhmKYU https://t.co/67sk81Ez3y,United States,Russian,2017-04-13T16:29:00,2017-04-13T16:29:00,5.0000000000,4341.0000000000,832.0000000000,,False
NovostiShoigu,Пловцы ЦСКА на чемпионате России каждый день пополняют свой «золотой запас» https://t.co/0F2xCllVFT https://t.co/O1IHIq3jDM,United States,Russian,2017-04-13T22:26:00,2017-04-13T22:26:00,5.0000000000,4339.0000000000,836.0000000000,,False
NovostiShoigu,На чемпионате Европы по дзюдо выступят пять спортсменов ЦСКА https://t.co/kc289h494V https://t.co/TeEdatsD0t,United States,Russian,2017-04-14T00:27:00,2017-04-14T00:27:00,5.0000000000,4339.0000000000,837.0000000000,,False
NovostiShoigu,Более 200 бойцов сразятся за победу на VII Кубке ЦСКА по кикбоксингу https://t.co/fk6fnqTcoO https://t.co/7NvtBMYq92,United States,Russian,2017-04-14T16:40:00,2017-04-14T16:40:00,5.0000000000,4340.0000000000,854.0000000000,,False
NovostiShoigu,Более 200 бойцов сразятся за победу на VII Кубке ЦСКА по кикбоксингу https://t.co/fk6fnqTcoO https://t.co/DBhcOdntGC,United States,Russian,2017-04-14T16:40:00,2017-04-14T16:40:00,5.0000000000,4340.0000000000,853.0000000000,,False
NovostiShoigu,Известные артисты поздравили военнослужащих - лауреатов премии фонда имени героя России Виктора Дубынина https://t.co/zZEPi5TQ8C https://t.co/oyYu6ShIFF,United States,Russian,2017-04-15T00:45:00,2017-04-15T00:55:00,5.0000000000,4341.0000000000,863.0000000000,,False
NovostiShoigu,Проблемы развития и применения БПЛА обсудили на конференции в КВЦ «Патриот» https://t.co/0PfWbAPVqQ https://t.co/1pkDaZ8P2P,United States,Russian,2017-04-15T00:45:00,2017-04-15T00:46:00,5.0000000000,4341.0000000000,862.0000000000,,False
NovostiShoigu,В 2017 году на полигоне «Капустин Яр» будут испытаны более 80 образцов вооружения https://t.co/ML7IzGLNKB https://t.co/HCumDNkHiD,United States,Russian,2017-04-15T20:55:00,2017-04-15T20:55:00,5.0000000000,4337.0000000000,878.0000000000,,False
NovostiShoigu,В 2017 году в практическую деятельность финансовой службы ВС РФ продолжится внедрение системы «Электронный бюджет» https://t.co/J9sMrBgudd https://t.co/rXfAjYQgAq,United States,Russian,2017-04-16T15:05:00,2017-04-16T15:05:00,5.0000000000,4336.0000000000,893.0000000000,,False
NovostiShoigu,Россия проведет в 2017 году две международные олимпиады среди курсантов https://t.co/CG1rpxQ3zz https://t.co/dvX4xo2LWP,United States,Russian,2017-04-16T23:10:00,2017-04-16T23:10:00,5.0000000000,4333.0000000000,901.0000000000,,False
NovostiShoigu,В Южном Военном Округе стартовала акция «Безопасность дорожного движения» https://t.co/T2a8bXVeO8 https://t.co/mOW5TzYCY4,United States,Russian,2017-04-17T01:11:00,2017-04-17T01:11:00,5.0000000000,4332.0000000000,903.0000000000,,False
NovostiShoigu,На форуме «АРМИЯ-2017»  будет представлена зона психологической службы и организовано социологическое исследование https://t.co/WNQCkJ0x0W https://t.co/ZbrFGV09Fe,United States,Russian,2017-04-17T03:14:00,2017-04-17T03:14:00,5.0000000000,4332.0000000000,905.0000000000,,False
NovostiShoigu,Для гостей и участников Форума «Армия-2017» предусмотрена обширная культурно-развлекательная программа https://t.co/MGbsBZwriw https://t.co/W5LllzWUZi,United States,Russian,2017-04-17T09:18:00,2017-04-17T09:18:00,5.0000000000,4331.0000000000,911.0000000000,,False
NovostiShoigu,Армейские бойцы победили на VII открытом Кубке ЦСКА по кикбоксингу https://t.co/nCzcLASyNA https://t.co/shSGHdlq1b,United States,Russian,2017-04-17T15:25:00,2017-04-17T15:25:00,5.0000000000,4332.0000000000,922.0000000000,,False
NovostiShoigu,Самбистки ЦСКА завоевали «серебро» и «бронзу» на международных соревнованиях во Владивостоке https://t.co/qzUW7jQO19 https://t.co/RYdkbq3FYJ,United States,Russian,2017-04-17T15:26:00,2017-04-17T15:26:00,5.0000000000,4332.0000000000,925.0000000000,,False
NovostiShoigu,Шпажистка ЦСКА Татьяна Гудкова стала чемпионкой России в составе команды Москвы-1 https://t.co/D5HTvDKIrc https://t.co/vDGUNZR8Np,United States,Russian,2017-04-17T19:31:00,2017-04-17T19:31:00,5.0000000000,4331.0000000000,930.0000000000,,False
NovostiShoigu,Шпажистка ЦСКА Татьяна Гудкова стала чемпионкой России в составе команды Москвы-1 https://t.co/D5HTvDKIrc https://t.co/9OkHvQcc6M,United States,Russian,2017-04-17T19:31:00,2017-04-17T19:31:00,5.0000000000,4331.0000000000,931.0000000000,,False
NovostiShoigu,На фестивале-конкурсе «Катюша-юниор-2017» названы имена лауреатов https://t.co/e6PU290zaH https://t.co/WwRpJoS5ON,United States,Russian,2017-04-17T21:34:00,2017-04-17T21:34:00,5.0000000000,4331.0000000000,934.0000000000,,False
NovostiShoigu,Специалисты России и Белоруссии выполнят наблюдательный полет над территорией Франции https://t.co/84Xx7CBw8y https://t.co/uzrp0xAhMF,United States,Russian,2017-04-17T21:34:00,2017-04-17T21:34:00,5.0000000000,4331.0000000000,933.0000000000,,False
NovostiShoigu,Первые соревнования сотрудников военных автоинспекций пройдут на отечественных автомобилях ЛАДА Веста https://t.co/KRiWib7Flc https://t.co/dk6siLGbSJ,United States,Russian,2017-04-18T19:49:00,2017-04-18T19:49:00,5.0000000000,4328.0000000000,964.0000000000,,False
NovostiShoigu,Малые противолодочные корабли уничтожили условного подводного противника в Баренцевом море https://t.co/5h5nfbUVhu https://t.co/VGgSUqhSCT,United States,Russian,2017-04-19T01:57:00,2017-04-19T02:00:00,5.0000000000,4327.0000000000,968.0000000000,,False
NovostiShoigu,В июне на территории Белоруссии пройдет международное учение «Славянское братство-2017» https://t.co/ahX2FSVdr2 https://t.co/kPH3e5FpXW,United States,Russian,2017-04-19T07:55:00,2017-04-19T07:55:00,5.0000000000,4325.0000000000,972.0000000000,,False
NovostiShoigu,Курсанты Военной академии МТО удостоены наград НТТМ-2017 https://t.co/sCCAgiifme https://t.co/wWg5zek7So,United States,Russian,2017-04-19T11:57:00,2017-04-19T11:57:00,5.0000000000,4325.0000000000,975.0000000000,,False
NovostiShoigu,Травматологи ГВКГ им. Бурденко предлагают новый способ лечения боли в спине https://t.co/hWceTi7FV4,United States,Russian,2017-04-20T12:09:00,2017-04-20T12:09:00,5.0000000000,4324.0000000000,992.0000000000,,False
NovostiShoigu,В подмосковном Алабино для участников военного парада состоялась военно-патриотическая акция «Под знаменем Победы!» https://t.co/gO4JNXetIn https://t.co/v3JUCAnfYJ,United States,Russian,2017-04-21T20:25:00,2017-04-21T20:25:00,4.0000000000,4326.0000000000,1011.0000000000,,False
NovostiShoigu,На базе Пансиона воспитанниц Министерства обороны России проведена II Всероссийская гендерная конференция https://t.co/JnHeDMKevf https://t.co/hXiZDyBdTs,United States,Russian,2017-04-21T22:26:00,2017-04-21T22:26:00,4.0000000000,4326.0000000000,1013.0000000000,,False
NovostiShoigu,В Хабаровске состоялась акция «День призывника» https://t.co/s9Ub4krWW7 https://t.co/7dizpkSf8D,United States,Russian,2017-04-22T06:30:00,2017-04-22T06:30:00,3.0000000000,4327.0000000000,1021.0000000000,,False
NovostiShoigu,Соединение РЭБ ВВО отметило 75 — летие https://t.co/i9DI742TQk https://t.co/oUrZZAfDYu,United States,Russian,2017-04-22T08:31:00,2017-04-22T08:31:00,3.0000000000,4327.0000000000,1023.0000000000,,False
NovostiShoigu,В военно-патриотическом конкурсе «Юнармеец-2017» приняли участие более 300 школьников https://t.co/6cnBtBA05S https://t.co/cUowSCuqSD,United States,Russian,2017-04-22T18:36:00,2017-04-22T18:36:00,3.0000000000,4326.0000000000,1031.0000000000,,False
NovostiShoigu,В военно-патриотическом конкурсе «Юнармеец-2017» приняли участие более 300 школьников https://t.co/6cnBtBA05S https://t.co/bUr9J75yPI,United States,Russian,2017-04-22T20:36:00,2017-04-22T20:37:00,3.0000000000,4325.0000000000,1033.0000000000,,False
NovostiShoigu,Совместная миссия Италии и США выполнит наблюдательный полет над территориями Белоруссии и России https://t.co/RdUV1ywglf https://t.co/dzEtALOlDx,United States,Russian,2017-04-23T22:50:00,2017-04-23T22:50:00,3.0000000000,4318.0000000000,1052.0000000000,,False
NovostiShoigu,На базе ЦСКА в Санкт-Петербурге юные хоккеисты вступили в ряды «Юнармии» https://t.co/soGYvpkmVf https://t.co/VgmAUSqQKv,United States,Russian,2017-04-24T16:59:00,2017-04-24T16:59:00,3.0000000000,4317.0000000000,1066.0000000000,,False
NovostiShoigu,Открыт конкурс по отбору экспонатов специальной экспозиции «Инновационный клуб» на форуме «Армия-2017» https://t.co/ejjkdXGxu7 https://t.co/uKw4fNiHgR,United States,Russian,2017-04-24T23:02:00,2017-04-24T23:02:00,3.0000000000,4316.0000000000,1071.0000000000,,False
NovostiShoigu,Сегодня начинает работу VI Московская конференция по международной безопасности https://t.co/nkUaDqcyqP https://t.co/VBBVsrmcOE,United States,Russian,2017-04-26T03:53:00,2017-04-26T03:53:00,3.0000000000,4313.0000000000,1090.0000000000,,False
NovostiShoigu,На VI конференции MCIS ГУНИД МО РФ организовало презентацию Международного военно-технического форума «АРМИЯ-2017» https://t.co/0Z2DbqlBzy https://t.co/tJn65g8V8Q,United States,Russian,2017-04-26T22:08:00,2017-04-26T22:09:00,3.0000000000,4312.0000000000,1105.0000000000,,False
NovostiShoigu,Венесуэла намерена показать выучку своих военнослужащих на «Армейских международных играх–2017» https://t.co/sfCn52VCnr https://t.co/i5OchtmBNn,United States,Russian,2017-04-27T02:05:00,2017-04-27T02:06:00,3.0000000000,4312.0000000000,1109.0000000000,,False
NovostiShoigu,"Количество учений РВСН в 2017 году возрастет в 1,5 раза https://t.co/qsW9I5cf3z https://t.co/H2Lfchjz1p",United States,Russian,2017-04-30T12:51:00,2017-04-30T12:51:00,5.0000000000,4304.0000000000,1177.0000000000,,False
NovostiShoigu,Более 800 курсантов Краснодарского ВВАУЛ приступили к полетам в учебных авиабазах https://t.co/LytWqVuI9q https://t.co/LAxcnY8aiI,United States,Russian,2017-05-02T19:31:00,2017-05-02T19:32:00,5.0000000000,4303.0000000000,1228.0000000000,,False
NovostiShoigu,15 мая 2017 г. стартует 1 этап всеармейского  кинологического конкурса «Верный друг» https://t.co/UbMjINhvL6 https://t.co/0TiD8UOkMR,United States,Russian,2017-05-04T23:57:00,2017-05-04T23:57:00,5.0000000000,4298.0000000000,1267.0000000000,,False
NovostiShoigu,Спасательный буксир проекта 02980 «Полярный конвой» войдет в состав Военно-Морского Флота в конце мая 2017 года https://t.co/DWPmIEjgEh https://t.co/cbs2XEs7rX,United States,Russian,2017-05-07T16:29:00,2017-05-07T16:29:00,5.0000000000,4289.0000000000,1323.0000000000,,False
NovostiShoigu,В Москве для военнослужащих досрочно подготовлено к заселению более 800 квартир https://t.co/Lw2kJJUnyG https://t.co/lPPLeiVSmX,United States,Russian,2017-05-07T20:32:00,2017-05-07T20:33:00,5.0000000000,4288.0000000000,1330.0000000000,,False
NovostiShoigu,На Северном флоте пройдет акция  «Военная служба по контракту в Вооруженных Силах РФ – твой выбор!» https://t.co/ZQhGAxDGDb https://t.co/moX4Bbwlgn,United States,Russian,2017-05-08T04:36:00,2017-05-08T04:36:00,5.0000000000,4288.0000000000,1337.0000000000,,False
NovostiShoigu,"Десантник преодолел 800 метровую полосу препятствий на военной технике, троекратно перекрыв лучший результат https://t.co/a9VUrcZa8P https://t.co/rVJV7y0Q10",United States,Russian,2017-05-08T16:42:00,2017-05-08T16:42:00,5.0000000000,4289.0000000000,1346.0000000000,,False
NovostiShoigu,"Более 4,3 тысяч военнослужащих Северного флота прошли маршем в День Победы https://t.co/zJ6t4ngBwH https://t.co/jQ99oeVebt",United States,Russian,2017-05-09T18:55:00,2017-05-09T18:55:00,5.0000000000,4286.0000000000,1366.0000000000,,False
NovostiShoigu,"Военнослужащие ЮВО перезахоронили останки 15 красноармейцев, освобождавших Кубань от немецко-фашистских захватчиков https://t.co/AOpHtmjaMb https://t.co/RlIGgx6sBo",United States,Russian,2017-05-10T00:58:00,2017-05-10T00:58:00,5.0000000000,4283.0000000000,1371.0000000000,,False
NovostiShoigu,"Более 1,1 тыс. человек посетили боевые корабли Северного флота в День Победы https://t.co/tCXqShbkx5",United States,Russian,2017-05-10T17:06:00,2017-05-10T17:06:00,5.0000000000,4281.0000000000,1386.0000000000,,False
NovostiShoigu,Олимпийские чемпионы ЦСКА поделились секретами успеха с воспитанниками Тверского СВУ https://t.co/DIqz7S3PUw https://t.co/1SHRQBbX50,United States,Russian,2017-05-11T19:23:00,2017-05-11T19:23:00,5.0000000000,4281.0000000000,1407.0000000000,,False
NovostiShoigu,Свыше 400 военнослужащих весеннего призыва 2017 года освоят специальности военных кинологов https://t.co/p33Ryt9Kwl https://t.co/RnfbAS41lU,United States,Russian,2017-05-11T21:24:00,2017-05-11T21:24:00,5.0000000000,4281.0000000000,1409.0000000000,,False
NovostiShoigu,"Более 550 единиц вооружения, военной и специальной техники покажут на форуме «Армия-2017» https://t.co/AS5EddAK0q https://t.co/5NylNbJtOi",United States,Russian,2017-05-12T01:26:00,2017-05-12T01:26:00,5.0000000000,4280.0000000000,1411.0000000000,,False
NovostiShoigu,Около сотни спортсменов-парашютистов ВДВ готовится к международным соревнованиям «Рязанский кремль-2017» https://t.co/KDVc30zYdQ https://t.co/pDVPz03D1l,United States,Russian,2017-05-12T07:29:00,2017-05-12T07:29:00,5.0000000000,4279.0000000000,1416.0000000000,,False
NovostiShoigu,В Артеме состоится  масштабная акция по набору граждан на военную службу по контракту https://t.co/AahfGNiZKf https://t.co/buRC3KKoya,United States,Russian,2017-05-12T09:35:00,2017-05-12T09:35:00,5.0000000000,4278.0000000000,1417.0000000000,,False
NovostiShoigu,"Воспитанницы Пансиона МО РФ посетили посетили Казань в рамках проекта, посвященного Году экологии в России https://t.co/oVQmJRHG9z https://t.co/DWPSCOLfQo",United States,Russian,2017-05-13T03:39:00,2017-05-13T03:39:00,5.0000000000,4279.0000000000,1435.0000000000,,False
NovostiShoigu,Военные водители ЗВО приступили к тренировкам на конкурс АРМИ-2017  «Мастера автобронетанковой техники-2017» https://t.co/yeT6k5VY1x https://t.co/imDBXtTLCR,United States,Russian,2017-05-13T19:46:00,2017-05-13T19:48:00,5.0000000000,4278.0000000000,1450.0000000000,,False
NovostiShoigu,В Краснодарском военном училище летчиков состоялось заседание военного совета ВКС https://t.co/weYEn7lJtn https://t.co/eZYP5fM6HZ,United States,Russian,2017-05-13T21:47:00,2017-05-13T21:58:00,5.0000000000,4277.0000000000,1453.0000000000,,False
NovostiShoigu,Воспитанницы Пансиона посетили Волжско-Камский государственный природный биосферный заповедник в городе Казань https://t.co/J2F71DHicA https://t.co/nQSiiBgCPR,United States,Russian,2017-05-14T14:00:00,2017-05-14T14:01:00,5.0000000000,4275.0000000000,1467.0000000000,,False
NovostiShoigu,Представители Минобороны РФ выполнят наблюдательный полет над США https://t.co/qsKvZq6MYu https://t.co/j8nzM5gHmN,United States,Russian,2017-05-14T22:04:00,2017-05-14T22:05:00,5.0000000000,4274.0000000000,1474.0000000000,,False
NovostiShoigu,"Специалисты ""Электронной приемной"" Минобороны России дадут ответы на наиболее распространенные вопросы граждан https://t.co/aD9HUXwIdq https://t.co/havuybFMwA",United States,Russian,2017-05-15T04:07:00,2017-05-15T04:19:00,5.0000000000,4274.0000000000,1480.0000000000,,False
NovostiShoigu,В Пензе стартовала III-я Всеармейская и Международная олимпиада курсантов по информатике https://t.co/uKu8BG4u80 https://t.co/GmXYAL8Mij,United States,Russian,2017-05-15T20:15:00,2017-05-15T20:15:00,5.0000000000,4274.0000000000,1490.0000000000,,False
NovostiShoigu,Акция «Лес Победы» состоялась в Алтайском филиале «Оборонлес» Минобороны России https://t.co/At1OuQpD9L https://t.co/iqeKs2nuqK,United States,Russian,2017-05-15T22:16:00,2017-05-15T22:17:00,5.0000000000,4273.0000000000,1493.0000000000,,False
NovostiShoigu,Центральный Военно-Морской музей совместно с Главным командованием ВМФ России  проведут акцию «Ночь музеев-2017» . https://t.co/q08Q1ETKQx https://t.co/wJrtR2CsMh,United States,Russian,2017-05-15T22:16:00,2017-05-15T22:16:00,5.0000000000,4273.0000000000,1492.0000000000,,False
NovostiShoigu,Стартовал 1 этап всеармейского кинологического конкурса «Верный друг». https://t.co/IRxa8PYe2y https://t.co/wD7cMuVw9s,United States,Russian,2017-05-16T00:18:00,2017-05-16T00:29:00,5.0000000000,4272.0000000000,1494.0000000000,,False
NovostiShoigu,Парад кадетов и большой спортивный праздник с участием регионального отделения ДОСААФ прошли в столице https://t.co/VDNsTZvCKM https://t.co/SDigqQEW92,United States,Russian,2017-05-16T00:18:00,2017-05-16T00:29:00,5.0000000000,4272.0000000000,1495.0000000000,,False
